id,conversation_id,created_at,date,time,timezone,user_id,username,name,place,tweet,mentions,urls,photos,replies_count,retweets_count,likes_count,hashtags,cashtags,link,retweet,quote_url,video,near,geo,source,user_rt_id,user_rt,retweet_id,reply_to,retweet_date,translate,trans_src,trans_dest
1304793147499741184,1304793147499741184,1599921902000,2020-09-12,10:45:02,EDT,229110702,asuprepacademy,ASU Preparatory Academy,,"As more of the state re-opens, it is imperative for students to adopt healthy mask wearing habits now, so they are ready to see and interact with their friends when ASU Prep is ready to officially re-open its campuses. Please help us prepare. https://www.healthline.com/health-news/from-toddlers-to-teens-how-to-talk-to-kids-about-wearing-masks …",[],['https://www.healthline.com/health-news/from-toddlers-to-teens-how-to-talk-to-kids-about-wearing-masks'],[],0,0,0,[],[],https://twitter.com/ASUPrepAcademy/status/1304793147499741184,False,,0,,,,,,,"[{'user_id': '229110702', 'username': 'ASUPrepAcademy'}]",,,,
1304480987590598656,1304480987590598656,1599847478000,2020-09-11,14:04:38,EDT,229110702,asuprepacademy,ASU Preparatory Academy,,💛 We remember. 💛 pic.twitter.com/5VnlfIgtVl,[],[],['https://pbs.twimg.com/media/Ehpyi6VWAAE4jEW.jpg'],0,1,3,[],[],https://twitter.com/ASUPrepAcademy/status/1304480987590598656,False,,0,,,,,,,"[{'user_id': '229110702', 'username': 'ASUPrepAcademy'}]",,,,
1304215339044163589,1304215339044163589,1599784142000,2020-09-10,20:29:02,EDT,229110702,asuprepacademy,ASU Preparatory Academy,,Today is #WSPD20. #BeThe1To to make a difference - stepping forward and reaching out can help save lives. Visit:  https://bit.ly/2PRK8Qq  pic.twitter.com/4dW6f3TX5T,[],['https://bit.ly/2PRK8Qq'],['https://pbs.twimg.com/media/EhmA8HTWoAMlDNO.jpg'],0,1,1,"['#wspd20', '#bethe1to']",[],https://twitter.com/ASUPrepAcademy/status/1304215339044163589,False,,0,,,,,,,"[{'user_id': '229110702', 'username': 'ASUPrepAcademy'}]",,,,
1303380091699949568,1303380091699949568,1599585004000,2020-09-08,13:10:04,EDT,229110702,asuprepacademy,ASU Preparatory Academy,,"Word of mouth is the best form of advertising! Who do you think should hear about our ASU Prep Casa Grande high school campus? We have a virtual open house scheduled for Thursday, September 10! Help us spread the word. To RSVP: https://www.eventbrite.com/e/asu-prep-casa-grande-virtual-open-house-tickets-113372622566 …",[],['https://www.eventbrite.com/e/asu-prep-casa-grande-virtual-open-house-tickets-113372622566'],[],0,0,2,[],[],https://twitter.com/ASUPrepAcademy/status/1303380091699949568,False,,0,,,,,,,"[{'user_id': '229110702', 'username': 'ASUPrepAcademy'}]",,,,
1302253916705492996,1302253916705492996,1599316503000,2020-09-05,10:35:03,EDT,229110702,asuprepacademy,ASU Preparatory Academy,,Please be like Sparky and Forks up™. Masks up. 💛 How to wear masks from the CDC:  https://www.cdc.gov/coronavirus/2019-ncov/prevent-getting-sick/how-to-wear-cloth-face-coverings.html … pic.twitter.com/0DWoABgLwc,[],['https://www.cdc.gov/coronavirus/2019-ncov/prevent-getting-sick/how-to-wear-cloth-face-coverings.html'],['https://pbs.twimg.com/media/EhKJCVeWAAUBlHd.jpg'],0,1,1,[],[],https://twitter.com/ASUPrepAcademy/status/1302253916705492996,False,,0,,,,,,,"[{'user_id': '229110702', 'username': 'ASUPrepAcademy'}]",,,,
1301913578136629248,1301913578136629248,1599235360000,2020-09-04,12:02:40,EDT,229110702,asuprepacademy,ASU Preparatory Academy,,"The 7th annual Hacks for Humanity event is one month away! ASU Prep's Sun Devils have participated in the past. The 3-day virtual event challenges participants to create/innovate solutions to local & global issues + vying for $10,000 in prizes! To register  https://www.hacksforhumanity.io/  pic.twitter.com/UuEzF7Xvcv",[],['https://www.hacksforhumanity.io/'],['https://pbs.twimg.com/media/EhFTgBIXkAEpcy9.jpg'],0,1,1,[],[],https://twitter.com/ASUPrepAcademy/status/1301913578136629248,False,,0,,,,,,,"[{'user_id': '229110702', 'username': 'ASUPrepAcademy'}]",,,,
1301589539975237632,1301589539975237632,1599158103000,2020-09-03,14:35:03,EDT,229110702,asuprepacademy,ASU Preparatory Academy,,"Help us spread the word: The AZ Department of Health is providing free masks to vulnerable populations (including students/school staff/those who may not be able to purchase one). Each order provides 5 washable, reusable masks, one order per household.

 https://www.azdhs.gov/preparedness/epidemiology-disease-control/infectious-disease-epidemiology/index.php#novel-coronavirus-order-masks … pic.twitter.com/vKEU2BqELU",[],['https://www.azdhs.gov/preparedness/epidemiology-disease-control/infectious-disease-epidemiology/index.php#novel-coronavirus-order-masks'],['https://pbs.twimg.com/media/EhAsyh6XgAA2swU.jpg'],0,2,1,[],[],https://twitter.com/ASUPrepAcademy/status/1301589539975237632,False,,0,,,,,,,"[{'user_id': '229110702', 'username': 'ASUPrepAcademy'}]",,,,
1301505776318636032,1301505776318636032,1599138132000,2020-09-03,09:02:12,EDT,229110702,asuprepacademy,ASU Preparatory Academy,,"Child development experts tell us that play is an essential part of childhood...In this global health crisis, here’s what parents need to know: when children experience stress and adversity, play becomes more important than ever.

Read more: https://www.pbs.org/parents/thrive/how-play-helps-kids-navigate-difficult-times …",[],['https://www.pbs.org/parents/thrive/how-play-helps-kids-navigate-difficult-times'],[],0,0,1,[],[],https://twitter.com/ASUPrepAcademy/status/1301505776318636032,False,,0,,,,,,,"[{'user_id': '229110702', 'username': 'ASUPrepAcademy'}]",,,,
1300869797308248064,1300869797308248064,1598986503000,2020-09-01,14:55:03,EDT,229110702,asuprepacademy,ASU Preparatory Academy,,"ASU Prep Tempe alum Jarod Arroyo impressed us as a student with his champion mindset and we're proud to see his progress post-graduation. Still cheering for you, Jarod! https://www.swimmingworldmagazine.com/news/puerto-ricos-jarod-arroyo-undaunted-by-pause-in-momentum-in-tokyo-push/ …",[],['https://www.swimmingworldmagazine.com/news/puerto-ricos-jarod-arroyo-undaunted-by-pause-in-momentum-in-tokyo-push/'],[],0,0,2,[],[],https://twitter.com/ASUPrepAcademy/status/1300869797308248064,False,,0,,,,,,,"[{'user_id': '229110702', 'username': 'ASUPrepAcademy'}]",,,,
1300071293199491073,1300071293199491073,1598796125000,2020-08-30,10:02:05,EDT,229110702,asuprepacademy,ASU Preparatory Academy,,For our fellow space nerds! https://asunow.asu.edu/20200824-recently-discovered-planets-not-safe-stellar-flares-first-thought …,[],['https://asunow.asu.edu/20200824-recently-discovered-planets-not-safe-stellar-flares-first-thought'],[],0,1,1,[],[],https://twitter.com/ASUPrepAcademy/status/1300071293199491073,False,,0,,,,,,,"[{'user_id': '229110702', 'username': 'ASUPrepAcademy'}]",,,,
1299754183130783745,1299754183130783745,1598720520000,2020-08-29,13:02:00,EDT,229110702,asuprepacademy,ASU Preparatory Academy,,"Forks up, ASU! #GoDevils https://asunow.asu.edu/20200820-asu-ranks-among-worlds-best …",[],['https://asunow.asu.edu/20200820-asu-ranks-among-worlds-best'],[],0,0,1,['#godevils'],[],https://twitter.com/ASUPrepAcademy/status/1299754183130783745,False,,0,,,,,,,"[{'user_id': '229110702', 'username': 'ASUPrepAcademy'}]",,,,
1299347367334944769,1299347367334944769,1598623527000,2020-08-28,10:05:27,EDT,229110702,asuprepacademy,ASU Preparatory Academy,,We're not suggesting you put your kiddos in timeout - we're just saying if you put YOURSELF in timeout that THESE ARE PRETTY! 😜 How to make a mindfulness jar or calming timeout timer:  https://www.pbs.org/parents/crafts-and-experiments/make-a-mindfulness-jar-or-calming-timeout-timer … pic.twitter.com/G5YVCMDZRn,[],['https://www.pbs.org/parents/crafts-and-experiments/make-a-mindfulness-jar-or-calming-timeout-timer'],['https://pbs.twimg.com/media/Egg1i3oVoAIq29w.jpg'],0,0,0,[],[],https://twitter.com/ASUPrepAcademy/status/1299347367334944769,False,,0,,,,,,,"[{'user_id': '229110702', 'username': 'ASUPrepAcademy'}]",,,,
1299052070192939009,1299052070192939009,1598553123000,2020-08-27,14:32:03,EDT,229110702,asuprepacademy,ASU Preparatory Academy,,"As AZ starts to re-open gyms and movie theaters, this is a good thing to keep in mind. Forks up™. Masks up. https://asunow.asu.edu/20200428-research-shows-water-quality-could-diminish-closed-buildings-during-covid-19-pandemic …",[],['https://asunow.asu.edu/20200428-research-shows-water-quality-could-diminish-closed-buildings-during-covid-19-pandemic'],[],0,2,0,[],[],https://twitter.com/ASUPrepAcademy/status/1299052070192939009,False,,0,,,,,,,"[{'user_id': '229110702', 'username': 'ASUPrepAcademy'}]",,,,
1298999415466848256,1298999415466848256,1598540569000,2020-08-27,11:02:49,EDT,229110702,asuprepacademy,ASU Preparatory Academy,,"This is a #tbt blast from the past, from when our friends at @BarcaAcademyAZ and our ASU Prep Casa Grande campus were featured in ASU Now.

Watch: https://vimeo.com/239844708 ",['barcaacademyaz'],['https://vimeo.com/239844708'],[],0,0,1,['#tbt'],[],https://twitter.com/ASUPrepAcademy/status/1298999415466848256,False,,0,,,,,,,"[{'user_id': '229110702', 'username': 'ASUPrepAcademy'}, {'user_id': '851885310778716161', 'username': 'BarcaAcademyAZ'}]",,,,
1298653952238551041,1298653952238551041,1598458204000,2020-08-26,12:10:04,EDT,229110702,asuprepacademy,ASU Preparatory Academy,,"Our ASU Prep Poly STEM Academy students appreciated the compassion found working with Eye to Eye ASU. 💛 Check out this profile on the program!

 https://studentlife.asu.edu/content/sun-devils-launched-initiative-middle-schoolers-learning-disabilities … pic.twitter.com/sWUsH942Yq",[],['https://studentlife.asu.edu/content/sun-devils-launched-initiative-middle-schoolers-learning-disabilities'],['https://pbs.twimg.com/media/EgW-4zHWAAI4N1k.jpg'],0,0,0,[],[],https://twitter.com/ASUPrepAcademy/status/1298653952238551041,False,,0,,,,,,,"[{'user_id': '229110702', 'username': 'ASUPrepAcademy'}]",,,,
1298333086883684363,1298333086883684363,1598381704000,2020-08-25,14:55:04,EDT,229110702,asuprepacademy,ASU Preparatory Academy,,"Not sure about you, but we are DEFINITELY at the making homemade granola bars level of quarantine. These look delicious!

 https://www.pbs.org/food/kitchen-vignettes/back-to-school-granola-bars/ … pic.twitter.com/oIBRtURHZf",[],['https://www.pbs.org/food/kitchen-vignettes/back-to-school-granola-bars/'],['https://pbs.twimg.com/media/EgSbD_RXoAEvPWe.jpg'],0,0,1,[],[],https://twitter.com/ASUPrepAcademy/status/1298333086883684363,False,,0,,,,,,,"[{'user_id': '229110702', 'username': 'ASUPrepAcademy'}]",,,,
1297974470964121602,1297974470964121602,1598296203000,2020-08-24,15:10:03,EDT,229110702,asuprepacademy,ASU Preparatory Academy,,Sun Devils who visit ASU's Tempe campus are familiar with the iconic Old Main but how much do you know about it? https://asunow.asu.edu/20200821-sun-devil-life-old-main-heart-asu …,[],['https://asunow.asu.edu/20200821-sun-devil-life-old-main-heart-asu'],[],0,1,2,[],[],https://twitter.com/ASUPrepAcademy/status/1297974470964121602,False,,0,,,,,,,"[{'user_id': '229110702', 'username': 'ASUPrepAcademy'}]",,,,
1297172334298701827,1297172334298701827,1598104959000,2020-08-22,10:02:39,EDT,229110702,asuprepacademy,ASU Preparatory Academy,,This year’s “back-to-school” looks very different for families grappling with the pandemic. Children and Screens: Institute of Digital Media and Child Development has pulled together these useful tips for making the most of the 2020-21 school year:  https://mailchi.mp/a0aa7af51084/fact-or-fake-how-to-help-kids-spot-misinformation-online-12305816 … pic.twitter.com/Ye80lScdtL,[],['https://mailchi.mp/a0aa7af51084/fact-or-fake-how-to-help-kids-spot-misinformation-online-12305816'],['https://pbs.twimg.com/media/EgB7XQEXYAE-pu8.jpg'],0,2,4,[],[],https://twitter.com/ASUPrepAcademy/status/1297172334298701827,False,,0,,,,,,,"[{'user_id': '229110702', 'username': 'ASUPrepAcademy'}]",,,,
1296838254856216577,1296838254856216577,1598025308000,2020-08-21,11:55:08,EDT,229110702,asuprepacademy,ASU Preparatory Academy,,"The pandemic is a stress test: It tests how well we handle isolation, schooling from home, and all the other changes to our jobs, lives and livelihoods.  Here are some mental health tips from a psychologist at Phoenix Children's Hospital:  https://www.raisingarizonakids.com/2020/08/9-mental-health-tips-for-covid-frazzled-kids-and-parents/ …",[],['https://www.raisingarizonakids.com/2020/08/9-mental-health-tips-for-covid-frazzled-kids-and-parents/'],[],0,1,1,[],[],https://twitter.com/ASUPrepAcademy/status/1296838254856216577,False,,0,,,,,,,"[{'user_id': '229110702', 'username': 'ASUPrepAcademy'}]",,,,
1296538105487523840,1296538105487523840,1597953747000,2020-08-20,16:02:27,EDT,229110702,asuprepacademy,ASU Preparatory Academy,,"Do your little ones love Daniel Tiger on PBS? Daniel Tiger is great for helping us talk about feelings, and that could really come in handy during Covid! Read more here:  https://www.pbs.org/parents/thrive/how-daniel-tigers-neighborhood-songs-help-my-parenting-during-covid-19 … pic.twitter.com/T1ws4SQ7o6",[],['https://www.pbs.org/parents/thrive/how-daniel-tigers-neighborhood-songs-help-my-parenting-during-covid-19'],['https://pbs.twimg.com/media/Ef46iSmWAAEt-bl.jpg'],0,0,2,[],[],https://twitter.com/ASUPrepAcademy/status/1296538105487523840,False,,0,,,,,,,"[{'user_id': '229110702', 'username': 'ASUPrepAcademy'}]",,,,
1296148141746479105,1296148141746479105,1597860772000,2020-08-19,14:12:52,EDT,229110702,asuprepacademy,ASU Preparatory Academy,,Digital summer school students feel ready for the fall https://asunow.asu.edu/20200814-digital-summer-school-students-feel-ready-fall …,[],['https://asunow.asu.edu/20200814-digital-summer-school-students-feel-ready-fall'],[],0,0,1,[],[],https://twitter.com/ASUPrepAcademy/status/1296148141746479105,False,,0,,,,,,,"[{'user_id': '229110702', 'username': 'ASUPrepAcademy'}]",,,,
1295886963418058754,1295886963418058754,1597798503000,2020-08-18,20:55:03,EDT,229110702,asuprepacademy,ASU Preparatory Academy,,"Now that we've returned to online learning, you might need a new Zoom background! We curated a few from ASU to help you show your Sun Devil pride. Go check them out, on our Facebook page  https://www.facebook.com/asupreparatoryacademy/ …. pic.twitter.com/BIcXSOOhML",[],['https://www.facebook.com/asupreparatoryacademy/'],['https://pbs.twimg.com/media/EfvqU1FXoAEP3BB.jpg'],0,0,2,[],[],https://twitter.com/ASUPrepAcademy/status/1295886963418058754,False,,0,,,,,,,"[{'user_id': '229110702', 'username': 'ASUPrepAcademy'}]",,,,
1295360674042978304,1295360674042978304,1597673025000,2020-08-17,10:03:45,EDT,229110702,asuprepacademy,ASU Preparatory Academy,,🔱WELCOME BACK!🔱 Show 💛 us 💛 your 💛 back-to-school 💛 photos 💛 using  #PrepsFirstDay pic.twitter.com/qA1NBgtVVb,[],[],['https://pbs.twimg.com/media/EfoLqxZXgAAnllq.jpg'],0,3,6,['#prepsfirstday'],[],https://twitter.com/ASUPrepAcademy/status/1295360674042978304,False,,0,,,,,,,"[{'user_id': '229110702', 'username': 'ASUPrepAcademy'}]",,,,
1294001348426506242,1294001348426506242,1597348937000,2020-08-13,16:02:17,EDT,229110702,asuprepacademy,ASU Preparatory Academy,,"There have been many calls for conversations about race. To be anti-racist and confront bias requires active, honest, and sometimes uncomfortable living...Parents can create opportunities through regular media use. Read more from PBS for Parents:  https://www.pbs.org/parents/thrive/using-media-to-talk-with-children-about-race … pic.twitter.com/61RlY3HK7t",[],['https://www.pbs.org/parents/thrive/using-media-to-talk-with-children-about-race'],['https://pbs.twimg.com/media/EfU3XneWkAAv0OC.jpg'],0,0,2,[],[],https://twitter.com/ASUPrepAcademy/status/1294001348426506242,False,,0,,,,,,,"[{'user_id': '229110702', 'username': 'ASUPrepAcademy'}]",,,,
1293941563677081601,1293941563677081601,1597334683000,2020-08-13,12:04:43,EDT,229110702,asuprepacademy,ASU Preparatory Academy,,Here we go Sun Devils! The countdown to the first day of school begins. See you *online* Monday and don't forget we want to see your back-to-school student photos using #PrepsFirstDay pic.twitter.com/79ZapA5oM1,[],[],['https://pbs.twimg.com/media/EfUA_plXsAEHiMi.jpg'],0,1,4,['#prepsfirstday'],[],https://twitter.com/ASUPrepAcademy/status/1293941563677081601,False,,0,,,,,,,"[{'user_id': '229110702', 'username': 'ASUPrepAcademy'}]",,,,
1293618269887373316,1293618269887373316,1597257604000,2020-08-12,14:40:04,EDT,229110702,asuprepacademy,ASU Preparatory Academy,,"You're Invited to a Virtual Event on Thursday, Aug 18 at 12:30 pm AZ: In the face of current challenges, there's a lot we can do to bolster our children’s feelings of confidence and security as they head into a new school year. Join the conversation! 

 https://www.pbs.org/parents/back-to-school-event … pic.twitter.com/KdY0MjOC7a",[],['https://www.pbs.org/parents/back-to-school-event'],['https://pbs.twimg.com/media/EfPa9gkWoAAtXOS.jpg'],0,3,1,[],[],https://twitter.com/ASUPrepAcademy/status/1293618269887373316,False,,0,,,,,,,"[{'user_id': '229110702', 'username': 'ASUPrepAcademy'}]",,,,
1293577868908273666,1293577868908273666,1597247972000,2020-08-12,11:59:32,EDT,229110702,asuprepacademy,ASU Preparatory Academy,,Pac-12 Conference postpones all sport competitions through end of calendar year http://thesundevils.com/news/2020/8/11/pac-12-postpones-2020.aspx …,[],['http://thesundevils.com/news/2020/8/11/pac-12-postpones-2020.aspx'],[],0,1,0,[],[],https://twitter.com/ASUPrepAcademy/status/1293577868908273666,False,,0,,,,,,,"[{'user_id': '229110702', 'username': 'ASUPrepAcademy'}]",,,,
1293364086550474754,1293364086550474754,1597197002000,2020-08-11,21:50:02,EDT,229110702,asuprepacademy,ASU Preparatory Academy,,"As America grapples with the challenges of COVID-19 and the need for flexible models of K-12 education, two new enterprises are quietly rolling out of Arizona State University...and one of them is ASU Prep Digital. https://indefenseofliberty.blog/2020/08/11/modern-student-learning-classical-teacher-training-to-reshape-k-12/ …",[],['https://indefenseofliberty.blog/2020/08/11/modern-student-learning-classical-teacher-training-to-reshape-k-12/'],[],0,0,0,[],[],https://twitter.com/ASUPrepAcademy/status/1293364086550474754,False,,0,,,,,,,"[{'user_id': '229110702', 'username': 'ASUPrepAcademy'}]",,,,
1293350248136486917,1293350248136486917,1597193703000,2020-08-11,20:55:03,EDT,229110702,asuprepacademy,ASU Preparatory Academy,,"With COVID-19 numbers still high in Arizona, and in-person learning delayed, distance learning is the new back-to-school reality. As a parent, you probably have a lot of questions about how to make sure kids stay engaged and learning this school year.  https://www.raisingarizonakids.com/2020/08/using-common-sense-9-ways-to-motivate-kids-for-online-learning/ …",[],['https://www.raisingarizonakids.com/2020/08/using-common-sense-9-ways-to-motivate-kids-for-online-learning/'],[],0,0,3,[],[],https://twitter.com/ASUPrepAcademy/status/1293350248136486917,False,,0,,,,,,,"[{'user_id': '229110702', 'username': 'ASUPrepAcademy'}]",,,,
1293262064304062464,1293262064304062464,1597172678000,2020-08-11,15:04:38,EDT,229110702,asuprepacademy,ASU Preparatory Academy,,"Pro Tip: When your online schoolwork includes synchronous learning, set an alarm a few minutes beforehand to make sure you join the virtual classroom on time. You can also set alarms to remind you when to take breaks ...and when to come back from them! #DistanceLearning pic.twitter.com/FJcS2X7F6v",[],[],[],0,1,2,['#distancelearning'],[],https://twitter.com/ASUPrepAcademy/status/1293262064304062464,False,,1,,,,,,,"[{'user_id': '229110702', 'username': 'ASUPrepAcademy'}]",,,,
1293261217830563841,1292934507964665856,1597172476000,2020-08-11,15:01:16,EDT,229110702,asuprepacademy,ASU Preparatory Academy,,Exactly! It makes us so proud. 🔱,['jaronrheinedu'],[],[],0,0,0,[],[],https://twitter.com/ASUPrepAcademy/status/1293261217830563841,False,,0,,,,,,,"[{'user_id': '229110702', 'username': 'ASUPrepAcademy'}, {'user_id': '1293250642249572352', 'username': 'JaronRheinEdu'}]",,,,
1293218132354629633,1293218132354629633,1597162204000,2020-08-11,12:10:04,EDT,229110702,asuprepacademy,ASU Preparatory Academy,,"Word of mouth is the best form of advertising! Who do you think should hear about our ASU Prep South Phoenix campus? We have a virtual open house scheduled for this Friday, August 14! Help us spread the word. To RSVP: https://www.eventbrite.com/e/asu-prep-south-phoenix-virtual-open-house-tickets-116046226387 …",[],['https://www.eventbrite.com/e/asu-prep-south-phoenix-virtual-open-house-tickets-116046226387'],[],0,0,3,[],[],https://twitter.com/ASUPrepAcademy/status/1293218132354629633,False,,0,,,,,,,"[{'user_id': '229110702', 'username': 'ASUPrepAcademy'}]",,,,
1292934507964665856,1292934507964665856,1597094582000,2020-08-10,17:23:02,EDT,229110702,asuprepacademy,ASU Preparatory Academy,,"Reason # 597 why our kids are so cool: School doesn't start for another week, but we're already getting emails from students asking if there is any work they can get started on now. 🥺 #RepthePrep #onlinelearning",[],[],[],1,0,6,"['#reptheprep', '#onlinelearning']",[],https://twitter.com/ASUPrepAcademy/status/1292934507964665856,False,,0,,,,,,,"[{'user_id': '229110702', 'username': 'ASUPrepAcademy'}]",,,,
1292885943289028609,1292885943289028609,1597083004000,2020-08-10,14:10:04,EDT,229110702,asuprepacademy,ASU Preparatory Academy,,"Word of mouth is the best form of advertising! Who do you think should hear about our ASU Prep Casa Grande high school campus? We have a virtual open house scheduled for Thursday, August 13! Help us spread the word. To RSVP: https://www.eventbrite.com/e/asu-prep-casa-grande-virtual-open-house-tickets-113372522266 …",[],['https://www.eventbrite.com/e/asu-prep-casa-grande-virtual-open-house-tickets-113372522266'],[],0,0,1,[],[],https://twitter.com/ASUPrepAcademy/status/1292885943289028609,False,,0,,,,,,,"[{'user_id': '229110702', 'username': 'ASUPrepAcademy'}]",,,,
1291813665671266304,1291813665671266304,1596827353000,2020-08-07,15:09:13,EDT,229110702,asuprepacademy,ASU Preparatory Academy,,"We're so excited! This grant funding will help to pay for Swivl equipment for our teachers that will allow us to maximize student learning, regardless if they learn with us in-person/online or a combination of both. Thank you! https://twitter.com/AforArizona/status/1291403756832079879 …",[],['https://twitter.com/AforArizona/status/1291403756832079879'],[],0,4,9,[],[],https://twitter.com/ASUPrepAcademy/status/1291813665671266304,False,https://twitter.com/AforArizona/status/1291403756832079879,0,,,,,,,"[{'user_id': '229110702', 'username': 'ASUPrepAcademy'}]",,,,
1291389283325050883,1291389283325050883,1596726172000,2020-08-06,11:02:52,EDT,229110702,asuprepacademy,ASU Preparatory Academy,,"In commemoration of this year’s centennial of the ratification of the 19th Amendment, Zócalo Public Square will present a three-part livestreamed event Aug. 20 in a series called ""When Women Vote.""

To register: https://www.zocalopublicsquare.org/event/how-have-womens-protests-changed-history/ …",[],['https://www.zocalopublicsquare.org/event/how-have-womens-protests-changed-history/'],[],0,0,0,[],[],https://twitter.com/ASUPrepAcademy/status/1291389283325050883,False,,0,,,,,,,"[{'user_id': '229110702', 'username': 'ASUPrepAcademy'}]",,,,
1291179695208308736,1291179695208308736,1596676202000,2020-08-05,21:10:02,EDT,229110702,asuprepacademy,ASU Preparatory Academy,,"Technology distribution has begun at our ASU Prep campuses! So far our small but might campus and IT teams have distributed +1,100 computers. By the end of next week we should distribute more than 3,000 computers to students. Thank you, families, for your patience! #PrepsFirstDay pic.twitter.com/EFNSPtXv27",[],[],['https://pbs.twimg.com/media/EesxFvsXgAEhXbj.jpg'],0,0,3,['#prepsfirstday'],[],https://twitter.com/ASUPrepAcademy/status/1291179695208308736,False,,0,,,,,,,"[{'user_id': '229110702', 'username': 'ASUPrepAcademy'}]",,,,
1291087845516554242,1291087845516554242,1596654304000,2020-08-05,15:05:04,EDT,229110702,asuprepacademy,ASU Preparatory Academy,,#WednesdayWisdom pic.twitter.com/Vg3WuKmxkL,[],[],['https://pbs.twimg.com/media/EerdjbDXsAU9XbG.jpg'],0,0,2,['#wednesdaywisdom'],[],https://twitter.com/ASUPrepAcademy/status/1291087845516554242,False,,0,,,,,,,"[{'user_id': '229110702', 'username': 'ASUPrepAcademy'}]",,,,
1290745965788323840,1290481339292999681,1596572793000,2020-08-04,16:26:33,EDT,229110702,asuprepacademy,ASU Preparatory Academy,,👏,"['dukebryce', 'barcaacademyaz', 'nathanschnur3']",[],[],0,0,0,[],[],https://twitter.com/ASUPrepAcademy/status/1290745965788323840,False,,0,,,,,,,"[{'user_id': '229110702', 'username': 'ASUPrepAcademy'}, {'user_id': '3240098976', 'username': 'DukeBryce'}, {'user_id': '851885310778716161', 'username': 'BarcaAcademyAZ'}, {'user_id': '1161307102637252608', 'username': 'NathanSchnur3'}]",,,,
