id,conversation_id,created_at,date,time,timezone,user_id,username,name,place,tweet,mentions,urls,photos,replies_count,retweets_count,likes_count,hashtags,cashtags,link,retweet,quote_url,video,near,geo,source,user_rt_id,user_rt,retweet_id,reply_to,retweet_date,translate,trans_src,trans_dest
1276321795520552960,1276321795520552960,1593133803000,2020-06-25,21:10:03,EDT,229110702,asuprepacademy,ASU Preparatory Academy,,A great resource from ASU's School of Family and Social Dynamics: https://asunow.asu.edu/20200614-discoveries-%E2%80%98systemic-racism%E2%80%99-defined-and-deconstructed …,[],['https://asunow.asu.edu/20200614-discoveries-%E2%80%98systemic-racism%E2%80%99-defined-and-deconstructed'],[],0,0,0,[],[],https://twitter.com/ASUPrepAcademy/status/1276321795520552960,False,,0,,,,,,,"[{'user_id': '229110702', 'username': 'ASUPrepAcademy'}]",,,,
1276270206306877446,1276270206306877446,1593121503000,2020-06-25,17:45:03,EDT,229110702,asuprepacademy,ASU Preparatory Academy,,Parents and Guardians hopefully by now you saw last night's email regarding the back-to-school learning models. We know there is a lot to digest but we are happy that our students will have options in the Fall. For more please visit:  http://ow.ly/eGz150Ai2K6  pic.twitter.com/M0Qn3ohUep,[],['http://ow.ly/eGz150Ai2K6'],['https://pbs.twimg.com/media/EbY4_SPXsAAKcU7.jpg'],0,0,0,[],[],https://twitter.com/ASUPrepAcademy/status/1276270206306877446,False,,0,,,,,,,"[{'user_id': '229110702', 'username': 'ASUPrepAcademy'}]",,,,
1275834162339934210,1275834162339934210,1593017542000,2020-06-24,12:52:22,EDT,229110702,asuprepacademy,ASU Preparatory Academy,,Go Nathan! @BarcaAcademyAZ https://www.soccerwire.com/news/creighton-university-mens-soccer-announces-7-player-recruiting-class/ …,['barcaacademyaz'],['https://www.soccerwire.com/news/creighton-university-mens-soccer-announces-7-player-recruiting-class/'],[],0,1,4,[],[],https://twitter.com/ASUPrepAcademy/status/1275834162339934210,False,,0,,,,,,,"[{'user_id': '229110702', 'username': 'ASUPrepAcademy'}, {'user_id': '851885310778716161', 'username': 'BarcaAcademyAZ'}]",,,,
1275429719073271808,1275429719073271808,1592921116000,2020-06-23,10:05:16,EDT,229110702,asuprepacademy,ASU Preparatory Academy,,Tell your teacher friends: ASU Prep is actively interviewing. Visit  https://asuprep.asu.edu/careers  to learn more and apply today! pic.twitter.com/JBoPVkysFJ,[],['https://asuprep.asu.edu/careers'],['https://pbs.twimg.com/media/EbM8kgrX0AcoZrt.png'],0,0,1,[],[],https://twitter.com/ASUPrepAcademy/status/1275429719073271808,False,,0,,,,,,,"[{'user_id': '229110702', 'username': 'ASUPrepAcademy'}]",,,,
1275185568910135296,1275185568910135296,1592862906000,2020-06-22,17:55:06,EDT,229110702,asuprepacademy,ASU Preparatory Academy,,"Important notice for all incoming and current ASU Prep Families, we are performing maintenance on our Infinite Campus site. The site will be down for all families Tuesday, June 23 through Thursday, June 26. Thank you for your patience while this maintenance is completed. pic.twitter.com/dNqD7ssQNA",[],[],['https://pbs.twimg.com/media/EbJehGRXkAAzAup.jpg'],0,1,1,[],[],https://twitter.com/ASUPrepAcademy/status/1275185568910135296,False,,0,,,,,,,"[{'user_id': '229110702', 'username': 'ASUPrepAcademy'}]",,,,
1274711321355988993,1274711321355988993,1592749836000,2020-06-21,10:30:36,EDT,229110702,asuprepacademy,ASU Preparatory Academy,,Happy Father's Day to all the Sun Devil dads out there! pic.twitter.com/Jqjv8eIFlx,[],[],['https://pbs.twimg.com/media/EbCvMRLXsAM8_dq.jpg'],0,0,0,[],[],https://twitter.com/ASUPrepAcademy/status/1274711321355988993,False,,0,,,,,,,"[{'user_id': '229110702', 'username': 'ASUPrepAcademy'}]",,,,
1274372247868846081,1274372247868846081,1592668995000,2020-06-20,12:03:15,EDT,229110702,asuprepacademy,ASU Preparatory Academy,,"Let’s raise a generation of children who are Thoughtful, Informed, and Brave about race. For resources, please visit: https://www.embracerace.org/ ",[],['https://www.embracerace.org/'],[],0,0,1,[],[],https://twitter.com/ASUPrepAcademy/status/1274372247868846081,False,,0,,,,,,,"[{'user_id': '229110702', 'username': 'ASUPrepAcademy'}]",,,,
1274040677429653511,1274040677429653511,1592589942000,2020-06-19,14:05:42,EDT,229110702,asuprepacademy,ASU Preparatory Academy,,Tell your teacher friends: ASU Prep is actively interviewing. Visit  https://asuprep.asu.edu/careers  to learn more and apply today! pic.twitter.com/RPWNvZqBGG,[],['https://asuprep.asu.edu/careers'],['https://pbs.twimg.com/media/Ea5NPooWkAI5Nr1.png'],0,0,0,[],[],https://twitter.com/ASUPrepAcademy/status/1274040677429653511,False,,0,,,,,,,"[{'user_id': '229110702', 'username': 'ASUPrepAcademy'}]",,,,
1273980042880512006,1273980042880512006,1592575486000,2020-06-19,10:04:46,EDT,229110702,asuprepacademy,ASU Preparatory Academy,,"""Children are taught to notice differences between shapes and colors from a young age. Consequently, they also start noticing differences in the people around them. You are critical in guiding how they handle these differences.""

Parent resources:  https://www.apa.org/res/about  pic.twitter.com/xuJ5My0KhR",[],['https://www.apa.org/res/about'],['https://pbs.twimg.com/media/Ea4WGOSWoAA1OMs.jpg'],0,1,1,[],[],https://twitter.com/ASUPrepAcademy/status/1273980042880512006,False,,0,,,,,,,"[{'user_id': '229110702', 'username': 'ASUPrepAcademy'}]",,,,
1273797781749194757,1273797781749194757,1592532031000,2020-06-18,22:00:31,EDT,229110702,asuprepacademy,ASU Preparatory Academy,,"The In My Skin podcast features episodes about how parents and teachers can explore bias, race, and how to nurture black children.

Listen here or on any podcast platform:  https://www.racepride.pitt.edu/in-my-skin-podcast/ … pic.twitter.com/SYm5uhwDA5",[],['https://www.racepride.pitt.edu/in-my-skin-podcast/'],['https://pbs.twimg.com/media/Ea1wVQtWoAIPMPZ.jpg'],0,0,0,[],[],https://twitter.com/ASUPrepAcademy/status/1273797781749194757,False,,0,,,,,,,"[{'user_id': '229110702', 'username': 'ASUPrepAcademy'}]",,,,
1273708456881516544,1273708456881516544,1592510735000,2020-06-18,16:05:35,EDT,229110702,asuprepacademy,ASU Preparatory Academy,,👏! Our students love BioBeyond 🔱 @asuprepdigital https://twitter.com/redefinEDonline/status/1273616604878778376 …,['asuprepdigital'],['https://twitter.com/redefinEDonline/status/1273616604878778376'],[],0,0,0,[],[],https://twitter.com/ASUPrepAcademy/status/1273708456881516544,False,https://twitter.com/redefinEDonline/status/1273616604878778376,0,,,,,,,"[{'user_id': '229110702', 'username': 'ASUPrepAcademy'}, {'user_id': '831208730263908353', 'username': 'asuprepdigital'}]",,,,
1273632819017854979,1273632819017854979,1592492701000,2020-06-18,11:05:01,EDT,229110702,asuprepacademy,ASU Preparatory Academy,,"If you could celebrate #internationalpicnicday with ONE person, who would it be? (And you can't pick Sparky!) pic.twitter.com/6Vbiv25oIR",[],[],['https://pbs.twimg.com/media/EazaTKQXYAEPxG8.jpg'],0,0,1,['#internationalpicnicday'],[],https://twitter.com/ASUPrepAcademy/status/1273632819017854979,False,,0,,,,,,,"[{'user_id': '229110702', 'username': 'ASUPrepAcademy'}]",,,,
1273370228068626438,1273370228068626438,1592430095000,2020-06-17,17:41:35,EDT,229110702,asuprepacademy,ASU Preparatory Academy,,Happy #NationalMascotDay Sparky! We 💛 you. 🔱 pic.twitter.com/rj0yyS7pKT,[],[],['https://pbs.twimg.com/media/EavreXUXsAEk4-a.jpg'],0,0,1,['#nationalmascotday'],[],https://twitter.com/ASUPrepAcademy/status/1273370228068626438,False,,0,,,,,,,"[{'user_id': '229110702', 'username': 'ASUPrepAcademy'}]",,,,
1272694142204870658,1272694142204870658,1592268903000,2020-06-15,20:55:03,EDT,229110702,asuprepacademy,ASU Preparatory Academy,,"Many Arizona students and their families are in need of food assistance this summer. Please visit the AZ Food Bank Network, which maintains a list of food sites throughout the entire state. 

 http://www.azfoodbanks.org/index.php/foodbank/index/ … pic.twitter.com/SwdON1zPxF",[],['http://www.azfoodbanks.org/index.php/foodbank/index/'],['https://pbs.twimg.com/media/EamElAHWsAEk1dB.jpg'],0,0,1,[],[],https://twitter.com/ASUPrepAcademy/status/1272694142204870658,False,,0,,,,,,,"[{'user_id': '229110702', 'username': 'ASUPrepAcademy'}]",,,,
1272546936588034048,1272546936588034048,1592233807000,2020-06-15,11:10:07,EDT,229110702,asuprepacademy,ASU Preparatory Academy,,Tell your teacher friends: ASU Prep is actively interviewing. Visit  https://asuprep.asu.edu/careers  to learn more and apply today! pic.twitter.com/eVui5l7IdO,[],['https://asuprep.asu.edu/careers'],['https://pbs.twimg.com/media/Eaj-sgIWoAAAYyr.png'],0,0,1,[],[],https://twitter.com/ASUPrepAcademy/status/1272546936588034048,False,,0,,,,,,,"[{'user_id': '229110702', 'username': 'ASUPrepAcademy'}]",,,,
1271820323957231616,1271820323957231616,1592060569000,2020-06-13,11:02:49,EDT,229110702,asuprepacademy,ASU Preparatory Academy,,"How to talk honestly with children about racism.
 https://www.pbs.org/parents/thrive/how-to-talk-honestly-with-children-about-racism … pic.twitter.com/EdR60qQNkH",[],['https://www.pbs.org/parents/thrive/how-to-talk-honestly-with-children-about-racism'],['https://pbs.twimg.com/media/EaZp2BQXsAAfoUj.jpg'],1,0,1,[],[],https://twitter.com/ASUPrepAcademy/status/1271820323957231616,False,,0,,,,,,,"[{'user_id': '229110702', 'username': 'ASUPrepAcademy'}]",,,,
1271498781784248320,1271498781784248320,1591983907000,2020-06-12,13:45:07,EDT,229110702,asuprepacademy,ASU Preparatory Academy,,"STUDENT OPP: Maricopa County ASU Pathways students can apply for a scholarship to cover the cost of their Open Scale courses in engineering, business or liberal arts and sciences. Deadline is Monday, June 15!

Apply:  https://scholarships.asu.edu/scholarship/168088 … pic.twitter.com/2mPnCfZ2re",[],['https://scholarships.asu.edu/scholarship/168088'],['https://pbs.twimg.com/media/EaVFZzEXgAAv5Fg.jpg'],0,0,0,[],[],https://twitter.com/ASUPrepAcademy/status/1271498781784248320,False,,0,,,,,,,"[{'user_id': '229110702', 'username': 'ASUPrepAcademy'}]",,,,
1271243332035977217,1271243332035977217,1591923003000,2020-06-11,20:50:03,EDT,229110702,asuprepacademy,ASU Preparatory Academy,,"13 children’s books about race and diversity. 📚
 https://www.pbs.org/parents/thrive/childrens-books-about-race-and-diversity … pic.twitter.com/b1quek4tf1",[],['https://www.pbs.org/parents/thrive/childrens-books-about-race-and-diversity'],['https://pbs.twimg.com/media/EaRdEs-XQAcfcEl.jpg'],0,1,1,[],[],https://twitter.com/ASUPrepAcademy/status/1271243332035977217,False,,0,,,,,,,"[{'user_id': '229110702', 'username': 'ASUPrepAcademy'}]",,,,
1271203068957413376,1271203068957413376,1591913404000,2020-06-11,18:10:04,EDT,229110702,asuprepacademy,ASU Preparatory Academy,,Tell your teacher friends: ASU Prep is actively interviewing. Visit  https://asuprep.asu.edu/careers  to learn more and apply today! pic.twitter.com/TaLWZuNWbx,[],['https://asuprep.asu.edu/careers'],['https://pbs.twimg.com/media/EaQ4dF0X0AIE7et.png'],0,2,1,[],[],https://twitter.com/ASUPrepAcademy/status/1271203068957413376,False,,0,,,,,,,"[{'user_id': '229110702', 'username': 'ASUPrepAcademy'}]",,,,
