id,conversation_id,created_at,date,time,timezone,user_id,username,name,place,tweet,mentions,urls,photos,replies_count,retweets_count,likes_count,hashtags,cashtags,link,retweet,quote_url,video,near,geo,source,user_rt_id,user_rt,retweet_id,reply_to,retweet_date,translate,trans_src,trans_dest
1099310605851389952,1099310605851389952,1550931047000,2019-02-23,09:10:47,EDT,1044628782802489349,blountboe,Blount County Schools,,Starting Saturday morning in the Gauntlet!,[],[],[],0,0,4,[],[],https://twitter.com/BLOUNTBOE/status/1099310605851389952,False,,0,,,,,,,"[{'user_id': '1044628782802489349', 'username': 'BLOUNTBOE'}]",,,,
1099176240068595712,1099176240068595712,1550899011000,2019-02-23,00:16:51,EDT,1044628782802489349,blountboe,Blount County Schools,,Follow the Ron Clark Academy page to check out some of the incredible experiences our Blount County Amazing Shake winners are having this weekend at the National competition!  https://www.facebook.com/story.php?story_fbid=2297793660244760&id=1991209247569871 …,[],['https://www.facebook.com/story.php?story_fbid=2297793660244760&id=1991209247569871'],[],0,0,2,[],[],https://twitter.com/BLOUNTBOE/status/1099176240068595712,False,,0,,,,,,,"[{'user_id': '1044628782802489349', 'username': 'BLOUNTBOE'}]",,,,
1099161688920809473,1099161688920809473,1550895542000,2019-02-22,23:19:02,EDT,1044628782802489349,blountboe,Blount County Schools,,Reporting the weather in Atlanta!,[],[],[],0,0,0,[],[],https://twitter.com/BLOUNTBOE/status/1099161688920809473,False,,0,,,,,,,"[{'user_id': '1044628782802489349', 'username': 'BLOUNTBOE'}]",,,,
1099085362440343554,1099085362440343554,1550877345000,2019-02-22,18:15:45,EDT,1044628782802489349,blountboe,Blount County Schools,, https://www.facebook.com/story.php?story_fbid=2297409253616534&id=1991209247569871 …,[],['https://www.facebook.com/story.php?story_fbid=2297409253616534&id=1991209247569871'],[],0,0,2,[],[],https://twitter.com/BLOUNTBOE/status/1099085362440343554,False,,0,,,,,,,"[{'user_id': '1044628782802489349', 'username': 'BLOUNTBOE'}]",,,,
1098543547190398977,1098543547190398977,1550748166000,2019-02-21,06:22:46,EDT,1044628782802489349,blountboe,Blount County Schools,,"All Blount County Schools will operate on a two hour delay on Thursday, February 21, due to heavy rain and thunderstorms.  All bus times and school start times will be delayed by two hours.",[],[],[],0,0,3,[],[],https://twitter.com/BLOUNTBOE/status/1098543547190398977,False,,0,,,,,,,"[{'user_id': '1044628782802489349', 'username': 'BLOUNTBOE'}]",,,,
1098542812801499136,1098542812801499136,1550747991000,2019-02-21,06:19:51,EDT,1044628782802489349,blountboe,Blount County Schools,,"ALL Blount County Schools will be on a 2 hour delay this morning, Thursday, February 21st. This is for all schools.",[],[],[],0,3,4,[],[],https://twitter.com/BLOUNTBOE/status/1098542812801499136,False,,0,,,,,,,"[{'user_id': '1044628782802489349', 'username': 'BLOUNTBOE'}]",,,,
1098273530569986049,1098273530569986049,1550683789000,2019-02-20,12:29:49,EDT,1044628782802489349,blountboe,Blount County Schools,,"Blountsville Elementary and JB Pennington High School will be dismissing at 12:30 on February 20th, 2019 due to an extended power outage at Blountsville Elementary.  

Eleventh graders taking the ACT will continue to...  https://www.facebook.com/BLOUNTBOE/posts/2293600993997360 …",[],['https://www.facebook.com/BLOUNTBOE/posts/2293600993997360'],[],0,1,0,[],[],https://twitter.com/BLOUNTBOE/status/1098273530569986049,False,,0,,,,,,,"[{'user_id': '1044628782802489349', 'username': 'BLOUNTBOE'}]",,,,
1096791665619152896,1096791665619152896,1550330485000,2019-02-16,10:21:25,EDT,1044628782802489349,blountboe,Blount County Schools,,Hayden Middle School is hosting almost 500 students from 27 schools at their 5th annual math tournament today!  4 Blount County Schools are competing! Good luck mathletes!,[],[],[],0,1,9,[],[],https://twitter.com/BLOUNTBOE/status/1096791665619152896,False,,0,,,,,,,"[{'user_id': '1044628782802489349', 'username': 'BLOUNTBOE'}]",,,,
1093245773410635777,1093245773410635777,1549485078000,2019-02-06,15:31:18,EDT,1044628782802489349,blountboe,Blount County Schools,,"Hayden Area Schools will be closed Thursday, February 7th and Friday, February 8th due to flu.  All faculty and staff should report on a regular schedule.

All other Blount County Schools will operate on a normal schedule.",[],[],[],0,2,2,[],[],https://twitter.com/BLOUNTBOE/status/1093245773410635777,False,,0,,,,,,,"[{'user_id': '1044628782802489349', 'username': 'BLOUNTBOE'}]",,,,
1092847781616803842,1092847781616803842,1549390189000,2019-02-05,13:09:49,EDT,1044628782802489349,blountboe,Blount County Schools,,This Chicken Pot Pie from the Southeastern cafeteria was absolutely fantastic! Comfort food at its finest!! Those not eating a School Lunch today sure missed out!! Thanks to Southeastern Child Nutrition...  https://www.facebook.com/1991209247569871/posts/2269147756442684/ …,[],['https://www.facebook.com/1991209247569871/posts/2269147756442684/'],[],0,0,1,[],[],https://twitter.com/BLOUNTBOE/status/1092847781616803842,False,,0,,,,,,,"[{'user_id': '1044628782802489349', 'username': 'BLOUNTBOE'}]",,,,
1092554979477458944,1092554979477458944,1549320380000,2019-02-04,17:46:20,EDT,1044628782802489349,blountboe,Blount County Schools,,The Blount County Amazing Shake winners had a great experience this weekend at the Mountain Brook Betty Gunn Speech and Debate Tournament! Each of our girls were partnered with a student from Mountain Brook for...  https://www.facebook.com/1991209247569871/posts/2267909409899852/ …,[],['https://www.facebook.com/1991209247569871/posts/2267909409899852/'],[],0,0,1,[],[],https://twitter.com/BLOUNTBOE/status/1092554979477458944,False,,0,,,,,,,"[{'user_id': '1044628782802489349', 'username': 'BLOUNTBOE'}]",,,,
1091418981708296193,1091418981708296193,1549049537000,2019-02-01,14:32:17,EDT,1044628782802489349,blountboe,Blount County Schools,,"@bcslearn  
Had a blast reading to and with Ms. Baba’s wonderful third graders this Morning for World Read Aloud Day in 2019!",[],[],[],0,0,0,[],[],https://twitter.com/BLOUNTBOE/status/1091418981708296193,False,,0,,,,,,,"[{'user_id': '1044628782802489349', 'username': 'BLOUNTBOE'}]",,,,
1091397444343091200,1091397444343091200,1549044402000,2019-02-01,13:06:42,EDT,1044628782802489349,blountboe,Blount County Schools,,"Lunch today at Hayden Elementary was “beautiful”, as I heard it described by a student in line. I had a Crispy Fish Sandwich, salad with Ranch, baked beans, cold chocolate milk and a cup of chocolate pudding...  https://www.facebook.com/1991209247569871/posts/2263138040376989/ …",[],['https://www.facebook.com/1991209247569871/posts/2263138040376989/'],[],0,1,0,[],[],https://twitter.com/BLOUNTBOE/status/1091397444343091200,False,,0,,,,,,,"[{'user_id': '1044628782802489349', 'username': 'BLOUNTBOE'}]",,,,
1090354341196849152,1090354341196849152,1548795707000,2019-01-29,16:01:47,EDT,1044628782802489349,blountboe,Blount County Schools,,"Blount County Schools will operate on a regular schedule on Wednesday, January 30th.",[],[],[],0,1,1,[],[],https://twitter.com/BLOUNTBOE/status/1090354341196849152,False,,0,,,,,,,"[{'user_id': '1044628782802489349', 'username': 'BLOUNTBOE'}]",,,,
1090347142319869953,1090347142319869953,1548793991000,2019-01-29,15:33:11,EDT,1044628782802489349,blountboe,Blount County Schools,,"All Blount County schools will operate on a regular schedule tomorrow, Wednesday, January 30th.",[],[],[],0,3,3,[],[],https://twitter.com/BLOUNTBOE/status/1090347142319869953,False,,0,,,,,,,"[{'user_id': '1044628782802489349', 'username': 'BLOUNTBOE'}]",,,,
1090005515583848450,1090005515583848450,1548712540000,2019-01-28,16:55:40,EDT,1044628782802489349,blountboe,Blount County Schools,,"All Blount County Schools will be closed on Tuesday, January 29th, 2019.  All extracurricular activities, practices, and ballgames are cancelled.  We will continue to monitor weather and road conditions and make a call about Wednesday as soon as possible.",[],[],[],0,4,13,[],[],https://twitter.com/BLOUNTBOE/status/1090005515583848450,False,,0,,,,,,,"[{'user_id': '1044628782802489349', 'username': 'BLOUNTBOE'}]",,,,
1089886544285044738,1089886544285044738,1548684175000,2019-01-28,09:02:55,EDT,1044628782802489349,blountboe,Blount County Schools,,"Congratulations to the winners to the Blount County Basketball Championship winners.
Varsity Boys - Appalachian 
Varsity Girls - Locust Fork
JV Boys - Locust Fork
JV Girls - Susan Moore",[],[],[],0,0,1,[],[],https://twitter.com/BLOUNTBOE/status/1089886544285044738,False,,0,,,,,,,"[{'user_id': '1044628782802489349', 'username': 'BLOUNTBOE'}]",,,,
1088862581111078912,1088862581111078912,1548440044000,2019-01-25,13:14:04,EDT,1044628782802489349,blountboe,Blount County Schools,,"How do BCS Home Economics teachers spend their PD day?
The spend time with Chef Judy Brown doing Culinary training and creating cross-curricular lessons and STEM lessons.",[],[],[],0,1,3,[],[],https://twitter.com/BLOUNTBOE/status/1088862581111078912,False,,0,,,,,,,"[{'user_id': '1044628782802489349', 'username': 'BLOUNTBOE'}]",,,,
1088839253239439360,1088839253239439360,1548434482000,2019-01-25,11:41:22,EDT,1044628782802489349,blountboe,Blount County Schools,,"Lunch today at Cleveland is one of our favorites! Crispy Chicken Sandwich, Potato Wedges, Baked Beans, Sandwich Fixings, Fresh Delicious Apples, Alabama Local Satsumas, cold milk and even a sweet treat...Ice...  https://www.facebook.com/1991209247569871/posts/2252295658127894/ …",[],['https://www.facebook.com/1991209247569871/posts/2252295658127894/'],[],0,0,0,[],[],https://twitter.com/BLOUNTBOE/status/1088839253239439360,False,,0,,,,,,,"[{'user_id': '1044628782802489349', 'username': 'BLOUNTBOE'}]",,,,
1087807197780815873,1087807197780815873,1548188421000,2019-01-22,15:20:21,EDT,1044628782802489349,blountboe,Blount County Schools,,Students are solving mysteries by solving equations in 6th grade at Hayden Middle School!,[],[],[],0,0,3,[],[],https://twitter.com/BLOUNTBOE/status/1087807197780815873,False,,0,,,,,,,"[{'user_id': '1044628782802489349', 'username': 'BLOUNTBOE'}]",,,,
1085352413316431873,1085352413316431873,1547603154000,2019-01-15,20:45:54,EDT,1044628782802489349,blountboe,Blount County Schools,,Blount County Learning Center's Winter Wonderland. Thank you to everyone who made this special day happen.  https://www.youtube.com/watch?v=LPz7uuaOo2A&feature=share …,[],['https://www.youtube.com/watch?v=LPz7uuaOo2A&feature=share'],[],0,0,4,[],[],https://twitter.com/BLOUNTBOE/status/1085352413316431873,False,,0,,,,,,,"[{'user_id': '1044628782802489349', 'username': 'BLOUNTBOE'}]",,,,
1085298953875279872,1085298953875279872,1547590409000,2019-01-15,17:13:29,EDT,1044628782802489349,blountboe,Blount County Schools,,"Hayden Primary Cafeteria served up an awesome lunch today that really warmed the tummies of our kiddos! Chili, grilled cheese, glazed carrots, garden salad with homemade ranch, peach cups, and milk...Yum-O!!...  https://www.facebook.com/1991209247569871/posts/2236852856338841/ …",[],['https://www.facebook.com/1991209247569871/posts/2236852856338841/'],[],0,0,3,[],[],https://twitter.com/BLOUNTBOE/status/1085298953875279872,False,,0,,,,,,,"[{'user_id': '1044628782802489349', 'username': 'BLOUNTBOE'}]",,,,
1083853148450627584,1083853148450627584,1547245702000,2019-01-11,17:28:22,EDT,1044628782802489349,blountboe,Blount County Schools,,Blount County Schools by the Numbers 2018 pic.twitter.com/8YbVNcCcMt,[],[],['https://pbs.twimg.com/media/DwqeqrDWwAAwp6y.jpg'],0,2,5,[],[],https://twitter.com/BLOUNTBOE/status/1083853148450627584,False,,0,,,,,,,"[{'user_id': '1044628782802489349', 'username': 'BLOUNTBOE'}]",,,,
