,comments,image,likes,link,post_id,post_text,post_url,shared_text,shares,text,time,video,video_thumbnail
141,0.0,https://scontent-atl3-1.xx.fbcdn.net/v/t1.0-9/fr/cp0/e15/q65/70513298_1448261861994573_2709018014560288768_n.jpg?_nc_cat=110&_nc_sid=110474&_nc_ohc=dLjvYQClKykAX9BOYy6&_nc_ht=scontent-atl3-1.xx&tp=14&oh=f594c28d0a017accb8d87085df4621b6&oe=5F821AC4,60.0,,1448304595323633,"📣We’ve got spirit, Yes we do! We’ve got spirit, how ‘bout you! 📣Students from Jim Pearson up to BR are showing their WILDCAT spirit today!!",https://facebook.com/story.php?story_fbid=1448304595323633&id=211441775676594,,0.0,"📣We’ve got spirit, Yes we do! We’ve got spirit, how ‘bout you! 📣Students from Jim Pearson up to BR are showing their WILDCAT spirit today!!",2019-09-20 13:02:18,,
142,0.0,https://scontent-atl3-1.xx.fbcdn.net/v/t1.0-9/fr/cp0/e15/q65/70410372_1448152255338867_4592530502941933568_o.jpg?_nc_cat=100&_nc_sid=8024bb&_nc_ohc=7ZFJFFDKw3cAX8sKRJU&_nc_ht=scontent-atl3-1.xx&tp=14&oh=52bfb3457f5180ee43af220212a74435&oe=5F83283B,28.0,,1448152532005506,"These 3rd - 6th grade teachers have had a busy week participating in the On-Going Assessment Project (OGap). It provides teachers with instruction on how to use formative assessments and student work samples in math to increase student understanding. They will participate in a year of on-going, job-embedded professional development using the OGAP Multiplicative Framework. Our teachers are life-long learners!! 👏👏👏",https://facebook.com/story.php?story_fbid=1448152532005506&id=211441775676594,,0.0,"These 3rd - 6th grade teachers have had a busy week participating in the On-Going Assessment Project (OGap). It provides teachers with instruction on how to use formative assessments and student work samples in math to increase student understanding. They will participate in a year of on-going, job-embedded professional development using the OGAP Multiplicative Framework. Our teachers are life-long learners!! 👏👏👏",2019-09-20 09:19:02,,
143,5.0,https://scontent-atl3-1.xx.fbcdn.net/v/t1.0-9/70649350_1447436018743824_3852416056253480960_n.png?_nc_cat=100&_nc_sid=8024bb&_nc_ohc=2RQMOo-4_7YAX_zANvz&_nc_ht=scontent-atl3-1.xx&oh=e9cdbd2efa2a383b99c028e234f97727&oe=5F8291BD,26.0,,1447443178743108,"Alexander City Schools will be dismissing early tomorrow, September 20, 2019, for Homecoming festivities. We hope everyone makes an effort to be at the Homecoming Parade at 2:30. BR's students (and parents) have been working hard all week on class floats. BR will take on Demopolis tomorrow night. Kickoff is at 7:00 p.m.🐾GO WILDCATS!!🐾",https://facebook.com/story.php?story_fbid=1447443178743108&id=211441775676594,,0.0,"Alexander City Schools will be dismissing early tomorrow, September 20, 2019, for Homecoming festivities. We hope everyone makes an effort to be at the Homecoming Parade at 2:30. BR's students (and parents) have been working hard all week on class floats. BR will take on Demopolis tomorrow night. Kickoff is at 7:00 p.m.🐾GO WILDCATS!!🐾",2019-09-19 12:53:39,,
144,2.0,https://scontent-atl3-1.xx.fbcdn.net/v/t1.0-9/70350818_1445585345595558_2029135849928523776_n.png?_nc_cat=110&_nc_sid=8024bb&_nc_ohc=BM3Eug2px44AX_oqF8Y&_nc_ht=scontent-atl3-1.xx&oh=a1ef61f5d8f9ca06c11928e29d24ad70&oe=5F8269E5,33.0,,1445612382259521,"BRHS Volleyball has their first area match at home tomorrow night against Opelika. These ladies have worked hard under the direction of Head Coach Magan Martin Ford and Assitant Coaches CJ Ford, Jennifer Clanton, and Rick Jones. Good luck tomorrow night ladies! Show them some love in the comments below! 👏👏👏 #werbr WeR>UR 🐾",https://facebook.com/story.php?story_fbid=1445612382259521&id=211441775676594,,0.0,"BRHS Volleyball has their first area match at home tomorrow night against Opelika. These ladies have worked hard under the direction of Head Coach Magan Martin Ford and Assitant Coaches CJ Ford, Jennifer Clanton, and Rick Jones. Good luck tomorrow night ladies! Show them some love in the comments below! 👏👏👏 #werbr WeR>UR 🐾",2019-09-17 09:30:52,,
145,0.0,https://scontent-atl3-1.xx.fbcdn.net/v/t1.0-9/fr/cp0/e15/q65/69913175_1442548742565885_4126652088925028352_n.jpg?_nc_cat=108&_nc_sid=110474&_nc_ohc=3dK13QNxK_QAX9cz2os&_nc_ht=scontent-atl3-1.xx&tp=14&oh=3a21886070733879d9771c27a6f7e5ac&oe=5F7FBBDF,54.0,,1442552199232206,"“A Grandparents love is strong and deep, filled with memories to cherish and keep.” These are just a few of the Grandparents who took time to visit with our students at Jim Pearson to celebrate Grandparents Day over the past few days. Thank you to all who were able to join in on the fun! 🥰",https://facebook.com/story.php?story_fbid=1442552199232206&id=211441775676594,,0.0,"“A Grandparents love is strong and deep, filled with memories to cherish and keep.” These are just a few of the Grandparents who took time to visit with our students at Jim Pearson to celebrate Grandparents Day over the past few days. Thank you to all who were able to join in on the fun! 🥰",2019-09-13 16:56:42,,
146,7.0,https://scontent-atl3-1.xx.fbcdn.net/v/t1.0-9/69734294_1439062766247816_1566870581444345856_n.png?_nc_cat=104&_nc_sid=8024bb&_nc_ohc=YrSla-ACEasAX-RGh5l&_nc_ht=scontent-atl3-1.xx&oh=feb1bfec44a036e1c32f650d82060701&oe=5F82C1BE,24.0,,1439063742914385,"Alexander City Schools parents and employees, we are excited to bring you the ""WiFi on the Go Program"" where you can stay connected and take the internet with you! You can get a hotspot and UNLIMITED internet through the ACS #WiFiontheGo program. The hotspot is battery-powered and small enough to fit in your pocket. Plus, no contract, no extra fees, and no data throttling- all for donating $50 per month to Alex City Schools. It's the best deal around and you can ONLY get it if you are an Alexander City Schools employee or a parent. Get one for yourself or for family. Signing up helps raise funds for our schools
also. That is what we call a win-win - our kids win and you win too! #WiFiontheGo harnesses the power of T-Mobile's 4G/LTE cellular network to give you unlimited internet.
It's really easy to sign up. Just go to https://bit.ly/2m8mgwt and click ""WiFi on the Go"" to get yours today! You will need your student’s “S” code id number or an employee id
number for the sign-up process so have those handy. You can email @leanstreamrp at info@leanstreamrp.com if you need to know more. #GoAnywhereGoEvery",https://facebook.com/story.php?story_fbid=1439063742914385&id=211441775676594,,0.0,"Alexander City Schools parents and employees, we are excited to bring you the ""WiFi on the Go Program"" where you can stay connected and take the internet with you! You can get a hotspot and UNLIMITED internet through the ACS #WiFiontheGo program. The hotspot is battery-powered and small enough to fit in your pocket. Plus, no contract, no extra fees, and no data throttling- all for donating $50 per month to Alex City Schools. It's the best deal around and you can ONLY get it if you are an Alexander City Schools employee or a parent. Get one for yourself or for family. Signing up helps raise funds for our schools
also. That is what we call a win-win - our kids win and you win too! #WiFiontheGo harnesses the power of T-Mobile's 4G/LTE cellular network to give you unlimited internet.
It's really easy to sign up. Just go to https://bit.ly/2m8mgwt and click ""WiFi on the Go"" to get yours today! You will need your student’s “S” code id number or an employee id
number for the sign-up process so have those handy. You can email @leanstreamrp at info@leanstreamrp.com if you need to know more. #GoAnywhereGoEvery",2019-09-09 19:00:15,,
147,13.0,,72.0,http://acms.alexcityschools.net/,1439055926248500,"Alexander City Middle School, located in the heart of downtown Alexander City, is home to our 7th and 8th-grade students. Mrs. Tracie Blakely is in her third year as the Principal at ACMS and Mr. Shannon Benefield is in his third year as the Assistant Principal.

Building relationships and creating a sense of belonging, ensuring that all students achieve academic growth and creating a culture of learning are the top priorities for the leadership at ACMS!

http://acms.alexcityschools.net",https://facebook.com/story.php?story_fbid=1439055926248500&id=211441775676594,"Alexander City Middle School -

Alexander City Middle School -

Alexander City Middle School -

See more at
acms.alexcityschools.net",0.0,"Alexander City Middle School, located in the heart of downtown Alexander City, is home to our 7th and 8th-grade students. Mrs. Tracie Blakely is in her third year as the Principal at ACMS and Mr. Shannon Benefield is in his third year as the Assistant Principal.

Building relationships and creating a sense of belonging, ensuring that all students achieve academic growth and creating a culture of learning are the top priorities for the leadership at ACMS!

http://acms.alexcityschools.net

Alexander City Middle School -

Alexander City Middle School -

Alexander City Middle School -

See more at
acms.alexcityschools.net",2019-09-09 15:02:13,,
148,0.0,https://scontent-atl3-1.xx.fbcdn.net/v/t1.0-9/70167323_1438845699602856_7498513381234573312_n.png?_nc_cat=100&_nc_sid=8024bb&_nc_ohc=9Xk2PaQIVeQAX-5zTCR&_nc_ht=scontent-atl3-1.xx&oh=566c0eab438a59a23977e0057b1c5902&oe=5F82D017,3.0,,1438846556269437,Today is the last day for girls grades 4th - 8th to register for Cooper Rec Community Center's Volleyball league. 🤾‍♀️,https://facebook.com/story.php?story_fbid=1438846556269437&id=211441775676594,,0.0,Today is the last day for girls grades 4th - 8th to register for Cooper Rec Community Center's Volleyball league. 🤾‍♀️,2019-09-09 09:45:52,,
149,0.0,,26.0,https://www.alexcityoutlook.com/news/alexander-city-schools-adds-new-teachers-to-system/article_3abee30a-d0a8-11e9-8500-df6da5afd700.html,1437218756432217,We have amazing teachers in our school system! 💯💯💯,https://facebook.com/story.php?story_fbid=1437218756432217&id=211441775676594,"ALEXCITYOUTLOOK.COM
Alexander City Schools adds 54 new teachers to system

The Alexander City Outlook
September 6, 2019 at 6:36 PM ·

Alexander City Schools has 274 teachers total and hired 54 new ones this year. Superintendent Dr. Keith Lankford says the system's teachers are enthused about what they're doing.",2.0,"We have amazing teachers in our school system! 💯💯💯

ALEXCITYOUTLOOK.COM
Alexander City Schools adds 54 new teachers to system

The Alexander City Outlook
September 6, 2019 at 6:36 PM ·

Alexander City Schools has 274 teachers total and hired 54 new ones this year. Superintendent Dr. Keith Lankford says the system's teachers are enthused about what they're doing.",2019-09-07 11:20:57,,
150,0.0,,0.0,https://www.alexcityoutlook.com/news/alexander-city-schools-adds-new-teachers-to-system/article_3abee30a-d0a8-11e9-8500-df6da5afd700.html,,,https://facebook.com/story.php?story_fbid=10157093962409892&id=84710064891,"The Alexander City Outlook
September 6, 2019 at 6:36 PM ·

Alexander City Schools has 274 teachers total and hired 54 new ones this year. Superintendent Dr. Keith Lankford says the system's teachers are enthused about what they're doing.",0.0,"The Alexander City Outlook
September 6, 2019 at 6:36 PM ·

Alexander City Schools has 274 teachers total and hired 54 new ones this year. Superintendent Dr. Keith Lankford says the system's teachers are enthused about what they're doing.",2020-09-11 20:21:15.917737,,
151,0.0,https://scontent-atl3-1.xx.fbcdn.net/v/t1.0-9/70347387_1436539359833490_1066547070879399936_n.png?_nc_cat=102&_nc_sid=8024bb&_nc_ohc=rjaWd_ySpIMAX81C_e4&_nc_ht=scontent-atl3-1.xx&oh=a85d751df1d1453032bc3abb5c4366b0&oe=5F81F628,13.0,,1436542543166505,Alexander City Schools is in need of substitute bus drivers 🚌 and substitute nurses👨‍⚕️👩‍⚕️. If you are interested in a substitute bus driver position please contact Kathy Hawkins at khawkins@acsk12.net or 256-234-8693. If you are interested in a substitute nursing opportunity please contact Gail Brasell at gbrasell@acsk12.net or 256-234-8607.,https://facebook.com/story.php?story_fbid=1436542543166505&id=211441775676594,,0.0,Alexander City Schools is in need of substitute bus drivers 🚌 and substitute nurses👨‍⚕️👩‍⚕️. If you are interested in a substitute bus driver position please contact Kathy Hawkins at khawkins@acsk12.net or 256-234-8693. If you are interested in a substitute nursing opportunity please contact Gail Brasell at gbrasell@acsk12.net or 256-234-8607.,2019-09-06 16:05:35,,
152,0.0,https://scontent-atl3-1.xx.fbcdn.net/v/t1.0-9/69516536_1436466933174066_5511402119850098688_n.png?_nc_cat=101&_nc_sid=8024bb&_nc_ohc=Tb-sVRxjkPMAX8-nBd5&_nc_ht=scontent-atl3-1.xx&oh=f3feef2b37881d4e0f67ec753b052d75&oe=5F80AC93,16.0,,1436467466507346,"If you are a retired teacher with a valid teaching certificate and would like to work with Alexander City Schools when opportunities arise for long-term substitutes, intervention, testing, etc. please contact Gail Brasell at 256-234-8607 or gbrasell@acsk12.net.",https://facebook.com/story.php?story_fbid=1436467466507346&id=211441775676594,,0.0,"If you are a retired teacher with a valid teaching certificate and would like to work with Alexander City Schools when opportunities arise for long-term substitutes, intervention, testing, etc. please contact Gail Brasell at 256-234-8607 or gbrasell@acsk12.net.",2019-09-06 14:13:24,,
153,7.0,https://scontent-atl3-1.xx.fbcdn.net/v/t1.0-9/fr/cp0/e15/q65/69769841_1435529149934511_9174993306189299712_o.jpg?_nc_cat=111&_nc_sid=8024bb&_nc_ohc=WYPMaaiaaqwAX9fx1oH&_nc_ht=scontent-atl3-1.xx&tp=14&oh=57bcbaa74c0ba25d3b48c95b0c276812&oe=5F8070E5,167.0,,1435543023266457,"What an honor it was for our students at Jim Pearson to have two-time Super Bowl Champion, Justin Tuck, stop by to read his book ""Home Field Advantage."" He also discussed the process an author goes through when publishing a book. A big thanks to his sister and one of our veteran teachers at Jim Pearson, Ms. Christale Tuck, for inviting him. Our students absolutely loved it!",https://facebook.com/story.php?story_fbid=1435543023266457&id=211441775676594,,0.0,"What an honor it was for our students at Jim Pearson to have two-time Super Bowl Champion, Justin Tuck, stop by to read his book ""Home Field Advantage."" He also discussed the process an author goes through when publishing a book. A big thanks to his sister and one of our veteran teachers at Jim Pearson, Ms. Christale Tuck, for inviting him. Our students absolutely loved it!",2019-09-05 12:10:01,,
154,2.0,https://scontent-atl3-1.xx.fbcdn.net/v/t1.0-9/fr/cp0/e15/q65/69768958_1428238747330218_8305830756001775616_n.jpg?_nc_cat=103&_nc_sid=8024bb&_nc_ohc=p_qD5UHNtEwAX-HoMKf&_nc_ht=scontent-atl3-1.xx&tp=14&oh=2c46226a46be029470a2aaf4d97fd485&oe=5F838DFC,53.0,,1428239203996839,What a great turnout at last night's Community Pep Rally for our Benjamin Russell High School Wildcats. We hope you are able to cheer them on at the Sportplex tonight as they take on Central High School of Clay County.,https://facebook.com/story.php?story_fbid=1428239203996839&id=211441775676594,,0.0,What a great turnout at last night's Community Pep Rally for our Benjamin Russell High School Wildcats. We hope you are able to cheer them on at the Sportplex tonight as they take on Central High School of Clay County.,2019-08-30 08:00:01,,
155,0.0,https://scontent-atl3-1.xx.fbcdn.net/v/t1.0-9/69355469_1429995207154572_1629947072448823296_n.png?_nc_cat=108&_nc_sid=8024bb&_nc_ohc=Q1a0DRJP9skAX-XT_yq&_nc_ht=scontent-atl3-1.xx&oh=2fda8c24809783685acb99b6b6383303&oe=5F7FED37,9.0,,1429995943821165,We are seeking a System Psychometrist and a High School Math Teacher. If you are interested please call Gail Brasell at 256.234.8607. As always help us by spreading the word!,https://facebook.com/story.php?story_fbid=1429995943821165&id=211441775676594,,0.0,We are seeking a System Psychometrist and a High School Math Teacher. If you are interested please call Gail Brasell at 256.234.8607. As always help us by spreading the word!,2019-08-29 17:02:52,,
156,96.0,https://scontent-atl3-1.xx.fbcdn.net/v/t1.0-9/fr/cp0/e15/q65/69875672_1429978270489599_1602666501041553408_n.jpg?_nc_cat=109&_nc_sid=110474&_nc_ohc=x4F5ThY8xY8AX__sCR6&_nc_ht=scontent-atl3-1.xx&tp=14&oh=d31a5881acec5db910455cbdc202e3a5&oe=5F7FEF4C,366.0,,1429984220489004,"The story comes full circle. When two teachers set out on a mission to help their friend and coworker, Mr. Kinnie Morris, they had no idea how our community would show up and show out. With the help of Brian Bice at Bice Motors they were able to purchase a preowned Dodge Journey. He was surprised with it today at Jim Pearson while students chanted, “Mr. Kinnie! We Love You!” 🧡",https://facebook.com/story.php?story_fbid=1429984220489004&id=211441775676594,,0.0,"The story comes full circle. When two teachers set out on a mission to help their friend and coworker, Mr. Kinnie Morris, they had no idea how our community would show up and show out. With the help of Brian Bice at Bice Motors they were able to purchase a preowned Dodge Journey. He was surprised with it today at Jim Pearson while students chanted, “Mr. Kinnie! We Love You!” 🧡",2019-08-29 16:38:33,,
157,0.0,https://scontent-atl3-1.xx.fbcdn.net/v/t1.0-9/68653254_1423345731152853_4174740630125150208_o.png?_nc_cat=104&_nc_sid=8024bb&_nc_ohc=pr2ycsQ_d_IAX_cp6G2&_nc_ht=scontent-atl3-1.xx&oh=1b937e4a8546c672fa362d892ddbdb6f&oe=5F837291,12.0,,1423348331152593,ATTENDANCE MATTERS ✔️ Missed days in early years can weaken reading skills. It is vital students are in the classroom each day. 📖,https://facebook.com/story.php?story_fbid=1423348331152593&id=211441775676594,,0.0,ATTENDANCE MATTERS ✔️ Missed days in early years can weaken reading skills. It is vital students are in the classroom each day. 📖,2019-08-29 10:52:00,,
158,0.0,https://scontent-atl3-1.xx.fbcdn.net/v/t1.0-9/fr/cp0/e15/q65/69121290_1427572487396844_5386824334276820992_n.jpg?_nc_cat=104&_nc_sid=8024bb&_nc_ohc=sxpPTdMi9hoAX9pBAXp&_nc_ht=scontent-atl3-1.xx&tp=14&oh=ac1af1f4eb0867949027c6fe67e9ec23&oe=5F826BC8,16.0,,1427573537396739,🎉Come out to Strand Park tomorrow night and support the Benjamin Russell Wildcats before their first home game of the season!🐾,https://facebook.com/story.php?story_fbid=1427573537396739&id=211441775676594,,0.0,🎉Come out to Strand Park tomorrow night and support the Benjamin Russell Wildcats before their first home game of the season!🐾,2019-08-28 08:07:00,,
159,0.0,https://scontent-atl3-1.xx.fbcdn.net/v/t1.0-9/68915723_1423340481153378_4459272893406117888_o.png?_nc_cat=103&_nc_sid=8024bb&_nc_ohc=gWhoJGsMQ-0AX_6s2gT&_nc_ht=scontent-atl3-1.xx&oh=482a57c4daa54497c91bd2cb2f01275b&oe=5F80DD1D,21.0,,1423345344486225,ATTENDANCE MATTERS✔️ Absenteeism in the first month of school can predict poor attendance throughout the school year.,https://facebook.com/story.php?story_fbid=1423345344486225&id=211441775676594,,0.0,ATTENDANCE MATTERS✔️ Absenteeism in the first month of school can predict poor attendance throughout the school year.,2019-08-27 10:44:00,,
160,1.0,,33.0,http://www.alexcityschools.net/,1427381117415981,William L. Radney School is home to 400 5th and 6th-grade students. Mr. Marcus Dent joined the Alexander City Schools this year as principal at Radney. He brings with him twenty years of experience in education. Dr. Brittney Duncan is in her second year at Radney as the Assitant Principal. These two make quite the team and together they will strive to provide a safe and inviting learning environment with high expectations for all. http://www.alexcityschools.net,https://facebook.com/story.php?story_fbid=1427381117415981&id=211441775676594,"Alexander City Schools

Alexander City Schools

Alexander City Schools

See more at
alexcityschools.net",0.0,"William L. Radney School is home to 400 5th and 6th-grade students. Mr. Marcus Dent joined the Alexander City Schools this year as principal at Radney. He brings with him twenty years of experience in education. Dr. Brittney Duncan is in her second year at Radney as the Assitant Principal. These two make quite the team and together they will strive to provide a safe and inviting learning environment with high expectations for all. http://www.alexcityschools.net

Alexander City Schools

Alexander City Schools

Alexander City Schools

See more at
alexcityschools.net",2019-08-26 09:59:57,,
161,18.0,,71.0,http://www.alexcityschools.net/,1418582288295864,Stephens Elementary School is home to about 480 3rd and 4th-grade students. This is Dr. Mary Holloway's second year as Principal at Stephen's Elementary School. Mitchell Black joined Alexander City Schools this year as the Assitant Principal. Dr. Holloway and Mr. Black make a great team and we are proud to have them leading the way at SES!,https://facebook.com/story.php?story_fbid=1418582288295864&id=211441775676594,"Alexander City Schools

Alexander City Schools

Alexander City Schools

See more at
alexcityschools.net",0.0,"Stephens Elementary School is home to about 480 3rd and 4th-grade students. This is Dr. Mary Holloway's second year as Principal at Stephen's Elementary School. Mitchell Black joined Alexander City Schools this year as the Assitant Principal. Dr. Holloway and Mr. Black make a great team and we are proud to have them leading the way at SES!

Alexander City Schools

Alexander City Schools

Alexander City Schools

See more at
alexcityschools.net",2019-08-15 09:14:09,,
162,1.0,https://scontent-atl3-1.xx.fbcdn.net/v/t1.0-9/68479663_1418097291677697_6481314827456217088_n.png?_nc_cat=110&_nc_sid=8024bb&_nc_ohc=BrTKBpCFMzYAX-jUmH7&_nc_ht=scontent-atl3-1.xx&oh=62b5bd97a00c66a9b45e7905396a52a9&oe=5F818621,20.0,,1418097791677647,🗣Alexander City Schools has an immediate opening for a 5th-grade reading teacher. This is for the first semester with full benefits.📚 Call Gail Brasell at 256-234-8607!,https://facebook.com/story.php?story_fbid=1418097791677647&id=211441775676594,,0.0,🗣Alexander City Schools has an immediate opening for a 5th-grade reading teacher. This is for the first semester with full benefits.📚 Call Gail Brasell at 256-234-8607!,2019-08-14 17:13:40,,
163,1.0,,76.0,http://www.alexcityschools.net/,1417899071697519,"Jim Pearson Elementary School serves roughly 800 primary students, PreK through 2nd grade. Angela Strickland(pictured center) joined Alexader City Schools this year as Principal while Assistant Principals Windy Eldred and Reginald Clifton are familiar faces in our system. All are excited about this school year and are eager to embark on a student-focused, data-driven journey. #babywildcats #wepromise #JPE #ACS",https://facebook.com/story.php?story_fbid=1417899071697519&id=211441775676594,"Alexander City Schools

Alexander City Schools

Alexander City Schools

See more at
alexcityschools.net",0.0,"Jim Pearson Elementary School serves roughly 800 primary students, PreK through 2nd grade. Angela Strickland(pictured center) joined Alexader City Schools this year as Principal while Assistant Principals Windy Eldred and Reginald Clifton are familiar faces in our system. All are excited about this school year and are eager to embark on a student-focused, data-driven journey. #babywildcats #wepromise #JPE #ACS

Alexander City Schools

Alexander City Schools

Alexander City Schools

See more at
alexcityschools.net",2019-08-14 11:23:36,,
164,32.0,https://scontent-atl3-1.xx.fbcdn.net/v/t1.0-9/fr/cp0/e15/q65/68360894_1417311741756252_5878425638141952000_o.jpg?_nc_cat=104&_nc_sid=8024bb&_nc_ohc=47-ywLPfUL4AX_Jwjsa&_nc_ht=scontent-atl3-1.xx&tp=14&oh=6ca9ecf158b66f3d265ef01140a0f171&oe=5F832823,262.0,,1417312481756178,"It's hot out there today which is why we were all hands on deck making sure every student who rides the bus had water for the ride home. A special thanks to Lake Martin Area United Way for coordinating this effort and to Tallapoosa Christian Crisis Center , Piggly Wiggly Alex City , and East Alabama Food Bank for donating the water on behalf of our students. Not to mention the hard work of Ken Cowart with the Tallapoosa County Rescue Squad for picking up the water and delivering it to the school system. Our students were so grateful as they loaded the buses. ☀️💦",https://facebook.com/story.php?story_fbid=1417312481756178&id=211441775676594,,0.0,"It's hot out there today which is why we were all hands on deck making sure every student who rides the bus had water for the ride home. A special thanks to Lake Martin Area United Way for coordinating this effort and to Tallapoosa Christian Crisis Center , Piggly Wiggly Alex City , and East Alabama Food Bank for donating the water on behalf of our students. Not to mention the hard work of Ken Cowart with the Tallapoosa County Rescue Squad for picking up the water and delivering it to the school system. Our students were so grateful as they loaded the buses. ☀️💦",2019-08-13 17:11:53,,
