,comments,image,likes,link,post_id,post_text,post_url,shared_text,shares,text,time,video,video_thumbnail
0,0.0,https://scontent-atl3-1.xx.fbcdn.net/v/t1.0-9/119121785_1801293386691417_2917376161761087699_n.png?_nc_cat=106&_nc_sid=8024bb&_nc_ohc=1JM3PBg_dUkAX99RNGJ&_nc_ht=scontent-atl3-1.xx&oh=9dda9c13ce858b7c0d75dadb80803809&oe=5F8186B8,14.0,,1801293723358050,"BRHS takes on Helena tonight in our first home game of the season. Kickoff is at 7:00 pm. Reminder to fans: masks that cover mouth and nose are required😷, social distancing is also required, we will allow less than 50% capacity for fans' safety, and fans are encouraged to stay seated unless walking to the concessions or restroom. Good Luck, Wildcats!! 🐾🏈",https://facebook.com/story.php?story_fbid=1801293723358050&id=211441775676594,,0.0,"BRHS takes on Helena tonight in our first home game of the season. Kickoff is at 7:00 pm. Reminder to fans: masks that cover mouth and nose are required😷, social distancing is also required, we will allow less than 50% capacity for fans' safety, and fans are encouraged to stay seated unless walking to the concessions or restroom. Good Luck, Wildcats!! 🐾🏈",2020-09-11 11:03:21,,
1,4.0,https://scontent-atl3-1.xx.fbcdn.net/v/t1.0-9/fr/cp0/e15/q65/119212421_1800770273410395_730685134194177716_n.jpg?_nc_cat=103&_nc_sid=110474&_nc_ohc=gf3AIn9GwhQAX-61u6F&_nc_ht=scontent-atl3-1.xx&tp=14&oh=b6f49c30fdc4534761b56427cef0691d&oe=5F7FEA87,43.0,,1800777070076382,"What a night for BRHS Volleyball!! BRHS Senior, Timira Lawson, was honored as this is her final Wildcat Season. Coach Magan Ford recently said of Lawson, “She’s done an excellent job with this young group of girls. She’s been great with not only her ability but her presence. She’s always calm no matter the circumstances and it has transferred to the rest of our team...” 👏🏼👏🏼👏🏼 Athletic Director, Coach Pam Robinson, was also honored as she gears up to retire at the end of the year. 🐾🐾🐾",https://facebook.com/story.php?story_fbid=1800777070076382&id=211441775676594,,0.0,"What a night for BRHS Volleyball!! BRHS Senior, Timira Lawson, was honored as this is her final Wildcat Season. Coach Magan Ford recently said of Lawson, “She’s done an excellent job with this young group of girls. She’s been great with not only her ability but her presence. She’s always calm no matter the circumstances and it has transferred to the rest of our team...” 👏🏼👏🏼👏🏼 Athletic Director, Coach Pam Robinson, was also honored as she gears up to retire at the end of the year. 🐾🐾🐾",2020-09-10 21:57:52,,
2,0.0,https://scontent-atl3-1.xx.fbcdn.net/v/t1.0-9/119010484_1800587883428634_7882985441171154079_n.png?_nc_cat=110&_nc_sid=8024bb&_nc_ohc=_3Yovb98PTwAX8i-D7F&_nc_ht=scontent-atl3-1.xx&oh=0be98cb10baadc75bcfe959df83f90df&oe=5F80A81F,8.0,,1800587426762013,"Alexander City Schools is looking to fill the following positions at Benjamin Russell High School:

🔬 Science Teacher
📖 English Teacher
🩺 LPN

Please go to Teach in Alabama to apply. Contact Gail Brasell at 256-234-8607 with any questions.",https://facebook.com/story.php?story_fbid=1800587426762013&id=211441775676594,,0.0,"Alexander City Schools is looking to fill the following positions at Benjamin Russell High School:

🔬 Science Teacher
📖 English Teacher
🩺 LPN

Please go to Teach in Alabama to apply. Contact Gail Brasell at 256-234-8607 with any questions.",2020-09-10 16:18:45,,
3,0.0,https://scontent-atl3-1.xx.fbcdn.net/v/t1.0-9/fr/cp0/e15/q65/118948499_1799391980214891_4141174067703672942_n.jpg?_nc_cat=100&_nc_sid=110474&_nc_ohc=FFS2UMhrlw0AX8EmhKY&_nc_ht=scontent-atl3-1.xx&tp=14&oh=67f4443d37d54d16662770ab951008e5&oe=5F830F01,2.0,http://census.gov/,1799392226881533,"Education is counting on you! Complete your 2020 census today. Respond online, by phone or mail. For more information please visit census.gov
.
.
#2020census #alabamaachieves #alschoolscontinuelearning",https://facebook.com/story.php?story_fbid=1799392226881533&id=211441775676594,,0.0,"Education is counting on you! Complete your 2020 census today. Respond online, by phone or mail. For more information please visit census.gov
.
.
#2020census #alabamaachieves #alschoolscontinuelearning",2020-09-09 10:25:11,,
4,2.0,,19.0,,1798773486943407,"This year might look a little different 😷 but we are so excited to have students back in the classroom and on our campuses. Welcome back, Wildcats!! 🐾",,,0.0,"This year might look a little different 😷 but we are so excited to have students back in the classroom and on our campuses. Welcome back, Wildcats!! 🐾",2020-09-08 18:27:04,https://video-atl3-1.xx.fbcdn.net/v/t42.9040-2/119024754_2383253591981497_7416513224484907894_n.mp4?_nc_cat=103&_nc_sid=985c63&efg=eyJ2ZW5jb2RlX3RhZyI6ImxlZ2FjeV9zZCJ9&_nc_ohc=MkUzl0ZrEfEAX9gJe3l&_nc_ht=video-atl3-1.xx&oh=7a35dbcc61d64ca5b4e73163d3d3b653&oe=5F5C3C08,
5,1.0,https://scontent-atl3-1.xx.fbcdn.net/v/t1.0-9/119037360_1798312430322846_3640546405516256613_n.png?_nc_cat=100&_nc_sid=2d5d41&_nc_ohc=G6woY25-fxMAX9w2R0r&_nc_ht=scontent-atl3-1.xx&oh=add618522849918c4b1b4dcdb7faa8e6&oe=5F823145,34.0,,1798312426989513,We are excited to work together to take on a new school year. It is our goal for all students to remain safe while obtaining a high level of academic success. Let's go!!,,,0.0,We are excited to work together to take on a new school year. It is our goal for all students to remain safe while obtaining a high level of academic success. Let's go!!,2020-09-08 08:00:12,,
6,19.0,https://scontent-atl3-1.xx.fbcdn.net/v/t1.0-9/fr/cp0/e15/q65/118918692_1794707890683300_8984440443089838469_n.jpg?_nc_cat=102&_nc_sid=110474&_nc_ohc=CMqS4gtSzTsAX-OWVBV&_nc_ht=scontent-atl3-1.xx&tp=14&oh=4a3840e150b22f1dc2b15e4359525c5d&oe=5F8337E1,110.0,http://www.alexcityschools.net/,1794709044016518,As a part of our RETURN TO LEARN Plan ACS has implemented extensive cleaning protocols for all of our schools. Today each school is being thoroughly cleaned as we prepare for the first day of traditional classes next week. Please know that we are committed to doing everything we can to create a safe learning environment for your students. #inittogether *The full Return to Learn Plan can be found at www.alexcityschools.net,https://facebook.com/story.php?story_fbid=1794709044016518&id=211441775676594,,0.0,As a part of our RETURN TO LEARN Plan ACS has implemented extensive cleaning protocols for all of our schools. Today each school is being thoroughly cleaned as we prepare for the first day of traditional classes next week. Please know that we are committed to doing everything we can to create a safe learning environment for your students. #inittogether *The full Return to Learn Plan can be found at www.alexcityschools.net,2020-09-04 12:54:47,,
7,0.0,,6.0,,1792994547521301,"We will be sharing ""Wildcat Features"" throughtout the year in an effort to spotlight various areas, departments and people within Alexander City School. This week we are featuring the Transportation Department. Please enjoy! Let us know in the comments if you have an area you would like to learn more about.",,,0.0,"We will be sharing ""Wildcat Features"" throughtout the year in an effort to spotlight various areas, departments and people within Alexander City School. This week we are featuring the Transportation Department. Please enjoy! Let us know in the comments if you have an area you would like to learn more about.",2020-09-02 18:09:22,https://video-atl3-1.xx.fbcdn.net/v/t42.9040-2/118730432_3094640587324484_2482264396949848378_n.mp4?_nc_cat=108&_nc_sid=985c63&efg=eyJ2ZW5jb2RlX3RhZyI6ImxlZ2FjeV9zZCJ9&_nc_ohc=qCljq9XRY98AX9Y6BFt&_nc_ht=video-atl3-1.xx&oh=9bf23da509179db825d4ec726913425d&oe=5F5C33D3,
8,0.0,https://scontent-atl3-1.xx.fbcdn.net/v/t1.0-9/118086621_1791734590980630_3529690062142963832_n.png?_nc_cat=107&_nc_sid=8024bb&_nc_ohc=WAwD-BJ4qN4AX9Rc97f&_nc_ht=scontent-atl3-1.xx&oh=2337c4f8f58ed2f88873e494b3fe1840&oe=5F831C4E,12.0,https://bit.ly/ACSbusform,1791738377646918,"🚌 Will your student be riding the bus to or from school this year? 🚌 If so, you are required to complete a Transportation Form for each student who will require transport. Students will NOT be eligible to ride the bus if this form has not been completed prior to the start of the school year. Click this link http://bit.ly/ACSbusform to complete the required form. It is important that we have the most up-to-date information for each of our students. Thank you!",https://facebook.com/story.php?story_fbid=1791738377646918&id=211441775676594,,0.0,"🚌 Will your student be riding the bus to or from school this year? 🚌 If so, you are required to complete a Transportation Form for each student who will require transport. Students will NOT be eligible to ride the bus if this form has not been completed prior to the start of the school year. Click this link http://bit.ly/ACSbusform to complete the required form. It is important that we have the most up-to-date information for each of our students. Thank you!",2020-09-01 12:39:58,,
9,0.0,https://scontent-atl3-1.xx.fbcdn.net/v/t1.0-9/118702814_1791556710998418_1646766116886722006_n.png?_nc_cat=110&_nc_sid=2d5d41&_nc_ohc=SzVNErnDLnoAX9DyzI4&_nc_ht=scontent-atl3-1.xx&oh=d9c80a3c9bf9bece92524e6d6a83e26e&oe=5F805F7B,10.0,,1791556707665085,It is SEPTEMBER which means school will be back in session in just a few short days. For those who will be attending traditional school please check out these 8 Tips we put together for Back To School!,,,0.0,It is SEPTEMBER which means school will be back in session in just a few short days. For those who will be attending traditional school please check out these 8 Tips we put together for Back To School!,2020-09-01 09:26:01,,
10,0.0,,0.0,https://www.alexcityoutlook.com/sports/benjamin-russell-quarterback-club-still-welcoming-new-members/article_eb2fdb70-e9bd-11ea-a4b8-97cd2b53f731.html,1790740914413331,"🏈 Benjamin Russell Quarterback Club memberships will be on sale this Thursday, Sept. 3, from 4:30-6:30pm at the Sportplex gym.

The cost of membership is $50 and provides members with a parking pass for home games and meals at QB Club meetings.

For any questions or concerns contact 256-496-2450. #wildcatpride 🐾",https://facebook.com/story.php?story_fbid=1790740914413331&id=211441775676594,"ALEXCITYOUTLOOK.COM
Benjamin Russell Quarterback Club still welcoming new members",0.0,"🏈 Benjamin Russell Quarterback Club memberships will be on sale this Thursday, Sept. 3, from 4:30-6:30pm at the Sportplex gym.

The cost of membership is $50 and provides members with a parking pass for home games and meals at QB Club meetings.

For any questions or concerns contact 256-496-2450. #wildcatpride 🐾

ALEXCITYOUTLOOK.COM
Benjamin Russell Quarterback Club still welcoming new members",2020-08-31 15:50:17,,
11,0.0,,5.0,https://www.alexcityoutlook.com/sports/benjamin-russell-clay-central-game-postponed-until-saturday/article_714d49e8-e934-11ea-8088-47239b2f405a.html,1787474611406628,The BR vs Clay Central football game has been postponed until tomorrow due to weather.,https://facebook.com/story.php?story_fbid=1787474611406628&id=211441775676594,"ALEXCITYOUTLOOK.COM
Benjamin Russell-Clay Central game postponed until Saturday",10.0,"The BR vs Clay Central football game has been postponed until tomorrow due to weather.

ALEXCITYOUTLOOK.COM
Benjamin Russell-Clay Central game postponed until Saturday",2020-08-28 10:02:30,,
12,0.0,https://scontent-atl3-1.xx.fbcdn.net/v/t1.0-9/fr/cp0/e15/q65/117290320_1775092879311468_3853220908922486435_o.jpg?_nc_cat=109&_nc_sid=8024bb&_nc_ohc=1gvQbSdJ2T8AX9dE4rK&_nc_ht=scontent-atl3-1.xx&tp=14&oh=b3bfcd833692efa914ed7fd1cc8fa76b&oe=5F80170E,17.0,,1775096119311144,"Please see the letter below from Dr. Keith Lankford, ACS Superintendent, regarding information for the upcoming school year. Contact information is included should you have any questions regarding one of the topics. We are working continuously to prepare for the 2020-2021 school year and thank you all for your continued support as we work together to take on the school year. ""Alone we can do so little; together we can do so much."" -Helen Keller",https://facebook.com/story.php?story_fbid=1775096119311144&id=211441775676594,,0.0,"Please see the letter below from Dr. Keith Lankford, ACS Superintendent, regarding information for the upcoming school year. Contact information is included should you have any questions regarding one of the topics. We are working continuously to prepare for the 2020-2021 school year and thank you all for your continued support as we work together to take on the school year. ""Alone we can do so little; together we can do so much."" -Helen Keller",2020-08-15 16:00:28,,
13,0.0,https://scontent-atl3-1.xx.fbcdn.net/v/t1.0-9/117256046_1771891126298310_119919072072271673_n.png?_nc_cat=107&_nc_sid=8024bb&_nc_ohc=omPoJtsWV_sAX_iJwC7&_nc_ht=scontent-atl3-1.xx&oh=d1b71ff35cc6f9a8066568008a638f32&oe=5F805CE4,4.0,,1771892892964800,Alexander City Schools is currently seeking a Mental Health Coordinator. If you are interested please go to the Teach In Alabama Website to apply. Please feel free to share. Thanks!,https://facebook.com/story.php?story_fbid=1771892892964800&id=211441775676594,,0.0,Alexander City Schools is currently seeking a Mental Health Coordinator. If you are interested please go to the Teach In Alabama Website to apply. Please feel free to share. Thanks!,2020-08-12 11:09:02,,
14,0.0,,29.0,https://www.alexcityoutlook.com/news/updated-alex-city-schools-push-the-date-of-traditional-school-to-sept-8/article_8efa2d1e-d730-11ea-a2dd-f771cb709ce7.html,1765183066969116,‼️ Student safety is at the forefront of Alexander City Schools decision to delay the start of traditional school until Sept. 8.‼️,https://facebook.com/story.php?story_fbid=1765183066969116&id=211441775676594,"ALEXCITYOUTLOOK.COM
UPDATED: Alex City Schools push the date of traditional school to Sept. 8",48.0,"‼️ Student safety is at the forefront of Alexander City Schools decision to delay the start of traditional school until Sept. 8.‼️

ALEXCITYOUTLOOK.COM
UPDATED: Alex City Schools push the date of traditional school to Sept. 8",2020-08-05 13:31:16,,
15,3.0,https://scontent-atl3-1.xx.fbcdn.net/v/t1.0-9/fr/cp0/e15/q65/116666631_2726931287555629_5019562693420312774_o.jpg?_nc_cat=107&_nc_sid=8024bb&_nc_ohc=yyO4NiwMG5sAX9LLYno&_nc_ht=scontent-atl3-1.xx&tp=14&oh=6395af53c3fcf675c5020d8195772b45&oe=5F838650,28.0,,1760301477457275,"Meet Lee Lee, Alexander City Schools new Certified Facility Dog! 🐶",https://facebook.com/story.php?story_fbid=1760301477457275&id=211441775676594,"N. H. Stephens Elementary School
July 31 at 3:13 PM ·

Wildcat 🐾 Welcome

LeeLee, Certified Facility Dog

LeeLee, received her training from Service Dogs Alabama. LeeLee is very calm and sweet and loves being petted. Mrs. Waldrop is her handler and has attended many hours of training with her!

🍎Fun Fact: LeeLee loves playing with Loula the cat, taking naps, and camping!",8.0,"Meet Lee Lee, Alexander City Schools new Certified Facility Dog! 🐶

N. H. Stephens Elementary School
July 31 at 3:13 PM ·

Wildcat 🐾 Welcome

LeeLee, Certified Facility Dog

LeeLee, received her training from Service Dogs Alabama. LeeLee is very calm and sweet and loves being petted. Mrs. Waldrop is her handler and has attended many hours of training with her!

🍎Fun Fact: LeeLee loves playing with Loula the cat, taking naps, and camping!",2020-07-31 12:10:33,,
16,0.0,https://scontent-atl3-1.xx.fbcdn.net/v/t1.0-9/fr/cp0/e15/q65/116461552_290864579001237_1802934319982256565_n.jpg?_nc_cat=111&_nc_sid=110474&_nc_ohc=4qPzVwrVEkQAX9BDE5K&_nc_ht=scontent-atl3-1.xx&tp=14&oh=0737948ee6215b0e6bf33478ef1d9e96&oe=5F804324,24.0,,1759755290845227,Big things happening at Jim Pearson!! 👏🏼👏🏼👏🏼,https://facebook.com/story.php?story_fbid=1759755290845227&id=211441775676594,"Jim Pearson Elementary School
July 30 at 11:30 PM ·

Groundbreaking at JP! It starts with US, and ‘JP Under Construction’ officially starts NOW! ❤️🐾",0.0,"Big things happening at Jim Pearson!! 👏🏼👏🏼👏🏼

Jim Pearson Elementary School
July 30 at 11:30 PM ·

Groundbreaking at JP! It starts with US, and ‘JP Under Construction’ officially starts NOW! ❤️🐾",2020-07-30 21:33:44,,
17,1.0,https://scontent-atl3-1.xx.fbcdn.net/v/t1.0-9/fr/cp0/e15/q65/116437939_1759341460886610_564466464860813307_o.jpg?_nc_cat=105&_nc_sid=8024bb&_nc_ohc=_H_BY53LZXUAX9zcW4F&_nc_ht=scontent-atl3-1.xx&tp=14&oh=0264a92aec5830876df1b8f92fbd89cb&oe=5F81F2A9,8.0,,1759343064219783,"Alexander City Schools has the following positions available for the upcoming school year:
-LPN
-Maintenance Worker
-Special Education Teachers
If you are interested please apply online on the Teach In Alabama website. Feel free to share!",https://facebook.com/story.php?story_fbid=1759343064219783&id=211441775676594,,0.0,"Alexander City Schools has the following positions available for the upcoming school year:
-LPN
-Maintenance Worker
-Special Education Teachers
If you are interested please apply online on the Teach In Alabama website. Feel free to share!",2020-07-30 11:03:02,,
18,0.0,https://scontent-atl3-1.xx.fbcdn.net/v/t1.0-9/fr/cp0/e15/q65/116358903_290132269074468_8049255547168705721_n.jpg?_nc_cat=107&_nc_sid=110474&_nc_ohc=Vp13gxdBN-8AX-T02Dz&_nc_ht=scontent-atl3-1.xx&tp=14&oh=1bba9c4faeab655ac3427d8d42b48d39&oe=5F80DCE4,12.0,,1758868844267205,"🚧🚧 Parents of students going to PreK, K, 1st or 2nd grade, please like & follow Jim Pearson’s page to keep with construction updates. See below regarding changes to the drop off and pick up entrance. 🚧🚧",https://facebook.com/story.php?story_fbid=1758868844267205&id=211441775676594,"Jim Pearson Elementary School
July 29 at 11:55 PM ·

Happy Wednesday, JP Family! This is the first of many construction updates for the 2020-2021 school year! If you haven’t heard yet, our construction started last Monday, 7/20/20, and it is moving quickly along! The first thing we need you to know is that the main entrance has moved to the back of the school! We will be posting signs and making videos to help everyone with the process of changing to our new normal while we are under construction...please check our page often and start listening out for more updates! ❤️🐾 #jpunderconstruction #excitingtimesatjp #giveusayear",10.0,"🚧🚧 Parents of students going to PreK, K, 1st or 2nd grade, please like & follow Jim Pearson’s page to keep with construction updates. See below regarding changes to the drop off and pick up entrance. 🚧🚧

Jim Pearson Elementary School
July 29 at 11:55 PM ·

Happy Wednesday, JP Family! This is the first of many construction updates for the 2020-2021 school year! If you haven’t heard yet, our construction started last Monday, 7/20/20, and it is moving quickly along! The first thing we need you to know is that the main entrance has moved to the back of the school! We will be posting signs and making videos to help everyone with the process of changing to our new normal while we are under construction...please check our page often and start listening out for more updates! ❤️🐾 #jpunderconstruction #excitingtimesatjp #giveusayear",2020-07-29 21:55:43,,
19,14.0,,18.0,,1757904657696957,"A message from Dr. Price:
Parents, if you missed tonight’s virtual school presentation or had difficulty hearing it, it will be made available to all that have signed up. If you are interested and still trying to make a decision please email Dr. Price at bprice@acsk12.net and she will email the presentation to you. Thank you.",https://facebook.com/story.php?story_fbid=1757904657696957&id=211441775676594,,0.0,"A message from Dr. Price:
Parents, if you missed tonight’s virtual school presentation or had difficulty hearing it, it will be made available to all that have signed up. If you are interested and still trying to make a decision please email Dr. Price at bprice@acsk12.net and she will email the presentation to you. Thank you.",2020-07-28 20:01:39,,
20,2.0,https://scontent-atl3-1.xx.fbcdn.net/v/t1.0-9/fr/cp0/e15/q65/115880749_1754105501410206_1616301866945971508_o.jpg?_nc_cat=101&_nc_sid=8024bb&_nc_ohc=zvpF8tw8pM8AX-pFz-a&_nc_ht=scontent-atl3-1.xx&tp=14&oh=1e4501fd6ca4f05c31f9aac649599bd8&oe=5F812F18,10.0,http://www.alexcityschools.net/,1754107088076714,"🚌 Transportation Forms are due this Friday, JULY 31st. If your student rides the bus please complete the transportation form located on ACS homepage at www.alexcityschools.net.",https://facebook.com/story.php?story_fbid=1754107088076714&id=211441775676594,,0.0,"🚌 Transportation Forms are due this Friday, JULY 31st. If your student rides the bus please complete the transportation form located on ACS homepage at www.alexcityschools.net.",2020-07-27 10:44:20,,
21,5.0,https://scontent-atl3-1.xx.fbcdn.net/v/t1.0-9/fr/cp0/e15/q65/114485529_1754093144744775_1731509641766609767_o.jpg?_nc_cat=111&_nc_sid=8024bb&_nc_ohc=ZiH5Zt6ZHI4AX9oqvxq&_nc_ht=scontent-atl3-1.xx&tp=14&oh=efce2937d35a819ff6f9b3b0c4e3f03e&oe=5F813B91,14.0,,1754094508077972,"RETURN TO LEARN Plan for the 2020-2021 School Year. ACS's Return-to-Learn plan is a draft copy only. Many of the live links and some of the infographics designed for quick reference are not yet uploaded and connected. We are placing the “draft plan” on the website for your review.

We will also be creating a Frequently Asked Questions (FAQ) link for you to post questions so we can answer them in the plan. You can ask your questions by emailing rtl2020@acsk12.net

The Alexander City Schools Leadership Team is in constant contact with multiple agencies (Alabama High School Athletic Association (AHSAA), Alabama State Department of Education (ALSDE), and the Alabama Department of Public Health (ADPH)) to help guide our decisions for reopening schools. These agencies update and change information sometimes daily; therefore, the plan will be constantly updated as we make necessary changes. We will use SchoolCast, social media, and the district website to alert you to the updates. I am anticipating the plan being complete by August 1, 2020. The individual school plans outlining specific school procedures (drop-off and pick-up, schedules, check-in/out, and electronic device assignment) will also be included in the plan by August 1, 2020.
Please click here to review the draft version of our full plan: https://bit.ly/38Jbd0W",https://facebook.com/story.php?story_fbid=1754094508077972&id=211441775676594,,0.0,"RETURN TO LEARN Plan for the 2020-2021 School Year. ACS's Return-to-Learn plan is a draft copy only. Many of the live links and some of the infographics designed for quick reference are not yet uploaded and connected. We are placing the “draft plan” on the website for your review.

We will also be creating a Frequently Asked Questions (FAQ) link for you to post questions so we can answer them in the plan. You can ask your questions by emailing rtl2020@acsk12.net

The Alexander City Schools Leadership Team is in constant contact with multiple agencies (Alabama High School Athletic Association (AHSAA), Alabama State Department of Education (ALSDE), and the Alabama Department of Public Health (ADPH)) to help guide our decisions for reopening schools. These agencies update and change information sometimes daily; therefore, the plan will be constantly updated as we make necessary changes. We will use SchoolCast, social media, and the district website to alert you to the updates. I am anticipating the plan being complete by August 1, 2020. The individual school plans outlining specific school procedures (drop-off and pick-up, schedules, check-in/out, and electronic device assignment) will also be included in the plan by August 1, 2020.
Please click here to review the draft version of our full plan: https://bit.ly/38Jbd0W",2020-07-25 10:16:33,,
22,21.0,https://scontent-atl3-1.xx.fbcdn.net/v/t1.0-9/fr/cp0/e15/q65/115728662_1754099808077442_6526265886382107579_o.jpg?_nc_cat=106&_nc_sid=8024bb&_nc_ohc=SqWquiVk68sAX_kZZ2w&_nc_ht=scontent-atl3-1.xx&tp=14&oh=bf74d1817553e73f098af9adff192e4c&oe=5F83652A,21.0,http://www.alexcityschools.net/,1754103008077122,"Alexander City Schools Virtual Academy Informational Meeting:
-WHEN: July 28, 2020 @ 5:30PM
-WHERE: In the Benjamin Russell High School Auditorium

If you would like more information about the Alexander City Virtual Academy, please attend this meeting in person or online via Zoom or Facebook Live. Seating capacity for the auditorium is limited. Social Distancing will be enforced and attendees must wear masks.

For more in formation click the link under ""School News"" on the righthand column at www.alexcityschools.net.",https://facebook.com/story.php?story_fbid=1754103008077122&id=211441775676594,,0.0,"Alexander City Schools Virtual Academy Informational Meeting:
-WHEN: July 28, 2020 @ 5:30PM
-WHERE: In the Benjamin Russell High School Auditorium

If you would like more information about the Alexander City Virtual Academy, please attend this meeting in person or online via Zoom or Facebook Live. Seating capacity for the auditorium is limited. Social Distancing will be enforced and attendees must wear masks.

For more in formation click the link under ""School News"" on the righthand column at www.alexcityschools.net.",2020-07-24 19:36:54,,
