,comments,image,likes,link,post_id,post_text,post_url,shared_text,shares,text,time,video,video_thumbnail
79,6.0,,36.0,https://bit.ly/ACSpreK,1598126383674786,"We had a great time on The Front Porch this morning sharing about Jim Pearson's PreK Program for children who are four years old or will be four by Sept. 01, 2020. Windy Eldred, Assistant Principal at Jim Pearson, had all the details about open registration which is going on now. Click here for more details, http://bit.ly/ACSpreK",https://facebook.com/story.php?story_fbid=1598126383674786&id=211441775676594,"ALPREK.ASAPCONNECTED.COM
Alabama First Class Pre-K Pre-Registration Online Registration",18.0,"We had a great time on The Front Porch this morning sharing about Jim Pearson's PreK Program for children who are four years old or will be four by Sept. 01, 2020. Windy Eldred, Assistant Principal at Jim Pearson, had all the details about open registration which is going on now. Click here for more details, http://bit.ly/ACSpreK

ALPREK.ASAPCONNECTED.COM
Alabama First Class Pre-K Pre-Registration Online Registration",2020-02-17 11:09:23,,
80,0.0,https://scontent-atl3-1.xx.fbcdn.net/v/t1.0-9/fr/cp0/e15/q65/86415470_1449747211860582_4957865506380972032_n.jpg?_nc_cat=107&_nc_sid=110474&_nc_ohc=6nocCwhLerAAX9Xeo8w&_nc_ht=scontent-atl3-1.xx&tp=14&oh=2cdc39f9b25df21b2f0dd3c40f04deff&oe=5F830BE4,20.0,,1595429463944478,Special treats for our teachers from the Alexander City Schools Education Foundation today to celebrate Valentine’s Day. 👏🏼👏🏼,https://facebook.com/story.php?story_fbid=1595429463944478&id=211441775676594,"Alex City Schools Education Foundation
February 14 at 6:16 PM ·

ACSEF 💚’s ACS teachers!! A special delivery was taken to each school this morning, from Jim Pearson to Benjamin Russell, so that all of our teachers had a sweet treat today too. Happy Valentine’s Day to everyone!",0.0,"Special treats for our teachers from the Alexander City Schools Education Foundation today to celebrate Valentine’s Day. 👏🏼👏🏼

Alex City Schools Education Foundation
February 14 at 6:16 PM ·

ACSEF 💚’s ACS teachers!! A special delivery was taken to each school this morning, from Jim Pearson to Benjamin Russell, so that all of our teachers had a sweet treat today too. Happy Valentine’s Day to everyone!",2020-02-14 13:42:11,,
81,0.0,https://scontent-atl3-1.xx.fbcdn.net/v/t1.0-9/85092112_1593578917462866_5740525280628310016_n.png?_nc_cat=110&_nc_sid=8024bb&_nc_ohc=fwgDAr1s0JkAX-\-\SWIz&_nc_ht=scontent-atl3-1.xx&oh=fc3021726ac3df24ff7f710a15ad3d0b&oe=5F7FE3A0,6.0,https://bit.ly/AlexCityGIVE,1593580380796053,"🖤Not sure about Valentine’s Day? Roses are great-don't get us wrong. 🌹But not very...you know...creative. Looking for something different, something that can be used all year long, something that will make your valentine smile? How about unlimited portable internet plus a cool T9 hotspot from the WiFi on the Go program? 👩‍💻With unlimited data, there is no limit to the number of romantic comedies you can stream! Sounds like the perfect gift to us. So do something different this year and try a gift that will last and support Alexander City Schools at the same time. It’s only $50 per month! Click here for more info 👉http://bit.ly/AlexCityGIVE",https://facebook.com/story.php?story_fbid=1593580380796053&id=211441775676594,,0.0,"🖤Not sure about Valentine’s Day? Roses are great-don't get us wrong. 🌹But not very...you know...creative. Looking for something different, something that can be used all year long, something that will make your valentine smile? How about unlimited portable internet plus a cool T9 hotspot from the WiFi on the Go program? 👩‍💻With unlimited data, there is no limit to the number of romantic comedies you can stream! Sounds like the perfect gift to us. So do something different this year and try a gift that will last and support Alexander City Schools at the same time. It’s only $50 per month! Click here for more info 👉http://bit.ly/AlexCityGIVE",2020-02-12 17:02:10,,
82,0.0,https://scontent-atl3-1.xx.fbcdn.net/v/t1.0-9/fr/cp0/e15/q65/84847419_1588623341291757_6471181702524829696_o.jpg?_nc_cat=102&_nc_sid=8024bb&_nc_ohc=t2fWu9LdrAMAX_eYpnh&_nc_ht=scontent-atl3-1.xx&tp=14&oh=1e1f074093d1ef89c43dbb0285e41a5a&oe=5F80BB72,14.0,,1588637834623641,"Happy School Counseling Week to our #schoolcounselors! School counselors play an important role, often times behind the scenes, by promoting student success, teaching character education, and helping students plan for the future. We thank our school counselors: Mrs. Harris and Mrs. Kelly (Jim Pearson), Mrs. Blankenship (Stephens), Counselor Curtis (Radney), Mrs. Lashley (ACMS) and Mr. Burton and Mrs. Carr (BRHS) for their hardworking and dedication to ACS!",https://facebook.com/story.php?story_fbid=1588637834623641&id=211441775676594,,0.0,"Happy School Counseling Week to our #schoolcounselors! School counselors play an important role, often times behind the scenes, by promoting student success, teaching character education, and helping students plan for the future. We thank our school counselors: Mrs. Harris and Mrs. Kelly (Jim Pearson), Mrs. Blankenship (Stephens), Counselor Curtis (Radney), Mrs. Lashley (ACMS) and Mr. Burton and Mrs. Carr (BRHS) for their hardworking and dedication to ACS!",2020-02-07 10:01:02,,
83,5.0,https://scontent-atl3-1.xx.fbcdn.net/v/t1.0-9/84813749_1587769728043785_5700795441570906112_n.png?_nc_cat=107&_nc_sid=8024bb&_nc_ohc=mrvXMfjqkOEAX-EDX3e&_nc_ht=scontent-atl3-1.xx&oh=d2f0daffc0418a1176655feebaa831d9&oe=5F82A5B1,82.0,,1587774391376652,"Alexander City School buses were able to complete their routes this morning and dropped students off safely at each school. We were able to begin classes based on the two-hour delay. Alexander City Schools understands there are some hardships in certain areas due to the weather such as power outages and downed trees. We would like parents to know that anyone experiencing such hardships would receive a permissible absence authorized by the superintendent. Please submit the excuse to your child’s school upon their return.

Please understand any modification in our schools' schedules, such as a delay, is done so with much consideration. We communicate with the National Weather Service as well as our local Emergency Management Agency for their expert advice when making these decisions.",https://facebook.com/story.php?story_fbid=1587774391376652&id=211441775676594,,0.0,"Alexander City School buses were able to complete their routes this morning and dropped students off safely at each school. We were able to begin classes based on the two-hour delay. Alexander City Schools understands there are some hardships in certain areas due to the weather such as power outages and downed trees. We would like parents to know that anyone experiencing such hardships would receive a permissible absence authorized by the superintendent. Please submit the excuse to your child’s school upon their return.

Please understand any modification in our schools' schedules, such as a delay, is done so with much consideration. We communicate with the National Weather Service as well as our local Emergency Management Agency for their expert advice when making these decisions.",2020-02-06 11:41:46,,
84,0.0,https://scontent-atl3-1.xx.fbcdn.net/v/t1.0-9/83903478_1587044358116322_3351988650429644800_n.png?_nc_cat=104&_nc_sid=8024bb&_nc_ohc=JEdrf1X9bscAX89YZ4L&_nc_ht=scontent-atl3-1.xx&oh=f146b45d10640da397babb96b636f0ea&oe=5F81008D,38.0,,1587047918115966,"‼️According to the National Weather Service, we could experience severe weather in our area during the early morning hours. On Thursday, February 6th 2020, all Alexander City Schools will be delayed two hours for the safety and well being of our students, faculty, and staff. See school start times below. Faculty and staff should report 2 hours past regular report time. Buses will pick up students two hours past their regular pick up time. Please continue to monitor the weather and stay safe as this front moves through our area. ‼️",https://facebook.com/story.php?story_fbid=1587047918115966&id=211441775676594,,0.0,"‼️According to the National Weather Service, we could experience severe weather in our area during the early morning hours. On Thursday, February 6th 2020, all Alexander City Schools will be delayed two hours for the safety and well being of our students, faculty, and staff. See school start times below. Faculty and staff should report 2 hours past regular report time. Buses will pick up students two hours past their regular pick up time. Please continue to monitor the weather and stay safe as this front moves through our area. ‼️",2020-02-05 16:42:19,,
85,0.0,,21.0,,1582646068556151,"Alexander City Schools is aware of a recent video that depicts a portion of the exterior of one of our schools. The video was not filmed during school hours. Anything depicting our school was done so without our consent. We have contacted our local authorities to assist in an investigation. Alexander City Schools does not condone any type of gang or violent activity on any of our properties. As always, the safety of our students, faculty, and staff is our top priority.",https://facebook.com/story.php?story_fbid=1582646068556151&id=211441775676594,,0.0,"Alexander City Schools is aware of a recent video that depicts a portion of the exterior of one of our schools. The video was not filmed during school hours. Anything depicting our school was done so without our consent. We have contacted our local authorities to assist in an investigation. Alexander City Schools does not condone any type of gang or violent activity on any of our properties. As always, the safety of our students, faculty, and staff is our top priority.",2020-01-31 16:31:42,,
86,0.0,https://scontent-atl3-1.xx.fbcdn.net/v/t1.0-9/fr/cp0/e15/q65/83490833_1579065872247504_46921744614686720_o.jpg?_nc_cat=107&_nc_sid=8024bb&_nc_ohc=iekSXPJwJ3YAX9jYtUL&_nc_ht=scontent-atl3-1.xx&tp=14&oh=56d92eba73aa0838d9da5eb67f494c02&oe=5F80C361,32.0,,1579066125580812,"An ACS group of 'difference makers' recently attended the Spark, Ignite, Glow Technology Conference hosted by Janet Burnett, Technology Innovation Specialist with Florence City Schools. The experience allowed attendees to collaborate and use tech tools that engage students, promote efficient lesson design, and provide positive learning outcomes! We are always learning so that we can improve at ACS!!",https://facebook.com/story.php?story_fbid=1579066125580812&id=211441775676594,,0.0,"An ACS group of 'difference makers' recently attended the Spark, Ignite, Glow Technology Conference hosted by Janet Burnett, Technology Innovation Specialist with Florence City Schools. The experience allowed attendees to collaborate and use tech tools that engage students, promote efficient lesson design, and provide positive learning outcomes! We are always learning so that we can improve at ACS!!",2020-01-29 19:00:49,,
87,8.0,https://scontent-atl3-1.xx.fbcdn.net/v/t1.0-9/fr/cp0/e15/q65/83843423_1579064558914302_915313434071924736_o.jpg?_nc_cat=103&_nc_sid=8024bb&_nc_ohc=yyskV_y_04YAX9ikt2D&_nc_ht=scontent-atl3-1.xx&tp=14&oh=9fcdb8de5b320e20cd260060e6f93609&oe=5F8183CF,86.0,,1579064785580946,"👏👏👏Benjamin Russell High School teachers, Emily Sassano(left) and Jessica Dean(right), attended the Alabama National Board Certification Teacher Networking Conference over the weekend. Mrs. Sassano renewed her National Board Certification this year and Mrs. Dean became board certified this year. Board Certification allows teachers to hone their practice, showcase their talent in the classroom and demonstrate their dedication to their students and their profession. Becoming board certified is a rigorous process and we are so proud of these two teachers! Making ACS even better.",https://facebook.com/story.php?story_fbid=1579064785580946&id=211441775676594,,0.0,"👏👏👏Benjamin Russell High School teachers, Emily Sassano(left) and Jessica Dean(right), attended the Alabama National Board Certification Teacher Networking Conference over the weekend. Mrs. Sassano renewed her National Board Certification this year and Mrs. Dean became board certified this year. Board Certification allows teachers to hone their practice, showcase their talent in the classroom and demonstrate their dedication to their students and their profession. Becoming board certified is a rigorous process and we are so proud of these two teachers! Making ACS even better.",2020-01-28 19:00:48,,
88,4.0,https://scontent-atl3-1.xx.fbcdn.net/v/t1.0-9/fr/cp0/e15/q65/82978427_1579073038913454_2478134939392933888_o.jpg?_nc_cat=101&_nc_sid=8024bb&_nc_ohc=4n7RdLzQ4-IAX9nJA86&_nc_ht=scontent-atl3-1.xx&tp=14&oh=c18b13d783d9aed947207d5681ffec0c&oe=5F80B5C5,40.0,,1579073485580076,"January is School Board Member Appreciation Month. Although, we are grateful year round for the dedication that is required of our school board members. They do this job because they know their time and effort makes a difference in the lives of our students, teachers and community. Join us in thanking Denise Bates, Kelly Waldrop, Dorothea Walker, Kevin Speaks and Michael Ransaw for all they do for Alexander City Schools.",https://facebook.com/story.php?story_fbid=1579073485580076&id=211441775676594,,0.0,"January is School Board Member Appreciation Month. Although, we are grateful year round for the dedication that is required of our school board members. They do this job because they know their time and effort makes a difference in the lives of our students, teachers and community. Join us in thanking Denise Bates, Kelly Waldrop, Dorothea Walker, Kevin Speaks and Michael Ransaw for all they do for Alexander City Schools.",2020-01-27 19:00:11,,
89,0.0,,11.0,https://www.alexcityoutlook.com/news/college-credit-requirement-led-bartlett-to-career-teaching-spanish/article_315b0b74-3dfc-11ea-99a3-bfa02c827f7e.html,1576164149204343,Ms. Bartlett does a great job teaching Spanish at Benjamin Russell High School. We are thankful to have her on the ACS team!,https://facebook.com/story.php?story_fbid=1576164149204343&id=211441775676594,"ALEXCITYOUTLOOK.COM
College credit requirement led Bartlett to career teaching Spanish",3.0,"Ms. Bartlett does a great job teaching Spanish at Benjamin Russell High School. We are thankful to have her on the ACS team!

ALEXCITYOUTLOOK.COM
College credit requirement led Bartlett to career teaching Spanish",2020-01-24 11:54:06,,
90,1.0,https://scontent-atl3-1.xx.fbcdn.net/v/t1.0-9/fr/cp0/e15/q65/82829242_1574476429373115_7046300878843674624_o.jpg?_nc_cat=104&_nc_sid=8024bb&_nc_ohc=B9wK0Kg8fwQAX_3cwTI&_nc_ht=scontent-atl3-1.xx&tp=14&oh=c8e00a9a803e455b5ecd80a9164b73ab&oe=5F82E983,40.0,,1574478226039602,"To celebrate the ""100th Day of School"" Ms. Ellen's 1st Grade class shared 100 Reasons Why They Love School. Some of the reasons include: lunch, Jim (gym), our classroom, Coach Ford, After the Bell and friends. Is there anything sweeter? Yay for 100 days!",https://facebook.com/story.php?story_fbid=1574478226039602&id=211441775676594,,0.0,"To celebrate the ""100th Day of School"" Ms. Ellen's 1st Grade class shared 100 Reasons Why They Love School. Some of the reasons include: lunch, Jim (gym), our classroom, Coach Ford, After the Bell and friends. Is there anything sweeter? Yay for 100 days!",2020-01-22 15:26:04,,
91,0.0,https://scontent-atl3-1.xx.fbcdn.net/v/t1.0-9/82512191_1566751066812318_945034165378613248_n.png?_nc_cat=107&_nc_sid=8024bb&_nc_ohc=XMNAYFpGARwAX_k-6QH&_nc_ht=scontent-atl3-1.xx&oh=f5d7c7c0459942d4905495131b46e987&oe=5F808E5F,18.0,https://bit.ly/ACSpreK,1566755886811836,Pre-registration for Alexander City Schools Voluntary Pre-K Program will be open January 15 - March 24. Click here http://bit.ly/ACSpreK to complete the pre-registration form and submit birth certificate and proof of residence. Acceptance is strictly through random drawing to be held on March 26th at 4:00 pm at Jim Pearson's Lunchroom. Parent/Guardian does not have to be present. Notices will be mailed on April 16th.,https://facebook.com/story.php?story_fbid=1566755886811836&id=211441775676594,,0.0,Pre-registration for Alexander City Schools Voluntary Pre-K Program will be open January 15 - March 24. Click here http://bit.ly/ACSpreK to complete the pre-registration form and submit birth certificate and proof of residence. Acceptance is strictly through random drawing to be held on March 26th at 4:00 pm at Jim Pearson's Lunchroom. Parent/Guardian does not have to be present. Notices will be mailed on April 16th.,2020-01-14 11:23:54,,
92,2.0,https://scontent-atl3-1.xx.fbcdn.net/v/t1.0-9/81682024_1561267500694008_7452318452460552192_n.png?_nc_cat=103&_nc_sid=8024bb&_nc_ohc=TwDZ1cPxkdUAX_dQb2t&_nc_ht=scontent-atl3-1.xx&oh=9f8e2038c6c3cf5ff3bdd0adce16cfd5&oe=5F82EF21,45.0,,1561283057359119,"Today we thank the incredible officers with the Alexander City Police Department for all they do to keep us safe. We truly appreciate their commitment to our community and school system. A special thanks to our Student Resource Officers, David Johnson (Jim Pearson and Stephens) Marcus Billups (Radney and D.A.R.E.) and Brian Ray (BRHS) who help ensure safety and crime prevention within our school system.",https://facebook.com/story.php?story_fbid=1561283057359119&id=211441775676594,,0.0,"Today we thank the incredible officers with the Alexander City Police Department for all they do to keep us safe. We truly appreciate their commitment to our community and school system. A special thanks to our Student Resource Officers, David Johnson (Jim Pearson and Stephens) Marcus Billups (Radney and D.A.R.E.) and Brian Ray (BRHS) who help ensure safety and crime prevention within our school system.",2020-01-09 15:37:34,,
93,0.0,https://scontent-atl3-1.xx.fbcdn.net/v/t1.0-9/fr/cp0/e15/q65/81323257_10157862074819776_6780543137384235008_o.jpg?_nc_cat=109&_nc_sid=8024bb&_nc_ohc=_KWn_xFoznUAX-3AWkD&_nc_ht=scontent-atl3-1.xx&tp=14&oh=9f28d50a358b568f3293389a14f05ee4&oe=5F803D8E,1.0,http://www.russellforestrun.com/,1560952994058792,Mark your calendars for Feb. 29! The Russell Forrest Run is just around the corner. All levels of runners and walkers are invited to take part in this fun event to benefit the Alex City Schools Education Foundation.,https://facebook.com/story.php?story_fbid=1560952994058792&id=211441775676594,"Russell Forest Run
January 3 at 3:01 PM ·

It's that time! Go ahead and register for the 11th annual Russell Forest Run! We are updating the course.......more to come on that! :) Click sign up on the FB page or www.russellforestrun.com",0.0,"Mark your calendars for Feb. 29! The Russell Forrest Run is just around the corner. All levels of runners and walkers are invited to take part in this fun event to benefit the Alex City Schools Education Foundation.

Russell Forest Run
January 3 at 3:01 PM ·

It's that time! Go ahead and register for the 11th annual Russell Forest Run! We are updating the course.......more to come on that! :) Click sign up on the FB page or www.russellforestrun.com",2020-01-09 08:55:45,,
94,0.0,https://scontent-atl3-1.xx.fbcdn.net/v/t1.0-9/fr/cp0/e15/q65/82342847_1556679384486153_9034235708797091840_n.jpg?_nc_cat=100&_nc_sid=110474&_nc_ohc=01rniWaw94YAX_U9arU&_nc_ht=scontent-atl3-1.xx&tp=14&oh=d5ca78a224b6d3c2bfce1702347157aa&oe=5F82196C,34.0,,1556682731152485,"ACS is looking forward to an amazing second semester. We hope everyone has enjoyed their holiday break. We would like to welcome back all teachers and staff on Monday, January 6th and our students on Tuesday, January 7th.",https://facebook.com/story.php?story_fbid=1556682731152485&id=211441775676594,,0.0,"ACS is looking forward to an amazing second semester. We hope everyone has enjoyed their holiday break. We would like to welcome back all teachers and staff on Monday, January 6th and our students on Tuesday, January 7th.",2020-01-05 09:25:40,,
95,0.0,https://scontent-atl3-1.xx.fbcdn.net/v/t1.0-9/fr/cp0/e15/q65/81929063_1551138478373577_1310174233136988160_o.jpg?_nc_cat=107&_nc_sid=8024bb&_nc_ohc=64b7cX1YA0gAX8pXKE1&_nc_ht=scontent-atl3-1.xx&tp=14&oh=9ce6bbba5f20e1eebee3246754179809&oe=5F828B05,42.0,,1551139175040174,"ACS started the 2019-2020 school year with the following quote by Jim Stewart: ""To achieve a goal you have never achieved before, you must first start by doing things you have never done before."" As you set goals in this new decade consider new ways to achieve them! Happy New Year from Alexander City Schools.",https://facebook.com/story.php?story_fbid=1551139175040174&id=211441775676594,,0.0,"ACS started the 2019-2020 school year with the following quote by Jim Stewart: ""To achieve a goal you have never achieved before, you must first start by doing things you have never done before."" As you set goals in this new decade consider new ways to achieve them! Happy New Year from Alexander City Schools.",2020-01-01 10:27:21,,
96,8.0,https://scontent-atl3-1.xx.fbcdn.net/v/t1.0-9/fr/cp0/e15/q65/80394693_2250571108576215_6116408053731426304_n.jpg?_nc_cat=109&_nc_sid=110474&_nc_ohc=9sc8J1048mcAX_pmxST&_nc_ht=scontent-atl3-1.xx&tp=14&oh=8005248c725b230879bdf028009e051e&oe=5F81D4AB,55.0,,1548016442019114,"👏🏼👏🏼Way to go,BR Wrestling! 👏🏼👏🏼",https://facebook.com/story.php?story_fbid=1548016442019114&id=211441775676594,"Benjamin Russell High School
December 28, 2019 at 10:16 PM ·

Congrats to BR Wrestling on winning the 2019 Indians Invitational with 8 finalist! #werBR #MatCats",3.0,"👏🏼👏🏼Way to go,BR Wrestling! 👏🏼👏🏼

Benjamin Russell High School
December 28, 2019 at 10:16 PM ·

Congrats to BR Wrestling on winning the 2019 Indians Invitational with 8 finalist! #werBR #MatCats",2019-12-28 18:00:22,,
97,45.0,https://scontent-atl3-1.xx.fbcdn.net/v/t1.0-9/80610294_1539083766245715_8839070195843596288_n.png?_nc_cat=107&_nc_sid=8024bb&_nc_ohc=uwIFoDPxu60AX-6_YLS&_nc_ht=scontent-atl3-1.xx&oh=0c28f547cde176c43729d93109ea2043&oe=5F822889,163.0,,1539086316245460,"Congratulations are in order for STEM Teachers, Jerri Mattox (Jim Pearson) and Leanne Waldrop (Stephens) as they both received Alabama Robotics Grants for 2020. Help us applaud their efforts to actively utilize robotics education as a means to engage students in learning. 👏👏👏",https://facebook.com/story.php?story_fbid=1539086316245460&id=211441775676594,,0.0,"Congratulations are in order for STEM Teachers, Jerri Mattox (Jim Pearson) and Leanne Waldrop (Stephens) as they both received Alabama Robotics Grants for 2020. Help us applaud their efforts to actively utilize robotics education as a means to engage students in learning. 👏👏👏",2019-12-20 12:00:30,,
98,28.0,https://scontent-atl3-1.xx.fbcdn.net/v/t1.0-9/fr/cp0/e15/q65/79932064_1536158226538269_2354865688620826624_o.jpg?_nc_cat=108&_nc_sid=8024bb&_nc_ohc=1lphhU6hokEAX9iWCD1&_nc_ht=scontent-atl3-1.xx&tp=14&oh=529bc7e71278bc2ff9f01db115325c9e&oe=5F839F6C,128.0,,1536167953203963,"✨ Santa came a few days early for Jim Pearson student, Kennedi Tuck. Her sister, Amelia Blakely, is in the US Marine Corps and has been deployed for close to a year. Kennedi told Santa getting to see her sister would be make for the best Christmas present ever. Santa did what he does best... he granted Kennedi her wish. It was a heartwarming moment today as Kennedi and Amelia were reunited in Mrs. Latham's Kindergarten class at Jim Pearson. ✨ It is a very Merry Christmas indeed! 🎄",https://facebook.com/story.php?story_fbid=1536167953203963&id=211441775676594,,0.0,"✨ Santa came a few days early for Jim Pearson student, Kennedi Tuck. Her sister, Amelia Blakely, is in the US Marine Corps and has been deployed for close to a year. Kennedi told Santa getting to see her sister would be make for the best Christmas present ever. Santa did what he does best... he granted Kennedi her wish. It was a heartwarming moment today as Kennedi and Amelia were reunited in Mrs. Latham's Kindergarten class at Jim Pearson. ✨ It is a very Merry Christmas indeed! 🎄",2019-12-17 17:12:29,,
99,11.0,https://scontent-atl3-1.xx.fbcdn.net/v/t1.0-9/80129520_1535089319978493_1107704982267756544_n.png?_nc_cat=106&_nc_sid=8024bb&_nc_ohc=4UVKYYynZLEAX9FiMjP&_nc_ht=scontent-atl3-1.xx&oh=d45d6f8f46e6abf623cdfb8aa76f1cc1&oe=5F808A2B,54.0,,1535131556640936,"According to the National Weather Service we could experience severe weather in our area during the early morning hours. On Tuesday, December 17, 2019 all Alexander City Schools will be delayed two hours for the safety and well being of our students, faculty and staff. Each school’s start time is listed below. Faculty and staff should report 2 hours past your regular report time. Buses will begin running at 8:15 a.m. to pick up students. Parents, be on the lookout for your child’s bus thereafter. Please be mindful of the weather and stay safe tonight.",https://facebook.com/story.php?story_fbid=1535131556640936&id=211441775676594,,0.0,"According to the National Weather Service we could experience severe weather in our area during the early morning hours. On Tuesday, December 17, 2019 all Alexander City Schools will be delayed two hours for the safety and well being of our students, faculty and staff. Each school’s start time is listed below. Faculty and staff should report 2 hours past your regular report time. Buses will begin running at 8:15 a.m. to pick up students. Parents, be on the lookout for your child’s bus thereafter. Please be mindful of the weather and stay safe tonight.",2019-12-16 17:30:14,,
