,comments,image,likes,link,post_id,post_text,post_url,shared_text,shares,text,time,video,video_thumbnail
45,0.0,,38.0,,10163891259425237,The JV Football team won their first game of the season over Elm Creek 12-0!! Way to go boys!! #ProudToBeACardinal,https://facebook.com/story.php?story_fbid=10163891259425237&id=303269020236,,0.0,The JV Football team won their first game of the season over Elm Creek 12-0!! Way to go boys!! #ProudToBeACardinal,2020-08-31 20:30:03,,
46,1.0,,5.0,https://striv.tv/channel/alma/,10163890727385237,The JV Football game tonight against Elm Creek will be streamed on our Striv channel. The game will begin at 6 PM. It can be found at https://striv.tv/channel/alma/. #ProudToBeACardinal #ShareToBeAware,https://facebook.com/story.php?story_fbid=10163890727385237&id=303269020236,,0.0,The JV Football game tonight against Elm Creek will be streamed on our Striv channel. The game will begin at 6 PM. It can be found at https://striv.tv/channel/alma/. #ProudToBeACardinal #ShareToBeAware,2020-08-31 18:05:29,,
47,0.0,https://scontent-atl3-1.xx.fbcdn.net/v/t1.0-9/118717655_10163888981725237_4551765534587540372_o.png?_nc_cat=109&_nc_sid=2d5d41&_nc_ohc=7dQCd2nBX_0AX-ZWrMr&_nc_ht=scontent-atl3-1.xx&oh=a4fcdee3e0eb35052f70305114194d33&oe=5F8189B2,3.0,,10163888981720237,"Below you will find the guidelines to follow if you plan to attend the Volleyball Triangular at Franklin tomorrow, September 1. Alma will start playing right at 5 PM! Thank you for doing your part!! #ProudToBeACardinal #ShareToBeAware",,,0.0,"Below you will find the guidelines to follow if you plan to attend the Volleyball Triangular at Franklin tomorrow, September 1. Alma will start playing right at 5 PM! Thank you for doing your part!! #ProudToBeACardinal #ShareToBeAware",2020-08-31 10:58:47,,
48,0.0,,7.0,https://www.almacardinals.org/article/297574?org=alma-public-schools,10163888976515237,Fall Activity Guidelines,https://facebook.com/story.php?story_fbid=10163888976515237&id=303269020236,"ALMACARDINALS.ORG
Fall Activity Guidelines",4.0,"Fall Activity Guidelines

ALMACARDINALS.ORG
Fall Activity Guidelines",2020-08-31 10:56:29,,
49,1.0,,11.0,,10163881036090237,Congratulations!!! #ProudToBeACardinal,https://facebook.com/story.php?story_fbid=10163881036090237&id=303269020236,"Alma FFA
August 29 at 3:14 AM ·

After COVID 19 delays and multiple rescheduling conflicts we got out interviews done Monday, thanks to those who volunteered to help with that process. Congratulations to newly elected officers, should be a great team to lead us this school year!",0.0,"Congratulations!!! #ProudToBeACardinal

Alma FFA
August 29 at 3:14 AM ·

After COVID 19 delays and multiple rescheduling conflicts we got out interviews done Monday, thanks to those who volunteered to help with that process. Congratulations to newly elected officers, should be a great team to lead us this school year!",2020-08-29 19:21:45,https://video-atl3-1.xx.fbcdn.net/v/t42.9040-2/118076482_3421081587957916_6232283072228887833_n.mp4?_nc_cat=101&_nc_sid=985c63&efg=eyJ2ZW5jb2RlX3RhZyI6ImxlZ2FjeV9zZCJ9&_nc_ohc=RXNyXNK3iFUAX9LqYen&_nc_ht=video-atl3-1.xx&oh=1ddefb6c7952c246a024791b20e0d476&oe=5F5E0439,
50,8.0,https://scontent-atl3-1.xx.fbcdn.net/v/t1.0-9/fr/cp0/e15/q65/118651022_10163880776185237_2755311665319797771_o.jpg?_nc_cat=105&_nc_sid=8024bb&_nc_ohc=SzinDL2Ta4kAX-qmASF&_nc_ht=scontent-atl3-1.xx&tp=14&oh=7bf8cec427045a7095d3fe0190bb23f2&oe=5F82E614,83.0,,10163880776570237,"The Lady Cardinals couldn’t quite take down Axtell, and lost in three sets for second place, but it was a great day of volleyball!!! We are so proud of you, ladies! #ProudToBeACardinal",https://facebook.com/story.php?story_fbid=10163880776570237&id=303269020236,,0.0,"The Lady Cardinals couldn’t quite take down Axtell, and lost in three sets for second place, but it was a great day of volleyball!!! We are so proud of you, ladies! #ProudToBeACardinal",2020-08-29 18:30:24,,
51,1.0,,5.0,http://striv.tv/channel/Axtell,10163880014525237,Alma’s championship game will be streamed on the Axtell striv channel. The game will begin approximately 4 pm. It can be found at striv.tv/channel/Axtell. Go get them ladies!!!! #ShareToBeAware,https://facebook.com/story.php?story_fbid=10163880014525237&id=303269020236,,0.0,Alma’s championship game will be streamed on the Axtell striv channel. The game will begin approximately 4 pm. It can be found at striv.tv/channel/Axtell. Go get them ladies!!!! #ShareToBeAware,2020-08-29 16:17:38,,
52,1.0,,37.0,,10163879868830237,Congrats to the Lady Cards! They just beat Silver Lake in two sets and will play for the championship around approximately 4 PM!! Go ladies!! #ProudToBeACardinal,https://facebook.com/story.php?story_fbid=10163879868830237&id=303269020236,,0.0,Congrats to the Lady Cards! They just beat Silver Lake in two sets and will play for the championship around approximately 4 PM!! Go ladies!! #ProudToBeACardinal,2020-08-29 15:51:31,,
53,0.0,,1.0,http://striv.tv/channel/Axtell,10163879433475237,Alma’s next game will be streamed on the Axtell striv channel. Go to striv.tv/channel/Axtell to watch. It will be the game following the one in progress. #ProudToBeACardinal #ShareToBeAware,https://facebook.com/story.php?story_fbid=10163879433475237&id=303269020236,,0.0,Alma’s next game will be streamed on the Axtell striv channel. Go to striv.tv/channel/Axtell to watch. It will be the game following the one in progress. #ProudToBeACardinal #ShareToBeAware,2020-08-29 14:26:37,,
54,2.0,,42.0,,10163879326230237,The Cardinal Volleyball team took down Loomis in their first contest of the day in the Axtell tournament! They won in two sets! Way to go ladies! Keep those wins coming!! #ProudToBeACardinal,https://facebook.com/story.php?story_fbid=10163879326230237&id=303269020236,,0.0,The Cardinal Volleyball team took down Loomis in their first contest of the day in the Axtell tournament! They won in two sets! Way to go ladies! Keep those wins coming!! #ProudToBeACardinal,2020-08-29 13:59:39,,
55,0.0,,4.0,https://m.youtube.com/channel/UC6ctWKGmKDWbkWIjH-FFXPQ,10163878606665237,Axtell will only be live streaming the main gym. Loomis will be streaming the game vs Alma on their YouTube live channel. I will post updates on the rest of the games as I get information. https://m.youtube.com/channel/UC6ctWKGmKDWbkWIjH-FFXPQ here is the link for game 1. #ProudToBeACardinal #ShareToBeAware,https://facebook.com/story.php?story_fbid=10163878606665237&id=303269020236,,0.0,Axtell will only be live streaming the main gym. Loomis will be streaming the game vs Alma on their YouTube live channel. I will post updates on the rest of the games as I get information. https://m.youtube.com/channel/UC6ctWKGmKDWbkWIjH-FFXPQ here is the link for game 1. #ProudToBeACardinal #ShareToBeAware,2020-08-29 11:38:16,,
56,0.0,,19.0,,10163876516880237,The Cardinal football team lost a tough one to Amherst 45-12. They fought hard until the end! #ProudToBeACardinal,https://facebook.com/story.php?story_fbid=10163876516880237&id=303269020236,,0.0,The Cardinal football team lost a tough one to Amherst 45-12. They fought hard until the end! #ProudToBeACardinal,2020-08-28 22:09:20,,
57,0.0,,1.0,,10163876274595237,At the end of the first half the Cardinal football team is down 38-6. Keep fighting boys! #ProudToBeACardinal,https://facebook.com/story.php?story_fbid=10163876274595237&id=303269020236,,0.0,At the end of the first half the Cardinal football team is down 38-6. Keep fighting boys! #ProudToBeACardinal,2020-08-28 20:59:38,,
58,4.0,,45.0,,10163876203020237,The Saints took down both Gothenburg and Alliance today!! Way to go ladies! Keep it going into the next game!! #Saints,https://facebook.com/story.php?story_fbid=10163876203020237&id=303269020236,,0.0,The Saints took down both Gothenburg and Alliance today!! Way to go ladies! Keep it going into the next game!! #Saints,2020-08-28 20:45:19,,
59,0.0,https://scontent-atl3-1.xx.fbcdn.net/v/t1.0-9/118579436_10163873798820237_7411421608322944549_o.png?_nc_cat=107&_nc_sid=2d5d41&_nc_ohc=6UVu8bbmtwoAX_7Jlzo&_nc_ht=scontent-atl3-1.xx&oh=ed22f4a8329d5171eca2c24304056fec&oe=5F834717,9.0,https://striv.tv/channel/amherst/,10163873798810237,"If you are unable to attend the football game in Amherst tonight you can still catch the game at this link: https://striv.tv/channel/amherst/

Below are the guidelines you will need to follow if you are attending the game in person! #ProudToBeACardinal #ShareToBeAware",,,0.0,"If you are unable to attend the football game in Amherst tonight you can still catch the game at this link: https://striv.tv/channel/amherst/

Below are the guidelines you will need to follow if you are attending the game in person! #ProudToBeACardinal #ShareToBeAware",2020-08-28 11:13:56,,
60,0.0,https://scontent-atl3-1.xx.fbcdn.net/v/t1.0-9/fr/cp0/e15/q65/118598874_10163873760735237_7310280656413173694_o.jpg?_nc_cat=108&_nc_sid=2d5d41&_nc_ohc=thunVIKKyQQAX-6BChj&_nc_ht=scontent-atl3-1.xx&tp=14&oh=79986da836c8a1936ce21b4f5bcb5873&oe=5F851280,19.0,,10163873760725237,"Please help the ATA support the Kronhofman/Lynch family during the home opener volleyball game next Thursday, September 3, by coming to the concession stand and buying a pulled pork sandwich meal! #ProudToBeACardinal #ShareToBeAware",,,0.0,"Please help the ATA support the Kronhofman/Lynch family during the home opener volleyball game next Thursday, September 3, by coming to the concession stand and buying a pulled pork sandwich meal! #ProudToBeACardinal #ShareToBeAware",2020-08-28 11:03:37,,
61,0.0,,0.0,https://almacrosscountry.itemorder.com/sale,10163865285710237,Alma Cross Country clothing for sale! Here is the link for you Alma CC clothing. Just go to https://almacrosscountry.itemorder.com/sale to order! Sale ends Monday August 31st at 11:59PM. Thank you for your support! #ProudToBeACardinal,https://facebook.com/story.php?story_fbid=10163865285710237&id=303269020236,,0.0,Alma Cross Country clothing for sale! Here is the link for you Alma CC clothing. Just go to https://almacrosscountry.itemorder.com/sale to order! Sale ends Monday August 31st at 11:59PM. Thank you for your support! #ProudToBeACardinal,2020-08-26 13:52:21,,
62,0.0,https://scontent-atl3-1.xx.fbcdn.net/v/t1.0-9/118450806_10163864495525237_6652048045064972761_o.png?_nc_cat=109&_nc_sid=8024bb&_nc_ohc=2zpd0hhrhVsAX90yuup&_nc_ht=scontent-atl3-1.xx&oh=cc9bfac143d801075cce3415dab9aa6e&oe=5F81F856,2.0,,10163864495750237,Here is information related to the softball triangular at Gothenburg on Friday! #ProudToBeACardinal #ShareToBeAware,https://facebook.com/story.php?story_fbid=10163864495750237&id=303269020236,,0.0,Here is information related to the softball triangular at Gothenburg on Friday! #ProudToBeACardinal #ShareToBeAware,2020-08-26 09:53:37,,
63,9.0,,62.0,,10163862516900237,The Lady Saints Softball team beat both Chase County and Minden in three innings tonight! They won over Chase County 12-0 and over Minden 13-1!! Way to go ladies!! Keep it going! #Saints,https://facebook.com/story.php?story_fbid=10163862516900237&id=303269020236,,0.0,The Lady Saints Softball team beat both Chase County and Minden in three innings tonight! They won over Chase County 12-0 and over Minden 13-1!! Way to go ladies!! Keep it going! #Saints,2020-08-25 21:09:25,,
64,0.0,https://scontent-atl3-1.xx.fbcdn.net/v/t1.0-9/118299975_10163861013825237_7064352800735721909_o.png?_nc_cat=103&_nc_sid=2d5d41&_nc_ohc=AzUK6U7KsR0AX9YR1Xr&_nc_oc=AQlh9X7vMxtv-1Y1uMjcZWkfMuOYpktPbzsvrBfs7-u9AkGhyR7CN8ERN9UkeyMF0lU&_nc_ht=scontent-atl3-1.xx&oh=3785fb9a1622046c9b504aea04f3065c&oe=5F830643,0.0,,10163861013820237,"Just a reminder that Two Rivers Public Health Department will be administering flu shots to students at Alma Public Schools on Friday, September 11. Please complete one entire packet for EACH student you want to get their flu shot. The completed packet must be returned by August 28. On another note, we will not restrain students in order to administer the shot. If your child comes to get their shot and refuses they will be sent back to class unless you, as the parent, want to come to school to restrain your child. We are excited to provide this opportunity for our students!! Share to be aware! #ProudToBeACardinal",,,0.0,"Just a reminder that Two Rivers Public Health Department will be administering flu shots to students at Alma Public Schools on Friday, September 11. Please complete one entire packet for EACH student you want to get their flu shot. The completed packet must be returned by August 28. On another note, we will not restrain students in order to administer the shot. If your child comes to get their shot and refuses they will be sent back to class unless you, as the parent, want to come to school to restrain your child. We are excited to provide this opportunity for our students!! Share to be aware! #ProudToBeACardinal",2020-08-25 14:17:03,,
65,1.0,https://scontent-atl3-1.xx.fbcdn.net/v/t1.0-9/118574099_10163856077035237_3875983962405307011_o.png?_nc_cat=106&_nc_sid=8024bb&_nc_ohc=zruNgHSfGHIAX8klsbD&_nc_ht=scontent-atl3-1.xx&oh=56d4f56736f06a0d85e4296b390089a3&oe=5F853CEF,6.0,,10163856077295237,Please review the following information if you plan to attend the football game in Amherst or the volleyball tournament in Axtell this week. Please note that Axtell will be limiting attendance to the volleyball tournament. #ProudToBeACardinal #ShareToBeAware,https://facebook.com/story.php?story_fbid=10163856077295237&id=303269020236,,0.0,Please review the following information if you plan to attend the football game in Amherst or the volleyball tournament in Axtell this week. Please note that Axtell will be limiting attendance to the volleyball tournament. #ProudToBeACardinal #ShareToBeAware,2020-08-24 10:01:01,,
66,4.0,,43.0,,10163848500760237,The Saints are bringing home 3rd place after beating Lexington in their final contest of the day!! Way to represent!! #Saints,https://facebook.com/story.php?story_fbid=10163848500760237&id=303269020236,,0.0,The Saints are bringing home 3rd place after beating Lexington in their final contest of the day!! Way to represent!! #Saints,2020-08-22 17:58:26,,
67,0.0,,17.0,,10163848445405237,"The Saints beat Alliance and lost to Scottsbluff, but there is still more softball to play today!!! Get the next one ladies! #Saints",https://facebook.com/story.php?story_fbid=10163848445405237&id=303269020236,,0.0,"The Saints beat Alliance and lost to Scottsbluff, but there is still more softball to play today!!! Get the next one ladies! #Saints",2020-08-22 17:44:38,,
68,1.0,,39.0,,10163844775385237,"The softball team kicked off their season tonight against Chadron!! The JV lost 10-3, and the Varsity won 8-1!! Way to go ladies! You can check them out again on Saturday in Lexington! #ProudToBeACardinal",https://facebook.com/story.php?story_fbid=10163844775385237&id=303269020236,,0.0,"The softball team kicked off their season tonight against Chadron!! The JV lost 10-3, and the Varsity won 8-1!! Way to go ladies! You can check them out again on Saturday in Lexington! #ProudToBeACardinal",2020-08-21 21:25:07,,
69,0.0,,4.0,https://www.almacardinals.org/article/291186?org=alma-public-schools,10163838235290237,Activity Guidelines,https://facebook.com/story.php?story_fbid=10163838235290237&id=303269020236,"ALMACARDINALS.ORG
Activity Guidelines",9.0,"Activity Guidelines

ALMACARDINALS.ORG
Activity Guidelines",2020-08-20 13:02:44,,
70,2.0,https://scontent-atl3-1.xx.fbcdn.net/v/t1.0-9/117931397_10163834437195237_1136142794809010600_n.png?_nc_cat=103&_nc_sid=2d5d41&_nc_ohc=4dkKjV9AqYMAX_7Jv2V&_nc_ht=scontent-atl3-1.xx&oh=ca31a011e4466a26f5d882ba4a3f652d&oe=5F8379FD,8.0,,10163834437190237,"Things are heating up and getting started this week for activities!! Here's the lowdown:

Thursday: Volleyball Sports Drink Scrimmage 4-6:30 PM
Friday: Softball in Stamford vs Chadron 4:30/5:30 PM
Football Sports Drink Scrimmage 7 PM
Saturday: Softball Tournament @ Lexington 9 AM

If possible, powdered mixes are preferred for the scrimmages! #ProudToBeACardinal #ShareToBeAware",,,0.0,"Things are heating up and getting started this week for activities!! Here's the lowdown:

Thursday: Volleyball Sports Drink Scrimmage 4-6:30 PM
Friday: Softball in Stamford vs Chadron 4:30/5:30 PM
Football Sports Drink Scrimmage 7 PM
Saturday: Softball Tournament @ Lexington 9 AM

If possible, powdered mixes are preferred for the scrimmages! #ProudToBeACardinal #ShareToBeAware",2020-08-19 16:00:38,,
71,1.0,https://scontent-atl3-1.xx.fbcdn.net/v/t1.0-9/117595146_10163834350870237_8972896175449471928_o.png?_nc_cat=103&_nc_sid=2d5d41&_nc_ohc=o24cmO0vovcAX95w01b&_nc_ht=scontent-atl3-1.xx&oh=0ba219985447b1640124aceb25db301f&oe=5F840E28,5.0,,10163834350865237,"It's that time of year again!!! Booster Button pictures will be taken during lunch tomorrow and Friday, August 20 and 21. Order forms were sent home with 5th and 6th grade students! Students in grades 7-12 can pick an order form up in the office. A copy of the order form is below! Buttons should be here by next Thursday if all goes as planned! #ProudToBeACardinal #ShareToBeAware",,,0.0,"It's that time of year again!!! Booster Button pictures will be taken during lunch tomorrow and Friday, August 20 and 21. Order forms were sent home with 5th and 6th grade students! Students in grades 7-12 can pick an order form up in the office. A copy of the order form is below! Buttons should be here by next Thursday if all goes as planned! #ProudToBeACardinal #ShareToBeAware",2020-08-19 15:28:30,,
72,0.0,https://scontent-atl3-1.xx.fbcdn.net/v/t1.0-9/fr/cp0/e15/q65/117628858_10163833824995237_4170802786183876286_o.jpg?_nc_cat=111&_nc_sid=2d5d41&_nc_ohc=_R3keWbgNM0AX-exIuF&_nc_ht=scontent-atl3-1.xx&tp=14&oh=51ae314d8cc9add9f2f23cf7cbdccbe1&oe=5F8388BF,11.0,,10163833824985237,"Two Rivers Public Health Department will be administering flu shots to students at Alma Public Schools on Friday, September 11. Please complete one entire packet for EACH student you want to get their flu shot. The completed packet must be returned by August 28. On another note, we will not restrain students in order to administer the shot. If your child comes to get their shot and refuses they will be sent back to class unless you, as the parent, want to come to school to restrain your child. We are excited to provide this opportunity for our students!! Share to be aware! #ProudToBeACardinal",,,0.0,"Two Rivers Public Health Department will be administering flu shots to students at Alma Public Schools on Friday, September 11. Please complete one entire packet for EACH student you want to get their flu shot. The completed packet must be returned by August 28. On another note, we will not restrain students in order to administer the shot. If your child comes to get their shot and refuses they will be sent back to class unless you, as the parent, want to come to school to restrain your child. We are excited to provide this opportunity for our students!! Share to be aware! #ProudToBeACardinal",2020-08-19 12:59:24,,
73,0.0,https://scontent-atl3-1.xx.fbcdn.net/v/t1.0-9/117876043_10163833670270237_2263531455212636374_n.png?_nc_cat=110&_nc_sid=2d5d41&_nc_ohc=IXX447bJ0xMAX9SypWO&_nc_ht=scontent-atl3-1.xx&oh=831c7cf6bfe366ffbe5de1f4adc25ce2&oe=5F83CDB2,5.0,,10163833670260237,,,,0.0,,2020-08-19 12:06:40,,
74,0.0,https://scontent-atl3-1.xx.fbcdn.net/v/t1.0-9/117647699_10163805482740237_8142389054101694975_n.png?_nc_cat=105&_nc_sid=2d5d41&_nc_ohc=tiFOrKOJhnUAX_IvLsM&_nc_ht=scontent-atl3-1.xx&oh=0bc0f36d0ee2464f27668b79a5298a83&oe=5F8260E9,23.0,,10163805482735237,,,,0.0,,2020-08-12 18:36:50,,
75,3.0,,37.0,https://www.teamjackfoundation.org/small-town-superstar-fundraisers,10163801182030237,There really aren’t a lot of words needed to say how amazingly proud we are of these boys! #ProudToBeACardinal,https://facebook.com/story.php?story_fbid=10163801182030237&id=303269020236,"TEAMJACKFOUNDATION.ORG
Small Town Superstar Fundraisers",0.0,"There really aren’t a lot of words needed to say how amazingly proud we are of these boys! #ProudToBeACardinal

TEAMJACKFOUNDATION.ORG
Small Town Superstar Fundraisers",2020-08-11 17:47:40,,
76,0.0,,7.0,https://almafb2020.itemorder.com/sale,10163800815555237,Alma Football clothing for sale!! Here is the link for your Alma Football clothing. Just go to https://almafb2020.itemorder.com/sale to order. Ends August 23rd. Thanks for your support! #ProudToBeACardinal,https://facebook.com/story.php?story_fbid=10163800815555237&id=303269020236,,0.0,Alma Football clothing for sale!! Here is the link for your Alma Football clothing. Just go to https://almafb2020.itemorder.com/sale to order. Ends August 23rd. Thanks for your support! #ProudToBeACardinal,2020-08-11 16:27:25,,
77,0.0,,3.0,http://FANCLOTH.SHOP/AFAAF,10163797813095237,ALMA VOLLEYBALL Fan Cloth fundraiser! Here is the link for the Alma Volleyball clothing. It is shipped directly to you! Just go to FANCLOTH.SHOP/AFAAF. Ends August 17th. Thanks for your support. GBR!!,https://facebook.com/story.php?story_fbid=10163797813095237&id=303269020236,,0.0,ALMA VOLLEYBALL Fan Cloth fundraiser! Here is the link for the Alma Volleyball clothing. It is shipped directly to you! Just go to FANCLOTH.SHOP/AFAAF. Ends August 17th. Thanks for your support. GBR!!,2020-08-10 22:00:35,,
78,0.0,https://scontent-atl3-1.xx.fbcdn.net/v/t1.0-9/117444697_10163796647285237_403939031552527107_n.png?_nc_cat=108&_nc_sid=2d5d41&_nc_ohc=BTn1myeL2FgAX_8labE&_nc_ht=scontent-atl3-1.xx&oh=a6de5e7c406bb1e8fd1d1627cc25e87b&oe=5F854E7D,5.0,,10163796647280237,"Just a reminder to 7th grade students, new students, and their parents: There is an orientation meeting tomorrow, Tuesday, August 11, at 6:30 PM in the commons area! Don't miss it!! #ProudToBeACardinal #ShareToBeAware",,,0.0,"Just a reminder to 7th grade students, new students, and their parents: There is an orientation meeting tomorrow, Tuesday, August 11, at 6:30 PM in the commons area! Don't miss it!! #ProudToBeACardinal #ShareToBeAware",2020-08-10 17:06:13,,
79,0.0,https://scontent-atl3-1.xx.fbcdn.net/v/t1.0-9/fr/cp0/e15/q65/117336943_10163793304085237_8866787830433526077_n.jpg?_nc_cat=100&_nc_sid=2d5d41&_nc_ohc=ipXiB2flRn4AX_agb8R&_nc_ht=scontent-atl3-1.xx&tp=14&oh=6da67d8392bf8cc3714ee94d743dd506&oe=5F81A4C8,1.0,,10163793304075237,"Important Reminder: All beginning of the year paperwork (handbook forms, computer contracts, and Acceptable Use policies) that were mailed to you need to be returned to the school before your student can use a school computer. They can be dropped off in the office during office hours. Questions, please let us know at the school.",,,0.0,"Important Reminder: All beginning of the year paperwork (handbook forms, computer contracts, and Acceptable Use policies) that were mailed to you need to be returned to the school before your student can use a school computer. They can be dropped off in the office during office hours. Questions, please let us know at the school.",2020-08-09 21:19:05,,
80,2.0,,11.0,https://covidactnow.org/us/ne/county/harlan_county?s=830154,10163781679090237,,https://facebook.com/story.php?story_fbid=10163781679090237&id=303269020236,"COVIDACTNOW.ORG
America’s COVID warning system",0.0,"COVIDACTNOW.ORG
America’s COVID warning system",2020-08-07 11:47:39,,
81,0.0,https://scontent-atl3-1.xx.fbcdn.net/v/t1.0-9/116909455_10163776714655237_2595750636490259387_n.png?_nc_cat=104&_nc_sid=2d5d41&_nc_ohc=I4XGqgGWReIAX_XZspy&_nc_ht=scontent-atl3-1.xx&oh=5cab0543e8c17851c0c31fe42d7889be&oe=5F835C20,33.0,,10163776714645237,Congratulations to the following students who will be the 2020 One Act Cast!! This year they will be performing Shrek!!! #ProudToBeACardinal,,,0.0,Congratulations to the following students who will be the 2020 One Act Cast!! This year they will be performing Shrek!!! #ProudToBeACardinal,2020-08-06 09:40:53,,
82,0.0,,11.0,https://www.almacardinals.org/article/280730?org=alma-public-schools,10163768573525237,APS Question & Answer,https://facebook.com/story.php?story_fbid=10163768573525237&id=303269020236,"ALMACARDINALS.ORG
APS Question & Answer",8.0,"APS Question & Answer

ALMACARDINALS.ORG
APS Question & Answer",2020-08-04 15:58:15,,
83,2.0,,66.0,,10163767728740237,APS wants to send a thank you out to Harlan County Health Systems!! They donated 500 cloth masks to the school today!! We appreciate living in such a giving community!! #ProudToBeACardinal,https://facebook.com/story.php?story_fbid=10163767728740237&id=303269020236,,0.0,APS wants to send a thank you out to Harlan County Health Systems!! They donated 500 cloth masks to the school today!! We appreciate living in such a giving community!! #ProudToBeACardinal,2020-08-04 12:26:08,,
