,comments,image,likes,link,post_id,post_text,post_url,shared_text,shares,text,time,video,video_thumbnail
126,0.0,https://scontent-atl3-1.xx.fbcdn.net/v/t1.0-9/fr/cp0/e15/q65/89606647_209909723694184_366391642703265792_o.jpg?_nc_cat=106&_nc_sid=2d5d41&_nc_ohc=6DlsttdkS0kAX_gRvqs&_nc_ht=scontent-atl3-1.xx&tp=14&oh=1827ebc1d9148487d7bd95d58d0e6a59&oe=5F82EBFE,15.0,,209909717027518,BHS Seniors attending a Morrill County Commissioner’s Meeting during County Government Day. It’s a GREAT day to be a Bulldog! #bpsbulldogpride,,,0.0,BHS Seniors attending a Morrill County Commissioner’s Meeting during County Government Day. It’s a GREAT day to be a Bulldog! #bpsbulldogpride,2020-03-10 15:18:50,,
127,1.0,https://scontent-atl3-1.xx.fbcdn.net/v/t1.0-9/fr/cp0/e15/q65/89328538_209400887078401_6698927110808928256_o.jpg?_nc_cat=110&_nc_sid=2d5d41&_nc_ohc=-VBeLv4k0w4AX-IpCE3&_nc_ht=scontent-atl3-1.xx&tp=14&oh=67e9d97ad2fab7f0c115ee36710bd0cf&oe=5F83CE0E,28.0,,209400880411735,Our AWESOME school under a really cool full moon! It’s always a GREAT day to be a Bulldog! #bpsbulldogpride,,,0.0,Our AWESOME school under a really cool full moon! It’s always a GREAT day to be a Bulldog! #bpsbulldogpride,2020-03-09 23:10:06,,
128,0.0,,9.0,,208450273840129,"After learning about Viking Longships and citing textual evidence to refute the claim that all Vikings were cruel and ruthless plunderers, Rodak’s 6B students designed and built their own boats with recycled materials and custom- designed sails.

The boats were tested in the water tray and assessed against the success criteria. Awards were given out for best use of resources, best technical expertise, best visual effects, best individual work, and most stable boat. It’s a GREAT day to be a Bulldog! #bpsbulldogpride",https://facebook.com/story.php?story_fbid=208450273840129&id=109779253707232,,0.0,"After learning about Viking Longships and citing textual evidence to refute the claim that all Vikings were cruel and ruthless plunderers, Rodak’s 6B students designed and built their own boats with recycled materials and custom- designed sails.

The boats were tested in the water tray and assessed against the success criteria. Awards were given out for best use of resources, best technical expertise, best visual effects, best individual work, and most stable boat. It’s a GREAT day to be a Bulldog! #bpsbulldogpride",2020-03-08 14:43:14,,
129,0.0,https://scontent-atl3-1.xx.fbcdn.net/v/t1.0-9/fr/cp0/e15/q65/89148178_208289697189520_4778619216695656448_o.jpg?_nc_cat=108&_nc_sid=2d5d41&_nc_ohc=POXxNLkdDnYAX9rB8ot&_nc_ht=scontent-atl3-1.xx&tp=14&oh=95957504cb1c4cdb40c6969153287349&oe=5F837361,19.0,,208289693856187,Speech team is WTC Runners-up! It’s a GREAT day to be a Bulldog! #bpsbulldogpride,,,0.0,Speech team is WTC Runners-up! It’s a GREAT day to be a Bulldog! #bpsbulldogpride,2020-03-08 09:55:56,,
130,0.0,https://scontent-atl3-1.xx.fbcdn.net/v/t1.0-9/fr/cp0/e15/q65/89166474_206444720707351_8363896725273837568_o.jpg?_nc_cat=106&_nc_sid=9e2e56&_nc_ohc=33S2poVoGmcAX8G7OLt&_nc_ht=scontent-atl3-1.xx&tp=14&oh=120d79283553c73a2a450004a54ebfb4&oe=5F854604,11.0,,206444910707332,Today the Kindergarteners and 1st grader got to explore playing a guiro and the boomwhackers. The 1st graders even read two part rhythm patterns. It’s a GREAT day to be a Bulldog! #bpsbulldogpride,https://facebook.com/story.php?story_fbid=206444910707332&id=109779253707232,,0.0,Today the Kindergarteners and 1st grader got to explore playing a guiro and the boomwhackers. The 1st graders even read two part rhythm patterns. It’s a GREAT day to be a Bulldog! #bpsbulldogpride,2020-03-05 16:45:57,,
131,0.0,https://scontent-atl3-1.xx.fbcdn.net/v/t1.0-9/fr/cp0/e15/q65/84211499_205756214109535_423945115002732544_o.jpg?_nc_cat=107&_nc_sid=2d5d41&_nc_ohc=zBIHDJ9mv_AAX93wi0O&_nc_ht=scontent-atl3-1.xx&tp=14&oh=c0719b8862353b5ce86df78dc8f08ff8&oe=5F826EDF,10.0,,205756204109536,"Nate, 7th Grader, working on replacing his lap top hard drive and boosting his RAM in JH Computers. It’s a GREAT day to be a Bulldog! #bpsbulldogpride",,,0.0,"Nate, 7th Grader, working on replacing his lap top hard drive and boosting his RAM in JH Computers. It’s a GREAT day to be a Bulldog! #bpsbulldogpride",2020-03-04 16:33:38,,
132,0.0,https://scontent-atl3-1.xx.fbcdn.net/v/t1.0-9/fr/cp0/e15/q65/88265960_205237600828063_5486905086682595328_o.jpg?_nc_cat=110&_nc_sid=9e2e56&_nc_ohc=xCfLHavGef4AX-I0N-t&_nc_ht=scontent-atl3-1.xx&tp=14&oh=5fc460ab2d5325f108eaff913e77d2c6&oe=5F82D7A8,11.0,,205237840828039,JH Swing Choir. It’s a GREAT day to be a Bulldog! #bpsbulldogpride,https://facebook.com/story.php?story_fbid=205237840828039&id=109779253707232,,0.0,JH Swing Choir. It’s a GREAT day to be a Bulldog! #bpsbulldogpride,2020-03-03 23:20:21,,
133,0.0,https://scontent-atl3-1.xx.fbcdn.net/v/t1.0-9/fr/cp0/e15/q65/88240555_205236470828176_5355554498460778496_o.jpg?_nc_cat=102&_nc_sid=2d5d41&_nc_ohc=YbSr3WjpdNAAX9fPA2W&_nc_ht=scontent-atl3-1.xx&tp=14&oh=387789ba2e657fc52fea67c1517627f7&oe=5F8452B0,7.0,,205236467494843,Vocal Jazz group. It’s a GREAT day to be a Bulldog! #bpsbulldogpride,,,0.0,Vocal Jazz group. It’s a GREAT day to be a Bulldog! #bpsbulldogpride,2020-03-03 23:18:30,,
134,0.0,https://scontent-atl3-1.xx.fbcdn.net/v/t1.0-9/fr/cp0/e15/q65/89210629_205219217496568_6455135008922271744_o.jpg?_nc_cat=110&_nc_sid=9e2e56&_nc_ohc=i-MTBt3IVlAAX9JuUFi&_nc_ht=scontent-atl3-1.xx&tp=14&oh=627f3fdf511728d27637b9bef4ba052e&oe=5F8548E1,7.0,,205219287496561,Solos by Sarah and Leyla. It’s a GREAT day to be a Bulldog! #bpsbulldogpride,https://facebook.com/story.php?story_fbid=205219287496561&id=109779253707232,,0.0,Solos by Sarah and Leyla. It’s a GREAT day to be a Bulldog! #bpsbulldogpride,2020-03-03 22:49:05,,
135,0.0,https://scontent-atl3-1.xx.fbcdn.net/v/t1.0-9/fr/cp0/e15/q65/89246478_205217800830043_9171216642661679104_o.jpg?_nc_cat=110&_nc_sid=9e2e56&_nc_ohc=-FciRkzDB-MAX8PJyl2&_nc_ht=scontent-atl3-1.xx&tp=14&oh=5b17c016519277606e785b04d758557d&oe=5F82F226,12.0,,205217984163358,HS Choir!! It’s a GREAT day to be a Bulldog! #bpsbulldogpride,https://facebook.com/story.php?story_fbid=205217984163358&id=109779253707232,,0.0,HS Choir!! It’s a GREAT day to be a Bulldog! #bpsbulldogpride,2020-03-03 22:46:30,,
136,0.0,,12.0,,205200807498409,The Women’s Acapella group. It’s a GREAT day to be a Bulldog! #bpsbulldogpride,,,0.0,The Women’s Acapella group. It’s a GREAT day to be a Bulldog! #bpsbulldogpride,2020-03-03 22:05:54,https://video-atl3-1.xx.fbcdn.net/v/t42.9040-2/89102228_3088112551208428_7030773979363147776_n.mp4?_nc_cat=110&_nc_sid=985c63&efg=eyJ2ZW5jb2RlX3RhZyI6ImxlZ2FjeV9zZCJ9&_nc_ohc=mhc5jlVIER4AX8pN4U_&_nc_ht=video-atl3-1.xx&oh=45d0c9b9400e3ce457b019eaa57eb1f6&oe=5F5E0B48,
137,0.0,,6.0,,205183240833499,If you didn’t make it to Supper & Sounds concert tonight...a little of what you missed. It’s a GREAT day to be a Bulldog! #bpsbulldogpride,,,0.0,If you didn’t make it to Supper & Sounds concert tonight...a little of what you missed. It’s a GREAT day to be a Bulldog! #bpsbulldogpride,2020-03-03 21:29:20,https://video-atl3-1.xx.fbcdn.net/v/t42.9040-2/89110607_792169431266207_2701952428286148608_n.mp4?_nc_cat=110&_nc_sid=985c63&efg=eyJ2ZW5jb2RlX3RhZyI6ImxlZ2FjeV9zZCJ9&_nc_ohc=u1UJq03bogEAX_r6DY_&_nc_ht=video-atl3-1.xx&oh=a645afda4993dde0ff9f1f5a746c3e72&oe=5F5E0043,
138,0.0,,5.0,,205178287500661,The HS BAND!! It’s a GREAT day to be a Bulldog! #bpsbulldogpride,,,0.0,The HS BAND!! It’s a GREAT day to be a Bulldog! #bpsbulldogpride,2020-03-03 21:23:18,https://video-atl3-1.xx.fbcdn.net/v/t42.9040-2/89206680_195959784831289_5210420350868783104_n.mp4?_nc_cat=108&_nc_sid=985c63&efg=eyJ2ZW5jb2RlX3RhZyI6ImxlZ2FjeV9zZCJ9&_nc_ohc=Hv1av8yY2c8AX9Zu520&_nc_ht=video-atl3-1.xx&oh=544e1c68b30410ae95fcbac9a126f85a&oe=5F5E063F,
139,0.0,https://scontent-atl3-1.xx.fbcdn.net/v/t1.0-9/fr/cp0/e15/q65/84505632_205163394168817_1797537091475734528_o.jpg?_nc_cat=106&_nc_sid=9e2e56&_nc_ohc=FUZNLfY1YJcAX9ze_CM&_nc_ht=scontent-atl3-1.xx&tp=14&oh=e6d407b0b5a67e6a7bee9a0ce17a829c&oe=5F833DC9,14.0,,205163824168774,JH band getting ready to kick off the “sounds “ part of Supper & Sounds this evening. It’s a GREAT day to be a Bulldog! #bpsbulldogpride,https://facebook.com/story.php?story_fbid=205163824168774&id=109779253707232,,0.0,JH band getting ready to kick off the “sounds “ part of Supper & Sounds this evening. It’s a GREAT day to be a Bulldog! #bpsbulldogpride,2020-03-03 20:50:12,,
140,0.0,https://scontent-atl3-1.xx.fbcdn.net/v/t1.0-9/fr/cp0/e15/q65/87460065_205040847514405_1459109491210452992_o.jpg?_nc_cat=107&_nc_sid=9e2e56&_nc_ohc=WxBZA74XIGgAX9-9PAg&_nc_ht=scontent-atl3-1.xx&tp=14&oh=2ee203238bad097e196fa4f5b8f4ee70&oe=5F8498F8,3.0,,205040924181064,"Becca Lang and Caitlyn Amateis attended the first annual Portfolio Days at West Nebraska Community College on Monday, March 2. It’s a GREAT day to be a Bulldog! #bpsbulldogpride",https://facebook.com/story.php?story_fbid=205040924181064&id=109779253707232,,0.0,"Becca Lang and Caitlyn Amateis attended the first annual Portfolio Days at West Nebraska Community College on Monday, March 2. It’s a GREAT day to be a Bulldog! #bpsbulldogpride",2020-03-03 16:09:44,,
141,0.0,https://scontent-atl3-1.xx.fbcdn.net/v/t1.0-9/fr/cp0/e15/q65/88013846_204546567563833_6285307792970481664_o.jpg?_nc_cat=109&_nc_sid=9e2e56&_nc_ohc=YkV1tLQTmUMAX8exGvM&_nc_ht=scontent-atl3-1.xx&tp=14&oh=87333947ab019ca46e3fd6b2dd261bfd&oe=5F82084A,13.0,,204546807563809,We really liked green eggs and ham!!,https://facebook.com/story.php?story_fbid=204546807563809&id=109779253707232,,0.0,We really liked green eggs and ham!!,2020-03-03 01:53:17,,
142,0.0,https://scontent-atl3-1.xx.fbcdn.net/v/t1.0-9/fr/cp0/e15/q65/89352148_204545594230597_285025415720861696_o.jpg?_nc_cat=105&_nc_sid=9e2e56&_nc_ohc=sJqp2UW3-i0AX96rLVo&_nc_ht=scontent-atl3-1.xx&tp=14&oh=c25788fd44d62bea59cac8439e641eb6&oe=5F833314,14.0,,204545920897231,"Dr. Seuss day! We celebrated by making Thing 1, Thing 2 hats, reading and eating green eggs and ham. Our small group reading was spent reading Dr.Seuss books and enjoying coloring and art projects to go with our books! It’s a GREAT day to be a Bulldog! #bpsbulldogpride",https://facebook.com/story.php?story_fbid=204545920897231&id=109779253707232,,0.0,"Dr. Seuss day! We celebrated by making Thing 1, Thing 2 hats, reading and eating green eggs and ham. Our small group reading was spent reading Dr.Seuss books and enjoying coloring and art projects to go with our books! It’s a GREAT day to be a Bulldog! #bpsbulldogpride",2020-03-03 01:51:51,,
143,0.0,https://scontent-atl3-1.xx.fbcdn.net/v/t1.0-9/fr/cp0/e15/q65/87951739_203066021045221_5431217150608015360_n.jpg?_nc_cat=109&_nc_sid=2d5d41&_nc_ohc=cWCoraL7wY8AX875VfH&_nc_ht=scontent-atl3-1.xx&tp=14&oh=413787bf9ba9fcc23dd13d9e3a1cd662&oe=5F8564EB,30.0,,203066017711888,Class C Champs at Mitchell Speech Invite today. It’s a GREAT day to be a Bulldog! #bpsbulldogpride,,,0.0,Class C Champs at Mitchell Speech Invite today. It’s a GREAT day to be a Bulldog! #bpsbulldogpride,2020-02-29 21:19:08,,
144,3.0,https://scontent-atl3-1.xx.fbcdn.net/v/t1.0-9/fr/cp0/e15/q65/88981926_202783007740189_6944511747361341440_o.jpg?_nc_cat=106&_nc_sid=9e2e56&_nc_ohc=ftLjceTNZbsAX83UAAU&_nc_ht=scontent-atl3-1.xx&tp=14&oh=fd7f14928008b5057a84371e6155bc46&oe=5F85242E,38.0,,202783207740169,The Lady Bulldogs lost a tough one in the C2-6 District Final Friday night marking the end of a very successful season. It’s a GREAT day to be a Bulldog! #bpsbulldogpride,https://facebook.com/story.php?story_fbid=202783207740169&id=109779253707232,,0.0,The Lady Bulldogs lost a tough one in the C2-6 District Final Friday night marking the end of a very successful season. It’s a GREAT day to be a Bulldog! #bpsbulldogpride,2020-02-29 10:49:25,,
145,0.0,https://scontent-atl3-1.xx.fbcdn.net/v/t1.0-9/fr/cp0/e15/q65/88128338_202736534411503_2677363491408445440_o.jpg?_nc_cat=101&_nc_sid=9e2e56&_nc_ohc=FFjX8-hFKrcAX9mfl3K&_nc_ht=scontent-atl3-1.xx&tp=14&oh=55eea362ba8a4c18b38483ddb2e47c00&oe=5F82CFDE,11.0,,202736734411483,"Ms. Vasquez's class experienced a wide-range of activities during Dr. Seuss's Birthday celebration (Read Across America). Students ate yummy snacks, made a Green Eggs and Ham booklet and created silly art sculptures! Fun day for all!! It’s a GREAT day to be a Bulldog! #bpsbulldogpride",https://facebook.com/story.php?story_fbid=202736734411483&id=109779253707232,,0.0,"Ms. Vasquez's class experienced a wide-range of activities during Dr. Seuss's Birthday celebration (Read Across America). Students ate yummy snacks, made a Green Eggs and Ham booklet and created silly art sculptures! Fun day for all!! It’s a GREAT day to be a Bulldog! #bpsbulldogpride",2020-02-29 09:32:07,,
146,0.0,,18.0,,202735551078268,Two very excited Bridgeport Staff members reading to Ms.Vasquez's First Grade class. Thanks for coming in and reading to us. We appreciate it!! It’s a GREAT day to be a Bulldog! #bpsbulldogpride,https://facebook.com/story.php?story_fbid=202735551078268&id=109779253707232,,0.0,Two very excited Bridgeport Staff members reading to Ms.Vasquez's First Grade class. Thanks for coming in and reading to us. We appreciate it!! It’s a GREAT day to be a Bulldog! #bpsbulldogpride,2020-02-29 09:29:56,,
147,0.0,https://scontent-atl3-1.xx.fbcdn.net/v/t1.0-9/fr/cp0/e15/q65/88958499_202162364468920_1650249812353744896_o.jpg?_nc_cat=102&_nc_sid=9e2e56&_nc_ohc=RugCXYAmaYEAX8R1BeL&_nc_ht=scontent-atl3-1.xx&tp=14&oh=e245a7d65f5bdac990be0a6e65613b88&oe=5F84CD42,11.0,,202162441135579,Kindergarten B say Good Luck Lady Bulldogs! It’s a GREAT day to be a Bulldog! #bpsbulldogpride,https://facebook.com/story.php?story_fbid=202162441135579&id=109779253707232,,0.0,Kindergarten B say Good Luck Lady Bulldogs! It’s a GREAT day to be a Bulldog! #bpsbulldogpride,2020-02-28 13:35:05,,
148,0.0,,3.0,http://nbcnebraskascottsbluff.com/,202149604470196,,https://facebook.com/story.php?story_fbid=202149604470196&id=109779253707232,"John Clanton NBC Nebraska
February 27 at 11:54 PM ·

Kimball and Bridgeport go the distance in the end Bulldogs defeat Longhorns 45-43 in overtime to claim the C2-12 Sub-District Championship. For all of your local sub-district scores you can log on to our website nbcnebraskascottsbluff.com",0.0,"John Clanton NBC Nebraska
February 27 at 11:54 PM ·

Kimball and Bridgeport go the distance in the end Bulldogs defeat Longhorns 45-43 in overtime to claim the C2-12 Sub-District Championship. For all of your local sub-district scores you can log on to our website nbcnebraskascottsbluff.com",2020-02-28 13:09:39,https://video-atl3-1.xx.fbcdn.net/v/t42.9040-2/88173874_595015394383583_8215140378358054912_n.mp4?_nc_cat=104&_nc_sid=985c63&efg=eyJ2ZW5jb2RlX3RhZyI6ImxlZ2FjeV9zZCJ9&_nc_ohc=ClxSZsNQL4sAX__pakT&_nc_ht=video-atl3-1.xx&oh=08627872c08a7401aaa583fda00ceb9d&oe=5F5E0A06,
149,0.0,https://scontent-atl3-1.xx.fbcdn.net/v/t1.0-9/fr/cp0/e15/q65/88962433_202021174483039_279453683496779776_o.jpg?_nc_cat=103&_nc_sid=2d5d41&_nc_ohc=bVcIcLhdDz4AX_89G8s&_nc_ht=scontent-atl3-1.xx&tp=14&oh=67a19037ebdceae44f02f3f19a3223bd&oe=5F84E585,7.0,,202021167816373,The boys basketball district final is set for Monday at 6:00 PM MTN at Maxwell vs. Doniphan-Trumbull. It’s a GREAT day to be a Bulldog! #bpsbulldogpride,,,0.0,The boys basketball district final is set for Monday at 6:00 PM MTN at Maxwell vs. Doniphan-Trumbull. It’s a GREAT day to be a Bulldog! #bpsbulldogpride,2020-02-28 09:28:20,,
150,0.0,,21.0,,201706384514518,AWESOME fan support at Bulldog Boys Basketball against Kimball. More games to go for both boys and girls. Let’s keep it rolling! It’s a GREAT day to be a Bulldog! #bpsbulldogpride,https://facebook.com/story.php?story_fbid=201706384514518&id=109779253707232,,0.0,AWESOME fan support at Bulldog Boys Basketball against Kimball. More games to go for both boys and girls. Let’s keep it rolling! It’s a GREAT day to be a Bulldog! #bpsbulldogpride,2020-02-27 23:53:34,,
151,0.0,https://scontent-atl3-1.xx.fbcdn.net/v/t1.0-9/fr/cp0/e15/q65/87772095_201647191187104_6547892184958369792_o.jpg?_nc_cat=106&_nc_sid=9e2e56&_nc_ohc=VP5YiJ0_orgAX-YAjyu&_nc_ht=scontent-atl3-1.xx&tp=14&oh=fbab53ea0148bbbc17ffaecb0bb2077c&oe=5F82AEF1,19.0,,201647284520428,Getting things going in Gering at the boys game. It’s a GREAT day to be a Bulldog! #bpsbulldogpride,https://facebook.com/story.php?story_fbid=201647284520428&id=109779253707232,,0.0,Getting things going in Gering at the boys game. It’s a GREAT day to be a Bulldog! #bpsbulldogpride,2020-02-27 21:36:52,,
152,1.0,https://scontent-atl3-1.xx.fbcdn.net/v/t1.0-9/fr/cp0/e15/q65/88339897_201550527863437_5770950734463893504_n.jpg?_nc_cat=101&_nc_sid=2d5d41&_nc_ohc=ZLEjfd8mRn8AX-qfaGQ&_nc_ht=scontent-atl3-1.xx&tp=14&oh=e8e220d8fbba0f50fe29f526b205cc35&oe=5F83C436,9.0,,201550524530104,Bulldog Boys Basketball takes on Kimball tonight at 7 PM in Gering in a sub district final and Bulldog Girls Basketball takes on GICC Friday night at North Platte Community College at 6 PM in a district final. Winner in the girls game goes to state. It’s a GREAT day to be a Bulldog! #bpsbulldogpride,,,0.0,Bulldog Boys Basketball takes on Kimball tonight at 7 PM in Gering in a sub district final and Bulldog Girls Basketball takes on GICC Friday night at North Platte Community College at 6 PM in a district final. Winner in the girls game goes to state. It’s a GREAT day to be a Bulldog! #bpsbulldogpride,2020-02-27 17:49:39,,
153,0.0,https://scontent-atl3-1.xx.fbcdn.net/v/t1.0-9/fr/cp0/e15/q65/88213253_201545971197226_6843678104368447488_o.jpg?_nc_cat=105&_nc_sid=9e2e56&_nc_ohc=4Ge38YXiHQcAX91OESU&_nc_ht=scontent-atl3-1.xx&tp=14&oh=2b147234c6c66d4684c4e212f06da8ae&oe=5F839AFA,3.0,,201546071197216,Advanced Biology students monitoring their plant growth experiments in the greenhouse. It’s a GREAT day to be a Bulldog! #bpsbulldogpride,https://facebook.com/story.php?story_fbid=201546071197216&id=109779253707232,,0.0,Advanced Biology students monitoring their plant growth experiments in the greenhouse. It’s a GREAT day to be a Bulldog! #bpsbulldogpride,2020-02-27 17:38:23,,
154,0.0,,16.0,,201522537866236,Kindergarten and 4B students reading together. It’s a GREAT day to be a Bulldog! #bpsbulldogpride,https://facebook.com/story.php?story_fbid=201522537866236&id=109779253707232,,0.0,Kindergarten and 4B students reading together. It’s a GREAT day to be a Bulldog! #bpsbulldogpride,2020-02-27 16:40:23,,
155,0.0,https://scontent-atl3-1.xx.fbcdn.net/v/t1.0-9/fr/cp0/e15/q65/87554452_201519901199833_8391794122704289792_o.jpg?_nc_cat=101&_nc_sid=9e2e56&_nc_ohc=gSuuL3KFJ6kAX9v-H0T&_nc_ht=scontent-atl3-1.xx&tp=14&oh=eecfca04e472c573b068f68e47cc7e8b&oe=5F82E41A,11.0,,201520021199821,"FFA students working with 3rd graders during FFA week creating biodegradable plastic, learning plant cycle of wheat and making and creating a tag for a cow. It’s a GREAT day to be a Bulldog! #bpsbulldogpride",https://facebook.com/story.php?story_fbid=201520021199821&id=109779253707232,,0.0,"FFA students working with 3rd graders during FFA week creating biodegradable plastic, learning plant cycle of wheat and making and creating a tag for a cow. It’s a GREAT day to be a Bulldog! #bpsbulldogpride",2020-02-27 16:36:55,,
156,0.0,https://scontent-atl3-1.xx.fbcdn.net/v/t1.0-9/fr/cp0/e15/q65/88102883_201481177870372_8790544822109732864_o.jpg?_nc_cat=102&_nc_sid=9e2e56&_nc_ohc=noh4zhC2F0cAX-2EIcj&_nc_ht=scontent-atl3-1.xx&tp=14&oh=49da1be0cced69c4e332548086073ff5&oe=5F8322AC,13.0,,201481821203641,"6B students in Mrs. Rodak's design catapults using limited supplies, then compete in teams to hit a target using Valentine candy as projectile. It’s a GREAT day to be a Bulldog! #bpsbulldogpride",https://facebook.com/story.php?story_fbid=201481821203641&id=109779253707232,,0.0,"6B students in Mrs. Rodak's design catapults using limited supplies, then compete in teams to hit a target using Valentine candy as projectile. It’s a GREAT day to be a Bulldog! #bpsbulldogpride",2020-02-27 15:26:32,,
157,0.0,https://scontent-atl3-1.xx.fbcdn.net/v/t1.0-9/fr/cp0/e15/q65/87901359_200862847932205_4316264522697408512_o.jpg?_nc_cat=110&_nc_sid=9e2e56&_nc_ohc=YCQPOprcdxoAX97X97v&_nc_ht=scontent-atl3-1.xx&tp=14&oh=5dc72fd979c20b3dff22b3e451b43030&oe=5F84883F,1.0,,200863287932161,Kindergarten math learning how to divide and share. Each person in their group had the same amount of candy hearts. It’s a GREAT day to be a Bulldog! #bpsbulldogpride,https://facebook.com/story.php?story_fbid=200863287932161&id=109779253707232,,0.0,Kindergarten math learning how to divide and share. Each person in their group had the same amount of candy hearts. It’s a GREAT day to be a Bulldog! #bpsbulldogpride,2020-02-26 18:00:55,,
158,0.0,https://scontent-atl3-1.xx.fbcdn.net/v/t1.0-9/fr/cp0/e15/q65/87841740_200862351265588_5478836380731703296_o.jpg?_nc_cat=101&_nc_sid=9e2e56&_nc_ohc=BSRcxVDKv80AX-6NIzv&_nc_ht=scontent-atl3-1.xx&tp=14&oh=2e2aa24b5df59b226934932a50dc2def&oe=5F817D45,23.0,,200862487932241,FFA students sharing with the kindergarten. They planted seeds and made and tagged cows. It’s a GREAT day to be a Bulldog! #bpsbulldogpride,https://facebook.com/story.php?story_fbid=200862487932241&id=109779253707232,,0.0,FFA students sharing with the kindergarten. They planted seeds and made and tagged cows. It’s a GREAT day to be a Bulldog! #bpsbulldogpride,2020-02-26 18:00:00,,
159,0.0,https://scontent-atl3-1.xx.fbcdn.net/v/t1.0-9/fr/cp0/e15/q65/87975821_200860917932398_2920143157834285056_o.jpg?_nc_cat=102&_nc_sid=9e2e56&_nc_ohc=id46GTSbPGYAX_22Ky0&_nc_ht=scontent-atl3-1.xx&tp=14&oh=2b1c3f8ffb93577624ad4af654627d66&oe=5F85651B,16.0,,200861211265702,Kindergarten math learning how to divide and share. Each person in their group had the same amount of candy hearts. It’s a GREAT day to be a Bulldog! #bpsbulldogpride,https://facebook.com/story.php?story_fbid=200861211265702&id=109779253707232,,0.0,Kindergarten math learning how to divide and share. Each person in their group had the same amount of candy hearts. It’s a GREAT day to be a Bulldog! #bpsbulldogpride,2020-02-26 17:57:36,,
160,2.0,https://scontent-atl3-1.xx.fbcdn.net/v/t1.0-9/fr/cp0/e15/q65/87284822_3447098458650179_5630030009918816256_n.jpg?_nc_cat=110&_nc_sid=110474&_nc_ohc=aNjWsoNa028AX9pXp49&_nc_ht=scontent-atl3-1.xx&tp=14&oh=ab554615e1736064faa1acb5b0c9d019&oe=5F850E2D,23.0,,199416678076822,Bridgeport alumni giving his all.,https://facebook.com/story.php?story_fbid=199416678076822&id=109779253707232,"York College Wrestling
February 22 at 9:04 PM ·

Here’s our first team all KCAC men’s wrestling honorees. Congrats to Marce Douglas Vasquez Pierce Mederios Harley Williamson and John Fox. Great work men! Go Panthers!",0.0,"Bridgeport alumni giving his all.

York College Wrestling
February 22 at 9:04 PM ·

Here’s our first team all KCAC men’s wrestling honorees. Congrats to Marce Douglas Vasquez Pierce Mederios Harley Williamson and John Fox. Great work men! Go Panthers!",2020-02-24 14:42:35,,
161,0.0,,18.0,http://www.strongrunnerchicks.com/src-of-the-week-marissa-widener/,199407631411060,Bridgeport alumni killing it!!!,https://facebook.com/story.php?story_fbid=199407631411060&id=109779253707232,"STRONGRUNNERCHICKS.COM
SRC of the Week: Marissa Widener - Self Discovery & Appreciation",0.0,"Bridgeport alumni killing it!!!

STRONGRUNNERCHICKS.COM
SRC of the Week: Marissa Widener - Self Discovery & Appreciation",2020-02-24 14:23:50,,
162,0.0,https://scontent-atl3-1.xx.fbcdn.net/v/t1.0-9/fr/cp0/e15/q65/87363623_198877854797371_8900116619016011776_o.jpg?_nc_cat=110&_nc_sid=2d5d41&_nc_ohc=jRTTnhQN6f0AX_mTtjG&_nc_ht=scontent-atl3-1.xx&tp=14&oh=ac50b102f24f4a9ac18281965b419f4b&oe=5F82E7C4,16.0,,198877851464038,Congratulations to Bulldog Girls and Boys basketball teams for earning the WTC regular season championships. It’s a GREAT day to be a Bulldog! #bpsbulldogpride,,,0.0,Congratulations to Bulldog Girls and Boys basketball teams for earning the WTC regular season championships. It’s a GREAT day to be a Bulldog! #bpsbulldogpride,2020-02-23 21:01:31,,
163,0.0,https://scontent-atl3-1.xx.fbcdn.net/v/t1.0-9/fr/cp0/e15/q65/84078353_198116244873532_383513190526353408_o.jpg?_nc_cat=107&_nc_sid=2d5d41&_nc_ohc=t5Y9mbjKyOkAX-0eYQR&_nc_ht=scontent-atl3-1.xx&tp=14&oh=51d4aac27905370ee98e3fedde20ab42&oe=5F854B39,17.0,,198116238206866,"Bulldog Speech team is
C- D Champs at Ogallala today! It’s a GREAT day to be a Bulldog! #bpsbulldogpride",,,0.0,"Bulldog Speech team is
C- D Champs at Ogallala today! It’s a GREAT day to be a Bulldog! #bpsbulldogpride",2020-02-22 18:58:14,,
164,3.0,https://scontent-atl3-1.xx.fbcdn.net/v/t1.0-9/fr/cp0/e15/q65/84116124_197936588224831_6697026106744111104_o.jpg?_nc_cat=106&_nc_sid=2d5d41&_nc_ohc=lBaHpo63crsAX8oy6v9&_nc_ht=scontent-atl3-1.xx&tp=14&oh=83c2061ebe051202aa41764aa84ae5d0&oe=5F82FD07,49.0,,197936581558165,Trevor finishes the season 4th at state. It’s a GREAT day to be a Bulldog! #bpsbulldogpride,,,0.0,Trevor finishes the season 4th at state. It’s a GREAT day to be a Bulldog! #bpsbulldogpride,2020-02-22 12:05:23,,
165,2.0,https://scontent-atl3-1.xx.fbcdn.net/v/t1.0-9/fr/cp0/e15/q65/87129345_197918881559935_4528872194192703488_o.jpg?_nc_cat=101&_nc_sid=2d5d41&_nc_ohc=afW-GtifBFkAX_W2Vo7&_nc_ht=scontent-atl3-1.xx&tp=14&oh=7c90cb37e65defeb3d7ed14e27bbf8bb&oe=5F839E70,51.0,,197918874893269,Casey wins 3rd!! It’s a GREAT day to be a Bulldog! #bpsbulldogpride,,,0.0,Casey wins 3rd!! It’s a GREAT day to be a Bulldog! #bpsbulldogpride,2020-02-22 11:29:05,,
