,comments,image,likes,link,post_id,post_text,post_url,shared_text,shares,text,time,video,video_thumbnail
0,0.0,,1.0,https://www.youtube.com/watch?v=qsiZOPsRG3g,4385112534894712,"Here is the live streaming link for the Special Board of Trustees meeting this evening.

https://www.youtube.com/watch?v=qsiZOPsRG3g",https://facebook.com/story.php?story_fbid=4385112534894712&id=111326945606647,"YOUTUBE.COM
CUSD Special Board Meeting 9/11/2020",0.0,"Here is the live streaming link for the Special Board of Trustees meeting this evening.

https://www.youtube.com/watch?v=qsiZOPsRG3g

YOUTUBE.COM
CUSD Special Board Meeting 9/11/2020",2020-09-11 20:09:06,,
1,2.0,,10.0,https://drive.google.com/file/d/1dDXVr4rX-qsEsl_brwZT-Rrk00OHjXkw/view?usp=sharing,4314201518652481,"Update on School Reopening - August 28, 2020 / Actualización sobre la reapertura de la escuela

https://drive.google.com/file/d/1dDXVr4rX-qsEsl_brwZT-Rrk00OHjXkw/view?usp=sharing",https://facebook.com/story.php?story_fbid=4314201518652481&id=111326945606647,"DRIVE.GOOGLE.COM
8.28.2020 Update on School Reopening - August 28, 2020.pdf",4.0,"Update on School Reopening - August 28, 2020 / Actualización sobre la reapertura de la escuela

https://drive.google.com/file/d/1dDXVr4rX-qsEsl_brwZT-Rrk00OHjXkw/view?usp=sharing

DRIVE.GOOGLE.COM
8.28.2020 Update on School Reopening - August 28, 2020.pdf",2020-08-28 22:16:00,,
2,0.0,https://scontent-atl3-1.xx.fbcdn.net/v/t1.0-9/fr/cp0/e15/q65/118095633_3455551127797054_8681490946589292648_o.jpg?_nc_cat=110&_nc_sid=2d5d41&_nc_ohc=ZTxMHl8diRMAX-KdOvz&_nc_ht=scontent-atl3-1.xx&tp=14&oh=fa23d7df380b8bf2b12096435e9145d3&oe=5F864B01,6.0,http://www.CarlsbadEd.org/move-forward-together,4302146223191344,,https://facebook.com/story.php?story_fbid=4302146223191344&id=111326945606647,"Carlsbad Educational Foundation
August 25 at 6:16 PM ·

Save the date & join us!

We are *really* looking forward to this important and timely discussion.

Four experts from our community will share insight and resources to help you support your students during these challenging times.

Be part of the discussion. Help us #moveforwardtogether

Learn more: www.CarlsbadEd.org/move-forward-together
💛✏️💡",4.0,"Carlsbad Educational Foundation
August 25 at 6:16 PM ·

Save the date & join us!

We are *really* looking forward to this important and timely discussion.

Four experts from our community will share insight and resources to help you support your students during these challenging times.

Be part of the discussion. Help us #moveforwardtogether

Learn more: www.CarlsbadEd.org/move-forward-together
💛✏️💡",2020-08-26 14:15:06,,
3,1.0,https://scontent-atl3-1.xx.fbcdn.net/v/t1.0-9/fr/cp0/e15/q65/118563563_4295980000474633_3796612639282170168_o.jpg?_nc_cat=102&_nc_sid=2d5d41&_nc_ohc=10nOglQe7IcAX85YSsa&_nc_ht=scontent-atl3-1.xx&tp=14&oh=7a26197c290917d876ddff484a317273&oe=5F8438D5,35.0,,4295979990474634,First day of school! Welcome back! #cusdlearns,,,0.0,First day of school! Welcome back! #cusdlearns,2020-08-25 09:35:19,,
4,1.0,,3.0,,4287887337950566,We can’t wait to see you! Look for info from your principal about schedules for the first day. #wegotthis #weloveourstudents,,,0.0,We can’t wait to see you! Look for info from your principal about schedules for the first day. #wegotthis #weloveourstudents,2020-08-23 16:44:13,https://video-atl3-1.xx.fbcdn.net/v/t42.9040-2/118398261_314778553291120_9175276909816100606_n.mp4?_nc_cat=107&_nc_sid=985c63&efg=eyJ2ZW5jb2RlX3RhZyI6ImxlZ2FjeV9zZCJ9&_nc_ohc=XhjvvYO-H0QAX9ueD4O&_nc_ht=video-atl3-1.xx&oh=234e54a4eadfa18de73f4344c8b41ea7&oe=5F5EEA60,
5,2.0,,8.0,https://drive.google.com/file/d/1d13lBgLQBHxOzTjNzf-UePG-83pxsYsm/view?usp=sharing,4273521912720442,"Carlsbad Unified School District's School Reopening Handbook
https://drive.google.com/file/d/1d13lBgLQBHxOzTjNzf-UePG-83pxsYsm/view?usp=sharing",https://facebook.com/story.php?story_fbid=4273521912720442&id=111326945606647,"DRIVE.GOOGLE.COM
CUSD Reopening Handbook rev 8.20.2020.pdf",2.0,"Carlsbad Unified School District's School Reopening Handbook
https://drive.google.com/file/d/1d13lBgLQBHxOzTjNzf-UePG-83pxsYsm/view?usp=sharing

DRIVE.GOOGLE.COM
CUSD Reopening Handbook rev 8.20.2020.pdf",2020-08-20 20:01:29,,
6,3.0,,11.0,https://drive.google.com/file/d/1f2UEevmTVzFUSQd6txtanGoc2Yh-WDY9/view?usp=sharing,4273519899387310,"Update on School Reopening - August 20, 2020
https://drive.google.com/file/d/1f2UEevmTVzFUSQd6txtanGoc2Yh-WDY9/view?usp=sharing",https://facebook.com/story.php?story_fbid=4273519899387310&id=111326945606647,"DRIVE.GOOGLE.COM
8.20.2020 Update on School Reopening - August 20, 2020 (1).pdf",0.0,"Update on School Reopening - August 20, 2020
https://drive.google.com/file/d/1f2UEevmTVzFUSQd6txtanGoc2Yh-WDY9/view?usp=sharing

DRIVE.GOOGLE.COM
8.20.2020 Update on School Reopening - August 20, 2020 (1).pdf",2020-08-20 20:00:51,,
7,0.0,,3.0,https://www.youtube.com/watch?v=eDGPhT5GhSs,4268751266530840,"August 19, 2020 - Board of Trustees Meeting - live streaming YouTube link:
https://www.youtube.com/watch?v=eDGPhT5GhSs",https://facebook.com/story.php?story_fbid=4268751266530840&id=111326945606647,"YOUTUBE.COM
Carlsbad Unified Board Meeting: Aug 19, 2020",0.0,"August 19, 2020 - Board of Trustees Meeting - live streaming YouTube link:
https://www.youtube.com/watch?v=eDGPhT5GhSs

YOUTUBE.COM
Carlsbad Unified Board Meeting: Aug 19, 2020",2020-08-19 20:12:43,,
8,1.0,https://scontent-atl3-1.xx.fbcdn.net/v/t1.0-9/fr/cp0/e15/q65/117343366_4257373967668570_577309723507231312_n.jpg?_nc_cat=108&_nc_sid=8024bb&_nc_ohc=SJAmrHOUjXAAX-kCcOZ&_nc_ht=scontent-atl3-1.xx&tp=14&oh=784b79982c6eb1ebce08fbd0be91d56b&oe=5F846749,5.0,https://www.smore.com/xdtr8,4257374364335197,https://www.smore.com/xdtr8,https://facebook.com/story.php?story_fbid=4257374364335197&id=111326945606647,,0.0,https://www.smore.com/xdtr8,2020-08-17 12:29:36,,
9,2.0,,9.0,https://sites.google.com/carlsbadusd.net/cusdonlinelearning/home,4245116062227694,"We’ve put together an updated Distance Learning 2.0 website (https://sites.google.com/carlsbadusd.net/cusdonlinelearning/home) with useful information for parents and students in advance of our first day of school. This will be updated as more information becomes available.

If you have students in middle and high school, you should have heard from your principal by now about upcoming materials distribution dates and other important details. If you have students in preschool and elementary school, you will receive important updates from your principal no later than Wednesday, August 19.

More info and today's update: https://drive.google.com/file/d/1dOeIamQu30tmhO62hUG3RWIB1SVY2yVz/view?usp=sharing",https://facebook.com/story.php?story_fbid=4245116062227694&id=111326945606647,"DRIVE.GOOGLE.COM
8.14.2020 Update on School Reopening - August 14, 2020.pdf",3.0,"We’ve put together an updated Distance Learning 2.0 website (https://sites.google.com/carlsbadusd.net/cusdonlinelearning/home) with useful information for parents and students in advance of our first day of school. This will be updated as more information becomes available.

If you have students in middle and high school, you should have heard from your principal by now about upcoming materials distribution dates and other important details. If you have students in preschool and elementary school, you will receive important updates from your principal no later than Wednesday, August 19.

More info and today's update: https://drive.google.com/file/d/1dOeIamQu30tmhO62hUG3RWIB1SVY2yVz/view?usp=sharing

DRIVE.GOOGLE.COM
8.14.2020 Update on School Reopening - August 14, 2020.pdf",2020-08-14 22:04:35,,
10,3.0,,12.0,https://drive.google.com/file/d/1LmOJps0Navcd5coIFUPuCoE5NFYeDUbq/view?usp=sharing,4211946055544695,"August 7 Update on School Reopening / Actualización sobre la reapertura de la escuela

https://drive.google.com/file/d/1LmOJps0Navcd5coIFUPuCoE5NFYeDUbq/view?usp=sharing",https://facebook.com/story.php?story_fbid=4211946055544695&id=111326945606647,"DRIVE.GOOGLE.COM
8.7.2020 Update on School Reopening - August 7, 2020.pdf",3.0,"August 7 Update on School Reopening / Actualización sobre la reapertura de la escuela

https://drive.google.com/file/d/1LmOJps0Navcd5coIFUPuCoE5NFYeDUbq/view?usp=sharing

DRIVE.GOOGLE.COM
8.7.2020 Update on School Reopening - August 7, 2020.pdf",2020-08-07 19:33:28,,
11,7.0,,15.0,https://cusd-ca.schoolloop.com/pf4/cms2/view_page?d=x&group_id=1593846434727&vdid=i19am2jex3981x,4146220552117246,"We’ve put together additional information in the form of Frequently Asked Questions (FAQs) regarding our safe return to instruction on August 25, 2020. Both documents can be accessed on our new Safe Reopening Plan webpage: https://cusd-ca.schoolloop.com/pf4/cms2/view_page?d=x&group_id=1593846434727&vdid=i19am2jex3981x",https://facebook.com/story.php?story_fbid=4146220552117246&id=111326945606647,"CUSD-CA.SCHOOLLOOP.COM
COVID-19 Safe Reopening Plan",0.0,"We’ve put together additional information in the form of Frequently Asked Questions (FAQs) regarding our safe return to instruction on August 25, 2020. Both documents can be accessed on our new Safe Reopening Plan webpage: https://cusd-ca.schoolloop.com/pf4/cms2/view_page?d=x&group_id=1593846434727&vdid=i19am2jex3981x

CUSD-CA.SCHOOLLOOP.COM
COVID-19 Safe Reopening Plan",2020-07-24 19:01:21,,
12,14.0,,24.0,https://drive.google.com/file/d/1Zn-2phUJPTh5BDE8TDfdu4O_4OPyBdAw/view?usp=sharing,4141175665955068,School starts on August 25; the first four weeks of the school year will be in a Distance Learning format. More info: https://drive.google.com/file/d/1Zn-2phUJPTh5BDE8TDfdu4O_4OPyBdAw/view?usp=sharing,https://facebook.com/story.php?story_fbid=4141175665955068&id=111326945606647,"DRIVE.GOOGLE.COM
7.23.2020 Update on School Reopening - July 23, 2020.pdf",7.0,"School starts on August 25; the first four weeks of the school year will be in a Distance Learning format. More info: https://drive.google.com/file/d/1Zn-2phUJPTh5BDE8TDfdu4O_4OPyBdAw/view?usp=sharing

DRIVE.GOOGLE.COM
7.23.2020 Update on School Reopening - July 23, 2020.pdf",2020-07-23 16:32:01,,
13,4.0,,22.0,https://drive.google.com/file/d/17RRShDu8hGaYrLOOkyC1Vp51XTZrhOhi/view?usp=sharing,4114348348637800,"As you may have heard, Governor Newsom issued an order today about reopening and closing schools. In the order, he is requiring all public, charter, and private schools that are located in counties on the state’s COVID-19 monitoring list to start the school year with distance learning until certain conditions are met. This includes San Diego County.

More information: https://drive.google.com/file/d/17RRShDu8hGaYrLOOkyC1Vp51XTZrhOhi/view?usp=sharing",https://facebook.com/story.php?story_fbid=4114348348637800&id=111326945606647,"DRIVE.GOOGLE.COM
7.17.2020 Update on School Reopening _ FAQs - July 17, 2020.pdf",3.0,"As you may have heard, Governor Newsom issued an order today about reopening and closing schools. In the order, he is requiring all public, charter, and private schools that are located in counties on the state’s COVID-19 monitoring list to start the school year with distance learning until certain conditions are met. This includes San Diego County.

More information: https://drive.google.com/file/d/17RRShDu8hGaYrLOOkyC1Vp51XTZrhOhi/view?usp=sharing

DRIVE.GOOGLE.COM
7.17.2020 Update on School Reopening _ FAQs - July 17, 2020.pdf",2020-07-17 20:16:47,,
14,10.0,,18.0,https://drive.google.com/file/d/1q1FwL0nBcvUvTUmvHZ8NH8wO3BcczvBs/view?usp=sharing,4101077593298209,"We know you've got lots of questions about the specifics of reopening schools in the fall. We're working on FAQs to share in the near future. Stay tuned for more info.

In the meantime, we've created a high level summary of the scenarios currently in development. This is not meant to be an exhaustive explanation of each scenario, but rather an at-a-glance overview.

https://drive.google.com/file/d/1q1FwL0nBcvUvTUmvHZ8NH8wO3BcczvBs/view?usp=sharing",https://facebook.com/story.php?story_fbid=4101077593298209&id=111326945606647,"DRIVE.GOOGLE.COM
Overview of Possible Modes of Instruction - July 14, 2020 (English and Spanish).pdf",5.0,"We know you've got lots of questions about the specifics of reopening schools in the fall. We're working on FAQs to share in the near future. Stay tuned for more info.

In the meantime, we've created a high level summary of the scenarios currently in development. This is not meant to be an exhaustive explanation of each scenario, but rather an at-a-glance overview.

https://drive.google.com/file/d/1q1FwL0nBcvUvTUmvHZ8NH8wO3BcczvBs/view?usp=sharing

DRIVE.GOOGLE.COM
Overview of Possible Modes of Instruction - July 14, 2020 (English and Spanish).pdf",2020-07-14 23:16:24,,
15,16.0,,27.0,https://drive.google.com/file/d/1C0eRAshS837peDGvGVjAhfbqo7g48Vx1/view?usp=sharing,4095916820480953,"Here in Carlsbad Unified, we’ve not yet made a decision about the reopening of school. We continue to make plans for a variety of scenarios; local health conditions will dictate which of the scenarios are in place at any given time in the upcoming school year. We’ll provide a report on this topic to our Board of Trustees at their regular meeting on July 22, 2020.

More info: https://drive.google.com/file/d/1C0eRAshS837peDGvGVjAhfbqo7g48Vx1/view?usp=sharing",https://facebook.com/story.php?story_fbid=4095916820480953&id=111326945606647,"DRIVE.GOOGLE.COM
7.13.2020 Update on School Reopening - July 13, 2020.pdf",5.0,"Here in Carlsbad Unified, we’ve not yet made a decision about the reopening of school. We continue to make plans for a variety of scenarios; local health conditions will dictate which of the scenarios are in place at any given time in the upcoming school year. We’ll provide a report on this topic to our Board of Trustees at their regular meeting on July 22, 2020.

More info: https://drive.google.com/file/d/1C0eRAshS837peDGvGVjAhfbqo7g48Vx1/view?usp=sharing

DRIVE.GOOGLE.COM
7.13.2020 Update on School Reopening - July 13, 2020.pdf",2020-07-13 20:10:20,,
16,2.0,,7.0,https://youtu.be/2JSTLjEx2E4,4078610338878268,"CSA Reimagined: Q & A Webinar video - recorded July 9, 6:00 pm

https://youtu.be/2JSTLjEx2E4",https://facebook.com/story.php?story_fbid=4078610338878268&id=111326945606647,"YOUTUBE.COM
Carlsbad Seaside Academy Q&A Webinar",0.0,"CSA Reimagined: Q & A Webinar video - recorded July 9, 6:00 pm

https://youtu.be/2JSTLjEx2E4

YOUTUBE.COM
Carlsbad Seaside Academy Q&A Webinar",2020-07-09 21:00:41,,
17,6.0,,7.0,https://www.youtube.com/watch?v=Ed9_VQ1D0BU&feature=youtu.be,4069993233073312,"Carlsbad Seaside Academy Webinar - Transfer to Our Virtual School

Tuesday, July 7th, 6:00pm

Available at this link: https://www.youtube.com/watch?v=Ed9_VQ1D0BU&feature=youtu.be",https://facebook.com/story.php?story_fbid=4069993233073312&id=111326945606647,"YOUTUBE.COM
Copy of Seaside Academy Informational Webinar 2020-2021 School Year",0.0,"Carlsbad Seaside Academy Webinar - Transfer to Our Virtual School

Tuesday, July 7th, 6:00pm

Available at this link: https://www.youtube.com/watch?v=Ed9_VQ1D0BU&feature=youtu.be

YOUTUBE.COM
Copy of Seaside Academy Informational Webinar 2020-2021 School Year",2020-07-07 20:45:40,,
18,3.0,https://scontent-atl3-1.xx.fbcdn.net/v/t1.0-9/106536184_4050511531688149_4517165641043517498_n.png?_nc_cat=107&_nc_sid=8024bb&_nc_ohc=fC9505nyO6cAX-t8M2s&_nc_ht=scontent-atl3-1.xx&oh=8aa04ace0390405a8df1716147894120&oe=5F8267AC,8.0,https://bit.ly/July7RSVP,4050517335020902,"Transfer Window Now Open for Our Virtual School: Carlsbad Seaside Academy

Carlsbad Seaside Academy (CSA) is the virtual independent study program for students in all grade levels in Carlsbad Unified School District. Our virtual program at CSA will provide the opportunity for students to work closely with a cooperating teacher who will provide a challenging yet nurturing distance learning curriculum.

We’ll be hosting an informational webinar on July 7, 2020 at 6:00 PM. To RSVP and to receive the link to attend the webinar: http://bit.ly/July7RSVP. We’ll record and post it to the website later for those who are unable to attend.

Here's more information: https://drive.google.com/file/d/1AwqSeIaqU85RcIomg2FftVEUoun4eWHO/view?usp=sharing",https://facebook.com/story.php?story_fbid=4050517335020902&id=111326945606647,,0.0,"Transfer Window Now Open for Our Virtual School: Carlsbad Seaside Academy

Carlsbad Seaside Academy (CSA) is the virtual independent study program for students in all grade levels in Carlsbad Unified School District. Our virtual program at CSA will provide the opportunity for students to work closely with a cooperating teacher who will provide a challenging yet nurturing distance learning curriculum.

We’ll be hosting an informational webinar on July 7, 2020 at 6:00 PM. To RSVP and to receive the link to attend the webinar: http://bit.ly/July7RSVP. We’ll record and post it to the website later for those who are unable to attend.

Here's more information: https://drive.google.com/file/d/1AwqSeIaqU85RcIomg2FftVEUoun4eWHO/view?usp=sharing",2020-07-03 11:33:24,,
19,8.0,,11.0,https://drive.google.com/file/d/1EPeVAIUg3Byii9aGEVJFg5c0iEZLW_E2/view?usp=sharing,4017834151622554,"Here's a copy of the recap from last night's Board meeting, regarding planning for the reopening of schools.

https://drive.google.com/file/d/1EPeVAIUg3Byii9aGEVJFg5c0iEZLW_E2/view?usp=sharing",https://facebook.com/story.php?story_fbid=4017834151622554&id=111326945606647,"DRIVE.GOOGLE.COM
6.25.2020 Board Meeting Recap and Reopening Planning - June 25, 2020.pdf",10.0,"Here's a copy of the recap from last night's Board meeting, regarding planning for the reopening of schools.

https://drive.google.com/file/d/1EPeVAIUg3Byii9aGEVJFg5c0iEZLW_E2/view?usp=sharing

DRIVE.GOOGLE.COM
6.25.2020 Board Meeting Recap and Reopening Planning - June 25, 2020.pdf",2020-06-25 19:24:19,,
20,2.0,,4.0,https://www.youtube.com/watch?v=My25cRsnKyI,4013920392013930,"To access the live streaming of the board meeting, go to: https://www.youtube.com/watch?v=My25cRsnKyI",https://facebook.com/story.php?story_fbid=4013920392013930&id=111326945606647,"YOUTUBE.COM
Carlsbad Unified Board Meeting - June 24, 2020",0.0,"To access the live streaming of the board meeting, go to: https://www.youtube.com/watch?v=My25cRsnKyI

YOUTUBE.COM
Carlsbad Unified Board Meeting - June 24, 2020",2020-06-24 21:23:15,,
21,0.0,https://scontent-atl3-1.xx.fbcdn.net/v/t1.0-9/fr/cp0/e15/q65/103441573_3959547307451239_7663163297251552911_o.jpg?_nc_cat=108&_nc_sid=8024bb&_nc_ohc=Zz9iHqcxb9wAX-uTaMK&_nc_ht=scontent-atl3-1.xx&tp=14&oh=5b1d1c15776f8f2358e46dee0bcde2bc&oe=5F838190,71.0,http://carlsbadcrawl.com/carlsbad-art-wall-congratulates-graduating-seniors/,3959548164117820,"As the school year officially wraps up for students today, please join us in congratulating the graduating class of 2020! This will be a year none of us will forget.

If you’ve been in Carlsbad Village this week, we hope you’ve seen the Carlsbad Art Wall. I want to thank our amazing high school art teachers, with the support of local artist Bryan Snyder, for creating an amazing mural to celebrate all of our 2020 graduates!

http://carlsbadcrawl.com/carlsbad-art-wall-congratulates-graduating-seniors/",https://facebook.com/story.php?story_fbid=3959548164117820&id=111326945606647,,0.0,"As the school year officially wraps up for students today, please join us in congratulating the graduating class of 2020! This will be a year none of us will forget.

If you’ve been in Carlsbad Village this week, we hope you’ve seen the Carlsbad Art Wall. I want to thank our amazing high school art teachers, with the support of local artist Bryan Snyder, for creating an amazing mural to celebrate all of our 2020 graduates!

http://carlsbadcrawl.com/carlsbad-art-wall-congratulates-graduating-seniors/",2020-06-11 22:17:59,,
22,0.0,,4.0,https://drive.google.com/open?id=1Gzs4hhscl6rq5VAlOhJQHjDDL9soF682,3959542517451718,"Information from the June 10, 2020 meeting of the Board of Trustees:

https://drive.google.com/open?id=1Gzs4hhscl6rq5VAlOhJQHjDDL9soF682",https://facebook.com/story.php?story_fbid=3959542517451718&id=111326945606647,"DRIVE.GOOGLE.COM
6.11.2020 Board Meeting Recap - June 11, 2020.pdf",0.0,"Information from the June 10, 2020 meeting of the Board of Trustees:

https://drive.google.com/open?id=1Gzs4hhscl6rq5VAlOhJQHjDDL9soF682

DRIVE.GOOGLE.COM
6.11.2020 Board Meeting Recap - June 11, 2020.pdf",2020-06-11 22:16:35,,
23,1.0,,6.0,https://drive.google.com/open?id=1-rQTTq9Dp1i8gl5Me-PZ4uDvsmVL1EWP,3935357403203563,"Info about our next Board meeting, scheduled for June 10 at 6pm:

https://drive.google.com/open?id=1-rQTTq9Dp1i8gl5Me-PZ4uDvsmVL1EWP

Link to the agenda:

http://go.boarddocs.com/ca/cusd/Board.nsf/goto?open&id=BPAJQD4DCFFA",https://facebook.com/story.php?story_fbid=3935357403203563&id=111326945606647,"DRIVE.GOOGLE.COM
6.5.2020 Info about June 10 Board Meeting - June 5, 2020.pdf",0.0,"Info about our next Board meeting, scheduled for June 10 at 6pm:

https://drive.google.com/open?id=1-rQTTq9Dp1i8gl5Me-PZ4uDvsmVL1EWP

Link to the agenda:

http://go.boarddocs.com/ca/cusd/Board.nsf/goto?open&id=BPAJQD4DCFFA

DRIVE.GOOGLE.COM
6.5.2020 Info about June 10 Board Meeting - June 5, 2020.pdf",2020-06-05 21:26:12,,
24,1.0,,10.0,https://drive.google.com/open?id=15nbqqDMzlfOXnUyh0c3iEJAHmjH9cbVo,3929434717129165,"Talking to kids about recent events can be challenging. We've shared some resources to help parents:

https://drive.google.com/open?id=15nbqqDMzlfOXnUyh0c3iEJAHmjH9cbVo",https://facebook.com/story.php?story_fbid=3929434717129165&id=111326945606647,"DRIVE.GOOGLE.COM
6.4.2020 Equity Resources - June 4, 2020.pdf",5.0,"Talking to kids about recent events can be challenging. We've shared some resources to help parents:

https://drive.google.com/open?id=15nbqqDMzlfOXnUyh0c3iEJAHmjH9cbVo

DRIVE.GOOGLE.COM
6.4.2020 Equity Resources - June 4, 2020.pdf",2020-06-04 10:25:16,,
25,3.0,,29.0,https://carlsbadunified.blogspot.com/2020/05/may-2020-message-from-superintendent.html,3913386832067287,"We'd like to congratulate some exemplary Carlsbad Unified schools, programs, and people for the honors and accomplishments they have achieved this year. We are proud of all you do for the students of Carlsbad Unified.

https://carlsbadunified.blogspot.com/2020/05/may-2020-message-from-superintendent.html",https://facebook.com/story.php?story_fbid=3913386832067287&id=111326945606647,"CARLSBADUNIFIED.BLOGSPOT.COM
May 2020 Message from the Superintendent",2.0,"We'd like to congratulate some exemplary Carlsbad Unified schools, programs, and people for the honors and accomplishments they have achieved this year. We are proud of all you do for the students of Carlsbad Unified.

https://carlsbadunified.blogspot.com/2020/05/may-2020-message-from-superintendent.html

CARLSBADUNIFIED.BLOGSPOT.COM
May 2020 Message from the Superintendent",2020-05-31 12:02:57,,
26,0.0,,3.0,https://drive.google.com/open?id=1qEM-ZxNNteaO-TiOOEkhFFSV_9QqSeZ2,3881148501957787,"Have a great Memorial Day weekend - thanks to all those who serve. Here are quick updates on the enrollment process for new kindergarten and new families, and the agenda for the special board meeting on May 27.

https://drive.google.com/open?id=1qEM-ZxNNteaO-TiOOEkhFFSV_9QqSeZ2",https://facebook.com/story.php?story_fbid=3881148501957787&id=111326945606647,"DRIVE.GOOGLE.COM
5.2.22020 Update During School Closure - May 22, 2020.pdf",0.0,"Have a great Memorial Day weekend - thanks to all those who serve. Here are quick updates on the enrollment process for new kindergarten and new families, and the agenda for the special board meeting on May 27.

https://drive.google.com/open?id=1qEM-ZxNNteaO-TiOOEkhFFSV_9QqSeZ2

DRIVE.GOOGLE.COM
5.2.22020 Update During School Closure - May 22, 2020.pdf",2020-05-22 20:24:40,,
27,0.0,,33.0,https://youtu.be/rFiihjZcuJQ,3868495589889745,"Yep - our students are amazing. Thank you to these Carlsbad High School students for making masks for the City of Carlsbad - Official

https://youtu.be/rFiihjZcuJQ",https://facebook.com/story.php?story_fbid=3868495589889745&id=111326945606647,"YOUTUBE.COM
Sew2Care – Carlsbad High School Robotics Team",0.0,"Yep - our students are amazing. Thank you to these Carlsbad High School students for making masks for the City of Carlsbad - Official

https://youtu.be/rFiihjZcuJQ

YOUTUBE.COM
Sew2Care – Carlsbad High School Robotics Team",2020-05-19 10:52:24,,
28,3.0,https://scontent-atl3-1.xx.fbcdn.net/v/t1.0-9/fr/cp0/e15/q65/97493034_3850638745008763_2991099779955556352_o.jpg?_nc_cat=111&_nc_sid=2d5d41&_nc_ohc=8uFa3hwUYBIAX9Lads-&_nc_ht=scontent-atl3-1.xx&tp=14&oh=c233f96a3cfd588651cb8c80f393b3f7&oe=5F842753,55.0,,3850638738342097,"Our Nutrition Services professionals are awesome! #cusdlearns
・・・
#Repost @hope_amid_crisis
・・・
These amazing women made a new record today #568! Cheers to Karen, Laura, Vicki, Rachel and Nikki! #teamworkmakesthedreamwork #endurance",,,0.0,"Our Nutrition Services professionals are awesome! #cusdlearns
・・・
#Repost @hope_amid_crisis
・・・
These amazing women made a new record today #568! Cheers to Karen, Laura, Vicki, Rachel and Nikki! #teamworkmakesthedreamwork #endurance",2020-05-15 17:40:46,,
29,0.0,,15.0,https://drive.google.com/open?id=1Psa8JQY9qJG_--BLXJlNcd2X0xOkuXhe,3846798255392812,"Update on end of year planning:

https://drive.google.com/open?id=1Psa8JQY9qJG_--BLXJlNcd2X0xOkuXhe",https://facebook.com/story.php?story_fbid=3846798255392812&id=111326945606647,"DRIVE.GOOGLE.COM
5.14.2020 Update on End of Year Planning - May 14, 2020.pdf",4.0,"Update on end of year planning:

https://drive.google.com/open?id=1Psa8JQY9qJG_--BLXJlNcd2X0xOkuXhe

DRIVE.GOOGLE.COM
5.14.2020 Update on End of Year Planning - May 14, 2020.pdf",2020-05-14 18:56:54,,
30,0.0,,16.0,https://drive.google.com/open?id=1azI9YxGfqk6b1APkrZGXGiO5M3FiH0vD,3846793302059974,"High School Graduation Update:

https://drive.google.com/open?id=1azI9YxGfqk6b1APkrZGXGiO5M3FiH0vD

Quick version: we're postponing graduation until July 23, 2020 in the hopes that the public health order at the time will allow an in-person ceremony.",https://facebook.com/story.php?story_fbid=3846793302059974&id=111326945606647,"DRIVE.GOOGLE.COM
5.14.2020 High School Graduation Update - May 14, 2020 (1).pdf",2.0,"High School Graduation Update:

https://drive.google.com/open?id=1azI9YxGfqk6b1APkrZGXGiO5M3FiH0vD

Quick version: we're postponing graduation until July 23, 2020 in the hopes that the public health order at the time will allow an in-person ceremony.

DRIVE.GOOGLE.COM
5.14.2020 High School Graduation Update - May 14, 2020 (1).pdf",2020-05-14 18:54:55,,
31,2.0,,5.0,https://drive.google.com/open?id=1LC_Zvn7C6Tqsv_iZJ9vWs0G1Acqiteim,3846788855393752,"Update from the May 13, 2020 Meeting of the Board of Trustees:

https://drive.google.com/open?id=1LC_Zvn7C6Tqsv_iZJ9vWs0G1Acqiteim",https://facebook.com/story.php?story_fbid=3846788855393752&id=111326945606647,"DRIVE.GOOGLE.COM
5.14.2020 Board Meeting Update - May 14, 2020.pdf",0.0,"Update from the May 13, 2020 Meeting of the Board of Trustees:

https://drive.google.com/open?id=1LC_Zvn7C6Tqsv_iZJ9vWs0G1Acqiteim

DRIVE.GOOGLE.COM
5.14.2020 Board Meeting Update - May 14, 2020.pdf",2020-05-14 18:53:07,,
32,3.0,https://scontent-atl3-1.xx.fbcdn.net/v/t1.0-9/fr/cp0/e15/q65/96720842_3840506939355277_1884845375647383552_o.jpg?_nc_cat=100&_nc_sid=2d5d41&_nc_ohc=Z2A2nwpvufwAX9M8eVu&_nc_ht=scontent-atl3-1.xx&tp=14&oh=d01120a2e139a398bd3f65f2bd75b7d1&oe=5F82CB4C,9.0,http://cusd-ca.schoolloop.com/,3840506929355278,We’ll be live at 6 pm. Visit cusd-ca.schoolloop.com for links to the agenda and livestream. #cusdlearns,,,0.0,We’ll be live at 6 pm. Visit cusd-ca.schoolloop.com for links to the agenda and livestream. #cusdlearns,2020-05-13 09:34:45,,
33,0.0,https://scontent-atl3-1.xx.fbcdn.net/v/t1.0-9/fr/cp0/e15/q65/97484015_3830291947043443_8274512125062283264_o.jpg?_nc_cat=104&_nc_sid=2d5d41&_nc_ohc=j_S_hOaPPtwAX8K1w7u&_nc_ht=scontent-atl3-1.xx&tp=14&oh=bab2642ba33372440bba273ff0f1e4c2&oe=5F859196,18.0,,3830291940376777,Happy Mother’s Day! #cusdlearns,,,0.0,Happy Mother’s Day! #cusdlearns,2020-05-10 13:07:09,,
34,0.0,,5.0,https://drive.google.com/open?id=1p-l_9GeravPdSQARmhXxquf_kFEQRhcg,3823787707693867,"Update During School Closure and Board Meeting Agenda - May 8, 2020

https://drive.google.com/open?id=1p-l_9GeravPdSQARmhXxquf_kFEQRhcg",https://facebook.com/story.php?story_fbid=3823787707693867&id=111326945606647,"DRIVE.GOOGLE.COM
5.8.2020 Update During School Closure and Board Meeting Agenda - May 8, 2020.pdf",2.0,"Update During School Closure and Board Meeting Agenda - May 8, 2020

https://drive.google.com/open?id=1p-l_9GeravPdSQARmhXxquf_kFEQRhcg

DRIVE.GOOGLE.COM
5.8.2020 Update During School Closure and Board Meeting Agenda - May 8, 2020.pdf",2020-05-08 19:45:36,,
35,0.0,,3.0,https://drive.google.com/open?id=1jYgAyImv5URmJjxv70a5hc13TGQX-7r2,3823762941029677,"Updated process for Public Comment at our next meeting of the Board of Trustees on May 13, 2020:

https://drive.google.com/open?id=1jYgAyImv5URmJjxv70a5hc13TGQX-7r2

Agenda and info about livestreaming the meeting available here: https://cusd-ca.schoolloop.com/boardagendas",https://facebook.com/story.php?story_fbid=3823762941029677&id=111326945606647,"DRIVE.GOOGLE.COM
CUSD Public Comment Process during Teleconference Meetings 2020.pdf",0.0,"Updated process for Public Comment at our next meeting of the Board of Trustees on May 13, 2020:

https://drive.google.com/open?id=1jYgAyImv5URmJjxv70a5hc13TGQX-7r2

Agenda and info about livestreaming the meeting available here: https://cusd-ca.schoolloop.com/boardagendas

DRIVE.GOOGLE.COM
CUSD Public Comment Process during Teleconference Meetings 2020.pdf",2020-05-08 19:35:38,,
36,0.0,,18.0,https://www.nbcsandiego.com/news/local/grocery-grab-north-county-teens-step-up-to-help-elderly-neighbors/2320155/,3819938221412149,"Check out these impressive Sage Creek High School students - making a difference in our community! Thanks also to the City of Carlsbad - Official for working with these students to expand the program.

https://www.nbcsandiego.com/news/local/grocery-grab-north-county-teens-step-up-to-help-elderly-neighbors/2320155/",https://facebook.com/story.php?story_fbid=3819938221412149&id=111326945606647,"NBCSANDIEGO.COM
Grocery Grab: North County Teens Step Up to Help Elderly Neighbors",0.0,"Check out these impressive Sage Creek High School students - making a difference in our community! Thanks also to the City of Carlsbad - Official for working with these students to expand the program.

https://www.nbcsandiego.com/news/local/grocery-grab-north-county-teens-step-up-to-help-elderly-neighbors/2320155/

NBCSANDIEGO.COM
Grocery Grab: North County Teens Step Up to Help Elderly Neighbors",2020-05-07 18:29:10,,
37,0.0,https://scontent-atl3-1.xx.fbcdn.net/v/t1.0-9/fr/cp0/e15/q65/95931955_3816126165126688_5466989263201501184_n.jpg?_nc_cat=109&_nc_sid=2d5d41&_nc_ohc=qaOEHa1dV7oAX-dwdYG&_nc_ht=scontent-atl3-1.xx&tp=14&oh=f222637da9887f6e4655255534604a2b&oe=5F8288E7,7.0,,3816126161793355,#ThankYouNurses #NationalNurseDay #NationalNurseWeek #CUSDlearns,,,0.0,#ThankYouNurses #NationalNurseDay #NationalNurseWeek #CUSDlearns,2020-05-06 17:24:14,,
38,0.0,https://scontent-atl3-1.xx.fbcdn.net/v/t1.0-9/fr/cp0/e15/q65/95850190_3808481765891128_1826567810516516864_n.jpg?_nc_cat=101&_nc_sid=2d5d41&_nc_ohc=v3Y9T0ds02wAX-Z-1dp&_nc_ht=scontent-atl3-1.xx&tp=14&oh=f06f86bde455c3ba3775fc6803ebfed6&oe=5F832A81,29.0,,3808481759224462,‪Thank you to our amazing teachers. You’ve never been more appreciated than right now! Keep up the outstanding work. #cusdlearns #TeacherAppreciationWeek ‬,,,0.0,‪Thank you to our amazing teachers. You’ve never been more appreciated than right now! Keep up the outstanding work. #cusdlearns #TeacherAppreciationWeek ‬,2020-05-04 14:11:41,,
39,0.0,,8.0,https://www.youtube.com/playlist?list=PLl574UpZ180JI8bKehZOZTipdDagfRVH4,3808451285894176,"We love our teachers! Congrats to our Teacher of the Year, Mrs. Bannock! #cusdlearns",https://facebook.com/story.php?story_fbid=3808451285894176&id=111326945606647,"YOUTUBE.COM
2021 Teachers of the Year - YouTube

San Diego County Office of Education
May 4 at 8:05 AM ·

How do you celebrate #TeacherAppreciationWeek during a pandemic? Virtually, of course! Today and every day this week, we will highlight the 2020-21 teachers of the year from San Diego County school districts. These amazing educators stay positive and humble in order to better serve students, and even in a distance-learning format, make their students feel welcome, safe, and loved. Visit our YouTube playlist to meet Arah Allard (Del Mar Hills Elementary, Del Mar Union School District), Hilary Anelli (Lemon Grove Academy Elementary, Lemon Grove School District), Andrea Arroyo (Eastlake Middle School, Sweetwater Union High School District), Kim Arvidson (Empressa Elementary, Vista Unified), Jennifer Bannock (Hope Elementary, Carlsbad Unified School District), Susana Baum (Solana Beach School District), Jessica Borah (Rancho Minerva MS Bulls - VUSD, Vista Unified), Jennifer Cerda (Oceanside Unified School District), and Ellen Cody (Silver Strand Elementary School, Coronado Unified School District). https://www.youtube.com/playlist?list=PLl574UpZ180JI8bKehZOZTipdDagfRVH4",0.0,"We love our teachers! Congrats to our Teacher of the Year, Mrs. Bannock! #cusdlearns

YOUTUBE.COM
2021 Teachers of the Year - YouTube

San Diego County Office of Education
May 4 at 8:05 AM ·

How do you celebrate #TeacherAppreciationWeek during a pandemic? Virtually, of course! Today and every day this week, we will highlight the 2020-21 teachers of the year from San Diego County school districts. These amazing educators stay positive and humble in order to better serve students, and even in a distance-learning format, make their students feel welcome, safe, and loved. Visit our YouTube playlist to meet Arah Allard (Del Mar Hills Elementary, Del Mar Union School District), Hilary Anelli (Lemon Grove Academy Elementary, Lemon Grove School District), Andrea Arroyo (Eastlake Middle School, Sweetwater Union High School District), Kim Arvidson (Empressa Elementary, Vista Unified), Jennifer Bannock (Hope Elementary, Carlsbad Unified School District), Susana Baum (Solana Beach School District), Jessica Borah (Rancho Minerva MS Bulls - VUSD, Vista Unified), Jennifer Cerda (Oceanside Unified School District), and Ellen Cody (Silver Strand Elementary School, Coronado Unified School District). https://www.youtube.com/playlist?list=PLl574UpZ180JI8bKehZOZTipdDagfRVH4",2020-05-04 14:00:54,,
40,0.0,,0.0,https://www.youtube.com/playlist?list=PLl574UpZ180JI8bKehZOZTipdDagfRVH4,,,https://facebook.com/story.php?story_fbid=3181006391943401&id=133789459998458,"San Diego County Office of Education
May 4 at 8:05 AM ·

How do you celebrate #TeacherAppreciationWeek during a pandemic? Virtually, of course! Today and every day this week, we will highlight the 2020-21 teachers of the year from San Diego County school districts. These amazing educators stay positive and humble in order to better serve students, and even in a distance-learning format, make their students feel welcome, safe, and loved. Visit our YouTube playlist to meet Arah Allard (Del Mar Hills Elementary, Del Mar Union School District), Hilary Anelli (Lemon Grove Academy Elementary, Lemon Grove School District), Andrea Arroyo (Eastlake Middle School, Sweetwater Union High School District), Kim Arvidson (Empressa Elementary, Vista Unified), Jennifer Bannock (Hope Elementary, Carlsbad Unified School District), Susana Baum (Solana Beach School District), Jessica Borah (Rancho Minerva MS Bulls - VUSD, Vista Unified), Jennifer Cerda (Oceanside Unified School District), and Ellen Cody (Silver Strand Elementary School, Coronado Unified School District). https://www.youtube.com/playlist?list=PLl574UpZ180JI8bKehZOZTipdDagfRVH4",0.0,"San Diego County Office of Education
May 4 at 8:05 AM ·

How do you celebrate #TeacherAppreciationWeek during a pandemic? Virtually, of course! Today and every day this week, we will highlight the 2020-21 teachers of the year from San Diego County school districts. These amazing educators stay positive and humble in order to better serve students, and even in a distance-learning format, make their students feel welcome, safe, and loved. Visit our YouTube playlist to meet Arah Allard (Del Mar Hills Elementary, Del Mar Union School District), Hilary Anelli (Lemon Grove Academy Elementary, Lemon Grove School District), Andrea Arroyo (Eastlake Middle School, Sweetwater Union High School District), Kim Arvidson (Empressa Elementary, Vista Unified), Jennifer Bannock (Hope Elementary, Carlsbad Unified School District), Susana Baum (Solana Beach School District), Jessica Borah (Rancho Minerva MS Bulls - VUSD, Vista Unified), Jennifer Cerda (Oceanside Unified School District), and Ellen Cody (Silver Strand Elementary School, Coronado Unified School District). https://www.youtube.com/playlist?list=PLl574UpZ180JI8bKehZOZTipdDagfRVH4",2020-09-13 21:36:46.723841,,
41,0.0,https://scontent-atl3-1.xx.fbcdn.net/v/t1.0-9/fr/cp0/e15/q65/95810095_3793565924049379_6839199626004791296_o.jpg?_nc_cat=108&_nc_sid=8024bb&_nc_ohc=xeQ4cx6RTdkAX9gD2eF&_nc_ht=scontent-atl3-1.xx&tp=14&oh=e28abad43ea17c54ad3fbb07ef7ba2d9&oe=5F82E1B1,21.0,http://cusd-ca.schoolloop.com/pf4/cms2/news_themed_display?id=1588239162715,3793568504049121,"In these difficult times of online learning while sheltering in place, many Carlsbad Unified teachers are responding to the COVID-19 crisis by making a difference in their communities -- supporting the work of medical professionals and helping to keep community members safe. Here are some highlights from Calavera Hills Middle School.
http://cusd-ca.schoolloop.com/pf4/cms2/news_themed_display?id=1588239162715",https://facebook.com/story.php?story_fbid=3793568504049121&id=111326945606647,,0.0,"In these difficult times of online learning while sheltering in place, many Carlsbad Unified teachers are responding to the COVID-19 crisis by making a difference in their communities -- supporting the work of medical professionals and helping to keep community members safe. Here are some highlights from Calavera Hills Middle School.
http://cusd-ca.schoolloop.com/pf4/cms2/news_themed_display?id=1588239162715",2020-04-30 12:40:19,,
42,8.0,,14.0,https://drive.google.com/open?id=1c3HK6sA385-FP4V0dZ_2jBIU79mA2bD8,3791434767595828,"Update During School Closures - April 29, 2020

https://drive.google.com/open?id=1c3HK6sA385-FP4V0dZ_2jBIU79mA2bD8",https://facebook.com/story.php?story_fbid=3791434767595828&id=111326945606647,"DRIVE.GOOGLE.COM
4.29.2020 Update During School Closures - April 29, 2020.pdf",2.0,"Update During School Closures - April 29, 2020

https://drive.google.com/open?id=1c3HK6sA385-FP4V0dZ_2jBIU79mA2bD8

DRIVE.GOOGLE.COM
4.29.2020 Update During School Closures - April 29, 2020.pdf",2020-04-29 22:03:36,,
43,0.0,https://scontent-atl3-1.xx.fbcdn.net/v/t1.0-9/94887703_3783901031682535_452162659295428608_o.png?_nc_cat=103&_nc_sid=8024bb&_nc_ohc=cqsEEGdxIC4AX8un4N8&_nc_ht=scontent-atl3-1.xx&oh=d1a9a33751e60f36a81ffd30f29f72c0&oe=5F82D535,9.0,https://drive.google.com/open?id=12VGj_Agkfu64ENE-etDzhDN8FKtzoVc4,3784024751670163,"Here is some additional information about our temporary grading policy during school facility closures due to COVID-19: https://drive.google.com/open?id=12VGj_Agkfu64ENE-etDzhDN8FKtzoVc4
Families of high school students will receive additional information directly from their high school.",https://facebook.com/story.php?story_fbid=3784024751670163&id=111326945606647,,0.0,"Here is some additional information about our temporary grading policy during school facility closures due to COVID-19: https://drive.google.com/open?id=12VGj_Agkfu64ENE-etDzhDN8FKtzoVc4
Families of high school students will receive additional information directly from their high school.",2020-04-27 19:32:14,,
44,0.0,https://scontent-atl3-1.xx.fbcdn.net/v/t1.0-9/94529613_3167944823249558_9216683479989747712_n.png?_nc_cat=111&_nc_sid=8024bb&_nc_ohc=1BPiOuz7p68AX9V8Bh2&_nc_ht=scontent-atl3-1.xx&oh=461437e9d7bfc15779bb37d337316ae2&oe=5F8301E1,15.0,https://www.sdcoe.net/news/Pages/2020-Green-Ribbon-Schools-Award-Honorees.aspx,3782854871787151,"So proud of the students, staff and families at Jefferson Elementary! #CUSDlearns",https://facebook.com/story.php?story_fbid=3782854871787151&id=111326945606647,"San Diego County Office of Education
April 27 at 8:22 AM ·

Congrats to Jefferson Elementary School & PTA (Carlsbad Unified School District), Francis Parker School, San Diego Unified School District, and @St. Martin of Tours Academy -La Mesa, the schools and district that were among a handful in the state to earn 2020 California Green Ribbon Schools awards.

The award honors schools, school districts, and institutions of higher education for excellence in resource efficiency, health and wellness, and environmental and sustainability education. More at https://www.sdcoe.net/news/Pages/2020-Green-Ribbon-Schools-Award-Honorees.aspx.

*Image credit: California Department of Education
#EarthDay #GreenRibbonSchools #SanDiegoCountySchools",2.0,"So proud of the students, staff and families at Jefferson Elementary! #CUSDlearns

San Diego County Office of Education
April 27 at 8:22 AM ·

Congrats to Jefferson Elementary School & PTA (Carlsbad Unified School District), Francis Parker School, San Diego Unified School District, and @St. Martin of Tours Academy -La Mesa, the schools and district that were among a handful in the state to earn 2020 California Green Ribbon Schools awards.

The award honors schools, school districts, and institutions of higher education for excellence in resource efficiency, health and wellness, and environmental and sustainability education. More at https://www.sdcoe.net/news/Pages/2020-Green-Ribbon-Schools-Award-Honorees.aspx.

*Image credit: California Department of Education
#EarthDay #GreenRibbonSchools #SanDiegoCountySchools",2020-04-27 11:50:18,,
45,0.0,,11.0,https://drive.google.com/open?id=1_A5N0Y8sEHG6RaT0f0zqKIEnHmfcFtZH,3769768533095785,"Some updates on grading and other items following the meeting of the Board of Trustees on April 22, 2020:
https://drive.google.com/open?id=1_A5N0Y8sEHG6RaT0f0zqKIEnHmfcFtZH",https://facebook.com/story.php?story_fbid=3769768533095785&id=111326945606647,"DRIVE.GOOGLE.COM
4.23.2020 Update from our Board of Trustees - April 23, 2020.pdf",0.0,"Some updates on grading and other items following the meeting of the Board of Trustees on April 22, 2020:
https://drive.google.com/open?id=1_A5N0Y8sEHG6RaT0f0zqKIEnHmfcFtZH

DRIVE.GOOGLE.COM
4.23.2020 Update from our Board of Trustees - April 23, 2020.pdf",2020-04-23 20:40:02,,
46,0.0,,7.0,http://cusd-ca.schoolloop.com/pf4/cms2/news_themed_display?id=1587464909976,3764548330284472,"Information about the April 22, 2020 meeting of the Board of Trustees:
http://cusd-ca.schoolloop.com/pf4/cms2/news_themed_display?id=1587464909976",https://facebook.com/story.php?story_fbid=3764548330284472&id=111326945606647,"CUSD-CA.SCHOOLLOOP.COM
Carlsbad Unified School District",0.0,"Information about the April 22, 2020 meeting of the Board of Trustees:
http://cusd-ca.schoolloop.com/pf4/cms2/news_themed_display?id=1587464909976

CUSD-CA.SCHOOLLOOP.COM
Carlsbad Unified School District",2020-04-22 11:27:25,,
47,1.0,,6.0,https://carlsbadunified.blogspot.com/2020/04/april-2020-message-from-superintendent.html,3758627494209889,"Please check out our guest post by Mrs. Suzy Ryan from Valley Middle School!
https://carlsbadunified.blogspot.com/2020/04/april-2020-message-from-superintendent.html",https://facebook.com/story.php?story_fbid=3758627494209889&id=111326945606647,"CARLSBADUNIFIED.BLOGSPOT.COM
April 2020 Message from the Superintendent",0.0,"Please check out our guest post by Mrs. Suzy Ryan from Valley Middle School!
https://carlsbadunified.blogspot.com/2020/04/april-2020-message-from-superintendent.html

CARLSBADUNIFIED.BLOGSPOT.COM
April 2020 Message from the Superintendent",2020-04-20 19:20:42,,
48,0.0,,10.0,https://drive.google.com/open?id=1RPDqGq2FnBGfI0dwrfvJgKYnJwmFqMHi,3747491318656840,"We've posted our proposed grading policy during emergency school closures on our website. This will be reviewed by the Board of Trustees on April 22, 2020. Here is a copy of the letter sent to parents today: https://drive.google.com/open?id=1RPDqGq2FnBGfI0dwrfvJgKYnJwmFqMHi

Here is the agenda for the April 22 Board meeting:
http://go.boarddocs.com/ca/cusd/Board.nsf/goto?open&id=BLKQCT68A61A",https://facebook.com/story.php?story_fbid=3747491318656840&id=111326945606647,"DRIVE.GOOGLE.COM
4.17.2020 Grading Policy Proposal and Public Comment Process - April 17, 2020.pdf",3.0,"We've posted our proposed grading policy during emergency school closures on our website. This will be reviewed by the Board of Trustees on April 22, 2020. Here is a copy of the letter sent to parents today: https://drive.google.com/open?id=1RPDqGq2FnBGfI0dwrfvJgKYnJwmFqMHi

Here is the agenda for the April 22 Board meeting:
http://go.boarddocs.com/ca/cusd/Board.nsf/goto?open&id=BLKQCT68A61A

DRIVE.GOOGLE.COM
4.17.2020 Grading Policy Proposal and Public Comment Process - April 17, 2020.pdf",2020-04-17 19:09:04,,
49,3.0,,9.0,https://drive.google.com/open?id=1-i0wFq-wfmr0m5qMB0c8Ddikn6hq8m63,3740519622687343,"We’ve now passed the one-month mark of school facility closures due to COVID-19, and in addition to keeping our community physically safe, it is important to make sure we are all mentally and emotionally healthy too.

Resources and more here: https://drive.google.com/open?id=1-i0wFq-wfmr0m5qMB0c8Ddikn6hq8m63",https://facebook.com/story.php?story_fbid=3740519622687343&id=111326945606647,"DRIVE.GOOGLE.COM
4.15.2020 Update During School Closure _ Mental Health Resources - April 15, 2020.pdf",0.0,"We’ve now passed the one-month mark of school facility closures due to COVID-19, and in addition to keeping our community physically safe, it is important to make sure we are all mentally and emotionally healthy too.

Resources and more here: https://drive.google.com/open?id=1-i0wFq-wfmr0m5qMB0c8Ddikn6hq8m63

DRIVE.GOOGLE.COM
4.15.2020 Update During School Closure _ Mental Health Resources - April 15, 2020.pdf",2020-04-15 22:27:15,,
50,0.0,,10.0,https://www.nbcsandiego.com/videos/more-free-time-less-freedom-8th-graders-adjust-to-new-normal/2305192/,3735166439889328,"Our students at Valley Middle School and Aviara Oaks Middle School collaborated with NBC 7 San Diego on this story:

https://www.nbcsandiego.com/videos/more-free-time-less-freedom-8th-graders-adjust-to-new-normal/2305192/",https://facebook.com/story.php?story_fbid=3735166439889328&id=111326945606647,"NBCSANDIEGO.COM
More Free Time, Less Freedom: 8th Graders Adjust to Their New Normal",0.0,"Our students at Valley Middle School and Aviara Oaks Middle School collaborated with NBC 7 San Diego on this story:

https://www.nbcsandiego.com/videos/more-free-time-less-freedom-8th-graders-adjust-to-new-normal/2305192/

NBCSANDIEGO.COM
More Free Time, Less Freedom: 8th Graders Adjust to Their New Normal",2020-04-14 12:52:24,,
51,7.0,,52.0,http://cusd-ca.schoolloop.com/pf4/cms2/news_themed_display?id=1586770172764,3730743300331642,"Valley Middle School and Carlsbad High School’s Broadcasting Programs Named Best in the United States!

On April 7, 2020 the Student Television Network awarded Valley Middle School and Carlsbad High School’s broadcast journalism programs with the prestigious STN Award of Excellence. CHSTV won in the competitive ‘Daily, Live’ category and VMSTV won in the ‘Middle School’ category.

Congrats!
http://cusd-ca.schoolloop.com/pf4/cms2/news_themed_display?id=1586770172764",https://facebook.com/story.php?story_fbid=3730743300331642&id=111326945606647,"CUSD-CA.SCHOOLLOOP.COM
Carlsbad Unified School District",9.0,"Valley Middle School and Carlsbad High School’s Broadcasting Programs Named Best in the United States!

On April 7, 2020 the Student Television Network awarded Valley Middle School and Carlsbad High School’s broadcast journalism programs with the prestigious STN Award of Excellence. CHSTV won in the competitive ‘Daily, Live’ category and VMSTV won in the ‘Middle School’ category.

Congrats!
http://cusd-ca.schoolloop.com/pf4/cms2/news_themed_display?id=1586770172764

CUSD-CA.SCHOOLLOOP.COM
Carlsbad Unified School District",2020-04-13 13:54:49,,
52,0.0,https://scontent-atl3-1.xx.fbcdn.net/v/t1.0-9/fr/cp0/e15/q65/93263869_3729209500485022_2917646196992376832_o.jpg?_nc_cat=102&_nc_sid=2d5d41&_nc_ohc=tWpixHjjwK0AX8D6oRj&_nc_ht=scontent-atl3-1.xx&tp=14&oh=4cfc8abcb0dc6eebcb0f92fe1e307f98&oe=5F8398E5,7.0,,3729209493818356,We hope everyone is healthy and safe. Welcome back to Remote Online Learning in this time of emergency school facilities closures due to COVID-19. Visit our website for more info. #cusdlearns,,,0.0,We hope everyone is healthy and safe. Welcome back to Remote Online Learning in this time of emergency school facilities closures due to COVID-19. Visit our website for more info. #cusdlearns,2020-04-13 09:27:11,,
53,0.0,,10.0,https://drive.google.com/open?id=1DwPw1W-qED81c99XaD1kH0OCSA1i4MR6,3723055921100380,"Carlsbad Unified School District's Remote Online Learning Plan during school facilities closures due to COVID-19:

https://drive.google.com/open?id=1DwPw1W-qED81c99XaD1kH0OCSA1i4MR6",https://facebook.com/story.php?story_fbid=3723055921100380&id=111326945606647,"DRIVE.GOOGLE.COM
CUSD Remote Online Learning Plan 2020",2.0,"Carlsbad Unified School District's Remote Online Learning Plan during school facilities closures due to COVID-19:

https://drive.google.com/open?id=1DwPw1W-qED81c99XaD1kH0OCSA1i4MR6

DRIVE.GOOGLE.COM
CUSD Remote Online Learning Plan 2020",2020-04-12 19:10:50,,
54,1.0,,6.0,https://drive.google.com/open?id=1-AiIZfnM7NpsASD1IRtiFLyJmQxQOe8L,3723049661101006,"Some info about the timeline for making decisions about grading, a note about planning for graduation, a link to an article titled ""Teacher Who Survived Katrina Has This Advice for Class of 2020"" and more...

https://drive.google.com/open?id=1-AiIZfnM7NpsASD1IRtiFLyJmQxQOe8L",https://facebook.com/story.php?story_fbid=3723049661101006&id=111326945606647,"DRIVE.GOOGLE.COM
4.12.2020 Welcome Back from Spring Break - April 12, 2020.pdf",0.0,"Some info about the timeline for making decisions about grading, a note about planning for graduation, a link to an article titled ""Teacher Who Survived Katrina Has This Advice for Class of 2020"" and more...

https://drive.google.com/open?id=1-AiIZfnM7NpsASD1IRtiFLyJmQxQOe8L

DRIVE.GOOGLE.COM
4.12.2020 Welcome Back from Spring Break - April 12, 2020.pdf",2020-04-12 19:09:32,,
55,2.0,https://scontent-atl3-1.xx.fbcdn.net/v/t1.0-9/fr/cp0/e15/q65/92028462_3706813369391302_6361342389285552128_o.jpg?_nc_cat=107&_nc_sid=8024bb&_nc_ohc=QF52PSZJx5YAX8JSk2E&_nc_ht=scontent-atl3-1.xx&tp=14&oh=0d181b20f86b3509e64a64939ae66c2c&oe=5F8460F3,18.0,http://cusd-ca.schoolloop.com/pf4/cms2/news_themed_display?id=1586334842443,3706814346057871,"At a time like this, it's great to share some good news: Our Music Education Program Receives National Recognition!

Carlsbad Unified School District has been honored with the Best Communities for Music Education designation from The NAMM Foundation for its outstanding commitment to music education.

Now in its 21st year, the Best Communities for Music Education designation is awarded to districts that demonstrate outstanding achievement in efforts to provide music access and education to all students.

Full announcement: http://cusd-ca.schoolloop.com/pf4/cms2/news_themed_display?id=1586334842443",https://facebook.com/story.php?story_fbid=3706814346057871&id=111326945606647,,0.0,"At a time like this, it's great to share some good news: Our Music Education Program Receives National Recognition!

Carlsbad Unified School District has been honored with the Best Communities for Music Education designation from The NAMM Foundation for its outstanding commitment to music education.

Now in its 21st year, the Best Communities for Music Education designation is awarded to districts that demonstrate outstanding achievement in efforts to provide music access and education to all students.

Full announcement: http://cusd-ca.schoolloop.com/pf4/cms2/news_themed_display?id=1586334842443",2020-04-08 12:37:18,,
56,0.0,https://scontent-atl3-1.xx.fbcdn.net/v/t1.0-9/fr/cp0/e15/q65/92456536_3701412266598079_799663992153833472_n.jpg?_nc_cat=110&_nc_sid=2d5d41&_nc_ohc=7WYZRnFFTJMAX8gzM-V&_nc_ht=scontent-atl3-1.xx&tp=14&oh=77685f3b93f3d7a77c260c1dd8aa642e&oe=5F82A855,27.0,,3701412263264746,#stayhome,,,0.0,#stayhome,2020-04-06 21:39:18,,
57,2.0,,15.0,https://www.nbcsandiego.com/news/local/carlsbad-unified-completes-first-week-of-distance-learning/2299276/,3694511037288202,Carlsbad Unified Completes First Week of Distance Learning https://www.nbcsandiego.com/news/local/carlsbad-unified-completes-first-week-of-distance-learning/2299276/,https://facebook.com/story.php?story_fbid=3694511037288202&id=111326945606647,"NBCSANDIEGO.COM
Carlsbad Unified Completes First Week of Distance Learning",0.0,"Carlsbad Unified Completes First Week of Distance Learning https://www.nbcsandiego.com/news/local/carlsbad-unified-completes-first-week-of-distance-learning/2299276/

NBCSANDIEGO.COM
Carlsbad Unified Completes First Week of Distance Learning",2020-04-04 19:58:28,,
58,1.0,,15.0,https://drive.google.com/open?id=1yTMa6W7J-rbs5trFSb3jOO22Gi9P1zoO,3691139200958719,"Thank you all for your patience and support as we officially rolled out Remote Online Learning this week. We crunched some numbers early in the week, and we had over 10,300 students access instruction through Google Classroom and Google Meet over the first few days; nearly 94% of our students were online and active this week. I’m very impressed with our students and teachers!

Please note that Spring Break is next week (April 6 through 10). Just like a traditional Spring Break, there will be no teacher-led instruction during this time. Remote Online Learning will begin again on Monday, April 13, and will continue for as long as our school facilities are closed.

More info: https://drive.google.com/open?id=1yTMa6W7J-rbs5trFSb3jOO22Gi9P1zoO",https://facebook.com/story.php?story_fbid=3691139200958719&id=111326945606647,"DRIVE.GOOGLE.COM
4.3.2020 Reminder About Spring Break for Families - April 3, 2020.pdf",0.0,"Thank you all for your patience and support as we officially rolled out Remote Online Learning this week. We crunched some numbers early in the week, and we had over 10,300 students access instruction through Google Classroom and Google Meet over the first few days; nearly 94% of our students were online and active this week. I’m very impressed with our students and teachers!

Please note that Spring Break is next week (April 6 through 10). Just like a traditional Spring Break, there will be no teacher-led instruction during this time. Remote Online Learning will begin again on Monday, April 13, and will continue for as long as our school facilities are closed.

More info: https://drive.google.com/open?id=1yTMa6W7J-rbs5trFSb3jOO22Gi9P1zoO

DRIVE.GOOGLE.COM
4.3.2020 Reminder About Spring Break for Families - April 3, 2020.pdf",2020-04-03 19:38:57,,
59,0.0,https://scontent-atl3-1.xx.fbcdn.net/v/t1.0-9/fr/cp0/e15/q65/91950706_3689802681092371_789685563354513408_o.jpg?_nc_cat=100&_nc_sid=2d5d41&_nc_ohc=oF9Ig66WPoMAX8C2nMB&_nc_ht=scontent-atl3-1.xx&tp=14&oh=bc3093dc085bdb9cd2b8f6720e67eb52&oe=5F85AE43,11.0,,3689802671092372,Self-care strategies for teens. #cusdlearns,,,0.0,Self-care strategies for teens. #cusdlearns,2020-04-03 10:37:04,,
60,0.0,https://scontent-atl3-1.xx.fbcdn.net/v/t1.0-9/fr/cp0/e15/q65/92206437_3689800381092601_4797849413072453632_o.jpg?_nc_cat=109&_nc_sid=2d5d41&_nc_ohc=sVkNo02PYQkAX93hqCv&_nc_ht=scontent-atl3-1.xx&tp=14&oh=cc5b1dc7546e0f7ab225006d8050b9f7&oe=5F83EABC,7.0,,3689800371092602,Teen guide to mental health and wellness. #cusdlearns,,,0.0,Teen guide to mental health and wellness. #cusdlearns,2020-04-03 10:36:15,,
61,4.0,,15.0,https://www.youtube.com/watch?v=ZZUHtfQBgoA&feature=youtu.be,3687631197976186,Valley Middle School broadcasting students were asked to share their thoughts and feelings about what they are experiencing. In their own words: https://www.youtube.com/watch?v=ZZUHtfQBgoA&feature=youtu.be,https://facebook.com/story.php?story_fbid=3687631197976186&id=111326945606647,"YOUTUBE.COM
In Their Own Words.",0.0,"Valley Middle School broadcasting students were asked to share their thoughts and feelings about what they are experiencing. In their own words: https://www.youtube.com/watch?v=ZZUHtfQBgoA&feature=youtu.be

YOUTUBE.COM
In Their Own Words.",2020-04-02 18:15:30,,
62,5.0,,31.0,https://drive.google.com/open?id=1N8JWER6rAJSGswHbZ1_OGs9yOBX3-AFr,3684442918295014,"Clarification about School Closures in California - April 1, 2020

Today, Governor Gavin Newsom commented in his daily press conference that all school facilities in the state of California should be closed for the rest of the school year, and all districts should fully commit to distance learning for the remainder of the school year.

He did not, however, issue an Executive Order closing all schools for the year.

As such, we are in the same situation as we were yesterday:
1. Our school facilities are closed for the moment;
2. Our teachers will continue to engage students in Remote Online Learning for as long as we’re closed; and
3. We are waiting to hear from the San Diego County public health officer about when we can safely reopen.

Read the full statement here:
https://drive.google.com/open?id=1N8JWER6rAJSGswHbZ1_OGs9yOBX3-AFr",https://facebook.com/story.php?story_fbid=3684442918295014&id=111326945606647,"DRIVE.GOOGLE.COM
Clarification about School Closures in California - April 1, 2020.pdf",14.0,"Clarification about School Closures in California - April 1, 2020

Today, Governor Gavin Newsom commented in his daily press conference that all school facilities in the state of California should be closed for the rest of the school year, and all districts should fully commit to distance learning for the remainder of the school year.

He did not, however, issue an Executive Order closing all schools for the year.

As such, we are in the same situation as we were yesterday:
1. Our school facilities are closed for the moment;
2. Our teachers will continue to engage students in Remote Online Learning for as long as we’re closed; and
3. We are waiting to hear from the San Diego County public health officer about when we can safely reopen.

Read the full statement here:
https://drive.google.com/open?id=1N8JWER6rAJSGswHbZ1_OGs9yOBX3-AFr

DRIVE.GOOGLE.COM
Clarification about School Closures in California - April 1, 2020.pdf",2020-04-01 20:47:38,,
63,0.0,,18.0,https://www.nbcsandiego.com/news/local/carlsbad-unified-school-district-begins-distance-learning/2297195/,3682704115135561,Carlsbad Unified School District Begins Distance Learning https://www.nbcsandiego.com/news/local/carlsbad-unified-school-district-begins-distance-learning/2297195/,https://facebook.com/story.php?story_fbid=3682704115135561&id=111326945606647,"NBCSANDIEGO.COM
Carlsbad Unified School District Begins Distance Learning",4.0,"Carlsbad Unified School District Begins Distance Learning https://www.nbcsandiego.com/news/local/carlsbad-unified-school-district-begins-distance-learning/2297195/

NBCSANDIEGO.COM
Carlsbad Unified School District Begins Distance Learning",2020-04-01 08:51:47,,
64,0.0,,9.0,https://sites.google.com/carlsbadusd.net/cusdonlinelearning/home,3681120591960580,,https://facebook.com/story.php?story_fbid=3681120591960580&id=111326945606647,,0.0,,2020-03-31 20:13:31,,
65,0.0,,17.0,https://drive.google.com/open?id=1J8EXNsfhwJHvziAPa3s19UA9QyvGzHBy,3677733082299331,"Today marked the start of week three of school closure. We hope your family and loved ones are safe and healthy. Mental and emotional health is incredibly important at this time, and we hope you are finding ways to stay socially connected to others while following all physical distancing guidelines.

Attached, you’ll find updates on:
1. The San Diego County public health officer’s extension of school closures, and
2. Our transition to Remote Online Learning.

https://drive.google.com/open?id=1J8EXNsfhwJHvziAPa3s19UA9QyvGzHBy",https://facebook.com/story.php?story_fbid=3677733082299331&id=111326945606647,"DRIVE.GOOGLE.COM
3.30.2020 Update on Extended School Closure - March 30, 2020.pdf",3.0,"Today marked the start of week three of school closure. We hope your family and loved ones are safe and healthy. Mental and emotional health is incredibly important at this time, and we hope you are finding ways to stay socially connected to others while following all physical distancing guidelines.

Attached, you’ll find updates on:
1. The San Diego County public health officer’s extension of school closures, and
2. Our transition to Remote Online Learning.

https://drive.google.com/open?id=1J8EXNsfhwJHvziAPa3s19UA9QyvGzHBy

DRIVE.GOOGLE.COM
3.30.2020 Update on Extended School Closure - March 30, 2020.pdf",2020-03-30 19:43:42,,
66,0.0,https://scontent-atl3-1.xx.fbcdn.net/v/t1.0-9/fr/cp0/e15/q65/91860754_3676856995720273_2524052430459502592_o.jpg?_nc_cat=109&_nc_sid=2d5d41&_nc_ohc=BZye15U_X2gAX_z-mdK&_nc_ht=scontent-atl3-1.xx&tp=14&oh=1bd3fda04064341d659987b009f09eb2&oe=5F864B68,7.0,,3676856989053607,Tips for supporting mental health during the stay-at-home order. #cusdlearns,,,0.0,Tips for supporting mental health during the stay-at-home order. #cusdlearns,2020-03-30 13:22:56,,
67,0.0,https://scontent-atl3-1.xx.fbcdn.net/v/t1.0-9/fr/cp0/e15/q65/91374395_3095857660458275_110314839133388800_n.jpg?_nc_cat=111&_nc_sid=110474&_nc_ohc=M-m1tKvtQUcAX9DeRx3&_nc_ht=scontent-atl3-1.xx&tp=14&oh=1eb8930fa13c07a38217be4ed0ba465a&oe=5F833147,9.0,https://covid-19.sdcoe.net/Parent-Resources,3673376499401656,Mental and emotion health are as important as ever during this time of school closure.,https://facebook.com/story.php?story_fbid=3673376499401656&id=111326945606647,"San Diego County Office of Education
March 28 at 7:16 AM ·

The mental health effects of COVID-19 are as important to address as the physical health effects. This is especially true for the one in five who already have mental health conditions – or the one in two who are at risk of developing them.

Be sure to take time this weekend to take care of yourself - take a break from the news, get some fresh air, talk to a friend - so you can help your child through this time. Here are some ways you can create a safe emotional and physical environment for your student.

Find more resources at https://covid-19.sdcoe.net/Parent-Resources.

#StayHome #InItTogether #COVID19 #ParentResources #MentalHealthMatters",0.0,"Mental and emotion health are as important as ever during this time of school closure.

San Diego County Office of Education
March 28 at 7:16 AM ·

The mental health effects of COVID-19 are as important to address as the physical health effects. This is especially true for the one in five who already have mental health conditions – or the one in two who are at risk of developing them.

Be sure to take time this weekend to take care of yourself - take a break from the news, get some fresh air, talk to a friend - so you can help your child through this time. Here are some ways you can create a safe emotional and physical environment for your student.

Find more resources at https://covid-19.sdcoe.net/Parent-Resources.

#StayHome #InItTogether #COVID19 #ParentResources #MentalHealthMatters",2020-03-29 12:13:36,,
68,0.0,,4.0,https://drive.google.com/file/d/1G8pi4Orx8LscNMv-cbsP4PcNvFCRnui8/view,3667000710039235,"As shared previously, on Monday, March 30 we’re changing the location of our daily meal service from Jefferson Elementary to Carlsbad High School. Meal distribution will continue to include breakfast and lunch, and service will remain during the hours of 11:30 am to 1 pm, Monday through Friday.

Here's some more information about that, as well as information about the devices needed for accessing Remote Online Learning (spoiler: students do not need a district-issued chromebook to receive lessons from their teacher. Any internet connected computer, tablet or cell phone will work.)

https://drive.google.com/file/d/1G8pi4Orx8LscNMv-cbsP4PcNvFCRnui8/view",https://facebook.com/story.php?story_fbid=3667000710039235&id=111326945606647,"DRIVE.GOOGLE.COM
3.27.2020 Chromebook and Meal Service Location Update - March 27, 2020.pdf",2.0,"As shared previously, on Monday, March 30 we’re changing the location of our daily meal service from Jefferson Elementary to Carlsbad High School. Meal distribution will continue to include breakfast and lunch, and service will remain during the hours of 11:30 am to 1 pm, Monday through Friday.

Here's some more information about that, as well as information about the devices needed for accessing Remote Online Learning (spoiler: students do not need a district-issued chromebook to receive lessons from their teacher. Any internet connected computer, tablet or cell phone will work.)

https://drive.google.com/file/d/1G8pi4Orx8LscNMv-cbsP4PcNvFCRnui8/view

DRIVE.GOOGLE.COM
3.27.2020 Chromebook and Meal Service Location Update - March 27, 2020.pdf",2020-03-27 14:13:01,,
69,5.0,,19.0,https://drive.google.com/open?id=14TKcqYQDq1GgnTryYiqK_DxhJsM6xthQ,3661013850637921,,https://facebook.com/story.php?story_fbid=3661013850637921&id=111326945606647,,6.0,,2020-03-25 18:54:06,,
70,0.0,,5.0,https://www.sdcoe.net/news/Pages/20-03-13-student-food-service-during-district-closures.aspx,3660342994038340,,https://facebook.com/story.php?story_fbid=3660342994038340&id=111326945606647,,3.0,,2020-03-25 14:19:02,,
71,1.0,,3.0,https://sites.google.com/carlsbadusd.net/cusd-optional-ext-learn-activ/home,3652919701447336,"As we begin week 2 of school closures, we hope everyone is staying safe and keeping active.

If you haven’t yet done so, please share our Extended Learning Activities website with your student. We’ve included day-by-day activities by grade level and content area, as well as sample daily schedules for students. If your student has already started working on the daily activities, please continue with the next day in the sequence. If your child hasn’t yet started working on the daily activities, no problem; today is a great day to start!

https://sites.google.com/carlsbadusd.net/cusd-optional-ext-learn-activ/home

Please continue to follow all local, county, and statewide directives on physical distancing / social distancing. We're using both terms here because, while it is important to physically distance ourselves during this time, it’s never been more important to find ways to stay socially connected.",https://facebook.com/story.php?story_fbid=3652919701447336&id=111326945606647,"SITES.GOOGLE.COM
CUSD Optional Extended Learning Activities",0.0,"As we begin week 2 of school closures, we hope everyone is staying safe and keeping active.

If you haven’t yet done so, please share our Extended Learning Activities website with your student. We’ve included day-by-day activities by grade level and content area, as well as sample daily schedules for students. If your student has already started working on the daily activities, please continue with the next day in the sequence. If your child hasn’t yet started working on the daily activities, no problem; today is a great day to start!

https://sites.google.com/carlsbadusd.net/cusd-optional-ext-learn-activ/home

Please continue to follow all local, county, and statewide directives on physical distancing / social distancing. We're using both terms here because, while it is important to physically distance ourselves during this time, it’s never been more important to find ways to stay socially connected.

SITES.GOOGLE.COM
CUSD Optional Extended Learning Activities",2020-03-23 09:55:00,,
72,0.0,https://scontent-atl3-1.xx.fbcdn.net/v/t1.0-9/90335616_2852443441458303_4620496864662257664_o.png?_nc_cat=103&_nc_sid=8024bb&_nc_ohc=CtQwtmra60YAX_eZ_DM&_nc_ht=scontent-atl3-1.xx&oh=7c85e114a6f0216f5a2ab10f93bb4cfb&oe=5F83ABB3,6.0,https://www.sandiegocounty.gov/content/dam/sdc/hhsa/programs/phs/Epidemiology/COVID-19%20Daily%20Update_City%20of%20Residence.pdf,3648140298591943,Important update from City of Carlsbad - Official. Please help stop the spread of COVID-19. We’re all in this together!,https://facebook.com/story.php?story_fbid=3648140298591943&id=111326945606647,"City of Carlsbad - Official
March 21 at 8:09 PM ·

Sorry to say that the latest numbers are out, and Carlsbad now has 11 confirmed COVID-19 cases. Starting tomorrow we are closing:

Athletic fields
Basketball courts
Dog parks
Pickleball courts
Picnic amenities
Playgrounds
Skate parks
Tennis courts

Please continue to go outside for walks, but do not gather and do not get closer than 6 feet from each other. We need to all work together on this. Our Police Department can't be at all the parks all the time. We need your help. It's only been 2 days -- some people might not know -- or maybe they don't understand the importance. Be kind to each other and help share this important information.

https://www.sandiegocounty.gov/content/dam/sdc/hhsa/programs/phs/Epidemiology/COVID-19%20Daily%20Update_City%20of%20Residence.pdf",5.0,"Important update from City of Carlsbad - Official. Please help stop the spread of COVID-19. We’re all in this together!

City of Carlsbad - Official
March 21 at 8:09 PM ·

Sorry to say that the latest numbers are out, and Carlsbad now has 11 confirmed COVID-19 cases. Starting tomorrow we are closing:

Athletic fields
Basketball courts
Dog parks
Pickleball courts
Picnic amenities
Playgrounds
Skate parks
Tennis courts

Please continue to go outside for walks, but do not gather and do not get closer than 6 feet from each other. We need to all work together on this. Our Police Department can't be at all the parks all the time. We need your help. It's only been 2 days -- some people might not know -- or maybe they don't understand the importance. Be kind to each other and help share this important information.

https://www.sandiegocounty.gov/content/dam/sdc/hhsa/programs/phs/Epidemiology/COVID-19%20Daily%20Update_City%20of%20Residence.pdf",2020-03-21 23:29:43,,
73,0.0,https://scontent-atl3-1.xx.fbcdn.net/v/t1.0-9/90351300_3646777772061529_843507860124991488_n.png?_nc_cat=106&_nc_sid=8024bb&_nc_ohc=jXRawJw5dbcAX_tidXg&_nc_ht=scontent-atl3-1.xx&oh=057255b906500e18fb2e0fa31ead36da&oe=5F83827D,11.0,https://www.youtube.com/watch?v=Nlyxz2X97Do,3646779222061384,"Just a quick reminder about social distancing and California's stay-at-home order - at this time, it’s really important to reduce the possible transmission of COVID-19 by following a few basic principles.

Do the five!
1. HANDS - Wash them often
2. ELBOW - Cough into it
3. FACE - Don’t touch it
4. SPACE - Keep a safe distance (at least six feet apart)
5. HOME - Stay if you can

What is social distancing? Here’s a quick video explanation by Dr. Anthony Fauci, Dr. Deborah Birx, and U.S. Surgeon General Jerome Adams: https://www.youtube.com/watch?v=Nlyxz2X97Do

We’d all like to get back to school and work as quickly as possible; please help reduce the spread of COVID-19 by staying away from groups and gatherings during this critical time.",https://facebook.com/story.php?story_fbid=3646779222061384&id=111326945606647,,0.0,"Just a quick reminder about social distancing and California's stay-at-home order - at this time, it’s really important to reduce the possible transmission of COVID-19 by following a few basic principles.

Do the five!
1. HANDS - Wash them often
2. ELBOW - Cough into it
3. FACE - Don’t touch it
4. SPACE - Keep a safe distance (at least six feet apart)
5. HOME - Stay if you can

What is social distancing? Here’s a quick video explanation by Dr. Anthony Fauci, Dr. Deborah Birx, and U.S. Surgeon General Jerome Adams: https://www.youtube.com/watch?v=Nlyxz2X97Do

We’d all like to get back to school and work as quickly as possible; please help reduce the spread of COVID-19 by staying away from groups and gatherings during this critical time.",2020-03-21 13:47:51,,
74,0.0,,6.0,https://drive.google.com/open?id=10D81R-wlLdIQnwg2bC7MMIwHEqkD4_bg,3644005925672047,"We hope everyone in our community is staying physically and emotionally healthy, especially following the Governor’s announcement of our new stay-at-home order.

We've included four quick items for families in today's update:
https://drive.google.com/open?id=10D81R-wlLdIQnwg2bC7MMIwHEqkD4_bg",https://facebook.com/story.php?story_fbid=3644005925672047&id=111326945606647,"DRIVE.GOOGLE.COM
3.20.2020 Update During School Closure - March 20, 2020.pdf",0.0,"We hope everyone in our community is staying physically and emotionally healthy, especially following the Governor’s announcement of our new stay-at-home order.

We've included four quick items for families in today's update:
https://drive.google.com/open?id=10D81R-wlLdIQnwg2bC7MMIwHEqkD4_bg

DRIVE.GOOGLE.COM
3.20.2020 Update During School Closure - March 20, 2020.pdf",2020-03-20 18:04:38,,
75,0.0,,16.0,https://drive.google.com/open?id=1q_KSQ7KAV_SsYnegyPpb4eRtMw5B84Qz,3640441842695122,"Update: March 19, 2020

Yesterday we shared with you our newly released Extended Learning Activities website with daily activities for students in grades K through 12. We also shared recommended daily schedules for students to follow while they’re learning at home. Our website currently provides extended learning activities for each day until Spring Break (which begins on April 6).

We’ve received a few questions about why the student activities are not required. Put simply, we currently want to ensure student physical and emotional wellness before requiring completion of learning activities. Many of our students may not be in a place to focus fully on learning right now, and we don’t want to add additional pressure at this time to an already stressful situation.

That said, we're currently working to develop additional tools and resources for online learning; more info to come!

Here's the full message from today with additional info: https://drive.google.com/open?id=1q_KSQ7KAV_SsYnegyPpb4eRtMw5B84Qz",https://facebook.com/story.php?story_fbid=3640441842695122&id=111326945606647,"DRIVE.GOOGLE.COM
3.19.2020 Update During School Closure - March 19, 2020.pdf",2.0,"Update: March 19, 2020

Yesterday we shared with you our newly released Extended Learning Activities website with daily activities for students in grades K through 12. We also shared recommended daily schedules for students to follow while they’re learning at home. Our website currently provides extended learning activities for each day until Spring Break (which begins on April 6).

We’ve received a few questions about why the student activities are not required. Put simply, we currently want to ensure student physical and emotional wellness before requiring completion of learning activities. Many of our students may not be in a place to focus fully on learning right now, and we don’t want to add additional pressure at this time to an already stressful situation.

That said, we're currently working to develop additional tools and resources for online learning; more info to come!

Here's the full message from today with additional info: https://drive.google.com/open?id=1q_KSQ7KAV_SsYnegyPpb4eRtMw5B84Qz

DRIVE.GOOGLE.COM
3.19.2020 Update During School Closure - March 19, 2020.pdf",2020-03-19 17:09:13,,
76,3.0,,9.0,https://sites.google.com/carlsbadusd.net/cusd-optional-ext-learn-activ/home,3637170966355543,,https://facebook.com/story.php?story_fbid=3637170966355543&id=111326945606647,,10.0,,2020-03-18 17:18:37,,
77,1.0,,4.0,https://vimeo.com/398088452,3632710256801614,"Parents, please share this important #socialdistancing message with your kids. They’ll listen to what other young people have to say. Thanks to Student Broadcast Journalism and Storytelling- Carlsbad, California for this important public service announcement. https://vimeo.com/398088452",https://facebook.com/story.php?story_fbid=3632710256801614&id=111326945606647,"VIMEO.COM
CORONAVIRUS- WE'RE IN THIS TOGETHER",7.0,"Parents, please share this important #socialdistancing message with your kids. They’ll listen to what other young people have to say. Thanks to Student Broadcast Journalism and Storytelling- Carlsbad, California for this important public service announcement. https://vimeo.com/398088452

VIMEO.COM
CORONAVIRUS- WE'RE IN THIS TOGETHER",2020-03-17 11:08:17,,
78,0.0,,2.0,https://drive.google.com/open?id=1t2XpGXXUG9tbP4dsXMyn-XFimJDEzPqK,3627107894028517,"Updated list of meal service sites in North County as of March 15, 2020: https://drive.google.com/open?id=1t2XpGXXUG9tbP4dsXMyn-XFimJDEzPqK

The countywide list can be found here: https://www.sdcoe.net/news/Pages/20-03-13-student-food-service-during-district-closures.aspx",https://facebook.com/story.php?story_fbid=3627107894028517&id=111326945606647,"DRIVE.GOOGLE.COM
3.15.2020 Updated List of Meal Service Sites in North County - March 15, 2020.pdf",0.0,"Updated list of meal service sites in North County as of March 15, 2020: https://drive.google.com/open?id=1t2XpGXXUG9tbP4dsXMyn-XFimJDEzPqK

The countywide list can be found here: https://www.sdcoe.net/news/Pages/20-03-13-student-food-service-during-district-closures.aspx

DRIVE.GOOGLE.COM
3.15.2020 Updated List of Meal Service Sites in North County - March 15, 2020.pdf",2020-03-15 19:07:13,,
79,1.0,,10.0,https://cusd-ca.schoolloop.com/covid-19,3626745644064742,,https://facebook.com/story.php?story_fbid=3626745644064742&id=111326945606647,,0.0,,2020-03-15 16:29:01,,
80,1.0,,17.0,https://cusd-ca.schoolloop.com/covid-19,3626693897403250,,https://facebook.com/story.php?story_fbid=3626693897403250&id=111326945606647,,0.0,,2020-03-15 16:09:29,,
81,1.0,,23.0,https://drive.google.com/open?id=1s0TU3GkQM0LFD_7SuTGosmoARKXB5YzX,3623102144429092,"Beginning Monday, March 16, Carlsbad Unified will provide temporary lunch service at Jefferson Elementary School in Carlsbad. Foods will be portable so that families may take the food to go. Food service will be available from 11:30 am to 1:00 pm, Monday through Friday. Jefferson Elementary's address is 3743 Jefferson St., Carlsbad CA 92008.

Any student age 2 to 18 can go to any school site providing meals and receive food during this period of school closures due to COVID-19.

Here's more info, as well as additional North County school sites offering meals: https://drive.google.com/open?id=1s0TU3GkQM0LFD_7SuTGosmoARKXB5YzX",https://facebook.com/story.php?story_fbid=3623102144429092&id=111326945606647,"DRIVE.GOOGLE.COM
3.14.2020 Food service sites during school closure - as of March 14, 2020.pdf",78.0,"Beginning Monday, March 16, Carlsbad Unified will provide temporary lunch service at Jefferson Elementary School in Carlsbad. Foods will be portable so that families may take the food to go. Food service will be available from 11:30 am to 1:00 pm, Monday through Friday. Jefferson Elementary's address is 3743 Jefferson St., Carlsbad CA 92008.

Any student age 2 to 18 can go to any school site providing meals and receive food during this period of school closures due to COVID-19.

Here's more info, as well as additional North County school sites offering meals: https://drive.google.com/open?id=1s0TU3GkQM0LFD_7SuTGosmoARKXB5YzX

DRIVE.GOOGLE.COM
3.14.2020 Food service sites during school closure - as of March 14, 2020.pdf",2020-03-14 15:10:34,,
82,10.0,,18.0,https://drive.google.com/open?id=1Lbrwfw2r39RnHRsEIzT9UpqDjOJ_QVsw,3620894761316497,"This evening, our Board of Trustees held an emergency meeting to review and discuss our district response to the unfolding COVID-19 situation. We made the decision this evening to move our spring break from the week of April 13 to the week of April 6, for the sake of continuity of school closure. In order to curb the potential transmission of COVID-19, all Carlsbad Unified schools will be closed from Monday, March 16 through Friday, April 10, 2020 (which now includes one week of spring break). Students will return to school on Monday, April 13, 2020. See the full statement here: https://drive.google.com/open?id=1Lbrwfw2r39RnHRsEIzT9UpqDjOJ_QVsw",https://facebook.com/story.php?story_fbid=3620894761316497&id=111326945606647,"DRIVE.GOOGLE.COM
3.13.2020 Modification of spring break - March 13, 2020.pdf",22.0,"This evening, our Board of Trustees held an emergency meeting to review and discuss our district response to the unfolding COVID-19 situation. We made the decision this evening to move our spring break from the week of April 13 to the week of April 6, for the sake of continuity of school closure. In order to curb the potential transmission of COVID-19, all Carlsbad Unified schools will be closed from Monday, March 16 through Friday, April 10, 2020 (which now includes one week of spring break). Students will return to school on Monday, April 13, 2020. See the full statement here: https://drive.google.com/open?id=1Lbrwfw2r39RnHRsEIzT9UpqDjOJ_QVsw

DRIVE.GOOGLE.COM
3.13.2020 Modification of spring break - March 13, 2020.pdf",2020-03-13 23:23:19,,
83,4.0,,8.0,https://drive.google.com/open?id=11JYS5YFpBql_CYSDiKdZHByTDsXMP-sD,3620156558056984,"Here is a copy of our communication from 2:30 pm today (March 13). Schools will be closed at least through April 3, with more information to be shared as soon as possible.
https://drive.google.com/open?id=11JYS5YFpBql_CYSDiKdZHByTDsXMP-sD",https://facebook.com/story.php?story_fbid=3620156558056984&id=111326945606647,"DRIVE.GOOGLE.COM
3.13.2020 Additional info about school closure - March 13, 2020.pdf",9.0,"Here is a copy of our communication from 2:30 pm today (March 13). Schools will be closed at least through April 3, with more information to be shared as soon as possible.
https://drive.google.com/open?id=11JYS5YFpBql_CYSDiKdZHByTDsXMP-sD

DRIVE.GOOGLE.COM
3.13.2020 Additional info about school closure - March 13, 2020.pdf",2020-03-13 17:32:51,,
84,4.0,,42.0,,3619448078127832,"Carlsbad Unified School District is providing preliminary notice of school closure for the entire district beginning Monday, March 16. We will provide more information later today.

Our highest priority is the health and safety of our students, families, staff and community. Thank you for your patience in these unprecedented times.",https://facebook.com/story.php?story_fbid=3619448078127832&id=111326945606647,,0.0,"Carlsbad Unified School District is providing preliminary notice of school closure for the entire district beginning Monday, March 16. We will provide more information later today.

Our highest priority is the health and safety of our students, families, staff and community. Thank you for your patience in these unprecedented times.",2020-03-13 12:46:14,,
85,16.0,,15.0,https://drive.google.com/file/d/1MoKTNCRHcgj8jQCub1g6Fn-Wfzj443u_/view,3617753044964002,"Here is a copy of the most recent parent communication regarding COVID-19. Schools will not be closed without direction from county health officials. As of this evening, their recommendation is that the closing of schools would be premature. https://drive.google.com/file/d/1MoKTNCRHcgj8jQCub1g6Fn-Wfzj443u_/view",https://facebook.com/story.php?story_fbid=3617753044964002&id=111326945606647,"DRIVE.GOOGLE.COM
3.12.2020 Additional COVID-19 Guidance to Families and Staff - March 12, 2020.pdf",5.0,"Here is a copy of the most recent parent communication regarding COVID-19. Schools will not be closed without direction from county health officials. As of this evening, their recommendation is that the closing of schools would be premature. https://drive.google.com/file/d/1MoKTNCRHcgj8jQCub1g6Fn-Wfzj443u_/view

DRIVE.GOOGLE.COM
3.12.2020 Additional COVID-19 Guidance to Families and Staff - March 12, 2020.pdf",2020-03-13 00:12:06,,
86,8.0,,10.0,https://drive.google.com/file/d/1ZTn9NPRYiEtvZlvxRH4CBWosGU23etwS/view,3616659295073377,Here is a copy of the most recent parent communication regarding COVID-19: https://drive.google.com/file/d/1ZTn9NPRYiEtvZlvxRH4CBWosGU23etwS/view,https://facebook.com/story.php?story_fbid=3616659295073377&id=111326945606647,"DRIVE.GOOGLE.COM
3.12.2020 COVID-19 and Large Gatherings - Message to Parents and Staff - March 12, 2020 - Google Docs.pdf",0.0,"Here is a copy of the most recent parent communication regarding COVID-19: https://drive.google.com/file/d/1ZTn9NPRYiEtvZlvxRH4CBWosGU23etwS/view

DRIVE.GOOGLE.COM
3.12.2020 COVID-19 and Large Gatherings - Message to Parents and Staff - March 12, 2020 - Google Docs.pdf",2020-03-12 15:37:03,,
87,1.0,,6.0,https://cusd-ca.schoolloop.com/covid-19,3616654591740514,We are providing updates related to Coronavirus here: https://cusd-ca.schoolloop.com/covid-19,https://facebook.com/story.php?story_fbid=3616654591740514&id=111326945606647,"CUSD-CA.SCHOOLLOOP.COM
Coronavirus (COVID-19) Updates",0.0,"We are providing updates related to Coronavirus here: https://cusd-ca.schoolloop.com/covid-19

CUSD-CA.SCHOOLLOOP.COM
Coronavirus (COVID-19) Updates",2020-03-12 15:35:23,,
88,1.0,https://scontent-atl3-1.xx.fbcdn.net/v/t1.0-9/fr/cp0/e15/q65/87800641_3578180235587950_6017336313697533952_o.jpg?_nc_cat=106&_nc_sid=2d5d41&_nc_ohc=4y0cwKzPkNkAX-tD1d5&_nc_ht=scontent-atl3-1.xx&tp=14&oh=a986d0e10cceb270444b2ce5a5776c6a&oe=5F849E48,8.0,,3578180228921284,"Fun in the sun - today we have 35 teams from our elementary and middle schools competing in the 8th annual @firstroboticscalifornia #FLL robotics showcase, powered by @carlsbadedfoundation. Thank you to #CEF for sponsoring robotics in our district, and thank you to the teams from Carlsbad High and Sage Creek High for helping with the judging. Great job today to all the teams! #cusdlearns",,,0.0,"Fun in the sun - today we have 35 teams from our elementary and middle schools competing in the 8th annual @firstroboticscalifornia #FLL robotics showcase, powered by @carlsbadedfoundation. Thank you to #CEF for sponsoring robotics in our district, and thank you to the teams from Carlsbad High and Sage Creek High for helping with the judging. Great job today to all the teams! #cusdlearns",2020-02-29 16:54:58,,
89,7.0,https://scontent-atl3-1.xx.fbcdn.net/v/t1.0-9/fr/cp0/e15/q65/88056501_3572101296195844_586830160565633024_o.jpg?_nc_cat=109&_nc_sid=2d5d41&_nc_ohc=DuU8fcbv3Q8AX91nPll&_nc_ht=scontent-atl3-1.xx&tp=14&oh=9e2c92dd1ccc0dfd06e7512f8a778b71&oe=5F842544,34.0,,3572101289529178,"Congrats to Mrs. Katie Browne, recipient of the Artful Advocate Award at the Arts Empower Ovation Awards! @sandiegocoe @aomsband #cusdlearns",,,0.0,"Congrats to Mrs. Katie Browne, recipient of the Artful Advocate Award at the Arts Empower Ovation Awards! @sandiegocoe @aomsband #cusdlearns",2020-02-27 22:14:58,,
90,0.0,https://scontent-atl3-1.xx.fbcdn.net/v/t1.0-9/fr/cp0/e15/q65/87788810_3565113813561259_7626514479081062400_o.jpg?_nc_cat=100&_nc_sid=2d5d41&_nc_ohc=lFgQPn_TG-QAX9YVC2r&_nc_ht=scontent-atl3-1.xx&tp=14&oh=fd81e1a58075fb13cc7289307cb2d35e&oe=5F836765,8.0,,3565113810227926,Thank you @carlsbadchamber for recognizing students each month - we’re proud that Steven and Destini from @carlsbadhslancers and @scbobcats were two of your #RisingStars this morning! @carlsbadedfoundation #cusdlearns,,,0.0,Thank you @carlsbadchamber for recognizing students each month - we’re proud that Steven and Destini from @carlsbadhslancers and @scbobcats were two of your #RisingStars this morning! @carlsbadedfoundation #cusdlearns,2020-02-25 16:31:58,,
91,0.0,,1.0,https://pedal.carlsbaded.org/about_us.asp,3551888848217089,"The 6th Annual Spin for Schools
Saturday, March 21, 2020
10 a.m. to 1 p.m.
Omni La Costa Resort and Spa Plaza
https://pedal.carlsbaded.org/about_us.asp",https://facebook.com/story.php?story_fbid=3551888848217089&id=111326945606647,"Spin for Schools
Spin for Schools

Spin for Schools
Spin for Schools

Spin for Schools
Spin for Schools

Spin for Schools
Spin for Schools

See more at
pedal.carlsbaded.org",0.0,"The 6th Annual Spin for Schools
Saturday, March 21, 2020
10 a.m. to 1 p.m.
Omni La Costa Resort and Spa Plaza
https://pedal.carlsbaded.org/about_us.asp

Spin for Schools
Spin for Schools

Spin for Schools
Spin for Schools

Spin for Schools
Spin for Schools

Spin for Schools
Spin for Schools

See more at
pedal.carlsbaded.org",2020-02-21 12:15:03,,
92,0.0,https://scontent-atl3-1.xx.fbcdn.net/v/t1.0-9/fr/cp0/e15/q65/87301630_3551576761581631_804798479527313408_o.jpg?_nc_cat=109&_nc_sid=8024bb&_nc_ohc=5Cazlt0Cz1IAX-Pu0Mf&_nc_ht=scontent-atl3-1.xx&tp=14&oh=8316dc215d69664ed900e5e5cd4e54e2&oe=5F85BC5F,0.0,https://cusd-ca.schoolloop.com/lcap-survey,3551577134914927,https://cusd-ca.schoolloop.com/lcap-survey,https://facebook.com/story.php?story_fbid=3551577134914927&id=111326945606647,,0.0,https://cusd-ca.schoolloop.com/lcap-survey,2020-02-21 10:21:55,,
93,0.0,,1.0,https://www.smore.com/zsvum,3548679078538066,Our monthly newsletter is available now! https://www.smore.com/zsvum,https://facebook.com/story.php?story_fbid=3548679078538066&id=111326945606647,"SMORE.COM
CARLSBAD UNIFIED CONNECTIONS",0.0,"Our monthly newsletter is available now! https://www.smore.com/zsvum

SMORE.COM
CARLSBAD UNIFIED CONNECTIONS",2020-02-20 14:02:45,,
94,0.0,https://scontent-atl3-1.xx.fbcdn.net/v/t1.0-9/fr/cp0/e15/q65/87052845_3545703065502334_2608486037185363968_o.jpg?_nc_cat=104&_nc_sid=2d5d41&_nc_ohc=IGyVqk7b_rIAX-vr8jr&_nc_ht=scontent-atl3-1.xx&tp=14&oh=853f4c90318bb871deb33bf18b1352fc&oe=5F82756D,4.0,,3545703062169001,"Meeting of the Board at 6 pm on February 19, 2020.",,,0.0,"Meeting of the Board at 6 pm on February 19, 2020.",2020-02-19 15:12:19,,
95,0.0,https://scontent-atl3-1.xx.fbcdn.net/v/t1.0-9/fr/cp0/e15/q65/86287493_3526161250789849_6779539953282973696_o.jpg?_nc_cat=107&_nc_sid=2d5d41&_nc_ohc=Vk_W58tf-BwAX-xDneY&_nc_ht=scontent-atl3-1.xx&tp=14&oh=9c6153ea749fb4a60056e79c3ce22247&oe=5F8505F2,8.0,,3526161247456516,Enjoy the long weekend!,,,0.0,Enjoy the long weekend!,2020-02-13 20:57:41,,
96,0.0,https://scontent-atl3-1.xx.fbcdn.net/v/t1.0-9/fr/cp0/e15/q65/83888638_3524667544272553_5630907742320328704_o.jpg?_nc_cat=100&_nc_sid=8024bb&_nc_ohc=3zlA0lc7mRkAX8JQVV_&_nc_ht=scontent-atl3-1.xx&tp=14&oh=25aa46cd3b1f68f4e05356a87e816581&oe=5F852967,1.0,http://www.carlsbadusd.k12.ca.us/,3524668850939089,http://www.carlsbadusd.k12.ca.us,https://facebook.com/story.php?story_fbid=3524668850939089&id=111326945606647,,0.0,http://www.carlsbadusd.k12.ca.us,2020-02-13 11:33:35,,
97,0.0,,4.0,https://www.smore.com/05b7r,3513951412010833,"Each year, we produce a District video to highlight our many excellent programs. This year the focus of our video is on the Visual and Performing Arts, or VAPA. Enjoy!
https://www.smore.com/05b7r",https://facebook.com/story.php?story_fbid=3513951412010833&id=111326945606647,"SMORE.COM
VAPA: Visual and Performing Arts",2.0,"Each year, we produce a District video to highlight our many excellent programs. This year the focus of our video is on the Visual and Performing Arts, or VAPA. Enjoy!
https://www.smore.com/05b7r

SMORE.COM
VAPA: Visual and Performing Arts",2020-02-10 12:16:40,,
98,1.0,,30.0,https://www.nbcsandiego.com/community/inspirational-teacher-of-the-month/inspirational-teacher-of-the-month-valerie-park/2259712/,3513910355348272,So proud of Mrs. Park and the Sage Creek High School Biomed Pathway! Thank you to NBC 7 San Diego and San Diego County Office of Education for recognizing her as the #InspirationalTeacheroftheMonth https://www.nbcsandiego.com/community/inspirational-teacher-of-the-month/inspirational-teacher-of-the-month-valerie-park/2259712/ #cusdlearns,https://facebook.com/story.php?story_fbid=3513910355348272&id=111326945606647,"NBCSANDIEGO.COM
Inspirational Teacher of the Month: Valerie Park",3.0,"So proud of Mrs. Park and the Sage Creek High School Biomed Pathway! Thank you to NBC 7 San Diego and San Diego County Office of Education for recognizing her as the #InspirationalTeacheroftheMonth https://www.nbcsandiego.com/community/inspirational-teacher-of-the-month/inspirational-teacher-of-the-month-valerie-park/2259712/ #cusdlearns

NBCSANDIEGO.COM
Inspirational Teacher of the Month: Valerie Park",2020-02-10 12:05:23,,
99,0.0,https://scontent-atl3-1.xx.fbcdn.net/v/t1.0-9/fr/cp0/e15/q65/85236450_3504079272998047_6816194484087291904_o.jpg?_nc_cat=105&_nc_sid=8024bb&_nc_ohc=SY1pGkZ-sfcAX9M93Zg&_nc_ht=scontent-atl3-1.xx&tp=14&oh=6d784d9748f4fa6025a66b86f63e2c0f&oe=5F82F04A,0.0,https://cusd-ca.schoolloop.com/lcap-survey,3504079486331359,https://cusd-ca.schoolloop.com/lcap-survey,https://facebook.com/story.php?story_fbid=3504079486331359&id=111326945606647,,0.0,https://cusd-ca.schoolloop.com/lcap-survey,2020-02-07 16:11:41,,
100,0.0,,1.0,https://www.surveymonkey.com/r/STLD97D,3503870543018920,"Dear Carlsbad Unified families,

We’d like your input! Here are links to our survey, in English and Spanish, for the purposes of engaging teachers, staff, parents, students, and the community in the process of setting next year's goals and priorities.

https://www.surveymonkey.com/r/STLD97D English

https://www.surveymonkey.com/r/NHZR5CM Spanish

These goals and priorities become part of our LCAP (Local Control Accountability Plan), a three-year plan that describes our overall vision for students, the results we expect to achieve, and key actions we will take to achieve these results. The three-year plan will also describe how our District's budget is aligned with our goals and priorities.

This survey will take about 5 minutes to complete. Again, thank you for your time and your support for the education of our students.

Sincerely,

Veronica Williams, President, Board of Trustees
Dr. Ben Churchill, Superintendent",https://facebook.com/story.php?story_fbid=3503870543018920&id=111326945606647,"SURVEYMONKEY.COM
LCAP Survey for 2019-2020",0.0,"Dear Carlsbad Unified families,

We’d like your input! Here are links to our survey, in English and Spanish, for the purposes of engaging teachers, staff, parents, students, and the community in the process of setting next year's goals and priorities.

https://www.surveymonkey.com/r/STLD97D English

https://www.surveymonkey.com/r/NHZR5CM Spanish

These goals and priorities become part of our LCAP (Local Control Accountability Plan), a three-year plan that describes our overall vision for students, the results we expect to achieve, and key actions we will take to achieve these results. The three-year plan will also describe how our District's budget is aligned with our goals and priorities.

This survey will take about 5 minutes to complete. Again, thank you for your time and your support for the education of our students.

Sincerely,

Veronica Williams, President, Board of Trustees
Dr. Ben Churchill, Superintendent

SURVEYMONKEY.COM
LCAP Survey for 2019-2020",2020-02-07 14:51:12,,
101,1.0,,4.0,,3500689053337069,"Hoopcoming at Sage Creek High School on February 7, 2020! This annual tradition includes fun filled spirit days, carnival, and their home boys and girls basketball games on Friday evening. We hope you can join them! Sage Creek High School",,,0.0,"Hoopcoming at Sage Creek High School on February 7, 2020! This annual tradition includes fun filled spirit days, carnival, and their home boys and girls basketball games on Friday evening. We hope you can join them! Sage Creek High School",2020-02-06 16:50:22,https://video-atl3-1.xx.fbcdn.net/v/t42.9040-2/85548922_2561652540771539_2672185551850831872_n.mp4?_nc_cat=101&_nc_sid=985c63&efg=eyJ2ZW5jb2RlX3RhZyI6ImxlZ2FjeV9zZCJ9&_nc_ohc=UXlBcA6QB4kAX8W2_dU&_nc_oc=AQloj0uDxUDr9f3KRRAf3DtmD4X0AqdgefCiYk_R1PedhhZNpQ_TW4IhHLaD0hu4eKE&_nc_ht=video-atl3-1.xx&oh=9ac936d31710b7f509c62186ac40a7ee&oe=5F5EEFE4,
102,0.0,https://scontent-atl3-1.xx.fbcdn.net/v/t1.0-9/fr/cp0/e15/q65/84645602_3495879573818017_8947613176283791360_o.jpg?_nc_cat=110&_nc_sid=2d5d41&_nc_ohc=exsipat4ZDUAX84eDaJ&_nc_ht=scontent-atl3-1.xx&tp=14&oh=75b9c1c7fd1f77014e53aca2d0a87d04&oe=5F84D8A9,11.0,,3495879567151351,"Thank you to the City of Carlsbad for convening a meeting of superintendents and board members from the four public school districts with schools in Carlsbad. Superintendent Churchill, Board President Williams, and Trustee Pearson met with Mayor Hall, Councilmember Bhat-Patel, and representatives from San Marcos Unified School District, San Dieguito Union High School District, and Encinitas Union School District to discuss collaboration in our schools. Of the approx. 16,000 school aged children in Carlsbad, nearly 12,000 attend Carlsbad Unified schools - we’re proud to work collaboratively with our education partners to support all students, and thankful to have such strong support from the City of Carlsbad. #bettertogether #teamcarlsbad #cusdlearns",,,0.0,"Thank you to the City of Carlsbad for convening a meeting of superintendents and board members from the four public school districts with schools in Carlsbad. Superintendent Churchill, Board President Williams, and Trustee Pearson met with Mayor Hall, Councilmember Bhat-Patel, and representatives from San Marcos Unified School District, San Dieguito Union High School District, and Encinitas Union School District to discuss collaboration in our schools. Of the approx. 16,000 school aged children in Carlsbad, nearly 12,000 attend Carlsbad Unified schools - we’re proud to work collaboratively with our education partners to support all students, and thankful to have such strong support from the City of Carlsbad. #bettertogether #teamcarlsbad #cusdlearns",2020-02-05 08:34:15,,
103,0.0,,13.0,https://www.cbs8.com/article/news/education/15-million-students-participate-in-the-great-kindness-challenge/509-7442c02b-54e4-4662-880d-e3959d6953a7,3477402245665750,"#KindnessMatters

https://www.cbs8.com/article/news/education/15-million-students-participate-in-the-great-kindness-challenge/509-7442c02b-54e4-4662-880d-e3959d6953a7",https://facebook.com/story.php?story_fbid=3477402245665750&id=111326945606647,"CBS8.COM
15 million students participate in the Great Kindness Challenge",0.0,"#KindnessMatters

https://www.cbs8.com/article/news/education/15-million-students-participate-in-the-great-kindness-challenge/509-7442c02b-54e4-4662-880d-e3959d6953a7

CBS8.COM
15 million students participate in the Great Kindness Challenge",2020-01-30 17:15:35,,
104,2.0,,25.0,https://www.10news.com/news/local-news/carlsbad-teacher-a-driving-force-for-teen-journalism,3474394682633173,We love Mr. Green! https://www.10news.com/news/local-news/carlsbad-teacher-a-driving-force-for-teen-journalism,https://facebook.com/story.php?story_fbid=3474394682633173&id=111326945606647,"10NEWS.COM
Carlsbad teacher a driving force for teen journalism",4.0,"We love Mr. Green! https://www.10news.com/news/local-news/carlsbad-teacher-a-driving-force-for-teen-journalism

10NEWS.COM
Carlsbad teacher a driving force for teen journalism",2020-01-29 19:14:22,,
105,0.0,,18.0,https://youtu.be/3j70R6rGGpU,3470896736316301,We're celebrating kindness this week as part of the #GreatKindnessChallenge https://youtu.be/3j70R6rGGpU #KindnessMatters #CUSDlearns,https://facebook.com/story.php?story_fbid=3470896736316301&id=111326945606647,"YOUTUBE.COM
Kindness Builds Bridges - 2020 Great Kindness Challenge Kickoff Video",0.0,"We're celebrating kindness this week as part of the #GreatKindnessChallenge https://youtu.be/3j70R6rGGpU #KindnessMatters #CUSDlearns

YOUTUBE.COM
Kindness Builds Bridges - 2020 Great Kindness Challenge Kickoff Video",2020-01-28 18:01:16,,
