,comments,image,likes,link,post_id,post_text,post_url,shared_text,shares,text,time,video,video_thumbnail
0,0.0,https://scontent-atl3-1.xx.fbcdn.net/v/t1.0-9/fr/cp0/e15/q65/119157438_622101201787309_904918418231383146_n.jpg?_nc_cat=109&_nc_sid=110474&_nc_ohc=HC6Uy-6WpzQAX_YEjYS&_nc_ht=scontent-atl3-1.xx&tp=14&oh=2e99e65bee9ff999992e2822c826e226&oe=5F81E506,4.0,,622102451787184,"Today in 1954, CBS premiered “Lassie”. The television series followed the adventures of a female Rough Collie dog named Lassie and her companions, both human and animal.",https://facebook.com/story.php?story_fbid=622102451787184&id=127573997906701,,0.0,"Today in 1954, CBS premiered “Lassie”. The television series followed the adventures of a female Rough Collie dog named Lassie and her companions, both human and animal.",2020-09-12 13:30:23,,
1,0.0,https://scontent-atl3-1.xx.fbcdn.net/v/t1.0-9/fr/cp0/e15/q65/119061631_621500501847379_7432570110355852904_n.jpg?_nc_cat=104&_nc_sid=110474&_nc_ohc=0EScyz8Bp8YAX9s98JS&_nc_ht=scontent-atl3-1.xx&tp=14&oh=f2619b8a6f165b429f45cec7789cba3d&oe=5F82FF4D,21.0,,621500661847363,,https://facebook.com/story.php?story_fbid=621500661847363&id=127573997906701,,0.0,,2020-09-11 15:57:33,,
2,0.0,,1.0,https://www.denverpost.com/2013/11/16/a-look-at-tvs-instant-replay-through-the-years/amp/,620941578569938,"If you’re enjoying the NFL kickoff tonight; take a moment to examine the instant replays. You can thank Roone Arledge… The godfather of the instant replay.
https://www.denverpost.com/2013/11/16/a-look-at-tvs-instant-replay-through-the-years/amp/",https://facebook.com/story.php?story_fbid=620941578569938&id=127573997906701,"DENVERPOST.COM
A look at TV’s instant replay through the years",0.0,"If you’re enjoying the NFL kickoff tonight; take a moment to examine the instant replays. You can thank Roone Arledge… The godfather of the instant replay.
https://www.denverpost.com/2013/11/16/a-look-at-tvs-instant-replay-through-the-years/amp/

DENVERPOST.COM
A look at TV’s instant replay through the years",2020-09-10 20:20:07,,
3,0.0,https://scontent-atl3-1.xx.fbcdn.net/v/t1.0-9/fr/cp0/e15/q65/119008549_620833258580770_8060342120227917606_n.jpg?_nc_cat=100&_nc_sid=110474&_nc_ohc=mHLoQRjdf4MAX9wuIgi&_nc_oc=AQk_wBQRDi70YgTAcAfkEvkIuihhnNYI2IQ7qbP_VomhUiWXvm-wLRSKGUcvhdOMF50&_nc_ht=scontent-atl3-1.xx&tp=14&oh=dd1b374f85df59b58365850f05630865&oe=5F8511FC,4.0,,620833785247384,"On this date in 1990 NBC premiered “The Fresh Prince of Bel Air”.
The American sitcom television series was created by Andy and Susan Borowitz. The series starred Will Smith as a fictionalized version of himself, a street-smart teenager from West Philadelphia; sent to move in with his wealthy uncle and aunt in their Bel Air mansion after getting into a fight in his hometown.",https://facebook.com/story.php?story_fbid=620833785247384&id=127573997906701,,0.0,"On this date in 1990 NBC premiered “The Fresh Prince of Bel Air”.
The American sitcom television series was created by Andy and Susan Borowitz. The series starred Will Smith as a fictionalized version of himself, a street-smart teenager from West Philadelphia; sent to move in with his wealthy uncle and aunt in their Bel Air mansion after getting into a fight in his hometown.",2020-09-10 16:07:02,,
4,32.0,,7.0,,361239295263700,Center Stage - Labor Day Special 6:30 Peter Annone and Friends----8:00 Union Jack,,,3.0,Center Stage - Labor Day Special 6:30 Peter Annone and Friends----8:00 Union Jack,2020-09-07 18:27:26,https://scontent-atl3-1.xx.fbcdn.net/v/t66.36281-6/10000000_3250536941707939_9080970937443181630_n.mp4?_nc_cat=109&_nc_sid=985c63&efg=eyJ2ZW5jb2RlX3RhZyI6Im9lcF9zZCJ9&_nc_ohc=Ki_zBW18ZJ0AX8tL8dN&_nc_ht=scontent-atl3-1.xx&oh=d66a72d448379e78f32a68f51a00d486&oe=5F8315D7,
5,0.0,https://scontent-atl3-1.xx.fbcdn.net/v/t1.0-9/fr/cp0/e15/q65/118949256_617893092208120_4193110015876432133_o.jpg?_nc_cat=101&_nc_sid=8024bb&_nc_ohc=MzdgwIXYAd8AX8S2ExO&_nc_ht=scontent-atl3-1.xx&tp=14&oh=961f5bda787ce9e4b7c497c231a487e0&oe=5F826A3C,2.0,,617893408874755,"At 8pm tonight - Union Jack concludes our Labor Day double header with rock classics you know & love - wrapping up the Center Stage concert series we've been producing with Chicopee Public Library & Chicopee Parks and Recreation Department. Tune in here, on Vimeo or on channel 191.",https://facebook.com/story.php?story_fbid=617893408874755&id=127573997906701,,0.0,"At 8pm tonight - Union Jack concludes our Labor Day double header with rock classics you know & love - wrapping up the Center Stage concert series we've been producing with Chicopee Public Library & Chicopee Parks and Recreation Department. Tune in here, on Vimeo or on channel 191.",2020-09-07 17:00:27,,
6,0.0,https://scontent-atl3-1.xx.fbcdn.net/v/t1.0-9/fr/cp0/e15/q65/118926729_617891628874933_5093620265916682699_o.jpg?_nc_cat=108&_nc_sid=8024bb&_nc_ohc=BD5-Jv2zEr8AX_HlmA2&_nc_ht=scontent-atl3-1.xx&tp=14&oh=72b45155de06f54258bbb89a63d3cc10&oe=5F8481B3,4.0,,617891915541571,"Tonight - Center Stage concludes with back-to-back performances. Starting things off at 6:30pm - Peter Annone & Friends! Don't miss it! Here, on Vimeo or on channel 191. Chicopee Parks and Recreation Department Chicopee Cultural Council Chicopee Public Library",https://facebook.com/story.php?story_fbid=617891915541571&id=127573997906701,,0.0,"Tonight - Center Stage concludes with back-to-back performances. Starting things off at 6:30pm - Peter Annone & Friends! Don't miss it! Here, on Vimeo or on channel 191. Chicopee Parks and Recreation Department Chicopee Cultural Council Chicopee Public Library",2020-09-07 10:40:05,,
7,0.0,https://scontent-atl3-1.xx.fbcdn.net/v/t1.0-9/fr/cp0/e15/q65/118972647_617890402208389_8153546623782893712_o.jpg?_nc_cat=106&_nc_sid=8024bb&_nc_ohc=5jRkb7slbMsAX_L5C-A&_nc_ht=scontent-atl3-1.xx&tp=14&oh=d0ba016b9e45f78d0c8362dade5edddd&oe=5F83A336,4.0,,617890602208369,"Tomorrow night at 8pm - Union Jack concludes our Center Stage concert series with classic rock! Join us here, on Vimeo, or on channel 191.",https://facebook.com/story.php?story_fbid=617890602208369&id=127573997906701,,0.0,"Tomorrow night at 8pm - Union Jack concludes our Center Stage concert series with classic rock! Join us here, on Vimeo, or on channel 191.",2020-09-06 18:37:44,,
8,0.0,https://scontent-atl3-1.xx.fbcdn.net/v/t1.0-9/fr/cp0/e15/q65/119002177_617889065541856_2990553529356547123_o.jpg?_nc_cat=108&_nc_sid=8024bb&_nc_ohc=uAaomLA8P9sAX-9A6ON&_nc_ht=scontent-atl3-1.xx&tp=14&oh=b117f010a4182094e4304d0d39d6b466&oe=5F81C2E3,1.0,,617889252208504,Tomorrow night - Peter Annone & Friends kicks off our virtual Labor Day Center Stage concert! Join us at 6:30pm for well-sung classics.,https://facebook.com/story.php?story_fbid=617889252208504&id=127573997906701,,0.0,Tomorrow night - Peter Annone & Friends kicks off our virtual Labor Day Center Stage concert! Join us at 6:30pm for well-sung classics.,2020-09-06 11:00:36,,
9,0.0,,2.0,https://vimeo.com/showcase/5816982,617898935540869,"Missed some of our summer concert series? You can see every concert, free / On-Demand here: https://vimeo.com/showcase/5816982",https://facebook.com/story.php?story_fbid=617898935540869&id=127573997906701,"VIMEO.COM
Featured Programs on Vimeo",0.0,"Missed some of our summer concert series? You can see every concert, free / On-Demand here: https://vimeo.com/showcase/5816982

VIMEO.COM
Featured Programs on Vimeo",2020-09-06 09:31:25,,
10,0.0,https://scontent-atl3-1.xx.fbcdn.net/v/t1.0-9/fr/cp0/e15/q65/118652306_617500675580695_2341067549951812043_o.jpg?_nc_cat=102&_nc_sid=8024bb&_nc_ohc=pPvT7VmiQdoAX8ISapF&_nc_ht=scontent-atl3-1.xx&tp=14&oh=10bd2ea35c5a14a7df8a850a14f3c64e&oe=5F82366E,2.0,,617500742247355,"On Labor Day, our final episode of this summer's Center Stage Covid Concert Series - a live music series in collaboration with the Chicopee Parks and Recreation Department & Chicopee Public Library, with grant funds from Chicopee Cultural Council. A double header - with classics sung by Peter Annone & Friends, followed by some classic rock from Union Jack! Livestreaming at 6:30pm on Labor Day - here, on Vimeo, and on channel 191.",https://facebook.com/story.php?story_fbid=617500742247355&id=127573997906701,,0.0,"On Labor Day, our final episode of this summer's Center Stage Covid Concert Series - a live music series in collaboration with the Chicopee Parks and Recreation Department & Chicopee Public Library, with grant funds from Chicopee Cultural Council. A double header - with classics sung by Peter Annone & Friends, followed by some classic rock from Union Jack! Livestreaming at 6:30pm on Labor Day - here, on Vimeo, and on channel 191.",2020-09-05 18:48:44,,
11,9.0,,9.0,,647611869469300,Dave Collucci Band f. Donna-Lee DePrille Band (show begins at 730),,,6.0,Dave Collucci Band f. Donna-Lee DePrille Band (show begins at 730),2020-09-04 19:28:07,https://scontent-atl3-1.xx.fbcdn.net/v/t66.36281-6/10000000_601629707180349_2712491219384957048_n.mp4?_nc_cat=104&_nc_sid=985c63&efg=eyJ2ZW5jb2RlX3RhZyI6Im9lcF9zZCJ9&_nc_ohc=ulwdBpvih60AX-xRcma&_nc_ht=scontent-atl3-1.xx&oh=6f7d8f264d4f590d9ef404cf70148f15&oe=5F833CB3,
12,1.0,https://scontent-atl3-1.xx.fbcdn.net/v/t1.0-9/fr/cp0/e15/q65/118700438_616768098987286_531935737955412541_o.jpg?_nc_cat=107&_nc_sid=110474&_nc_ohc=JKKXvHxgZh8AX_jGmVD&_nc_ht=scontent-atl3-1.xx&tp=14&oh=d7615d0656611c4aa266027776371119&oe=5F845F4D,11.0,,616768165653946,Stopped by the Chicopee Comprehensive High School field to see the progress. Always a nice spot,https://facebook.com/story.php?story_fbid=616768165653946&id=127573997906701,,0.0,Stopped by the Chicopee Comprehensive High School field to see the progress. Always a nice spot,2020-09-04 17:52:45,,
13,1.0,https://scontent-atl3-1.xx.fbcdn.net/v/t1.0-9/fr/cp0/e15/q65/118537304_615864275744335_4223111748876537217_o.jpg?_nc_cat=109&_nc_sid=8024bb&_nc_ohc=HMS9K8pJWH8AX8ZlFym&_nc_ht=scontent-atl3-1.xx&tp=14&oh=c65c61d13abba257ccb58873bf58fb62&oe=5F82BA49,4.0,,615865965744166,"Tonight at 7:30pm - the penultimate Center Stage! Vocalist Entertainer Dave Colucci and Donna-Lee DePrille Band take on 50s and 60s American musical greats and ""Croon With the Classics""! This collaboration with the Chicopee Public Library and Chicopee Parks and Recreation Department has been great; they lined up a diverse mix of bands and we're proud of the series thus far - and hope you all are enjoying the music!",https://facebook.com/story.php?story_fbid=615865965744166&id=127573997906701,,0.0,"Tonight at 7:30pm - the penultimate Center Stage! Vocalist Entertainer Dave Colucci and Donna-Lee DePrille Band take on 50s and 60s American musical greats and ""Croon With the Classics""! This collaboration with the Chicopee Public Library and Chicopee Parks and Recreation Department has been great; they lined up a diverse mix of bands and we're proud of the series thus far - and hope you all are enjoying the music!",2020-09-04 11:30:06,,
14,8.0,,1.0,,1599426693573583,City Council Sept 3 2020,,,0.0,City Council Sept 3 2020,2020-09-03 19:06:44,https://scontent-atl3-1.xx.fbcdn.net/v/t66.36281-6/10000000_351190219410016_3087728520700207553_n.mp4?_nc_cat=100&_nc_sid=985c63&efg=eyJ2ZW5jb2RlX3RhZyI6Im9lcF9zZCJ9&_nc_ohc=CcLuinzf-coAX93INFR&_nc_oc=AQkcjub07yiqwcNLA5WC1F7FJHFK9KyKsyO79RDF2KOwHnr8_vsupLnKIst-tgZyLc0&_nc_ht=scontent-atl3-1.xx&oh=139e5ac571e0acbcc54a92e5834f423f&oe=5F8423ED,
15,5.0,,3.0,,692894901573002,City Council Sept 3 2020 (Mayor's Briefing),,,2.0,City Council Sept 3 2020 (Mayor's Briefing),2020-09-03 18:28:09,https://scontent-atl3-1.xx.fbcdn.net/v/t66.36281-6/10000000_373149427031497_3649561099646051840_n.mp4?_nc_cat=109&_nc_sid=985c63&efg=eyJ2ZW5jb2RlX3RhZyI6Im9lcF9zZCJ9&_nc_ohc=M4eID0w0JUsAX8DrQsH&_nc_ht=scontent-atl3-1.xx&oh=76e61aa461073e3cb2a4d8e6b6b5f392&oe=5F82A06A,
16,0.0,,4.0,,615864012411028,"Center Stage - tomorrow night at 7:30pm! This week's band is The Dave Colucci show - featuring Vocalist Entertainer Dave Colucci and Donna-Lee DePrille Band ""Croonin' With the Classics""! Sing along to oldies you know or discover the era of 50s/60s music you've never heard!",https://facebook.com/story.php?story_fbid=615864012411028&id=127573997906701,,0.0,"Center Stage - tomorrow night at 7:30pm! This week's band is The Dave Colucci show - featuring Vocalist Entertainer Dave Colucci and Donna-Lee DePrille Band ""Croonin' With the Classics""! Sing along to oldies you know or discover the era of 50s/60s music you've never heard!",2020-09-03 13:16:41,,
17,0.0,,0.0,https://vimeo.com/452270608,615861665744596,"FYI, folks - this week's City Council meeting (which normally would have happened Tuesday but was delayed due to the election on Tuesday) is happening tonight. Watch on channel 191 of your Chicopee Charter Cable dial, or Livestream here or from Vimeo: https://vimeo.com/452270608",https://facebook.com/story.php?story_fbid=615861665744596&id=127573997906701,"VIMEO.COM
City Council",0.0,"FYI, folks - this week's City Council meeting (which normally would have happened Tuesday but was delayed due to the election on Tuesday) is happening tonight. Watch on channel 191 of your Chicopee Charter Cable dial, or Livestream here or from Vimeo: https://vimeo.com/452270608

VIMEO.COM
City Council",2020-09-03 13:13:07,,
18,4.0,,1.0,,615433949120701,"Apologies, folks, but there were some internet drop-outs at the school committee chambers this evening, and the livestream was a little dirty. Here's a clean recording of the meeting.",,,0.0,"Apologies, folks, but there were some internet drop-outs at the school committee chambers this evening, and the livestream was a little dirty. Here's a clean recording of the meeting.",2020-09-02 23:06:38,https://video-atl3-1.xx.fbcdn.net/v/t42.9040-2/10000000_331929657958950_6697966992133264099_n.mp4?_nc_cat=104&_nc_sid=985c63&efg=eyJ2ZW5jb2RlX3RhZyI6ImxlZ2FjeV9zZCJ9&_nc_ohc=YLTWuT9GU-kAX9yyUYE&_nc_ht=video-atl3-1.xx&oh=790a672dcfe7712bc6547038bade9b01&oe=5F5DC787,
19,446.0,,39.0,,754506261782220,09-02-20 School Committee,,,22.0,09-02-20 School Committee,2020-09-02 19:01:38,https://scontent-atl3-1.xx.fbcdn.net/v/t66.36281-6/10000000_619673195417295_1980590288021559323_n.mp4?_nc_cat=106&_nc_sid=985c63&efg=eyJ2ZW5jb2RlX3RhZyI6Im9lcF9zZCJ9&_nc_ohc=Z_EqZXV8180AX8-Y-M-&_nc_ht=scontent-atl3-1.xx&oh=8fff4f284aacc4849828e1de4cb59d6d&oe=5F820D7D,
20,6.0,,7.0,,303286560954802,Center Stage - Brad Shepard Band,,,8.0,Center Stage - Brad Shepard Band,2020-08-27 18:29:54,https://scontent-atl3-1.xx.fbcdn.net/v/t66.36281-6/10000000_2458192381147465_775878035991839455_n.mp4?_nc_cat=101&_nc_sid=985c63&efg=eyJ2ZW5jb2RlX3RhZyI6Im9lcF9zZCJ9&_nc_ohc=6q4Ua6owNVgAX9LOtsB&_nc_ht=scontent-atl3-1.xx&oh=9a5288c84f3f7e40349b126d3938c579&oe=5F8505FC,
21,0.0,,3.0,,611003022897127,"At 6:30 tonight, tune in as our Center Stage series continues - tonight with local radio legend Brad Shepard Music - singing crooner classics by the likes of Sinatra, Bobby Darin, and other ""Great American Songbook"" classics. Chicopee Public Library Chicopee Cultural Council Chicopee Parks and Recreation Department",https://facebook.com/story.php?story_fbid=611003022897127&id=127573997906701,,0.0,"At 6:30 tonight, tune in as our Center Stage series continues - tonight with local radio legend Brad Shepard Music - singing crooner classics by the likes of Sinatra, Bobby Darin, and other ""Great American Songbook"" classics. Chicopee Public Library Chicopee Cultural Council Chicopee Parks and Recreation Department",2020-08-27 17:31:49,,
22,38.0,,6.0,,1560232627471207,Center Stage - Ukulele Scramble,,,6.0,Center Stage - Ukulele Scramble,2020-08-21 20:00:07,https://scontent-atl3-1.xx.fbcdn.net/v/t66.36281-6/10000000_167091281646156_9194963993822884275_n.mp4?_nc_cat=101&_nc_sid=985c63&efg=eyJ2ZW5jb2RlX3RhZyI6Im9lcF9zZCJ9&_nc_ohc=dvZDHUFsZSYAX98D4og&_nc_ht=scontent-atl3-1.xx&oh=433b552b94e1ab6e7f146e423289ffa2&oe=5F833176,
23,0.0,,2.0,,606809843316445,"Tonight! Center Stage continues at 8PM (pushing our normal Thursday 6:30PM time so you can kick off the weekend with your family). ￼After dinner, tune in here for The Ukulele Scramble! Great, timeless folk tunes with lots and lots of strings!",https://facebook.com/story.php?story_fbid=606809843316445&id=127573997906701,,0.0,"Tonight! Center Stage continues at 8PM (pushing our normal Thursday 6:30PM time so you can kick off the weekend with your family). ￼After dinner, tune in here for The Ukulele Scramble! Great, timeless folk tunes with lots and lots of strings!",2020-08-21 16:25:39,,
24,0.0,,1.0,,606176176713145,"Apologies, viewers; this problem's going to take a few hours to solve. Tonight's scheduled Center Stage, The Ukulele Scramble, will air tomorrow night - Friday at 6:30pm. In the meantime, we've got a HUGE school department video coming at you in moments...",https://facebook.com/story.php?story_fbid=606176176713145&id=127573997906701,,0.0,"Apologies, viewers; this problem's going to take a few hours to solve. Tonight's scheduled Center Stage, The Ukulele Scramble, will air tomorrow night - Friday at 6:30pm. In the meantime, we've got a HUGE school department video coming at you in moments...",2020-08-20 19:17:04,,
25,0.0,,9.0,https://vimeo.com/449803336,606115946719168,"Hot off the camera: Chicopee Public Schools's hot-off-the-camera televised event answering questions about the start of the Covid-era school year. Tune in for answers, right here: https://vimeo.com/449803336 Chicopee High School Chicopee Comprehensive High School Bellamy Middle School 1st Sgt. Kevin A. Dupont Memorial Middle School Chicopee Academy Szetela Early Childhood School Fairview Elementary School P.E. Bowe School Belcher Elementary School PTO Anna E Barry School Lambert-Lavoie Sgt. Robert R. Litwin School Gen. John J Stefanik Elementary School Streiber Mem Elementary School",https://facebook.com/story.php?story_fbid=606115946719168&id=127573997906701,"VIMEO.COM
A Path Forward - A Q&A with School Leaders",56.0,"Hot off the camera: Chicopee Public Schools's hot-off-the-camera televised event answering questions about the start of the Covid-era school year. Tune in for answers, right here: https://vimeo.com/449803336 Chicopee High School Chicopee Comprehensive High School Bellamy Middle School 1st Sgt. Kevin A. Dupont Memorial Middle School Chicopee Academy Szetela Early Childhood School Fairview Elementary School P.E. Bowe School Belcher Elementary School PTO Anna E Barry School Lambert-Lavoie Sgt. Robert R. Litwin School Gen. John J Stefanik Elementary School Streiber Mem Elementary School

VIMEO.COM
A Path Forward - A Q&A with School Leaders",2020-08-20 19:16:49,,
26,0.0,,4.0,,606151933382236,"If you are tuning in at 6:30 for The Ukulele Scramble, be patient for a moment. Hoping to be on the air by 7. Stay tuned!￼",https://facebook.com/story.php?story_fbid=606151933382236&id=127573997906701,,0.0,"If you are tuning in at 6:30 for The Ukulele Scramble, be patient for a moment. Hoping to be on the air by 7. Stay tuned!￼",2020-08-20 18:22:15,,
27,0.0,,0.0,,605338806796882,"Join us right here at 6:30pm for the next concert in our live music series, ""Center Stage"", produced in partnership with Chicopee Public Library and Chicopee Parks and Recreation Department.",https://facebook.com/story.php?story_fbid=605338806796882&id=127573997906701,,0.0,"Join us right here at 6:30pm for the next concert in our live music series, ""Center Stage"", produced in partnership with Chicopee Public Library and Chicopee Parks and Recreation Department.",2020-08-20 17:30:21,,
28,1.0,https://scontent-atl3-1.xx.fbcdn.net/v/t1.0-9/fr/cp0/e15/q65/118157036_605339590130137_7257649017236057961_o.jpg?_nc_cat=110&_nc_sid=8024bb&_nc_ohc=Ge-b1GZFLioAX9Uul7c&_nc_ht=scontent-atl3-1.xx&tp=14&oh=b6019bccd568d3853a73d558984491eb&oe=5F81CD37,2.0,https://vimeo.com/channels/chicopeefeatured,605340640130032,Tonight - Center Stage continues with The Ukulele Scramble! Missed the previous concerts in the series? Check them out here: https://vimeo.com/channels/chicopeefeatured,https://facebook.com/story.php?story_fbid=605340640130032&id=127573997906701,,0.0,Tonight - Center Stage continues with The Ukulele Scramble! Missed the previous concerts in the series? Check them out here: https://vimeo.com/channels/chicopeefeatured,2020-08-20 10:00:23,,
29,0.0,,3.0,,605336496797113,"Tomorrow night, our ""Center Stage"" Covid Concert Series continues with The Ukulele Scramble - a self-produced bee-bop through the brains of two stringy thinkers & pluckers! Join us here or on Channel 191 at 6:30pm to hear them play.",https://facebook.com/story.php?story_fbid=605336496797113&id=127573997906701,,0.0,"Tomorrow night, our ""Center Stage"" Covid Concert Series continues with The Ukulele Scramble - a self-produced bee-bop through the brains of two stringy thinkers & pluckers! Join us here or on Channel 191 at 6:30pm to hear them play.",2020-08-19 13:54:57,,
30,14.0,,10.0,,299820391467018,Josee Vachon,,,4.0,Josee Vachon,2020-08-13 18:32:58,https://scontent-atl3-1.xx.fbcdn.net/v/t66.36281-6/10000000_106881901104718_4746102291669199573_n.mp4?_nc_cat=100&_nc_sid=985c63&efg=eyJ2ZW5jb2RlX3RhZyI6Im9lcF9zZCJ9&_nc_ohc=iAB6WaJYf84AX91nNRa&_nc_ht=scontent-atl3-1.xx&oh=3f30643eaee6493373e4d0cd534dc8e3&oe=5F815F14,
31,2976.0,,120.0,,329573504832138,08-12-20 School Committee Meeting,,,87.0,08-12-20 School Committee Meeting,2020-08-12 19:01:23,https://video-atl3-1.xx.fbcdn.net/v/t42.26565-2/10000000_600240877517973_934343404580483702_n.mp4?_nc_cat=111&_nc_sid=985c63&efg=eyJ2ZW5jb2RlX3RhZyI6Im9lcF9zZCJ9&_nc_ohc=-RMk1Sq8sKoAX81UBVn&_nc_ht=video-atl3-1.xx&oh=384037737cb315058790f715cbbddafa&oe=5F5DC415,
32,11.0,,4.0,,297495924839727,test,,,6.0,test,2020-08-12 18:19:03,https://video-atl3-1.xx.fbcdn.net/v/t42.26565-2/117751867_2814763072141261_5690696733631767474_n.mp4?_nc_cat=102&_nc_sid=985c63&efg=eyJ2ZW5jb2RlX3RhZyI6Im9lcF9zZCJ9&_nc_ohc=7uCHrTKSuZIAX_qsR_X&_nc_ht=video-atl3-1.xx&oh=eb67d5b6f276ba1957b1db3c97f4b54b&oe=5F5DC58D,
33,15.0,,2.0,,767951673940539,City Council 7-11-20 LIVE! (partial),,,6.0,City Council 7-11-20 LIVE! (partial),2020-08-11 19:04:37,https://video-atl3-1.xx.fbcdn.net/v/t42.26565-2/10000000_303970430929970_7516785808958432238_n.mp4?_nc_cat=101&_nc_sid=985c63&efg=eyJ2ZW5jb2RlX3RhZyI6Im9lcF9zZCJ9&_nc_ohc=a4rlu7nxIfkAX__agEW&_nc_ht=video-atl3-1.xx&oh=283c3c29c03520df6a4806520c1521ec&oe=5F5DC8B8,
34,0.0,,6.0,,597261680937928,"If you missed it last night, check out the latest episode of Center Stage - Chicopee's Covid Concert Series that we're producing in collaboration with Chicopee Public Library and Chicopee Parks and Recreation Department. This week we featured an ensemble of professional singers performing excerpts from showtunes and Gilbert & Sullivan and more! It's great fun - especially for those who like singalongs!",https://facebook.com/story.php?story_fbid=597261680937928&id=127573997906701,,0.0,"If you missed it last night, check out the latest episode of Center Stage - Chicopee's Covid Concert Series that we're producing in collaboration with Chicopee Public Library and Chicopee Parks and Recreation Department. This week we featured an ensemble of professional singers performing excerpts from showtunes and Gilbert & Sullivan and more! It's great fun - especially for those who like singalongs!",2020-08-07 10:46:17,,
35,4.0,,3.0,,308517770378496,Center Stage - Steve Curylo Ensemble,,,3.0,Center Stage - Steve Curylo Ensemble,2020-08-06 18:31:06,https://video-atl3-1.xx.fbcdn.net/v/t42.26565-2/10000000_171598251083116_8901612466853052911_n.mp4?_nc_cat=109&_nc_sid=985c63&efg=eyJ2ZW5jb2RlX3RhZyI6Im9lcF9zZCJ9&_nc_ohc=GmTLOPojyU8AX9Dc2mF&_nc_ht=video-atl3-1.xx&oh=c94a8060bc33ea1f00c83a51d28e0236&oe=5F5DC701,
36,0.0,,0.0,,596845957646167,"Join us in 15 minutes for 2020 Annual Recital with baritone Steve Curylo and others! A great collection of selections from Gilbert & Sullivan and other great musicals, sung / played by folks who know how to sing it!",https://facebook.com/story.php?story_fbid=596845957646167&id=127573997906701,,0.0,"Join us in 15 minutes for 2020 Annual Recital with baritone Steve Curylo and others! A great collection of selections from Gilbert & Sullivan and other great musicals, sung / played by folks who know how to sing it!",2020-08-06 18:14:29,,
37,2451.0,,83.0,,626583177979409,8/5/20 Chicopee School Committee,,,107.0,8/5/20 Chicopee School Committee,2020-08-05 19:01:48,https://video-atl3-1.xx.fbcdn.net/v/t42.26565-2/10000000_3542971025781897_3834513973272635017_n.mp4?_nc_cat=103&_nc_sid=985c63&efg=eyJ2ZW5jb2RlX3RhZyI6Im9lcF9zZCJ9&_nc_ohc=KmSBknozR7cAX8Khw97&_nc_ht=video-atl3-1.xx&oh=6c736dd1292adfb875c9e99c9d7566fb&oe=5F5DBC17,
38,1.0,,5.0,,289079785642923,Center Stage - Yiddishkeit Klezmer Ensemble,,,0.0,Center Stage - Yiddishkeit Klezmer Ensemble,2020-07-30 18:30:19,https://video-atl3-1.xx.fbcdn.net/v/t42.26565-2/10000000_156833619348619_7478945000035160590_n.mp4?_nc_cat=105&_nc_sid=985c63&efg=eyJ2ZW5jb2RlX3RhZyI6Im9lcF9zZCJ9&_nc_ohc=8k63dCPJrYEAX-_G3DT&_nc_ht=video-atl3-1.xx&oh=9571a02ba54be61ed69dcdf7e00d511a&oe=5F5DC5CB,
39,0.0,https://scontent-atl3-1.xx.fbcdn.net/v/t1.0-9/fr/cp0/e15/q65/115823911_590680084929421_5703021452273363991_o.jpg?_nc_cat=106&_nc_sid=8024bb&_nc_ohc=-CqZld01L10AX-D9gmY&_nc_ht=scontent-atl3-1.xx&tp=14&oh=a3c99977a42e1091a656130a7bf08948&oe=5F81D55D,7.0,,590680221596074,"Tonight at 6:30pm, Yiddishkeit Klezmer Ensemble plays live in the ChicopeeTV studio. Watch here or on channel 191.",https://facebook.com/story.php?story_fbid=590680221596074&id=127573997906701,,0.0,"Tonight at 6:30pm, Yiddishkeit Klezmer Ensemble plays live in the ChicopeeTV studio. Watch here or on channel 191.",2020-07-30 15:01:54,,
40,19.0,,12.0,,296115838166831,07-29-20 City Council,,,7.0,07-29-20 City Council,2020-07-29 18:32:30,https://video-atl3-1.xx.fbcdn.net/v/t42.26565-2/10000000_290895528801155_4009217904573972199_n.mp4?_nc_cat=100&_nc_sid=985c63&efg=eyJ2ZW5jb2RlX3RhZyI6Im9lcF9zZCJ9&_nc_ohc=7pphJ5TK4tcAX9JGhD5&_nc_ht=video-atl3-1.xx&oh=7b03fd7dabe2bf8c0660071d97acaafc&oe=5F5DC891,
41,0.0,https://scontent-atl3-1.xx.fbcdn.net/v/t1.0-9/fr/cp0/e15/q65/116706765_590679191596177_8008436358805826895_o.jpg?_nc_cat=110&_nc_sid=8024bb&_nc_ohc=1L6z5A3jXLwAX9SmOtY&_nc_ht=scontent-atl3-1.xx&tp=14&oh=3e362efa952fdc83caae5a5d03ecedda&oe=5F819564,59.0,,590679418262821,"We're really enjoying co-hosting our weekly concert series with the Chicopee Public Library and Chicopee Parks and Recreation Department. This Thursday at 6:30pm - a cultural experience: Yiddishkeit Klezmer Ensemble. Join us here, or on channel 191!",https://facebook.com/story.php?story_fbid=590679418262821&id=127573997906701,,0.0,"We're really enjoying co-hosting our weekly concert series with the Chicopee Public Library and Chicopee Parks and Recreation Department. This Thursday at 6:30pm - a cultural experience: Yiddishkeit Klezmer Ensemble. Join us here, or on channel 191!",2020-07-27 17:00:07,,
42,10.0,,11.0,,286845932623292,Center Stage - Hungrytown,,,7.0,Center Stage - Hungrytown,2020-07-23 18:29:35,https://video-atl3-1.xx.fbcdn.net/v/t42.26565-2/10000000_1193872457639409_1016321605414493138_n.mp4?_nc_cat=102&_nc_sid=985c63&efg=eyJ2ZW5jb2RlX3RhZyI6Im9lcF9zZCJ9&_nc_ohc=4e24aWKS-JIAX_Zod7Z&_nc_ht=video-atl3-1.xx&oh=f837f0b59ac7932a7cd54592285aebf9&oe=5F5DBD71,
43,0.0,https://scontent-atl3-1.xx.fbcdn.net/v/t1.0-9/fr/cp0/e15/q65/115805023_587844755212954_5326962801562887863_o.jpg?_nc_cat=104&_nc_sid=8024bb&_nc_ohc=UaqdjPUXD54AX9EZXBO&_nc_ht=scontent-atl3-1.xx&tp=14&oh=18405f2316f44f302ca5208b69c230c0&oe=5F84DC41,6.0,,587844918546271,Really excited to share Hungrytown's set with you at 6:30pm tonight - kicking off our every-Thursday Covid Concert Series!,https://facebook.com/story.php?story_fbid=587844918546271&id=127573997906701,,0.0,Really excited to share Hungrytown's set with you at 6:30pm tonight - kicking off our every-Thursday Covid Concert Series!,2020-07-23 16:30:37,,
44,0.0,https://scontent-atl3-1.xx.fbcdn.net/v/t1.0-9/fr/cp0/e15/q65/111271805_587845801879516_5789580572194016009_o.jpg?_nc_cat=104&_nc_sid=8024bb&_nc_ohc=SRE_lr8tL58AX8dfSCw&_nc_ht=scontent-atl3-1.xx&tp=14&oh=7ac6aeb49cc2f71dab8499dc05ac78f5&oe=5F836C2F,2.0,,587846015212828,"Tonight! Live Streaming on Facebook and Vimeo, and channel 191, Hungrytown!",https://facebook.com/story.php?story_fbid=587846015212828&id=127573997906701,,0.0,"Tonight! Live Streaming on Facebook and Vimeo, and channel 191, Hungrytown!",2020-07-23 10:45:04,,
45,25.0,,16.0,,3167744886594470,07-22-20 School Committee,,,37.0,07-22-20 School Committee,2020-07-22 19:01:00,https://video-atl3-1.xx.fbcdn.net/v/t42.26565-2/10000000_330441988115162_4013164931145496411_n.mp4?_nc_cat=105&_nc_sid=985c63&efg=eyJ2ZW5jb2RlX3RhZyI6Im9lcF9zZCJ9&_nc_ohc=i4B7JcilduwAX8H3gH-&_nc_oc=AQmknqbUfio1l9fEy-PEDqTRybc2a0PuUzWVBXC3odTlj_cYM-KmxUm-IoiJYnW7M6A&_nc_ht=video-atl3-1.xx&oh=f518c96228f209c0ff701dc6183218b1&oe=5F5DC325,
46,0.0,,5.0,https://Vimeo.com/ChicopeeTV,586987645298665,"Tomorrow at 6:30pm - our ""Center Stage"" summer concert series kicks off with Hungrytown. Check it out live-streaming here or at Vimeo.com/ChicopeeTV, or on channel 191",https://facebook.com/story.php?story_fbid=586987645298665&id=127573997906701,"VIMEO.COM
ChicopeeTV",2.0,"Tomorrow at 6:30pm - our ""Center Stage"" summer concert series kicks off with Hungrytown. Check it out live-streaming here or at Vimeo.com/ChicopeeTV, or on channel 191

VIMEO.COM
ChicopeeTV",2020-07-22 18:30:31,,
47,1.0,https://scontent-atl3-1.xx.fbcdn.net/v/t1.0-9/fr/cp0/e15/q65/115721504_586983948632368_1028182613122735193_o.jpg?_nc_cat=103&_nc_sid=8024bb&_nc_ohc=dvUARcWMMJQAX-V69Qq&_nc_ht=scontent-atl3-1.xx&tp=14&oh=276e4126a354d20b65424bb63e5c31aa&oe=5F83E2CB,9.0,,586984095299020,"We've been hard at work with the Chicopee Public Library and Chicopee Parks and Recreation Department bringing their summer concert series to life via TV. The performance schedule has changed since we last posted it, but our first band - Hungrytown (an uber-charming folk duo) is set to perform on Thursday! Tune in here to FB Live, to Vimeo, or to channel 191 for that concert. Here's the schedule for the rest of the summer - every Thursday through Labor Day!",https://facebook.com/story.php?story_fbid=586984095299020&id=127573997906701,,0.0,"We've been hard at work with the Chicopee Public Library and Chicopee Parks and Recreation Department bringing their summer concert series to life via TV. The performance schedule has changed since we last posted it, but our first band - Hungrytown (an uber-charming folk duo) is set to perform on Thursday! Tune in here to FB Live, to Vimeo, or to channel 191 for that concert. Here's the schedule for the rest of the summer - every Thursday through Labor Day!",2020-07-21 13:57:44,,
48,1.0,https://scontent-atl3-1.xx.fbcdn.net/v/t1.0-9/fr/cp0/e15/q65/107887803_2653061198244197_8491404647526571663_o.jpg?_nc_cat=101&_nc_sid=8024bb&_nc_ohc=Oq-u7R3iZoEAX-eYV5Z&_nc_ht=scontent-atl3-1.xx&tp=14&oh=7cae9aab24c40f944b3261a2fdbb4819&oe=5F830BB6,12.0,,583999108930852,"Congratulations Officrs and welcome, May god bless you all out there!!",https://facebook.com/story.php?story_fbid=583999108930852&id=127573997906701,"Debbie Miner shared a post to the group: Chicopee Area Community Forum.
July 15 at 5:52 PM ·

City of Chicopee - Mayor's Office
July 15 at 5:12 PM ·

Yesterday, we welcomed 👨‍✈️👨‍✈️👨‍✈️👨‍✈️👨‍✈️ New Police Officers to the Chicopee Police Department. They were welcomed by Mayor Vieau, Police Chief Jebb, and sworn in by City Clerk Keith Rattell at the Safety Complex Training Room - in social distance style. The new officers are Kyle Soja, Joseph Isabelle, Theodore Enos, II, Aaron Beaulieu, Michael Sydorak. Welcome aboard!

#WelcomeToTheChicopeePD Western Mass News Chicopee Chamber of Commerce WWLP-22News",0.0,"Congratulations Officrs and welcome, May god bless you all out there!!

Debbie Miner shared a post to the group: Chicopee Area Community Forum.
July 15 at 5:52 PM ·

City of Chicopee - Mayor's Office
July 15 at 5:12 PM ·

Yesterday, we welcomed 👨‍✈️👨‍✈️👨‍✈️👨‍✈️👨‍✈️ New Police Officers to the Chicopee Police Department. They were welcomed by Mayor Vieau, Police Chief Jebb, and sworn in by City Clerk Keith Rattell at the Safety Complex Training Room - in social distance style. The new officers are Kyle Soja, Joseph Isabelle, Theodore Enos, II, Aaron Beaulieu, Michael Sydorak. Welcome aboard!

#WelcomeToTheChicopeePD Western Mass News Chicopee Chamber of Commerce WWLP-22News",2020-07-16 12:22:57,,
49,0.0,https://scontent-atl3-1.xx.fbcdn.net/v/t1.0-9/fr/cp0/e15/q65/107887803_2653061198244197_8491404647526571663_o.jpg?_nc_cat=101&_nc_sid=8024bb&_nc_ohc=Oq-u7R3iZoEAX-eYV5Z&_nc_ht=scontent-atl3-1.xx&tp=14&oh=7cae9aab24c40f944b3261a2fdbb4819&oe=5F830BB6,0.0,,,,https://facebook.com/story.php?story_fbid=2653066654910318&id=1451703288380000,"City of Chicopee - Mayor's Office
July 15 at 5:12 PM ·

Yesterday, we welcomed 👨‍✈️👨‍✈️👨‍✈️👨‍✈️👨‍✈️ New Police Officers to the Chicopee Police Department. They were welcomed by Mayor Vieau, Police Chief Jebb, and sworn in by City Clerk Keith Rattell at the Safety Complex Training Room - in social distance style. The new officers are Kyle Soja, Joseph Isabelle, Theodore Enos, II, Aaron Beaulieu, Michael Sydorak. Welcome aboard!

#WelcomeToTheChicopeePD Western Mass News Chicopee Chamber of Commerce WWLP-22News",0.0,"City of Chicopee - Mayor's Office
July 15 at 5:12 PM ·

Yesterday, we welcomed 👨‍✈️👨‍✈️👨‍✈️👨‍✈️👨‍✈️ New Police Officers to the Chicopee Police Department. They were welcomed by Mayor Vieau, Police Chief Jebb, and sworn in by City Clerk Keith Rattell at the Safety Complex Training Room - in social distance style. The new officers are Kyle Soja, Joseph Isabelle, Theodore Enos, II, Aaron Beaulieu, Michael Sydorak. Welcome aboard!

#WelcomeToTheChicopeePD Western Mass News Chicopee Chamber of Commerce WWLP-22News",2020-09-13 00:29:03.353140,,
50,0.0,,2.0,https://vimeo.com/436257932,579082372755859,"Sorry, folks! Looks like the internet was glitchy last night during last night's City Council stream. We've uploaded a clean version here: https://vimeo.com/436257932",https://facebook.com/story.php?story_fbid=579082372755859&id=127573997906701,"VIMEO.COM
07-07-20 City Council Meeting",0.0,"Sorry, folks! Looks like the internet was glitchy last night during last night's City Council stream. We've uploaded a clean version here: https://vimeo.com/436257932

VIMEO.COM
07-07-20 City Council Meeting",2020-07-08 09:16:36,,
51,8.0,,4.0,,579157599655481,07-07-20 City Council,,,3.0,07-07-20 City Council,2020-07-07 19:05:42,https://video-atl3-1.xx.fbcdn.net/v/t42.26565-2/10000000_296574474722928_572016094087902085_n.mp4?_nc_cat=109&_nc_sid=985c63&efg=eyJ2ZW5jb2RlX3RhZyI6Im9lcF9zZCJ9&_nc_ohc=Y8K7UiBfJ28AX-AWuQx&_nc_ht=video-atl3-1.xx&oh=751dc80d6cdda7a23e5109bc8683052a&oe=5F5DC367,
52,0.0,,1.0,,268569021144478,07-07-20 City Mayor’s Briefing,,,2.0,07-07-20 City Mayor’s Briefing,2020-07-07 18:29:37,https://video-atl3-1.xx.fbcdn.net/v/t42.26565-2/10000000_1154505894932161_8224800595042023628_n.mp4?_nc_cat=102&_nc_sid=985c63&efg=eyJ2ZW5jb2RlX3RhZyI6Im9lcF9zZCJ9&_nc_ohc=ZqIbWE7LA1cAX9F77Y3&_nc_oc=AQmf2khpZZ44etLDPUw6MwjE4kv68uDqP91cV0GMOmxgoFAZf8VgGyxMNkWGOI8kgRI&_nc_ht=video-atl3-1.xx&oh=fa89761e5912c80347fe9951c686f682&oe=5F5DC7C0,
53,0.0,,4.0,,276445973677036,07-01-20 School Committee Meeting,,,0.0,07-01-20 School Committee Meeting,2020-07-01 19:00:33,https://video-atl3-1.xx.fbcdn.net/v/t42.26565-2/10000000_1326995127508996_8630561740329796211_n.mp4?_nc_cat=105&_nc_sid=985c63&efg=eyJ2ZW5jb2RlX3RhZyI6Im9lcF9zZCJ9&_nc_ohc=iX38hIO-w_IAX8n3IB3&_nc_ht=video-atl3-1.xx&oh=e26182698557e2810d806644f01b6977&oe=5F5DBC79,
54,0.0,,4.0,,1010910752701537,06-30-20 School Committee Meeting,,,4.0,06-30-20 School Committee Meeting,2020-06-30 19:02:19,https://video-atl3-1.xx.fbcdn.net/v/t42.26565-2/10000000_201948761099971_4761610994952831935_n.mp4?_nc_cat=110&_nc_sid=985c63&efg=eyJ2ZW5jb2RlX3RhZyI6Im9lcF9zZCJ9&_nc_ohc=wTJ6I-M5TRoAX-rstyX&_nc_ht=video-atl3-1.xx&oh=74c68e9ff0212222a5e6449dcb722b2f&oe=5F5DC126,
55,0.0,https://scontent-atl3-1.xx.fbcdn.net/v/t1.0-9/105629184_573968869933876_6539405151848856152_o.png?_nc_cat=104&_nc_sid=8024bb&_nc_ohc=46Pc_S-5cKMAX-zV50O&_nc_ht=scontent-atl3-1.xx&oh=3cbc45cb2980408ddbf0fb7dcffbf204&oe=5F84F508,8.0,,573995609931202,"ChicopeeTV is proud to announce that we'll be collaborating with the Chicopee Public Library to make their usual (live/in-person) summer concerts a series of virtual/televised events. Every Thursday from July 23 > August 27, we'll televise a live performance by a different band! Tune in for great, safe/distanced music!",https://facebook.com/story.php?story_fbid=573995609931202&id=127573997906701,,0.0,"ChicopeeTV is proud to announce that we'll be collaborating with the Chicopee Public Library to make their usual (live/in-person) summer concerts a series of virtual/televised events. Every Thursday from July 23 > August 27, we'll televise a live performance by a different band! Tune in for great, safe/distanced music!",2020-06-29 14:31:11,,
56,1.0,,7.0,https://vimeo.com/432849968,572171846780245,"The Chicopee Planning Department has kicked off new meetings of a Conservation Commission, and welcomes your input! Reach out to 413-594-1515 with thoughts/feedback/ideas. https://vimeo.com/432849968 City of Chicopee - Mayor's Office",https://facebook.com/story.php?story_fbid=572171846780245&id=127573997906701,"VIMEO.COM
6/24/20 Conservation Commission",0.0,"The Chicopee Planning Department has kicked off new meetings of a Conservation Commission, and welcomes your input! Reach out to 413-594-1515 with thoughts/feedback/ideas. https://vimeo.com/432849968 City of Chicopee - Mayor's Office

VIMEO.COM
6/24/20 Conservation Commission",2020-06-26 11:15:31,,
57,2.0,,1.0,,2805093819710161,6-25-20 Chicopee City Council Budget Hearing,,,0.0,6-25-20 Chicopee City Council Budget Hearing,2020-06-25 18:27:07,https://video-atl3-1.xx.fbcdn.net/v/t42.26565-2/10000000_428783084671689_6627190698601818749_n.mp4?_nc_cat=102&_nc_sid=985c63&efg=eyJ2ZW5jb2RlX3RhZyI6Im9lcF9zZCJ9&_nc_ohc=IMXGCvs7c0AAX87SqOV&_nc_ht=video-atl3-1.xx&oh=17679806b4a562a39da2fb1c45c42c92&oe=5F5DC033,
58,2.0,,2.0,,574324756785216,6-25-20 Chicopee City Council Budget Hearing,,,0.0,6-25-20 Chicopee City Council Budget Hearing,2020-06-25 17:55:24,https://video-atl3-1.xx.fbcdn.net/v/t42.26565-2/10000000_111531467137302_9160432732236712954_n.mp4?_nc_cat=108&_nc_sid=985c63&efg=eyJ2ZW5jb2RlX3RhZyI6Im9lcF9zZCJ9&_nc_ohc=uKBjqRvNnfMAX8WuHPH&_nc_ht=video-atl3-1.xx&oh=1f9398303db229fc0b8f53e368ca99f6&oe=5F5DC6EA,
59,2.0,,1.0,,689241068593961,6-24-20 City Council Budget Hearing,,,2.0,6-24-20 City Council Budget Hearing,2020-06-24 17:56:05,https://video-atl3-1.xx.fbcdn.net/v/t42.26565-2/10000000_124961149246921_4051679898922289464_n.mp4?_nc_cat=102&_nc_sid=985c63&efg=eyJ2ZW5jb2RlX3RhZyI6Im9lcF9zZCJ9&_nc_ohc=ivTJPRsIG4UAX8eSNEi&_nc_ht=video-atl3-1.xx&oh=fd95773479f13799e584e17f4ad7aa55&oe=5F5DBD64,
60,1.0,,1.0,,604526487147159,test signal,,,2.0,test signal,2020-06-24 17:31:12,https://video-atl3-1.xx.fbcdn.net/v/t42.26565-2/106374349_260579758373948_3202429565422054932_n.mp4?_nc_cat=105&_nc_sid=985c63&efg=eyJ2ZW5jb2RlX3RhZyI6Im9lcF9zZCJ9&_nc_ohc=xWu9GBirKRkAX8zonx_&_nc_ht=video-atl3-1.xx&oh=a96186bcd3d6d4cb18a40988fd534262&oe=5F5DBD4F,
61,6.0,,3.0,,330766651250422,6-23-20 Budget Subcommittee Meeting. LIVE! at 6PM,,,6.0,6-23-20 Budget Subcommittee Meeting. LIVE! at 6PM,2020-06-23 17:54:13,https://video-atl3-1.xx.fbcdn.net/v/t42.26565-2/10000000_715847439248113_644947061659226910_n.mp4?_nc_cat=109&_nc_sid=985c63&efg=eyJ2ZW5jb2RlX3RhZyI6Im9lcF9zZCJ9&_nc_ohc=UBR5aeo4QawAX-hYKrx&_nc_ht=video-atl3-1.xx&oh=e367f9aef72b10efea07095ad547bf5f&oe=5F5DBC82,
62,2.0,https://scontent-atl3-1.xx.fbcdn.net/v/t1.0-9/105316694_567005700630193_5217481608114293870_n.png?_nc_cat=108&_nc_sid=8024bb&_nc_ohc=bLtzcBvjm8QAX8q2HLX&_nc_ht=scontent-atl3-1.xx&oh=5069ca124dad9667c40b0020f0e860b9&oe=5F81C4CB,7.0,,567005943963502,,https://facebook.com/story.php?story_fbid=567005943963502&id=127573997906701,,0.0,,2020-06-19 21:30:08,,
63,0.0,,6.0,,567004487296981,A great fragment of a poem by local artist/entrepeneur Johnny Miranda. #BlackLivesMatter,,,0.0,A great fragment of a poem by local artist/entrepeneur Johnny Miranda. #BlackLivesMatter,2020-06-17 21:36:59,https://video-atl3-1.xx.fbcdn.net/v/t42.9040-2/104026404_1044309609297046_4881327377549930576_n.mp4?_nc_cat=109&_nc_sid=985c63&efg=eyJ2ZW5jb2RlX3RhZyI6ImxlZ2FjeV9zZCJ9&_nc_ohc=vL2xCay-twwAX_jCI-R&_nc_ht=video-atl3-1.xx&oh=53dc5374332052dae8d05dc673959ade&oe=5F5DCA17,
64,8.0,,0.0,,189214735806004,06-17-20 School Committee Meeting,,,3.0,06-17-20 School Committee Meeting,2020-06-17 18:58:44,https://scontent-atl3-1.xx.fbcdn.net/v/t66.36281-6/10000000_306418610685457_4271767007946840237_n.mp4?_nc_cat=106&_nc_sid=985c63&efg=eyJ2ZW5jb2RlX3RhZyI6Im9lcF9zZCJ9&_nc_ohc=8lls-5DOg44AX9AReOW&_nc_ht=scontent-atl3-1.xx&oh=c26d1b3647b81632fe80c323a0e1a119&oe=5F840403,
65,0.0,,1.0,,271327844281456,06-17-20 School Committee Meeting,,,0.0,06-17-20 School Committee Meeting,2020-06-17 18:42:27,https://video-atl3-1.xx.fbcdn.net/v/t42.26565-2/104523727_299014207903457_7900999543551402661_n.mp4?_nc_cat=109&_nc_sid=985c63&efg=eyJ2ZW5jb2RlX3RhZyI6Im9lcF9zZCJ9&_nc_ohc=rx7MOOcOGfYAX9_VZSX&_nc_ht=video-atl3-1.xx&oh=9419b9b941e08a7e2d541273183b2618&oe=5F5DC55D,
66,0.0,,1.0,https://vimeo.com/429803708,566796400651123,Last night's City Council meeting (sound error corrected) is here: https://vimeo.com/429803708,https://facebook.com/story.php?story_fbid=566796400651123&id=127573997906701,"VIMEO.COM
6-16-20 City Council",0.0,"Last night's City Council meeting (sound error corrected) is here: https://vimeo.com/429803708

VIMEO.COM
6-16-20 City Council",2020-06-17 13:22:25,,
67,0.0,,1.0,https://vimeo.com/429859356,566700360660727,Apologies for the sound issues last night. There was an event in the chambers and we had no setup time before the meeting began. Here's the (truncated) Mayor's Briefing with audio: https://vimeo.com/429859356,https://facebook.com/story.php?story_fbid=566700360660727&id=127573997906701,"VIMEO.COM
6-16-20 Mayor's Briefing",2.0,"Apologies for the sound issues last night. There was an event in the chambers and we had no setup time before the meeting began. Here's the (truncated) Mayor's Briefing with audio: https://vimeo.com/429859356

VIMEO.COM
6-16-20 Mayor's Briefing",2020-06-17 10:23:41,,
68,11.0,,9.0,,2631027017185997,06-10-20 School Committee Meeting,,,6.0,06-10-20 School Committee Meeting,2020-06-10 18:58:41,https://scontent-atl3-1.xx.fbcdn.net/v/t66.36281-6/10000000_1010255519417483_2749646424438851763_n.mp4?_nc_cat=109&_nc_sid=985c63&efg=eyJ2ZW5jb2RlX3RhZyI6Im9lcF9zZCJ9&_nc_ohc=NS8_ZZ5jZhsAX-KAk5a&_nc_ht=scontent-atl3-1.xx&oh=5b8a93b5d8f5b8a1af12676fb56da416&oe=5F84A570,
69,0.0,,6.0,https://vimeo.com/427518479,562225551108208,Check out the reading of names from yesterday’s “Voice Put” event at Chicopee High. https://vimeo.com/427518479,https://facebook.com/story.php?story_fbid=562225551108208&id=127573997906701,"VIMEO.COM
Chicopee Black Lives Voice Out",2.0,"Check out the reading of names from yesterday’s “Voice Put” event at Chicopee High. https://vimeo.com/427518479

VIMEO.COM
Chicopee Black Lives Voice Out",2020-06-09 19:33:25,,
70,2.0,https://scontent-atl3-1.xx.fbcdn.net/v/t1.0-9/fr/cp0/e15/q65/102394847_559891958008234_2155749384537804996_o.jpg?_nc_cat=103&_nc_sid=8024bb&_nc_ohc=BLeLoSgFexcAX9nNQjN&_nc_ht=scontent-atl3-1.xx&tp=14&oh=c8b70affb0bc67dea5bf2579c1772f74&oe=5F835A19,11.0,https://vimeo.com/425382028,559892208008209,"Missed the Chicopee Comprehensive High School graduation? Easy enough: Go here & click the ""Download"" button! https://vimeo.com/425382028",https://facebook.com/story.php?story_fbid=559892208008209&id=127573997906701,,0.0,"Missed the Chicopee Comprehensive High School graduation? Easy enough: Go here & click the ""Download"" button! https://vimeo.com/425382028",2020-06-05 19:20:34,,
71,6.0,https://scontent-atl3-1.xx.fbcdn.net/v/t1.0-9/fr/cp0/e15/q65/101808887_559828161347947_3431190151746609318_o.jpg?_nc_cat=100&_nc_sid=8024bb&_nc_ohc=j11Ire1PaDsAX_0W64d&_nc_ht=scontent-atl3-1.xx&tp=14&oh=e276c8ef9fad5972de9701432c91ac6d&oe=5F84A6D6,55.0,,559828861347877,"Got family who missed graduation and doesn't have internet to stream it On-Demand. No problem. ChicopeeTV is airing all three high schools' graduations repeatedly this weekend on channel 191 of Chicopee Charter Cable. Here's the schedule:
Saturday, June 6
* Comp: 8am, 2pm, 9pm
* CHS: 10am & 7pm
* Academy: 4pm
Sunday, June 7
* Comp: 3pm
* CHS: 9am & 8pm
* Academy: 11am",https://facebook.com/story.php?story_fbid=559828861347877&id=127573997906701,,0.0,"Got family who missed graduation and doesn't have internet to stream it On-Demand. No problem. ChicopeeTV is airing all three high schools' graduations repeatedly this weekend on channel 191 of Chicopee Charter Cable. Here's the schedule:
Saturday, June 6
* Comp: 8am, 2pm, 9pm
* CHS: 10am & 7pm
* Academy: 4pm
Sunday, June 7
* Comp: 3pm
* CHS: 9am & 8pm
* Academy: 11am",2020-06-05 19:15:20,,
72,117.0,,38.0,,184557566242592,Chicopee Comp Graduation 2020,,,55.0,Chicopee Comp Graduation 2020,2020-06-05 17:25:28,https://scontent-atl3-1.xx.fbcdn.net/v/t66.36281-6/10000000_333039744792302_3392805854944836895_n.mp4?_nc_cat=106&_nc_sid=985c63&efg=eyJ2ZW5jb2RlX3RhZyI6Im9lcF9zZCJ9&_nc_ohc=524jCzNp9wIAX8cNvF6&_nc_ht=scontent-atl3-1.xx&oh=5c54e1f98956b5cedf05ea06441d569a&oe=5F84D386,
73,2.0,https://scontent-atl3-1.xx.fbcdn.net/v/t1.0-9/fr/cp0/e15/q65/101376092_559830011347762_8055092003703781707_o.jpg?_nc_cat=106&_nc_sid=8024bb&_nc_ohc=nMDK6Gx49SMAX-uMJz9&_nc_ht=scontent-atl3-1.xx&tp=14&oh=70c7d6e89472cff0f99e612d672a7c2f&oe=5F82993C,52.0,,559830071347756,"Just a few minutes away... The Chicopee Comprehensive High School's 2020 Virtual Graduation. Join us here, or on channel 191 on Chicopee Charter Cable!",https://facebook.com/story.php?story_fbid=559830071347756&id=127573997906701,,0.0,"Just a few minutes away... The Chicopee Comprehensive High School's 2020 Virtual Graduation. Join us here, or on channel 191 on Chicopee Charter Cable!",2020-06-05 17:19:11,,
74,4.0,,25.0,https://vimeo.com/425167700,559541668043263,"Good morning Chicopee:
https://vimeo.com/425167700
Here is the link to the CHS Graduation video, which can be downloaded for families to keep.
Congratulations to our graduates!

Chicopee Comprehensive gets their turn to shine tonight at 5:30.
Watch on Charter Spectrum Channel 191
on the ChicopeeTV facebook page
or at www.vimeo.com/chicopeetv",https://facebook.com/story.php?story_fbid=559541668043263&id=127573997906701,"VIMEO.COM
2020 Chicopee High School Graduation",16.0,"Good morning Chicopee:
https://vimeo.com/425167700
Here is the link to the CHS Graduation video, which can be downloaded for families to keep.
Congratulations to our graduates!

Chicopee Comprehensive gets their turn to shine tonight at 5:30.
Watch on Charter Spectrum Channel 191
on the ChicopeeTV facebook page
or at www.vimeo.com/chicopeetv

VIMEO.COM
2020 Chicopee High School Graduation",2020-06-05 07:25:01,,
75,163.0,,74.0,http://www.ChicopeeTV.org/,584213672230059,2020 Chicopee High Graduation,,"2020 Chicopee High Graduation
www.ChicopeeTV.org

2020 Chicopee High Graduation",82.0,"2020 Chicopee High Graduation

2020 Chicopee High Graduation
www.ChicopeeTV.org

2020 Chicopee High Graduation",2020-06-04 17:25:13,https://scontent-atl3-1.xx.fbcdn.net/v/t66.36281-6/10000000_361666815003719_5568727754124429554_n.mp4?_nc_cat=109&_nc_sid=985c63&efg=eyJ2ZW5jb2RlX3RhZyI6Im9lcF9zZCJ9&_nc_ohc=G9jiKWWdz_8AX_R951J&_nc_ht=scontent-atl3-1.xx&oh=54ff128f639364f7061bce78e4a1a10f&oe=5F84C211,
76,3.0,https://scontent-atl3-1.xx.fbcdn.net/v/t1.0-9/fr/cp0/e15/q65/101659785_559121908085239_1372054296576655360_n.jpg?_nc_cat=105&_nc_sid=110474&_nc_ohc=9mzXtF_mFOUAX8U0ImH&_nc_ht=scontent-atl3-1.xx&tp=14&oh=962664c4c4a0dd70bb76232a2b8729df&oe=5F81A7B0,39.0,https://www.vimeo.com/chicopeetv,559121988085231,"Posting Pacer Parade Preps
Parade at 4
Graduation Video at 5:30
Charter Spectrum 191
ChicopeeTV Facebook page livestream
www.vimeo.com/chicopeetv livestream",https://facebook.com/story.php?story_fbid=559121988085231&id=127573997906701,,0.0,"Posting Pacer Parade Preps
Parade at 4
Graduation Video at 5:30
Charter Spectrum 191
ChicopeeTV Facebook page livestream
www.vimeo.com/chicopeetv livestream",2020-06-04 15:33:26,,
77,21.0,,18.0,,720508865443333,Chicopee Academy Graduation 2020 LIVE at 12 NOON!,,,3.0,Chicopee Academy Graduation 2020 LIVE at 12 NOON!,2020-06-04 11:55:45,https://scontent-atl3-1.xx.fbcdn.net/v/t66.36281-6/10000000_1245394589160461_6455827277620192346_n.mp4?_nc_cat=103&_nc_sid=985c63&efg=eyJ2ZW5jb2RlX3RhZyI6Im9lcF9zZCJ9&_nc_ohc=pFpSlO6kaIcAX_U_F7b&_nc_ht=scontent-atl3-1.xx&oh=4b93f09ebe63722166af4ccc7b2c4ef9&oe=5F851BAB,
78,1.0,,4.0,,862102940866954,06/03/20 School Committee Meeting,,,0.0,06/03/20 School Committee Meeting,2020-06-03 18:58:31,https://scontent-atl3-1.xx.fbcdn.net/v/t66.36281-6/10000000_192714535597452_9189785778400124535_n.mp4?_nc_cat=102&_nc_sid=985c63&efg=eyJ2ZW5jb2RlX3RhZyI6Im9lcF9zZCJ9&_nc_ohc=sp9E5DNErbUAX-RF37F&_nc_ht=scontent-atl3-1.xx&oh=5aea6b94978636303d6dfff73105d59e&oe=5F830752,
79,17.0,https://scontent-atl3-1.xx.fbcdn.net/v/t1.0-9/fr/cp0/e15/q65/101446754_558489024815194_7266925965790412800_o.jpg?_nc_cat=101&_nc_sid=8024bb&_nc_ohc=2qu7qTmHlykAX-uKM_M&_nc_ht=scontent-atl3-1.xx&tp=14&oh=2866b58255950cfeb6fdbca07716e03b&oe=5F83CC4C,323.0,https://www.chicopeetv.org/grad-details,558489501481813,Starting tomorrow - ChicopeeTV airs all 3 of the city's graduations. Join us for these live events! Details on how to view and a schedule on our website: https://www.chicopeetv.org/grad-details,https://facebook.com/story.php?story_fbid=558489501481813&id=127573997906701,,0.0,Starting tomorrow - ChicopeeTV airs all 3 of the city's graduations. Join us for these live events! Details on how to view and a schedule on our website: https://www.chicopeetv.org/grad-details,2020-06-03 15:23:20,,
80,0.0,,0.0,,303238657506800,6/2/20 City Council,,,0.0,6/2/20 City Council,2020-06-02 18:44:12,https://scontent-atl3-1.xx.fbcdn.net/v/t66.36281-6/10000000_2275210875957576_2336689736928952274_n.mp4?_nc_cat=110&_nc_sid=985c63&efg=eyJ2ZW5jb2RlX3RhZyI6Im9lcF9zZCJ9&_nc_ohc=GNWsA885H5AAX8r2BAN&_nc_ht=scontent-atl3-1.xx&oh=ef998f8d259abbc9c214183c4b4726ea&oe=5F815DA5,
81,2.0,,6.0,,185933426041854,6/2/20 Mayor's Briefing,,,3.0,6/2/20 Mayor's Briefing,2020-06-02 18:26:51,https://scontent-atl3-1.xx.fbcdn.net/v/t66.36281-6/10000000_2700181926962300_7665256673324492655_n.mp4?_nc_cat=100&_nc_sid=985c63&efg=eyJ2ZW5jb2RlX3RhZyI6Im9lcF9zZCJ9&_nc_ohc=upr806TrbB4AX_R8kgR&_nc_ht=scontent-atl3-1.xx&oh=69a7a9768f0dff598300c5fd3145cdf6&oe=5F82BF06,
82,0.0,,4.0,,3461472233882857,6/2/20 City Council School Committee Special Meeting,,,0.0,6/2/20 City Council School Committee Special Meeting,2020-06-02 17:46:52,https://scontent-atl3-1.xx.fbcdn.net/v/t66.36281-6/10000000_771113473646269_7194925590783418711_n.mp4?_nc_cat=102&_nc_sid=985c63&efg=eyJ2ZW5jb2RlX3RhZyI6Im9lcF9zZCJ9&_nc_ohc=QxCJVpRdfpEAX_LduOQ&_nc_ht=scontent-atl3-1.xx&oh=fe71d26e090e7277a99c467eb48371df&oe=5F82FAA8,
83,9.0,https://scontent-atl3-1.xx.fbcdn.net/v/t1.0-9/fr/cp0/e15/q65/100526297_555444691786294_4194963517998104576_o.jpg?_nc_cat=100&_nc_sid=8024bb&_nc_ohc=lP-06l5yrEgAX__vGlw&_nc_oc=AQl04ZOISxV5_BdC9L45fu9n5BCdG-_HKwlWacgYOoMxSIlR18_Mp5qWpSfDX0V5hDE&_nc_ht=scontent-atl3-1.xx&tp=14&oh=806cda8dfb1fd722763254ff1b550e31&oe=5F826632,141.0,http://www.ChicopeeTV.org/,555445838452846,"1 week from today - on Friday, June 5th - at 5:30pm, Chicopee Comprehensive High School's Class of 2020 will graduate. ChicopeeTV has been hard at work collaborating with Comp to get the event produced. It will livestream here on Facebook, and on Vimeo - or on channel 191 on your Chicopee/Charter Cable dial. Join us! It's going to be awesome! City of Chicopee - Mayor's Office Chicopee Public Schools",https://facebook.com/story.php?story_fbid=555445838452846&id=127573997906701,,0.0,"1 week from today - on Friday, June 5th - at 5:30pm, Chicopee Comprehensive High School's Class of 2020 will graduate. ChicopeeTV has been hard at work collaborating with Comp to get the event produced. It will livestream here on Facebook, and on Vimeo - or on channel 191 on your Chicopee/Charter Cable dial. Join us! It's going to be awesome! City of Chicopee - Mayor's Office Chicopee Public Schools",2020-05-29 13:32:32,,
84,0.0,,15.0,https://vimeo.com/422477780,553173138680116,"Undeterred by the inability to gather for a Memorial Day Parade, Chicopee Department of Veterans Services decided to produce a televised Memorial. We at ChicopeeTV edited for them - and are happy to share it with you. In memory of our fallen brothers & sisters; we will never forget you. https://vimeo.com/422477780",https://facebook.com/story.php?story_fbid=553173138680116&id=127573997906701,"VIMEO.COM
Memorial Day 2020",10.0,"Undeterred by the inability to gather for a Memorial Day Parade, Chicopee Department of Veterans Services decided to produce a televised Memorial. We at ChicopeeTV edited for them - and are happy to share it with you. In memory of our fallen brothers & sisters; we will never forget you. https://vimeo.com/422477780

VIMEO.COM
Memorial Day 2020",2020-05-25 13:06:31,,
85,0.0,,2.0,,552846202046143,We join the @Chicopee Department of Veterans Services in remembrance of those who have died in service to our country.,https://facebook.com/story.php?story_fbid=552846202046143&id=127573997906701,,0.0,We join the @Chicopee Department of Veterans Services in remembrance of those who have died in service to our country.,2020-05-24 22:44:24,,
86,0.0,,14.0,,551411922189571,"Pacers should prepare....
Chicopee High School - Pacers
City of Chicopee - Mayor's Office
Chicopee FRESH
Chicopee Police Department
Chicopee Public Schools",,,0.0,"Pacers should prepare....
Chicopee High School - Pacers
City of Chicopee - Mayor's Office
Chicopee FRESH
Chicopee Police Department
Chicopee Public Schools",2020-05-22 09:57:52,https://video-atl3-1.xx.fbcdn.net/v/t42.9040-2/99154219_2723765624522853_1664620137271001088_n.mp4?_nc_cat=103&_nc_sid=985c63&efg=eyJ2ZW5jb2RlX3RhZyI6ImxlZ2FjeV9zZCJ9&_nc_ohc=woPZBkCTr7wAX_mVcP2&_nc_ht=video-atl3-1.xx&oh=4fb73e3c87a29007ff53131415eead53&oe=5F5DC1D0,
87,10.0,,6.0,,1199736967035268,05/21/20 City Council School Committee Special Meeting,,,2.0,05/21/20 City Council School Committee Special Meeting,2020-05-21 18:45:06,https://scontent-atl3-1.xx.fbcdn.net/v/t66.36281-6/10000000_691918631539635_8741941911565390090_n.mp4?_nc_cat=106&_nc_sid=985c63&efg=eyJ2ZW5jb2RlX3RhZyI6Im9lcF9zZCJ9&_nc_ohc=uGI4eDrPHLUAX93j9sv&_nc_oc=AQnJFeqOBHdgM1XZUiN4HGXiyL4YxNuLsXgtqnLuFUjKFiXY5Jwvss43u1Db6kV5uX4&_nc_ht=scontent-atl3-1.xx&oh=40571d0f0756f95d36738f1171bd7a7f&oe=5F8484E1,
88,4.0,,0.0,,2629349960671970,05/20/20 School Committee Meeting,,,2.0,05/20/20 School Committee Meeting,2020-05-20 19:00:12,https://scontent-atl3-1.xx.fbcdn.net/v/t66.36281-6/10000000_590253581666822_8904084048914133189_n.mp4?_nc_cat=105&_nc_sid=985c63&efg=eyJ2ZW5jb2RlX3RhZyI6Im9lcF9zZCJ9&_nc_ohc=Mq7ZuQ08giwAX9Zk_3y&_nc_ht=scontent-atl3-1.xx&oh=6d90cdc02d6fff0ff4d72c584c68f622&oe=5F8183F9,
89,10.0,https://scontent-atl3-1.xx.fbcdn.net/v/t1.0-9/fr/cp0/e15/q65/98489930_549772595686837_5283733655905107968_n.jpg?_nc_cat=103&_nc_sid=110474&_nc_ohc=QBaIODRHVhEAX-NKz9J&_nc_ht=scontent-atl3-1.xx&tp=14&oh=5cc4ba43389aea20a06ff034d72d2823&oe=5F832CB5,67.0,,549773945686702,On the field at Chicopee Comprehensive High School shooting (socially distant) virtual graduation walks! Proud of our city’s seniors! City of Chicopee - Mayor's Office Chicopee Public Schools,https://facebook.com/story.php?story_fbid=549773945686702&id=127573997906701,,0.0,On the field at Chicopee Comprehensive High School shooting (socially distant) virtual graduation walks! Proud of our city’s seniors! City of Chicopee - Mayor's Office Chicopee Public Schools,2020-05-19 12:56:33,,
90,1.0,,1.0,,249485886260254,5/18/20 Chicopee City Council,,,2.0,5/18/20 Chicopee City Council,2020-05-18 19:14:41,https://scontent-atl3-1.xx.fbcdn.net/v/t66.36281-6/10000000_782207965688123_1804981845588280504_n.mp4?_nc_cat=102&_nc_sid=985c63&efg=eyJ2ZW5jb2RlX3RhZyI6Im9lcF9zZCJ9&_nc_ohc=2Q3d-vYINh8AX-_NbRb&_nc_ht=scontent-atl3-1.xx&oh=7ba1907fe9f9c642638a3f7bee8af1a3&oe=5F814FE8,
91,3.0,,7.0,,2713551068875636,5/18/20 Mayor's Briefing,,,2.0,5/18/20 Mayor's Briefing,2020-05-18 18:28:39,https://scontent-atl3-1.xx.fbcdn.net/v/t66.36281-6/10000000_221234705975848_3501923307218085301_n.mp4?_nc_cat=111&_nc_sid=985c63&efg=eyJ2ZW5jb2RlX3RhZyI6Im9lcF9zZCJ9&_nc_ohc=l6HuRUADya0AX8E35eY&_nc_ht=scontent-atl3-1.xx&oh=58aad921610119d4b295d3034763fdc6&oe=5F834AFC,
92,0.0,,0.0,,2637112696569719,5/18/20 Chicopee City Council Stream test,,,0.0,5/18/20 Chicopee City Council Stream test,2020-05-18 17:23:57,https://video-atl3-1.xx.fbcdn.net/v/t42.26565-2/118294305_338935880475504_5858010030744357355_n.mp4?_nc_cat=109&_nc_sid=985c63&efg=eyJ2ZW5jb2RlX3RhZyI6Im9lcF9zZCJ9&_nc_ohc=y01Q45XzjnkAX8KYFGX&_nc_ht=video-atl3-1.xx&oh=5b921a6e19981dccf9128f7ef1fbc713&oe=5F5DC916,
93,0.0,,5.0,,355648832062593,5/13/20 School Committee,,,0.0,5/13/20 School Committee,2020-05-13 19:00:00,https://video-atl3-1.xx.fbcdn.net/v/t42.26565-2/10000000_755456121956877_2663388772112014957_n.mp4?_nc_cat=105&_nc_sid=985c63&efg=eyJ2ZW5jb2RlX3RhZyI6Im9lcF9zZCJ9&_nc_ohc=9PPNaG4xXyAAX_aYXBl&_nc_oc=AQkaKLmOBhN-BhgHWQXafKJJWs6h2XKJSF3-5jaTA0Gog2g7ngFlCidx-DFoVC1nEew&_nc_ht=video-atl3-1.xx&oh=33882d2743bdb9eee19547bfe7f78db0&oe=5F5DC6CA,
94,2.0,,39.0,https://vimeo.com/418146196,546265376037559,"Chicopee Comprehensive High School held its reverse parade yesterday, and it was off the hook! https://vimeo.com/418146196 Chicopee Police Department City of Chicopee - Mayor's Office",https://facebook.com/story.php?story_fbid=546265376037559&id=127573997906701,"VIMEO.COM
Comp Reverse Parade",81.0,"Chicopee Comprehensive High School held its reverse parade yesterday, and it was off the hook! https://vimeo.com/418146196 Chicopee Police Department City of Chicopee - Mayor's Office

VIMEO.COM
Comp Reverse Parade",2020-05-13 15:23:31,,
95,0.0,https://scontent-atl3-1.xx.fbcdn.net/v/t1.0-9/fr/cp0/e15/q65/96821049_545646019432828_1105752790782705664_n.jpg?_nc_cat=110&_nc_sid=110474&_nc_ohc=gXtO_YD5FFQAX9P3qx1&_nc_ht=scontent-atl3-1.xx&tp=14&oh=9736e87d5d7ea55debcd8f91d7a5b43e&oe=5F82DB5C,55.0,,545646746099422,Chicopee High School virtual graduation shoot day 1! Chicopee Public Schools City of Chicopee - Mayor's Office Chicopee High School - Pacers,https://facebook.com/story.php?story_fbid=545646746099422&id=127573997906701,,0.0,Chicopee High School virtual graduation shoot day 1! Chicopee Public Schools City of Chicopee - Mayor's Office Chicopee High School - Pacers,2020-05-12 12:46:53,,
96,1.0,,16.0,https://vimeo.com/417370246,545223089475121,"Hats off to Ernest on his 96th birthday - and his service to our country and our great city! Chicopee Department of Veterans Services City of Chicopee - Mayor's Office
https://vimeo.com/417370246",https://facebook.com/story.php?story_fbid=545223089475121&id=127573997906701,"VIMEO.COM
Ernest ""Ernie"" Despault Birthday Parade",17.0,"Hats off to Ernest on his 96th birthday - and his service to our country and our great city! Chicopee Department of Veterans Services City of Chicopee - Mayor's Office
https://vimeo.com/417370246

VIMEO.COM
Ernest ""Ernie"" Despault Birthday Parade",2020-05-11 17:44:31,,
97,0.0,,0.0,,543489852981778,"Thank you to Casey at the Council on Aging for sharing this home fitness video, Gentle Exercise with Ryan. His company The Davis Method helps keep seniors healthy and active.",,,0.0,"Thank you to Casey at the Council on Aging for sharing this home fitness video, Gentle Exercise with Ryan. His company The Davis Method helps keep seniors healthy and active.",2020-05-08 16:50:34,https://video-atl3-1.xx.fbcdn.net/v/t42.9040-2/10000000_596186177658727_8234621078702391296_n.mp4?_nc_cat=104&_nc_sid=985c63&efg=eyJ2ZW5jb2RlX3RhZyI6ImxlZ2FjeV9zZCJ9&_nc_ohc=e-dTT1WEWI8AX9-u9X0&_nc_ht=video-atl3-1.xx&oh=765e73a0c9a9c3a438f54303721b17e4&oe=5F5DC032,
98,13.0,,94.0,,542713186392778,Chicopee High passed out caps and gowns in a Reverse Car Parade. Teachers greeted the seniors as they made thier way around the parking lot! Chicopee High School - Pacers City of Chicopee - Mayor's Office Chicopee Public Schools Chicopee Police Department Chicopee FRESH,,,0.0,Chicopee High passed out caps and gowns in a Reverse Car Parade. Teachers greeted the seniors as they made thier way around the parking lot! Chicopee High School - Pacers City of Chicopee - Mayor's Office Chicopee Public Schools Chicopee Police Department Chicopee FRESH,2020-05-07 09:51:56,https://video-atl3-1.xx.fbcdn.net/v/t42.9040-2/96739668_258903311970499_5506227938388869120_n.mp4?_nc_cat=108&_nc_sid=985c63&efg=eyJ2ZW5jb2RlX3RhZyI6ImxlZ2FjeV9zZCJ9&_nc_ohc=KkQiaMarxJAAX8xuRsg&_nc_ht=video-atl3-1.xx&oh=f8c308e50c523219ef6f9fcad3d858b7&oe=5F5DC60E,
99,1.0,,4.0,,834335657090821,5/5/20 City Council,,,2.0,5/5/20 City Council,2020-05-05 19:15:09,https://video-atl3-1.xx.fbcdn.net/v/t42.26565-2/10000000_767790187382060_5877702580117921581_n.mp4?_nc_cat=106&_nc_sid=985c63&efg=eyJ2ZW5jb2RlX3RhZyI6Im9lcF9zZCJ9&_nc_ohc=1yIlRKNPDtEAX9hJC1p&_nc_ht=video-atl3-1.xx&oh=aa0d14693756c42a1ab49aa2253b3f96&oe=5F5DC00A,
100,0.0,,5.0,,1902650076533768,5/5/20 Mayor's Briefing,,,0.0,5/5/20 Mayor's Briefing,2020-05-05 18:29:54,https://video-atl3-1.xx.fbcdn.net/v/t42.26565-2/10000000_166630118321370_1620368022255594369_n.mp4?_nc_cat=103&_nc_sid=985c63&efg=eyJ2ZW5jb2RlX3RhZyI6Im9lcF9zZCJ9&_nc_ohc=goksCm-dJzsAX-kV2oo&_nc_ht=video-atl3-1.xx&oh=88dc4d8c33a2f3456827d3f321e23c31&oe=5F5DC3A1,
101,6.0,,5.0,,702733943870759,5/4/20 School Committee,,,0.0,5/4/20 School Committee,2020-05-04 18:59:24,https://video-atl3-1.xx.fbcdn.net/v/t42.26565-2/10000000_348359963231118_604432830108517857_n.mp4?_nc_cat=109&_nc_sid=985c63&efg=eyJ2ZW5jb2RlX3RhZyI6Im9lcF9zZCJ9&_nc_ohc=28o8MWobPkYAX9IaYJn&_nc_ht=video-atl3-1.xx&oh=928cec2a83d703d5838b87c7c17bb976&oe=5F5DC127,
102,6.0,,35.0,,534718580525572,"Thank you to Officer Wilk for sharing his time and letting us get to know him!
Were taking a glimpse into the lives to city employees to see how they are staying healthy, active and busy during this unusual time.
Share your stories here!
ChicopeeTV is the community media voice for Chicopee residents. We care about the city you live in; and are interested in your life and well being. Share your favorite recipe. Guide us through a project. Show us your at home workout.",,,0.0,"Thank you to Officer Wilk for sharing his time and letting us get to know him!
Were taking a glimpse into the lives to city employees to see how they are staying healthy, active and busy during this unusual time.
Share your stories here!
ChicopeeTV is the community media voice for Chicopee residents. We care about the city you live in; and are interested in your life and well being. Share your favorite recipe. Guide us through a project. Show us your at home workout.",2020-04-24 08:25:00,https://video-atl3-1.xx.fbcdn.net/v/t42.9040-2/94686257_184794762530947_533850093996998656_n.mp4?_nc_cat=108&_nc_sid=985c63&efg=eyJ2ZW5jb2RlX3RhZyI6ImxlZ2FjeV9zZCJ9&_nc_ohc=-WlNjTMxNS4AX8jedGh&_nc_ht=video-atl3-1.xx&oh=04f4b7dd52e4f9c258fe41be429b0e1b&oe=5F5DC0B0,
103,15.0,,12.0,,534727433858020,1987 Chicopee High Graduation,,,0.0,1987 Chicopee High Graduation,2020-04-24 07:37:00,https://video-atl3-1.xx.fbcdn.net/v/t42.9040-2/10000000_549781849072935_7136676860586360832_n.mp4?_nc_cat=107&_nc_sid=985c63&efg=eyJ2ZW5jb2RlX3RhZyI6ImxlZ2FjeV9zZCJ9&_nc_ohc=GyGsWjXUo_EAX9VcMqA&_nc_ht=video-atl3-1.xx&oh=0f07259e10ebeea0bfd774a121ca4d16&oe=5F5DBD58,
104,0.0,,0.0,https://vimeo.com/103525511,534672347196862,"Per the Chicopee Police Department, the Registry has been updated: https://vimeo.com/103525511",https://facebook.com/story.php?story_fbid=534672347196862&id=127573997906701,"VIMEO.COM
Sex Offender Registry Board",0.0,"Per the Chicopee Police Department, the Registry has been updated: https://vimeo.com/103525511

VIMEO.COM
Sex Offender Registry Board",2020-04-23 21:30:17,,
105,1.0,,3.0,https://nypost.com/2020/04/20/can-the-coronavirus-be-spread-through-farts/,534471687216928,"OK, it's childish, but everyone needs a laugh right about now... and this is an actual article: https://nypost.com/2020/04/20/can-the-coronavirus-be-spread-through-farts/",https://facebook.com/story.php?story_fbid=534471687216928&id=127573997906701,"NYPOST.COM
Can the coronavirus be spread through farts?",13.0,"OK, it's childish, but everyone needs a laugh right about now... and this is an actual article: https://nypost.com/2020/04/20/can-the-coronavirus-be-spread-through-farts/

NYPOST.COM
Can the coronavirus be spread through farts?",2020-04-23 13:45:57,,
106,9.0,,17.0,,532890620708368,1984 Chicopee Comprehensive Graduation,,,0.0,1984 Chicopee Comprehensive Graduation,2020-04-22 07:11:00,https://video-atl3-1.xx.fbcdn.net/v/t42.9040-2/10000000_259632711862603_6022437944571199488_n.mp4?_nc_cat=100&_nc_sid=985c63&efg=eyJ2ZW5jb2RlX3RhZyI6ImxlZ2FjeV9zZCJ9&_nc_ohc=kw8F-aKhsjEAX_7nbcD&_nc_ht=video-atl3-1.xx&oh=47bc56c727adaf47dd7fa68ca6288007&oe=5F5DC875,
107,4.0,,1.0,,244771526829403,04/21/20 City Council,,,2.0,04/21/20 City Council,2020-04-21 19:14:36,https://video-atl3-1.xx.fbcdn.net/v/t42.26565-2/10000000_593324601610180_2380488505657834079_n.mp4?_nc_cat=110&_nc_sid=985c63&efg=eyJ2ZW5jb2RlX3RhZyI6Im9lcF9zZCJ9&_nc_ohc=BiximMFxQjIAX_eBY5T&_nc_ht=video-atl3-1.xx&oh=b21377cb932de002b8285367e24c7c7e&oe=5F5DC7CC,
108,6.0,,5.0,,710336553105478,04/21/20 Mayor's Briefing,,,2.0,04/21/20 Mayor's Briefing,2020-04-21 18:29:34,https://video-atl3-1.xx.fbcdn.net/v/t42.26565-2/10000000_2648791818782104_3204377071192698434_n.mp4?_nc_cat=102&_nc_sid=985c63&efg=eyJ2ZW5jb2RlX3RhZyI6Im9lcF9zZCJ9&_nc_ohc=dBCnemJ-JFAAX-P9EB5&_nc_ht=video-atl3-1.xx&oh=2b65d535ed41eb00b238bc8debe1b196&oe=5F5DC847,
109,12.0,,14.0,,532874900709940,1997 Chicopee High Graduation,,,0.0,1997 Chicopee High Graduation,2020-04-21 06:27:00,https://video-atl3-1.xx.fbcdn.net/v/t42.9040-2/10000000_649449019210686_3919378423213981696_n.mp4?_nc_cat=107&_nc_sid=985c63&efg=eyJ2ZW5jb2RlX3RhZyI6ImxlZ2FjeV9zZCJ9&_nc_ohc=hcaq6jCtt90AX_nUxvR&_nc_ht=video-atl3-1.xx&oh=5356cea6428ce9eef92c6ec4cb390cbd&oe=5F5DBD08,
110,0.0,,7.0,https://vimeo.com/408201479,529681114362652,"Apologies, viewers, for tonight's Facebook Live debacle! After 2 days of prep, it was very frustrating on our end as well. The meeting aired in its entirety live on channel 191. We managed to salvage a recording of minute 10 onward. That recording is here:
https://vimeo.com/408201479",https://facebook.com/story.php?story_fbid=529681114362652&id=127573997906701,"VIMEO.COM
4/15/20 School Committee Meeting",0.0,"Apologies, viewers, for tonight's Facebook Live debacle! After 2 days of prep, it was very frustrating on our end as well. The meeting aired in its entirety live on channel 191. We managed to salvage a recording of minute 10 onward. That recording is here:
https://vimeo.com/408201479

VIMEO.COM
4/15/20 School Committee Meeting",2020-04-15 21:14:21,,
111,1.0,,9.0,,529638694366894,It was our intention to live stream tonight’s School Committee meeting. A technical failure has prevented the live stream from being broadcast. The meeting did air on channel 191 on Chicopee Cable. We apologize for this problem. We have been working all week to iron out issues associated with live streaming and broadcasting a meeting remotely. Hopefully this problem will not recur. Thanks for supporting ChicopeeTV.,https://facebook.com/story.php?story_fbid=529638694366894&id=127573997906701,,0.0,It was our intention to live stream tonight’s School Committee meeting. A technical failure has prevented the live stream from being broadcast. The meeting did air on channel 191 on Chicopee Cable. We apologize for this problem. We have been working all week to iron out issues associated with live streaming and broadcasting a meeting remotely. Hopefully this problem will not recur. Thanks for supporting ChicopeeTV.,2020-04-15 19:35:16,,
112,2.0,,7.0,,529598564370907,"Tonight's school committee meeting is happening at 7pm tonight, via a new socially-distanced video-conference method. Tune in here or on channel 191 shortly to check out the latest/live developments in the city & education.",https://facebook.com/story.php?story_fbid=529598564370907&id=127573997906701,,0.0,"Tonight's school committee meeting is happening at 7pm tonight, via a new socially-distanced video-conference method. Tune in here or on channel 191 shortly to check out the latest/live developments in the city & education.",2020-04-15 18:12:20,,
113,0.0,,1.0,https://www.youtube.com/watch?v=yLuHE-82o40,529597427704354,"Today's Song of the Day...an irrefutable/lesser-known track by none other than ""it's a sunny day"" legend Bob Marley: Easy Skankin' (and btw, ""skankin"" in Jamaica means something far less nefarious than here in the U.S.!) https://www.youtube.com/watch?v=yLuHE-82o40",https://facebook.com/story.php?story_fbid=529597427704354&id=127573997906701,"YOUTUBE.COM
Bob Marley - Easy Skanking",0.0,"Today's Song of the Day...an irrefutable/lesser-known track by none other than ""it's a sunny day"" legend Bob Marley: Easy Skankin' (and btw, ""skankin"" in Jamaica means something far less nefarious than here in the U.S.!) https://www.youtube.com/watch?v=yLuHE-82o40

YOUTUBE.COM
Bob Marley - Easy Skanking",2020-04-15 18:10:19,,
114,12.0,,19.0,,527748614555902,1986 Chicopee Comp Graduation,,,0.0,1986 Chicopee Comp Graduation,2020-04-14 08:49:00,https://video-atl3-1.xx.fbcdn.net/v/t42.9040-2/10000000_577222393141367_3133330632734670848_n.mp4?_nc_cat=111&_nc_sid=985c63&efg=eyJ2ZW5jb2RlX3RhZyI6ImxlZ2FjeV9zZCJ9&_nc_ohc=PG2WOdCprSEAX_VT1OJ&_nc_ht=video-atl3-1.xx&oh=617e8595e592ac88e6a3f5ce47b28bd8&oe=5F5DC08C,
115,0.0,,2.0,https://weather.com/photos/news/2020-03-19-national-parks-photos#1,528040401193390,"Have you checked out our new show, Mass Earth? It explores the nature of western Mass. But these virtual tours of the nation's most epic national parks are pretty great too, if you're needing a glimpse of the world beyond your living room...
https://weather.com/photos/news/2020-03-19-national-parks-photos#1",https://facebook.com/story.php?story_fbid=528040401193390&id=127573997906701,"WEATHER.COM
Bored at Home? Take a Virtual Tour of the Country's Best National Parks (PHOTOS) | The Weather Channel",0.0,"Have you checked out our new show, Mass Earth? It explores the nature of western Mass. But these virtual tours of the nation's most epic national parks are pretty great too, if you're needing a glimpse of the world beyond your living room...
https://weather.com/photos/news/2020-03-19-national-parks-photos#1

WEATHER.COM
Bored at Home? Take a Virtual Tour of the Country's Best National Parks (PHOTOS) | The Weather Channel",2020-04-13 17:44:05,,
116,0.0,,1.0,https://www.youtube.com/watch?v=yYuTEcArOr8&list=PLGtp__SJsu_sxTQd1U0fhg6KktKJ0fr6p,528037974526966,"Today's Song of the Day isn't just *a* song; it's an entire score - and it's MAGICAL on a rainy day like today! Check out Philip Glass' score for ""The Hours"" - an existential masterpiece of piano & string! https://www.youtube.com/watch?v=yYuTEcArOr8&list=PLGtp__SJsu_sxTQd1U0fhg6KktKJ0fr6p",https://facebook.com/story.php?story_fbid=528037974526966&id=127573997906701,"YOUTUBE.COM
The Hours",0.0,"Today's Song of the Day isn't just *a* song; it's an entire score - and it's MAGICAL on a rainy day like today! Check out Philip Glass' score for ""The Hours"" - an existential masterpiece of piano & string! https://www.youtube.com/watch?v=yYuTEcArOr8&list=PLGtp__SJsu_sxTQd1U0fhg6KktKJ0fr6p

YOUTUBE.COM
The Hours",2020-04-13 11:28:30,,
117,1.0,,3.0,,526518591345571,"Missing baseball?
Volume up for this one...sit back and listen to the smooth souds of Steve Jendrysik call this game...
2002 Chicopee Comprehensive v Chicopee High baseball",,,0.0,"Missing baseball?
Volume up for this one...sit back and listen to the smooth souds of Steve Jendrysik call this game...
2002 Chicopee Comprehensive v Chicopee High baseball",2020-04-13 09:06:00,https://video-atl3-1.xx.fbcdn.net/v/t42.9040-2/10000000_669955607102992_8376514042109362176_n.mp4?_nc_cat=103&_nc_sid=985c63&efg=eyJ2ZW5jb2RlX3RhZyI6ImxlZ2FjeV9zZCJ9&_nc_ohc=WGgNe1LER_gAX-aZ0Lz&_nc_ht=video-atl3-1.xx&oh=b6f59dba0486c16ecd47c5d632672de9&oe=5F5DC77D,
118,0.0,,18.0,,526515814679182,1992 Comp v High Softball,,,0.0,1992 Comp v High Softball,2020-04-12 14:54:00,https://video-atl3-1.xx.fbcdn.net/v/t42.9040-2/10000000_521162705458320_3040634123111628800_n.mp4?_nc_cat=105&_nc_sid=985c63&efg=eyJ2ZW5jb2RlX3RhZyI6ImxlZ2FjeV9zZCJ9&_nc_ohc=nb82IMp02KUAX-6gtWw&_nc_ht=video-atl3-1.xx&oh=03418b2743c64228e3ace8d97a9c6ded&oe=5F5DC217,
119,0.0,,3.0,https://www.youtube.com/watch?v=MRTggpaBR6o,526178024712961,"Happy Easter! For today's Song of the Day, we transport you to the depths of southern soul - to Mississippi! For a church choir that'll sing y'all's socks right off ya feet! https://www.youtube.com/watch?v=MRTggpaBR6o",https://facebook.com/story.php?story_fbid=526178024712961&id=127573997906701,"YOUTUBE.COM
The Mississippi Mass Choir - Old Time Church",0.0,"Happy Easter! For today's Song of the Day, we transport you to the depths of southern soul - to Mississippi! For a church choir that'll sing y'all's socks right off ya feet! https://www.youtube.com/watch?v=MRTggpaBR6o

YOUTUBE.COM
The Mississippi Mass Choir - Old Time Church",2020-04-12 12:15:27,,
120,2.0,,16.0,,526507824679981,"1983 Comp v High Boys hockey.
Great goaltending!",,,0.0,"1983 Comp v High Boys hockey.
Great goaltending!",2020-04-12 07:31:00,https://video-atl3-1.xx.fbcdn.net/v/t42.9040-2/10000000_247230893078229_5604234487878647808_n.mp4?_nc_cat=110&_nc_sid=985c63&efg=eyJ2ZW5jb2RlX3RhZyI6ImxlZ2FjeV9zZCJ9&_nc_ohc=91tmD_oxpEAAX8Oe-Ea&_nc_ht=video-atl3-1.xx&oh=3b264317088570d7c16f19005bb868e3&oe=5F5DBD33,
121,0.0,,0.0,https://www.youtube.com/watch?v=zZI0zO2TS1Y,525683541429076,"In honor of Easter and the Passover holiday, today's Song of the Day comes from Lyle Lovett...a great narrative song full of soul and a great sense of humor! https://www.youtube.com/watch?v=zZI0zO2TS1Y",https://facebook.com/story.php?story_fbid=525683541429076&id=127573997906701,,0.0,"In honor of Easter and the Passover holiday, today's Song of the Day comes from Lyle Lovett...a great narrative song full of soul and a great sense of humor! https://www.youtube.com/watch?v=zZI0zO2TS1Y",2020-04-11 15:49:16,,
122,0.0,,16.0,,526506491346781,"1981 Holyoke v Chicopee High Football...Thanksgiving day game.
LOVE the analog clock on the scoreboard!",,,0.0,"1981 Holyoke v Chicopee High Football...Thanksgiving day game.
LOVE the analog clock on the scoreboard!",2020-04-11 08:21:00,https://video-atl3-1.xx.fbcdn.net/v/t42.9040-2/10000000_892326744546784_145711129203572736_n.mp4?_nc_cat=107&_nc_sid=985c63&efg=eyJ2ZW5jb2RlX3RhZyI6ImxlZ2FjeV9zZCJ9&_nc_ohc=eBfngdrWQO4AX_yG6UQ&_nc_ht=video-atl3-1.xx&oh=8263076a0adb6eeb52d2690075cd4988&oe=5F5DC513,
123,1.0,,5.0,https://www.youtube.com/watch?v=kVdnqEyToqg,526352734695490,"Today's Song of the Day! 70s music made great by a 90s film (can you name it?). Change out ""sharona"" with ""corona"" and it's relevant all over again! https://www.youtube.com/watch?v=kVdnqEyToqg",https://facebook.com/story.php?story_fbid=526352734695490&id=127573997906701,"YOUTUBE.COM
My Sharona - The Knack Official Video",0.0,"Today's Song of the Day! 70s music made great by a 90s film (can you name it?). Change out ""sharona"" with ""corona"" and it's relevant all over again! https://www.youtube.com/watch?v=kVdnqEyToqg

YOUTUBE.COM
My Sharona - The Knack Official Video",2020-04-10 19:00:18,,
124,0.0,,7.0,,525918838072213,"A nailbiter from 1982.
Bedlam in the Chicopee High gym!!",,,0.0,"A nailbiter from 1982.
Bedlam in the Chicopee High gym!!",2020-04-10 09:27:00,https://video-atl3-1.xx.fbcdn.net/v/t42.9040-2/10000000_563253237629449_5662156382472765440_n.mp4?_nc_cat=111&_nc_sid=985c63&efg=eyJ2ZW5jb2RlX3RhZyI6ImxlZ2FjeV9zZCJ9&_nc_ohc=4TphzOiZ52YAX8NUHH5&_nc_ht=video-atl3-1.xx&oh=5751a9ba93f7433ce9a7a976260f6b3c&oe=5F5DBFC6,
125,10.0,,15.0,,525912778072819,1983 Chicopee High Graduation. Great energy in the room!,,,0.0,1983 Chicopee High Graduation. Great energy in the room!,2020-04-10 06:08:00,https://video-atl3-1.xx.fbcdn.net/v/t42.9040-2/10000000_1073893092967284_2385651747910582272_n.mp4?_nc_cat=102&_nc_sid=985c63&efg=eyJ2ZW5jb2RlX3RhZyI6ImxlZ2FjeV9zZCJ9&_nc_ohc=mzD1-WbsPrsAX8cNUxA&_nc_ht=video-atl3-1.xx&oh=1ed8d0ab810c733dceda9b73e3df2ea1&oe=5F5DC5B7,
126,1.0,,36.0,,525783838085713,Your support has been amazing! We were below 1000 last week. Do I hear 1200 likes and 1400 follows? Almost there! Thank you Chicopee!! (And friends) 😄,https://facebook.com/story.php?story_fbid=525783838085713&id=127573997906701,,0.0,Your support has been amazing! We were below 1000 last week. Do I hear 1200 likes and 1400 follows? Almost there! Thank you Chicopee!! (And friends) 😄,2020-04-09 19:34:55,,
127,0.0,,2.0,https://www.youtube.com/watch?v=Z2VXYxVBsjE,525628508101246,"Today's Song of the Day comes to us from beyond Chicopee - from Brooklyn! God knows NYC needs our love & good vibes right now. Check out Turkuaz...an amazing funk band with an Aretha-meets-James Brown style! Post a video of you dancing to it if it moves you to shake your butt! https://www.youtube.com/watch?v=Z2VXYxVBsjE (step up, local musicians...send your self-taped songs to chicopeetv@cpsge.org)",https://facebook.com/story.php?story_fbid=525628508101246&id=127573997906701,"YOUTUBE.COM
Turkuaz: Bubba Slide [4K] 2015-08-01 - Gathering of the Vibes",0.0,"Today's Song of the Day comes to us from beyond Chicopee - from Brooklyn! God knows NYC needs our love & good vibes right now. Check out Turkuaz...an amazing funk band with an Aretha-meets-James Brown style! Post a video of you dancing to it if it moves you to shake your butt! https://www.youtube.com/watch?v=Z2VXYxVBsjE (step up, local musicians...send your self-taped songs to chicopeetv@cpsge.org)

YOUTUBE.COM
Turkuaz: Bubba Slide [4K] 2015-08-01 - Gathering of the Vibes",2020-04-09 13:40:57,,
128,14.0,,23.0,,525311014799662,1991 Chicopee Comp Graduation,,,0.0,1991 Chicopee Comp Graduation,2020-04-09 08:42:00,https://video-atl3-1.xx.fbcdn.net/v/t42.9040-2/10000000_163161671567654_2326476186722500608_n.mp4?_nc_cat=107&_nc_sid=985c63&efg=eyJ2ZW5jb2RlX3RhZyI6ImxlZ2FjeV9zZCJ9&_nc_ohc=bozO4dCrESAAX-pYDwp&_nc_ht=video-atl3-1.xx&oh=d370439bfa1db9904782e29fbc3566bb&oe=5F5DBDD8,
129,10.0,,12.0,,525309804799783,Chcek out the 2004 Chicopee Comp Graduation,,,0.0,Chcek out the 2004 Chicopee Comp Graduation,2020-04-09 07:39:00,https://video-atl3-1.xx.fbcdn.net/v/t42.9040-2/10000000_219898129102162_4570944061736747008_n.mp4?_nc_cat=110&_nc_sid=985c63&efg=eyJ2ZW5jb2RlX3RhZyI6ImxlZ2FjeV9zZCJ9&_nc_ohc=Iz73--Lx_MEAX_JcBiO&_nc_ht=video-atl3-1.xx&oh=3fd688e33881e936fdf0f29bd0713d31&oe=5F5DC906,
130,3.0,,20.0,,525305064800257,1987 Comp v High Girls Basketball. A close game!,,,0.0,1987 Comp v High Girls Basketball. A close game!,2020-04-09 06:34:00,https://video-atl3-1.xx.fbcdn.net/v/t42.9040-2/10000000_2812616212299779_141986443370168320_n.mp4?_nc_cat=111&_nc_sid=985c63&efg=eyJ2ZW5jb2RlX3RhZyI6ImxlZ2FjeV9zZCJ9&_nc_ohc=PBwJDCgYZz8AX8JqUN2&_nc_ht=video-atl3-1.xx&oh=d781b162283a308292af3c39c1f4bca0&oe=5F5DBE3D,
131,4.0,,4.0,,2776850132542940,04/07/20 City Council,,,0.0,04/07/20 City Council,2020-04-07 19:14:47,https://video-atl3-1.xx.fbcdn.net/v/t42.26565-2/10000000_104803294602463_5331017582193231903_n.mp4?_nc_cat=111&_nc_sid=985c63&efg=eyJ2ZW5jb2RlX3RhZyI6Im9lcF9zZCJ9&_nc_ohc=4UU_Qj0qleoAX_uRIpQ&_nc_ht=video-atl3-1.xx&oh=a051f835e680f22817eb0dd5155d30e7&oe=5F5DC827,
132,2.0,,7.0,,2824135677668040,04/07/20 Mayor's Briefing,,,2.0,04/07/20 Mayor's Briefing,2020-04-07 18:33:20,https://video-atl3-1.xx.fbcdn.net/v/t42.26565-2/10000000_1691769180988884_8213314918727674934_n.mp4?_nc_cat=104&_nc_sid=985c63&efg=eyJ2ZW5jb2RlX3RhZyI6Im9lcF9zZCJ9&_nc_ohc=y1KlNuaaOOAAX-TE9CT&_nc_ht=video-atl3-1.xx&oh=bc3edca254435e775f53de35283264d4&oe=5F5DC64D,
133,0.0,,13.0,,524362521561178,"Chicopee natives Jesse Ball and Sarah-Hadley Yakir are actually the musicians who *inspired* the idea of ""Covid Song of the Day"" series. Check them out! City of Chicopee - Mayor's Office",,,0.0,"Chicopee natives Jesse Ball and Sarah-Hadley Yakir are actually the musicians who *inspired* the idea of ""Covid Song of the Day"" series. Check them out! City of Chicopee - Mayor's Office",2020-04-07 11:51:21,https://video-atl3-1.xx.fbcdn.net/v/t42.9040-2/91869582_823090594865920_2072316785402576896_n.mp4?_nc_cat=100&_nc_sid=985c63&efg=eyJ2ZW5jb2RlX3RhZyI6ImxlZ2FjeV9zZCJ9&_nc_ohc=FnQV2kzjb20AX9OuFL2&_nc_ht=video-atl3-1.xx&oh=4bf7b751c19f82e485fe9b19679a6604&oe=5F5DC2FF,
134,1.0,,12.0,,524359521561478,"We're finding, from our respective home offices, that MUSIC is a great way to cope. Listening to it, making it, dancing to it... So...starting today, ChicopeeTV is launching a ""Covid Song of the Day"" series. If you're a local musician who has something we could share, write to chicopeetv@cpsge.org",https://facebook.com/story.php?story_fbid=524359521561478&id=127573997906701,,0.0,"We're finding, from our respective home offices, that MUSIC is a great way to cope. Listening to it, making it, dancing to it... So...starting today, ChicopeeTV is launching a ""Covid Song of the Day"" series. If you're a local musician who has something we could share, write to chicopeetv@cpsge.org",2020-04-07 11:44:10,,
135,7.0,,22.0,,524123151585115,Check out the 1989 Comp graduation!,,,0.0,Check out the 1989 Comp graduation!,2020-04-07 06:10:00,https://video-atl3-1.xx.fbcdn.net/v/t42.9040-2/10000000_4011573902201278_3718024034185641984_n.mp4?_nc_cat=108&_nc_sid=985c63&efg=eyJ2ZW5jb2RlX3RhZyI6ImxlZ2FjeV9zZCJ9&_nc_ohc=_LAduV0_1FcAX9FW3Pg&_nc_ht=video-atl3-1.xx&oh=5b0d5f6d356ea9339c04ba96da3fb64e&oe=5F5DC83A,
136,12.0,,24.0,,523522784978485,1993 Chicopee Comp Graduation,,,0.0,1993 Chicopee Comp Graduation,2020-04-06 09:18:00,https://video-atl3-1.xx.fbcdn.net/v/t42.9040-2/10000000_803667033462512_8806107550207442944_n.mp4?_nc_cat=100&_nc_sid=985c63&efg=eyJ2ZW5jb2RlX3RhZyI6ImxlZ2FjeV9zZCJ9&_nc_ohc=CcMlVMKMgbgAX8WKJdz&_nc_ht=video-atl3-1.xx&oh=ae80b191a76e473a9c6786115dc5206c&oe=5F5DC0EC,
137,0.0,,12.0,,523504021647028,1996 Chicopee High Graduation,,,0.0,1996 Chicopee High Graduation,2020-04-06 07:02:00,https://video-atl3-1.xx.fbcdn.net/v/t42.9040-2/10000000_517295375828412_3459129414242009088_n.mp4?_nc_cat=104&_nc_sid=985c63&efg=eyJ2ZW5jb2RlX3RhZyI6ImxlZ2FjeV9zZCJ9&_nc_ohc=_O-uPbM4OZQAX_ZDrnz&_nc_ht=video-atl3-1.xx&oh=a8479ea08384795ff2a1f8291555ed96&oe=5F5DC475,
138,3.0,,66.0,,523105145020249,,https://facebook.com/story.php?story_fbid=523105145020249&id=127573997906701,,0.0,,2020-04-05 09:15:19,,
139,1.0,,6.0,,522383355092428,Here is the 1993 Chicopee High Graduation,,,0.0,Here is the 1993 Chicopee High Graduation,2020-04-04 10:42:00,https://video-atl3-1.xx.fbcdn.net/v/t42.9040-2/10000000_514927029382757_5059644042178985984_n.mp4?_nc_cat=111&_nc_sid=985c63&efg=eyJ2ZW5jb2RlX3RhZyI6ImxlZ2FjeV9zZCJ9&_nc_ohc=VxJJe951WLsAX-1FOCZ&_nc_ht=video-atl3-1.xx&oh=9984765b2ad5bb86f214a3996b614585&oe=5F5DC722,
140,3.0,,6.0,,522382615092502,Chcek out the 1993 Chicopee High Graduation!,,,0.0,Chcek out the 1993 Chicopee High Graduation!,2020-04-04 09:22:00,https://video-atl3-1.xx.fbcdn.net/v/t42.9040-2/10000000_266125714387548_1393083435710414848_n.mp4?_nc_cat=105&_nc_sid=985c63&efg=eyJ2ZW5jb2RlX3RhZyI6ImxlZ2FjeV9zZCJ9&_nc_ohc=saBbHOll77UAX8QXZrR&_nc_ht=video-atl3-1.xx&oh=aa82cb18b48bcf80d197d67c99c1557c&oe=5F5DBE38,
141,16.0,,85.0,,522365778427519,"Check out the amazing team at Chicopee Food Services working hard to make things easier for Chicopee parents by providing daily to-go meals.
Thank you for all of your hard work! Chicopee FRESH",,,0.0,"Check out the amazing team at Chicopee Food Services working hard to make things easier for Chicopee parents by providing daily to-go meals.
Thank you for all of your hard work! Chicopee FRESH",2020-04-04 07:39:00,https://video-atl3-1.xx.fbcdn.net/v/t42.9040-2/10000000_649958539179084_9122036853350858752_n.mp4?_nc_cat=102&_nc_sid=985c63&efg=eyJ2ZW5jb2RlX3RhZyI6ImxlZ2FjeV9zZCJ9&_nc_ohc=T2eCZxq7FVUAX-p_RCK&_nc_ht=video-atl3-1.xx&oh=6034a32244af88cef3ecf1170ef0a392&oe=5F5DC46C,
142,2.0,,17.0,,521975055133258,https://www.facebook.com/1944686818974639/posts/2601408089969172/,https://facebook.com/story.php?story_fbid=521975055133258&id=127573997906701,,0.0,https://www.facebook.com/1944686818974639/posts/2601408089969172/,2020-04-03 09:46:09,,
143,0.0,,4.0,https://vimeo.com/403399854,521549055175858,Check out our newest show - MassEarth - and find some great new outdoor places to hike and explore western Massachusetts! https://vimeo.com/403399854,https://facebook.com/story.php?story_fbid=521549055175858&id=127573997906701,"VIMEO.COM
MassEarth - Packing & Shatterack Mountain",0.0,"Check out our newest show - MassEarth - and find some great new outdoor places to hike and explore western Massachusetts! https://vimeo.com/403399854

VIMEO.COM
MassEarth - Packing & Shatterack Mountain",2020-04-02 17:39:07,,
144,1.0,,13.0,,521400361857394,"TONIGHT - ChicopeeTV premieres its brand new show, MassEarth - which explores little-known outdoor spots in western Massachusetts where you can take in our region's natural beauty.",https://facebook.com/story.php?story_fbid=521400361857394&id=127573997906701,,0.0,"TONIGHT - ChicopeeTV premieres its brand new show, MassEarth - which explores little-known outdoor spots in western Massachusetts where you can take in our region's natural beauty.",2020-04-02 09:36:38,,
145,5.0,,16.0,,521070811890349,"Hop into the ChicopeeTV Delorean and set your time circuts for the year 2000!
...Wait i thought the year 2000 was supposed to be the future...
...not 20 years in the past; how did that happen?
Time flies for sure!",,,0.0,"Hop into the ChicopeeTV Delorean and set your time circuts for the year 2000!
...Wait i thought the year 2000 was supposed to be the future...
...not 20 years in the past; how did that happen?
Time flies for sure!",2020-04-01 19:18:00,https://video-atl3-1.xx.fbcdn.net/v/t42.9040-2/10000000_523144645051444_1040206749417603072_n.mp4?_nc_cat=105&_nc_sid=985c63&efg=eyJ2ZW5jb2RlX3RhZyI6ImxlZ2FjeV9zZCJ9&_nc_ohc=iNMu05gfepQAX-NFPuL&_nc_ht=video-atl3-1.xx&oh=e6ea4457371e88c495389a8571833d79&oe=5F5DC707,
146,0.0,,1.0,https://2020census.gov/en/partners/psa-toolkit/made-simple.html,521044765226287,"Hey folks...Check out this info about the upcoming 2020 Census. It is important that YOU respond! Every person matters. The Census helps determine how much funding WE receive as a City. That means funding for schools and after school programs, public safety, seniors, roads, medical facilities, and more. Please click and share!
City of Chicopee - Mayor's Office Chicopee Public Schools Chicopee Fire Department Chicopee Police Department Chicopee Area Community Forum
U.S. Census Bureau
https://2020census.gov/en/partners/psa-toolkit/made-simple.html",https://facebook.com/story.php?story_fbid=521044765226287&id=127573997906701,"2020CENSUS.GOV
2020 Census Made Simple",0.0,"Hey folks...Check out this info about the upcoming 2020 Census. It is important that YOU respond! Every person matters. The Census helps determine how much funding WE receive as a City. That means funding for schools and after school programs, public safety, seniors, roads, medical facilities, and more. Please click and share!
City of Chicopee - Mayor's Office Chicopee Public Schools Chicopee Fire Department Chicopee Police Department Chicopee Area Community Forum
U.S. Census Bureau
https://2020census.gov/en/partners/psa-toolkit/made-simple.html

2020CENSUS.GOV
2020 Census Made Simple",2020-04-01 17:31:22,,
147,1.0,https://scontent-atl3-1.xx.fbcdn.net/v/t1.0-9/fr/cp0/e15/q65/91889162_520949535235810_4240359531315462144_n.jpg?_nc_cat=110&_nc_sid=110474&_nc_ohc=lkTuBXjO9ZIAX-KLFL7&_nc_oc=AQlIrGuoN6swqOyS-q5-nNy9NEIXKr_nEo1x1fmyEyp3-ImoUkg3Mfdq8Cca5LDS7C4&_nc_ht=scontent-atl3-1.xx&tp=14&oh=33e2664fd87c647ccfd9829508d4a5a6&oe=5F83078C,4.0,,520949558569141,,https://facebook.com/story.php?story_fbid=520949558569141&id=127573997906701,,0.0,,2020-04-01 14:20:34,,
148,11.0,,17.0,,520925618571535,2000 Chicopee Comprehensive Graduation,,,0.0,2000 Chicopee Comprehensive Graduation,2020-04-01 13:57:26,https://video-atl3-1.xx.fbcdn.net/v/t42.9040-2/10000000_2093648164114967_1157954059521490944_n.mp4?_nc_cat=101&_nc_sid=985c63&efg=eyJ2ZW5jb2RlX3RhZyI6ImxlZ2FjeV9zZCJ9&_nc_ohc=RwvQPEGa4Z4AX-ss-Ky&_nc_ht=video-atl3-1.xx&oh=11cb100931f33429e519cd3707353e85&oe=5F5DC2A5,
149,0.0,,8.0,,547058349266850,03/31/20 Special City Council Meeting,,,0.0,03/31/20 Special City Council Meeting,2020-03-31 18:59:50,https://video-atl3-1.xx.fbcdn.net/v/t42.26565-2/10000000_291315558727596_3977269705844413930_n.mp4?_nc_cat=104&_nc_sid=985c63&efg=eyJ2ZW5jb2RlX3RhZyI6Im9lcF9zZCJ9&_nc_ohc=Uq-uEduv5CwAX9E9CGM&_nc_oc=AQklHAwUDdx0DsSoR5tl6ZeEsZaDre1R7HDMUS8ujKMqqC0FKP1eQ-rK31q_yAocMEs&_nc_ht=video-atl3-1.xx&oh=da1be394c454c7f0f643bf957e34c105&oe=5F5DC775,
150,12.0,,26.0,,520478761949554,"We are happy that we have been able to provide some entertainment and escape through nostalgia during all of this uncertainty. Thank you for all of your shares, likes, requests and feedback. We will continue to post our archive material. Not all of the tapes survived the digitization process; some we just can’t find. But if we can find it we will post it.",https://facebook.com/story.php?story_fbid=520478761949554&id=127573997906701,,0.0,"We are happy that we have been able to provide some entertainment and escape through nostalgia during all of this uncertainty. Thank you for all of your shares, likes, requests and feedback. We will continue to post our archive material. Not all of the tapes survived the digitization process; some we just can’t find. But if we can find it we will post it.",2020-03-31 18:40:32,,
151,18.0,,17.0,,520230475307716,1990 Chicopee High Graduation. Enjoy!,,,0.0,1990 Chicopee High Graduation. Enjoy!,2020-03-31 10:02:00,https://video-atl3-1.xx.fbcdn.net/v/t42.9040-2/10000000_1111952442490343_5330327840543997952_n.mp4?_nc_cat=106&_nc_sid=985c63&efg=eyJ2ZW5jb2RlX3RhZyI6ImxlZ2FjeV9zZCJ9&_nc_ohc=39mRqASxNpIAX_yUin8&_nc_ht=video-atl3-1.xx&oh=70b95c5bf5a628003a7f73b6fb2dced6&oe=5F5DC28B,
152,9.0,,18.0,,519252315405532,1988 Comp Graduation. Can you find a friend? Share and tag!,,,0.0,1988 Comp Graduation. Can you find a friend? Share and tag!,2020-03-29 19:02:00,https://video-atl3-1.xx.fbcdn.net/v/t42.9040-2/10000000_221115769140178_7056439290879803392_n.mp4?_nc_cat=101&_nc_sid=985c63&efg=eyJ2ZW5jb2RlX3RhZyI6ImxlZ2FjeV9zZCJ9&_nc_ohc=xVeA7IA-lD4AX9B1kWS&_nc_ht=video-atl3-1.xx&oh=24738d172280ef5dd90d353f0f8396fc&oe=5F5DBD0B,
153,6.0,,9.0,,519248328739264,1988 Chicopee High Graduation. Find a lost friend and tag!,,,0.0,1988 Chicopee High Graduation. Find a lost friend and tag!,2020-03-29 17:37:00,https://video-atl3-1.xx.fbcdn.net/v/t42.9040-2/10000000_2809636325821940_2716468876580749312_n.mp4?_nc_cat=107&_nc_sid=985c63&efg=eyJ2ZW5jb2RlX3RhZyI6ImxlZ2FjeV9zZCJ9&_nc_ohc=VIzPbXzXWYYAX-3uYjF&_nc_ht=video-atl3-1.xx&oh=641568174bd548fb08bf4beae6f6fa86&oe=5F5DC5CC,
154,2.0,,6.0,,519205738743523,Comp v. High Football. 1997 edition of the cross town rivalry.,,,0.0,Comp v. High Football. 1997 edition of the cross town rivalry.,2020-03-29 16:02:00,https://video-atl3-1.xx.fbcdn.net/v/t42.9040-2/10000000_906141496494258_3031845872699703296_n.mp4?_nc_cat=102&_nc_sid=985c63&efg=eyJ2ZW5jb2RlX3RhZyI6ImxlZ2FjeV9zZCJ9&_nc_ohc=XY8G0zI7KpUAX8WWOs2&_nc_ht=video-atl3-1.xx&oh=6b0880cd29a93bd3495942e967193af3&oe=5F5DC566,
155,1.0,,2.0,,518782008785896,Digging through the digital archives....1998 Comp v High Girls Soccer. Enjoy and tag a friend!,,,0.0,Digging through the digital archives....1998 Comp v High Girls Soccer. Enjoy and tag a friend!,2020-03-29 07:07:00,https://video-atl3-1.xx.fbcdn.net/v/t42.9040-2/10000000_1223708744686980_9131771714554822656_n.mp4?_nc_cat=104&_nc_sid=985c63&efg=eyJ2ZW5jb2RlX3RhZyI6ImxlZ2FjeV9zZCJ9&_nc_ohc=9yHz5SO02bIAX9UpkO7&_nc_ht=video-atl3-1.xx&oh=94b779721a73f20c698748cd8e001f11&oe=5F5DC08A,
156,2.0,,3.0,,518188778845219,Check out this rare find. Comp boys track in a close meet from '91. Track is not easy to televise. Lots of respect for our predecessors who produced this program! Check out the credits.,,,0.0,Check out this rare find. Comp boys track in a close meet from '91. Track is not easy to televise. Lots of respect for our predecessors who produced this program! Check out the credits.,2020-03-28 07:58:00,https://video-atl3-1.xx.fbcdn.net/v/t42.9040-2/10000000_3105338222831915_1649355063291805696_n.mp4?_nc_cat=101&_nc_sid=985c63&efg=eyJ2ZW5jb2RlX3RhZyI6ImxlZ2FjeV9zZCJ9&_nc_ohc=SiTK7qW5meQAX-9i_W2&_nc_ht=video-atl3-1.xx&oh=af2fdb3e420a82b22a1b2e74d63f27f7&oe=5F5DC77B,
157,7.0,,19.0,,517558758908221,"Take a moment to enjoy the 1982 Chicopee High Graduation exercises!
City of Chicopee - Mayor's Office
Chicopee High School - Pacers",,,0.0,"Take a moment to enjoy the 1982 Chicopee High Graduation exercises!
City of Chicopee - Mayor's Office
Chicopee High School - Pacers",2020-03-27 15:58:00,https://video-atl3-1.xx.fbcdn.net/v/t42.9040-2/10000000_209662466763487_8701680643085434880_n.mp4?_nc_cat=109&_nc_sid=985c63&efg=eyJ2ZW5jb2RlX3RhZyI6ImxlZ2FjeV9zZCJ9&_nc_ohc=mq2WQCfyaC0AX-zuqdW&_nc_ht=video-atl3-1.xx&oh=0399c15af6cf7577b8b36c9e602c079f&oe=5F5DBCC3,
158,0.0,,2.0,,517552712242159,"Take a look at the 1982 Chicopee Comprehensive Graduation exercises. Share and tag a friend!
Chicopee Comprehensive High School",,,0.0,"Take a look at the 1982 Chicopee Comprehensive Graduation exercises. Share and tag a friend!
Chicopee Comprehensive High School",2020-03-27 08:43:00,https://video-atl3-1.xx.fbcdn.net/v/t42.9040-2/10000000_218866479318252_1812394684727689216_n.mp4?_nc_cat=111&_nc_sid=985c63&efg=eyJ2ZW5jb2RlX3RhZyI6ImxlZ2FjeV9zZCJ9&_nc_ohc=bxKnzrQZll4AX9xXTUs&_nc_ht=video-atl3-1.xx&oh=ae88d4d34a0cf17458d4f3c29037142f&oe=5F5DC033,
159,0.0,,5.0,https://vimeo.com/401018010,517492362248194,"Check out this years Battle of the Badges! Police and Fire continue their community based efforts with a charity hockey game.
https://vimeo.com/401018010",https://facebook.com/story.php?story_fbid=517492362248194&id=127573997906701,"VIMEO.COM
2020 Battle of the Badges",7.0,"Check out this years Battle of the Badges! Police and Fire continue their community based efforts with a charity hockey game.
https://vimeo.com/401018010

VIMEO.COM
2020 Battle of the Badges",2020-03-27 06:18:33,,
160,2.0,,8.0,,516913572306073,Chicopee legend Dan Dulchinos honored with field dedication in 1994. We've included the game which followed.,,,0.0,Chicopee legend Dan Dulchinos honored with field dedication in 1994. We've included the game which followed.,2020-03-26 08:19:00,https://video-atl3-1.xx.fbcdn.net/v/t42.9040-2/10000000_2619939991580700_5198678417087660032_n.mp4?_nc_cat=109&_nc_sid=985c63&efg=eyJ2ZW5jb2RlX3RhZyI6ImxlZ2FjeV9zZCJ9&_nc_ohc=NchJpabeFH0AX9WPKhq&_nc_oc=AQnGiq6AoylFS18aSUlK6XUP2T1kHY86arn_cTIWDgTpulGdgzX_SCo_k1K0rF96uGE&_nc_ht=video-atl3-1.xx&oh=30d4f9d775de76b7bfd2e1c1a274a246&oe=5F5DBCCC,
161,0.0,,15.0,,516866155644148,An interesting look at Chicopee's history and it's architecture,,,0.0,An interesting look at Chicopee's history and it's architecture,2020-03-25 22:50:18,https://video-atl3-1.xx.fbcdn.net/v/t42.9040-2/10000000_666435100582363_4253272745627877376_n.mp4?_nc_cat=106&_nc_sid=985c63&efg=eyJ2ZW5jb2RlX3RhZyI6ImxlZ2FjeV9zZCJ9&_nc_ohc=25Hbt_-MlYUAX8Cq-t7&_nc_ht=video-atl3-1.xx&oh=b4654da92d503140836f259b5880a32a&oe=5F5DC721,
162,5.0,,16.0,,512865199377577,"A throwback to a different era!
Click on the link to see the hairstyles and clothes....
Stay until the 12:25 mark to see a GIGANTIC star of the 80's make an appearance right here in Chicopee.
Worth a watch!
City of Chicopee - Mayor's Office",,,0.0,"A throwback to a different era!
Click on the link to see the hairstyles and clothes....
Stay until the 12:25 mark to see a GIGANTIC star of the 80's make an appearance right here in Chicopee.
Worth a watch!
City of Chicopee - Mayor's Office",2020-03-19 11:29:31,https://video-atl3-1.xx.fbcdn.net/v/t42.9040-2/10000000_873593633126707_8613122072459083776_n.mp4?_nc_cat=106&_nc_sid=985c63&efg=eyJ2ZW5jb2RlX3RhZyI6ImxlZ2FjeV9zZCJ9&_nc_ohc=MaBq1FCanZwAX8AUpYp&_nc_ht=video-atl3-1.xx&oh=f7e0cac2dabab9aa4052ff2dc674895d&oe=5F5DC7F6,
163,0.0,,5.0,,525771848318034,3-18-20 Chicopee School Comm Mtg.,,,2.0,3-18-20 Chicopee School Comm Mtg.,2020-03-18 18:57:24,https://video-atl3-1.xx.fbcdn.net/v/t42.1790-2/10000000_483262312559391_2219277441007316490_n.mp4?_nc_cat=102&vs=7f271ae3574578aa&_nc_vs=HBksFQAYJEdJQ1dtQUFmTTNsR2hyY0JBQXB1UndrVGRjd2VidjRHQUFBRhUAAsgBABUAGCRHSUNXbUFDTE9YQ0E5R2dDQUNhQTluamhDbUJSYnY0R0FBQUYVAgLIAQAoRC1pICclcycgLWZiX3VzZV90ZmR0X3N0YXJ0dGltZSAxIC1pICclcycgLWMgY29weSAtbW92ZmxhZ3MgZmFzdHN0YXJ0KwGIEnByb2dyZXNzaXZlX3JlY2lwZQExFQAlABwAABgBMBaml7%2B6%2BYvvARUCKAJDMxgDYXYxHBdAq6swo9cKPRgZZGFzaF9saXZlX21kX2ZyYWdfMl92aWRlbxIAGBh2aWRlb3MudnRzLmNhbGxiYWNrLnByb2QZHBUAFfK2BAAoElZJREVPX1ZJRVdfUkVRVUVTVBsHiBVvZW1fdGFyZ2V0X2VuY29kZV90YWcGb2VwX3NkE29lbV9yZXF1ZXN0X3RpbWVfbXMNMTU5OTk3MTMzNzA2MAxvZW1fY2ZnX3J1bGUKd2FzbGl2ZV9zZBNvZW1fcm9pX3JlYWNoX2NvdW50BTIsOTMzDG9lbV92aWRlb19pZA81MjU3NzE4NDgzMTgwMzQSb2VtX3ZpZGVvX2Fzc2V0X2lkDzUyNTc3MTg0MTY1MTM2OBVvZW1fdmlkZW9fcmVzb3VyY2VfaWQPNTI1NzcxODM4MzE4MDM1JQQcAAA%3D&_nc_sid=a6057a&efg=eyJ2ZW5jb2RlX3RhZyI6Im9lcF9zZCJ9&_nc_ohc=MqV4T-VnxHoAX-zCzT2&_nc_oc=AQm1OZH1mqqDBaxBeGye94yjOotn6eE4QfP52vdQ8edtS0aYAFtYKsZtaFC2GT28xMs&_nc_ht=video-atl3-1.xx&oh=2e7d5a9741b14bfadb0374566704ed03&oe=5F5DC179&_nc_rid=e749bddeba1f4f2,
164,1.0,https://scontent-atl3-1.xx.fbcdn.net/v/t1.0-9/90161641_512356829428414_1255759995383840768_n.png?_nc_cat=109&_nc_sid=8024bb&_nc_ohc=U6ZWoBmhYzwAX9PVhOH&_nc_ht=scontent-atl3-1.xx&oh=6b5e2f40abdcbf005c3f25dd2017f93b&oe=5F81FBA0,1.0,,512356999428397,"Cooped up indoors? Send us a funny video of how you're filling your time! We'll compile of a compilation and put it on air: ""How Chicopee's Coping With Corona""! Would love to glimpse into your homes, and share that with your neighbors!",https://facebook.com/story.php?story_fbid=512356999428397&id=127573997906701,,0.0,"Cooped up indoors? Send us a funny video of how you're filling your time! We'll compile of a compilation and put it on air: ""How Chicopee's Coping With Corona""! Would love to glimpse into your homes, and share that with your neighbors!",2020-03-18 18:33:59,,
165,0.0,,0.0,,3262410153781463,Later Tonight Committee Meeting,,,0.0,Later Tonight Committee Meeting,2020-03-18 17:33:11,https://video-atl3-1.xx.fbcdn.net/v/t42.26565-2/105954741_967917803652682_5150007047898940025_n.mp4?_nc_cat=107&_nc_sid=985c63&efg=eyJ2ZW5jb2RlX3RhZyI6Im9lcF9zZCJ9&_nc_ohc=QQIklTIcJTwAX9aDiqh&_nc_ht=video-atl3-1.xx&oh=2d64b1604c1c61a58012e1ebf969862d&oe=5F5DBC48,
166,0.0,,1.0,,1083698645319400,03/17/20 City Council,,,2.0,03/17/20 City Council,2020-03-17 19:14:32,https://video-atl3-1.xx.fbcdn.net/v/t42.26565-2/10000000_1220969104916595_3554841823271950819_n.mp4?_nc_cat=100&_nc_sid=985c63&efg=eyJ2ZW5jb2RlX3RhZyI6Im9lcF9zZCJ9&_nc_ohc=CQDQhR1lJwwAX89gh9l&_nc_ht=video-atl3-1.xx&oh=2c8570d72eeefe2e9e26a1a83000f6d6&oe=5F5DBE36,
