,comments,image,likes,link,post_id,post_text,post_url,shared_text,shares,text,time,video,video_thumbnail
0,10.0,,131.0,,1805785759567904,People make the difference at Corunna Public Schools! See for yourself!,,,0.0,People make the difference at Corunna Public Schools! See for yourself!,2019-08-21 13:36:39,https://video.fbna1-2.fna.fbcdn.net/v/t42.9040-2/69633642_2360715964143834_3531160181914206208_n.mp4?_nc_cat=103&_nc_sid=985c63&efg=eyJ2ZW5jb2RlX3RhZyI6InN2ZV9zZCJ9&_nc_ohc=FXbMuCGB_s4AX8PzHa0&_nc_ht=video.fbna1-2.fna&oh=735474d6bb47487ab20e52f9033edf1c&oe=5F5D8981,
1,0.0,,1.0,https://www.corunna.k12.mi.us/article/302651?org=cps,2226868177459658,"Free Breakfast and Lunch Information

https://www.corunna.k12.mi.us/article/302651?org=cps",https://facebook.com/story.php?story_fbid=2226868177459658&id=504376869708806,,0.0,"Free Breakfast and Lunch Information

https://www.corunna.k12.mi.us/article/302651?org=cps",2020-09-12 14:13:10,,
2,0.0,,1.0,https://www.corunna.k12.mi.us/article/302651?org=cps,2225034600976349,"Free Breakfast and Lunch Information

https://www.corunna.k12.mi.us/article/302651?org=cps",https://facebook.com/story.php?story_fbid=2225034600976349&id=504376869708806,,0.0,"Free Breakfast and Lunch Information

https://www.corunna.k12.mi.us/article/302651?org=cps",2020-09-10 19:12:35,,
3,0.0,,0.0,https://www.corunna.k12.mi.us/article/302651?org=cps,2222453781234431,"Free Breakfast and Lunch Information

https://www.corunna.k12.mi.us/article/302651?org=cps",https://facebook.com/story.php?story_fbid=2222453781234431&id=504376869708806,,0.0,"Free Breakfast and Lunch Information

https://www.corunna.k12.mi.us/article/302651?org=cps",2020-09-08 07:06:39,,
4,0.0,,4.0,https://docs.google.com/document/d/1sPG6hdMoaVxvfJYMEJovaQvTPkqYz33ECizBceTIjnY/edit?usp=sharing,2221729271306882,"Message (9.7.2020) from Superintendent John Fattal

https://docs.google.com/document/d/1sPG6hdMoaVxvfJYMEJovaQvTPkqYz33ECizBceTIjnY/edit?usp=sharing",https://facebook.com/story.php?story_fbid=2221729271306882&id=504376869708806,,0.0,"Message (9.7.2020) from Superintendent John Fattal

https://docs.google.com/document/d/1sPG6hdMoaVxvfJYMEJovaQvTPkqYz33ECizBceTIjnY/edit?usp=sharing",2020-09-07 13:00:20,,
5,0.0,,4.0,https://drive.google.com/file/d/12MsboVBuosAf1q_2r1FMCfW1PERgKYZv/view,2214326098713866,"August 30, 2020 Golden Gazette

https://drive.google.com/file/d/12MsboVBuosAf1q_2r1FMCfW1PERgKYZv/view",https://facebook.com/story.php?story_fbid=2214326098713866&id=504376869708806,,0.0,"August 30, 2020 Golden Gazette

https://drive.google.com/file/d/12MsboVBuosAf1q_2r1FMCfW1PERgKYZv/view",2020-08-31 12:42:43,,
6,0.0,,6.0,https://drive.google.com/file/d/1J_cKieaza81pMPBeAeSy-1IP-ie_nW9e/view?usp=sharing,2210931495719993,"We will be part of the Independent this weekend. Check out the earlier publication in the Independent and The Argus Press.

The Communicator August 23, 2020
https://drive.google.com/file/d/1J_cKieaza81pMPBeAeSy-1IP-ie_nW9e/view?usp=sharing

Golden Gazette August 9, 2020 https://drive.google.com/file/d/1hY1Kku8o1u2w0XRB_3FtsiZLXlByqmJW/view?usp=sharing

Golden Gazette August 23, 2020
https://drive.google.com/file/d/1L6sV5V4MvTzsOXQrCVNj_6jU1lOM0ccm/view?usp=sharing",https://facebook.com/story.php?story_fbid=2210931495719993&id=504376869708806,,0.0,"We will be part of the Independent this weekend. Check out the earlier publication in the Independent and The Argus Press.

The Communicator August 23, 2020
https://drive.google.com/file/d/1J_cKieaza81pMPBeAeSy-1IP-ie_nW9e/view?usp=sharing

Golden Gazette August 9, 2020 https://drive.google.com/file/d/1hY1Kku8o1u2w0XRB_3FtsiZLXlByqmJW/view?usp=sharing

Golden Gazette August 23, 2020
https://drive.google.com/file/d/1L6sV5V4MvTzsOXQrCVNj_6jU1lOM0ccm/view?usp=sharing",2020-08-28 09:32:06,,
7,0.0,,1.0,https://www.corunna.k12.mi.us/article/295702?org=cps,2209959115817231,"Click on the link below to learn all about online student meals.

https://www.corunna.k12.mi.us/article/295702?org=cps",https://facebook.com/story.php?story_fbid=2209959115817231&id=504376869708806,,0.0,"Click on the link below to learn all about online student meals.

https://www.corunna.k12.mi.us/article/295702?org=cps",2020-08-27 12:18:09,,
8,0.0,https://scontent.fbna1-1.fna.fbcdn.net/v/t1.0-9/fr/cp0/e15/q65/118041562_2209114175901725_7554748472675130687_o.jpg?_nc_cat=108&_nc_sid=2d5d41&_nc_ohc=j19reo_BqJ4AX94hbcY&_nc_ht=scontent.fbna1-1.fna&tp=14&oh=d23c2a676eaaa84705d42c4382636ad6&oe=5F83AA51,8.0,https://docs.google.com/document/d/1VtE5_lcEvcAVlPjvBnFiaUiUsUn_fqZT7uQqtop7jtk/edit?usp=sharing,2209114169235059,"Parent update (8.26.2020) from Superintendent John Fattal.

https://docs.google.com/document/d/1VtE5_lcEvcAVlPjvBnFiaUiUsUn_fqZT7uQqtop7jtk/edit?usp=sharing",,,0.0,"Parent update (8.26.2020) from Superintendent John Fattal.

https://docs.google.com/document/d/1VtE5_lcEvcAVlPjvBnFiaUiUsUn_fqZT7uQqtop7jtk/edit?usp=sharing",2020-08-26 16:29:50,,
9,2.0,,1.0,https://docs.google.com/document/d/1YymOQ98SakbxszzVO_Eha6JlPWb3qwPQnkuGFca3AgA/edit?usp=sharing,2204792663000543,"Corunna Public Schools is looking for a Cook II and a Cook III. Please click on the link for more details.

https://docs.google.com/document/d/1YymOQ98SakbxszzVO_Eha6JlPWb3qwPQnkuGFca3AgA/edit?usp=sharing",https://facebook.com/story.php?story_fbid=2204792663000543&id=504376869708806,,0.0,"Corunna Public Schools is looking for a Cook II and a Cook III. Please click on the link for more details.

https://docs.google.com/document/d/1YymOQ98SakbxszzVO_Eha6JlPWb3qwPQnkuGFca3AgA/edit?usp=sharing",2020-08-22 14:41:12,,
10,0.0,,1.0,https://docs.google.com/document/d/1HUld7pdnhx15UWFTcYF6BcGFrORHU_tS5WLL9Oxg4w4/edit?usp=sharing,2202280896585053,"CPS is looking for paraprofessionals -Paraprofessionals with Braille experience, elementary classroom paraprofessionals, and one-to one paraprofessionals.

https://docs.google.com/document/d/1HUld7pdnhx15UWFTcYF6BcGFrORHU_tS5WLL9Oxg4w4/edit?usp=sharing",https://facebook.com/story.php?story_fbid=2202280896585053&id=504376869708806,,0.0,"CPS is looking for paraprofessionals -Paraprofessionals with Braille experience, elementary classroom paraprofessionals, and one-to one paraprofessionals.

https://docs.google.com/document/d/1HUld7pdnhx15UWFTcYF6BcGFrORHU_tS5WLL9Oxg4w4/edit?usp=sharing",2020-08-20 08:22:56,,
11,1.0,,0.0,https://docs.google.com/document/d/1EgudORvuIPVQBEB3lOUaG2PjluJrcSCK-C2M0Mrhbv8/edit?usp=sharing,2201339910012485,"Posting for an Elementary Paraprofessional for Corunna Public Schools

Please click on the link below.

https://docs.google.com/document/d/1EgudORvuIPVQBEB3lOUaG2PjluJrcSCK-C2M0Mrhbv8/edit?usp=sharing",https://facebook.com/story.php?story_fbid=2201339910012485&id=504376869708806,,0.0,"Posting for an Elementary Paraprofessional for Corunna Public Schools

Please click on the link below.

https://docs.google.com/document/d/1EgudORvuIPVQBEB3lOUaG2PjluJrcSCK-C2M0Mrhbv8/edit?usp=sharing",2020-08-19 10:26:11,,
12,3.0,https://scontent.fbna1-2.fna.fbcdn.net/v/t1.0-9/117960886_2198237226989420_4909702607380019283_o.png?_nc_cat=103&_nc_sid=2d5d41&_nc_ohc=QYAQFlwpVfkAX-StWTV&_nc_ht=scontent.fbna1-2.fna&oh=b7bd2ac376c0d68110d00c02711126f2&oe=5F8301AA,7.0,https://docs.google.com/document/d/1bV9sUOOBTAimQCd2RDzLc-3Fr7OrKS5lKi0ERrmc1QQ/edit?usp=sharing,2198237223656087,"Parent update (8.16.2020) from Superintendent John Fattal

https://docs.google.com/document/d/1bV9sUOOBTAimQCd2RDzLc-3Fr7OrKS5lKi0ERrmc1QQ/edit?usp=sharing",,,0.0,"Parent update (8.16.2020) from Superintendent John Fattal

https://docs.google.com/document/d/1bV9sUOOBTAimQCd2RDzLc-3Fr7OrKS5lKi0ERrmc1QQ/edit?usp=sharing",2020-08-16 13:24:13,,
13,0.0,,1.0,https://www.corunna.k12.mi.us/article/286870?org=cps,2195843587228784,"Posting:
Special Education One-To-One Paraprofessionals

https://www.corunna.k12.mi.us/article/286870?org=cps

Great to be Gold!",https://facebook.com/story.php?story_fbid=2195843587228784&id=504376869708806,,0.0,"Posting:
Special Education One-To-One Paraprofessionals

https://www.corunna.k12.mi.us/article/286870?org=cps

Great to be Gold!",2020-08-14 09:12:23,,
14,0.0,,0.0,https://drive.google.com/file/d/1W5_tqkcguBg3k5v5uqAD1DMYUXOXKk__/view?usp=sharing,2192854114194398,"Information regarding our summer food distribution.

https://drive.google.com/file/d/1W5_tqkcguBg3k5v5uqAD1DMYUXOXKk__/view?usp=sharing",https://facebook.com/story.php?story_fbid=2192854114194398&id=504376869708806,,0.0,"Information regarding our summer food distribution.

https://drive.google.com/file/d/1W5_tqkcguBg3k5v5uqAD1DMYUXOXKk__/view?usp=sharing",2020-08-11 14:03:36,,
15,12.0,https://scontent.fbna1-1.fna.fbcdn.net/v/t1.0-9/fr/cp0/e15/q65/117277492_2189925064487303_9018858947671868704_o.jpg?_nc_cat=104&_nc_sid=2d5d41&_nc_ohc=mpZFYoX-npkAX8OGf6Q&_nc_ht=scontent.fbna1-1.fna&tp=14&oh=3344513effc496af28124a60c8e51143&oe=5F845188,22.0,https://docs.google.com/document/d/1K74AEp45aJ6YPxNS4T4rVsODqdTWuu9e2i21I1PP-CY/edit?usp=sharing,2189925061153970,"Important back to school information from Superintendent John Fattal (8.8.2020)

https://docs.google.com/document/d/1K74AEp45aJ6YPxNS4T4rVsODqdTWuu9e2i21I1PP-CY/edit?usp=sharing",,,0.0,"Important back to school information from Superintendent John Fattal (8.8.2020)

https://docs.google.com/document/d/1K74AEp45aJ6YPxNS4T4rVsODqdTWuu9e2i21I1PP-CY/edit?usp=sharing",2020-08-08 18:55:21,,
16,0.0,https://scontent.fbna1-2.fna.fbcdn.net/v/t1.0-9/fr/cp0/e15/q65/117306681_2187416788071464_6522217736561855659_o.jpg?_nc_cat=101&_nc_sid=2d5d41&_nc_ohc=mtB5t1Y0GMcAX8VxVz4&_nc_ht=scontent.fbna1-2.fna&tp=14&oh=eb5d610c34987d060e362abe9a4f0ff7&oe=5F83B544,1.0,https://docs.google.com/document/d/17axxy_8pG8XVxdZl92QfRJHuHnQZGA5gL-3HRqcGLI8/edit?usp=sharing,2187416784738131,"Today's (8.6.2020) community information from Superintendent John Fattal

https://docs.google.com/document/d/17axxy_8pG8XVxdZl92QfRJHuHnQZGA5gL-3HRqcGLI8/edit?usp=sharing",,,0.0,"Today's (8.6.2020) community information from Superintendent John Fattal

https://docs.google.com/document/d/17axxy_8pG8XVxdZl92QfRJHuHnQZGA5gL-3HRqcGLI8/edit?usp=sharing",2020-08-06 10:47:36,,
17,0.0,,1.0,https://docs.google.com/document/d/1HUld7pdnhx15UWFTcYF6BcGFrORHU_tS5WLL9Oxg4w4/edit?usp=sharing,2187392504740559,"1 on 1 Paraprofessional Posting

Please see the posting below. Come and join the Cavalier team!

https://docs.google.com/document/d/1HUld7pdnhx15UWFTcYF6BcGFrORHU_tS5WLL9Oxg4w4/edit?usp=sharing",https://facebook.com/story.php?story_fbid=2187392504740559&id=504376869708806,,0.0,"1 on 1 Paraprofessional Posting

Please see the posting below. Come and join the Cavalier team!

https://docs.google.com/document/d/1HUld7pdnhx15UWFTcYF6BcGFrORHU_tS5WLL9Oxg4w4/edit?usp=sharing",2020-08-06 10:17:45,,
18,0.0,https://scontent.fbna1-2.fna.fbcdn.net/v/t1.0-9/fr/cp0/e15/q65/117173287_2186611151485361_4722513330246455373_n.jpg?_nc_cat=106&_nc_sid=2d5d41&_nc_ohc=pQe-Qj4FwhYAX8lF5kr&_nc_ht=scontent.fbna1-2.fna&tp=14&oh=80a685892ab6c9b2af19fde50c13e824&oe=5F838767,1.0,https://docs.google.com/document/d/1kgtZrgrqodo63OZe8NRhQyJbwdqUyF6ycyGuTNHfh7I/edit?usp=sharing,2186611148152028,"August 5 Parent message from Superintendent John Fattal

https://docs.google.com/document/d/1kgtZrgrqodo63OZe8NRhQyJbwdqUyF6ycyGuTNHfh7I/edit?usp=sharing",,,0.0,"August 5 Parent message from Superintendent John Fattal

https://docs.google.com/document/d/1kgtZrgrqodo63OZe8NRhQyJbwdqUyF6ycyGuTNHfh7I/edit?usp=sharing",2020-08-05 15:23:25,,
19,0.0,https://scontent.fbna1-2.fna.fbcdn.net/v/t1.0-9/fr/cp0/e15/q65/117238815_2185523871594089_3888668600672749438_n.jpg?_nc_cat=109&_nc_sid=2d5d41&_nc_ohc=I0u3GXqY-14AX8wmyCH&_nc_ht=scontent.fbna1-2.fna&tp=14&oh=4c521c61f50855503bdb149bee50183c&oe=5F83C73A,1.0,https://docs.google.com/document/d/12QllbcJg5MV8vWsZygZ08DTOsVhuT73mh15PK2gOmp0/edit?usp=sharing,2185523868260756,"Important message from Superintendent John Fattal regarding a community forum, 8 p.m. tonight.

https://docs.google.com/document/d/12QllbcJg5MV8vWsZygZ08DTOsVhuT73mh15PK2gOmp0/edit?usp=sharing",,,0.0,"Important message from Superintendent John Fattal regarding a community forum, 8 p.m. tonight.

https://docs.google.com/document/d/12QllbcJg5MV8vWsZygZ08DTOsVhuT73mh15PK2gOmp0/edit?usp=sharing",2020-08-04 15:05:35,,
20,5.0,,9.0,https://docs.google.com/document/d/14pSeV052LP7gi5Tw62tG3GSDRB8CW6ZXXujUweuyCmY/edit?usp=sharing,2184677088345434,"Return to School Survey for Corunna Public Schools. Please complete before NOON this Wednesday, August 5.

https://docs.google.com/document/d/14pSeV052LP7gi5Tw62tG3GSDRB8CW6ZXXujUweuyCmY/edit?usp=sharing",https://facebook.com/story.php?story_fbid=2184677088345434&id=504376869708806,,0.0,"Return to School Survey for Corunna Public Schools. Please complete before NOON this Wednesday, August 5.

https://docs.google.com/document/d/14pSeV052LP7gi5Tw62tG3GSDRB8CW6ZXXujUweuyCmY/edit?usp=sharing",2020-08-03 19:45:33,,
21,3.0,,4.0,https://forms.gle/S2ihq3YAdm15zWRc7,2184121055067704,Families who need childcare must complete the following survey: https://forms.gle/S2ihq3YAdm15zWRc7 PRIOR to August 5th 11:00 pm. Once the survey closes we will be contacting families to register for childcare. Spaces will be limited!,https://facebook.com/story.php?story_fbid=2184121055067704&id=504376869708806,"DOCS.GOOGLE.COM
Childcare SURVEY 2020-21",15.0,"Families who need childcare must complete the following survey: https://forms.gle/S2ihq3YAdm15zWRc7 PRIOR to August 5th 11:00 pm. Once the survey closes we will be contacting families to register for childcare. Spaces will be limited!

DOCS.GOOGLE.COM
Childcare SURVEY 2020-21",2020-08-03 08:10:14,,
22,0.0,https://scontent.fbna1-2.fna.fbcdn.net/v/t1.0-9/fr/cp0/e15/q65/116692436_2182008951945581_7114160007705939704_o.jpg?_nc_cat=111&_nc_sid=2d5d41&_nc_ohc=TlDZ4-KqdSsAX8-kD6P&_nc_ht=scontent.fbna1-2.fna&tp=14&oh=e292c85baac4e8ed568894676f56d392&oe=5F81D0CD,8.0,https://docs.google.com/document/d/1qLPFhVYh_j-nPJauq1iaWzv3dyzUYPATVEDV9Z1sCkE/edit?usp=sharing,2182008945278915,"Updated back to school information from Superintendent John Fattal.

https://docs.google.com/document/d/1qLPFhVYh_j-nPJauq1iaWzv3dyzUYPATVEDV9Z1sCkE/edit?usp=sharing",,,0.0,"Updated back to school information from Superintendent John Fattal.

https://docs.google.com/document/d/1qLPFhVYh_j-nPJauq1iaWzv3dyzUYPATVEDV9Z1sCkE/edit?usp=sharing",2020-08-01 08:24:45,,
23,0.0,,3.0,https://youtu.be/m03nSuM-6hQ,2181510418662101,"For those of you who couldn't watch the video, this link should help: https://youtu.be/m03nSuM-6hQ",https://facebook.com/story.php?story_fbid=2181510418662101&id=504376869708806,,0.0,"For those of you who couldn't watch the video, this link should help: https://youtu.be/m03nSuM-6hQ",2020-07-31 19:42:15,,
24,12.0,,12.0,https://docs.google.com/forms/d/e/1FAIpQLSedPcOTeDh5j1HRQ-BT8oSYvO6fx03DpR20chJagLqAzZxG9Q/viewform?usp=sf_link,2181491868663956,"Here is a link where you can ask us questions about the 2020-2021 school year options:

https://docs.google.com/forms/d/e/1FAIpQLSedPcOTeDh5j1HRQ-BT8oSYvO6fx03DpR20chJagLqAzZxG9Q/viewform?usp=sf_link",https://facebook.com/story.php?story_fbid=2181491868663956&id=504376869708806,,0.0,"Here is a link where you can ask us questions about the 2020-2021 school year options:

https://docs.google.com/forms/d/e/1FAIpQLSedPcOTeDh5j1HRQ-BT8oSYvO6fx03DpR20chJagLqAzZxG9Q/viewform?usp=sf_link",2020-07-31 19:15:05,,
25,16.0,https://scontent.fbna1-1.fna.fbcdn.net/v/t1.0-9/fr/cp0/e15/q65/116435674_2181481695331640_5013281081475320005_n.jpg?_nc_cat=108&_nc_sid=2d5d41&_nc_ohc=5l5mss3SWvMAX9RvQAe&_nc_ht=scontent.fbna1-1.fna&tp=14&oh=fc5ac5dc5dc742f597dbfdd39122fd58&oe=5F81D994,14.0,https://drive.google.com/file/d/1WF_zyqOd2tiTfz68k3eT5CSJExmeG7zj/view,2181481691998307,"IMPORTANT information from Superintendent John Fattal regarding the start of the 2020-2021 school year.

https://drive.google.com/file/d/1WF_zyqOd2tiTfz68k3eT5CSJExmeG7zj/view

Information has also been emailed to parents.",,,0.0,"IMPORTANT information from Superintendent John Fattal regarding the start of the 2020-2021 school year.

https://drive.google.com/file/d/1WF_zyqOd2tiTfz68k3eT5CSJExmeG7zj/view

Information has also been emailed to parents.",2020-07-31 19:00:14,,
26,0.0,,2.0,https://drive.google.com/file/d/1RElwDUfkhfaHUmO0IN8pAabh6aTcEtBh/view?usp=sharing,2178761015603708,"Mobile Food Distribution and Community Care Fair Planned

https://drive.google.com/file/d/1RElwDUfkhfaHUmO0IN8pAabh6aTcEtBh/view?usp=sharing

https://drive.google.com/file/d/1Ha9O_646aVsHecZjb9w6jARTx09XvU7v/view?usp=sharing",https://facebook.com/story.php?story_fbid=2178761015603708&id=504376869708806,,0.0,"Mobile Food Distribution and Community Care Fair Planned

https://drive.google.com/file/d/1RElwDUfkhfaHUmO0IN8pAabh6aTcEtBh/view?usp=sharing

https://drive.google.com/file/d/1Ha9O_646aVsHecZjb9w6jARTx09XvU7v/view?usp=sharing",2020-07-29 06:48:49,,
27,0.0,,46.0,,2171499149663228,"The Corunna Town Tub would like to recognize and congratulate this year's 2020 Corunna graduates. Graduates please stop by the administration office at 124 N. Shiawassee Street, (Next to the Town Tub) and pick up your coupon for a free fountain drink. Offices are open from 7:00 a.m.-3:00 p.m. Monday through Friday. Thank you to the Town Tub for your kindness!",https://facebook.com/story.php?story_fbid=2171499149663228&id=504376869708806,,0.0,"The Corunna Town Tub would like to recognize and congratulate this year's 2020 Corunna graduates. Graduates please stop by the administration office at 124 N. Shiawassee Street, (Next to the Town Tub) and pick up your coupon for a free fountain drink. Offices are open from 7:00 a.m.-3:00 p.m. Monday through Friday. Thank you to the Town Tub for your kindness!",2020-07-22 13:02:45,,
28,8.0,,20.0,https://docs.google.com/document/d/1CusJun3KD_hZvVcD00WT6M7uNmhF2ZROW-eH-WI4qLY/edit?usp=sharing,2169423336537476,"Message from Superintendent John Fattal

https://docs.google.com/document/d/1CusJun3KD_hZvVcD00WT6M7uNmhF2ZROW-eH-WI4qLY/edit?usp=sharing",https://facebook.com/story.php?story_fbid=2169423336537476&id=504376869708806,,0.0,"Message from Superintendent John Fattal

https://docs.google.com/document/d/1CusJun3KD_hZvVcD00WT6M7uNmhF2ZROW-eH-WI4qLY/edit?usp=sharing",2020-07-20 14:41:58,,
29,1.0,https://scontent.fbna1-2.fna.fbcdn.net/v/t1.0-9/fr/cp0/e15/q65/108918493_2164185390394604_3614365751721534936_n.jpg?_nc_cat=103&_nc_sid=8024bb&_nc_ohc=71f8RxJFgqEAX9B-x9i&_nc_ht=scontent.fbna1-2.fna&tp=14&oh=62f006e34c448687ceb573e180001040&oe=5F843F53,11.0,https://forms.gle/A9U1Y4wqUwRwRbpk8,2164185597061250,"We have extended our pre-order sale of Cavalier Face Masks and Neck Buffs until 11:00 pm TONIGHT due to overwhelming popularity and demand! To learn more about the masks/buffs, how to get your hands on them, & to place your order please go to- https://forms.gle/A9U1Y4wqUwRwRbpk8",https://facebook.com/story.php?story_fbid=2164185597061250&id=504376869708806,,0.0,"We have extended our pre-order sale of Cavalier Face Masks and Neck Buffs until 11:00 pm TONIGHT due to overwhelming popularity and demand! To learn more about the masks/buffs, how to get your hands on them, & to place your order please go to- https://forms.gle/A9U1Y4wqUwRwRbpk8",2020-07-15 13:26:42,,
30,1.0,https://scontent.fbna1-2.fna.fbcdn.net/v/t1.0-9/fr/cp0/e15/q65/107915043_2162854627194347_7109827189227254091_o.jpg?_nc_cat=111&_nc_sid=2d5d41&_nc_ohc=VGReDYXkSagAX81rTFS&_nc_oc=AQkge_PuaB5XebcEcillQinp3d-8dbg_d9WZNC0zpAWxv9ok3XTTEpIBDKHX0P4ff0c&_nc_ht=scontent.fbna1-2.fna&tp=14&oh=7944e7a10c10ffd6aad0a102460c116b&oe=5F821D0C,54.0,,2162854617194348,"Corunnaâ€™s FFA Officers (Faith Butcher, Braden Fruchey, Emma Bruckman, Amara Jackson, and Haylee Schneider) are enjoying Officer Camp with Advisors Mr. Kiesling and Ms. Forbush!",,,0.0,"Corunnaâ€™s FFA Officers (Faith Butcher, Braden Fruchey, Emma Bruckman, Amara Jackson, and Haylee Schneider) are enjoying Officer Camp with Advisors Mr. Kiesling and Ms. Forbush!",2020-07-14 09:47:44,,
31,0.0,https://scontent.fbna1-2.fna.fbcdn.net/v/t1.0-9/109056503_2162798543866622_3726628136700968964_n.png?_nc_cat=100&_nc_sid=2d5d41&_nc_ohc=nLMHlVQM-80AX-6UMTL&_nc_ht=scontent.fbna1-2.fna&oh=04de68b10bb9cecb5c8384228cc9772a&oe=5F84CCE7,9.0,,2162798540533289,"Reading is an excellent way to spend some time this summer!

""Reading gives us someplace to go when we have to stay where we are."" -Mason Cooley",,,0.0,"Reading is an excellent way to spend some time this summer!

""Reading gives us someplace to go when we have to stay where we are."" -Mason Cooley",2020-07-14 08:46:52,,
32,0.0,,6.0,https://drive.google.com/file/d/1Hs5_byNlRrSgLf7cgnAwuM-zxkFPLMKN/view?usp=sharing,2156595117820298,"School Calendar for Corunna Public Schools (Includes parent teacher conference date of October 29.

https://drive.google.com/file/d/1Hs5_byNlRrSgLf7cgnAwuM-zxkFPLMKN/view?usp=sharing",https://facebook.com/story.php?story_fbid=2156595117820298&id=504376869708806,,0.0,"School Calendar for Corunna Public Schools (Includes parent teacher conference date of October 29.

https://drive.google.com/file/d/1Hs5_byNlRrSgLf7cgnAwuM-zxkFPLMKN/view?usp=sharing",2020-07-08 14:36:33,,
33,12.0,,20.0,https://drive.google.com/file/d/1c3932GwIX6BTe__E84yXqGKa2UmnUNz2/view?usp=sharing,2156549111158232,"2020-2021 School Calendar for Corunna Public Schools

https://drive.google.com/file/d/1c3932GwIX6BTe__E84yXqGKa2UmnUNz2/view?usp=sharing

Go Cavs!",https://facebook.com/story.php?story_fbid=2156549111158232&id=504376869708806,,0.0,"2020-2021 School Calendar for Corunna Public Schools

https://drive.google.com/file/d/1c3932GwIX6BTe__E84yXqGKa2UmnUNz2/view?usp=sharing

Go Cavs!",2020-07-08 13:34:44,,
34,0.0,,0.0,,2153979748081835,The Corunna Public Schools' administration office is open Mon.-Fri. 7:00 to 3:00- July 6-13. If you have any questions please call (989) 743-6338. Go Cavs!,https://facebook.com/story.php?story_fbid=2153979748081835&id=504376869708806,,0.0,The Corunna Public Schools' administration office is open Mon.-Fri. 7:00 to 3:00- July 6-13. If you have any questions please call (989) 743-6338. Go Cavs!,2020-07-06 06:53:15,,
35,0.0,,0.0,https://drive.google.com/file/d/1T0gYCw_QVJG5IM4VWPqiGtac5Ej1bnco/view?usp=sharing,2153973724749104,"As summer continues, things to remember about celebrations and keeping everyone safe. Click below
https://drive.google.com/file/d/1T0gYCw_QVJG5IM4VWPqiGtac5Ej1bnco/view?usp=sharing",https://facebook.com/story.php?story_fbid=2153973724749104&id=504376869708806,,0.0,"As summer continues, things to remember about celebrations and keeping everyone safe. Click below
https://drive.google.com/file/d/1T0gYCw_QVJG5IM4VWPqiGtac5Ej1bnco/view?usp=sharing",2020-07-06 06:44:16,,
36,1.0,,4.0,,2150813755065101,"Moving forward through the summer, the Corunna Public Schoolsâ€™ Administration Office, 124 North Shiawassee Street, Corunna, will be open Monday-Friday from 7:00 a.m.-3:00 p.m. July 6-31. If you would like to register a child for school, or need other assistance, please call (989) 743-6338. Have a fun summer and remember, Itâ€™s Great to be Gold!",https://facebook.com/story.php?story_fbid=2150813755065101&id=504376869708806,,0.0,"Moving forward through the summer, the Corunna Public Schoolsâ€™ Administration Office, 124 North Shiawassee Street, Corunna, will be open Monday-Friday from 7:00 a.m.-3:00 p.m. July 6-31. If you would like to register a child for school, or need other assistance, please call (989) 743-6338. Have a fun summer and remember, Itâ€™s Great to be Gold!",2020-07-03 05:16:07,,
37,0.0,,2.0,,2148149608664849,"Moving forward through the summer, the Corunna Public Schoolsâ€™ Administration Office, 124 North Shiawassee Street, Corunna, will be open Monday-Friday from 7:00 a.m.-3:00 p.m. July 6-31. If you would like to register a child for school, or need other assistance, please call (989) 743-6338. Have a fun summer and remember, Itâ€™s Great to be Gold!",https://facebook.com/story.php?story_fbid=2148149608664849&id=504376869708806,,0.0,"Moving forward through the summer, the Corunna Public Schoolsâ€™ Administration Office, 124 North Shiawassee Street, Corunna, will be open Monday-Friday from 7:00 a.m.-3:00 p.m. July 6-31. If you would like to register a child for school, or need other assistance, please call (989) 743-6338. Have a fun summer and remember, Itâ€™s Great to be Gold!",2020-06-30 17:15:08,,
38,0.0,,7.0,https://www.schuttphotography.com/p971976260,2146917495454727,"Here is the link to the graduation photos from this past Saturday. Congratulations again to the Class of 2020!

https://www.schuttphotography.com/p971976260",https://facebook.com/story.php?story_fbid=2146917495454727&id=504376869708806,,0.0,"Here is the link to the graduation photos from this past Saturday. Congratulations again to the Class of 2020!

https://www.schuttphotography.com/p971976260",2020-06-29 13:30:27,,
39,0.0,,1.0,https://youtu.be/VR75dJU7NZ8,2144780682335075,"Here is a link to the beginning components of the Class of 2020 Corunna High School Commencement Ceremony! #gr82bgold

https://youtu.be/VR75dJU7NZ8",https://facebook.com/story.php?story_fbid=2144780682335075&id=504376869708806,,0.0,"Here is a link to the beginning components of the Class of 2020 Corunna High School Commencement Ceremony! #gr82bgold

https://youtu.be/VR75dJU7NZ8",2020-06-27 15:00:03,,
40,0.0,,7.0,https://www.nfhsnetwork.com/events/corunna-high-school-corunna-mi/evt11895a9f48,2144521545694322,"Click the link below to watch a free LIVE feed of this eveningâ€™s graduation ceremonies! On-Demand video of the action will also be available afterward. Congrats to the Class of 2020!
#Gr82bGOLD
https://www.nfhsnetwork.com/events/corunna-high-school-corunna-mi/evt11895a9f48",https://facebook.com/story.php?story_fbid=2144521545694322&id=504376869708806,,0.0,"Click the link below to watch a free LIVE feed of this eveningâ€™s graduation ceremonies! On-Demand video of the action will also be available afterward. Congrats to the Class of 2020!
#Gr82bGOLD
https://www.nfhsnetwork.com/events/corunna-high-school-corunna-mi/evt11895a9f48",2020-06-27 09:27:01,,
41,0.0,,5.0,https://docs.google.com/document/d/1KxKBlLgXs_Nuo2WCnsBquYJODi_nKf128lyvhL_JDXA/edit?usp=sharing,2143854355761041,"Tomorrow (Saturday, June 27) we celebrate the Class of 2020! Click on the following link for important/pertinent graduation information.

https://docs.google.com/document/d/1KxKBlLgXs_Nuo2WCnsBquYJODi_nKf128lyvhL_JDXA/edit?usp=sharing",https://facebook.com/story.php?story_fbid=2143854355761041&id=504376869708806,,0.0,"Tomorrow (Saturday, June 27) we celebrate the Class of 2020! Click on the following link for important/pertinent graduation information.

https://docs.google.com/document/d/1KxKBlLgXs_Nuo2WCnsBquYJODi_nKf128lyvhL_JDXA/edit?usp=sharing",2020-06-26 19:13:19,,
42,1.0,https://scontent.fbna1-2.fna.fbcdn.net/v/t1.0-9/fr/cp0/e15/q65/106300141_2430090317280957_1649458293320551927_n.jpg?_nc_cat=109&_nc_sid=8024bb&_nc_ohc=L_NKyUXSF3gAX_NLMgU&_nc_ht=scontent.fbna1-2.fna&tp=14&oh=41cd07875a688f91bccc17de5eb35499&oe=5F8110C0,11.0,,2143415299138280,,https://facebook.com/story.php?story_fbid=2143415299138280&id=504376869708806,"Corunna Children's Services- Louise Peacock
June 25 at 2:34 PM Â·

Don't miss your chance for this coming school year! PRESCHOOL Enrollment has begun and we're filling fast! Applications are available on our website. You can mail them in to CS-Louise Peacock 485 E. McArthur St. Corunna Mi 48817.",3.0,"Corunna Children's Services- Louise Peacock
June 25 at 2:34 PM Â·

Don't miss your chance for this coming school year! PRESCHOOL Enrollment has begun and we're filling fast! Applications are available on our website. You can mail them in to CS-Louise Peacock 485 E. McArthur St. Corunna Mi 48817.",2020-06-26 10:08:30,,
43,1.0,,13.0,,2139918976154579,"Moving forward through the summer, the Corunna Public Schoolsâ€™ Administration Office, 124 North Shiawassee Street, Corunna, will be open Monday-Friday from 7:00 a.m.-3:00 p.m. July 6-31. If you would like to register a child for school, or need other assistance, please call (989) 743-6338. Have a fun summer and remember, Itâ€™s Great to be Gold!",https://facebook.com/story.php?story_fbid=2139918976154579&id=504376869708806,,0.0,"Moving forward through the summer, the Corunna Public Schoolsâ€™ Administration Office, 124 North Shiawassee Street, Corunna, will be open Monday-Friday from 7:00 a.m.-3:00 p.m. July 6-31. If you would like to register a child for school, or need other assistance, please call (989) 743-6338. Have a fun summer and remember, Itâ€™s Great to be Gold!",2020-06-23 08:06:55,,
44,0.0,,4.0,,2135434946602982,"Families may come this week and get both non-perishable food items and fresh produce. They also have re-opened their Community Closet. All giveaways are free.

Catholic Charities of Shiawassee & Genesee Counties
1480 N. M- 52, Ste. 1, Owosso, MI 48867

Community Closet & Food Pantry
Mondays 12 pm - 3 pm
Wednesdays & Fridays 9 am - 12 pm

Call or email with questions:
(989) 723-8239
wmalzahn@ccsgc.org",https://facebook.com/story.php?story_fbid=2135434946602982&id=504376869708806,,0.0,"Families may come this week and get both non-perishable food items and fresh produce. They also have re-opened their Community Closet. All giveaways are free.

Catholic Charities of Shiawassee & Genesee Counties
1480 N. M- 52, Ste. 1, Owosso, MI 48867

Community Closet & Food Pantry
Mondays 12 pm - 3 pm
Wednesdays & Fridays 9 am - 12 pm

Call or email with questions:
(989) 723-8239
wmalzahn@ccsgc.org",2020-06-19 06:37:10,,
45,15.0,,4.0,https://docs.google.com/document/d/1v77vEKyMz3mIbQTEgS194yaJQAoU8wyZ6da3HjJvFVE/edit?usp=sharing,2134505600029250,"Important graduation information -- please read!

https://docs.google.com/document/d/1v77vEKyMz3mIbQTEgS194yaJQAoU8wyZ6da3HjJvFVE/edit?usp=sharing",https://facebook.com/story.php?story_fbid=2134505600029250&id=504376869708806,,0.0,"Important graduation information -- please read!

https://docs.google.com/document/d/1v77vEKyMz3mIbQTEgS194yaJQAoU8wyZ6da3HjJvFVE/edit?usp=sharing",2020-06-18 11:45:01,,
46,0.0,,3.0,,2133075943505549,"Families may come this week and get both non-perishable food items and fresh produce. They also have re-opened their Community Closet. All giveaways are free.

Catholic Charities of Shiawassee & Genesee Counties
1480 N. M- 52, Ste. 1, Owosso, MI 48867

Community Closet & Food Pantry
Mondays 12 pm - 3 pm
Wednesdays & Fridays 9 am - 12 pm

Call or email with questions:
(989) 723-8239
wmalzahn@ccsgc.org",https://facebook.com/story.php?story_fbid=2133075943505549&id=504376869708806,,0.0,"Families may come this week and get both non-perishable food items and fresh produce. They also have re-opened their Community Closet. All giveaways are free.

Catholic Charities of Shiawassee & Genesee Counties
1480 N. M- 52, Ste. 1, Owosso, MI 48867

Community Closet & Food Pantry
Mondays 12 pm - 3 pm
Wednesdays & Fridays 9 am - 12 pm

Call or email with questions:
(989) 723-8239
wmalzahn@ccsgc.org",2020-06-17 06:36:10,,
47,0.0,,5.0,,2130878313725312,"Families may come this week and get both non-perishable food items and fresh produce. They also have re-opened their Community Closet. All giveaways are free.

Catholic Charities of Shiawassee & Genesee Counties
1480 N. M- 52, Ste. 1, Owosso, MI 48867

Community Closet & Food Pantry
Mondays 12 pm - 3 pm
Wednesdays & Fridays 9 am - 12 pm

Call or email with questions:
(989) 723-8239
wmalzahn@ccsgc.org",https://facebook.com/story.php?story_fbid=2130878313725312&id=504376869708806,,0.0,"Families may come this week and get both non-perishable food items and fresh produce. They also have re-opened their Community Closet. All giveaways are free.

Catholic Charities of Shiawassee & Genesee Counties
1480 N. M- 52, Ste. 1, Owosso, MI 48867

Community Closet & Food Pantry
Mondays 12 pm - 3 pm
Wednesdays & Fridays 9 am - 12 pm

Call or email with questions:
(989) 723-8239
wmalzahn@ccsgc.org",2020-06-15 05:36:12,,
48,0.0,,5.0,,2127711247375352,"Next week families may come get both non-perishable food items and fresh produce. They also will be re-opening their Community Closet All giveaways are free.

Catholic Charities of Shiawassee & Genesee Counties
1480 N. M- 52, Ste. 1, Owosso, MI 48867

Community Closet & Food Pantry
Mondays 12 pm - 3 pm
Wednesdays & Fridays 9 am - 12 pm

Call or email with questions:
(989) 723-8239
wmalzahn@ccsgc.org",https://facebook.com/story.php?story_fbid=2127711247375352&id=504376869708806,,0.0,"Next week families may come get both non-perishable food items and fresh produce. They also will be re-opening their Community Closet All giveaways are free.

Catholic Charities of Shiawassee & Genesee Counties
1480 N. M- 52, Ste. 1, Owosso, MI 48867

Community Closet & Food Pantry
Mondays 12 pm - 3 pm
Wednesdays & Fridays 9 am - 12 pm

Call or email with questions:
(989) 723-8239
wmalzahn@ccsgc.org",2020-06-12 06:50:06,,
49,4.0,https://scontent.fbna1-1.fna.fbcdn.net/v/t1.0-9/fr/cp0/e15/q65/103837050_2126630330816777_9057759191581163104_o.jpg?_nc_cat=108&_nc_sid=2d5d41&_nc_ohc=SP405u2QSCAAX_tk61-&_nc_oc=AQk4vJSInPNt2K_WBpBB_7IzoF0w7yPbonPUpuOUi3zQ6Jjl5rlQp6af2B-ohUnAaPA&_nc_ht=scontent.fbna1-1.fna&tp=14&oh=22153eaf21668eaf36a1ddff36e07b49&oe=5F8181EB,38.0,https://www.corunna.k12.mi.us/article/257371?org=chs,2126630327483444,"Corunna High School Senior Parade Honoring the Class of 2020 is tonight starting at 7:00 p.m.!!!
Click on the link for all the details

https://www.corunna.k12.mi.us/article/257371?org=chs",,,0.0,"Corunna High School Senior Parade Honoring the Class of 2020 is tonight starting at 7:00 p.m.!!!
Click on the link for all the details

https://www.corunna.k12.mi.us/article/257371?org=chs",2020-06-11 07:09:53,,
50,0.0,,9.0,,2124848727661604,"Next week families may come get both non-perishable food items and fresh produce. They also will be re-opening their Community Closet All giveaways are free.

Catholic Charities of Shiawassee & Genesee Counties
1480 N. M- 52, Ste. 1, Owosso, MI 48867

Community Closet & Food Pantry
Mondays 12 pm - 3 pm
Wednesdays & Fridays 9 am - 12 pm

Call or email with questions:
(989) 723-8239
wmalzahn@ccsgc.org",https://facebook.com/story.php?story_fbid=2124848727661604&id=504376869708806,,0.0,"Next week families may come get both non-perishable food items and fresh produce. They also will be re-opening their Community Closet All giveaways are free.

Catholic Charities of Shiawassee & Genesee Counties
1480 N. M- 52, Ste. 1, Owosso, MI 48867

Community Closet & Food Pantry
Mondays 12 pm - 3 pm
Wednesdays & Fridays 9 am - 12 pm

Call or email with questions:
(989) 723-8239
wmalzahn@ccsgc.org",2020-06-09 15:29:06,,
51,0.0,,4.0,,2124705154342628,"Positive Lunch Balances: If your senior student has a remaining positive lunch balance you can reach out to Erin Levi, elevi@corunna.k12.mi.us or 989-743-8232 to have a check refunded back to you; or you can transfer the money to a sibling.",https://facebook.com/story.php?story_fbid=2124705154342628&id=504376869708806,,0.0,"Positive Lunch Balances: If your senior student has a remaining positive lunch balance you can reach out to Erin Levi, elevi@corunna.k12.mi.us or 989-743-8232 to have a check refunded back to you; or you can transfer the money to a sibling.",2020-06-09 12:40:07,,
52,3.0,,14.0,https://docs.google.com/forms/d/e/1FAIpQLSeybqAiGKKQ1M8Ku25_bnlX4iNh2dHV7ojo8Qcyu5lQ_UxVVg/viewform?usp=sf_link,2124638881015922,"We will be giving away 25-pound produce boxes 10-11 a.m. this Friday, June 12. This will be our last distribution this month. If you want to pick up a box, you MUST fill out the form below to ensure we have enough for everyone that wants one.

https://docs.google.com/forms/d/e/1FAIpQLSeybqAiGKKQ1M8Ku25_bnlX4iNh2dHV7ojo8Qcyu5lQ_UxVVg/viewform?usp=sf_link",https://facebook.com/story.php?story_fbid=2124638881015922&id=504376869708806,,0.0,"We will be giving away 25-pound produce boxes 10-11 a.m. this Friday, June 12. This will be our last distribution this month. If you want to pick up a box, you MUST fill out the form below to ensure we have enough for everyone that wants one.

https://docs.google.com/forms/d/e/1FAIpQLSeybqAiGKKQ1M8Ku25_bnlX4iNh2dHV7ojo8Qcyu5lQ_UxVVg/viewform?usp=sf_link",2020-06-09 11:14:43,,
53,2.0,,11.0,https://www.youtube.com/watch?v=qTIxPaAORVg&feature=youtu.be,2122834347863042,"Corunna High School's Honors Night can be seen here... Please watch and share with friends, relatives, and Corunna alumni world wide! Congrats to the Class of 2020!! #gr82bgold

https://www.youtube.com/watch?v=qTIxPaAORVg&feature=youtu.be",https://facebook.com/story.php?story_fbid=2122834347863042&id=504376869708806,,0.0,"Corunna High School's Honors Night can be seen here... Please watch and share with friends, relatives, and Corunna alumni world wide! Congrats to the Class of 2020!! #gr82bgold

https://www.youtube.com/watch?v=qTIxPaAORVg&feature=youtu.be",2020-06-07 19:00:13,,
54,0.0,,0.0,https://docs.google.com/document/d/1xIShov5W-0s1I4ysZYXkWZp0eAi8ifeZnwuMBY4Hc_w/edit?usp=sharing,2120171481462662,"Today's (6.5.2020) superintendent message

https://docs.google.com/document/d/1xIShov5W-0s1I4ysZYXkWZp0eAi8ifeZnwuMBY4Hc_w/edit?usp=sharing",https://facebook.com/story.php?story_fbid=2120171481462662&id=504376869708806,,0.0,"Today's (6.5.2020) superintendent message

https://docs.google.com/document/d/1xIShov5W-0s1I4ysZYXkWZp0eAi8ifeZnwuMBY4Hc_w/edit?usp=sharing",2020-06-05 10:05:20,,
55,0.0,,1.0,https://drive.google.com/file/d/1g4wg5uZCQL9YtFqDxva-dAF8kkgH3fnq/view?usp=sharing,2119901838156293,"Corunna Public Schools
Summer Meals Program
Click on the link for all the details.
https://drive.google.com/file/d/1g4wg5uZCQL9YtFqDxva-dAF8kkgH3fnq/view?usp=sharing",https://facebook.com/story.php?story_fbid=2119901838156293&id=504376869708806,,0.0,"Corunna Public Schools
Summer Meals Program
Click on the link for all the details.
https://drive.google.com/file/d/1g4wg5uZCQL9YtFqDxva-dAF8kkgH3fnq/view?usp=sharing",2020-06-05 04:41:48,,
56,0.0,,2.0,https://docs.google.com/document/d/1tXBuFdqVcUvcTkj8-n0DmFKco5f64eZFQBHVLVLWwJc/edit?usp=sharing,2119141544898989,"Today's (6.4.2020) Superintendent message

https://docs.google.com/document/d/1tXBuFdqVcUvcTkj8-n0DmFKco5f64eZFQBHVLVLWwJc/edit?usp=sharing",https://facebook.com/story.php?story_fbid=2119141544898989&id=504376869708806,,0.0,"Today's (6.4.2020) Superintendent message

https://docs.google.com/document/d/1tXBuFdqVcUvcTkj8-n0DmFKco5f64eZFQBHVLVLWwJc/edit?usp=sharing",2020-06-04 11:40:24,,
57,2.0,https://scontent.fbna1-1.fna.fbcdn.net/v/t1.0-9/fr/cp0/e15/q65/101943136_2118960718250405_1960086846121705472_o.jpg?_nc_cat=110&_nc_sid=2d5d41&_nc_ohc=rn_QCkit9RUAX-tMEUs&_nc_ht=scontent.fbna1-1.fna&tp=14&oh=15a6b8f8f088414f8c225d68e4e3e54f&oe=5F82C24E,16.0,https://drive.google.com/file/d/1gFQ6gczxzwaDBa-2ZHcrhAVM4xHObJcS/view?usp=sharing,2118960711583739,"Senior Parent and Guardian Letter regarding plans for Graduation.
https://drive.google.com/file/d/1gFQ6gczxzwaDBa-2ZHcrhAVM4xHObJcS/view?usp=sharing",,,0.0,"Senior Parent and Guardian Letter regarding plans for Graduation.
https://drive.google.com/file/d/1gFQ6gczxzwaDBa-2ZHcrhAVM4xHObJcS/view?usp=sharing",2020-06-04 08:07:21,,
58,0.0,,6.0,http://www.corunna.k12.mi.us/,2118955171584293,"This yearâ€™s Senior Honors Night will occur virtually at 7 p.m. on Sunday, June 7. Families can view the ceremony on the Corunna High School Facebook page, Corunna Public Schools Facebook page, CPS website (www.corunna.k12.mi.us), or on the CPS YouTube page.",https://facebook.com/story.php?story_fbid=2118955171584293&id=504376869708806,,0.0,"This yearâ€™s Senior Honors Night will occur virtually at 7 p.m. on Sunday, June 7. Families can view the ceremony on the Corunna High School Facebook page, Corunna Public Schools Facebook page, CPS website (www.corunna.k12.mi.us), or on the CPS YouTube page.",2020-06-04 08:00:13,,
59,0.0,,0.0,https://docs.google.com/document/d/1y_lT-rIFcIO1oaZ3qEGAVg0XDvujJbekVHe34SDwBbo/edit?usp=sharing,2117904875022656,"Today's (6.3.2020) superintendent's message

https://docs.google.com/document/d/1y_lT-rIFcIO1oaZ3qEGAVg0XDvujJbekVHe34SDwBbo/edit?usp=sharing",https://facebook.com/story.php?story_fbid=2117904875022656&id=504376869708806,,0.0,"Today's (6.3.2020) superintendent's message

https://docs.google.com/document/d/1y_lT-rIFcIO1oaZ3qEGAVg0XDvujJbekVHe34SDwBbo/edit?usp=sharing",2020-06-03 09:25:15,,
60,0.0,https://scontent.fbna1-2.fna.fbcdn.net/v/t1.0-9/fr/cp0/e15/q65/101700879_2117761728370304_6039461953686994944_o.jpg?_nc_cat=101&_nc_sid=2d5d41&_nc_ohc=6pkFUhk94n0AX_o8FLH&_nc_ht=scontent.fbna1-2.fna&tp=14&oh=18af65e540a997e23a14807d40e61f2b&oe=5F83F4F1,14.0,https://drive.google.com/file/d/1g4wg5uZCQL9YtFqDxva-dAF8kkgH3fnq/view?usp=sharing,2117761725036971,"Meet Up and Eat Up
Free Summer Meals brought to you by Corunna Public Schools!
Click on the link below for all the details!
https://drive.google.com/file/d/1g4wg5uZCQL9YtFqDxva-dAF8kkgH3fnq/view?usp=sharing",,,0.0,"Meet Up and Eat Up
Free Summer Meals brought to you by Corunna Public Schools!
Click on the link below for all the details!
https://drive.google.com/file/d/1g4wg5uZCQL9YtFqDxva-dAF8kkgH3fnq/view?usp=sharing",2020-06-03 06:33:34,,
61,0.0,,1.0,https://docs.google.com/document/d/1yfg0la0dnVfH22rEtcmOt-0n5eiBJ_UJo3gATH5stpc/edit?usp=drivesdk,2116800375133106,"Today's (6.2.2020) superintendent's message

https://docs.google.com/document/d/1yfg0la0dnVfH22rEtcmOt-0n5eiBJ_UJo3gATH5stpc/edit?usp=drivesdk",https://facebook.com/story.php?story_fbid=2116800375133106&id=504376869708806,,0.0,"Today's (6.2.2020) superintendent's message

https://docs.google.com/document/d/1yfg0la0dnVfH22rEtcmOt-0n5eiBJ_UJo3gATH5stpc/edit?usp=drivesdk",2020-06-02 09:33:30,,
62,8.0,,19.0,https://docs.google.com/document/d/17-NQUC-kAmlGfrqqASTIm0Lj7rLG4MVnwbgoHlCTdKU/edit?usp=sharing,2115718851907925,"Today's superintendent (6.1.2020) message

https://docs.google.com/document/d/17-NQUC-kAmlGfrqqASTIm0Lj7rLG4MVnwbgoHlCTdKU/edit?usp=sharing",https://facebook.com/story.php?story_fbid=2115718851907925&id=504376869708806,,0.0,"Today's superintendent (6.1.2020) message

https://docs.google.com/document/d/17-NQUC-kAmlGfrqqASTIm0Lj7rLG4MVnwbgoHlCTdKU/edit?usp=sharing",2020-06-01 08:29:45,,
63,6.0,,17.0,https://docs.google.com/document/d/130PbRysWfBDxM8JP5Dxc8jy1VbpzqoJGnOXWi8LN_2I/edit?usp=sharing,2113033652176445,"IMPORTANT message regarding the start of next school year (2020-2021). Please read.

https://docs.google.com/document/d/130PbRysWfBDxM8JP5Dxc8jy1VbpzqoJGnOXWi8LN_2I/edit?usp=sharing",https://facebook.com/story.php?story_fbid=2113033652176445&id=504376869708806,,0.0,"IMPORTANT message regarding the start of next school year (2020-2021). Please read.

https://docs.google.com/document/d/130PbRysWfBDxM8JP5Dxc8jy1VbpzqoJGnOXWi8LN_2I/edit?usp=sharing",2020-05-29 16:55:15,,
64,0.0,,4.0,https://docs.google.com/document/d/117OguzQAZkrxP5xhfwRrLp7IVz892KNt3z052aAtNas/edit?usp=sharing,2112678278878649,"Today's (5.29.2020) superintendent's message:

https://docs.google.com/document/d/117OguzQAZkrxP5xhfwRrLp7IVz892KNt3z052aAtNas/edit?usp=sharing",https://facebook.com/story.php?story_fbid=2112678278878649&id=504376869708806,,0.0,"Today's (5.29.2020) superintendent's message:

https://docs.google.com/document/d/117OguzQAZkrxP5xhfwRrLp7IVz892KNt3z052aAtNas/edit?usp=sharing",2020-05-29 09:30:10,,
65,2.0,https://scontent.fbna1-2.fna.fbcdn.net/v/t1.0-9/fr/cp0/e15/q65/101058575_2112669762212834_5750941937825742848_o.jpg?_nc_cat=103&_nc_sid=8024bb&_nc_ohc=PyVy-UdaVEMAX_I9T2O&_nc_ht=scontent.fbna1-2.fna&tp=14&oh=47317b27e4a73946e1594645a4368017&oe=5F841806,49.0,,2112669842212826,"Argus Press Best of the Best!
Congratulations to:
Children's Services-Best Day Care
Lynn Ingram-Best Bus Driver",https://facebook.com/story.php?story_fbid=2112669842212826&id=504376869708806,,0.0,"Argus Press Best of the Best!
Congratulations to:
Children's Services-Best Day Care
Lynn Ingram-Best Bus Driver",2020-05-29 09:22:39,,
66,10.0,,68.0,,2112659785547165,"Argus Press Best of the Best!
Congratulations to:
Amy Murphy-Best Counselor/Therapist
Alan Montgomery-Best Coach",https://facebook.com/story.php?story_fbid=2112659785547165&id=504376869708806,,0.0,"Argus Press Best of the Best!
Congratulations to:
Amy Murphy-Best Counselor/Therapist
Alan Montgomery-Best Coach",2020-05-29 09:10:23,,
67,35.0,https://scontent.fbna1-2.fna.fbcdn.net/v/t1.0-9/fr/cp0/e15/q65/101344470_2112657365547407_303330321523277824_o.jpg?_nc_cat=100&_nc_sid=8024bb&_nc_ohc=FKy1e6hgDwgAX-YefG4&_nc_ht=scontent.fbna1-2.fna&tp=14&oh=43571d4e8e11c2f798bbce1d6eaaf322&oe=5F82C192,115.0,,2112657455547398,"Argus Press Best of the Best!
Congratulations to:
Marjorie Westerlund-Best Receptionist
Kim Phillips-Best Support Staff",https://facebook.com/story.php?story_fbid=2112657455547398&id=504376869708806,,0.0,"Argus Press Best of the Best!
Congratulations to:
Marjorie Westerlund-Best Receptionist
Kim Phillips-Best Support Staff",2020-05-29 09:07:09,,
68,1.0,,3.0,https://docs.google.com/document/d/1OvcdCusdjjjsjMpGxdnOjv8QLtI6Ikn_LiiBMnwR4B4/edit?usp=sharing,2111622425650901,"Today's (5.28.2020) superintendent message

https://docs.google.com/document/d/1OvcdCusdjjjsjMpGxdnOjv8QLtI6Ikn_LiiBMnwR4B4/edit?usp=sharing",https://facebook.com/story.php?story_fbid=2111622425650901&id=504376869708806,,0.0,"Today's (5.28.2020) superintendent message

https://docs.google.com/document/d/1OvcdCusdjjjsjMpGxdnOjv8QLtI6Ikn_LiiBMnwR4B4/edit?usp=sharing",2020-05-28 09:30:06,,
69,0.0,,1.0,https://docs.google.com/document/d/1i-5CgkKhFg2iCuUrQ6_epnS6Em1sRYw105ADuzK4Eq8/edit?usp=sharing,2110619062417904,"Today's (5.27.2020) superintendent's message

https://docs.google.com/document/d/1i-5CgkKhFg2iCuUrQ6_epnS6Em1sRYw105ADuzK4Eq8/edit?usp=sharing",https://facebook.com/story.php?story_fbid=2110619062417904&id=504376869708806,,0.0,"Today's (5.27.2020) superintendent's message

https://docs.google.com/document/d/1i-5CgkKhFg2iCuUrQ6_epnS6Em1sRYw105ADuzK4Eq8/edit?usp=sharing",2020-05-27 09:30:14,,
70,0.0,,1.0,https://forms.gle/wDFyyjLzkwz8Kh486,2109888915824252,"Time sensitive survey regarding free produce boxes -- LIMITED availability.

https://forms.gle/wDFyyjLzkwz8Kh486",https://facebook.com/story.php?story_fbid=2109888915824252&id=504376869708806,,0.0,"Time sensitive survey regarding free produce boxes -- LIMITED availability.

https://forms.gle/wDFyyjLzkwz8Kh486",2020-05-26 15:03:51,,
71,0.0,,0.0,https://docs.google.com/document/d/1YMjjOYsEarIEjVU0RmzpC-syPog7DLKLREHJcbQl2Z4/edit?usp=sharing,2109604829185994,"Today's (5.26.2020) superintendent message.

https://docs.google.com/document/d/1YMjjOYsEarIEjVU0RmzpC-syPog7DLKLREHJcbQl2Z4/edit?usp=sharing",https://facebook.com/story.php?story_fbid=2109604829185994&id=504376869708806,,0.0,"Today's (5.26.2020) superintendent message.

https://docs.google.com/document/d/1YMjjOYsEarIEjVU0RmzpC-syPog7DLKLREHJcbQl2Z4/edit?usp=sharing",2020-05-26 09:37:43,,
72,0.0,https://scontent.fbna1-2.fna.fbcdn.net/v/t1.0-9/fr/cp0/e15/q65/100514746_2108921899254287_757533773184106496_o.jpg?_nc_cat=103&_nc_sid=2d5d41&_nc_ohc=7w7iyvgPOiAAX8MbOj0&_nc_ht=scontent.fbna1-2.fna&tp=14&oh=94c4c866a4902071d706ec926a8d8299&oe=5F825E4A,12.0,,2108921892587621,Happy Memorial Day! Thank you to all the brave men and women who have sacrificed for our beautiful nation! #Gr82bGOLD,,,0.0,Happy Memorial Day! Thank you to all the brave men and women who have sacrificed for our beautiful nation! #Gr82bGOLD,2020-05-25 16:25:03,,
73,0.0,https://scontent.fbna1-2.fna.fbcdn.net/v/t1.0-9/fr/cp0/e15/q65/100773911_2108620105951133_1642395378026283008_o.jpg?_nc_cat=103&_nc_sid=2d5d41&_nc_ohc=01GECF4AfuwAX_-YZlk&_nc_ht=scontent.fbna1-2.fna&tp=14&oh=4a3a547b975626738895c0ade9f6009a&oe=5F8225C1,41.0,,2108620095951134,Happy Memorial Day! Thank you to all the brave men and women who have served this beautiful nation of ours! ðŸ‡ºðŸ‡¸,,,0.0,Happy Memorial Day! Thank you to all the brave men and women who have served this beautiful nation of ours! ðŸ‡ºðŸ‡¸,2020-05-25 10:34:30,,
74,0.0,,0.0,https://docs.google.com/document/d/1YHq4XbMSlOZCJtNur24w090iTCs1T2EMFq1qaoJ0lLc/edit?usp=sharing,2105677586245385,"Corunna Public Schools' Bid Information for BUS GARAGE work. Click on the link for all the information.
https://docs.google.com/document/d/1YHq4XbMSlOZCJtNur24w090iTCs1T2EMFq1qaoJ0lLc/edit?usp=sharing",https://facebook.com/story.php?story_fbid=2105677586245385&id=504376869708806,,0.0,"Corunna Public Schools' Bid Information for BUS GARAGE work. Click on the link for all the information.
https://docs.google.com/document/d/1YHq4XbMSlOZCJtNur24w090iTCs1T2EMFq1qaoJ0lLc/edit?usp=sharing",2020-05-22 16:36:15,,
75,0.0,,2.0,https://docs.google.com/document/d/1JhR2raR3R1OeIsK4L-z1vbXIrz9_BXZ7ZCWAYr5WtKc/edit?usp=sharing,2105348192944991,"Today's (5.22.2020) Superintendent message:
(You would think after doing this for 55 times I would have remembered to share the link!!)

https://docs.google.com/document/d/1JhR2raR3R1OeIsK4L-z1vbXIrz9_BXZ7ZCWAYr5WtKc/edit?usp=sharing",https://facebook.com/story.php?story_fbid=2105348192944991&id=504376869708806,,0.0,"Today's (5.22.2020) Superintendent message:
(You would think after doing this for 55 times I would have remembered to share the link!!)

https://docs.google.com/document/d/1JhR2raR3R1OeIsK4L-z1vbXIrz9_BXZ7ZCWAYr5WtKc/edit?usp=sharing",2020-05-22 09:19:14,,
76,0.0,,1.0,,2105346229611854,Today's superintendent (5.22.2020) message,https://facebook.com/story.php?story_fbid=2105346229611854&id=504376869708806,,0.0,Today's superintendent (5.22.2020) message,2020-05-22 09:17:57,,
77,2.0,,15.0,,2104657199680757,The generosity of this community is outstanding! Look at all of the donations. Corunna Robotics and the Corunna Public Schools could not be more thankful to those who support the Cavaliers!,,,0.0,The generosity of this community is outstanding! Look at all of the donations. Corunna Robotics and the Corunna Public Schools could not be more thankful to those who support the Cavaliers!,2020-05-21 17:25:00,,
78,3.0,https://scontent.fbna1-1.fna.fbcdn.net/v/t1.0-9/fr/cp0/e15/q65/98091173_2104326243047186_5450509018420215808_o.jpg?_nc_cat=105&_nc_sid=2d5d41&_nc_ohc=J6nEmJAEp5YAX_nhujw&_nc_ht=scontent.fbna1-1.fna&tp=14&oh=f245ae131b597134ce74cc16ed751d21&oe=5F848ED0,13.0,,2104326236380520,"Please consider donating your can/bottle returns to the Corunna Robotics team at Central Office, 124 North Shiawassee Street, Corunna. Right next door to the Town Tub! The Robotics members would be forever grateful!",,,0.0,"Please consider donating your can/bottle returns to the Corunna Robotics team at Central Office, 124 North Shiawassee Street, Corunna. Right next door to the Town Tub! The Robotics members would be forever grateful!",2020-05-21 10:06:44,,
79,0.0,,1.0,https://docs.google.com/document/d/15SvLrOdCd9Z0h1Qvw353UyTdvMubXl98nENmyRUtMJE/edit?usp=sharing,2104265859719891,"Today's (5.21.2020) superintendent message

https://docs.google.com/document/d/15SvLrOdCd9Z0h1Qvw353UyTdvMubXl98nENmyRUtMJE/edit?usp=sharing",https://facebook.com/story.php?story_fbid=2104265859719891&id=504376869708806,,0.0,"Today's (5.21.2020) superintendent message

https://docs.google.com/document/d/15SvLrOdCd9Z0h1Qvw353UyTdvMubXl98nENmyRUtMJE/edit?usp=sharing",2020-05-21 08:45:49,,
80,1.0,,2.0,https://docs.google.com/document/d/12AeI3rFHLwZDzITqF9Uawkb6XZ-6Eqemjv6D2hS_qVg/edit?usp=sharing,2103296613150149,"Today's (5.20.2020) message

https://docs.google.com/document/d/12AeI3rFHLwZDzITqF9Uawkb6XZ-6Eqemjv6D2hS_qVg/edit?usp=sharing",https://facebook.com/story.php?story_fbid=2103296613150149&id=504376869708806,,0.0,"Today's (5.20.2020) message

https://docs.google.com/document/d/12AeI3rFHLwZDzITqF9Uawkb6XZ-6Eqemjv6D2hS_qVg/edit?usp=sharing",2020-05-20 09:49:25,,
81,0.0,,0.0,https://docs.google.com/document/d/1YHq4XbMSlOZCJtNur24w090iTCs1T2EMFq1qaoJ0lLc/edit?usp=sharing,2103114539835023,"Corunna Public Schools' Bid Information for BUS GARAGE work. Click on the link for all the information.
https://docs.google.com/document/d/1YHq4XbMSlOZCJtNur24w090iTCs1T2EMFq1qaoJ0lLc/edit?usp=sharing",https://facebook.com/story.php?story_fbid=2103114539835023&id=504376869708806,,0.0,"Corunna Public Schools' Bid Information for BUS GARAGE work. Click on the link for all the information.
https://docs.google.com/document/d/1YHq4XbMSlOZCJtNur24w090iTCs1T2EMFq1qaoJ0lLc/edit?usp=sharing",2020-05-20 05:35:05,,
82,1.0,,6.0,https://forms.gle/6qRDXp8QBEUnmy3G8,2102263703253440,"Families who need childcare should complete this form prior to 5 p.m. Thursday, May 21. We are looking to open up Louise Peacock Children's Services by the of the month, depending on community need.

https://forms.gle/6qRDXp8QBEUnmy3G8",https://facebook.com/story.php?story_fbid=2102263703253440&id=504376869708806,,0.0,"Families who need childcare should complete this form prior to 5 p.m. Thursday, May 21. We are looking to open up Louise Peacock Children's Services by the of the month, depending on community need.

https://forms.gle/6qRDXp8QBEUnmy3G8",2020-05-19 09:49:42,,
83,0.0,,0.0,https://docs.google.com/document/d/1AMt_2C1llhFotucq8E2wtvApnSbr0dU7bXcNS04UG7g/edit?usp=sharing,2102259893253821,"Today's (5.19.2020) message

https://docs.google.com/document/d/1AMt_2C1llhFotucq8E2wtvApnSbr0dU7bXcNS04UG7g/edit?usp=sharing",https://facebook.com/story.php?story_fbid=2102259893253821&id=504376869708806,,0.0,"Today's (5.19.2020) message

https://docs.google.com/document/d/1AMt_2C1llhFotucq8E2wtvApnSbr0dU7bXcNS04UG7g/edit?usp=sharing",2020-05-19 09:45:44,,
84,0.0,,1.0,https://docs.google.com/document/d/18U4qgck6GiJAZVhB9v8emYmeEHNI31WW5NvuLrascp4/edit?usp=sharing,2101262143353596,"Today's (5.18.2020) message

https://docs.google.com/document/d/18U4qgck6GiJAZVhB9v8emYmeEHNI31WW5NvuLrascp4/edit?usp=sharing",https://facebook.com/story.php?story_fbid=2101262143353596&id=504376869708806,,0.0,"Today's (5.18.2020) message

https://docs.google.com/document/d/18U4qgck6GiJAZVhB9v8emYmeEHNI31WW5NvuLrascp4/edit?usp=sharing",2020-05-18 10:00:55,,
85,0.0,,0.0,https://docs.google.com/document/d/1YHq4XbMSlOZCJtNur24w090iTCs1T2EMFq1qaoJ0lLc/edit?usp=sharing,2101235206689623,"Corunna Public Schools' Bid Information for BUS GARAGE work. Click on the link for all the information.
https://docs.google.com/document/d/1YHq4XbMSlOZCJtNur24w090iTCs1T2EMFq1qaoJ0lLc/edit?usp=sharing",https://facebook.com/story.php?story_fbid=2101235206689623&id=504376869708806,,0.0,"Corunna Public Schools' Bid Information for BUS GARAGE work. Click on the link for all the information.
https://docs.google.com/document/d/1YHq4XbMSlOZCJtNur24w090iTCs1T2EMFq1qaoJ0lLc/edit?usp=sharing",2020-05-18 09:29:47,,
86,0.0,,3.0,https://drive.google.com/file/d/1H3GkjIbT7n4QZbNZywVc5_wa7hWzaV6a/view?usp=sharing,2098946936918450,"Drive-Through Mobile Food Distribution Today!

https://drive.google.com/file/d/1H3GkjIbT7n4QZbNZywVc5_wa7hWzaV6a/view?usp=sharing",https://facebook.com/story.php?story_fbid=2098946936918450&id=504376869708806,,0.0,"Drive-Through Mobile Food Distribution Today!

https://drive.google.com/file/d/1H3GkjIbT7n4QZbNZywVc5_wa7hWzaV6a/view?usp=sharing",2020-05-16 05:16:02,,
87,0.0,,0.0,https://docs.google.com/document/d/1iDQvy4qJerhseF2ES7hr0UGB2I4jBgm_hwrfZ_LQO6M/edit?usp=sharing,2098139546999189,"Today's (5.15.2020) message

https://docs.google.com/document/d/1iDQvy4qJerhseF2ES7hr0UGB2I4jBgm_hwrfZ_LQO6M/edit?usp=sharing",https://facebook.com/story.php?story_fbid=2098139546999189&id=504376869708806,,0.0,"Today's (5.15.2020) message

https://docs.google.com/document/d/1iDQvy4qJerhseF2ES7hr0UGB2I4jBgm_hwrfZ_LQO6M/edit?usp=sharing",2020-05-15 10:09:43,,
88,0.0,,0.0,https://docs.google.com/document/d/1ZDwX0gZfPsohbQTqnuiFurn2Z1u7C5GjC40GgOmtz1o/edit?usp=sharing,2097165623763248,"Today's (5.14.2020) message

https://docs.google.com/document/d/1ZDwX0gZfPsohbQTqnuiFurn2Z1u7C5GjC40GgOmtz1o/edit?usp=sharing",https://facebook.com/story.php?story_fbid=2097165623763248&id=504376869708806,,0.0,"Today's (5.14.2020) message

https://docs.google.com/document/d/1ZDwX0gZfPsohbQTqnuiFurn2Z1u7C5GjC40GgOmtz1o/edit?usp=sharing",2020-05-14 11:11:06,,
89,0.0,,2.0,https://drive.google.com/file/d/1H3GkjIbT7n4QZbNZywVc5_wa7hWzaV6a/view?usp=sharing,2096985480447929,"Drive-Through Mobile Food Bank on May 16

https://drive.google.com/file/d/1H3GkjIbT7n4QZbNZywVc5_wa7hWzaV6a/view?usp=sharing",https://facebook.com/story.php?story_fbid=2096985480447929&id=504376869708806,,0.0,"Drive-Through Mobile Food Bank on May 16

https://drive.google.com/file/d/1H3GkjIbT7n4QZbNZywVc5_wa7hWzaV6a/view?usp=sharing",2020-05-14 07:14:08,,
90,0.0,,1.0,https://docs.google.com/document/d/1LqE7WqE0zU-cYO9iuKC1KE8xzdhIPsjb7FJF0wQJbJc/edit?usp=sharing,2096179610528516,"Today's (5.13.2020) message

https://docs.google.com/document/d/1LqE7WqE0zU-cYO9iuKC1KE8xzdhIPsjb7FJF0wQJbJc/edit?usp=sharing",https://facebook.com/story.php?story_fbid=2096179610528516&id=504376869708806,,0.0,"Today's (5.13.2020) message

https://docs.google.com/document/d/1LqE7WqE0zU-cYO9iuKC1KE8xzdhIPsjb7FJF0wQJbJc/edit?usp=sharing",2020-05-13 10:58:31,,
91,0.0,,0.0,https://docs.google.com/document/d/1eHsQ6ZEGZd8wu2UEinfM8eLzJJsZf4Q2uCFA1gJGiGk/edit?usp=sharing,2095046360641841,"Today's (5.12.2020) message

https://docs.google.com/document/d/1eHsQ6ZEGZd8wu2UEinfM8eLzJJsZf4Q2uCFA1gJGiGk/edit?usp=sharing",https://facebook.com/story.php?story_fbid=2095046360641841&id=504376869708806,,0.0,"Today's (5.12.2020) message

https://docs.google.com/document/d/1eHsQ6ZEGZd8wu2UEinfM8eLzJJsZf4Q2uCFA1gJGiGk/edit?usp=sharing",2020-05-12 09:00:05,,
92,0.0,,1.0,https://drive.google.com/file/d/1H3GkjIbT7n4QZbNZywVc5_wa7hWzaV6a/view?usp=sharing,2094173380729139,"Link to Drive-Through Mobile Food Distribution-May 16

https://drive.google.com/file/d/1H3GkjIbT7n4QZbNZywVc5_wa7hWzaV6a/view?usp=sharing",https://facebook.com/story.php?story_fbid=2094173380729139&id=504376869708806,,0.0,"Link to Drive-Through Mobile Food Distribution-May 16

https://drive.google.com/file/d/1H3GkjIbT7n4QZbNZywVc5_wa7hWzaV6a/view?usp=sharing",2020-05-11 10:08:05,,
93,1.0,,1.0,,2094172457395898,Drive-Through Mobile Food Distribution-May 16,https://facebook.com/story.php?story_fbid=2094172457395898&id=504376869708806,,0.0,Drive-Through Mobile Food Distribution-May 16,2020-05-11 10:07:07,,
94,1.0,,2.0,https://docs.google.com/document/d/1JId9b27_ePMYho2tDlZ-365WyJ5m2VjnOAY-Vzi-_3k/edit?usp=sharing,2094143234065487,"Today's (5.11.2020) message

https://docs.google.com/document/d/1JId9b27_ePMYho2tDlZ-365WyJ5m2VjnOAY-Vzi-_3k/edit?usp=sharing",https://facebook.com/story.php?story_fbid=2094143234065487&id=504376869708806,,0.0,"Today's (5.11.2020) message

https://docs.google.com/document/d/1JId9b27_ePMYho2tDlZ-365WyJ5m2VjnOAY-Vzi-_3k/edit?usp=sharing",2020-05-11 09:32:29,,
95,0.0,,2.0,https://docs.google.com/document/d/15mLdAnnx2-pppew5gLHfA2DdRe0zqbJYkmGwYl8kguU/edit?usp=sharing,2090980134381797,"Today's (5.8.2020) message

https://docs.google.com/document/d/15mLdAnnx2-pppew5gLHfA2DdRe0zqbJYkmGwYl8kguU/edit?usp=sharing",https://facebook.com/story.php?story_fbid=2090980134381797&id=504376869708806,,0.0,"Today's (5.8.2020) message

https://docs.google.com/document/d/15mLdAnnx2-pppew5gLHfA2DdRe0zqbJYkmGwYl8kguU/edit?usp=sharing",2020-05-08 10:15:07,,
96,35.0,https://scontent.fbna1-1.fna.fbcdn.net/v/t1.0-9/fr/cp0/e15/q65/96499354_2089870707826073_7190302207336513536_o.jpg?_nc_cat=104&_nc_sid=2d5d41&_nc_ohc=IINn7oor_EIAX-qC-ju&_nc_ht=scontent.fbna1-1.fna&tp=14&oh=539bb29d5757715bd7ea445b5f7d47ec&oe=5F815CEB,196.0,,2089870697826074,"Corunna Public Schools' Food Service Staff is Amazing!!!
Yesterday they served 12,558 meals for the week. They are truly School Lunch Heroes!!!",,,0.0,"Corunna Public Schools' Food Service Staff is Amazing!!!
Yesterday they served 12,558 meals for the week. They are truly School Lunch Heroes!!!",2020-05-07 09:30:58,,
97,0.0,,3.0,https://docs.google.com/document/d/1n8DVGx-zu4IxM1VH6RKIelv8c0WsWaQPR1bd5Klf6h0/edit?usp=sharing,2089867254493085,"Today's (5.7.2020) message

https://docs.google.com/document/d/1n8DVGx-zu4IxM1VH6RKIelv8c0WsWaQPR1bd5Klf6h0/edit?usp=sharing",https://facebook.com/story.php?story_fbid=2089867254493085&id=504376869708806,,0.0,"Today's (5.7.2020) message

https://docs.google.com/document/d/1n8DVGx-zu4IxM1VH6RKIelv8c0WsWaQPR1bd5Klf6h0/edit?usp=sharing",2020-05-07 09:26:26,,
98,0.0,,1.0,https://docs.google.com/document/d/1sspWN-6kf9lybxMdGpIoJjirWdbIjD3xwTlxAsJUrx8/edit?usp=sharing,2088828934596917,"Today's (5.6.2020) message

https://docs.google.com/document/d/1sspWN-6kf9lybxMdGpIoJjirWdbIjD3xwTlxAsJUrx8/edit?usp=sharing",https://facebook.com/story.php?story_fbid=2088828934596917&id=504376869708806,,0.0,"Today's (5.6.2020) message

https://docs.google.com/document/d/1sspWN-6kf9lybxMdGpIoJjirWdbIjD3xwTlxAsJUrx8/edit?usp=sharing",2020-05-06 09:00:12,,
99,0.0,,0.0,https://docs.google.com/document/d/12INbo3TDXiMeTyVbmYKhVDPKA4drgBTAUb67qVWqOSk/edit?usp=sharing,2087817384698072,"Today's (5.5.2020) message

https://docs.google.com/document/d/12INbo3TDXiMeTyVbmYKhVDPKA4drgBTAUb67qVWqOSk/edit?usp=sharing",https://facebook.com/story.php?story_fbid=2087817384698072&id=504376869708806,,0.0,"Today's (5.5.2020) message

https://docs.google.com/document/d/12INbo3TDXiMeTyVbmYKhVDPKA4drgBTAUb67qVWqOSk/edit?usp=sharing",2020-05-05 08:49:10,,
100,1.0,,2.0,https://drive.google.com/file/d/1fvhK4mj0T4d1tMe6RCuif5wNsGJlGsVN/view?usp=sharing,2087013001445177,"Senior Letter 2020

https://drive.google.com/file/d/1fvhK4mj0T4d1tMe6RCuif5wNsGJlGsVN/view?usp=sharing",https://facebook.com/story.php?story_fbid=2087013001445177&id=504376869708806,,0.0,"Senior Letter 2020

https://drive.google.com/file/d/1fvhK4mj0T4d1tMe6RCuif5wNsGJlGsVN/view?usp=sharing",2020-05-04 13:41:56,,
101,0.0,,0.0,https://docs.google.com/document/d/1jsTJL9VT3cracO97aqtNF0JHtTeHa_ixe0ZXeeJ1lP4/edit?usp=sharing,2086832761463201,"Today's (5.4.2020) message

https://docs.google.com/document/d/1jsTJL9VT3cracO97aqtNF0JHtTeHa_ixe0ZXeeJ1lP4/edit?usp=sharing",https://facebook.com/story.php?story_fbid=2086832761463201&id=504376869708806,,0.0,"Today's (5.4.2020) message

https://docs.google.com/document/d/1jsTJL9VT3cracO97aqtNF0JHtTeHa_ixe0ZXeeJ1lP4/edit?usp=sharing",2020-05-04 09:49:19,,
102,0.0,,0.0,http://2020census.gov/,2086235054856305,"2020 Census-Your Response Matters!

Census results help determine how billions of dollars in federal funding flow into states and communities each year.

Please go to 2020census.gov and be counted!",https://facebook.com/story.php?story_fbid=2086235054856305&id=504376869708806,,0.0,"2020 Census-Your Response Matters!

Census results help determine how billions of dollars in federal funding flow into states and communities each year.

Please go to 2020census.gov and be counted!",2020-05-03 18:28:09,,
103,0.0,,4.0,http://2020census.gov/,2085053998307744,"The 2020 Census counts every person living in the United States and five U.S. territories.
Please go to 2020census.gov and be counted.",https://facebook.com/story.php?story_fbid=2085053998307744&id=504376869708806,,0.0,"The 2020 Census counts every person living in the United States and five U.S. territories.
Please go to 2020census.gov and be counted.",2020-05-02 15:35:16,,
104,1.0,,7.0,https://docs.google.com/document/d/1QHcg5-9ZntNbllqPYZr-goySZkCe6l7Jlv9-HDNLFCg/edit?usp=sharing,2084023328410811,"Senior Letter 2020

https://docs.google.com/document/d/1QHcg5-9ZntNbllqPYZr-goySZkCe6l7Jlv9-HDNLFCg/edit?usp=sharing",https://facebook.com/story.php?story_fbid=2084023328410811&id=504376869708806,,0.0,"Senior Letter 2020

https://docs.google.com/document/d/1QHcg5-9ZntNbllqPYZr-goySZkCe6l7Jlv9-HDNLFCg/edit?usp=sharing",2020-05-01 15:07:35,,
105,0.0,,3.0,http://2020census.gov/,2083951275084683,"2020 Census-Your Response Matters!

Census results help determine how billions of dollars in federal funding flow into states and communities each year.

Please go to 2020census.gov and be counted!",https://facebook.com/story.php?story_fbid=2083951275084683&id=504376869708806,,0.0,"2020 Census-Your Response Matters!

Census results help determine how billions of dollars in federal funding flow into states and communities each year.

Please go to 2020census.gov and be counted!",2020-05-01 13:27:16,,
106,0.0,,0.0,https://docs.google.com/document/d/1OS363WU6osxciqpfeTS-yk8QtIgELZy1dwtP9jqUWrA/edit?usp=sharing,2083747935105017,"2020 Census Information-Click Below and Be Counted!

https://docs.google.com/document/d/1OS363WU6osxciqpfeTS-yk8QtIgELZy1dwtP9jqUWrA/edit?usp=sharing",https://facebook.com/story.php?story_fbid=2083747935105017&id=504376869708806,,0.0,"2020 Census Information-Click Below and Be Counted!

https://docs.google.com/document/d/1OS363WU6osxciqpfeTS-yk8QtIgELZy1dwtP9jqUWrA/edit?usp=sharing",2020-05-01 09:19:13,,
107,0.0,,2.0,https://docs.google.com/document/d/1eGuI5G1pq2NP0rAVFI8tYWi9-AiG92nM-stUOh3Vfok/edit?usp=sharing,2083727531773724,"Today's (5.1.2020) message

https://docs.google.com/document/d/1eGuI5G1pq2NP0rAVFI8tYWi9-AiG92nM-stUOh3Vfok/edit?usp=sharing",https://facebook.com/story.php?story_fbid=2083727531773724&id=504376869708806,,0.0,"Today's (5.1.2020) message

https://docs.google.com/document/d/1eGuI5G1pq2NP0rAVFI8tYWi9-AiG92nM-stUOh3Vfok/edit?usp=sharing",2020-05-01 08:55:10,,
108,0.0,,1.0,https://docs.google.com/document/d/1MtB7WmF_xizYdkuOVWL-xFVZUWxIOuu_3d5_Fw1QlLI/edit?usp=sharing,2082879678525176,"Today's (4.30.2020) message

https://docs.google.com/document/d/1MtB7WmF_xizYdkuOVWL-xFVZUWxIOuu_3d5_Fw1QlLI/edit?usp=sharing",https://facebook.com/story.php?story_fbid=2082879678525176&id=504376869708806,,0.0,"Today's (4.30.2020) message

https://docs.google.com/document/d/1MtB7WmF_xizYdkuOVWL-xFVZUWxIOuu_3d5_Fw1QlLI/edit?usp=sharing",2020-04-30 12:53:28,,
109,0.0,,2.0,,2081728325306978,"This week on the Facebook Live #LoungAndLearn series, they are focusing on Scholarship Searching.

www.facebook.com/mistudentaid",https://facebook.com/story.php?story_fbid=2081728325306978&id=504376869708806,,0.0,"This week on the Facebook Live #LoungAndLearn series, they are focusing on Scholarship Searching.

www.facebook.com/mistudentaid",2020-04-29 09:55:37,,
110,0.0,,7.0,,2081715471974930,"CPS Education Foundation raffle will go on as planned tonight, beginning around 5 p.m. (the actual drawing wonâ€™t start until 6 p.m.). The drawing will be on our athletic Facebook page- Corunna High School Athletics

Good luck and thank you for your continued support!",https://facebook.com/story.php?story_fbid=2081715471974930&id=504376869708806,,0.0,"CPS Education Foundation raffle will go on as planned tonight, beginning around 5 p.m. (the actual drawing wonâ€™t start until 6 p.m.). The drawing will be on our athletic Facebook page- Corunna High School Athletics

Good luck and thank you for your continued support!",2020-04-29 09:41:51,,
111,0.0,,2.0,https://docs.google.com/document/d/1bDVRRk8OT7eyXasoDz8DEwpZJWm7C-Wui7qrjtjm9V8/edit?usp=sharing,2081662678646876,"Today's (4.29.2020) message

https://docs.google.com/document/d/1bDVRRk8OT7eyXasoDz8DEwpZJWm7C-Wui7qrjtjm9V8/edit?usp=sharing",https://facebook.com/story.php?story_fbid=2081662678646876&id=504376869708806,,0.0,"Today's (4.29.2020) message

https://docs.google.com/document/d/1bDVRRk8OT7eyXasoDz8DEwpZJWm7C-Wui7qrjtjm9V8/edit?usp=sharing",2020-04-29 09:00:45,,
112,0.0,,1.0,https://docs.google.com/document/d/12PKdV0hgWGkJ_Uh8jipHQbLA6pVQPC5F-brRTWKoD4g/edit?usp=sharing,2080610458752098,"Today's (4.28.2020) message

https://docs.google.com/document/d/12PKdV0hgWGkJ_Uh8jipHQbLA6pVQPC5F-brRTWKoD4g/edit?usp=sharing",https://facebook.com/story.php?story_fbid=2080610458752098&id=504376869708806,,0.0,"Today's (4.28.2020) message

https://docs.google.com/document/d/12PKdV0hgWGkJ_Uh8jipHQbLA6pVQPC5F-brRTWKoD4g/edit?usp=sharing",2020-04-28 08:49:10,,
113,0.0,,2.0,https://docs.google.com/document/d/1FIeJh6FXKIEf0Kvu5hX-A5xaWmDNM7jqVwHoBUfR33w/edit?usp=sharing,2079600225519788,"Today's (4.27.2020) message

https://docs.google.com/document/d/1FIeJh6FXKIEf0Kvu5hX-A5xaWmDNM7jqVwHoBUfR33w/edit?usp=sharing",https://facebook.com/story.php?story_fbid=2079600225519788&id=504376869708806,,0.0,"Today's (4.27.2020) message

https://docs.google.com/document/d/1FIeJh6FXKIEf0Kvu5hX-A5xaWmDNM7jqVwHoBUfR33w/edit?usp=sharing",2020-04-27 10:16:46,,
114,0.0,,0.0,https://docs.google.com/document/d/1fDwOAU-tvy4-dJxYwX2KE-hGHFfiOLCDWGtGTHGr0Ik/edit?usp=sharing,2076577519155392,"Today's (4.24.2020) message

https://docs.google.com/document/d/1fDwOAU-tvy4-dJxYwX2KE-hGHFfiOLCDWGtGTHGr0Ik/edit?usp=sharing",https://facebook.com/story.php?story_fbid=2076577519155392&id=504376869708806,,0.0,"Today's (4.24.2020) message

https://docs.google.com/document/d/1fDwOAU-tvy4-dJxYwX2KE-hGHFfiOLCDWGtGTHGr0Ik/edit?usp=sharing",2020-04-24 10:27:36,,
115,0.0,,2.0,https://docs.google.com/document/d/1B_qEhh9Px1_3bm6ftUh6twZ3Pu02sjW_HXJRCk7MFh0/edit?usp=sharing,2075568755922935,"Today's (4.23.2020) message

https://docs.google.com/document/d/1B_qEhh9Px1_3bm6ftUh6twZ3Pu02sjW_HXJRCk7MFh0/edit?usp=sharing",https://facebook.com/story.php?story_fbid=2075568755922935&id=504376869708806,,0.0,"Today's (4.23.2020) message

https://docs.google.com/document/d/1B_qEhh9Px1_3bm6ftUh6twZ3Pu02sjW_HXJRCk7MFh0/edit?usp=sharing",2020-04-23 11:53:59,,
116,0.0,,0.0,https://docs.google.com/document/d/1gttXKh9K9Absw4QSGMgblAh54BF0O0-hfywCAHW6GeQ/edit?usp=sharing,2074412956038515,"Today's (4.22.2020) message

https://docs.google.com/document/d/1gttXKh9K9Absw4QSGMgblAh54BF0O0-hfywCAHW6GeQ/edit?usp=sharing",https://facebook.com/story.php?story_fbid=2074412956038515&id=504376869708806,,0.0,"Today's (4.22.2020) message

https://docs.google.com/document/d/1gttXKh9K9Absw4QSGMgblAh54BF0O0-hfywCAHW6GeQ/edit?usp=sharing",2020-04-22 09:27:32,,
117,0.0,,1.0,https://docs.google.com/document/d/1gFx19n8md2zWWdkOrXHJtxA1IfJa35Qq_A_h7uEIuBc/edit?usp=sharing,2073222732824204,"Today's (4.21.2020) message

https://docs.google.com/document/d/1gFx19n8md2zWWdkOrXHJtxA1IfJa35Qq_A_h7uEIuBc/edit?usp=sharing",https://facebook.com/story.php?story_fbid=2073222732824204&id=504376869708806,,0.0,"Today's (4.21.2020) message

https://docs.google.com/document/d/1gFx19n8md2zWWdkOrXHJtxA1IfJa35Qq_A_h7uEIuBc/edit?usp=sharing",2020-04-21 08:39:57,,
118,0.0,,0.0,https://docs.google.com/document/d/1HgVkNQI-Q0dKCaPMzdaeB9mL7-eB4Ti8MZtGbPMwKm8/edit?usp=sharing,2072252486254562,"Today's (4.20.2020) message

https://docs.google.com/document/d/1HgVkNQI-Q0dKCaPMzdaeB9mL7-eB4Ti8MZtGbPMwKm8/edit?usp=sharing",https://facebook.com/story.php?story_fbid=2072252486254562&id=504376869708806,,0.0,"Today's (4.20.2020) message

https://docs.google.com/document/d/1HgVkNQI-Q0dKCaPMzdaeB9mL7-eB4Ti8MZtGbPMwKm8/edit?usp=sharing",2020-04-20 09:29:24,,
119,0.0,,0.0,https://docs.google.com/document/d/1IZZ5da9hbcVUkvpR_rOuX6uMwDydfc_ZkHPqtUsTLpI/edit?usp=sharing,2069077373238740,"Today's (4.17.2020) message

https://docs.google.com/document/d/1IZZ5da9hbcVUkvpR_rOuX6uMwDydfc_ZkHPqtUsTLpI/edit?usp=sharing",https://facebook.com/story.php?story_fbid=2069077373238740&id=504376869708806,,0.0,"Today's (4.17.2020) message

https://docs.google.com/document/d/1IZZ5da9hbcVUkvpR_rOuX6uMwDydfc_ZkHPqtUsTLpI/edit?usp=sharing",2020-04-17 10:04:39,,
120,0.0,,1.0,https://docs.google.com/document/d/1bnJHhDQ6xlJz2Zq4K9s3ef8SajBpj6CT9VxFMeHnSzQ/edit?usp=sharing,2067864073360070,"Today's (4.16.2020) message

https://docs.google.com/document/d/1bnJHhDQ6xlJz2Zq4K9s3ef8SajBpj6CT9VxFMeHnSzQ/edit?usp=sharing",https://facebook.com/story.php?story_fbid=2067864073360070&id=504376869708806,,0.0,"Today's (4.16.2020) message

https://docs.google.com/document/d/1bnJHhDQ6xlJz2Zq4K9s3ef8SajBpj6CT9VxFMeHnSzQ/edit?usp=sharing",2020-04-16 09:26:33,,
121,0.0,https://scontent.fbna1-2.fna.fbcdn.net/v/t1.0-9/fr/cp0/e15/q65/93611348_2067032283443249_8057814231656955904_o.jpg?_nc_cat=102&_nc_sid=8024bb&_nc_ohc=GYX-cDoyQt8AX9fvIo6&_nc_ht=scontent.fbna1-2.fna&tp=14&oh=0daa412ac47b492bb373fea86e028bf7&oe=5F8223BF,19.0,,2067032356776575,Love seeing pics of our students reading!!!,https://facebook.com/story.php?story_fbid=2067032356776575&id=504376869708806,,0.0,Love seeing pics of our students reading!!!,2020-04-15 14:45:05,,
122,1.0,,1.0,https://docs.google.com/document/d/1oASnrjmIn_vd9mFsm4OMWstu1Gv119IC3XFsDd1aAyo/edit?usp=sharing,2066821076797703,"This morning's (4.15.2020) message. I have been getting reports that some of you have not been able to access today's message. Here it is again (you could also look to access it on the LiveFeed on our website if this doesn't work).

https://docs.google.com/document/d/1oASnrjmIn_vd9mFsm4OMWstu1Gv119IC3XFsDd1aAyo/edit?usp=sharing",https://facebook.com/story.php?story_fbid=2066821076797703&id=504376869708806,,0.0,"This morning's (4.15.2020) message. I have been getting reports that some of you have not been able to access today's message. Here it is again (you could also look to access it on the LiveFeed on our website if this doesn't work).

https://docs.google.com/document/d/1oASnrjmIn_vd9mFsm4OMWstu1Gv119IC3XFsDd1aAyo/edit?usp=sharing",2020-04-15 10:18:36,,
123,1.0,,0.0,,2066776910135453,"MI Student Aid Presents
#Lounge and Learn with Chelsea Rademacher

https://www.facebook.com/mistudentaid",https://facebook.com/story.php?story_fbid=2066776910135453&id=504376869708806,,0.0,"MI Student Aid Presents
#Lounge and Learn with Chelsea Rademacher

https://www.facebook.com/mistudentaid",2020-04-15 09:28:26,,
124,0.0,,4.0,https://docs.google.com/document/d/1oASnrjmIn_vd9mFsm4OMWstu1Gv119IC3XFsDd1aAyo/edit?usp=sharing,2066751710137973,"Today's (4.15.2020) message. This includes our learning plan information and is rather lengthy. Please read in its entirety.

https://docs.google.com/document/d/1oASnrjmIn_vd9mFsm4OMWstu1Gv119IC3XFsDd1aAyo/edit?usp=sharing",https://facebook.com/story.php?story_fbid=2066751710137973&id=504376869708806,,0.0,"Today's (4.15.2020) message. This includes our learning plan information and is rather lengthy. Please read in its entirety.

https://docs.google.com/document/d/1oASnrjmIn_vd9mFsm4OMWstu1Gv119IC3XFsDd1aAyo/edit?usp=sharing",2020-04-15 08:58:04,,
125,1.0,,2.0,https://docs.google.com/document/d/1lYn28OUaChQdJYctgSgQPYHlbkVqaIrsuN3iVStamfA/edit?usp=sharing,2065792206900590,"Today's (4.14.2020) message

https://docs.google.com/document/d/1lYn28OUaChQdJYctgSgQPYHlbkVqaIrsuN3iVStamfA/edit?usp=sharing",https://facebook.com/story.php?story_fbid=2065792206900590&id=504376869708806,,0.0,"Today's (4.14.2020) message

https://docs.google.com/document/d/1lYn28OUaChQdJYctgSgQPYHlbkVqaIrsuN3iVStamfA/edit?usp=sharing",2020-04-14 11:58:14,,
126,2.0,,2.0,https://docs.google.com/document/d/1WT7d4BQCgWUU_OetQNBmN-UNlxLt3Dfi8uUlfDlxmNU/edit?usp=sharing,2064547480358396,"Today's (4.13.2020) message

https://docs.google.com/document/d/1WT7d4BQCgWUU_OetQNBmN-UNlxLt3Dfi8uUlfDlxmNU/edit?usp=sharing",https://facebook.com/story.php?story_fbid=2064547480358396&id=504376869708806,,0.0,"Today's (4.13.2020) message

https://docs.google.com/document/d/1WT7d4BQCgWUU_OetQNBmN-UNlxLt3Dfi8uUlfDlxmNU/edit?usp=sharing",2020-04-13 09:02:21,,
127,1.0,,0.0,https://youtu.be/_h6JinRWkjI,2061486203997857,Mother Bruce!!! Sure to be a classicðŸ» https://youtu.be/_h6JinRWkjI,https://facebook.com/story.php?story_fbid=2061486203997857&id=504376869708806,,0.0,Mother Bruce!!! Sure to be a classicðŸ» https://youtu.be/_h6JinRWkjI,2020-04-10 13:47:13,,
128,2.0,,5.0,https://docs.google.com/document/d/1lElDxoDIlQfOfQeyDST28nQFnIEPoT8Hs76xCAC4Js8/edit?usp=sharing,2061238520689292,"Today's (4.10.2020) message

https://docs.google.com/document/d/1lElDxoDIlQfOfQeyDST28nQFnIEPoT8Hs76xCAC4Js8/edit?usp=sharing",https://facebook.com/story.php?story_fbid=2061238520689292&id=504376869708806,,0.0,"Today's (4.10.2020) message

https://docs.google.com/document/d/1lElDxoDIlQfOfQeyDST28nQFnIEPoT8Hs76xCAC4Js8/edit?usp=sharing",2020-04-10 09:18:37,,
129,5.0,,2.0,https://docs.google.com/document/d/165_ukI03jaEKp49rpUqIC8-mIIcJWvoIw3mp4CVei7o/edit?usp=sharing,2060164620796682,"Today's (4.9.2020) update

https://docs.google.com/document/d/165_ukI03jaEKp49rpUqIC8-mIIcJWvoIw3mp4CVei7o/edit?usp=sharing",https://facebook.com/story.php?story_fbid=2060164620796682&id=504376869708806,,0.0,"Today's (4.9.2020) update

https://docs.google.com/document/d/165_ukI03jaEKp49rpUqIC8-mIIcJWvoIw3mp4CVei7o/edit?usp=sharing",2020-04-09 09:44:06,,
130,6.0,,40.0,,2060088794137598,"Good morning, There recently has been a post going around regarding an individual who said some racist comments. That person has NEVER BEEN AN EMPLOYEE OF CORUNNA PUBLIC SCHOOLS. Please help rectify this situation by clarifying this information on social media. I trust you will help do this, as there were SO MANY who were quick to spread the information as if that person worked here. Again, that person has NEVER BEEN EMPLOYED BY CORUNNA PUBLIC SCHOOLS.",https://facebook.com/story.php?story_fbid=2060088794137598&id=504376869708806,,0.0,"Good morning, There recently has been a post going around regarding an individual who said some racist comments. That person has NEVER BEEN AN EMPLOYEE OF CORUNNA PUBLIC SCHOOLS. Please help rectify this situation by clarifying this information on social media. I trust you will help do this, as there were SO MANY who were quick to spread the information as if that person worked here. Again, that person has NEVER BEEN EMPLOYED BY CORUNNA PUBLIC SCHOOLS.",2020-04-09 08:08:58,,
131,1.0,,4.0,https://docs.google.com/document/d/1opUCWN6YG50L-edXnc9klZqNIBhyJRQBEsqYZrpX3HQ/edit?usp=sharing,2058099654336512,"Today's (4.7.2020) message:

https://docs.google.com/document/d/1opUCWN6YG50L-edXnc9klZqNIBhyJRQBEsqYZrpX3HQ/edit?usp=sharing",https://facebook.com/story.php?story_fbid=2058099654336512&id=504376869708806,,0.0,"Today's (4.7.2020) message:

https://docs.google.com/document/d/1opUCWN6YG50L-edXnc9klZqNIBhyJRQBEsqYZrpX3HQ/edit?usp=sharing",2020-04-07 10:48:28,,
132,2.0,,3.0,https://drive.google.com/a/corunna.k12.mi.us/file/d/1SJ7AwUMBKbOzu1hR_-mhAHkZVaTx_oys/view?usp=sharing,2057397394406738,"Corunna Public Schools
Meal Distribution Change Starting April 8th!

https://drive.google.com/a/corunna.k12.mi.us/file/d/1SJ7AwUMBKbOzu1hR_-mhAHkZVaTx_oys/view?usp=sharing",https://facebook.com/story.php?story_fbid=2057397394406738&id=504376869708806,,0.0,"Corunna Public Schools
Meal Distribution Change Starting April 8th!

https://drive.google.com/a/corunna.k12.mi.us/file/d/1SJ7AwUMBKbOzu1hR_-mhAHkZVaTx_oys/view?usp=sharing",2020-04-06 18:44:13,,
133,0.0,,3.0,https://docs.google.com/document/d/1BmX_cM8PGFJoi0Kw9lnkgbYEpJZr3dNVArx-2XzeNg4/edit?usp=sharing,2057086191104525,"Today's (4.6.2020) update:

https://docs.google.com/document/d/1BmX_cM8PGFJoi0Kw9lnkgbYEpJZr3dNVArx-2XzeNg4/edit?usp=sharing",https://facebook.com/story.php?story_fbid=2057086191104525&id=504376869708806,,0.0,"Today's (4.6.2020) update:

https://docs.google.com/document/d/1BmX_cM8PGFJoi0Kw9lnkgbYEpJZr3dNVArx-2XzeNg4/edit?usp=sharing",2020-04-06 11:24:56,,
134,2.0,,7.0,https://drive.google.com/a/corunna.k12.mi.us/file/d/18GTIhworOL46ToRqQ4g5BGOBPX-FZGJY/view?usp=sharing,2054042728075538,"Please review and follow the recommendations regarding playgrounds and public outdoor equipment.
Keep all our children safe!

https://drive.google.com/a/corunna.k12.mi.us/file/d/18GTIhworOL46ToRqQ4g5BGOBPX-FZGJY/view?usp=sharing",https://facebook.com/story.php?story_fbid=2054042728075538&id=504376869708806,,0.0,"Please review and follow the recommendations regarding playgrounds and public outdoor equipment.
Keep all our children safe!

https://drive.google.com/a/corunna.k12.mi.us/file/d/18GTIhworOL46ToRqQ4g5BGOBPX-FZGJY/view?usp=sharing",2020-04-03 13:12:48,,
135,0.0,,4.0,https://docs.google.com/document/d/15fOFsdtmowq1MxoU6WMKhwAV9_hDLSeDsfRrx6yBM_8/edit?usp=sharing,2053924238087387,"Today's (4.3.2020) message:

https://docs.google.com/document/d/15fOFsdtmowq1MxoU6WMKhwAV9_hDLSeDsfRrx6yBM_8/edit?usp=sharing",https://facebook.com/story.php?story_fbid=2053924238087387&id=504376869708806,,0.0,"Today's (4.3.2020) message:

https://docs.google.com/document/d/15fOFsdtmowq1MxoU6WMKhwAV9_hDLSeDsfRrx6yBM_8/edit?usp=sharing",2020-04-03 10:44:05,,
136,0.0,,4.0,https://drive.google.com/a/corunna.k12.mi.us/file/d/1PLOOTQmr_ivCZlr_YuehUshWhF9QSbHS/view?usp=sharing,2053206844825793,"Governor Whitmer's Executive Order-April 2, 2020
K-12 Education for the remainder of the 2019-2020 school year.
https://drive.google.com/a/corunna.k12.mi.us/file/d/1PLOOTQmr_ivCZlr_YuehUshWhF9QSbHS/view?usp=sharing",https://facebook.com/story.php?story_fbid=2053206844825793&id=504376869708806,,0.0,"Governor Whitmer's Executive Order-April 2, 2020
K-12 Education for the remainder of the 2019-2020 school year.
https://drive.google.com/a/corunna.k12.mi.us/file/d/1PLOOTQmr_ivCZlr_YuehUshWhF9QSbHS/view?usp=sharing",2020-04-02 18:21:10,,
137,1.0,,14.0,https://drive.google.com/file/d/1SZiM6GE2BCivxG5QHjA0U-KYC5XDLZRt/view?usp=sharing,2052954344851043,"Update from county superintendents regarding Governor Whitmer's statement earlier today:
https://drive.google.com/file/d/1SZiM6GE2BCivxG5QHjA0U-KYC5XDLZRt/view?usp=sharing",https://facebook.com/story.php?story_fbid=2052954344851043&id=504376869708806,,0.0,"Update from county superintendents regarding Governor Whitmer's statement earlier today:
https://drive.google.com/file/d/1SZiM6GE2BCivxG5QHjA0U-KYC5XDLZRt/view?usp=sharing",2020-04-02 12:36:42,,
138,3.0,,11.0,https://docs.google.com/document/d/1oIJz4P2Ee60wQe-LInWTLC6aZdPWTCBK6dswO7W2mws/edit?usp=sharing,2052775341535610,"Today's (4.2.2020) message

https://docs.google.com/document/d/1oIJz4P2Ee60wQe-LInWTLC6aZdPWTCBK6dswO7W2mws/edit?usp=sharing",https://facebook.com/story.php?story_fbid=2052775341535610&id=504376869708806,,0.0,"Today's (4.2.2020) message

https://docs.google.com/document/d/1oIJz4P2Ee60wQe-LInWTLC6aZdPWTCBK6dswO7W2mws/edit?usp=sharing",2020-04-02 09:05:23,,
139,0.0,https://scontent.fbna1-1.fna.fbcdn.net/v/t1.0-9/fr/cp0/e15/q65/91911959_2051851254961352_7024296477191045120_n.jpg?_nc_cat=105&_nc_sid=2d5d41&_nc_ohc=zweiaBbTZmkAX_HAvDj&_nc_ht=scontent.fbna1-1.fna&tp=14&oh=3558bb0acaaa30aa4760b9d6ea246e0e&oe=5F815D43,5.0,,2051851248294686,"Shiawassee County Health Department
Community Need Hotline
Call Monday-Friday 9:00 a.m.-4:00 p.m.
For Essential Needs (989) 743-2460

Please see the attached graphic for the Shiawassee County Health Department Community Needs Hotline",,,0.0,"Shiawassee County Health Department
Community Need Hotline
Call Monday-Friday 9:00 a.m.-4:00 p.m.
For Essential Needs (989) 743-2460

Please see the attached graphic for the Shiawassee County Health Department Community Needs Hotline",2020-04-01 11:16:11,,
140,0.0,,2.0,https://www.corunna.k12.mi.us/article/223878?org=cps,2051832188296592,"Corunna Public Schools
Educational Foundation Raffle-Update
Click on the link below.

https://www.corunna.k12.mi.us/article/223878?org=cps",https://facebook.com/story.php?story_fbid=2051832188296592&id=504376869708806,,0.0,"Corunna Public Schools
Educational Foundation Raffle-Update
Click on the link below.

https://www.corunna.k12.mi.us/article/223878?org=cps",2020-04-01 10:53:18,,
141,0.0,,4.0,https://docs.google.com/document/d/1QISSa7W7GXPmHYegSwUF7ehFnjlrVxFx1ZLcowAZgNY/edit?usp=sharing,2051738368305974,"Today's (4.1.2020) message
https://docs.google.com/document/d/1QISSa7W7GXPmHYegSwUF7ehFnjlrVxFx1ZLcowAZgNY/edit?usp=sharing",https://facebook.com/story.php?story_fbid=2051738368305974&id=504376869708806,,0.0,"Today's (4.1.2020) message
https://docs.google.com/document/d/1QISSa7W7GXPmHYegSwUF7ehFnjlrVxFx1ZLcowAZgNY/edit?usp=sharing",2020-04-01 09:10:08,,
142,2.0,,5.0,https://docs.google.com/document/d/1CR8BnodHsQZFu8-6WGqwX_Hs3QmCVe4VSlMIDy_BeXA/edit?usp=sharing,2050591671753977,"Today's (3.31.2020) message
https://docs.google.com/document/d/1CR8BnodHsQZFu8-6WGqwX_Hs3QmCVe4VSlMIDy_BeXA/edit?usp=sharing",https://facebook.com/story.php?story_fbid=2050591671753977&id=504376869708806,,0.0,"Today's (3.31.2020) message
https://docs.google.com/document/d/1CR8BnodHsQZFu8-6WGqwX_Hs3QmCVe4VSlMIDy_BeXA/edit?usp=sharing",2020-03-31 08:52:01,,
143,0.0,,10.0,,2050537308426080,,https://facebook.com/story.php?story_fbid=2050537308426080&id=504376869708806,"Corunna Children's Services- Louise Peacock
March 25 at 6:59 PM Â·

Ms.Phillips... baby cow!?! #gr82bgold #SchoolsGetItDone",2.0,"Corunna Children's Services- Louise Peacock
March 25 at 6:59 PM Â·

Ms.Phillips... baby cow!?! #gr82bgold #SchoolsGetItDone",2020-03-31 07:57:32,https://video.fbna1-1.fna.fbcdn.net/v/t42.9040-2/91214146_215206136217812_8319739221610856448_n.mp4?_nc_cat=105&_nc_sid=985c63&efg=eyJ2ZW5jb2RlX3RhZyI6ImxlZ2FjeV9zZCJ9&_nc_ohc=PgkmMPSCKMAAX-GrdB-&_nc_ht=video.fbna1-1.fna&oh=1b6ed73837f210a31a752f7ddb9f8e93&oe=5F5D8C3C,
144,2.0,,16.0,,2050536748426136,,https://facebook.com/story.php?story_fbid=2050536748426136&id=504376869708806,"Corunna Children's Services- Louise Peacock
March 30 at 7:51 PM Â·

Mr. Beckham is... ESCARGOT! #gr82bgold #SchoolsGetItDone",4.0,"Corunna Children's Services- Louise Peacock
March 30 at 7:51 PM Â·

Mr. Beckham is... ESCARGOT! #gr82bgold #SchoolsGetItDone",2020-03-31 07:56:34,https://video.fbna1-2.fna.fbcdn.net/v/t42.9040-2/10000000_1540571239453425_7706163904556040192_n.mp4?_nc_cat=100&_nc_sid=985c63&efg=eyJ2ZW5jb2RlX3RhZyI6ImxlZ2FjeV9zZCJ9&_nc_ohc=WOaHU0hxhNYAX8u7kXB&_nc_ht=video.fbna1-2.fna&oh=c435b010595fe99b26dba0985248b969&oe=5F5D88F2,
145,2.0,,19.0,,2050536571759487,,https://facebook.com/story.php?story_fbid=2050536571759487&id=504376869708806,"Corunna Children's Services- Louise Peacock
March 28 at 9:00 AM Â·

Mr. Windnagle and the SNEETCHES! #gr82bgold #SchoolsGetItDone",13.0,"Corunna Children's Services- Louise Peacock
March 28 at 9:00 AM Â·

Mr. Windnagle and the SNEETCHES! #gr82bgold #SchoolsGetItDone",2020-03-31 07:56:20,https://video.fbna1-2.fna.fbcdn.net/v/t42.9040-2/10000000_216970876045029_2301784127680020480_n.mp4?_nc_cat=100&_nc_sid=985c63&efg=eyJ2ZW5jb2RlX3RhZyI6ImxlZ2FjeV9zZCJ9&_nc_ohc=igy7CQrEMokAX9WdyP7&_nc_oc=AQkfpxiVQMJweFFWN_xeN8w2-f9YGzDKUrEm5DxVRyMWwT5NIU_ZIlPW0WNU2fXLPuo&_nc_ht=video.fbna1-2.fna&oh=4138b1c0744b10bb4a2c44aaca7a3dd0&oe=5F5D8145,
146,0.0,,9.0,https://docs.google.com/document/d/1hGBrO2Y-rnGbkl26uGceDZGB0wnS8rHGZ-id_evdzb8/edit?usp=sharing,2049585241854620,"Today's (3.30.2020) message:
https://docs.google.com/document/d/1hGBrO2Y-rnGbkl26uGceDZGB0wnS8rHGZ-id_evdzb8/edit?usp=sharing",https://facebook.com/story.php?story_fbid=2049585241854620&id=504376869708806,,0.0,"Today's (3.30.2020) message:
https://docs.google.com/document/d/1hGBrO2Y-rnGbkl26uGceDZGB0wnS8rHGZ-id_evdzb8/edit?usp=sharing",2020-03-30 10:10:58,,
147,0.0,,2.0,https://docs.google.com/document/d/1up55IS7QiLXEpO7gZ8aY3eJ5BzKqB6pmDM1HzWFnOmU/edit?usp=sharing,2046109002202244,"Today's (3.27.2020) message

https://docs.google.com/document/d/1up55IS7QiLXEpO7gZ8aY3eJ5BzKqB6pmDM1HzWFnOmU/edit?usp=sharing",https://facebook.com/story.php?story_fbid=2046109002202244&id=504376869708806,,0.0,"Today's (3.27.2020) message

https://docs.google.com/document/d/1up55IS7QiLXEpO7gZ8aY3eJ5BzKqB6pmDM1HzWFnOmU/edit?usp=sharing",2020-03-27 09:11:42,,
148,0.0,,1.0,https://drive.google.com/a/corunna.k12.mi.us/file/d/1iNaaJzADdqgOQHhsHhDqWGC8nD0vzU1Z/view?usp=sharing,2045413525605125,"Connecting home, school and community
https://drive.google.com/a/corunna.k12.mi.us/file/d/1iNaaJzADdqgOQHhsHhDqWGC8nD0vzU1Z/view?usp=sharing",https://facebook.com/story.php?story_fbid=2045413525605125&id=504376869708806,,0.0,"Connecting home, school and community
https://drive.google.com/a/corunna.k12.mi.us/file/d/1iNaaJzADdqgOQHhsHhDqWGC8nD0vzU1Z/view?usp=sharing",2020-03-26 18:54:38,,
149,0.0,,11.0,,2045125338967277,Want another fun idea? Have a scavenger hunt in your home trying to find items that start with each letter of the alphabet!! GOOD LUCK!,https://facebook.com/story.php?story_fbid=2045125338967277&id=504376869708806,,0.0,Want another fun idea? Have a scavenger hunt in your home trying to find items that start with each letter of the alphabet!! GOOD LUCK!,2020-03-26 13:07:10,,
150,0.0,,4.0,https://www.youtube.com/cosmickidsyoga,2045120892301055,"It's a little chilly out today! This might be a great time to check out Cosmic Kids. It is a place to learn about yoga, relaxation and mindfulness. https://www.youtube.com/cosmickidsyoga",https://facebook.com/story.php?story_fbid=2045120892301055&id=504376869708806,,0.0,"It's a little chilly out today! This might be a great time to check out Cosmic Kids. It is a place to learn about yoga, relaxation and mindfulness. https://www.youtube.com/cosmickidsyoga",2020-03-26 13:01:32,,
151,0.0,,0.0,https://docs.google.com/document/d/17z3Ci-HccTlzgTEpPKpRKCdBplQl0z_UBpLNlWMCA8M/edit?usp=sharing,2044898515656626,"Today's (3.26.2020) message

https://docs.google.com/document/d/17z3Ci-HccTlzgTEpPKpRKCdBplQl0z_UBpLNlWMCA8M/edit?usp=sharing",https://facebook.com/story.php?story_fbid=2044898515656626&id=504376869708806,,0.0,"Today's (3.26.2020) message

https://docs.google.com/document/d/17z3Ci-HccTlzgTEpPKpRKCdBplQl0z_UBpLNlWMCA8M/edit?usp=sharing",2020-03-26 08:56:11,,
152,0.0,,1.0,https://www.youtube.com/watch?v=K5guOVOuVMs,2043927375753740,"Don't forget to DOODLE today! Ep. 5 with Mo Willems!
https://www.youtube.com/watch?v=K5guOVOuVMs",https://facebook.com/story.php?story_fbid=2043927375753740&id=504376869708806,,0.0,"Don't forget to DOODLE today! Ep. 5 with Mo Willems!
https://www.youtube.com/watch?v=K5guOVOuVMs",2020-03-25 12:48:05,,
153,1.0,,4.0,https://drive.google.com/file/d/1h5MEab8YPvceO-kE2YS89m7TzMGr3xMZ/view?usp=sharing,2043923519087459,"Instructional statement from all Shiawassee County superintendents

https://drive.google.com/file/d/1h5MEab8YPvceO-kE2YS89m7TzMGr3xMZ/view?usp=sharing",https://facebook.com/story.php?story_fbid=2043923519087459&id=504376869708806,,0.0,"Instructional statement from all Shiawassee County superintendents

https://drive.google.com/file/d/1h5MEab8YPvceO-kE2YS89m7TzMGr3xMZ/view?usp=sharing",2020-03-25 12:43:25,,
154,0.0,,1.0,https://www.storypirates.com/our-story,2043920485754429,"Check out Story Pirates! This is a fun website with books, music, podcasts and you can even submit original stories! https://www.storypirates.com/our-story",https://facebook.com/story.php?story_fbid=2043920485754429&id=504376869708806,,0.0,"Check out Story Pirates! This is a fun website with books, music, podcasts and you can even submit original stories! https://www.storypirates.com/our-story",2020-03-25 12:39:25,,
155,0.0,,1.0,https://docs.google.com/document/d/1jI39tgJEFeUVM9jmrCDuUHEk3OoPKs5r9xdLpKOTnmo/edit?usp=sharing,2043905412422603,"Today's (3.25.2020) update:

https://docs.google.com/document/d/1jI39tgJEFeUVM9jmrCDuUHEk3OoPKs5r9xdLpKOTnmo/edit?usp=sharing",https://facebook.com/story.php?story_fbid=2043905412422603&id=504376869708806,,0.0,"Today's (3.25.2020) update:

https://docs.google.com/document/d/1jI39tgJEFeUVM9jmrCDuUHEk3OoPKs5r9xdLpKOTnmo/edit?usp=sharing",2020-03-25 12:37:40,,
156,0.0,,2.0,https://docs.google.com/document/d/1JdrXlbFAVixh3kbjLzfNINtNZ51W7p5Rim5B_2nuRJI/edit?usp=sharing,2042601965886281,"Today's (3.24.2020) message

https://docs.google.com/document/d/1JdrXlbFAVixh3kbjLzfNINtNZ51W7p5Rim5B_2nuRJI/edit?usp=sharing",https://facebook.com/story.php?story_fbid=2042601965886281&id=504376869708806,,0.0,"Today's (3.24.2020) message

https://docs.google.com/document/d/1JdrXlbFAVixh3kbjLzfNINtNZ51W7p5Rim5B_2nuRJI/edit?usp=sharing",2020-03-24 09:45:14,,
157,2.0,,7.0,"https://www.michigan.gov/whitmer/0,9309,7-387-90499_90705-522576--,00.html",2041663879313423,"Governor Whitmer's Executive Order-3/23/2020

https://www.michigan.gov/whitmer/0,9309,7-387-90499_90705-522576--,00.html

Take Care of You and Yours Cavaliers!",https://facebook.com/story.php?story_fbid=2041663879313423&id=504376869708806,,0.0,"Governor Whitmer's Executive Order-3/23/2020

https://www.michigan.gov/whitmer/0,9309,7-387-90499_90705-522576--,00.html

Take Care of You and Yours Cavaliers!",2020-03-23 12:46:53,,
158,0.0,,7.0,https://docs.google.com/document/d/1-1UAUpw8XV9W-N888kVlPjwd3oesDKQzucJGZvWReUQ/edit?usp=sharing,2041479622665182,"Today's (3.23.2020) message:
https://docs.google.com/document/d/1-1UAUpw8XV9W-N888kVlPjwd3oesDKQzucJGZvWReUQ/edit?usp=sharing",https://facebook.com/story.php?story_fbid=2041479622665182&id=504376869708806,,0.0,"Today's (3.23.2020) message:
https://docs.google.com/document/d/1-1UAUpw8XV9W-N888kVlPjwd3oesDKQzucJGZvWReUQ/edit?usp=sharing",2020-03-23 09:14:54,,
159,0.0,,9.0,,2038681209611690,More students having fun at home! #gr82bgold,https://facebook.com/story.php?story_fbid=2038681209611690&id=504376869708806,,0.0,More students having fun at home! #gr82bgold,2020-03-20 21:35:24,,
160,0.0,https://scontent.fbna1-2.fna.fbcdn.net/v/t1.0-9/fr/cp0/e15/q65/90482084_2038647936281684_1779054043314782208_o.jpg?_nc_cat=101&_nc_sid=8024bb&_nc_ohc=wOD4C1fGWckAX_XsSiO&_nc_ht=scontent.fbna1-2.fna&tp=14&oh=98ce5323595f1e205c9540cee28067b6&oe=5F81F167,13.0,,2038648012948343,Fun at home! #gr82bgold,https://facebook.com/story.php?story_fbid=2038648012948343&id=504376869708806,,0.0,Fun at home! #gr82bgold,2020-03-20 20:50:00,,
161,0.0,,7.0,,2038568649622946,Mrs. Woodruff! #gr82bgold #SchoolsGetItDone,https://facebook.com/story.php?story_fbid=2038568649622946&id=504376869708806,"Corunna Children's Services- Louise Peacock
March 20 at 12:00 PM Â·

Mrs. Woodruff reads Dusty Locks and the Three Bears! #gr82bgold #SchoolsGetItDone",0.0,"Mrs. Woodruff! #gr82bgold #SchoolsGetItDone

Corunna Children's Services- Louise Peacock
March 20 at 12:00 PM Â·

Mrs. Woodruff reads Dusty Locks and the Three Bears! #gr82bgold #SchoolsGetItDone",2020-03-20 19:06:26,https://video.fbna1-1.fna.fbcdn.net/v/t42.9040-2/10000000_2242837516020733_6100287164568829952_n.mp4?_nc_cat=105&_nc_sid=985c63&efg=eyJ2ZW5jb2RlX3RhZyI6ImxlZ2FjeV9zZCJ9&_nc_ohc=pkpb2piCAG4AX9Cf3sf&_nc_ht=video.fbna1-1.fna&oh=1d0562390da092d0973f756453bf5a90&oe=5F5D866C,
162,0.0,,8.0,,2038567609623050,"Ms. Warner... Fancy suit! #gr82bgold #SchoolsGetItDone
https://www.facebook.com/1234cps/",https://facebook.com/story.php?story_fbid=2038567609623050&id=504376869708806,"Corunna Children's Services- Louise Peacock
March 20 at 9:00 AM Â·

Ms.Warner... fancy gear! #gr82bgold #SchoolsGetItDone",0.0,"Ms. Warner... Fancy suit! #gr82bgold #SchoolsGetItDone
https://www.facebook.com/1234cps/

Corunna Children's Services- Louise Peacock
March 20 at 9:00 AM Â·

Ms.Warner... fancy gear! #gr82bgold #SchoolsGetItDone",2020-03-20 19:04:39,https://video.fbna1-1.fna.fbcdn.net/v/t42.9040-2/89232933_521346188568781_8284263667919224832_n.mp4?_nc_cat=105&_nc_sid=985c63&efg=eyJ2ZW5jb2RlX3RhZyI6ImxlZ2FjeV9zZCJ9&_nc_ohc=fLnWW-SyCpAAX9RCGpo&_nc_ht=video.fbna1-1.fna&oh=a4ff769e6674752170972402ef4eb896&oe=5F5D8B4C,
163,2.0,,15.0,,2038566269623184,Mr. Windnagle! #gr82bgold #SchoolsGetItDone,https://facebook.com/story.php?story_fbid=2038566269623184&id=504376869708806,"Corunna Children's Services- Louise Peacock
March 18 at 8:09 PM Â·

Mr. Windnagle returns! #gr82gold #SchoolsGetItDone Chicka Chicka Boom Boom!",3.0,"Mr. Windnagle! #gr82bgold #SchoolsGetItDone

Corunna Children's Services- Louise Peacock
March 18 at 8:09 PM Â·

Mr. Windnagle returns! #gr82gold #SchoolsGetItDone Chicka Chicka Boom Boom!",2020-03-20 19:02:34,https://video.fbna1-2.fna.fbcdn.net/v/t42.9040-2/90510453_2245395899099260_6309290658423111680_n.mp4?_nc_cat=100&_nc_sid=985c63&efg=eyJ2ZW5jb2RlX3RhZyI6ImxlZ2FjeV9zZCJ9&_nc_ohc=NbxXbVbRdP4AX-Qmu1q&_nc_ht=video.fbna1-2.fna&oh=87edacfe5094508908f128225a537761&oe=5F5D8C04,
164,0.0,,9.0,,2038470599632751,"Be True to Your School Video by Sherri Svrcek
Thank you Sherri for sharing your talents with us!

https://www.facebook.com/100008283284218/videos/2593905437562207/?story_fbid=2593907994228618&id=100008283284218&notif_id=1584721979488296&notif_t=feedback_reaction_generic",https://facebook.com/story.php?story_fbid=2038470599632751&id=504376869708806,,0.0,"Be True to Your School Video by Sherri Svrcek
Thank you Sherri for sharing your talents with us!

https://www.facebook.com/100008283284218/videos/2593905437562207/?story_fbid=2593907994228618&id=100008283284218&notif_id=1584721979488296&notif_t=feedback_reaction_generic",2020-03-20 16:46:35,,
165,0.0,,19.0,,2038456582967486,"THANK YOU TO THE ESSENTIAL WORKFORCE IN SHIAWASSEE COUNTY!

If you are part of the essential workforce and are in need of childcare services during the COVID-19 Emergency, please call the Great Start Shiawassee intake hub at:
989 725-2581
or
1-866-725-7792",https://facebook.com/story.php?story_fbid=2038456582967486&id=504376869708806,,0.0,"THANK YOU TO THE ESSENTIAL WORKFORCE IN SHIAWASSEE COUNTY!

If you are part of the essential workforce and are in need of childcare services during the COVID-19 Emergency, please call the Great Start Shiawassee intake hub at:
989 725-2581
or
1-866-725-7792",2020-03-20 16:28:00,,
166,0.0,,2.0,https://docs.google.com/forms/d/e/1FAIpQLSfbRSAhrdRq0PD-VD3XgPByc0O576hbPl-ZemljULRRbO_Edw/viewform?usp=sf_link,2038423686304109,"Corunna Public Schools' Student/Family Needs Survey:

https://docs.google.com/forms/d/e/1FAIpQLSfbRSAhrdRq0PD-VD3XgPByc0O576hbPl-ZemljULRRbO_Edw/viewform?usp=sf_link",https://facebook.com/story.php?story_fbid=2038423686304109&id=504376869708806,,0.0,"Corunna Public Schools' Student/Family Needs Survey:

https://docs.google.com/forms/d/e/1FAIpQLSfbRSAhrdRq0PD-VD3XgPByc0O576hbPl-ZemljULRRbO_Edw/viewform?usp=sf_link",2020-03-20 15:47:02,,
167,0.0,,0.0,https://www.youtube.com/watch?v=N90fLxaBCGE,2038282356318242,Keep doodling with Mo Willems Ep. 4 https://www.youtube.com/watch?v=N90fLxaBCGE,https://facebook.com/story.php?story_fbid=2038282356318242&id=504376869708806,,0.0,Keep doodling with Mo Willems Ep. 4 https://www.youtube.com/watch?v=N90fLxaBCGE,2020-03-20 12:50:44,,
168,1.0,https://scontent.fbna1-2.fna.fbcdn.net/v/t1.0-9/fr/cp0/e15/q65/90423638_2038274149652396_3368732331324997632_o.jpg?_nc_cat=109&_nc_sid=2d5d41&_nc_ohc=_rnM2KeNAlEAX-VYRn0&_nc_ht=scontent.fbna1-2.fna&tp=14&oh=83a44cc55818b0a19423f1bf29bf5b84&oe=5F82D3F0,19.0,,2038274139652397,Donâ€™t forget to read everyday for at least 20 minutes!,,,0.0,Donâ€™t forget to read everyday for at least 20 minutes!,2020-03-20 12:40:02,,
169,0.0,https://scontent.fbna1-2.fna.fbcdn.net/v/t1.0-9/fr/cp0/e15/q65/90525742_2038148886331589_2270654608445538304_o.jpg?_nc_cat=106&_nc_sid=8024bb&_nc_ohc=1WK4EURpH_YAX8lzsk3&_nc_ht=scontent.fbna1-2.fna&tp=14&oh=9243411c5a69744d848c47ca85513507&oe=5F82D481,17.0,,2038149086331569,"Having fun at home drawing, doing science experiments and art! #gr82bgold",https://facebook.com/story.php?story_fbid=2038149086331569&id=504376869708806,,0.0,"Having fun at home drawing, doing science experiments and art! #gr82bgold",2020-03-20 10:22:04,,
170,3.0,,11.0,,2038132252999919,"Here's a sample of what our Children's Services staff are sharing. Stop by their Facebook page and check it out!
https://www.facebook.com/1234cps/",https://facebook.com/story.php?story_fbid=2038132252999919&id=504376869708806,"Corunna Children's Services- Louise Peacock
March 19 at 9:19 AM Â·

Mrs. Deyarmond's new arrival... help her name it!",2.0,"Here's a sample of what our Children's Services staff are sharing. Stop by their Facebook page and check it out!
https://www.facebook.com/1234cps/

Corunna Children's Services- Louise Peacock
March 19 at 9:19 AM Â·

Mrs. Deyarmond's new arrival... help her name it!",2020-03-20 10:02:27,https://video.fbna1-2.fna.fbcdn.net/v/t42.9040-2/90572512_210529260166835_7135026442093461504_n.mp4?_nc_cat=103&_nc_sid=985c63&efg=eyJ2ZW5jb2RlX3RhZyI6ImxlZ2FjeV9zZCJ9&_nc_ohc=Dhy4uBCJCusAX9VN7L-&_nc_ht=video.fbna1-2.fna&oh=540de172afd83a9b993e36844da8082e&oe=5F5D842E,
