,comments,image,likes,link,post_id,post_text,post_url,shared_text,shares,text,time,video,video_thumbnail
30,0.0,https://scontent-atl3-1.xx.fbcdn.net/v/t1.0-9/fr/cp0/e15/q65/69783494_3513454098679987_7420001052646178816_o.jpg?_nc_cat=100&_nc_sid=2d5d41&_nc_ohc=59GHcrxo7eAAX_sbJFj&_nc_ht=scontent-atl3-1.xx&tp=14&oh=1ca8477fe046db5c47ac3557200dca7b&oe=5F83EF37,12.0,,3513454088679988,"On this day, we celebrate the contributions workers have made to our country’s growing industries from steel mills to corporations. Without the hard work of these individuals we wouldn’t have seen many industries change over the years! Have a safe and happy holiday!",,,0.0,"On this day, we celebrate the contributions workers have made to our country’s growing industries from steel mills to corporations. Without the hard work of these individuals we wouldn’t have seen many industries change over the years! Have a safe and happy holiday!",2019-09-02 09:04:41,,
31,0.0,https://scontent-atl3-1.xx.fbcdn.net/v/t1.0-9/fr/cp0/e15/q65/69642733_3504988839526513_2328708611938713600_o.jpg?_nc_cat=106&_nc_sid=2d5d41&_nc_ohc=OJUk0VaywfgAX9xq5H1&_nc_ht=scontent-atl3-1.xx&tp=14&oh=bccc97d08ba87c73530e1e39b65381ea&oe=5F84407F,4.0,,3504988829526514,"⚡Flashback Friday⚡! The Meatball Baker, a client product was licensed by Xtraordinary Home Products in January 2012! Just after the magazine hits the mailboxes, it is quickly featured on Good Morning America's "" Secret Steals and Deals"" website.",,,0.0,"⚡Flashback Friday⚡! The Meatball Baker, a client product was licensed by Xtraordinary Home Products in January 2012! Just after the magazine hits the mailboxes, it is quickly featured on Good Morning America's "" Secret Steals and Deals"" website.",2019-08-30 09:06:06,,
32,6.0,,15.0,,3502493403109390,"Have you ever got into something so much that it consumed all your thoughts? At Davison, we are in an inventor's state of mind! We are always looking for better ways to improve existing products and thinking “what if”. What are you thinking about today?",,,0.0,"Have you ever got into something so much that it consumed all your thoughts? At Davison, we are in an inventor's state of mind! We are always looking for better ways to improve existing products and thinking “what if”. What are you thinking about today?",2019-08-29 11:05:57,,
33,10.0,,8.0,,3494080320617365,"Happy National Dog Day! Many of us here at Davison have fur-kids at home, and sometimes we bring them into the office as well. Did you know that when we have pet products, sometimes we use our own fur-kids to model them for our inventomercials?! Post a picture of your fur-kid in the comments🐶, we would love to see them!",,,0.0,"Happy National Dog Day! Many of us here at Davison have fur-kids at home, and sometimes we bring them into the office as well. Did you know that when we have pet products, sometimes we use our own fur-kids to model them for our inventomercials?! Post a picture of your fur-kid in the comments🐶, we would love to see them!",2019-08-26 11:08:57,,
34,0.0,https://scontent-atl3-1.xx.fbcdn.net/v/t1.0-9/fr/cp0/e15/q65/69336621_3493545417337522_8467967948974194688_o.jpg?_nc_cat=109&_nc_sid=2d5d41&_nc_ohc=UUqKRlgMHlMAX9xZhg2&_nc_ht=scontent-atl3-1.xx&tp=14&oh=10f301049af8eeda0a851bca0604b592&oe=5F830507,6.0,,3493545410670856,When you look back at your life what is one thing you wished you would of took the chance and crossed the line? What about a time when you wish you had pushed yourself to go a little harder towards a goal. Pick something on your goal list today and apply a little extra towards it,,,0.0,When you look back at your life what is one thing you wished you would of took the chance and crossed the line? What about a time when you wish you had pushed yourself to go a little harder towards a goal. Pick something on your goal list today and apply a little extra towards it,2019-08-26 07:30:01,,
35,0.0,https://scontent-atl3-1.xx.fbcdn.net/v/t1.0-9/fr/cp0/e15/q65/68796583_3485348061490591_4393057043301269504_o.jpg?_nc_cat=101&_nc_sid=2d5d41&_nc_ohc=OU7zRg9R_LMAX8ZWMJx&_nc_ht=scontent-atl3-1.xx&tp=14&oh=82f7017b526df6ce0fc4ef3a64ba0654&oe=5F84217C,5.0,,3485348051490592,"⚡Flashback Friday⚡! The Original Perfect Pizza Pan🍕 is featured in Ingredient Magazine in August of 2011, after a reader tested and rated the invention. The pan allows users to customize every slice and allows for easy cleanup.",,,0.0,"⚡Flashback Friday⚡! The Original Perfect Pizza Pan🍕 is featured in Ingredient Magazine in August of 2011, after a reader tested and rated the invention. The pan allows users to customize every slice and allows for easy cleanup.",2019-08-23 09:10:04,,
36,0.0,https://scontent-atl3-1.xx.fbcdn.net/v/t1.0-9/fr/cp0/e15/q65/69261257_3475090989182965_6689281189787729920_o.jpg?_nc_cat=111&_nc_sid=2d5d41&_nc_ohc=SpwnXXL1dLYAX90aHkw&_nc_ht=scontent-atl3-1.xx&tp=14&oh=449a257f10dbe30189eef026bb0cc8db&oe=5F85149E,9.0,https://hubs.ly/H0j_FFh0,3475090982516299,"The Oil Filter Gripper has been in the Davison family for 26 years! That's a long time for one product to be around. If you change your own oil or know someone who loves working on cars, this is a great gift for them! Get yours on Amazon today at https://hubs.ly/H0j_FFh0.",,,0.0,"The Oil Filter Gripper has been in the Davison family for 26 years! That's a long time for one product to be around. If you change your own oil or know someone who loves working on cars, this is a great gift for them! Get yours on Amazon today at https://hubs.ly/H0j_FFh0.",2019-08-19 15:02:32,,
37,0.0,https://scontent-atl3-1.xx.fbcdn.net/v/t1.0-9/fr/cp0/e15/q65/68328424_3474273935931337_1476608119982260224_o.jpg?_nc_cat=100&_nc_sid=2d5d41&_nc_ohc=U_yNS3HhUa8AX-\-\JFzj&_nc_ht=scontent-atl3-1.xx&tp=14&oh=058001e659f9758c170b8548b7a39c6c&oe=5F836EDA,3.0,,3474273925931338,"Did you know that today is National Aviation Day? Did you know that at any given hour over 61,000 people are airborne over the USA? How about the average 747 has 240-280 kilometers of wiring, yeah we didn't either! #aviation #flying #intheair",,,0.0,"Did you know that today is National Aviation Day? Did you know that at any given hour over 61,000 people are airborne over the USA? How about the average 747 has 240-280 kilometers of wiring, yeah we didn't either! #aviation #flying #intheair",2019-08-19 09:01:32,,
38,0.0,https://scontent-atl3-1.xx.fbcdn.net/v/t1.0-9/fr/cp0/e15/q65/67905541_3465956430096421_5137919907047931904_o.jpg?_nc_cat=106&_nc_sid=2d5d41&_nc_ohc=2n7D_nocEuwAX91faPX&_nc_ht=scontent-atl3-1.xx&tp=14&oh=4f7d06d4b7cc1cdede9b592f05ba2eb8&oe=5F82A1B5,7.0,,3465956416763089,"⚡Flashback Friday⚡! The Freshtainer, a product designed by Davison for XHP, is on the market and appeared in 988 Ross Dress for Less stores. By allowing airflow into the container it allows for the fruit to stay good longer.",,,0.0,"⚡Flashback Friday⚡! The Freshtainer, a product designed by Davison for XHP, is on the market and appeared in 988 Ross Dress for Less stores. By allowing airflow into the container it allows for the fruit to stay good longer.",2019-08-16 09:03:07,,
39,0.0,https://scontent-atl3-1.xx.fbcdn.net/v/t1.0-9/fr/cp0/e15/q65/68844730_3463308293694568_6155898521376522240_o.jpg?_nc_cat=108&_nc_sid=2d5d41&_nc_ohc=ent-IVhR24MAX8wTWXK&_nc_ht=scontent-atl3-1.xx&tp=14&oh=f4dd292c5353a353cc2cd529b4948fc2&oe=5F842778,3.0,https://hubs.ly/H0j_GqW0,3463308280361236,"With school just around the corner, staying organized is a huge help while making the summer to school transition! What better way to stay organized than with erasable labels! Grab some of these Davison designed labels from @jokari at https://hubs.ly/H0j_GqW0 !",,,0.0,"With school just around the corner, staying organized is a huge help while making the summer to school transition! What better way to stay organized than with erasable labels! Grab some of these Davison designed labels from @jokari at https://hubs.ly/H0j_GqW0 !",2019-08-15 09:10:29,,
40,1.0,https://scontent-atl3-1.xx.fbcdn.net/v/t1.0-9/fr/cp0/e15/q65/68607266_3461718563853541_1059626405391761408_o.jpg?_nc_cat=111&_nc_sid=2d5d41&_nc_ohc=719q8HKf1R0AX85rGQR&_nc_ht=scontent-atl3-1.xx&tp=14&oh=4554bda0cbff0194cbcafc40945b08a9&oe=5F84D733,3.0,https://hubs.ly/H0j_Gq70,3461718560520208,"When was the last time you sat down with your best friend? Well let us introduce you to your new best friend. If you have tried to grab an oil filter that has oil on it, you know that it is slick, well never fear, we solved that problem for you! On Amazon https://hubs.ly/H0j_Gq70",,,0.0,"When was the last time you sat down with your best friend? Well let us introduce you to your new best friend. If you have tried to grab an oil filter that has oil on it, you know that it is slick, well never fear, we solved that problem for you! On Amazon https://hubs.ly/H0j_Gq70",2019-08-14 18:08:29,,
41,2.0,https://scontent-atl3-1.xx.fbcdn.net/v/t1.0-9/fr/cp0/e15/q65/67823331_3457808357577895_7665567534371831808_o.jpg?_nc_cat=105&_nc_sid=2d5d41&_nc_ohc=hgoqI_3N1bMAX9V887z&_nc_ht=scontent-atl3-1.xx&tp=14&oh=02a56465b4e535c694e1b6acc7ea9912&oe=5F846DB1,6.0,,3457808350911229,"So you are a left handed person? Did you know that today is your day?! While smudging paper or writing between the binder rings isn't always fun, make sure to celebrate your uniqueness! Happy Left-handers day!",,,0.0,"So you are a left handed person? Did you know that today is your day?! While smudging paper or writing between the binder rings isn't always fun, make sure to celebrate your uniqueness! Happy Left-handers day!",2019-08-13 09:07:22,,
42,13.0,https://scontent-atl3-1.xx.fbcdn.net/v/t1.0-9/fr/cp0/e15/q65/68733652_3455304831161581_6332827873774141440_o.jpg?_nc_cat=106&_nc_sid=2d5d41&_nc_ohc=cglS9EcloyoAX-21n7b&_nc_ht=scontent-atl3-1.xx&tp=14&oh=0dc83506f21a38aae7693b0d3d7b3b52&oe=5F8487DE,4.0,,3455304824494915,It's #nationalvinylrecordday!! What was your favorite vinyl to listen to growing up? Have you seen any cool art made out of records?,,,0.0,It's #nationalvinylrecordday!! What was your favorite vinyl to listen to growing up? Have you seen any cool art made out of records?,2019-08-12 11:05:12,,
43,9.0,https://scontent-atl3-1.xx.fbcdn.net/v/t1.0-9/fr/cp0/e15/q65/68406473_3454818487876882_8386913523732578304_o.jpg?_nc_cat=107&_nc_sid=2d5d41&_nc_ohc=6fVxfSzqhkMAX_qwSol&_nc_ht=scontent-atl3-1.xx&tp=14&oh=fc19d184ae73b3d8ed906c6dc474bc6a&oe=5F84B033,8.0,,3454818484543549,Most people don't know that behind each action we take is inspiration or drive. Many times we fail to put the drive or inspiration to the front of what we are pushing for. What are you pushing forward today? #success #inspiration #quote #drive,,,0.0,Most people don't know that behind each action we take is inspiration or drive. Many times we fail to put the drive or inspiration to the front of what we are pushing for. What are you pushing forward today? #success #inspiration #quote #drive,2019-08-12 07:20:01,,
44,16.0,https://scontent-atl3-1.xx.fbcdn.net/v/t1.0-9/fr/cp0/e15/q65/67803949_3446846032007461_1402000303212986368_o.jpg?_nc_cat=111&_nc_sid=2d5d41&_nc_ohc=Ba4vxadje4wAX8wSLXp&_nc_ht=scontent-atl3-1.xx&tp=14&oh=a5968c973c951b5b7e63714541146f0b&oe=5F83626D,2.0,https://hubs.ly/H0k3rHP0,3446846022007462,"Who knew that being organized was so simple. With the Tumbler Organizer you will be able to organize anything in your home, from your reusable cups to kids toys. Don't be left with clutter this back to school season, get your Tumbler Organizer at https://hubs.ly/H0k3rHP0",,,0.0,"Who knew that being organized was so simple. With the Tumbler Organizer you will be able to organize anything in your home, from your reusable cups to kids toys. Don't be left with clutter this back to school season, get your Tumbler Organizer at https://hubs.ly/H0k3rHP0",2019-08-09 09:03:31,,
45,11.0,https://scontent-atl3-1.xx.fbcdn.net/v/t1.0-9/fr/cp0/e15/q65/67798104_3441743545851043_5251539233889320960_o.jpg?_nc_cat=101&_nc_sid=2d5d41&_nc_ohc=l5hvrpCjgaMAX8zbiRr&_nc_ht=scontent-atl3-1.xx&tp=14&oh=d6a65edb50f8119127c877bd879f8552&oe=5F82F2FA,9.0,,3441743542517710,"Henry Ford may have started with cars but did you know that he dabbled in tractors? The first tractor that he designed had three wheels, two in the front and a steering wheel in the back. It also ran off of three different types of fuel, gas, kerosene, and alcohol. #funfact #ford #nationalfarmersweek",,,0.0,"Henry Ford may have started with cars but did you know that he dabbled in tractors? The first tractor that he designed had three wheels, two in the front and a steering wheel in the back. It also ran off of three different types of fuel, gas, kerosene, and alcohol. #funfact #ford #nationalfarmersweek",2019-08-07 12:02:37,,
46,0.0,,11.0,https://hubs.ly/H0jqHt00,3439270169431714,"We love sharing our inventors stories and this DTI is special because it shows that sometimes you have to go back to the drawing board in order to succeed. You will be sure to find a laugh or two in this inspirational video about Trish and the Tater Gator! Check out the full version at
https://hubs.ly/H0jqHt00",,,0.0,"We love sharing our inventors stories and this DTI is special because it shows that sometimes you have to go back to the drawing board in order to succeed. You will be sure to find a laugh or two in this inspirational video about Trish and the Tater Gator! Check out the full version at
https://hubs.ly/H0jqHt00",2019-08-06 13:36:09,https://video-atl3-1.xx.fbcdn.net/v/t42.9040-2/68945017_1065477306984093_6642104929706049536_n.mp4?_nc_cat=103&_nc_sid=985c63&efg=eyJ2ZW5jb2RlX3RhZyI6InN2ZV9zZCJ9&_nc_ohc=I2pM1X_trtwAX-q9YjJ&_nc_ht=video-atl3-1.xx&oh=6994ac13677cd3084c6e9942d0912914&oe=5F5E15C2,
47,0.0,https://scontent-atl3-1.xx.fbcdn.net/v/t1.0-9/fr/cp0/e15/q65/67810200_3438933552798709_312724630475374592_o.jpg?_nc_cat=107&_nc_sid=2d5d41&_nc_ohc=ILr3xFsJBtMAX9ODonD&_nc_ht=scontent-atl3-1.xx&tp=14&oh=697e05d4bfbe186a590a8eace5a2ad2d&oe=5F8259C0,11.0,https://hubs.ly/H0k6M8x0,3438933546132043,"Do you know someone who loves to work on cars? We have the perfect #invention for them! For a birthday, a anniversary, or just because this is a must have!Don’t worry, after 26 years of being on the market, this item has a great record! Available on #Amazon https://hubs.ly/H0k6M8x0",,,0.0,"Do you know someone who loves to work on cars? We have the perfect #invention for them! For a birthday, a anniversary, or just because this is a must have!Don’t worry, after 26 years of being on the market, this item has a great record! Available on #Amazon https://hubs.ly/H0k6M8x0",2019-08-06 11:09:30,,
48,0.0,,8.0,,3436078636417534,"Since it’s #NationalFarmersWeek 🌽 we wanted to showcase an invention that revolutionized the way round bales are wrapped.

#farmlife #farmers #hardworking #crops #innovation #invention #tractor #johndeere #international #hayseason",,,0.0,"Since it’s #NationalFarmersWeek 🌽 we wanted to showcase an invention that revolutionized the way round bales are wrapped.

#farmlife #farmers #hardworking #crops #innovation #invention #tractor #johndeere #international #hayseason",2019-08-05 10:30:40,https://video-atl3-1.xx.fbcdn.net/v/t42.9040-2/68872678_2404497523168636_6975238025001304064_n.mp4?_nc_cat=105&_nc_sid=985c63&efg=eyJ2ZW5jb2RlX3RhZyI6InN2ZV9zZCJ9&_nc_ohc=giQaujwZg7oAX9LDJjx&_nc_ht=video-atl3-1.xx&oh=da5e4c40ee857815f1ab45560ec9a393&oe=5F5E1B7A,
49,0.0,,7.0,,3428144170544314,⚡Flashback Friday⚡ In May of 2011 Huggs Pet Products created three hydrating chew toys with the Creationeers at Davison. This product line became a big hit at the Global Pet Expo in Orlando. Check out this #flashback commercial of the Hydro Bone!,,,0.0,⚡Flashback Friday⚡ In May of 2011 Huggs Pet Products created three hydrating chew toys with the Creationeers at Davison. This product line became a big hit at the Global Pet Expo in Orlando. Check out this #flashback commercial of the Hydro Bone!,2019-08-02 11:31:10,https://video-atl3-1.xx.fbcdn.net/v/t42.9040-2/68759557_343621463251771_2607345762022981632_n.mp4?_nc_cat=109&_nc_sid=985c63&efg=eyJ2ZW5jb2RlX3RhZyI6InN2ZV9zZCJ9&_nc_ohc=nMrKq8LnvzAAX9XCi0U&_nc_ht=video-atl3-1.xx&oh=3848d30d87acf90b6ecba8560a90145d&oe=5F5E2036,
50,0.0,https://scontent-atl3-1.xx.fbcdn.net/v/t1.0-9/fr/cp0/e15/q65/68257411_3419617698063628_4043455677593550848_o.jpg?_nc_cat=107&_nc_sid=2d5d41&_nc_ohc=nNJHoMUYf7kAX86Xq3t&_nc_ht=scontent-atl3-1.xx&tp=14&oh=27f21ab28e18306ad54508ece663e0e8&oe=5F8363DA,4.0,https://hubs.ly/H0jlS4n0,3419617688063629,"Who remembers seeing these growing up? This was definitely something that has continued to grow and expand over the years! From a basic firework with gunpowder to the first one with the color orange, they have changed over the years. If you have an idea for something that could impact future generations, submit it by clicking the link below, we would love to talk with you about your idea! https://hubs.ly/H0jlS4n0",,,0.0,"Who remembers seeing these growing up? This was definitely something that has continued to grow and expand over the years! From a basic firework with gunpowder to the first one with the color orange, they have changed over the years. If you have an idea for something that could impact future generations, submit it by clicking the link below, we would love to talk with you about your idea! https://hubs.ly/H0jlS4n0",2019-07-30 09:04:06,,
51,19.0,https://scontent-atl3-1.xx.fbcdn.net/v/t1.0-9/fr/cp0/e15/q65/67802276_3416822541676477_4170707234927411200_n.jpg?_nc_cat=109&_nc_sid=8024bb&_nc_ohc=FK2RC5LG8cgAX9mRbsZ&_nc_ht=scontent-atl3-1.xx&tp=14&oh=4c4f419bc6bff6af75cb6ad05d205ece&oe=5F842534,23.0,https://bit.ly/2YzW13L,3416847198340678,"Some inventions change drastically before they hit the market, while others change after they are on the market for years! Our newest blog talks about some of the inventions that have changed the most since being on the market! Check it out at http://bit.ly/2YzW13L",https://facebook.com/story.php?story_fbid=3416847198340678&id=261238053901624,,0.0,"Some inventions change drastically before they hit the market, while others change after they are on the market for years! Our newest blog talks about some of the inventions that have changed the most since being on the market! Check it out at http://bit.ly/2YzW13L",2019-07-29 08:35:27,,
52,0.0,,4.0,https://hubs.ly/H0jJCFc0,3403381516353913,"Don't sweat it out, join the inventing heatwave this summer! Submit your idea at https://hubs.ly/H0jJCFc0",,,0.0,"Don't sweat it out, join the inventing heatwave this summer! Submit your idea at https://hubs.ly/H0jJCFc0",2019-07-24 09:00:21,,
53,0.0,https://scontent-atl3-1.xx.fbcdn.net/v/t1.0-9/fr/cp0/e15/q65/67664283_3401811403177591_7163213144226004992_o.jpg?_nc_cat=102&_nc_sid=2d5d41&_nc_ohc=JEUz2HA1YccAX_0B0Zo&_nc_ht=scontent-atl3-1.xx&tp=14&oh=8f906ff9da9edc624f832a418e0242fe&oe=5F8540D1,2.0,https://hubs.ly/H0jWXCl0,3401811393177592,"In less than 30 days on the market, this NEW product has transformed & organized 100's of spaces! Check it out here: https://hubs.ly/H0jWXCl0",,,0.0,"In less than 30 days on the market, this NEW product has transformed & organized 100's of spaces! Check it out here: https://hubs.ly/H0jWXCl0",2019-07-23 19:09:30,,
54,0.0,https://scontent-atl3-1.xx.fbcdn.net/v/t1.0-9/fr/cp0/e15/q65/67122971_3397628180262580_4137153520186949632_o.jpg?_nc_cat=103&_nc_sid=2d5d41&_nc_ohc=Z3YJYp0Gsk0AX_WpDPV&_nc_ht=scontent-atl3-1.xx&tp=14&oh=52d4868753c1187599ee0bfcdba9ff85&oe=5F84A7AE,7.0,,3397628173595914,Goals help us achieve the things we want each and everyday. From getting a chore done in the house to saving up for a vacation. Pick a goal today that you have been struggling to set and set your plan!,,,0.0,Goals help us achieve the things we want each and everyday. From getting a chore done in the house to saving up for a vacation. Pick a goal today that you have been struggling to set and set your plan!,2019-07-22 09:04:26,,
55,0.0,https://scontent-atl3-1.xx.fbcdn.net/v/t1.0-9/fr/cp0/e15/q65/67370249_3389839491041449_7472510274835054592_n.jpg?_nc_cat=108&_nc_sid=2d5d41&_nc_ohc=xPP8CtY9e94AX-Kzhwg&_nc_ht=scontent-atl3-1.xx&tp=14&oh=8bf5cadfc3c06b575be9e11a9442bca0&oe=5F81E6D2,7.0,,3389839487708116,"⚡Flashback Friday⚡ Being that its peak grilling season, we couldn’t find a better #FBF to talk about than the Fill N’ Grill stuffed burger maker. This product was a corporate product, we worked with Xtraordinary Home Products and it became a huge success on QVC! It sold over 2,000 units in just 3 minutes.",,,0.0,"⚡Flashback Friday⚡ Being that its peak grilling season, we couldn’t find a better #FBF to talk about than the Fill N’ Grill stuffed burger maker. This product was a corporate product, we worked with Xtraordinary Home Products and it became a huge success on QVC! It sold over 2,000 units in just 3 minutes.",2019-07-19 11:08:17,,
56,0.0,https://scontent-atl3-1.xx.fbcdn.net/v/t1.0-9/fr/cp0/e15/q65/67330366_3388200264538705_8028269512405024768_n.jpg?_nc_cat=108&_nc_sid=2d5d41&_nc_ohc=7tkBz2bskosAX_5XTfx&_nc_ht=scontent-atl3-1.xx&tp=14&oh=c75b67db29e136aebd8eafe704c10496&oe=5F819E63,5.0,https://hubs.ly/H0jSlRn0,3388200257872039,"At Davison we are firm believers in celebrating all wins, big or small! This time the excitement is around one of our own Amazon items! The Tumbler Organizer, has had over 123 orders and we couldn’t be more excited for our team! Let’s talk about your idea today at https://hubs.ly/H0jSlRn0.",,,0.0,"At Davison we are firm believers in celebrating all wins, big or small! This time the excitement is around one of our own Amazon items! The Tumbler Organizer, has had over 123 orders and we couldn’t be more excited for our team! Let’s talk about your idea today at https://hubs.ly/H0jSlRn0.",2019-07-18 20:05:20,,
57,1.0,,8.0,,3387374201287978,"#regram Our friends at @polygonlights have came up with a super #innovative way to create #bridgelighting within the home! This is one way to bring #innovation into the home and office! .
.
.
#new #lighting #home #fixtures #wow #shop #smallbusiness #diy #gadget #fixture #diyhome #room #ideas #newproduct",,,0.0,"#regram Our friends at @polygonlights have came up with a super #innovative way to create #bridgelighting within the home! This is one way to bring #innovation into the home and office! .
.
.
#new #lighting #home #fixtures #wow #shop #smallbusiness #diy #gadget #fixture #diyhome #room #ideas #newproduct",2019-07-18 12:52:11,https://video-atl3-1.xx.fbcdn.net/v/t42.9040-2/67640454_2493022264264256_3422225277118316544_n.mp4?_nc_cat=101&_nc_sid=985c63&efg=eyJ2ZW5jb2RlX3RhZyI6InN2ZV9zZCJ9&_nc_ohc=SB6ZEeaRVjAAX8AaX0c&_nc_ht=video-atl3-1.xx&oh=368f309beaf00733ef7b6d1a09fa6b52&oe=5F5E221F,
58,0.0,https://scontent-atl3-1.xx.fbcdn.net/v/t1.0-9/fr/cp0/e15/q65/67598821_3387129997979065_8424388663873372160_o.jpg?_nc_cat=108&_nc_sid=2d5d41&_nc_ohc=mS5zeRETPlgAX_bkR3j&_nc_ht=scontent-atl3-1.xx&tp=14&oh=d2a5b5776dcc6ada262dcdc77060596d&oe=5F843BD2,6.0,https://hubs.ly/H0hLvhw0,3387129994645732,"Farmers know how important the plow is, and so do everyday gardeners. We enjoy getting to watch ideas grow! Let's talk about your idea today! Submit your idea at https://hubs.ly/H0hLvhw0 .",,,0.0,"Farmers know how important the plow is, and so do everyday gardeners. We enjoy getting to watch ideas grow! Let's talk about your idea today! Submit your idea at https://hubs.ly/H0hLvhw0 .",2019-07-18 11:05:28,,
59,2.0,https://scontent-atl3-1.xx.fbcdn.net/v/t1.0-9/fr/cp0/e15/q65/67057200_3384035344955197_6956723434600529920_o.jpg?_nc_cat=102&_nc_sid=2d5d41&_nc_ohc=xW76BH84wCAAX-xFv_U&_nc_ht=scontent-atl3-1.xx&tp=14&oh=d5d5c338de7286383404b3d70fa68dc6&oe=5F82C6D3,3.0,,3384035334955198,"The emoji has been an advancement into the tech world that has changed the way that we communicate with each other. From the winky face to a t-rex, there isn’t much left that we can’t say with emojis. On this World Emoji Day comment with your favorite emojis, ours are in the comments!",,,0.0,"The emoji has been an advancement into the tech world that has changed the way that we communicate with each other. From the winky face to a t-rex, there isn’t much left that we can’t say with emojis. On this World Emoji Day comment with your favorite emojis, ours are in the comments!",2019-07-17 09:01:46,,
60,0.0,https://scontent-atl3-1.xx.fbcdn.net/v/t1.0-9/fr/cp0/e15/q65/66649090_3381423158549749_6274789065875259392_o.jpg?_nc_cat=107&_nc_sid=8024bb&_nc_ohc=P7mSd4STyyAAX9HJgPB&_nc_ht=scontent-atl3-1.xx&tp=14&oh=ff8335f4034bd616c952c50adc186a34&oe=5F83F9C8,7.0,https://amzn.to/2x8dgK4,3381445235214208,"As Prime Day comes to a close tonight, don't be left without your favorite Davison designed products! Here are the links to these great products!
OTLOTE:https://amzn.to/2x8dgK4
Tumbler Organizer: https://amzn.to/2IuNrdA
TaterGator: https://amzn.to/2YXbYOi",https://facebook.com/story.php?story_fbid=3381445235214208&id=261238053901624,,0.0,"As Prime Day comes to a close tonight, don't be left without your favorite Davison designed products! Here are the links to these great products!
OTLOTE:https://amzn.to/2x8dgK4
Tumbler Organizer: https://amzn.to/2IuNrdA
TaterGator: https://amzn.to/2YXbYOi",2019-07-16 10:35:26,,
