,comments,image,likes,link,post_id,post_text,post_url,shared_text,shares,text,time,video,video_thumbnail
0,1.0,https://scontent-atl3-1.xx.fbcdn.net/v/t1.0-9/fr/cp0/e15/q65/117715009_4838432346182149_4435967020099009371_o.jpg?_nc_cat=103&_nc_sid=8024bb&_nc_ohc=PeO64BFc0O0AX-TzKgC&_nc_ht=scontent-atl3-1.xx&tp=14&oh=3c9cabfbdc7c3f5d3569db4015d2e2d8&oe=5F82D3CC,4.0,http://TheTickBand.com/,4838438466181537,"What a great day to be outside! Don't forget to check out one of our newest products!

Go to TheTickBand.com

#sundayfunday",https://facebook.com/story.php?story_fbid=4838438466181537&id=261238053901624,,0.0,"What a great day to be outside! Don't forget to check out one of our newest products!

Go to TheTickBand.com

#sundayfunday",2020-08-16 12:13:56,,
1,0.0,,5.0,,4833991159959601,HAPPY #SATURDAY !,https://facebook.com/story.php?story_fbid=4833991159959601&id=261238053901624,,0.0,HAPPY #SATURDAY !,2020-08-15 14:29:48,,
2,5.0,https://scontent-atl3-1.xx.fbcdn.net/v/t1.0-9/117261000_4814948471863870_1158553418406248979_o.png?_nc_cat=104&_nc_sid=8024bb&_nc_ohc=yDT4i_nNqnUAX8wfdsI&_nc_ht=scontent-atl3-1.xx&oh=854aada12c7e0b82f5ee9234fa5995b2&oe=5F8206CF,7.0,http://www.davison.com/,4814949375197113,"Do these personality traits hit close to home for you?
Are you ready to #challengeyourself?
If so, #INVENT!
www.davison.com",https://facebook.com/story.php?story_fbid=4814949375197113&id=261238053901624,,0.0,"Do these personality traits hit close to home for you?
Are you ready to #challengeyourself?
If so, #INVENT!
www.davison.com",2020-08-11 15:58:09,,
3,8.0,https://scontent-atl3-1.xx.fbcdn.net/v/t1.0-9/fr/cp0/e15/q65/115811948_4730167323675319_2347057301123550385_n.jpg?_nc_cat=109&_nc_sid=110474&_nc_ohc=bt6sVRRoJ3oAX89W5ZV&_nc_ht=scontent-atl3-1.xx&tp=14&oh=58b2676ee0f576cc6b79f8b721dce190&oe=5F847A8E,466.0,,4730214760337242,"Remember, there is no uniform for ￼creativity & hard work. Live limitless!",https://facebook.com/story.php?story_fbid=4730214760337242&id=261238053901624,,0.0,"Remember, there is no uniform for ￼creativity & hard work. Live limitless!",2020-07-25 00:43:34,,
4,1.0,https://scontent-atl3-1.xx.fbcdn.net/v/t1.0-9/fr/cp0/e15/q65/107832971_4690225154336203_4081139823970474300_o.jpg?_nc_cat=103&_nc_sid=8024bb&_nc_ohc=YhsWYsuFqgEAX8P75QH&_nc_ht=scontent-atl3-1.xx&tp=14&oh=9c1a7acfcfd9f7ebda7ac59dc0ccf019&oe=5F8451B8,92.0,,4690334050991980,"This Week's Thursday Thoughts From Clients,
is brought to you by inventor Kenneth D.

Kenneth, thank you for sharing your thoughts on the experience you had with Scott, a valuable member of the Davison team!

We wish you all the best, as you travel on your inventor's journey with the Davison team!",https://facebook.com/story.php?story_fbid=4690334050991980&id=261238053901624,,0.0,"This Week's Thursday Thoughts From Clients,
is brought to you by inventor Kenneth D.

Kenneth, thank you for sharing your thoughts on the experience you had with Scott, a valuable member of the Davison team!

We wish you all the best, as you travel on your inventor's journey with the Davison team!",2020-07-16 12:02:38,,
5,11.0,,18.0,http://Shop.davison.com/,3825057114186349,"Vision, innovation, imagination, resourcefulness and heart.... does that describe anyone you know?

Showcase your creativity today. Inspire yourself and/or the people around you.

#dareyou #creative

Check out products created by idea people like you!
Shop.davison.com",,,0.0,"Vision, innovation, imagination, resourcefulness and heart.... does that describe anyone you know?

Showcase your creativity today. Inspire yourself and/or the people around you.

#dareyou #creative

Check out products created by idea people like you!
Shop.davison.com",2019-12-06 12:17:00,https://video-atl3-1.xx.fbcdn.net/v/t42.9040-2/80190453_733398397171750_743983778430451712_n.mp4?_nc_cat=107&_nc_sid=985c63&efg=eyJ2ZW5jb2RlX3RhZyI6InN2ZV9zZCJ9&_nc_ohc=BX5fzXlXpT8AX_3Op3B&_nc_ht=video-atl3-1.xx&oh=e5a62cac27eb5dacb1a44bc722e25c96&oe=5F5E1EC3,
6,15.0,,13.0,,3694813483877380,"Happy Halloween from all of your friends at Davison! Check out this Ideation sketch @linds.huss did! She brought the spooky to the office!
#ideation #adobe #idea #design #innovation #create #creative #halloween #spooky #ghost #davison #abetterwaytoinvent",,,0.0,"Happy Halloween from all of your friends at Davison! Check out this Ideation sketch @linds.huss did! She brought the spooky to the office!
#ideation #adobe #idea #design #innovation #create #creative #halloween #spooky #ghost #davison #abetterwaytoinvent",2019-10-31 06:41:26,https://video-atl3-1.xx.fbcdn.net/v/t42.9040-2/75626164_722958464851426_8625287966756962304_n.mp4?_nc_cat=105&_nc_sid=985c63&efg=eyJ2ZW5jb2RlX3RhZyI6InN2ZV9zZCJ9&_nc_ohc=Pu5-izSXRxIAX8Neh9I&_nc_ht=video-atl3-1.xx&oh=bbdb83ec7c9f05ef1c952f84b4411810&oe=5F5E1537,
7,11.0,https://scontent-atl3-1.xx.fbcdn.net/v/t1.0-9/fr/cp0/e15/q65/73055191_3662185140473548_4479775229031219200_o.jpg?_nc_cat=105&_nc_sid=2d5d41&_nc_ohc=4iBu15ym2wgAX9x21Te&_nc_ht=scontent-atl3-1.xx&tp=14&oh=000809837da744c53eedafed966228c6&oe=5F83E698,18.0,,3662185133806882,"We love getting to see a product that Davison was a part of being used by customers! Davison helped design the packaging for our friends at @jokari_inc ! If you are enjoying it be sure to check out the new version coming soon!
Regram:@organiseme101
#design #kitchengadget #innovation #kitchentools #pghbased #cooking #cookingtools #coolkitchengadgets",,,0.0,"We love getting to see a product that Davison was a part of being used by customers! Davison helped design the packaging for our friends at @jokari_inc ! If you are enjoying it be sure to check out the new version coming soon!
Regram:@organiseme101
#design #kitchengadget #innovation #kitchentools #pghbased #cooking #cookingtools #coolkitchengadgets",2019-10-21 11:57:30,,
8,5.0,,11.0,,3638907839467945,"With #fall officially here, we couldn’t help but ask our design department to do a fall themed design for us! They made sure to bring the pumpkin 🎃 patch to the office!
#design #thinking #ideas #creative #adobe #graphicdesigner #thoughts #diy #innovation #licensing #invention #inspire #startup #art #architecture #ideation",,,0.0,"With #fall officially here, we couldn’t help but ask our design department to do a fall themed design for us! They made sure to bring the pumpkin 🎃 patch to the office!
#design #thinking #ideas #creative #adobe #graphicdesigner #thoughts #diy #innovation #licensing #invention #inspire #startup #art #architecture #ideation",2019-10-14 10:07:35,https://video-atl3-1.xx.fbcdn.net/v/t42.9040-2/73235154_517262569057639_768994231988518912_n.mp4?_nc_cat=106&_nc_sid=985c63&efg=eyJ2ZW5jb2RlX3RhZyI6InN2ZV9zZCJ9&_nc_ohc=DtifqRDjZBYAX-9jLqt&_nc_oc=AQmZkkMpYAkOaCy0m9cdREhvGos4NsJOR4sGVAccxf1VVd5heWeuj9Xc5YRzodcax10&_nc_ht=video-atl3-1.xx&oh=907a986c466751afc2ba000e58565cb7&oe=5F5E219B,
9,0.0,,10.0,,3623540307671365,"We know that inspiration comes from all aspects of life. With Fall upon us in Pittsburgh, many of us are decorating pumpkins. This video from Garden Answer is sure to inspire all your pumpkin decorating needs.
#fall #pumpkins #decorating",,,0.0,"We know that inspiration comes from all aspects of life. With Fall upon us in Pittsburgh, many of us are decorating pumpkins. This video from Garden Answer is sure to inspire all your pumpkin decorating needs.
#fall #pumpkins #decorating",2019-10-09 15:58:03,https://video-atl3-1.xx.fbcdn.net/v/t42.9040-2/72777727_394789244536509_5733632004147118080_n.mp4?_nc_cat=107&_nc_sid=985c63&efg=eyJ2ZW5jb2RlX3RhZyI6InN2ZV9zZCJ9&_nc_ohc=nRAo-CVqxrEAX_vk67I&_nc_ht=video-atl3-1.xx&oh=ca040225f6cdb163be99e013a0e11f18&oe=5F5E1B48,
10,0.0,,13.0,,3607169069308489,"Yesterday we had an exciting day at our factory! We started decorating for our favorite holiday, #Halloween! Check out these snapshots! Can you spot our founder helping out?
#Create #Innovation #Idea #Davison #ABetterWayToInvent #MakingAHauntedHouse #Spooky",,,0.0,"Yesterday we had an exciting day at our factory! We started decorating for our favorite holiday, #Halloween! Check out these snapshots! Can you spot our founder helping out?
#Create #Innovation #Idea #Davison #ABetterWayToInvent #MakingAHauntedHouse #Spooky",2019-10-04 11:12:42,https://video-atl3-1.xx.fbcdn.net/v/t42.9040-2/72531827_501336413755903_6792355611708227584_n.mp4?_nc_cat=100&_nc_sid=985c63&efg=eyJ2ZW5jb2RlX3RhZyI6InN2ZV9zZCJ9&_nc_ohc=wak3JDZpdQ8AX_1a6s7&_nc_ht=video-atl3-1.xx&oh=1cb7185ae5df4dfea12016e0d74611ec&oe=5F5E1F3D,
11,7.0,,15.0,https://birdeye.com/davison-153936964597727/review/2000953964133921930,3601419369883459,"""Davidson corporation, is a honest ,They try not to give you misinformation,

They patiently work with Disabled veterans.

They do have a lot of information that they don't share , You just have to ask the right questions.

I find them Intellectually knowledgeable.
New Ideas and unique strategy. Creative people of the world.
Is back bout backbone of inventors such as myself.

Of course it is a business a.."" says Robert on Google",https://facebook.com/story.php?story_fbid=3601419369883459&id=261238053901624,"BIRDEYE.COM
Davison | Pittsburgh, PA",3.0,"""Davidson corporation, is a honest ,They try not to give you misinformation,

They patiently work with Disabled veterans.

They do have a lot of information that they don't share , You just have to ask the right questions.

I find them Intellectually knowledgeable.
New Ideas and unique strategy. Creative people of the world.
Is back bout backbone of inventors such as myself.

Of course it is a business a.."" says Robert on Google

BIRDEYE.COM
Davison | Pittsburgh, PA",2019-10-02 13:17:15,,
12,17.0,,26.0,,3594979953860734,"On this #innovative Monday we are excited to #ProductSpotlight this @haven_lock ! Safety has become something that many individuals and families worry about, and this innovative lock helps to ease those worries! Check it out!
#products #newproducts #innovation #ideas #sharktank #inspiration #design #tech #safety #homeproducts #safehome #davison #abetterwaytoinvent",,,0.0,"On this #innovative Monday we are excited to #ProductSpotlight this @haven_lock ! Safety has become something that many individuals and families worry about, and this innovative lock helps to ease those worries! Check it out!
#products #newproducts #innovation #ideas #sharktank #inspiration #design #tech #safety #homeproducts #safehome #davison #abetterwaytoinvent",2019-09-30 08:50:26,https://video-atl3-1.xx.fbcdn.net/v/t42.9040-2/72271791_510795996374857_3222770139808137216_n.mp4?_nc_cat=106&_nc_sid=985c63&efg=eyJ2ZW5jb2RlX3RhZyI6InN2ZV9zZCJ9&_nc_ohc=Fl4_-9jxN8wAX-guIVq&_nc_ht=video-atl3-1.xx&oh=46ed1616ffb9cb7cfdb722a81c1e7691&oe=5F5E2013,
13,1.0,https://scontent-atl3-1.xx.fbcdn.net/v/t1.0-9/fr/cp0/e15/q65/71576321_3585977994760930_7963747855099756544_o.jpg?_nc_cat=102&_nc_sid=2d5d41&_nc_ohc=EBwiz81670kAX_oUuVg&_nc_ht=scontent-atl3-1.xx&tp=14&oh=fa6b9c5056be0a9b8094df04d362b063&oe=5F827192,13.0,,3585977988094264,"⚡Flashback Friday⚡ In April of 2013, we opened our office in South Florida.",,,0.0,"⚡Flashback Friday⚡ In April of 2013, we opened our office in South Florida.",2019-09-27 09:03:31,,
14,0.0,,9.0,https://hubs.ly/H0kXCwK0,3579957238696339,"Did you know that our founder loves to create assets to help young people learn the creative way of life? Insert the Inventsons! A grandfather and his three grandkids own an amusement park known as Inventionland, where they are up against their arch-nemesis Balzer, who has his own amusement park!
#NationalComicBookDay
Grab your copy today at https://hubs.ly/H0kXCwK0",,,0.0,"Did you know that our founder loves to create assets to help young people learn the creative way of life? Insert the Inventsons! A grandfather and his three grandkids own an amusement park known as Inventionland, where they are up against their arch-nemesis Balzer, who has his own amusement park!
#NationalComicBookDay
Grab your copy today at https://hubs.ly/H0kXCwK0",2019-09-25 09:09:44,,
15,1.0,https://scontent-atl3-1.xx.fbcdn.net/v/t1.0-9/fr/cp0/e15/q65/70742930_3574998322525564_6316954267353612288_o.jpg?_nc_cat=110&_nc_sid=8024bb&_nc_ohc=qZQOdB1KySoAX-5KwL0&_nc_ht=scontent-atl3-1.xx&tp=14&oh=d1edd54b0a5e04f3149bb90da54e03bd&oe=5F8574DF,7.0,,3574999955858734,"With the first day of fall upon us, its a great time to start a new tradition or participate in one that you have had a long time. Did you know that inventing can be a tradition? What is one tradition you have invented with your family?",https://facebook.com/story.php?story_fbid=3574999955858734&id=261238053901624,,0.0,"With the first day of fall upon us, its a great time to start a new tradition or participate in one that you have had a long time. Did you know that inventing can be a tradition? What is one tradition you have invented with your family?",2019-09-23 15:48:05,,
16,1.0,https://scontent-atl3-1.xx.fbcdn.net/v/t1.0-9/fr/cp0/e15/q65/70578070_3573740092651387_7324247947942559744_o.jpg?_nc_cat=110&_nc_sid=2d5d41&_nc_ohc=LSIgmQl0j00AX9kjf3U&_nc_ht=scontent-atl3-1.xx&tp=14&oh=5fa70a8a1f22b02c24417943cde8b86d&oe=5F829064,9.0,,3573740085984721,"Today, take a moment to look at one item and think about where that idea started and where it has evolved to. What about where it’s going to evolve to?",,,0.0,"Today, take a moment to look at one item and think about where that idea started and where it has evolved to. What about where it’s going to evolve to?",2019-09-23 07:05:17,,
17,2.0,https://scontent-atl3-1.xx.fbcdn.net/v/t1.0-9/fr/cp0/e15/q65/71135474_3565034503521946_5975246969931563008_o.jpg?_nc_cat=105&_nc_sid=2d5d41&_nc_ohc=IaLj-t4NpdsAX_3SLWn&_nc_ht=scontent-atl3-1.xx&tp=14&oh=a678ff475412d16853f1fb96f18da74b&oe=5F83B25A,7.0,,3565034496855280,"⚡Flashback Friday⚡ In September of 2012, we launched our Pinterest! Today, you can find inspiration on some of our favorite products as well as seasonal inspiration on our board!",,,0.0,"⚡Flashback Friday⚡ In September of 2012, we launched our Pinterest! Today, you can find inspiration on some of our favorite products as well as seasonal inspiration on our board!",2019-09-20 09:06:06,,
18,0.0,https://scontent-atl3-1.xx.fbcdn.net/v/t1.0-9/fr/cp0/e15/q65/70480548_3561991700492893_3841165754493829120_o.jpg?_nc_cat=110&_nc_sid=2d5d41&_nc_ohc=TkQM1XCYdc0AX_X2rXN&_nc_ht=scontent-atl3-1.xx&tp=14&oh=ff6578821c44659e0daace87dbe7251a&oe=5F851C2F,9.0,https://hubs.ly/H0kxbs_0,3561991680492895,"If you cook regularly and have a busy schedule, we know you have used seasoning packets at some point, and probably have a Tupperware container full of them sitting in your cabinet taking up space. Well look through that container no more, we have a solution to get that cabinet space back. The Packet Rack! https://hubs.ly/H0kxbs_0",,,0.0,"If you cook regularly and have a busy schedule, we know you have used seasoning packets at some point, and probably have a Tupperware container full of them sitting in your cabinet taking up space. Well look through that container no more, we have a solution to get that cabinet space back. The Packet Rack! https://hubs.ly/H0kxbs_0",2019-09-19 09:04:32,,
19,1.0,,5.0,,3557016717657058,"Our Ideation team is at it again! This time they are racing to fall. Check out some of these fallen 🍂!
#itsfallyall #ideation #adobe #innovation #ideas #diy #creative #fall #leaves #create #idea",,,0.0,"Our Ideation team is at it again! This time they are racing to fall. Check out some of these fallen 🍂!
#itsfallyall #ideation #adobe #innovation #ideas #diy #creative #fall #leaves #create #idea",2019-09-17 15:40:15,https://video-atl3-1.xx.fbcdn.net/v/t42.9040-2/71645842_473501856878635_2708238993392140288_n.mp4?_nc_cat=107&_nc_sid=985c63&efg=eyJ2ZW5jb2RlX3RhZyI6InN2ZV9zZCJ9&_nc_ohc=cDyDzsWaIEwAX_lZoh-&_nc_ht=video-atl3-1.xx&oh=0b106f93120758a785ac3014ebe415e7&oe=5F5E1DCE,
20,1.0,https://scontent-atl3-1.xx.fbcdn.net/v/t1.0-9/fr/cp0/e15/q65/70027398_3544713732220690_7615763974075711488_o.jpg?_nc_cat=108&_nc_sid=2d5d41&_nc_ohc=3pLmMmm_KTEAX_wPWDm&_nc_ht=scontent-atl3-1.xx&tp=14&oh=499a3a81acee974add4e5095434b4457&oe=5F84CE3D,7.0,,3544713725554024,"⚡Flashback Friday⚡ In August of 2012, 4 of our products are featured on a variety of blogs. From the 6-in-1 Manicure Multitool to our Silicone Dog Treat Pan we took the blog world by storm!",,,0.0,"⚡Flashback Friday⚡ In August of 2012, 4 of our products are featured on a variety of blogs. From the 6-in-1 Manicure Multitool to our Silicone Dog Treat Pan we took the blog world by storm!",2019-09-13 09:09:17,,
21,1.0,,13.0,,3542157649142965,We are always talking about the evolution of how ideas evolve and this video sure reminds us of the old days.,,,0.0,We are always talking about the evolution of how ideas evolve and this video sure reminds us of the old days.,2019-09-12 11:07:19,https://video-atl3-1.xx.fbcdn.net/v/t42.9040-2/71091404_500149064134705_7534126064642031616_n.mp4?_nc_cat=101&_nc_sid=985c63&efg=eyJ2ZW5jb2RlX3RhZyI6InN2ZV9zZCJ9&_nc_ohc=wxMWbSThRxkAX8Mfe6h&_nc_ht=video-atl3-1.xx&oh=1ffbcc26257590e2553296b01fa75f6b&oe=5F5E2133,
22,0.0,https://scontent-atl3-1.xx.fbcdn.net/v/t1.0-9/fr/cp0/e15/q65/69627455_3541860299172700_4364968610020458496_o.jpg?_nc_cat=101&_nc_sid=2d5d41&_nc_ohc=l4EU_zF2D6oAX-p0Qte&_nc_ht=scontent-atl3-1.xx&tp=14&oh=0815866f2d77b402775185527ddb24e8&oe=5F81BA54,4.0,https://hubs.ly/H0kJft20,3541860292506034,"With school back in full swing we wanted to help families with school children add some organization to their hectic lifestyles. Our tumbler organizer is able to be used in many different ways. Check out how one person used their tumbler organizer to organize their school supplies! To add some organization into your life, grab yours at https://hubs.ly/H0kJft20.",,,0.0,"With school back in full swing we wanted to help families with school children add some organization to their hectic lifestyles. Our tumbler organizer is able to be used in many different ways. Check out how one person used their tumbler organizer to organize their school supplies! To add some organization into your life, grab yours at https://hubs.ly/H0kJft20.",2019-09-12 09:05:32,,
23,0.0,https://scontent-atl3-1.xx.fbcdn.net/v/t1.0-9/fr/cp0/e15/q65/70727457_3536311243060939_3225828555954847744_o.jpg?_nc_cat=101&_nc_sid=2d5d41&_nc_ohc=7EE7I0H_p-YAX-FveX5&_nc_ht=scontent-atl3-1.xx&tp=14&oh=4a1075c2e3ff6b8218731a6507de5a17&oe=5F837B6F,12.0,https://hubs.ly/H0kH5DH0,3536311229727607,"Today is a special day! One of the best days of the year! National Swap Ideas💡 Day, holds a special place in our hearts. From our brainstorming sessions with our clients to brainstorming with our teams, we love to talk about ideas! If you would love to talk about your idea today, head over to our idea security agreement and we’ll be sure to give you a call! https://hubs.ly/H0kH5DH0",,,0.0,"Today is a special day! One of the best days of the year! National Swap Ideas💡 Day, holds a special place in our hearts. From our brainstorming sessions with our clients to brainstorming with our teams, we love to talk about ideas! If you would love to talk about your idea today, head over to our idea security agreement and we’ll be sure to give you a call! https://hubs.ly/H0kH5DH0",2019-09-10 09:03:21,,
24,0.0,,5.0,,3533155750043155,"When was the last time you took an action to better improve your idea or invention? Today take 15 minutes today to work towards your idea, you will be glad you did.",,,0.0,"When was the last time you took an action to better improve your idea or invention? Today take 15 minutes today to work towards your idea, you will be glad you did.",2019-09-09 06:01:38,https://video-atl3-1.xx.fbcdn.net/v/t42.9040-2/71157145_1066205280390968_8090383604317683712_n.mp4?_nc_cat=102&_nc_sid=985c63&efg=eyJ2ZW5jb2RlX3RhZyI6InN2ZV9zZCJ9&_nc_ohc=fUZFACbDK98AX_0RO1Y&_nc_ht=video-atl3-1.xx&oh=93c9fa817f0e2366cd7aeb9cabb1bed5&oe=5F5E2250,
25,0.0,https://scontent-atl3-1.xx.fbcdn.net/v/t1.0-9/fr/cp0/e15/q65/70042852_3528001037225293_1269464660499759104_o.jpg?_nc_cat=100&_nc_sid=2d5d41&_nc_ohc=zCcUq-dhu6UAX-mKcGu&_nc_ht=scontent-atl3-1.xx&tp=14&oh=07e926c85f034a451df3cbb227c1c580&oe=5F844002,10.0,https://hubs.ly/H0kF0K30,3528001030558627,"When was the last time you were changing oil on your car and had the filter slip or you couldn’t get a great grip on it? No worries, for Davison’s 30th Anniversary we are bringing a blast from the past back to the market for a limited time. Grab yours today at https://hubs.ly/H0kF0K30.",,,0.0,"When was the last time you were changing oil on your car and had the filter slip or you couldn’t get a great grip on it? No worries, for Davison’s 30th Anniversary we are bringing a blast from the past back to the market for a limited time. Grab yours today at https://hubs.ly/H0kF0K30.",2019-09-07 11:04:41,,
26,0.0,https://scontent-atl3-1.xx.fbcdn.net/v/t1.0-9/70941594_3525173390841391_2485784396406194176_o.png?_nc_cat=101&_nc_sid=2d5d41&_nc_ohc=luVZBThW0fMAX9EuLqk&_nc_ht=scontent-atl3-1.xx&oh=e0c7fe3e2a6769f80976c45e982b8d5d&oe=5F83733B,7.0,https://hubs.ly/H0kDQRb0,3525173387508058,"Did you know that Davison’s founder George Davison, wrote a children's book about a cloud named Chipper that is bullied by a gloomy cloud named Stormy. Or how about a book about our factory? Inside the Inventionland book you can find out about each of our immersive work spaces and how our creationeers are inspired everyday. Check Chipper out at https://hubs.ly/H0kDQRb0 or our Factory’s picture book https://hubs.ly/H0kDQRc0 .",,,0.0,"Did you know that Davison’s founder George Davison, wrote a children's book about a cloud named Chipper that is bullied by a gloomy cloud named Stormy. Or how about a book about our factory? Inside the Inventionland book you can find out about each of our immersive work spaces and how our creationeers are inspired everyday. Check Chipper out at https://hubs.ly/H0kDQRb0 or our Factory’s picture book https://hubs.ly/H0kDQRc0 .",2019-09-06 11:17:10,,
27,1.0,,7.0,https://hubs.ly/H0kg27t0,3524807904211273,"⚡Flashback Friday⚡! This one is a big flashback! We launched our webisode series ""Dare to Invent"" in February 2012! The series was initially intended to only be 12 episodes, we are now up to 16 episodes with a few more coming down the pike! To check out our latest one head on over to our Youtube channel https://hubs.ly/H0kg27t0 .",,,0.0,"⚡Flashback Friday⚡! This one is a big flashback! We launched our webisode series ""Dare to Invent"" in February 2012! The series was initially intended to only be 12 episodes, we are now up to 16 episodes with a few more coming down the pike! To check out our latest one head on over to our Youtube channel https://hubs.ly/H0kg27t0 .",2019-09-06 09:02:30,https://video-atl3-1.xx.fbcdn.net/v/t42.9040-2/70835425_457394408185953_1821495913701441536_n.mp4?_nc_cat=102&_nc_sid=985c63&efg=eyJ2ZW5jb2RlX3RhZyI6InN2ZV9zZCJ9&_nc_ohc=G_5Xhy4-mIMAX9uKFL4&_nc_oc=AQni8LRUlWaUqiujQAHMX6zKuIdiIiDqEwrsqKZuhXvgmgPYllLGPFVSOa2kFd2uP48&_nc_ht=video-atl3-1.xx&oh=a020fed3b02ef7eb188735b51abc125d&oe=5F5E196E,
28,1.0,,5.0,https://hubs.ly/H0kz7sb0,3521935821165148,When you are working on a project and you get stuck to the point where you have to take a brain break it is sometimes good to look at nature. We have created a notebook to help you work through your ideas and from the first thought until its ready to be submitted. Download it here! https://hubs.ly/H0kz7sb0,,,0.0,When you are working on a project and you get stuck to the point where you have to take a brain break it is sometimes good to look at nature. We have created a notebook to help you work through your ideas and from the first thought until its ready to be submitted. Download it here! https://hubs.ly/H0kz7sb0,2019-09-05 09:10:39,https://video-atl3-1.xx.fbcdn.net/v/t42.9040-2/70583261_692141127921372_3374957280830160896_n.mp4?_nc_cat=108&_nc_sid=985c63&efg=eyJ2ZW5jb2RlX3RhZyI6InN2ZV9zZCJ9&_nc_ohc=HMDp_1bFjvMAX_pecQb&_nc_ht=video-atl3-1.xx&oh=5d990ba5439de20127ee3ef3a7f3e906&oe=5F5E15AA,
29,0.0,https://scontent-atl3-1.xx.fbcdn.net/v/t1.0-9/fr/cp0/e15/q65/70375244_3519103421448388_3475039304546254848_o.jpg?_nc_cat=102&_nc_sid=2d5d41&_nc_ohc=1UFjJgqXSksAX9cOKAI&_nc_ht=scontent-atl3-1.xx&tp=14&oh=239773636730648af7fdb153ab13ccd4&oe=5F81F919,7.0,https://hubs.ly/H0kxc-V0,3519103411448389,"As fall approaches many people like to do a few projects around the house to make sure their winter goes smoothly. Did you know that an easy project is changing out the bolt caps on your toilet? We have all been there you are cleaning around the toilet and the bolt cap pops off and rolls somewhere under the vanity. Well never fear, these easy to install caps are a great addition to every bathroom! Grab a pair or two at https://hubs.ly/H0kxc-V0 .",,,0.0,"As fall approaches many people like to do a few projects around the house to make sure their winter goes smoothly. Did you know that an easy project is changing out the bolt caps on your toilet? We have all been there you are cleaning around the toilet and the bolt cap pops off and rolls somewhere under the vanity. Well never fear, these easy to install caps are a great addition to every bathroom! Grab a pair or two at https://hubs.ly/H0kxc-V0 .",2019-09-04 09:09:12,,
