,comments,image,likes,link,post_id,post_text,post_url,shared_text,shares,text,time,video,video_thumbnail
61,2.0,https://scontent-atl3-1.xx.fbcdn.net/v/t1.0-9/fr/cp0/e15/q65/66617691_3381236258568439_4383414188886720512_o.jpg?_nc_cat=105&_nc_sid=2d5d41&_nc_ohc=ieSvurutBoAAX8Hjkyh&_nc_ht=scontent-atl3-1.xx&tp=14&oh=9370d25a1fef774f5765341af1e5cfef&oe=5F841E23,6.0,https://hubs.ly/H0jlRTk0,3381236251901773,"Have you been doing a task this week that you said to yourself “man I wish I had an item to make this easier?”. Chances are, if you did, you’re an innovator! We created a fun quiz to help you identify with your inventor personality! Take it today by clicking https://hubs.ly/H0jlRTk0 .",,,0.0,"Have you been doing a task this week that you said to yourself “man I wish I had an item to make this easier?”. Chances are, if you did, you’re an innovator! We created a fun quiz to help you identify with your inventor personality! Take it today by clicking https://hubs.ly/H0jlRTk0 .",2019-07-16 09:09:58,,
62,0.0,https://scontent-atl3-1.xx.fbcdn.net/v/t1.0-9/fr/cp0/e15/q65/67191056_3378428085515923_4643051438740602880_o.jpg?_nc_cat=106&_nc_sid=2d5d41&_nc_ohc=VdTvLPlWVIcAX8c24pS&_nc_ht=scontent-atl3-1.xx&tp=14&oh=5f8235bf7e99bb4671c9a5715399b5f1&oe=5F82BD7A,1.0,https://hubs.ly/H0jCxkv0,3378428075515924,"When game night is as boring as watching paint dry, shake things up with this new Davison designed product, OTLOTE! Featuring customizable rules, this game is perfect for co-workers, family, friends, or grab a special partner and play one on one.
Buy now on Amazon Prime! https://hubs.ly/H0jCxkv0",,,0.0,"When game night is as boring as watching paint dry, shake things up with this new Davison designed product, OTLOTE! Featuring customizable rules, this game is perfect for co-workers, family, friends, or grab a special partner and play one on one.
Buy now on Amazon Prime! https://hubs.ly/H0jCxkv0",2019-07-15 09:07:29,,
63,0.0,,1.0,,3378292695529462,🎉IT’S PRIME DAY!!!🎉 We are so excited that #PrimeDay is here 😍! We are feeling like little kids at Christmas. What was the first thing you had to have in your cart this morning?,,,0.0,🎉IT’S PRIME DAY!!!🎉 We are so excited that #PrimeDay is here 😍! We are feeling like little kids at Christmas. What was the first thing you had to have in your cart this morning?,2019-07-15 08:07:04,https://video-atl3-1.xx.fbcdn.net/v/t42.9040-2/67452869_404083393540090_1678248132925718528_n.mp4?_nc_cat=102&_nc_sid=985c63&efg=eyJ2ZW5jb2RlX3RhZyI6InN2ZV9zZCJ9&_nc_ohc=N61HpdqGxoYAX9d_iih&_nc_ht=video-atl3-1.xx&oh=f6e6ded3eee186818011d583ea06c047&oe=5F5E1F5D,
64,0.0,https://scontent-atl3-1.xx.fbcdn.net/v/t1.0-9/66842710_3377033268988738_6898707639136419840_o.png?_nc_cat=110&_nc_sid=2d5d41&_nc_ohc=uwuKIIjS5A8AX-KgokP&_nc_ht=scontent-atl3-1.xx&oh=7379b56173400968476b6c74bd7409e1&oe=5F8399CA,3.0,,3377033258988739,"Set your alarm for tomorrow morning, Prime Day deals are the best deals of the year! Don't forget to add the Tumbler Organizer or OTLOTE to your cart when shopping!",,,0.0,"Set your alarm for tomorrow morning, Prime Day deals are the best deals of the year! Don't forget to add the Tumbler Organizer or OTLOTE to your cart when shopping!",2019-07-14 19:50:02,,
65,1.0,https://scontent-atl3-1.xx.fbcdn.net/v/t1.0-9/fr/cp0/e15/q65/66607062_3376350995723632_7152357880673337344_o.jpg?_nc_cat=105&_nc_sid=2d5d41&_nc_ohc=FfW4AOk8ZpgAX_SNgT1&_nc_ht=scontent-atl3-1.xx&tp=14&oh=3db7dd74effc83d28db04e8f42fe0084&oe=5F84DC36,7.0,,3376350992390299,Have you gotten your wish list ready for Prime Days starting tomorrow on Amazon? Make sure to include the newest Davison designed products before they are gone!,,,0.0,Have you gotten your wish list ready for Prime Days starting tomorrow on Amazon? Make sure to include the newest Davison designed products before they are gone!,2019-07-14 14:05:21,,
66,0.0,https://scontent-atl3-1.xx.fbcdn.net/v/t1.0-9/fr/cp0/e15/q65/66846567_3374704272554971_5817189420364726272_o.jpg?_nc_cat=111&_nc_sid=2d5d41&_nc_ohc=nRxy36-GUP8AX-2dGY9&_nc_ht=scontent-atl3-1.xx&tp=14&oh=0b85e3d2e23a03fc6811772fd4b39526&oe=5F849B03,3.0,,3374704265888305,Did you know that your favorite invention factory is a part of Amazon Prime Days? Make sure to add your favorite factory designed products to your cart before checking out!,,,0.0,Did you know that your favorite invention factory is a part of Amazon Prime Days? Make sure to add your favorite factory designed products to your cart before checking out!,2019-07-14 00:05:01,,
67,0.0,https://scontent-atl3-1.xx.fbcdn.net/v/t1.0-9/fr/cp0/e15/q65/66589736_3374135949278470_2706843064596430848_o.jpg?_nc_cat=107&_nc_sid=2d5d41&_nc_ohc=77t2w3eOxvwAX80wJTu&_nc_ht=scontent-atl3-1.xx&tp=14&oh=31060009b4f34a8c80b26e9e6c813bcf&oe=5F85018D,11.0,,3374135942611804,Did you hear👂 the news? Several great Davison designed products will be apart of Prime Day this Monday and Tuesday! Be sure check back Monday and Tuesday for the links!,,,0.0,Did you hear👂 the news? Several great Davison designed products will be apart of Prime Day this Monday and Tuesday! Be sure check back Monday and Tuesday for the links!,2019-07-13 18:41:21,,
68,0.0,,12.0,,3370998922925506,Congratulations to our Father's Day Grilling Gadget Giveaway Winner Amanda W.! Thank you to everyone who took the time to enter our giveaway and stay tuned for future contests and giveaways!,,,0.0,Congratulations to our Father's Day Grilling Gadget Giveaway Winner Amanda W.! Thank you to everyone who took the time to enter our giveaway and stay tuned for future contests and giveaways!,2019-07-12 15:09:01,,
69,0.0,https://scontent-atl3-1.xx.fbcdn.net/v/t1.0-9/fr/cp0/e15/q65/66425688_3370462422979156_5577768358234816512_n.jpg?_nc_cat=100&_nc_sid=2d5d41&_nc_ohc=Xne2_lS_1zQAX_MuzBc&_nc_ht=scontent-atl3-1.xx&tp=14&oh=ceacb35a297877ee0abff471f217e97e&oe=5F836256,5.0,,3370462416312490,"⚡Flashback Friday⚡ In the Spring of 2011, we debuted our Sweetheart Silicone Dessert Pan and Easter Egg Silicone Dessert Pan! Both pans have joined the original Silicone Dessert Bar Pan in several online and retail outlets.",,,0.0,"⚡Flashback Friday⚡ In the Spring of 2011, we debuted our Sweetheart Silicone Dessert Pan and Easter Egg Silicone Dessert Pan! Both pans have joined the original Silicone Dessert Bar Pan in several online and retail outlets.",2019-07-12 11:10:13,,
70,0.0,https://scontent-atl3-1.xx.fbcdn.net/v/t1.0-9/fr/cp0/e15/q65/66524059_3367382779953787_3397626259952369664_o.jpg?_nc_cat=111&_nc_sid=2d5d41&_nc_ohc=rBH5Ml7PA_8AX8i5Yq_&_nc_ht=scontent-atl3-1.xx&tp=14&oh=93501163064a0b2f36f3b4fe5ce62e14&oe=5F854A21,2.0,https://hubs.ly/H0jJB9B0,3367382773287121,What makes the best get together fun besides the company? The games of course! OTLOTE is one of Davison's newest products to be on the market! This fun dice game is great for those extra competitive people in your life! Get yours today on Amazon at https://hubs.ly/H0jJB9B0 .,,,0.0,What makes the best get together fun besides the company? The games of course! OTLOTE is one of Davison's newest products to be on the market! This fun dice game is great for those extra competitive people in your life! Get yours today on Amazon at https://hubs.ly/H0jJB9B0 .,2019-07-11 09:04:29,,
71,0.0,,7.0,,3367373476621384,Happy Wednesday! Sometimes we need a little extra push to make it to the weekend! What are you doing today to be creative🎨?,,,0.0,Happy Wednesday! Sometimes we need a little extra push to make it to the weekend! What are you doing today to be creative🎨?,2019-07-11 09:00:01,,
72,0.0,https://scontent-atl3-1.xx.fbcdn.net/v/t1.0-9/fr/cp0/e15/q65/66175027_3359515330740532_8090088716158107648_o.jpg?_nc_cat=111&_nc_sid=2d5d41&_nc_ohc=_XZAD5Gr0hwAX_ea08a&_nc_ht=scontent-atl3-1.xx&tp=14&oh=874c302b870542ee5ac520bbe89ad505&oe=5F83A02A,2.0,https://hubs.ly/H0jCwnB0,3359515317407200,"If you enjoy the comradery of good friends competing in a game of chance and skill… grab OTLOTE! With customizable rules this game lets you kick game night up a notch, but only when you want to.
Take game night over the line or to the edge with, OTLOTE!
Available on Amazon Prime! https://hubs.ly/H0jCwnB0.",,,0.0,"If you enjoy the comradery of good friends competing in a game of chance and skill… grab OTLOTE! With customizable rules this game lets you kick game night up a notch, but only when you want to.
Take game night over the line or to the edge with, OTLOTE!
Available on Amazon Prime! https://hubs.ly/H0jCwnB0.",2019-07-08 11:11:35,,
73,0.0,https://scontent-atl3-1.xx.fbcdn.net/v/t1.0-9/fr/cp0/e15/q65/66390729_3359242977434434_3958392823799087104_o.jpg?_nc_cat=106&_nc_sid=2d5d41&_nc_ohc=80WRVYn4BAEAX_Ohy9E&_nc_ht=scontent-atl3-1.xx&tp=14&oh=3921d78d8103f3c61d7a463333f1c646&oe=5F81F81E,2.0,,3359242970767768,"Each and everyday we choose whether we live outside of our comfort zone or if we stay in it. If we stay there, we are never able to grow from the experiences that we get outside of it. What are you going to do today that is out of your comfort zone?",,,0.0,"Each and everyday we choose whether we live outside of our comfort zone or if we stay in it. If we stay there, we are never able to grow from the experiences that we get outside of it. What are you going to do today that is out of your comfort zone?",2019-07-08 09:10:21,,
74,0.0,https://scontent-atl3-1.xx.fbcdn.net/v/t1.0-9/fr/cp0/e15/q65/65884675_3351039271588138_2754772696301568000_n.jpg?_nc_cat=104&_nc_sid=2d5d41&_nc_ohc=z8iVDeUUM6cAX9EBvgW&_nc_ht=scontent-atl3-1.xx&tp=14&oh=002993861505738080022c4f80d8b235&oe=5F84DA29,3.0,,3351039264921472,"⚡Flashback Friday⚡We kicked off 2011, by collaborating with Jokari on the Healthy Steps line. It was quickly featured on the Kitchen Critic and the pasta basket was described as “a great tool for pasta lovers”.",,,0.0,"⚡Flashback Friday⚡We kicked off 2011, by collaborating with Jokari on the Healthy Steps line. It was quickly featured on the Kitchen Critic and the pasta basket was described as “a great tool for pasta lovers”.",2019-07-05 11:02:12,,
75,3.0,,8.0,,3347878335237565,From everyone at Davison we hope that you have a safe and fun 4th of July! Happy Independence Day!,,,0.0,From everyone at Davison we hope that you have a safe and fun 4th of July! Happy Independence Day!,2019-07-04 09:09:43,https://video-atl3-1.xx.fbcdn.net/v/t42.9040-2/66418348_698285857267349_3194753617164763136_n.mp4?_nc_cat=106&_nc_sid=985c63&efg=eyJ2ZW5jb2RlX3RhZyI6InN2ZV9zZCJ9&_nc_ohc=QbJxD0klMf4AX_NCRo6&_nc_ht=video-atl3-1.xx&oh=c706c61968a5be611b309672bbf8b0b5&oe=5F5E186A,
76,0.0,https://scontent-atl3-1.xx.fbcdn.net/v/t1.0-9/65643184_3345362605489138_309475874263007232_o.png?_nc_cat=111&_nc_sid=2d5d41&_nc_ohc=89MYYFJNB3oAX887TDZ&_nc_ht=scontent-atl3-1.xx&oh=123b76a2adf954fca1099e12640cadd3&oe=5F820DB8,3.0,https://hubs.ly/H0jCxm40,3345362598822472,"If your average board game isn’t doing the trick anymore, grab, OTLOTE! This new game is designed to bring out the competitive side of each player! The first player to 50 wins, but beware, the game changer dice can take you from, leader of the pack to the last one in line!
Take game night over the line, with OTLOTE! Only on Amazon https://hubs.ly/H0jCxm40
.",,,0.0,"If your average board game isn’t doing the trick anymore, grab, OTLOTE! This new game is designed to bring out the competitive side of each player! The first player to 50 wins, but beware, the game changer dice can take you from, leader of the pack to the last one in line!
Take game night over the line, with OTLOTE! Only on Amazon https://hubs.ly/H0jCxm40
.",2019-07-03 08:44:24,,
77,0.0,,0.0,https://hubs.ly/H0jygyH0,3334402406585158,"Oh no! Time is almost up! Our month of celebrating fathers is about over, but don't worry, you still have a few days left to enter our giveaway! Be sure to share it so that your friends have the opportunity to win this amazing grilling set by @jokari! Don't miss out, enter today at https://hubs.ly/H0jygyH0.",https://facebook.com/story.php?story_fbid=3334402406585158&id=261238053901624,"INVENTING.DAVISON.COM
Father's Day Giveaway",0.0,"Oh no! Time is almost up! Our month of celebrating fathers is about over, but don't worry, you still have a few days left to enter our giveaway! Be sure to share it so that your friends have the opportunity to win this amazing grilling set by @jokari! Don't miss out, enter today at https://hubs.ly/H0jygyH0.

INVENTING.DAVISON.COM
Father's Day Giveaway",2019-06-29 09:06:16,,
78,0.0,https://scontent-atl3-1.xx.fbcdn.net/v/t1.0-9/fr/cp0/e15/q65/65393896_3332492196776179_5611731473552900096_o.jpg?_nc_cat=111&_nc_sid=2d5d41&_nc_ohc=d65tZpGaeWUAX-v06AJ&_nc_ht=scontent-atl3-1.xx&tp=14&oh=c6d5f3687b42370bb72d42f67c8008f4&oe=5F81B54E,3.0,https://hubs.ly/H0jyKW30,3332492183442847,"Hmm...I wonder which of these dice games I will be playing at #gamenight Friday! Let's just say, I won't be bringing the boring one!

Take game night over the line with OTLOTE! Buy now on Amazon Prime! https://hubs.ly/H0jyKW30",,,0.0,"Hmm...I wonder which of these dice games I will be playing at #gamenight Friday! Let's just say, I won't be bringing the boring one!

Take game night over the line with OTLOTE! Buy now on Amazon Prime! https://hubs.ly/H0jyKW30",2019-06-28 15:17:23,,
79,0.0,,7.0,https://bit.ly/Davisongiveaway,3332229653469100,It's Friday! That means that we only have a few more days for our Father's Day month-long celebration giveaway! Hurry before time runs out! http://bit.ly/Davisongiveaway,https://facebook.com/story.php?story_fbid=3332229653469100&id=261238053901624,"INVENTING.DAVISON.COM
Father's Day Giveaway",0.0,"It's Friday! That means that we only have a few more days for our Father's Day month-long celebration giveaway! Hurry before time runs out! http://bit.ly/Davisongiveaway

INVENTING.DAVISON.COM
Father's Day Giveaway",2019-06-28 13:09:48,,
80,0.0,https://scontent-atl3-1.xx.fbcdn.net/v/t1.0-9/fr/cp0/e15/q65/65392938_3331957096829689_2292844458196074496_n.jpg?_nc_cat=104&_nc_sid=2d5d41&_nc_ohc=ZhxryU0lfLAAX9EAQE0&_nc_ht=scontent-atl3-1.xx&tp=14&oh=74d6088eba4f0c5f84487bdcc0cbbb6a&oe=5F847D1D,5.0,,3331957090163023,"⚡Flashback Friday⚡In September 2010, The Fuel Helmet line that Davison designed the packaging for, crossed the border into Canada! This was a first for Davison!",,,0.0,"⚡Flashback Friday⚡In September 2010, The Fuel Helmet line that Davison designed the packaging for, crossed the border into Canada! This was a first for Davison!",2019-06-28 11:06:02,,
81,0.0,https://scontent-atl3-1.xx.fbcdn.net/v/t1.0-9/fr/cp0/e15/q65/65181791_3329308493761216_8114938086967738368_o.jpg?_nc_cat=104&_nc_sid=2d5d41&_nc_ohc=NE_Jcf3NoE8AX-xeteg&_nc_ht=scontent-atl3-1.xx&tp=14&oh=d2f89c60c2fde079e46c89dad5134921&oe=5F842F34,6.0,https://hubs.ly/H0h_FTJ0,3329308483761217,If your notebook looks like this for your idea then we have the perfect tool for you! Download our idea recorder today to help organize your ideas! Click here to download https://hubs.ly/H0h_FTJ0 !,,,0.0,If your notebook looks like this for your idea then we have the perfect tool for you! Download our idea recorder today to help organize your ideas! Click here to download https://hubs.ly/H0h_FTJ0 !,2019-06-27 11:05:10,,
82,0.0,https://scontent-atl3-1.xx.fbcdn.net/v/t1.0-9/fr/cp0/e15/q65/65039009_3326539347371464_1402789512043560960_o.jpg?_nc_cat=107&_nc_sid=2d5d41&_nc_ohc=MnDdDuDORwMAX_2r2M6&_nc_ht=scontent-atl3-1.xx&tp=14&oh=72d5ad762593fc1c3c6d80b37e659124&oe=5F826285,8.0,https://hubs.ly/H0h_DLk0,3326539340704798,The newest Davison designed product to hit a homerun is the FenceFan! This item is great for sporting events and individuals that like to stand at the fence but don’t want to be burned by the metal. The FenceFan holds all their favorite items at their fingertips. With two compartments this invention is a great addition to all sports families. Check it out at https://hubs.ly/H0h_DLk0,,,0.0,The newest Davison designed product to hit a homerun is the FenceFan! This item is great for sporting events and individuals that like to stand at the fence but don’t want to be burned by the metal. The FenceFan holds all their favorite items at their fingertips. With two compartments this invention is a great addition to all sports families. Check it out at https://hubs.ly/H0h_DLk0,2019-06-26 11:11:06,,
83,0.0,https://scontent-atl3-1.xx.fbcdn.net/v/t1.0-9/fr/cp0/e15/q65/65047437_3323456327679766_3845810469566676992_o.jpg?_nc_cat=100&_nc_sid=2d5d41&_nc_ohc=M6B5yBJ3rrAAX_RG4oE&_nc_ht=scontent-atl3-1.xx&tp=14&oh=f91f83c28c4f00c1844a2bad177b4dec&oe=5F84AAEB,7.0,https://hubs.ly/H0jt5Zq0,3323456317679767,"You heard it correctly! One of the latest Davison designed products is taking Amazon by storm!
Search no more, as Davison has provided you with the solution to the dreaded reusable cup and lid search! Hurry and grab yours before they are out of stock! Available here: https://hubs.ly/H0jt5Zq0",,,0.0,"You heard it correctly! One of the latest Davison designed products is taking Amazon by storm!
Search no more, as Davison has provided you with the solution to the dreaded reusable cup and lid search! Hurry and grab yours before they are out of stock! Available here: https://hubs.ly/H0jt5Zq0",2019-06-25 09:09:10,,
84,0.0,https://scontent-atl3-1.xx.fbcdn.net/v/t1.0-9/fr/cp0/e15/q65/64883370_3320965754595490_317772789006204928_o.jpg?_nc_cat=100&_nc_sid=2d5d41&_nc_ohc=5C6TRMxCZBoAX-iHssF&_nc_ht=scontent-atl3-1.xx&tp=14&oh=737ca3c181c8d373995452de0c93fa3e&oe=5F840650,4.0,https://hubs.ly/H0jlPcX0,3320965747928824,Who knew that garden flags would of taken off when they were first invented?! Do you have an idea that could leave an impact? Submit your idea today at https://hubs.ly/H0jlPcX0 .,,,0.0,Who knew that garden flags would of taken off when they were first invented?! Do you have an idea that could leave an impact? Submit your idea today at https://hubs.ly/H0jlPcX0 .,2019-06-24 11:07:22,,
85,1.0,https://scontent-atl3-1.xx.fbcdn.net/v/t1.0-9/fr/cp0/e15/q65/64747170_3312971542061578_8481461426253201408_o.jpg?_nc_cat=105&_nc_sid=2d5d41&_nc_ohc=0LucgKo_Rs4AX8uF3Zh&_nc_ht=scontent-atl3-1.xx&tp=14&oh=edd2657154e559e618574a60840549d5&oe=5F84E903,4.0,,3312971532061579,Summertime is a busy time for many and is one of the most influential seasons for many inventors. What is your favorite summertime invention?,,,0.0,Summertime is a busy time for many and is one of the most influential seasons for many inventors. What is your favorite summertime invention?,2019-06-21 14:09:33,,
86,0.0,https://scontent-atl3-1.xx.fbcdn.net/v/t1.0-9/fr/cp0/e15/q65/65303502_3312575848767814_3733409813925724160_n.jpg?_nc_cat=110&_nc_sid=2d5d41&_nc_ohc=-fV_aa5fBLYAX-jlDvq&_nc_oc=AQn5sLDOKH-JZqcbB3MpSVyB-knWYfCTsjmcnB64nUHiyRRarAZdjVrerTD2lCh-D6s&_nc_ht=scontent-atl3-1.xx&tp=14&oh=b11f956b1c952ff56143c9add3aba98a&oe=5F83856A,9.0,,3312575838767815,"In July of 2010, we hit another huge milestone when our founder and CEO, George Davison, landed a “corporate spotlight” in American Executive. They discussed Mr. Davison’s inventing method and how he has become known as the “Henry Ford of Inventing”, making new product design affordable for individuals and corporations.",,,0.0,"In July of 2010, we hit another huge milestone when our founder and CEO, George Davison, landed a “corporate spotlight” in American Executive. They discussed Mr. Davison’s inventing method and how he has become known as the “Henry Ford of Inventing”, making new product design affordable for individuals and corporations.",2019-06-21 11:08:48,,
87,0.0,https://scontent-atl3-1.xx.fbcdn.net/v/t1.0-9/64703545_3310698345622231_5327935522285289472_o.png?_nc_cat=103&_nc_sid=2d5d41&_nc_ohc=WfuxQtwS8sYAX9TmtJ4&_nc_ht=scontent-atl3-1.xx&oh=5554e5e5a124b42e817290999c778ce1&oe=5F854F17,6.0,https://hubs.ly/H0jqM7V0,3310698335622232,Game Night just got a game changer… Dice that is! Davison is introducing the newest invention to come out of our invention factory. With inspiration drawn from corn hole and Yahtzee this game will be sure to inspire you and your friends and family. Grab your game today at https://hubs.ly/H0jqM7V0.,,,0.0,Game Night just got a game changer… Dice that is! Davison is introducing the newest invention to come out of our invention factory. With inspiration drawn from corn hole and Yahtzee this game will be sure to inspire you and your friends and family. Grab your game today at https://hubs.ly/H0jqM7V0.,2019-06-20 18:06:33,,
88,22.0,,25.0,https://hubs.ly/H0jqHt00,3310047819020617,"We are excited for the release of the newest Dare to Invent short film! This DTI is special because it shows that sometimes you have to go back to the drawing board in order to succeed. You will be sure to find a laugh or two in this inspirational video about Trish and the Tater Gator! Check it out!
https://hubs.ly/H0jqHt00",,,0.0,"We are excited for the release of the newest Dare to Invent short film! This DTI is special because it shows that sometimes you have to go back to the drawing board in order to succeed. You will be sure to find a laugh or two in this inspirational video about Trish and the Tater Gator! Check it out!
https://hubs.ly/H0jqHt00",2019-06-20 12:37:31,,
89,0.0,https://scontent-atl3-1.xx.fbcdn.net/v/t1.0-9/fr/cp0/e15/q65/65016676_3307004342658298_7927920646665797632_o.jpg?_nc_cat=103&_nc_sid=2d5d41&_nc_ohc=mYdJUXYCM84AX_subc3&_nc_ht=scontent-atl3-1.xx&tp=14&oh=5f816596dbbdb9acf1f5718e733c2d60&oe=5F853B6A,9.0,,3307004332658299,"At Davison, we are firm believers in failing our way forward. From our founders first invention all the way to the inventors we help today. Sometimes it takes failing a few times to get something to work correctly.",,,0.0,"At Davison, we are firm believers in failing our way forward. From our founders first invention all the way to the inventors we help today. Sometimes it takes failing a few times to get something to work correctly.",2019-06-19 11:04:13,,
90,0.0,,3.0,https://hubs.ly/H0jnv_00,3304794249545974,"🙌🙌 GIVEAWAY NEWS!! 🙌🙌

We wanted to remind you that if you haven't had a chance to enter our Father's Day Giveaway to make sure that you do so in the next 11 days! Be sure to check out Jokari 's full grilling line for some new innovative favorites!

Learn more about the products and how you can win here! https://hubs.ly/H0jnv_00

Contest Ends: June 30, 2019, @12 AM!",https://facebook.com/story.php?story_fbid=3304794249545974&id=261238053901624,"INVENTING.DAVISON.COM
Father's Day Giveaway",0.0,"🙌🙌 GIVEAWAY NEWS!! 🙌🙌

We wanted to remind you that if you haven't had a chance to enter our Father's Day Giveaway to make sure that you do so in the next 11 days! Be sure to check out Jokari 's full grilling line for some new innovative favorites!

Learn more about the products and how you can win here! https://hubs.ly/H0jnv_00

Contest Ends: June 30, 2019, @12 AM!

INVENTING.DAVISON.COM
Father's Day Giveaway",2019-06-18 15:02:16,,
91,0.0,,9.0,https://hubs.ly/H0jlS6R0,3302037186488347,"We each have something unique about us, that helps us harness our creativity. From working on specific tasks such as cars or four wheelers all the way to working in the trade industry. Check out what kind of inventor you are by taking our inventor quiz! Click here https://hubs.ly/H0jlS6R0",,,0.0,"We each have something unique about us, that helps us harness our creativity. From working on specific tasks such as cars or four wheelers all the way to working in the trade industry. Check out what kind of inventor you are by taking our inventor quiz! Click here https://hubs.ly/H0jlS6R0",2019-06-17 15:10:19,,
92,0.0,,6.0,,3301470896544976,"Each day spent working on a project, is a magical day!",,,0.0,"Each day spent working on a project, is a magical day!",2019-06-17 11:09:47,,
93,0.0,,7.0,https://bit.ly/Davisongiveaway,3298724926819573,Happy Father's Day from all of us at Davison! Enjoy your special day! Don't forget to enter our Father's Day Giveaway at http://bit.ly/Davisongiveaway .,,,0.0,Happy Father's Day from all of us at Davison! Enjoy your special day! Don't forget to enter our Father's Day Giveaway at http://bit.ly/Davisongiveaway .,2019-06-16 11:07:02,,
94,0.0,https://scontent-atl3-1.xx.fbcdn.net/v/t1.0-9/fr/cp0/e15/q65/62574642_3293146274044105_2401489353915236352_n.jpg?_nc_cat=103&_nc_sid=2d5d41&_nc_ohc=r6MdD-dZ2gQAX8jQsuS&_nc_ht=scontent-atl3-1.xx&tp=14&oh=b240d5b174df3807c4037a8cf9d8e0eb&oe=5F823743,10.0,,3293146267377439,"Davison realized that silicone bakeware was a trending kitchen product, so in May 2010, Davison launched The Silicone Dessert Bar Pan. We were able to sell it in many retailers as well as online stores.",,,0.0,"Davison realized that silicone bakeware was a trending kitchen product, so in May 2010, Davison launched The Silicone Dessert Bar Pan. We were able to sell it in many retailers as well as online stores.",2019-06-14 11:11:53,,
95,0.0,https://scontent-atl3-1.xx.fbcdn.net/v/t1.0-9/fr/cp0/e15/q65/62367621_3290344704324262_8975609065904275456_o.jpg?_nc_cat=102&_nc_sid=2d5d41&_nc_ohc=CWmBRh_9Sc0AX9sepKB&_nc_ht=scontent-atl3-1.xx&tp=14&oh=cb894a75bd8ff964f5aa04f2314e92d3&oe=5F84F483,10.0,,3290344697657596,Our founder is always looking for new ways to create innovative products. One of the latest ones was a multi seat camping chair set. This seating system allows for friends and families to only have to carry one bag to sit up to 6 people! How innovative is that?,,,0.0,Our founder is always looking for new ways to create innovative products. One of the latest ones was a multi seat camping chair set. This seating system allows for friends and families to only have to carry one bag to sit up to 6 people! How innovative is that?,2019-06-13 11:08:27,,
