,comments,image,likes,link,post_id,post_text,post_url,shared_text,shares,text,time,video,video_thumbnail
135,0.0,https://scontent-atl3-1.xx.fbcdn.net/v/t1.0-9/fr/cp0/e15/q65/57543649_3156201131071954_4225275700661190656_o.jpg?_nc_cat=105&_nc_sid=2d5d41&_nc_ohc=jTGJqxd5k8AAX_9Pfpv&_nc_ht=scontent-atl3-1.xx&tp=14&oh=ade9b157aec8a3aa304618f4b100adc3&oe=5F82F50B,7.0,,3156201121071955,Many people don’t understand that there are small steps that each one of us can make. Did you know that something as simple as having a reusable water bottle can help cut out over 38 billion water bottles in one year?,,,0.0,Many people don’t understand that there are small steps that each one of us can make. Did you know that something as simple as having a reusable water bottle can help cut out over 38 billion water bottles in one year?,2019-04-23 11:08:09,,
136,0.0,https://scontent-atl3-1.xx.fbcdn.net/v/t1.0-9/fr/cp0/e15/q65/57568505_3154468111245256_6676972152819810304_o.jpg?_nc_cat=108&_nc_sid=2d5d41&_nc_ohc=_vDKn3TWbyoAX9hacfz&_nc_ht=scontent-atl3-1.xx&tp=14&oh=10b45eab18164d933e86c160bd9c2535&oe=5F840E97,9.0,https://hubs.ly/H0hxY2T0,3154468101245257,We are excited to announce that we have recently launched an audio blog! This episode talks about 6 women inventors who paved the way! Take a listen at https://hubs.ly/H0hxY2T0!,,,0.0,We are excited to announce that we have recently launched an audio blog! This episode talks about 6 women inventors who paved the way! Take a listen at https://hubs.ly/H0hxY2T0!,2019-04-22 16:49:25,,
137,0.0,https://scontent-atl3-1.xx.fbcdn.net/v/t1.0-9/fr/cp0/e15/q65/58373573_3154161231275944_3784200276102086656_o.jpg?_nc_cat=101&_nc_sid=2d5d41&_nc_ohc=nrpRBlBEALAAX-9L5th&_nc_ht=scontent-atl3-1.xx&tp=14&oh=8818e3cac4874f29a245d716f7d66e53&oe=5F83BC99,4.0,,3154161224609278,"Did you know that there have been many unique ways to measure rain? Since 500 B.C. rain has been recorded to influence the expected growth of agriculture. It wasn't until 1441 that we saw the rain gauge invented, it was called the Cheugugi. Rain gauges can help us determinate many things like where to construct buildings or plant gardens. Check out this patent we found on one style of rain gauges!",,,0.0,"Did you know that there have been many unique ways to measure rain? Since 500 B.C. rain has been recorded to influence the expected growth of agriculture. It wasn't until 1441 that we saw the rain gauge invented, it was called the Cheugugi. Rain gauges can help us determinate many things like where to construct buildings or plant gardens. Check out this patent we found on one style of rain gauges!",2019-04-22 14:05:08,,
138,0.0,https://scontent-atl3-1.xx.fbcdn.net/v/t1.0-9/fr/cp0/e15/q65/58695711_3153798724645528_8015542798457503744_o.jpg?_nc_cat=108&_nc_sid=2d5d41&_nc_ohc=kTYZCnTENHAAX_BQ6Xd&_nc_ht=scontent-atl3-1.xx&tp=14&oh=f507b03904f3dc6c2a8da479fbd50c1a&oe=5F842EA4,6.0,https://hubs.ly/H0hxQBY0,3153798721312195,There are many great resources that are available to help measure your footprint and we found one to help gauge the amount of water that we use. Check it out at https://hubs.ly/H0hxQBY0,,,0.0,There are many great resources that are available to help measure your footprint and we found one to help gauge the amount of water that we use. Check it out at https://hubs.ly/H0hxQBY0,2019-04-22 11:04:58,,
139,0.0,https://scontent-atl3-1.xx.fbcdn.net/v/t1.0-9/fr/cp0/e15/q65/57502908_3153749247983809_772247248808443904_o.jpg?_nc_cat=103&_nc_sid=2d5d41&_nc_ohc=g4FbvIU_9xYAX-qAiHC&_nc_ht=scontent-atl3-1.xx&tp=14&oh=3014cc7d30440a61ebf660be1429897c&oe=5F839D64,6.0,,3153749241317143,Happy Earth Day! We are excited to share with you 5 sustainability tips throughout the week! Each day check back at 11 am for a new tip!,,,0.0,Happy Earth Day! We are excited to share with you 5 sustainability tips throughout the week! Each day check back at 11 am for a new tip!,2019-04-22 10:38:40,,
140,0.0,https://scontent-atl3-1.xx.fbcdn.net/v/t1.0-9/fr/cp0/e15/q65/57247032_3145519808806753_3557036668382871552_o.jpg?_nc_cat=100&_nc_sid=2d5d41&_nc_ohc=BVvia2xaC_EAX_42Pol&_nc_ht=scontent-atl3-1.xx&tp=14&oh=81c8a712d0eec6538255615124666101&oe=5F821685,5.0,,3145519798806754,⚡Flashback Friday⚡In 2009 Davison celebrated 20 years in business!,,,0.0,⚡Flashback Friday⚡In 2009 Davison celebrated 20 years in business!,2019-04-19 11:07:04,,
141,0.0,https://scontent-atl3-1.xx.fbcdn.net/v/t1.0-9/fr/cp0/e15/q65/57343442_3143085385716862_4313721833338699776_n.jpg?_nc_cat=101&_nc_sid=2d5d41&_nc_ohc=XSdV1hqE8lsAX-oq2gW&_nc_ht=scontent-atl3-1.xx&tp=14&oh=18a1f736810fc4583f6547f8a0432f89&oe=5F83F375,4.0,https://hubs.ly/H0h57lk0,3143085382383529,Have you had one of those moments where you know your idea could change how people do things? We would love to talk with you about your idea! Be sure to submit your idea today at https://hubs.ly/H0h57lk0,,,0.0,Have you had one of those moments where you know your idea could change how people do things? We would love to talk with you about your idea! Be sure to submit your idea today at https://hubs.ly/H0h57lk0,2019-04-18 11:05:29,,
142,0.0,https://scontent-atl3-1.xx.fbcdn.net/v/t1.0-9/fr/cp0/e15/q65/57188212_3138369219521812_181075799724523520_o.jpg?_nc_cat=100&_nc_sid=2d5d41&_nc_ohc=g4615ktTJO0AX-c7ht-&_nc_ht=scontent-atl3-1.xx&tp=14&oh=c8b9970af67d11149019f1862b338320&oe=5F836ACA,4.0,https://hubs.ly/H0htlx_0,3138369212855146,There are only a few days left to enter our Spring Giveaway! Be sure to enter to win some of our favorite spring cleaning items🌷! To enter head to https://hubs.ly/H0htlx_0 !,,,0.0,There are only a few days left to enter our Spring Giveaway! Be sure to enter to win some of our favorite spring cleaning items🌷! To enter head to https://hubs.ly/H0htlx_0 !,2019-04-16 11:09:25,,
143,0.0,https://scontent-atl3-1.xx.fbcdn.net/v/t1.0-9/fr/cp0/e15/q65/57484499_3136045929754141_437316116994326528_n.jpg?_nc_cat=107&_nc_sid=2d5d41&_nc_ohc=9rza9U9ZAfkAX8rKURg&_nc_oc=AQlGDrZ-XTNG_of0RvUOnuwcXXEIEEX6lHxhbMcWmWyYgL5GOonymKGxnpqs2Ix-ZEc&_nc_ht=scontent-atl3-1.xx&tp=14&oh=3762a33af11d91a3c875740be345b0ce&oe=5F826886,2.0,,3136045923087475,Today is Tax Deadline Day! Don't forget to file!,,,0.0,Today is Tax Deadline Day! Don't forget to file!,2019-04-15 11:08:02,,
144,0.0,https://scontent-atl3-1.xx.fbcdn.net/v/t1.0-9/fr/cp0/e15/q65/56823284_3129211237104277_4888178059980570624_o.jpg?_nc_cat=110&_nc_sid=2d5d41&_nc_ohc=ck15RT0wDngAX-C1PL6&_nc_ht=scontent-atl3-1.xx&tp=14&oh=4681b65357f6fb398b91fc55194daa27&oe=5F828CBB,6.0,,3129211227104278,"Today is International Day of Human Space Flight! We wanted to celebrate this day because it allowed for many inventions to follow that didn't even pertain to space. Scratch-Resistant lenses, CAT scans, LED's, home insulation, baby formula, and water purification systems to name a few! #InternationalDayOfHumanSpaceFlight",,,0.0,"Today is International Day of Human Space Flight! We wanted to celebrate this day because it allowed for many inventions to follow that didn't even pertain to space. Scratch-Resistant lenses, CAT scans, LED's, home insulation, baby formula, and water purification systems to name a few! #InternationalDayOfHumanSpaceFlight",2019-04-12 14:10:18,,
145,0.0,https://scontent-atl3-1.xx.fbcdn.net/v/t1.0-9/fr/cp0/e15/q65/56951183_3128816090477125_2133154129567023104_o.jpg?_nc_cat=101&_nc_sid=2d5d41&_nc_ohc=zjDrLGjZDCEAX8fvOow&_nc_ht=scontent-atl3-1.xx&tp=14&oh=da599691ddeffbf768ade52408e05e25&oe=5F84647F,8.0,,3128816087143792,"⚡Flashback Friday⚡In April 2008, Davison designed a creative and shelf-friendly packaging for Comfort Products’ line of “Fuel” helmets. The packaged allowed consumers to try on a helmet without taking it out of the box.",,,0.0,"⚡Flashback Friday⚡In April 2008, Davison designed a creative and shelf-friendly packaging for Comfort Products’ line of “Fuel” helmets. The packaged allowed consumers to try on a helmet without taking it out of the box.",2019-04-12 11:09:07,,
146,0.0,https://scontent-atl3-1.xx.fbcdn.net/v/t1.0-9/57331316_3126527284039339_8016860249610780672_o.png?_nc_cat=103&_nc_sid=2d5d41&_nc_ohc=z0XY2_Ku0LgAX9MaRCg&_nc_ht=scontent-atl3-1.xx&oh=9031f3bbd57e514e562ba703c0229472&oe=5F84587C,6.0,https://hubs.ly/H0h57gx0,3126527274039340,Do you love to think on your feet? Are you an excellent problem solver? Check out our inventor quiz to see what kind of inventor you are! You may be surprised at your result. https://hubs.ly/H0h57gx0,,,0.0,Do you love to think on your feet? Are you an excellent problem solver? Check out our inventor quiz to see what kind of inventor you are! You may be surprised at your result. https://hubs.ly/H0h57gx0,2019-04-11 11:06:57,,
147,1.0,,4.0,https://hubs.ly/H0h57Zd0,3121885147836886,Did you have a ah-ha moment? Do you have a great invention or idea? We love to talk with people about their ideas. Be sure to submit your idea today at https://hubs.ly/H0h57Zd0,,,0.0,Did you have a ah-ha moment? Do you have a great invention or idea? We love to talk with people about their ideas. Be sure to submit your idea today at https://hubs.ly/H0h57Zd0,2019-04-09 11:03:21,,
148,0.0,https://scontent-atl3-1.xx.fbcdn.net/v/t1.0-9/fr/cp0/e15/q65/56965545_3112162582142476_8018912462294220800_n.jpg?_nc_cat=108&_nc_sid=2d5d41&_nc_ohc=DAIbV4xIor4AX-Sc1Me&_nc_ht=scontent-atl3-1.xx&tp=14&oh=bc89de00f297e6fe205d1c43c515b366&oe=5F83CE83,8.0,,3112162575475810,"⚡Flashback Friday⚡In 2007, we received a “tree-mendous” recognition from Ripley’s Believe It or Not! Our invention factory was featured as a truly unbelievable office space! We were even featured in the book “The Remarkable...Revealed”.",,,0.0,"⚡Flashback Friday⚡In 2007, we received a “tree-mendous” recognition from Ripley’s Believe It or Not! Our invention factory was featured as a truly unbelievable office space! We were even featured in the book “The Remarkable...Revealed”.",2019-04-05 11:03:34,,
149,0.0,https://scontent-atl3-1.xx.fbcdn.net/v/t1.0-9/fr/cp0/e15/q65/56158295_3110144769010924_7076012878481850368_o.jpg?_nc_cat=100&_nc_sid=2d5d41&_nc_ohc=6yGCUCVoI-EAX_MCEK3&_nc_ht=scontent-atl3-1.xx&tp=14&oh=09bb60b95d8f82011be86546900f0d04&oe=5F82E049,3.0,https://hubs.ly/H0hjTSr0,3110144762344258,"Have you heard the news?! We are having another giveaway! This time we are excited to bring you products that focus on getting rid of the old and bringing in new! Be sure to share the giveaway with your friends! Use #springflingGW when you share!
https://hubs.ly/H0hjTSr0",,,0.0,"Have you heard the news?! We are having another giveaway! This time we are excited to bring you products that focus on getting rid of the old and bringing in new! Be sure to share the giveaway with your friends! Use #springflingGW when you share!
https://hubs.ly/H0hjTSr0",2019-04-04 14:28:52,,
150,0.0,,9.0,,3109679192390815,💡Product Spotlight💡 Have you ever walked two dogs and had their leashes get tangled? The @wigzi Dual Retractable Leash was designed for individual control of each dog and rotates to keep them untangled. Check it out!,,,0.0,💡Product Spotlight💡 Have you ever walked two dogs and had their leashes get tangled? The @wigzi Dual Retractable Leash was designed for individual control of each dog and rotates to keep them untangled. Check it out!,2019-04-04 11:11:21,https://video-atl3-1.xx.fbcdn.net/v/t42.9040-2/56885867_2251765735084853_165199418755121152_n.mp4?_nc_cat=104&_nc_sid=985c63&efg=eyJ2ZW5jb2RlX3RhZyI6InN2ZV9zZCJ9&_nc_ohc=ErU2KYnAlgwAX9iOgfA&_nc_ht=video-atl3-1.xx&oh=6e67db702f851113f7d4ef7662418add&oe=5F5E1AC0,
151,1.0,https://scontent-atl3-1.xx.fbcdn.net/v/t1.0-9/fr/cp0/e15/q65/55929427_3104826852876049_3634970924437995520_o.jpg?_nc_cat=104&_nc_sid=2d5d41&_nc_ohc=Do7iCybce_0AX87w662&_nc_ht=scontent-atl3-1.xx&tp=14&oh=33be20ebc5129118f7bab201ebb793d1&oe=5F8551A4,8.0,,3104826842876050,"Always remember that there is a light at the end of the tunnel. As we see with May flowers, dreary days are necessary!",,,0.0,"Always remember that there is a light at the end of the tunnel. As we see with May flowers, dreary days are necessary!",2019-04-02 11:07:14,,
152,0.0,,5.0,https://www.davison.com/blog/virtual-reality-and-the-future-of-invention/,3095201100505291,"According to the Virtual Reality Society, the first known example of “creating the illusion that we are somewhere we are not” are panoramic paintings. Read more about VR on the blog!",https://facebook.com/story.php?story_fbid=3095201100505291&id=261238053901624,"DAVISON.COM
Virtual Reality and the Future of Invention | Davison",0.0,"According to the Virtual Reality Society, the first known example of “creating the illusion that we are somewhere we are not” are panoramic paintings. Read more about VR on the blog!

DAVISON.COM
Virtual Reality and the Future of Invention | Davison",2019-03-29 14:00:00,,
153,0.0,https://scontent-atl3-1.xx.fbcdn.net/v/t1.0-9/fr/cp0/e15/q65/55726450_3095194157172652_5441314232173854720_o.jpg?_nc_cat=111&_nc_sid=2d5d41&_nc_ohc=tUNeny85nQwAX8SDlFw&_nc_ht=scontent-atl3-1.xx&tp=14&oh=7c6f57ccf7391462bc249b6d74ca222e&oe=5F8446BA,4.0,,3095194150505986,We had another feel-good moment in 2006 when we won two Industrial Design Excellence Awards for the Hover Creeper and the BikeBoard! #flashbackfriday #davison30,,,0.0,We had another feel-good moment in 2006 when we won two Industrial Design Excellence Awards for the Hover Creeper and the BikeBoard! #flashbackfriday #davison30,2019-03-29 10:02:09,,
154,0.0,https://scontent-atl3-1.xx.fbcdn.net/v/t1.0-9/fr/cp0/e15/q65/55600739_3093308324027902_3630911252630339584_o.jpg?_nc_cat=101&_nc_sid=2d5d41&_nc_ohc=3TGcgKrNxpgAX879D7z&_nc_ht=scontent-atl3-1.xx&tp=14&oh=90dc786594d9b4a0122497db397ca41e&oe=5F81DDFE,3.0,https://hubs.ly/H0hbWK90,3093308314027903,"Have you started spring cleaning in your house? Be sure to enter our Spring Fling- Out with the Old, In with the New giveaway! You wont want to miss this! Enter here: https://hubs.ly/H0hbWK90",,,0.0,"Have you started spring cleaning in your house? Be sure to enter our Spring Fling- Out with the Old, In with the New giveaway! You wont want to miss this! Enter here: https://hubs.ly/H0hbWK90",2019-03-28 14:03:17,,
155,0.0,https://scontent-atl3-1.xx.fbcdn.net/v/t1.0-9/fr/cp0/e15/q65/55608084_3092991254059609_5563860339302334464_o.jpg?_nc_cat=105&_nc_sid=2d5d41&_nc_ohc=r-zCY_VgK_oAX-MoUCT&_nc_ht=scontent-atl3-1.xx&tp=14&oh=c6bb08565f92fbd519470de5673f3ed8&oe=5F82AFCF,7.0,,3092991247392943,"Happy Birthday to Ángela Ruiz Robles! She was the inventor of the mechanical precursor to the electronic book. In 1949, Ruiz was awarded Spanish patent 190,698 for the ""Mechanical Encyclopedia"".",,,0.0,"Happy Birthday to Ángela Ruiz Robles! She was the inventor of the mechanical precursor to the electronic book. In 1949, Ruiz was awarded Spanish patent 190,698 for the ""Mechanical Encyclopedia"".",2019-03-28 11:04:38,,
156,0.0,https://scontent-atl3-1.xx.fbcdn.net/v/t1.0-9/fr/cp0/e15/q65/55661521_3090950960930305_4491892233716367360_o.jpg?_nc_cat=105&_nc_sid=2d5d41&_nc_ohc=dHOwOvCZKp4AX_Fh5xH&_nc_ht=scontent-atl3-1.xx&tp=14&oh=6a23a9e0b44ee43c0f0df4176951eac8&oe=5F82BA41,9.0,,3090950954263639,"While all the women we have talked about this month have degrees from colleges and universities, we can't forget to take a look at the young innovators!
Anna Du was a finalist with Science News for Students, Broadcom M.A.S.T.E.R.S. , and Society for Science & the Public at Broadcom MASTERS 2018. She had been collecting sea glass and noticed the amount of microplastics along the shore. She wanted to create a low-cost way to spot accumulations of microplastics in the ocean or brackish water environments. She created a remotely-operated vehicle that could detect plastics underwater. Congratulations to Anna on being a finalist!
#Womenshistorymonth #innovator",,,0.0,"While all the women we have talked about this month have degrees from colleges and universities, we can't forget to take a look at the young innovators!
Anna Du was a finalist with Science News for Students, Broadcom M.A.S.T.E.R.S. , and Society for Science & the Public at Broadcom MASTERS 2018. She had been collecting sea glass and noticed the amount of microplastics along the shore. She wanted to create a low-cost way to spot accumulations of microplastics in the ocean or brackish water environments. She created a remotely-operated vehicle that could detect plastics underwater. Congratulations to Anna on being a finalist!
#Womenshistorymonth #innovator",2019-03-27 14:02:33,,
157,0.0,https://scontent-atl3-1.xx.fbcdn.net/v/t1.0-9/fr/cp0/e15/q65/55535174_3088604711164930_5169853963851268096_o.jpg?_nc_cat=106&_nc_sid=2d5d41&_nc_ohc=soHcQjfE8QoAX95V0DN&_nc_ht=scontent-atl3-1.xx&tp=14&oh=0cf645067fe891b5c01c64a5dac926b8&oe=5F82C8BC,2.0,https://hubs.ly/H0h9sys0,3088604704498264,Have you entered the Spring Fling Giveaway? Not yet? Well get on it! And don't forget to tag 3 of your best friends who would love the chance to win some spring organization items! https://hubs.ly/H0h9sys0,,,0.0,Have you entered the Spring Fling Giveaway? Not yet? Well get on it! And don't forget to tag 3 of your best friends who would love the chance to win some spring organization items! https://hubs.ly/H0h9sys0,2019-03-26 15:10:33,,
158,0.0,https://scontent-atl3-1.xx.fbcdn.net/v/t1.0-9/fr/cp0/e15/q65/55576616_3088128514545883_32044639326306304_o.jpg?_nc_cat=100&_nc_sid=2d5d41&_nc_ohc=yZNqYfrBfd4AX9OWYyj&_nc_ht=scontent-atl3-1.xx&tp=14&oh=c7e2268db84bc9559aa8e0c58a924d1c&oe=5F837876,10.0,,3088128504545884,Have you picked up your favorite way to draw lately✏️? Even if you are not a Picasso you can still draw to share your vision.,,,0.0,Have you picked up your favorite way to draw lately✏️? Even if you are not a Picasso you can still draw to share your vision.,2019-03-26 11:09:31,,
159,0.0,,3.0,https://inventing.davison.com/spring-giveaway-2019,3086110538081014,Have you entered into our spring giveaway yet? https://inventing.davison.com/spring-giveaway-2019,https://facebook.com/story.php?story_fbid=3086110538081014&id=261238053901624,"INVENTING.DAVISON.COM
Spring Fling Giveaway",0.0,"Have you entered into our spring giveaway yet? https://inventing.davison.com/spring-giveaway-2019

INVENTING.DAVISON.COM
Spring Fling Giveaway",2019-03-25 14:08:19,,
160,0.0,,7.0,,3085781781447223,Sometimes we need a little extra motivation! Remember that your goals are yours and when you reach them you need to celebrate!,,,0.0,Sometimes we need a little extra motivation! Remember that your goals are yours and when you reach them you need to celebrate!,2019-03-25 11:09:19,,
161,0.0,https://scontent-atl3-1.xx.fbcdn.net/v/t1.0-9/fr/cp0/e15/q65/54521987_3079350078757060_913134077471621120_o.jpg?_nc_cat=111&_nc_sid=2d5d41&_nc_ohc=h43c4MRYZ_8AX8mFja-&_nc_ht=scontent-atl3-1.xx&tp=14&oh=2c2e5283c9f77da05c46135420896db2&oe=5F84D123,4.0,https://hubs.ly/H0h75v00,3079350075423727,"Have you heard the news?! We are having another giveaway! This time we are excited to bring you products that focus on getting rid of the old and bringing in new! Be sure to share the giveaway with your friends! Use #springflingGW when you share!
https://hubs.ly/H0h75v00",,,0.0,"Have you heard the news?! We are having another giveaway! This time we are excited to bring you products that focus on getting rid of the old and bringing in new! Be sure to share the giveaway with your friends! Use #springflingGW when you share!
https://hubs.ly/H0h75v00",2019-03-22 16:08:01,,
162,0.0,https://scontent-atl3-1.xx.fbcdn.net/v/t1.0-9/fr/cp0/e15/q65/54730954_3078838578808210_3363279552515145728_o.jpg?_nc_cat=105&_nc_sid=2d5d41&_nc_ohc=WXfoOqF-ObsAX_IgCcs&_nc_ht=scontent-atl3-1.xx&tp=14&oh=ec9eb101e10d18a6dc829fb7e58bdb5a&oe=5F857A73,6.0,,3078838565474878,"⚡Flashback Friday⚡In 2006, we were able to acquire a building next door to us. This immersive workspace would be specifically for our designers and would become one of the most innovative spaces to work in. By the end of 2006, we reached the halfway point of construction. #davison30 #flashbackfriday",,,0.0,"⚡Flashback Friday⚡In 2006, we were able to acquire a building next door to us. This immersive workspace would be specifically for our designers and would become one of the most innovative spaces to work in. By the end of 2006, we reached the halfway point of construction. #davison30 #flashbackfriday",2019-03-22 11:09:04,,
163,0.0,https://scontent-atl3-1.xx.fbcdn.net/v/t1.0-9/fr/cp0/e15/q65/54520246_3076892422336159_7387216167116472320_o.jpg?_nc_cat=111&_nc_sid=2d5d41&_nc_ohc=7sZa_7-hkY8AX_hwASb&_nc_ht=scontent-atl3-1.xx&tp=14&oh=f7b6975efa9e9c96197d41123de89a5a&oe=5F82B7F4,8.0,,3076892415669493,"Today we want to talk about Ellen Ochoa, she was an astronaut, researcher, and inventor. She holds three patents that help scientists refine images that come from space! Ellen knew that the sky was the limit being the first Hispanic woman in space and the second woman director of NASA's Johnson Space Center! #womenshistorymonth",,,0.0,"Today we want to talk about Ellen Ochoa, she was an astronaut, researcher, and inventor. She holds three patents that help scientists refine images that come from space! Ellen knew that the sky was the limit being the first Hispanic woman in space and the second woman director of NASA's Johnson Space Center! #womenshistorymonth",2019-03-21 14:07:53,,
164,0.0,https://scontent-atl3-1.xx.fbcdn.net/v/t1.0-9/fr/cp0/e15/q65/54727613_3074858755872859_8221816303724265472_n.jpg?_nc_cat=111&_nc_sid=2d5d41&_nc_ohc=LFHb709O0MAAX9dcExl&_nc_ht=scontent-atl3-1.xx&tp=14&oh=e1b526c02eca7c6200383fbc9f89c31c&oe=5F82AED5,4.0,,3074858752539526,"Do you have an idea like the umbrella? What about the utility knife? If so, we love to talk to idea people about their ideas, submit yours today! Link in Bio!",,,0.0,"Do you have an idea like the umbrella? What about the utility knife? If so, we love to talk to idea people about their ideas, submit yours today! Link in Bio!",2019-03-20 16:49:00,,
165,0.0,,3.0,https://hubs.ly/H0h3JR90,3074585752566826,"With today marking the first day of spring, we wanted to show some spring-inspired patent drawings! From garden shears, a fishing-bobber birdhouse, to the all-time-classic wheelbarrow, inventions happen every day and even evolve over time! If you have a spring invention idea be sure to head over to our idea submission page at https://hubs.ly/H0h3JR90!
*These designs were not designed or manufactured at Davison.",,,0.0,"With today marking the first day of spring, we wanted to show some spring-inspired patent drawings! From garden shears, a fishing-bobber birdhouse, to the all-time-classic wheelbarrow, inventions happen every day and even evolve over time! If you have a spring invention idea be sure to head over to our idea submission page at https://hubs.ly/H0h3JR90!
*These designs were not designed or manufactured at Davison.",2019-03-20 14:05:34,,
166,0.0,,5.0,,3074252999266768,"Today marks the first day of spring🌹! If the weather permits, get outside, even if its just for a walk👟. Or if you are stuck inside do a spring-inspired craft🎨.
Comment below with how you are celebrating spring!",,,0.0,"Today marks the first day of spring🌹! If the weather permits, get outside, even if its just for a walk👟. Or if you are stuck inside do a spring-inspired craft🎨.
Comment below with how you are celebrating spring!",2019-03-20 11:05:37,,
167,0.0,https://scontent-atl3-1.xx.fbcdn.net/v/t1.0-9/fr/cp0/e15/q65/54434521_3071924372832964_228264167319011328_o.jpg?_nc_cat=110&_nc_sid=2d5d41&_nc_ohc=9MFCfssUj8YAX_1f00H&_nc_ht=scontent-atl3-1.xx&tp=14&oh=8032fbe12d6585b7244eca23304f6d4d&oe=5F848EFE,5.0,,3071924366166298,"Did you know that the type of soil that you have plays a large role in the success of your plants growth🌱? Clay and Silt are two of the most nutrient types whereas sand holds a lot of air space. Do you plant in raised beds or any different ways, comment below with how you garden.",,,0.0,"Did you know that the type of soil that you have plays a large role in the success of your plants growth🌱? Clay and Silt are two of the most nutrient types whereas sand holds a lot of air space. Do you plant in raised beds or any different ways, comment below with how you garden.",2019-03-19 11:04:20,,
168,0.0,https://scontent-atl3-1.xx.fbcdn.net/v/t1.0-9/fr/cp0/e15/q65/54799249_3069710433054358_8803746769893588992_o.jpg?_nc_cat=106&_nc_sid=2d5d41&_nc_ohc=cbaWNAsYk2UAX-ehOVN&_nc_ht=scontent-atl3-1.xx&tp=14&oh=33cd5e7a4717119c9129738f44eb6533&oe=5F833A6A,3.0,,3069710423054359,"We wanted to show a blast from the past with the Can-Do! While the first can opener wasn't patented until 1855 in England, and then again three years later in the US, this is one invention that has stood the test of time and evolution.",,,0.0,"We wanted to show a blast from the past with the Can-Do! While the first can opener wasn't patented until 1855 in England, and then again three years later in the US, this is one invention that has stood the test of time and evolution.",2019-03-18 11:12:18,,
169,0.0,https://scontent-atl3-1.xx.fbcdn.net/v/t1.0-9/fr/cp0/e15/q65/53857824_3062725730419495_5732670159106080768_o.jpg?_nc_cat=102&_nc_sid=2d5d41&_nc_ohc=MTehhxBsSo4AX_bg8ly&_nc_ht=scontent-atl3-1.xx&tp=14&oh=1d36c661cffa1a49c6daf696d04be542&oe=5F8384FF,10.0,,3062725720419496,"⚡Flashback Friday⚡In 2003, Davison had the pleasure to work with a client named John, he came to us with the idea for the BikeBoard. 15 years later, we still see the BikeBoard used! #davison30 #flashbackfriday",,,0.0,"⚡Flashback Friday⚡In 2003, Davison had the pleasure to work with a client named John, he came to us with the idea for the BikeBoard. 15 years later, we still see the BikeBoard used! #davison30 #flashbackfriday",2019-03-15 11:01:22,,
