,comments,image,likes,link,post_id,post_text,post_url,shared_text,shares,text,time,video,video_thumbnail
0,0.0,https://scontent-atl3-1.xx.fbcdn.net/v/t1.0-9/fr/cp0/e15/q65/118953255_3267915536576915_2771712564959096406_n.jpg?_nc_cat=106&_nc_sid=2d5d41&_nc_ohc=KyY4d-ncdUkAX8b7tYx&_nc_ht=scontent-atl3-1.xx&tp=14&oh=8d3955df56ea5a2fdbc1da4f3f4b3bd4&oe=5F829226,14.0,,3267915533243582,"In honor of 9/11, everyone is encouraged to wear red, white and blue tomorrow. #desbulldogpride #proudtobeamerican",,,0.0,"In honor of 9/11, everyone is encouraged to wear red, white and blue tomorrow. #desbulldogpride #proudtobeamerican",2020-09-10 19:50:16,,
1,5.0,,26.0,,3265299583505177,"GREAT NEWS from the Dixon R-1 Food Director:

There is no doubt that COVID-19 has impacted all families in some manner, especially so from a financial standpoint. Many of the nation's education organizations have lobbied both the USDE and USDA to extend the waivers and continue offering meals to student at no cost. Last week, the USDA, which has oversight of the school breakfast and lunch programs, announced an indefinite extension of the waivers. Extension of the waivers means, that ALL Dixon R-1 students, for the indefinite future, will receive FREE Breakfast and Lunch.

We ask that if your child has a negative balance that you use this time to try and catch that balance up. If your student has a positive balance, it will remain in their account until we return to normal and everyone goes back to their regular lunch program. Keep in mind this extension could stop at any time and everyone will go back to what they were on to begin with.

#desbulldogpride",https://facebook.com/story.php?story_fbid=3265299583505177&id=669082349793593,,0.0,"GREAT NEWS from the Dixon R-1 Food Director:

There is no doubt that COVID-19 has impacted all families in some manner, especially so from a financial standpoint. Many of the nation's education organizations have lobbied both the USDE and USDA to extend the waivers and continue offering meals to student at no cost. Last week, the USDA, which has oversight of the school breakfast and lunch programs, announced an indefinite extension of the waivers. Extension of the waivers means, that ALL Dixon R-1 students, for the indefinite future, will receive FREE Breakfast and Lunch.

We ask that if your child has a negative balance that you use this time to try and catch that balance up. If your student has a positive balance, it will remain in their account until we return to normal and everyone goes back to their regular lunch program. Keep in mind this extension could stop at any time and everyone will go back to what they were on to begin with.

#desbulldogpride",2020-09-09 22:58:18,,
2,4.0,https://scontent-atl3-1.xx.fbcdn.net/v/t1.0-9/fr/cp0/e15/q65/119170118_3265192076849261_2016686027268198546_o.jpg?_nc_cat=111&_nc_sid=2d5d41&_nc_ohc=jenQs_1GTFsAX9_NWDK&_nc_ht=scontent-atl3-1.xx&tp=14&oh=6b73c21ee10c52403b31c220382367ec&oe=5F83F66E,59.0,,3265192060182596,Thank you to Dixon Area Caring Center for the extra school supplies donated to help staff and students have a productive year. #desbulldogpride #blessed,,,0.0,Thank you to Dixon Area Caring Center for the extra school supplies donated to help staff and students have a productive year. #desbulldogpride #blessed,2020-09-09 22:16:00,,
3,0.0,,3.0,https://www.smore.com/78m3q,3264550570246745,September's Newsletter #desbulldogpride,https://facebook.com/story.php?story_fbid=3264550570246745&id=669082349793593,"SMORE.COM
DES Family Newsletter",0.0,"September's Newsletter #desbulldogpride

SMORE.COM
DES Family Newsletter",2020-09-09 16:18:33,,
4,0.0,,24.0,,3261817553853380,Second grade students took advantage of AR time on Friday. DES students will be able to take AR tests on Fridays. #desbulldogpride #readersareleaders,https://facebook.com/story.php?story_fbid=3261817553853380&id=669082349793593,,0.0,Second grade students took advantage of AR time on Friday. DES students will be able to take AR tests on Fridays. #desbulldogpride #readersareleaders,2020-09-08 19:40:16,,
5,0.0,,6.0,,3255770854458050,,https://facebook.com/story.php?story_fbid=3255770854458050&id=669082349793593,"Des Web
September 6 at 4:13 PM ·

#desbulldogpride",0.0,"Des Web
September 6 at 4:13 PM ·

#desbulldogpride",2020-09-06 19:13:33,,
6,0.0,https://scontent-atl3-1.xx.fbcdn.net/v/t1.0-9/118655656_3234273179941151_7889257414971473261_n.png?_nc_cat=105&_nc_sid=8024bb&_nc_ohc=2qUDbz4NxTwAX8UFT8r&_nc_oc=AQmjSC9M9hPpypHgz_UUOBGXOD_M0-pWaHnDfxwpMPcJUSU5LsbSLQU1UOJMAX4ars4&_nc_ht=scontent-atl3-1.xx&oh=0d67ad824819e36c66b1c2a31c3fbb8f&oe=5F848ED7,3.0,,3234274309941038,#desbulldogpride,https://facebook.com/story.php?story_fbid=3234274309941038&id=669082349793593,,0.0,#desbulldogpride,2020-08-30 22:27:16,,
7,5.0,https://scontent-atl3-1.xx.fbcdn.net/v/t1.0-9/fr/cp0/e15/q65/118406536_3482155848469975_3061330162603669541_o.jpg?_nc_cat=101&_nc_sid=8024bb&_nc_ohc=uQct_Ew6vq4AX_b9dF3&_nc_oc=AQmS_vG6oF2CioDttxcLHG9pSgamKdosbxlalcNH5NGy7-A2970mbg1LyftvX9BtbK4&_nc_ht=scontent-atl3-1.xx&tp=14&oh=c07a44a2418ae03ece60641dee570ebd&oe=5F822962,24.0,,3224737007561435,Thanks to Bank of Missouri for blessing DES staff with a bag of goodies. #blessed #desbulldogpride,https://facebook.com/story.php?story_fbid=3224737007561435&id=669082349793593,"The Bank of Missouri
August 24 at 1:00 PM ·

We appreciate our community teachers and school staff! Branch Manager Sonya McClendon and Commercial Loan Officer Tanya Shoemaker dropped off masks made by our Dixon Branch employees for their local school staff. This is how we #LiveWellBankWellGiveWell and help you #LiveWellBankWellLearnWell!",0.0,"Thanks to Bank of Missouri for blessing DES staff with a bag of goodies. #blessed #desbulldogpride

The Bank of Missouri
August 24 at 1:00 PM ·

We appreciate our community teachers and school staff! Branch Manager Sonya McClendon and Commercial Loan Officer Tanya Shoemaker dropped off masks made by our Dixon Branch employees for their local school staff. This is how we #LiveWellBankWellGiveWell and help you #LiveWellBankWellLearnWell!",2020-08-27 17:31:07,,
8,11.0,https://scontent-atl3-1.xx.fbcdn.net/v/t1.0-9/fr/cp0/e15/q65/118634380_3224728407562295_7282835932541022543_o.jpg?_nc_cat=101&_nc_sid=110474&_nc_ohc=K0Up5OVRXR8AX_MbseG&_nc_ht=scontent-atl3-1.xx&tp=14&oh=bd868e02a2f37de7c9792ebd30557b98&oe=5F835335,50.0,,3224730750895394,Thanks to Santee Church for blessing teachers and staff with breakfast this morning. #blessed #desbulldogpride,https://facebook.com/story.php?story_fbid=3224730750895394&id=669082349793593,,0.0,Thanks to Santee Church for blessing teachers and staff with breakfast this morning. #blessed #desbulldogpride,2020-08-27 17:27:59,,
9,0.0,,8.0,,3218833388151797,Please don’t forget school releases at 2:45 on Wednesday afternoons.,https://facebook.com/story.php?story_fbid=3218833388151797&id=669082349793593,,0.0,Please don’t forget school releases at 2:45 on Wednesday afternoons.,2020-08-25 18:28:48,,
10,0.0,,6.0,,3211589048876231,"Just a reminder that morning Dawg Pound starts Wednesday, August 26 at 6:45 and after school Dawg Pound starts August 31, Monday.",https://facebook.com/story.php?story_fbid=3211589048876231&id=669082349793593,,0.0,"Just a reminder that morning Dawg Pound starts Wednesday, August 26 at 6:45 and after school Dawg Pound starts August 31, Monday.",2020-08-23 08:50:15,,
11,0.0,https://scontent-atl3-1.xx.fbcdn.net/v/t1.0-9/fr/cp0/e15/q65/118005646_3209276845774118_2878298219974733569_n.jpg?_nc_cat=107&_nc_sid=110474&_nc_ohc=wwoisGMjeQsAX_w47n3&_nc_ht=scontent-atl3-1.xx&tp=14&oh=d22a9c8239119b419d150d0e23eb6652&oe=5F815564,8.0,,3209277085774094,,https://facebook.com/story.php?story_fbid=3209277085774094&id=669082349793593,,0.0,,2020-08-22 13:21:04,,
12,2.0,,6.0,https://docs.google.com/document/d/1VRAlo1yk_YSGmFU6CjywWx3bFW6SHdyrVXOkol30RM0/edit?usp=sharing,3208881325813670,Here is August’s Newsletter.,https://facebook.com/story.php?story_fbid=3208881325813670&id=669082349793593,"DOCS.GOOGLE.COM
Parent letter open house 2020",5.0,"Here is August’s Newsletter.

DOCS.GOOGLE.COM
Parent letter open house 2020",2020-08-22 10:26:40,,
13,5.0,,11.0,,3206938649341271,,https://facebook.com/story.php?story_fbid=3206938649341271&id=669082349793593,"Des Web
August 21 at 3:20 PM ·

First day of school is Monday, August 24, 2020. We are excited to see all of those smiling faces! #desbulldogpride",3.0,"Des Web
August 21 at 3:20 PM ·

First day of school is Monday, August 24, 2020. We are excited to see all of those smiling faces! #desbulldogpride",2020-08-21 18:20:49,,
14,2.0,https://scontent-atl3-1.xx.fbcdn.net/v/t1.0-9/fr/cp0/e15/q65/117420201_3162196870482116_292503494701639999_n.jpg?_nc_cat=109&_nc_sid=2d5d41&_nc_ohc=pVx308RWI14AX9HvMCp&_nc_oc=AQnOqeYCDhiE7I2Qqa6XkU6gdQCsYXH7gemump2WYDoxZx06ivsTX6WH8bbHqb6v5Fg&_nc_ht=scontent-atl3-1.xx&tp=14&oh=d1a364c3a3ed89561ac2d37c54d63fd0&oe=5F813F87,2.0,,3162196860482117,Elementary Dawgpound enrollment forms are available for pickup and return from 9:00-2:00 in the elementary office. Get a head start and enroll today. #bulldogpride,,,0.0,Elementary Dawgpound enrollment forms are available for pickup and return from 9:00-2:00 in the elementary office. Get a head start and enroll today. #bulldogpride,2020-08-06 10:28:10,,
15,2.0,https://scontent-atl3-1.xx.fbcdn.net/v/t1.0-9/fr/cp0/e15/q65/116586524_3140577909310679_2109041643733996068_n.jpg?_nc_cat=104&_nc_sid=2d5d41&_nc_ohc=dGT4gsfL-xIAX_OeMwO&_nc_ht=scontent-atl3-1.xx&tp=14&oh=ecd0aaa9d2d28458208fceae59d45143&oe=5F82D8F3,8.0,,3140577905977346,Here is the school supply list for the 2020-2021 school year. #desbulldogpride,,,0.0,Here is the school supply list for the 2020-2021 school year. #desbulldogpride,2020-07-30 01:16:06,,
16,1.0,https://scontent-atl3-1.xx.fbcdn.net/v/t1.0-9/fr/cp0/e15/q65/115880757_3392662550765752_3218439388237737662_o.jpg?_nc_cat=109&_nc_sid=8024bb&_nc_ohc=hD3miqVhhuQAX-z89TE&_nc_ht=scontent-atl3-1.xx&tp=14&oh=2d25d34af6041cdda574dcdb3358b117&oe=5F8299D0,3.0,,3117353754966428,,https://facebook.com/story.php?story_fbid=3117353754966428&id=669082349793593,"Dixon Area Caring-Center
July 21 at 11:04 AM ·

Registration for the Back to School Fair is open!
Come by the Caring Center to get your child registered anytime Monday thru Friday 10 am - 4 pm.
Due to COVID 19, things will be a little different this year. We will be pre-filling your childs new back pack with all of the requested supplies and delivering them to your child's classroom. So there WON'T be a fair for you to attend this year but your child will still get all supplies requested by their teacher. We will miss seeing all of you and your children but want to ensure everyone's safety. Only people who pre-register their child will get backpacks on the first day so make sure to get up here to get registered. If you have any questions please call the Caring Center at 759-3023.",5.0,"Dixon Area Caring-Center
July 21 at 11:04 AM ·

Registration for the Back to School Fair is open!
Come by the Caring Center to get your child registered anytime Monday thru Friday 10 am - 4 pm.
Due to COVID 19, things will be a little different this year. We will be pre-filling your childs new back pack with all of the requested supplies and delivering them to your child's classroom. So there WON'T be a fair for you to attend this year but your child will still get all supplies requested by their teacher. We will miss seeing all of you and your children but want to ensure everyone's safety. Only people who pre-register their child will get backpacks on the first day so make sure to get up here to get registered. If you have any questions please call the Caring Center at 759-3023.",2020-07-21 18:53:20,,
17,9.0,https://scontent-atl3-1.xx.fbcdn.net/v/t1.0-9/fr/cp0/e15/q65/110184423_3117316224970181_6131314186178131889_o.jpg?_nc_cat=111&_nc_sid=2d5d41&_nc_ohc=E4aA4vgDiYAAX-Etfjx&_nc_ht=scontent-atl3-1.xx&tp=14&oh=73a4c72d0658427a1104cbc8dbadc12b&oe=5F83FDCB,17.0,,3117316221636848,Here is information about school opening and the safety plan. This is from the NEWS section of our district’s website.,,,0.0,Here is information about school opening and the safety plan. This is from the NEWS section of our district’s website.,2020-07-21 18:34:37,,
18,0.0,,7.0,,3081258798575924,Everyone is welcome to pick up a sack lunch at the Dixon Area Caring Center.,https://facebook.com/story.php?story_fbid=3081258798575924&id=669082349793593,"Dixon Area Caring-Center
July 8 at 1:35 PM ·",3.0,"Everyone is welcome to pick up a sack lunch at the Dixon Area Caring Center.

Dixon Area Caring-Center
July 8 at 1:35 PM ·",2020-07-08 16:51:39,,
19,0.0,https://scontent-atl3-1.xx.fbcdn.net/v/t1.0-9/fr/cp0/e15/q65/105740289_3038040846231053_2700235038772837205_o.jpg?_nc_cat=105&_nc_sid=2d5d41&_nc_ohc=4VbYOc5TDoQAX82EbXj&_nc_ht=scontent-atl3-1.xx&tp=14&oh=7105743c4e1f0e2118ef5e3e88b23cd1&oe=5F827FD5,5.0,,3038040842897720,Santee Community Church and Dixon Area Caring Center have lunches and produce boxes available until 1:00.,,,0.0,Santee Community Church and Dixon Area Caring Center have lunches and produce boxes available until 1:00.,2020-06-22 13:21:20,,
20,0.0,,2.0,,3038008149567656,Santee Community Church and Dixon Area Caring Center have free lunches and produce boxes available at the Caring Center until 1:00. #desbulldogpride,https://facebook.com/story.php?story_fbid=3038008149567656&id=669082349793593,,0.0,Santee Community Church and Dixon Area Caring Center have free lunches and produce boxes available at the Caring Center until 1:00. #desbulldogpride,2020-06-22 13:02:20,,
21,2.0,,1.0,https://www.smore.com/78m3q,2993559690679169,Here is the link to your May Family Newsletter https://www.smore.com/78m3q . Have a great summer!,https://facebook.com/story.php?story_fbid=2993559690679169&id=669082349793593,"SMORE.COM
DES Family Newsletter",0.0,"Here is the link to your May Family Newsletter https://www.smore.com/78m3q . Have a great summer!

SMORE.COM
DES Family Newsletter",2020-06-05 10:12:53,,
22,1.0,,0.0,https://forms.gle/9YerjGJtmFkHehcx7,2985893934779078,,https://facebook.com/story.php?story_fbid=2985893934779078&id=669082349793593,"Dixon R-I School District
June 2 at 7:21 AM ·

Dixon R-1 summer school registration deadline has been changed to Friday, June 5. Use the following link to access the registration form:

https://forms.gle/9YerjGJtmFkHehcx7",0.0,"Dixon R-I School District
June 2 at 7:21 AM ·

Dixon R-1 summer school registration deadline has been changed to Friday, June 5. Use the following link to access the registration form:

https://forms.gle/9YerjGJtmFkHehcx7",2020-06-02 10:23:46,,
23,0.0,,0.0,https://forms.gle/9YerjGJtmFkHehcx7,,"Dixon R-1 summer school registration deadline has been changed to Friday, June 5. Use the following link to access the registration form:

https://forms.gle/9YerjGJtmFkHehcx7",https://facebook.com/story.php?story_fbid=3602579416438020&id=761144070581583,,0.0,"Dixon R-1 summer school registration deadline has been changed to Friday, June 5. Use the following link to access the registration form:

https://forms.gle/9YerjGJtmFkHehcx7",2020-09-12 20:42:45.436311,,
24,2.0,,4.0,https://forms.gle/9YerjGJtmFkHehcx7,2971465239555281,"Parents who are interested in registering your child for summer school, please use the following link to register:

https://forms.gle/9YerjGJtmFkHehcx7

Important information and dates can be found when you click on the link. #desbulldogpride",,,0.0,"Parents who are interested in registering your child for summer school, please use the following link to register:

https://forms.gle/9YerjGJtmFkHehcx7

Important information and dates can be found when you click on the link. #desbulldogpride",2020-05-27 12:46:11,,
25,0.0,,19.0,,2971450469556758,Our district was proud to be a part of this. Today was the last day for meal deliveries. Have a great summer! #desbulldogpride,https://facebook.com/story.php?story_fbid=2971450469556758&id=669082349793593,"Missouri Department of Elementary and Secondary Education
May 22 at 5:42 AM ·

A significant update to our previous count! In the time since school buildings closed due to #COVID19, Missouri schools have served over 11.2 MILLION meals to students and families. Thanks to our school staff and partners for assisting this effort! #ShowMeSuccess #WeServeMO",0.0,"Our district was proud to be a part of this. Today was the last day for meal deliveries. Have a great summer! #desbulldogpride

Missouri Department of Elementary and Secondary Education
May 22 at 5:42 AM ·

A significant update to our previous count! In the time since school buildings closed due to #COVID19, Missouri schools have served over 11.2 MILLION meals to students and families. Thanks to our school staff and partners for assisting this effort! #ShowMeSuccess #WeServeMO",2020-05-27 12:36:37,,
26,1.0,,1.0,,2956636391038166,,https://facebook.com/story.php?story_fbid=2956636391038166&id=669082349793593,"Dixon R-1 Middle School
May 21 at 10:58 AM ·

New Student Registration for Dixon R1 Schools will be August 6th, 7th and 10th from 9-1. For an appointment, please contact the school that your student will be enrolled in. 573-759-7163 extension (DHS 2), (DMS 3) (DES 4).",0.0,"Dixon R-1 Middle School
May 21 at 10:58 AM ·

New Student Registration for Dixon R1 Schools will be August 6th, 7th and 10th from 9-1. For an appointment, please contact the school that your student will be enrolled in. 573-759-7163 extension (DHS 2), (DMS 3) (DES 4).",2020-05-21 17:27:53,,
27,0.0,,0.0,,,"New Student Registration for Dixon R1 Schools will be August 6th, 7th and 10th from 9-1. For an appointment, please contact the school that your student will be enrolled in. 573-759-7163 extension (DHS 2), (DMS 3) (DES 4).",https://facebook.com/story.php?story_fbid=2940889029364122&id=1039023059550738,,0.0,"New Student Registration for Dixon R1 Schools will be August 6th, 7th and 10th from 9-1. For an appointment, please contact the school that your student will be enrolled in. 573-759-7163 extension (DHS 2), (DMS 3) (DES 4).",2020-09-12 20:42:45.436321,,
28,2.0,https://scontent-atl3-1.xx.fbcdn.net/v/t1.0-9/fr/cp0/e15/q65/97998074_2941537425881396_8713588933834833920_o.jpg?_nc_cat=109&_nc_sid=110474&_nc_ohc=3IU3edGYgLsAX_p54Iy&_nc_ht=scontent-atl3-1.xx&tp=14&oh=f190ccb6bdab4699ba35ce52ee178efa&oe=5F839C5F,17.0,,2941575292544276,"Thanks for being flexible and making 2019-2020 a great school year, despite the challenges.

Don’t forget to pick up your child’s supplies from DES any week day from 9:00-1:00.

All 5th grade parents need to call the DMS office during 9:00-1:00 to request locker partners. The last day to request is May 29th.",https://facebook.com/story.php?story_fbid=2941575292544276&id=669082349793593,,0.0,"Thanks for being flexible and making 2019-2020 a great school year, despite the challenges.

Don’t forget to pick up your child’s supplies from DES any week day from 9:00-1:00.

All 5th grade parents need to call the DMS office during 9:00-1:00 to request locker partners. The last day to request is May 29th.",2020-05-16 10:07:48,,
29,1.0,,10.0,,2912574632111009,,,,0.0,,2020-05-06 10:10:24,,
30,0.0,,27.0,,2909847259050413,"Good morning,

This week is Teacher Appreciation Week and I want to reach out to you, our parents, and tell you thank you for all you have done these past few weeks to help educate your child at home. You are your child's first teacher and I realize that these last few weeks have been stressful for everyone involved. Words can never tell you how much I appreciate you, for all you do, and for all you continue to do each and every day. A quote by Henry Ford sums up how I feel, ""Coming together is the beginning. Keeping together is progress. Working together is success"". Together we are strong! #desbulldogpride

Have a great week, Mrs. Allen.",https://facebook.com/story.php?story_fbid=2909847259050413&id=669082349793593,,0.0,"Good morning,

This week is Teacher Appreciation Week and I want to reach out to you, our parents, and tell you thank you for all you have done these past few weeks to help educate your child at home. You are your child's first teacher and I realize that these last few weeks have been stressful for everyone involved. Words can never tell you how much I appreciate you, for all you do, and for all you continue to do each and every day. A quote by Henry Ford sums up how I feel, ""Coming together is the beginning. Keeping together is progress. Working together is success"". Together we are strong! #desbulldogpride

Have a great week, Mrs. Allen.",2020-05-05 11:05:41,,
31,0.0,https://scontent-atl3-1.xx.fbcdn.net/v/t1.0-9/fr/cp0/e15/q65/96144736_2909616632406809_8842412655357460480_n.jpg?_nc_cat=103&_nc_sid=2d5d41&_nc_ohc=8KuhnuQoY48AX9U_ptx&_nc_ht=scontent-atl3-1.xx&tp=14&oh=0d926c08208dd7fae785d0f6431bcbcf&oe=5F82D270,5.0,,2909616629073476,"We are blessed with some amazing teachers at DES! If you get a chance, take a minute to show your gratitude. A grateful email would bring a smile to any teacher. #desbulldogpride",,,0.0,"We are blessed with some amazing teachers at DES! If you get a chance, take a minute to show your gratitude. A grateful email would bring a smile to any teacher. #desbulldogpride",2020-05-05 09:54:24,,
32,0.0,https://scontent-atl3-1.xx.fbcdn.net/v/t1.0-9/fr/cp0/e15/q65/94889865_2895134310521708_6006076090563428352_n.jpg?_nc_cat=104&_nc_sid=2d5d41&_nc_ohc=cUxZgQIZ-LwAX9TvhbI&_nc_ht=scontent-atl3-1.xx&tp=14&oh=89f11253ddf38159aa22ec060b18cb2b&oe=5F82FAFB,5.0,,2895134307188375,"Please come by the elementary school office and pick up your child's supplies. Our office is open 9:00-1:00, Monday through Friday. #desbulldogpride",,,0.0,"Please come by the elementary school office and pick up your child's supplies. Our office is open 9:00-1:00, Monday through Friday. #desbulldogpride",2020-05-01 12:51:03,,
33,2.0,https://scontent-atl3-1.xx.fbcdn.net/v/t1.0-9/fr/cp0/e15/q65/95463156_3080539608677790_3275982658596765696_o.jpg?_nc_cat=111&_nc_sid=8024bb&_nc_ohc=nb5cPOmcoXoAX_ZgOPT&_nc_ht=scontent-atl3-1.xx&tp=14&oh=d3bed9d23b7d67cf3c1456770b87f229&oe=5F81EBE8,15.0,,2894574790577660,Thank you to our lunch staff! We appreciate all you do! #desbulldogpride,https://facebook.com/story.php?story_fbid=2894574790577660&id=669082349793593,"Missouri Department of Elementary and Secondary Education
May 1 at 5:00 AM ·

Today, we celebrate ""School Lunch Hero Day!"" Between preparing healthy food, adhering to strict nutrition standards, navigating student food allergies, and offering service with a smile, Missouri nutrition professionals have a lot on their plate on a “normal” day. Extended building closures during COVID-19 required our food service professionals to quickly be innovative and creative to develop ways to continue feeding the Missouri students who rely on school breakfast and lunch each day.

Join us in recognizing these important team members today!",2.0,"Thank you to our lunch staff! We appreciate all you do! #desbulldogpride

Missouri Department of Elementary and Secondary Education
May 1 at 5:00 AM ·

Today, we celebrate ""School Lunch Hero Day!"" Between preparing healthy food, adhering to strict nutrition standards, navigating student food allergies, and offering service with a smile, Missouri nutrition professionals have a lot on their plate on a “normal” day. Extended building closures during COVID-19 required our food service professionals to quickly be innovative and creative to develop ways to continue feeding the Missouri students who rely on school breakfast and lunch each day.

Join us in recognizing these important team members today!",2020-05-01 09:39:57,,
34,0.0,https://scontent-atl3-1.xx.fbcdn.net/v/t1.0-9/fr/cp0/e15/q65/95129330_2887753971259742_1015505430425632768_n.jpg?_nc_cat=111&_nc_sid=2d5d41&_nc_ohc=o6eBRIYLqZwAX-4RDlU&_nc_ht=scontent-atl3-1.xx&tp=14&oh=c5f5cb32291b476b03caed56f7585b1e&oe=5F81D23F,9.0,,2887753964593076,,,,0.0,,2020-04-29 09:30:29,,
35,0.0,https://scontent-atl3-1.xx.fbcdn.net/v/t1.0-9/fr/cp0/e15/q65/94883319_2883681515000321_4775339171646537728_o.jpg?_nc_cat=104&_nc_sid=8024bb&_nc_aid=0&_nc_ohc=XatimZxG7qMAX-RmWzJ&_nc_ht=scontent-atl3-1.xx&tp=14&oh=e0843569e3b95837648d604c19643343&oe=5F841455,6.0,,2883733021661837,"Tuesday, April 28, from 10:00-1:00 you can drop off your library books and pick up your child's packets.

If you collected soda tabs for the Ronald McDonald House, feel free to bring them too. There will be a tote for your Ziploc bags of tabs.

Most students' school supplies from their desks should be bagged and ready for pick up then too. You may want to touch base with your child's teacher to confirm.",https://facebook.com/story.php?story_fbid=2883733021661837&id=669082349793593,,0.0,"Tuesday, April 28, from 10:00-1:00 you can drop off your library books and pick up your child's packets.

If you collected soda tabs for the Ronald McDonald House, feel free to bring them too. There will be a tote for your Ziploc bags of tabs.

Most students' school supplies from their desks should be bagged and ready for pick up then too. You may want to touch base with your child's teacher to confirm.",2020-04-27 13:09:21,,
