,comments,image,likes,link,post_id,post_text,post_url,shared_text,shares,text,time,video,video_thumbnail
76,0.0,,16.0,,2797148400320300,"Due to ongoing COVID-19 concerns, Dixon R-I will remain closed for on-site classes through 04/03. We will re-evaluate the week of 03/30 and tentatively resume 04/06.

Teachers are posting and distributing lessons one week at a time. We plan to initiate our distance education plan this coming Monday, March 23. We are asking students to begin their first week’s lessons at that time.

Teachers will hold virtual office hours to assist students from 9am-1pm each school day.

Assignments sent home to students will be graded. Finished assignments should be turned in digitally.

Additional academic support will be provided by a Homework Hotline that will be offered through Dawg Pound.

Thank you for your continued patience and support. #desbulldogpride",https://facebook.com/story.php?story_fbid=2797148400320300&id=669082349793593,,0.0,"Due to ongoing COVID-19 concerns, Dixon R-I will remain closed for on-site classes through 04/03. We will re-evaluate the week of 03/30 and tentatively resume 04/06.

Teachers are posting and distributing lessons one week at a time. We plan to initiate our distance education plan this coming Monday, March 23. We are asking students to begin their first week’s lessons at that time.

Teachers will hold virtual office hours to assist students from 9am-1pm each school day.

Assignments sent home to students will be graded. Finished assignments should be turned in digitally.

Additional academic support will be provided by a Homework Hotline that will be offered through Dawg Pound.

Thank you for your continued patience and support. #desbulldogpride",2020-03-19 16:47:18,,
77,3.0,,6.0,,2788384034530070,,https://facebook.com/story.php?story_fbid=2788384034530070&id=669082349793593,"Dixon R-I School District
March 15 at 3:04 PM ·

BULLDOG ALERT: In light of recent information, Dixon R-I School District is taking precautionary measures by extending Spring Break thru 03/22. As this is an evolving, fluid state of affairs, more info regarding all school activities will be forthcoming by the end of the week.",10.0,"Dixon R-I School District
March 15 at 3:04 PM ·

BULLDOG ALERT: In light of recent information, Dixon R-I School District is taking precautionary measures by extending Spring Break thru 03/22. As this is an evolving, fluid state of affairs, more info regarding all school activities will be forthcoming by the end of the week.",2020-03-15 18:34:18,,
78,0.0,,0.0,,,"BULLDOG ALERT: In light of recent information, Dixon R-I School District is taking precautionary measures by extending Spring Break thru 03/22. As this is an evolving, fluid state of affairs, more info regarding all school activities will be forthcoming by the end of the week.",https://facebook.com/story.php?story_fbid=3390572900972007&id=761144070581583,,0.0,"BULLDOG ALERT: In light of recent information, Dixon R-I School District is taking precautionary measures by extending Spring Break thru 03/22. As this is an evolving, fluid state of affairs, more info regarding all school activities will be forthcoming by the end of the week.",2020-09-12 20:42:45.436408,,
79,2.0,https://scontent-atl3-1.xx.fbcdn.net/v/t1.0-9/fr/cp0/e15/q65/87891700_2771752689526538_3238754526320132096_o.jpg?_nc_cat=110&_nc_sid=2d5d41&_nc_ohc=1gY7nnnEyD4AX-OUu-1&_nc_ht=scontent-atl3-1.xx&tp=14&oh=e0e872214094ee4460af7e1d0dec88be&oe=5F8289C4,22.0,,2771752686193205,Congratulations to this first grader!!! He is the first student in 1st grade to reach 100 AR points. This is a huge accomplishment!!! Great Job and keep on reading those books!!! #desbulldogpride,,,0.0,Congratulations to this first grader!!! He is the first student in 1st grade to reach 100 AR points. This is a huge accomplishment!!! Great Job and keep on reading those books!!! #desbulldogpride,2020-03-07 23:10:14,,
80,7.0,https://scontent-atl3-1.xx.fbcdn.net/v/t1.0-9/87638107_2771713022863838_3706306594603008000_n.png?_nc_cat=109&_nc_sid=2d5d41&_nc_ohc=eu5WmWgO2F4AX-OqHu1&_nc_ht=scontent-atl3-1.xx&oh=0475152d282ae6ee7b7beb91d5f1778c&oe=5F8439B2,58.0,,2771713019530505,"Mrs. Allen is fired up that the illustrations are finished and her new book is now going to publishing and soon will be ready for purchase at Barnes and Noble, iTunes, and Amazon. Be on the lookout for “The Ozark Gingerbread Man” in a few weeks. #desbulldogpride",,,0.0,"Mrs. Allen is fired up that the illustrations are finished and her new book is now going to publishing and soon will be ready for purchase at Barnes and Noble, iTunes, and Amazon. Be on the lookout for “The Ozark Gingerbread Man” in a few weeks. #desbulldogpride",2020-03-07 22:40:18,,
81,0.0,https://scontent-atl3-1.xx.fbcdn.net/v/t1.0-9/fr/cp0/e15/q65/88257475_2769268053108335_1934062969260343296_n.jpg?_nc_cat=104&_nc_sid=2d5d41&_nc_ohc=txbd8trq8ykAX86Dhvx&_nc_ht=scontent-atl3-1.xx&tp=14&oh=8caabfda021fe7c0ace7976550b8970f&oe=5F81F87A,6.0,,2769268049775002,"Happy Spring Break! Have fun and be safe. Classes will resume on Monday, March 16. #desbulldogpride",,,0.0,"Happy Spring Break! Have fun and be safe. Classes will resume on Monday, March 16. #desbulldogpride",2020-03-06 17:51:19,,
82,0.0,,10.0,,2765522523482888,,https://facebook.com/story.php?story_fbid=2765522523482888&id=669082349793593,"Des Web
March 4 at 9:07 PM ·

Thank you to these officers for coming to Dixon Elementary to share some information about the K-9 Unit to our second graders. #desbulldogpride",0.0,"Des Web
March 4 at 9:07 PM ·

Thank you to these officers for coming to Dixon Elementary to share some information about the K-9 Unit to our second graders. #desbulldogpride",2020-03-04 23:09:09,,
83,2.0,https://scontent-atl3-1.xx.fbcdn.net/v/t1.0-9/fr/cp0/e15/q65/87725632_2765509963484144_684350614246785024_o.jpg?_nc_cat=111&_nc_sid=110474&_nc_ohc=QwSuPeyeJ5wAX-XY1YM&_nc_ht=scontent-atl3-1.xx&tp=14&oh=8105e087bd0bf7668c29676c362a22c9&oe=5F815321,35.0,,2765516103483530,"Second Grade students are reading a book called, “Officer Buckle and Gloria” which is about an officer and his K-9 partner. To create a text to real-life correlation, students were introduced to Missouri Highway Patrol K-9 team, Bruno, and his handler. #desbulldogpride",https://facebook.com/story.php?story_fbid=2765516103483530&id=669082349793593,,0.0,"Second Grade students are reading a book called, “Officer Buckle and Gloria” which is about an officer and his K-9 partner. To create a text to real-life correlation, students were introduced to Missouri Highway Patrol K-9 team, Bruno, and his handler. #desbulldogpride",2020-03-04 23:04:19,,
84,2.0,https://scontent-atl3-1.xx.fbcdn.net/v/t1.0-9/fr/cp0/e15/q65/88059954_2765015840200223_5620304640592576512_o.jpg?_nc_cat=107&_nc_sid=8024bb&_nc_ohc=DIahpKGf7I0AX-S2OMD&_nc_ht=scontent-atl3-1.xx&tp=14&oh=e47768c123910a5a79244ed742150b84&oe=5F83B286,41.0,,2765016773533463,"Mrs. Wilson's class would like to give a BIG thank you to Daniel Draper, for supplying the class with our very own Waliki Exercise balls!!! The students are now able to bounce and wiggle in style. #desbulldogpride",https://facebook.com/story.php?story_fbid=2765016773533463&id=669082349793593,,0.0,"Mrs. Wilson's class would like to give a BIG thank you to Daniel Draper, for supplying the class with our very own Waliki Exercise balls!!! The students are now able to bounce and wiggle in style. #desbulldogpride",2020-03-04 17:05:11,,
85,3.0,https://scontent-atl3-1.xx.fbcdn.net/v/t1.0-9/fr/cp0/e15/q65/87394543_2764211243614016_9148550923419648000_o.jpg?_nc_cat=102&_nc_sid=8024bb&_nc_ohc=i9y2H2AeryUAX-H62Rx&_nc_ht=scontent-atl3-1.xx&tp=14&oh=437cff7de5addfebfe13b63cb6ee7fb7&oe=5F8392F2,20.0,,2764212310280576,Congratulations to this 2nd grader who reached his AR reading goal of 75 AR points. Great Job!!! Keep working hard and reading those books!!!! #desbulldogpride,https://facebook.com/story.php?story_fbid=2764212310280576&id=669082349793593,,0.0,Congratulations to this 2nd grader who reached his AR reading goal of 75 AR points. Great Job!!! Keep working hard and reading those books!!!! #desbulldogpride,2020-03-04 08:40:14,,
86,0.0,https://scontent-atl3-1.xx.fbcdn.net/v/t1.0-9/fr/cp0/e15/q65/88985477_2763113193723821_7891041617920917504_o.jpg?_nc_cat=106&_nc_sid=110474&_nc_ohc=lUatr9BoaYcAX82V7ub&_nc_ht=scontent-atl3-1.xx&tp=14&oh=a93a3fd32ac88a26f674b6fd57e76ba0&oe=5F8123B7,6.0,,2763113383723802,,https://facebook.com/story.php?story_fbid=2763113383723802&id=669082349793593,,0.0,,2020-03-03 19:06:05,,
87,0.0,,0.0,https://www.smore.com/7n2jz,2762470703788070,,https://facebook.com/story.php?story_fbid=2762470703788070&id=669082349793593,"SMORE.COM
March Family Newsletter",0.0,"SMORE.COM
March Family Newsletter",2020-03-03 11:44:35,,
88,0.0,https://scontent-atl3-1.xx.fbcdn.net/v/t1.0-9/fr/cp0/e15/q65/88095804_2761071013928039_8096944007948533760_o.jpg?_nc_cat=104&_nc_sid=2d5d41&_nc_ohc=73AnzGgbGmwAX8sTk0K&_nc_ht=scontent-atl3-1.xx&tp=14&oh=c4b4aa4f57dbc5164c1fee23f4f853bb&oe=5F810CD4,30.0,,2761071010594706,Being student of the month is a great accomplishment! Sorry for the confusion of not getting everyone’s pictures posted at the same time. #desbulldogpride,,,0.0,Being student of the month is a great accomplishment! Sorry for the confusion of not getting everyone’s pictures posted at the same time. #desbulldogpride,2020-03-02 20:05:04,,
89,0.0,https://scontent-atl3-1.xx.fbcdn.net/v/t1.0-9/fr/cp0/e15/q65/88057126_2761017553933385_8152402871942381568_n.jpg?_nc_cat=109&_nc_sid=2d5d41&_nc_ohc=p1fZZ3xmTUUAX8Q5-2m&_nc_oc=AQl8ZcQIuAMjCydIl6_lwyybG37JDMes4X5USre9ZoL_IQY7Zx5ectw1cnfxJdCgbSI&_nc_ht=scontent-atl3-1.xx&tp=14&oh=899d5642f7d7d3870050c568a16c404c&oe=5F81F631,4.0,,2761017550600052,Don’t forget Spring Pictures are tomorrow. #desbulldogpride,,,0.0,Don’t forget Spring Pictures are tomorrow. #desbulldogpride,2020-03-02 19:26:44,,
90,1.0,https://scontent-atl3-1.xx.fbcdn.net/v/t1.0-9/fr/cp0/e15/q65/88041290_2760808820620925_8704130312042446848_o.jpg?_nc_cat=109&_nc_sid=110474&_nc_ohc=BNyuEoJmiuUAX-0QtWL&_nc_ht=scontent-atl3-1.xx&tp=14&oh=e90e817456d33c684f46dbea8e1da7cc&oe=5F8107CF,33.0,,2760810417287432,Here are some more Braggin’ Wagon pictures. #desbulldogpride,https://facebook.com/story.php?story_fbid=2760810417287432&id=669082349793593,,0.0,Here are some more Braggin’ Wagon pictures. #desbulldogpride,2020-03-02 16:57:51,,
91,1.0,https://scontent-atl3-1.xx.fbcdn.net/v/t1.0-9/fr/cp0/e15/q65/88011443_2759888240712983_8964419447737548800_o.jpg?_nc_cat=100&_nc_sid=110474&_nc_ohc=LA8DWtiypM4AX-8-bVV&_nc_ht=scontent-atl3-1.xx&tp=14&oh=f9dc7a53536e42b4d02bb8bf01b8eb46&oe=5F84D30A,33.0,,2759889997379474,"Outstanding job to the students in the photos below!!! They all read 4 out of 12 Mark Twain nominee books and voted for their favorite. They all received treat bags for their hard work. We are extremely proud of the three in the last photo, too. They read ALL 12 of the Mark Twain Nominees to receive a treat bag, a trip to a restaurant of their choice in town, and ice cream from Johnson’s Snackette. Great job to all of these readers. Keep on reading those books!!!!! #desbulldogpride",https://facebook.com/story.php?story_fbid=2759889997379474&id=669082349793593,,0.0,"Outstanding job to the students in the photos below!!! They all read 4 out of 12 Mark Twain nominee books and voted for their favorite. They all received treat bags for their hard work. We are extremely proud of the three in the last photo, too. They read ALL 12 of the Mark Twain Nominees to receive a treat bag, a trip to a restaurant of their choice in town, and ice cream from Johnson’s Snackette. Great job to all of these readers. Keep on reading those books!!!!! #desbulldogpride",2020-03-02 07:41:06,,
92,0.0,https://scontent-atl3-1.xx.fbcdn.net/v/t1.0-9/fr/cp0/e15/q65/88082422_2759873930714414_240800451006562304_o.jpg?_nc_cat=107&_nc_sid=110474&_nc_ohc=n7Ma_mxF1qsAX-n54QW&_nc_ht=scontent-atl3-1.xx&tp=14&oh=d77c56b63f4aa82366e3f3fa24ea80fb&oe=5F81F489,22.0,,2759877834047357,"Thank you to every student that participated in Readquest. We had 1,874 AR tests taken and passed on Friday, February 28th. There were classes from each grade that had the most AR tests passed: Mrs. Baker’s Class, Mrs. Warnol's Class, Mrs. Eckert's Class, Mrs. Ray's 4th Grade Class, and the overall winner that won out of the whole school: Mr. Clubb’s class!!!! Thank you to all the students and teachers for participating this year.#desbulldogpride",https://facebook.com/story.php?story_fbid=2759877834047357&id=669082349793593,,0.0,"Thank you to every student that participated in Readquest. We had 1,874 AR tests taken and passed on Friday, February 28th. There were classes from each grade that had the most AR tests passed: Mrs. Baker’s Class, Mrs. Warnol's Class, Mrs. Eckert's Class, Mrs. Ray's 4th Grade Class, and the overall winner that won out of the whole school: Mr. Clubb’s class!!!! Thank you to all the students and teachers for participating this year.#desbulldogpride",2020-03-02 07:34:12,,
93,5.0,https://scontent-atl3-1.xx.fbcdn.net/v/t1.0-9/fr/cp0/e15/q65/87887679_2759857980716009_3393006885186568192_o.jpg?_nc_cat=110&_nc_sid=110474&_nc_ohc=HDSMRNEkZ1EAX-Emy7I&_nc_ht=scontent-atl3-1.xx&tp=14&oh=0c3dc2aff93b0872de3d5b13de68342d&oe=5F848177,38.0,,2759860854049055,Congratulations to our students of the month! The Braggin’ Wagon rolled out last week to recognize these awesome students. We are proud of you! #desbulldogpride,https://facebook.com/story.php?story_fbid=2759860854049055&id=669082349793593,,0.0,Congratulations to our students of the month! The Braggin’ Wagon rolled out last week to recognize these awesome students. We are proud of you! #desbulldogpride,2020-03-02 07:24:18,,
94,0.0,https://scontent-atl3-1.xx.fbcdn.net/v/t1.0-9/fr/cp0/e15/q65/88041288_2758861777482296_8323481345011482624_n.jpg?_nc_cat=106&_nc_sid=8024bb&_nc_ohc=Qpd4maVXpVsAX-JOVAt&_nc_ht=scontent-atl3-1.xx&tp=14&oh=6ec7ba753408f3c385905c7c3f8a1fb8&oe=5F83B08B,6.0,,2758863354148805,This week's activity schedule and menu.,https://facebook.com/story.php?story_fbid=2758863354148805&id=669082349793593,,0.0,This week's activity schedule and menu.,2020-03-01 19:00:15,,
95,1.0,https://scontent-atl3-1.xx.fbcdn.net/v/t1.0-9/fr/cp0/e15/q65/88937762_2752794608089013_3664462875721728000_o.jpg?_nc_cat=110&_nc_sid=110474&_nc_ohc=e6D4v2A0KsoAX8A7IQW&_nc_ht=scontent-atl3-1.xx&tp=14&oh=845db83176111e30cbb60fee93b462ef&oe=5F82C455,20.0,,2752798841421923,Great job to the 4th Grade students who created dream jars and wrote awesome papers after reading the BFG by Roald Dahl. #desbulldogpride,https://facebook.com/story.php?story_fbid=2752798841421923&id=669082349793593,,0.0,Great job to the 4th Grade students who created dream jars and wrote awesome papers after reading the BFG by Roald Dahl. #desbulldogpride,2020-02-27 22:09:42,,
96,5.0,https://scontent-atl3-1.xx.fbcdn.net/v/t1.0-9/fr/cp0/e15/q65/88945733_2752784564756684_7098341477150883840_o.jpg?_nc_cat=109&_nc_sid=2d5d41&_nc_ohc=p5mt5ad95FsAX8jZC6S&_nc_ht=scontent-atl3-1.xx&tp=14&oh=e7737f3a3cf9a6acd2a78b53c637a8e8&oe=5F81B3CC,30.0,,2752784558090018,Congratulations to this 2nd grade student for getting 75 AR Reading points. She has worked very hard to reach this goal. Keep up the great work!!! Happy Reading!!!! #desbulldogpride,,,0.0,Congratulations to this 2nd grade student for getting 75 AR Reading points. She has worked very hard to reach this goal. Keep up the great work!!! Happy Reading!!!! #desbulldogpride,2020-02-27 21:59:45,,
97,0.0,https://scontent-atl3-1.xx.fbcdn.net/v/t1.0-9/fr/cp0/e15/q65/87572622_2752775124757628_7563878149209980928_n.jpg?_nc_cat=108&_nc_sid=2d5d41&_nc_ohc=QHi7iByKc-0AX-AtqMt&_nc_ht=scontent-atl3-1.xx&tp=14&oh=affa37ea54136faf5bd1c34e440564ad&oe=5F81AD81,2.0,,2752775121424295,"Don’t forget tomorrow is our annual Readquest Day. This day is for students to get the opportunity to read books and take AR tests.

Also, don’t forget to turn in Daddy Daughter Dance forms, if your daughter is interested.",,,0.0,"Don’t forget tomorrow is our annual Readquest Day. This day is for students to get the opportunity to read books and take AR tests.

Also, don’t forget to turn in Daddy Daughter Dance forms, if your daughter is interested.",2020-02-27 21:57:25,,
98,0.0,https://scontent-atl3-1.xx.fbcdn.net/v/t1.0-9/87287878_2746839485351192_3184528549868470272_n.png?_nc_cat=102&_nc_sid=2d5d41&_nc_ohc=0GU_B49jnR4AX_0cCAh&_nc_ht=scontent-atl3-1.xx&oh=17d1ca949850ce70a5b4524771cbae15&oe=5F828721,9.0,,2746839482017859,"Menu Change:

Due to freezer issues the menu has changed this week.
Tuesday- popcorn chicken, corn, applesauce, potato wedges
Wednesday- mozzarella sticks, raw veggies, apple cobbler, mixed fruit
Thursday- tater tot casserole, green beans, pears, sliced bread
Friday- chicken strips, french fries, green beans, fruit",,,0.0,"Menu Change:

Due to freezer issues the menu has changed this week.
Tuesday- popcorn chicken, corn, applesauce, potato wedges
Wednesday- mozzarella sticks, raw veggies, apple cobbler, mixed fruit
Thursday- tater tot casserole, green beans, pears, sliced bread
Friday- chicken strips, french fries, green beans, fruit",2020-02-24 21:41:37,,
99,0.0,https://scontent-atl3-1.xx.fbcdn.net/v/t1.0-9/87264142_2744823222219485_4452716471209951232_n.png?_nc_cat=102&_nc_sid=2d5d41&_nc_ohc=AlFdlWG-bOoAX9g4G1F&_nc_ht=scontent-atl3-1.xx&oh=5726de1cd73b0f4a280d4efe7982a336&oe=5F827FA6,6.0,,2744823218886152,"Activity Schedule for Feb 24-28

Monday C
Tuesday D
Wednesday E
Thursday A
Friday All to the gym for Read Across America Activities
*Remember to wear gym shoes.",,,0.0,"Activity Schedule for Feb 24-28

Monday C
Tuesday D
Wednesday E
Thursday A
Friday All to the gym for Read Across America Activities
*Remember to wear gym shoes.",2020-02-23 21:55:14,,
100,0.0,,33.0,,2734301639938310,DES students are excited to learn from our amazing DHS Cheerleaders! #desbulldogpride,https://facebook.com/story.php?story_fbid=2734301639938310&id=669082349793593,"Sarah G'Sell
February 18 at 8:34 PM ·

Day 1 of the elementary cheer camp brought tons of smiles and lots of excitement! We are super excited to share our love of cheer with these kiddos this week!",5.0,"DES students are excited to learn from our amazing DHS Cheerleaders! #desbulldogpride

Sarah G'Sell
February 18 at 8:34 PM ·

Day 1 of the elementary cheer camp brought tons of smiles and lots of excitement! We are super excited to share our love of cheer with these kiddos this week!",2020-02-18 22:45:03,,
101,0.0,https://scontent-atl3-1.xx.fbcdn.net/v/t1.0-9/fr/cp0/e15/q65/86348835_2730127797022361_7032819247084470272_n.jpg?_nc_cat=101&_nc_sid=2d5d41&_nc_ohc=jdO_DIKCLHUAX_8S898&_nc_ht=scontent-atl3-1.xx&tp=14&oh=950f3d1e22ccf25acb5a80ea8b637693&oe=5F84DBBA,7.0,,2730127793689028,"Here is the activity schedule for this week:
Monday NO SCHOOL
Tuesday D
Wednesday E
Thursday A
Friday B",,,0.0,"Here is the activity schedule for this week:
Monday NO SCHOOL
Tuesday D
Wednesday E
Thursday A
Friday B",2020-02-17 01:31:37,,
102,1.0,https://scontent-atl3-1.xx.fbcdn.net/v/t1.0-9/fr/cp0/e15/q65/84333642_2723472091021265_8480583951549726720_o.jpg?_nc_cat=106&_nc_sid=110474&_nc_ohc=hJXaIXhY-sYAX-Weodm&_nc_ht=scontent-atl3-1.xx&tp=14&oh=223ac881eb9a1947336efe0a481ae74f&oe=5F832A74,52.0,,2723474221021052,DES students were excited this morning to cheer on our DHS athletes in a short Pep Assembly. Good luck Bulldogs at Homecoming 2020. #desbulldogpride,https://facebook.com/story.php?story_fbid=2723474221021052&id=669082349793593,,0.0,DES students were excited this morning to cheer on our DHS athletes in a short Pep Assembly. Good luck Bulldogs at Homecoming 2020. #desbulldogpride,2020-02-13 22:15:32,,
103,0.0,https://scontent-atl3-1.xx.fbcdn.net/v/t1.0-9/fr/cp0/e15/q65/84621030_2723287264373081_1301619770679885824_n.jpg?_nc_cat=102&_nc_sid=2d5d41&_nc_ohc=0EDebRBQM9kAX9idFBr&_nc_ht=scontent-atl3-1.xx&tp=14&oh=5c61afdaf599c12413d9f0ad8b89bf85&oe=5F84AA24,8.0,,2723287261039748,Happy EARLY Valentine’s Day! Harlem Wizards tickets make a great gift for your loved ones. These are for sale online! #desbulldogpride,,,0.0,Happy EARLY Valentine’s Day! Harlem Wizards tickets make a great gift for your loved ones. These are for sale online! #desbulldogpride,2020-02-13 19:58:13,,
104,0.0,https://scontent-atl3-1.xx.fbcdn.net/v/t1.0-9/fr/cp0/e15/q65/84397528_2712668315434976_1297022940197421056_o.jpg?_nc_cat=105&_nc_sid=2d5d41&_nc_ohc=Rs4ZXZ_jN4YAX8y7JWE&_nc_ht=scontent-atl3-1.xx&tp=14&oh=61b69782afa74fb99a79c88e8e26f895&oe=5F81DAAC,8.0,,2712668312101643,"DES would like it support our DHS students. This is an optional spirit week. #desbulldogpride

Our activity schedule will be:
Monday A Day
Tuesday B Day
Wednesday C Day
Thursday All to the gym
Friday No School (Professional Development)",,,0.0,"DES would like it support our DHS students. This is an optional spirit week. #desbulldogpride

Our activity schedule will be:
Monday A Day
Tuesday B Day
Wednesday C Day
Thursday All to the gym
Friday No School (Professional Development)",2020-02-08 18:30:21,,
105,1.0,https://scontent-atl3-1.xx.fbcdn.net/v/t1.0-9/fr/cp0/e15/q65/84591991_2710858918949249_3341033679211200512_o.jpg?_nc_cat=106&_nc_sid=110474&_nc_ohc=mWJI-uLaIWEAX8eE7vB&_nc_ht=scontent-atl3-1.xx&tp=14&oh=14b09124a32e534bd655fd99bf553409&oe=5F84BB22,34.0,,2710861035615704,Congratulations to these 2nd grade students for getting 75 AR points. They have read so many books to be the first 2nd graders to reach their goal. Great Job!!! Keep on reading those books!!!,https://facebook.com/story.php?story_fbid=2710861035615704&id=669082349793593,,0.0,Congratulations to these 2nd grade students for getting 75 AR points. They have read so many books to be the first 2nd graders to reach their goal. Great Job!!! Keep on reading those books!!!,2020-02-07 22:01:51,,
106,1.0,https://scontent-atl3-1.xx.fbcdn.net/v/t1.0-9/fr/cp0/e15/q65/84764436_2706653296036478_1660952995409428480_n.jpg?_nc_cat=111&_nc_sid=2d5d41&_nc_ohc=DuHrPabgYRoAX_Z27up&_nc_ht=scontent-atl3-1.xx&tp=14&oh=09861cf8d38ea3b66903748d1fb7eb99&oe=5F82D36D,4.0,,2706653289369812,"No school tomorrow, Thursday, February 6th due to secondary road conditions.",,,0.0,"No school tomorrow, Thursday, February 6th due to secondary road conditions.",2020-02-05 23:14:17,,
107,2.0,https://scontent-atl3-1.xx.fbcdn.net/v/t1.0-9/fr/cp0/e15/q65/83989278_2704592332909241_1936796282152550400_n.jpg?_nc_cat=110&_nc_sid=2d5d41&_nc_ohc=7nbEmwoobskAX-KMERs&_nc_ht=scontent-atl3-1.xx&tp=14&oh=c3cafc4f0d22539229537a73744a4760&oe=5F81EDC8,10.0,,2704592329575908,"Due to the impending forecast and dropping temperatures, there will be no school tomorrow, Wednesday, February 5th.",,,0.0,"Due to the impending forecast and dropping temperatures, there will be no school tomorrow, Wednesday, February 5th.",2020-02-04 22:53:46,,
108,0.0,,7.0,,2703799829655158,,https://facebook.com/story.php?story_fbid=2703799829655158&id=669082349793593,,0.0,,2020-02-04 13:08:11,,
109,0.0,,0.0,,2701631329872008,,https://facebook.com/story.php?story_fbid=2701631329872008&id=669082349793593,"Des Web
February 3 at 9:26 AM ·

Soda Grams are on sale this week in the gym from 7:30 to 8:00. Proceeds go to Bullpup Booster. #desbulldogpride",0.0,"Des Web
February 3 at 9:26 AM ·

Soda Grams are on sale this week in the gym from 7:30 to 8:00. Proceeds go to Bullpup Booster. #desbulldogpride",2020-02-03 11:27:51,,
110,1.0,https://scontent-atl3-1.xx.fbcdn.net/v/t1.0-9/fr/cp0/e15/q65/83954353_2701281943240280_15271709703667712_o.jpg?_nc_cat=110&_nc_sid=110474&_nc_ohc=Ht6RQ4DZVuwAX89Rn7M&_nc_ht=scontent-atl3-1.xx&tp=14&oh=c9addeb328e4189c6205c2ecba9cf022&oe=5F8125E0,3.0,,2701282229906918,,https://facebook.com/story.php?story_fbid=2701282229906918&id=669082349793593,,0.0,,2020-02-03 07:56:05,,
111,0.0,,2.0,,2700658276635980,"This week’s activity schedule will be:
Monday D
Tuesday E
Wednesday A
Thursday B
Friday C",https://facebook.com/story.php?story_fbid=2700658276635980&id=669082349793593,,0.0,"This week’s activity schedule will be:
Monday D
Tuesday E
Wednesday A
Thursday B
Friday C",2020-02-02 23:25:25,,
112,1.0,https://scontent-atl3-1.xx.fbcdn.net/v/t1.0-9/fr/cp0/e15/q65/82743960_2681588995209575_1706944385683292160_o.jpg?_nc_cat=106&_nc_sid=2d5d41&_nc_ohc=faIZbo7g5-8AX_gkDkE&_nc_ht=scontent-atl3-1.xx&tp=14&oh=c220335e2efb5e0df01e9fd0cbbce4c8&oe=5F8153CE,19.0,,2681588988542909,"Let’s celebrate The Kansas City Chiefs Super Bowl run with “Super Bowl Spirit Week”, January 27-31st. #desbulldogpride",,,0.0,"Let’s celebrate The Kansas City Chiefs Super Bowl run with “Super Bowl Spirit Week”, January 27-31st. #desbulldogpride",2020-01-24 15:46:54,,
113,0.0,https://scontent-atl3-1.xx.fbcdn.net/v/t1.0-9/83597788_2679785675389907_4360158229469069312_n.png?_nc_cat=108&_nc_sid=2d5d41&_nc_ohc=IMvpg1rVPL0AX-auyiq&_nc_ht=scontent-atl3-1.xx&oh=3ae58284cefda64f5df1f906c3b99e86&oe=5F83A041,8.0,,2679785668723241,"No school tomorrow, Friday, January 24th due to road conditions. #desbulldogpride",,,0.0,"No school tomorrow, Friday, January 24th due to road conditions. #desbulldogpride",2020-01-23 19:36:31,,
114,0.0,https://scontent-atl3-1.xx.fbcdn.net/v/t1.0-9/fr/cp0/e15/q65/84111992_2677814445587030_7846039569068720128_o.jpg?_nc_cat=104&_nc_sid=2d5d41&_nc_ohc=hvQ2tjHOvFgAX_Xk4q0&_nc_ht=scontent-atl3-1.xx&tp=14&oh=d7bb8c978e53ad66641cf4f22219b5f0&oe=5F818986,5.0,,2677814438920364,"No school on Thursday, January 23rd, due to icy road conditions. #desbulldogpride",,,0.0,"No school on Thursday, January 23rd, due to icy road conditions. #desbulldogpride",2020-01-22 22:29:23,,
