,comments,image,likes,link,post_id,post_text,post_url,shared_text,shares,text,time,video,video_thumbnail
39,0.0,,0.0,http://nhaschools.com/en/covid-19#return,3636564239711819,"As the 2019-20 school year comes to an end, East Arbor would like to share instructions regarding safely returning to our school to pick up student belongings and to return any school-owned items such as Chromebooks and library books. To learn more about return dates and times, please visit nhaschools.com/en/covid-19#return",https://facebook.com/story.php?story_fbid=3636564239711819&id=197805676921043,"NHASCHOOLS.COM
NHA Schools | COVID-19 Information",0.0,"As the 2019-20 school year comes to an end, East Arbor would like to share instructions regarding safely returning to our school to pick up student belongings and to return any school-owned items such as Chromebooks and library books. To learn more about return dates and times, please visit nhaschools.com/en/covid-19#return

NHASCHOOLS.COM
NHA Schools | COVID-19 Information",2020-06-04 11:52:05,,
40,0.0,https://scontent-atl3-1.xx.fbcdn.net/v/t1.0-9/fr/cp0/e15/q65/101298811_3628294720538771_1156525141081980928_o.jpg?_nc_cat=105&_nc_sid=8024bb&_nc_ohc=QSFG4I7Auq4AX8hksrx&_nc_ht=scontent-atl3-1.xx&tp=14&oh=419f36dcc5759b77290bde50b0010f57&oe=5F82B9E8,7.0,,3628302017204708,Happy Virtual Spirit Week 8th graders! We are so excited to celebrate you this week as you finish off your last school year at East Arbor! Today we kick off our 8th grade spirit week with Quarantine Drip Day.,https://facebook.com/story.php?story_fbid=3628302017204708&id=197805676921043,,0.0,Happy Virtual Spirit Week 8th graders! We are so excited to celebrate you this week as you finish off your last school year at East Arbor! Today we kick off our 8th grade spirit week with Quarantine Drip Day.,2020-06-01 13:41:54,,
41,0.0,https://scontent-atl3-1.xx.fbcdn.net/v/t1.0-9/fr/cp0/e15/q65/99399221_3614903221877921_1056932129457307648_o.jpg?_nc_cat=107&_nc_sid=8024bb&_nc_ohc=j0pDseObwkwAX-dJAa1&_nc_ht=scontent-atl3-1.xx&tp=14&oh=09560ef6180b4555181491a92ea965b4&oe=5F82B958,5.0,,3614915481876695,Top 5 Reasons to become a RAM! Apply today.,https://facebook.com/story.php?story_fbid=3614915481876695&id=197805676921043,,0.0,Top 5 Reasons to become a RAM! Apply today.,2020-05-27 11:25:20,,
42,0.0,,0.0,,1392455090938989,,,"MON, JUN 15
Virtual Enrollment Information Meeting",0.0,"MON, JUN 15
Virtual Enrollment Information Meeting",2020-05-27 10:42:33,,
43,0.0,https://scontent-atl3-1.xx.fbcdn.net/v/t1.0-9/fr/cp0/e15/q65/100747054_3612402018794708_7176794771413794816_o.jpg?_nc_cat=108&_nc_sid=da1649&_nc_ohc=wiBGsdMHmYsAX8PAPlz&_nc_ht=scontent-atl3-1.xx&tp=14&oh=970d875c691608a0dca8e881eeaa90e4&oe=5F82684B,0.0,https://bit.ly/3ep73g7,3612402012128042,Is your child begging to download TikTok? Here’s everything you need to know about today’s hottest app for tweens and teens – and whether it’s right for your family. https://bit.ly/3ep73g7,,,0.0,Is your child begging to download TikTok? Here’s everything you need to know about today’s hottest app for tweens and teens – and whether it’s right for your family. https://bit.ly/3ep73g7,2020-05-26 11:45:06,,
44,0.0,https://scontent-atl3-1.xx.fbcdn.net/v/t1.0-9/fr/cp0/e15/q65/99122066_3609862439048666_5198516896252559360_o.jpg?_nc_cat=111&_nc_sid=da1649&_nc_ohc=vbD70t7gsScAX8wazTh&_nc_ht=scontent-atl3-1.xx&tp=14&oh=45bafcd686aa31c3fa4ac459972f43dc&oe=5F832EF2,5.0,,3609862432382000,Today we honor those who have made the ultimate sacrifice for our country. #MemorialDay,,,0.0,Today we honor those who have made the ultimate sacrifice for our country. #MemorialDay,2020-05-25 12:12:05,,
45,2.0,,2.0,https://www.youtube.com/watch?v=VblNyW9IwQo,3602605786440998,"What do we miss most? You!
https://www.youtube.com/watch?v=VblNyW9IwQo",https://facebook.com/story.php?story_fbid=3602605786440998&id=197805676921043,"YOUTUBE.COM
Dear School",4.0,"What do we miss most? You!
https://www.youtube.com/watch?v=VblNyW9IwQo

YOUTUBE.COM
Dear School",2020-05-22 15:11:01,,
46,0.0,,3.0,https://safeyoutube.net/w/jIJG,3602004729834437,"Happy Friday EA families! Our month of Integrity is just flying by! Remember, NHA defines integrity as abiding by principles that demonstrate honorable conduct and moral character. After watching Mrs. Emery's read aloud, talk to your family about a time that you did the right thing, even when your friends did not.",https://facebook.com/story.php?story_fbid=3602004729834437&id=197805676921043,"SAFEYOUTUBE.NET
Integrity video",4.0,"Happy Friday EA families! Our month of Integrity is just flying by! Remember, NHA defines integrity as abiding by principles that demonstrate honorable conduct and moral character. After watching Mrs. Emery's read aloud, talk to your family about a time that you did the right thing, even when your friends did not.

SAFEYOUTUBE.NET
Integrity video",2020-05-22 10:17:57,,
47,0.0,https://scontent-atl3-1.xx.fbcdn.net/v/t1.0-9/fr/cp0/e15/q65/98364146_3594452640589646_3774558491134394368_o.jpg?_nc_cat=110&_nc_sid=da1649&_nc_ohc=BWme4D2Z2DAAX_DY5KB&_nc_ht=scontent-atl3-1.xx&tp=14&oh=b0d59bf95dd881a3480fa5c3306595ce&oe=5F83CFDE,1.0,https://bit.ly/3g1PdBz,3594452633922980,"When so much feels out of your control, it’s important to remember what you can control. Here are some positive coping strategies for processing your emotions surrounding COVID-19 and creating healthy rhythms in your days at home. https://bit.ly/3g1PdBz",,,0.0,"When so much feels out of your control, it’s important to remember what you can control. Here are some positive coping strategies for processing your emotions surrounding COVID-19 and creating healthy rhythms in your days at home. https://bit.ly/3g1PdBz",2020-05-19 12:52:06,,
48,0.0,https://scontent-atl3-1.xx.fbcdn.net/v/t1.0-9/fr/cp0/e15/q65/96234642_3568343203200590_785166205492133888_o.jpg?_nc_cat=103&_nc_sid=da1649&_nc_ohc=AJRq7kCuYOUAX_L0ydt&_nc_ht=scontent-atl3-1.xx&tp=14&oh=9337cab5c9cdaa08ba680ee661b6ae2e&oe=5F848919,0.0,https://bit.ly/2A2ENkB,3568343196533924,Did you know it’s every parent’s favorite unofficial holiday today? It’s National Clean Your Room Day! Here are three ways to observe it: https://bit.ly/2A2ENkB,,,0.0,Did you know it’s every parent’s favorite unofficial holiday today? It’s National Clean Your Room Day! Here are three ways to observe it: https://bit.ly/2A2ENkB,2020-05-10 13:11:04,,
49,0.0,,2.0,,3568148229886754,"Celebrating those who take care of us, moms and others, who are more than mothers this year.
Teachers. Nurses. Chefs. Cheerleaders. Our Biggest Fans.
Happy Mother's Day!",,,0.0,"Celebrating those who take care of us, moms and others, who are more than mothers this year.
Teachers. Nurses. Chefs. Cheerleaders. Our Biggest Fans.
Happy Mother's Day!",2020-05-10 11:47:02,,
50,0.0,https://scontent-atl3-1.xx.fbcdn.net/v/t1.0-9/fr/cp0/e15/q65/96290002_3562649180436659_388691379192070144_n.jpg?_nc_cat=111&_nc_sid=dd9801&_nc_ohc=pvqEbH5SO2gAX-7YlAz&_nc_ht=scontent-atl3-1.xx&tp=14&oh=894af087645fb2b7e3869d293249e838&oe=5F83CED3,5.0,,3562649317103312,,,,0.0,,2020-05-08 10:00:45,,
51,0.0,,0.0,,3560225757345668,"Although our teachers are doing a fantastic job virtually teaching our scholars, it's tough not seeing their smiling faces every day! What do you miss most about your teachers? Tell us in the comments below!",https://facebook.com/story.php?story_fbid=3560225757345668&id=197805676921043,,0.0,"Although our teachers are doing a fantastic job virtually teaching our scholars, it's tough not seeing their smiling faces every day! What do you miss most about your teachers? Tell us in the comments below!",2020-05-07 11:50:04,,
52,3.0,,3.0,,3555138797854364,Today is #ThankATeacher Day! For whom are you most thankful? Tell us in the comments below!,https://facebook.com/story.php?story_fbid=3555138797854364&id=197805676921043,,0.0,Today is #ThankATeacher Day! For whom are you most thankful? Tell us in the comments below!,2020-05-05 12:47:06,,
53,3.0,,9.0,https://www.youtube.com/watch?v=PfEfRbIEIRU&feature=youtu.be,3554843034550607,"Welcome to our East Arbor Virtual Talent Show! We are so excited to share our East Arbor shining stars with you! Please sit back, relax and enjoy the show!!",https://facebook.com/story.php?story_fbid=3554843034550607&id=197805676921043,"YOUTUBE.COM
East Arbors Got Talent",10.0,"Welcome to our East Arbor Virtual Talent Show! We are so excited to share our East Arbor shining stars with you! Please sit back, relax and enjoy the show!!

YOUTUBE.COM
East Arbors Got Talent",2020-05-05 10:49:31,,
54,0.0,https://scontent-atl3-1.xx.fbcdn.net/v/t1.0-9/fr/cp0/e15/q65/94964808_3552808554754055_1845008304141500416_n.jpg?_nc_cat=100&_nc_sid=8024bb&_nc_ohc=u2X_seXPhF4AX_LJI1Q&_nc_ht=scontent-atl3-1.xx&tp=14&oh=e7a73f9fc1023e886446d65abda899b0&oe=5F8362EE,2.0,,3552811831420394,"If you were not able to come on Saturday and still need to borrow a chromebook, or if the one you picked up is non-operational, please stop by on Friday! We will be there 3:00-4:00!",https://facebook.com/story.php?story_fbid=3552811831420394&id=197805676921043,,0.0,"If you were not able to come on Saturday and still need to borrow a chromebook, or if the one you picked up is non-operational, please stop by on Friday! We will be there 3:00-4:00!",2020-05-04 15:12:56,,
55,0.0,https://scontent-atl3-1.xx.fbcdn.net/v/t1.0-9/fr/cp0/e15/q65/95172369_3552645011437076_7965212615041351680_o.jpg?_nc_cat=109&_nc_sid=da1649&_nc_ohc=Nqly0QVP5rUAX91QXnK&_nc_ht=scontent-atl3-1.xx&tp=14&oh=e792639499f5c67e6b7e1ef16e1c7388&oe=5F81991A,1.0,https://bit.ly/2z5jNcL,3552645004770410,Happy Star Wars Day! Five ways to celebrate at home here are. #maythe4thbewithyou https://bit.ly/2z5jNcL,,,0.0,Happy Star Wars Day! Five ways to celebrate at home here are. #maythe4thbewithyou https://bit.ly/2z5jNcL,2020-05-04 14:03:47,,
56,0.0,https://scontent-atl3-1.xx.fbcdn.net/v/t1.0-9/fr/cp0/e15/q65/95222648_3544968168871427_692325054255464448_o.jpg?_nc_cat=108&_nc_sid=da1649&_nc_ohc=Rab0T4EGp2YAX_RlBt9&_nc_ht=scontent-atl3-1.xx&tp=14&oh=324675948d43c86944d5ca561b192f33&oe=5F82AE3F,4.0,,3544968162204761,"Next week is Teacher Appreciation Week! Even from a distance, our school will be celebrating our wonderful teachers all week long. Make sure to watch this page for special ways to celebrate the folks who inspire our students to reach their full potential.",,,0.0,"Next week is Teacher Appreciation Week! Even from a distance, our school will be celebrating our wonderful teachers all week long. Make sure to watch this page for special ways to celebrate the folks who inspire our students to reach their full potential.",2020-05-01 15:09:03,,
57,1.0,,4.0,https://safeyoutube.net/w/iYY9,3539767439391500,"We can't believe that we are already in our last week of April! In these last few days of April, we encourage you to reflect on all that you have learned about compassion. After watching Mrs. Newby's read aloud about compassion, think about putting yourself in others' shoes to understand how they feel and how you can help.",https://facebook.com/story.php?story_fbid=3539767439391500&id=197805676921043,"SAFEYOUTUBE.NET
Compassion Read Aloud with Mrs. Newby",4.0,"We can't believe that we are already in our last week of April! In these last few days of April, we encourage you to reflect on all that you have learned about compassion. After watching Mrs. Newby's read aloud about compassion, think about putting yourself in others' shoes to understand how they feel and how you can help.

SAFEYOUTUBE.NET
Compassion Read Aloud with Mrs. Newby",2020-04-29 16:42:25,,
58,0.0,https://scontent-atl3-1.xx.fbcdn.net/v/t1.0-9/fr/cp0/e15/q65/95218677_3539402129428031_8205059192466178048_n.jpg?_nc_cat=104&_nc_sid=8024bb&_nc_ohc=LypNXCqZKPcAX-g_hoO&_nc_ht=scontent-atl3-1.xx&tp=14&oh=b6001060318cecd55ede19c2be26dcaf&oe=5F83788D,5.0,,3539402346094676,,https://facebook.com/story.php?story_fbid=3539402346094676&id=197805676921043,,0.0,,2020-04-29 13:37:25,,
59,0.0,,0.0,https://bit.ly/3e3qr32,3539147709453473,"Tomorrow is the final day to apply for the National Heritage Academies CollegeBound™ Scholarship! This is a fantastic opportunity for eighth graders. The scholarship application is open until Thursday, April 30, 2020, before 11:59 p.m. PST. https://bit.ly/3e3qr32",https://facebook.com/story.php?story_fbid=3539147709453473&id=197805676921043,"NHASCHOOLS.COM
College Bound Scholars",0.0,"Tomorrow is the final day to apply for the National Heritage Academies CollegeBound™ Scholarship! This is a fantastic opportunity for eighth graders. The scholarship application is open until Thursday, April 30, 2020, before 11:59 p.m. PST. https://bit.ly/3e3qr32

NHASCHOOLS.COM
College Bound Scholars",2020-04-29 11:45:05,,
60,0.0,,0.0,https://bit.ly/3bNkc1V,3537046832996894,Are you or your child feeling extra stressed or anxious? You’re not alone. Here’s some help. https://bit.ly/3bNkc1V,https://facebook.com/story.php?story_fbid=3537046832996894&id=197805676921043,"NHASCHOOLS.COM
Dealing with Stress and Anxiety (for you and your kids)",0.0,"Are you or your child feeling extra stressed or anxious? You’re not alone. Here’s some help. https://bit.ly/3bNkc1V

NHASCHOOLS.COM
Dealing with Stress and Anxiety (for you and your kids)",2020-04-28 14:53:05,,
61,0.0,,0.0,https://bit.ly/3e3qr32,3523947954306782,"There’s only one week left to apply for the National Heritage Academies CollegeBound™ Scholarship! Don’t let this amazing opportunity pass your eighth grader by. The scholarship application is open until April 30, 2020, at 11:59 p.m. PST. Begin or complete the application process today! https://bit.ly/3e3qr32",https://facebook.com/story.php?story_fbid=3523947954306782&id=197805676921043,"NHASCHOOLS.COM
College Bound Scholars",0.0,"There’s only one week left to apply for the National Heritage Academies CollegeBound™ Scholarship! Don’t let this amazing opportunity pass your eighth grader by. The scholarship application is open until April 30, 2020, at 11:59 p.m. PST. Begin or complete the application process today! https://bit.ly/3e3qr32

NHASCHOOLS.COM
College Bound Scholars",2020-04-23 12:52:05,,
62,0.0,https://scontent-atl3-1.xx.fbcdn.net/v/t1.0-9/fr/cp0/e15/q65/93436093_3521453404556237_5335634405782192128_o.jpg?_nc_cat=101&_nc_sid=da1649&_nc_ohc=yNzbxvFAfy8AX9Aoo8S&_nc_ht=scontent-atl3-1.xx&tp=14&oh=07975dd09d6a850e75467883a649024f&oe=5F83F9B7,0.0,https://bit.ly/2QihMzl,3521453394556238,"Today we recognize Earth Day, 2020. Here are 8 great ways you can make small changes for big impact on the environment today. http://bit.ly/2QihMzl",,,0.0,"Today we recognize Earth Day, 2020. Here are 8 great ways you can make small changes for big impact on the environment today. http://bit.ly/2QihMzl",2020-04-22 15:53:31,,
63,4.0,,2.0,https://drive.google.com/file/d/1XCWgw5QEAeeS7J7Kv4h1cMXnyIgtwqFP/view?usp=sharing,3521346527900258,"Happy Earth day! Mrs. Emery shared this activity and we thought it would be fun to share with you! After you watch the video post your picture in the comments.
https://drive.google.com/file/d/1XCWgw5QEAeeS7J7Kv4h1cMXnyIgtwqFP/view?usp=sharing",https://facebook.com/story.php?story_fbid=3521346527900258&id=197805676921043,"DRIVE.GOOGLE.COM
Earth Day 2020.webm",0.0,"Happy Earth day! Mrs. Emery shared this activity and we thought it would be fun to share with you! After you watch the video post your picture in the comments.
https://drive.google.com/file/d/1XCWgw5QEAeeS7J7Kv4h1cMXnyIgtwqFP/view?usp=sharing

DRIVE.GOOGLE.COM
Earth Day 2020.webm",2020-04-22 14:52:53,,
64,0.0,https://scontent-atl3-1.xx.fbcdn.net/v/t1.0-9/94035019_3520469121321332_415172811804377088_o.png?_nc_cat=111&_nc_sid=8024bb&_nc_ohc=WFQ5mqVKGjoAX-Iz7c8&_nc_ht=scontent-atl3-1.xx&oh=59170fdbbb457c3a0da2691068c448c9&oe=5F85337D,0.0,https://meet.google.com/mjb-jixz-sfw,3520478827987028,"Do you have questions, comments, or feedback about East Arbor's remote learning? If so, you are invited to a Virtual Coffee With The Principal. Please join us on
Thursday, April 30th from 4-5 PM.

To join, click on the link below. If you would like to submit questions, please do so by April 28th.

https://meet.google.com/mjb-jixz-sfw
or you may dial in at 1-319-406-2079 PIN 362123548#

Looking forward to seeing you!",https://facebook.com/story.php?story_fbid=3520478827987028&id=197805676921043,,0.0,"Do you have questions, comments, or feedback about East Arbor's remote learning? If so, you are invited to a Virtual Coffee With The Principal. Please join us on
Thursday, April 30th from 4-5 PM.

To join, click on the link below. If you would like to submit questions, please do so by April 28th.

https://meet.google.com/mjb-jixz-sfw
or you may dial in at 1-319-406-2079 PIN 362123548#

Looking forward to seeing you!",2020-04-22 07:36:27,,
65,1.0,https://scontent-atl3-1.xx.fbcdn.net/v/t1.0-9/fr/cp0/e15/q65/94134365_3520440761324168_7498757249477640192_o.jpg?_nc_cat=109&_nc_sid=8024bb&_nc_ohc=bHQbc2_ro9cAX8iqZsd&_nc_oc=AQnV9Otcb0Hk2lhIjrE25jCpYKnCunQWdZdhMV4NTRLdzRIb8kqRIZ5WHThreako92I&_nc_ht=scontent-atl3-1.xx&tp=14&oh=215d6c680612d3fb199bd4245db47136&oe=5F8482B3,5.0,,3520467751321469,"East Arbor is grateful to everyone on the frontline committed to keeping us healthy and safe. To show our appreciation, coffee will be FREE for Essential and First-Responding Parents, starting on April 23rd!

Thank you for all that you do!",https://facebook.com/story.php?story_fbid=3520467751321469&id=197805676921043,,0.0,"East Arbor is grateful to everyone on the frontline committed to keeping us healthy and safe. To show our appreciation, coffee will be FREE for Essential and First-Responding Parents, starting on April 23rd!

Thank you for all that you do!",2020-04-22 07:30:20,,
66,0.0,,2.0,,519770722031413,,,"THU, APR 30
Virtual Q&A Coffee with the Principal",0.0,"THU, APR 30
Virtual Q&A Coffee with the Principal",2020-04-21 22:47:02,,
67,0.0,,2.0,https://youtu.be/wJHvk5-6tk0,3515774651790779,"Compassion can also be shown by willingly caring for others when they need help. After listening to Mrs. Emery's Moral Focus read aloud, think about what you are doing at home to get better at using or showing compassion everyday.",https://facebook.com/story.php?story_fbid=3515774651790779&id=197805676921043,"YOUTUBE.COM
The Giving Tree",3.0,"Compassion can also be shown by willingly caring for others when they need help. After listening to Mrs. Emery's Moral Focus read aloud, think about what you are doing at home to get better at using or showing compassion everyday.

YOUTUBE.COM
The Giving Tree",2020-04-20 10:59:36,,
68,0.0,,0.0,https://bit.ly/3e3qr32,3508710879163823,"The deadline for NHA’s CollegeBound™ Scholarship is quickly approaching! To enter, please ensure that your scholar submits their online application and essay by April 30, before 11:59 p.m. PST. Students are required to write a 250-500-word essay about the difference the school’s Moral Focus curriculum is making in their lives. Take a look at the CBS essay questions. https://bit.ly/3e3qr32",https://facebook.com/story.php?story_fbid=3508710879163823&id=197805676921043,"NHASCHOOLS.COM
College Bound Scholars",0.0,"The deadline for NHA’s CollegeBound™ Scholarship is quickly approaching! To enter, please ensure that your scholar submits their online application and essay by April 30, before 11:59 p.m. PST. Students are required to write a 250-500-word essay about the difference the school’s Moral Focus curriculum is making in their lives. Take a look at the CBS essay questions. https://bit.ly/3e3qr32

NHASCHOOLS.COM
College Bound Scholars",2020-04-17 14:55:03,,
69,0.0,,6.0,https://drive.google.com/file/d/1LoSSqj2uzChliDUth1ZpglVvfJ1JDOQL/view?usp=drivesdk,3508045955896982,"Happy Friday East Arbor Families! Let's wrap up the week with Moral Focus read aloud with Ms. Wilson. As you listen to the read aloud, think about how you've shown compassion to your family this week.",https://facebook.com/story.php?story_fbid=3508045955896982&id=197805676921043,"DRIVE.GOOGLE.COM
IMG_4167.MOV",4.0,"Happy Friday East Arbor Families! Let's wrap up the week with Moral Focus read aloud with Ms. Wilson. As you listen to the read aloud, think about how you've shown compassion to your family this week.

DRIVE.GOOGLE.COM
IMG_4167.MOV",2020-04-17 09:57:59,,
70,0.0,,2.0,https://bit.ly/2wf7Fod,3503359456365632,Running out of fun things to do with the kids inside? Check out these 9 ideas you may not have tried yet! http://bit.ly/2wf7Fod,https://facebook.com/story.php?story_fbid=3503359456365632&id=197805676921043,"NHASCHOOLS.COM
Fun Indoor Family Activities",0.0,"Running out of fun things to do with the kids inside? Check out these 9 ideas you may not have tried yet! http://bit.ly/2wf7Fod

NHASCHOOLS.COM
Fun Indoor Family Activities",2020-04-15 12:53:04,,
71,6.0,,5.0,https://youtu.be/xlKOcU-IXas,3503304476371130,"Happy Wednesday East Arbor Families! We are missing all of our students and families so much! We wanted to try to put a smile on everyone's faces today. Please enjoy our video message from the EA staff!

*(We do not own the rights to the music in this video)*",https://facebook.com/story.php?story_fbid=3503304476371130&id=197805676921043,"YOUTUBE.COM
East Arbor Misses You!",14.0,"Happy Wednesday East Arbor Families! We are missing all of our students and families so much! We wanted to try to put a smile on everyone's faces today. Please enjoy our video message from the EA staff!

*(We do not own the rights to the music in this video)*

YOUTUBE.COM
East Arbor Misses You!",2020-04-15 12:25:36,,
72,0.0,https://scontent-atl3-1.xx.fbcdn.net/v/t1.0-9/fr/cp0/e15/q65/93425242_3501149906586587_1091715295766118400_n.jpg?_nc_cat=103&_nc_sid=dd9801&_nc_ohc=7uPqGocG4pQAX8devuJ&_nc_ht=scontent-atl3-1.xx&tp=14&oh=1835e959153dcc4a440a0935b1d0f75c&oe=5F8319B3,0.0,,3501150223253222,,,,0.0,,2020-04-14 15:17:26,,
73,2.0,,6.0,https://bit.ly/2Xq6KN5,3498430770191834,"Dean of lower elementary Ryan Killebrew had a unique journey on her way to becoming a school leader. Some teachers teach the same grade for their whole careers, some teach every grade they can, and sometimes teachers get to have the same class four times. https://bit.ly/2Xq6KN5",https://facebook.com/story.php?story_fbid=3498430770191834&id=197805676921043,"NHASCHOOLS.COM
Blog & News | Ypsilanti MI | East Arbor Charter Academy",5.0,"Dean of lower elementary Ryan Killebrew had a unique journey on her way to becoming a school leader. Some teachers teach the same grade for their whole careers, some teach every grade they can, and sometimes teachers get to have the same class four times. https://bit.ly/2Xq6KN5

NHASCHOOLS.COM
Blog & News | Ypsilanti MI | East Arbor Charter Academy",2020-04-13 13:12:02,,
74,0.0,,10.0,https://drive.google.com/file/d/1_mYLEUsbeU19JefNIY0EMJEcOxudvdPN/view?usp=sharing,3498266513541593,"Compassion can be shown by doing nice things for others to make them feel better. After watching today's Moral Focus read aloud, talk with your family about what kinds of nice things you can do at home to make others feel better.",https://facebook.com/story.php?story_fbid=3498266513541593&id=197805676921043,"DRIVE.GOOGLE.COM
Compassion Read Aloud video.mp4",3.0,"Compassion can be shown by doing nice things for others to make them feel better. After watching today's Moral Focus read aloud, talk with your family about what kinds of nice things you can do at home to make others feel better.

DRIVE.GOOGLE.COM
Compassion Read Aloud video.mp4",2020-04-13 11:51:35,,
75,0.0,,0.0,https://bit.ly/3e3qr32,3485925768109001,"During these times of uncertainty, please know, we are continuing to offer the opportunity for eighth-grade students to apply for an NHA CollegeBound™️ Scholarship. We’ve extended the application deadline this year to allow more students the opportunity to complete an online application. Students interested in applying are required to submit their online application and essay by April 30, 2020, before 11:59 p.m. PST. https://bit.ly/3e3qr32",https://facebook.com/story.php?story_fbid=3485925768109001&id=197805676921043,"NHASCHOOLS.COM
College Bound Scholars",0.0,"During these times of uncertainty, please know, we are continuing to offer the opportunity for eighth-grade students to apply for an NHA CollegeBound™️ Scholarship. We’ve extended the application deadline this year to allow more students the opportunity to complete an online application. Students interested in applying are required to submit their online application and essay by April 30, 2020, before 11:59 p.m. PST. https://bit.ly/3e3qr32

NHASCHOOLS.COM
College Bound Scholars",2020-04-08 12:47:05,,
76,3.0,,14.0,,3470846482950263,"Today we are celebrating a very special day! April 2nd, is National Autism Awareness Day. Remember today, and everyday, that it is important to be kind to everyone you meet, no matter what their differences are.",,,0.0,"Today we are celebrating a very special day! April 2nd, is National Autism Awareness Day. Remember today, and everyday, that it is important to be kind to everyone you meet, no matter what their differences are.",2020-04-02 11:32:37,https://video-atl3-1.xx.fbcdn.net/v/t42.9040-2/10000000_687958545348813_3929971070991335424_n.mp4?_nc_cat=111&_nc_sid=985c63&efg=eyJ2ZW5jb2RlX3RhZyI6ImxlZ2FjeV9zZCJ9&_nc_ohc=VovFfiT_NJgAX9Kz-aS&_nc_ht=video-atl3-1.xx&oh=2f85bf1d0000666dc6dd9de6a0f16296&oe=5F5E28CE,
