,comments,image,likes,link,post_id,post_text,post_url,shared_text,shares,text,time,video,video_thumbnail
193,0.0,https://scontent-atl3-1.xx.fbcdn.net/v/t1.0-9/fr/cp0/e15/q65/103333265_10158304203823540_3217671217613957744_o.jpg?_nc_cat=111&_nc_sid=8024bb&_nc_ohc=CGAtcEFXNJ0AX9hLDax&_nc_ht=scontent-atl3-1.xx&tp=14&oh=c6c952cd75893a5ca15f2e13ead95b41&oe=5F858681,4.0,,10158310232783540,"Today is the first day of the Summer Reading Program at the Elementary. Drive up to receive a packet, while supplies last. For Pre-K-6th grade. From 10:00-11:00 am.",https://facebook.com/story.php?story_fbid=10158310232783540&id=262407518539,"Elida Local Schools
June 8 at 9:18 AM ·

The Elida Summer Reading Program starts this Wednesday for Pre-K-6th grade.",2.0,"Today is the first day of the Summer Reading Program at the Elementary. Drive up to receive a packet, while supplies last. For Pre-K-6th grade. From 10:00-11:00 am.

Elida Local Schools
June 8 at 9:18 AM ·

The Elida Summer Reading Program starts this Wednesday for Pre-K-6th grade.",2020-06-10 09:49:36,,
194,0.0,https://scontent-atl3-1.xx.fbcdn.net/v/t1.0-9/fr/cp0/e15/q65/103730524_10158307865663540_6573540249517096791_o.jpg?_nc_cat=103&_nc_sid=8024bb&_nc_ohc=EL-6-hKREPUAX-KWIrn&_nc_ht=scontent-atl3-1.xx&tp=14&oh=c6ab71a04ada9aa2db8f44926a27a937&oe=5F85249D,82.0,,10158307858733540,The trusses had a police escort as they made their way from Quality Welding & Fabrication on East Road.,https://facebook.com/story.php?story_fbid=10158307858733540&id=262407518539,,0.0,The trusses had a police escort as they made their way from Quality Welding & Fabrication on East Road.,2020-06-09 14:12:09,,
195,3.0,,67.0,,10158307849388540,"There was some excitement in the district this morning as the trusses for the new elementary gym were delivered from Quality Welding & Fabrication, an alumni owned business in Elida. They should be installed sometime next week. #elidapride #elidaelementary",https://facebook.com/story.php?story_fbid=10158307849388540&id=262407518539,"Yes4Elida
June 9 at 9:59 AM ·

The trusses are arriving!",2.0,"There was some excitement in the district this morning as the trusses for the new elementary gym were delivered from Quality Welding & Fabrication, an alumni owned business in Elida. They should be installed sometime next week. #elidapride #elidaelementary

Yes4Elida
June 9 at 9:59 AM ·

The trusses are arriving!",2020-06-09 14:08:51,https://video-atl3-1.xx.fbcdn.net/v/t42.9040-2/103046082_258938315391074_7283741377064037271_n.mp4?_nc_cat=108&_nc_sid=985c63&efg=eyJ2ZW5jb2RlX3RhZyI6ImxlZ2FjeV9zZCJ9&_nc_ohc=1kAGFxvvPcQAX-73nGf&_nc_ht=video-atl3-1.xx&oh=bc2bd55387d499af8542630088cab2a3&oe=5F5F475D,
196,3.0,https://scontent-atl3-1.xx.fbcdn.net/v/t1.0-9/fr/cp0/e15/q65/103838491_10158307351683540_6178337259403582136_n.jpg?_nc_cat=110&_nc_sid=8024bb&_nc_ohc=V5qpwlTp-mgAX9klzB7&_nc_ht=scontent-atl3-1.xx&tp=14&oh=5d6457d04bf63eb80c9b1b41ca3eb2e2&oe=5F84D7EC,16.0,https://www.home.elida.k12.oh.us/News/1370#sthash.KJ3c8NsE.dpbs,10158307351843540,https://www.home.elida.k12.oh.us/News/1370#sthash.KJ3c8NsE.dpbs,https://facebook.com/story.php?story_fbid=10158307351843540&id=262407518539,,0.0,https://www.home.elida.k12.oh.us/News/1370#sthash.KJ3c8NsE.dpbs,2020-06-09 10:38:23,,
197,2.0,,9.0,,10158307303633540,"MIDDLE SCHOOL STUDENTS IMPORTANT INFORMATION: LAST CALL FOR ITEM PICK UP! Personal items that were left at the building must be picked up by 2:00 Thursday, June 11. After June 11, remaining items may be donated.",https://facebook.com/story.php?story_fbid=10158307303633540&id=262407518539,,0.0,"MIDDLE SCHOOL STUDENTS IMPORTANT INFORMATION: LAST CALL FOR ITEM PICK UP! Personal items that were left at the building must be picked up by 2:00 Thursday, June 11. After June 11, remaining items may be donated.",2020-06-09 10:14:30,,
198,6.0,https://scontent-atl3-1.xx.fbcdn.net/v/t1.0-9/fr/cp0/e15/q65/103333265_10158304203823540_3217671217613957744_o.jpg?_nc_cat=111&_nc_sid=8024bb&_nc_ohc=CGAtcEFXNJ0AX9hLDax&_nc_ht=scontent-atl3-1.xx&tp=14&oh=c6c952cd75893a5ca15f2e13ead95b41&oe=5F858681,32.0,,10158304204058540,The Elida Summer Reading Program starts this Wednesday for Pre-K-6th grade.,https://facebook.com/story.php?story_fbid=10158304204058540&id=262407518539,,0.0,The Elida Summer Reading Program starts this Wednesday for Pre-K-6th grade.,2020-06-08 09:18:44,,
199,0.0,https://scontent-atl3-1.xx.fbcdn.net/v/t1.0-9/fr/cp0/e15/q65/102960421_10158304156888540_4988047662801783105_n.jpg?_nc_cat=106&_nc_sid=8024bb&_nc_ohc=mqUp08SEPF8AX-hKeax&_nc_ht=scontent-atl3-1.xx&tp=14&oh=d96ee3dd1ed3acd77bce75b81ec8055c&oe=5F85A94C,12.0,,10158304158818540,Reminder about the Summer Lunch Program through Lima City Schools:,https://facebook.com/story.php?story_fbid=10158304158818540&id=262407518539,,0.0,Reminder about the Summer Lunch Program through Lima City Schools:,2020-06-08 09:00:05,,
200,0.0,https://scontent-atl3-1.xx.fbcdn.net/v/t1.0-9/fr/cp0/e15/q65/102454991_10158295425933540_7356616329018736640_n.jpg?_nc_cat=107&_nc_sid=8024bb&_nc_ohc=Mz2yudN6tRIAX_SQG2G&_nc_oc=AQkJnhPvWWFXUwNq1j-8_krECGBEwwtT2Y8BqEw0EhcXgBwXqtIPOg3w9QSBl2EZng4&_nc_ht=scontent-atl3-1.xx&tp=14&oh=0844740b03096c7800e5d1299c3a6a36&oe=5F85223C,85.0,https://www.home.elida.k12.oh.us/userfiles/431/my%20files/const.%20wkly.%20report%20010.pdf?id=24976,10158295427503540,We are excited for the future when we watch the construction of the new elementary building! You can read about the progress and see many great photos in this week's construction update linked here. #elidapride #elidaelementary https://www.home.elida.k12.oh.us/userfiles/431/my%20files/const.%20wkly.%20report%20010.pdf?id=24976,https://facebook.com/story.php?story_fbid=10158295427503540&id=262407518539,,0.0,We are excited for the future when we watch the construction of the new elementary building! You can read about the progress and see many great photos in this week's construction update linked here. #elidapride #elidaelementary https://www.home.elida.k12.oh.us/userfiles/431/my%20files/const.%20wkly.%20report%20010.pdf?id=24976,2020-06-05 12:28:27,,
201,0.0,,8.0,https://www.kidsbowlfree.com/index.php,10158295228783540,"Summer fun is still out there! Here's information from Westgate Entertainment Center about ""Kids Bowl Free."" https://www.kidsbowlfree.com/index.php",https://facebook.com/story.php?story_fbid=10158295228783540&id=262407518539,"KIDSBOWLFREE.COM
KidsBowlFree.com: Kids Bowl Free All Summer Long!",5.0,"Summer fun is still out there! Here's information from Westgate Entertainment Center about ""Kids Bowl Free."" https://www.kidsbowlfree.com/index.php

KIDSBOWLFREE.COM
KidsBowlFree.com: Kids Bowl Free All Summer Long!",2020-06-05 11:18:59,,
202,0.0,,1.0,,10158295043898540,"TOMORROW, Sat. June 6th : The Annual American Township Community Clean-Up Day. Elida Middle School, west parking lot. Proof of residency required. 8 am-Noon. No paint, solvents or chemicals. Tires are $3 each. Call Township Building for more info. 419-331-8651.",https://facebook.com/story.php?story_fbid=10158295043898540&id=262407518539,,0.0,"TOMORROW, Sat. June 6th : The Annual American Township Community Clean-Up Day. Elida Middle School, west parking lot. Proof of residency required. 8 am-Noon. No paint, solvents or chemicals. Tires are $3 each. Call Township Building for more info. 419-331-8651.",2020-06-05 10:09:19,,
203,0.0,,0.0,,10158292202043540,"IMPORTANT REMINDER: The FINAL computer drop-off opportunity is TODAY, Thursday, June 4th from 12-6pm at the Elida High School west (Academic) entrance.",https://facebook.com/story.php?story_fbid=10158292202043540&id=262407518539,,0.0,"IMPORTANT REMINDER: The FINAL computer drop-off opportunity is TODAY, Thursday, June 4th from 12-6pm at the Elida High School west (Academic) entrance.",2020-06-04 11:47:18,,
204,0.0,,4.0,,10158292188623540,"Reminder... final computer drop-off opportunity will be today Thursday, June 4 from 12-6 pm at Elida High School west (Academic) entrance.",https://facebook.com/story.php?story_fbid=10158292188623540&id=262407518539,,0.0,"Reminder... final computer drop-off opportunity will be today Thursday, June 4 from 12-6 pm at Elida High School west (Academic) entrance.",2020-06-04 11:40:21,,
205,0.0,,5.0,http://www.2020census.gov/,10158285795193540,"Here is some information from the 2020 Census and local statistics. Elida at 80% so far, but remember to respond online at the link below. The results help provide financial support in our community and school! Also, there are part time job opportunities in Allen County, as well. Some of the job perks, good pay $17.50 an hour, flexibility, you set your own hours,paid mileage. apply online at: www.2020census.gov Currently, Allen County is still in need for individuals to fill the temporary job positions.",https://facebook.com/story.php?story_fbid=10158285795193540&id=262407518539,"2020CENSUS.GOV
2020 Census | United States Census Bureau",3.0,"Here is some information from the 2020 Census and local statistics. Elida at 80% so far, but remember to respond online at the link below. The results help provide financial support in our community and school! Also, there are part time job opportunities in Allen County, as well. Some of the job perks, good pay $17.50 an hour, flexibility, you set your own hours,paid mileage. apply online at: www.2020census.gov Currently, Allen County is still in need for individuals to fill the temporary job positions.

2020CENSUS.GOV
2020 Census | United States Census Bureau",2020-06-02 10:26:41,,
206,8.0,,10.0,https://schools.scriptapp.com/#/inbox/to-do?workflowIdForNewSubmission=1436986498b3f79a3159ae4500b81d8320d09f6527,10158283004048540,"Please read this Important Information from the Transportation Department regarding bus transportation this fall. The Alternate Address Transportation Request forms (linked below) are to notify the Transportation Department that your child riding the bus will be coming from and/or going to a location (sitter or daycare) other than your home address and for a request for open enrollment transportation. In previous years, a letter and form were mailed to you to be completed and returned. Starting this year, this form WILL NOT BE MAILED but is available by completing the forms via the online link below to submit them. Please fill out the forms soon, as the form submissions are due by JULY 1st as school starts August 11th. Questions can be directed to the transportation department at 419-331-4135 or 419-331-4036. https://schools.scriptapp.com/#/inbox/to-do?workflowIdForNewSubmission=1436986498b3f79a3159ae4500b81d8320d09f6527",https://facebook.com/story.php?story_fbid=10158283004048540&id=262407518539,"SCHOOLS.SCRIPTAPP.COM
Script",17.0,"Please read this Important Information from the Transportation Department regarding bus transportation this fall. The Alternate Address Transportation Request forms (linked below) are to notify the Transportation Department that your child riding the bus will be coming from and/or going to a location (sitter or daycare) other than your home address and for a request for open enrollment transportation. In previous years, a letter and form were mailed to you to be completed and returned. Starting this year, this form WILL NOT BE MAILED but is available by completing the forms via the online link below to submit them. Please fill out the forms soon, as the form submissions are due by JULY 1st as school starts August 11th. Questions can be directed to the transportation department at 419-331-4135 or 419-331-4036. https://schools.scriptapp.com/#/inbox/to-do?workflowIdForNewSubmission=1436986498b3f79a3159ae4500b81d8320d09f6527

SCHOOLS.SCRIPTAPP.COM
Script",2020-06-01 11:15:46,,
207,2.0,https://scontent-atl3-1.xx.fbcdn.net/v/t1.0-9/fr/cp0/e15/q65/101842231_10158279612353540_4746895480145838080_n.jpg?_nc_cat=111&_nc_sid=8024bb&_nc_ohc=-zXssz6amlQAX_meRPf&_nc_ht=scontent-atl3-1.xx&tp=14&oh=7377789f2510f9a18d5c1116fcafc3f8&oe=5F85B73B,68.0,,10158279612983540,"Congratulations to the following students for receiving the Elida Athletic Boosters $1,000 Scholarships. Thank you to the Athletic Boosters for your support of Elida graduating Seniors.",https://facebook.com/story.php?story_fbid=10158279612983540&id=262407518539,,0.0,"Congratulations to the following students for receiving the Elida Athletic Boosters $1,000 Scholarships. Thank you to the Athletic Boosters for your support of Elida graduating Seniors.",2020-05-31 08:04:35,,
208,7.0,https://scontent-atl3-1.xx.fbcdn.net/v/t1.0-9/fr/cp0/e15/q65/77315992_10158279604403540_4713518232726667264_o.jpg?_nc_cat=108&_nc_sid=8024bb&_nc_ohc=KFnFqZwjeDoAX-HyChH&_nc_ht=scontent-atl3-1.xx&tp=14&oh=88f91b79695c449c6625c87c480468e5&oe=5F837FFE,85.0,,10158279605528540,"Congratulations to these Elida Seniors for receiving the local scholarships listed below. We send our gratitude to the individuals and organizations who provide these generous, annual scholarships to our students. Thank you for your continued support of Elida students! #elidapride",https://facebook.com/story.php?story_fbid=10158279605528540&id=262407518539,,0.0,"Congratulations to these Elida Seniors for receiving the local scholarships listed below. We send our gratitude to the individuals and organizations who provide these generous, annual scholarships to our students. Thank you for your continued support of Elida students! #elidapride",2020-05-31 08:02:13,,
209,0.0,https://scontent-atl3-1.xx.fbcdn.net/v/t1.0-9/fr/cp0/e15/q65/101954787_10158274295043540_1941769106957008896_n.jpg?_nc_cat=105&_nc_sid=8024bb&_nc_ohc=VyksV9tpjSoAX-GE-vl&_nc_ht=scontent-atl3-1.xx&tp=14&oh=c6cc19ea900af5450d32c3b5ea0bd9c6&oe=5F84383B,51.0,,10158274289918540,It is fascinating to see the Elementary construction photos to watch a building being built! Here's a few new images from this week. Peterson Construction Company #garmannmiller,https://facebook.com/story.php?story_fbid=10158274289918540&id=262407518539,,0.0,It is fascinating to see the Elementary construction photos to watch a building being built! Here's a few new images from this week. Peterson Construction Company #garmannmiller,2020-05-29 12:11:08,,
210,3.0,,26.0,https://www.youtube.com/watch?v=2lSypSixDME&feature=youtu.be,10158274231608540,Here's Mrs. Turner & Mrs. Henderson from the Elida School Libraries in a short video to tell us more about this year's Summer Library Program: Learn more about the great things they have planned. https://www.youtube.com/watch?v=2lSypSixDME&feature=youtu.be,https://facebook.com/story.php?story_fbid=10158274231608540&id=262407518539,"YOUTUBE.COM
Elida Local Schools Summer Library Program 2020",9.0,"Here's Mrs. Turner & Mrs. Henderson from the Elida School Libraries in a short video to tell us more about this year's Summer Library Program: Learn more about the great things they have planned. https://www.youtube.com/watch?v=2lSypSixDME&feature=youtu.be

YOUTUBE.COM
Elida Local Schools Summer Library Program 2020",2020-05-29 11:51:53,,
211,3.0,https://scontent-atl3-1.xx.fbcdn.net/v/t1.0-9/fr/cp0/e15/q65/101578448_10158274213793540_5983024915186450432_o.jpg?_nc_cat=105&_nc_sid=8024bb&_nc_ohc=OjqSz4F6sdQAX8RfkeV&_nc_ht=scontent-atl3-1.xx&tp=14&oh=f2c2a917b67aadd7ccc47634360179b6&oe=5F84558E,91.0,,10158274215778540,Check out this great aerial photo of the elementary building site courtesy of Britt Munson! #elidaelementary #elidapride,https://facebook.com/story.php?story_fbid=10158274215778540&id=262407518539,,0.0,Check out this great aerial photo of the elementary building site courtesy of Britt Munson! #elidaelementary #elidapride,2020-05-29 11:44:38,,
212,1.0,,10.0,,10158271648978540,"The annual Community Clean-up is scheduled for Saturday, June 6th at the Elida Middle School West parking lot 8:00 am -Noon.
No paint, solvents or chemicals. Tires are acccepted for $3 each. No charge for batteries. Proof of Residency is required.
Sponsored by The American Twp. Trustees and North Central Ohio Solid Waste District",https://facebook.com/story.php?story_fbid=10158271648978540&id=262407518539,,0.0,"The annual Community Clean-up is scheduled for Saturday, June 6th at the Elida Middle School West parking lot 8:00 am -Noon.
No paint, solvents or chemicals. Tires are acccepted for $3 each. No charge for batteries. Proof of Residency is required.
Sponsored by The American Twp. Trustees and North Central Ohio Solid Waste District",2020-05-28 15:07:39,,
213,75.0,,69.0,,573047000297473,,,,34.0,,2020-05-28 09:58:48,https://video-atl3-1.xx.fbcdn.net/v/t42.26565-2/10000000_318979709162137_8522750535905372577_n.mp4?_nc_cat=110&_nc_sid=985c63&efg=eyJ2ZW5jb2RlX3RhZyI6Im9lcF9zZCJ9&_nc_ohc=Gy_0d2WqLaEAX8WTPmB&_nc_ht=video-atl3-1.xx&oh=1e1c41f243b6718d3fea0bc7b9176815&oe=5F5F436D,
214,7.0,,41.0,https://www.youtube.com/watch?v=SywzQERd_YI,10158270504663540,The Live stream of the 8th grade recognition ceremony at 10:00 am will follow this video.https://www.youtube.com/watch?v=SywzQERd_YI,https://facebook.com/story.php?story_fbid=10158270504663540&id=262407518539,"YOUTUBE.COM
Elida Middle School 2020 8th Grade Recognition",24.0,"The Live stream of the 8th grade recognition ceremony at 10:00 am will follow this video.https://www.youtube.com/watch?v=SywzQERd_YI

YOUTUBE.COM
Elida Middle School 2020 8th Grade Recognition",2020-05-28 09:30:18,,
215,0.0,,17.0,http://wordpress.limacityschools.org/news/2020/05/22/summer-lunch-schedule/?fbclid=IwAR2Ifg8u5XM5zZAqIUlhMmNcr8snh6JWHhVI-IhjFqMEHKzsTWl6XkqeotM,10158268709833540,Free lunches will be available to Elida students over the summer months (June 1-July 30) through the Summer Lunch Program with Lima City Schools. Distributions on Mondays & Wednesdays at several locations. Read the details of the program at the link below. http://wordpress.limacityschools.org/news/2020/05/22/summer-lunch-schedule/?fbclid=IwAR2Ifg8u5XM5zZAqIUlhMmNcr8snh6JWHhVI-IhjFqMEHKzsTWl6XkqeotM,https://facebook.com/story.php?story_fbid=10158268709833540&id=262407518539,"WORDPRESS.LIMACITYSCHOOLS.ORG
Summer Lunch Schedule | Spartan News",20.0,"Free lunches will be available to Elida students over the summer months (June 1-July 30) through the Summer Lunch Program with Lima City Schools. Distributions on Mondays & Wednesdays at several locations. Read the details of the program at the link below. http://wordpress.limacityschools.org/news/2020/05/22/summer-lunch-schedule/?fbclid=IwAR2Ifg8u5XM5zZAqIUlhMmNcr8snh6JWHhVI-IhjFqMEHKzsTWl6XkqeotM

WORDPRESS.LIMACITYSCHOOLS.ORG
Summer Lunch Schedule | Spartan News",2020-05-27 16:31:08,,
216,0.0,,1.0,,10158267686523540,"The final meal distribution through Elida Schools is today, Wednesday, May 27th, from 10:30-11:30 at Lima Community Church near the Axis Bldg., and Temple Christian School/Lima Baptist Temple. Be sure to continue to utilize other distributions in the community including West Ohio Food Bank and SAFY (Tuesdays & Fridays 10:30-1:30) at the SAFY Youth Drop- In Center 658 W. Market Street.",https://facebook.com/story.php?story_fbid=10158267686523540&id=262407518539,,0.0,"The final meal distribution through Elida Schools is today, Wednesday, May 27th, from 10:30-11:30 at Lima Community Church near the Axis Bldg., and Temple Christian School/Lima Baptist Temple. Be sure to continue to utilize other distributions in the community including West Ohio Food Bank and SAFY (Tuesdays & Fridays 10:30-1:30) at the SAFY Youth Drop- In Center 658 W. Market Street.",2020-05-27 09:35:04,,
217,0.0,,23.0,https://www.home.elida.k12.oh.us/userfiles/431/my%20files/8th%20grade%20graduation%20route.pdf?id=24941,10158265774863540,"REMINDER: The 8th grade recognition event will take place this Thursday, May 28th starting at 10am with a drive up procession from the high school to the middle school. The recognition will include passing out awards to the 8th grade students who have passed all their classes and are being promoted to 9th grade. Participation is voluntary. Please read the important details of the ceremony and the route.https://www.home.elida.k12.oh.us/userfiles/431/my%20files/8th%20grade%20graduation%20route.pdf?id=24941",https://facebook.com/story.php?story_fbid=10158265774863540&id=262407518539,"HOME.ELIDA.K12.OH.US
www.home.elida.k12.oh.us",13.0,"REMINDER: The 8th grade recognition event will take place this Thursday, May 28th starting at 10am with a drive up procession from the high school to the middle school. The recognition will include passing out awards to the 8th grade students who have passed all their classes and are being promoted to 9th grade. Participation is voluntary. Please read the important details of the ceremony and the route.https://www.home.elida.k12.oh.us/userfiles/431/my%20files/8th%20grade%20graduation%20route.pdf?id=24941

HOME.ELIDA.K12.OH.US
www.home.elida.k12.oh.us",2020-05-26 16:06:26,,
218,4.0,,18.0,https://www.dropbox.com/s/4abdtrcsu3nzph7/Elida%20High%20School%20-%20You%20Will%20Be%20Found.mp4?dl=0,10158265750033540,"Please enjoy the Senior Chamber Choir Recording of ""You Will Be Found"" https://www.dropbox.com/s/4abdtrcsu3nzph7/Elida%20High%20School%20-%20You%20Will%20Be%20Found.mp4?dl=0",https://facebook.com/story.php?story_fbid=10158265750033540&id=262407518539,"DROPBOX.COM
Elida High School - You Will Be Found.mp4",4.0,"Please enjoy the Senior Chamber Choir Recording of ""You Will Be Found"" https://www.dropbox.com/s/4abdtrcsu3nzph7/Elida%20High%20School%20-%20You%20Will%20Be%20Found.mp4?dl=0

DROPBOX.COM
Elida High School - You Will Be Found.mp4",2020-05-26 15:56:21,,
219,0.0,,3.0,http://www.blufftonicon.com/news/2020/05/23/rhodes-state-hosts-manufacturing-certification-program,10158265737598540,"High School students /parents: Rhodes State College is offering special 8 week Manufacturing Skills and Production Technician certification programs for high school students interested in high demand manufacturing careers. The Summer Program courses offer an alternative pathway to graduation, are instructor led/on-line and begin June 2nd. Read more in this article. http://www.blufftonicon.com/news/2020/05/23/rhodes-state-hosts-manufacturing-certification-program",https://facebook.com/story.php?story_fbid=10158265737598540&id=262407518539,"BLUFFTONICON.COM
Rhodes State hosts manufacturing certification program",5.0,"High School students /parents: Rhodes State College is offering special 8 week Manufacturing Skills and Production Technician certification programs for high school students interested in high demand manufacturing careers. The Summer Program courses offer an alternative pathway to graduation, are instructor led/on-line and begin June 2nd. Read more in this article. http://www.blufftonicon.com/news/2020/05/23/rhodes-state-hosts-manufacturing-certification-program

BLUFFTONICON.COM
Rhodes State hosts manufacturing certification program",2020-05-26 15:50:49,,
220,0.0,https://scontent-atl3-1.xx.fbcdn.net/v/t1.0-9/fr/cp0/e15/q65/101534741_10158265212043540_5871279886303232000_n.jpg?_nc_cat=110&_nc_sid=8024bb&_nc_ohc=jyrgnqsCqgYAX-EUFJK&_nc_ht=scontent-atl3-1.xx&tp=14&oh=3c2e3f032f05de2deb0d71c406856d2e&oe=5F850187,32.0,https://www.home.elida.k12.oh.us/userfiles/431/my%20files/summer%20library%202020%20flyer%20(1).pdf?id=24963,10158265202468540,Elida's Summer Library Program for Pre-K through 6th grade students: 3 weeks in June! More details on the flyer link: https://www.home.elida.k12.oh.us/userfiles/431/my%20files/summer%20library%202020%20flyer%20(1).pdf?id=24963 Institute of Museum and Library Services facebook.com/StateLibraryOhio,https://facebook.com/story.php?story_fbid=10158265202468540&id=262407518539,,0.0,Elida's Summer Library Program for Pre-K through 6th grade students: 3 weeks in June! More details on the flyer link: https://www.home.elida.k12.oh.us/userfiles/431/my%20files/summer%20library%202020%20flyer%20(1).pdf?id=24963 Institute of Museum and Library Services facebook.com/StateLibraryOhio,2020-05-26 11:55:25,,
221,1.0,https://scontent-atl3-1.xx.fbcdn.net/v/t1.0-9/fr/cp0/e15/q65/100843786_10158264807123540_8858071225650380800_n.jpg?_nc_cat=106&_nc_sid=8024bb&_nc_ohc=6DIUp_FtKVIAX8Oy0o2&_nc_ht=scontent-atl3-1.xx&tp=14&oh=25fc994dc580338946dc8cd702478b6f&oe=5F85E5E7,16.0,,10158264807373540,"WEDNESDAY, May 27th, will be the last day for meal distribution by Elida Schools. We encourage you to visit other food distribution services in the community including West Ohio Food Bank and SAFY, Tuesdays & Fridays from 10:30 am -1:30 pm.
Curb-side pick up at the SAFY Youth Drop-In Center 658 W. Market Street. Please call (419) 695-3050 or (419) 222-1527 upon your arrival.",https://facebook.com/story.php?story_fbid=10158264807373540&id=262407518539,,0.0,"WEDNESDAY, May 27th, will be the last day for meal distribution by Elida Schools. We encourage you to visit other food distribution services in the community including West Ohio Food Bank and SAFY, Tuesdays & Fridays from 10:30 am -1:30 pm.
Curb-side pick up at the SAFY Youth Drop-In Center 658 W. Market Street. Please call (419) 695-3050 or (419) 222-1527 upon your arrival.",2020-05-26 09:07:58,,
