,comments,image,likes,link,post_id,post_text,post_url,shared_text,shares,text,time,video,video_thumbnail
0,441.0,,165.0,,1291150874550357,,,,162.0,,2020-09-12 19:20:11,https://scontent-atl3-1.xx.fbcdn.net/v/t66.36281-6/10000000_964463080720907_4652728446880542015_n.mp4?_nc_cat=111&_nc_sid=985c63&efg=eyJ2ZW5jb2RlX3RhZyI6Im9lcF9zZCJ9&_nc_ohc=eQu3vyzaCbMAX83rgWW&_nc_ht=scontent-atl3-1.xx&oh=7b83452c00d294566eb8b6f3535e050b&oe=5F8350C3,
1,16.0,https://scontent-atl3-1.xx.fbcdn.net/v/t1.0-9/fr/cp0/e15/q65/119475197_10159039116923258_7387453795884018120_o.jpg?_nc_cat=108&_nc_sid=da1649&_nc_ohc=utVImIqpetgAX89M4aQ&_nc_ht=scontent-atl3-1.xx&tp=14&oh=23389d09e98ca0775a865239659abf4c&oe=5F82EFBB,129.0,,10159039116918258,We are so excited to offer a live stream of our first marching band showcase of 2020 tonight. We hope you will join us right here on Facebook live to watch EVSC and other local marching bands perform!,,,0.0,We are so excited to offer a live stream of our first marching band showcase of 2020 tonight. We hope you will join us right here on Facebook live to watch EVSC and other local marching bands perform!,2020-09-12 09:00:18,,
2,6.0,https://scontent-atl3-1.xx.fbcdn.net/v/t1.0-9/fr/cp0/e15/q65/119229323_10159037052913258_6544092101015073994_o.jpg?_nc_cat=110&_nc_sid=da1649&_nc_ohc=Svk9XVjgKNUAX_8STu8&_nc_ht=scontent-atl3-1.xx&tp=14&oh=55e3dd58f3f6eaf0226d925989ca5ea7&oe=5F837770,31.0,,10159037052903258,Lots of great football games tonight!,,,0.0,Lots of great football games tonight!,2020-09-11 14:00:31,,
3,8.0,,157.0,,10159034582548258,Central High School's stadium is looking great after some painting (including the bathrooms ) and extensive concrete work!,,,0.0,Central High School's stadium is looking great after some painting (including the bathrooms ) and extensive concrete work!,2020-09-11 10:30:00,https://video-atl3-1.xx.fbcdn.net/v/t42.9040-2/119318801_319291239334180_47893350591124324_n.mp4?_nc_cat=100&_nc_sid=985c63&efg=eyJ2ZW5jb2RlX3RhZyI6ImxlZ2FjeV9zZCJ9&_nc_ohc=-_wi978PcoEAX9v8ocZ&_nc_ht=video-atl3-1.xx&oh=d76b1dd6e9e0e6a89f77837383d00b5d&oe=5F5E4E60,
4,61.0,https://scontent-atl3-1.xx.fbcdn.net/v/t1.0-9/fr/cp0/e15/q65/119193998_10159034693268258_3904236405139181552_n.jpg?_nc_cat=111&_nc_sid=8024bb&_nc_ohc=_DupEx6PL5IAX9kwYF1&_nc_ht=scontent-atl3-1.xx&tp=14&oh=a8c0caa9cb2537f5e6da14c8f0009e7d&oe=5F83A81D,439.0,,10159034696463258,"We have good news to share with all our families. Due to the extension of USDA waivers, the EVSC will be offering free breakfast and lunch to ALL students at ALL schools effective tomorrow, (Friday, September 11th). Please note, this will be in effect until December 31, 2020 OR until available federal funding from the USDA runs out. A la carte food items are not included. Families can leave funds in student lunch accounts to be used next semester. Please keep in mind eligible families still must complete a free and reduced application to qualify for textbook assistance.",https://facebook.com/story.php?story_fbid=10159034696463258&id=182125408257,,0.0,"We have good news to share with all our families. Due to the extension of USDA waivers, the EVSC will be offering free breakfast and lunch to ALL students at ALL schools effective tomorrow, (Friday, September 11th). Please note, this will be in effect until December 31, 2020 OR until available federal funding from the USDA runs out. A la carte food items are not included. Families can leave funds in student lunch accounts to be used next semester. Please keep in mind eligible families still must complete a free and reduced application to qualify for textbook assistance.",2020-09-10 17:06:53,,
5,1.0,https://scontent-atl3-1.xx.fbcdn.net/v/t1.0-9/fr/cp0/e15/q65/119168864_10159034108853258_5699264200284113529_o.jpg?_nc_cat=109&_nc_sid=da1649&_nc_ohc=snKrnS_eL-MAX_FhT00&_nc_ht=scontent-atl3-1.xx&tp=14&oh=3dd8cdeaea2b369deb47233a90e07530&oe=5F830316,3.0,http://evscschools.com/calendar,10159034108823258,"Please keep in mind the 2020-2021 school calendar was changed last month due to COVID-19. Because of this, the calendars students received now have some incorrect dates since they were printed in June. Please refer to the image below, or evscschools.com/calendar, for the updated calendar for this school year. (This is the same revised calendar we posted earlier.)",,,0.0,"Please keep in mind the 2020-2021 school calendar was changed last month due to COVID-19. Because of this, the calendars students received now have some incorrect dates since they were printed in June. Please refer to the image below, or evscschools.com/calendar, for the updated calendar for this school year. (This is the same revised calendar we posted earlier.)",2020-09-10 12:11:47,,
6,1.0,https://scontent-atl3-1.xx.fbcdn.net/v/t1.0-9/fr/cp0/e15/q65/118475078_10157682787933247_3633422901910885831_n.jpg?_nc_cat=110&_nc_sid=8024bb&_nc_ohc=LKWkuMO-YLsAX85vzo3&_nc_ht=scontent-atl3-1.xx&tp=14&oh=a9c3326f97b8e8db6a3dc1bbf184293d&oe=5F85B334,14.0,https://vanderburghhealth.org/school-vaccination-clinics-2020/,10159030770198258,Check out this post from the Vanderburgh County Health Department for info on vaccination clinics at our schools!,https://facebook.com/story.php?story_fbid=10159030770198258&id=182125408257,"Vanderburgh County Health Department
August 28 at 9:17 AM 路

Dont want your child to miss school or worried about missing work for a vaccination appointment?

VCHD is offering vaccination clinics at school for EVSC grades 6-12.

Sign up online!

https://vanderburghhealth.org/school-vaccination-clinics-2020/

2 weeks before your child's scheduled clinic, you will receive an electronic consent form detailing which vaccines are recommended for your child. Your child will not be vaccinated without receipt of the consent form.",14.0,"Check out this post from the Vanderburgh County Health Department for info on vaccination clinics at our schools!

Vanderburgh County Health Department
August 28 at 9:17 AM 路

Dont want your child to miss school or worried about missing work for a vaccination appointment?

VCHD is offering vaccination clinics at school for EVSC grades 6-12.

Sign up online!

https://vanderburghhealth.org/school-vaccination-clinics-2020/

2 weeks before your child's scheduled clinic, you will receive an electronic consent form detailing which vaccines are recommended for your child. Your child will not be vaccinated without receipt of the consent form.",2020-09-09 08:42:57,,
7,5.0,https://scontent-atl3-1.xx.fbcdn.net/v/t1.0-9/fr/cp0/e15/q65/118800276_10159014001268258_5419401423433787051_n.jpg?_nc_cat=100&_nc_sid=8024bb&_nc_ohc=rmhhORJ7z9AAX9Tuv_x&_nc_ht=scontent-atl3-1.xx&tp=14&oh=f2edc75cf5bd57978b3ec2a3feb6b702&oe=5F84E5C6,53.0,,10159014267113258,Have a GREAT and SAFE Labor Day Weekend!,https://facebook.com/story.php?story_fbid=10159014267113258&id=182125408257,,0.0,Have a GREAT and SAFE Labor Day Weekend!,2020-09-04 16:00:02,,
8,15.0,,169.0,,10159016698663258,"Thanks to University of Evansville for recognizing last spring's Vanderburgh County Educators of the Year yesterday during a special Zoom ceremony. While this wasn't the typical recognition banquet due to the pandemic, it was still a great way to honor these highly respected educators. Congrats to Vogel Elementary School teacher Kelsey Simmons, North Jr High School & EVSC North High School teacher Noah Farmer and EVSC Harrison & Shepard Leadership and Law Academy teacher Chad Fetscher. #EVSCproud",https://facebook.com/story.php?story_fbid=10159016698663258&id=182125408257,,0.0,"Thanks to University of Evansville for recognizing last spring's Vanderburgh County Educators of the Year yesterday during a special Zoom ceremony. While this wasn't the typical recognition banquet due to the pandemic, it was still a great way to honor these highly respected educators. Congrats to Vogel Elementary School teacher Kelsey Simmons, North Jr High School & EVSC North High School teacher Noah Farmer and EVSC Harrison & Shepard Leadership and Law Academy teacher Chad Fetscher. #EVSCproud",2020-09-04 09:25:07,,
9,0.0,,11.0,https://bit.ly/32Km3B0,10159007877743258,https://www.facebook.com/EVPLibrary/posts/10164378475635341,https://facebook.com/story.php?story_fbid=10159007877743258&id=182125408257,"EVPL.ORG
Library Card Sign-up Month | Evansville Vanderburgh Public Library",8.0,"https://www.facebook.com/EVPLibrary/posts/10164378475635341

EVPL.ORG
Library Card Sign-up Month | Evansville Vanderburgh Public Library",2020-09-01 11:19:17,,
10,5.0,https://scontent-atl3-1.xx.fbcdn.net/v/t1.0-9/118553769_10158997259793258_59843696127523927_o.png?_nc_cat=102&_nc_sid=8024bb&_nc_ohc=T8aWLiL6lmAAX9Zkm_E&_nc_ht=scontent-atl3-1.xx&oh=886a731846a70effa27ac92547278fe0&oe=5F844EFB,39.0,,10158997263443258,Keep in mind you can now report student absences online. We hope parents find this to be a convenient way to inform schools when your child will not be at school.,https://facebook.com/story.php?story_fbid=10158997263443258&id=182125408257,,0.0,Keep in mind you can now report student absences online. We hope parents find this to be a convenient way to inform schools when your child will not be at school.,2020-08-30 14:30:01,,
11,38.0,,59.0,,10158994065778258,COVID-19 update with Vanderburgh County Health Department discussing changes from the CDC on screening guidance for parents as well as a new state color coding system to track positive cases in Indiana counties.,,,0.0,COVID-19 update with Vanderburgh County Health Department discussing changes from the CDC on screening guidance for parents as well as a new state color coding system to track positive cases in Indiana counties.,2020-08-27 15:54:21,https://video-atl3-1.xx.fbcdn.net/v/t42.9040-2/10000000_411756649796497_3560588236405552279_n.mp4?_nc_cat=101&_nc_sid=985c63&efg=eyJ2ZW5jb2RlX3RhZyI6ImxlZ2FjeV9zZCJ9&_nc_ohc=lcer-jxcKTEAX_pLXIN&_nc_ht=video-atl3-1.xx&oh=83e2b1a3522277e3c536920adc9b7b39&oe=5F5E48FB,
12,1.0,https://scontent-atl3-1.xx.fbcdn.net/v/t1.0-9/92642108_10158509441983258_1507505354500472832_n.png?_nc_cat=106&_nc_sid=dd9801&_nc_ohc=oooxZrk87JAAX8ErpsW&_nc_ht=scontent-atl3-1.xx&oh=1cec2e57f322e46273ff422107bf110a&oe=5F83F514,39.0,,10158993884028258,,,,0.0,,2020-08-27 14:32:04,,
13,14.0,https://scontent-atl3-1.xx.fbcdn.net/v/t1.0-9/fr/cp0/e15/q65/118513652_10158991130998258_8234091236661966180_o.jpg?_nc_cat=107&_nc_sid=8024bb&_nc_ohc=1U57MVABrDoAX9-Khh8&_nc_ht=scontent-atl3-1.xx&tp=14&oh=1e8b83778a81a3a4c3eb1e94f69050b2&oe=5F8548FE,36.0,,10158991132573258,Updated screening guidelines from the CDC and Indiana Department of Health.,https://facebook.com/story.php?story_fbid=10158991132573258&id=182125408257,,0.0,Updated screening guidelines from the CDC and Indiana Department of Health.,2020-08-26 16:27:05,,
14,10.0,,79.0,,10158990044223258,,,,0.0,,2020-08-26 09:01:11,,
15,10.0,,216.0,,10158988430513258,To all of our K-Z students & families and to all our hard working staff...THANK YOU for the past 2 days. We are off to a great start with the second half of our students! One more day with the soft start before we see everyone on Thursday. #inthistogether #WeAreEVSC,https://facebook.com/story.php?story_fbid=10158988430513258&id=182125408257,,0.0,To all of our K-Z students & families and to all our hard working staff...THANK YOU for the past 2 days. We are off to a great start with the second half of our students! One more day with the soft start before we see everyone on Thursday. #inthistogether #WeAreEVSC,2020-08-25 17:28:56,,
16,3.0,https://scontent-atl3-1.xx.fbcdn.net/v/t1.0-9/fr/cp0/e15/q65/118438118_10158982981883258_824883246007756753_o.jpg?_nc_cat=111&_nc_sid=da1649&_nc_ohc=hAKOf2ACzEoAX9RmGzl&_nc_ht=scontent-atl3-1.xx&tp=14&oh=27982fe1f1303b87a2f33d087bb2d7c1&oe=5F81EB14,34.0,,10158982981878258,"For everyone's safety, bus riders MUST wear a mask at ALL TIMES when loading, riding, and unloading school buses. #INthistogether",,,0.0,"For everyone's safety, bus riders MUST wear a mask at ALL TIMES when loading, riding, and unloading school buses. #INthistogether",2020-08-23 15:00:11,,
17,18.0,https://scontent-atl3-1.xx.fbcdn.net/v/t1.0-9/fr/cp0/e15/q65/118444461_10158982009233258_1240248725756145006_o.jpg?_nc_cat=109&_nc_sid=da1649&_nc_ohc=nLCdSaCBQUIAX9Myp17&_nc_ht=scontent-atl3-1.xx&tp=14&oh=5eb4ceb63da66a563d0b09ee7965452b&oe=5F851339,75.0,,10158982009223258,"Parents of K-Z students, please make sure you are working with your student on wearing masks properly so they are ready when school begins tomorrow. Let's work together to keep everyone safe! #INthistogether",,,0.0,"Parents of K-Z students, please make sure you are working with your student on wearing masks properly so they are ready when school begins tomorrow. Let's work together to keep everyone safe! #INthistogether",2020-08-23 09:00:14,,
18,3.0,https://scontent-atl3-1.xx.fbcdn.net/v/t1.0-9/fr/cp0/e15/q65/118319049_10158980170123258_8238508899312296573_o.jpg?_nc_cat=110&_nc_sid=da1649&_nc_ohc=pfE-eVgyjKMAX9qy4kd&_nc_ht=scontent-atl3-1.xx&tp=14&oh=dca4fd0ff2ef128b979291916f062c4b&oe=5F84688B,35.0,,10158980170118258,"K-Z students, we are excited to see you Monday! Remember, for everyone's safety, all bus riders must wear a mask at all times when loading, riding, and unloading our school buses. #INthistogether",,,0.0,"K-Z students, we are excited to see you Monday! Remember, for everyone's safety, all bus riders must wear a mask at all times when loading, riding, and unloading our school buses. #INthistogether",2020-08-22 15:00:10,,
19,3.0,https://scontent-atl3-1.xx.fbcdn.net/v/t1.0-9/fr/cp0/e15/q65/118307079_10158979065948258_3035870476985697912_o.jpg?_nc_cat=101&_nc_sid=da1649&_nc_ohc=cyyrCUAVKJ8AX89NnFh&_nc_ht=scontent-atl3-1.xx&tp=14&oh=a72176124a9503685793e0cd524514b2&oe=5F82EA16,31.0,,10158979065938258,Covid-19 screening handout from our reopening plan for parents to use. Please help us by remembering to keep students home if they are not feeling well or waiting for a test result.,,,0.0,Covid-19 screening handout from our reopening plan for parents to use. Please help us by remembering to keep students home if they are not feeling well or waiting for a test result.,2020-08-22 09:00:11,,
20,15.0,,79.0,,10158977046078258,"Wrap-up podcast of school reopening for students with names A-J, looking forward to welcoming students K-Z on Monday! In this podcast you will hear from Dr. Smith, students and a teacher providing remote instruction.",,,0.0,"Wrap-up podcast of school reopening for students with names A-J, looking forward to welcoming students K-Z on Monday! In this podcast you will hear from Dr. Smith, students and a teacher providing remote instruction.",2020-08-21 17:00:02,https://video-atl3-1.xx.fbcdn.net/v/t42.9040-2/10000000_2877979629154918_4944722463881691692_n.mp4?_nc_cat=106&_nc_sid=985c63&efg=eyJ2ZW5jb2RlX3RhZyI6ImxlZ2FjeV9zZCJ9&_nc_ohc=vDTvMwn_Kv8AX-attf7&_nc_ht=video-atl3-1.xx&oh=d1114026ea5493b295869b27f822cdd2&oe=5F5E52DF,
21,15.0,https://scontent-atl3-1.xx.fbcdn.net/v/t1.0-9/fr/cp0/e15/q65/118014281_10158975983863258_6448695850270333591_o.jpg?_nc_cat=110&_nc_sid=da1649&_nc_ohc=Jsc-kk7GHIEAX9QpvR6&_nc_ht=scontent-atl3-1.xx&tp=14&oh=dbb1ad2880ff2db03074cc9a187b8a79&oe=5F83F23D,93.0,,10158975983853258,"We are so excited to see our K-Z students on Monday!

A-J students, don't forget that you will stay home from the 24th-26th, and join us again starting on Thursday the 27th.",,,0.0,"We are so excited to see our K-Z students on Monday!

A-J students, don't forget that you will stay home from the 24th-26th, and join us again starting on Thursday the 27th.",2020-08-21 10:00:21,,
22,61.0,https://scontent-atl3-1.xx.fbcdn.net/v/t1.0-9/fr/cp0/e15/q65/118192050_10158973919373258_395813988182906262_o.jpg?_nc_cat=103&_nc_sid=8024bb&_nc_ohc=9RhZL2Cbxz0AX-WNTwP&_nc_ht=scontent-atl3-1.xx&tp=14&oh=57ad3b3cea62918f104be4935e354de3&oe=5F839DD1,335.0,,10158973924348258,Great to see students and staff adjusting so quickly to the new normal! #WeAreEVSC #INthistogether,https://facebook.com/story.php?story_fbid=10158973924348258&id=182125408257,,0.0,Great to see students and staff adjusting so quickly to the new normal! #WeAreEVSC #INthistogether,2020-08-20 16:48:25,,
23,25.0,,262.0,,10158971012268258,"UPDATE...Now we can say THANK YOU to everyone for making today a great reopening of schools! So many smiling faces in all schools today. What a total team effort...students, teachers, staff, parents and community members are responsible for making this successful! We have two more days with students A-J before students with last names K-Z return on Monday.",https://facebook.com/story.php?story_fbid=10158971012268258&id=182125408257,"EVSC (Evansville Vanderburgh School Corporation)
August 19 at 11:37 AM 路

Thanks to all the parents and families for your support in getting the year started this morning for half of our students...we couldn't do it without you! #inthistogether #WeAreEVSC",10.0,"UPDATE...Now we can say THANK YOU to everyone for making today a great reopening of schools! So many smiling faces in all schools today. What a total team effort...students, teachers, staff, parents and community members are responsible for making this successful! We have two more days with students A-J before students with last names K-Z return on Monday.

EVSC (Evansville Vanderburgh School Corporation)
August 19 at 11:37 AM 路

Thanks to all the parents and families for your support in getting the year started this morning for half of our students...we couldn't do it without you! #inthistogether #WeAreEVSC",2020-08-19 16:53:06,,
24,9.0,https://scontent-atl3-1.xx.fbcdn.net/v/t1.0-9/fr/cp0/e15/q65/118168357_10158970408703258_7401886330829475370_n.jpg?_nc_cat=101&_nc_sid=8024bb&_nc_ohc=lWEVWK7pdbQAX8ZkA7b&_nc_ht=scontent-atl3-1.xx&tp=14&oh=d7c145c4dbff4fd2c205e1844c6c9e1a&oe=5F836CDB,210.0,,10158970412363258,Thanks to all the parents and families for your support in getting the year started this morning for half of our students...we couldn't do it without you! #inthistogether #WeAreEVSC,https://facebook.com/story.php?story_fbid=10158970412363258&id=182125408257,,0.0,Thanks to all the parents and families for your support in getting the year started this morning for half of our students...we couldn't do it without you! #inthistogether #WeAreEVSC,2020-08-19 12:37:39,,
25,30.0,,259.0,,10158965330748258,"After some extensive concrete work and a new paint job, the Reitz High School bowl is looking great!

Updates from Benjamin Bosse High School and Central High School stadiums coming soon...",,,0.0,"After some extensive concrete work and a new paint job, the Reitz High School bowl is looking great!

Updates from Benjamin Bosse High School and Central High School stadiums coming soon...",2020-08-18 18:00:02,https://video-atl3-1.xx.fbcdn.net/v/t42.9040-2/117939116_727241094487714_4284075869212281196_n.mp4?_nc_cat=101&_nc_sid=985c63&efg=eyJ2ZW5jb2RlX3RhZyI6ImxlZ2FjeV9zZCJ9&_nc_ohc=Has2cQzZWyIAX8Lz-nt&_nc_ht=video-atl3-1.xx&oh=1f453019a247d11e34cf5924c2f6314d&oe=5F5E4706,
26,36.0,https://scontent-atl3-1.xx.fbcdn.net/v/t1.0-9/fr/cp0/e15/q65/118226334_10158968012178258_7798767113301190223_o.jpg?_nc_cat=102&_nc_sid=8024bb&_nc_ohc=kUoA5mw6hyYAX8vobyg&_nc_ht=scontent-atl3-1.xx&tp=14&oh=df2340fd006c1e8967d1e86507d38da3&oe=5F857401,39.0,,10158968018203258,"Make sure you remember, any student riding the bus must wear their mask properly when loading, riding and unloading the school bus. If you enrolled online for bus transportation, you should have received a phone call from your bus driver late last week. If you have a question about your child riding the bus, please call 812-435-1BUS.",https://facebook.com/story.php?story_fbid=10158968018203258&id=182125408257,,0.0,"Make sure you remember, any student riding the bus must wear their mask properly when loading, riding and unloading the school bus. If you enrolled online for bus transportation, you should have received a phone call from your bus driver late last week. If you have a question about your child riding the bus, please call 812-435-1BUS.",2020-08-18 14:47:26,,
27,39.0,https://scontent-atl3-1.xx.fbcdn.net/v/t1.0-9/fr/cp0/e15/q65/118003314_10158967581258258_6508191015412559543_o.jpg?_nc_cat=110&_nc_sid=8024bb&_nc_ohc=OdxO5b_opIwAX8txQZg&_nc_ht=scontent-atl3-1.xx&tp=14&oh=aee9fc7421e8d1e50bbaec7c8c6bccab&oe=5F82ED31,103.0,,10158967581433258,"UPDATE from the EVSC Virtual Academy: We are working to enroll all of the student applications that were submitted in the past two days. Keep in mind students may not be enrolled on the same day they submit their enrollment forms. Once students are officially enrolled, the Virtual Academy will be able to generate usernames and login information for the curriculum platforms. These will be emailed to students and parents as soon as they are available, so please keep checking your email. We appreciate your patience and look forward to working with students new to the program.",https://facebook.com/story.php?story_fbid=10158967581433258&id=182125408257,,0.0,"UPDATE from the EVSC Virtual Academy: We are working to enroll all of the student applications that were submitted in the past two days. Keep in mind students may not be enrolled on the same day they submit their enrollment forms. Once students are officially enrolled, the Virtual Academy will be able to generate usernames and login information for the curriculum platforms. These will be emailed to students and parents as soon as they are available, so please keep checking your email. We appreciate your patience and look forward to working with students new to the program.",2020-08-18 11:05:50,,
28,7.0,https://scontent-atl3-1.xx.fbcdn.net/v/t1.0-9/fr/cp0/e15/q65/118040566_10158965483133258_3933261375941950076_o.jpg?_nc_cat=111&_nc_sid=da1649&_nc_ohc=7DDSYEmpSpkAX_UXbnl&_nc_ht=scontent-atl3-1.xx&tp=14&oh=a79636d87dbd17330337ef2071582900&oe=5F840F0F,108.0,,10158965483128258,This year we encourage families to use the new online attendance reporting system.,,,0.0,This year we encourage families to use the new online attendance reporting system.,2020-08-17 18:00:13,,
29,0.0,https://scontent-atl3-1.xx.fbcdn.net/v/t1.0-9/fr/cp0/e15/q65/118098566_10158965156943258_684238177731944728_o.jpg?_nc_cat=105&_nc_sid=dd9801&_nc_ohc=ZgUzuAi-XrsAX8D00Vx&_nc_ht=scontent-atl3-1.xx&tp=14&oh=6eb0c9257bdc2096d7b672b2ba2a9bfd&oe=5F83617E,26.0,,10158965157668258,,,,0.0,,2020-08-17 15:55:17,,
30,9.0,,31.0,https://omny.fm/shows/wiky-morning-show-to-go/evsc-schools-at-last-begin-but-slowly,10158964659263258,,https://facebook.com/story.php?story_fbid=10158964659263258&id=182125408257,"OMNY.FM
EVSC Schools At Last Begin (but slowly) - WIKY Morning Show To Go - Omny.fm",5.0,"OMNY.FM
EVSC Schools At Last Begin (but slowly) - WIKY Morning Show To Go - Omny.fm",2020-08-17 12:40:30,,
31,23.0,https://scontent-atl3-1.xx.fbcdn.net/v/t1.0-9/fr/cp0/e15/q65/117783763_10158956586353258_8512289228014854974_o.jpg?_nc_cat=103&_nc_sid=8024bb&_nc_ohc=zmiMyDEjzO8AX_7oNQw&_nc_ht=scontent-atl3-1.xx&tp=14&oh=117e0f4a3dc9dcdb937d3b8d579a8609&oe=5F843E2B,121.0,,10158956587203258,"Don't forget!!

For everyone's safety, all bus riders MUST wear a mask at all times when loading, riding, and unloading our school buses. #INthistogether",https://facebook.com/story.php?story_fbid=10158956587203258&id=182125408257,,0.0,"Don't forget!!

For everyone's safety, all bus riders MUST wear a mask at all times when loading, riding, and unloading our school buses. #INthistogether",2020-08-16 14:00:01,,
32,2.0,https://scontent-atl3-1.xx.fbcdn.net/v/t1.0-9/fr/cp0/e15/q65/118003751_10158956584688258_3597489682154931261_o.jpg?_nc_cat=110&_nc_sid=8024bb&_nc_ohc=ttHwnyaT6iEAX8dSnnO&_nc_ht=scontent-atl3-1.xx&tp=14&oh=91613ee84388536e9fd78b8a04bef60b&oe=5F83CAC1,90.0,,10158956586038258,"Don't forget! For everyone's safety, all bus riders must wear a mask at all times when loading, riding, and unloading our school buses. #INthistogether",https://facebook.com/story.php?story_fbid=10158956586038258&id=182125408257,,0.0,"Don't forget! For everyone's safety, all bus riders must wear a mask at all times when loading, riding, and unloading our school buses. #INthistogether",2020-08-15 09:00:01,,
33,2.0,https://scontent-atl3-1.xx.fbcdn.net/v/t1.0-9/fr/cp0/e15/q65/117907291_10158956999913258_9210246427816930949_o.jpg?_nc_cat=110&_nc_sid=8024bb&_nc_ohc=fMpHFylfmJsAX_QhQWD&_nc_ht=scontent-atl3-1.xx&tp=14&oh=91921daa2c57c54680ecdf135dbc22f1&oe=5F82FE6C,36.0,,10158957001473258,Join our team! #WeAreEVSC,https://facebook.com/story.php?story_fbid=10158957001473258&id=182125408257,,0.0,Join our team! #WeAreEVSC,2020-08-14 15:57:06,,
34,14.0,https://scontent-atl3-1.xx.fbcdn.net/v/t1.0-9/fr/cp0/e15/q65/117890756_10158956144473258_5303597373975532004_o.jpg?_nc_cat=100&_nc_sid=8024bb&_nc_ohc=GaOnAy_w674AX-78YGO&_nc_ht=scontent-atl3-1.xx&tp=14&oh=5d9f7a693181244a4d411064544937c9&oe=5F85077D,66.0,,10158956149128258,Keep this handy...Covid-19 screening guidance from our reopening plan for parents to use. Please remember to keep students home if they are not feeling well or waiting for a test result.,https://facebook.com/story.php?story_fbid=10158956149128258&id=182125408257,,0.0,Keep this handy...Covid-19 screening guidance from our reopening plan for parents to use. Please remember to keep students home if they are not feeling well or waiting for a test result.,2020-08-14 09:52:57,,
