,comments,image,likes,link,post_id,post_text,post_url,shared_text,shares,text,time,video,video_thumbnail
0,0.0,,5.0,https://www.frankfortema.org/,2074839955995417,"Please see the below link to the County and City Joint COVID-19 webpage. This page will be continuously updated as information is received. Please share this information with your family and friends. -

https://www.frankfortema.org/",https://facebook.com/story.php?story_fbid=2074839955995417&id=242234105922687,"Home

Home

Home

Home

Home

See more at
frankfortema.org",0.0,"Please see the below link to the County and City Joint COVID-19 webpage. This page will be continuously updated as information is received. Please share this information with your family and friends. -

https://www.frankfortema.org/

Home

Home

Home

Home

Home

See more at
frankfortema.org",2020-03-18 08:25:05,,
1,0.0,,0.0,https://go.usa.gov/xG8qW,2264318043714273,"As of 4 p.m. Sept. 11, Gov. Beshear reported that there are at least 55,704 #COVID19 cases in Kentucky, 948 of which were newly reported Friday. https://go.usa.gov/xG8qW",https://facebook.com/story.php?story_fbid=2264318043714273&id=242234105922687,"Governor Andy Beshear
23 hrs ·

As of 4 p.m. Sept. 11, Gov. Beshear reported that there are at least 55,704 #COVID19 cases in Kentucky, 948 of which were newly reported Friday. https://go.usa.gov/xG8qW",0.0,"As of 4 p.m. Sept. 11, Gov. Beshear reported that there are at least 55,704 #COVID19 cases in Kentucky, 948 of which were newly reported Friday. https://go.usa.gov/xG8qW

Governor Andy Beshear
23 hrs ·

As of 4 p.m. Sept. 11, Gov. Beshear reported that there are at least 55,704 #COVID19 cases in Kentucky, 948 of which were newly reported Friday. https://go.usa.gov/xG8qW",2020-09-11 17:28:41,https://video-atl3-1.xx.fbcdn.net/v/t42.9040-2/119308008_627857741263213_2514433129559832766_n.mp4?_nc_cat=105&_nc_sid=985c63&efg=eyJ2ZW5jb2RlX3RhZyI6ImxlZ2FjeV9zZCJ9&_nc_ohc=i-l8k3qMtzMAX8W5iOd&_nc_ht=video-atl3-1.xx&oh=02314209bd4e22b6555ef4373d6e2916&oe=5F5D5A53,
2,0.0,,4.0,http://www.911memorial.org/anniversary,2264182033727874,"Today we remember those who lost their lives on September 11th, 2001. We honor their memories and pay tribute to the courage of all the first responders who answered the call of duty that day. We will never forget their sacrifice.",https://facebook.com/story.php?story_fbid=2264182033727874&id=242234105922687,"National September 11 Memorial & Museum was live.
Yesterday at 12:30 PM ·

On this sacred day, we honor the innocent lives lost and recognize the courage of those who made the ultimate sacrifice and risked their lives to save others 19 years ago. Today, at the 9/11 Memorial, we will hear the names of the 2,983 men, women and children killed as a result of the terrorist events of September 11, 2001 and February 26, 1993. We will stand in solidarity with their families and loved ones as we honor the life of every victim and fulfill our sacred promise to remember always. www.911memorial.org/anniversary",0.0,"Today we remember those who lost their lives on September 11th, 2001. We honor their memories and pay tribute to the courage of all the first responders who answered the call of duty that day. We will never forget their sacrifice.

National September 11 Memorial & Museum was live.
Yesterday at 12:30 PM ·

On this sacred day, we honor the innocent lives lost and recognize the courage of those who made the ultimate sacrifice and risked their lives to save others 19 years ago. Today, at the 9/11 Memorial, we will hear the names of the 2,983 men, women and children killed as a result of the terrorist events of September 11, 2001 and February 26, 1993. We will stand in solidarity with their families and loved ones as we honor the life of every victim and fulfill our sacred promise to remember always. www.911memorial.org/anniversary",2020-09-11 14:26:25,https://scontent-atl3-1.xx.fbcdn.net/v/t66.36281-6/10000000_377032729976597_6662038773355501770_n.mp4?_nc_cat=101&_nc_sid=985c63&efg=eyJ2ZW5jb2RlX3RhZyI6Im9lcF9zZCJ9&_nc_ohc=_i-Hxy-vqxUAX944aA4&_nc_ht=scontent-atl3-1.xx&oh=72037f0288916ebda82508bcb3e2ca0c&oe=5F84101C,
3,0.0,,0.0,https://franklincounty.ky.gov/wp-content/uploads/2020/09/09-15-2020-NOTICE-OF-VIDEO-TELECONFERENCE-MEETING-AND-AGENDA.pdf,2264024930410251,"Fiscal Court Agenda: 9/15/20, 5 PM -",https://facebook.com/story.php?story_fbid=2264024930410251&id=242234105922687,"FRANKLINCOUNTY.KY.GOV
franklincounty.ky.gov",0.0,"Fiscal Court Agenda: 9/15/20, 5 PM -

FRANKLINCOUNTY.KY.GOV
franklincounty.ky.gov",2020-09-11 11:11:48,,
4,1.0,,1.0,http://www.govoteky.com/,2263909013755176,"An update from the Franklin County Clerk -

Please read and share:

It is my unfortunate obligation to inform the citizens of Franklin County that the Franklin County Clerk’s Office will be closed starting Friday, September 11th, until Wednesday, September 16th. This closure is necessary for a thorough cleaning of the building and offices. Due to the pandemic, this is an essential step in our commitment to serve our community responsibly. Our goal is to ensure a safe environment for our employees, the general public, and anyone who enters our offices.

We apologize for this inconvenience. We pledge to make every effort to complete your transactions in a timely manner. We remain diligent in our efforts to reopen and appreciate your patience during this unprecedented time.

For questions concerning the upcoming General Election please contact our Franklin County Election Headquarters at 317 W. 2nd St. (502) 875–8704 or visit www.govoteky.com

It’s truly my honor to serve this community. Thank you

Jeff Hancock
Franklin County Clerk",https://facebook.com/story.php?story_fbid=2263909013755176&id=242234105922687,"VRSWS.SOS.KY.GOV
Voter Information Guide - Kentucky State Board of Elections",4.0,"An update from the Franklin County Clerk -

Please read and share:

It is my unfortunate obligation to inform the citizens of Franklin County that the Franklin County Clerk’s Office will be closed starting Friday, September 11th, until Wednesday, September 16th. This closure is necessary for a thorough cleaning of the building and offices. Due to the pandemic, this is an essential step in our commitment to serve our community responsibly. Our goal is to ensure a safe environment for our employees, the general public, and anyone who enters our offices.

We apologize for this inconvenience. We pledge to make every effort to complete your transactions in a timely manner. We remain diligent in our efforts to reopen and appreciate your patience during this unprecedented time.

For questions concerning the upcoming General Election please contact our Franklin County Election Headquarters at 317 W. 2nd St. (502) 875–8704 or visit www.govoteky.com

It’s truly my honor to serve this community. Thank you

Jeff Hancock
Franklin County Clerk

VRSWS.SOS.KY.GOV
Voter Information Guide - Kentucky State Board of Elections",2020-09-11 09:14:08,,
5,0.0,https://scontent-atl3-1.xx.fbcdn.net/v/t1.0-9/119154832_10161411939444616_391886287970330612_o.png?_nc_cat=106&_nc_sid=8024bb&_nc_ohc=u9apNFq065MAX_ec4rM&_nc_ht=scontent-atl3-1.xx&oh=71da198c13e531561c37e130722158c6&oe=5F83B8CC,0.0,http://FCHD.org/,2263286733817404,,https://facebook.com/story.php?story_fbid=2263286733817404&id=242234105922687,,0.0,,2020-09-10 19:41:36,,
6,0.0,,0.0,,2263274033818674,Gov. Andy Beshear -Special Address 09.10.2020,https://facebook.com/story.php?story_fbid=2263274033818674&id=242234105922687,"Governor Andy Beshear was live.
September 10 at 9:27 PM ·

Gov. Andy Beshear -Special Address 09.10.2020",0.0,"Gov. Andy Beshear -Special Address 09.10.2020

Governor Andy Beshear was live.
September 10 at 9:27 PM ·

Gov. Andy Beshear -Special Address 09.10.2020",2020-09-10 19:24:54,https://scontent-atl3-1.xx.fbcdn.net/v/t66.36281-6/10000000_176560214025720_4780962283338474210_n.mp4?_nc_cat=102&_nc_sid=985c63&efg=eyJ2ZW5jb2RlX3RhZyI6Im9lcF9zZCJ9&_nc_ohc=WVqrkLyldnYAX-NLOVr&_nc_ht=scontent-atl3-1.xx&oh=18cb7f91f919e1e3829e2c1e1e99d285&oe=5F8320C9,
7,0.0,,0.0,,327225605004597,"Frankfort-Franklin County Planning Commission Sept. 10, 2020",,,0.0,"Frankfort-Franklin County Planning Commission Sept. 10, 2020",2020-09-10 17:40:40,https://scontent-atl3-1.xx.fbcdn.net/v/t66.36281-6/10000000_364768344546083_8603358664877397256_n.mp4?_nc_cat=102&_nc_sid=985c63&efg=eyJ2ZW5jb2RlX3RhZyI6Im9lcF9zZCJ9&_nc_ohc=g0bPXSnPCfAAX8zusB6&_nc_ht=scontent-atl3-1.xx&oh=3ffa9c9a0c7264afcd03104175810c82&oe=5F839DC7,
8,0.0,,1.0,,665075904364268,"Finance Committee Meeting: September 10, 2020.",,,0.0,"Finance Committee Meeting: September 10, 2020.",2020-09-10 13:01:26,https://scontent-atl3-1.xx.fbcdn.net/v/t66.36281-6/10000000_2757765561173957_3371359398624819009_n.mp4?_nc_cat=109&_nc_sid=985c63&efg=eyJ2ZW5jb2RlX3RhZyI6Im9lcF9zZCJ9&_nc_ohc=HRFtDoExYwcAX-hNQJ_&_nc_ht=scontent-atl3-1.xx&oh=69d5951764cfecb1b4387a30ac6c07f5&oe=5F82D324,
9,0.0,,0.0,,2262901410522603,An update from the Franklin County Clerk:,https://facebook.com/story.php?story_fbid=2262901410522603&id=242234105922687,"Franklin County Clerk
September 10 at 2:09 PM ·

The Franklin County Clerk's Office will close at 1:00PM today, Sept. 10th, and reopen tomorrow morning, Sept. 11th, at 8:30AM. We apologize for the inconvenience.",3.0,"An update from the Franklin County Clerk:

Franklin County Clerk
September 10 at 2:09 PM ·

The Franklin County Clerk's Office will close at 1:00PM today, Sept. 10th, and reopen tomorrow morning, Sept. 11th, at 8:30AM. We apologize for the inconvenience.",2020-09-10 10:27:32,,
10,0.0,,0.0,,,"The Franklin County Clerk's Office will close at 1:00PM today, Sept. 10th, and reopen tomorrow morning, Sept. 11th, at 8:30AM. We apologize for the inconvenience.",https://facebook.com/story.php?story_fbid=2046782738785216&id=616711918458979,,0.0,"The Franklin County Clerk's Office will close at 1:00PM today, Sept. 10th, and reopen tomorrow morning, Sept. 11th, at 8:30AM. We apologize for the inconvenience.",,,
11,0.0,,0.0,,2262246597254751,"An update from the Franklin County Health Department, KY:",https://facebook.com/story.php?story_fbid=2262246597254751&id=242234105922687,"Franklin County Health Department, KY
September 9 at 10:00 PM ·

⚠️ Please remember, on average, it takes 5-7 days from exposure for individuals to become symptomatic.
🤧🤒🤕😷If you are experiencing symptoms of fever, cough, shortness of breath, diarrhea, vomiting, body aches, chills, extreme tiredness and/or sudden loss of taste or smell PLEASE stay home and away from others, and speak with your medical provider.

📰Important to remember social distancing is still in place and while small groups are allowed - you should maintain six feet apart from each other to prevent the spread of disease. Also, please keep yourself and others safe through prevention measures:
✅ Practice social distancing at ALL times - indoors and outdoors
✅Wash your hands frequently with soap and water
✅Avoid touching your eyes, nose, and mouth
✅Disinfect surfaces often
✅If you are sick, stay home
✅Wear a mask out in public💚
#COVID19 #TeamKentucky #TogetherKy #Patriot #StayHealthyStayHome #StayHealthyFranklinCounty
#MakeAndyProud #FlattenTheCurve #WeWillGetThroughThisTogether",0.0,"An update from the Franklin County Health Department, KY:

Franklin County Health Department, KY
September 9 at 10:00 PM ·

⚠️ Please remember, on average, it takes 5-7 days from exposure for individuals to become symptomatic.
🤧🤒🤕😷If you are experiencing symptoms of fever, cough, shortness of breath, diarrhea, vomiting, body aches, chills, extreme tiredness and/or sudden loss of taste or smell PLEASE stay home and away from others, and speak with your medical provider.

📰Important to remember social distancing is still in place and while small groups are allowed - you should maintain six feet apart from each other to prevent the spread of disease. Also, please keep yourself and others safe through prevention measures:
✅ Practice social distancing at ALL times - indoors and outdoors
✅Wash your hands frequently with soap and water
✅Avoid touching your eyes, nose, and mouth
✅Disinfect surfaces often
✅If you are sick, stay home
✅Wear a mask out in public💚
#COVID19 #TeamKentucky #TogetherKy #Patriot #StayHealthyStayHome #StayHealthyFranklinCounty
#MakeAndyProud #FlattenTheCurve #WeWillGetThroughThisTogether",2020-09-09 20:41:18,,
12,0.0,,0.0,,2262063660606378,Gov. Andy Beshear - Media Briefing 09.09.2020,https://facebook.com/story.php?story_fbid=2262063660606378&id=242234105922687,"Governor Andy Beshear was live.
September 9 at 7:55 PM ·

Gov. Andy Beshear - Media Briefing 09.09.2020",0.0,"Gov. Andy Beshear - Media Briefing 09.09.2020

Governor Andy Beshear was live.
September 9 at 7:55 PM ·

Gov. Andy Beshear - Media Briefing 09.09.2020",2020-09-09 16:08:25,https://scontent-atl3-1.xx.fbcdn.net/v/t66.36281-6/10000000_795408611205597_5214636071022813187_n.mp4?_nc_cat=104&_nc_sid=985c63&efg=eyJ2ZW5jb2RlX3RhZyI6Im9lcF9zZCJ9&_nc_ohc=AOeH2rKkVccAX-Qy8ax&_nc_ht=scontent-atl3-1.xx&oh=5c51dd5e934c756e079e396a6968b1e2&oe=5F838D6F,
13,0.0,https://scontent-atl3-1.xx.fbcdn.net/v/t1.0-9/119064679_10161405543964616_6757519380087925540_o.png?_nc_cat=104&_nc_sid=8024bb&_nc_ohc=GabrjBshCXMAX-keTM_&_nc_oc=AQkIPjD1g1GyznRq4K19GYW5afWwJyBrRmDAYUAaR4KHp37f5z0-wu2QwS7VxK9jAEU&_nc_ht=scontent-atl3-1.xx&oh=45f0531a7a5a700dc8b3bbf7362709e8&oe=5F84732D,0.0,,2261083197371091,"An update from the Franklin County Health Department, KY:",https://facebook.com/story.php?story_fbid=2261083197371091&id=242234105922687,"Franklin County Health Department, KY
September 8 at 10:08 PM ·

⚠️ Please remember, on average, it takes 5-7 days from exposure for individuals to become symptomatic.
🤧🤒🤕😷If you are experiencing symptoms of fever, cough, shortness of breath, diarrhea, vomiting, body aches, chills, extreme tiredness and/or sudden loss of taste or smell PLEASE stay home and away from others, and speak with your medical provider.
📰Important to remember social distancing is still in place and while small groups are allowed - you should maintain six feet apart from each other to prevent the spread of disease. Also, please keep yourself and others safe through prevention measures:
✅ Practice social distancing at ALL times - indoors and outdoors
✅Wash your hands frequently with soap and water
✅Avoid touching your eyes, nose, and mouth
✅Disinfect surfaces often
✅If you are sick, stay home
✅Wear a mask out in public
#COVID19 #TeamKentucky #TogetherKy #Patriot #StayHealthyStayHome #StayHealthyFranklinCounty
#MakeAndyProud #FlattenTheCurve #WeWillGetThroughThisTogether",0.0,"An update from the Franklin County Health Department, KY:

Franklin County Health Department, KY
September 8 at 10:08 PM ·

⚠️ Please remember, on average, it takes 5-7 days from exposure for individuals to become symptomatic.
🤧🤒🤕😷If you are experiencing symptoms of fever, cough, shortness of breath, diarrhea, vomiting, body aches, chills, extreme tiredness and/or sudden loss of taste or smell PLEASE stay home and away from others, and speak with your medical provider.
📰Important to remember social distancing is still in place and while small groups are allowed - you should maintain six feet apart from each other to prevent the spread of disease. Also, please keep yourself and others safe through prevention measures:
✅ Practice social distancing at ALL times - indoors and outdoors
✅Wash your hands frequently with soap and water
✅Avoid touching your eyes, nose, and mouth
✅Disinfect surfaces often
✅If you are sick, stay home
✅Wear a mask out in public
#COVID19 #TeamKentucky #TogetherKy #Patriot #StayHealthyStayHome #StayHealthyFranklinCounty
#MakeAndyProud #FlattenTheCurve #WeWillGetThroughThisTogether",2020-09-08 18:36:23,,
14,0.0,,0.0,,2261035310709213,Gov. Andy Beshear - Media Briefing 09.08.2020,https://facebook.com/story.php?story_fbid=2261035310709213&id=242234105922687,"Governor Andy Beshear was live.
September 8 at 7:56 PM ·

Gov. Andy Beshear - Media Briefing 09.08.2020",0.0,"Gov. Andy Beshear - Media Briefing 09.08.2020

Governor Andy Beshear was live.
September 8 at 7:56 PM ·

Gov. Andy Beshear - Media Briefing 09.08.2020",2020-09-08 17:12:03,https://scontent-atl3-1.xx.fbcdn.net/v/t66.36281-6/10000000_2742010439460356_4923299491169904947_n.mp4?_nc_cat=106&_nc_sid=985c63&efg=eyJ2ZW5jb2RlX3RhZyI6Im9lcF9zZCJ9&_nc_ohc=3m0HqyKwks4AX_zG-Mj&_nc_oc=AQkAKKJhpmEavMsEG33OKbs9wK-hQ-xuDCyZ9WTdR4LNhZK06JVYUPEpX4ieo9qEGrc&_nc_ht=scontent-atl3-1.xx&oh=4304cf6a0b728d3f1b746381de17975a&oe=5F8110CA,
15,0.0,,2.0,,341386583842929,"Tax Rate Public Hearing September 8th, 2020.",,,2.0,"Tax Rate Public Hearing September 8th, 2020.",2020-09-08 16:59:40,https://scontent-atl3-1.xx.fbcdn.net/v/t66.36281-6/10000000_3341746245905567_7339570651054808301_n.mp4?_nc_cat=111&_nc_sid=985c63&efg=eyJ2ZW5jb2RlX3RhZyI6Im9lcF9zZCJ9&_nc_ohc=QiLkH2XOI-AAX9A4xeB&_nc_ht=scontent-atl3-1.xx&oh=221c2acdd3aec3b0a0413783d1294252&oe=5F8165E0,
16,0.0,,0.0,,360530691780757,"Energy Committee Meeting – September 8th, 2020",,,0.0,"Energy Committee Meeting – September 8th, 2020",2020-09-08 15:06:31,https://scontent-atl3-1.xx.fbcdn.net/v/t66.36281-6/10000000_2714016382143865_8758692081232988450_n.mp4?_nc_cat=104&_nc_sid=985c63&efg=eyJ2ZW5jb2RlX3RhZyI6Im9lcF9zZCJ9&_nc_ohc=Nbl_UnYEYF4AX8sKfuj&_nc_ht=scontent-atl3-1.xx&oh=ae255c8bef5d2fa94a29fc9ab6cfc926&oe=5F81BFF4,
17,0.0,https://scontent-atl3-1.xx.fbcdn.net/v/t1.0-9/118882736_10161392565409616_8919852543049172470_n.png?_nc_cat=110&_nc_sid=8024bb&_nc_ohc=W7WAaOXiZPcAX9Km8ry&_nc_ht=scontent-atl3-1.xx&oh=c7a3df8ab9b95382ff95559288ff806a&oe=5F83D0FC,0.0,http://FCHD.org/,2256522834493794,,https://facebook.com/story.php?story_fbid=2256522834493794&id=242234105922687,,0.0,,2020-09-04 18:58:54,,
18,2.0,https://scontent-atl3-1.xx.fbcdn.net/v/t1.0-9/118869115_10158144268356677_481476741102104847_n.png?_nc_cat=108&_nc_sid=da1649&_nc_ohc=Vc_7Vxu1bHoAX-2_Eq1&_nc_ht=scontent-atl3-1.xx&oh=4e3bf8a4f6ee1d62a80b693ed9714bbd&oe=5F8198FE,3.0,,2256397157839695,Frankfort Fireworks tonight at 8:45 PM!,https://facebook.com/story.php?story_fbid=2256397157839695&id=242234105922687,"Frankfort Plant Board
September 4 at 1:45 PM ·

If you want to know when the fireworks are here's the info! May not be traditional but it's on! Dedicated to a Frankfort Business Entrepreneur Tony Davis, who recently passed away in August.",6.0,"Frankfort Fireworks tonight at 8:45 PM!

Frankfort Plant Board
September 4 at 1:45 PM ·

If you want to know when the fireworks are here's the info! May not be traditional but it's on! Dedicated to a Frankfort Business Entrepreneur Tony Davis, who recently passed away in August.",2020-09-04 15:46:11,,
19,0.0,https://scontent-atl3-1.xx.fbcdn.net/v/t1.0-9/107892467_2200695323409879_812579024501425619_o.png?_nc_cat=109&_nc_sid=8024bb&_nc_ohc=xjcmXt7o0Z4AX8_v-jZ&_nc_ht=scontent-atl3-1.xx&oh=acc5e00524f561dd4418d6a97d45434c&oe=5F847367,0.0,,2200695603409851,"A reminder for the holiday trash schedule -

🇺🇸 LABOR DAY COLLECTION SCHEDULE CHANGE 🇺🇸

Central Kentucky Hauling will not be running on Monday, September 7, in observance of Labor Day. All routes for the week will be delayed by one day - Monday will be picked up Tuesday, Tuesday picked up Wednesday, and so on.
The following week, starting September 14, will return to the normal schedule. Please contact the Judge/Executive's Office with any questions - 502-875-8751.",https://facebook.com/story.php?story_fbid=2200695603409851&id=242234105922687,,0.0,"A reminder for the holiday trash schedule -

🇺🇸 LABOR DAY COLLECTION SCHEDULE CHANGE 🇺🇸

Central Kentucky Hauling will not be running on Monday, September 7, in observance of Labor Day. All routes for the week will be delayed by one day - Monday will be picked up Tuesday, Tuesday picked up Wednesday, and so on.
The following week, starting September 14, will return to the normal schedule. Please contact the Judge/Executive's Office with any questions - 502-875-8751.",2020-09-04 13:30:09,,
20,0.0,https://scontent-atl3-1.xx.fbcdn.net/v/t1.0-9/fr/cp0/e15/q65/118814225_2256146001198144_4631782398712750891_o.jpg?_nc_cat=100&_nc_sid=8024bb&_nc_ohc=esecCAoYHesAX-k4gd_&_nc_ht=scontent-atl3-1.xx&tp=14&oh=f4e8da1e9c8cf4c4e04ab8632fe5c1f0&oe=5F83C877,1.0,,2256146087864802,"All County administrative offices will be closed on Monday, September 7, 2020 in observance of the Labor Day holiday.

We will resume normal operations on Tuesday, September 8th, 2020 at 8 AM.

Have a great holiday weekend!",https://facebook.com/story.php?story_fbid=2256146087864802&id=242234105922687,,0.0,"All County administrative offices will be closed on Monday, September 7, 2020 in observance of the Labor Day holiday.

We will resume normal operations on Tuesday, September 8th, 2020 at 8 AM.

Have a great holiday weekend!",2020-09-04 10:31:45,,
21,1.0,https://scontent-atl3-1.xx.fbcdn.net/v/t1.0-9/118790018_10161388994269616_1571938284995331773_n.png?_nc_cat=101&_nc_sid=8024bb&_nc_ohc=1nwLQbplsRQAX8Yb-tr&_nc_ht=scontent-atl3-1.xx&oh=e756d37b40e7935ff196008b3d838c58&oe=5F843CAB,0.0,http://FCHD.org/,2255452871267457,,https://facebook.com/story.php?story_fbid=2255452871267457&id=242234105922687,,0.0,,2020-09-03 18:43:14,,
22,2.0,,2.0,,2255345487944862,Gov. Andy Beshear - Media Briefing 09.03.2020,https://facebook.com/story.php?story_fbid=2255345487944862&id=242234105922687,"Governor Andy Beshear was live.
September 3 at 7:56 PM ·

Gov. Andy Beshear - Media Briefing 09.03.2020",0.0,"Gov. Andy Beshear - Media Briefing 09.03.2020

Governor Andy Beshear was live.
September 3 at 7:56 PM ·

Gov. Andy Beshear - Media Briefing 09.03.2020",2020-09-03 16:10:33,https://scontent-atl3-1.xx.fbcdn.net/v/t66.36281-6/10000000_719549705443515_245716356611851035_n.mp4?_nc_cat=104&_nc_sid=985c63&efg=eyJ2ZW5jb2RlX3RhZyI6Im9lcF9zZCJ9&_nc_ohc=lxXPs2ayrUwAX-09mjU&_nc_ht=scontent-atl3-1.xx&oh=2c5e08d91e929323453ad0ca98be1f29&oe=5F813EFF,
23,0.0,https://scontent-atl3-1.xx.fbcdn.net/v/t1.0-9/118770071_10161385863399616_1740285836909300289_n.png?_nc_cat=109&_nc_sid=8024bb&_nc_ohc=GP3M6TgRQ5oAX8hDNYs&_nc_ht=scontent-atl3-1.xx&oh=a1c27345c3677042f7e2150662e68cbf&oe=5F81E2B9,0.0,,2254294541383290,"An update from the Franklin County Health Department, KY:",https://facebook.com/story.php?story_fbid=2254294541383290&id=242234105922687,"Franklin County Health Department, KY
September 2 at 10:38 PM ·

⚠️ Please remember, on average, it takes 5-7 days from exposure for individuals to become symptomatic.
🤧🤒🤕😷If you are experiencing symptoms of fever, cough, shortness of breath, diarrhea, vomiting, body aches, chills, extreme tiredness and/or sudden loss of taste or smell PLEASE stay home and away from others, and speak with your medical provider.

📰Important to remember social distancing is still in place and while small groups are allowed - you should maintain six feet apart from each other to prevent the spread of disease. Also, please keep yourself and others safe through prevention measures:
✅ Practice social distancing at ALL times - indoors and outdoors
✅Wash your hands frequently with soap and water
✅Avoid touching your eyes, nose, and mouth
✅Disinfect surfaces often
✅If you are sick, stay home
✅Wear a mask out in public💚
#COVID19 #TeamKentucky #TogetherKy #Patriot #StayHealthyStayHome #StayHealthyFranklinCounty
#MakeAndyProud #FlattenTheCurve #WeWillGetThroughThisTogether",0.0,"An update from the Franklin County Health Department, KY:

Franklin County Health Department, KY
September 2 at 10:38 PM ·

⚠️ Please remember, on average, it takes 5-7 days from exposure for individuals to become symptomatic.
🤧🤒🤕😷If you are experiencing symptoms of fever, cough, shortness of breath, diarrhea, vomiting, body aches, chills, extreme tiredness and/or sudden loss of taste or smell PLEASE stay home and away from others, and speak with your medical provider.

📰Important to remember social distancing is still in place and while small groups are allowed - you should maintain six feet apart from each other to prevent the spread of disease. Also, please keep yourself and others safe through prevention measures:
✅ Practice social distancing at ALL times - indoors and outdoors
✅Wash your hands frequently with soap and water
✅Avoid touching your eyes, nose, and mouth
✅Disinfect surfaces often
✅If you are sick, stay home
✅Wear a mask out in public💚
#COVID19 #TeamKentucky #TogetherKy #Patriot #StayHealthyStayHome #StayHealthyFranklinCounty
#MakeAndyProud #FlattenTheCurve #WeWillGetThroughThisTogether",2020-09-02 19:06:43,,
24,2.0,,2.0,,2254175998061811,Gov. Andy Beshear - Media Briefing 09.02.2020,https://facebook.com/story.php?story_fbid=2254175998061811&id=242234105922687,"Governor Andy Beshear was live.
September 2 at 7:56 PM ·

Gov. Andy Beshear - Media Briefing 09.02.2020",0.0,"Gov. Andy Beshear - Media Briefing 09.02.2020

Governor Andy Beshear was live.
September 2 at 7:56 PM ·

Gov. Andy Beshear - Media Briefing 09.02.2020",2020-09-02 16:04:38,https://scontent-atl3-1.xx.fbcdn.net/v/t66.36281-6/10000000_109954410740619_6202699499148761121_n.mp4?_nc_cat=106&_nc_sid=985c63&efg=eyJ2ZW5jb2RlX3RhZyI6Im9lcF9zZCJ9&_nc_ohc=27EAw1wQaZMAX9OV-pY&_nc_ht=scontent-atl3-1.xx&oh=a6cc6cb779895ff290fedf3a899e5024&oe=5F842EF2,
25,0.0,,0.0,,2253050721507672,Gov. Andy Beshear - Media Briefing 09.01.2020,https://facebook.com/story.php?story_fbid=2253050721507672&id=242234105922687,"Governor Andy Beshear was live.
September 1 at 7:56 PM ·

Gov. Andy Beshear - Media Briefing 09.01.2020",0.0,"Gov. Andy Beshear - Media Briefing 09.01.2020

Governor Andy Beshear was live.
September 1 at 7:56 PM ·

Gov. Andy Beshear - Media Briefing 09.01.2020",2020-09-01 16:20:45,https://scontent-atl3-1.xx.fbcdn.net/v/t66.36281-6/10000000_1156064321444946_499293601117642204_n.mp4?_nc_cat=109&_nc_sid=985c63&efg=eyJ2ZW5jb2RlX3RhZyI6Im9lcF9zZCJ9&_nc_ohc=PFw5HuY-z8kAX8IwRR4&_nc_ht=scontent-atl3-1.xx&oh=cfecb019f153373af34cf78e13bd2df1&oe=5F8160E2,
26,0.0,https://scontent-atl3-1.xx.fbcdn.net/v/t1.0-9/118580569_10161379071514616_589451181619356896_n.png?_nc_cat=103&_nc_sid=8024bb&_nc_ohc=lUVbirGRjZMAX9PyTsr&_nc_ht=scontent-atl3-1.xx&oh=37c41f282fd47f8077c85bad9c4a5d74&oe=5F84AB4C,0.0,http://FCHD.org/,2252105541602190,,https://facebook.com/story.php?story_fbid=2252105541602190&id=242234105922687,,0.0,,2020-08-31 18:26:42,,
27,1.0,,3.0,,2252018204944257,Gov. Andy Beshear - Media Briefing 08.31.2020,https://facebook.com/story.php?story_fbid=2252018204944257&id=242234105922687,"Governor Andy Beshear was live.
August 31 at 7:56 PM ·

Gov. Andy Beshear - Media Briefing 08.31.2020",0.0,"Gov. Andy Beshear - Media Briefing 08.31.2020

Governor Andy Beshear was live.
August 31 at 7:56 PM ·

Gov. Andy Beshear - Media Briefing 08.31.2020",2020-08-31 16:21:01,https://scontent-atl3-1.xx.fbcdn.net/v/t66.36281-6/10000000_189278885902040_3319950668292140258_n.mp4?_nc_cat=107&_nc_sid=985c63&efg=eyJ2ZW5jb2RlX3RhZyI6Im9lcF9zZCJ9&_nc_ohc=ND5_0wNmGucAX-JQUUN&_nc_ht=scontent-atl3-1.xx&oh=b68a99b39255deedf5516e86afdc0ec6&oe=5F83B770,
28,1.0,,7.0,https://franklincounty.ky.gov/job-posting-temporary-custodian-up-to-12-months/,2251982468281164,"JOB OPENING!

Temporary Custodian up to 12 months.
$13.00 per hour
M-F 12:00pm-8:30pm.

Must be able to start immediately.

Employment applications may be obtained from the County’s website at https://franklincounty.ky.gov/job-posting-temporary-custodian-up-to-12-months/. Applications may be submitted through the online portal, placed in the mail drop box located outside of the Fiscal Court building, emailed to breadnower@franklincountyky.com or mailed to:

Human Resources Director,
321 West Main Street, Frankfort, KY 40601
If you have any questions you can call HR at 502-875-8751 Ext 1351",https://facebook.com/story.php?story_fbid=2251982468281164&id=242234105922687,"FRANKLINCOUNTY.KY.GOV
Job Posting: Temporary Custodian up to 12 months | Franklin County",29.0,"JOB OPENING!

Temporary Custodian up to 12 months.
$13.00 per hour
M-F 12:00pm-8:30pm.

Must be able to start immediately.

Employment applications may be obtained from the County’s website at https://franklincounty.ky.gov/job-posting-temporary-custodian-up-to-12-months/. Applications may be submitted through the online portal, placed in the mail drop box located outside of the Fiscal Court building, emailed to breadnower@franklincountyky.com or mailed to:

Human Resources Director,
321 West Main Street, Frankfort, KY 40601
If you have any questions you can call HR at 502-875-8751 Ext 1351

FRANKLINCOUNTY.KY.GOV
Job Posting: Temporary Custodian up to 12 months | Franklin County",2020-08-31 15:26:01,,
29,0.0,,0.0,,2251870654959012,Frankfort/Franklin Co COVID-19 Update 8/31/2020,https://facebook.com/story.php?story_fbid=2251870654959012&id=242234105922687,"Frankfort, Kentucky - City Hall was live.
August 31 at 5:01 PM ·

Frankfort/Franklin Co COVID-19 Update 8/31/2020",0.0,"Frankfort/Franklin Co COVID-19 Update 8/31/2020

Frankfort, Kentucky - City Hall was live.
August 31 at 5:01 PM ·

Frankfort/Franklin Co COVID-19 Update 8/31/2020",2020-08-31 13:02:44,https://scontent-atl3-1.xx.fbcdn.net/v/t66.36281-6/10000000_227047852078139_3322953931797237557_n.mp4?_nc_cat=106&_nc_sid=985c63&efg=eyJ2ZW5jb2RlX3RhZyI6Im9lcF9zZCJ9&_nc_ohc=EtZHPvwyuzwAX87u6xa&_nc_ht=scontent-atl3-1.xx&oh=991608b2018949392596128e0381de89&oe=5F84159E,
30,0.0,https://scontent-atl3-1.xx.fbcdn.net/v/t1.0-9/118732075_3247095872047070_1904603492201541544_n.png?_nc_cat=107&_nc_sid=8024bb&_nc_ohc=vOiTKlWS4u8AX9OGala&_nc_ht=scontent-atl3-1.xx&oh=d081421b97411adc4a12e778be15cfdb&oe=5F80F6FE,0.0,,2251786584967419,Join us at 1:00 today for the COVID-19 live update.,https://facebook.com/story.php?story_fbid=2251786584967419&id=242234105922687,"Frankfort, Kentucky - City Hall
August 31 at 3:08 PM ·

Join us at 1:00 today for the COVID-19 live update.",0.0,"Join us at 1:00 today for the COVID-19 live update.

Frankfort, Kentucky - City Hall
August 31 at 3:08 PM ·

Join us at 1:00 today for the COVID-19 live update.",2020-08-31 11:18:36,,
31,0.0,https://scontent-atl3-1.xx.fbcdn.net/v/t1.0-9/106425714_2194227490723329_6814143685654758236_o.png?_nc_cat=103&_nc_sid=8024bb&_nc_ohc=ThAQrfFB6rcAX8FxCNU&_nc_ht=scontent-atl3-1.xx&oh=f27f17e80b06d8fe7f0295db5622e013&oe=5F812EF2,1.0,,2194227710723307,"🇺🇸 LABOR DAY TRASH COLLECTION SCHEDULE CHANGE 🇺🇸

Central Kentucky Hauling will not be running on Monday, September 7, in observance of Labor Day. All routes for the week will be delayed by one day - Monday will be picked up Tuesday, Tuesday picked up Wednesday, and so on.
The following week, starting September 14, will return to the normal schedule. Please contact the Judge/Executive's Office with any questions - 502-875-8751.",https://facebook.com/story.php?story_fbid=2194227710723307&id=242234105922687,,0.0,"🇺🇸 LABOR DAY TRASH COLLECTION SCHEDULE CHANGE 🇺🇸

Central Kentucky Hauling will not be running on Monday, September 7, in observance of Labor Day. All routes for the week will be delayed by one day - Monday will be picked up Tuesday, Tuesday picked up Wednesday, and so on.
The following week, starting September 14, will return to the normal schedule. Please contact the Judge/Executive's Office with any questions - 502-875-8751.",2020-08-31 09:00:14,,
32,2.0,,1.0,https://go.usa.gov/xGYXK,2251023661710378,"With today’s 462 new positive cases of COVID-19, this last week has been our single largest week ever for new cases of COVID: 4,503. It brings our total number of cases to date to 48,032. https://go.usa.gov/xGYXK",https://facebook.com/story.php?story_fbid=2251023661710378&id=242234105922687,"Governor Andy Beshear
August 30 at 8:49 PM ·

With today’s 462 new positive cases of COVID-19, this last week has been our single largest week ever for new cases of COVID: 4,503. It brings our total number of cases to date to 48,032. https://go.usa.gov/xGYXK",0.0,"With today’s 462 new positive cases of COVID-19, this last week has been our single largest week ever for new cases of COVID: 4,503. It brings our total number of cases to date to 48,032. https://go.usa.gov/xGYXK

Governor Andy Beshear
August 30 at 8:49 PM ·

With today’s 462 new positive cases of COVID-19, this last week has been our single largest week ever for new cases of COVID: 4,503. It brings our total number of cases to date to 48,032. https://go.usa.gov/xGYXK",2020-08-30 18:17:19,https://video-atl3-1.xx.fbcdn.net/v/t42.9040-2/117943663_343541600167433_2278086214299785141_n.mp4?_nc_cat=102&_nc_sid=985c63&efg=eyJ2ZW5jb2RlX3RhZyI6ImxlZ2FjeV9zZCJ9&_nc_ohc=UAiRAK1K0toAX_89FBw&_nc_ht=video-atl3-1.xx&oh=d87858c79e5b7c64473858af7e0c9186&oe=5F5D50C0,
33,0.0,,2.0,https://go.usa.gov/xGrM9,2249934735152604,Gov. Andy Beshear on Saturday updated Kentuckians on the state’s continuing efforts to fight #COVID19. https://go.usa.gov/xGrM9,https://facebook.com/story.php?story_fbid=2249934735152604&id=242234105922687,"Governor Andy Beshear
August 29 at 9:10 PM ·

Gov. Andy Beshear on Saturday updated Kentuckians on the state’s continuing efforts to fight #COVID19. https://go.usa.gov/xGrM9",0.0,"Gov. Andy Beshear on Saturday updated Kentuckians on the state’s continuing efforts to fight #COVID19. https://go.usa.gov/xGrM9

Governor Andy Beshear
August 29 at 9:10 PM ·

Gov. Andy Beshear on Saturday updated Kentuckians on the state’s continuing efforts to fight #COVID19. https://go.usa.gov/xGrM9",2020-08-29 17:53:44,https://video-atl3-1.xx.fbcdn.net/v/t42.9040-2/118684192_237104154229746_330246374204515924_n.mp4?_nc_cat=108&_nc_sid=985c63&efg=eyJ2ZW5jb2RlX3RhZyI6ImxlZ2FjeV9zZCJ9&_nc_ohc=jQbeHwt_eLkAX-EWLjH&_nc_ht=video-atl3-1.xx&oh=97bb72dcbada5163c8160a5c9e132b80&oe=5F5D522B,
34,1.0,,1.0,https://go.usa.gov/xGrYb,2248900805255997,"As of 4 p.m. Aug. 28, Gov. Beshear said there were at least 46,757 coronavirus cases in Kentucky, 792 of which were newly reported Friday. https://go.usa.gov/xGrYb",https://facebook.com/story.php?story_fbid=2248900805255997&id=242234105922687,"Governor Andy Beshear
August 28 at 10:03 PM ·

As of 4 p.m. Aug. 28, Gov. Beshear said there were at least 46,757 coronavirus cases in Kentucky, 792 of which were newly reported Friday. https://go.usa.gov/xGrYb",0.0,"As of 4 p.m. Aug. 28, Gov. Beshear said there were at least 46,757 coronavirus cases in Kentucky, 792 of which were newly reported Friday. https://go.usa.gov/xGrYb

Governor Andy Beshear
August 28 at 10:03 PM ·

As of 4 p.m. Aug. 28, Gov. Beshear said there were at least 46,757 coronavirus cases in Kentucky, 792 of which were newly reported Friday. https://go.usa.gov/xGrYb",2020-08-28 20:11:47,https://video-atl3-1.xx.fbcdn.net/v/t42.9040-2/118527414_237380854191417_5929254443992344479_n.mp4?_nc_cat=107&_nc_sid=985c63&efg=eyJ2ZW5jb2RlX3RhZyI6ImxlZ2FjeV9zZCJ9&_nc_ohc=Y_264KyVOrwAX8G-tmx&_nc_ht=video-atl3-1.xx&oh=c37dcf52d4df77722f24c82d399ffd05&oe=5F5D5398,
35,0.0,https://scontent-atl3-1.xx.fbcdn.net/v/t1.0-9/118651673_10161368974259616_4904767023360839844_n.png?_nc_cat=104&_nc_sid=8024bb&_nc_ohc=yr5Pjf4a6BkAX9lKZTc&_nc_ht=scontent-atl3-1.xx&oh=504c9f5f9123d997f78d43da26fd6d9e&oe=5F83C81A,0.0,http://FCHD.org/,2248831581929586,,https://facebook.com/story.php?story_fbid=2248831581929586&id=242234105922687,,0.0,,2020-08-28 18:18:19,,
36,0.0,https://scontent-atl3-1.xx.fbcdn.net/v/t1.0-9/fr/cp0/e15/q65/118621211_2248396961973048_2814793021960920039_o.jpg?_nc_cat=109&_nc_sid=8024bb&_nc_ohc=QidpKH4DbooAX8EAreq&_nc_ht=scontent-atl3-1.xx&tp=14&oh=c2aa0f3029762d427a1cdd64bb3c3ed2&oe=5F821756,0.0,,2248397391973005,Notice of Video Teleconference Public Hearing: 2020 Proposed Tax Rate,https://facebook.com/story.php?story_fbid=2248397391973005&id=242234105922687,,0.0,Notice of Video Teleconference Public Hearing: 2020 Proposed Tax Rate,2020-08-28 09:22:38,,
37,6.0,,3.0,,305697947188778,Franklin County Fiscal Court LIVE 08/27/2020,,,0.0,Franklin County Fiscal Court LIVE 08/27/2020,2020-08-27 17:02:16,https://scontent-atl3-1.xx.fbcdn.net/v/t66.36281-6/10000000_632857447640507_7166250810020804887_n.mp4?_nc_cat=107&_nc_sid=985c63&efg=eyJ2ZW5jb2RlX3RhZyI6Im9lcF9zZCJ9&_nc_ohc=-XPwmJL2FnwAX91VeTj&_nc_ht=scontent-atl3-1.xx&oh=f52ed15f13f1b56085d1ba8f3d5c7b6d&oe=5F8299E8,
38,0.0,,1.0,,2247557425390335,Gov. Andy Beshear - Media Briefing 08.27.2020,https://facebook.com/story.php?story_fbid=2247557425390335&id=242234105922687,"Governor Andy Beshear was live.
August 27 at 7:55 PM ·

Gov. Andy Beshear - Media Briefing 08.27.2020",0.0,"Gov. Andy Beshear - Media Briefing 08.27.2020

Governor Andy Beshear was live.
August 27 at 7:55 PM ·

Gov. Andy Beshear - Media Briefing 08.27.2020",2020-08-27 15:59:21,https://scontent-atl3-1.xx.fbcdn.net/v/t66.36281-6/10000000_1208795676120636_1412856859393405182_n.mp4?_nc_cat=109&_nc_sid=985c63&efg=eyJ2ZW5jb2RlX3RhZyI6Im9lcF9zZCJ9&_nc_ohc=uu7M3O3JIrAAX90wlko&_nc_ht=scontent-atl3-1.xx&oh=e904c4af324dbc23b2116b80451438ea&oe=5F83E529,
39,0.0,,0.0,,1197503537288449,Energy Committee Meeting 8/27/20,,,0.0,Energy Committee Meeting 8/27/20,2020-08-27 14:55:14,https://scontent-atl3-1.xx.fbcdn.net/v/t66.36281-6/10000000_2745012995783589_1037227681440698826_n.mp4?_nc_cat=105&_nc_sid=985c63&efg=eyJ2ZW5jb2RlX3RhZyI6Im9lcF9zZCJ9&_nc_ohc=F0yR8x-DOSYAX9bLyCf&_nc_ht=scontent-atl3-1.xx&oh=58f7859a26a52821d01de850c716e38e&oe=5F849B55,
40,0.0,,0.0,,2246576738821737,Gov. Andy Beshear - Media Briefing 08.26.2020,https://facebook.com/story.php?story_fbid=2246576738821737&id=242234105922687,"Governor Andy Beshear was live.
August 26 at 7:55 PM ·

Gov. Andy Beshear - Media Briefing 08.26.2020",0.0,"Gov. Andy Beshear - Media Briefing 08.26.2020

Governor Andy Beshear was live.
August 26 at 7:55 PM ·

Gov. Andy Beshear - Media Briefing 08.26.2020",2020-08-26 20:10:44,https://video-atl3-1.xx.fbcdn.net/v/t42.26565-2/10000000_594077364801837_8757325246087970083_n.mp4?_nc_cat=108&_nc_sid=985c63&efg=eyJ2ZW5jb2RlX3RhZyI6Im9lcF9zZCJ9&_nc_ohc=Lwo_hYFrBosAX9P1eZ_&_nc_ht=video-atl3-1.xx&oh=1ce02c1874e5a91a93417ddb7b23650d&oe=5F5D5899,
41,0.0,https://scontent-atl3-1.xx.fbcdn.net/v/t1.0-9/118516680_10161362428514616_3296825434712150079_n.png?_nc_cat=109&_nc_sid=8024bb&_nc_ohc=YnwlwhG8aLUAX9LPvzV&_nc_ht=scontent-atl3-1.xx&oh=cf91a8ea3b4cc95fb7df71da13456519&oe=5F822A80,0.0,,2246570832155661,"An update from the Franklin County Health Department, KY:",https://facebook.com/story.php?story_fbid=2246570832155661&id=242234105922687,"Franklin County Health Department, KY
August 26 at 10:00 PM ·

⚠️ Please remember, on average, it takes 5-7 days from exposure for individuals to become symptomatic.
🤧🤒🤕😷If you are experiencing symptoms of fever, cough, shortness of breath, diarrhea, vomiting, body aches, chills, extreme tiredness and/or sudden loss of taste or smell PLEASE stay home and away from others.
📰Important to remember social distancing is still in place and while small groups are allowed - you should maintain six feet apart from each other to prevent the spread of disease. Also, please keep yourself and others safe through prevention measures:
✅ Practice social distancing at ALL times - indoors and outdoors
✅Wash your hands frequently with soap and water
✅Avoid touching your eyes, nose, and mouth
✅Disinfect surfaces often
✅If you are sick, stay home
✅Wear a mask out in public
#COVID19 #TeamKentucky #TogetherKy #Patriot #StayHealthyStayHome #StayHealthyFranklinCounty
#MakeAndyProud #FlattenTheCurve #WeWillGetThroughThisTogether",0.0,"An update from the Franklin County Health Department, KY:

Franklin County Health Department, KY
August 26 at 10:00 PM ·

⚠️ Please remember, on average, it takes 5-7 days from exposure for individuals to become symptomatic.
🤧🤒🤕😷If you are experiencing symptoms of fever, cough, shortness of breath, diarrhea, vomiting, body aches, chills, extreme tiredness and/or sudden loss of taste or smell PLEASE stay home and away from others.
📰Important to remember social distancing is still in place and while small groups are allowed - you should maintain six feet apart from each other to prevent the spread of disease. Also, please keep yourself and others safe through prevention measures:
✅ Practice social distancing at ALL times - indoors and outdoors
✅Wash your hands frequently with soap and water
✅Avoid touching your eyes, nose, and mouth
✅Disinfect surfaces often
✅If you are sick, stay home
✅Wear a mask out in public
#COVID19 #TeamKentucky #TogetherKy #Patriot #StayHealthyStayHome #StayHealthyFranklinCounty
#MakeAndyProud #FlattenTheCurve #WeWillGetThroughThisTogether",2020-08-26 20:03:13,,
42,0.0,,0.0,http://www.franklincounty.ky.gov/,2246359058843505,"Temporary Custodian up to 12 months.
$13.00 per hour
M-F 12:00pm-8:30pm.

Must be able to start immediately.

Employment applications may be obtained from the County’s website at www.franklincounty.ky.gov. Applications may be submitted through the online portal, placed in the mail drop box located outside of the Fiscal Court building, emailed to breadnower@franklincountyky.com or mailed to:

Human Resources Director,
321 West Main Street, Frankfort, KY 40601

If you have any questions you can call HR at 502-875-8751 Ext 1351",https://facebook.com/story.php?story_fbid=2246359058843505&id=242234105922687,"FRANKLINCOUNTY.KY.GOV
Franklin County | KENTUCKY",3.0,"Temporary Custodian up to 12 months.
$13.00 per hour
M-F 12:00pm-8:30pm.

Must be able to start immediately.

Employment applications may be obtained from the County’s website at www.franklincounty.ky.gov. Applications may be submitted through the online portal, placed in the mail drop box located outside of the Fiscal Court building, emailed to breadnower@franklincountyky.com or mailed to:

Human Resources Director,
321 West Main Street, Frankfort, KY 40601

If you have any questions you can call HR at 502-875-8751 Ext 1351

FRANKLINCOUNTY.KY.GOV
Franklin County | KENTUCKY",2020-08-26 14:39:52,,
43,4.0,https://scontent-atl3-1.xx.fbcdn.net/v/t1.0-9/fr/cp0/e15/q65/118472322_2246298355516242_2905480638793698908_o.jpg?_nc_cat=110&_nc_sid=8024bb&_nc_ohc=MBabcZgtHg0AX8scYIs&_nc_ht=scontent-atl3-1.xx&tp=14&oh=ab4db5f6d48674a24c883d43f9c06b86&oe=5F83BC09,45.0,https://franklincounty.ky.gov/job-opening-electrical-inspector/,2246298582182886,Job opening: Electrical Inspector - https://franklincounty.ky.gov/job-opening-electrical-inspector/,https://facebook.com/story.php?story_fbid=2246298582182886&id=242234105922687,,0.0,Job opening: Electrical Inspector - https://franklincounty.ky.gov/job-opening-electrical-inspector/,2020-08-26 13:26:25,,
44,0.0,,0.0,,2245342015611876,Gov. Andy Beshear - Media Briefing 08.25.2020,https://facebook.com/story.php?story_fbid=2245342015611876&id=242234105922687,"Governor Andy Beshear was live.
August 25 at 7:56 PM ·

Gov. Andy Beshear - Media Briefing 08.25.2020",0.0,"Gov. Andy Beshear - Media Briefing 08.25.2020

Governor Andy Beshear was live.
August 25 at 7:56 PM ·

Gov. Andy Beshear - Media Briefing 08.25.2020",2020-08-25 16:20:20,https://scontent-atl3-1.xx.fbcdn.net/v/t66.36281-6/10000000_176352017386940_8868318757264956519_n.mp4?_nc_cat=101&_nc_sid=985c63&efg=eyJ2ZW5jb2RlX3RhZyI6Im9lcF9zZCJ9&_nc_ohc=EcySzJb3i0kAX_oE3HR&_nc_ht=scontent-atl3-1.xx&oh=21bb4e5e8cf9898c7a6d24d170bc2546&oe=5F823E01,
45,0.0,https://scontent-atl3-1.xx.fbcdn.net/v/t1.0-9/fr/cp0/e15/q65/118247447_186472542842847_2334326545272446066_o.jpg?_nc_cat=102&_nc_sid=8024bb&_nc_ohc=FE1xi0uD8FQAX8ZXEED&_nc_ht=scontent-atl3-1.xx&tp=14&oh=3f980a684705b8a9d16a8072dd309f41&oe=5F828681,2.0,,2245321725613905,Labor Day waste collection schedule for Franklin County residents.,https://facebook.com/story.php?story_fbid=2245321725613905&id=242234105922687,"Franklin County KY Solid Waste
August 25 at 7:46 PM ·

Labor Day waste collection schedule for Franklin County residents.",6.0,"Labor Day waste collection schedule for Franklin County residents.

Franklin County KY Solid Waste
August 25 at 7:46 PM ·

Labor Day waste collection schedule for Franklin County residents.",2020-08-25 15:47:17,,
46,0.0,,0.0,https://franklincounty.ky.gov/wp-content/uploads/2020/08/08-27-2020-Agenda.pdf,2245246188954792,"Fiscal Court Agenda: 8/27/20, 5 PM:",https://facebook.com/story.php?story_fbid=2245246188954792&id=242234105922687,"FRANKLINCOUNTY.KY.GOV
franklincounty.ky.gov",0.0,"Fiscal Court Agenda: 8/27/20, 5 PM:

FRANKLINCOUNTY.KY.GOV
franklincounty.ky.gov",2020-08-25 13:53:24,,
47,0.0,https://scontent-atl3-1.xx.fbcdn.net/v/t1.0-9/118224669_10161355902464616_8175251845794517102_n.png?_nc_cat=107&_nc_sid=8024bb&_nc_ohc=XLtN89KBWikAX9JYpqY&_nc_ht=scontent-atl3-1.xx&oh=1a0eacdee83cbd0a1cd0a1c5cff425fa&oe=5F83BC22,1.0,,2244400765706001,"An update from the Franklin County Health Department, KY:",https://facebook.com/story.php?story_fbid=2244400765706001&id=242234105922687,"Franklin County Health Department, KY is sharing a COVID-19 Update.
August 24 at 9:50 PM ·

⚠️ Please remember, on average, it takes 5-7 days from exposure for individuals to become symptomatic.
🤧🤒🤕😷If you are experiencing symptoms of fever, cough, shortness of breath, diarrhea, vomiting, body aches, chills, extreme tiredness and/or sudden loss of taste or smell PLEASE stay home and away from others.
📰Important to remember social distancing is still in place and while small groups are allowed - you should maintain six feet apart from each other to prevent the spread of disease. Also, please keep yourself and others safe through prevention measures:
✅ Practice social distancing at ALL times - indoors and outdoors
✅Wash your hands frequently with soap and water
✅Avoid touching your eyes, nose, and mouth
✅Disinfect surfaces often
✅If you are sick, stay home
✅Wear a mask out in public
#COVID19 #TeamKentucky #TogetherKy #Patriot #StayHealthyStayHome #StayHealthyFranklinCounty
#MakeAndyProud #FlattenTheCurve #WeWillGetThroughThisTogether",0.0,"An update from the Franklin County Health Department, KY:

Franklin County Health Department, KY is sharing a COVID-19 Update.
August 24 at 9:50 PM ·

⚠️ Please remember, on average, it takes 5-7 days from exposure for individuals to become symptomatic.
🤧🤒🤕😷If you are experiencing symptoms of fever, cough, shortness of breath, diarrhea, vomiting, body aches, chills, extreme tiredness and/or sudden loss of taste or smell PLEASE stay home and away from others.
📰Important to remember social distancing is still in place and while small groups are allowed - you should maintain six feet apart from each other to prevent the spread of disease. Also, please keep yourself and others safe through prevention measures:
✅ Practice social distancing at ALL times - indoors and outdoors
✅Wash your hands frequently with soap and water
✅Avoid touching your eyes, nose, and mouth
✅Disinfect surfaces often
✅If you are sick, stay home
✅Wear a mask out in public
#COVID19 #TeamKentucky #TogetherKy #Patriot #StayHealthyStayHome #StayHealthyFranklinCounty
#MakeAndyProud #FlattenTheCurve #WeWillGetThroughThisTogether",2020-08-24 18:30:52,,
48,0.0,,1.0,,2244366042376140,Gov. Andy Beshear - Media Briefing 08.24.2020,https://facebook.com/story.php?story_fbid=2244366042376140&id=242234105922687,"Governor Andy Beshear was live.
August 24 at 7:55 PM ·

Gov. Andy Beshear - Media Briefing 08.24.2020",0.0,"Gov. Andy Beshear - Media Briefing 08.24.2020

Governor Andy Beshear was live.
August 24 at 7:55 PM ·

Gov. Andy Beshear - Media Briefing 08.24.2020",2020-08-24 17:17:11,https://scontent-atl3-1.xx.fbcdn.net/v/t66.36281-6/10000000_183145833207136_3688573085493220215_n.mp4?_nc_cat=106&_nc_sid=985c63&efg=eyJ2ZW5jb2RlX3RhZyI6Im9lcF9zZCJ9&_nc_ohc=kZXy8tQLV_sAX-d03Cj&_nc_oc=AQkP7OYIJFucbOUAXDR4IlKTFtv5lsyZssVT8cbiDgEzZf3_EqZ6tpdeyKVM_umxau8&_nc_ht=scontent-atl3-1.xx&oh=b96d56cc6f8fcdff1ff1bdf97110f14c&oe=5F82FAFA,
49,0.0,,1.0,,2244170085729069,Frankfort/Franklin Co COVID-19 Update 8/24/2020,https://facebook.com/story.php?story_fbid=2244170085729069&id=242234105922687,"Frankfort, Kentucky - City Hall was live.
August 24 at 5:01 PM ·

Frankfort/Franklin Co COVID-19 Update 8/24/2020",0.0,"Frankfort/Franklin Co COVID-19 Update 8/24/2020

Frankfort, Kentucky - City Hall was live.
August 24 at 5:01 PM ·

Frankfort/Franklin Co COVID-19 Update 8/24/2020",2020-08-24 13:02:47,https://scontent-atl3-1.xx.fbcdn.net/v/t66.36281-6/10000000_746689449440943_6923096082585602120_n.mp4?_nc_cat=111&_nc_sid=985c63&efg=eyJ2ZW5jb2RlX3RhZyI6Im9lcF9zZCJ9&_nc_ohc=qjsVB5pBQ8gAX_a8NU8&_nc_ht=scontent-atl3-1.xx&oh=eaabf04171ee707e909f580d510c5043&oe=5F816C98,
50,0.0,,0.0,https://go.usa.gov/xfhr5,2241268216019256,"As of 4 p.m. Aug. 21, Gov. Beshear said there were at least 42,265 coronavirus cases in Kentucky, 785 of which were newly reported Friday. https://go.usa.gov/xfhr5",https://facebook.com/story.php?story_fbid=2241268216019256&id=242234105922687,"Governor Andy Beshear
August 21 at 9:05 PM ·

As of 4 p.m. Aug. 21, Gov. Beshear said there were at least 42,265 coronavirus cases in Kentucky, 785 of which were newly reported Friday. https://go.usa.gov/xfhr5",0.0,"As of 4 p.m. Aug. 21, Gov. Beshear said there were at least 42,265 coronavirus cases in Kentucky, 785 of which were newly reported Friday. https://go.usa.gov/xfhr5

Governor Andy Beshear
August 21 at 9:05 PM ·

As of 4 p.m. Aug. 21, Gov. Beshear said there were at least 42,265 coronavirus cases in Kentucky, 785 of which were newly reported Friday. https://go.usa.gov/xfhr5",2020-08-21 21:38:01,https://video-atl3-1.xx.fbcdn.net/v/t42.9040-2/118318547_650166765624183_7706386438312801905_n.mp4?_nc_cat=110&_nc_sid=985c63&efg=eyJ2ZW5jb2RlX3RhZyI6ImxlZ2FjeV9zZCJ9&_nc_ohc=kfuGT04cAO0AX_K-t4F&_nc_ht=video-atl3-1.xx&oh=f735e9db488b268b2fdbfa1f33c76bae&oe=5F5D577F,
51,0.0,https://scontent-atl3-1.xx.fbcdn.net/v/t1.0-9/118036432_10161346023069616_6552193239564758596_o.png?_nc_cat=107&_nc_sid=8024bb&_nc_ohc=Um8G10tgajgAX__J6pJ&_nc_oc=AQmslpUIN_acXVRKYxOcAN-8Iu_sK2S56xqRx2V8SCYa_dawL4yNhIjpthuk7ybgEI0&_nc_ht=scontent-atl3-1.xx&oh=9cea21e671c28c0aff8b67d95ccf562c&oe=5F830E1F,0.0,,2241265626019515,"And update from the Franklin County Health Department, KY:",https://facebook.com/story.php?story_fbid=2241265626019515&id=242234105922687,"Franklin County Health Department, KY
August 21 at 8:07 PM ·

Please see below for Franklin County's weekly update.",0.0,"And update from the Franklin County Health Department, KY:

Franklin County Health Department, KY
August 21 at 8:07 PM ·

Please see below for Franklin County's weekly update.",2020-08-21 21:35:45,,
52,0.0,,0.0,,2241235289355882,"An update from the Franklin County Health Department, KY:",https://facebook.com/story.php?story_fbid=2241235289355882&id=242234105922687,"Franklin County Health Department, KY
August 21 at 8:07 PM ·

Please see below for Franklin County's weekly update.",0.0,"An update from the Franklin County Health Department, KY:

Franklin County Health Department, KY
August 21 at 8:07 PM ·

Please see below for Franklin County's weekly update.",2020-08-21 20:47:02,,
53,0.0,https://scontent-atl3-1.xx.fbcdn.net/v/t1.0-9/fr/cp0/e15/q65/117841522_2239973742815370_2731873944732101192_o.jpg?_nc_cat=109&_nc_sid=8024bb&_nc_ohc=veD71BmYek0AX-pA74G&_nc_ht=scontent-atl3-1.xx&tp=14&oh=a32954696b6dc7f094c7ab11d32ba2c3&oe=5F810622,0.0,,2239974139481997,"Starting Monday, August 24, 2020, Goose Creek Road will be closed starting just past the 200 block for approximately two weeks weather permitting for bridge replacement.",https://facebook.com/story.php?story_fbid=2239974139481997&id=242234105922687,,0.0,"Starting Monday, August 24, 2020, Goose Creek Road will be closed starting just past the 200 block for approximately two weeks weather permitting for bridge replacement.",2020-08-20 19:38:19,,
54,0.0,https://scontent-atl3-1.xx.fbcdn.net/v/t1.0-9/118242794_10161342730754616_5439666955839644122_n.png?_nc_cat=110&_nc_sid=8024bb&_nc_ohc=saR2c0FT8KIAX_LDuIf&_nc_ht=scontent-atl3-1.xx&oh=481977ef3037ad65910e7a99a748d769&oe=5F815DAC,1.0,,2240044452808299,"An update from the Franklin County Health Department, KY:",https://facebook.com/story.php?story_fbid=2240044452808299&id=242234105922687,"Franklin County Health Department, KY is sharing a COVID-19 Update.
August 20 at 10:00 PM ·

⚠️ Please remember, on average, it takes 5-7 days from exposure for individuals to become symptomatic.
🤧🤒🤕😷If you are experiencing symptoms of fever, cough, shortness of breath, diarrhea, vomiting, body aches, chills, extreme tiredness and/or sudden loss of taste or smell PLEASE stay home and away from others.
📰Important to remember social distancing is still in place and while small groups are allowed - you should maintain six feet apart from each other to prevent the spread of disease. Also, please keep yourself and others safe through prevention measures:
✅ Practice social distancing at ALL times - indoors and outdoors
✅Wash your hands frequently with soap and water
✅Avoid touching your eyes, nose, and mouth
✅Disinfect surfaces often
✅If you are sick, stay home
✅Wear a mask out in public
#COVID19 #TeamKentucky #TogetherKy #Patriot #StayHealthyStayHome #StayHealthyFranklinCounty
#MakeAndyProud #FlattenTheCurve #WeWillGetThroughThisTogether",0.0,"An update from the Franklin County Health Department, KY:

Franklin County Health Department, KY is sharing a COVID-19 Update.
August 20 at 10:00 PM ·

⚠️ Please remember, on average, it takes 5-7 days from exposure for individuals to become symptomatic.
🤧🤒🤕😷If you are experiencing symptoms of fever, cough, shortness of breath, diarrhea, vomiting, body aches, chills, extreme tiredness and/or sudden loss of taste or smell PLEASE stay home and away from others.
📰Important to remember social distancing is still in place and while small groups are allowed - you should maintain six feet apart from each other to prevent the spread of disease. Also, please keep yourself and others safe through prevention measures:
✅ Practice social distancing at ALL times - indoors and outdoors
✅Wash your hands frequently with soap and water
✅Avoid touching your eyes, nose, and mouth
✅Disinfect surfaces often
✅If you are sick, stay home
✅Wear a mask out in public
#COVID19 #TeamKentucky #TogetherKy #Patriot #StayHealthyStayHome #StayHealthyFranklinCounty
#MakeAndyProud #FlattenTheCurve #WeWillGetThroughThisTogether",2020-08-20 18:10:41,,
55,1.0,,0.0,,2239972372815507,Gov. Andy Beshear - Media Briefing 08.20.2020,https://facebook.com/story.php?story_fbid=2239972372815507&id=242234105922687,"Governor Andy Beshear was live.
August 20 at 7:55 PM ·

Gov. Andy Beshear - Media Briefing 08.20.2020",0.0,"Gov. Andy Beshear - Media Briefing 08.20.2020

Governor Andy Beshear was live.
August 20 at 7:55 PM ·

Gov. Andy Beshear - Media Briefing 08.20.2020",2020-08-20 16:14:47,https://scontent-atl3-1.xx.fbcdn.net/v/t66.36281-6/10000000_1014566079007189_3219254219570313403_n.mp4?_nc_cat=108&_nc_sid=985c63&efg=eyJ2ZW5jb2RlX3RhZyI6Im9lcF9zZCJ9&_nc_ohc=5R10RN99oskAX-BU4F7&_nc_ht=scontent-atl3-1.xx&oh=e37a4477a3464b1dc79efcfad2a6552b&oe=5F816AE9,
56,0.0,,0.0,,998555443930429,Energy Committee Meeting: 8/20/2020,,,0.0,Energy Committee Meeting: 8/20/2020,2020-08-20 13:06:05,https://scontent-atl3-1.xx.fbcdn.net/v/t66.36281-6/10000000_2448673668766676_5954166461243858061_n.mp4?_nc_cat=107&_nc_sid=985c63&efg=eyJ2ZW5jb2RlX3RhZyI6Im9lcF9zZCJ9&_nc_ohc=5VVPLdyNdnQAX_ud0KW&_nc_ht=scontent-atl3-1.xx&oh=aed44943d44d56a9853b2ab6cb71e3ee&oe=5F81B83B,
57,0.0,,1.0,,2238870632925681,Gov. Andy Beshear - Media Briefing 08.19.2020,https://facebook.com/story.php?story_fbid=2238870632925681&id=242234105922687,"Governor Andy Beshear was live.
August 19 at 7:55 PM ·

Gov. Andy Beshear - Media Briefing 08.19.2020",0.0,"Gov. Andy Beshear - Media Briefing 08.19.2020

Governor Andy Beshear was live.
August 19 at 7:55 PM ·

Gov. Andy Beshear - Media Briefing 08.19.2020",2020-08-19 15:58:37,https://scontent-atl3-1.xx.fbcdn.net/v/t66.36281-6/10000000_166454795009881_9008255373752820796_n.mp4?_nc_cat=109&_nc_sid=985c63&efg=eyJ2ZW5jb2RlX3RhZyI6Im9lcF9zZCJ9&_nc_ohc=0reuMiLH1bcAX9wTXc0&_nc_ht=scontent-atl3-1.xx&oh=74b63693448217572d2f725c24029b67&oe=5F80DBC5,
58,0.0,https://scontent-atl3-1.xx.fbcdn.net/v/t1.0-9/fr/cp0/e15/q65/117903177_2237733563039388_2718190155912399353_o.jpg?_nc_cat=111&_nc_sid=8024bb&_nc_ohc=80m9ZTiAAjQAX-vgGkp&_nc_ht=scontent-atl3-1.xx&tp=14&oh=d9a50800d4827d975539bb7ad11e4fc6&oe=5F8150BA,4.0,,2237735279705883,Judge Wells swears-in the Franklin County Tax Assessment Appeals Board members this morning in the Fiscal Court Conference room.,https://facebook.com/story.php?story_fbid=2237735279705883&id=242234105922687,,0.0,Judge Wells swears-in the Franklin County Tax Assessment Appeals Board members this morning in the Fiscal Court Conference room.,2020-08-18 19:38:01,,
59,0.0,https://scontent-atl3-1.xx.fbcdn.net/v/t1.0-9/118125710_10161335979299616_6308698321224904302_n.png?_nc_cat=100&_nc_sid=8024bb&_nc_ohc=3LLjjAqWmykAX909gzQ&_nc_ht=scontent-atl3-1.xx&oh=d685a574cef003c993426d9b2ab4f6ac&oe=5F831801,2.0,,2237851323027612,"An update from the Franklin County Health Department, KY:",https://facebook.com/story.php?story_fbid=2237851323027612&id=242234105922687,"Franklin County Health Department, KY is sharing a COVID-19 Update.
August 18 at 10:00 PM ·

⚠️ Please remember, on average, it takes 5-7 days from exposure for individuals to become symptomatic.
🤧🤒🤕😷If you are experiencing symptoms of fever, cough, shortness of breath, diarrhea, vomiting, body aches, chills, extreme tiredness and/or sudden loss of taste or smell PLEASE stay home and away from others.
📰Important to remember social distancing is still in place and while small groups are allowed - you should maintain six feet apart from each other to prevent the spread of disease. Also, please keep yourself and others safe through prevention measures:
✅ Practice social distancing at ALL times - indoors and outdoors
✅Wash your hands frequently with soap and water
✅Avoid touching your eyes, nose, and mouth
✅Disinfect surfaces often
✅If you are sick, stay home
✅Wear a mask out in public
#COVID19 #TeamKentucky #TogetherKy #Patriot #StayHealthyStayHome #StayHealthyFranklinCounty
#MakeAndyProud #FlattenTheCurve #WeWillGetThroughThisTogether",2.0,"An update from the Franklin County Health Department, KY:

Franklin County Health Department, KY is sharing a COVID-19 Update.
August 18 at 10:00 PM ·

⚠️ Please remember, on average, it takes 5-7 days from exposure for individuals to become symptomatic.
🤧🤒🤕😷If you are experiencing symptoms of fever, cough, shortness of breath, diarrhea, vomiting, body aches, chills, extreme tiredness and/or sudden loss of taste or smell PLEASE stay home and away from others.
📰Important to remember social distancing is still in place and while small groups are allowed - you should maintain six feet apart from each other to prevent the spread of disease. Also, please keep yourself and others safe through prevention measures:
✅ Practice social distancing at ALL times - indoors and outdoors
✅Wash your hands frequently with soap and water
✅Avoid touching your eyes, nose, and mouth
✅Disinfect surfaces often
✅If you are sick, stay home
✅Wear a mask out in public
#COVID19 #TeamKentucky #TogetherKy #Patriot #StayHealthyStayHome #StayHealthyFranklinCounty
#MakeAndyProud #FlattenTheCurve #WeWillGetThroughThisTogether",2020-08-18 18:30:19,,
60,0.0,https://scontent-atl3-1.xx.fbcdn.net/v/t1.0-9/fr/cp0/e15/q65/117907628_2237731743039570_8293797233801494968_o.jpg?_nc_cat=103&_nc_sid=8024bb&_nc_ohc=YqnVUwcJ4K4AX-vd6T1&_nc_ht=scontent-atl3-1.xx&tp=14&oh=89ec621e6f05f5b3e89535905dd397a5&oe=5F824E76,0.0,,2237731783039566,"Severe Thunderstorm Warning from 8/18/2020 3:57 PM to 4:45 PM EDT for Franklin County, KY.",https://facebook.com/story.php?story_fbid=2237731783039566&id=242234105922687,,0.0,"Severe Thunderstorm Warning from 8/18/2020 3:57 PM to 4:45 PM EDT for Franklin County, KY.",2020-08-18 16:12:29,,
61,0.0,,2.0,,2237730019706409,Gov. Andy Beshear - Media Briefing 08.18.2020,https://facebook.com/story.php?story_fbid=2237730019706409&id=242234105922687,"Governor Andy Beshear was live.
August 18 at 7:58 PM ·

Gov. Andy Beshear - Media Briefing 08.18.2020",0.0,"Gov. Andy Beshear - Media Briefing 08.18.2020

Governor Andy Beshear was live.
August 18 at 7:58 PM ·

Gov. Andy Beshear - Media Briefing 08.18.2020",2020-08-18 16:09:58,https://scontent-atl3-1.xx.fbcdn.net/v/t66.36281-6/10000000_429442044658776_4492173050399496525_n.mp4?_nc_cat=109&_nc_sid=985c63&efg=eyJ2ZW5jb2RlX3RhZyI6Im9lcF9zZCJ9&_nc_ohc=qBmtAwUU8DUAX-Nu15Q&_nc_ht=scontent-atl3-1.xx&oh=8d43113a8982464ddd594ff5862d4d93&oe=5F8122FC,
62,0.0,,1.0,,1427415387457628,"Finance Committee Meeting: August 18, 2020.",,,0.0,"Finance Committee Meeting: August 18, 2020.",2020-08-18 14:01:52,https://scontent-atl3-1.xx.fbcdn.net/v/t66.36281-6/10000000_646420519331390_1082477488298139398_n.mp4?_nc_cat=105&_nc_sid=985c63&efg=eyJ2ZW5jb2RlX3RhZyI6Im9lcF9zZCJ9&_nc_ohc=vg9r7LkIqLMAX-ggR0C&_nc_ht=scontent-atl3-1.xx&oh=d320dfd4939c8ddda095c066d5851d6b&oe=5F823562,
63,1.0,,0.0,,300992524320622,"Benefits Committee Meeting: August 18th, 2020",,,0.0,"Benefits Committee Meeting: August 18th, 2020",2020-08-18 10:07:21,https://video-atl3-1.xx.fbcdn.net/v/t42.26565-2/10000000_597190681159805_6269867310135145938_n.mp4?_nc_cat=109&_nc_sid=985c63&efg=eyJ2ZW5jb2RlX3RhZyI6Im9lcF9zZCJ9&_nc_ohc=5RenC5VdSFUAX-j8Wzy&_nc_ht=video-atl3-1.xx&oh=e85c97368cba2cf633b7ac6acc393b57&oe=5F5D59FC,
64,0.0,https://scontent-atl3-1.xx.fbcdn.net/v/t1.0-9/fr/cp0/e15/q65/117335212_2236614499817961_4824940294414449771_o.jpg?_nc_cat=109&_nc_sid=8024bb&_nc_ohc=in4cNZPTeWoAX8kCqVk&_nc_ht=scontent-atl3-1.xx&tp=14&oh=b1d51e5eb32430567c699446ef110431&oe=5F81ABFE,1.0,http://www.fchd.org/,2236615759817835,"UPCOMING Franklin County COVID-19 Testing Dates

The Franklin County Health Department, KY will be offering free Covid-19 testing at the following times and locations. You must sign up for the tests prior to arriving at www.fchd.org.

Thorn Hill Learning Center
Tuesday, August 25th, 2020
9 AM – Noon
Registration will open on Friday, August 21st, 2020 at www.fchd.org

Public Health Center
Every Tuesday in September (1st, 8th, 15th, 22nd & 29th)
9 AM – NOON
Pre-registration is required via www.fchd.org

If you need testing sooner please contact Frankfort Urgent Care, Frankfort First Care Clinic or your primary care physician.",https://facebook.com/story.php?story_fbid=2236615759817835&id=242234105922687,,0.0,"UPCOMING Franklin County COVID-19 Testing Dates

The Franklin County Health Department, KY will be offering free Covid-19 testing at the following times and locations. You must sign up for the tests prior to arriving at www.fchd.org.

Thorn Hill Learning Center
Tuesday, August 25th, 2020
9 AM – Noon
Registration will open on Friday, August 21st, 2020 at www.fchd.org

Public Health Center
Every Tuesday in September (1st, 8th, 15th, 22nd & 29th)
9 AM – NOON
Pre-registration is required via www.fchd.org

If you need testing sooner please contact Frankfort Urgent Care, Frankfort First Care Clinic or your primary care physician.",2020-08-17 19:30:41,,
65,0.0,https://scontent-atl3-1.xx.fbcdn.net/v/t1.0-9/118002344_10161332848329616_198525555993033979_n.png?_nc_cat=105&_nc_sid=8024bb&_nc_ohc=50QD7NHy8OEAX_Pq3Qo&_nc_ht=scontent-atl3-1.xx&oh=c3c1284f3f382d33d0660a97fb6364a7&oe=5F845C99,0.0,,2236699663142778,"An update from the Franklin County Health Department, KY:",https://facebook.com/story.php?story_fbid=2236699663142778&id=242234105922687,"Franklin County Health Department, KY
August 17 at 10:04 PM ·

⚠️ Please remember, on average, it takes 5-7 days from exposure for individuals to become symptomatic.
🤧🤒🤕😷If you are experiencing symptoms of fever, cough, shortness of breath, diarrhea, vomiting, body aches, chills, extreme tiredness and/or sudden loss of taste or smell PLEASE stay home and away from others.
📰Important to remember social distancing is still in place and while small groups are allowed - you should maintain six feet apart from each other to prevent the spread of disease. Also, please keep yourself and others safe through prevention measures:
✅ Practice social distancing at ALL times - indoors and outdoors
✅Wash your hands frequently with soap and water
✅Avoid touching your eyes, nose, and mouth
✅Disinfect surfaces often
✅If you are sick, stay home
✅Wear a mask out in public
#COVID19 #TeamKentucky #TogetherKy #Patriot #StayHealthyStayHome #StayHealthyFranklinCounty
#MakeAndyProud #FlattenTheCurve #WeWillGetThroughThisTogether",0.0,"An update from the Franklin County Health Department, KY:

Franklin County Health Department, KY
August 17 at 10:04 PM ·

⚠️ Please remember, on average, it takes 5-7 days from exposure for individuals to become symptomatic.
🤧🤒🤕😷If you are experiencing symptoms of fever, cough, shortness of breath, diarrhea, vomiting, body aches, chills, extreme tiredness and/or sudden loss of taste or smell PLEASE stay home and away from others.
📰Important to remember social distancing is still in place and while small groups are allowed - you should maintain six feet apart from each other to prevent the spread of disease. Also, please keep yourself and others safe through prevention measures:
✅ Practice social distancing at ALL times - indoors and outdoors
✅Wash your hands frequently with soap and water
✅Avoid touching your eyes, nose, and mouth
✅Disinfect surfaces often
✅If you are sick, stay home
✅Wear a mask out in public
#COVID19 #TeamKentucky #TogetherKy #Patriot #StayHealthyStayHome #StayHealthyFranklinCounty
#MakeAndyProud #FlattenTheCurve #WeWillGetThroughThisTogether",2020-08-17 18:24:07,,
66,0.0,,2.0,,2236611903151554,"Governor Andy Beshear Media Briefing, 8/17/20",https://facebook.com/story.php?story_fbid=2236611903151554&id=242234105922687,"Governor Andy Beshear was live.
August 17 at 7:57 PM ·

Gov. Andy Beshear - Media Briefing 08.17.2020",0.0,"Governor Andy Beshear Media Briefing, 8/17/20

Governor Andy Beshear was live.
August 17 at 7:57 PM ·

Gov. Andy Beshear - Media Briefing 08.17.2020",2020-08-17 16:05:12,https://video-atl3-1.xx.fbcdn.net/v/t42.26565-2/10000000_336560217728755_3139027788731657332_n.mp4?_nc_cat=102&_nc_sid=985c63&efg=eyJ2ZW5jb2RlX3RhZyI6Im9lcF9zZCJ9&_nc_ohc=nWth4GD9KQAAX-xLjYq&_nc_ht=video-atl3-1.xx&oh=ccdc86ec014e0199a1a3dabd309908df&oe=5F5D5634,
67,0.0,,0.0,,2236481166497961,Frankfort/Franklin Co COVID-19 Update 8/17/20,https://facebook.com/story.php?story_fbid=2236481166497961&id=242234105922687,"Frankfort, Kentucky - City Hall was live.
August 17 at 5:00 PM ·

Frankfort/Franklin Co COVID-19 Update 8/17/20",0.0,"Frankfort/Franklin Co COVID-19 Update 8/17/20

Frankfort, Kentucky - City Hall was live.
August 17 at 5:00 PM ·

Frankfort/Franklin Co COVID-19 Update 8/17/20",2020-08-17 13:13:54,https://video-atl3-1.xx.fbcdn.net/v/t42.26565-2/10000000_152230459832043_7148691719248435685_n.mp4?_nc_cat=107&_nc_sid=985c63&efg=eyJ2ZW5jb2RlX3RhZyI6Im9lcF9zZCJ9&_nc_ohc=acWhlWM-9_kAX9EoYP-&_nc_ht=video-atl3-1.xx&oh=d2e5281946a1e29b9c0cc743e985146e&oe=5F5D5807,
68,0.0,https://scontent-atl3-1.xx.fbcdn.net/v/t1.0-9/117944974_10161322852324616_8735242036512207466_o.png?_nc_cat=103&_nc_sid=8024bb&_nc_ohc=T5vVsDeLg34AX_MDU3f&_nc_ht=scontent-atl3-1.xx&oh=8d4d85a3e28f8938707007849949c7c5&oe=5F836130,0.0,,2233480376798040,"An update from the Franklin County Health Department, KY:",https://facebook.com/story.php?story_fbid=2233480376798040&id=242234105922687,"Franklin County Health Department, KY
August 14 at 9:45 PM ·

⚠️ Please remember, on average, it takes 5-7 days from exposure for individuals to become symptomatic.
🤧🤒🤕😷If you are experiencing symptoms of fever, cough, shortness of breath, diarrhea, vomiting, body aches, chills, extreme tiredness and/or sudden loss of taste or smell PLEASE stay home and away from others.
📰Important to remember social distancing is still in place and while small groups are allowed - you should maintain six feet apart from each other to prevent the spread of disease. Also, please keep yourself and others safe through prevention measures:
✅ Practice social distancing at ALL times - indoors and outdoors
✅Wash your hands frequently with soap and water
✅Avoid touching your eyes, nose, and mouth
✅Disinfect surfaces often
✅If you are sick, stay home
✅Wear a mask out in public
#COVID19 #TeamKentucky #TogetherKy #Patriot #StayHealthyStayHome #StayHealthyFranklinCounty
#MakeAndyProud #FlattenTheCurve #WeWillGetThroughThisTogether",0.0,"An update from the Franklin County Health Department, KY:

Franklin County Health Department, KY
August 14 at 9:45 PM ·

⚠️ Please remember, on average, it takes 5-7 days from exposure for individuals to become symptomatic.
🤧🤒🤕😷If you are experiencing symptoms of fever, cough, shortness of breath, diarrhea, vomiting, body aches, chills, extreme tiredness and/or sudden loss of taste or smell PLEASE stay home and away from others.
📰Important to remember social distancing is still in place and while small groups are allowed - you should maintain six feet apart from each other to prevent the spread of disease. Also, please keep yourself and others safe through prevention measures:
✅ Practice social distancing at ALL times - indoors and outdoors
✅Wash your hands frequently with soap and water
✅Avoid touching your eyes, nose, and mouth
✅Disinfect surfaces often
✅If you are sick, stay home
✅Wear a mask out in public
#COVID19 #TeamKentucky #TogetherKy #Patriot #StayHealthyStayHome #StayHealthyFranklinCounty
#MakeAndyProud #FlattenTheCurve #WeWillGetThroughThisTogether",2020-08-14 18:33:11,,
69,0.0,,2.0,,2233364803476264,Gov. Andy Beshear - Media Briefing 08.14.2020,https://facebook.com/story.php?story_fbid=2233364803476264&id=242234105922687,"Governor Andy Beshear was live.
August 14 at 7:55 PM ·

Gov. Andy Beshear - Media Briefing 08.14.2020",0.0,"Gov. Andy Beshear - Media Briefing 08.14.2020

Governor Andy Beshear was live.
August 14 at 7:55 PM ·

Gov. Andy Beshear - Media Briefing 08.14.2020",2020-08-14 15:56:40,https://video-atl3-1.xx.fbcdn.net/v/t42.26565-2/10000000_305382907573518_641589048167323694_n.mp4?_nc_cat=103&_nc_sid=985c63&efg=eyJ2ZW5jb2RlX3RhZyI6Im9lcF9zZCJ9&_nc_ohc=8mptLAzk8SYAX-f-R9j&_nc_ht=video-atl3-1.xx&oh=0ee18807e49f272728954844d6db09d1&oe=5F5D544F,
70,3.0,,16.0,,2233146710164740,"Frankfort/Franklin County Planning Commission goes to the dogs!

Franklin County - In a surprising motion during last night’s planning commission meeting, Shih Tzu Peanut Hewitt suggested that the entire County be rezoned GDP (General Dog Park). The motion was quickly seconded by Westie Henry Cross. After an hour of contentious debate, the motion narrowly failed in a 4-3 vote. However, board Chair Sherron Jackson directed city and county planning staff to further investigate the GDP designation for possible inclusion in the upcoming comprehensive plan revision. A spokesperson for the Franklin County Humane Society indicated that they vigorously supported the idea.

Happy Friday everyone! We hope that you have a safe and fun weekend. Please remember to wear your masks, wash your hands and socially distance while out in public! #TeamKentucky #togetherky #StayHealthyFranklinCounty",https://facebook.com/story.php?story_fbid=2233146710164740&id=242234105922687,,0.0,"Frankfort/Franklin County Planning Commission goes to the dogs!

Franklin County - In a surprising motion during last night’s planning commission meeting, Shih Tzu Peanut Hewitt suggested that the entire County be rezoned GDP (General Dog Park). The motion was quickly seconded by Westie Henry Cross. After an hour of contentious debate, the motion narrowly failed in a 4-3 vote. However, board Chair Sherron Jackson directed city and county planning staff to further investigate the GDP designation for possible inclusion in the upcoming comprehensive plan revision. A spokesperson for the Franklin County Humane Society indicated that they vigorously supported the idea.

Happy Friday everyone! We hope that you have a safe and fun weekend. Please remember to wear your masks, wash your hands and socially distance while out in public! #TeamKentucky #togetherky #StayHealthyFranklinCounty",2020-08-14 11:20:13,,
71,2.0,,5.0,https://franklincounty.ky.gov/job-posting-temporary-custodian-up-to-12-months/,2233034406842637,Job Posting: Temporary Custodian up to 12 months,https://facebook.com/story.php?story_fbid=2233034406842637&id=242234105922687,Job Posting: Temporary Custodian up to 12 months | Franklin County,41.0,"Job Posting: Temporary Custodian up to 12 months

Job Posting: Temporary Custodian up to 12 months | Franklin County",2020-08-14 09:32:01,,
72,0.0,https://scontent-atl3-1.xx.fbcdn.net/v/t1.0-9/117830415_10161319508184616_8414505822980879126_n.png?_nc_cat=100&_nc_sid=8024bb&_nc_ohc=nW93farOBtcAX-HEE0L&_nc_ht=scontent-atl3-1.xx&oh=7e5a07f221092401986b4af8adf744b9&oe=5F82BEA2,0.0,,2232392163573528,"An update from the Franklin County Health Department, KY:",https://facebook.com/story.php?story_fbid=2232392163573528&id=242234105922687,"Franklin County Health Department, KY
August 13 at 10:12 PM ·

⚠️ Please remember, on average, it takes 5-7 days from exposure for individuals to become symptomatic.
🤧🤒🤕😷If you are experiencing symptoms of fever, cough, shortness of breath, diarrhea, vomiting, body aches, chills, extreme tiredness and/or sudden loss of taste or smell PLEASE stay home and away from others.
📰Important to remember social distancing is still in place and while small groups are allowed - you should maintain six feet apart from each other to prevent the spread of disease. Also, please keep yourself and others safe through prevention measures:
✅ Practice social distancing at ALL times - indoors and outdoors
✅Wash your hands frequently with soap and water
✅Avoid touching your eyes, nose, and mouth
✅Disinfect surfaces often
✅If you are sick, stay home
✅Wear a mask out in public
#COVID19 #TeamKentucky #TogetherKy #Patriot #StayHealthyStayHome #StayHealthyFranklinCounty
#MakeAndyProud #FlattenTheCurve #WeWillGetThroughThisTogether",0.0,"An update from the Franklin County Health Department, KY:

Franklin County Health Department, KY
August 13 at 10:12 PM ·

⚠️ Please remember, on average, it takes 5-7 days from exposure for individuals to become symptomatic.
🤧🤒🤕😷If you are experiencing symptoms of fever, cough, shortness of breath, diarrhea, vomiting, body aches, chills, extreme tiredness and/or sudden loss of taste or smell PLEASE stay home and away from others.
📰Important to remember social distancing is still in place and while small groups are allowed - you should maintain six feet apart from each other to prevent the spread of disease. Also, please keep yourself and others safe through prevention measures:
✅ Practice social distancing at ALL times - indoors and outdoors
✅Wash your hands frequently with soap and water
✅Avoid touching your eyes, nose, and mouth
✅Disinfect surfaces often
✅If you are sick, stay home
✅Wear a mask out in public
#COVID19 #TeamKentucky #TogetherKy #Patriot #StayHealthyStayHome #StayHealthyFranklinCounty
#MakeAndyProud #FlattenTheCurve #WeWillGetThroughThisTogether",2020-08-13 18:27:25,,
73,0.0,,4.0,,428704981361881,"Frankfort/Franklin County Planning Commission August 13, 2020",,,0.0,"Frankfort/Franklin County Planning Commission August 13, 2020",2020-08-13 17:30:18,https://scontent-atl3-1.xx.fbcdn.net/v/t66.36281-6/10000000_375144760545626_6900152272888486834_n.mp4?_nc_cat=104&_nc_sid=985c63&efg=eyJ2ZW5jb2RlX3RhZyI6Im9lcF9zZCJ9&_nc_ohc=pZHXxnwbENUAX8GsiT2&_nc_ht=scontent-atl3-1.xx&oh=f6eb1c61c165bd0776e0fa6f18dc5094&oe=5F8467C8,
74,0.0,,3.0,,2232281403584604,Gov. Andy Beshear - Media Briefing 08.13.2020,https://facebook.com/story.php?story_fbid=2232281403584604&id=242234105922687,"Governor Andy Beshear was live.
August 13 at 7:56 PM ·

Gov. Andy Beshear - Media Briefing 08.13.2020",0.0,"Gov. Andy Beshear - Media Briefing 08.13.2020

Governor Andy Beshear was live.
August 13 at 7:56 PM ·

Gov. Andy Beshear - Media Briefing 08.13.2020",2020-08-13 15:58:21,https://video-atl3-1.xx.fbcdn.net/v/t42.26565-2/10000000_296028324820826_7191606255872637927_n.mp4?_nc_cat=101&_nc_sid=985c63&efg=eyJ2ZW5jb2RlX3RhZyI6Im9lcF9zZCJ9&_nc_ohc=KTTldKVURiwAX_6-QBs&_nc_ht=video-atl3-1.xx&oh=c633301e0e914e7fe09b01621fb6fb03&oe=5F5D5995,
75,0.0,,0.0,,2231277020351709,Gov. Andy Beshear - Media Briefing 08.12.2020,https://facebook.com/story.php?story_fbid=2231277020351709&id=242234105922687,"Governor Andy Beshear was live.
August 12 at 7:57 PM ·

Gov. Andy Beshear - Media Briefing 08.12.2020",0.0,"Gov. Andy Beshear - Media Briefing 08.12.2020

Governor Andy Beshear was live.
August 12 at 7:57 PM ·

Gov. Andy Beshear - Media Briefing 08.12.2020",2020-08-12 16:54:47,https://video-atl3-1.xx.fbcdn.net/v/t42.26565-2/10000000_849997075406562_6328016479251833712_n.mp4?_nc_cat=110&_nc_sid=985c63&efg=eyJ2ZW5jb2RlX3RhZyI6Im9lcF9zZCJ9&_nc_ohc=wRai5o-SDboAX8SW9TE&_nc_ht=video-atl3-1.xx&oh=a8d9fca5df646b0a9724d04489cd6241&oe=5F5D566E,
76,1.0,https://scontent-atl3-1.xx.fbcdn.net/v/t1.0-9/117816598_10161312452664616_1764351140299022663_n.png?_nc_cat=100&_nc_sid=8024bb&_nc_ohc=BiIhhDYQf_0AX-jgaUW&_nc_ht=scontent-atl3-1.xx&oh=43bf97c9913bfc374540171a6b34ee56&oe=5F8356E7,0.0,,2230340840445327,"An update from the Franklin County Health Department, KY:",https://facebook.com/story.php?story_fbid=2230340840445327&id=242234105922687,"Franklin County Health Department, KY
August 11 at 10:00 PM ·

⚠️ Please remember, on average, it takes 5-7 days from exposure for individuals to become symptomatic.
🤧🤒🤕😷If you are experiencing symptoms of fever, cough, shortness of breath, diarrhea, vomiting, body aches, chills, extreme tiredness and/or sudden loss of taste or smell PLEASE stay home and away from others.
📰Important to remember social distancing is still in place and while small groups are allowed - you should maintain six feet apart from each other to prevent the spread of disease. Also, please keep yourself and others safe through prevention measures:
✅ Practice social distancing at ALL times - indoors and outdoors
✅Wash your hands frequently with soap and water
✅Avoid touching your eyes, nose, and mouth
✅Disinfect surfaces often
✅If you are sick, stay home
✅Wear a mask out in public
#COVID19 #TeamKentucky #TogetherKy #Patriot #StayHealthyStayHome #StayHealthyFranklinCounty
#MakeAndyProud #FlattenTheCurve #WeWillGetThroughThisTogether",0.0,"An update from the Franklin County Health Department, KY:

Franklin County Health Department, KY
August 11 at 10:00 PM ·

⚠️ Please remember, on average, it takes 5-7 days from exposure for individuals to become symptomatic.
🤧🤒🤕😷If you are experiencing symptoms of fever, cough, shortness of breath, diarrhea, vomiting, body aches, chills, extreme tiredness and/or sudden loss of taste or smell PLEASE stay home and away from others.
📰Important to remember social distancing is still in place and while small groups are allowed - you should maintain six feet apart from each other to prevent the spread of disease. Also, please keep yourself and others safe through prevention measures:
✅ Practice social distancing at ALL times - indoors and outdoors
✅Wash your hands frequently with soap and water
✅Avoid touching your eyes, nose, and mouth
✅Disinfect surfaces often
✅If you are sick, stay home
✅Wear a mask out in public
#COVID19 #TeamKentucky #TogetherKy #Patriot #StayHealthyStayHome #StayHealthyFranklinCounty
#MakeAndyProud #FlattenTheCurve #WeWillGetThroughThisTogether",2020-08-11 19:25:25,,
77,0.0,,0.0,https://go.usa.gov/xfATt,2230256123787132,"As of 4 p.m. Aug. 11, Gov. Beshear said there were at least 35,793 #COVID19 cases in Kentucky, 562 of which were newly reported Tuesday. https://go.usa.gov/xfATt",https://facebook.com/story.php?story_fbid=2230256123787132&id=242234105922687,"Governor Andy Beshear
August 11 at 8:46 PM ·

As of 4 p.m. Aug. 11, Gov. Beshear said there were at least 35,793 #COVID19 cases in Kentucky, 562 of which were newly reported Tuesday. https://go.usa.gov/xfATt",0.0,"As of 4 p.m. Aug. 11, Gov. Beshear said there were at least 35,793 #COVID19 cases in Kentucky, 562 of which were newly reported Tuesday. https://go.usa.gov/xfATt

Governor Andy Beshear
August 11 at 8:46 PM ·

As of 4 p.m. Aug. 11, Gov. Beshear said there were at least 35,793 #COVID19 cases in Kentucky, 562 of which were newly reported Tuesday. https://go.usa.gov/xfATt",2020-08-11 17:17:08,https://video-atl3-1.xx.fbcdn.net/v/t42.9040-2/117733046_1132995770434115_4134198456734684288_n.mp4?_nc_cat=101&_nc_sid=985c63&efg=eyJ2ZW5jb2RlX3RhZyI6ImxlZ2FjeV9zZCJ9&_nc_ohc=KFzQWJowUmkAX8MHyik&_nc_ht=video-atl3-1.xx&oh=6745d54bac4db1f7109ab0a102ff7d1d&oe=5F5D5441,
78,0.0,https://scontent-atl3-1.xx.fbcdn.net/v/t1.0-9/117583974_10161309199699616_5755403736575633343_n.png?_nc_cat=106&_nc_sid=8024bb&_nc_ohc=w-xumIxlengAX9iWVOx&_nc_ht=scontent-atl3-1.xx&oh=52c52c6aa053ac4fdcbae104f19899fd&oe=5F81D8A5,0.0,,2229303670549044,,https://facebook.com/story.php?story_fbid=2229303670549044&id=242234105922687,,0.0,,2020-08-10 19:38:52,,
79,0.0,,2.0,,2229148213897923,Gov. Andy Beshear - Media Briefing 08.10.2020,https://facebook.com/story.php?story_fbid=2229148213897923&id=242234105922687,"Governor Andy Beshear was live.
August 10 at 7:55 PM ·

Gov. Andy Beshear - Media Briefing 08.10.2020",0.0,"Gov. Andy Beshear - Media Briefing 08.10.2020

Governor Andy Beshear was live.
August 10 at 7:55 PM ·

Gov. Andy Beshear - Media Briefing 08.10.2020",2020-08-10 16:01:03,https://scontent-atl3-1.xx.fbcdn.net/v/t66.36281-6/10000000_335738540811462_8886445269455282079_n.mp4?_nc_cat=106&_nc_sid=985c63&efg=eyJ2ZW5jb2RlX3RhZyI6Im9lcF9zZCJ9&_nc_ohc=H3zyxu4FtDIAX8xhG0c&_nc_ht=scontent-atl3-1.xx&oh=c5f4253c4222ccae660f76520ad206d9&oe=5F80F1AB,
80,0.0,,1.0,,2228999540579457,Frankfort/Franklin Co COVID-19 Update 8/10/2020,https://facebook.com/story.php?story_fbid=2228999540579457&id=242234105922687,"Frankfort, Kentucky - City Hall was live.
August 10 at 5:00 PM ·

Frankfort/Franklin Co COVID-19 Update 8/10/2020",0.0,"Frankfort/Franklin Co COVID-19 Update 8/10/2020

Frankfort, Kentucky - City Hall was live.
August 10 at 5:00 PM ·

Frankfort/Franklin Co COVID-19 Update 8/10/2020",2020-08-10 13:01:51,https://video-atl3-1.xx.fbcdn.net/v/t42.26565-2/10000000_146223517114476_4946600289254995888_n.mp4?_nc_cat=108&_nc_sid=985c63&efg=eyJ2ZW5jb2RlX3RhZyI6Im9lcF9zZCJ9&_nc_ohc=JV1aIaNp484AX9PND_z&_nc_ht=video-atl3-1.xx&oh=e994763b45957de082af4db3446bc2a8&oe=5F5D4EE7,
81,0.0,https://scontent-atl3-1.xx.fbcdn.net/v/t1.0-9/117341249_3183757335047591_4324938121246533029_n.png?_nc_cat=108&_nc_sid=8024bb&_nc_ohc=33fDG-pQw60AX82ekKU&_nc_ht=scontent-atl3-1.xx&oh=de362c995dc07a548b3bfe911f04ed76&oe=5F81780A,0.0,,2228900873922657,Join us today at 1:00 for the weekly live COVID-19 update,https://facebook.com/story.php?story_fbid=2228900873922657&id=242234105922687,"Frankfort, Kentucky - City Hall
August 10 at 3:09 PM ·

Join us today at 1:00 for the weekly live COVID-19 update",0.0,"Join us today at 1:00 for the weekly live COVID-19 update

Frankfort, Kentucky - City Hall
August 10 at 3:09 PM ·

Join us today at 1:00 for the weekly live COVID-19 update",2020-08-10 11:09:43,,
82,0.0,https://scontent-atl3-1.xx.fbcdn.net/v/t1.0-9/117327111_10161298191434616_308727836355800896_n.png?_nc_cat=106&_nc_sid=8024bb&_nc_ohc=fzBqj8jQnWYAX-kHK78&_nc_ht=scontent-atl3-1.xx&oh=00253dad8594efd13c125cdadfa2b899&oe=5F832318,0.0,,2225938787552199,"An update from the Franklin County Health Department, KY:",https://facebook.com/story.php?story_fbid=2225938787552199&id=242234105922687,"Franklin County Health Department, KY
August 7 at 10:23 PM ·

We need everyone in this fight, to save lives, to save our economy, and to help get our kids back in school. I know we have what it takes and that we’ll do what it takes because we care about one another. #MaskUpKy #TogetherKy

📰PLEASE continue to keep yourself & others safe through prevention measures:
✅ Practice social distancing at ALL times - indoors & outdoors
✅Wash your hands frequently with soap and water 👏
✅Avoid touching your eyes, nose, and mouth
✅Disinfect surfaces often
✅If you are sick, stay home
✅Wear a mask out in public",0.0,"An update from the Franklin County Health Department, KY:

Franklin County Health Department, KY
August 7 at 10:23 PM ·

We need everyone in this fight, to save lives, to save our economy, and to help get our kids back in school. I know we have what it takes and that we’ll do what it takes because we care about one another. #MaskUpKy #TogetherKy

📰PLEASE continue to keep yourself & others safe through prevention measures:
✅ Practice social distancing at ALL times - indoors & outdoors
✅Wash your hands frequently with soap and water 👏
✅Avoid touching your eyes, nose, and mouth
✅Disinfect surfaces often
✅If you are sick, stay home
✅Wear a mask out in public",2020-08-07 18:26:03,,
83,4.0,,2.0,,287709675654687,Franklin County Fiscal Court LIVE 08/7/2020,,,0.0,Franklin County Fiscal Court LIVE 08/7/2020,2020-08-07 09:04:25,https://video-atl3-1.xx.fbcdn.net/v/t42.26565-2/10000000_1560665647437919_5718453393449085823_n.mp4?_nc_cat=100&_nc_sid=985c63&efg=eyJ2ZW5jb2RlX3RhZyI6Im9lcF9zZCJ9&_nc_ohc=h5xYcANFO40AX_CWk6d&_nc_ht=video-atl3-1.xx&oh=95a8f661dbc111a914b5e9e459051cf6&oe=5F5D535F,
84,0.0,https://scontent-atl3-1.xx.fbcdn.net/v/t1.0-9/117304470_10161294260719616_6290796583978762463_n.png?_nc_cat=108&_nc_sid=8024bb&_nc_ohc=MWfdmxeQhkwAX_IZjaz&_nc_ht=scontent-atl3-1.xx&oh=95c4f762f540bd14868c8e4bf9bfaae1&oe=5F81C4F0,0.0,,2224875760991835,"An update from the Franklin County Health Department, KY:",https://facebook.com/story.php?story_fbid=2224875760991835&id=242234105922687,"Franklin County Health Department, KY
August 6 at 9:53 PM ·

We need everyone in this fight, to save lives, to save our economy, and to help get our kids back in school. I know we have what it takes and that we’ll do what it takes because we care about one another. #MaskUpKy #TogetherKy

📰PLEASE continue to keep yourself & others safe through prevention measures:
✅ Practice social distancing at ALL times - indoors & outdoors
✅Wash your hands frequently with soap and water 👏
✅Avoid touching your eyes, nose, and mouth
✅Disinfect surfaces often
✅If you are sick, stay home
✅Wear a mask out in public",0.0,"An update from the Franklin County Health Department, KY:

Franklin County Health Department, KY
August 6 at 9:53 PM ·

We need everyone in this fight, to save lives, to save our economy, and to help get our kids back in school. I know we have what it takes and that we’ll do what it takes because we care about one another. #MaskUpKy #TogetherKy

📰PLEASE continue to keep yourself & others safe through prevention measures:
✅ Practice social distancing at ALL times - indoors & outdoors
✅Wash your hands frequently with soap and water 👏
✅Avoid touching your eyes, nose, and mouth
✅Disinfect surfaces often
✅If you are sick, stay home
✅Wear a mask out in public",2020-08-06 18:51:40,,
85,0.0,,2.0,,2224763451003066,Gov. Andy Beshear - Media Briefing 08.06.2020,https://facebook.com/story.php?story_fbid=2224763451003066&id=242234105922687,"Governor Andy Beshear was live.
August 6 at 7:55 PM ·

Gov. Andy Beshear - Media Briefing 08.06.2020",0.0,"Gov. Andy Beshear - Media Briefing 08.06.2020

Governor Andy Beshear was live.
August 6 at 7:55 PM ·

Gov. Andy Beshear - Media Briefing 08.06.2020",2020-08-06 15:58:16,https://video-atl3-1.xx.fbcdn.net/v/t42.26565-2/10000000_308143847093693_5514028871437327728_n.mp4?_nc_cat=108&_nc_sid=985c63&efg=eyJ2ZW5jb2RlX3RhZyI6Im9lcF9zZCJ9&_nc_ohc=xcWn1Avj714AX9r0KYS&_nc_ht=video-atl3-1.xx&oh=f69d590a4bd7d6ca3750ff41cc14971c&oe=5F5D58FA,
86,0.0,https://scontent-atl3-1.xx.fbcdn.net/v/t1.0-9/117183242_10161290482339616_7838660932856992827_n.png?_nc_cat=108&_nc_sid=8024bb&_nc_ohc=qQpu-NL6ImYAX9IC1cD&_nc_ht=scontent-atl3-1.xx&oh=fa126e77997e5e932cb8abb7ab2e8db4&oe=5F80FAF8,0.0,,2224465107699567,"An update from the Franklin County Health Department, KY:",https://facebook.com/story.php?story_fbid=2224465107699567&id=242234105922687,"Franklin County Health Department, KY
August 5 at 10:05 PM ·

🕒 COVID-19 Summary: 7 New Cases. 292 Total. 82 Active in the Community. 13 Active in LTC Residents. 191 Recovered. 6 Hospitalized.

📰PLEASE continue to keep yourself & others safe through prevention measures:
✅ Practice social distancing at ALL times - indoors & outdoors
✅Wash your hands frequently with soap and water 👏
✅Avoid touching your eyes, nose, and mouth
✅Disinfect surfaces often
✅If you are sick, stay home
✅Wear a mask out in public",0.0,"An update from the Franklin County Health Department, KY:

Franklin County Health Department, KY
August 5 at 10:05 PM ·

🕒 COVID-19 Summary: 7 New Cases. 292 Total. 82 Active in the Community. 13 Active in LTC Residents. 191 Recovered. 6 Hospitalized.

📰PLEASE continue to keep yourself & others safe through prevention measures:
✅ Practice social distancing at ALL times - indoors & outdoors
✅Wash your hands frequently with soap and water 👏
✅Avoid touching your eyes, nose, and mouth
✅Disinfect surfaces often
✅If you are sick, stay home
✅Wear a mask out in public",2020-08-06 09:52:35,,
87,0.0,,1.0,,2223651481114263,Gov. Andy Beshear - Media Briefing 08.05.2020,https://facebook.com/story.php?story_fbid=2223651481114263&id=242234105922687,"Governor Andy Beshear was live.
August 5 at 7:55 PM ·

Gov. Andy Beshear - Media Briefing 08.05.2020",0.0,"Gov. Andy Beshear - Media Briefing 08.05.2020

Governor Andy Beshear was live.
August 5 at 7:55 PM ·

Gov. Andy Beshear - Media Briefing 08.05.2020",2020-08-05 16:00:21,https://video-atl3-1.xx.fbcdn.net/v/t42.26565-2/10000000_206286607497511_5660126838276847083_n.mp4?_nc_cat=102&_nc_sid=985c63&efg=eyJ2ZW5jb2RlX3RhZyI6Im9lcF9zZCJ9&_nc_ohc=44VNSzv6QzAAX8I-9eu&_nc_ht=video-atl3-1.xx&oh=5296ca7debd355c0233da63307dc424f&oe=5F5D5058,
88,1.0,,0.0,,1767370993429058,"Energy Committee Meeting held on August 5, 2020.",,,0.0,"Energy Committee Meeting held on August 5, 2020.",2020-08-05 13:58:00,https://scontent-atl3-1.xx.fbcdn.net/v/t66.36281-6/10000000_689720544979822_7438433921187262740_n.mp4?_nc_cat=104&_nc_sid=985c63&efg=eyJ2ZW5jb2RlX3RhZyI6Im9lcF9zZCJ9&_nc_ohc=vAiwFut9srcAX_eWk0m&_nc_ht=scontent-atl3-1.xx&oh=9a8820d43fe285710a1fb25cf07fbc7a&oe=5F8259CD,
89,0.0,,0.0,http://fchd.org/,2222728444539900,,https://facebook.com/story.php?story_fbid=2222728444539900&id=242234105922687,,0.0,,2020-08-04 20:02:56,,
90,0.0,,0.0,https://franklincounty.ky.gov/wp-content/uploads/2020/08/08-07-2020-Meeting-Notice-and-Agenda.pdf,2222561397889938,"Fiscal Court Agenda, 8/7/2020, 9 AM:",https://facebook.com/story.php?story_fbid=2222561397889938&id=242234105922687,"FRANKLINCOUNTY.KY.GOV
franklincounty.ky.gov",0.0,"Fiscal Court Agenda, 8/7/2020, 9 AM:

FRANKLINCOUNTY.KY.GOV
franklincounty.ky.gov",2020-08-04 16:13:23,,
91,0.0,,0.0,,2222554081224003,Gov. Andy Beshear - Media Briefing 08.04.2020,https://facebook.com/story.php?story_fbid=2222554081224003&id=242234105922687,"Governor Andy Beshear was live.
August 4 at 7:52 PM ·

Gov. Andy Beshear - Media Briefing 08.04.2020",0.0,"Gov. Andy Beshear - Media Briefing 08.04.2020

Governor Andy Beshear was live.
August 4 at 7:52 PM ·

Gov. Andy Beshear - Media Briefing 08.04.2020",2020-08-04 16:07:50,https://video-atl3-1.xx.fbcdn.net/v/t42.26565-2/10000000_117393023398675_6389740752976325372_n.mp4?_nc_cat=105&_nc_sid=985c63&efg=eyJ2ZW5jb2RlX3RhZyI6Im9lcF9zZCJ9&_nc_ohc=dyY4RCuJXbIAX9C_u38&_nc_ht=video-atl3-1.xx&oh=ab67206773e1908c5d12930c6f16a790&oe=5F5D57E5,
92,0.0,,0.0,,2221507144662030,Gov. Andy Beshear - Media Briefing 08.03.2020,https://facebook.com/story.php?story_fbid=2221507144662030&id=242234105922687,"Governor Andy Beshear was live.
August 3 at 7:55 PM ·

Gov. Andy Beshear - Media Briefing 08.03.2020",0.0,"Gov. Andy Beshear - Media Briefing 08.03.2020

Governor Andy Beshear was live.
August 3 at 7:55 PM ·

Gov. Andy Beshear - Media Briefing 08.03.2020",2020-08-03 16:31:10,https://video-atl3-1.xx.fbcdn.net/v/t42.26565-2/10000000_3233089036756934_7062037583954865017_n.mp4?_nc_cat=111&_nc_sid=985c63&efg=eyJ2ZW5jb2RlX3RhZyI6Im9lcF9zZCJ9&_nc_ohc=-E4lALGocYsAX8TBg31&_nc_ht=video-atl3-1.xx&oh=c75acb19dc876e105b65bd34cf61830f&oe=5F5D5571,
93,0.0,,1.0,,2221386004674144,Frankfort/Franklin Co COVID-19 Update 8/3/2020,https://facebook.com/story.php?story_fbid=2221386004674144&id=242234105922687,"Frankfort, Kentucky - City Hall was live.
August 3 at 5:04 PM ·

Frankfort/Franklin Co COVID-19 Update 8/3/2020",0.0,"Frankfort/Franklin Co COVID-19 Update 8/3/2020

Frankfort, Kentucky - City Hall was live.
August 3 at 5:04 PM ·

Frankfort/Franklin Co COVID-19 Update 8/3/2020",2020-08-03 13:29:13,https://video-atl3-1.xx.fbcdn.net/v/t42.26565-2/10000000_333260998083095_8037422166996976909_n.mp4?_nc_cat=109&_nc_sid=985c63&efg=eyJ2ZW5jb2RlX3RhZyI6Im9lcF9zZCJ9&_nc_ohc=0HI2UYMeq4oAX8hUzXh&_nc_ht=video-atl3-1.xx&oh=268c4c0036b1ba7dc52c7d3ac94c7dce&oe=5F5D50CD,
94,0.0,https://scontent-atl3-1.xx.fbcdn.net/v/t1.0-9/117168064_3163629843727007_7642045870455683973_n.png?_nc_cat=108&_nc_sid=8024bb&_nc_ohc=cyeJQjOxCKYAX-kCEUe&_nc_ht=scontent-atl3-1.xx&oh=279c4ecea4908869fd41f96d27eedb4d&oe=5F8223B8,0.0,,2221220408024037,"Join us today for the COVID-19 live update, with special guests Superintendents Mark Kopp and Houston Barber.",https://facebook.com/story.php?story_fbid=2221220408024037&id=242234105922687,"Frankfort, Kentucky - City Hall
August 3 at 1:19 PM ·

Join us today for the COVID-19 live update, with special guests Superintendents Mark Kopp and Houston Barber.",0.0,"Join us today for the COVID-19 live update, with special guests Superintendents Mark Kopp and Houston Barber.

Frankfort, Kentucky - City Hall
August 3 at 1:19 PM ·

Join us today for the COVID-19 live update, with special guests Superintendents Mark Kopp and Houston Barber.",2020-08-03 10:04:28,,
95,0.0,https://scontent-atl3-1.xx.fbcdn.net/v/t1.0-9/116645381_10161272303974616_3134300253001454727_o.png?_nc_cat=105&_nc_sid=8024bb&_nc_ohc=1D-fVb4eAdwAX84cKhS&_nc_ht=scontent-atl3-1.xx&oh=a7954743bd2bb500eae6d400d1bb332c&oe=5F830018,0.0,,2218487171630694,"A Covid-19 update from the Franklin County Health Department, KY:",https://facebook.com/story.php?story_fbid=2218487171630694&id=242234105922687,"Franklin County Health Department, KY
July 31 at 8:19 PM ·",0.0,"A Covid-19 update from the Franklin County Health Department, KY:

Franklin County Health Department, KY
July 31 at 8:19 PM ·",2020-07-31 19:18:33,,
96,1.0,https://scontent-atl3-1.xx.fbcdn.net/v/t1.0-9/fr/cp0/e15/q65/110934876_2218365154976229_2949797539219908328_o.jpg?_nc_cat=110&_nc_sid=8024bb&_nc_ohc=ubQp27xnqkoAX-kzJzJ&_nc_ht=scontent-atl3-1.xx&tp=14&oh=2f51e274886b12902f25bb982f3f35f9&oe=5F812488,8.0,,2218349904977754,Fiscal Court Public Reopening Postponed,https://facebook.com/story.php?story_fbid=2218349904977754&id=242234105922687,,0.0,Fiscal Court Public Reopening Postponed,2020-07-31 15:55:56,,
97,0.0,https://scontent-atl3-1.xx.fbcdn.net/v/t1.0-9/110166334_180256140131154_2416013205854032821_o.png?_nc_cat=110&_nc_sid=8024bb&_nc_ohc=nnASeSc4UnMAX9GzYpU&_nc_ht=scontent-atl3-1.xx&oh=fb3ee380aa4ef580e7ecb0e4c306e890&oe=5F818DA8,4.0,https://forms.gle/4Th5uVRKiVWoXZTa6,2218083345004410,"🌿YARD WASTE WEDNESDAY TO BEGIN AUGUST 5TH🌿

Yard waste drop off at the Franklin County Road Department will resume Wednesday August 5th. Hours are 8 AM to 12 PM. Please do not enter the Road Department office - there will be a sign-in table under a tent where you will fill out the waiver for the program. Brush, limbs, tree sections, grass clippings, flowers, etc are accepted. Items not accepted include tires, trash, and hazardous waste. Please DO NOT bag your waste. All who are physically able must unload their own vehicles.

Please be sure to follow all CDC guidelines regarding social distancing and mask wearing while on the premises. For any questions about the program, please call the Road Department at 502-875-8760.

Interested in finished compost material? Fill out our survey ! Our Solid Waste Department is working on developing a program for a FREE giveaway program for the future. Click the link below to enter your response.",https://facebook.com/story.php?story_fbid=2218083345004410&id=242234105922687,"Franklin County KY Solid Waste
July 31 at 1:30 PM ·

YARD WASTE WEDNESDAY TO BEGIN AUGUST 5TH

Yard waste drop off at the Franklin County Road Department will resume Wednesday August 5th. Hours are 8 AM to 12 PM. Brush, limbs, tree sections, grass clippings, flowers, etc are accepted. Items not accepted include tires, trash, and hazardous waste. Please DO NOT bag your waste. All who are physically able, must unload their own vehicles. Please be sure to follow all CDC guidelines regarding social distancing and mask wearing while on the premises. Please do not enter the Road Department office - there will be a sign in table under a tent where you will fill out the waiver for the program. For any questions about the program, please call the Road Department at 502-875-8760.

Interested in finished compost material? Fill out our survey ! We're working on developing a program for a FREE giveaway program for the future. Click the link here, and fill it out: https://forms.gle/4Th5uVRKiVWoXZTa6",4.0,"🌿YARD WASTE WEDNESDAY TO BEGIN AUGUST 5TH🌿

Yard waste drop off at the Franklin County Road Department will resume Wednesday August 5th. Hours are 8 AM to 12 PM. Please do not enter the Road Department office - there will be a sign-in table under a tent where you will fill out the waiver for the program. Brush, limbs, tree sections, grass clippings, flowers, etc are accepted. Items not accepted include tires, trash, and hazardous waste. Please DO NOT bag your waste. All who are physically able must unload their own vehicles.

Please be sure to follow all CDC guidelines regarding social distancing and mask wearing while on the premises. For any questions about the program, please call the Road Department at 502-875-8760.

Interested in finished compost material? Fill out our survey ! Our Solid Waste Department is working on developing a program for a FREE giveaway program for the future. Click the link below to enter your response.

Franklin County KY Solid Waste
July 31 at 1:30 PM ·

YARD WASTE WEDNESDAY TO BEGIN AUGUST 5TH

Yard waste drop off at the Franklin County Road Department will resume Wednesday August 5th. Hours are 8 AM to 12 PM. Brush, limbs, tree sections, grass clippings, flowers, etc are accepted. Items not accepted include tires, trash, and hazardous waste. Please DO NOT bag your waste. All who are physically able, must unload their own vehicles. Please be sure to follow all CDC guidelines regarding social distancing and mask wearing while on the premises. Please do not enter the Road Department office - there will be a sign in table under a tent where you will fill out the waiver for the program. For any questions about the program, please call the Road Department at 502-875-8760.

Interested in finished compost material? Fill out our survey ! We're working on developing a program for a FREE giveaway program for the future. Click the link here, and fill it out: https://forms.gle/4Th5uVRKiVWoXZTa6",2020-07-31 10:04:29,,
98,0.0,https://scontent-atl3-1.xx.fbcdn.net/v/t1.0-9/116714211_10161268778909616_2790034787764228953_n.png?_nc_cat=101&_nc_sid=8024bb&_nc_ohc=iHriUckEa6wAX_IFkhy&_nc_oc=AQnwQSBiMpLqB7qJbRWAv821pseawsoe5aKbggCP4NV3e2uKmVZPGVrAJ6cgOAZ01mw&_nc_ht=scontent-atl3-1.xx&oh=50660c374c916c5180d1e92457caba13&oe=5F845F31,1.0,,2217379615074783,"An update from the Franklin County Health Department, KY:",https://facebook.com/story.php?story_fbid=2217379615074783&id=242234105922687,"Franklin County Health Department, KY
July 30 at 9:09 PM ·",0.0,"An update from the Franklin County Health Department, KY:

Franklin County Health Department, KY
July 30 at 9:09 PM ·",2020-07-30 17:11:08,,
99,0.0,,3.0,,2217317868414291,Gov. Andy Beshear - Media Briefing 07.30.2020,https://facebook.com/story.php?story_fbid=2217317868414291&id=242234105922687,"Governor Andy Beshear was live.
