,comments,image,likes,link,post_id,post_text,post_url,shared_text,shares,text,time,video,video_thumbnail
0,1.0,,11.0,https://bit.ly/FCFBC19,3985370488149291,"It's here! Friday Night Lights at home! Good luck to the FC Football team tonight as they take on the Milford Eagles.
Please check the COVID-19 Protocols here: http://bit.ly/FCFBC19
The game will be on our Striv: https://striv.tv/channel/fillmore-central/",https://facebook.com/story.php?story_fbid=3985370488149291&id=318756731477370,,0.0,"It's here! Friday Night Lights at home! Good luck to the FC Football team tonight as they take on the Milford Eagles.
Please check the COVID-19 Protocols here: http://bit.ly/FCFBC19
The game will be on our Striv: https://striv.tv/channel/fillmore-central/",2020-09-11 10:39:06,,
1,0.0,,21.0,https://bit.ly/ACCC-19,3985252698161070,"Run, run as fast as you can. You can't catch me. I'm in the Panther clan.
Good luck to the FC Cross Country team today at Aurora. Due to rain it the meet will now take place at Streeter Park.
COVID-19 Protocols can be found here: http://bit.ly/ACCC-19",https://facebook.com/story.php?story_fbid=3985252698161070&id=318756731477370,,0.0,"Run, run as fast as you can. You can't catch me. I'm in the Panther clan.
Good luck to the FC Cross Country team today at Aurora. Due to rain it the meet will now take place at Streeter Park.
COVID-19 Protocols can be found here: http://bit.ly/ACCC-19",2020-09-11 09:59:04,,
2,1.0,,4.0,,3982688728417467,"Due to an over abundance of caution, the Fillmore Central Junior High volleyball game that was to be played on Thursday, September 10th at Sutton has been postponed.",https://facebook.com/story.php?story_fbid=3982688728417467&id=318756731477370,,0.0,"Due to an over abundance of caution, the Fillmore Central Junior High volleyball game that was to be played on Thursday, September 10th at Sutton has been postponed.",2020-09-10 15:50:03,,
3,0.0,,4.0,https://www.fillmorecentral.org/article/304880?org=fillmore-cps,3982162611803412,"September 10, 2020 Update from Mr. Cumpston",https://facebook.com/story.php?story_fbid=3982162611803412&id=318756731477370,"FILLMORECENTRAL.ORG
September 10, 2020 Update from Mr. Cumpston",5.0,"September 10, 2020 Update from Mr. Cumpston

FILLMORECENTRAL.ORG
September 10, 2020 Update from Mr. Cumpston",2020-09-10 12:09:53,,
4,0.0,https://scontent-atl3-1.xx.fbcdn.net/v/t1.0-9/fr/cp0/e15/q65/119057441_3981953078491032_8397402120853782546_o.jpg?_nc_cat=106&_nc_sid=2d5d41&_nc_ohc=pO3vIeBM0WYAX95kql2&_nc_ht=scontent-atl3-1.xx&tp=14&oh=370429f309957b8d665c964ebaa6c008&oe=5F84A522,7.0,,3981953071824366,Forgot to purchase your 2020 yearbook last year? There are some available for purchase. The cost is $40. Please contact Mr. Dahl at the high school to get your copy today!,,,0.0,Forgot to purchase your 2020 yearbook last year? There are some available for purchase. The cost is $40. Please contact Mr. Dahl at the high school to get your copy today!,2020-09-10 10:47:42,,
5,0.0,,1.0,,3981918181827855,The SB triangular scheduled for today vs. Freeman and WC has been postponed due to weather. We are looking for make-up dates.,https://facebook.com/story.php?story_fbid=3981918181827855&id=318756731477370,,0.0,The SB triangular scheduled for today vs. Freeman and WC has been postponed due to weather. We are looking for make-up dates.,2020-09-10 10:34:03,,
6,0.0,https://scontent-atl3-1.xx.fbcdn.net/v/t1.0-9/fr/cp0/e15/q65/119139991_3981901921829481_4174485049453876864_o.jpg?_nc_cat=103&_nc_sid=8024bb&_nc_ohc=XbfvoXbnot4AX-MZ6Pt&_nc_ht=scontent-atl3-1.xx&tp=14&oh=12fdacc14ca1634f70bfad88c76382ab&oe=5F8273F4,4.0,https://fillmorecentralbooster.itemorder.com/,3981902035162803,Fillmore Central High School Booster Apparel for 2020 is available for purchase online at https://fillmorecentralbooster.itemorder.com. Last day to order is September 17th.,https://facebook.com/story.php?story_fbid=3981902035162803&id=318756731477370,,0.0,Fillmore Central High School Booster Apparel for 2020 is available for purchase online at https://fillmorecentralbooster.itemorder.com. Last day to order is September 17th.,2020-09-10 10:28:09,,
7,1.0,,11.0,http://www.martinphotography.hhimagehost.com/,3981901148496225,"School Pictures are September 16th and you can order your School Pictures today!

You now have the convenience to place an online order for School Pictures.

Please click the link below to place your order. Thank you!

www.martinphotography.hhimagehost.com",https://facebook.com/story.php?story_fbid=3981901148496225&id=318756731477370,,0.0,"School Pictures are September 16th and you can order your School Pictures today!

You now have the convenience to place an online order for School Pictures.

Please click the link below to place your order. Thank you!

www.martinphotography.hhimagehost.com",2020-09-10 10:27:50,,
8,0.0,,2.0,,3979460725406934,The fall sports Meet the Panthers event has been postponed until further notice.,https://facebook.com/story.php?story_fbid=3979460725406934&id=318756731477370,,0.0,The fall sports Meet the Panthers event has been postponed until further notice.,2020-09-09 16:04:29,,
9,2.0,https://scontent-atl3-1.xx.fbcdn.net/v/t1.0-9/fr/cp0/e15/q65/119123952_3979460138740326_5055742682221417743_o.jpg?_nc_cat=102&_nc_sid=2d5d41&_nc_ohc=UofMqAddGqQAX_mKyEx&_nc_ht=scontent-atl3-1.xx&tp=14&oh=afb4975ba78916f1c11e0dbe6dd71e78&oe=5F83A928,42.0,,3979460132073660,The freshman family and consumer sciences exploratory class made their own masks as their first sewing project.,,,0.0,The freshman family and consumer sciences exploratory class made their own masks as their first sewing project.,2020-09-09 16:04:16,,
10,0.0,https://scontent-atl3-1.xx.fbcdn.net/v/t1.0-9/fr/cp0/e15/q65/119040143_3976235779062762_141025491802907667_o.jpg?_nc_cat=108&_nc_sid=2d5d41&_nc_ohc=_X6KOYzcktkAX-4b7Mx&_nc_ht=scontent-atl3-1.xx&tp=14&oh=33a01a243510577520a996ed80824e32&oe=5F825F9F,6.0,,3976235775729429,"In honor of our 20th year, a commemorative t-shirt is available for purchase with all proceeds going to benefit the FC Backpack program! Please consider supporting the Backpack Program and also celebrating 20 Years of Fillmore Central!
We are #BetterTogether!!",,,0.0,"In honor of our 20th year, a commemorative t-shirt is available for purchase with all proceeds going to benefit the FC Backpack program! Please consider supporting the Backpack Program and also celebrating 20 Years of Fillmore Central!
We are #BetterTogether!!",2020-09-08 17:10:21,,
11,0.0,,2.0,,3976105359075804,Junior high football game for tonight has been postponed.,https://facebook.com/story.php?story_fbid=3976105359075804&id=318756731477370,,0.0,Junior high football game for tonight has been postponed.,2020-09-08 16:06:55,,
12,0.0,,7.0,,3976097775743229,"Due to the weather, the JH and JV FB games vs. Centennial scheduled for today have been postponed.",https://facebook.com/story.php?story_fbid=3976097775743229&id=318756731477370,,0.0,"Due to the weather, the JH and JV FB games vs. Centennial scheduled for today have been postponed.",2020-09-08 16:03:04,,
13,0.0,,2.0,,3975695665783440,"Tonight's VB games with Milford, both JV and V are postponed due to quarantine.",https://facebook.com/story.php?story_fbid=3975695665783440&id=318756731477370,,0.0,"Tonight's VB games with Milford, both JV and V are postponed due to quarantine.",2020-09-08 13:25:46,,
14,0.0,,6.0,https://core-docs.s3.amazonaws.com/documents/asset/uploaded_file/887338/Covid_Information_pertaining_to_Fairbury_High_School.pdf,3962877027065304,"Good luck to the FCEMF Softball team at Fairbury this weekend!
Here are the COVID-19 Protocols: https://core-docs.s3.amazonaws.com/documents/asset/uploaded_file/887338/Covid_Information_pertaining_to_Fairbury_High_School.pdf",https://facebook.com/story.php?story_fbid=3962877027065304&id=318756731477370,,0.0,"Good luck to the FCEMF Softball team at Fairbury this weekend!
Here are the COVID-19 Protocols: https://core-docs.s3.amazonaws.com/documents/asset/uploaded_file/887338/Covid_Information_pertaining_to_Fairbury_High_School.pdf",2020-09-04 15:32:06,,
15,3.0,,9.0,http://striv.tv/channel/sda/,3962075260478814,"Good luck to the FC Football team as they head to Syracuse tonight to take on the SDA Rockets.
Their Striv is: http://striv.tv/channel/sda/
View the COVID-19 protocols here: http://bit.ly/SDAFBC-19",https://facebook.com/story.php?story_fbid=3962075260478814&id=318756731477370,,0.0,"Good luck to the FC Football team as they head to Syracuse tonight to take on the SDA Rockets.
Their Striv is: http://striv.tv/channel/sda/
View the COVID-19 protocols here: http://bit.ly/SDAFBC-19",2020-09-04 10:26:10,,
16,0.0,,6.0,https://striv.tv/channel/fillmore-central/,3958939030792437,"Take me out to the ball game to watch the FCEMF Panthers take on Southern Raiders tonight. There will be 2 innings of JV starting at 5:30.
Watch live on Striv: https://striv.tv/channel/fillmore-central/
Don't forget to check the COVID Protocols: http://bit.ly/FCSBC-19",https://facebook.com/story.php?story_fbid=3958939030792437&id=318756731477370,,0.0,"Take me out to the ball game to watch the FCEMF Panthers take on Southern Raiders tonight. There will be 2 innings of JV starting at 5:30.
Watch live on Striv: https://striv.tv/channel/fillmore-central/
Don't forget to check the COVID Protocols: http://bit.ly/FCSBC-19",2020-09-03 11:20:14,,
17,0.0,,8.0,https://striv.tv/channel/david-city/,3958650427487964,"Good to the FC Volleyball team today in David City. Bump, Set, Spike, Win Tonight!
The game is scheduled to be broadcasted on Striv: https://striv.tv/channel/david-city/
See David City's COVID-19 Protocols here: http://bit.ly/DCVBC-19",https://facebook.com/story.php?story_fbid=3958650427487964&id=318756731477370,,0.0,"Good to the FC Volleyball team today in David City. Bump, Set, Spike, Win Tonight!
The game is scheduled to be broadcasted on Striv: https://striv.tv/channel/david-city/
See David City's COVID-19 Protocols here: http://bit.ly/DCVBC-19",2020-09-03 09:38:03,,
18,0.0,,15.0,https://bit.ly/SXCC-19,3958650180821322,"The first cross country meet is today in Superior. Good luck FC Panther runners!
See the COVID-19 Protocols here: http://bit.ly/SXCC-19",https://facebook.com/story.php?story_fbid=3958650180821322&id=318756731477370,,0.0,"The first cross country meet is today in Superior. Good luck FC Panther runners!
See the COVID-19 Protocols here: http://bit.ly/SXCC-19",2020-09-03 09:37:58,,
19,0.0,,2.0,,3953194121366928,"There will be a scheduled early dismissal on Wednesday, September 2. Elementary dismiss at 1:05, Middle School at 1:20 and High School at 1:35. Buses run accordingly.",https://facebook.com/story.php?story_fbid=3953194121366928&id=318756731477370,,0.0,"There will be a scheduled early dismissal on Wednesday, September 2. Elementary dismiss at 1:05, Middle School at 1:20 and High School at 1:35. Buses run accordingly.",2020-09-01 19:30:04,,
20,0.0,,13.0,https://bit.ly/SVBC19P,3951811261505214,"Good luck to the FC Volleyball team as they head to Superior today. Their COVID-19 Protocols can be found here: http://bit.ly/SVBC19P
Go Panthers!",https://facebook.com/story.php?story_fbid=3951811261505214&id=318756731477370,,0.0,"Good luck to the FC Volleyball team as they head to Superior today. Their COVID-19 Protocols can be found here: http://bit.ly/SVBC19P
Go Panthers!",2020-09-01 10:09:53,,
21,0.0,https://scontent-atl3-1.xx.fbcdn.net/v/t1.0-9/fr/cp0/e15/q65/118774597_3951741891512151_8740155308075335165_o.jpg?_nc_cat=110&_nc_sid=2d5d41&_nc_ohc=xVYWOAJ3DnoAX-9cMeb&_nc_ht=scontent-atl3-1.xx&tp=14&oh=796d93d3628bdca357e585708ff12886&oe=5F84DC95,41.0,https://bit.ly/SVSBC19,3951741884845485,"Congratulations FCEMF Softball for winning their home quad on August 29th. Today you can catch the Panthers in action at Southern Valley. View the COVID-19 Protocols for the game here: http://bit.ly/SVSBC19
Good luck Panthers!",,,0.0,"Congratulations FCEMF Softball for winning their home quad on August 29th. Today you can catch the Panthers in action at Southern Valley. View the COVID-19 Protocols for the game here: http://bit.ly/SVSBC19
Good luck Panthers!",2020-09-01 09:44:48,,
22,4.0,,2.0,,3937637056255968,The YouTube link on our previous post appears to be a scam. We apologize for the inconvenience.,https://facebook.com/story.php?story_fbid=3937637056255968&id=318756731477370,,0.0,The YouTube link on our previous post appears to be a scam. We apologize for the inconvenience.,2020-08-28 21:14:08,,
23,5.0,,4.0,https://youtu.be/UKvqZcziGbQ,3937351822951158,"Watch the Panthers take on the Mustangs!
https://youtu.be/UKvqZcziGbQ",https://facebook.com/story.php?story_fbid=3937351822951158&id=318756731477370,,0.0,"Watch the Panthers take on the Mustangs!
https://youtu.be/UKvqZcziGbQ",2020-08-28 18:59:33,,
24,0.0,,6.0,https://www.fillmorecentral.org/article/296736?org=fillmore-cps,3936806509672356,"August 28, 2020 Update from Mr. Cumpston",https://facebook.com/story.php?story_fbid=3936806509672356&id=318756731477370,"FILLMORECENTRAL.ORG
August 28, 2020 Update from Mr. Cumpston",0.0,"August 28, 2020 Update from Mr. Cumpston

FILLMORECENTRAL.ORG
August 28, 2020 Update from Mr. Cumpston",2020-08-28 15:29:52,,
25,0.0,https://scontent-atl3-1.xx.fbcdn.net/v/t1.0-9/fr/cp0/e15/q65/118572828_3936059439747063_631147514832684871_o.jpg?_nc_cat=108&_nc_sid=2d5d41&_nc_ohc=kBHzRITaV0YAX_ZVYHZ&_nc_ht=scontent-atl3-1.xx&tp=14&oh=7aba30e08dbaac170350cc787408e017&oe=5F851C09,9.0,https://bit.ly/2YIEgy2,3936059433080397,"Good luck to the FC Volleyball team as they head to their tournament in Minden tomorrow. Their COVID Protocols can be found here: https://bit.ly/2YIEgy2
Go Panthers!",,,0.0,"Good luck to the FC Volleyball team as they head to their tournament in Minden tomorrow. Their COVID Protocols can be found here: https://bit.ly/2YIEgy2
Go Panthers!",2020-08-28 11:08:07,,
26,0.0,https://scontent-atl3-1.xx.fbcdn.net/v/t1.0-9/fr/cp0/e15/q65/118518823_3935997326419941_8910865811081799695_o.jpg?_nc_cat=107&_nc_sid=2d5d41&_nc_ohc=mxTzpyOX9qUAX_jugzb&_nc_ht=scontent-atl3-1.xx&tp=14&oh=b90c6876df7fcb521a11fcc52cf4a16c&oe=5F81D2A0,3.0,https://bit.ly/32CZj60,3935997319753275,"Good luck to FCEMF Softball tomorrow at their home quad! Games will be played in Geneva & Fairmont. Here are our protocols for the game: https://bit.ly/32CZj60
The games in Geneva will be available on Striv.: https://striv.tv/channel/fillmore-central/
Go Panthers!",,,0.0,"Good luck to FCEMF Softball tomorrow at their home quad! Games will be played in Geneva & Fairmont. Here are our protocols for the game: https://bit.ly/32CZj60
The games in Geneva will be available on Striv.: https://striv.tv/channel/fillmore-central/
Go Panthers!",2020-08-28 10:45:39,,
27,0.0,,12.0,https://core-docs.s3.amazonaws.com/documents/asset/uploaded_file/868350/FB_COVID_Procedure.pdf,3935688296450844,Good luck to the Panther football players as they head to Raymond Central tonight. Please see the fan guide from RC. https://core-docs.s3.amazonaws.com/documents/asset/uploaded_file/868350/FB_COVID_Procedure.pdf,,,0.0,Good luck to the Panther football players as they head to Raymond Central tonight. Please see the fan guide from RC. https://core-docs.s3.amazonaws.com/documents/asset/uploaded_file/868350/FB_COVID_Procedure.pdf,2020-08-28 09:01:17,,
28,0.0,https://scontent-atl3-1.xx.fbcdn.net/v/t1.0-9/fr/cp0/e15/q65/118580706_3929682907051383_6165934299676073865_o.jpg?_nc_cat=104&_nc_sid=8024bb&_nc_ohc=I0Ld4CapcOYAX8u-9Gx&_nc_ht=scontent-atl3-1.xx&tp=14&oh=1c2e8e7b57b802a936da6823776de6e4&oe=5F84BDE4,37.0,,3929683430384664,"Thank you to the FC Beef Boosters for providing the roasts for our meal today. It was delicious! Also thank you to the City of Geneva for allowing us to use your picnic tables to help with social distancing.
#ProudToBeAPanther",https://facebook.com/story.php?story_fbid=3929683430384664&id=318756731477370,,0.0,"Thank you to the FC Beef Boosters for providing the roasts for our meal today. It was delicious! Also thank you to the City of Geneva for allowing us to use your picnic tables to help with social distancing.
#ProudToBeAPanther",2020-08-26 14:29:00,,
29,0.0,,2.0,,3929675333718807,All 7th and 8th grade home volleyball matches have been moved to the high school gym in Geneva. The change was due to allow for a larger seating capacity that is being recommended by our local health department and the NSAA. All matches will begin at 4:30 p.m. More information will be shared on the number of spectators that will be allowed to attend per player.. Call Mr. Adkisson at the middle school if you have questions. #BetterTogether,https://facebook.com/story.php?story_fbid=3929675333718807&id=318756731477370,,0.0,All 7th and 8th grade home volleyball matches have been moved to the high school gym in Geneva. The change was due to allow for a larger seating capacity that is being recommended by our local health department and the NSAA. All matches will begin at 4:30 p.m. More information will be shared on the number of spectators that will be allowed to attend per player.. Call Mr. Adkisson at the middle school if you have questions. #BetterTogether,2020-08-26 14:26:20,,
30,1.0,https://scontent-atl3-1.xx.fbcdn.net/v/t1.0-9/fr/cp0/e15/q65/118320318_3929668250386182_1997152683914647282_o.jpg?_nc_cat=108&_nc_sid=2d5d41&_nc_ohc=EyDbZCP3HNMAX9s5xbh&_nc_ht=scontent-atl3-1.xx&tp=14&oh=31e5f2e53527172e054633df1609d838&oe=5F84E314,10.0,,3929668243719516,"Ms. Fitzgerald's 5th grade math class has been enjoying some ""mask free"" time as they learn outside.
Thank you to everyone who donated towels!!!",,,0.0,"Ms. Fitzgerald's 5th grade math class has been enjoying some ""mask free"" time as they learn outside.
Thank you to everyone who donated towels!!!",2020-08-26 14:23:04,,
31,3.0,,27.0,,3929668050386202,"Ms. Fitzgerald's 5th grade math class has been enjoying some ""mask free"" time as they learn outside.
Thank you to everyone who donated towels!!!",,,0.0,"Ms. Fitzgerald's 5th grade math class has been enjoying some ""mask free"" time as they learn outside.
Thank you to everyone who donated towels!!!",2020-08-26 14:22:59,,
32,0.0,,6.0,https://core-docs.s3.amazonaws.com/documents/asset/uploaded_file/874885/FC_SB_COVID-19_PROTOCOLS.pdf,3926154424070898,"Good luck to the FCEMF Softball team as they take on Fairbury tonight at home. Please view our COVID-19 Protocols before attending the game. https://core-docs.s3.amazonaws.com/documents/asset/uploaded_file/874885/FC_SB_COVID-19_PROTOCOLS.pdf
Go Panthers!",https://facebook.com/story.php?story_fbid=3926154424070898&id=318756731477370,,0.0,"Good luck to the FCEMF Softball team as they take on Fairbury tonight at home. Please view our COVID-19 Protocols before attending the game. https://core-docs.s3.amazonaws.com/documents/asset/uploaded_file/874885/FC_SB_COVID-19_PROTOCOLS.pdf
Go Panthers!",2020-08-25 12:27:43,,
33,1.0,,8.0,https://www.fillmorecentral.org/o/fillmore-cps/page/covid-19-away-game-protocols,3923315071021500,Good luck to the FCEMF Softball team tonight at Aurora and the FC Volleyball team at Raymond Central. Don't forget to check out the visiting COVID-19 protocols on our website. https://www.fillmorecentral.org/o/fillmore-cps/page/covid-19-away-game-protocols,https://facebook.com/story.php?story_fbid=3923315071021500&id=318756731477370,,0.0,Good luck to the FCEMF Softball team tonight at Aurora and the FC Volleyball team at Raymond Central. Don't forget to check out the visiting COVID-19 protocols on our website. https://www.fillmorecentral.org/o/fillmore-cps/page/covid-19-away-game-protocols,2020-08-24 15:28:04,,
34,0.0,,1.0,https://www.fillmorecentral.org/article/293406?org=fillmore-cps,3922775071075500,PRESIDENT’S AWARD FOR EDUCATIONAL EXCELLENCE – 2020,https://facebook.com/story.php?story_fbid=3922775071075500&id=318756731477370,"FILLMORECENTRAL.ORG
PRESIDENT’S AWARD FOR EDUCATIONAL EXCELLENCE – ...",0.0,"PRESIDENT’S AWARD FOR EDUCATIONAL EXCELLENCE – 2020

FILLMORECENTRAL.ORG
PRESIDENT’S AWARD FOR EDUCATIONAL EXCELLENCE – ...",2020-08-24 11:39:04,,
35,0.0,,11.0,https://www.fillmorecentral.org/article/292318?org=fillmore-cps,3910632202289787,"August 21, 2020 Update from Mr. Cumpston",https://facebook.com/story.php?story_fbid=3910632202289787&id=318756731477370,"FILLMORECENTRAL.ORG
August 21, 2020 Update from Mr. Cumpston",5.0,"August 21, 2020 Update from Mr. Cumpston

FILLMORECENTRAL.ORG
August 21, 2020 Update from Mr. Cumpston",2020-08-21 15:16:25,,
36,2.0,https://scontent-atl3-1.xx.fbcdn.net/v/t1.0-9/fr/cp0/e15/q65/118110865_3906702182682789_5620403465900932357_o.jpg?_nc_cat=102&_nc_sid=2d5d41&_nc_ohc=Q6hXElw5JIAAX_hg7n8&_nc_ht=scontent-atl3-1.xx&tp=14&oh=4c47f73a1a85f9aa59334b4e7435e702&oe=5F81E9D7,0.0,,3906702179349456,2020 Cancer Awareness shirts are available to purchase. We will be celebrating Cancer Awareness week on 9/14-9/18. Turn in order forms to the office by September 1st.,,,0.0,2020 Cancer Awareness shirts are available to purchase. We will be celebrating Cancer Awareness week on 9/14-9/18. Turn in order forms to the office by September 1st.,2020-08-20 16:57:42,,
37,0.0,,10.0,,3900094490010225,"FCEMF Softball will be heading to Centennial for a triangular on Aug. 22nd. Admission will be $6 for adults and $4 for students. Concessions will be provided by A1 Southern Cooking. Games times are 12:00 PM - Bishop Neumann vs. FCEMF & 2:00 PM - Centennial vs. FCEMF.
COVID EXPECTATIONS:
-Social distancing is required
-Masks are encouraged
-Please bring chairs as bleacher space will be limited
-Social distance in dugouts (can use bleachers for more room)
-When team is done playing, please have fans clear out for next team’s fans to sit
-Only 2 per restroom at a time
-Playground equipment use is at the risk of the parents
-Only food allowed is either from A1 Southern Cooking or prepackaged foods (sack lunches)",https://facebook.com/story.php?story_fbid=3900094490010225&id=318756731477370,,0.0,"FCEMF Softball will be heading to Centennial for a triangular on Aug. 22nd. Admission will be $6 for adults and $4 for students. Concessions will be provided by A1 Southern Cooking. Games times are 12:00 PM - Bishop Neumann vs. FCEMF & 2:00 PM - Centennial vs. FCEMF.
COVID EXPECTATIONS:
-Social distancing is required
-Masks are encouraged
-Please bring chairs as bleacher space will be limited
-Social distance in dugouts (can use bleachers for more room)
-When team is done playing, please have fans clear out for next team’s fans to sit
-Only 2 per restroom at a time
-Playground equipment use is at the risk of the parents
-Only food allowed is either from A1 Southern Cooking or prepackaged foods (sack lunches)",2020-08-19 09:34:33,,
38,0.0,,16.0,,3896226710397003,"The FC Cheer Squad is excited to announce that plans are underway for a terrific Cheer Clinic experience for all of our attendees. At this time, the Sept 11 date is being postponed, so that the best possible experience can be safely planned for all attendees! More soon!",https://facebook.com/story.php?story_fbid=3896226710397003&id=318756731477370,,0.0,"The FC Cheer Squad is excited to announce that plans are underway for a terrific Cheer Clinic experience for all of our attendees. At this time, the Sept 11 date is being postponed, so that the best possible experience can be safely planned for all attendees! More soon!",2020-08-18 15:14:51,,
39,0.0,,25.0,https://www.fillmorecentral.org/article/286614?org=fillmore-cps,3880593798626961,New Staff Members,https://facebook.com/story.php?story_fbid=3880593798626961&id=318756731477370,"FILLMORECENTRAL.ORG
New Staff Members",4.0,"New Staff Members

FILLMORECENTRAL.ORG
New Staff Members",2020-08-13 17:01:30,,
40,0.0,,5.0,https://www.fillmorecentral.org/article/284961?org=fillmore-cps,3874276915925316,Mr. Cumpston's Start of School Update Letter,https://facebook.com/story.php?story_fbid=3874276915925316&id=318756731477370,"FILLMORECENTRAL.ORG
Mr. Cumpston's Start of School Update Letter",6.0,"Mr. Cumpston's Start of School Update Letter

FILLMORECENTRAL.ORG
Mr. Cumpston's Start of School Update Letter",2020-08-11 16:49:22,,
41,0.0,https://scontent-atl3-1.xx.fbcdn.net/v/t1.0-9/fr/cp0/e15/q65/117444714_3873589872660687_7352992335974258897_o.jpg?_nc_cat=104&_nc_sid=2d5d41&_nc_ohc=Kf0aPikHK-AAX9PnlUb&_nc_ht=scontent-atl3-1.xx&tp=14&oh=02a60170e444f236f812ed00c0a26fab&oe=5F8548AB,2.0,,3873589862660688,Volleyball Shirt Order Form,,,0.0,Volleyball Shirt Order Form,2020-08-11 11:36:45,,
42,0.0,,5.0,https://core-docs.s3.amazonaws.com/documents/asset/uploaded_file/842003/August_September_2020_Newsletter.pdf,3858699200816421,"The August newsletter has been emailed to all parents or you can read it here: https://core-docs.s3.amazonaws.com/documents/asset/uploaded_file/842003/August_September_2020_Newsletter.pdf
#GoPanthers",https://facebook.com/story.php?story_fbid=3858699200816421&id=318756731477370,,0.0,"The August newsletter has been emailed to all parents or you can read it here: https://core-docs.s3.amazonaws.com/documents/asset/uploaded_file/842003/August_September_2020_Newsletter.pdf
#GoPanthers",2020-08-06 15:44:09,,
43,4.0,,17.0,https://www.loom.com/share/e0d86e6201dd49b4ad98cc42fb364e31,3839440299408978,"This is a message from Mr. Cumpston regarding school starting this fall. Please share.

https://www.loom.com/share/e0d86e6201dd49b4ad98cc42fb364e31",https://facebook.com/story.php?story_fbid=3839440299408978&id=318756731477370,"LOOM.COM
COVID Information - Google Slides",7.0,"This is a message from Mr. Cumpston regarding school starting this fall. Please share.

https://www.loom.com/share/e0d86e6201dd49b4ad98cc42fb364e31

LOOM.COM
COVID Information - Google Slides",2020-07-31 13:48:50,,
