,comments,image,likes,link,post_id,post_text,post_url,shared_text,shares,text,time,video,video_thumbnail
157,2.0,https://scontent-atl3-1.xx.fbcdn.net/v/t1.0-9/fr/cp0/e15/q65/91180681_1342997402539558_471506010880606208_o.jpg?_nc_cat=100&_nc_sid=8024bb&_nc_ohc=h33iy3o0zdoAX9tmfsB&_nc_ht=scontent-atl3-1.xx&tp=14&oh=019e111509b47962fa303e0bcaec9c6c&oe=5F82FCE3,66.0,,1342998585872773,"Hello Magelssen Elementary Families:

I hope this message finds you well. The Magelssen Elementary staff has created distance learning packets for all students Pre-K through 6th grade. Packets will be available for pickup Friday, March 27th from 7:00am-5:30pm. Sorry, NO early pickups will be available. Original pick up date has been changed due to the governor’s “Stay at Home Order.” Pickup procedure will be curbside on the south side of the elementary school (where students are typically picked up). Staff will be on hand to deliver packets to your vehicle. Please, remain in your vehicle and be patient. If you have any questions, please call Magelssen Elementary School @ 218-435-6036.

Dan Boushee-Principal",https://facebook.com/story.php?story_fbid=1342998585872773&id=269120043260638,,0.0,"Hello Magelssen Elementary Families:

I hope this message finds you well. The Magelssen Elementary staff has created distance learning packets for all students Pre-K through 6th grade. Packets will be available for pickup Friday, March 27th from 7:00am-5:30pm. Sorry, NO early pickups will be available. Original pick up date has been changed due to the governor’s “Stay at Home Order.” Pickup procedure will be curbside on the south side of the elementary school (where students are typically picked up). Staff will be on hand to deliver packets to your vehicle. Please, remain in your vehicle and be patient. If you have any questions, please call Magelssen Elementary School @ 218-435-6036.

Dan Boushee-Principal",2020-03-26 14:33:42,,
158,2.0,https://scontent-atl3-1.xx.fbcdn.net/v/t1.0-9/fr/cp0/e15/q65/91011504_1342798919226073_4499612218387595264_n.jpg?_nc_cat=106&_nc_sid=110474&_nc_ohc=K_pxa7ARZMgAX8yFhxm&_nc_ht=scontent-atl3-1.xx&tp=14&oh=499c0c60ad2bd1fde89060d2b224d0be&oe=5F81B3DA,46.0,,1342799015892730,We have Fancy Nancy's Glam Squad here at Magelssen Elementary! 👠👗💄💅💃💍👛,https://facebook.com/story.php?story_fbid=1342799015892730&id=269120043260638,,0.0,We have Fancy Nancy's Glam Squad here at Magelssen Elementary! 👠👗💄💅💃💍👛,2020-03-26 09:30:02,,
159,2.0,https://scontent-atl3-1.xx.fbcdn.net/v/t1.0-9/fr/cp0/e15/q65/91025320_1342796185893013_1148455052151619584_o.jpg?_nc_cat=106&_nc_sid=8024bb&_nc_ohc=Nv073rmMHZwAX_Yk7O9&_nc_ht=scontent-atl3-1.xx&tp=14&oh=cddb206267533777d5cd0b17f1e83883&oe=5F824590,75.0,,1342796409226324,ISD 601 staff making masks for staff to use while delivering meals.,https://facebook.com/story.php?story_fbid=1342796409226324&id=269120043260638,,0.0,ISD 601 staff making masks for staff to use while delivering meals.,2020-03-26 09:26:10,,
160,8.0,https://scontent-atl3-1.xx.fbcdn.net/v/t1.0-9/fr/cp0/e15/q65/91020336_1342054369300528_5370921294445412352_n.jpg?_nc_cat=101&_nc_sid=110474&_nc_ohc=kuAqQhr2snAAX8Zg6OH&_nc_ht=scontent-atl3-1.xx&tp=14&oh=38d455476e378bb46bdcd61f2b831370&oe=5F811807,126.0,,1342055019300463,It's Always A Great Day to Be A Greyhound!! Magelssen Elementary Staff Waving to Our Students!! We Miss You!! 🐾,https://facebook.com/story.php?story_fbid=1342055019300463&id=269120043260638,,0.0,It's Always A Great Day to Be A Greyhound!! Magelssen Elementary Staff Waving to Our Students!! We Miss You!! 🐾,2020-03-25 11:13:30,,
161,0.0,https://scontent-atl3-1.xx.fbcdn.net/v/t1.0-9/fr/cp0/e15/q65/91192825_1341262096046422_860947325722296320_o.jpg?_nc_cat=110&_nc_sid=8024bb&_nc_ohc=WvSwUov3yS8AX8kXicy&_nc_ht=scontent-atl3-1.xx&tp=14&oh=284238215a13dfed6f664223c12e4bb1&oe=5F81ED46,3.0,,1341262182713080,,https://facebook.com/story.php?story_fbid=1341262182713080&id=269120043260638,,0.0,,2020-03-24 12:05:59,,
162,0.0,,4.0,,1341210699384895,Order Your Magelssen Elementary Yearbook!,https://facebook.com/story.php?story_fbid=1341210699384895&id=269120043260638,,0.0,Order Your Magelssen Elementary Yearbook!,2020-03-24 10:53:13,,
163,0.0,https://scontent-atl3-1.xx.fbcdn.net/v/t1.0-9/fr/cp0/e15/q65/90554460_1340581499447815_490684281102794752_n.jpg?_nc_cat=101&_nc_sid=110474&_nc_ohc=CXV0-Q9WrB0AX8wVsaS&_nc_ht=scontent-atl3-1.xx&tp=14&oh=3a1027781facad0059b7239a74f06333&oe=5F83C14B,46.0,,1340581986114433,Magelssen Elementary Staff Hard at Work!,https://facebook.com/story.php?story_fbid=1340581986114433&id=269120043260638,,0.0,Magelssen Elementary Staff Hard at Work!,2020-03-23 16:09:46,,
164,0.0,https://scontent-atl3-1.xx.fbcdn.net/v/t1.0-9/fr/cp0/e15/q65/90206664_1340471729458792_2890377947846279168_o.jpg?_nc_cat=108&_nc_sid=8024bb&_nc_ohc=yao6KjR-gVAAX_du9OL&_nc_ht=scontent-atl3-1.xx&tp=14&oh=50cb319df2054e31783007610dfc6d7a&oe=5F82E0CD,18.0,,1340472042792094,Happy Birthday to these High School Students!,https://facebook.com/story.php?story_fbid=1340472042792094&id=269120043260638,,0.0,Happy Birthday to these High School Students!,2020-03-23 13:15:54,,
165,9.0,https://scontent-atl3-1.xx.fbcdn.net/v/t1.0-9/fr/cp0/e15/q65/90707514_1340436356128996_8314929257671294976_o.jpg?_nc_cat=105&_nc_sid=8024bb&_nc_ohc=8E7c4AutWWEAX96iram&_nc_ht=scontent-atl3-1.xx&tp=14&oh=f40d6cb5feb25f101e1f1bad6af2b5ed&oe=5F8210B8,122.0,,1340436506128981,Fosston School staff getting ready to deliver meals to our children!,https://facebook.com/story.php?story_fbid=1340436506128981&id=269120043260638,,0.0,Fosston School staff getting ready to deliver meals to our children!,2020-03-23 12:25:40,,
166,1.0,https://scontent-atl3-1.xx.fbcdn.net/v/t1.0-9/fr/cp0/e15/q65/90108969_1338806892958609_4243149911438131200_o.jpg?_nc_cat=111&_nc_sid=8024bb&_nc_ohc=TDqOHeAW0T4AX8nAhNr&_nc_ht=scontent-atl3-1.xx&tp=14&oh=19b6ad0c937d24e06c1edbc42e6a3e58&oe=5F834C7F,116.0,,1338807322958566,We love our Senior Class of 2020!,https://facebook.com/story.php?story_fbid=1338807322958566&id=269120043260638,,0.0,We love our Senior Class of 2020!,2020-03-21 12:33:12,,
167,13.0,https://scontent-atl3-1.xx.fbcdn.net/v/t1.0-9/fr/cp0/e15/q65/90253038_1338229463016352_4868139606593241088_n.jpg?_nc_cat=111&_nc_sid=8024bb&_nc_ohc=azm0LM9f8zMAX-65GuP&_nc_ht=scontent-atl3-1.xx&tp=14&oh=c803687461f268f83b9c73768dc01217&oe=5F842F38,117.0,,1338230266349605,"Congratulations to Faith Balstad, recipient of the Excel Award, sponsored by the Minnesota State High School League. She is one of 36 students in the state of Minnesota who was to be honored during half time of the girls AA championship game at Williams Arena in St. Paul on March 14th. The Excel Award recognizes an outstanding student for being an athlete, leader, honor student, involved in the Arts and who exhibits excellence in community service. We are so proud of you, Faith!",https://facebook.com/story.php?story_fbid=1338230266349605&id=269120043260638,,0.0,"Congratulations to Faith Balstad, recipient of the Excel Award, sponsored by the Minnesota State High School League. She is one of 36 students in the state of Minnesota who was to be honored during half time of the girls AA championship game at Williams Arena in St. Paul on March 14th. The Excel Award recognizes an outstanding student for being an athlete, leader, honor student, involved in the Arts and who exhibits excellence in community service. We are so proud of you, Faith!",2020-03-20 19:11:01,,
168,0.0,https://scontent-atl3-1.xx.fbcdn.net/v/t1.0-9/fr/cp0/e15/q65/90359819_1338044039701561_958146464310099968_n.jpg?_nc_cat=111&_nc_sid=110474&_nc_ohc=1UNSQjalIloAX_fu8pX&_nc_ht=scontent-atl3-1.xx&tp=14&oh=a83a87eec36724440dec64acef990d6b&oe=5F82FC0C,52.0,,1338044133034885,"Thank you, Fosston Ultima Bank for the beautiful flower bouquets! 💐🌹🥀🌷🌺🌸🏵️🌻🌼",https://facebook.com/story.php?story_fbid=1338044133034885&id=269120043260638,,0.0,"Thank you, Fosston Ultima Bank for the beautiful flower bouquets! 💐🌹🥀🌷🌺🌸🏵️🌻🌼",2020-03-20 14:08:05,,
169,5.0,https://scontent-atl3-1.xx.fbcdn.net/v/t1.0-9/fr/cp0/e15/q65/90330167_1338027379703227_122071517537239040_o.jpg?_nc_cat=109&_nc_sid=8024bb&_nc_ohc=h3GI1lr1oOoAX-zcw2-&_nc_ht=scontent-atl3-1.xx&tp=14&oh=25e197639f6a1f8d97fe9c0553111ca0&oe=5F83853F,110.0,,1338027523036546,ISD 601 Fosston Schools staff have meals ready to go to feed our children.,https://facebook.com/story.php?story_fbid=1338027523036546&id=269120043260638,,0.0,ISD 601 Fosston Schools staff have meals ready to go to feed our children.,2020-03-20 13:43:50,,
170,0.0,,15.0,,1337422803097018,"Are you ready for some fun, prizes, and Greyhound pride?",https://facebook.com/story.php?story_fbid=1337422803097018&id=269120043260638,"VITAL Fosston
March 19 at 5:04 PM ·

Calling all Greyhound Families!

We understand that these are uncertain times and that our children are feeling the stress. They’re missing their friends and the sense of community. We are determined to bring some light and fun to the situation.

VITAL is proud to present...Virtual Spirit Week!

This is a contest based on Facebook that is open to all students from Threeschool through 12th grade. Students who play along will be entered into drawings to win awesome prizes purchased here in town to support our local businesses.

Here’s how to play:

Each day, have your students dress up according to the theme. Snap a photo of your students and post it on Facebook - *MUST TAG @VITAL Fosston* on your post. That’s it!
** Earn an extra chance to win by liking the VITAL Facebook page and sharing this post! **

Winners will be announced on the VITAL Facebook page and in the Thirteen Towns.
Keep checking the VITAL Facebook page for more fun activities and contests while we are out of school.

Let’s show Covid-19 that it can’t keep the Greyhounds down! ️",6.0,"Are you ready for some fun, prizes, and Greyhound pride?

VITAL Fosston
March 19 at 5:04 PM ·

Calling all Greyhound Families!

We understand that these are uncertain times and that our children are feeling the stress. They’re missing their friends and the sense of community. We are determined to bring some light and fun to the situation.

VITAL is proud to present...Virtual Spirit Week!

This is a contest based on Facebook that is open to all students from Threeschool through 12th grade. Students who play along will be entered into drawings to win awesome prizes purchased here in town to support our local businesses.

Here’s how to play:

Each day, have your students dress up according to the theme. Snap a photo of your students and post it on Facebook - *MUST TAG @VITAL Fosston* on your post. That’s it!
** Earn an extra chance to win by liking the VITAL Facebook page and sharing this post! **

Winners will be announced on the VITAL Facebook page and in the Thirteen Towns.
Keep checking the VITAL Facebook page for more fun activities and contests while we are out of school.

Let’s show Covid-19 that it can’t keep the Greyhounds down! ️",2020-03-19 20:58:30,,
171,1.0,,44.0,,1335487153290583,,https://facebook.com/story.php?story_fbid=1335487153290583&id=269120043260638,,0.0,,2020-03-17 11:02:56,,
172,0.0,,6.0,,1334991946673437,"School Closure Emergency Workers Information Form for school planning during closure period.

Printable Forms can be found on the Fosston School District Website under Quick Links COVID-19 latest information and forms.",https://facebook.com/story.php?story_fbid=1334991946673437&id=269120043260638,,0.0,"School Closure Emergency Workers Information Form for school planning during closure period.

Printable Forms can be found on the Fosston School District Website under Quick Links COVID-19 latest information and forms.",2020-03-16 19:14:36,,
173,0.0,,26.0,,1334971786675453,Fosston Schools can provide breakfast and lunch to children ages 18 and under during the school closure. You must sign up ahead of time! Call Melissa at 218-435-6335.,https://facebook.com/story.php?story_fbid=1334971786675453&id=269120043260638,,0.0,Fosston Schools can provide breakfast and lunch to children ages 18 and under during the school closure. You must sign up ahead of time! Call Melissa at 218-435-6335.,2020-03-16 18:31:31,,
174,1.0,,43.0,,1333941203445178,,https://facebook.com/story.php?story_fbid=1333941203445178&id=269120043260638,,0.0,,2020-03-15 11:37:18,,
175,0.0,https://scontent-atl3-1.xx.fbcdn.net/v/t1.0-9/fr/cp0/e15/q65/90297966_1332479593591339_340955291598192640_n.jpg?_nc_cat=106&_nc_sid=8024bb&_nc_ohc=38NwFoAXom0AX-W5fu6&_nc_ht=scontent-atl3-1.xx&tp=14&oh=f2425a5b7e0aa7adad4e988fe4e530f5&oe=5F81F171,8.0,,1332479910257974,"The Region 8A Visual Arts Festival scheduled at Fosston High School for this Wednesday, March 18 has been postponed indefinitely.",https://facebook.com/story.php?story_fbid=1332479910257974&id=269120043260638,,0.0,"The Region 8A Visual Arts Festival scheduled at Fosston High School for this Wednesday, March 18 has been postponed indefinitely.",2020-03-13 13:06:06,,
176,15.0,,107.0,,1331103477062284,"A big congratulations to the Fosston High School Knowledge Bowl Team under the coaching of Ron Berntson. The team took 4th today at the Region tourney, and will advance to STATE competition, held on April 2 and 3 at Cragun's Resort! L to R: Dane Schoenborn, Jack Ubert, Harlee Bingham, Emma Olson, and Carl Johnson.",https://facebook.com/story.php?story_fbid=1331103477062284&id=269120043260638,,0.0,"A big congratulations to the Fosston High School Knowledge Bowl Team under the coaching of Ron Berntson. The team took 4th today at the Region tourney, and will advance to STATE competition, held on April 2 and 3 at Cragun's Resort! L to R: Dane Schoenborn, Jack Ubert, Harlee Bingham, Emma Olson, and Carl Johnson.",2020-03-11 17:30:15,,
177,0.0,https://scontent-atl3-1.xx.fbcdn.net/v/t1.0-9/fr/cp0/e15/q65/89116080_1330515990454366_9185474473795518464_o.jpg?_nc_cat=104&_nc_sid=8024bb&_nc_ohc=IC2LcNnOBxMAX-_nVmu&_nc_ht=scontent-atl3-1.xx&tp=14&oh=57eff3c0cd50ef1711b1c4ee7e6ae49a&oe=5F82B60D,53.0,,1330516087121023,"FHS Music Students participated in the Ensemble Contest at Mahnomen on Monday, March 9.",https://facebook.com/story.php?story_fbid=1330516087121023&id=269120043260638,,0.0,"FHS Music Students participated in the Ensemble Contest at Mahnomen on Monday, March 9.",2020-03-10 23:35:40,,
178,0.0,https://scontent-atl3-1.xx.fbcdn.net/v/t1.0-9/fr/cp0/e15/q65/89236277_1330040673835231_3873150101069234176_o.jpg?_nc_cat=107&_nc_sid=110474&_nc_ohc=5LYDRaqSgAMAX_4986I&_nc_ht=scontent-atl3-1.xx&tp=14&oh=1b638f1e26f51969eaf2f8787eddf83b&oe=5F83C0E8,3.0,,1330040697168562,"Magelssen Elementary Scholastic Book Fair
Schedule of Events:",https://facebook.com/story.php?story_fbid=1330040697168562&id=269120043260638,,0.0,"Magelssen Elementary Scholastic Book Fair
Schedule of Events:",2020-03-10 09:21:52,,
179,0.0,https://scontent-atl3-1.xx.fbcdn.net/v/t1.0-9/fr/cp0/e15/q65/88364025_1329291817243450_6000483201330446336_o.jpg?_nc_cat=107&_nc_sid=8024bb&_nc_ohc=lFUK_BhJVrIAX85QgRx&_nc_ht=scontent-atl3-1.xx&tp=14&oh=545ce702302cbac92ce6211e6841ea2c&oe=5F82F774,8.0,,1329291913910107,Happy Birthday this week to these high school students!,https://facebook.com/story.php?story_fbid=1329291913910107&id=269120043260638,,0.0,Happy Birthday this week to these high school students!,2020-03-09 10:11:14,,
180,0.0,https://scontent-atl3-1.xx.fbcdn.net/v/t1.0-9/fr/cp0/e15/q65/89774744_1329233180582647_7526616705166999552_n.jpg?_nc_cat=103&_nc_sid=110474&_nc_ohc=jDm9wfSipYwAX9fF5SV&_nc_ht=scontent-atl3-1.xx&tp=14&oh=d4e6e4145f99c2e1b5fed14c8e1014bf&oe=5F8386BE,63.0,,1329235447249087,The Magelssen Elementary Breakfast Buddies Book Fair Kickoff! 🍩📚,https://facebook.com/story.php?story_fbid=1329235447249087&id=269120043260638,,0.0,The Magelssen Elementary Breakfast Buddies Book Fair Kickoff! 🍩📚,2020-03-09 09:18:49,,
181,0.0,https://scontent-atl3-1.xx.fbcdn.net/v/t1.0-9/fr/cp0/e15/q65/87480494_1327052487467383_3314837398067609600_n.jpg?_nc_cat=106&_nc_sid=110474&_nc_ohc=Br09suUcpjkAX8cJmyc&_nc_ht=scontent-atl3-1.xx&tp=14&oh=906680f3d2033689bb1c5f49826b1bdc&oe=5F835F51,33.0,,1327053937467238,"Cat in the Hat Day! 🎩🧢👑🎓

Today you are YOU, that is truer than true. There is NO ONE alive who is YOUER than YOU! ~ Dr. Seuss",https://facebook.com/story.php?story_fbid=1327053937467238&id=269120043260638,,0.0,"Cat in the Hat Day! 🎩🧢👑🎓

Today you are YOU, that is truer than true. There is NO ONE alive who is YOUER than YOU! ~ Dr. Seuss",2020-03-06 10:08:12,,
182,0.0,https://scontent-atl3-1.xx.fbcdn.net/v/t1.0-9/fr/cp0/e15/q65/87475895_1326325210873444_8338895411406176256_n.jpg?_nc_cat=111&_nc_sid=110474&_nc_ohc=Dngxlza9t3wAX80HX-X&_nc_ht=scontent-atl3-1.xx&tp=14&oh=b6ede3ce6c868670c8e587f3b127188d&oe=5F810EF9,59.0,,1326326457539986,The weather outside is dreary... It makes us all a little 'Sleepy' at Magelssen Elementary! 😴🌧️❄️,https://facebook.com/story.php?story_fbid=1326326457539986&id=269120043260638,,0.0,The weather outside is dreary... It makes us all a little 'Sleepy' at Magelssen Elementary! 😴🌧️❄️,2020-03-05 11:05:22,,
183,0.0,,57.0,,1325556034283695,"These guys are Awemakers! Matt Radtke, Jacob Gutterud, and Evan Chalich all gave blood today at the Student Council Blood Drive!",https://facebook.com/story.php?story_fbid=1325556034283695&id=269120043260638,,0.0,"These guys are Awemakers! Matt Radtke, Jacob Gutterud, and Evan Chalich all gave blood today at the Student Council Blood Drive!",2020-03-04 11:18:18,,
184,0.0,https://scontent-atl3-1.xx.fbcdn.net/v/t1.0-9/fr/cp0/e15/q65/87328073_1325488880957077_6329186729349611520_n.jpg?_nc_cat=101&_nc_sid=110474&_nc_ohc=ifvW0TcJjO4AX9iDwkj&_nc_ht=scontent-atl3-1.xx&tp=14&oh=4a8188595a4108728c38314a9513bfea&oe=5F84765B,73.0,,1325490037623628,We've gone a little 'Wacky' at Magelssen Elementary! 🤪,https://facebook.com/story.php?story_fbid=1325490037623628&id=269120043260638,,0.0,We've gone a little 'Wacky' at Magelssen Elementary! 🤪,2020-03-04 09:36:26,,
185,0.0,https://scontent-atl3-1.xx.fbcdn.net/v/t1.0-9/fr/cp0/e15/q65/87736590_1321684654670833_1030293449502359552_n.jpg?_nc_cat=101&_nc_sid=8024bb&_nc_ohc=jbqgwDt7FDwAX_Z8TOv&_nc_ht=scontent-atl3-1.xx&tp=14&oh=a2e9c22f4402d6f109635233b642af3b&oe=5F81A741,7.0,,1321687498003882,"We are so excited for the Magelssen Elementary Scholastic Book Fair and we hope you are as well! The Book Fair starts Monday, March 9th.

Spend $20.00 or purchase a book for a classroom, and receive this FREE book bag. One bag per customer. While supplies last.",https://facebook.com/story.php?story_fbid=1321687498003882&id=269120043260638,,0.0,"We are so excited for the Magelssen Elementary Scholastic Book Fair and we hope you are as well! The Book Fair starts Monday, March 9th.

Spend $20.00 or purchase a book for a classroom, and receive this FREE book bag. One bag per customer. While supplies last.",2020-03-04 08:30:46,,
186,1.0,https://scontent-atl3-1.xx.fbcdn.net/v/t1.0-9/fr/cp0/e15/q65/88011733_1325079080998057_7863070527441600512_o.jpg?_nc_cat=100&_nc_sid=8024bb&_nc_ohc=R2B1k7l9uhkAX8k2lqU&_nc_ht=scontent-atl3-1.xx&tp=14&oh=502bc3d5a4ed9d2deed8bcc1c216a6a7&oe=5F81DADD,52.0,,1325079240998041,Staff and community members practiced with the Knowledge Bowl team on Tuesday morning in preparation for their upcoming tournament play. A friendly little competition...😊,https://facebook.com/story.php?story_fbid=1325079240998041&id=269120043260638,,0.0,Staff and community members practiced with the Knowledge Bowl team on Tuesday morning in preparation for their upcoming tournament play. A friendly little competition...😊,2020-03-03 20:27:30,,
187,1.0,,31.0,,1325073177665314,Thanks to the Pep Band -- they sounded great at the Girls Basketball tournament game at the Ralph on Monday night!,,,0.0,Thanks to the Pep Band -- they sounded great at the Girls Basketball tournament game at the Ralph on Monday night!,2020-03-03 20:15:14,https://video-atl3-1.xx.fbcdn.net/v/t42.9040-2/87866164_340338576883884_3420827338277912576_n.mp4?_nc_cat=110&_nc_sid=985c63&efg=eyJ2ZW5jb2RlX3RhZyI6ImxlZ2FjeV9zZCJ9&_nc_ohc=lofn1W_-yj4AX_Mcb_A&_nc_ht=video-atl3-1.xx&oh=fba342cb7f13b79a7f2c6b10ddd5ab59&oe=5F5D1D3C,
188,0.0,https://scontent-atl3-1.xx.fbcdn.net/v/t1.0-9/fr/cp0/e15/q65/87045179_1324865167686115_2497920917422735360_n.jpg?_nc_cat=107&_nc_sid=110474&_nc_ohc=Bo_LVL1vXZcAX97APIu&_nc_ht=scontent-atl3-1.xx&tp=14&oh=25e814dc89342cae4777dca755fa6adf&oe=5F8415B1,39.0,,1324865607686071,It's Green Eggs and Ham Day at Magelssen Elementary!💚🍳💚🍖💚,https://facebook.com/story.php?story_fbid=1324865607686071&id=269120043260638,,0.0,It's Green Eggs and Ham Day at Magelssen Elementary!💚🍳💚🍖💚,2020-03-03 13:12:01,,
189,5.0,,48.0,,1324852234354075,"Magelssen Elementary February Students of the Month:

Front Row: Kelby M, Emma H, Jayden J, Kamron A, Adelynn J, Isabella P

Back Row: Ronnie J, Livia B, Darien H, Lewis J, Rylan G, Gavin C, Max U *Not pictured: Jillian B",https://facebook.com/story.php?story_fbid=1324852234354075&id=269120043260638,,0.0,"Magelssen Elementary February Students of the Month:

Front Row: Kelby M, Emma H, Jayden J, Kamron A, Adelynn J, Isabella P

Back Row: Ronnie J, Livia B, Darien H, Lewis J, Rylan G, Gavin C, Max U *Not pictured: Jillian B",2020-03-03 12:48:53,,
190,0.0,https://scontent-atl3-1.xx.fbcdn.net/v/t1.0-9/fr/cp0/e15/q65/88001448_2751334181587748_7569799599146139648_o.jpg?_nc_cat=109&_nc_sid=8024bb&_nc_ohc=tX5P75kx19EAX-TuIfD&_nc_ht=scontent-atl3-1.xx&tp=14&oh=ef1a7ab6729c1960f0f731fab0d83ff0&oe=5F81047C,5.0,,1324195957753036,,https://facebook.com/story.php?story_fbid=1324195957753036&id=269120043260638,"Fosston Greyhounds
March 2 at 1:43 PM ·

There will be a welcome home reception/open house for our two State Wrestling Participants Carter Sorenson and Dane Schoenborn tomorrow (TUESDAY) after school in the High School Library. Please stop by and Congratulate Dane and Carter between 3:30 and 4:30, Cake and Lemonade will be served. #FosstonProud",0.0,"Fosston Greyhounds
March 2 at 1:43 PM ·

There will be a welcome home reception/open house for our two State Wrestling Participants Carter Sorenson and Dane Schoenborn tomorrow (TUESDAY) after school in the High School Library. Please stop by and Congratulate Dane and Carter between 3:30 and 4:30, Cake and Lemonade will be served. #FosstonProud",2020-03-02 15:52:59,,
191,2.0,https://scontent-atl3-1.xx.fbcdn.net/v/t1.0-9/fr/cp0/e15/q65/87987212_1324092161096749_8501971638848323584_o.jpg?_nc_cat=110&_nc_sid=8024bb&_nc_ohc=D6ahrYxhcE8AX8q6chh&_nc_ht=scontent-atl3-1.xx&tp=14&oh=012e228c0218adb87d84988382750062&oe=5F821412,56.0,,1324092271096738,"Pictured here is Student Council Advisor Kristen Perry with over 1,100 PAIRS OF NEW SOCKS from the Student Council Sock Drive! The Seniors took first place in the competition, with the 8th graders coming in second. Thanks to ALL who contributed the socks, which will be delivered to a Women's Shelter and Homeless Shelter in the area.",https://facebook.com/story.php?story_fbid=1324092271096738&id=269120043260638,,0.0,"Pictured here is Student Council Advisor Kristen Perry with over 1,100 PAIRS OF NEW SOCKS from the Student Council Sock Drive! The Seniors took first place in the competition, with the 8th graders coming in second. Thanks to ALL who contributed the socks, which will be delivered to a Women's Shelter and Homeless Shelter in the area.",2020-03-02 12:42:32,,
192,0.0,https://scontent-atl3-1.xx.fbcdn.net/v/t1.0-9/fr/cp0/e15/q65/87887939_1324021644437134_6998454221611728896_n.jpg?_nc_cat=101&_nc_sid=110474&_nc_ohc=YlQ12vPzUbQAX_xoVyG&_nc_ht=scontent-atl3-1.xx&tp=14&oh=267b4f0ef83f304f1bd8fdccf96bd3ef&oe=5F83F6D4,35.0,,1324022201103745,"Happy Birthday, Dr Seuss from Magelssen Elementary! Celebrating with some crazy socks! 🧦🎉🧦",https://facebook.com/story.php?story_fbid=1324022201103745&id=269120043260638,,0.0,"Happy Birthday, Dr Seuss from Magelssen Elementary! Celebrating with some crazy socks! 🧦🎉🧦",2020-03-02 10:57:33,,
193,0.0,https://scontent-atl3-1.xx.fbcdn.net/v/t1.0-9/fr/cp0/e15/q65/87898005_1323560237816608_2652910352806707200_o.jpg?_nc_cat=101&_nc_sid=8024bb&_nc_ohc=ROv9awiJ7lMAX9Eglin&_nc_ht=scontent-atl3-1.xx&tp=14&oh=7d7e01f5c9e0917cb6949f01b7a12164&oe=5F8133AD,8.0,,1323560277816604,,https://facebook.com/story.php?story_fbid=1323560277816604&id=269120043260638,,0.0,,2020-03-01 19:51:16,,
194,1.0,https://scontent-atl3-1.xx.fbcdn.net/v/t1.0-9/fr/cp0/e15/q65/89030339_2748086868579146_2647436524362137600_o.jpg?_nc_cat=106&_nc_sid=110474&_nc_ohc=o0uOGxh9OgwAX-K5b5Q&_nc_ht=scontent-atl3-1.xx&tp=14&oh=50be550f0e3d20101e19e9e815723285&oe=5F80D259,18.0,,1323268984512400,"Congratulations, Carter!",https://facebook.com/story.php?story_fbid=1323268984512400&id=269120043260638,"Fosston Greyhounds
March 1 at 12:06 AM ·

Carter Sorenson earned a spot on the podium for the second straight season at the State Wrestling Tournament. Last year a 6th place finish, this year 3rd! Sorenson finished the 2019-2020 campaign with a 51-2 record.",0.0,"Congratulations, Carter!

Fosston Greyhounds
March 1 at 12:06 AM ·

Carter Sorenson earned a spot on the podium for the second straight season at the State Wrestling Tournament. Last year a 6th place finish, this year 3rd! Sorenson finished the 2019-2020 campaign with a 51-2 record.",2020-03-01 11:00:27,,
195,0.0,,35.0,,1322128121293153,The Cha Cha Slide at the FHS Dance!,,,0.0,The Cha Cha Slide at the FHS Dance!,2020-02-28 23:54:11,https://video-atl3-1.xx.fbcdn.net/v/t42.9040-2/87978207_191629352107953_2444889538879815680_n.mp4?_nc_cat=106&_nc_sid=985c63&efg=eyJ2ZW5jb2RlX3RhZyI6ImxlZ2FjeV9zZCJ9&_nc_ohc=O90mx1VieXcAX8S41v8&_nc_ht=video-atl3-1.xx&oh=73ef1bc764209ca854fe5b1147a62cc5&oe=5F5D2056,
