,comments,image,likes,link,post_id,post_text,post_url,shared_text,shares,text,time,video,video_thumbnail
30,0.0,https://scontent-atl3-1.xx.fbcdn.net/v/t1.0-9/fr/cp0/e15/q65/99426851_1385464754959489_7898324924677226496_n.jpg?_nc_cat=110&_nc_sid=8024bb&_nc_ohc=5BbSuCBDsBQAX_ZPBmz&_nc_ht=scontent-atl3-1.xx&tp=14&oh=9d523a1f9af917b5fc43f23c112b6d7b&oe=5F842610,25.0,,1385465011626130,"Hello Senior Families,

This is Principal Krump with a Graduation Update.

The Caulfield photo for seniors on May 20th has been cancelled. We will be contacting families to schedule cap and gown pick up for June. When graduates pick up their caps and gowns, a photographer will be onsite to take pictures. It is our hope to have parents give diplomas to their child on material pick-up day. We will record this as part of the graduation video, and we will share the video with graduates and families. Graduation will be June 13th at 2:00 pm. Due to graduation guidelines set by the governor and Department of Education, we will be using the seniors' second choice, a parade-style graduation. Once our plan is finalized, we will share the date and times for material pick up, parade guidelines, and ceremony recordings. I thank families and graduates for their patience and understanding as we plan to give you the best possible graduation ceremony. Our ceremony may have changed, but the hopes, dreams, and well wishes for our graduates have not. Thank you!",https://facebook.com/story.php?story_fbid=1385465011626130&id=269120043260638,,0.0,"Hello Senior Families,

This is Principal Krump with a Graduation Update.

The Caulfield photo for seniors on May 20th has been cancelled. We will be contacting families to schedule cap and gown pick up for June. When graduates pick up their caps and gowns, a photographer will be onsite to take pictures. It is our hope to have parents give diplomas to their child on material pick-up day. We will record this as part of the graduation video, and we will share the video with graduates and families. Graduation will be June 13th at 2:00 pm. Due to graduation guidelines set by the governor and Department of Education, we will be using the seniors' second choice, a parade-style graduation. Once our plan is finalized, we will share the date and times for material pick up, parade guidelines, and ceremony recordings. I thank families and graduates for their patience and understanding as we plan to give you the best possible graduation ceremony. Our ceremony may have changed, but the hopes, dreams, and well wishes for our graduates have not. Thank you!",2020-05-18 22:29:10,,
31,42.0,https://scontent-atl3-1.xx.fbcdn.net/v/t1.0-9/fr/cp0/e15/q65/97719773_1383751158464182_8133416599643226112_n.jpg?_nc_cat=104&_nc_sid=8024bb&_nc_ohc=g_uY-3D3NvwAX9qU1KG&_nc_ht=scontent-atl3-1.xx&tp=14&oh=95e96e09b5a8adb90011555ac9408b92&oe=5F8405BC,232.0,,1383751318464166,Congratulations to Mr. Russ Bly on his retirement from Fosston High School. Thank you for your many years of dedicated service to our students! We will miss you!,https://facebook.com/story.php?story_fbid=1383751318464166&id=269120043260638,,0.0,Congratulations to Mr. Russ Bly on his retirement from Fosston High School. Thank you for your many years of dedicated service to our students! We will miss you!,2020-05-16 22:41:30,,
32,49.0,https://scontent-atl3-1.xx.fbcdn.net/v/t1.0-9/fr/cp0/e15/q65/97256660_1383746101798021_3952795515044757504_n.jpg?_nc_cat=105&_nc_sid=8024bb&_nc_ohc=QbqjX5hyRgQAX8BG1hh&_nc_oc=AQn4eUh2RTUmwPybMVXypGYoX-eqQ5eurpP3Pf8maepaBdEw8PUo8l1hSa79WGeKMz8&_nc_ht=scontent-atl3-1.xx&tp=14&oh=2864c43c26eb67764bd7b7aad471f216&oe=5F8458BA,253.0,,1383746681797963,Congratulations to Mr. Nathan Fultz on his retirement from Fosston High School. Your work and dedication are greatly appreciated. We will miss you!,https://facebook.com/story.php?story_fbid=1383746681797963&id=269120043260638,,0.0,Congratulations to Mr. Nathan Fultz on his retirement from Fosston High School. Your work and dedication are greatly appreciated. We will miss you!,2020-05-16 22:35:09,,
33,32.0,https://scontent-atl3-1.xx.fbcdn.net/v/t1.0-9/fr/cp0/e15/q65/97797006_1383313148507983_45045385072214016_o.jpg?_nc_cat=104&_nc_sid=8024bb&_nc_ohc=3daxDvcM8KoAX_fLvjw&_nc_ht=scontent-atl3-1.xx&tp=14&oh=4e4bd78a3f434c96fa8a50fda486b98c&oe=5F823F65,183.0,,1383744915131473,Congratulations to Mr. Jacobson on his retirement! Thank you for your years of service and dedication to so many elementary students! We will miss you!,https://facebook.com/story.php?story_fbid=1383744915131473&id=269120043260638,,0.0,Congratulations to Mr. Jacobson on his retirement! Thank you for your years of service and dedication to so many elementary students! We will miss you!,2020-05-16 22:32:52,,
34,12.0,,77.0,,1382066565299308,"Happy Retirement, Mr. J from the Magelssen Elementary Staff! You will be missed by many!! 🥰",,,0.0,"Happy Retirement, Mr. J from the Magelssen Elementary Staff! You will be missed by many!! 🥰",2020-05-14 21:20:34,https://video-atl3-1.xx.fbcdn.net/v/t42.9040-2/96371320_2620133931598679_7171567864934039552_n.mp4?_nc_cat=100&_nc_sid=985c63&efg=eyJ2ZW5jb2RlX3RhZyI6ImxlZ2FjeV9zZCJ9&_nc_ohc=JfNovBtaJ7IAX8lJV2P&_nc_ht=video-atl3-1.xx&oh=35477fdfab9fd527620351e71d257037&oe=5F5D1EE7,
35,0.0,https://scontent-atl3-1.xx.fbcdn.net/v/t1.0-9/fr/cp0/e15/q65/96795109_1381897815316183_8188556330387111936_n.jpg?_nc_cat=108&_nc_sid=8024bb&_nc_ohc=QCwhzmDmJesAX8Q2yj4&_nc_ht=scontent-atl3-1.xx&tp=14&oh=cf7d549bf9f85482219ed371b22d6d4c&oe=5F82534A,21.0,,1381898278649470,Magelssen Elementary 2019-2020 Yearbooks,https://facebook.com/story.php?story_fbid=1381898278649470&id=269120043260638,,0.0,Magelssen Elementary 2019-2020 Yearbooks,2020-05-14 16:00:09,,
36,0.0,,36.0,,1381080102064621,,https://facebook.com/story.php?story_fbid=1381080102064621&id=269120043260638,,0.0,,2020-05-13 14:27:17,,
37,13.0,https://scontent-atl3-1.xx.fbcdn.net/v/t1.0-9/fr/cp0/e15/q65/97458271_1381018255404139_1693300021908209664_o.jpg?_nc_cat=108&_nc_sid=8024bb&_nc_ohc=_0Axo1MXtJcAX-p6tqT&_nc_ht=scontent-atl3-1.xx&tp=14&oh=cfdd5a4b72a998c26e49f61f9cf973d1&oe=5F827EE9,73.0,,1381018808737417,,https://facebook.com/story.php?story_fbid=1381018808737417&id=269120043260638,,0.0,,2020-05-13 12:39:21,,
38,3.0,https://scontent-atl3-1.xx.fbcdn.net/v/t1.0-9/fr/cp0/e15/q65/96685942_1380443622128269_818944164770086912_n.jpg?_nc_cat=108&_nc_sid=110474&_nc_ohc=QGq9pLv-3s8AX_LeFxb&_nc_ht=scontent-atl3-1.xx&tp=14&oh=64f77f2b58eca6de86ffd3100cc346eb&oe=5F80E939,81.0,,1380443835461581,Move out day at Magelssen Elementary!,https://facebook.com/story.php?story_fbid=1380443835461581&id=269120043260638,,0.0,Move out day at Magelssen Elementary!,2020-05-12 19:06:08,,
39,10.0,https://scontent-atl3-1.xx.fbcdn.net/v/t1.0-9/fr/cp0/e15/q65/97441343_1380441788795119_5630311480600559616_n.jpg?_nc_cat=102&_nc_sid=110474&_nc_ohc=hZn2mkp3NtIAX-IAClR&_nc_oc=AQlvhAvEFC9Qyfd6cJiTS9srky6TnsUQkynXsF4Tre5My_jQV-k1IX8IWy10B_sSifE&_nc_ht=scontent-atl3-1.xx&tp=14&oh=b4c9a6731c51a85380b8d2de3705f41e&oe=5F81071F,125.0,,1380441862128445,"Mr. Boushee was presented the Certificate of Outstanding Achievement in the COVID-19/Distance Learning/Construction & Moving Project from the Magelssen Elementary Staff. Thank you for navigating us through these last 8 weeks while juggling a very full plate, but continuing to push us to finish the school year strong! 💪🏆",https://facebook.com/story.php?story_fbid=1380441862128445&id=269120043260638,,0.0,"Mr. Boushee was presented the Certificate of Outstanding Achievement in the COVID-19/Distance Learning/Construction & Moving Project from the Magelssen Elementary Staff. Thank you for navigating us through these last 8 weeks while juggling a very full plate, but continuing to push us to finish the school year strong! 💪🏆",2020-05-12 19:01:58,,
40,37.0,https://scontent-atl3-1.xx.fbcdn.net/v/t1.0-9/fr/cp0/e15/q65/98036344_1380357822136849_4729168316164210688_o.jpg?_nc_cat=107&_nc_sid=8024bb&_nc_ohc=_Gry5rWKRgUAX9-vnH6&_nc_ht=scontent-atl3-1.xx&tp=14&oh=55423b37b27eb514ef9bf56df978d643&oe=5F8290D4,138.0,,1380357898803508,"Congratulations to Jayson Osmonson, selected for the 2020 Minnesota Music Educators All-State Mixed Choir! Jayson will perform as a Bass I at Orchestra Hall in February.",https://facebook.com/story.php?story_fbid=1380357898803508&id=269120043260638,,0.0,"Congratulations to Jayson Osmonson, selected for the 2020 Minnesota Music Educators All-State Mixed Choir! Jayson will perform as a Bass I at Orchestra Hall in February.",2020-05-12 16:06:58,,
41,5.0,,63.0,,1380344955471469,Congratulations to the Fosston High School Class of 2020 Scholarship winners!,,,0.0,Congratulations to the Fosston High School Class of 2020 Scholarship winners!,2020-05-12 15:46:32,https://video-atl3-1.xx.fbcdn.net/v/t42.9040-2/10000000_174231470549688_307743275865866240_n.mp4?_nc_cat=102&_nc_sid=985c63&efg=eyJ2ZW5jb2RlX3RhZyI6ImxlZ2FjeV9zZCJ9&_nc_ohc=P0idx0IyXycAX-H1_wn&_nc_ht=video-atl3-1.xx&oh=ec548cd937c4366512843d159626b718&oe=5F5D1CDE,
42,0.0,https://scontent-atl3-1.xx.fbcdn.net/v/t1.0-9/fr/cp0/e15/q65/96519577_1380136822158949_3656568867565600768_o.jpg?_nc_cat=108&_nc_sid=8024bb&_nc_ohc=fD0ZDTY6m2YAX8W6vfL&_nc_ht=scontent-atl3-1.xx&tp=14&oh=00e725b3b0495d51afd0c9d8a5c45069&oe=5F82C6F1,48.0,,1380138568825441,"We Are Here! FHS Students are to drop off all textbooks, school laptops, band instruments and folders TODAY, May 12, from 7:00 am to 5:30 pm. Pick up your yearbooks today if your ordered one. There is a limited number of books for sale at $45 on a first-come, first-serve basis. Drive to the North Foyer curb!",https://facebook.com/story.php?story_fbid=1380138568825441&id=269120043260638,,0.0,"We Are Here! FHS Students are to drop off all textbooks, school laptops, band instruments and folders TODAY, May 12, from 7:00 am to 5:30 pm. Pick up your yearbooks today if your ordered one. There is a limited number of books for sale at $45 on a first-come, first-serve basis. Drive to the North Foyer curb!",2020-05-12 10:08:11,,
43,18.0,,86.0,,1377174655788499,"Congratulations to Mr. McWilliam, the recipient of the 2020 Yearbook Dedication!",,,0.0,"Congratulations to Mr. McWilliam, the recipient of the 2020 Yearbook Dedication!",2020-05-08 14:43:11,https://video-atl3-1.xx.fbcdn.net/v/t42.9040-2/95426504_236895567377969_3514118344389165056_n.mp4?_nc_cat=103&_nc_sid=985c63&efg=eyJ2ZW5jb2RlX3RhZyI6ImxlZ2FjeV9zZCJ9&_nc_ohc=iEHS6kxiwMEAX9NCbEC&_nc_ht=video-atl3-1.xx&oh=22ff73d9868b9b2cee13c387d3926b82&oe=5F5D1F4C,
44,6.0,https://scontent-atl3-1.xx.fbcdn.net/v/t1.0-9/fr/cp0/e15/q65/96356541_1376985289140769_2498209487685419008_o.jpg?_nc_cat=101&_nc_sid=8024bb&_nc_ohc=ccez52NpkrAAX_LPquW&_nc_ht=scontent-atl3-1.xx&tp=14&oh=da35b47b80a77b9d23cc3efae9ddc47b&oe=5F817204,84.0,,1376985342474097,"Each day, we will be honoring our graduating seniors from the Class of 2020!",https://facebook.com/story.php?story_fbid=1376985342474097&id=269120043260638,,0.0,"Each day, we will be honoring our graduating seniors from the Class of 2020!",2020-05-08 10:13:18,,
45,21.0,https://scontent-atl3-1.xx.fbcdn.net/v/t1.0-9/fr/cp0/e15/q65/96827019_1376984812474150_4998924182549954560_o.jpg?_nc_cat=111&_nc_sid=8024bb&_nc_ohc=4X7k6jGeoJwAX8qhsAt&_nc_ht=scontent-atl3-1.xx&tp=14&oh=48429c3c66f762d66331acc3fa49ce3f&oe=5F80B2F0,125.0,,1376984859140812,"Each day, we will be honoring our graduating seniors from the Class of 2020!",https://facebook.com/story.php?story_fbid=1376984859140812&id=269120043260638,,0.0,"Each day, we will be honoring our graduating seniors from the Class of 2020!",2020-05-08 10:12:52,,
46,0.0,https://scontent-atl3-1.xx.fbcdn.net/v/t1.0-9/fr/cp0/e15/q65/96412221_1376285422544089_1809022654363992064_o.jpg?_nc_cat=110&_nc_sid=110474&_nc_ohc=O9kczlauXeEAX91uack&_nc_ht=scontent-atl3-1.xx&tp=14&oh=f2a6670c35b5f37776c882683fe43674&oe=5F8420CB,41.0,,1376285459210752,Mrs. Macy's 1st Grade Zoom Meeting. Ms. Ellen joined us last night! We did a scavenger hunt and one of the treasures was to go find their favorite book. 🥰,https://facebook.com/story.php?story_fbid=1376285459210752&id=269120043260638,,0.0,Mrs. Macy's 1st Grade Zoom Meeting. Ms. Ellen joined us last night! We did a scavenger hunt and one of the treasures was to go find their favorite book. 🥰,2020-05-07 11:55:49,,
47,0.0,https://scontent-atl3-1.xx.fbcdn.net/v/t1.0-9/fr/cp0/e15/q65/95608391_1375470689292229_6654975997504389120_o.jpg?_nc_cat=109&_nc_sid=8024bb&_nc_ohc=UD0qjObDJq0AX-L32ax&_nc_ht=scontent-atl3-1.xx&tp=14&oh=057a0e90e07d0a28e82ecc69a2fbde22&oe=5F835801,18.0,,1375474885958476,"IMPORTANT INFORMATION ABOUT HIGH SCHOOL TURN-IN DAY! Students are asked to turn in all school materials at the high school next Tuesday, May 12. The hours will be from 7:00 am to 5:30 pm. This will be a drive-through hand in. Please stay in your car, and we will meet you with instructions.

WHAT TO TURN IN: Your school computers, all textbooks, band instruments you have rented, school-owned calculators, and library books.

YOU WILL ALSO PICK UP YOUR YEARBOOK AT THIS TIME. There are a small number of extra books available for sale at $45 each on a first-come, first-serve basis, if you have not purchased one. If you have any questions about whether you ordered one, please contact Mrs. Mary Hanson at mhanson@fosston.k12.mn.us.

IN ADDITION, all student work needs to be turned in by May 12th.",https://facebook.com/story.php?story_fbid=1375474885958476&id=269120043260638,,0.0,"IMPORTANT INFORMATION ABOUT HIGH SCHOOL TURN-IN DAY! Students are asked to turn in all school materials at the high school next Tuesday, May 12. The hours will be from 7:00 am to 5:30 pm. This will be a drive-through hand in. Please stay in your car, and we will meet you with instructions.

WHAT TO TURN IN: Your school computers, all textbooks, band instruments you have rented, school-owned calculators, and library books.

YOU WILL ALSO PICK UP YOUR YEARBOOK AT THIS TIME. There are a small number of extra books available for sale at $45 each on a first-come, first-serve basis, if you have not purchased one. If you have any questions about whether you ordered one, please contact Mrs. Mary Hanson at mhanson@fosston.k12.mn.us.

IN ADDITION, all student work needs to be turned in by May 12th.",2020-05-06 11:05:38,,
48,0.0,,47.0,,1375451605960804,Graduation update: The Commencement Ceremony has been moved to June 13th at 2:00 PM. More details have been emailed to Seniors and their parents.,https://facebook.com/story.php?story_fbid=1375451605960804&id=269120043260638,,0.0,Graduation update: The Commencement Ceremony has been moved to June 13th at 2:00 PM. More details have been emailed to Seniors and their parents.,2020-05-06 10:26:24,,
49,4.0,,24.0,https://youtu.be/JoXO8xVfkCY,1374939479345350,"We are so proud of how our early childhood and elementary students took on Distance Learning. Thank you students, parents, and caregivers for your hard work, perseverance and dedication to learning. Please enjoy the video from the Magelssen Elementary family. We're Better Together! We miss you! 🥰

https://youtu.be/JoXO8xVfkCY",https://facebook.com/story.php?story_fbid=1374939479345350&id=269120043260638,"YOUTUBE.COM
Magelssen Elementary: We're Better Together",23.0,"We are so proud of how our early childhood and elementary students took on Distance Learning. Thank you students, parents, and caregivers for your hard work, perseverance and dedication to learning. Please enjoy the video from the Magelssen Elementary family. We're Better Together! We miss you! 🥰

https://youtu.be/JoXO8xVfkCY

YOUTUBE.COM
Magelssen Elementary: We're Better Together",2020-05-05 17:00:59,,
50,0.0,https://scontent-atl3-1.xx.fbcdn.net/v/t1.0-9/fr/cp0/e15/q65/95263279_1374920709347227_4330868897562492928_o.jpg?_nc_cat=100&_nc_sid=110474&_nc_ohc=Av9AUPPmHNsAX_N-UsE&_nc_ht=scontent-atl3-1.xx&tp=14&oh=6eb5cb403a7102f0aa063053f51548ce&oe=5F827326,41.0,,1374920726013892,"A special, ""Thank You"" to all those that had a part in donating & providing the pizza lunch and the delicious coffee & treats to the Fosston School District teachers & staff. Thank you, from the bottom of our hearts! 🥰",https://facebook.com/story.php?story_fbid=1374920726013892&id=269120043260638,,0.0,"A special, ""Thank You"" to all those that had a part in donating & providing the pizza lunch and the delicious coffee & treats to the Fosston School District teachers & staff. Thank you, from the bottom of our hearts! 🥰",2020-05-05 16:13:00,,
51,0.0,https://scontent-atl3-1.xx.fbcdn.net/v/t1.0-9/fr/cp0/e15/q65/95688407_1374877802684851_3320629840071098368_o.jpg?_nc_cat=108&_nc_sid=110474&_nc_ohc=ZKdJDhicVycAX8jNEXD&_nc_ht=scontent-atl3-1.xx&tp=14&oh=e178f4a1693a0b43326833bfbbfdff2c&oe=5F8344AF,49.0,,1374877822684849,Ms. Amanda is missing her speech/language students. Postcards are in the mail! 🥰,https://facebook.com/story.php?story_fbid=1374877822684849&id=269120043260638,,0.0,Ms. Amanda is missing her speech/language students. Postcards are in the mail! 🥰,2020-05-05 14:52:21,,
52,0.0,https://scontent-atl3-1.xx.fbcdn.net/v/t1.0-9/fr/cp0/e15/q65/95963348_1374802299359068_5471505335413899264_n.jpg?_nc_cat=107&_nc_sid=8024bb&_nc_ohc=xWDs2q52KCMAX_1sRzW&_nc_ht=scontent-atl3-1.xx&tp=14&oh=78142e6a4c7de2f5c131a23854bc504c&oe=5F83F660,17.0,,1374803532692278,"Magelssen Elementary-Final Packet Return Date:
Please remember to also return any classroom textbooks and library books with your last packet.",https://facebook.com/story.php?story_fbid=1374803532692278&id=269120043260638,,0.0,"Magelssen Elementary-Final Packet Return Date:
Please remember to also return any classroom textbooks and library books with your last packet.",2020-05-05 12:53:02,,
53,13.0,https://scontent-atl3-1.xx.fbcdn.net/v/t1.0-9/fr/cp0/e15/q65/95641498_1374782492694382_3197069364746518528_o.jpg?_nc_cat=102&_nc_sid=8024bb&_nc_ohc=YuCc3bWUPPYAX_l1xaE&_nc_ht=scontent-atl3-1.xx&tp=14&oh=97ddfba3b5073614f8a2b2f7ee8307c4&oe=5F836EDA,110.0,,1374782539361044,"Each day, we will be honoring our graduating seniors from the Class of 2020!",https://facebook.com/story.php?story_fbid=1374782539361044&id=269120043260638,,0.0,"Each day, we will be honoring our graduating seniors from the Class of 2020!",2020-05-05 12:14:01,,
54,0.0,https://scontent-atl3-1.xx.fbcdn.net/v/t1.0-9/fr/cp0/e15/q65/95922440_1374782219361076_3526140580620926976_o.jpg?_nc_cat=103&_nc_sid=8024bb&_nc_ohc=EJ_kl1XlnfUAX9UN3mJ&_nc_ht=scontent-atl3-1.xx&tp=14&oh=1712768190b4c9c738b481142f8b1245&oe=5F82B11C,66.0,,1374782312694400,"Each day, we will be honoring our graduating seniors from the Class of 2020!",https://facebook.com/story.php?story_fbid=1374782312694400&id=269120043260638,,0.0,"Each day, we will be honoring our graduating seniors from the Class of 2020!",2020-05-05 12:13:41,,
55,8.0,https://scontent-atl3-1.xx.fbcdn.net/v/t1.0-9/fr/cp0/e15/q65/95602691_1374782016027763_6287622724508450816_o.jpg?_nc_cat=111&_nc_sid=8024bb&_nc_ohc=kyosuxY50t0AX8IP2GE&_nc_ht=scontent-atl3-1.xx&tp=14&oh=6378a3766b6271c13c6930add93a1532&oe=5F834CE0,86.0,,1374782082694423,"Each day, we will be honoring our graduating seniors from the Class of 2020!",https://facebook.com/story.php?story_fbid=1374782082694423&id=269120043260638,,0.0,"Each day, we will be honoring our graduating seniors from the Class of 2020!",2020-05-05 12:13:20,,
56,21.0,https://scontent-atl3-1.xx.fbcdn.net/v/t1.0-9/fr/cp0/e15/q65/95944363_1373916156114349_65432005688426496_o.jpg?_nc_cat=109&_nc_sid=8024bb&_nc_ohc=vk3XGj8AuOsAX_DSYWC&_nc_ht=scontent-atl3-1.xx&tp=14&oh=67814bc5c65e6aa610cacd53f5ab1f6a&oe=5F80C7D8,134.0,,1373916229447675,"Each day, we will be honoring our graduating seniors from the Class of 2020!",https://facebook.com/story.php?story_fbid=1373916229447675&id=269120043260638,,0.0,"Each day, we will be honoring our graduating seniors from the Class of 2020!",2020-05-04 10:13:49,,
57,5.0,https://scontent-atl3-1.xx.fbcdn.net/v/t1.0-9/fr/cp0/e15/q65/95811046_1373915976114367_8457283715314221056_o.jpg?_nc_cat=103&_nc_sid=8024bb&_nc_ohc=67XtD3GwGxAAX_vDE4m&_nc_ht=scontent-atl3-1.xx&tp=14&oh=616e9e4330a5eb3ef5a5c75f903b2ef0&oe=5F81828E,82.0,,1373916056114359,"Each day, we will be honoring our graduating seniors from the Class of 2020!",https://facebook.com/story.php?story_fbid=1373916056114359&id=269120043260638,,0.0,"Each day, we will be honoring our graduating seniors from the Class of 2020!",2020-05-04 10:13:30,,
58,10.0,https://scontent-atl3-1.xx.fbcdn.net/v/t1.0-9/fr/cp0/e15/q65/95832108_1373915126114452_2376445713144872960_o.jpg?_nc_cat=102&_nc_sid=8024bb&_nc_ohc=ZDRRb9N_W7EAX94IgtQ&_nc_ht=scontent-atl3-1.xx&tp=14&oh=5c08ee5ab566f3788658cef2644cd1b5&oe=5F8221A3,80.0,,1373915189447779,"Each day, we will be honoring our graduating seniors from the Class of 2020!",https://facebook.com/story.php?story_fbid=1373915189447779&id=269120043260638,,0.0,"Each day, we will be honoring our graduating seniors from the Class of 2020!",2020-05-04 10:11:46,,
59,0.0,https://scontent-atl3-1.xx.fbcdn.net/v/t1.0-9/95142876_1371833392989292_1531532969217359872_n.png?_nc_cat=110&_nc_sid=8024bb&_nc_ohc=LPRJ-3YbCQoAX978nck&_nc_ht=scontent-atl3-1.xx&oh=664e3a4731d6d8f04f8420259cde455a&oe=5F81B885,8.0,,1371833436322621,"Reminder: No Classes will be held on Monday, May 4, as it is a designated Teacher Work Day. Teachers will be available for help or questions on existing assignments.",https://facebook.com/story.php?story_fbid=1371833436322621&id=269120043260638,,0.0,"Reminder: No Classes will be held on Monday, May 4, as it is a designated Teacher Work Day. Teachers will be available for help or questions on existing assignments.",2020-05-01 16:50:19,,
60,7.0,https://scontent-atl3-1.xx.fbcdn.net/v/t1.0-9/fr/cp0/e15/q65/95626544_1371562469683051_766990406406635520_o.jpg?_nc_cat=102&_nc_sid=8024bb&_nc_ohc=5UoCzylCr4sAX8GoxFy&_nc_ht=scontent-atl3-1.xx&tp=14&oh=2312978cb105474e34673f2fedc1a8bc&oe=5F83F933,70.0,,1371562526349712,"Each day, we will be honoring our graduating seniors from the Class of 2020!",https://facebook.com/story.php?story_fbid=1371562526349712&id=269120043260638,,0.0,"Each day, we will be honoring our graduating seniors from the Class of 2020!",2020-05-01 09:45:49,,
61,0.0,https://scontent-atl3-1.xx.fbcdn.net/v/t1.0-9/fr/cp0/e15/q65/95571682_1371562216349743_3743044954579009536_o.jpg?_nc_cat=103&_nc_sid=8024bb&_nc_ohc=8QDKM9a6E8MAX8LuSlV&_nc_ht=scontent-atl3-1.xx&tp=14&oh=9d5184d21fde7c1072f4240b08811fc0&oe=5F83FF6D,71.0,,1371562283016403,"Each day, we will be honoring our graduating seniors from the Class of 2020!",https://facebook.com/story.php?story_fbid=1371562283016403&id=269120043260638,,0.0,"Each day, we will be honoring our graduating seniors from the Class of 2020!",2020-05-01 09:45:26,,
62,6.0,https://scontent-atl3-1.xx.fbcdn.net/v/t1.0-9/fr/cp0/e15/q65/95583205_1371561959683102_6198969819220410368_o.jpg?_nc_cat=100&_nc_sid=8024bb&_nc_ohc=XLbYPsZym0wAX88mLFd&_nc_ht=scontent-atl3-1.xx&tp=14&oh=3f673bec5003700f280eecde83a28df3&oe=5F82712E,75.0,,1371562016349763,"Each day, we will be honoring our graduating seniors from the Class of 2020!",https://facebook.com/story.php?story_fbid=1371562016349763&id=269120043260638,,0.0,"Each day, we will be honoring our graduating seniors from the Class of 2020!",2020-05-01 09:45:05,,
63,3.0,https://scontent-atl3-1.xx.fbcdn.net/v/t1.0-9/fr/cp0/e15/q65/95615096_1371201063052525_5647489464293916672_n.jpg?_nc_cat=103&_nc_sid=8024bb&_nc_ohc=VsHBNRpGB7oAX-OH_Vb&_nc_ht=scontent-atl3-1.xx&tp=14&oh=f87cf903d3f9adf86163f7c040df391f&oe=5F819660,64.0,,1371202466385718,"Mrs. Halbur's class would like to thank Mr. Boushee for all that he does for our school!

Today is National School Principal's Day. Even though we are not physically at school, Mr. Boushee works tirelessly each day to do all the he can for every student! THANK YOU, MR. BOUSHEE!",https://facebook.com/story.php?story_fbid=1371202466385718&id=269120043260638,,0.0,"Mrs. Halbur's class would like to thank Mr. Boushee for all that he does for our school!

Today is National School Principal's Day. Even though we are not physically at school, Mr. Boushee works tirelessly each day to do all the he can for every student! THANK YOU, MR. BOUSHEE!",2020-05-01 08:30:34,,
64,5.0,https://scontent-atl3-1.xx.fbcdn.net/v/t1.0-9/fr/cp0/e15/q65/95606560_1371160056389959_8031106140735537152_n.jpg?_nc_cat=106&_nc_sid=110474&_nc_ohc=nUTinwIW21cAX_t-HlE&_nc_ht=scontent-atl3-1.xx&tp=14&oh=b07ab277c078105f4edafff18f85a39f&oe=5F82E6FA,44.0,,1371161186389846,"Mrs Rood's 2nd Grade Zoom Scavenger Hunt. We were on the hunt for Cylinders, Spheres, Cubes, Cones, Pyrimids and something Soft, Crunchy, Tiny & Green. 🤔",https://facebook.com/story.php?story_fbid=1371161186389846&id=269120043260638,,0.0,"Mrs Rood's 2nd Grade Zoom Scavenger Hunt. We were on the hunt for Cylinders, Spheres, Cubes, Cones, Pyrimids and something Soft, Crunchy, Tiny & Green. 🤔",2020-04-30 21:20:45,,
