,comments,image,likes,link,post_id,post_text,post_url,shared_text,shares,text,time,video,video_thumbnail
0,0.0,https://scontent-atl3-1.xx.fbcdn.net/v/t1.0-9/fr/cp0/e15/q65/119290398_1481016415404322_4432741500780097360_o.jpg?_nc_cat=100&_nc_sid=110474&_nc_ohc=CsKRcKWEoIYAX9vJJNd&_nc_ht=scontent-atl3-1.xx&tp=14&oh=a6559f9dbd6372496998359018fbbf71&oe=5F828A5A,27.0,,1481016482070982,A message for high school students and parents from Mr. Krump. Have a great weekend!,https://facebook.com/story.php?story_fbid=1481016482070982&id=269120043260638,,0.0,A message for high school students and parents from Mr. Krump. Have a great weekend!,2020-09-11 10:34:00,,
1,0.0,https://scontent-atl3-1.xx.fbcdn.net/v/t1.0-9/fr/cp0/e15/q65/118935407_1480221998817097_2062209540548569281_n.jpg?_nc_cat=109&_nc_sid=8024bb&_nc_ohc=zbZDc8A9wcwAX8RnQUW&_nc_ht=scontent-atl3-1.xx&tp=14&oh=c6e05f2cc5a80e38328c5588c0e3ccb8&oe=5F8439C4,26.0,,1480222162150414,We're so happy to see you!,https://facebook.com/story.php?story_fbid=1480222162150414&id=269120043260638,,0.0,We're so happy to see you!,2020-09-10 13:10:50,,
2,0.0,https://scontent-atl3-1.xx.fbcdn.net/v/t1.0-9/fr/cp0/e15/q65/118953459_1480219588817338_4278033443696987900_n.jpg?_nc_cat=109&_nc_sid=8024bb&_nc_ohc=x8PZMZuraOcAX-QJVdg&_nc_ht=scontent-atl3-1.xx&tp=14&oh=dc92373c5106f3e50b339c4162b50818&oe=5F81050D,17.0,,1480219745483989,"ISD 601 Fosston Schools is participating in a USDA sponsored meal program that will allow us to serve free meals to enrolled students. This program is available until funding runs out or December 31, whichever comes first. Any enrolled student can participate, even if learning from home. If your child(ren) is distance learning (including high school students on the hybrid schedule) and you want to access free meals, please notify Melissa Kennedy at 218-435-6335.

Families should still fill out the free and reduced form; when funding for free meals is gone, we will return to charging for meals. This could happen at any time, and with very little notice. The free and reduced eligibility impacts our overall funding significantly. As well, our technology partner Garden Valley is offering a discount on internet servicesfor families that qualify for free or reduced priced meals.

Superintendent Sue Chase",https://facebook.com/story.php?story_fbid=1480219745483989&id=269120043260638,,0.0,"ISD 601 Fosston Schools is participating in a USDA sponsored meal program that will allow us to serve free meals to enrolled students. This program is available until funding runs out or December 31, whichever comes first. Any enrolled student can participate, even if learning from home. If your child(ren) is distance learning (including high school students on the hybrid schedule) and you want to access free meals, please notify Melissa Kennedy at 218-435-6335.

Families should still fill out the free and reduced form; when funding for free meals is gone, we will return to charging for meals. This could happen at any time, and with very little notice. The free and reduced eligibility impacts our overall funding significantly. As well, our technology partner Garden Valley is offering a discount on internet servicesfor families that qualify for free or reduced priced meals.

Superintendent Sue Chase",2020-09-10 13:07:29,,
3,0.0,https://scontent-atl3-1.xx.fbcdn.net/v/t1.0-9/fr/cp0/e15/q65/118777462_1473080172864613_4792810807492661156_n.jpg?_nc_cat=109&_nc_sid=110474&_nc_ohc=dOW3HBOV6iEAX-FCEu6&_nc_ht=scontent-atl3-1.xx&tp=14&oh=5fdce50a1f813cd6afc148584cdad016&oe=5F81287B,15.0,,1473080199531277,"Magelssen Elementary's Open House has been rescheduled to Thursday, September 10th and will follow the same appointment schedule that was mailed home.",https://facebook.com/story.php?story_fbid=1473080199531277&id=269120043260638,,0.0,"Magelssen Elementary's Open House has been rescheduled to Thursday, September 10th and will follow the same appointment schedule that was mailed home.",2020-09-02 09:53:21,,
4,0.0,,16.0,,1472489456257018,"Attention: There WILL be Computer Pick-Up at the high school on Wednesday, September 2 as originally specified in the information letter that was sent to each family.",https://facebook.com/story.php?story_fbid=1472489456257018&id=269120043260638,,0.0,"Attention: There WILL be Computer Pick-Up at the high school on Wednesday, September 2 as originally specified in the information letter that was sent to each family.",2020-09-01 18:41:32,,
5,2.0,https://scontent-atl3-1.xx.fbcdn.net/v/t1.0-9/fr/cp0/e15/q65/118744877_1472302966275667_5347657913541221751_o.jpg?_nc_cat=100&_nc_sid=8024bb&_nc_ohc=ZD734t0DtasAX9XiX4A&_nc_ht=scontent-atl3-1.xx&tp=14&oh=6f0625bd8af1a70458fbd871a6c1cd2c&oe=5F819C6A,15.0,,1472303326275631,"There have been some unforeseen delays in construction district wide in the past week. For the health and safety of students and staff, administration has elected to push back our official start of the school year. School will officially begin Thursday September 10, 2020. Regular classes will be held September 11.

Magelssen Elementary will hold its open house on Thursday, September 10, following the same appointment schedule sent out previously. Please bring your student(s) to the open house with you as this will be an attendance day.

7th Grade Orientation will be Wednesday, September 9, following the same schedule starting at 4:00 pm for the Maroon Group and 5:15 for the Grey Group.

Fosston High School will be in session on Thursday, September 10. The Grey Group will attend school on site on Thursday September 10 while the Maroon Group learns from home. Both groups will be learning from home on Friday, September 11.",https://facebook.com/story.php?story_fbid=1472303326275631&id=269120043260638,,0.0,"There have been some unforeseen delays in construction district wide in the past week. For the health and safety of students and staff, administration has elected to push back our official start of the school year. School will officially begin Thursday September 10, 2020. Regular classes will be held September 11.

Magelssen Elementary will hold its open house on Thursday, September 10, following the same appointment schedule sent out previously. Please bring your student(s) to the open house with you as this will be an attendance day.

7th Grade Orientation will be Wednesday, September 9, following the same schedule starting at 4:00 pm for the Maroon Group and 5:15 for the Grey Group.

Fosston High School will be in session on Thursday, September 10. The Grey Group will attend school on site on Thursday September 10 while the Maroon Group learns from home. Both groups will be learning from home on Friday, September 11.",2020-09-01 13:38:26,,
6,0.0,,16.0,,1462679460571351,Superintendent Chase with an August 21 Reopening Update Video,,,0.0,Superintendent Chase with an August 21 Reopening Update Video,2020-08-21 14:38:43,https://video-atl3-1.xx.fbcdn.net/v/t42.9040-2/118205669_2590489511264695_3116393940043914969_n.mp4?_nc_cat=104&_nc_sid=985c63&efg=eyJ2ZW5jb2RlX3RhZyI6ImxlZ2FjeV9zZCJ9&_nc_ohc=L_TZ2M3mOV0AX9nVmP7&_nc_ht=video-atl3-1.xx&oh=72c458a349a5aa9b104e03f23546087c&oe=5F5D1A88,
7,1.0,https://scontent-atl3-1.xx.fbcdn.net/v/t1.0-9/fr/cp0/e15/q65/117612984_1460040814168549_3926797129314663918_o.jpg?_nc_cat=108&_nc_sid=8024bb&_nc_ohc=i0JsO235d2kAX_2DCMe&_nc_oc=AQlMiVt0lEAKbaDJiq1pWoEQqFEGym0SZtnPVxYeB6nRnX-1hzdjc8qSPIRLNZqwATc&_nc_ht=scontent-atl3-1.xx&tp=14&oh=967b86352cd88f8a07f1ad4965478558&oe=5F82673C,5.0,https://www.fosston.k12.mn.us/,1460040924168538,Have a question about the upcoming school year? Follow this link to submit a question and to view other frequently asked questions: https://www.fosston.k12.mn.us/,https://facebook.com/story.php?story_fbid=1460040924168538&id=269120043260638,,0.0,Have a question about the upcoming school year? Follow this link to submit a question and to view other frequently asked questions: https://www.fosston.k12.mn.us/,2020-08-18 14:50:38,,
8,2.0,,21.0,,1456384191200878,Superintendent Chase with a Construction Update! Things are coming together!,,,0.0,Superintendent Chase with a Construction Update! Things are coming together!,2020-08-14 10:30:20,https://video-atl3-1.xx.fbcdn.net/v/t42.9040-2/117458373_745797022659593_4041194599352977728_n.mp4?_nc_cat=106&_nc_sid=985c63&efg=eyJ2ZW5jb2RlX3RhZyI6ImxlZ2FjeV9zZCJ9&_nc_ohc=6nPk5a_f6YUAX_uChDL&_nc_ht=video-atl3-1.xx&oh=35e86fc18f0a48a38954217455a88764&oe=5F5D1489,
9,0.0,https://scontent-atl3-1.xx.fbcdn.net/v/t1.0-9/fr/cp0/e15/q65/116444531_1450702791769018_4429174504866453478_n.jpg?_nc_cat=111&_nc_sid=8024bb&_nc_ohc=AIlZi3AuSrwAX_TbCHU&_nc_ht=scontent-atl3-1.xx&tp=14&oh=37f4838e4c4a62ce53f1313cc65cb2c0&oe=5F83690F,0.0,,1452880788217885,,https://facebook.com/story.php?story_fbid=1452880788217885&id=269120043260638,"Fosston School District
August 7 at 4:58 PM ·

Elections for school board members for ISD 601 will be taking place during the general election on Tuesday, November 3, 2020. The filing period for candidates will close on TUESDAY, AUGUST 11, 2020. Affidavits of Candidacy are available from the school district clerk in the Superintendent's Office. Four members will be elected to the board for four-year terms, and one member will be elected for a two-year term.",0.0,"Fosston School District
August 7 at 4:58 PM ·

Elections for school board members for ISD 601 will be taking place during the general election on Tuesday, November 3, 2020. The filing period for candidates will close on TUESDAY, AUGUST 11, 2020. Affidavits of Candidacy are available from the school district clerk in the Superintendent's Office. Four members will be elected to the board for four-year terms, and one member will be elected for a two-year term.",2020-08-10 09:34:28,,
10,1.0,https://scontent-atl3-1.xx.fbcdn.net/v/t1.0-9/fr/cp0/e15/q65/116444531_1450702791769018_4429174504866453478_n.jpg?_nc_cat=111&_nc_sid=8024bb&_nc_ohc=AIlZi3AuSrwAX_TbCHU&_nc_ht=scontent-atl3-1.xx&tp=14&oh=37f4838e4c4a62ce53f1313cc65cb2c0&oe=5F83690F,20.0,,1450704491768848,"Elections for school board members for ISD 601 will be taking place during the general election on Tuesday, November 3, 2020. The filing period for candidates will close on TUESDAY, AUGUST 11, 2020. Affidavits of Candidacy are available from the school district clerk in the Superintendent's Office. Four members will be elected to the board for four-year terms, and one member will be elected for a two-year term.",https://facebook.com/story.php?story_fbid=1450704491768848&id=269120043260638,,0.0,"Elections for school board members for ISD 601 will be taking place during the general election on Tuesday, November 3, 2020. The filing period for candidates will close on TUESDAY, AUGUST 11, 2020. Affidavits of Candidacy are available from the school district clerk in the Superintendent's Office. Four members will be elected to the board for four-year terms, and one member will be elected for a two-year term.",2020-08-07 17:58:51,,
11,6.0,,184.0,,1447995708706393,Greetings from some of our bus drivers!,https://facebook.com/story.php?story_fbid=1447995708706393&id=269120043260638,,0.0,Greetings from some of our bus drivers!,2020-08-04 13:06:17,,
12,5.0,,23.0,,1447887588717205,Superintendent Chase Discusses District 601 Reopening Plan,,,0.0,Superintendent Chase Discusses District 601 Reopening Plan,2020-08-04 10:30:19,https://video-atl3-1.xx.fbcdn.net/v/t42.9040-2/116190869_1473278449541262_1681928240097454771_n.mp4?_nc_cat=111&_nc_sid=985c63&efg=eyJ2ZW5jb2RlX3RhZyI6ImxlZ2FjeV9zZCJ9&_nc_ohc=0W0ATKctTk4AX_jtky5&_nc_ht=video-atl3-1.xx&oh=f4d6bf2ebb91c45d17af98b6e7bd2bd5&oe=5F5D2097,
13,1.0,,30.0,,1438459162993381,Superintendent Chase Discusses the Reopening of Our Schools,,,0.0,Superintendent Chase Discusses the Reopening of Our Schools,2020-07-23 17:24:23,https://video-atl3-1.xx.fbcdn.net/v/t42.9040-2/115808979_1621570951342497_6172050057214820089_n.mp4?_nc_cat=106&_nc_sid=985c63&efg=eyJ2ZW5jb2RlX3RhZyI6ImxlZ2FjeV9zZCJ9&_nc_ohc=Ab-tEuUm2bsAX81LSJB&_nc_oc=AQkuM2jfo7ml65cQ6c0PXaZ__3dMGYU-K0Shz0-mpgkU2iRqeL3Mwt9CJkintXRkUg0&_nc_ht=video-atl3-1.xx&oh=1bb5ac5f4eceaab282b23a816f82a58c&oe=5F5D1CD5,
14,0.0,,6.0,https://sites.google.com/a/isd601.org/community-education/drivers-education,1431684297004201,"IMPORTANT ANNOUNCEMENT! Drivers Education Classroom is scheduled for August 2020. Please visit this link for details:
https://sites.google.com/a/isd601.org/community-education/drivers-education",https://facebook.com/story.php?story_fbid=1431684297004201&id=269120043260638,"SITES.GOOGLE.COM
Drivers Education - Community Education",8.0,"IMPORTANT ANNOUNCEMENT! Drivers Education Classroom is scheduled for August 2020. Please visit this link for details:
https://sites.google.com/a/isd601.org/community-education/drivers-education

SITES.GOOGLE.COM
Drivers Education - Community Education",2020-07-15 08:06:01,,
15,0.0,,31.0,https://services.aap.org/en/pages/2019-novel-coronavirus-covid-19-infections/clinical-guidance/covid-19-planning-considerations-return-to-in-person-education-in-schools/,1430990983740199,,https://facebook.com/story.php?story_fbid=1430990983740199&id=269120043260638,,15.0,,2020-07-14 10:23:28,,
16,0.0,,20.0,,1427801777392453,Join Superintendent Chase as she gives a second construction update.,,,0.0,Join Superintendent Chase as she gives a second construction update.,2020-07-10 09:51:48,https://video-atl3-1.xx.fbcdn.net/v/t42.9040-2/107065098_1139793236393014_2248874722077213995_n.mp4?_nc_cat=104&_nc_sid=985c63&efg=eyJ2ZW5jb2RlX3RhZyI6ImxlZ2FjeV9zZCJ9&_nc_ohc=_9I-W1neCiUAX8dZXbK&_nc_ht=video-atl3-1.xx&oh=221c7d0ab6a8d0c8894a696e1de82b4b&oe=5F5D1D7A,
17,1.0,,15.0,,1420957968076834,The Final Revised Version of the 2020 Graduation and Commencement Activities at Fosston High School,,,0.0,The Final Revised Version of the 2020 Graduation and Commencement Activities at Fosston High School,2020-07-01 20:07:14,https://video-atl3-1.xx.fbcdn.net/v/t42.9040-2/10000000_379612289687585_813238304004152808_n.mp4?_nc_cat=108&_nc_sid=985c63&efg=eyJ2ZW5jb2RlX3RhZyI6ImxlZ2FjeV9zZCJ9&_nc_ohc=FkXeZamTns4AX_CI_fb&_nc_ht=video-atl3-1.xx&oh=22d240446a8a7c663ab302f16506c4e9&oe=5F5D1A20,
18,3.0,https://scontent-atl3-1.xx.fbcdn.net/v/t1.0-9/106074592_1419966118176019_6465997173936491093_n.png?_nc_cat=101&_nc_sid=8024bb&_nc_ohc=B-mI-RFcj3AAX8W6Pd8&_nc_ht=scontent-atl3-1.xx&oh=99935a0b6909092527e19b2540ad32b8&oe=5F846DE2,11.0,,1419969134842384,"From Stacy Manecke, Junior Class Advisor: I am very sad to inform you that the decision has been made to cancel PROM 2020. The health guidelines are not going to change in the next few weeks so Mrs. Chase made the decision to cancel it.

After Prom will have a prize giveaway night for Fosston Jrs and Srs that are registered for after prom. No out of town guests or sophomores are able to come. ONLY FOSSTON JRS AND SRS who are already signed up for after prom will win prizes.

DATE: Thursday, July 16th
PLACE: Fosston City Park
TIME:6:45 pm

Prize giveaway begins at 7 pm. Music, snacks and beverages will be provided.",https://facebook.com/story.php?story_fbid=1419969134842384&id=269120043260638,,0.0,"From Stacy Manecke, Junior Class Advisor: I am very sad to inform you that the decision has been made to cancel PROM 2020. The health guidelines are not going to change in the next few weeks so Mrs. Chase made the decision to cancel it.

After Prom will have a prize giveaway night for Fosston Jrs and Srs that are registered for after prom. No out of town guests or sophomores are able to come. ONLY FOSSTON JRS AND SRS who are already signed up for after prom will win prizes.

DATE: Thursday, July 16th
PLACE: Fosston City Park
TIME:6:45 pm

Prize giveaway begins at 7 pm. Music, snacks and beverages will be provided.",2020-06-30 14:51:40,,
19,1.0,,23.0,,1415894368583194,A Construction Update from Superintendent Chase,,,0.0,A Construction Update from Superintendent Chase,2020-06-25 13:30:45,https://video-atl3-1.xx.fbcdn.net/v/t42.9040-2/105659624_641734360023705_339102468645390451_n.mp4?_nc_cat=104&_nc_sid=985c63&efg=eyJ2ZW5jb2RlX3RhZyI6ImxlZ2FjeV9zZCJ9&_nc_ohc=vC2V-ZqtzmUAX-UX1zQ&_nc_ht=video-atl3-1.xx&oh=0d64572febb458d365cbba62baddf2b1&oe=5F5D1FA4,
20,0.0,,13.0,https://larl.org/explore/kids/,1415883481917616,From the Fosston Public Library: Sign up for our online summer program June 15-August 15 to log reading activity and earn tickets for prizes! Kids get to pick out a free book once registered (while supplies last)! https://larl.org/explore/kids/,https://facebook.com/story.php?story_fbid=1415883481917616&id=269120043260638,"LARL.ORG
Summer Library Experience: Kids",0.0,"From the Fosston Public Library: Sign up for our online summer program June 15-August 15 to log reading activity and earn tickets for prizes! Kids get to pick out a free book once registered (while supplies last)! https://larl.org/explore/kids/

LARL.ORG
Summer Library Experience: Kids",2020-06-25 13:13:23,,
21,0.0,,15.0,http://www.do-bid.com/cgi-bin/mndetails.cgi?dobid101,1414133385425959,"Fosston School District is auctioning off surplus property. We will be doing this in two phases -- Phase 1 electronics, printers, etc.. Phase 2 will be surplus desks and chairs. Below is the link with more information:",https://facebook.com/story.php?story_fbid=1414133385425959&id=269120043260638,"DO-BID.COM
Do-Bid.com",7.0,"Fosston School District is auctioning off surplus property. We will be doing this in two phases -- Phase 1 electronics, printers, etc.. Phase 2 will be surplus desks and chairs. Below is the link with more information:

DO-BID.COM
Do-Bid.com",2020-06-23 09:38:30,,
22,2.0,https://scontent-atl3-1.xx.fbcdn.net/v/t1.0-9/fr/cp0/e15/q65/104271977_1408480699324561_7405041133818826513_n.jpg?_nc_cat=110&_nc_sid=8024bb&_nc_ohc=sWR2gswoydMAX8MqdOZ&_nc_ht=scontent-atl3-1.xx&tp=14&oh=8835578ded59244d21c1f954ce0819f9&oe=5F8466DC,38.0,,1408480949324536,,https://facebook.com/story.php?story_fbid=1408480949324536&id=269120043260638,,0.0,,2020-06-16 09:29:33,,
23,0.0,https://scontent-atl3-1.xx.fbcdn.net/v/t1.0-9/fr/cp0/e15/q65/102334210_1402824526556845_1659645781645928132_n.jpg?_nc_cat=107&_nc_sid=8024bb&_nc_ohc=9Z-P0B3OeAoAX9KNrak&_nc_ht=scontent-atl3-1.xx&tp=14&oh=39b6edd991f87e09c2ba701b7d2be62c&oe=5F840B5F,7.0,,1402824583223506,,https://facebook.com/story.php?story_fbid=1402824583223506&id=269120043260638,,0.0,,2020-06-09 11:23:25,,
24,0.0,https://scontent-atl3-1.xx.fbcdn.net/v/t1.0-9/101217683_1398668110305820_7150547092396572672_n.png?_nc_cat=101&_nc_sid=8024bb&_nc_ohc=PchAg7kc3u8AX9iN5nV&_nc_ht=scontent-atl3-1.xx&oh=06a460e682ca801319c9d6e4f3c035a2&oe=5F83D6FF,28.0,http://RJBroadcasting.com/,1398668610305770,"IMPORTANT FACTS ON THE GRADUATION PARADE! PLEASE SHARE! On Saturday, June 13th, at 2:00 pm Fosston High School will be having a graduation parade. We ask that community members come out to show your support for our 2020 graduates. Graduates and their families will drive through town on the designated parade route (Map attached). The ceremony will be broadcast on KKCQ 96.7 FM and be live streamed on RJBroadcasting.com We ask spectators to station along the parade route, practice social distancing, and refrain from physical contact. Feel free to make signs to congratulate our graduates, cheer loudly, and show your Greyhound Pride. Thank you for helping to make this graduation a momentous occasion!

Sincerely,

Dominic Krump

Fosston High School Principal",https://facebook.com/story.php?story_fbid=1398668610305770&id=269120043260638,,0.0,"IMPORTANT FACTS ON THE GRADUATION PARADE! PLEASE SHARE! On Saturday, June 13th, at 2:00 pm Fosston High School will be having a graduation parade. We ask that community members come out to show your support for our 2020 graduates. Graduates and their families will drive through town on the designated parade route (Map attached). The ceremony will be broadcast on KKCQ 96.7 FM and be live streamed on RJBroadcasting.com We ask spectators to station along the parade route, practice social distancing, and refrain from physical contact. Feel free to make signs to congratulate our graduates, cheer loudly, and show your Greyhound Pride. Thank you for helping to make this graduation a momentous occasion!

Sincerely,

Dominic Krump

Fosston High School Principal",2020-06-04 11:01:11,,
25,17.0,https://scontent-atl3-1.xx.fbcdn.net/v/t1.0-9/fr/cp0/e15/q65/101651921_1398663743639590_4817928406656090112_o.jpg?_nc_cat=108&_nc_sid=8024bb&_nc_ohc=WIlVY52lX0oAX_cpzos&_nc_ht=scontent-atl3-1.xx&tp=14&oh=7debb9e748d5ebcd14881db00b9e0f7e&oe=5F826703,91.0,,1398664743639490,"The Polk County Environmental Services held its annual essay contest this spring on the topic of Reducing, Reusing & Recycling. Numerous schools from across the county submitted essays this year. One essay from each grade was chosen as Best in Class and from there, the essays were ranked by a panel to determine countywide placings. Hilde Deusterman of Fosston was the county’s first-place winner. Congratulations, Hilde! 🏅👏",https://facebook.com/story.php?story_fbid=1398664743639490&id=269120043260638,,0.0,"The Polk County Environmental Services held its annual essay contest this spring on the topic of Reducing, Reusing & Recycling. Numerous schools from across the county submitted essays this year. One essay from each grade was chosen as Best in Class and from there, the essays were ranked by a panel to determine countywide placings. Hilde Deusterman of Fosston was the county’s first-place winner. Congratulations, Hilde! 🏅👏",2020-06-04 10:55:39,,
26,21.0,,90.0,,1391673527671945,Thanks to Taydin Brown for putting this iMovie together as a tribute to her class. Enjoy!,,,0.0,Thanks to Taydin Brown for putting this iMovie together as a tribute to her class. Enjoy!,2020-05-26 11:35:26,https://video-atl3-1.xx.fbcdn.net/v/t42.9040-2/99161785_824741511382859_2731249263500591104_n.mp4?_nc_cat=103&_nc_sid=985c63&efg=eyJ2ZW5jb2RlX3RhZyI6ImxlZ2FjeV9zZCJ9&_nc_ohc=AtQG0qCghQcAX_mVh9m&_nc_ht=video-atl3-1.xx&oh=fb0e2be7d998cec00744fb553100b74b&oe=5F5D1DE4,
27,4.0,https://scontent-atl3-1.xx.fbcdn.net/v/t1.0-9/fr/cp0/e15/q65/97574587_1387713571401274_397893552782180352_n.jpg?_nc_cat=103&_nc_sid=8024bb&_nc_ohc=g_mPVBRXeo8AX-D9AeU&_nc_ht=scontent-atl3-1.xx&tp=14&oh=c2671f6300e47e7af73bd0ea16116049&oe=5F82E6EC,80.0,,1387716198067678,"Congrats to Our Gold List Winners for 2019-2020!

In order to be eligible for the drawing, students had No Tardies, No Unexcused absences, No End of Quarter Incompletes, and No referrals to the office, with one entry in the drawing for every quarter on the Gold List, with a maximum of three entries.

Prizes this year were an Apple Ipad, and two pairs of Tozo Bluetooth Wireless Earbuds.",https://facebook.com/story.php?story_fbid=1387716198067678&id=269120043260638,,0.0,"Congrats to Our Gold List Winners for 2019-2020!

In order to be eligible for the drawing, students had No Tardies, No Unexcused absences, No End of Quarter Incompletes, and No referrals to the office, with one entry in the drawing for every quarter on the Gold List, with a maximum of three entries.

Prizes this year were an Apple Ipad, and two pairs of Tozo Bluetooth Wireless Earbuds.",2020-05-21 15:25:09,,
28,22.0,https://scontent-atl3-1.xx.fbcdn.net/v/t1.0-9/fr/cp0/e15/q65/98133364_1387705408068757_6557421970063884288_n.jpg?_nc_cat=105&_nc_sid=8024bb&_nc_ohc=Q0j-lHGytzwAX-y_QBj&_nc_ht=scontent-atl3-1.xx&tp=14&oh=e0c3b22dddc150075899482cd363f12c&oe=5F82BE2F,86.0,,1387705464735418,,https://facebook.com/story.php?story_fbid=1387705464735418&id=269120043260638,,0.0,,2020-05-21 15:05:04,,
29,0.0,https://scontent-atl3-1.xx.fbcdn.net/v/t1.0-9/fr/cp0/e15/q65/98201863_1386844368154861_3412086688988528640_n.jpg?_nc_cat=102&_nc_sid=8024bb&_nc_ohc=KAB0JqWU5U8AX9wBfZz&_nc_ht=scontent-atl3-1.xx&tp=14&oh=77ee263d6b9b093b98fbfabb59256fd3&oe=5F820BF6,30.0,,1386844468154851,"There will be a special ""Senior Spotlight"" to honor the 2020 graduates on the Fosston Radio station tonight (Wednesday, May 20) at 6:00pm. They'll be broadcasting special messages from family members and friends to their 2020 graduate. If you'd like to call in a message (live) you can call +1 (218) 668-2400 at 6:00pm, otherwise you can email a message any time before 6:00pm (and include your name)
Emails can be sent to: tom@kkcqradio.com",https://facebook.com/story.php?story_fbid=1386844468154851&id=269120043260638,,0.0,"There will be a special ""Senior Spotlight"" to honor the 2020 graduates on the Fosston Radio station tonight (Wednesday, May 20) at 6:00pm. They'll be broadcasting special messages from family members and friends to their 2020 graduate. If you'd like to call in a message (live) you can call +1 (218) 668-2400 at 6:00pm, otherwise you can email a message any time before 6:00pm (and include your name)
Emails can be sent to: tom@kkcqradio.com",2020-05-20 13:41:04,,
