,comments,image,likes,link,post_id,post_text,post_url,shared_text,shares,text,time,video,video_thumbnail
0,0.0,,23.0,http://web-extract.constantcontact.com/v1/social_annotation_v2?permalink_uri=https%3A%2F%2Fmyemail.constantcontact.com%2FWelcome-Back--again--To-School-Teachers---Staff-.html%3Fsoid%3D1102037584410%26aid%3Do7zGG9yGUX0&image_url=https%3A%2F%2Fmlsvc01-prod.s3.amazonaws.com%2Fa1a0f869001%2F1eea748a-8f64-4517-a495-04d98528d302.jpg%3Fver%3D1599695002000,5108821155810002,Another HUGE thank you goes out to our PTO for supporting our staff. Each school received a well stocked snack cart to enjoy throughout the first day (again) of school.,https://facebook.com/story.php?story_fbid=5108821155810002&id=116140448411456,"WEB-EXTRACT.CONSTANTCONTACT.COM
Welcome Back (again) To School Teachers & Staff!

Fountain Hills PTO
Yesterday at 6:01 AM ·

Welcome Back (again) To School Teachers & Staff!",0.0,"Another HUGE thank you goes out to our PTO for supporting our staff. Each school received a well stocked snack cart to enjoy throughout the first day (again) of school.

WEB-EXTRACT.CONSTANTCONTACT.COM
Welcome Back (again) To School Teachers & Staff!

Fountain Hills PTO
Yesterday at 6:01 AM ·

Welcome Back (again) To School Teachers & Staff!",2020-09-10 11:24:42,,
1,0.0,,0.0,http://web-extract.constantcontact.com/v1/social_annotation_v2?permalink_uri=https%3A%2F%2Fmyemail.constantcontact.com%2FWelcome-Back--again--To-School-Teachers---Staff-.html%3Fsoid%3D1102037584410%26aid%3Do7zGG9yGUX0&image_url=https%3A%2F%2Fmlsvc01-prod.s3.amazonaws.com%2Fa1a0f869001%2F1eea748a-8f64-4517-a495-04d98528d302.jpg%3Fver%3D1599695002000,,,https://facebook.com/story.php?story_fbid=10158474080799043&id=274401099042,"Fountain Hills PTO
Yesterday at 6:01 AM ·

Welcome Back (again) To School Teachers & Staff!",0.0,"Fountain Hills PTO
Yesterday at 6:01 AM ·

Welcome Back (again) To School Teachers & Staff!",2020-09-12 00:30:26.972141,,
2,2.0,,18.0,https://www.instagram.com/p/CE5tENsnUzd/?igshid=ovshsndwgouz&utm_source=fb_msite_attr,5104097822949002,So great to see activity on our fields again! Go Falcons!,https://facebook.com/story.php?story_fbid=5104097822949002&id=116140448411456,"Jason Henslin is at Fhhs Falcon Field.
September 8 at 9:01 PM · Instagram ·

Day 1: ✅
With a lot of wind and a little bit of dust, we kicked off official practices today. 16 days til we host Show Low for our scrimmage. @ Fhhs Falcon Field",0.0,"So great to see activity on our fields again! Go Falcons!

Jason Henslin is at Fhhs Falcon Field.
September 8 at 9:01 PM · Instagram ·

Day 1: ✅
With a lot of wind and a little bit of dust, we kicked off official practices today. 16 days til we host Show Low for our scrimmage. @ Fhhs Falcon Field",2020-09-09 13:22:59,,
3,1.0,https://scontent-atl3-1.xx.fbcdn.net/v/t1.0-9/fr/cp0/e15/q65/118962515_2726882074082071_6810555249073412751_n.jpg?_nc_cat=110&_nc_sid=8024bb&_nc_ohc=NFgCIuG8UjEAX_9eqWn&_nc_ht=scontent-atl3-1.xx&tp=14&oh=b485dffdef6f07e1aeb9352266d3d508&oe=5F83BEEB,8.0,,5104090289616422,Interested in Middle School Football for your 7th or 8th grader? See the link below regarding an informational meeting taking place tonight at 7 pm.,https://facebook.com/story.php?story_fbid=5104090289616422&id=116140448411456,"Fountain Hills Athletic Booster Club
September 8 at 11:38 AM ·

Calling all FHMS 7 & 8 grade boys - Middle School Football is Back! Head Coach Rich Barnard is looking forward to another great season.

PARENTS AND PLAYERS ONLINE MEETING - Wednesday, September 9, 7-8 pm . You can contact Coach Barnard at richbarnard23@gmail.com for the online link to the meeting.",0.0,"Interested in Middle School Football for your 7th or 8th grader? See the link below regarding an informational meeting taking place tonight at 7 pm.

Fountain Hills Athletic Booster Club
September 8 at 11:38 AM ·

Calling all FHMS 7 & 8 grade boys - Middle School Football is Back! Head Coach Rich Barnard is looking forward to another great season.

PARENTS AND PLAYERS ONLINE MEETING - Wednesday, September 9, 7-8 pm . You can contact Coach Barnard at richbarnard23@gmail.com for the online link to the meeting.",2020-09-09 13:21:14,,
4,0.0,https://scontent-atl3-1.xx.fbcdn.net/v/t1.0-9/fr/cp0/e15/q65/119103262_3209526752428840_8078826665172775713_n.jpg?_nc_cat=103&_nc_sid=8024bb&_nc_ohc=v7V1Cqd-Hc4AX9l21sn&_nc_ht=scontent-atl3-1.xx&tp=14&oh=6858db5811329e947bb8c10a5b1ef508&oe=5F827C0C,10.0,http://www.Registermyathlete.com/,5100004713358313,Is your student a Golfer? Check out this info regarding 6-8th grade golf at the middle school...,https://facebook.com/story.php?story_fbid=5100004713358313&id=116140448411456,"Fountain Hills Middle School
September 8 at 3:47 PM ·

Any 6th-8th graders interested in golf, please email falcongolfing@gmail.com

You will need to go and register on www.Registermyathlete.com You could be the new Tiger Woods!!",2.0,"Is your student a Golfer? Check out this info regarding 6-8th grade golf at the middle school...

Fountain Hills Middle School
September 8 at 3:47 PM ·

Any 6th-8th graders interested in golf, please email falcongolfing@gmail.com

You will need to go and register on www.Registermyathlete.com You could be the new Tiger Woods!!",2020-09-08 18:52:40,,
5,0.0,,6.0,https://conta.cc/31WBVBs,5079584775400307,"Please click on the following link for this week's Superintendents Falcon Focus.

https://conta.cc/31WBVBs",https://facebook.com/story.php?story_fbid=5079584775400307&id=116140448411456,"MYEMAIL.CONSTANTCONTACT.COM
Superintendent's Falcon Focus - September 4, 2020",2.0,"Please click on the following link for this week's Superintendents Falcon Focus.

https://conta.cc/31WBVBs

MYEMAIL.CONSTANTCONTACT.COM
Superintendent's Falcon Focus - September 4, 2020",2020-09-04 18:54:34,,
6,0.0,https://scontent-atl3-1.xx.fbcdn.net/v/t1.0-9/fr/cp0/e15/q65/118616649_5074339259258192_2503654738462923588_n.jpg?_nc_cat=109&_nc_sid=8024bb&_nc_ohc=Xhz03hk-tiQAX9YVbIr&_nc_ht=scontent-atl3-1.xx&tp=14&oh=37bce3431ec19650ca182026290f0732&oe=5F83A22E,18.0,,5074341985924586,We can't wait for next week when we can celebrate a new school year face to face with our students. These kiddos are wearing their new grades well! #Falconstateofmind!,https://facebook.com/story.php?story_fbid=5074341985924586&id=116140448411456,,0.0,We can't wait for next week when we can celebrate a new school year face to face with our students. These kiddos are wearing their new grades well! #Falconstateofmind!,2020-09-04 15:20:18,,
7,0.0,https://scontent-atl3-1.xx.fbcdn.net/v/t1.0-9/fr/cp0/e15/q65/118794875_5078791922146259_7702687247458101738_o.jpg?_nc_cat=110&_nc_sid=8024bb&_nc_ohc=p6g2sIMzXmoAX_Uud8M&_nc_oc=AQnvTB8jE9Fc2W__XZD9aZPtNhSM0II5J7ZSF-TgRPU2oPP9tR0V6nuROh99Aymh8io&_nc_ht=scontent-atl3-1.xx&tp=14&oh=241c9482884b67894424d8a0b50eaf21&oe=5F7FF022,4.0,http://www.fh.az.gov/celebrate,5078792892146162,"Enter your favorite Fountain picture in the ""Fountain at 50"" Photo Contest.

Limited to the first 100 “registered” entries, one registration per person.
Registration begins on 9/14 at 8:00 A
Exhibition/Contest begins on 11/2 through 11/19
4 categories: B/W, Color, Special Events, and 18—Under
Great prizes--and notoriety!
Find out more at www.fh.az.gov/celebrate",https://facebook.com/story.php?story_fbid=5078792892146162&id=116140448411456,,0.0,"Enter your favorite Fountain picture in the ""Fountain at 50"" Photo Contest.

Limited to the first 100 “registered” entries, one registration per person.
Registration begins on 9/14 at 8:00 A
Exhibition/Contest begins on 11/2 through 11/19
4 categories: B/W, Color, Special Events, and 18—Under
Great prizes--and notoriety!
Find out more at www.fh.az.gov/celebrate",2020-09-04 14:56:14,,
8,0.0,https://scontent-atl3-1.xx.fbcdn.net/v/t1.0-9/fr/cp0/e15/q65/118657961_5074326262592825_2235336004003054310_n.jpg?_nc_cat=108&_nc_sid=8024bb&_nc_ohc=obx_lOJ4DLwAX-JeSQO&_nc_ht=scontent-atl3-1.xx&tp=14&oh=8a222047495cf57e48e16054decbf869&oe=5F837BC6,24.0,,5074328289259289,With our hybrid program beginning Tuesday we want to take one last look at our #FHUSDvirtuallearners. We look forward to seeing our students back in the classroom next week!,https://facebook.com/story.php?story_fbid=5074328289259289&id=116140448411456,,0.0,With our hybrid program beginning Tuesday we want to take one last look at our #FHUSDvirtuallearners. We look forward to seeing our students back in the classroom next week!,2020-09-04 12:15:55,,
9,0.0,https://scontent-atl3-1.xx.fbcdn.net/v/t1.0-9/fr/cp0/e15/q65/118648818_3191753500872832_8636682583796411199_o.jpg?_nc_cat=105&_nc_sid=110474&_nc_ohc=UBc5IVfiEKkAX-eoG6s&_nc_ht=scontent-atl3-1.xx&tp=14&oh=09580cc25c70c5b1e91c7bfd0b29c4bd&oe=5F838ED4,10.0,,5077831702242281,"Do you have a 6th, 7th or 8th grade girl who loves Volleyball? See information below regarding tryouts for the middle school girls volleyball team. Go Lady Falcons!",https://facebook.com/story.php?story_fbid=5077831702242281&id=116140448411456,"Fountain Hills Middle School
September 2 at 6:01 PM ·

Calling all 6th, 7th and 8th grade girls who want to play volleyball for Fountain Hills Middle School. Sign up on register my athlete so you will be prepared to try out. If you ARE NOT registered you CANNOT try out. Tryouts will be announced soon. Don't miss out!!!",0.0,"Do you have a 6th, 7th or 8th grade girl who loves Volleyball? See information below regarding tryouts for the middle school girls volleyball team. Go Lady Falcons!

Fountain Hills Middle School
September 2 at 6:01 PM ·

Calling all 6th, 7th and 8th grade girls who want to play volleyball for Fountain Hills Middle School. Sign up on register my athlete so you will be prepared to try out. If you ARE NOT registered you CANNOT try out. Tryouts will be announced soon. Don't miss out!!!",2020-09-04 11:04:32,,
10,0.0,,4.0,https://conta.cc/2EZ73Ya,5074416312583820,"Please click on the link for valuable information and resources from our district nurse.

https://conta.cc/2EZ73Ya",https://facebook.com/story.php?story_fbid=5074416312583820&id=116140448411456,"MYEMAIL.CONSTANTCONTACT.COM
COVID Information from our District Nurse",0.0,"Please click on the link for valuable information and resources from our district nurse.

https://conta.cc/2EZ73Ya

MYEMAIL.CONSTANTCONTACT.COM
COVID Information from our District Nurse",2020-09-03 18:34:20,,
11,0.0,https://scontent-atl3-1.xx.fbcdn.net/v/t1.0-9/fr/cp0/e15/q65/118629108_5073688579323260_2360533930833230347_n.jpg?_nc_cat=110&_nc_sid=8024bb&_nc_ohc=jDmGtvU7SBcAX_UoUF_&_nc_ht=scontent-atl3-1.xx&tp=14&oh=133de05d5ec7a2934b1d8d4a5bd92811&oe=5F808637,29.0,,5073701929321925,These Falcons are thrilled to be starting a new school year but they are even more excited because they will be returning to the classroom soon! #Falconstateofmind!,https://facebook.com/story.php?story_fbid=5073701929321925&id=116140448411456,,0.0,These Falcons are thrilled to be starting a new school year but they are even more excited because they will be returning to the classroom soon! #Falconstateofmind!,2020-09-03 17:00:05,,
12,0.0,https://scontent-atl3-1.xx.fbcdn.net/v/t1.0-9/fr/cp0/e15/q65/118653656_5073322586026526_1375242160593714333_n.jpg?_nc_cat=110&_nc_sid=8024bb&_nc_ohc=9HTr6WCFuP0AX__RVkJ&_nc_ht=scontent-atl3-1.xx&tp=14&oh=eb8dca76366856eace41ac863e043f8c&oe=5F8001BE,22.0,,5073323246026460,Soon enough these kiddos will be learning in the classroom again but until then we will showcase their virtual learning. #FHUSDvirtuallearning,https://facebook.com/story.php?story_fbid=5073323246026460&id=116140448411456,,0.0,Soon enough these kiddos will be learning in the classroom again but until then we will showcase their virtual learning. #FHUSDvirtuallearning,2020-09-03 14:58:59,,
13,19.0,https://scontent-atl3-1.xx.fbcdn.net/v/t1.0-9/fr/cp0/e15/q65/118793755_5072946342730817_4022049044666910645_n.jpg?_nc_cat=111&_nc_sid=8024bb&_nc_ohc=9-\-\Qk0QZokIAX-bZWcu&_nc_ht=scontent-atl3-1.xx&tp=14&oh=3d8cef94a600f797dc8d56ca4a92c166&oe=5F82A44B,61.0,,5072956139396504,"Please welcome Janetta Blair to FHUSD. She is very excited to work with the Special Education team at FHMS as an ELA resource teacher.

Janetta graduated from GCU with a Bachelor of Science in Educational studies, and is currently working on her Masters in Special Education, also at GCU. She has worked in Education upwards of 16 years. Being a big theatre buff, Janetta has incorporated her talents into working with middle-schoolers in a 21st Century after school drama program. She has also coached middle school cheer, and helped to start up a morning coffee cart with a high school special education class. Her heart is always with the kids she works with!

Janetta and her husband relocated back to Arizona from Colorado, and chose Fountain Hills as their home. They have a big family of seven kids with their youngest daughter recently graduating from high school. Golf is a big deal with this family, and now have two golf pros to brag about.

Janetta is extremely grateful to be a part of the FHUSD family!

Welcome Janetta to our team!",https://facebook.com/story.php?story_fbid=5072956139396504&id=116140448411456,,0.0,"Please welcome Janetta Blair to FHUSD. She is very excited to work with the Special Education team at FHMS as an ELA resource teacher.

Janetta graduated from GCU with a Bachelor of Science in Educational studies, and is currently working on her Masters in Special Education, also at GCU. She has worked in Education upwards of 16 years. Being a big theatre buff, Janetta has incorporated her talents into working with middle-schoolers in a 21st Century after school drama program. She has also coached middle school cheer, and helped to start up a morning coffee cart with a high school special education class. Her heart is always with the kids she works with!

Janetta and her husband relocated back to Arizona from Colorado, and chose Fountain Hills as their home. They have a big family of seven kids with their youngest daughter recently graduating from high school. Golf is a big deal with this family, and now have two golf pros to brag about.

Janetta is extremely grateful to be a part of the FHUSD family!

Welcome Janetta to our team!",2020-09-03 11:52:43,,
14,0.0,,5.0,https://conta.cc/3jE9DS7,5068138853211566,"FHHS Families...please click on the link for detailed information about Falcon Fest 2020 taking place next Tuesday, September 8th.

https://conta.cc/3jE9DS7",https://facebook.com/story.php?story_fbid=5068138853211566&id=116140448411456,"Falcon Fest 2020
Falcon Fest 2020 Home of the Falcons! ""We Achieve and Celebrate Educational Excellence"" Falcon Fest 2020 Good Morning FHHS Families! Falcon Fest 2020 will be taking place on Tuesday, September 8th and

Falcon Fest 2020
Falcon Fest 2020 Home of the Falcons! ""We Achieve and Celebrate Educational Excellence"" Falcon Fest 2020 Good Morning FHHS Families! Falcon Fest 2020 will be taking place on Tuesday, September 8th and

Falcon Fest 2020
Falcon Fest 2020 Home of the Falcons! ""We Achieve and Celebrate Educational Excellence"" Falcon Fest 2020 Good Morning FHHS Families! Falcon Fest 2020 will be taking place on Tuesday, September 8th and

See more at
myemail.constantcontact.com",0.0,"FHHS Families...please click on the link for detailed information about Falcon Fest 2020 taking place next Tuesday, September 8th.

https://conta.cc/3jE9DS7

Falcon Fest 2020
Falcon Fest 2020 Home of the Falcons! ""We Achieve and Celebrate Educational Excellence"" Falcon Fest 2020 Good Morning FHHS Families! Falcon Fest 2020 will be taking place on Tuesday, September 8th and

Falcon Fest 2020
Falcon Fest 2020 Home of the Falcons! ""We Achieve and Celebrate Educational Excellence"" Falcon Fest 2020 Good Morning FHHS Families! Falcon Fest 2020 will be taking place on Tuesday, September 8th and

Falcon Fest 2020
Falcon Fest 2020 Home of the Falcons! ""We Achieve and Celebrate Educational Excellence"" Falcon Fest 2020 Good Morning FHHS Families! Falcon Fest 2020 will be taking place on Tuesday, September 8th and

See more at
myemail.constantcontact.com",2020-09-02 13:53:08,,
15,0.0,,7.0,https://conta.cc/3hOQCMy,5058619230830195,"Please click on the link for important information regarding our Hybrid Program which will begin Tuesday, September 8th.

https://conta.cc/3hOQCMy",https://facebook.com/story.php?story_fbid=5058619230830195&id=116140448411456,"Return to School - Hybrid Program Information
Return to School 2020-2021 Home of the Falcons! ""We Achieve and Celebrate Educational Excellence"" Return to School 2020-2021 - Hybrid Program Information Dear FHUSD Families, Friends and Staff, Beginn

Return to School - Hybrid Program Information
Return to School 2020-2021 Home of the Falcons! ""We Achieve and Celebrate Educational Excellence"" Return to School 2020-2021 - Hybrid Program Information Dear FHUSD Families, Friends and Staff, Beginn

See more at
myemail.constantcontact.com",0.0,"Please click on the link for important information regarding our Hybrid Program which will begin Tuesday, September 8th.

https://conta.cc/3hOQCMy

Return to School - Hybrid Program Information
Return to School 2020-2021 Home of the Falcons! ""We Achieve and Celebrate Educational Excellence"" Return to School 2020-2021 - Hybrid Program Information Dear FHUSD Families, Friends and Staff, Beginn

Return to School - Hybrid Program Information
Return to School 2020-2021 Home of the Falcons! ""We Achieve and Celebrate Educational Excellence"" Return to School 2020-2021 - Hybrid Program Information Dear FHUSD Families, Friends and Staff, Beginn

See more at
myemail.constantcontact.com",2020-08-31 18:32:18,,
16,0.0,https://scontent-atl3-1.xx.fbcdn.net/v/t1.0-9/fr/cp0/e15/q65/118254087_5042478689110916_5852773020333947613_n.jpg?_nc_cat=111&_nc_sid=8024bb&_nc_ohc=TwzzQTuC_akAX8Vebgg&_nc_ht=scontent-atl3-1.xx&tp=14&oh=ff172c3627208d1c3f73135d80663b63&oe=5F80D98D,22.0,,5042482289110556,More celebration of a new school year! These smiles say it all. #Falconpride,https://facebook.com/story.php?story_fbid=5042482289110556&id=116140448411456,,0.0,More celebration of a new school year! These smiles say it all. #Falconpride,2020-08-28 18:30:01,,
17,6.0,https://scontent-atl3-1.xx.fbcdn.net/v/t1.0-9/fr/cp0/e15/q65/118117731_5042408582451260_1401680425069820630_o.jpg?_nc_cat=104&_nc_sid=8024bb&_nc_ohc=l_XywEe9MVAAX-KAv88&_nc_ht=scontent-atl3-1.xx&tp=14&oh=a58a78707bc0cbeee692391631b0c086&oe=5F8007D2,52.0,,5042462135779238,We're all happy it's a Falcon Friday at the District Office and we love to embrace our #Falconpride!,https://facebook.com/story.php?story_fbid=5042462135779238&id=116140448411456,,0.0,We're all happy it's a Falcon Friday at the District Office and we love to embrace our #Falconpride!,2020-08-28 16:11:50,,
18,1.0,https://scontent-atl3-1.xx.fbcdn.net/v/t1.0-9/fr/cp0/e15/q65/118287076_5042468205778631_5974821853481904345_n.jpg?_nc_cat=111&_nc_sid=8024bb&_nc_ohc=qlGyVgA3GYUAX-4yGHy&_nc_ht=scontent-atl3-1.xx&tp=14&oh=d90dccc9df7b75ce35046190d1e60e0d&oe=5F82FDB9,25.0,,5042471192444999,"We just love how these kids are set up for successful virtual learning!
#FHUSDvirtuallearning",https://facebook.com/story.php?story_fbid=5042471192444999&id=116140448411456,,0.0,"We just love how these kids are set up for successful virtual learning!
#FHUSDvirtuallearning",2020-08-28 14:49:53,,
19,0.0,https://scontent-atl3-1.xx.fbcdn.net/v/t1.0-9/fr/cp0/e15/q65/118519502_3169037526477763_7552019665823161340_o.jpg?_nc_cat=111&_nc_sid=110474&_nc_ohc=5aXpVkT0H98AX-yapGt&_nc_ht=scontent-atl3-1.xx&tp=14&oh=454cff7a5969fb3027e4ed03bed91813&oe=5F8117FC,19.0,,5037845066240945,💙 What's not to love about this? 💙,https://facebook.com/story.php?story_fbid=5037845066240945&id=116140448411456,"Fountain Hills Middle School
August 26 at 7:50 AM ·

Today’s vibe!",0.0,"💙 What's not to love about this? 💙

Fountain Hills Middle School
August 26 at 7:50 AM ·

Today’s vibe!",2020-08-27 18:05:34,,
20,0.0,,30.0,,5037830739575711,"Let's keep celebrating a new school year! A new grade, for some a new school and soon enough seeing old friends and making new ones! #Falconsforlife!",https://facebook.com/story.php?story_fbid=5037830739575711&id=116140448411456,,0.0,"Let's keep celebrating a new school year! A new grade, for some a new school and soon enough seeing old friends and making new ones! #Falconsforlife!",2020-08-27 18:01:48,,
21,18.0,https://scontent-atl3-1.xx.fbcdn.net/v/t1.0-9/fr/cp0/e15/q65/118353872_5031210003571118_6144270005559981474_o.jpg?_nc_cat=105&_nc_sid=8024bb&_nc_ohc=VqQMd7VTmnQAX8We1wR&_nc_ht=scontent-atl3-1.xx&tp=14&oh=8e434ca10fc62a1fd327ebe317453519&oe=5F8353D1,52.0,,5031211700237615,"Please welcome Brenda Samaniego to Fountain Hills Unified School District.

Brenda is new to Arizona, having relocated from Texas one year ago. She graduated from the University of Texas with a B.A.in Psychology, and a certification in Elementary Education. She has been in education for 24 years.

Brenda has three wonderful children with whom she spends a lot of her free time. Two of the three live in Scottsdale. She enjoys traveling, exercising, and gardening.

Brenda is thrilled to be a part of the Fountain Hills Unified School District, especially her first grade teaching assignment at McDowell Mountain Elementary!

Welcome to the Falcon Family Brenda!",https://facebook.com/story.php?story_fbid=5031211700237615&id=116140448411456,,0.0,"Please welcome Brenda Samaniego to Fountain Hills Unified School District.

Brenda is new to Arizona, having relocated from Texas one year ago. She graduated from the University of Texas with a B.A.in Psychology, and a certification in Elementary Education. She has been in education for 24 years.

Brenda has three wonderful children with whom she spends a lot of her free time. Two of the three live in Scottsdale. She enjoys traveling, exercising, and gardening.

Brenda is thrilled to be a part of the Fountain Hills Unified School District, especially her first grade teaching assignment at McDowell Mountain Elementary!

Welcome to the Falcon Family Brenda!",2020-08-27 12:00:26,,
22,0.0,https://scontent-atl3-1.xx.fbcdn.net/v/t1.0-9/fr/cp0/e15/q65/118131582_5032392083452910_3515420228460337029_n.jpg?_nc_cat=103&_nc_sid=8024bb&_nc_ohc=qdrLibeffGkAX_AxJA0&_nc_ht=scontent-atl3-1.xx&tp=14&oh=c4cb11367398b5782d2ca633cdd6273f&oe=5F8299FE,35.0,,5032398730118912,This is how the these girls roll with their virtual learning! #FHUSDvirtuallearning,https://facebook.com/story.php?story_fbid=5032398730118912&id=116140448411456,,0.0,This is how the these girls roll with their virtual learning! #FHUSDvirtuallearning,2020-08-26 17:19:09,,
23,16.0,https://scontent-atl3-1.xx.fbcdn.net/v/t1.0-9/fr/cp0/e15/q65/117959529_5026905194001599_1711233811520684639_o.jpg?_nc_cat=108&_nc_sid=8024bb&_nc_ohc=KSDdO7vG6YYAX-Toi8v&_nc_ht=scontent-atl3-1.xx&tp=14&oh=bc23fce77be7b14deebfe219af427c21&oe=5F824D15,51.0,,5026906250668160,,https://facebook.com/story.php?story_fbid=5026906250668160&id=116140448411456,,0.0,,2020-08-26 13:00:37,,
24,15.0,https://scontent-atl3-1.xx.fbcdn.net/v/t1.0-9/fr/cp0/e15/q65/118284933_5026403624051756_4513637613961167092_n.jpg?_nc_cat=109&_nc_sid=8024bb&_nc_ohc=QnG4Luo8TkAAX96Ozmc&_nc_ht=scontent-atl3-1.xx&tp=14&oh=432e7cfc4b14ccf2e121872b63e1cbf9&oe=5F809FD4,41.0,,5026405317384920,,https://facebook.com/story.php?story_fbid=5026405317384920&id=116140448411456,,0.0,,2020-08-25 13:16:17,,
25,0.0,,4.0,http://web-extract.constantcontact.com/v1/social_annotation_v2?permalink_uri=https%3A%2F%2Fmyemail.constantcontact.com%2FA-Year-s-Worth-of-Hometown-Perks-.html%3Fsoid%3D1102037584410%26aid%3D7gi0cHxqfDs&image_url=https%3A%2F%2Ffiles.constantcontact.com%2Fa1a0f869001%2Fb651bf9a-2a01-4328-88c1-8c097bcc782a.png,5022543627771089,Supporting our community and our PTO...it's a win win!,https://facebook.com/story.php?story_fbid=5022543627771089&id=116140448411456,"WEB-EXTRACT.CONSTANTCONTACT.COM
A Year's Worth of Hometown Perks!",0.0,"Supporting our community and our PTO...it's a win win!

WEB-EXTRACT.CONSTANTCONTACT.COM
A Year's Worth of Hometown Perks!",2020-08-24 18:53:35,,
26,0.0,https://scontent-atl3-1.xx.fbcdn.net/v/t1.0-9/fr/cp0/e15/q65/118530545_5022528041105981_8461591684996886822_n.jpg?_nc_cat=105&_nc_sid=8024bb&_nc_ohc=DT_QM0bjp-wAX_1WH3z&_nc_ht=scontent-atl3-1.xx&tp=14&oh=9b57c99c7828e1b222043944f4927c97&oe=5F804F9D,39.0,,5022529607772491,"It's another strong virtual start to the week! Happy learning Falcons!
#FHUSDvirtuallearning",https://facebook.com/story.php?story_fbid=5022529607772491&id=116140448411456,,0.0,"It's another strong virtual start to the week! Happy learning Falcons!
#FHUSDvirtuallearning",2020-08-24 18:48:48,,
27,1.0,https://scontent-atl3-1.xx.fbcdn.net/v/t1.0-9/fr/cp0/e15/q65/117840939_5006098036082315_5595798513531624139_n.jpg?_nc_cat=103&_nc_sid=8024bb&_nc_ohc=-9N6Pbwpe1sAX-LfbxV&_nc_ht=scontent-atl3-1.xx&tp=14&oh=99e86936efb54363cc1c5fc57826debc&oe=5F8227C8,31.0,,5006104019415050,It's been another great week of virtual learning in Fountain Hills! #FHUSDvirtuallearning,https://facebook.com/story.php?story_fbid=5006104019415050&id=116140448411456,,0.0,It's been another great week of virtual learning in Fountain Hills! #FHUSDvirtuallearning,2020-08-21 11:32:24,,
28,0.0,https://scontent-atl3-1.xx.fbcdn.net/v/t1.0-9/fr/cp0/e15/q65/117758059_5001199166572202_3623219292299942496_n.jpg?_nc_cat=106&_nc_sid=8024bb&_nc_ohc=DV3rOchTDm0AX-t18qH&_nc_ht=scontent-atl3-1.xx&tp=14&oh=c4c4bb10baf242b197caa720fb0ca3b2&oe=5F811AFF,34.0,,5001205669904885,It's never too late to celebrate the first day of a new grade! #Falconsforlife!,https://facebook.com/story.php?story_fbid=5001205669904885&id=116140448411456,,0.0,It's never too late to celebrate the first day of a new grade! #Falconsforlife!,2020-08-20 11:51:11,,
29,0.0,https://scontent-atl3-1.xx.fbcdn.net/v/t1.0-9/fr/cp0/e15/q65/117704568_4996660643692721_7392600655023357817_o.jpg?_nc_cat=102&_nc_sid=8024bb&_nc_ohc=IME_7fOKJm4AX8gkUnj&_nc_ht=scontent-atl3-1.xx&tp=14&oh=0ae250b65a59c1b8840c251ee7c54d5b&oe=5F838C63,32.0,,4996664077025711,"Look at these amazing virtual learners! The Good, Boersma and Stumpf families have this down! Whether you have set up a work station at home or you have taken it on the road, keep that virtual learning flowing! #FHUSDvirtuallearning",https://facebook.com/story.php?story_fbid=4996664077025711&id=116140448411456,,0.0,"Look at these amazing virtual learners! The Good, Boersma and Stumpf families have this down! Whether you have set up a work station at home or you have taken it on the road, keep that virtual learning flowing! #FHUSDvirtuallearning",2020-08-19 13:48:31,,
30,0.0,,7.0,https://conta.cc/2FBuB5r,4996619970363455,"View our latest Superintendent's Falcon Focus by clicking on the link below.

https://conta.cc/2FBuB5r",https://facebook.com/story.php?story_fbid=4996619970363455&id=116140448411456,"MYEMAIL.CONSTANTCONTACT.COM
Superintendent's Falcon Focus - August 19, 2020",2.0,"View our latest Superintendent's Falcon Focus by clicking on the link below.

https://conta.cc/2FBuB5r

MYEMAIL.CONSTANTCONTACT.COM
Superintendent's Falcon Focus - August 19, 2020",2020-08-19 13:36:46,,
31,0.0,https://scontent-atl3-1.xx.fbcdn.net/v/t1.0-9/fr/cp0/e15/q65/117267777_4972820549410064_3923208266598453831_n.jpg?_nc_cat=104&_nc_sid=8024bb&_nc_ohc=IhHxCc9QTVgAX9coOrW&_nc_ht=scontent-atl3-1.xx&tp=14&oh=4b09e436bcb21430207c5f2dd0ccdf43&oe=5F8083A0,30.0,,4972822782743174,"We end our first ""virtual"" week with these happy learners. Thanks to the Wilson and Lettieri families for sharing your virtual learning with us! Happy weekend all!
#FHUSDvirtuallearning",https://facebook.com/story.php?story_fbid=4972822782743174&id=116140448411456,,0.0,"We end our first ""virtual"" week with these happy learners. Thanks to the Wilson and Lettieri families for sharing your virtual learning with us! Happy weekend all!
#FHUSDvirtuallearning",2020-08-14 18:22:00,,
32,0.0,,1.0,http://web-extract.constantcontact.com/v1/social_annotation_v2?permalink_uri=https%3A%2F%2Fmyemail.constantcontact.com%2FCOIN-DRIVE-UPDATE-.html%3Fsoid%3D1102037584410%26aid%3D8KbZPFjPl4c&image_url=https%3A%2F%2Fmlsvc01-prod.s3.amazonaws.com%2Fa1a0f869001%2F21051ffe-0fe5-4fab-9eb0-77d6667b8eed.jpg%3Fver%3D1595290402000,4971284992896953,Today is the last day of the PTO Coin Drive. Click on the link to make your donation!,https://facebook.com/story.php?story_fbid=4971284992896953&id=116140448411456,"WEB-EXTRACT.CONSTANTCONTACT.COM
COIN DRIVE UPDATE!

Fountain Hills PTO
August 14 at 6:06 AM ·

COIN DRIVE UPDATE!",0.0,"Today is the last day of the PTO Coin Drive. Click on the link to make your donation!

WEB-EXTRACT.CONSTANTCONTACT.COM
COIN DRIVE UPDATE!

Fountain Hills PTO
August 14 at 6:06 AM ·

COIN DRIVE UPDATE!",2020-08-14 11:01:43,,
33,0.0,,0.0,http://web-extract.constantcontact.com/v1/social_annotation_v2?permalink_uri=https%3A%2F%2Fmyemail.constantcontact.com%2FCOIN-DRIVE-UPDATE-.html%3Fsoid%3D1102037584410%26aid%3D8KbZPFjPl4c&image_url=https%3A%2F%2Fmlsvc01-prod.s3.amazonaws.com%2Fa1a0f869001%2F21051ffe-0fe5-4fab-9eb0-77d6667b8eed.jpg%3Fver%3D1595290402000,,,https://facebook.com/story.php?story_fbid=10158406885079043&id=274401099042,"Fountain Hills PTO
August 14 at 6:06 AM ·

COIN DRIVE UPDATE!",0.0,"Fountain Hills PTO
August 14 at 6:06 AM ·

COIN DRIVE UPDATE!",2020-09-12 00:30:26.972196,,
34,2.0,,43.0,,4968036529888466,"FHUSD is celebrating the start to our 2020-21 school year with our #FHUSDvirtuallearning campaign. Over the next three weeks we will be sharing pictures of our virtual learners via Facebook and our district website. If you'd like us to share your virtual learners, please email your pictures to Krista Andreae at kandreae@fhacademics.org. You can even tag your own social media posts with #FHUSDvirtuallearning to keep the ""technology"" flowing. We can't wait to show off our Falcons!

*A special thank you to the Reed, Baxter and Rees families for being our first Falcons helping us to celebrate our virtual learning!",https://facebook.com/story.php?story_fbid=4968036529888466&id=116140448411456,,0.0,"FHUSD is celebrating the start to our 2020-21 school year with our #FHUSDvirtuallearning campaign. Over the next three weeks we will be sharing pictures of our virtual learners via Facebook and our district website. If you'd like us to share your virtual learners, please email your pictures to Krista Andreae at kandreae@fhacademics.org. You can even tag your own social media posts with #FHUSDvirtuallearning to keep the ""technology"" flowing. We can't wait to show off our Falcons!

*A special thank you to the Reed, Baxter and Rees families for being our first Falcons helping us to celebrate our virtual learning!",2020-08-13 19:36:12,,
35,0.0,,2.0,https://conta.cc/33MW3Hw,4952442358114550,"The District has limited childcare available from August 17th - September 4th. If you are interested in being considered for one of our limited spots, please click on the link to access the survey.

https://conta.cc/33MW3Hw",https://facebook.com/story.php?story_fbid=4952442358114550&id=116140448411456,"MYEMAIL.CONSTANTCONTACT.COM
Limited District Child Care Available",0.0,"The District has limited childcare available from August 17th - September 4th. If you are interested in being considered for one of our limited spots, please click on the link to access the survey.

https://conta.cc/33MW3Hw

MYEMAIL.CONSTANTCONTACT.COM
Limited District Child Care Available",2020-08-10 14:54:10,,
36,0.0,,3.0,https://conta.cc/3fLEutA,4951639671528152,"FHHS Families - Click on the link for the first day of school schedule with Google Meet links. Enjoy the week!

https://conta.cc/3fLEutA",https://facebook.com/story.php?story_fbid=4951639671528152&id=116140448411456,"MYEMAIL.CONSTANTCONTACT.COM
FHHS First Day of School Schedule - August 10, 2020",0.0,"FHHS Families - Click on the link for the first day of school schedule with Google Meet links. Enjoy the week!

https://conta.cc/3fLEutA

MYEMAIL.CONSTANTCONTACT.COM
FHHS First Day of School Schedule - August 10, 2020",2020-08-10 11:25:48,,
37,0.0,,0.0,https://conta.cc/33IjYrC,4951589938199792,"Please click on the link for important information regarding breakfast and lunch pick up.

https://conta.cc/33IjYrC",https://facebook.com/story.php?story_fbid=4951589938199792&id=116140448411456,"MYEMAIL.CONSTANTCONTACT.COM
Important Information Regarding Breakfast and Lunch Pick Up - August 10, 2020",0.0,"Please click on the link for important information regarding breakfast and lunch pick up.

https://conta.cc/33IjYrC

MYEMAIL.CONSTANTCONTACT.COM
Important Information Regarding Breakfast and Lunch Pick Up - August 10, 2020",2020-08-10 11:12:49,,
38,0.0,,5.0,https://conta.cc/2PEMsKM,4948878871804232,"Please click on the link to the Superintendent's Falcon Focus.

https://conta.cc/2PEMsKM",https://facebook.com/story.php?story_fbid=4948878871804232&id=116140448411456,"MYEMAIL.CONSTANTCONTACT.COM
Superintendent's Falcon Focus - August 9, 2020",11.0,"Please click on the link to the Superintendent's Falcon Focus.

https://conta.cc/2PEMsKM

MYEMAIL.CONSTANTCONTACT.COM
Superintendent's Falcon Focus - August 9, 2020",2020-08-09 21:12:49,,
39,0.0,,3.0,https://conta.cc/3iqGYzr,4948834215142031,"FHMS Families - Click on the link for more information for 4, 5 and 7th grade Back to School / Meet the teacher. 6th and 8th grade will follow tomorrow morning.

https://conta.cc/3iqGYzr",https://facebook.com/story.php?story_fbid=4948834215142031&id=116140448411456,"MYEMAIL.CONSTANTCONTACT.COM
FHMS Back to School/Meet the Teacher",2.0,"FHMS Families - Click on the link for more information for 4, 5 and 7th grade Back to School / Meet the teacher. 6th and 8th grade will follow tomorrow morning.

https://conta.cc/3iqGYzr

MYEMAIL.CONSTANTCONTACT.COM
FHMS Back to School/Meet the Teacher",2020-08-09 20:57:46,,
40,0.0,,5.0,https://conta.cc/3abntIc,4948642961827823,"FHHS Families - Click on the link for more information on tomorrow's Falcon Fest and Meet the Teacher.

https://conta.cc/3abntIc",https://facebook.com/story.php?story_fbid=4948642961827823&id=116140448411456,"FHHS Falcon Fest/Meet the Teacher

FHHS Falcon Fest/Meet the Teacher

See more at
myemail.constantcontact.com",0.0,"FHHS Families - Click on the link for more information on tomorrow's Falcon Fest and Meet the Teacher.

https://conta.cc/3abntIc

FHHS Falcon Fest/Meet the Teacher

FHHS Falcon Fest/Meet the Teacher

See more at
myemail.constantcontact.com",2020-08-09 19:54:56,,
41,0.0,,0.0,https://conta.cc/3abntIc,4948639028494883,"FHHS Parents - Click on the link for information regarding tomorrow's Falcon Fest and Meet the Teacher.

https://conta.cc/3abntIc",https://facebook.com/story.php?story_fbid=4948639028494883&id=116140448411456,"FHHS Falcon Fest/Meet the Teacher

FHHS Falcon Fest/Meet the Teacher

See more at
myemail.constantcontact.com",0.0,"FHHS Parents - Click on the link for information regarding tomorrow's Falcon Fest and Meet the Teacher.

https://conta.cc/3abntIc

FHHS Falcon Fest/Meet the Teacher

FHHS Falcon Fest/Meet the Teacher

See more at
myemail.constantcontact.com",2020-08-09 19:52:52,,
42,0.0,https://scontent-atl3-1.xx.fbcdn.net/v/t1.0-9/fr/cp0/e15/q65/116799067_10158389137429043_4806766931096283237_n.jpg?_nc_cat=102&_nc_sid=110474&_nc_ohc=rY10jU4tTRYAX_8ubnP&_nc_ht=scontent-atl3-1.xx&tp=14&oh=05b5da8eaa15cc43372e23bb26113216&oe=5F80E62D,13.0,,4937404259618360,"Take your coins when you head out to Chromebook Distribution today and Monday and drop a few in the PTO's bucket. The more they get, the more they can offer to the amazing programs they support district wide. 💰💵💰",https://facebook.com/story.php?story_fbid=4937404259618360&id=116140448411456,"Fountain Hills PTO
August 7 at 7:53 AM ·

PTO is set up and ready to go!

Find our table today during chrome book drive thru pick up at FHHS, FHMS or MMES. We have missed you all. 💙💙💙

Fountain Hills High School Fountain Hills Middle School McDowell Mountain Elementary School",0.0,"Take your coins when you head out to Chromebook Distribution today and Monday and drop a few in the PTO's bucket. The more they get, the more they can offer to the amazing programs they support district wide. 💰💵💰

Fountain Hills PTO
August 7 at 7:53 AM ·

PTO is set up and ready to go!

Find our table today during chrome book drive thru pick up at FHHS, FHMS or MMES. We have missed you all. 💙💙💙

Fountain Hills High School Fountain Hills Middle School McDowell Mountain Elementary School",2020-08-07 12:58:34,,
43,0.0,,7.0,,4927883753903744,What a great way to support our Booster!,https://facebook.com/story.php?story_fbid=4927883753903744&id=116140448411456,"Fountain Hills Athletic Booster Club
August 2 at 2:32 PM ·

Stay healthy & safe while supporting our amazing FH Falcons. Falcon Gaiters Preorders are closed. Gaiters available soon for $10.00 each.",0.0,"What a great way to support our Booster!

Fountain Hills Athletic Booster Club
August 2 at 2:32 PM ·

Stay healthy & safe while supporting our amazing FH Falcons. Falcon Gaiters Preorders are closed. Gaiters available soon for $10.00 each.",2020-08-05 14:16:01,,
44,0.0,,6.0,https://conta.cc/3fxNin0,4927850603907059,"Happy Wednesday Falcons! Please click on the link below for our Chromebook Distribution Plan which will take place this Friday, August 7th and Monday August, 10th.

https://conta.cc/3fxNin0",https://facebook.com/story.php?story_fbid=4927850603907059&id=116140448411456,"MYEMAIL.CONSTANTCONTACT.COM
Chromebook Distribution Plan - August 5, 2020",2.0,"Happy Wednesday Falcons! Please click on the link below for our Chromebook Distribution Plan which will take place this Friday, August 7th and Monday August, 10th.

https://conta.cc/3fxNin0

MYEMAIL.CONSTANTCONTACT.COM
Chromebook Distribution Plan - August 5, 2020",2020-08-05 14:07:52,,
45,0.0,,22.0,,4904513942907392,,https://facebook.com/story.php?story_fbid=4904513942907392&id=116140448411456,,0.0,,2020-07-31 19:42:48,,
46,1.0,,14.0,https://conta.cc/2Etk63I,4889664961058957,"Here is a link with the latest information on our school reopening plan:

https://conta.cc/2Etk63I",https://facebook.com/story.php?story_fbid=4889664961058957&id=116140448411456,"MYEMAIL.CONSTANTCONTACT.COM
School Reopening Update July 28, 2020",15.0,"Here is a link with the latest information on our school reopening plan:

https://conta.cc/2Etk63I

MYEMAIL.CONSTANTCONTACT.COM
School Reopening Update July 28, 2020",2020-07-28 19:33:26,,
47,25.0,https://scontent-atl3-1.xx.fbcdn.net/v/t1.0-9/fr/cp0/e15/q65/110221148_4870100419682078_5788114237711152834_o.jpg?_nc_cat=105&_nc_sid=8024bb&_nc_ohc=yL44LFBPHtgAX9K9P5P&_nc_ht=scontent-atl3-1.xx&tp=14&oh=2862439fb0ae4ebf28d16a6c65bbb4b1&oe=5F82785B,58.0,,4870101039682016,,https://facebook.com/story.php?story_fbid=4870101039682016&id=116140448411456,,0.0,,2020-07-24 17:44:41,,
48,30.0,,44.0,,4864327416926045,,https://facebook.com/story.php?story_fbid=4864327416926045&id=116140448411456,,0.0,,2020-07-23 13:15:56,,
49,0.0,,9.0,https://conta.cc/32MqZqS,4860728127285974,"Here is the link to the Superintendent's Falcon Focus with updated information for our school reopening plan.

https://conta.cc/32MqZqS July 22, 2020",https://facebook.com/story.php?story_fbid=4860728127285974&id=116140448411456,"Superintendent's Falcon Focus July 22, 2020

Superintendent's Falcon Focus July 22, 2020

See more at
myemail.constantcontact.com",0.0,"Here is the link to the Superintendent's Falcon Focus with updated information for our school reopening plan.

https://conta.cc/32MqZqS July 22, 2020

Superintendent's Falcon Focus July 22, 2020

Superintendent's Falcon Focus July 22, 2020

See more at
myemail.constantcontact.com",2020-07-22 18:27:51,,
50,0.0,,0.0,https://conta.cc/32MqZqS,4860726857286101,"Here is the link to the Superintendent's Falcon Focus with updated information for our school reopening plan.

https://conta.cc/32MqZqS July 22, 2020",https://facebook.com/story.php?story_fbid=4860726857286101&id=116140448411456,"Superintendent's Falcon Focus July 22, 2020

Superintendent's Falcon Focus July 22, 2020

See more at
myemail.constantcontact.com",0.0,"Here is the link to the Superintendent's Falcon Focus with updated information for our school reopening plan.

https://conta.cc/32MqZqS July 22, 2020

Superintendent's Falcon Focus July 22, 2020

Superintendent's Falcon Focus July 22, 2020

See more at
myemail.constantcontact.com",2020-07-22 18:27:29,,
51,0.0,,5.0,https://conta.cc/3j0tbRn,4827425117282942,"Here is a link to the superintendents Falcon Focus with important information regarding our school reopening plan.

https://conta.cc/3j0tbRn - 7/15",https://facebook.com/story.php?story_fbid=4827425117282942&id=116140448411456,"MYEMAIL.CONSTANTCONTACT.COM
Superintendent's Falcon Focus July 15, 2020",2.0,"Here is a link to the superintendents Falcon Focus with important information regarding our school reopening plan.

https://conta.cc/3j0tbRn - 7/15

MYEMAIL.CONSTANTCONTACT.COM
Superintendent's Falcon Focus July 15, 2020",2020-07-15 13:18:49,,
52,24.0,https://scontent-atl3-1.xx.fbcdn.net/v/t1.0-9/fr/cp0/e15/q65/107869712_4817665501592237_8456819265176096184_o.jpg?_nc_cat=101&_nc_sid=8024bb&_nc_ohc=LAGWb5RQ3hkAX8UBfst&_nc_ht=scontent-atl3-1.xx&tp=14&oh=d687c687c6812e79e85973212f582e0e&oe=5F8285D8,49.0,,4817669341591853,"Alexandra is very excited to be part of the FHUSD community as the Human Resource Coordinator!
Alexandra is excited to learn everything she can about FHUSD.

Alexandra is originally from California but fell in love with the desert when she attended Grand
Canyon University. Ms. Means graduated Cum Laude with her Bachelor’s in Business
Management, from GCU. Less than a year later, she graduated with her Master’s in Business
Administration with an Emphasis in Strategic Human Resources, from GCU as well. She is
new to the administrative side of education but is excited to gain knowledge within this field.

Alexandra is a proud dog mom of a German Shepherd named Nala, who keeps her very active.
She is also an avid traveler, especially to California where most of her family resides including her two-year-old nephew, Josiah, who keeps her smiling.

Alexandra Means has already seen how FHUSD is an amazing community and is so excited to see what develops in her time at FHUSD.

Welcome Alexandra!",https://facebook.com/story.php?story_fbid=4817669341591853&id=116140448411456,,0.0,"Alexandra is very excited to be part of the FHUSD community as the Human Resource Coordinator!
Alexandra is excited to learn everything she can about FHUSD.

Alexandra is originally from California but fell in love with the desert when she attended Grand
Canyon University. Ms. Means graduated Cum Laude with her Bachelor’s in Business
Management, from GCU. Less than a year later, she graduated with her Master’s in Business
Administration with an Emphasis in Strategic Human Resources, from GCU as well. She is
new to the administrative side of education but is excited to gain knowledge within this field.

Alexandra is a proud dog mom of a German Shepherd named Nala, who keeps her very active.
She is also an avid traveler, especially to California where most of her family resides including her two-year-old nephew, Josiah, who keeps her smiling.

Alexandra Means has already seen how FHUSD is an amazing community and is so excited to see what develops in her time at FHUSD.

Welcome Alexandra!",2020-07-15 13:00:54,,
53,18.0,https://scontent-atl3-1.xx.fbcdn.net/v/t1.0-9/fr/cp0/e15/q65/107476789_4817616324930488_6284240794650918634_o.jpg?_nc_cat=109&_nc_sid=8024bb&_nc_ohc=-ThFXb761fsAX-LGII-&_nc_ht=scontent-atl3-1.xx&tp=14&oh=fa3bb8fb8196543fefe4d194935c07e8&oe=5F827D92,40.0,,4817624101596377,"Denise Rose is excited to join the team at McDowell Mountain Elementary School as a special education teacher for the 2020-2021 school year.

Ms Rose is 44 years old and was born and raised in Scottsdale, Arizona. She has a sister who was born with Hydrophilic (water on the brain), which influenced her to go into special education due to her sister's struggles growing up. Denise got her degree from Arizona State University (ASU) in 2003 with a degree in Interdisciplinary Studies. She received her masters in December 2015 from ASU with a degree in Special Education Cross Categorical and an Elementary Education certification. Ms Rose has taught students with autism for the past 10 years and co taught a 7th grade math class for a year.

Denise also has a pug named Olive that is a year old. In her spare time she enjoys spending time with her family and taking daily trips around Arizona.

Welcome Denise!",https://facebook.com/story.php?story_fbid=4817624101596377&id=116140448411456,,0.0,"Denise Rose is excited to join the team at McDowell Mountain Elementary School as a special education teacher for the 2020-2021 school year.

Ms Rose is 44 years old and was born and raised in Scottsdale, Arizona. She has a sister who was born with Hydrophilic (water on the brain), which influenced her to go into special education due to her sister's struggles growing up. Denise got her degree from Arizona State University (ASU) in 2003 with a degree in Interdisciplinary Studies. She received her masters in December 2015 from ASU with a degree in Special Education Cross Categorical and an Elementary Education certification. Ms Rose has taught students with autism for the past 10 years and co taught a 7th grade math class for a year.

Denise also has a pug named Olive that is a year old. In her spare time she enjoys spending time with her family and taking daily trips around Arizona.

Welcome Denise!",2020-07-14 13:00:45,,
54,23.0,https://scontent-atl3-1.xx.fbcdn.net/v/t1.0-9/fr/cp0/e15/q65/107512200_4800729849952469_1445455036380928473_o.jpg?_nc_cat=101&_nc_sid=8024bb&_nc_ohc=Dk6veLT7i-EAX-PycEr&_nc_ht=scontent-atl3-1.xx&tp=14&oh=3ec1fa04f15ac2c94a317d6d2b084163&oe=5F813C1D,68.0,,4800730993285688,,https://facebook.com/story.php?story_fbid=4800730993285688&id=116140448411456,,0.0,,2020-07-09 15:49:00,,
55,0.0,,6.0,https://conta.cc/2YLLgdA,4760522243973230,"Here is the link to the Superintendent's Falcon Focus.

https://conta.cc/2YLLgdA 6/30/2020",https://facebook.com/story.php?story_fbid=4760522243973230&id=116140448411456,"Superintendent's Falcon Focus 6/30/2020

Superintendent's Falcon Focus 6/30/2020

See more at
myemail.constantcontact.com",0.0,"Here is the link to the Superintendent's Falcon Focus.

https://conta.cc/2YLLgdA 6/30/2020

Superintendent's Falcon Focus 6/30/2020

Superintendent's Falcon Focus 6/30/2020

See more at
myemail.constantcontact.com",2020-06-30 17:49:49,,
56,1.0,,3.0,https://conta.cc/3fXYObE,4733785309980257,"Here is the link to the Superintendent's Falcon Focus.
https://conta.cc/3fXYObE 6/24/2020",https://facebook.com/story.php?story_fbid=4733785309980257&id=116140448411456,"MYEMAIL.CONSTANTCONTACT.COM
Superintendent's Falcon Focus 6/24/2020",3.0,"Here is the link to the Superintendent's Falcon Focus.
https://conta.cc/3fXYObE 6/24/2020

MYEMAIL.CONSTANTCONTACT.COM
Superintendent's Falcon Focus 6/24/2020",2020-06-24 18:59:31,,
57,29.0,https://scontent-atl3-1.xx.fbcdn.net/v/t1.0-9/102582713_4693387760686679_3681867904006073473_n.png?_nc_cat=107&_nc_sid=8024bb&_nc_ohc=8fWSu4t6RekAX-jDlFk&_nc_ht=scontent-atl3-1.xx&oh=b154b5854b0ecbbb6e19e1044f6cc5a4&oe=5F80918C,68.0,,4693388427353279,"Please welcome back Sarah Yaron to FHUSD. Sarah has been teaching language arts and reading to students with special needs for ten years. Seven of those years were in Fountain Hills Unified School District. After a five-year hiatus taken to raise her twins, Sarah is happy to be teaching at Fountain Hills Middle School.
Sarah graduated from the University of Pittsburgh with a Bachelor of Science in Applied Developmental Psychology. She earned her post-baccalaureate in Special Education at Rio Salado College. Sarah’s has two standard teaching certificates in Special Education and General Education: Secondary. She is highly qualified to teach English and Middle Grades Language Arts and Reading. Sarah has ESL and SEI endorsements.
Sarah lives in Scottsdale with her husband, son, and daughter.
Welcome Sarah!",https://facebook.com/story.php?story_fbid=4693388427353279&id=116140448411456,,0.0,"Please welcome back Sarah Yaron to FHUSD. Sarah has been teaching language arts and reading to students with special needs for ten years. Seven of those years were in Fountain Hills Unified School District. After a five-year hiatus taken to raise her twins, Sarah is happy to be teaching at Fountain Hills Middle School.
Sarah graduated from the University of Pittsburgh with a Bachelor of Science in Applied Developmental Psychology. She earned her post-baccalaureate in Special Education at Rio Salado College. Sarah’s has two standard teaching certificates in Special Education and General Education: Secondary. She is highly qualified to teach English and Middle Grades Language Arts and Reading. Sarah has ESL and SEI endorsements.
Sarah lives in Scottsdale with her husband, son, and daughter.
Welcome Sarah!",2020-06-17 13:00:25,,
58,33.0,,101.0,,4693352547356867,,https://facebook.com/story.php?story_fbid=4693352547356867&id=116140448411456,,0.0,,2020-06-16 13:00:35,,
59,37.0,https://scontent-atl3-1.xx.fbcdn.net/v/t1.0-9/fr/cp0/e15/q65/102988840_4672215669470555_8236811832815326307_o.jpg?_nc_cat=103&_nc_sid=8024bb&_nc_ohc=iIE93Y3Yt3QAX9cDNo0&_nc_ht=scontent-atl3-1.xx&tp=14&oh=4a8a99370050f5c62c2b3d917353ba83&oe=5F8037A4,101.0,,4672216486137140,"Please welcome Jose Espinosa Olalde to FHUSD. He is very excited to be a part of your community serving as a custodian.

Jose previously worked in the equestrian world where he was in charge of the wellbeing and schedules of horses, both at their home barn and at shows. Horses will always have a special place in his heart but he looks forward to his next stage in life.

He has called Fountain Hills his home for 4 years where he has settled with his wife Nadine. He spends his time off tending to his garden that is filled with a variety of fruits and vegetables. He also finds enjoyment in meeting new people and being a part of the community.

Welcome Jose!",https://facebook.com/story.php?story_fbid=4672216486137140&id=116140448411456,,0.0,"Please welcome Jose Espinosa Olalde to FHUSD. He is very excited to be a part of your community serving as a custodian.

Jose previously worked in the equestrian world where he was in charge of the wellbeing and schedules of horses, both at their home barn and at shows. Horses will always have a special place in his heart but he looks forward to his next stage in life.

He has called Fountain Hills his home for 4 years where he has settled with his wife Nadine. He spends his time off tending to his garden that is filled with a variety of fruits and vegetables. He also finds enjoyment in meeting new people and being a part of the community.

Welcome Jose!",2020-06-12 13:00:05,,
60,52.0,https://scontent-atl3-1.xx.fbcdn.net/v/t1.0-9/fr/cp0/e15/q65/103511917_4672190002806455_2232380403159480464_o.jpg?_nc_cat=105&_nc_sid=8024bb&_nc_ohc=HW9zLy9fMsUAX_njuJI&_nc_ht=scontent-atl3-1.xx&tp=14&oh=bc7c085410be105bd98e329015b9c40f&oe=5F7FFBE3,106.0,,4672192146139574,,https://facebook.com/story.php?story_fbid=4672192146139574&id=116140448411456,,0.0,,2020-06-11 13:00:49,,
61,34.0,https://scontent-atl3-1.xx.fbcdn.net/v/t1.0-9/fr/cp0/e15/q65/103426926_4667972893228166_2875103111879025936_o.jpg?_nc_cat=104&_nc_sid=8024bb&_nc_ohc=HVg8eL1t-8wAX-Jh2Yh&_nc_ht=scontent-atl3-1.xx&tp=14&oh=081968744e53d2b285fa8aa988fef7d5&oe=5F80E987,82.0,,4667974016561387,"Please welcome Megan Johnson, to FHUSD. She is very excited to be apart of your creative community! She will be working as an art teacher at both the middle and high school. Megan is looking forward to helping students find a love for the arts, and their own artistic voice!

Megan graduated with a Bachelor of Fine Art from North Dakota State University, concentrating in painting and printmaking, in the spring of 2016. This Spring (May 2020) she earned a Master of Fine Arts concentrating in painting and drawing from Arizona State University. Megan has taught kindergarten art and a variety of art courses at ASU to undergraduate students that include 2d design, watercolor, and drawing. This will be her first year teaching middle school and high school art courses.
Megan has lived in the Phoenix area, for the last 4 years, and likes to spend her time painting, running, hiking, and traveling with her Fiancé.
Megan is so excited to be joining Fountain Hills School District, and feels very fortunate for the opportunity!

Welcome Megan!",https://facebook.com/story.php?story_fbid=4667974016561387&id=116140448411456,,0.0,"Please welcome Megan Johnson, to FHUSD. She is very excited to be apart of your creative community! She will be working as an art teacher at both the middle and high school. Megan is looking forward to helping students find a love for the arts, and their own artistic voice!

Megan graduated with a Bachelor of Fine Art from North Dakota State University, concentrating in painting and printmaking, in the spring of 2016. This Spring (May 2020) she earned a Master of Fine Arts concentrating in painting and drawing from Arizona State University. Megan has taught kindergarten art and a variety of art courses at ASU to undergraduate students that include 2d design, watercolor, and drawing. This will be her first year teaching middle school and high school art courses.
Megan has lived in the Phoenix area, for the last 4 years, and likes to spend her time painting, running, hiking, and traveling with her Fiancé.
Megan is so excited to be joining Fountain Hills School District, and feels very fortunate for the opportunity!

Welcome Megan!",2020-06-10 13:00:14,,
62,46.0,https://scontent-atl3-1.xx.fbcdn.net/v/t1.0-9/fr/cp0/e15/q65/103208861_4666659393359516_2919150418828260171_o.jpg?_nc_cat=105&_nc_sid=8024bb&_nc_ohc=0iVRl3XFKD4AX99amIU&_nc_ht=scontent-atl3-1.xx&tp=14&oh=dccaa15842b6dbe9d1a3f5eb0fcc8c2f&oe=5F814D16,124.0,,4666661183359337,"Please welcome Danielle Beasley to FHUSD. She is very excited to be apart of your community as the new Account Specialist. Danielle is looking forward to working with you and helping our students achieve success.

Danielle studied business administration at Strayer University in Orlando, FL. Danielle worked for the State of Florida for 11 years, before moving to AZ.

Danielle and her family moved to Fountain Hills in 2017. Danielle has a great husband & 3 children. Her oldest son graduated from Fountain Hills High School in 2019. She also has two children who attend Fountain Hills Middle School. Danielle and her family enjoy taking road trips and are huge foodies. Danielle enjoys cooking & baking for her family and neighbors.

Danielle is happy to be a part of the Fountain Hills community.

Welcome Danielle!",https://facebook.com/story.php?story_fbid=4666661183359337&id=116140448411456,,0.0,"Please welcome Danielle Beasley to FHUSD. She is very excited to be apart of your community as the new Account Specialist. Danielle is looking forward to working with you and helping our students achieve success.

Danielle studied business administration at Strayer University in Orlando, FL. Danielle worked for the State of Florida for 11 years, before moving to AZ.

Danielle and her family moved to Fountain Hills in 2017. Danielle has a great husband & 3 children. Her oldest son graduated from Fountain Hills High School in 2019. She also has two children who attend Fountain Hills Middle School. Danielle and her family enjoy taking road trips and are huge foodies. Danielle enjoys cooking & baking for her family and neighbors.

Danielle is happy to be a part of the Fountain Hills community.

Welcome Danielle!",2020-06-09 13:00:47,,
63,0.0,,6.0,https://conta.cc/2YiYIo9,4663913426967446,"Here is the link to the Superintendent's Falcon Focus.
https://conta.cc/2YiYIo9 6/8/2020",https://facebook.com/story.php?story_fbid=4663913426967446&id=116140448411456,"Superintendent's Falcon Focus 6/8/2020

Superintendent's Falcon Focus 6/8/2020

See more at
myemail.constantcontact.com",0.0,"Here is the link to the Superintendent's Falcon Focus.
https://conta.cc/2YiYIo9 6/8/2020

Superintendent's Falcon Focus 6/8/2020

Superintendent's Falcon Focus 6/8/2020

See more at
myemail.constantcontact.com",2020-06-08 20:32:23,,
64,23.0,https://scontent-atl3-1.xx.fbcdn.net/v/t1.0-9/fr/cp0/e15/q65/101506627_4638091719549617_6705203441007853568_o.jpg?_nc_cat=108&_nc_sid=8024bb&_nc_ohc=DSD5aYCfysoAX-TttpK&_nc_ht=scontent-atl3-1.xx&tp=14&oh=ac2a10f44a72676697a0b8775e6e7b7a&oe=5F824F28,69.0,,4638093072882815,"Welcome Stacy Morgan to FHUSD! Stacy recently moved back to Arizona from Colorado and is ready to call Fountain Hills her final home. As an Arizona State University alumni, Stacy has spent the last 13 years teaching Language Arts (10 of those in a Fort Worth middle school) with extra training in teaching writing. She is excited to take on the new challenges offered in FHUSD.

Stacy and her husband realize that AZ is the best place to experience the outdoor life such as hiking and boating that they both really enjoy. This also gives them a chance to be near their son, who is a senior at ASU, and other family members who are spread around Arizona. Their daughter is a veterinarian student at Texas A&M, and they can hardly wait for free vet care for their two German Shepherds and Golden Doodle.

Stacy is already feeling welcomed and excited about being part of the 4th grade team at Fountain Hills Middle School.

Welcome Stacy!",https://facebook.com/story.php?story_fbid=4638093072882815&id=116140448411456,,0.0,"Welcome Stacy Morgan to FHUSD! Stacy recently moved back to Arizona from Colorado and is ready to call Fountain Hills her final home. As an Arizona State University alumni, Stacy has spent the last 13 years teaching Language Arts (10 of those in a Fort Worth middle school) with extra training in teaching writing. She is excited to take on the new challenges offered in FHUSD.

Stacy and her husband realize that AZ is the best place to experience the outdoor life such as hiking and boating that they both really enjoy. This also gives them a chance to be near their son, who is a senior at ASU, and other family members who are spread around Arizona. Their daughter is a veterinarian student at Texas A&M, and they can hardly wait for free vet care for their two German Shepherds and Golden Doodle.

Stacy is already feeling welcomed and excited about being part of the 4th grade team at Fountain Hills Middle School.

Welcome Stacy!",2020-06-08 13:00:07,,
65,25.0,https://scontent-atl3-1.xx.fbcdn.net/v/t1.0-9/fr/cp0/e15/q65/97122063_4543531162339007_7373542563204038656_n.jpg?_nc_cat=106&_nc_sid=8024bb&_nc_ohc=dKlQUnScTrAAX_34JGH&_nc_ht=scontent-atl3-1.xx&tp=14&oh=0825333d09fad9e97688b65323583d44&oe=5F80D543,66.0,,4543533385672118,"Please welcome Laura Herron to FHUSD. She is very excited to be a part of your community as a math teacher at Fountain Hills Middle School.

Laura graduated from the University of Missouri with a Bachelor of Science in Elementary Education in 2011 and a Master’s in Mathematics Education, specializing in middle school mathematics in 2015. Laura obtained her Elementary Mathematics Specialist Certificate, as well. Laura taught elementary for 5 years before transitioning to secondary education for the last 4 years. She has taught in both Missouri and Texas.
Laura loves to spend time with her family. Her parents have been Fountain Hills residents for the last 10 years. She feels very lucky to be able to join the FHUSD team and be closer to them!
Outside of the classroom, Laura can be found hiking, camping, running, volunteering at local animal shelters, and serving her community through various ministries.
Welcome Laura!",https://facebook.com/story.php?story_fbid=4543533385672118&id=116140448411456,,0.0,"Please welcome Laura Herron to FHUSD. She is very excited to be a part of your community as a math teacher at Fountain Hills Middle School.

Laura graduated from the University of Missouri with a Bachelor of Science in Elementary Education in 2011 and a Master’s in Mathematics Education, specializing in middle school mathematics in 2015. Laura obtained her Elementary Mathematics Specialist Certificate, as well. Laura taught elementary for 5 years before transitioning to secondary education for the last 4 years. She has taught in both Missouri and Texas.
Laura loves to spend time with her family. Her parents have been Fountain Hills residents for the last 10 years. She feels very lucky to be able to join the FHUSD team and be closer to them!
Outside of the classroom, Laura can be found hiking, camping, running, volunteering at local animal shelters, and serving her community through various ministries.
Welcome Laura!",2020-06-05 13:00:18,,
66,43.0,https://scontent-atl3-1.xx.fbcdn.net/v/t1.0-9/fr/cp0/e15/q65/100997069_4642826685742787_1862924923425521664_o.jpg?_nc_cat=107&_nc_sid=8024bb&_nc_ohc=sRht1Ty7_e4AX_PAEHP&_nc_ht=scontent-atl3-1.xx&tp=14&oh=99754da5ee29d72ab2e26934a92c969b&oe=5F8003E0,101.0,,4642828852409237,,https://facebook.com/story.php?story_fbid=4642828852409237&id=116140448411456,,0.0,,2020-06-04 13:00:10,,
67,26.0,https://scontent-atl3-1.xx.fbcdn.net/v/t1.0-9/fr/cp0/e15/q65/96427287_4547019068656883_2620063963345321984_n.jpg?_nc_cat=100&_nc_sid=8024bb&_nc_ohc=XSbT9377yY0AX8G92sC&_nc_ht=scontent-atl3-1.xx&tp=14&oh=cfe358217e34543b19dbae895398fea8&oe=5F8205D3,59.0,,4547020328656757,,https://facebook.com/story.php?story_fbid=4547020328656757&id=116140448411456,,0.0,,2020-06-03 13:00:46,,
68,31.0,https://scontent-atl3-1.xx.fbcdn.net/v/t1.0-9/fr/cp0/e15/q65/96245017_4543494292342694_5644428011605327872_o.jpg?_nc_cat=111&_nc_sid=8024bb&_nc_ohc=6H0AacSJcqAAX8qcwis&_nc_ht=scontent-atl3-1.xx&tp=14&oh=06265b9a0b578b6baf4fc014193c2cb4&oe=5F8179AF,68.0,,4543496385675818,,https://facebook.com/story.php?story_fbid=4543496385675818&id=116140448411456,,0.0,,2020-06-02 13:00:32,,
69,0.0,,6.0,https://conta.cc/2AnIUYC,4621855087839947,"Here is the link to the Superintendent's Falcon Focus.

https://conta.cc/2AnIUYC 5/29/2020",https://facebook.com/story.php?story_fbid=4621855087839947&id=116140448411456,"MYEMAIL.CONSTANTCONTACT.COM
Superintendent's Falcon Focus 5/29/2020",0.0,"Here is the link to the Superintendent's Falcon Focus.

https://conta.cc/2AnIUYC 5/29/2020

MYEMAIL.CONSTANTCONTACT.COM
Superintendent's Falcon Focus 5/29/2020",2020-05-29 19:20:41,,
70,19.0,https://scontent-atl3-1.xx.fbcdn.net/v/t1.0-9/fr/cp0/e15/q65/95729227_4519973614694762_1073444814126579712_o.jpg?_nc_cat=105&_nc_sid=8024bb&_nc_ohc=5pz1PNcW9vwAX813w9I&_nc_ht=scontent-atl3-1.xx&tp=14&oh=3669c463198483df9aac4a3846802de1&oe=5F81C482,43.0,,4519976318027825,,https://facebook.com/story.php?story_fbid=4519976318027825&id=116140448411456,,0.0,,2020-05-28 18:15:16,,
71,23.0,https://scontent-atl3-1.xx.fbcdn.net/v/t1.0-9/fr/cp0/e15/q65/95959209_4519180041440786_5652182459094138880_n.jpg?_nc_cat=111&_nc_sid=8024bb&_nc_ohc=5gapXB_NRlUAX-Ln428&_nc_ht=scontent-atl3-1.xx&tp=14&oh=a1e6fcb92193a290fe2205e1f845a19c&oe=5F82072B,51.0,,4519181601440630,,https://facebook.com/story.php?story_fbid=4519181601440630&id=116140448411456,,0.0,,2020-05-26 13:50:06,,
72,0.0,,12.0,,4592887677403355,"Congratulations to our 8th grade students! Please click on the link below to view the 8th grade promotion slideshow.
https://www.facebook.com/fhmsfalcons/videos/676364446264807/",https://facebook.com/story.php?story_fbid=4592887677403355&id=116140448411456,"Phoenix, Arizona
City · City",0.0,"Congratulations to our 8th grade students! Please click on the link below to view the 8th grade promotion slideshow.
https://www.facebook.com/fhmsfalcons/videos/676364446264807/

Phoenix, Arizona
City · City",2020-05-22 19:39:33,,
73,0.0,,4.0,,4592878024070987,"Congratulations to our 8th grade students! Please click on the link below to view the 8th grade promotion slideshow.
https://www.facebook.com/fhmsfalcons/videos/676364446264807/",https://facebook.com/story.php?story_fbid=4592878024070987&id=116140448411456,,0.0,"Congratulations to our 8th grade students! Please click on the link below to view the 8th grade promotion slideshow.
https://www.facebook.com/fhmsfalcons/videos/676364446264807/",2020-05-22 19:35:43,,
74,0.0,,3.0,https://conta.cc/36m2G2I,4589332904425499,"Here is the link to the Superintendent's Falcon Focus.
https://conta.cc/36m2G2I 5/21/2020",https://facebook.com/story.php?story_fbid=4589332904425499&id=116140448411456,"MYEMAIL.CONSTANTCONTACT.COM
Superintendent's Falcon Focus 5/21/2020",0.0,"Here is the link to the Superintendent's Falcon Focus.
https://conta.cc/36m2G2I 5/21/2020

MYEMAIL.CONSTANTCONTACT.COM
Superintendent's Falcon Focus 5/21/2020",2020-05-21 22:23:24,,
75,0.0,,1.0,https://conta.cc/2ZpZ0f2,4588303844528405,"Here's a link to the Schools' Falcon Focus. You can access each school's newsletter by clicking the links under the purple banner.
https://conta.cc/2ZpZ0f2 5/21/2020",https://facebook.com/story.php?story_fbid=4588303844528405&id=116140448411456,"Schools' Falcon Focus 5/21/2020

Schools' Falcon Focus 5/21/2020

Schools' Falcon Focus 5/21/2020

Schools' Falcon Focus 5/21/2020

See more at
myemail.constantcontact.com",0.0,"Here's a link to the Schools' Falcon Focus. You can access each school's newsletter by clicking the links under the purple banner.
https://conta.cc/2ZpZ0f2 5/21/2020

Schools' Falcon Focus 5/21/2020

Schools' Falcon Focus 5/21/2020

Schools' Falcon Focus 5/21/2020

Schools' Falcon Focus 5/21/2020

See more at
myemail.constantcontact.com",2020-05-21 16:16:09,,
76,0.0,,1.0,https://conta.cc/2WYViWW,4561238990568224,"Here is the link to the Superintendent's Falcon Focus.
https://conta.cc/2WYViWW 5/15/2020",https://facebook.com/story.php?story_fbid=4561238990568224&id=116140448411456,"CONTA.CC
Bitly | Page Not Found | 404",0.0,"Here is the link to the Superintendent's Falcon Focus.
https://conta.cc/2WYViWW 5/15/2020

CONTA.CC
Bitly | Page Not Found | 404",2020-05-15 19:34:26,,
77,0.0,,3.0,https://conta.cc/2A6QKFX,4532160613476062,"Here's a link to the Schools' Falcon Focus. You can access each school's newsletter by clicking the links under the purple banner.

https://conta.cc/2A6QKFX 5/8/2020",https://facebook.com/story.php?story_fbid=4532160613476062&id=116140448411456,"Schools' Falcon Focus 5/8/2020

Schools' Falcon Focus 5/8/2020

Schools' Falcon Focus 5/8/2020

Schools' Falcon Focus 5/8/2020

See more at
myemail.constantcontact.com",0.0,"Here's a link to the Schools' Falcon Focus. You can access each school's newsletter by clicking the links under the purple banner.

https://conta.cc/2A6QKFX 5/8/2020

Schools' Falcon Focus 5/8/2020

Schools' Falcon Focus 5/8/2020

Schools' Falcon Focus 5/8/2020

Schools' Falcon Focus 5/8/2020

See more at
myemail.constantcontact.com",2020-05-08 19:40:01,,
78,0.0,,1.0,https://conta.cc/2VTHehR,4504630642895726,"Here is the link to the Superintendent's Falcon Focus.
https://conta.cc/2VTHehR 5/1/2020",https://facebook.com/story.php?story_fbid=4504630642895726&id=116140448411456,"Superintendent's Falcon Focus 5/1/2020

Superintendent's Falcon Focus 5/1/2020

See more at
myemail.constantcontact.com",0.0,"Here is the link to the Superintendent's Falcon Focus.
https://conta.cc/2VTHehR 5/1/2020

Superintendent's Falcon Focus 5/1/2020

Superintendent's Falcon Focus 5/1/2020

See more at
myemail.constantcontact.com",2020-05-01 19:55:20,,
79,0.0,,2.0,https://conta.cc/354VLKT,4477823065576484,"Here's a link to the Schools' Falcon Focus. You can access each school's newsletter by clicking the links under the purple banner.
https://conta.cc/354VLKT 4/24/2020",https://facebook.com/story.php?story_fbid=4477823065576484&id=116140448411456,"Schools' Falcon Focus 4/24/2020

Schools' Falcon Focus 4/24/2020

Schools' Falcon Focus 4/24/2020

See more at
myemail.constantcontact.com",0.0,"Here's a link to the Schools' Falcon Focus. You can access each school's newsletter by clicking the links under the purple banner.
https://conta.cc/354VLKT 4/24/2020

Schools' Falcon Focus 4/24/2020

Schools' Falcon Focus 4/24/2020

Schools' Falcon Focus 4/24/2020

See more at
myemail.constantcontact.com",2020-04-24 21:06:48,,
80,0.0,,0.0,https://conta.cc/2Xkd2xI,4420765994615525,"Here's a link to the Schools' Falcon Focus. You can access each school's newsletter by clicking the links under the purple banner.
https://conta.cc/2Xkd2xI",https://facebook.com/story.php?story_fbid=4420765994615525&id=116140448411456,"Schools' Falcon Focus 4/9/2020

Schools' Falcon Focus 4/9/2020

See more at
myemail.constantcontact.com",0.0,"Here's a link to the Schools' Falcon Focus. You can access each school's newsletter by clicking the links under the purple banner.
https://conta.cc/2Xkd2xI

Schools' Falcon Focus 4/9/2020

Schools' Falcon Focus 4/9/2020

See more at
myemail.constantcontact.com",2020-04-09 20:12:52,,
81,0.0,,1.0,https://tinyurl.com/Falcon-Focus-4-7-2020,4413500442008747,"Here is the link to the Superintendent's Falcon Focus.
https://tinyurl.com/Falcon-Focus-4-7-2020",https://facebook.com/story.php?story_fbid=4413500442008747&id=116140448411456,"MYEMAIL.CONSTANTCONTACT.COM
Superintendent's Falcon Focus 4/7/2020",0.0,"Here is the link to the Superintendent's Falcon Focus.
https://tinyurl.com/Falcon-Focus-4-7-2020

MYEMAIL.CONSTANTCONTACT.COM
Superintendent's Falcon Focus 4/7/2020",2020-04-07 19:27:21,,
82,0.0,,5.0,https://tinyurl.com/Special-Announcement-3-30-2020,4384893661536092,"Please click on the link below to read the Superintendent's Special Announcement.
https://tinyurl.com/Special-Announcement-3-30-2020",https://facebook.com/story.php?story_fbid=4384893661536092&id=116140448411456,"MYEMAIL.CONSTANTCONTACT.COM
Special Announcement from the Superintendent 3/30/2020",3.0,"Please click on the link below to read the Superintendent's Special Announcement.
https://tinyurl.com/Special-Announcement-3-30-2020

MYEMAIL.CONSTANTCONTACT.COM
Special Announcement from the Superintendent 3/30/2020",2020-03-30 19:35:50,,
83,0.0,,3.0,https://tinyurl.com/Special-Announcement-3-27-2020,4373971119295013,"Please click on the link below to read the Superintendent's Special Announcement.
https://tinyurl.com/Special-Announcement-3-27-2020",https://facebook.com/story.php?story_fbid=4373971119295013&id=116140448411456,"TINYURL.COM
TinyURL.com - shorten that long URL into a tiny URL",0.0,"Please click on the link below to read the Superintendent's Special Announcement.
https://tinyurl.com/Special-Announcement-3-27-2020

TINYURL.COM
TinyURL.com - shorten that long URL into a tiny URL",2020-03-27 20:26:47,,
84,16.0,https://scontent-atl3-1.xx.fbcdn.net/v/t1.0-9/fr/cp0/e15/q65/89959268_4357578694267589_1727450883131703296_o.jpg?_nc_cat=105&_nc_sid=8024bb&_nc_ohc=pO_yKUqHhEsAX8uJvJc&_nc_ht=scontent-atl3-1.xx&tp=14&oh=2f47da3bfea0025d0b6aa5fa0e37a275&oe=5F83446C,62.0,,4357579770934148,"Please welcome our new Superintendent Kelly Glass to Fountain Hills Unified School District. She will begin on July 1, 2020.

Kelly Glass served as Superintendent of Sierra Vista School District. She previously served as Assistant Superintendent in Page, Arizona and Torrington, Wyoming. Glass has been a child-centered educator for 23 years serving in a variety of roles. She started her career in a small school district in Montana and has continued to hold small communities close to her heart. Throughout her career in education, she has been a kindergarten and special education teacher, principal, and curriculum director. Glass has a master’s degree from University of Montana in Educational Leadership and Lesley University in Curriculum and Instruction. She has a bachelor’s of science in Elementary Education with endorsements in Special Education and Early Childhood Education. Glass is completing her doctoral degree through Walden University.

Welcome Kelly!",https://facebook.com/story.php?story_fbid=4357579770934148&id=116140448411456,,0.0,"Please welcome our new Superintendent Kelly Glass to Fountain Hills Unified School District. She will begin on July 1, 2020.

Kelly Glass served as Superintendent of Sierra Vista School District. She previously served as Assistant Superintendent in Page, Arizona and Torrington, Wyoming. Glass has been a child-centered educator for 23 years serving in a variety of roles. She started her career in a small school district in Montana and has continued to hold small communities close to her heart. Throughout her career in education, she has been a kindergarten and special education teacher, principal, and curriculum director. Glass has a master’s degree from University of Montana in Educational Leadership and Lesley University in Curriculum and Instruction. She has a bachelor’s of science in Elementary Education with endorsements in Special Education and Early Childhood Education. Glass is completing her doctoral degree through Walden University.

Welcome Kelly!",2020-03-23 11:40:36,,
85,0.0,,0.0,https://tinyurl.com/Special-Announcement-3-20-2020,4347574178601374,"Please click on the link below to read the Superintendent's Special Announcement.
https://tinyurl.com/Special-Announcement-3-20-2020",https://facebook.com/story.php?story_fbid=4347574178601374&id=116140448411456,"TINYURL.COM
TinyURL.com - shorten that long URL into a tiny URL",0.0,"Please click on the link below to read the Superintendent's Special Announcement.
https://tinyurl.com/Special-Announcement-3-20-2020

TINYURL.COM
TinyURL.com - shorten that long URL into a tiny URL",2020-03-20 20:48:19,,
86,0.0,,3.0,https://tinyurl.com/Special-Announcement-3-17-2020,4335990226426436,"Please click on the link below to read the Superintendent's Special Announcement.
https://tinyurl.com/Special-Announcement-3-17-2020",https://facebook.com/story.php?story_fbid=4335990226426436&id=116140448411456,"Special Announcement from the Superintendent 3/17/2020

Special Announcement from the Superintendent 3/17/2020

See more at
myemail.constantcontact.com",0.0,"Please click on the link below to read the Superintendent's Special Announcement.
https://tinyurl.com/Special-Announcement-3-17-2020

Special Announcement from the Superintendent 3/17/2020

Special Announcement from the Superintendent 3/17/2020

See more at
myemail.constantcontact.com",2020-03-17 19:34:46,,
87,0.0,,7.0,https://tinyurl.com/Special-Announcement-3-16-2020,4332393730119419,"Please click on the link below to read the Superintendent's Special Announcement.
https://tinyurl.com/Special-Announcement-3-16-2020",https://facebook.com/story.php?story_fbid=4332393730119419&id=116140448411456,"Special Announcement from the Superintendent 3/16/2020

Special Announcement from the Superintendent 3/16/2020

See more at
myemail.constantcontact.com",0.0,"Please click on the link below to read the Superintendent's Special Announcement.
https://tinyurl.com/Special-Announcement-3-16-2020

Special Announcement from the Superintendent 3/16/2020

Special Announcement from the Superintendent 3/16/2020

See more at
myemail.constantcontact.com",2020-03-16 21:09:02,,
88,0.0,,3.0,https://tinyurl.com/Updated-Announcement-3-14-2020,4324709497554509,"Please click on the link below to read the Urgent Updated Announcement from the Superintendent 3/14/2020.
https://tinyurl.com/Updated-Announcement-3-14-2020",https://facebook.com/story.php?story_fbid=4324709497554509&id=116140448411456,"MYEMAIL.CONSTANTCONTACT.COM
Urgent Updated Announcement from the Superintendent 3/14/2020",2.0,"Please click on the link below to read the Urgent Updated Announcement from the Superintendent 3/14/2020.
https://tinyurl.com/Updated-Announcement-3-14-2020

MYEMAIL.CONSTANTCONTACT.COM
Urgent Updated Announcement from the Superintendent 3/14/2020",2020-03-14 20:25:20,,
89,1.0,,3.0,https://tinyurl.com/Special-Announcement-3-13-202,4321215034570622,"Please click on the link below to read the Superintendent's Special Announcement.
https://tinyurl.com/Special-Announcement-3-13-202",https://facebook.com/story.php?story_fbid=4321215034570622&id=116140448411456,"MYEMAIL.CONSTANTCONTACT.COM
Special Announcement from the Superintendent 3/13/2020",2.0,"Please click on the link below to read the Superintendent's Special Announcement.
https://tinyurl.com/Special-Announcement-3-13-202

MYEMAIL.CONSTANTCONTACT.COM
Special Announcement from the Superintendent 3/13/2020",2020-03-13 21:25:15,,
90,0.0,,0.0,https://tinyurl.com/Falcon-Focus-3-5-2020,4292732287418897,"Here is the link to the Superintendent's Falcon Focus.
https://tinyurl.com/Falcon-Focus-3-5-2020",https://facebook.com/story.php?story_fbid=4292732287418897&id=116140448411456,"TINYURL.COM
TinyURL.com - shorten that long URL into a tiny URL",0.0,"Here is the link to the Superintendent's Falcon Focus.
https://tinyurl.com/Falcon-Focus-3-5-2020

TINYURL.COM
TinyURL.com - shorten that long URL into a tiny URL",2020-03-05 17:51:46,,
91,0.0,,0.0,https://tinyurl.com/MMES-Falcon-Focus-3-4-2020,4288036254555167,"Please click on the link below to view MMES's Falcon Focus.
https://tinyurl.com/MMES-Falcon-Focus-3-4-2020",https://facebook.com/story.php?story_fbid=4288036254555167&id=116140448411456,"MYEMAIL.CONSTANTCONTACT.COM
MMES - Falcon Focus 3/4/2020",0.0,"Please click on the link below to view MMES's Falcon Focus.
https://tinyurl.com/MMES-Falcon-Focus-3-4-2020

MYEMAIL.CONSTANTCONTACT.COM
MMES - Falcon Focus 3/4/2020",2020-03-04 10:47:02,,
92,0.0,https://scontent-atl3-1.xx.fbcdn.net/v/t1.0-9/fr/cp0/e15/q65/88325750_4271027816256011_6236597147232370688_o.jpg?_nc_cat=108&_nc_sid=8024bb&_nc_ohc=C912V5fY9XEAX8ZZLDH&_nc_ht=scontent-atl3-1.xx&tp=14&oh=b7a372e174a626e3935aab32b1832a39&oe=5F824614,15.0,,4271031969588929,"The Fountain Hills High School Band and Choir performed at the state's annual ESSA Conference at the We-Ko-Pa Conference Center and Resort in Scottsdale, AZ. Both groups of performers did an excellent job!",https://facebook.com/story.php?story_fbid=4271031969588929&id=116140448411456,,0.0,"The Fountain Hills High School Band and Choir performed at the state's annual ESSA Conference at the We-Ko-Pa Conference Center and Resort in Scottsdale, AZ. Both groups of performers did an excellent job!",2020-03-03 12:00:59,,
93,0.0,https://scontent-atl3-1.xx.fbcdn.net/v/t1.0-9/88004842_4270948996263893_6698526270101127168_n.png?_nc_cat=103&_nc_sid=8024bb&_nc_ohc=ujB0gXiQAx0AX_Z0a7J&_nc_ht=scontent-atl3-1.xx&oh=7663e1e8135d02db654798bf8ea805cf&oe=5F832878,0.0,https://conta.cc/32FaZ7V,4270950532930406,"Here's a link to the Falcon Focus. You can access each school's newsletter by clicking the links under the purple banner.
https://conta.cc/32FaZ7V",https://facebook.com/story.php?story_fbid=4270950532930406&id=116140448411456,,0.0,"Here's a link to the Falcon Focus. You can access each school's newsletter by clicking the links under the purple banner.
https://conta.cc/32FaZ7V",2020-02-28 13:19:35,,
94,0.0,,0.0,https://tinyurl.com/Falcon-Focus-2-21-2020,4247460688612724,"Here is the link to the Superintendent's Falcon Focus.
https://tinyurl.com/Falcon-Focus-2-21-2020",https://facebook.com/story.php?story_fbid=4247460688612724&id=116140448411456,"TINYURL.COM
TinyURL.com - shorten that long URL into a tiny URL",0.0,"Here is the link to the Superintendent's Falcon Focus.
https://tinyurl.com/Falcon-Focus-2-21-2020

TINYURL.COM
TinyURL.com - shorten that long URL into a tiny URL",2020-02-21 17:50:44,,
95,0.0,https://scontent-atl3-1.xx.fbcdn.net/v/t1.0-9/fr/cp0/e15/q65/87165929_4242826272409499_6687360738110996480_n.jpg?_nc_cat=108&_nc_sid=8024bb&_nc_ohc=DH3wAuidwewAX_DYoKX&_nc_ht=scontent-atl3-1.xx&tp=14&oh=6c8271c984af7d57a322c5bbf3e5b81c&oe=5F80F4F6,6.0,,4242828655742594,TONIGHT and Friday are PS/K Round-Up for 2020-2021 registration at MMES: 2/20 5:30-7:30 p.m. & 2/21 9:00-11:30 a.m. & 12:30-3:00 p.m. Please see more info below!,https://facebook.com/story.php?story_fbid=4242828655742594&id=116140448411456,,0.0,TONIGHT and Friday are PS/K Round-Up for 2020-2021 registration at MMES: 2/20 5:30-7:30 p.m. & 2/21 9:00-11:30 a.m. & 12:30-3:00 p.m. Please see more info below!,2020-02-20 10:14:23,,
96,0.0,,5.0,https://tinyurl.com/Falcon-Focus-2-14-2020,4236276833064443,"Here's a link to the Falcon Focus. You can access each school's newsletter by clicking the links under the purple banner.
https://tinyurl.com/Falcon-Focus-2-14-2020",https://facebook.com/story.php?story_fbid=4236276833064443&id=116140448411456,"TINYURL.COM
TinyURL.com - shorten that long URL into a tiny URL",0.0,"Here's a link to the Falcon Focus. You can access each school's newsletter by clicking the links under the purple banner.
https://tinyurl.com/Falcon-Focus-2-14-2020

TINYURL.COM
TinyURL.com - shorten that long URL into a tiny URL",2020-02-18 12:15:58,,
97,0.0,,0.0,https://tinyurl.com/Falcon-Focus-2-7-2020,4199318676760259,"Here is the link to the Superintendent's Falcon Focus.
https://tinyurl.com/Falcon-Focus-2-7-2020",https://facebook.com/story.php?story_fbid=4199318676760259&id=116140448411456,"MYEMAIL.CONSTANTCONTACT.COM
Superintendent's Falcon Focus",0.0,"Here is the link to the Superintendent's Falcon Focus.
https://tinyurl.com/Falcon-Focus-2-7-2020

MYEMAIL.CONSTANTCONTACT.COM
Superintendent's Falcon Focus",2020-02-07 18:00:08,,
98,1.0,,42.0,,4188368971188563,Congratulations to Michah Laughline FHUSD Spelling Bee Champion. We also want to congratulate Ryan McDonough FHUSD 2nd place winner. Great job boys!,https://facebook.com/story.php?story_fbid=4188368971188563&id=116140448411456,,0.0,Congratulations to Michah Laughline FHUSD Spelling Bee Champion. We also want to congratulate Ryan McDonough FHUSD 2nd place winner. Great job boys!,2020-02-04 11:55:29,,
99,0.0,,1.0,https://tinyurl.com/Falcon-Focus-1-31-2020,4176060112419449,"Here's a link to the Falcon Focus. You can access each school's newsletter by clicking the links under the purple banner.
https://tinyurl.com/Falcon-Focus-1-31-2020",https://facebook.com/story.php?story_fbid=4176060112419449&id=116140448411456,"Schools' Falcon Focus 1/31/2020

Schools' Falcon Focus 1/31/2020

Schools' Falcon Focus 1/31/2020

Schools' Falcon Focus 1/31/2020

See more at
myemail.constantcontact.com",0.0,"Here's a link to the Falcon Focus. You can access each school's newsletter by clicking the links under the purple banner.
https://tinyurl.com/Falcon-Focus-1-31-2020

Schools' Falcon Focus 1/31/2020

Schools' Falcon Focus 1/31/2020

Schools' Falcon Focus 1/31/2020

Schools' Falcon Focus 1/31/2020

See more at
myemail.constantcontact.com",2020-01-31 15:59:22,,
100,0.0,,0.0,https://tinyurl.com/Falcon-Focus-1-26-2020,4152771671414960,"Here is the link to the Superintendent's Falcon Focus.
https://tinyurl.com/Falcon-Focus-1-26-2020",https://facebook.com/story.php?story_fbid=4152771671414960&id=116140448411456,"Superintendent's Falcon Focus 1/24/2020

Superintendent's Falcon Focus 1/24/2020

See more at
myemail.constantcontact.com",0.0,"Here is the link to the Superintendent's Falcon Focus.
https://tinyurl.com/Falcon-Focus-1-26-2020

Superintendent's Falcon Focus 1/24/2020

Superintendent's Falcon Focus 1/24/2020

See more at
myemail.constantcontact.com",2020-01-24 15:45:14,,
101,5.0,https://scontent-atl3-1.xx.fbcdn.net/v/t1.0-9/fr/cp0/e15/q65/83074973_4146493812042746_6687022191608856576_o.jpg?_nc_cat=109&_nc_sid=8024bb&_nc_ohc=09ahy65PJ9UAX_BrV38&_nc_ht=scontent-atl3-1.xx&tp=14&oh=9bb3e41cd115cd8629c79eaaa8f4ace5&oe=5F837208,44.0,,4146537602038367,"Every year, FHUSD participates in the Scripps National Spelling Bee contest including 3rd-8th grade students from MMES and FHMS.

The middle school winners were as follows:
1st Place: Ryan Guthrie
2nd Place: Canon Lipps
3rd Place: Chris Towne
4th Place: Rocco Pelano

The District Spelling Bee will be Thursday, January 30 at 6:00 p.m. at the District Learning Center. Good luck to all of our fantastic spellers!",https://facebook.com/story.php?story_fbid=4146537602038367&id=116140448411456,,0.0,"Every year, FHUSD participates in the Scripps National Spelling Bee contest including 3rd-8th grade students from MMES and FHMS.

The middle school winners were as follows:
1st Place: Ryan Guthrie
2nd Place: Canon Lipps
3rd Place: Chris Towne
4th Place: Rocco Pelano

The District Spelling Bee will be Thursday, January 30 at 6:00 p.m. at the District Learning Center. Good luck to all of our fantastic spellers!",2020-01-22 18:06:10,,
102,0.0,,1.0,https://tinyurl.com/Falcon-Focus-1-17-2020,4130033927022068,"Here's a link to the Falcon Focus. You can access each school's newsletter by clicking the links under the purple banner.
https://tinyurl.com/Falcon-Focus-1-17-2020",https://facebook.com/story.php?story_fbid=4130033927022068&id=116140448411456,"Schools' Falcon Focus

Schools' Falcon Focus

Schools' Falcon Focus

Schools' Falcon Focus

See more at
myemail.constantcontact.com",0.0,"Here's a link to the Falcon Focus. You can access each school's newsletter by clicking the links under the purple banner.
https://tinyurl.com/Falcon-Focus-1-17-2020

Schools' Falcon Focus

Schools' Falcon Focus

Schools' Falcon Focus

Schools' Falcon Focus

See more at
myemail.constantcontact.com",2020-01-17 13:08:26,,
103,1.0,https://scontent-atl3-1.xx.fbcdn.net/v/t1.0-9/fr/cp0/e15/q65/82699149_4123942577631203_50992067941236736_o.jpg?_nc_cat=109&_nc_sid=8024bb&_nc_ohc=GJozB2Vp8wAAX9Y5Ttx&_nc_ht=scontent-atl3-1.xx&tp=14&oh=1d89ffe850f647bfe1e621f759bb0a2c&oe=5F82B440,35.0,,4123943430964451,"Every year, FHUSD participates in the Scripps National Spelling Besystem including 3rd-8th grade students from MMES and FHMS. The first step is the written test that all third graders took before winter break and resulted in 24 students participating in the bee on January 8.
Everyone did a marvelous job including the top four students who will compete in the district bee in the evening on Thursday, January 30 at 6:00 p.m. at the District Learning Center with 21 other winning students from FHMS:
MMES Spelling Bee Champion: Levi Lara
2nd Place: Angelo Latko
3rd Place: Ben Goodman
4th Place: DeMya Staten
In addition to the certificates that all participants received, MMES champion, Levi Lara was presented with a medal, a one-year subscription to Encyclopedia Britannica Kids Online, and a Kindle Fire donated by the Peter and Theresa Conti Foundation
Finally, the 1st place champion of the district bee will compete in the regional spelling bee in Deer Valley on February 20 involving winners from grades up to 8th grade from Deer Valley, Cave Creek, Paradise Valley, and Scottsdale.",https://facebook.com/story.php?story_fbid=4123943430964451&id=116140448411456,,0.0,"Every year, FHUSD participates in the Scripps National Spelling Besystem including 3rd-8th grade students from MMES and FHMS. The first step is the written test that all third graders took before winter break and resulted in 24 students participating in the bee on January 8.
Everyone did a marvelous job including the top four students who will compete in the district bee in the evening on Thursday, January 30 at 6:00 p.m. at the District Learning Center with 21 other winning students from FHMS:
MMES Spelling Bee Champion: Levi Lara
2nd Place: Angelo Latko
3rd Place: Ben Goodman
4th Place: DeMya Staten
In addition to the certificates that all participants received, MMES champion, Levi Lara was presented with a medal, a one-year subscription to Encyclopedia Britannica Kids Online, and a Kindle Fire donated by the Peter and Theresa Conti Foundation
Finally, the 1st place champion of the district bee will compete in the regional spelling bee in Deer Valley on February 20 involving winners from grades up to 8th grade from Deer Valley, Cave Creek, Paradise Valley, and Scottsdale.",2020-01-15 17:07:13,,
104,0.0,,0.0,https://tinyurl.com/Falcon-Focus-1-10-2020,4107076395984488,"Here is the link to the Superintendent's Falcon Focus.
https://tinyurl.com/Falcon-Focus-1-10-2020",https://facebook.com/story.php?story_fbid=4107076395984488&id=116140448411456,"MYEMAIL.CONSTANTCONTACT.COM
Superintendent's Falcon Focus 1/10/2020",0.0,"Here is the link to the Superintendent's Falcon Focus.
https://tinyurl.com/Falcon-Focus-1-10-2020

MYEMAIL.CONSTANTCONTACT.COM
Superintendent's Falcon Focus 1/10/2020",2020-01-10 17:51:37,,
105,0.0,https://scontent-atl3-1.xx.fbcdn.net/v/t1.0-9/fr/cp0/e15/q65/81877695_4102583969767064_8834259845356978176_n.jpg?_nc_cat=106&_nc_sid=8024bb&_nc_ohc=Pv-H0nTQm84AX_jziLJ&_nc_ht=scontent-atl3-1.xx&tp=14&oh=19607198f6c923cf34865ec2bd161ed6&oe=5F819D45,9.0,,4102599639765497,Fountain Hills Unified School District wants to wish our families a Happy New Year!,https://facebook.com/story.php?story_fbid=4102599639765497&id=116140448411456,,0.0,Fountain Hills Unified School District wants to wish our families a Happy New Year!,2020-01-09 10:21:46,,
106,0.0,,1.0,https://tinyurl.com/Falcon-Focus-12-20-19,4036326199726175,"Here's a link to the Falcon Focus. You can access each school's newsletter by clicking the links under the purple banner.
https://tinyurl.com/Falcon-Focus-12-20-19",https://facebook.com/story.php?story_fbid=4036326199726175&id=116140448411456,"MYEMAIL.CONSTANTCONTACT.COM
Schools' Falcon Focus 12/20/19",0.0,"Here's a link to the Falcon Focus. You can access each school's newsletter by clicking the links under the purple banner.
https://tinyurl.com/Falcon-Focus-12-20-19

MYEMAIL.CONSTANTCONTACT.COM
Schools' Falcon Focus 12/20/19",2019-12-20 16:49:06,,
107,1.0,,4.0,,4022730171085778,McDowell Mountain Elementary School 1st grade program was joined by the Fountain Hills Community Choir last week as they sang holiday songs at MMES. The schools had some beautiful art work hanging on the walls from MMES recent Art Show.,https://facebook.com/story.php?story_fbid=4022730171085778&id=116140448411456,,0.0,McDowell Mountain Elementary School 1st grade program was joined by the Fountain Hills Community Choir last week as they sang holiday songs at MMES. The schools had some beautiful art work hanging on the walls from MMES recent Art Show.,2019-12-18 11:00:27,,
108,0.0,https://scontent-atl3-1.xx.fbcdn.net/v/t1.0-9/fr/cp0/e15/q65/79839960_4022698817755580_2318403387667775488_o.jpg?_nc_cat=101&_nc_sid=8024bb&_nc_ohc=0T-8NAdyUgwAX_MWjrh&_nc_ht=scontent-atl3-1.xx&tp=14&oh=ad847c43d909ff420f699dc6fc264d84&oe=5F8014FB,8.0,,4022700371088758,Fountain Hills Unified School District held the Fountain Hills Noon Kiwanis Meeting last week. Sodexo catered the holiday luncheon.,https://facebook.com/story.php?story_fbid=4022700371088758&id=116140448411456,,0.0,Fountain Hills Unified School District held the Fountain Hills Noon Kiwanis Meeting last week. Sodexo catered the holiday luncheon.,2019-12-16 13:06:01,,
109,0.0,,2.0,https://tinyurl.com/Falcon-Focus-12-13-19,4012887225403406,"Here is the link to the Superintendent's Falcon Focus.
https://tinyurl.com/Falcon-Focus-12-13-19",https://facebook.com/story.php?story_fbid=4012887225403406&id=116140448411456,"MYEMAIL.CONSTANTCONTACT.COM
Superintendent's Falcon Focus 12/13/19",0.0,"Here is the link to the Superintendent's Falcon Focus.
https://tinyurl.com/Falcon-Focus-12-13-19

MYEMAIL.CONSTANTCONTACT.COM
Superintendent's Falcon Focus 12/13/19",2019-12-13 15:00:10,,
110,0.0,,6.0,https://tinyurl.com/Falcon-Focus-12-6-19,3987748671250595,"Here's a link to the Falcon Focus. You can access each school's newsletter by clicking the links under the purple banner.
https://tinyurl.com/Falcon-Focus-12-6-19",https://facebook.com/story.php?story_fbid=3987748671250595&id=116140448411456,"MYEMAIL.CONSTANTCONTACT.COM
Falcon Focus 12/6/19",0.0,"Here's a link to the Falcon Focus. You can access each school's newsletter by clicking the links under the purple banner.
https://tinyurl.com/Falcon-Focus-12-6-19

MYEMAIL.CONSTANTCONTACT.COM
Falcon Focus 12/6/19",2019-12-06 12:36:26,,
111,2.0,https://scontent-atl3-1.xx.fbcdn.net/v/t1.0-9/fr/cp0/e15/q65/79023552_3973742315984564_7900808489516138496_o.jpg?_nc_cat=107&_nc_sid=8024bb&_nc_ohc=yckcYzrYJugAX-j6Khu&_nc_ht=scontent-atl3-1.xx&tp=14&oh=63a942801e85d9fc62bebeec0c505937&oe=5F82A008,40.0,,3976688205689975,"Governing Board President Jill Reed and her daughter, FHUSD District Office Staff and Fountain Hills High School students served 508 Thanksgiving meals to our McDowell Mountain students and family members on the Tuesday before Thanksgiving. Thank you to all of the volunteers and PTA members for helping out with this fun event. It has been a MMES tradition for years and everyone always has a grand time.",https://facebook.com/story.php?story_fbid=3976688205689975&id=116140448411456,,0.0,"Governing Board President Jill Reed and her daughter, FHUSD District Office Staff and Fountain Hills High School students served 508 Thanksgiving meals to our McDowell Mountain students and family members on the Tuesday before Thanksgiving. Thank you to all of the volunteers and PTA members for helping out with this fun event. It has been a MMES tradition for years and everyone always has a grand time.",2019-12-03 12:36:47,,
112,0.0,,2.0,https://tinyurl.com/Falcon-Focus-11-27-19,3955115811180548,"Here is the link to the Superintendent's Falcon Focus.
https://tinyurl.com/Falcon-Focus-11-27-19",https://facebook.com/story.php?story_fbid=3955115811180548&id=116140448411456,"Superintendent's Falcon Focus 11/27/19

Superintendent's Falcon Focus 11/27/19

See more at
myemail.constantcontact.com",0.0,"Here is the link to the Superintendent's Falcon Focus.
https://tinyurl.com/Falcon-Focus-11-27-19

Superintendent's Falcon Focus 11/27/19

Superintendent's Falcon Focus 11/27/19

See more at
myemail.constantcontact.com",2019-11-27 17:12:04,,
113,0.0,https://scontent-atl3-1.xx.fbcdn.net/v/t1.0-9/fr/cp0/e15/q65/76759932_3901004289925034_7380328087545708544_o.jpg?_nc_cat=101&_nc_sid=8024bb&_nc_ohc=qT5ouweuCOcAX9jX454&_nc_ht=scontent-atl3-1.xx&tp=14&oh=7773c892e916e1a6700e8fd447c7aa22&oe=5F808A7B,22.0,,3947908645234598,Sodexo has added some new menu options for students to choose from at the high school. They are also updating the look of the lunch line area as well.,https://facebook.com/story.php?story_fbid=3947908645234598&id=116140448411456,,0.0,Sodexo has added some new menu options for students to choose from at the high school. They are also updating the look of the lunch line area as well.,2019-11-25 17:43:36,,
114,0.0,https://scontent-atl3-1.xx.fbcdn.net/v/t1.0-9/74443212_3935891236436339_4505966167235493888_n.png?_nc_cat=107&_nc_sid=8024bb&_nc_ohc=oQJTSU0NuksAX-a1nNy&_nc_ht=scontent-atl3-1.xx&oh=c033881fdfdb61dd1bb5e27a5fab8da5&oe=5F81174F,3.0,https://tinyurl.com/Falcon-Focus-11-22-19,3935891739769622,"Here's a link to the Falcon Focus. You can access each school's newsletter by clicking the links under the purple banner.
https://tinyurl.com/Falcon-Focus-11-22-19",https://facebook.com/story.php?story_fbid=3935891739769622&id=116140448411456,,0.0,"Here's a link to the Falcon Focus. You can access each school's newsletter by clicking the links under the purple banner.
https://tinyurl.com/Falcon-Focus-11-22-19",2019-11-22 11:33:54,,
115,0.0,,2.0,https://tinyurl.com/Falcon-Focus-11-15-19,3912415315450598,"Here is the link to the Superintendent's Falcon Focus.
https://tinyurl.com/Falcon-Focus-11-15-19",https://facebook.com/story.php?story_fbid=3912415315450598&id=116140448411456,,0.0,"Here is the link to the Superintendent's Falcon Focus.
https://tinyurl.com/Falcon-Focus-11-15-19",2019-11-15 17:29:00,,
116,0.0,https://scontent-atl3-1.xx.fbcdn.net/v/t1.0-9/fr/cp0/e15/q65/76604983_3900993299926133_3837565773035864064_o.jpg?_nc_cat=105&_nc_sid=8024bb&_nc_ohc=qjaDPloDL_8AX-EJzwp&_nc_ht=scontent-atl3-1.xx&tp=14&oh=f3324b354fa8a9fd122ea305b28a185a&oe=5F8239B4,13.0,,3900996229925840,Red Ribbon Week at Fountain Hills Middle School was a huge success!,https://facebook.com/story.php?story_fbid=3900996229925840&id=116140448411456,,0.0,Red Ribbon Week at Fountain Hills Middle School was a huge success!,2019-11-12 10:40:56,,
117,0.0,,0.0,https://conta.cc/2NvZlGA,3888486947843435,"Here's a link to the 11/8/19 Falcon Focus. You can access each school's newsletter by clicking the links under the purple banner.
https://conta .cc/2NvZlGA",https://facebook.com/story.php?story_fbid=3888486947843435&id=116140448411456,"MYEMAIL.CONSTANTCONTACT.COM
Schools' Falcon Focus 11/8/19",0.0,"Here's a link to the 11/8/19 Falcon Focus. You can access each school's newsletter by clicking the links under the purple banner.
https://conta .cc/2NvZlGA

MYEMAIL.CONSTANTCONTACT.COM
Schools' Falcon Focus 11/8/19",2019-11-08 19:48:10,,
118,0.0,,1.0,https://tinyurl.com/yyoas6ks,3864835566875240,Here is the link to the Superintendent's Falcon Focus (11/1/19) https://tinyurl.com/yyoas6ks,https://facebook.com/story.php?story_fbid=3864835566875240&id=116140448411456,"Superintendent's Falcon Focus 11/1/19

Superintendent's Falcon Focus 11/1/19

See more at
myemail.constantcontact.com",0.0,"Here is the link to the Superintendent's Falcon Focus (11/1/19) https://tinyurl.com/yyoas6ks

Superintendent's Falcon Focus 11/1/19

Superintendent's Falcon Focus 11/1/19

See more at
myemail.constantcontact.com",2019-11-01 17:41:29,,
119,6.0,https://scontent-atl3-1.xx.fbcdn.net/v/t1.0-9/fr/cp0/e15/q65/74217844_3860826433942820_7474829565764829184_o.jpg?_nc_cat=100&_nc_sid=8024bb&_nc_ohc=vA-kHb6YdhUAX-Vb4RS&_nc_ht=scontent-atl3-1.xx&tp=14&oh=6f1259914de2c34799117f67f30e9589&oe=5F810A35,58.0,,3860833843942079,It was fun to see all the students dressed up in their costumes as they arrived at the middle school this morning. The Pink Ladies made an appearance as well.,https://facebook.com/story.php?story_fbid=3860833843942079&id=116140448411456,,0.0,It was fun to see all the students dressed up in their costumes as they arrived at the middle school this morning. The Pink Ladies made an appearance as well.,2019-10-31 13:06:55,,
120,0.0,https://scontent-atl3-1.xx.fbcdn.net/v/t1.0-9/75107604_3841999629158834_2736932265442410496_n.png?_nc_cat=106&_nc_sid=8024bb&_nc_ohc=amaqFpXcFNIAX86GX7n&_nc_ht=scontent-atl3-1.xx&oh=1e60fe38fc674dccf211c743c3fcff02&oe=5F80BA85,0.0,https://tinyurl.com/Falcon-Focus-10-25-19,3841999932492137,"Here's a link to the Falcon Focus. You can access each school's newsletter by clicking the links under the purple banner.
https://tinyurl.com/Falcon-Focus-10-25-19",https://facebook.com/story.php?story_fbid=3841999932492137&id=116140448411456,,0.0,"Here's a link to the Falcon Focus. You can access each school's newsletter by clicking the links under the purple banner.
https://tinyurl.com/Falcon-Focus-10-25-19",2019-10-25 18:10:07,,
121,0.0,,2.0,,3832206316804832,"The Maricopa County Attorney's Office Bullying Presentation has been rescheduled for Wednesday, Oct. 23 from 6:00 - 7:30 p.m. in the FHMS Cafeteria.",https://facebook.com/story.php?story_fbid=3832206316804832&id=116140448411456,,0.0,"The Maricopa County Attorney's Office Bullying Presentation has been rescheduled for Wednesday, Oct. 23 from 6:00 - 7:30 p.m. in the FHMS Cafeteria.",2019-10-22 17:10:51,,
122,0.0,,24.0,https://www.bizjournals.com/phoenix/news/2019/10/16/here-are-arizonas-top-50-high-schools-ranked-by.html,3827967920562005,"The Phoenix Business Journal recently released Arizona's top 50 high schools ranked by SAT score. FHHS made the list at #45!
https://www.bizjournals.com/phoenix/news/2019/10/16/here-are-arizonas-top-50-high-schools-ranked-by.html",https://facebook.com/story.php?story_fbid=3827967920562005&id=116140448411456,"BIZJOURNALS.COM
Arizona's high schools with top SAT scores - Phoenix Business Journal",0.0,"The Phoenix Business Journal recently released Arizona's top 50 high schools ranked by SAT score. FHHS made the list at #45!
https://www.bizjournals.com/phoenix/news/2019/10/16/here-are-arizonas-top-50-high-schools-ranked-by.html

BIZJOURNALS.COM
Arizona's high schools with top SAT scores - Phoenix Business Journal",2019-10-21 11:46:23,,
