,comments,image,likes,link,post_id,post_text,post_url,shared_text,shares,text,time,video,video_thumbnail
0,3.0,,16.0,,1323541517710842,The purpose of this Facebook page is to celebrate the work and accomplishments of students and staff in the Gilford School District. Other information about our schools is posted on school web sites and shared in school-community correspondences,https://facebook.com/story.php?story_fbid=1323541517710842&id=1304138352984492,,0.0,The purpose of this Facebook page is to celebrate the work and accomplishments of students and staff in the Gilford School District. Other information about our schools is posted on school web sites and shared in school-community correspondences,2017-02-14 12:42:55,,
1,0.0,https://scontent-atl3-1.xx.fbcdn.net/v/t1.0-9/fr/cp0/e15/q65/119038874_3408276865903953_2149701617477145078_o.jpg?_nc_cat=110&_nc_sid=8024bb&_nc_ohc=sRb6LWH_jhUAX_07PNP&_nc_ht=scontent-atl3-1.xx&tp=14&oh=777bc975eaa6d09c588616fe078e1dfc&oe=5F823C42,24.0,,3408276949237278,Such a great day with freshmen! See everyone Monday. Were looking forward to it!!,https://facebook.com/story.php?story_fbid=3408276949237278&id=1304138352984492,,0.0,Such a great day with freshmen! See everyone Monday. Were looking forward to it!!,2020-09-11 18:09:42,,
2,0.0,https://scontent-atl3-1.xx.fbcdn.net/v/t1.0-9/fr/cp0/e15/q65/119064790_3406678092730497_5027848110321911747_o.jpg?_nc_cat=104&_nc_sid=8024bb&_nc_ohc=v-3TkxkaUBAAX8ldsBB&_nc_ht=scontent-atl3-1.xx&tp=14&oh=7a51404c6987719605c57bd74a1796c7&oe=5F8390D1,40.0,,3406678289397144,Welcome freshmen!!,https://facebook.com/story.php?story_fbid=3406678289397144&id=1304138352984492,,0.0,Welcome freshmen!!,2020-09-11 07:32:08,,
3,0.0,,2.0,https://conta.cc/3bySRkL,3396215613776745,"GHS Update 9/4/20
https://conta.cc/3bySRkL
Seniors- Tuesday
Juniors- Wednesday
Sophomores- Thursday
Freshmen- Friday
WELCOME BACK!!",https://facebook.com/story.php?story_fbid=3396215613776745&id=1304138352984492,"MYEMAIL.CONSTANTCONTACT.COM
GHS Welcome Back! 9/4/20",2.0,"GHS Update 9/4/20
https://conta.cc/3bySRkL
Seniors- Tuesday
Juniors- Wednesday
Sophomores- Thursday
Freshmen- Friday
WELCOME BACK!!

MYEMAIL.CONSTANTCONTACT.COM
GHS Welcome Back! 9/4/20",2020-09-07 20:58:13,,
4,0.0,,0.0,https://conta.cc/2EClRvy,3357634117634895,"Gilford High School Update 8/25/20
Welcome back letter!
https://conta.cc/2EClRvy",https://facebook.com/story.php?story_fbid=3357634117634895&id=1304138352984492,"MYEMAIL.CONSTANTCONTACT.COM
Gilford High School Update 8/25/20",2.0,"Gilford High School Update 8/25/20
Welcome back letter!
https://conta.cc/2EClRvy

MYEMAIL.CONSTANTCONTACT.COM
Gilford High School Update 8/25/20",2020-08-26 16:24:07,,
5,0.0,,0.0,https://conta.cc/3fmxUKx,3144835388914770,"Gilford High School Update 6/12/20
Final video message with a retirement send-off!
https://conta.cc/3fmxUKx",https://facebook.com/story.php?story_fbid=3144835388914770&id=1304138352984492,"MYEMAIL.CONSTANTCONTACT.COM
Gilford High School Update 6/12/20",0.0,"Gilford High School Update 6/12/20
Final video message with a retirement send-off!
https://conta.cc/3fmxUKx

MYEMAIL.CONSTANTCONTACT.COM
Gilford High School Update 6/12/20",2020-06-12 08:39:24,,
6,0.0,,0.0,https://conta.cc/2MGc34w,3134411366623839,"GHS Update 6/8/20
https://conta.cc/2MGc34w

Don't forget, underclassmen return all items today, Tuesday, and Wednesday",https://facebook.com/story.php?story_fbid=3134411366623839&id=1304138352984492,"MYEMAIL.CONSTANTCONTACT.COM
Gilford High School Update 6/8/20",0.0,"GHS Update 6/8/20
https://conta.cc/2MGc34w

Don't forget, underclassmen return all items today, Tuesday, and Wednesday

MYEMAIL.CONSTANTCONTACT.COM
Gilford High School Update 6/8/20",2020-06-08 09:01:46,,
7,0.0,,15.0,,3129577737107202,The parade has left Gunstock!! Congrats!!,https://facebook.com/story.php?story_fbid=3129577737107202&id=1304138352984492,,0.0,The parade has left Gunstock!! Congrats!!,2020-06-06 11:24:16,,
8,0.0,,0.0,,3129268043804838,"For those of you at the Graduation ceremony, the FM station to hear the ceremony is 88.9. Enjoy the day!!",https://facebook.com/story.php?story_fbid=3129268043804838&id=1304138352984492,,0.0,"For those of you at the Graduation ceremony, the FM station to hear the ceremony is 88.9. Enjoy the day!!",2020-06-06 08:49:23,,
9,0.0,,6.0,https://bit.ly/30cU0uq,3129080707156905,View graduation on Northeast Sports Network (https://bit.ly/30cU0uq) at 10:00am today. An announcement will be sent out after the ceremony updating you when the parade of seniors leaves Gunstock Mountain Resort. Estimated start time is around 12:30.,https://facebook.com/story.php?story_fbid=3129080707156905&id=1304138352984492,"NSNSPORTS.NET
New Hampshire - NSN",6.0,"View graduation on Northeast Sports Network (https://bit.ly/30cU0uq) at 10:00am today. An announcement will be sent out after the ceremony updating you when the parade of seniors leaves Gunstock Mountain Resort. Estimated start time is around 12:30.

NSNSPORTS.NET
New Hampshire - NSN",2020-06-06 07:08:52,,
10,0.0,,4.0,https://conta.cc/3gXpyup,3126731214058521,"Tribute to the Class of 2020 at Gilford!
https://conta.cc/3gXpyup",https://facebook.com/story.php?story_fbid=3126731214058521&id=1304138352984492,"MYEMAIL.CONSTANTCONTACT.COM
Special Announcement- Graduation tribute to the Class of 2020",3.0,"Tribute to the Class of 2020 at Gilford!
https://conta.cc/3gXpyup

MYEMAIL.CONSTANTCONTACT.COM
Special Announcement- Graduation tribute to the Class of 2020",2020-06-05 09:51:14,,
11,0.0,,7.0,,3126625457402430,"Share photos of your graduates with us by tagging @GilfordHigh and Gilford School District! Congratulations to the Class of 2020!

Graduation will be held Saturday, June 6 at 10:00 AM Gunstock Mountain Resort. Parade to follow. Check back here for updates!",https://facebook.com/story.php?story_fbid=3126625457402430&id=1304138352984492,,0.0,"Share photos of your graduates with us by tagging @GilfordHigh and Gilford School District! Congratulations to the Class of 2020!

Graduation will be held Saturday, June 6 at 10:00 AM Gunstock Mountain Resort. Parade to follow. Check back here for updates!",2020-06-05 09:00:50,,
12,0.0,,5.0,https://conta.cc/2Xz4suM,3125099054221737,"Gilford Graduation moved to Saturday 10:00am
https://conta.cc/2Xz4suM
Please share this message",https://facebook.com/story.php?story_fbid=3125099054221737&id=1304138352984492,"MYEMAIL.CONSTANTCONTACT.COM
Special Announcement- Senior Awards Night video & Graduation update",9.0,"Gilford Graduation moved to Saturday 10:00am
https://conta.cc/2Xz4suM
Please share this message

MYEMAIL.CONSTANTCONTACT.COM
Special Announcement- Senior Awards Night video & Graduation update",2020-06-04 18:02:41,,
13,0.0,,1.0,https://conta.cc/3gNgxnH,3124416184290024,"Gilford High School Graduation Weather Alert!!

Please read this announcement pertaining to Graduation and feel free to share.
https://conta.cc/3gNgxnH",https://facebook.com/story.php?story_fbid=3124416184290024&id=1304138352984492,"MYEMAIL.CONSTANTCONTACT.COM
Special Announcement- Graduation weather",7.0,"Gilford High School Graduation Weather Alert!!

Please read this announcement pertaining to Graduation and feel free to share.
https://conta.cc/3gNgxnH

MYEMAIL.CONSTANTCONTACT.COM
Special Announcement- Graduation weather",2020-06-04 11:54:15,,
14,0.0,,6.0,https://conta.cc/3cpKjLL,3116459171752392,"Senior video from GHS Staff!
https://conta.cc/3cpKjLL

Congrats Class of 2020!!",https://facebook.com/story.php?story_fbid=3116459171752392&id=1304138352984492,"MYEMAIL.CONSTANTCONTACT.COM
Special Announcement- Senior Video from GHS Staff",7.0,"Senior video from GHS Staff!
https://conta.cc/3cpKjLL

Congrats Class of 2020!!

MYEMAIL.CONSTANTCONTACT.COM
Special Announcement- Senior Video from GHS Staff",2020-06-01 11:58:06,,
15,0.0,,0.0,https://conta.cc/3eQq4IX,3116169371781372,"GHS Update 6/1
https://conta.cc/3eQq4IX

Congrats to our Seniors! It's your week! Looking forward to seeing you all at Graduation Friday at 4:00pm. The lot opens at 3:00.",https://facebook.com/story.php?story_fbid=3116169371781372&id=1304138352984492,"MYEMAIL.CONSTANTCONTACT.COM
Gilford High School Update 6/1/20",0.0,"GHS Update 6/1
https://conta.cc/3eQq4IX

Congrats to our Seniors! It's your week! Looking forward to seeing you all at Graduation Friday at 4:00pm. The lot opens at 3:00.

MYEMAIL.CONSTANTCONTACT.COM
Gilford High School Update 6/1/20",2020-06-01 09:50:09,,
16,0.0,,1.0,https://conta.cc/2TIJnvA,3100441453354164,"GHS Update 5/26/20
https://conta.cc/2TIJnvA

Senior Families- Be on the lookout this week for specific info on Senior Week and how to pick up your Graduation regalia.",https://facebook.com/story.php?story_fbid=3100441453354164&id=1304138352984492,"MYEMAIL.CONSTANTCONTACT.COM
Gilford High School Update 5/26/20",0.0,"GHS Update 5/26/20
https://conta.cc/2TIJnvA

Senior Families- Be on the lookout this week for specific info on Senior Week and how to pick up your Graduation regalia.

MYEMAIL.CONSTANTCONTACT.COM
Gilford High School Update 5/26/20",2020-05-26 08:45:43,,
17,3.0,https://scontent-atl3-1.xx.fbcdn.net/v/t1.0-9/fr/cp0/e15/q65/98362090_3086380768093566_7639121200232267776_n.jpg?_nc_cat=103&_nc_sid=2d5d41&_nc_ohc=FaooQZfBrLEAX_9vsfa&_nc_ht=scontent-atl3-1.xx&tp=14&oh=a81bfff4247e3e4a7755e9bd2882716d&oe=5F84CD08,2.0,,3086380758093567,"Gilford resident, Danielle Cook, is helping our seniors out. Order them for the parade if you'd like.",,,0.0,"Gilford resident, Danielle Cook, is helping our seniors out. Order them for the parade if you'd like.",2020-05-20 12:57:40,,
18,0.0,,0.0,https://conta.cc/2X84XdF,3080885521976424,"GHS Update 5/18/20
https://conta.cc/2X84XdF",https://facebook.com/story.php?story_fbid=3080885521976424&id=1304138352984492,,0.0,"GHS Update 5/18/20
https://conta.cc/2X84XdF",2020-05-18 07:58:46,,
19,0.0,,3.0,https://conta.cc/3fNzK80,3065682610163382,"GHS Update 5/11/20
Lots of info!! Please check out the exciting events planned!
https://conta.cc/3fNzK80",https://facebook.com/story.php?story_fbid=3065682610163382&id=1304138352984492,"MYEMAIL.CONSTANTCONTACT.COM
Gilford High School Update 5/11/20",2.0,"GHS Update 5/11/20
Lots of info!! Please check out the exciting events planned!
https://conta.cc/3fNzK80

MYEMAIL.CONSTANTCONTACT.COM
Gilford High School Update 5/11/20",2020-05-13 10:52:58,,
20,1.0,https://scontent-atl3-1.xx.fbcdn.net/v/t1.0-9/fr/cp0/e15/q65/95514140_3054016517996658_8525532854476603392_n.jpg?_nc_cat=107&_nc_sid=2d5d41&_nc_ohc=Yr8T-q3lCacAX9f7jgY&_nc_ht=scontent-atl3-1.xx&tp=14&oh=d5792b4d8998712c1b85ac7ceb4da910&oe=5F859F7D,13.0,https://conta.cc/3ch4RGR,3054016514663325,"Always one of the best announcements to make!
Class of 2020 Graduation Information!!!
https://conta.cc/3ch4RGR",,,0.0,"Always one of the best announcements to make!
Class of 2020 Graduation Information!!!
https://conta.cc/3ch4RGR",2020-05-08 14:15:40,,
21,0.0,https://scontent-atl3-1.xx.fbcdn.net/v/t1.0-9/fr/cp0/e15/q65/96141086_3051110408287269_6657081334638313472_n.jpg?_nc_cat=104&_nc_sid=2d5d41&_nc_ohc=Z5QrxQOjmHAAX-yJUjq&_nc_ht=scontent-atl3-1.xx&tp=14&oh=04a84c48f865288b32115f1164fbe278&oe=5F84FC8C,17.0,https://conta.cc/2L7ja53,3051110398287270,"Special Announcement- Graduation and End of Year dates
https://conta.cc/2L7ja53",,,0.0,"Special Announcement- Graduation and End of Year dates
https://conta.cc/2L7ja53",2020-05-07 09:03:25,,
22,1.0,https://scontent-atl3-1.xx.fbcdn.net/v/t1.0-9/fr/cp0/e15/q65/96138304_3048473728550937_2076216435318718464_o.jpg?_nc_cat=105&_nc_sid=8024bb&_nc_ohc=yPbWASYnOOUAX_woaXO&_nc_ht=scontent-atl3-1.xx&tp=14&oh=a80eb88b51b015de78d29c864b59d4d0&oe=5F824F55,25.0,,3048473841884259,Happy Teacher Appreciation Week!,https://facebook.com/story.php?story_fbid=3048473841884259&id=1304138352984492,,0.0,Happy Teacher Appreciation Week!,2020-05-06 08:10:07,,
23,0.0,,2.0,https://conta.cc/3fnN3vT,3046721715392805,"GHS Update 5/4/20
https://conta.cc/3fnN3vT",https://facebook.com/story.php?story_fbid=3046721715392805&id=1304138352984492,"MYEMAIL.CONSTANTCONTACT.COM
Gilford High School Update 5/4/20",0.0,"GHS Update 5/4/20
https://conta.cc/3fnN3vT

MYEMAIL.CONSTANTCONTACT.COM
Gilford High School Update 5/4/20",2020-05-05 13:05:25,,
24,6.0,https://scontent-atl3-1.xx.fbcdn.net/v/t1.0-9/fr/cp0/e15/q65/94889574_3027550487309928_7167122114221178880_o.jpg?_nc_cat=103&_nc_sid=8024bb&_nc_ohc=7AtJVQcK5fUAX9eDena&_nc_ht=scontent-atl3-1.xx&tp=14&oh=ae087efb7810ca24df125218c2de1fed&oe=5F833A37,36.0,,3027550580643252,Our helpers were out and about bringing smiles to our seniors today. We miss you!! Graduation info coming late next week!!,https://facebook.com/story.php?story_fbid=3027550580643252&id=1304138352984492,,0.0,Our helpers were out and about bringing smiles to our seniors today. We miss you!! Graduation info coming late next week!!,2020-04-27 15:56:44,,
25,0.0,https://scontent-atl3-1.xx.fbcdn.net/v/t1.0-9/fr/cp0/e15/q65/94976775_3026858310712479_893950159367438336_n.jpg?_nc_cat=101&_nc_sid=2d5d41&_nc_ohc=tg1hBT-sxqsAX8TguC5&_nc_ht=scontent-atl3-1.xx&tp=14&oh=287684dc01da8824db9a5be1fc92695f&oe=5F829690,19.0,https://conta.cc/3eUIHft,3026858304045813,"GHS Update 4/27
https://conta.cc/3eUIHft
Senior signs being delivered to your houses today!",,,0.0,"GHS Update 4/27
https://conta.cc/3eUIHft
Senior signs being delivered to your houses today!",2020-04-27 10:30:02,,
26,0.0,,0.0,https://conta.cc/2z7iVnI,3008985099166467,"GHS Update 4/17/20
https://conta.cc/2z7iVnI
Important Senior info included",https://facebook.com/story.php?story_fbid=3008985099166467&id=1304138352984492,"MYEMAIL.CONSTANTCONTACT.COM
Gilford High School Update 4/17/20",0.0,"GHS Update 4/17/20
https://conta.cc/2z7iVnI
Important Senior info included

MYEMAIL.CONSTANTCONTACT.COM
Gilford High School Update 4/17/20",2020-04-19 20:19:14,,
27,1.0,,14.0,https://drive.google.com/a/sau73.org/file/d/1XY7yuvsqLrEFwc_X1rBhuWVcp-qNFB6u/view?usp=drivesdk,2997548326976811,More footage from the EPIC parade! https://drive.google.com/a/sau73.org/file/d/1XY7yuvsqLrEFwc_X1rBhuWVcp-qNFB6u/view?usp=drivesdk KEEP SMILING ,https://facebook.com/story.php?story_fbid=2997548326976811&id=1304138352984492,"DRIVE.GOOGLE.COM
720p.mov",20.0,"More footage from the EPIC parade! https://drive.google.com/a/sau73.org/file/d/1XY7yuvsqLrEFwc_X1rBhuWVcp-qNFB6u/view?usp=drivesdk KEEP SMILING 

DRIVE.GOOGLE.COM
720p.mov",2020-04-14 22:29:23,,
28,0.0,,4.0,https://conta.cc/2RypN40,2993949920669985,"GHS Update 4/13/20
https://conta.cc/2RypN40

Great seeing you all at the parade!",https://facebook.com/story.php?story_fbid=2993949920669985&id=1304138352984492,"MYEMAIL.CONSTANTCONTACT.COM
Gilford High School Update 4/13/20",0.0,"GHS Update 4/13/20
https://conta.cc/2RypN40

Great seeing you all at the parade!

MYEMAIL.CONSTANTCONTACT.COM
Gilford High School Update 4/13/20",2020-04-13 09:03:54,,
29,1.0,,3.0,,2987840127947631,The parade is on Allens Mill Road,https://facebook.com/story.php?story_fbid=2987840127947631&id=1304138352984492,,0.0,The parade is on Allens Mill Road,2020-04-10 15:53:13,,
30,0.0,,10.0,,2987801091284868,Just left GHS at 3:30. See Gilmanton soon!!,https://facebook.com/story.php?story_fbid=2987801091284868&id=1304138352984492,,0.0,Just left GHS at 3:30. See Gilmanton soon!!,2020-04-10 15:29:42,,
31,0.0,,13.0,,3128686020489219,,,,2.0,,2020-04-10 14:14:55,https://video-atl3-1.xx.fbcdn.net/v/t42.9040-2/92956637_266400594369586_1437542656530972672_n.mp4?_nc_cat=103&_nc_sid=985c63&efg=eyJ2ZW5jb2RlX3RhZyI6ImxlZ2FjeV9zZCJ9&_nc_ohc=JPVsm4N4GMcAX92I98X&_nc_ht=video-atl3-1.xx&oh=962363d677143ee59fa01a54e31a5db0&oe=5F5E4371,
32,11.0,https://scontent-atl3-1.xx.fbcdn.net/v/t1.0-9/fr/cp0/e15/q65/93040857_2987589131306064_5503776998121537536_o.jpg?_nc_cat=101&_nc_sid=2d5d41&_nc_ohc=-30QXrtR2vgAX8bhGIb&_nc_ht=scontent-atl3-1.xx&tp=14&oh=a3295abd1990be86b76783da10323d7b&oe=5F842ACB,46.0,,2987589127972731,Well over 100 staff vehicles ready to say hello!!!,,,0.0,Well over 100 staff vehicles ready to say hello!!!,2020-04-10 13:34:14,,
33,1.0,,18.0,https://conta.cc/3c7MMuB,2985808571484120,"See you at the parade tomorrow, Friday April 10! Click this link to learn more about the route.
https://conta.cc/3c7MMuB

We wish we could drive by every house in Gilford and Gilmanton but that's just not feasible. Thanks for waving if you see us! We miss you!!",https://facebook.com/story.php?story_fbid=2985808571484120&id=1304138352984492,"MYEMAIL.CONSTANTCONTACT.COM
Special Announcement- Parade happening on 4/10",7.0,"See you at the parade tomorrow, Friday April 10! Click this link to learn more about the route.
https://conta.cc/3c7MMuB

We wish we could drive by every house in Gilford and Gilmanton but that's just not feasible. Thanks for waving if you see us! We miss you!!

MYEMAIL.CONSTANTCONTACT.COM
Special Announcement- Parade happening on 4/10",2020-04-09 20:29:21,,
34,0.0,,2.0,https://conta.cc/2whc8H2,2978243785573932,"GHS Update 4/6/20
https://conta.cc/2whc8H2

Stay healthy!",https://facebook.com/story.php?story_fbid=2978243785573932&id=1304138352984492,"MYEMAIL.CONSTANTCONTACT.COM
Gilford High School Update 4/6/20",0.0,"GHS Update 4/6/20
https://conta.cc/2whc8H2

Stay healthy!

MYEMAIL.CONSTANTCONTACT.COM
Gilford High School Update 4/6/20",2020-04-06 09:53:57,,
35,1.0,,9.0,https://conta.cc/39s0E0T,2961909697207341,"GHS Update 3/29/20
https://conta.cc/39s0E0T

Check in with all your teachers tomorrow! Have a great start to trimester 3! You got this!",https://facebook.com/story.php?story_fbid=2961909697207341&id=1304138352984492,"MYEMAIL.CONSTANTCONTACT.COM
Gilford High School Update 3/29/20",0.0,"GHS Update 3/29/20
https://conta.cc/39s0E0T

Check in with all your teachers tomorrow! Have a great start to trimester 3! You got this!

MYEMAIL.CONSTANTCONTACT.COM
Gilford High School Update 3/29/20",2020-03-29 20:00:40,,
36,0.0,,1.0,https://conta.cc/2JgpS7K,2952054224859555,"GHS Update 3/25/20
https://conta.cc/2JgpS7K

Please sign the consent form included in this update.",https://facebook.com/story.php?story_fbid=2952054224859555&id=1304138352984492,"MYEMAIL.CONSTANTCONTACT.COM
Gilford High School Update 3/25/20",0.0,"GHS Update 3/25/20
https://conta.cc/2JgpS7K

Please sign the consent form included in this update.

MYEMAIL.CONSTANTCONTACT.COM
Gilford High School Update 3/25/20",2020-03-25 11:06:08,,
37,0.0,,3.0,https://conta.cc/2vHKMcP,2947986395266338,"GHS Video Update 3/23/20
https://conta.cc/2vHKMcP",https://facebook.com/story.php?story_fbid=2947986395266338&id=1304138352984492,"MYEMAIL.CONSTANTCONTACT.COM
Special Announcement- COVID-19 Update 3/23/20",0.0,"GHS Video Update 3/23/20
https://conta.cc/2vHKMcP

MYEMAIL.CONSTANTCONTACT.COM
Special Announcement- COVID-19 Update 3/23/20",2020-03-23 15:12:32,,
38,3.0,https://scontent-atl3-1.xx.fbcdn.net/v/t1.0-9/fr/cp0/e15/q65/90636035_2947218025343175_8058368149294153728_n.jpg?_nc_cat=105&_nc_sid=2d5d41&_nc_ohc=Ccz3WhjCnyMAX-xCjPW&_nc_ht=scontent-atl3-1.xx&tp=14&oh=a8199a20319a73388ef112e05bdff253&oe=5F84303D,12.0,,2947218022009842,Remote learning starts today in the Gilford School District. Please have fun and be patient as we navigate this together. Send us your pictures while you're learning.,,,0.0,Remote learning starts today in the Gilford School District. Please have fun and be patient as we navigate this together. Send us your pictures while you're learning.,2020-03-23 08:44:45,,
39,0.0,,0.0,https://conta.cc/2wbfcok,2937697399628571,"GHS Update 3/19/20
https://conta.cc/2wbfcok

Say something to someone that puts a smile on your face today!",https://facebook.com/story.php?story_fbid=2937697399628571&id=1304138352984492,"MYEMAIL.CONSTANTCONTACT.COM
Gilford High School Update 3/19/20",0.0,"GHS Update 3/19/20
https://conta.cc/2wbfcok

Say something to someone that puts a smile on your face today!

MYEMAIL.CONSTANTCONTACT.COM
Gilford High School Update 3/19/20",2020-03-19 08:18:31,,
40,0.0,,0.0,https://conta.cc/38WMZif,2933010110097300,"GHS Update 3/17/20
https://conta.cc/38WMZif

Please click in the Update for Principal Sperazzo's video message.

Happy St. Patrick's Day!",https://facebook.com/story.php?story_fbid=2933010110097300&id=1304138352984492,"MYEMAIL.CONSTANTCONTACT.COM
Gilford High School Update 3/17/20",0.0,"GHS Update 3/17/20
https://conta.cc/38WMZif

Please click in the Update for Principal Sperazzo's video message.

Happy St. Patrick's Day!

MYEMAIL.CONSTANTCONTACT.COM
Gilford High School Update 3/17/20",2020-03-17 07:41:28,,
41,2.0,,1.0,https://conta.cc/2xsVqVl,2924103590987952,"GHS Update 3/13/20
https://conta.cc/2xsVqVl

No state championship basketball game this evening even though it states this in the GHS Update.",https://facebook.com/story.php?story_fbid=2924103590987952&id=1304138352984492,"MYEMAIL.CONSTANTCONTACT.COM
Gilford High School Update 3/13/20",0.0,"GHS Update 3/13/20
https://conta.cc/2xsVqVl

No state championship basketball game this evening even though it states this in the GHS Update.

MYEMAIL.CONSTANTCONTACT.COM
Gilford High School Update 3/13/20",2020-03-13 11:47:17,,
42,0.0,,2.0,,2923970367667941,The NHIAA has SUSPENDED ALL tournament games until further notice. This includes the boys basketball game tonight. Press release can be found at the NHIAA website. 3/13/20 @ 10:15am,https://facebook.com/story.php?story_fbid=2923970367667941&id=1304138352984492,,0.0,The NHIAA has SUSPENDED ALL tournament games until further notice. This includes the boys basketball game tonight. Press release can be found at the NHIAA website. 3/13/20 @ 10:15am,2020-03-13 10:30:36,,
43,0.0,,4.0,https://twitter.com/gilfordhigh/status/1238278650786721792?s=12,2922900264441618,Important announcement regarding the state championship boys basketball game. Please read BEFORE traveling. Good luck Gilford!! GilfordHighSchool on Twitter https://twitter.com/gilfordhigh/status/1238278650786721792?s=12,https://facebook.com/story.php?story_fbid=2922900264441618&id=1304138352984492,"TWITTER.COM
GilfordHighSchool on Twitter",2.0,"Important announcement regarding the state championship boys basketball game. Please read BEFORE traveling. Good luck Gilford!! GilfordHighSchool on Twitter https://twitter.com/gilfordhigh/status/1238278650786721792?s=12

TWITTER.COM
GilfordHighSchool on Twitter",2020-03-12 21:42:43,,
44,0.0,https://scontent-atl3-1.xx.fbcdn.net/v/t1.0-9/89614192_2916489961749315_4274442373141889024_o.png?_nc_cat=109&_nc_sid=da1649&_nc_ohc=YuyMYF3H054AX_VpB3T&_nc_ht=scontent-atl3-1.xx&oh=f6683a1a3ca75d7988b1470453d37cd5&oe=5F84077C,20.0,,2916489955082649,Onto the state final!,,,0.0,Onto the state final!,2020-03-09 21:29:45,,
45,1.0,https://scontent-atl3-1.xx.fbcdn.net/v/t1.0-9/85187852_2916418308423147_2131313761850490880_o.png?_nc_cat=110&_nc_sid=da1649&_nc_ohc=b_8_KBdzAQ4AX_NWIk1&_nc_oc=AQmJf8C7LO6Dezvix-yqThjmMN5L_4FYWCr0TwdeBjSdqU36WD9_jardepMUuxiWgZ0&_nc_ht=scontent-atl3-1.xx&oh=10c814a4e43aab811a918f8c5b517542&oe=5F82A2E4,18.0,,2916418301756481,Gilford boys basketball state semi-final game.,,,0.0,Gilford boys basketball state semi-final game.,2020-03-09 20:35:52,,
46,0.0,,1.0,https://conta.cc/2II4A2V,2914285015303143,"GHS Update 3/8/20
https://conta.cc/2II4A2V

Good luck boys basketball Monday at 8:00 at Keene State!",https://facebook.com/story.php?story_fbid=2914285015303143&id=1304138352984492,"MYEMAIL.CONSTANTCONTACT.COM
Gilford High School Update 3/8/20",0.0,"GHS Update 3/8/20
https://conta.cc/2II4A2V

Good luck boys basketball Monday at 8:00 at Keene State!

MYEMAIL.CONSTANTCONTACT.COM
Gilford High School Update 3/8/20",2020-03-08 20:16:08,,
47,0.0,https://scontent-atl3-1.xx.fbcdn.net/v/t1.0-9/fr/cp0/e15/q65/89588614_2914282371970074_3699510070850093056_o.jpg?_nc_cat=100&_nc_sid=da1649&_nc_ohc=Ch4dNhYqRfYAX9fGBXv&_nc_ht=scontent-atl3-1.xx&tp=14&oh=c842792e8e657397da02a115bdc5a41b&oe=5F84AEE6,7.0,,2914282361970075,,,,0.0,,2020-03-08 20:13:40,,
48,0.0,,4.0,https://conta.cc/2wieIw7,2899401860124792,"GHS Update 3/1/20
https://conta.cc/2wieIw7
Good luck to boy's basketball and ice hockey!",https://facebook.com/story.php?story_fbid=2899401860124792&id=1304138352984492,"MYEMAIL.CONSTANTCONTACT.COM
Gilford High School Update 3/1/20",0.0,"GHS Update 3/1/20
https://conta.cc/2wieIw7
Good luck to boy's basketball and ice hockey!

MYEMAIL.CONSTANTCONTACT.COM
Gilford High School Update 3/1/20",2020-03-01 19:55:47,,
49,1.0,,10.0,,2890433077688337,Girls basketball begin their playoff run tonight at 7:00. Good luck!!,https://facebook.com/story.php?story_fbid=2890433077688337&id=1304138352984492,,0.0,Girls basketball begin their playoff run tonight at 7:00. Good luck!!,2020-02-26 18:40:46,,
50,0.0,https://scontent-atl3-1.xx.fbcdn.net/v/t1.0-9/fr/cp0/e15/q65/86937139_2878635885534723_1742859477738061824_o.jpg?_nc_cat=110&_nc_sid=8024bb&_nc_ohc=zUme8VMxRuAAX_4Z4t6&_nc_ht=scontent-atl3-1.xx&tp=14&oh=04429139529f96381b3c7210f17e8170&oe=5F857C03,7.0,,2878635952201383,Thanks to @NH_StatePolice for speaking with our students today. Former GHS grad Officer Nathan Cobis joined Stephanie Colcord to deliver their message. Youre making us proud!,https://facebook.com/story.php?story_fbid=2878635952201383&id=1304138352984492,,0.0,Thanks to @NH_StatePolice for speaking with our students today. Former GHS grad Officer Nathan Cobis joined Stephanie Colcord to deliver their message. Youre making us proud!,2020-02-21 09:09:48,,
51,0.0,https://scontent-atl3-1.xx.fbcdn.net/v/t1.0-9/fr/cp0/e15/q65/87039883_2877524585645853_2935353436620718080_o.jpg?_nc_cat=103&_nc_sid=8024bb&_nc_ohc=Jths5ocvXekAX9a6e5N&_nc_ht=scontent-atl3-1.xx&tp=14&oh=646338cdbb86fac3db42d99605e1260b&oe=5F8252A5,20.0,,2877524695645842,GHS staff dance!!!,https://facebook.com/story.php?story_fbid=2877524695645842&id=1304138352984492,,0.0,GHS staff dance!!!,2020-02-20 20:17:58,,
52,0.0,https://scontent-atl3-1.xx.fbcdn.net/v/t1.0-9/fr/cp0/e15/q65/86970419_2877522962312682_8050053620890075136_o.jpg?_nc_cat=103&_nc_sid=8024bb&_nc_ohc=ij5tma6hIXEAX-Cn0bv&_nc_ht=scontent-atl3-1.xx&tp=14&oh=9d1642a4c50094b5030e91f45e3ac5a1&oe=5F83435B,22.0,,2877523092312669,The dances today were awesome!,https://facebook.com/story.php?story_fbid=2877523092312669&id=1304138352984492,,0.0,The dances today were awesome!,2020-02-20 20:16:48,,
53,0.0,https://scontent-atl3-1.xx.fbcdn.net/v/t1.0-9/fr/cp0/e15/q65/86871757_2877518922313086_4417804812364546048_o.jpg?_nc_cat=111&_nc_sid=8024bb&_nc_ohc=9h2_0BpyiMQAX_-sfbL&_nc_ht=scontent-atl3-1.xx&tp=14&oh=4fd52eca9131f67fca902f7ef8e3ea86&oe=5F84BF5A,5.0,,2877519035646408,More from today...,https://facebook.com/story.php?story_fbid=2877519035646408&id=1304138352984492,,0.0,More from today...,2020-02-20 20:14:34,,
54,0.0,https://scontent-atl3-1.xx.fbcdn.net/v/t1.0-9/fr/cp0/e15/q65/86999759_2877516938979951_7181289948610297856_o.jpg?_nc_cat=106&_nc_sid=8024bb&_nc_ohc=5ryxwb7Cfl8AX-YJFQx&_nc_ht=scontent-atl3-1.xx&tp=14&oh=1d9ae41e7c579bf57422302eab82ad47&oe=5F83D3D7,12.0,,2877517018979943,Thursdays winter carnival was a blast! Cant wait to see what Friday brings!!,https://facebook.com/story.php?story_fbid=2877517018979943&id=1304138352984492,,0.0,Thursdays winter carnival was a blast! Cant wait to see what Friday brings!!,2020-02-20 20:13:02,,
55,0.0,https://scontent-atl3-1.xx.fbcdn.net/v/t1.0-9/fr/cp0/e15/q65/86875323_2874558172609161_6738415607064035328_o.jpg?_nc_cat=102&_nc_sid=8024bb&_nc_ohc=M7aMko7IsUAAX_0W1Zi&_nc_ht=scontent-atl3-1.xx&tp=14&oh=fde3f4d98ec108347bbfa0d6e5299881&oe=5F83BDFD,20.0,,2874558372609141,More Winter Carnival fun!!,https://facebook.com/story.php?story_fbid=2874558372609141&id=1304138352984492,,0.0,More Winter Carnival fun!!,2020-02-19 10:56:21,,
56,0.0,https://scontent-atl3-1.xx.fbcdn.net/v/t1.0-9/fr/cp0/e15/q65/86971183_2870182369713408_1928981743776301056_o.jpg?_nc_cat=109&_nc_sid=da1649&_nc_ohc=196tCPiH5xgAX_nAp3U&_nc_ht=scontent-atl3-1.xx&tp=14&oh=fb746caa5977783767776930d0a6e035&oe=5F82F1B6,16.0,,2870182363046742,Winter Carnival has begun!!!,,,0.0,Winter Carnival has begun!!!,2020-02-17 08:54:22,,
57,0.0,,3.0,https://conta.cc/39BITNh,2869142796484032,"GHS Update
2/16/20
https://conta.cc/39BITNh",https://facebook.com/story.php?story_fbid=2869142796484032&id=1304138352984492,"MYEMAIL.CONSTANTCONTACT.COM
Gilford High School Update 2/16/20",0.0,"GHS Update
2/16/20
https://conta.cc/39BITNh

MYEMAIL.CONSTANTCONTACT.COM
Gilford High School Update 2/16/20",2020-02-16 20:06:37,,
58,2.0,https://scontent-atl3-1.xx.fbcdn.net/v/t1.0-9/fr/cp0/e15/q65/85146470_2864132163651762_3909568997082791936_o.jpg?_nc_cat=100&_nc_sid=da1649&_nc_ohc=CcOuB6BI2VsAX8Yqnby&_nc_ht=scontent-atl3-1.xx&tp=14&oh=740547e0f52ed772b1d42f5d8236e87d&oe=5F850FDC,38.0,,2864132156985096,"Championship bagels for girls alpine ski team, DII 300 meter champion Natalie Fraser, and 1000 point scored Shelby Cole. Well done!!",,,0.0,"Championship bagels for girls alpine ski team, DII 300 meter champion Natalie Fraser, and 1000 point scored Shelby Cole. Well done!!",2020-02-14 12:09:13,,
59,1.0,https://scontent-atl3-1.xx.fbcdn.net/v/t1.0-9/fr/cp0/e15/q65/86440380_2864128043652174_5841771661388414976_o.jpg?_nc_cat=109&_nc_sid=da1649&_nc_ohc=fcf2IZdvIikAX814PxN&_nc_ht=scontent-atl3-1.xx&tp=14&oh=9d2ffd9e1cb5132fc07c5451953faaa6&oe=5F84BFB0,4.0,,2864128036985508,Need scheduling assistance for next year? Contact your school counselor or visit us during lunch. Everything is due next Tuesday.,,,0.0,Need scheduling assistance for next year? Contact your school counselor or visit us during lunch. Everything is due next Tuesday.,2020-02-14 12:06:47,,
60,2.0,https://scontent-atl3-1.xx.fbcdn.net/v/t1.0-9/fr/cp0/e15/q65/85146470_2864123183652660_8143899661330022400_o.jpg?_nc_cat=109&_nc_sid=8024bb&_nc_ohc=zZxswqILS5wAX_BQPYM&_nc_ht=scontent-atl3-1.xx&tp=14&oh=3ae209735fbadc11f403d0a6c2cd01dd&oe=5F83F58A,50.0,,2864123256985986,"Congrats to the girls alpine ski team for capturing the DIII state title!!

The boys alpine ski team were runner-ups!",https://facebook.com/story.php?story_fbid=2864123256985986&id=1304138352984492,,0.0,"Congrats to the girls alpine ski team for capturing the DIII state title!!

The boys alpine ski team were runner-ups!",2020-02-14 12:04:14,,
61,0.0,,16.0,,2858253457572966,"Congrats Gilford!!! Natalie Fraser for capturing the DII 300 indoor track!
Girls Alpine State champions!! Shelby Cole for scoring her 1000th point tonight!! Boys Alpine runner-up!",https://facebook.com/story.php?story_fbid=2858253457572966&id=1304138352984492,,0.0,"Congrats Gilford!!! Natalie Fraser for capturing the DII 300 indoor track!
Girls Alpine State champions!! Shelby Cole for scoring her 1000th point tonight!! Boys Alpine runner-up!",2020-02-11 18:31:10,,
62,0.0,,4.0,https://conta.cc/2Hby1t7,2854308707967441,"GHS Update
https://conta.cc/2Hby1t7",https://facebook.com/story.php?story_fbid=2854308707967441&id=1304138352984492,"MYEMAIL.CONSTANTCONTACT.COM
Gilford High School Update 2/9/20",0.0,"GHS Update
https://conta.cc/2Hby1t7

MYEMAIL.CONSTANTCONTACT.COM
Gilford High School Update 2/9/20",2020-02-09 20:09:24,,
63,1.0,https://scontent-atl3-1.xx.fbcdn.net/v/t1.0-9/84814713_2838914096173569_8282078002011963392_n.png?_nc_cat=108&_nc_sid=da1649&_nc_ohc=ebT3km9mSt0AX_1Ypaf&_nc_ht=scontent-atl3-1.xx&oh=d8e63998933665c3d1843c5cebe4b8c3&oe=5F8246C2,14.0,,2838914092840236,Our school counselors are your child's biggest advocates. Thanks for all you do!,,,0.0,Our school counselors are your child's biggest advocates. Thanks for all you do!,2020-02-02 21:16:07,,
64,0.0,,2.0,https://conta.cc/2GPXN61,2838812109517101,"GHS Update 2/2/20
https://conta.cc/2GPXN61",https://facebook.com/story.php?story_fbid=2838812109517101&id=1304138352984492,"MYEMAIL.CONSTANTCONTACT.COM
Gilford High School Update 2/2/20",0.0,"GHS Update 2/2/20
https://conta.cc/2GPXN61

MYEMAIL.CONSTANTCONTACT.COM
Gilford High School Update 2/2/20",2020-02-02 19:53:02,,
65,32.0,https://scontent-atl3-1.xx.fbcdn.net/v/t1.0-9/fr/cp0/e15/q65/84727562_2832792346785744_840250367949144064_n.jpg?_nc_cat=101&_nc_sid=110474&_nc_ohc=CPsNmBMv_GsAX8sY18c&_nc_ht=scontent-atl3-1.xx&tp=14&oh=aeadb8f00834f1333ab623267822bff7&oe=5F8541FD,100.0,https://t.co/180rnDmJ3X,2832792440119068,Congratulations to Monica Sawyer for being honored as one of the nations top school counselors. #SCOY2020 https://t.co/180rnDmJ3X NH School Counselor of the Year! https://t.co/EVT5wZTS7U,https://facebook.com/story.php?story_fbid=2832792440119068&id=1304138352984492,,0.0,Congratulations to Monica Sawyer for being honored as one of the nations top school counselors. #SCOY2020 https://t.co/180rnDmJ3X NH School Counselor of the Year! https://t.co/EVT5wZTS7U,2020-01-30 20:46:08,,
66,0.0,,8.0,,2817749114956734,Coffeehouse!! Come see the action!,https://facebook.com/story.php?story_fbid=2817749114956734&id=1304138352984492,,0.0,Coffeehouse!! Come see the action!,2020-01-23 17:56:49,,
67,0.0,,0.0,https://conta.cc/37eUocu,2811877818877197,"GHS Update 1/20/20
https://conta.cc/37eUocu

A reminder there is no school Friday, January 24 due to teacher workshop. Have a great week!",https://facebook.com/story.php?story_fbid=2811877818877197&id=1304138352984492,"MYEMAIL.CONSTANTCONTACT.COM
Gilford High School Update 1/20/20",0.0,"GHS Update 1/20/20
https://conta.cc/37eUocu

A reminder there is no school Friday, January 24 due to teacher workshop. Have a great week!

MYEMAIL.CONSTANTCONTACT.COM
Gilford High School Update 1/20/20",2020-01-20 20:16:53,,
68,1.0,https://scontent-atl3-1.xx.fbcdn.net/v/t1.0-9/fr/cp0/e15/q65/82508540_1386272858210635_647863484087795712_o.jpg?_nc_cat=111&_nc_sid=8024bb&_nc_ohc=PLk1ar8cl_YAX_Flkfj&_nc_ht=scontent-atl3-1.xx&tp=14&oh=647453a18bb4825575f563de584d5ec2&oe=5F84890C,8.0,,2800724429992536,,https://facebook.com/story.php?story_fbid=2800724429992536&id=1304138352984492,"Gilford Police Department
January 14 at 4:58 PM 路

Our Sincere Gratitude!!

Ms. Laliberte's high school senior English class (titled Reading & Writing for the Workplace) was tasked with creating a business in order to help students learn real world skills in preparation for one day entering the workforce. Students chose to develop a business that makes wooden flags. As part of that business, students also decided they wanted to show their appreciation for public safety professionals in the community. As a result, the class, at a planned luncheon, presented the Gilford Fire & Police Departments with career-themed flags.

The police flag, presented to Lt. Dustin Parent and SRO Alyssa Raxter, is now being proudly displayed in SRO Raxter's GHS office.

Everyone at GPD would like to express their sincere gratitude to all the students who participated in creating this project, and for taking the time to recognize local public safety professionals in such a unique manner. We are honored to be a part of the Gilford community!!",0.0,"Gilford Police Department
January 14 at 4:58 PM 路

Our Sincere Gratitude!!

Ms. Laliberte's high school senior English class (titled Reading & Writing for the Workplace) was tasked with creating a business in order to help students learn real world skills in preparation for one day entering the workforce. Students chose to develop a business that makes wooden flags. As part of that business, students also decided they wanted to show their appreciation for public safety professionals in the community. As a result, the class, at a planned luncheon, presented the Gilford Fire & Police Departments with career-themed flags.

The police flag, presented to Lt. Dustin Parent and SRO Alyssa Raxter, is now being proudly displayed in SRO Raxter's GHS office.

Everyone at GPD would like to express their sincere gratitude to all the students who participated in creating this project, and for taking the time to recognize local public safety professionals in such a unique manner. We are honored to be a part of the Gilford community!!",2020-01-15 11:48:16,,
69,0.0,,2.0,https://conta.cc/2Nh5Exa,2794903430574636,"GHS Update 1/12/20
https://conta.cc/2Nh5Exa",https://facebook.com/story.php?story_fbid=2794903430574636&id=1304138352984492,"MYEMAIL.CONSTANTCONTACT.COM
Gilford High School Update 1/12/20",0.0,"GHS Update 1/12/20
https://conta.cc/2Nh5Exa

MYEMAIL.CONSTANTCONTACT.COM
Gilford High School Update 1/12/20",2020-01-12 20:03:19,,
70,0.0,,2.0,https://conta.cc/37zHBRY,2773773296020983,"GHS Update 1/3/20
https://conta.cc/37zHBRY
Happy New Year!!",https://facebook.com/story.php?story_fbid=2773773296020983&id=1304138352984492,"MYEMAIL.CONSTANTCONTACT.COM
Gilford High School Update 1/3/20",0.0,"GHS Update 1/3/20
https://conta.cc/37zHBRY
Happy New Year!!

MYEMAIL.CONSTANTCONTACT.COM
Gilford High School Update 1/3/20",2020-01-03 15:16:06,,
71,0.0,https://scontent-atl3-1.xx.fbcdn.net/v/t1.0-9/fr/cp0/e15/q65/81240841_2773152396083073_5359350558060707840_o.jpg?_nc_cat=103&_nc_sid=da1649&_nc_ohc=NXrQNlvwLH0AX_5oEXZ&_nc_ht=scontent-atl3-1.xx&tp=14&oh=a9d59565e57b819bbadbb104c75c9d74&oe=5F83CEFA,9.0,,2773152386083074,GHS is hosting the Granite State Music Festival! Welcome and good luck to all!!,,,0.0,GHS is hosting the Granite State Music Festival! Welcome and good luck to all!!,2020-01-03 09:46:36,,
72,1.0,,10.0,,2759264497471863,Lakes Region boys basketball finals- Gilford vs. @ShakerRegional 6:00pm Sunday night at Gilford. Good luck Golden Eagles!!,https://facebook.com/story.php?story_fbid=2759264497471863&id=1304138352984492,,0.0,Lakes Region boys basketball finals- Gilford vs. @ShakerRegional 6:00pm Sunday night at Gilford. Good luck Golden Eagles!!,2019-12-28 20:19:48,,
73,0.0,,3.0,https://conta.cc/2YSys3u,2719893204742326,"GHS Update 12/15/19
https://conta.cc/2YSys3u",https://facebook.com/story.php?story_fbid=2719893204742326&id=1304138352984492,"MYEMAIL.CONSTANTCONTACT.COM
Gilford High School Update 12/15/19",0.0,"GHS Update 12/15/19
https://conta.cc/2YSys3u

MYEMAIL.CONSTANTCONTACT.COM
Gilford High School Update 12/15/19",2019-12-15 19:26:00,,
74,0.0,,1.0,https://conta.cc/2P1bXGw,2705171169547863,"GHS Update 12/8/19
https://conta.cc/2P1bXGw",https://facebook.com/story.php?story_fbid=2705171169547863&id=1304138352984492,"MYEMAIL.CONSTANTCONTACT.COM
Gilford High School Update 12/8/19",0.0,"GHS Update 12/8/19
https://conta.cc/2P1bXGw

MYEMAIL.CONSTANTCONTACT.COM
Gilford High School Update 12/8/19",2019-12-09 07:05:11,,
75,0.0,,15.0,,2694130637318583,Alysha Burton giving her impact presentation on environmental stimuli and observed behavior. Our takeaway was people are always watching so model positive actions. Great job Alysha!,,,0.0,Alysha Burton giving her impact presentation on environmental stimuli and observed behavior. Our takeaway was people are always watching so model positive actions. Great job Alysha!,2019-12-04 09:40:39,,
76,0.0,,1.0,https://conta.cc/33i4FSL,2673349316063382,"Gilford High School Update

https://conta.cc/33i4FSL",https://facebook.com/story.php?story_fbid=2673349316063382&id=1304138352984492,"MYEMAIL.CONSTANTCONTACT.COM
Gilford High School Update 11/24/19",0.0,"Gilford High School Update

https://conta.cc/33i4FSL

MYEMAIL.CONSTANTCONTACT.COM
Gilford High School Update 11/24/19",2019-11-25 07:05:09,,
77,1.0,https://scontent-atl3-1.xx.fbcdn.net/v/t1.0-9/fr/cp0/e15/q65/77132868_2660592264005754_6086941782057156608_o.jpg?_nc_cat=109&_nc_sid=da1649&_nc_ohc=5ngA1FbhxEYAX9IaZOH&_nc_ht=scontent-atl3-1.xx&tp=14&oh=ca684bf6b87efafced65163eebecca67&oe=5F8582EC,43.0,,2660592257339088,Congratulations to our newest National Honor Society members!,,,0.0,Congratulations to our newest National Honor Society members!,2019-11-19 19:49:07,,
78,0.0,,2.0,https://conta.cc/2XrlmtG,2657283771003270,"GHS Update 11/17/19

https://conta.cc/2XrlmtG",https://facebook.com/story.php?story_fbid=2657283771003270&id=1304138352984492,"MYEMAIL.CONSTANTCONTACT.COM
Gilford High School Update 11/17/19",0.0,"GHS Update 11/17/19

https://conta.cc/2XrlmtG

MYEMAIL.CONSTANTCONTACT.COM
Gilford High School Update 11/17/19",2019-11-18 09:12:23,,
79,2.0,,10.0,,2651101928288121,See you tonight for opening night of School of Rock! 7:00pm tonight and tomorrow night- GHS auditorium- Best of luck!,https://facebook.com/story.php?story_fbid=2651101928288121&id=1304138352984492,,0.0,See you tonight for opening night of School of Rock! 7:00pm tonight and tomorrow night- GHS auditorium- Best of luck!,2019-11-15 15:28:11,,
80,8.0,https://scontent-atl3-1.xx.fbcdn.net/v/t1.0-9/fr/cp0/e15/q65/75279133_2651039271627720_6823990309291032576_o.jpg?_nc_cat=100&_nc_sid=8024bb&_nc_ohc=YfMdijV3U1sAX_Vf4hh&_nc_ht=scontent-atl3-1.xx&tp=14&oh=05f59b8fd3f4177a312a31159b90ab2f&oe=5F852C15,66.0,,2651039358294378,Congratulations to Adrian Siravo for signing his letter of intent to attend the University of UConn to play baseball. Well done Adrian!,https://facebook.com/story.php?story_fbid=2651039358294378&id=1304138352984492,,0.0,Congratulations to Adrian Siravo for signing his letter of intent to attend the University of UConn to play baseball. Well done Adrian!,2019-11-15 14:50:00,,
81,0.0,,0.0,https://conta.cc/2NGI3Xv,2642621609136153,"GHS Update 11/11/19
https://conta.cc/2NGI3Xv",https://facebook.com/story.php?story_fbid=2642621609136153&id=1304138352984492,"MYEMAIL.CONSTANTCONTACT.COM
Gilford High School Update 11/11/19",0.0,"GHS Update 11/11/19
https://conta.cc/2NGI3Xv

MYEMAIL.CONSTANTCONTACT.COM
Gilford High School Update 11/11/19",2019-11-11 19:55:55,,
82,4.0,https://scontent-atl3-1.xx.fbcdn.net/v/t1.0-9/fr/cp0/e15/q65/74614033_2638194042912243_1181148794180337664_o.jpg?_nc_cat=108&_nc_sid=da1649&_nc_ohc=kAd4jOSa8p4AX_um0eP&_nc_ht=scontent-atl3-1.xx&tp=14&oh=9b9b9b58b178ee877445e51c115cfc61&oe=5F84D545,59.0,,2638194039578910,Back to back state titles!!! Thanks for the strong support from our community tonight. You did it again! Congratulations!,,,0.0,Back to back state titles!!! Thanks for the strong support from our community tonight. You did it again! Congratulations!,2019-11-09 18:58:35,,
83,6.0,https://scontent-atl3-1.xx.fbcdn.net/v/t1.0-9/fr/cp0/e15/q65/75388084_2638175676247413_2869825283794403328_o.jpg?_nc_cat=107&_nc_sid=da1649&_nc_ohc=gc99Dywq8C8AX_wnotY&_nc_ht=scontent-atl3-1.xx&tp=14&oh=4452c772c6618685bffd01d65f328127&oe=5F85953E,90.0,,2638175666247414,Congrats to the volleyball team for capturing the state championship!! Back to back titles and undefeated seasons!! Well done!!,,,0.0,Congrats to the volleyball team for capturing the state championship!! Back to back titles and undefeated seasons!! Well done!!,2019-11-09 18:44:47,,
84,0.0,,1.0,https://conta.cc/2oK93vv,2626408307424150,"GHS Update 11/3/19
https://conta.cc/2oK93vv",https://facebook.com/story.php?story_fbid=2626408307424150&id=1304138352984492,"MYEMAIL.CONSTANTCONTACT.COM
Gilford High School Update 11/3/19",0.0,"GHS Update 11/3/19
https://conta.cc/2oK93vv

MYEMAIL.CONSTANTCONTACT.COM
Gilford High School Update 11/3/19",2019-11-04 07:15:10,,
85,2.0,,13.0,,2622816331116681,"Quarterfinal boys soccer playoff game starts at 2:00 today.

Quarterfinal volleyball playoff game starts at 6:00 tonight.

Go Golden Eagles!! ",https://facebook.com/story.php?story_fbid=2622816331116681&id=1304138352984492,,0.0,"Quarterfinal boys soccer playoff game starts at 2:00 today.

Quarterfinal volleyball playoff game starts at 6:00 tonight.

Go Golden Eagles!! ",2019-11-02 13:39:44,,
86,0.0,,0.0,,2622813204450327,See you tonight!!,,,0.0,See you tonight!!,2019-11-02 13:37:45,,
87,0.0,,1.0,https://conta.cc/32SnBIg,2610646882333626,"GHS Update 10/27/19

https://conta.cc/32SnBIg",https://facebook.com/story.php?story_fbid=2610646882333626&id=1304138352984492,"MYEMAIL.CONSTANTCONTACT.COM
Gilford High School Update 10/27/19",0.0,"GHS Update 10/27/19

https://conta.cc/32SnBIg

MYEMAIL.CONSTANTCONTACT.COM
Gilford High School Update 10/27/19",2019-10-27 20:06:53,,
88,0.0,https://scontent-atl3-1.xx.fbcdn.net/v/t1.0-9/fr/cp0/e15/q65/73225512_2604208369644144_2051014933025390592_o.jpg?_nc_cat=108&_nc_sid=8024bb&_nc_ohc=IBBWq26DjW4AX_rI6yb&_nc_ht=scontent-atl3-1.xx&tp=14&oh=74e02db02892cf0c2d6a063e39474d5a&oe=5F821B4D,9.0,,2604208459644135,Good luck to all GHS spellers at Lakes Region Scholarship Foundation!,https://facebook.com/story.php?story_fbid=2604208459644135&id=1304138352984492,,0.0,Good luck to all GHS spellers at Lakes Region Scholarship Foundation!,2019-10-24 19:24:03,,
89,0.0,https://scontent-atl3-1.xx.fbcdn.net/v/t1.0-9/fr/cp0/e15/q65/73420346_2604023829662598_6686457841496096768_o.jpg?_nc_cat=110&_nc_sid=da1649&_nc_ohc=unF8c5BP9rcAX_eoYAu&_nc_ht=scontent-atl3-1.xx&tp=14&oh=97f8f5245f566ea4624eafcf98968052&oe=5F842971,2.0,,2604023822995932,,,,0.0,,2019-10-24 16:56:55,,
90,1.0,https://scontent-atl3-1.xx.fbcdn.net/v/t1.0-9/fr/cp0/e15/q65/75587483_2603478029717178_567244718853849088_o.jpg?_nc_cat=104&_nc_sid=8024bb&_nc_ohc=ilfK80JqJ5IAX9ynDLt&_nc_ht=scontent-atl3-1.xx&tp=14&oh=b221cadb78fcbe6febb3ae767501cfe8&oe=5F835C1B,20.0,,2603478143050500,Lots happening at GHS today! College and Career Fair for our students. Exciting opportunities ahead!,https://facebook.com/story.php?story_fbid=2603478143050500&id=1304138352984492,,0.0,Lots happening at GHS today! College and Career Fair for our students. Exciting opportunities ahead!,2019-10-24 11:07:44,,
91,0.0,https://scontent-atl3-1.xx.fbcdn.net/v/t1.0-9/fr/cp0/e15/q65/73458989_2603358919729089_2380182364757164032_o.jpg?_nc_cat=105&_nc_sid=8024bb&_nc_ohc=w9cvEh7bezgAX9_q-2k&_nc_ht=scontent-atl3-1.xx&tp=14&oh=ba09aec277eb3e8a6a767241362e5d5e&oe=5F83C14C,14.0,,2603358993062415,"Just left Laconia Water Works. Wow! So interesting seeing the process! Pulling water from Lake Winnipesaukee, treatment process, control room for the whole city, and into the chemistry lab. Bringing the classroom to life!",https://facebook.com/story.php?story_fbid=2603358993062415&id=1304138352984492,,0.0,"Just left Laconia Water Works. Wow! So interesting seeing the process! Pulling water from Lake Winnipesaukee, treatment process, control room for the whole city, and into the chemistry lab. Bringing the classroom to life!",2019-10-24 10:03:19,,
92,0.0,https://scontent-atl3-1.xx.fbcdn.net/v/t1.0-9/fr/cp0/e15/q65/72840121_2597320253666289_7778370770182340608_o.jpg?_nc_cat=100&_nc_sid=da1649&_nc_ohc=_OrglOtnohsAX9ucZY-&_nc_ht=scontent-atl3-1.xx&tp=14&oh=1e727fcd962cd486b3cbf83d0b914127&oe=5F83F6F7,6.0,,2597320250332956,,,,0.0,,2019-10-21 16:18:47,,
93,0.0,,1.0,https://conta.cc/2J47MGs,2595212670543714,"GHS Update 10/20/19
https://conta.cc/2J47MGs",https://facebook.com/story.php?story_fbid=2595212670543714&id=1304138352984492,"MYEMAIL.CONSTANTCONTACT.COM
Gilford High School Update 10/21/19",0.0,"GHS Update 10/20/19
https://conta.cc/2J47MGs

MYEMAIL.CONSTANTCONTACT.COM
Gilford High School Update 10/21/19",2019-10-20 16:54:50,,
94,0.0,,3.0,https://conta.cc/2IPcY0X,2581845971880384,"GHS Update 10/14/19

https://conta.cc/2IPcY0X",https://facebook.com/story.php?story_fbid=2581845971880384&id=1304138352984492,"MYEMAIL.CONSTANTCONTACT.COM
Gilford High School Update 10/14/19",0.0,"GHS Update 10/14/19

https://conta.cc/2IPcY0X

MYEMAIL.CONSTANTCONTACT.COM
Gilford High School Update 10/14/19",2019-10-14 20:19:38,,
95,0.0,,12.0,,2571236962941285,We had a great time working with you Locke and not a bad view!,https://facebook.com/story.php?story_fbid=2571236962941285&id=1304138352984492,"Locke Hamill
October 9, 2019 at 4:21 PM 路

A very special thanks to the Gilford High School students who volunteered their time today along with chaperone Jillian Nickerson at the Lake Winnipesaukee Sailing Association. It was a beautiful fall day with lots accomplished!!",0.0,"We had a great time working with you Locke and not a bad view!

Locke Hamill
October 9, 2019 at 4:21 PM 路

A very special thanks to the Gilford High School students who volunteered their time today along with chaperone Jillian Nickerson at the Lake Winnipesaukee Sailing Association. It was a beautiful fall day with lots accomplished!!",2019-10-09 19:52:28,,
96,0.0,,4.0,https://conta.cc/31UCTvv,2566040076794307,"GHS Update 10/6/19
https://conta.cc/31UCTvv",https://facebook.com/story.php?story_fbid=2566040076794307&id=1304138352984492,"MYEMAIL.CONSTANTCONTACT.COM
Gilford High School Update 10/6/19",2.0,"GHS Update 10/6/19
https://conta.cc/31UCTvv

MYEMAIL.CONSTANTCONTACT.COM
Gilford High School Update 10/6/19",2019-10-07 07:05:09,,
97,0.0,https://scontent-atl3-1.xx.fbcdn.net/v/t1.0-9/fr/cp0/e15/q65/71691496_2563175153747466_3876249366649896960_o.jpg?_nc_cat=105&_nc_sid=8024bb&_nc_ohc=c9YrQ9aq_x4AX9zOcY0&_nc_ht=scontent-atl3-1.xx&tp=14&oh=807030b5928ab9cb76be8ef7696714ca&oe=5F83ED8A,28.0,,2563175323747449,Go Golden Eagles!! A great day for Homecoming.,https://facebook.com/story.php?story_fbid=2563175323747449&id=1304138352984492,,0.0,Go Golden Eagles!! A great day for Homecoming.,2019-10-05 20:16:57,,
98,0.0,https://scontent-atl3-1.xx.fbcdn.net/v/t1.0-9/fr/cp0/e15/q65/72621698_2562646357133679_6612831343149580288_o.jpg?_nc_cat=103&_nc_sid=8024bb&_nc_ohc=2t4fgkOVH2IAX9glPFG&_nc_ht=scontent-atl3-1.xx&tp=14&oh=64aa5885c8306745843350226b96b71c&oe=5F84B585,16.0,,2562646540466994,Homecoming pictures. Go Golden Eagles!! 4:30 volleyball. 7:00 football game.,https://facebook.com/story.php?story_fbid=2562646540466994&id=1304138352984492,,0.0,Homecoming pictures. Go Golden Eagles!! 4:30 volleyball. 7:00 football game.,2019-10-05 13:48:46,,
99,0.0,https://scontent-atl3-1.xx.fbcdn.net/v/t1.0-9/fr/cp0/e15/q65/71639081_2558934457504869_4955626874937016320_o.jpg?_nc_cat=106&_nc_sid=8024bb&_nc_ohc=C9HxdE1hk-UAX-J4njM&_nc_ht=scontent-atl3-1.xx&tp=14&oh=fb6c33b5093dbac75e9422eb04f99527&oe=5F84F0FC,16.0,,2558934574171524,More fun at spirit wall ways.,https://facebook.com/story.php?story_fbid=2558934574171524&id=1304138352984492,,0.0,More fun at spirit wall ways.,2019-10-03 18:43:48,,
100,0.0,https://scontent-atl3-1.xx.fbcdn.net/v/t1.0-9/fr/cp0/e15/q65/71914311_2558932807505034_1469564300602376192_o.jpg?_nc_cat=104&_nc_sid=8024bb&_nc_ohc=OEKqeQMwa0YAX93ovnq&_nc_ht=scontent-atl3-1.xx&tp=14&oh=427e7d1fad81ef8cb3922e00c73ffbc8&oe=5F856763,26.0,,2558932900838358,Homecoming is in full effect at GHS! Spirit wall ways.,https://facebook.com/story.php?story_fbid=2558932900838358&id=1304138352984492,,0.0,Homecoming is in full effect at GHS! Spirit wall ways.,2019-10-03 18:42:29,,
101,0.0,,0.0,https://conta.cc/2mf3BPS,2552044954860486,"GHS Update 9/29/19
https://conta.cc/2mf3BPS",https://facebook.com/story.php?story_fbid=2552044954860486&id=1304138352984492,"MYEMAIL.CONSTANTCONTACT.COM
Gilford High School Update 9/29/19",0.0,"GHS Update 9/29/19
https://conta.cc/2mf3BPS

MYEMAIL.CONSTANTCONTACT.COM
Gilford High School Update 9/29/19",2019-09-30 07:54:24,,
102,0.0,https://scontent-atl3-1.xx.fbcdn.net/v/t1.0-9/fr/cp0/e15/q65/70960491_2542947899103525_2986931406820605952_o.jpg?_nc_cat=102&_nc_sid=8024bb&_nc_ohc=ALypIIaxNJUAX8ITCYa&_nc_ht=scontent-atl3-1.xx&tp=14&oh=dde696727a5aed41566096b44f897fdf&oe=5F859FBD,7.0,,2542947989103516,A special thank you luncheon for our first responders on @graniteuwnh Day! Nice job Mrs. Lalibertes class!,https://facebook.com/story.php?story_fbid=2542947989103516&id=1304138352984492,,0.0,A special thank you luncheon for our first responders on @graniteuwnh Day! Nice job Mrs. Lalibertes class!,2019-09-25 16:59:37,,
103,1.0,https://scontent-atl3-1.xx.fbcdn.net/v/t1.0-9/fr/cp0/e15/q65/71866831_2540657249332590_2184146004234731520_o.jpg?_nc_cat=107&_nc_sid=8024bb&_nc_ohc=GHNiQhia28sAX-aQ3BP&_nc_ht=scontent-atl3-1.xx&tp=14&oh=d32c03f4404f43fa8276d969e4dd8baf&oe=5F81D603,28.0,,2540657352665913,Students from all classes were connected through STEM today. 150 students attended Laconia airport to learn about the WWII plane history.,https://facebook.com/story.php?story_fbid=2540657352665913&id=1304138352984492,,0.0,Students from all classes were connected through STEM today. 150 students attended Laconia airport to learn about the WWII plane history.,2019-09-24 13:27:26,,
104,1.0,,15.0,,2540635342668114,"New Science teacher, Mr. Pegg, leading a discussion on ecology about bears and the impact they have on this community.",,,0.0,"New Science teacher, Mr. Pegg, leading a discussion on ecology about bears and the impact they have on this community.",2019-09-24 13:13:04,,
105,0.0,,9.0,,2511536952244620,"Please support our learners on Tuesday, September 10th.",,,0.0,"Please support our learners on Tuesday, September 10th.",2019-09-09 11:02:57,,
106,1.0,https://scontent-atl3-1.xx.fbcdn.net/v/t1.0-9/fr/cp0/e15/q65/69544737_2505583299506652_121922941733568512_o.jpg?_nc_cat=109&_nc_sid=da1649&_nc_ohc=99u6DESW1IcAX_iARap&_nc_ht=scontent-atl3-1.xx&tp=14&oh=c798a8551b4a8b2fec45cb11f38cdda7&oe=5F836086,14.0,,2505583296173319,"Welcome to our visiting writer, Earl S. Braggs. He teaches creative writing, poetry and African Literature. He is the author of 12 collections of poetry. Thanks for working with our learners today!",,,0.0,"Welcome to our visiting writer, Earl S. Braggs. He teaches creative writing, poetry and African Literature. He is the author of 12 collections of poetry. Thanks for working with our learners today!",2019-09-06 08:24:54,,
107,0.0,https://scontent-atl3-1.xx.fbcdn.net/v/t1.0-9/fr/cp0/e15/q65/69540310_2504687729596209_8712967194369064960_o.jpg?_nc_cat=101&_nc_sid=8024bb&_nc_ohc=Gkn53d3oeT0AX9r-RgO&_nc_ht=scontent-atl3-1.xx&tp=14&oh=b652a9d5339d182f7cda506f98861059&oe=5F821DE9,22.0,,2504687809596201,Youre going to love it here!,https://facebook.com/story.php?story_fbid=2504687809596201&id=1304138352984492,,0.0,Youre going to love it here!,2019-09-05 19:47:50,,
108,1.0,,10.0,,391240384922835,Welcome to Gilford!!,,,2.0,Welcome to Gilford!!,2019-09-05 19:47:14,https://video-atl3-1.xx.fbcdn.net/v/t42.9040-2/70622472_867267793657013_6443053008220585984_n.mp4?_nc_cat=103&_nc_sid=985c63&efg=eyJ2ZW5jb2RlX3RhZyI6InN2ZV9zZCJ9&_nc_ohc=WB3ZmNeqaP0AX_aj5DQ&_nc_ht=video-atl3-1.xx&oh=3b4186dd0aedbee27068afec489711d5&oe=5F5E481E,
109,0.0,,12.0,,2146300309006427,Here they are!!,,,0.0,Here they are!!,2019-09-05 19:45:38,https://video-atl3-1.xx.fbcdn.net/v/t42.9040-2/70730640_2465817516831032_2879192732021030912_n.mp4?_nc_cat=108&_nc_sid=985c63&efg=eyJ2ZW5jb2RlX3RhZyI6InN2ZV9zZCJ9&_nc_ohc=NWu8ygDMB6wAX8wRRIl&_nc_ht=video-atl3-1.xx&oh=7fd384a5aa7c741ecfe1e59c601530d7&oe=5F5E4498,
110,0.0,https://scontent-atl3-1.xx.fbcdn.net/v/t1.0-9/fr/cp0/e15/q65/69517732_2504683746263274_5863879198090723328_o.jpg?_nc_cat=106&_nc_sid=8024bb&_nc_ohc=thyrWzvZA1kAX9HvbSJ&_nc_ht=scontent-atl3-1.xx&tp=14&oh=edc79a2e192054f9d4ff582b2b0b22c5&oe=5F833422,43.0,,2504683819596600,Our Spanish exchange students just arrived!! Welcome to America!!!,https://facebook.com/story.php?story_fbid=2504683819596600&id=1304138352984492,,0.0,Our Spanish exchange students just arrived!! Welcome to America!!!,2019-09-05 19:44:02,,
111,0.0,https://scontent-atl3-1.xx.fbcdn.net/v/t1.0-9/fr/cp0/e15/q65/69563515_2500279880036994_4890573595169783808_o.jpg?_nc_cat=100&_nc_sid=8024bb&_nc_ohc=xw48J1Mm630AX-M4cSQ&_nc_ht=scontent-atl3-1.xx&tp=14&oh=b296a550e2ace2617351893a2f957874&oe=5F836D6B,8.0,,2500279933370322,More pictures from @SenatorHassan visit.,https://facebook.com/story.php?story_fbid=2500279933370322&id=1304138352984492,,0.0,More pictures from @SenatorHassan visit.,2019-09-03 11:08:46,,
112,1.0,https://scontent-atl3-1.xx.fbcdn.net/v/t1.0-9/fr/cp0/e15/q65/70321437_2500276160037366_5460722059808079872_o.jpg?_nc_cat=109&_nc_sid=8024bb&_nc_ohc=VBBPk6QNNTMAX-FpLKl&_nc_oc=AQk6JctRU8EWM7URrC2nc4YVjmj8P5ftUK0cjvG77_rcQ5l1-_1_pwcgd9iCEfULvrY&_nc_ht=scontent-atl3-1.xx&tp=14&oh=2be988928746d231b6cec88c443095e7&oe=5F821867,44.0,http://ow.ly/iQKJ30pt5PY,2500276240037358,Thanks to @SenatorHassan for recognizing our Engineering Class for building vehicles specifically designed for three students @GilfordES Granite stater of the Month! http://ow.ly/iQKJ30pt5PY,https://facebook.com/story.php?story_fbid=2500276240037358&id=1304138352984492,,0.0,Thanks to @SenatorHassan for recognizing our Engineering Class for building vehicles specifically designed for three students @GilfordES Granite stater of the Month! http://ow.ly/iQKJ30pt5PY,2019-09-03 11:06:25,,
113,0.0,https://scontent-atl3-1.xx.fbcdn.net/v/t1.0-9/fr/cp0/e15/q65/69747395_2499175106814138_4919715884576014336_n.jpg?_nc_cat=102&_nc_sid=2d5d41&_nc_ohc=fNOIH3ktTaUAX_f1RIu&_nc_ht=scontent-atl3-1.xx&tp=14&oh=955d52711a8282d404dcfb192bd9c3c7&oe=5F84E706,42.0,,2499175103480805,We're looking forward to seeing you tomorrow! Do great things! Welcome back!,,,0.0,We're looking forward to seeing you tomorrow! Do great things! Welcome back!,2019-09-02 20:25:08,,
114,0.0,https://scontent-atl3-1.xx.fbcdn.net/v/t1.0-9/fr/cp0/e15/q65/69355277_2489268791138103_8529239333943640064_o.jpg?_nc_cat=111&_nc_sid=da1649&_nc_ohc=ZHR22sN4RyYAX8nAlpe&_nc_ht=scontent-atl3-1.xx&tp=14&oh=ebc81b881a716ab8081eb0fe1a5bb99c&oe=5F851EB9,18.0,https://www.jesselewischooselove.org/,2489268784471437,"Choose Love program being implemented throughout GSD with staff today. Thanks @DesiletsShannon @ScarlettMLewis Courage, Gratitude, Foregiveness, Compassion= Choose Love https://www.jesselewischooselove.org/",,,0.0,"Choose Love program being implemented throughout GSD with staff today. Thanks @DesiletsShannon @ScarlettMLewis Courage, Gratitude, Foregiveness, Compassion= Choose Love https://www.jesselewischooselove.org/",2019-08-28 09:24:05,,
115,0.0,,19.0,,2476113919120257,Welcome freshmen to Jump Start today! Making Learning Personal through Positive Connections,https://facebook.com/story.php?story_fbid=2476113919120257&id=1304138352984492,,0.0,Welcome freshmen to Jump Start today! Making Learning Personal through Positive Connections,2019-08-21 09:55:45,,
116,0.0,https://scontent-atl3-1.xx.fbcdn.net/v/t1.0-9/fr/cp0/e15/q65/68575902_2465266450205004_4406578184464629760_o.jpg?_nc_cat=110&_nc_sid=8024bb&_nc_ohc=OwhIxJnUZdkAX9SzG7S&_nc_ht=scontent-atl3-1.xx&tp=14&oh=75def98d7aef509e92aba1d8c55d04b8&oe=5F81B731,35.0,,2465269303538052,The resurfacing of the GHS itrack is making progress!,https://facebook.com/story.php?story_fbid=2465269303538052&id=1304138352984492,,0.0,The resurfacing of the GHS itrack is making progress!,2019-08-15 12:49:22,,
117,0.0,https://scontent-atl3-1.xx.fbcdn.net/v/t1.0-9/fr/cp0/e15/q65/69352637_2465263510205298_8461536918348234752_o.jpg?_nc_cat=103&_nc_sid=8024bb&_nc_ohc=MMLOlRH4MdQAX9LueMF&_nc_ht=scontent-atl3-1.xx&tp=14&oh=6126a49435bf0631dd16abdb6e6a1bc0&oe=5F82ED80,14.0,,2465264553538527,Gilford School District staff members have been busy our three day PERFORMANCE ASSESSMENT INSTITUTE this week!!,https://facebook.com/story.php?story_fbid=2465264553538527&id=1304138352984492,,0.0,Gilford School District staff members have been busy our three day PERFORMANCE ASSESSMENT INSTITUTE this week!!,2019-08-15 12:45:54,,
118,0.0,,0.0,,2463228820408767,Great PD today!,https://facebook.com/story.php?story_fbid=2463228820408767&id=1304138352984492,,0.0,Great PD today!,2019-08-14 10:40:04,,
119,2.0,,23.0,https://www.concordmonitor.com/SiravoBaseball-CMSP-080819-27546796,2452706838127632,https://www.concordmonitor.com/SiravoBaseball-CMSP-080819-27546796,https://facebook.com/story.php?story_fbid=2452706838127632&id=1304138352984492,"CONCORDMONITOR.COM
The real deal: Gilfords Siravo flashing rare skill set to get on MLBs radar",5.0,"https://www.concordmonitor.com/SiravoBaseball-CMSP-080819-27546796

CONCORDMONITOR.COM
The real deal: Gilfords Siravo flashing rare skill set to get on MLBs radar",2019-08-08 13:01:39,,
120,2.0,,12.0,,2360673040664346,,https://facebook.com/story.php?story_fbid=2360673040664346&id=1304138352984492,,0.0,,2019-06-18 09:54:10,,
121,0.0,,8.0,https://twitter.com/barksdale_anna/status/1140317910684131336?s=12,2357446784320305,Anna Barksdale on Twitter https://twitter.com/barksdale_anna/status/1140317910684131336?s=12,https://facebook.com/story.php?story_fbid=2357446784320305&id=1304138352984492,"TWITTER.COM
Anna Barksdale on Twitter",0.0,"Anna Barksdale on Twitter https://twitter.com/barksdale_anna/status/1140317910684131336?s=12

TWITTER.COM
Anna Barksdale on Twitter",2019-06-16 14:02:34,,
122,0.0,https://scontent-atl3-1.xx.fbcdn.net/v/t1.0-9/fr/cp0/e15/q65/64483520_2357330500998600_4769452291902144512_o.jpg?_nc_cat=101&_nc_sid=8024bb&_nc_ohc=R4aORIPumG8AX_GJItA&_nc_ht=scontent-atl3-1.xx&tp=14&oh=a618067b6e641678043b875c5bfb0774&oe=5F8369C6,73.0,,2357330580998592,Congratulations to the Class of 2019!! Good luck!!,https://facebook.com/story.php?story_fbid=2357330580998592&id=1304138352984492,,0.0,Congratulations to the Class of 2019!! Good luck!!,2019-06-16 12:37:46,,
123,0.0,https://scontent-atl3-1.xx.fbcdn.net/v/t1.0-9/fr/cp0/e15/q65/62648686_2354308497967467_8451437079413391360_o.jpg?_nc_cat=109&_nc_sid=8024bb&_nc_ohc=L9twpQZFO1wAX8Su-Rr&_nc_ht=scontent-atl3-1.xx&tp=14&oh=3817d09016bae0ea3b6c55f513e53060&oe=5F8493C6,33.0,,2354308661300784,65 flag cases built and delivered by the Business and Engineering classes to the NH Veterans Home.,https://facebook.com/story.php?story_fbid=2354308661300784&id=1304138352984492,,0.0,65 flag cases built and delivered by the Business and Engineering classes to the NH Veterans Home.,2019-06-14 21:33:20,,
124,0.0,,30.0,,372431220291622,Great kickoff to Senior Awards Night. Congratulations Class of 2019!,,,4.0,Great kickoff to Senior Awards Night. Congratulations Class of 2019!,2019-06-13 18:17:26,https://video-atl3-1.xx.fbcdn.net/v/t42.9040-2/64670795_2722482547766691_509785057230061568_n.mp4?_nc_cat=111&_nc_sid=985c63&efg=eyJ2ZW5jb2RlX3RhZyI6InN2ZV9zZCJ9&_nc_ohc=JboyARoqLaUAX8gyp8_&_nc_ht=video-atl3-1.xx&oh=c5b263de56e5275fd85ec95ac9732a53&oe=5F5E4627,
125,7.0,https://scontent-atl3-1.xx.fbcdn.net/v/t1.0-9/fr/cp0/e15/q65/62445746_2351457391585911_6808863584798375936_o.jpg?_nc_cat=100&_nc_sid=8024bb&_nc_ohc=l13OuCA3WJ4AX9fhalg&_nc_ht=scontent-atl3-1.xx&tp=14&oh=174111077f76bc4d0cad73063ec1ed55&oe=5F81D657,62.0,,2351457551585895,Alex Cheek and Connor Sullivan finished their 3D Design collaborative project @LaconiaMCWeek,https://facebook.com/story.php?story_fbid=2351457551585895&id=1304138352984492,,0.0,Alex Cheek and Connor Sullivan finished their 3D Design collaborative project @LaconiaMCWeek,2019-06-13 09:22:18,,
126,0.0,,52.0,,304736047141769,"The seniors final walk through the halls of GHS, together, as a class. We wish you luck!",,,15.0,"The seniors final walk through the halls of GHS, together, as a class. We wish you luck!",2019-06-10 19:17:29,https://video-atl3-1.xx.fbcdn.net/v/t42.9040-2/64349351_637312436787212_7358775469207977984_n.mp4?_nc_cat=107&_nc_sid=985c63&efg=eyJ2ZW5jb2RlX3RhZyI6InN2ZV9zZCJ9&_nc_ohc=DYxVVX8DNvUAX-52SK5&_nc_ht=video-atl3-1.xx&oh=bc65e60d97833d232c5779165d9a0a7f&oe=5F5E3E92,
127,1.0,https://scontent-atl3-1.xx.fbcdn.net/v/t1.0-9/fr/cp0/e15/q65/62092617_2340873555977628_7487900130499100672_o.jpg?_nc_cat=101&_nc_sid=8024bb&_nc_ohc=3y9m3QcZHnEAX_wp0Dq&_nc_ht=scontent-atl3-1.xx&tp=14&oh=389dfbec50f132617394f0800f8081e5&oe=5F82D4E4,33.0,,2340873655977618,Great job GHS engineers!,https://facebook.com/story.php?story_fbid=2340873655977618&id=1304138352984492,,0.0,Great job GHS engineers!,2019-06-07 14:02:12,,
128,2.0,,14.0,,2213912965329327,GHS Intro to Engineering class presented two GES students with modified Power Wheels vehicles. Troy is explaining the process.,,,4.0,GHS Intro to Engineering class presented two GES students with modified Power Wheels vehicles. Troy is explaining the process.,2019-06-07 14:01:12,https://video-atl3-1.xx.fbcdn.net/v/t42.9040-2/64353164_335648047106847_5024151166884249600_n.mp4?_nc_cat=110&_nc_sid=985c63&efg=eyJ2ZW5jb2RlX3RhZyI6InN2ZV9zZCJ9&_nc_ohc=zkNLB0UM-AwAX-_mbjL&_nc_oc=AQn63HNvFUn7eRMtJTxcEdhInDa1YFzqiU2DfLuACU_QmEflJ4hWMYDwQJgn8jIIqzQ&_nc_ht=video-atl3-1.xx&oh=cf2a4aa3ef49e9c1609f27d6684d5f61&oe=5F5E3B39,
129,1.0,,22.0,,2335617529836564,AP US History presented Gilford 1860s-1900s this evening. Very informative.,https://facebook.com/story.php?story_fbid=2335617529836564&id=1304138352984492,,0.0,AP US History presented Gilford 1860s-1900s this evening. Very informative.,2019-06-04 20:34:51,,
130,0.0,https://scontent-atl3-1.xx.fbcdn.net/v/t1.0-9/61693563_2331045330293784_8640380679403601920_n.png?_nc_cat=107&_nc_sid=da1649&_nc_ohc=N7Z9ZQGvgu8AX9q2JzO&_nc_ht=scontent-atl3-1.xx&oh=57ce64b717872042e48761f0e632d6ea&oe=5F846413,13.0,,2331045323627118,Go Golden Eagles!!,,,0.0,Go Golden Eagles!!,2019-06-02 09:03:48,,
131,1.0,https://scontent-atl3-1.xx.fbcdn.net/v/t1.0-9/fr/cp0/e15/q65/61430766_2326363397428644_5403877914242449408_o.jpg?_nc_cat=104&_nc_sid=8024bb&_nc_ohc=BKF7_FkW_NoAX-NR73C&_nc_ht=scontent-atl3-1.xx&tp=14&oh=2e3cad1ab4924db8660eaf52b97ffac0&oe=5F841305,21.0,,2326363440761973,Congratulations to the GHS students recognized @huottech this evening.,https://facebook.com/story.php?story_fbid=2326363440761973&id=1304138352984492,,0.0,Congratulations to the GHS students recognized @huottech this evening.,2019-05-30 19:40:49,,
132,1.0,https://scontent-atl3-1.xx.fbcdn.net/v/t1.0-9/fr/cp0/e15/q65/61196993_2315327808532203_2187610891791368192_n.jpg?_nc_cat=100&_nc_sid=8024bb&_nc_ohc=9oDa0o-s4VIAX99LSB1&_nc_ht=scontent-atl3-1.xx&tp=14&oh=cfd5506d04cbeebbedb44564c7c95fb5&oe=5F859009,17.0,,2315327948532189,,https://facebook.com/story.php?story_fbid=2315327948532189&id=1304138352984492,,0.0,,2019-05-24 14:24:49,,
133,0.0,https://scontent-atl3-1.xx.fbcdn.net/v/t1.0-9/fr/cp0/e15/q65/60688960_2313363955395255_8426877026190753792_o.jpg?_nc_cat=108&_nc_sid=da1649&_nc_ohc=pFZVgtSlaUQAX_8I1V9&_nc_ht=scontent-atl3-1.xx&tp=14&oh=169f45bee3504ef48ccb133ea3e02713&oe=5F834745,41.0,,2313363945395256,Congratulations to GHS New Hampshire Scholars!!,,,0.0,Congratulations to GHS New Hampshire Scholars!!,2019-05-23 12:40:44,,
134,0.0,https://scontent-atl3-1.xx.fbcdn.net/v/t1.0-9/61139200_2308237095907941_965217582502117376_n.png?_nc_cat=102&_nc_sid=8024bb&_nc_ohc=Yafkkjoc-QQAX94u6Eh&_nc_ht=scontent-atl3-1.xx&oh=aedb49c2bcdf0dd7924724e032b9604c&oe=5F82CF1D,4.0,,2308237282574589,,https://facebook.com/story.php?story_fbid=2308237282574589&id=1304138352984492,,0.0,,2019-05-20 13:19:00,,
135,2.0,https://scontent-atl3-1.xx.fbcdn.net/v/t1.0-9/fr/cp0/e15/q65/61122130_2307925855939065_8948603681641594880_n.jpg?_nc_cat=108&_nc_sid=8024bb&_nc_ohc=VNIhFMaJG8MAX-g56CK&_nc_ht=scontent-atl3-1.xx&tp=14&oh=fbcbdef1eba3d2051b316d01f8730f0c&oe=5F828AEB,19.0,,2307926185939032,Grade 6 Economy Project Sale,https://facebook.com/story.php?story_fbid=2307926185939032&id=1304138352984492,,0.0,Grade 6 Economy Project Sale,2019-05-20 09:40:20,,
136,0.0,https://scontent-atl3-1.xx.fbcdn.net/v/t1.0-9/fr/cp0/e15/q65/60422877_2303387746392876_3918786744224317440_o.jpg?_nc_cat=110&_nc_sid=8024bb&_nc_ohc=4lz1zQtdDkwAX-Wu2W_&_nc_ht=scontent-atl3-1.xx&tp=14&oh=2592aae7ca4d90a009fbe4c1caa2772b&oe=5F84DAC5,24.0,,2303387846392866,Gilfords Prom March. Have fun everyone and be safe!,https://facebook.com/story.php?story_fbid=2303387846392866&id=1304138352984492,,0.0,Gilfords Prom March. Have fun everyone and be safe!,2019-05-17 18:08:48,,
137,0.0,https://scontent-atl3-1.xx.fbcdn.net/v/t1.0-9/fr/cp0/e15/q65/60393952_2303249249740059_3965207218910920704_o.jpg?_nc_cat=105&_nc_sid=8024bb&_nc_ohc=Q8_URIeepgkAX8LI3Hu&_nc_ht=scontent-atl3-1.xx&tp=14&oh=34461e48944a8ec1a28f09169e34a17a&oe=5F83A894,3.0,,2303249329740051,"Nick Pugh, freelance artist and designer, gave a presentation to art students, today, on futuristic cars for movies and architectural projects. He designed and created a limo that was used in Logan.",https://facebook.com/story.php?story_fbid=2303249329740051&id=1304138352984492,,0.0,"Nick Pugh, freelance artist and designer, gave a presentation to art students, today, on futuristic cars for movies and architectural projects. He designed and created a limo that was used in Logan.",2019-05-17 16:05:34,,
138,3.0,https://scontent-atl3-1.xx.fbcdn.net/v/t1.0-9/60472825_2302910683107249_8277878052277452800_n.png?_nc_cat=105&_nc_sid=8024bb&_nc_ohc=n3t9kzaLANwAX-RHpkB&_nc_ht=scontent-atl3-1.xx&oh=753ec6111fba9902fb4eb59ab77176c9&oe=5F83CCCC,47.0,,2302912413107076,"Tanger Outlets Tilton is excited to announce that Gilford Elementary is one of four schools in the greater Lakes Region have been named this years recipients of a TangerKIDS Grant. In keeping with Tanger Outlets mission of being a good corporation citizen, the TangerKIDS Grant Program supports and serves the future generation by providing funding for schools located near Tangers centers. This money will be used next year.",https://facebook.com/story.php?story_fbid=2302912413107076&id=1304138352984492,,0.0,"Tanger Outlets Tilton is excited to announce that Gilford Elementary is one of four schools in the greater Lakes Region have been named this years recipients of a TangerKIDS Grant. In keeping with Tanger Outlets mission of being a good corporation citizen, the TangerKIDS Grant Program supports and serves the future generation by providing funding for schools located near Tangers centers. This money will be used next year.",2019-05-17 11:55:07,,
139,1.0,https://scontent-atl3-1.xx.fbcdn.net/v/t1.0-9/fr/cp0/e15/q65/60341796_2302624536469197_6263504408672206848_o.jpg?_nc_cat=102&_nc_sid=da1649&_nc_ohc=P9TqSzYB07kAX-H2IuH&_nc_ht=scontent-atl3-1.xx&tp=14&oh=91485c6daadd219b5f5134a262118d29&oe=5F82A30D,36.0,,2302624533135864,Thanks to Monica Sawyer for all her work leading the Rotary Interact Club.,,,0.0,Thanks to Monica Sawyer for all her work leading the Rotary Interact Club.,2019-05-17 08:50:30,,
140,0.0,https://scontent-atl3-1.xx.fbcdn.net/v/t1.0-9/fr/cp0/e15/q65/60355219_2302490296482621_5000810682510213120_o.jpg?_nc_cat=103&_nc_sid=8024bb&_nc_ohc=pAppjD0pqtIAX_o62cU&_nc_ht=scontent-atl3-1.xx&tp=14&oh=2130ffb194b9eb2e3cc374db70e613e8&oe=5F834931,4.0,,2302490359815948,Ashley and Max presenting their Rotary Four Way speeches at Gilford Rotary.,https://facebook.com/story.php?story_fbid=2302490359815948&id=1304138352984492,,0.0,Ashley and Max presenting their Rotary Four Way speeches at Gilford Rotary.,2019-05-17 07:14:06,,
141,2.0,https://scontent-atl3-1.xx.fbcdn.net/v/t1.0-9/fr/cp0/e15/q65/60165514_2297606126971038_6851842785658535936_o.jpg?_nc_cat=104&_nc_sid=8024bb&_nc_ohc=BXsSJRBD-oAAX_GoB8U&_nc_ht=scontent-atl3-1.xx&tp=14&oh=d37298c53e644f46ec6fae5df31f642f&oe=5F831C5A,25.0,,2297607370304247,MdDonald's recognition for Gilford Elementary School being a 2018 School of the Year last week.,https://facebook.com/story.php?story_fbid=2297607370304247&id=1304138352984492,,0.0,MdDonald's recognition for Gilford Elementary School being a 2018 School of the Year last week.,2019-05-14 11:10:08,,
142,0.0,https://scontent-atl3-1.xx.fbcdn.net/v/t1.0-9/60631777_2295874900477494_1814974169071222784_n.png?_nc_cat=104&_nc_sid=8024bb&_nc_ohc=TU_Ip1R_tB0AX8oEAQ6&_nc_oc=AQnRGm4LoxWX9ltDi41vZ7GIEQ_805BKOzDGbKskvZO5bUkXumXOYJJuBRhH8XzJ9VY&_nc_ht=scontent-atl3-1.xx&oh=42749c59d3a47ca2fb593aca30b055b9&oe=5F8369A9,2.0,,2295874917144159,,https://facebook.com/story.php?story_fbid=2295874917144159&id=1304138352984492,,0.0,,2019-05-13 10:53:59,,
143,1.0,,14.0,http://www.newhampshirelakesandmountains.com/Articles-Gilford-Steamer-c-2019-05-09-164438.113119-GMS-students-headed-to-NYC-theatre-camp.html#123,2295743383823979,,https://facebook.com/story.php?story_fbid=2295743383823979&id=1304138352984492,"NEWHAMPSHIRELAKESANDMOUNTAINS.COM
GMS students headed to NYC theatre camp",0.0,"NEWHAMPSHIRELAKESANDMOUNTAINS.COM
GMS students headed to NYC theatre camp",2019-05-13 09:28:08,,
144,0.0,https://scontent-atl3-1.xx.fbcdn.net/v/t1.0-9/fr/cp0/e15/q65/60061037_2295738440491140_7238766437915951104_o.jpg?_nc_cat=104&_nc_sid=8024bb&_nc_ohc=QIq7ujrC9OAAX8YZZ3h&_nc_ht=scontent-atl3-1.xx&tp=14&oh=794c383e15d4ac2b39a28560b92d0d45&oe=5F839504,13.0,,2295738590491125,"GMS 8th graders were among hundreds of other 8th grade students from the Region at NHTI at the New Hampshire Credit Union's ""CU 4 Reality Financial Literacy Fair"" last Friday. Students learned about personal finance, choosing a career, budgeting, and more.",https://facebook.com/story.php?story_fbid=2295738590491125&id=1304138352984492,,0.0,"GMS 8th graders were among hundreds of other 8th grade students from the Region at NHTI at the New Hampshire Credit Union's ""CU 4 Reality Financial Literacy Fair"" last Friday. Students learned about personal finance, choosing a career, budgeting, and more.",2019-05-13 09:24:45,,
145,0.0,,23.0,,2290493987682252,Business Management II preparing the Annual Steve-O Subs for todays delivery. Thanks to the community for your support.,,,0.0,Business Management II preparing the Annual Steve-O Subs for todays delivery. Thanks to the community for your support.,2019-05-10 08:34:11,,
146,0.0,https://scontent-atl3-1.xx.fbcdn.net/v/t1.0-9/fr/cp0/e15/q65/60116165_2289551451109839_5472613948077375488_o.jpg?_nc_cat=109&_nc_sid=da1649&_nc_ohc=Gn1CY8sTgYsAX9l-RR4&_nc_ht=scontent-atl3-1.xx&tp=14&oh=b25fd354382bf5a0ed48c89f8ee07e33&oe=5F81E438,26.0,,2289551447776506,Good luck to all performers at the Monster Band concert tonight!,,,0.0,Good luck to all performers at the Monster Band concert tonight!,2019-05-09 19:01:44,,
147,0.0,https://scontent-atl3-1.xx.fbcdn.net/v/t1.0-9/fr/cp0/e15/q65/59644604_2285930421471942_2338795394172977152_o.jpg?_nc_cat=108&_nc_sid=da1649&_nc_ohc=KH6u9ukYMCYAX_ma1YT&_nc_ht=scontent-atl3-1.xx&tp=14&oh=f36579e9d5800a7a3f3ea02c50b3131d&oe=5F82A1ED,14.0,,2285930411471943,Good luck to all students taking AP exams this week and next. Relaxing before the exam.,,,0.0,Good luck to all students taking AP exams this week and next. Relaxing before the exam.,2019-05-07 18:00:38,,
148,0.0,https://scontent-atl3-1.xx.fbcdn.net/v/t1.0-9/fr/cp0/e15/q65/59781856_2285553201509664_7777486101408645120_o.jpg?_nc_cat=103&_nc_sid=8024bb&_nc_ohc=OTUNQ77iaQMAX-nSlbc&_nc_ht=scontent-atl3-1.xx&tp=14&oh=77fa4182bda1720cfdde8cb4730ff464&oe=5F84877C,39.0,,2285554541509530,Pictures from the Class of 2019's Senior Trip,https://facebook.com/story.php?story_fbid=2285554541509530&id=1304138352984492,,0.0,Pictures from the Class of 2019's Senior Trip,2019-05-07 12:38:06,,
149,0.0,,12.0,,2283742471690737,May 6-10 is Teacher Appreciation Week! Thank you to all of the educators for all that you do!,https://facebook.com/story.php?story_fbid=2283742471690737&id=1304138352984492,,0.0,May 6-10 is Teacher Appreciation Week! Thank you to all of the educators for all that you do!,2019-05-06 09:48:34,,
150,0.0,https://scontent-atl3-1.xx.fbcdn.net/v/t1.0-9/59456686_2283735868358064_5570373790350704640_n.png?_nc_cat=111&_nc_sid=8024bb&_nc_ohc=FErG5ABo_4YAX-\-\8Fal&_nc_ht=scontent-atl3-1.xx&oh=135ca8ecd54ca91a0b42875300512bdd&oe=5F8392B7,3.0,,2283735895024728,,https://facebook.com/story.php?story_fbid=2283735895024728&id=1304138352984492,,0.0,,2019-05-06 09:43:39,,
151,0.0,https://scontent-atl3-1.xx.fbcdn.net/v/t1.0-9/59689288_2283734435024874_493166870984130560_n.png?_nc_cat=104&_nc_sid=8024bb&_nc_ohc=kWOrDVR_wxAAX-Xh5xE&_nc_ht=scontent-atl3-1.xx&oh=6d574683d3c828c9fd0b3878d9f45853&oe=5F828C79,7.0,,2283734488358202,,https://facebook.com/story.php?story_fbid=2283734488358202&id=1304138352984492,,0.0,,2019-05-06 09:42:39,,
152,0.0,https://scontent-atl3-1.xx.fbcdn.net/v/t1.0-9/59395121_2283724411692543_5138513716341374976_n.png?_nc_cat=107&_nc_sid=8024bb&_nc_ohc=lDzGEHasY-kAX8CLYuj&_nc_ht=scontent-atl3-1.xx&oh=73894cc3badb77c077edfb1b798541e5&oe=5F827969,5.0,,2283718145026503,,https://facebook.com/story.php?story_fbid=2283718145026503&id=1304138352984492,,0.0,,2019-05-06 09:29:49,,
153,0.0,https://scontent-atl3-1.xx.fbcdn.net/v/t1.0-9/fr/cp0/e15/q65/59774572_2283713738360277_3621916912507682816_n.jpg?_nc_cat=109&_nc_sid=8024bb&_nc_ohc=7wOEhM80YegAX8lmOPC&_nc_ht=scontent-atl3-1.xx&tp=14&oh=4016fc3a89e5678ffd083855be240fe7&oe=5F84B334,7.0,,2283713768360274,,https://facebook.com/story.php?story_fbid=2283713768360274&id=1304138352984492,,0.0,,2019-05-06 09:26:27,,
154,0.0,https://scontent-atl3-1.xx.fbcdn.net/v/t1.0-9/fr/cp0/e15/q65/59937676_2283712598360391_6122928574295965696_n.jpg?_nc_cat=104&_nc_sid=8024bb&_nc_ohc=kJRLn7WOCDAAX8_lfA1&_nc_ht=scontent-atl3-1.xx&tp=14&oh=8b9a48efefafc547b842f78cd41168cd&oe=5F82C87C,5.0,,2283712631693721,,https://facebook.com/story.php?story_fbid=2283712631693721&id=1304138352984492,,0.0,,2019-05-06 09:25:36,,
155,0.0,https://scontent-atl3-1.xx.fbcdn.net/v/t1.0-9/fr/cp0/e15/q65/59818099_2283711198360531_3205508417137410048_n.jpg?_nc_cat=106&_nc_sid=8024bb&_nc_ohc=Ezkq6V08djwAX9MZHGC&_nc_ht=scontent-atl3-1.xx&tp=14&oh=fca3ee60314693c225afede1ca49c70c&oe=5F834767,3.0,,2283711278360523,,https://facebook.com/story.php?story_fbid=2283711278360523&id=1304138352984492,,0.0,,2019-05-06 09:24:31,,
156,0.0,https://scontent-atl3-1.xx.fbcdn.net/v/t1.0-9/fr/cp0/e15/q65/59383223_2279426538788997_8607913033043279872_o.jpg?_nc_cat=108&_nc_sid=8024bb&_nc_ohc=EexEjOxLhnYAX_qYJuN&_nc_ht=scontent-atl3-1.xx&tp=14&oh=7f52e4754f7a9570bfcf12542d2fabc5&oe=5F848B7F,13.0,,2279426608788990,"Senior Class Trip weekend in Caratunk, ME.",https://facebook.com/story.php?story_fbid=2279426608788990&id=1304138352984492,,0.0,"Senior Class Trip weekend in Caratunk, ME.",2019-05-03 20:43:13,,
157,1.0,,19.0,,2274717069259944,"Gilford High School Class of 2019 will graduate on Sunday, June 16, 2019 at 10:00am at the Bank of New Hampshire Pavilion.",https://facebook.com/story.php?story_fbid=2274717069259944&id=1304138352984492,,0.0,"Gilford High School Class of 2019 will graduate on Sunday, June 16, 2019 at 10:00am at the Bank of New Hampshire Pavilion.",2019-04-30 20:09:14,,
158,0.0,https://scontent-atl3-1.xx.fbcdn.net/v/t1.0-9/fr/cp0/e15/q65/56935221_2249994415065543_110229145945899008_o.jpg?_nc_cat=110&_nc_sid=8024bb&_nc_ohc=PVd4H0vBrMcAX8A9-RW&_nc_ht=scontent-atl3-1.xx&tp=14&oh=c38319edcf92f50d66838fcd2108c8df&oe=5F831D0A,22.0,,2249995361732115,"Gilford finally has ""Five Guys""...not burgers but musicians! For the second year in a row, the same 5 male vocalists had the honor of representing GHS at the annual New England Music Festival, held at The Woodstock Academy in Woodstock, CT March 21-23. These five young men, along with 230 other stellar musicians from around NE, spent 2 1/2 days rehearsing their program with nationally known conductors, ending the weekend with incredible performances.

To earn this honor, students have to perform a prepared piece in a Solo & Ensemble Festival in December, earning scores that, if high enough, get them selected for the Concert Festival. Representing Gilford were senior Ryan Witham (4th year), junior Charles Purcell (3rd year) and sophomores Blake Bolduc, Jonathan Buttrick and Chandler Green (all 2nd year).

Congratulations!",https://facebook.com/story.php?story_fbid=2249995361732115&id=1304138352984492,,0.0,"Gilford finally has ""Five Guys""...not burgers but musicians! For the second year in a row, the same 5 male vocalists had the honor of representing GHS at the annual New England Music Festival, held at The Woodstock Academy in Woodstock, CT March 21-23. These five young men, along with 230 other stellar musicians from around NE, spent 2 1/2 days rehearsing their program with nationally known conductors, ending the weekend with incredible performances.

To earn this honor, students have to perform a prepared piece in a Solo & Ensemble Festival in December, earning scores that, if high enough, get them selected for the Concert Festival. Representing Gilford were senior Ryan Witham (4th year), junior Charles Purcell (3rd year) and sophomores Blake Bolduc, Jonathan Buttrick and Chandler Green (all 2nd year).

Congratulations!",2019-04-15 13:16:01,,
159,0.0,https://scontent-atl3-1.xx.fbcdn.net/v/t1.0-9/fr/cp0/e15/q65/56262506_2235912289807089_3537319126361964544_o.jpg?_nc_cat=109&_nc_sid=da1649&_nc_ohc=shBAu5blVvcAX_wC_es&_nc_ht=scontent-atl3-1.xx&tp=14&oh=5856ffe3c27de1cb51aee04e2491bc50&oe=5F84E959,45.0,,2235912283140423,The sugar shack is officially open!,,,0.0,The sugar shack is officially open!,2019-04-06 09:23:28,,
160,2.0,https://scontent-atl3-1.xx.fbcdn.net/v/t1.0-9/fr/cp0/e15/q65/56279970_2235910606473924_8373779788619317248_o.jpg?_nc_cat=101&_nc_sid=8024bb&_nc_ohc=EW6a7FRkmXAAX_2tUGG&_nc_ht=scontent-atl3-1.xx&tp=14&oh=7082fd55fb7c42a2738b15ab5595014e&oe=5F844CF4,54.0,,2235910773140574,Grand opening of Gilford Elementary Schools sweet sugar shack!!,https://facebook.com/story.php?story_fbid=2235910773140574&id=1304138352984492,,0.0,Grand opening of Gilford Elementary Schools sweet sugar shack!!,2019-04-06 09:22:17,,
161,1.0,https://scontent-atl3-1.xx.fbcdn.net/v/t1.0-9/fr/cp0/e15/q65/56472429_2232824743449177_2385377587263176704_o.jpg?_nc_cat=103&_nc_sid=8024bb&_nc_ohc=rFK1mpKLK4kAX9-gdq8&_nc_ht=scontent-atl3-1.xx&tp=14&oh=89c48e49e62e8fb0bc3ba0c7289f57e0&oe=5F81DE89,37.0,,2232824883449163,"Amie Edmunds, a Social Studies Teacher at GHS, is a nominee for the 2020 NH Teacher of the Year. Congratulations, Ms. Edmunds!

Here she is at the awards ceremony with the State Commissioner of Education.",https://facebook.com/story.php?story_fbid=2232824883449163&id=1304138352984492,,0.0,"Amie Edmunds, a Social Studies Teacher at GHS, is a nominee for the 2020 NH Teacher of the Year. Congratulations, Ms. Edmunds!

Here she is at the awards ceremony with the State Commissioner of Education.",2019-04-04 08:58:23,,
162,1.0,,19.0,https://www.laconiadailysun.com/news/local/local-students-in-state-theater-finals/article_332ad10e-564a-11e9-8c72-a7c0072c5c9f.html,2232819313449720,"Gilford High School students are in the State Theater Finals! See this article in The Sun.

https://www.laconiadailysun.com/news/local/local-students-in-state-theater-finals/article_332ad10e-564a-11e9-8c72-a7c0072c5c9f.html",https://facebook.com/story.php?story_fbid=2232819313449720&id=1304138352984492,"LACONIADAILYSUN.COM
Local students in state theater finals",4.0,"Gilford High School students are in the State Theater Finals! See this article in The Sun.

https://www.laconiadailysun.com/news/local/local-students-in-state-theater-finals/article_332ad10e-564a-11e9-8c72-a7c0072c5c9f.html

LACONIADAILYSUN.COM
Local students in state theater finals",2019-04-04 08:53:27,,
163,0.0,,13.0,,2228527213878930,"At GHS, the Pie-A-Teacher auction was held Tuesday and raised over $1900 in under and hour! 35 staff members will get pied in the face the Friday before April break. The money raised is going to ""The Doorway"" at LRGHealthcare to fight the opioid crisis that has impacted many of our community members in some way. Thanks to our students for giving back to help their community.",https://facebook.com/story.php?story_fbid=2228527213878930&id=1304138352984492,,0.0,"At GHS, the Pie-A-Teacher auction was held Tuesday and raised over $1900 in under and hour! 35 staff members will get pied in the face the Friday before April break. The money raised is going to ""The Doorway"" at LRGHealthcare to fight the opioid crisis that has impacted many of our community members in some way. Thanks to our students for giving back to help their community.",2019-04-01 13:34:27,,
164,0.0,https://scontent-atl3-1.xx.fbcdn.net/v/t1.0-9/fr/cp0/e15/q65/55783857_2228505280547790_4338590767724363776_n.jpg?_nc_cat=106&_nc_sid=8024bb&_nc_ohc=TrdyK-hazhoAX_TnWFd&_nc_ht=scontent-atl3-1.xx&tp=14&oh=6433105f81a2cf0bdfe5eb3e58e2007b&oe=5F82DA7D,4.0,,2228505347214450,,https://facebook.com/story.php?story_fbid=2228505347214450&id=1304138352984492,,0.0,,2019-04-01 13:21:22,,
165,0.0,,3.0,,2228504067214578,,https://facebook.com/story.php?story_fbid=2228504067214578&id=1304138352984492,,0.0,,2019-04-01 13:20:21,,
166,1.0,https://scontent-atl3-1.xx.fbcdn.net/v/t1.0-9/fr/cp0/e15/q65/56681255_2228365663895085_1146141963154620416_o.jpg?_nc_cat=106&_nc_sid=2d5d41&_nc_ohc=Qv5ntVzcNo4AX8rdesi&_nc_ht=scontent-atl3-1.xx&tp=14&oh=3eedd5709b42ab791f5fa1d8d3909bfc&oe=5F844ECC,32.0,,2228365657228419,Congratulations to our Senior Scholar Athletes being recognized at the Capitol Center for the Arts by NHIAA,,,0.0,Congratulations to our Senior Scholar Athletes being recognized at the Capitol Center for the Arts by NHIAA,2019-04-01 11:37:40,,
167,0.0,https://scontent-atl3-1.xx.fbcdn.net/v/t1.0-9/fr/cp0/e15/q65/55713687_2228348223896829_7726074174644420608_n.jpg?_nc_cat=110&_nc_sid=8024bb&_nc_ohc=6Mkuw8JBz9QAX87_mq_&_nc_ht=scontent-atl3-1.xx&tp=14&oh=b3195171b606fac87a9a13d25df2a2a1&oe=5F839E3D,14.0,,2228349210563397,"Gilford Elementary School Showcase (March 29, 2019)",https://facebook.com/story.php?story_fbid=2228349210563397&id=1304138352984492,,0.0,"Gilford Elementary School Showcase (March 29, 2019)",2019-04-01 11:25:08,,
168,6.0,https://scontent-atl3-1.xx.fbcdn.net/v/t1.0-9/fr/cp0/e15/q65/55832976_2228282200570098_412738892492439552_n.jpg?_nc_cat=105&_nc_sid=8024bb&_nc_ohc=nmyj6lk288AAX_oxSEJ&_nc_ht=scontent-atl3-1.xx&tp=14&oh=8ec7ef902e694711c996645f963cb4bb&oe=5F82B957,37.0,,2228286830569635,"Dan Caron, a GHS Technology and Engineering teacher at GHS, received a 2019 national Program Excellence Award last weekend. Congratulations!",https://facebook.com/story.php?story_fbid=2228286830569635&id=1304138352984492,,0.0,"Dan Caron, a GHS Technology and Engineering teacher at GHS, received a 2019 national Program Excellence Award last weekend. Congratulations!",2019-04-01 10:30:40,,
169,0.0,https://scontent-atl3-1.xx.fbcdn.net/v/t1.0-9/fr/cp0/e15/q65/55719280_2225586977506287_5696904811086086144_o.jpg?_nc_cat=107&_nc_sid=8024bb&_nc_ohc=rtkt68Cb2L4AX-MeRG_&_nc_ht=scontent-atl3-1.xx&tp=14&oh=b180d79bca6c21793a6234b5a2af706e&oe=5F848916,21.0,,2225587017506283,GHS Screaming Eagle Team1831 awaits their turn to compete at UNH First Robotics event!,https://facebook.com/story.php?story_fbid=2225587017506283&id=1304138352984492,,0.0,GHS Screaming Eagle Team1831 awaits their turn to compete at UNH First Robotics event!,2019-03-30 14:42:51,,
170,1.0,,17.0,,2224069800991338,,https://facebook.com/story.php?story_fbid=2224069800991338&id=1304138352984492,,0.0,,2019-03-29 15:53:53,,
171,2.0,https://scontent-atl3-1.xx.fbcdn.net/v/t1.0-9/fr/cp0/e15/q65/55575954_2224049014326750_3521773926025789440_o.jpg?_nc_cat=100&_nc_sid=8024bb&_nc_ohc=Qpf5NuyGTVQAX9NkrEQ&_nc_ht=scontent-atl3-1.xx&tp=14&oh=2e2c335f3d9b908b847ea63a412de2bc&oe=5F831BDA,51.0,,2224049490993369,"GMS 6th Grade Math Meet Champions! Our grade six mathletes were Ben Wolpin, Clark Blackwelder, Kyle Gandini, Carson McGreevy, Izzy Johnson, Georgia Eckhardt, Anna Coapland, Kendall Myers, and Mallory Daley.",https://facebook.com/story.php?story_fbid=2224049490993369&id=1304138352984492,,0.0,"GMS 6th Grade Math Meet Champions! Our grade six mathletes were Ben Wolpin, Clark Blackwelder, Kyle Gandini, Carson McGreevy, Izzy Johnson, Georgia Eckhardt, Anna Coapland, Kendall Myers, and Mallory Daley.",2019-03-29 15:32:14,,
172,0.0,,3.0,,2221864764545175,"Rotary District Governor, Venu Rao, speaking with our Interact Club members this morning about service projects. Rotary International",,,0.0,"Rotary District Governor, Venu Rao, speaking with our Interact Club members this morning about service projects. Rotary International",2019-03-28 07:23:04,,
173,1.0,,8.0,,2734125136628567,Mr. Wilson drew A LOT of bidders at the Pie-A-Teacher auction!,,,0.0,Mr. Wilson drew A LOT of bidders at the Pie-A-Teacher auction!,2019-03-26 17:24:17,https://video-atl3-1.xx.fbcdn.net/v/t42.9040-2/56167542_526239417902683_5697717771085807616_n.mp4?_nc_cat=106&_nc_sid=985c63&efg=eyJ2ZW5jb2RlX3RhZyI6InN2ZV9zZCJ9&_nc_ohc=RJ-nmaJz0RQAX9QWxvi&_nc_ht=video-atl3-1.xx&oh=d86a1c52f8aab54dcc248aa84a1de965&oe=5F5E437C,
174,1.0,https://scontent-atl3-1.xx.fbcdn.net/v/t1.0-9/fr/cp0/e15/q65/55887814_2219515438113441_8448890305540784128_o.jpg?_nc_cat=109&_nc_sid=8024bb&_nc_ohc=fsWBT6jZ5l0AX_dBxqw&_nc_ht=scontent-atl3-1.xx&tp=14&oh=9e8acdb1eaa7219dd7c08196632bb370&oe=5F84A58D,28.0,,2219515498113435,The Pie-A-Teacher auction raised over $1700 today to be donated to The Doorway LRGHealthcare to fight the opioid crisis. Great job students and staff!! Teachers getting pied on April 19. Mark your calendars!,https://facebook.com/story.php?story_fbid=2219515498113435&id=1304138352984492,,0.0,The Pie-A-Teacher auction raised over $1700 today to be donated to The Doorway LRGHealthcare to fight the opioid crisis. Great job students and staff!! Teachers getting pied on April 19. Mark your calendars!,2019-03-26 17:18:47,,
175,0.0,,5.0,,2217705461627772,,https://facebook.com/story.php?story_fbid=2217705461627772&id=1304138352984492,,0.0,,2019-03-25 12:52:36,,
176,3.0,,49.0,,2213222332076085,Fresh maple syrup made at GES bottled and ready to share. All of our learners had a taste!,https://facebook.com/story.php?story_fbid=2213222332076085&id=1304138352984492,,0.0,Fresh maple syrup made at GES bottled and ready to share. All of our learners had a taste!,2019-03-22 13:37:44,,
177,0.0,,24.0,http://wmur.com/article/sonh-training-run-with-jamie-staton/26901784?src=app,2212904448774540,GHS was visited by Jamie Staton on Thursday for a Special Olympics NH fun run. http://wmur.com/article/sonh-training-run-with-jamie-staton/26901784?src=app,https://facebook.com/story.php?story_fbid=2212904448774540&id=1304138352984492,"WMUR.COM
SONH Training run with Jamie Staton",0.0,"GHS was visited by Jamie Staton on Thursday for a Special Olympics NH fun run. http://wmur.com/article/sonh-training-run-with-jamie-staton/26901784?src=app

WMUR.COM
SONH Training run with Jamie Staton",2019-03-22 09:22:41,,
178,0.0,,15.0,,2212818062116512,"Pie A Teacher auction happening on Tuesday, March 26. Students can donate a dollar to pie their teacher with all funds going to The Doorway LRGHealthcare Many people have been affected by this crisis and this is our way to give back. #wearegilford WMUR TV",,,0.0,"Pie A Teacher auction happening on Tuesday, March 26. Students can donate a dollar to pie their teacher with all funds going to The Doorway LRGHealthcare Many people have been affected by this crisis and this is our way to give back. #wearegilford WMUR TV",2019-03-22 08:06:39,,
179,0.0,https://scontent-atl3-1.xx.fbcdn.net/v/t1.0-9/fr/cp0/e15/q65/55533238_2210153749049610_3163794767045722112_o.jpg?_nc_cat=102&_nc_sid=8024bb&_nc_ohc=6UDVWvN8-c8AX-SmfXM&_nc_ht=scontent-atl3-1.xx&tp=14&oh=2e4b30d96ff61a73fb863cb11b01a0a8&oe=5F84DE4D,9.0,,2210153825716269,International Day of Happiness #happyacts,https://facebook.com/story.php?story_fbid=2210153825716269&id=1304138352984492,,0.0,International Day of Happiness #happyacts,2019-03-20 11:30:31,,
180,0.0,https://scontent-atl3-1.xx.fbcdn.net/v/t1.0-9/fr/cp0/e15/q65/54522716_2210139242384394_6107654214597476352_n.jpg?_nc_cat=107&_nc_sid=8024bb&_nc_ohc=d2fzv4Jk5cwAX8myi7e&_nc_ht=scontent-atl3-1.xx&tp=14&oh=5313742173a6685827020a24c4a8078e&oe=5F84DD45,12.0,https://www.laconiadailysun.com/news/gilford-students-keep-maple-tradition-running/article_471eab8e-4733-11e9-a27b-c7d594db76f0.html,2210141692384149,https://www.laconiadailysun.com/news/gilford-students-keep-maple-tradition-running/article_471eab8e-4733-11e9-a27b-c7d594db76f0.html,https://facebook.com/story.php?story_fbid=2210141692384149&id=1304138352984492,,0.0,https://www.laconiadailysun.com/news/gilford-students-keep-maple-tradition-running/article_471eab8e-4733-11e9-a27b-c7d594db76f0.html,2019-03-20 11:18:29,,
181,0.0,https://scontent-atl3-1.xx.fbcdn.net/v/t1.0-9/fr/cp0/e15/q65/54526025_2208672205864431_8043722486908452864_o.jpg?_nc_cat=110&_nc_sid=8024bb&_nc_ohc=flyhK5TUyAUAX8DYjFX&_nc_ht=scontent-atl3-1.xx&tp=14&oh=8396dd40ccb934f287cf788187657ded&oe=5F836765,24.0,,2208672925864359,Some of Ms. Allen's GMS Grade 8 Site Plan projects.,https://facebook.com/story.php?story_fbid=2208672925864359&id=1304138352984492,,0.0,Some of Ms. Allen's GMS Grade 8 Site Plan projects.,2019-03-19 10:56:50,,
182,2.0,https://scontent-atl3-1.xx.fbcdn.net/v/t1.0-9/fr/cp0/e15/q65/53810875_2201823606549291_138081935846014976_o.jpg?_nc_cat=103&_nc_sid=2d5d41&_nc_ohc=4d8fCpzFfAcAX8tO90x&_nc_ht=scontent-atl3-1.xx&tp=14&oh=99bc969b42b75af44e4beacfa3016475&oe=5F833B1E,13.0,,2201823593215959,"Opening night for The Seussification of a Midsummer Nights Dream. Join us tonight, Friday, or Saturday at 7:00pm in the GHS auditorium. Enjoy the show!!",,,0.0,"Opening night for The Seussification of a Midsummer Nights Dream. Join us tonight, Friday, or Saturday at 7:00pm in the GHS auditorium. Enjoy the show!!",2019-03-14 19:08:05,,
183,0.0,https://scontent-atl3-1.xx.fbcdn.net/v/t1.0-9/fr/cp0/e15/q65/54268136_2201669003231418_5134563695048785920_o.jpg?_nc_cat=106&_nc_sid=2d5d41&_nc_ohc=uWTDYcZ4T0gAX9spGay&_nc_ht=scontent-atl3-1.xx&tp=14&oh=9b949f1ba2d0e7342332331f4cd89e12&oe=5F856D2E,10.0,,2201668996564752,GHS students at the UNH HYPE conference. What should the role of media be in society is the question theyre answering. SHS Ethics Forum,,,0.0,GHS students at the UNH HYPE conference. What should the role of media be in society is the question theyre answering. SHS Ethics Forum,2019-03-14 16:39:52,,
184,13.0,https://scontent-atl3-1.xx.fbcdn.net/v/t1.0-9/fr/cp0/e15/q65/53013967_2201035893294729_5084847760675438592_n.jpg?_nc_cat=100&_nc_sid=8024bb&_nc_ohc=chLjcQURoH4AX8KZxr_&_nc_ht=scontent-atl3-1.xx&tp=14&oh=742a2e85bfc9d2bfb22d8506867e02f4&oe=5F83AA00,54.0,,2201036113294707,Gigi Johnson names 2019's Champion for Children last week. Here she is with Superintendent Kirk Beitler.,https://facebook.com/story.php?story_fbid=2201036113294707&id=1304138352984492,,0.0,Gigi Johnson names 2019's Champion for Children last week. Here she is with Superintendent Kirk Beitler.,2019-03-14 08:30:50,,
185,2.0,https://scontent-atl3-1.xx.fbcdn.net/v/t1.0-9/fr/cp0/e15/q65/54432776_2201033423294976_6791288810551377920_n.jpg?_nc_cat=110&_nc_sid=8024bb&_nc_ohc=s5gbBy0yUFIAX-pluNY&_nc_ht=scontent-atl3-1.xx&tp=14&oh=97cfc97394e8f102a798d0e0f2afa257&oe=5F8433DE,41.0,,2201033643294954,GES learners started collecting sap yesterday.,https://facebook.com/story.php?story_fbid=2201033643294954&id=1304138352984492,,0.0,GES learners started collecting sap yesterday.,2019-03-14 08:28:19,,
186,0.0,,17.0,,2201032653295053,"Michelle Cuevas, author of Confessions of an Imaginary Friend, Skyped in to talk to our 1st graders before February Vacation.",https://facebook.com/story.php?story_fbid=2201032653295053&id=1304138352984492,,0.0,"Michelle Cuevas, author of Confessions of an Imaginary Friend, Skyped in to talk to our 1st graders before February Vacation.",2019-03-14 08:27:28,,
187,4.0,https://scontent-atl3-1.xx.fbcdn.net/v/t1.0-9/fr/cp0/e15/q65/53881530_2201029869961998_1517969290697900032_n.jpg?_nc_cat=108&_nc_sid=8024bb&_nc_ohc=korN9TAwx7QAX90h29J&_nc_ht=scontent-atl3-1.xx&tp=14&oh=01dd63b6f35a5615001bf172197da7a4&oe=5F823A24,59.0,http://linpub.blob.core.windows.net/pdf/1/676f4656-f9c9-4bd7-9120-21268c234335.pdf,2201030726628579,"GHS' Sawyer named School Counselor of the Year. Here is the story in The Gilford Steamer!

http://linpub.blob.core.windows.net/pdf/1/676f4656-f9c9-4bd7-9120-21268c234335.pdf",https://facebook.com/story.php?story_fbid=2201030726628579&id=1304138352984492,,0.0,"GHS' Sawyer named School Counselor of the Year. Here is the story in The Gilford Steamer!

http://linpub.blob.core.windows.net/pdf/1/676f4656-f9c9-4bd7-9120-21268c234335.pdf",2019-03-14 08:25:47,,
188,4.0,,26.0,,2197382823660036,"The GHS Theatre group was awarded a best production last week at the Regional One-Act Theatre Festival. They will be moving on to the next round at Kingswood Regional High School on April 5 and 6.

Chelsea Sasserson and Anna Cook were awarded superior acting awards.

Meredith Ellis was given a superior costume design award.

Kudos to guest-director Grace McLaughlin for her great work as well.",https://facebook.com/story.php?story_fbid=2197382823660036&id=1304138352984492,,0.0,"The GHS Theatre group was awarded a best production last week at the Regional One-Act Theatre Festival. They will be moving on to the next round at Kingswood Regional High School on April 5 and 6.

Chelsea Sasserson and Anna Cook were awarded superior acting awards.

Meredith Ellis was given a superior costume design award.

Kudos to guest-director Grace McLaughlin for her great work as well.",2019-03-11 10:48:08,,
189,0.0,,3.0,,2197233803674938,"Come see ""The Seussification of a Midsummer Night's Dream"" spring play March 14-16 beginning at 7:00pm in the GHS auditorium",https://facebook.com/story.php?story_fbid=2197233803674938&id=1304138352984492,,0.0,"Come see ""The Seussification of a Midsummer Night's Dream"" spring play March 14-16 beginning at 7:00pm in the GHS auditorium",2019-03-11 08:45:19,,
190,1.0,https://scontent-atl3-1.xx.fbcdn.net/v/t1.0-9/fr/cp0/e15/q65/54523617_2193521137379538_1368883133243457536_o.jpg?_nc_cat=100&_nc_sid=8024bb&_nc_ohc=zxgf39f9O6MAX_pnMaN&_nc_ht=scontent-atl3-1.xx&tp=14&oh=9803f5a83394d31dd1032a7e76f218de&oe=5F833FA8,21.0,,2193521970712788,,https://facebook.com/story.php?story_fbid=2193521970712788&id=1304138352984492,,0.0,,2019-03-08 11:48:39,,
191,12.0,,55.0,https://myemail.constantcontact.com/-enter-subject-here-.html?soid=1131580167833&aid=fmbArUhq_C0,2192455330819452,"Monica Sawyer named 2018-2019 New Hampshire School Counselor of the Year!

https://myemail.constantcontact.com/-enter-subject-here-.html?soid=1131580167833&aid=fmbArUhq_C0",https://facebook.com/story.php?story_fbid=2192455330819452&id=1304138352984492,"MYEMAIL.CONSTANTCONTACT.COM
Special Announcement 3/7/19",6.0,"Monica Sawyer named 2018-2019 New Hampshire School Counselor of the Year!

https://myemail.constantcontact.com/-enter-subject-here-.html?soid=1131580167833&aid=fmbArUhq_C0

MYEMAIL.CONSTANTCONTACT.COM
Special Announcement 3/7/19",2019-03-07 18:13:14,,
192,1.0,https://scontent-atl3-1.xx.fbcdn.net/v/t1.0-9/53533251_2191829284215390_5892648065860370432_n.png?_nc_cat=100&_nc_sid=2d5d41&_nc_ohc=9CqjjgznGUoAX_C2EPu&_nc_ht=scontent-atl3-1.xx&oh=d9dfc8f7ac973f6a550391e2e7c5487e&oe=5F84295B,2.0,,2191829277548724,Join us tonight in the GHS auditorium from 6:00pm - 7:30pm to learn about the dangers of tobacco and vapes.,,,0.0,Join us tonight in the GHS auditorium from 6:00pm - 7:30pm to learn about the dangers of tobacco and vapes.,2019-03-07 09:05:12,,
193,0.0,https://scontent-atl3-1.xx.fbcdn.net/v/t1.0-9/fr/cp0/e15/q65/53352455_2191745714223747_6806983462864551936_o.jpg?_nc_cat=101&_nc_sid=2d5d41&_nc_ohc=sCjq_ZwlyVwAX9gqL1k&_nc_ht=scontent-atl3-1.xx&tp=14&oh=8d1ff5d3cb663f83e00492ad1d798b39&oe=5F8356B7,19.0,,2191745710890414,Our learners listening to Robert entertain us on the dangers that influence us.,,,0.0,Our learners listening to Robert entertain us on the dangers that influence us.,2019-03-07 07:59:02,,
194,0.0,,3.0,,2191024240962561,"Final from PSU, Bulldogs drop a heartbreaker 3-2 to the Huskies. Tough end to the season but a great run by the team in Coach Parents first season at the helm.",https://facebook.com/story.php?story_fbid=2191024240962561&id=1304138352984492,,0.0,"Final from PSU, Bulldogs drop a heartbreaker 3-2 to the Huskies. Tough end to the season but a great run by the team in Coach Parents first season at the helm.",2019-03-06 19:21:48,,
195,0.0,,0.0,,2190984327633219,Hockey update: Gilford losing 3-1 at end of second.,https://facebook.com/story.php?story_fbid=2190984327633219&id=1304138352984492,,0.0,Hockey update: Gilford losing 3-1 at end of second.,2019-03-06 18:43:16,,
196,0.0,,4.0,,2190941597637492,Hockey state semis Plymouth State End of first period all tied 1-1.,https://facebook.com/story.php?story_fbid=2190941597637492&id=1304138352984492,,0.0,Hockey state semis Plymouth State End of first period all tied 1-1.,2019-03-06 18:04:36,,
197,0.0,https://scontent-atl3-1.xx.fbcdn.net/v/t1.0-9/fr/cp0/e15/q65/52890008_2183837511681234_5134406555080327168_o.jpg?_nc_cat=109&_nc_sid=2d5d41&_nc_ohc=hI6eZ816cbwAX-NTWIb&_nc_ht=scontent-atl3-1.xx&tp=14&oh=ff1886a60e02d60b0d733eb9a99664ad&oe=5F83AF18,25.0,,2183837508347901,"Mikey, Annabelle, and Gerron bowling with @JamieStatonWMUR in Manchester, tonight, to support Unified Sports and @SONewHampshire. @JamieStatonWMUR See you soon at Gilford High School for our run!",,,0.0,"Mikey, Annabelle, and Gerron bowling with @JamieStatonWMUR in Manchester, tonight, to support Unified Sports and @SONewHampshire. @JamieStatonWMUR See you soon at Gilford High School for our run!",2019-03-01 20:24:08,,
