,comments,image,likes,link,post_id,post_text,post_url,shared_text,shares,text,time,video,video_thumbnail
0,0.0,https://scontent.fbna1-2.fna.fbcdn.net/v/t1.0-9/119070238_3334917333292036_5773903407015286990_o.png?_nc_cat=103&_nc_sid=8024bb&_nc_ohc=xskUOZguDYsAX_Whw5F&_nc_ht=scontent.fbna1-2.fna&oh=e1fb03887f7aaca4c09f2f3cf80d6149&oe=5F836A54,2.0,,3334926889957747,Have you filled out a lunch form yet? You might qualify for the P-EBT Program! Deadline September 14th! See office for blank lunch forms.,https://facebook.com/story.php?story_fbid=3334926889957747&id=184058048377996,,0.0,Have you filled out a lunch form yet? You might qualify for the P-EBT Program! Deadline September 14th! See office for blank lunch forms.,2020-09-09 13:44:38,,
1,0.0,https://scontent.fbna1-1.fna.fbcdn.net/v/t1.0-9/119035339_3331552783628491_2599553609935842499_n.png?_nc_cat=107&_nc_sid=8024bb&_nc_ohc=9MYyjosOJMoAX_uPmGD&_nc_ht=scontent.fbna1-1.fna&oh=7e412b8332f0edd02fd4db3575b43a5b&oe=5F80862A,0.0,,3331553316961771,Welcome Back HSA Family!,https://facebook.com/story.php?story_fbid=3331553316961771&id=184058048377996,,0.0,Welcome Back HSA Family!,2020-09-08 12:13:44,,
2,0.0,https://scontent.fbna1-2.fna.fbcdn.net/v/t1.0-9/118829194_3319434818173621_1338551517610937037_n.png?_nc_cat=106&_nc_sid=8024bb&_nc_ohc=114DgmQw6CoAX8eGuNM&_nc_ht=scontent.fbna1-2.fna&oh=ce899d803940800b8ff57a84bd7717d0&oe=5F812BD3,8.0,https://docs.google.com/forms/d/e/1FAIpQLSc9IsU9Hokd7dMcxfTCBV9M5RNMz5rxr58f0QRcwVFyYopekQ/viewform?usp=sf_link,3319435671506869,"https://docs.google.com/forms/d/e/1FAIpQLSc9IsU9Hokd7dMcxfTCBV9M5RNMz5rxr58f0QRcwVFyYopekQ/viewform?usp=sf_link

HSA CHS was recently approved for a technology grant that will allow the school to purchase and provide free mobile hotspots and 1 year of free internet services to each of our HSA households. We have included a link in this email in order to request for service and hotspot for your family. There is a limit to one hotspot per household. You will be notified by the school when the device has been received and a pick-up time will be scheduled. A user agreement will be signed upon pick-up.",https://facebook.com/story.php?story_fbid=3319435671506869&id=184058048377996,,0.0,"https://docs.google.com/forms/d/e/1FAIpQLSc9IsU9Hokd7dMcxfTCBV9M5RNMz5rxr58f0QRcwVFyYopekQ/viewform?usp=sf_link

HSA CHS was recently approved for a technology grant that will allow the school to purchase and provide free mobile hotspots and 1 year of free internet services to each of our HSA households. We have included a link in this email in order to request for service and hotspot for your family. There is a limit to one hotspot per household. You will be notified by the school when the device has been received and a pick-up time will be scheduled. A user agreement will be signed upon pick-up.",2020-09-04 11:09:04,,
3,0.0,https://scontent.fbna1-1.fna.fbcdn.net/v/t1.0-9/fr/cp0/e15/q65/118699653_3313730035410766_8316926576949445590_o.jpg?_nc_cat=108&_nc_sid=110474&_nc_ohc=M6SFrUpqEowAX_B4tSJ&_nc_ht=scontent.fbna1-1.fna&tp=14&oh=c3da96b98edd23f62f7e3a08f1c928f7&oe=5F82C377,0.0,,3313730052077431,"If you or someone you know, is in need of lunch for your student, during remote learning. See the attached flyer for more information",https://facebook.com/story.php?story_fbid=3313730052077431&id=184058048377996,,0.0,"If you or someone you know, is in need of lunch for your student, during remote learning. See the attached flyer for more information",2020-09-02 13:46:59,,
4,0.0,https://scontent.fbna1-2.fna.fbcdn.net/v/t1.0-9/fr/cp0/e15/q65/118772571_3313375552112881_1595641231477702537_o.jpg?_nc_cat=102&_nc_sid=9e2e56&_nc_ohc=xhdO5flClOMAX-17ChK&_nc_ht=scontent.fbna1-2.fna&tp=14&oh=9bd2242fe5cb9c736f29a0f9d7eab671&oe=5F83ABB5,1.0,,3313375575446212,School starts September 8th! Are you ready HSA?!? Make sure you picked up you technology by Friday! Students with CTE classes will need special programs! Call us today!,https://facebook.com/story.php?story_fbid=3313375575446212&id=184058048377996,,0.0,School starts September 8th! Are you ready HSA?!? Make sure you picked up you technology by Friday! Students with CTE classes will need special programs! Call us today!,2020-09-02 11:20:06,,
5,0.0,https://scontent.fbna1-2.fna.fbcdn.net/v/t1.0-9/fr/cp0/e15/q65/118512895_3292103160906787_3227260907494076592_n.jpg?_nc_cat=100&_nc_sid=110474&_nc_ohc=BEm_xaZKE1wAX-UoCWy&_nc_ht=scontent.fbna1-2.fna&tp=14&oh=cd4bdb68de74132a0a067be6e2f38810&oe=5F8382A0,2.0,,3292104214240015,Attention 2019-2020 HSA Athletes: All athletic award plaques and certificates are available to be picked up at the school at your convenience. Please contact Mr. Horton with any questions. Good luck on the start of a new year!,https://facebook.com/story.php?story_fbid=3292104214240015&id=184058048377996,,0.0,Attention 2019-2020 HSA Athletes: All athletic award plaques and certificates are available to be picked up at the school at your convenience. Please contact Mr. Horton with any questions. Good luck on the start of a new year!,2020-08-26 13:16:58,,
6,0.0,https://scontent.fbna1-2.fna.fbcdn.net/v/t1.0-9/fr/cp0/e15/q65/118017251_3271273969656373_7457808888029073206_o.jpg?_nc_cat=103&_nc_sid=2d5d41&_nc_ohc=Ho89EkoxwjAAX8ewuru&_nc_ht=scontent.fbna1-2.fna&tp=14&oh=42ad7a75d718b5e23569aeff00bedfda&oe=5F8340C6,0.0,,3271273966323040,If you need a chromebook or laptop please make sure to call the office to schedule your pick-up appointment.,,,0.0,If you need a chromebook or laptop please make sure to call the office to schedule your pick-up appointment.,2020-08-19 12:29:32,,
7,0.0,https://scontent.fbna1-1.fna.fbcdn.net/v/t1.0-9/fr/cp0/e15/q65/117298612_3253518778098559_9048077352881059581_n.jpg?_nc_cat=107&_nc_sid=8024bb&_nc_ohc=cPueFrZhHAEAX_4I21X&_nc_ht=scontent.fbna1-1.fna&tp=14&oh=0121027a7ae297652fd3c6afe483310b&oe=5F817FB2,0.0,https://cjfs.cuyahogacounty.us/pdf_cjfs/en-US/PRCProgramPacket.pdf,3253520658098371,"We know that during these trying times many people are faced with unique circumstances. Cuyahoga County Job and family services has an emergency Assistance program that you or someone you know, may qualify for. The link below has information for this program.

https://cjfs.cuyahogacounty.us/pdf_cjfs/en-US/PRCProgramPacket.pdf",https://facebook.com/story.php?story_fbid=3253520658098371&id=184058048377996,,0.0,"We know that during these trying times many people are faced with unique circumstances. Cuyahoga County Job and family services has an emergency Assistance program that you or someone you know, may qualify for. The link below has information for this program.

https://cjfs.cuyahogacounty.us/pdf_cjfs/en-US/PRCProgramPacket.pdf",2020-08-13 09:58:45,,
8,0.0,,0.0,,3208315265952244,"Unfortunately due to the continued Covid-19 pandemic and current social distancing guidelines from the state and school, we will be cancelling fall sports for the 2020 season. No decision has been made about winter or spring sports yet and information will be shared as soon as it is available.

We are very sorry for the athletes and families that were looking forward to this season and we hope to get athletics up and running as soon as we can.

You can contact Mr. Horton at horton@horizoncleveland.org with any questions or concerns.",https://facebook.com/story.php?story_fbid=3208315265952244&id=184058048377996,,0.0,"Unfortunately due to the continued Covid-19 pandemic and current social distancing guidelines from the state and school, we will be cancelling fall sports for the 2020 season. No decision has been made about winter or spring sports yet and information will be shared as soon as it is available.

We are very sorry for the athletes and families that were looking forward to this season and we hope to get athletics up and running as soon as we can.

You can contact Mr. Horton at horton@horizoncleveland.org with any questions or concerns.",2020-07-28 18:34:54,,
9,0.0,https://scontent.fbna1-2.fna.fbcdn.net/v/t1.0-9/fr/cp0/e15/q65/116424551_3207796999337404_8047522937718884585_n.jpg?_nc_cat=106&_nc_sid=110474&_nc_ohc=c21-1aQT97oAX_IqEL2&_nc_ht=scontent.fbna1-2.fna&tp=14&oh=1efe54cac2b89a6f805fb949d869841c&oe=5F8162BA,0.0,,3207797902670647,Hello HSA returning students! Please see below updates regarding the Fall 2020/2021. Detailed information is being mailed and emailed home.,https://facebook.com/story.php?story_fbid=3207797902670647&id=184058048377996,,0.0,Hello HSA returning students! Please see below updates regarding the Fall 2020/2021. Detailed information is being mailed and emailed home.,2020-07-28 14:01:15,,
10,0.0,https://scontent.fbna1-2.fna.fbcdn.net/v/t1.0-9/fr/cp0/e15/q65/115824065_3187056311411473_967192621414027287_n.jpg?_nc_cat=106&_nc_sid=110474&_nc_ohc=wVWVL2seXDUAX9Uh7Kj&_nc_ht=scontent.fbna1-2.fna&tp=14&oh=0f836e518709ee8f8bd67596c2a52d25&oe=5F82D049,5.0,,3187057214744716,,https://facebook.com/story.php?story_fbid=3187057214744716&id=184058048377996,,0.0,,2020-07-21 10:04:35,,
11,0.0,,4.0,https://docs.google.com/forms/d/1Qp78a4fRg3xIOuv2y2a63HVTGC8l_bVadav1P-2pv6A/viewform?edit_requested=true,3088763167907455,"We have now closed the 2019-2020 school year and want to begin to look forward to the bright future of Horizon Science Academy Cleveland High School. As we transition into the 2020-2021 school year, we encourage all of you to complete a survey giving us feedback on the previous school year with a focus on the last few months and answer questions about different scenarios for the future school year. This survey will help in creating the safe learning environment we always strive to create. Below is link for this survey

https://docs.google.com/forms/d/1Qp78a4fRg3xIOuv2y2a63HVTGC8l_bVadav1P-2pv6A/viewform?edit_requested=true",https://facebook.com/story.php?story_fbid=3088763167907455&id=184058048377996,"ACCOUNTS.GOOGLE.COM
Google Forms - create and analyze surveys, for free.",0.0,"We have now closed the 2019-2020 school year and want to begin to look forward to the bright future of Horizon Science Academy Cleveland High School. As we transition into the 2020-2021 school year, we encourage all of you to complete a survey giving us feedback on the previous school year with a focus on the last few months and answer questions about different scenarios for the future school year. This survey will help in creating the safe learning environment we always strive to create. Below is link for this survey

https://docs.google.com/forms/d/1Qp78a4fRg3xIOuv2y2a63HVTGC8l_bVadav1P-2pv6A/viewform?edit_requested=true

ACCOUNTS.GOOGLE.COM
Google Forms - create and analyze surveys, for free.",2020-06-15 11:51:57,,
12,2.0,https://scontent.fbna1-1.fna.fbcdn.net/v/t1.0-9/101439899_3051481534968952_5240598814020075520_n.png?_nc_cat=108&_nc_sid=8024bb&_nc_ohc=Tfg2C6f-\-\4sAX-Q1YuB&_nc_ht=scontent.fbna1-1.fna&oh=2803007daeaad5c7d33d1681023027c3&oe=5F825BAC,3.0,,3051481664968939,"Due to curfew restrictions and traffic redirection, the building is closed today June 1st.",https://facebook.com/story.php?story_fbid=3051481664968939&id=184058048377996,,0.0,"Due to curfew restrictions and traffic redirection, the building is closed today June 1st.",2020-06-01 09:38:59,,
13,24.0,https://scontent.fbna1-1.fna.fbcdn.net/v/t1.0-9/fr/cp0/e15/q65/99436655_3027724784011294_381406586377076736_o.jpg?_nc_cat=108&_nc_sid=110474&_nc_ohc=6x3EgbU8MSAAX8nwswG&_nc_oc=AQm1hPZVfQZjBaFsBM5RrlejwXcCCykeP2UtpS2Zfzb7uWUWRXTxbfsRHTIeC1_RZk8&_nc_ht=scontent.fbna1-1.fna&tp=14&oh=c9413d762884748705076af788bfa70f&oe=5F80F213,70.0,,3027725077344598,WE ARE BEYOND PROUD OF OUR 2020 GRADUATES! Check out our exceptional students that earned a spot in our TOP TEN! These students achieved the highest cumulative GPAs in our graduating class.,https://facebook.com/story.php?story_fbid=3027725077344598&id=184058048377996,,0.0,WE ARE BEYOND PROUD OF OUR 2020 GRADUATES! Check out our exceptional students that earned a spot in our TOP TEN! These students achieved the highest cumulative GPAs in our graduating class.,2020-05-22 13:14:00,,
14,0.0,,5.0,https://youtu.be/WPu8KRi2yGk,3025855867531519,"Hello HSA Family,

This evening we are proud to present the 2020 Virtual Commencement Ceremony. Below is the link to connect families, friends, and graduates to access the Youtube Live Ceremony. Attached with this emails is a commemorative program and our traditional Senior Then and now video. Once again we want to congratulate the class of 2020 and we wish you all the best on your future endeavors.

https://youtu.be/WPu8KRi2yGk",https://facebook.com/story.php?story_fbid=3025855867531519&id=184058048377996,"YOUTUBE.COM
HSA Cleveland High Virtual Graduation Ceremony",5.0,"Hello HSA Family,

This evening we are proud to present the 2020 Virtual Commencement Ceremony. Below is the link to connect families, friends, and graduates to access the Youtube Live Ceremony. Attached with this emails is a commemorative program and our traditional Senior Then and now video. Once again we want to congratulate the class of 2020 and we wish you all the best on your future endeavors.

https://youtu.be/WPu8KRi2yGk

YOUTUBE.COM
HSA Cleveland High Virtual Graduation Ceremony",2020-05-21 18:37:36,,
15,0.0,,4.0,https://www.youtube.com/watch?v=WPu8KRi2yGk&feature=youtu.be,3025748794208893,Join us virtually to celebrate the Class of 2020 @ 6pm on YouTube LIVE!,https://facebook.com/story.php?story_fbid=3025748794208893&id=184058048377996,"YOUTUBE.COM
HSA Cleveland High Virtual Graduation Ceremony",0.0,"Join us virtually to celebrate the Class of 2020 @ 6pm on YouTube LIVE!

YOUTUBE.COM
HSA Cleveland High Virtual Graduation Ceremony",2020-05-21 17:51:10,,
16,0.0,,11.0,,3022862927830813,"We are ready for you, Class of 2020!! #graduation #classof2020 #hsa #dragons",,,0.0,"We are ready for you, Class of 2020!! #graduation #classof2020 #hsa #dragons",2020-05-20 13:37:01,https://video.fbna1-2.fna.fbcdn.net/v/t42.9040-2/97365223_569701677278216_4838428337099505664_n.mp4?_nc_cat=102&_nc_sid=985c63&efg=eyJ2ZW5jb2RlX3RhZyI6ImxlZ2FjeV9zZCJ9&_nc_ohc=CI57wo1VfRQAX-Tr-ph&_nc_ht=video.fbna1-2.fna&oh=84a8b6736aa6c93be7c2188193d84d69&oe=5F5C4E21,
17,0.0,,4.0,https://youtu.be/BQadR2zfaNE?t=1970,3018599231590516,"Thank you to everyone who was able to attend our virtual athletic banquet! Congratulations again to all of our athletes! If you would like to watch, or rewatch, the link to the video is below.

https://youtu.be/BQadR2zfaNE?t=1970",https://facebook.com/story.php?story_fbid=3018599231590516&id=184058048377996,"YOUTUBE.COM
2019-2020 Horizon Science Academy Cleveland HS Athletic Banquet",0.0,"Thank you to everyone who was able to attend our virtual athletic banquet! Congratulations again to all of our athletes! If you would like to watch, or rewatch, the link to the video is below.

https://youtu.be/BQadR2zfaNE?t=1970

YOUTUBE.COM
2019-2020 Horizon Science Academy Cleveland HS Athletic Banquet",2020-05-18 19:32:14,,
18,0.0,https://scontent.fbna1-2.fna.fbcdn.net/v/t1.0-9/fr/cp0/e15/q65/100482632_3018307621619677_6981854860207456256_n.jpg?_nc_cat=109&_nc_sid=110474&_nc_ohc=hbOIkwA-7kAAX9mSr6o&_nc_ht=scontent.fbna1-2.fna&tp=14&oh=0592f63fb36bf0ee9f3ccdfec435b2a6&oe=5F804ED9,2.0,https://youtu.be/BQadR2zfaNE,3018307834952989,The 2019-2020 HSA Athletic Banquet is starting soon! Click the following link to attend: https://youtu.be/BQadR2zfaNE,https://facebook.com/story.php?story_fbid=3018307834952989&id=184058048377996,,0.0,The 2019-2020 HSA Athletic Banquet is starting soon! Click the following link to attend: https://youtu.be/BQadR2zfaNE,2020-05-18 16:35:12,,
19,1.0,https://scontent.fbna1-2.fna.fbcdn.net/v/t1.0-9/fr/cp0/e15/q65/98097097_3017848708332235_3551845904052912128_n.jpg?_nc_cat=109&_nc_sid=110474&_nc_ohc=UjI7vHsXwXAAX94aZSo&_nc_ht=scontent.fbna1-2.fna&tp=14&oh=0e349bd8bc3514045fcc55ebe8d49461&oe=5F82822C,5.0,,3017849828332123,"Just under 5 hours until the online video Athletic banquet! Link will be posted here, on our Instagram account, and on the school website around 4:30-4:45pm today. Come help us celebrate our student athletes!",https://facebook.com/story.php?story_fbid=3017849828332123&id=184058048377996,,0.0,"Just under 5 hours until the online video Athletic banquet! Link will be posted here, on our Instagram account, and on the school website around 4:30-4:45pm today. Come help us celebrate our student athletes!",2020-05-18 12:27:06,,
20,0.0,https://scontent.fbna1-1.fna.fbcdn.net/v/t1.0-9/fr/cp0/e15/q65/96760441_2997545013695938_6689878267551285248_n.jpg?_nc_cat=105&_nc_sid=110474&_nc_ohc=u5pzDki0mw4AX-7Pz9r&_nc_ht=scontent.fbna1-1.fna&tp=14&oh=a87c4f67bd43e4fa64f6e95be8c59ecd&oe=5F8218F9,1.0,,3008596035924169,"Another reminder that our 2019-2020 Athletic Banquet Video will livestream this coming Monday, May 18, at 5:00pm. The link will be posted here and on our instagram page about 15-30 minuets before the stream begins. Hope to ""see"" you all there!",https://facebook.com/story.php?story_fbid=3008596035924169&id=184058048377996,"Horizon Science Academy Cleveland High School
May 11 at 2:03 PM 路

This coming Monday, May 18, at 5pm, we will be streaming the video of our 2019-2020 Athletic Banquet. The video will stay up on our YouTube page after it streams LIVE. The link to the video will be posted on our school website and social media accounts on Monday. We hope everyone is able to watch the student-athletes get the recognition they deserve!",0.0,"Another reminder that our 2019-2020 Athletic Banquet Video will livestream this coming Monday, May 18, at 5:00pm. The link will be posted here and on our instagram page about 15-30 minuets before the stream begins. Hope to ""see"" you all there!

Horizon Science Academy Cleveland High School
May 11 at 2:03 PM 路

This coming Monday, May 18, at 5pm, we will be streaming the video of our 2019-2020 Athletic Banquet. The video will stay up on our YouTube page after it streams LIVE. The link to the video will be posted on our school website and social media accounts on Monday. We hope everyone is able to watch the student-athletes get the recognition they deserve!",2020-05-15 15:14:55,,
21,1.0,,5.0,https://fox8.com/news/krispy-kreme-is-giving-free-dozen-donuts-to-2020-graduates/,3000868216696951,CLASS OF 2锔ｐ2锔ｐ!! Get your free doughnuts!!,https://facebook.com/story.php?story_fbid=3000868216696951&id=184058048377996,"FOX8.COM
Krispy Kreme is giving FREE dozen donuts to 2020 graduates",3.0,"CLASS OF 2锔ｐ2锔ｐ!! Get your free doughnuts!!

FOX8.COM
Krispy Kreme is giving FREE dozen donuts to 2020 graduates",2020-05-12 21:18:29,,
22,0.0,https://scontent.fbna1-1.fna.fbcdn.net/v/t1.0-9/fr/cp0/e15/q65/96760441_2997545013695938_6689878267551285248_n.jpg?_nc_cat=105&_nc_sid=110474&_nc_ohc=u5pzDki0mw4AX-7Pz9r&_nc_ht=scontent.fbna1-1.fna&tp=14&oh=a87c4f67bd43e4fa64f6e95be8c59ecd&oe=5F8218F9,4.0,,2997547650362341,"This coming Monday, May 18, at 5pm, we will be streaming the video of our 2019-2020 Athletic Banquet. The video will stay up on our YouTube page after it streams LIVE. The link to the video will be posted on our school website and social media accounts on Monday. We hope everyone is able to watch the student-athletes get the recognition they deserve!",https://facebook.com/story.php?story_fbid=2997547650362341&id=184058048377996,,0.0,"This coming Monday, May 18, at 5pm, we will be streaming the video of our 2019-2020 Athletic Banquet. The video will stay up on our YouTube page after it streams LIVE. The link to the video will be posted on our school website and social media accounts on Monday. We hope everyone is able to watch the student-athletes get the recognition they deserve!",2020-05-11 14:03:00,,
23,0.0,https://scontent.fbna1-2.fna.fbcdn.net/v/t1.0-9/fr/cp0/e15/q65/96030174_2983725261744580_3822976864348012544_n.jpg?_nc_cat=106&_nc_sid=8024bb&_nc_ohc=nBhHKjTOmxAAX_l4MHa&_nc_ht=scontent.fbna1-2.fna&tp=14&oh=44aa0cc9887c4556421f55078549dea5&oe=5F80B247,7.0,,2983725548411218,Happy Teacher Appreciation Week!,https://facebook.com/story.php?story_fbid=2983725548411218&id=184058048377996,,0.0,Happy Teacher Appreciation Week!,2020-05-05 19:58:33,,
24,0.0,https://scontent.fbna1-2.fna.fbcdn.net/v/t1.0-9/96101906_2983667611750345_7785995780241752064_o.png?_nc_cat=111&_nc_sid=8024bb&_nc_ohc=gVGOLHUiZB0AX9U3_Ud&_nc_ht=scontent.fbna1-2.fna&oh=04ee682eb12f0b1167f2246e09d70a0e&oe=5F7FECB9,2.0,,2983667691750337,Senior End of Year Reminders.,https://facebook.com/story.php?story_fbid=2983667691750337&id=184058048377996,,0.0,Senior End of Year Reminders.,2020-05-05 19:23:34,,
25,0.0,,9.0,https://www.youtube.com/watch?v=uxH5KnTLn34,2974513232665783,わ WE MISS OUR HSA STUDENTS! わ,https://facebook.com/story.php?story_fbid=2974513232665783&id=184058048377996,"YOUTUBE.COM
HSA Cleveland High - Message for Students and Families",0.0,"わ WE MISS OUR HSA STUDENTS! わ

YOUTUBE.COM
HSA Cleveland High - Message for Students and Families",2020-05-01 22:41:41,,
26,0.0,https://scontent.fbna1-2.fna.fbcdn.net/v/t1.0-9/95474650_2973480982769008_3023743674593837056_n.png?_nc_cat=111&_nc_sid=8024bb&_nc_ohc=G0ILuIBruDIAX_GmQ8p&_nc_ht=scontent.fbna1-2.fna&oh=1dc8b47774e8715e689ae78d6ea0c32a&oe=5F819D82,2.0,,2973481089435664,Reminder Josten Pick-up tomorrow 5/2/2020 from 2-3:30pm,https://facebook.com/story.php?story_fbid=2973481089435664&id=184058048377996,,0.0,Reminder Josten Pick-up tomorrow 5/2/2020 from 2-3:30pm,2020-05-01 12:16:03,,
27,0.0,,1.0,https://us04web.zoom.us/j/8335697287,2971736102943496,"If any parents would like to join in tomorrow at 2:30pm, HSA PTO, will be holding a Zoom PTO meeting.

Click https://us04web.zoom.us/j/8335697287 to start or join a scheduled Zoom meeting.

Tomorrow at 2:30pm",https://facebook.com/story.php?story_fbid=2971736102943496&id=184058048377996,"US04WEB.ZOOM.US
Join our Cloud HD Video Meeting now",0.0,"If any parents would like to join in tomorrow at 2:30pm, HSA PTO, will be holding a Zoom PTO meeting.

Click https://us04web.zoom.us/j/8335697287 to start or join a scheduled Zoom meeting.

Tomorrow at 2:30pm

US04WEB.ZOOM.US
Join our Cloud HD Video Meeting now",2020-04-30 18:51:46,,
28,1.0,https://scontent.fbna1-1.fna.fbcdn.net/v/t1.0-9/95143720_2969362553180851_3499898661154848768_o.png?_nc_cat=107&_nc_sid=8024bb&_nc_ohc=nBsWsJVEogAAX8E-xH6&_nc_ht=scontent.fbna1-1.fna&oh=75acc3b18f86757a178a7d435d29fb18&oe=5F817EE4,6.0,,2969363343180772,To the Class of 2020,https://facebook.com/story.php?story_fbid=2969363343180772&id=184058048377996,,0.0,To the Class of 2020,2020-04-29 19:11:02,,
29,0.0,,14.0,https://www.ideastream.org/news/how-one-cleveland-high-school-keeps-students-connected-during-quarantine,2939980916119015,Our beloved HSA made headlines this week! Check out the story below:,https://facebook.com/story.php?story_fbid=2939980916119015&id=184058048377996,"IDEASTREAM.ORG
How One Cleveland High School Keeps Students Connected During Quarantine",5.0,"Our beloved HSA made headlines this week! Check out the story below:

IDEASTREAM.ORG
How One Cleveland High School Keeps Students Connected During Quarantine",2020-04-17 13:43:27,,
30,1.0,https://scontent.fbna1-2.fna.fbcdn.net/v/t1.0-9/92642024_1209487912736696_7388912245406695424_o.png?_nc_cat=109&_nc_sid=8024bb&_nc_ohc=2y7Da3XskbAAX_j2V3f&_nc_ht=scontent.fbna1-2.fna&oh=6df4d56b8b1a92a6b3386f3105dce176&oe=5F809A56,3.0,http://www.strivescan.com/virtual,2935036519946788,"Attention Seniors and Juniors, visit Colleges Virtually!
Strive Virtual College Exploration Week, Monday, April 20 - Thursday, April 23, 2020
Registration for students and parents is now live:

www.strivescan.com/virtual",https://facebook.com/story.php?story_fbid=2935036519946788&id=184058048377996,"StriveScan
April 8 at 5:50 PM 路

佛    :

More than 300 colleges from 44 states and 10 countries will be participating in the 筐娥 娥筐 拣桂桂拆答 金桂拣筐娥拣 拆拆.

It's 4 full days with nearly 100 virtual presentations options on college search topics aimed at juniors and underclassmen.

Students can browse the schedule and register at: www.StriveScan.com/virtual",0.0,"Attention Seniors and Juniors, visit Colleges Virtually!
Strive Virtual College Exploration Week, Monday, April 20 - Thursday, April 23, 2020
Registration for students and parents is now live:

www.strivescan.com/virtual

StriveScan
April 8 at 5:50 PM 路

佛    :

More than 300 colleges from 44 states and 10 countries will be participating in the 筐娥 娥筐 拣桂桂拆答 金桂拣筐娥拣 拆拆.

It's 4 full days with nearly 100 virtual presentations options on college search topics aimed at juniors and underclassmen.

Students can browse the schedule and register at: www.StriveScan.com/virtual",2020-04-15 13:11:14,,
31,0.0,https://scontent.fbna1-1.fna.fbcdn.net/v/t1.0-9/93060489_2930418980408542_7610663837850664960_o.png?_nc_cat=107&_nc_sid=8024bb&_nc_ohc=f0Q3NxgBifMAX-1c_OA&_nc_ht=scontent.fbna1-1.fna&oh=d92cd0da2a0c2d957a94fb6f8c1ee539&oe=5F80E68A,0.0,http://www.hsas.org/coronavirus-response-information/,2930420977075009,Please see the schools official remote learning plan. http://www.hsas.org/coronavirus-response-information/,https://facebook.com/story.php?story_fbid=2930420977075009&id=184058048377996,,0.0,Please see the schools official remote learning plan. http://www.hsas.org/coronavirus-response-information/,2020-04-13 14:01:30,,
