,comments,image,likes,link,post_id,post_text,post_url,shared_text,shares,text,time,video,video_thumbnail
143,0.0,https://scontent.fbna1-2.fna.fbcdn.net/v/t1.0-9/fr/cp0/e15/q65/76929725_2598020863648357_651055585386561536_n.jpg?_nc_cat=103&_nc_sid=8024bb&_nc_ohc=I2KqT96ffL8AX-XL8yj&_nc_ht=scontent.fbna1-2.fna&tp=14&oh=81f7377d4b8acec62515bc4c1af7a008&oe=5F801B87,3.0,https://memesbams.com/monday-memes/,2598022563648187,"Love Mondays for the chance to start again! #mememondays #HSACHS #WeAreConcept

https://memesbams.com/monday-memes/",https://facebook.com/story.php?story_fbid=2598022563648187&id=184058048377996,,0.0,"Love Mondays for the chance to start again! #mememondays #HSACHS #WeAreConcept

https://memesbams.com/monday-memes/",2019-11-18 09:24:41,,
144,0.0,https://scontent.fbna1-2.fna.fbcdn.net/v/t1.0-9/fr/cp0/e15/q65/74317695_2591703550946755_856874038868312064_o.jpg?_nc_cat=102&_nc_sid=8024bb&_nc_ohc=Camq4fK9TBQAX_s26r8&_nc_ht=scontent.fbna1-2.fna&tp=14&oh=9dd7b371e77f14a65a68335813866f71&oe=5F82829B,0.0,,2591703830946727,"Due to requests, Jostens has added a visit to the campus. They will be back to take orders 12/12/19",https://facebook.com/story.php?story_fbid=2591703830946727&id=184058048377996,,0.0,"Due to requests, Jostens has added a visit to the campus. They will be back to take orders 12/12/19",2019-11-15 13:33:38,,
145,0.0,,0.0,,2591396024310841,Check out this exhibit at the Greatlakes Science Center! #funwithstemfridays #HSACHS #WeAreConcept,https://facebook.com/story.php?story_fbid=2591396024310841&id=184058048377996,"FRI, NOV 15, 2019
Curiosity Carnival",0.0,"Check out this exhibit at the Greatlakes Science Center! #funwithstemfridays #HSACHS #WeAreConcept

FRI, NOV 15, 2019
Curiosity Carnival",2019-11-15 10:46:06,,
146,0.0,,0.0,http://www.cleveleads.org/accelerate,2591286917655085,"The Cleveland Leadership Center is now accepting applications for Accelerate 2020: Citizens Make Change  a civic pitch competition that gives individuals an opportunity to bring their community-focused ideas to life. Anyone with an idea to make Greater Cleveland a better place to work, live, play, or visit can apply. Finalists from each of the categories win $2,000 and the overall winner receives $5,000 to help launch their idea. Ideas that involve technology can win additional funds in the Technovation Competition where the Cleveland Foundation is giving away $3,500 for the top technology idea.

Pitch applications are open until 9:00 a.m. on December 2 at www.cleveleads.org/accelerate.",https://facebook.com/story.php?story_fbid=2591286917655085&id=184058048377996,"CLEVELEADS.ORG
Accelerate - Cleveland Leadership Center",0.0,"The Cleveland Leadership Center is now accepting applications for Accelerate 2020: Citizens Make Change  a civic pitch competition that gives individuals an opportunity to bring their community-focused ideas to life. Anyone with an idea to make Greater Cleveland a better place to work, live, play, or visit can apply. Finalists from each of the categories win $2,000 and the overall winner receives $5,000 to help launch their idea. Ideas that involve technology can win additional funds in the Technovation Competition where the Cleveland Foundation is giving away $3,500 for the top technology idea.

Pitch applications are open until 9:00 a.m. on December 2 at www.cleveleads.org/accelerate.

CLEVELEADS.ORG
Accelerate - Cleveland Leadership Center",2019-11-15 09:45:10,,
147,0.0,https://scontent.fbna1-1.fna.fbcdn.net/v/t1.0-9/fr/cp0/e15/q65/75282247_2591274757656301_1457322157750091776_o.jpg?_nc_cat=105&_nc_sid=8024bb&_nc_ohc=rgCsI_gXApQAX9yzbGA&_nc_ht=scontent.fbna1-1.fna&tp=14&oh=37a14b2b70684ffc15f2f7c710253eaf&oe=5F830132,4.0,,2591279444322499,"This week in Mr. Sayre's Class students participated in a ""Current Events Gallery Walk"". Students made posters about current events happening in the recent weeks and were able to view each others posters and make comments about what they had learned and how they felt about them.",https://facebook.com/story.php?story_fbid=2591279444322499&id=184058048377996,,0.0,"This week in Mr. Sayre's Class students participated in a ""Current Events Gallery Walk"". Students made posters about current events happening in the recent weeks and were able to view each others posters and make comments about what they had learned and how they felt about them.",2019-11-15 09:42:04,,
148,0.0,https://scontent.fbna1-2.fna.fbcdn.net/v/t1.0-9/fr/cp0/e15/q65/75380256_2586928054757638_2942298982853902336_o.jpg?_nc_cat=111&_nc_sid=2d5d41&_nc_ohc=Rn6DD5I79iwAX8NOL_O&_nc_ht=scontent.fbna1-2.fna&tp=14&oh=27a68da1c98f06cd69816693c8a377b7&oe=5F8236CC,0.0,,2586928051424305,Seniors!! Dont forget Jostens will be here today during senior lunches to take orders! *you can also purchase your items online or by phone.,,,0.0,Seniors!! Dont forget Jostens will be here today during senior lunches to take orders! *you can also purchase your items online or by phone.,2019-11-13 10:16:40,,
149,0.0,https://scontent.fbna1-1.fna.fbcdn.net/v/t1.0-9/73498021_2584911778292599_5612143090333646848_o.png?_nc_cat=110&_nc_sid=8024bb&_nc_ohc=EzsSW0gQJ8cAX_HL0bk&_nc_ht=scontent.fbna1-1.fna&oh=afc608f2a9fa91aee354eacf2dc380f2&oe=5F834DBB,3.0,,2584912371625873,We will be canceling after school activities again for 11/12/19.,https://facebook.com/story.php?story_fbid=2584912371625873&id=184058048377996,,0.0,We will be canceling after school activities again for 11/12/19.,2019-11-12 11:40:24,,
150,0.0,,3.0,,2584407458343031,,https://facebook.com/story.php?story_fbid=2584407458343031&id=184058048377996,,0.0,,2019-11-12 06:53:04,,
151,1.0,https://scontent.fbna1-2.fna.fbcdn.net/v/t1.0-9/fr/cp0/e15/q65/76931647_2582728731844237_6966899419010564096_o.jpg?_nc_cat=106&_nc_sid=8024bb&_nc_ohc=pImgBvVAQvIAX_3zrmh&_nc_ht=scontent.fbna1-2.fna&tp=14&oh=fd887dd495e25a879902412bc4bd20a1&oe=5F8268AC,19.0,,2582729111844199,Today HSA Cleveland High School JROTC Color Guard and Drill Team presented the Colors and gave the elementary students a Drill performance during Veterans day activity at HSA Denison Middle School.,https://facebook.com/story.php?story_fbid=2582729111844199&id=184058048377996,,0.0,Today HSA Cleveland High School JROTC Color Guard and Drill Team presented the Colors and gave the elementary students a Drill performance during Veterans day activity at HSA Denison Middle School.,2019-11-11 12:11:10,,
152,0.0,https://scontent.fbna1-2.fna.fbcdn.net/v/t1.0-9/fr/cp0/e15/q65/75443107_2582685531848557_8593535127508746240_n.jpg?_nc_cat=103&_nc_sid=8024bb&_nc_ohc=UdxLB0Pm9wsAX9Kzv-p&_nc_ht=scontent.fbna1-2.fna&tp=14&oh=8ddb965392d62cc43ed75c0e14ee98bc&oe=5F8335F7,1.0,,2582686535181790,"A big thanks to our HSA Family members who have served in the Military. Thank you SFC Robertson, SFC Dejesus, PFC. Dejesus & LTC Gawry for their services!",https://facebook.com/story.php?story_fbid=2582686535181790&id=184058048377996,,0.0,"A big thanks to our HSA Family members who have served in the Military. Thank you SFC Robertson, SFC Dejesus, PFC. Dejesus & LTC Gawry for their services!",2019-11-11 11:45:07,,
153,0.0,https://scontent.fbna1-1.fna.fbcdn.net/v/t1.0-9/75328785_2582654985184945_5107377492662943744_o.png?_nc_cat=104&_nc_sid=8024bb&_nc_ohc=r9WuvYfJNwUAX-TjL1u&_nc_ht=scontent.fbna1-1.fna&oh=babc766446dd477161cff2b35e816582&oe=5F83487F,0.0,,2582655975184846,We will be cancelling all After School Activities today 11/11/19,https://facebook.com/story.php?story_fbid=2582655975184846&id=184058048377996,,0.0,We will be cancelling all After School Activities today 11/11/19,2019-11-11 11:29:58,,
154,0.0,https://scontent.fbna1-2.fna.fbcdn.net/v/t1.0-9/fr/cp0/e15/q65/75442905_2576499982467112_1159209637375901696_n.jpg?_nc_cat=101&_nc_sid=110474&_nc_ohc=OXaBISZrEv0AX_NydjH&_nc_ht=scontent.fbna1-2.fna&tp=14&oh=82ab42c1ace3ff6f4626a12294ea1fe1&oe=5F82B732,2.0,,2576502715800172,Coach Horton is teaching our wrestlers some winning moves! ぜ锔,https://facebook.com/story.php?story_fbid=2576502715800172&id=184058048377996,,0.0,Coach Horton is teaching our wrestlers some winning moves! ぜ锔,2019-11-08 15:26:05,,
155,0.0,https://scontent.fbna1-2.fna.fbcdn.net/v/t1.0-9/fr/cp0/e15/q65/73460737_2576497192467391_5242084666546061312_n.jpg?_nc_cat=109&_nc_sid=110474&_nc_ohc=jwxlX4IIohoAX9B_hrl&_nc_ht=scontent.fbna1-2.fna&tp=14&oh=b9255d1009002b44f6a6a2cc77018e89&oe=5F831E74,10.0,,2576499275800516,Our Cheer Team is practicing for the upcoming Basketball  season! ,https://facebook.com/story.php?story_fbid=2576499275800516&id=184058048377996,,0.0,Our Cheer Team is practicing for the upcoming Basketball  season! ,2019-11-08 15:23:52,,
156,0.0,https://scontent.fbna1-1.fna.fbcdn.net/v/t1.0-9/fr/cp0/e15/q65/74800266_2576001009183676_6784156884212383744_n.jpg?_nc_cat=107&_nc_sid=110474&_nc_ohc=IhjQQdUZuFAAX-GvsKz&_nc_ht=scontent.fbna1-1.fna&tp=14&oh=f2ede2084fa88a0cc538b2f25a32cf80&oe=5F83286B,5.0,,2576001865850257,┾锔Ms. Baldwin opened up a Bistro this morning and her AP students had a Book Tasting to decide which independent novels to read! 锔,https://facebook.com/story.php?story_fbid=2576001865850257&id=184058048377996,,0.0,┾锔Ms. Baldwin opened up a Bistro this morning and her AP students had a Book Tasting to decide which independent novels to read! 锔,2019-11-08 10:21:59,,
157,0.0,https://scontent.fbna1-2.fna.fbcdn.net/v/t1.0-9/fr/cp0/e15/q65/74503144_2575874129196364_1928462692683612160_o.jpg?_nc_cat=100&_nc_sid=8024bb&_nc_ohc=tBKyUhfb4Z4AX-rh2Sf&_nc_ht=scontent.fbna1-2.fna&tp=14&oh=72b5da7c267193bd3a57e360f89b59f9&oe=5F83719C,0.0,,2575874305863013,This week Mr. Girard's Physics class tested out their self made rockets and parachutes. Students had to try different variables to see how to increase height of rocket launch and length of air time for the parachute. #FunwithStemFridays #HSACHS #WeAreConcept,https://facebook.com/story.php?story_fbid=2575874305863013&id=184058048377996,,0.0,This week Mr. Girard's Physics class tested out their self made rockets and parachutes. Students had to try different variables to see how to increase height of rocket launch and length of air time for the parachute. #FunwithStemFridays #HSACHS #WeAreConcept,2019-11-08 09:08:28,,
158,0.0,,1.0,,2575866972530413,This week Mr. Girard's Physics class tested out their self made rockets and parachutes. Students had to try different variables to see how to increase height of rocket launch and length of air time for the parachute. Watch the video's below to see how they did! #FunwithStemFridays #HSACHS #WeAreConcept,,,0.0,This week Mr. Girard's Physics class tested out their self made rockets and parachutes. Students had to try different variables to see how to increase height of rocket launch and length of air time for the parachute. Watch the video's below to see how they did! #FunwithStemFridays #HSACHS #WeAreConcept,2019-11-08 09:04:31,https://video.fbna1-2.fna.fbcdn.net/v/t42.9040-2/77714541_468899750394830_5470722315631198208_n.mp4?_nc_cat=101&_nc_sid=985c63&efg=eyJ2ZW5jb2RlX3RhZyI6InN2ZV9zZCJ9&_nc_ohc=h_W_LhQNQSkAX-6WX67&_nc_oc=AQnO4nkLNp6aH5v9WayY43u7wD8v7HfwzsvKngKbUgrIbnUlDKzyPDTEJ0alZlW5XhY&_nc_ht=video.fbna1-2.fna&oh=7c764aa27048720aef98de85f6a6a1f1&oe=5F5C4AE4,
159,0.0,https://scontent.fbna1-1.fna.fbcdn.net/v/t1.0-9/fr/cp0/e15/q65/73497935_2575839939199783_8102366666152738816_o.jpg?_nc_cat=108&_nc_sid=8024bb&_nc_ohc=3p0cJjoSD4EAX_adjww&_nc_ht=scontent.fbna1-1.fna&tp=14&oh=d2001ae3b10e673600bed9e0e4c6fb39&oe=5F837BDF,4.0,,2575842555866188,Yesterday Ms. Lutch's students did stations to study for their Of Mice and Men exam next week!,https://facebook.com/story.php?story_fbid=2575842555866188&id=184058048377996,,0.0,Yesterday Ms. Lutch's students did stations to study for their Of Mice and Men exam next week!,2019-11-08 08:51:17,,
160,0.0,https://scontent.fbna1-1.fna.fbcdn.net/v/t1.0-9/fr/cp0/e15/q65/75442889_2574323412684769_2732593605444108288_o.jpg?_nc_cat=108&_nc_sid=8024bb&_nc_ohc=cAn9qARpi7kAX8eH36M&_nc_ht=scontent.fbna1-1.fna&tp=14&oh=69e1254ee834620582841bbe011ec0db&oe=5F839DB9,1.0,,2574324256018018,"Two events, One night! Join us Thursday, November 21 @5 pm for Thanksgiving dinner and for our College Credit Plus information night! Call the school to RSVP!",https://facebook.com/story.php?story_fbid=2574324256018018&id=184058048377996,,0.0,"Two events, One night! Join us Thursday, November 21 @5 pm for Thanksgiving dinner and for our College Credit Plus information night! Call the school to RSVP!",2019-11-07 15:50:04,,
161,0.0,https://scontent.fbna1-1.fna.fbcdn.net/v/t1.0-9/fr/cp0/e15/q65/74596450_2574319626018481_2655862026131210240_n.jpg?_nc_cat=108&_nc_sid=110474&_nc_ohc=4zG_tdgY7PgAX-eDYbk&_nc_ht=scontent.fbna1-1.fna&tp=14&oh=fd1bb522eec7bd9ad313812fe96a975a&oe=5F81CFD9,2.0,,2574322042684906,Our Lady Dragons practicing how to box out! ,https://facebook.com/story.php?story_fbid=2574322042684906&id=184058048377996,,0.0,Our Lady Dragons practicing how to box out! ,2019-11-07 15:48:29,,
162,0.0,https://scontent.fbna1-1.fna.fbcdn.net/v/t1.0-9/fr/cp0/e15/q65/74229526_2572076716242772_4322651607217995776_o.jpg?_nc_cat=110&_nc_sid=8024bb&_nc_ohc=JZa7tFd89jQAX_UMJgt&_nc_ht=scontent.fbna1-1.fna&tp=14&oh=638eecc1a3b16a6827a25f0576132867&oe=5F80C0E0,0.0,,2572077176242726,ATTENTION SENIORS!!! Jostens will be here tomorrow 11/7 for informational meeting during 3rd period.,https://facebook.com/story.php?story_fbid=2572077176242726&id=184058048377996,,0.0,ATTENTION SENIORS!!! Jostens will be here tomorrow 11/7 for informational meeting during 3rd period.,2019-11-06 14:24:52,,
163,0.0,https://scontent.fbna1-1.fna.fbcdn.net/v/t1.0-9/fr/cp0/e15/q65/74610042_2572060192911091_3220744620346441728_n.jpg?_nc_cat=110&_nc_sid=110474&_nc_ohc=8ctSxLya5YsAX8p8OEm&_nc_ht=scontent.fbna1-1.fna&tp=14&oh=c9bc0368ce042adcc5f266c8dc35fbd7&oe=5F819092,4.0,,2572065096243934,#wordsofwisdomwednesday #hsacleveland #weareconcept,https://facebook.com/story.php?story_fbid=2572065096243934&id=184058048377996,,0.0,#wordsofwisdomwednesday #hsacleveland #weareconcept,2019-11-06 14:16:34,,
164,0.0,https://scontent.fbna1-1.fna.fbcdn.net/v/t1.0-9/fr/cp0/e15/q65/75610851_2567752266675217_5692863826681135104_o.jpg?_nc_cat=107&_nc_sid=110474&_nc_ohc=1Jy4Yu1mJ90AX9cebd1&_nc_ht=scontent.fbna1-1.fna&tp=14&oh=84d8d34f6b980032a9d75e9c7205c53d&oe=5F80A539,6.0,,2567752443341866,筐イToday our Seniors went to see the film Harriet! 筐イ,https://facebook.com/story.php?story_fbid=2567752443341866&id=184058048377996,,0.0,筐イToday our Seniors went to see the film Harriet! 筐イ,2019-11-04 14:40:38,,
165,0.0,https://scontent.fbna1-2.fna.fbcdn.net/v/t1.0-9/fr/cp0/e15/q65/72545864_2567746863342424_8270136111733407744_o.jpg?_nc_cat=109&_nc_sid=9e2e56&_nc_ohc=BL46GoNuTx4AX_nAS9x&_nc_ht=scontent.fbna1-2.fna&tp=14&oh=463b01a90240c784572f90b57425ed5e&oe=5F8219AE,6.0,,2567747460009031,"The weekend PTO Chicago trip was a great success. The trip has been organized as a team building activity for the members of the newly formed PTO. We visited Concept Schools headquarters, toured Chicago Math & Science Academy, and went sightseeing at Navy Pier including a boat tour of Chicago river.",https://facebook.com/story.php?story_fbid=2567747460009031&id=184058048377996,,0.0,"The weekend PTO Chicago trip was a great success. The trip has been organized as a team building activity for the members of the newly formed PTO. We visited Concept Schools headquarters, toured Chicago Math & Science Academy, and went sightseeing at Navy Pier including a boat tour of Chicago river.",2019-11-04 14:37:29,,
166,0.0,https://scontent.fbna1-1.fna.fbcdn.net/v/t1.0-9/fr/cp0/e15/q65/74209227_2567741916676252_1832031502838267904_n.jpg?_nc_cat=105&_nc_sid=110474&_nc_ohc=S1tVAinncswAX9eXEzY&_nc_ht=scontent.fbna1-1.fna&tp=14&oh=86e01bcd8e48e710aeaaab65953bf5a3&oe=5F7FE76B,0.0,,2567744773342633,"Happy Monday, HSA! #mememondays #HSACleveland #weareconcept",https://facebook.com/story.php?story_fbid=2567744773342633&id=184058048377996,,0.0,"Happy Monday, HSA! #mememondays #HSACleveland #weareconcept",2019-11-04 14:35:40,,
167,1.0,https://scontent.fbna1-2.fna.fbcdn.net/v/t1.0-9/75328693_2567225330061244_3055132450939207680_n.png?_nc_cat=101&_nc_sid=8024bb&_nc_ohc=9mqeNM1zowcAX_Ws_Cv&_nc_ht=scontent.fbna1-2.fna&oh=5ed15556c5447df876cab6ea7dbd46ba&oe=5F839A8D,6.0,,2567225596727884,Reminder there is No School tomorrow November 5. #HSACHS #govote #everyvotecounts #WeAreConcept,https://facebook.com/story.php?story_fbid=2567225596727884&id=184058048377996,,0.0,Reminder there is No School tomorrow November 5. #HSACHS #govote #everyvotecounts #WeAreConcept,2019-11-04 09:23:58,,
168,0.0,,3.0,,2563735653743545,A beautiful and chilly evening on Lake Michigan! ゐ#pto #chicago #conceptschools,,,0.0,A beautiful and chilly evening on Lake Michigan! ゐ#pto #chicago #conceptschools,2019-11-02 19:08:04,https://video.fbna1-2.fna.fbcdn.net/v/t42.9040-2/76164186_2448952252057138_253655064785190912_n.mp4?_nc_cat=106&_nc_sid=985c63&efg=eyJ2ZW5jb2RlX3RhZyI6InN2ZV9zZCJ9&_nc_ohc=hB7cRqSQ4SsAX-dhmst&_nc_ht=video.fbna1-2.fna&oh=ef38082e4a121d06df5a677f1a39b7c6&oe=5F5C4BCA,
169,0.0,https://scontent.fbna1-2.fna.fbcdn.net/v/t1.0-9/fr/cp0/e15/q65/74839816_2563773770406400_2506355644781559808_n.jpg?_nc_cat=102&_nc_sid=110474&_nc_ohc=g4SjfZsdZ14AX-FMYM-&_nc_ht=scontent.fbna1-2.fna&tp=14&oh=91b3cb38f7dc0a7b286e7d6071440202&oe=5F8020CE,4.0,,2563667940416983,All aboard the SeaDog! #conceptschools #pto,https://facebook.com/story.php?story_fbid=2563667940416983&id=184058048377996,,0.0,All aboard the SeaDog! #conceptschools #pto,2019-11-02 18:13:43,,
170,0.0,https://scontent.fbna1-1.fna.fbcdn.net/v/t1.0-9/fr/cp0/e15/q65/74438963_2563328610450916_634455476657979392_n.jpg?_nc_cat=105&_nc_sid=110474&_nc_ohc=rd4hfVGxtJwAX-0Tw3H&_nc_ht=scontent.fbna1-1.fna&tp=14&oh=4b5c2abb5a9b710af278db6293661f52&oe=5F804299,9.0,,2563164787133965,Taking a tour of Concept Schools Headquarters! #pto #conceptschools,https://facebook.com/story.php?story_fbid=2563164787133965&id=184058048377996,,0.0,Taking a tour of Concept Schools Headquarters! #pto #conceptschools,2019-11-02 12:26:39,,
171,0.0,https://scontent.fbna1-2.fna.fbcdn.net/v/t1.0-9/fr/cp0/e15/q65/75610887_2563009960482781_1869026581599485952_n.jpg?_nc_cat=111&_nc_sid=110474&_nc_ohc=p81SGUE_bfgAX-j8Ygq&_nc_ht=scontent.fbna1-2.fna&tp=14&oh=bd332b6441771ea0e01eaff2189c1141&oe=5F82D37A,4.0,,2563021123814998,Mr. Duman is teaching our Parent Teacher Organization about Concept Schools formula for success!   З  #weareconcept #hsaclevelandhigh #pto #conceptschools,https://facebook.com/story.php?story_fbid=2563021123814998&id=184058048377996,,0.0,Mr. Duman is teaching our Parent Teacher Organization about Concept Schools formula for success!   З  #weareconcept #hsaclevelandhigh #pto #conceptschools,2019-11-02 11:05:31,,
172,0.0,https://scontent.fbna1-2.fna.fbcdn.net/v/t1.0-9/fr/cp0/e15/q65/75339391_2561851297265314_6033939003701460992_n.jpg?_nc_cat=101&_nc_sid=110474&_nc_ohc=oNE998ZvUKwAX8asAyU&_nc_ht=scontent.fbna1-2.fna&tp=14&oh=18ed6551d03517221674d7eb2a5518fa&oe=5F829993,9.0,,2561855487264895,HSAs Parent Teacher Organization loves Chicago deep dish pizza! わわWere looking forward to an exciting weekend in Chicago!,https://facebook.com/story.php?story_fbid=2561855487264895&id=184058048377996,,0.0,HSAs Parent Teacher Organization loves Chicago deep dish pizza! わわWere looking forward to an exciting weekend in Chicago!,2019-11-01 21:59:31,,
173,0.0,https://scontent.fbna1-2.fna.fbcdn.net/v/t1.0-9/fr/cp0/e15/q65/75398071_2561145794002531_3327576275362512896_o.jpg?_nc_cat=101&_nc_sid=8024bb&_nc_ohc=ftN-Dp2apNMAX-wdIf_&_nc_ht=scontent.fbna1-2.fna&tp=14&oh=033822459e7485468c3c844411bbc41f&oe=5F81CEED,5.0,https://www.youtube.com/watch?v=4Lb-6rxZxx0,2561189163998194,"Today in Mr. Nagelski's class students learned about the Monty Hall Paradox. Students participated in a probability exercise choosing 1 of 3 doors for a chance to win a goat or candy. Click on the link to learn more about this exercise!
https://www.youtube.com/watch?v=4Lb-6rxZxx0",https://facebook.com/story.php?story_fbid=2561189163998194&id=184058048377996,,0.0,"Today in Mr. Nagelski's class students learned about the Monty Hall Paradox. Students participated in a probability exercise choosing 1 of 3 doors for a chance to win a goat or candy. Click on the link to learn more about this exercise!
https://www.youtube.com/watch?v=4Lb-6rxZxx0",2019-11-01 13:43:05,,
174,1.0,https://scontent.fbna1-1.fna.fbcdn.net/v/t1.0-9/fr/cp0/e15/q65/74843429_2561020350681742_6383816926648336384_o.jpg?_nc_cat=107&_nc_sid=9e2e56&_nc_ohc=QCx1fTZyV6AAX-C1Qx7&_nc_ht=scontent.fbna1-1.fna&tp=14&oh=adf18e26a9faa27298e2d7608f7da60b&oe=5F816492,4.0,,2561021190681658,To wrap up October we announced the winners of our spooky door competition... congratulations to first place winner Ms. Baldwin!,https://facebook.com/story.php?story_fbid=2561021190681658&id=184058048377996,,0.0,To wrap up October we announced the winners of our spooky door competition... congratulations to first place winner Ms. Baldwin!,2019-11-01 12:00:42,,
175,0.0,,0.0,,2560768630706914,Check out this great STEM event! #funwitystemfridays #HSACHS #WeAreConcept,https://facebook.com/story.php?story_fbid=2560768630706914&id=184058048377996,"SAT, NOV 2, 2019
Maker Faire Cleveland 2019",0.0,"Check out this great STEM event! #funwitystemfridays #HSACHS #WeAreConcept

SAT, NOV 2, 2019
Maker Faire Cleveland 2019",2019-11-01 09:40:13,,
176,3.0,https://scontent.fbna1-2.fna.fbcdn.net/v/t1.0-9/fr/cp0/e15/q65/74613719_2560759744041136_3016135762799230976_n.jpg?_nc_cat=103&_nc_sid=8024bb&_nc_ohc=I70clmgenswAX9z6kyX&_nc_ht=scontent.fbna1-2.fna&tp=14&oh=cfda3e2a62806345a8efd5fb849dbb5f&oe=5F828AF9,9.0,,2560762804040830,"Congrats to Teacher of the Month for October, Mrs. Fisher! Shout out to Teacher of the Month for August, SFC Dejesus & September, Ms. Mitchell.",https://facebook.com/story.php?story_fbid=2560762804040830&id=184058048377996,,0.0,"Congrats to Teacher of the Month for October, Mrs. Fisher! Shout out to Teacher of the Month for August, SFC Dejesus & September, Ms. Mitchell.",2019-11-01 09:37:17,,
177,0.0,https://scontent.fbna1-2.fna.fbcdn.net/v/t1.0-9/fr/cp0/e15/q65/76190534_2559336624183448_5607129154102231040_n.jpg?_nc_cat=111&_nc_sid=2d5d41&_nc_ohc=t1qdRIyDIIsAX_Y9UJ_&_nc_ht=scontent.fbna1-2.fna&tp=14&oh=f176a9d9392fd06c08c1039706cbd2eb&oe=5F81D967,2.0,,2559336620850115,Happy Halloween,,,0.0,Happy Halloween,2019-10-31 17:13:54,,
178,1.0,https://scontent.fbna1-1.fna.fbcdn.net/v/t1.0-9/fr/cp0/e15/q65/76732203_2558546074262503_8834940790946922496_o.jpg?_nc_cat=110&_nc_sid=8024bb&_nc_ohc=KRBgsVJDRk8AX8oF1XT&_nc_ht=scontent.fbna1-1.fna&tp=14&oh=722fdfce61dee07d21c09c7fb163c680&oe=5F835258,7.0,,2558551257595318,"This week homeroom students and teachers participated in the Spooky Door decoration challenge. The results are in!!!!

1st Place - Ms. Baldwin Room 304
2nd Place - Ms. Mitchell Room 203
3rd Place - Ms. Woodall Room 308

Congrats to the winners and thank you to all the students and teachers who participated!!",https://facebook.com/story.php?story_fbid=2558551257595318&id=184058048377996,,0.0,"This week homeroom students and teachers participated in the Spooky Door decoration challenge. The results are in!!!!

1st Place - Ms. Baldwin Room 304
2nd Place - Ms. Mitchell Room 203
3rd Place - Ms. Woodall Room 308

Congrats to the winners and thank you to all the students and teachers who participated!!",2019-10-31 09:37:37,,
179,0.0,https://scontent.fbna1-1.fna.fbcdn.net/v/t1.0-9/72685084_2558476014269509_6554875286385590272_n.png?_nc_cat=108&_nc_sid=8024bb&_nc_ohc=DSQC_YudVfAAX9pigDW&_nc_ht=scontent.fbna1-1.fna&oh=ebee5c5fcde855f4e5bc6058805dc545&oe=5F7FDF57,5.0,,2558476067602837,,https://facebook.com/story.php?story_fbid=2558476067602837&id=184058048377996,,0.0,,2019-10-31 09:01:17,,
180,0.0,,3.0,,2556622687788175,,https://facebook.com/story.php?story_fbid=2556622687788175&id=184058048377996,,0.0,,2019-10-30 11:22:08,,
181,0.0,https://scontent.fbna1-1.fna.fbcdn.net/v/t1.0-9/fr/cp0/e15/q65/73122870_2556571531126624_7544247073470676992_o.jpg?_nc_cat=110&_nc_sid=8024bb&_nc_ohc=rVnQZjc3tWcAX-2l8b5&_nc_ht=scontent.fbna1-1.fna&tp=14&oh=9b46f85d2f578138476100b190680fc8&oe=5F833FF5,5.0,,2556572137793230,"Today in Mr. Guler's Forensic class, they were working with fabrics, examining fibers under the microscopes. Students said they enjoyed this experiment.",https://facebook.com/story.php?story_fbid=2556572137793230&id=184058048377996,,0.0,"Today in Mr. Guler's Forensic class, they were working with fabrics, examining fibers under the microscopes. Students said they enjoyed this experiment.",2019-10-30 10:50:58,,
182,0.0,,0.0,,2554498788000565,"Are you ready for Halloween? Here are some cute snack ideas. #TasteyTuesday #HSACHS #WeAreConcept
https://www.facebook.com/buzzfeedtasty/videos/2447134678705320/",https://facebook.com/story.php?story_fbid=2554498788000565&id=184058048377996,"Tasty
October 15, 2019 at 11:00 AM 路

From our friends at Nifty: Make some spooky Halloween party treats with these simple upgrades you can do to ordinary store-bought snacks!",0.0,"Are you ready for Halloween? Here are some cute snack ideas. #TasteyTuesday #HSACHS #WeAreConcept
https://www.facebook.com/buzzfeedtasty/videos/2447134678705320/

Tasty
October 15, 2019 at 11:00 AM 路

From our friends at Nifty: Make some spooky Halloween party treats with these simple upgrades you can do to ordinary store-bought snacks!",2019-10-29 10:39:52,https://video.fbna1-1.fna.fbcdn.net/v/t42.9040-2/10000000_677055896117609_8710685853770317824_n.mp4?_nc_cat=105&_nc_sid=985c63&efg=eyJ2ZW5jb2RlX3RhZyI6InN2ZV9zZCJ9&_nc_ohc=in4zwxbHU34AX-zXgOg&_nc_ht=video.fbna1-1.fna&oh=5f050b4e1ef968763ec67eeb7311c019&oe=5F5C41F5,
