,comments,image,likes,link,post_id,post_text,post_url,shared_text,shares,text,time,video,video_thumbnail
0,0.0,,0.0,http://www.jctigers.org/protected/EventView.aspx?id=822GG3BAY,1643748329118968,"Sat., September 12 - HS Volleyball @ RIverside - follow link for further information",https://facebook.com/story.php?story_fbid=1643748329118968&id=135525609941255,"JCTIGERS.ORG
Event Details",0.0,"Sat., September 12 - HS Volleyball @ RIverside - follow link for further information

JCTIGERS.ORG
Event Details",2020-09-11 06:44:58,,
1,0.0,,1.0,http://www.jctigers.org/protected/EventView.aspx?id=822GG3YGY,1643747759119025,"Sat., September 12 - Cross Country Bearcat Invitational - follow link for further information",https://facebook.com/story.php?story_fbid=1643747759119025&id=135525609941255,"JCTIGERS.ORG
Event Details",0.0,"Sat., September 12 - Cross Country Bearcat Invitational - follow link for further information

JCTIGERS.ORG
Event Details",2020-09-11 06:44:04,,
2,0.0,,1.0,http://www.jctigers.org/protected/ArticleView.aspx?iid=5I02BI&dasi=4GB3B,1643746952452439,Follow link to website to view,https://facebook.com/story.php?story_fbid=1643746952452439&id=135525609941255,"JCTIGERS.ORG
Announcements 9/11/2020",0.0,"Follow link to website to view

JCTIGERS.ORG
Announcements 9/11/2020",2020-09-11 06:42:44,,
3,0.0,,0.0,http://www.jctigers.org/protected/ArticleView.aspx?iid=5I0PUY&dasi=4GB3B,1643746295785838,Follow link to website to view,https://facebook.com/story.php?story_fbid=1643746295785838&id=135525609941255,"JCTIGERS.ORG
JC Fall 2020 Activity Updates",0.0,"Follow link to website to view

JCTIGERS.ORG
JC Fall 2020 Activity Updates",2020-09-11 06:41:59,,
4,0.0,,0.0,http://www.jctigers.org/protected/EventView.aspx?id=82II2PAU2,1643745809119220,Follow link to website for 9/11/2020 school lunch menu,https://facebook.com/story.php?story_fbid=1643745809119220&id=135525609941255,"JCTIGERS.ORG
Event Details",0.0,"Follow link to website for 9/11/2020 school lunch menu

JCTIGERS.ORG
Event Details",2020-09-11 06:41:18,,
5,0.0,,0.0,http://www.jctigers.org/protected/EventView.aspx?id=822GG3G2I,1642747449219056,9/10/2020 Soccer - follow link for additional information,https://facebook.com/story.php?story_fbid=1642747449219056&id=135525609941255,"JCTIGERS.ORG
Event Details",0.0,"9/10/2020 Soccer - follow link for additional information

JCTIGERS.ORG
Event Details",2020-09-10 06:14:23,,
6,0.0,,0.0,http://www.jctigers.org/protected/EventView.aspx?id=822GG3G20,1642747012552433,9/10/2020 Golf Match - follow link for additonal information,https://facebook.com/story.php?story_fbid=1642747012552433&id=135525609941255,"JCTIGERS.ORG
Event Details",0.0,"9/10/2020 Golf Match - follow link for additonal information

JCTIGERS.ORG
Event Details",2020-09-10 06:13:38,,
7,0.0,,0.0,http://www.jctigers.org/protected/ArticleView.aspx?iid=5I0PG0&dasi=4GB3B,1642746422552492,Link to website for today's school announcements,https://facebook.com/story.php?story_fbid=1642746422552492&id=135525609941255,"JCTIGERS.ORG
Announcements 9/10/2020",0.0,"Link to website for today's school announcements

JCTIGERS.ORG
Announcements 9/10/2020",2020-09-10 06:12:41,,
8,0.0,,0.0,http://www.jctigers.org/protected/EventView.aspx?id=82II2PAUI,1642746105885857,"Lunch menu 9/10/2020, click link to website",https://facebook.com/story.php?story_fbid=1642746105885857&id=135525609941255,"JCTIGERS.ORG
Event Details",0.0,"Lunch menu 9/10/2020, click link to website

JCTIGERS.ORG
Event Details",2020-09-10 06:12:10,,
9,0.0,,0.0,http://www.jctigers.org/protected/ArticleView.aspx?iid=5I0IB2&dasi=4GB3B,1641922239301577,Link to today's school announcements on website,https://facebook.com/story.php?story_fbid=1641922239301577&id=135525609941255,"JCTIGERS.ORG
Announcements 9/9/2020",0.0,"Link to today's school announcements on website

JCTIGERS.ORG
Announcements 9/9/2020",2020-09-09 06:14:13,,
10,0.0,,0.0,http://www.jctigers.org/protected/EventView.aspx?id=82II2PAUY,1641921895968278,Link to school lunch menu for 9/9/2020,https://facebook.com/story.php?story_fbid=1641921895968278&id=135525609941255,"JCTIGERS.ORG
Event Details",0.0,"Link to school lunch menu for 9/9/2020

JCTIGERS.ORG
Event Details",2020-09-09 06:13:37,,
11,0.0,,0.0,http://www.jctigers.org/protected/EventView.aspx?id=82P00IIP2,1641089796051488,HS Volleyballl 9/8/2020 - follow link for further information,https://facebook.com/story.php?story_fbid=1641089796051488&id=135525609941255,"JCTIGERS.ORG
Event Details",0.0,"HS Volleyballl 9/8/2020 - follow link for further information

JCTIGERS.ORG
Event Details",2020-09-08 06:53:02,,
12,0.0,,0.0,http://www.jctigers.org/protected/EventView.aspx?id=82P00I3I0,1641088812718253,JH Volleyball - 9/8/2020 - follow link for further information,https://facebook.com/story.php?story_fbid=1641088812718253&id=135525609941255,"JCTIGERS.ORG
Event Details",0.0,"JH Volleyball - 9/8/2020 - follow link for further information

JCTIGERS.ORG
Event Details",2020-09-08 06:52:29,,
13,0.0,,0.0,http://www.jctigers.org/protected/EventView.aspx?id=82P00I3U0,1641087732718361,Soccer - 9/8/2020 - follow link for further information,https://facebook.com/story.php?story_fbid=1641087732718361&id=135525609941255,"JCTIGERS.ORG
Event Details",0.0,"Soccer - 9/8/2020 - follow link for further information

JCTIGERS.ORG
Event Details",2020-09-08 06:51:52,,
14,0.0,,0.0,http://www.jctigers.org/protected/EventView.aspx?id=82P00I302,1641086989385102,Golf - 9/8 2020 - follow link for further information,https://facebook.com/story.php?story_fbid=1641086989385102&id=135525609941255,"JCTIGERS.ORG
Event Details",0.0,"Golf - 9/8 2020 - follow link for further information

JCTIGERS.ORG
Event Details",2020-09-08 06:51:05,,
15,0.0,,2.0,http://www.jctigers.org/protected/ArticleView.aspx?iid=5I03A0&dasi=4GB3B,1641083002718834,Link to website for today's school announcements,https://facebook.com/story.php?story_fbid=1641083002718834&id=135525609941255,"JCTIGERS.ORG
Announcements 9/8/2020",0.0,"Link to website for today's school announcements

JCTIGERS.ORG
Announcements 9/8/2020",2020-09-08 06:46:54,,
16,0.0,,0.0,http://www.jctigers.org/protected/EventView.aspx?id=82II2PAUB,1641082272718907,Follow link for 9/8/2020 Lunch menu,https://facebook.com/story.php?story_fbid=1641082272718907&id=135525609941255,"JCTIGERS.ORG
Event Details",0.0,"Follow link for 9/8/2020 Lunch menu

JCTIGERS.ORG
Event Details",2020-09-08 06:46:18,,
17,0.0,,0.0,http://www.jctigers.org/protected/ArticleView.aspx?iid=5I03Y0&dasi=4GB3B,1637518806408587,Link to the school website for today's announcements,https://facebook.com/story.php?story_fbid=1637518806408587&id=135525609941255,"JCTIGERS.ORG
Announcements, September 4, 2020",0.0,"Link to the school website for today's announcements

JCTIGERS.ORG
Announcements, September 4, 2020",2020-09-04 06:02:44,,
18,0.0,,0.0,http://www.jctigers.org/protected/EventView.aspx?id=82II2PA00,1637516613075473,"Lunch menu for Friday, September 4 - follow the link below",https://facebook.com/story.php?story_fbid=1637516613075473&id=135525609941255,"JCTIGERS.ORG
Event Details",0.0,"Lunch menu for Friday, September 4 - follow the link below

JCTIGERS.ORG
Event Details",2020-09-04 06:00:13,,
19,0.0,,0.0,http://www.jctigers.org/protected/EventView.aspx?id=82P3AUA2I,1636385286521939,9/3/2020 - Soccer @ Spencerville - 7pm - follow link for additional information,https://facebook.com/story.php?story_fbid=1636385286521939&id=135525609941255,"JCTIGERS.ORG
Event Details",0.0,"9/3/2020 - Soccer @ Spencerville - 7pm - follow link for additional information

JCTIGERS.ORG
Event Details",2020-09-03 06:35:33,,
20,0.0,,0.0,http://www.jctigers.org/protected/EventView.aspx?id=82P3AUA2Y,1636384749855326,9/3/2020 HS Volleyball vs. Houston - 5:30pm - follow link for additional information,https://facebook.com/story.php?story_fbid=1636384749855326&id=135525609941255,"JCTIGERS.ORG
Event Details",0.0,"9/3/2020 HS Volleyball vs. Houston - 5:30pm - follow link for additional information

JCTIGERS.ORG
Event Details",2020-09-03 06:34:40,,
21,0.0,,0.0,http://www.jctigers.org/protected/EventView.aspx?id=82P3AUA22,1636384289855372,9/3/2020 - JH Volleyball @ Houston - 5pm - follow link for additional information,https://facebook.com/story.php?story_fbid=1636384289855372&id=135525609941255,"JCTIGERS.ORG
Event Details",0.0,"9/3/2020 - JH Volleyball @ Houston - 5pm - follow link for additional information

JCTIGERS.ORG
Event Details",2020-09-03 06:33:54,,
22,0.0,,0.0,http://www.jctigers.org/protected/EventView.aspx?id=82P3B3B0Y,1636379919855809,9/3/2020 - Golf Match - follow link below for additional information,https://facebook.com/story.php?story_fbid=1636379919855809&id=135525609941255,"JCTIGERS.ORG
Event Details",0.0,"9/3/2020 - Golf Match - follow link below for additional information

JCTIGERS.ORG
Event Details",2020-09-03 06:25:55,,
23,0.0,https://scontent.fbna1-2.fna.fbcdn.net/v/t1.0-9/fr/cp0/e15/q65/118837761_1636378286522639_2713735183755000522_o.jpg?_nc_cat=111&_nc_sid=8024bb&_nc_ohc=Q8UljFq4TwcAX-cv8o7&_nc_ht=scontent.fbna1-2.fna&tp=14&oh=3e3dd67b8af60fdab090dca1bb66d1c7&oe=5F80B03C,12.0,,1636378526522615,JC Tiger Plates on sale now $20 each or 2/$30. Stop by the school office and purchase yours today!!! Sponsored by the JC Athletic Boosters.,https://facebook.com/story.php?story_fbid=1636378526522615&id=135525609941255,,0.0,JC Tiger Plates on sale now $20 each or 2/$30. Stop by the school office and purchase yours today!!! Sponsored by the JC Athletic Boosters.,2020-09-03 06:23:11,,
24,0.0,,2.0,http://www.jctigers.org/protected/ArticleView.aspx?iid=5I0YA0&dasi=4GB3B,1636367229857078,Follow link below for today's school announcements,https://facebook.com/story.php?story_fbid=1636367229857078&id=135525609941255,"JCTIGERS.ORG
Announcements September 3, 2020",0.0,"Follow link below for today's school announcements

JCTIGERS.ORG
Announcements September 3, 2020",2020-09-03 06:03:27,,
25,0.0,,0.0,http://www.jctigers.org/protected/EventView.aspx?id=82II2PAP2,1636366893190445,"Today's school lunch menu, follow the link below",https://facebook.com/story.php?story_fbid=1636366893190445&id=135525609941255,"JCTIGERS.ORG
Event Details",0.0,"Today's school lunch menu, follow the link below

JCTIGERS.ORG
Event Details",2020-09-03 06:02:48,,
26,0.0,,0.0,http://www.jctigers.org/protected/ArticleView.aspx?iid=5I0G00&dasi=4GB3B,1635457643281370,Link to website for today's school announcements,https://facebook.com/story.php?story_fbid=1635457643281370&id=135525609941255,"JCTIGERS.ORG
Announcements 9/2/2020",0.0,"Link to website for today's school announcements

JCTIGERS.ORG
Announcements 9/2/2020",2020-09-02 06:18:10,,
27,0.0,,0.0,http://www.jctigers.org/protected/EventView.aspx?id=82II2PAPI,1635447063282428,"9/2/2020 Lunch, follow link to website",https://facebook.com/story.php?story_fbid=1635447063282428&id=135525609941255,"JCTIGERS.ORG
Event Details",0.0,"9/2/2020 Lunch, follow link to website

JCTIGERS.ORG
Event Details",2020-09-02 06:01:01,,
28,0.0,,3.0,http://www.jctigers.org/protected/ArticleView.aspx?iid=5I0G3Y&dasi=4GB3B,1634454573381677,Link to website for today's school announcements,https://facebook.com/story.php?story_fbid=1634454573381677&id=135525609941255,"JCTIGERS.ORG
Announcements 9/1/2020",0.0,"Link to website for today's school announcements

JCTIGERS.ORG
Announcements 9/1/2020",2020-09-01 06:03:30,,
29,0.0,,0.0,http://www.jctigers.org/protected/EventView.aspx?id=82II2PAPY,1634453873381747,Link to website for 9/1/2020 Lunch Menu,https://facebook.com/story.php?story_fbid=1634453873381747&id=135525609941255,"JCTIGERS.ORG
Event Details",0.0,"Link to website for 9/1/2020 Lunch Menu

JCTIGERS.ORG
Event Details",2020-09-01 06:02:49,,
30,0.0,,4.0,,1633751493451985,"PLEASE NOTE: Volleyball Games scheduled on Thursday, September 10th have been cancelled. JCHS vs. Russia at Jackson Center and JCJH @ Russia. We will post rescheduled dates at a later date.",https://facebook.com/story.php?story_fbid=1633751493451985&id=135525609941255,,0.0,"PLEASE NOTE: Volleyball Games scheduled on Thursday, September 10th have been cancelled. JCHS vs. Russia at Jackson Center and JCJH @ Russia. We will post rescheduled dates at a later date.",2020-08-31 13:56:04,,
31,0.0,,0.0,http://www.jctigers.org/protected/EventView.aspx?id=82PB3I2II,1633427046817763,"HS Volleyball @ Fort Loramie, Tuesday, September 1st - 5:30pm, click link for additional information",https://facebook.com/story.php?story_fbid=1633427046817763&id=135525609941255,"JCTIGERS.ORG
Event Details",0.0,"HS Volleyball @ Fort Loramie, Tuesday, September 1st - 5:30pm, click link for additional information

JCTIGERS.ORG
Event Details",2020-08-31 06:13:46,,
32,0.0,,0.0,http://www.jctigers.org/protected/EventView.aspx?id=82PB3I2IY,1633426226817845,"JH Volleyball vs. Fort Loramie, Tuesday, September 1st @ 5pm, click link for further information",https://facebook.com/story.php?story_fbid=1633426226817845&id=135525609941255,"JCTIGERS.ORG
Event Details",0.0,"JH Volleyball vs. Fort Loramie, Tuesday, September 1st @ 5pm, click link for further information

JCTIGERS.ORG
Event Details",2020-08-31 06:12:47,,
33,0.0,,0.0,http://www.jctigers.org/protected/EventView.aspx?id=82IUP0IBY,1633421063485028,"Golf - Tuesday, September 1st 4pm view link for additional information",https://facebook.com/story.php?story_fbid=1633421063485028&id=135525609941255,"JCTIGERS.ORG
Event Details",0.0,"Golf - Tuesday, September 1st 4pm view link for additional information

JCTIGERS.ORG
Event Details",2020-08-31 06:05:54,,
34,0.0,,0.0,http://www.jctigers.org/protected/ArticleView.aspx?iid=5I0B20&dasi=4GB3B,1633419930151808,Link to website for today's school announcements,https://facebook.com/story.php?story_fbid=1633419930151808&id=135525609941255,"JCTIGERS.ORG
Announcements 08/31/2020",0.0,"Link to website for today's school announcements

JCTIGERS.ORG
Announcements 08/31/2020",2020-08-31 06:04:24,,
35,1.0,,5.0,http://www.jctigers.org/protected/ArticleView.aspx?iid=5I0BI0&dasi=4GB3B,1631182287042239,Follow the link below for results,https://facebook.com/story.php?story_fbid=1631182287042239&id=135525609941255,"JCTIGERS.ORG
Cheerleading Squad 2020-2021",5.0,"Follow the link below for results

JCTIGERS.ORG
Cheerleading Squad 2020-2021",2020-08-28 20:18:47,,
36,1.0,,4.0,http://www.jctigers.org/protected/ArticleView.aspx?iid=5I0B3Y&dasi=4GB3B,1630960717064396,Link to website below for latest back to school update on COVID and Case Protocol,https://facebook.com/story.php?story_fbid=1630960717064396&id=135525609941255,"JCTIGERS.ORG
Back to School #5 COVID Case Protocol",2.0,"Link to website below for latest back to school update on COVID and Case Protocol

JCTIGERS.ORG
Back to School #5 COVID Case Protocol",2020-08-28 14:13:41,,
37,0.0,,0.0,http://www.jctigers.org/protected/ArticleView.aspx?iid=5I0BBY&dasi=4GB3B,1630635767096891,Link to today's school announcements,https://facebook.com/story.php?story_fbid=1630635767096891&id=135525609941255,"JCTIGERS.ORG
Announcements 8/28/2020",0.0,"Link to today's school announcements

JCTIGERS.ORG
Announcements 8/28/2020",2020-08-28 06:12:05,,
38,0.0,,0.0,http://www.jctigers.org/protected/EventView.aspx?id=82I202YGB,1630624567098011,"HS Soccer Varsity Only - Monday, 8/31/2020 - follow link for further information",https://facebook.com/story.php?story_fbid=1630624567098011&id=135525609941255,"JCTIGERS.ORG
Event Details",0.0,"HS Soccer Varsity Only - Monday, 8/31/2020 - follow link for further information

JCTIGERS.ORG
Event Details",2020-08-28 05:52:42,,
39,0.0,,0.0,http://www.jctigers.org/protected/EventView.aspx?id=82I30032Y,1630620753765059,"Golf - Monday, 8/31/2020 - click link for further information",https://facebook.com/story.php?story_fbid=1630620753765059&id=135525609941255,"JCTIGERS.ORG
Event Details",0.0,"Golf - Monday, 8/31/2020 - click link for further information

JCTIGERS.ORG
Event Details",2020-08-28 05:45:15,,
40,0.0,,0.0,http://www.jctigers.org/protected/EventView.aspx?id=82I300I0Y,1630616273765507,"HS Volleyball vs. Lehman, Saturday 8/29/2020, click link below for additional information",https://facebook.com/story.php?story_fbid=1630616273765507&id=135525609941255,"JCTIGERS.ORG
Event Details",0.0,"HS Volleyball vs. Lehman, Saturday 8/29/2020, click link below for additional information

JCTIGERS.ORG
Event Details",2020-08-28 05:38:03,,
41,0.0,,0.0,http://www.jctigers.org/protected/EventView.aspx?id=82I3003BB,1630614720432329,"JH Volleyball, Saturday, 8/29/2020 at Lehman, click link below for additional information",https://facebook.com/story.php?story_fbid=1630614720432329&id=135525609941255,"JCTIGERS.ORG
Event Details",0.0,"JH Volleyball, Saturday, 8/29/2020 at Lehman, click link below for additional information

JCTIGERS.ORG
Event Details",2020-08-28 05:35:10,,
42,0.0,,3.0,http://www.jctigers.org/protected/EventView.aspx?id=82I300IIY,1629783733848761,"Cross Country Meet @ Versailles. Saturday 8/29, follow link to website for additional information",https://facebook.com/story.php?story_fbid=1629783733848761&id=135525609941255,"JCTIGERS.ORG
Event Details",0.0,"Cross Country Meet @ Versailles. Saturday 8/29, follow link to website for additional information

JCTIGERS.ORG
Event Details",2020-08-27 07:28:49,,
43,0.0,,0.0,http://www.jctigers.org/protected/ArticleView.aspx?iid=5IAUAY&dasi=4GB3B,1629778710515930,Link to website for today's announcements,https://facebook.com/story.php?story_fbid=1629778710515930&id=135525609941255,"JCTIGERS.ORG
Announcements 8/27/2020",0.0,"Link to website for today's announcements

JCTIGERS.ORG
Announcements 8/27/2020",2020-08-27 07:18:52,,
44,0.0,,0.0,http://www.jctigers.org/protected/EventView.aspx?id=82I300I0I,1628853927275075,"HS Volleyball 8/27/2020 @ 5:30pm, follow link for additional information",https://facebook.com/story.php?story_fbid=1628853927275075&id=135525609941255,"JCTIGERS.ORG
Event Details",0.0,"HS Volleyball 8/27/2020 @ 5:30pm, follow link for additional information

JCTIGERS.ORG
Event Details",2020-08-26 06:23:01,,
45,0.0,,1.0,http://www.jctigers.org/protected/EventView.aspx?id=82I3003PB,1628853390608462,"JH Volleyball 8/27/2020 @ 5pm, follow link for additional information",https://facebook.com/story.php?story_fbid=1628853390608462&id=135525609941255,"JCTIGERS.ORG
Event Details",0.0,"JH Volleyball 8/27/2020 @ 5pm, follow link for additional information

JCTIGERS.ORG
Event Details",2020-08-26 06:22:06,,
46,0.0,,1.0,http://www.jctigers.org/protected/EventView.aspx?id=82I300IGI,1628852847275183,"Soccer 8/27/2020 @ 5pm, follow link below for additional information",https://facebook.com/story.php?story_fbid=1628852847275183&id=135525609941255,"JCTIGERS.ORG
Event Details",0.0,"Soccer 8/27/2020 @ 5pm, follow link below for additional information

JCTIGERS.ORG
Event Details",2020-08-26 06:21:13,,
47,0.0,,0.0,http://www.jctigers.org/protected/EventView.aspx?id=82I300IG2,1628852457275222,"Golf - August 27th at 4pm, follow link below for further information",https://facebook.com/story.php?story_fbid=1628852457275222&id=135525609941255,"JCTIGERS.ORG
Event Details",0.0,"Golf - August 27th at 4pm, follow link below for further information

JCTIGERS.ORG
Event Details",2020-08-26 06:20:30,,
48,0.0,,2.0,http://www.jctigers.org/protected/ArticleView.aspx?iid=5IAU3B&dasi=4GB3B,1628851557275312,Link to webpage below for today's school announcements,https://facebook.com/story.php?story_fbid=1628851557275312&id=135525609941255,"JCTIGERS.ORG
Announcements 8/26/2020",0.0,"Link to webpage below for today's school announcements

JCTIGERS.ORG
Announcements 8/26/2020",2020-08-26 06:19:00,,
49,0.0,,2.0,http://www.jctigers.org/protected/ArticleView.aspx?iid=5IA0A2&dasi=4GB3B,1627929657367502,Link to website below for today's announcements,https://facebook.com/story.php?story_fbid=1627929657367502&id=135525609941255,"JCTIGERS.ORG
Announcements 8/25/2020",0.0,"Link to website below for today's announcements

JCTIGERS.ORG
Announcements 8/25/2020",2020-08-25 06:29:12,,
50,0.0,,2.0,http://www.jctigers.org/protected/ArticleView.aspx?iid=5IA0P2&dasi=4GB3B,1627303734096761,Click on link to website below,https://facebook.com/story.php?story_fbid=1627303734096761&id=135525609941255,"JCTIGERS.ORG
Announcements 8/24/2020",0.0,"Click on link to website below

JCTIGERS.ORG
Announcements 8/24/2020",2020-08-24 13:22:09,,
51,0.0,,1.0,http://www.jctigers.org/protected/EventView.aspx?id=823UBAG20,1623949671098834,"Link to website for HS Volleyball @ Marion Local on Tuesday, August 25 for spectator/ticket information",https://facebook.com/story.php?story_fbid=1623949671098834&id=135525609941255,"JCTIGERS.ORG
Event Details",0.0,"Link to website for HS Volleyball @ Marion Local on Tuesday, August 25 for spectator/ticket information

JCTIGERS.ORG
Event Details",2020-08-21 14:18:02,,
52,0.0,,2.0,http://www.jctigers.org/protected/EventView.aspx?id=8232G3PG0,1623544791139322,Link to website for 8/25/2020 Cross Country SCAL Preview information,https://facebook.com/story.php?story_fbid=1623544791139322&id=135525609941255,"JCTIGERS.ORG
Event Details",0.0,"Link to website for 8/25/2020 Cross Country SCAL Preview information

JCTIGERS.ORG
Event Details",2020-08-21 06:58:03,,
53,0.0,,0.0,http://www.jctigers.org/protected/EventView.aspx?id=8232G3PY2,1623543387806129,Link to website for Golf 8/24/2020,https://facebook.com/story.php?story_fbid=1623543387806129&id=135525609941255,"JCTIGERS.ORG
Event Details",0.0,"Link to website for Golf 8/24/2020

JCTIGERS.ORG
Event Details",2020-08-21 06:56:00,,
54,0.0,,3.0,http://www.jctigers.org/protected/ArticleView.aspx?iid=5IAAA0&dasi=4GB3B,1623542401139561,Link to website,https://facebook.com/story.php?story_fbid=1623542401139561&id=135525609941255,"JCTIGERS.ORG
Announcements 8/21/2020",0.0,"Link to website

JCTIGERS.ORG
Announcements 8/21/2020",2020-08-21 06:54:46,,
55,0.0,,0.0,http://www.jctigers.org/protected/EventView.aspx?id=823AUUYPI,1622673677893100,"Saturday, August 22, Soccer Tournament TIcket Information, click below to go to website",https://facebook.com/story.php?story_fbid=1622673677893100&id=135525609941255,"JCTIGERS.ORG
Event Details",0.0,"Saturday, August 22, Soccer Tournament TIcket Information, click below to go to website

JCTIGERS.ORG
Event Details",2020-08-20 13:45:34,,
56,0.0,,0.0,http://www.jctigers.org/protected/EventView.aspx?id=823AUUYP2,1622672787893189,"Friday, August 21, Soccer Tournament TIcket Information, click below to go to website",https://facebook.com/story.php?story_fbid=1622672787893189&id=135525609941255,"JCTIGERS.ORG
Event Details",0.0,"Friday, August 21, Soccer Tournament TIcket Information, click below to go to website

JCTIGERS.ORG
Event Details",2020-08-20 13:44:53,,
57,0.0,,5.0,http://www.jctigers.org/protected/ArticleView.aspx?iid=5IAAPB&dasi=4GB3B,1622671671226634,Link to website for today's school announcements,https://facebook.com/story.php?story_fbid=1622671671226634&id=135525609941255,"JCTIGERS.ORG
Announcements 08/20/2020",0.0,"Link to website for today's school announcements

JCTIGERS.ORG
Announcements 08/20/2020",2020-08-20 13:43:50,,
58,1.0,,3.0,http://www.jctigers.org/Downloads/Back%20to%20School%20Letter_8_14_2020.pdf,1617275828432885,"Back to School Update on school website
http://www.jctigers.org/Downloads/Back%20to%20School%20Letter_8_14_2020.pdf",https://facebook.com/story.php?story_fbid=1617275828432885&id=135525609941255,"JCTIGERS.ORG
www.jctigers.org",0.0,"Back to School Update on school website
http://www.jctigers.org/Downloads/Back%20to%20School%20Letter_8_14_2020.pdf

JCTIGERS.ORG
www.jctigers.org",2020-08-14 15:36:19,,
59,0.0,,5.0,http://www.jctigers.org/Downloads/Aug2020_Website_Rev1.pdf,1616893025137832,August 2020 Back to School Newsletter now available on school website. http://www.jctigers.org/Downloads/Aug2020_Website_Rev1.pdf,https://facebook.com/story.php?story_fbid=1616893025137832&id=135525609941255,"JCTIGERS.ORG
www.jctigers.org",3.0,"August 2020 Back to School Newsletter now available on school website. http://www.jctigers.org/Downloads/Aug2020_Website_Rev1.pdf

JCTIGERS.ORG
www.jctigers.org",2020-08-14 06:08:45,,
60,2.0,,9.0,,1615405525286582,,https://facebook.com/story.php?story_fbid=1615405525286582&id=135525609941255,,0.0,,2020-08-12 11:09:07,,
61,0.0,,11.0,http://www.jctigers.org/protected/ArticleView.aspx?iid=5IA3UI&dasi=4GB3B,1611181529042315,Updated back to school information and parent checklist from Superintendent Bill Reichert available on the schools website newsfeed. Follow the link below http://www.jctigers.org/protected/ArticleView.aspx?iid=5IA3UI&dasi=4GB3B,https://facebook.com/story.php?story_fbid=1611181529042315&id=135525609941255,"JCTIGERS.ORG
Back to School #4",12.0,"Updated back to school information and parent checklist from Superintendent Bill Reichert available on the schools website newsfeed. Follow the link below http://www.jctigers.org/protected/ArticleView.aspx?iid=5IA3UI&dasi=4GB3B

JCTIGERS.ORG
Back to School #4",2020-08-07 13:10:14,,
62,0.0,,25.0,,1611179262375875,,https://facebook.com/story.php?story_fbid=1611179262375875&id=135525609941255,,0.0,,2020-08-07 13:08:11,,
63,0.0,,12.0,http://www.jctigers.org/Downloads/Back%20to%20School%20Letter_3_2020_21.pdf,1598534863640315,"Back to School COVID-19 Update available on our website, just click the link to view... http://www.jctigers.org/Downloads/Back%20to%20School%20Letter_3_2020_21.pdf",https://facebook.com/story.php?story_fbid=1598534863640315&id=135525609941255,"JCTIGERS.ORG
www.jctigers.org",20.0,"Back to School COVID-19 Update available on our website, just click the link to view... http://www.jctigers.org/Downloads/Back%20to%20School%20Letter_3_2020_21.pdf

JCTIGERS.ORG
www.jctigers.org",2020-07-23 16:36:46,,
64,1.0,,4.0,http://www.jctigers.org/Downloads/Parent%20Checklist%20-%20Start%20of%202020-21%20School%20Year.pdf,1592413567585778,"Link to website for Sports Parent Checklist
http://www.jctigers.org/Downloads/Parent%20Checklist%20-%20Start%20of%202020-21%20School%20Year.pdf",https://facebook.com/story.php?story_fbid=1592413567585778&id=135525609941255,"JCTIGERS.ORG
www.jctigers.org",4.0,"Link to website for Sports Parent Checklist
http://www.jctigers.org/Downloads/Parent%20Checklist%20-%20Start%20of%202020-21%20School%20Year.pdf

JCTIGERS.ORG
www.jctigers.org",2020-07-16 13:02:20,,
65,1.0,,14.0,http://www.jctigers.org/Downloads/Back%20to%20School%20Letter_2_2020_21.pdf,1592412227585912,"Link to website for Back to School information from the Superintendent
http://www.jctigers.org/Downloads/Back%20to%20School%20Letter_2_2020_21.pdf",https://facebook.com/story.php?story_fbid=1592412227585912&id=135525609941255,"JCTIGERS.ORG
www.jctigers.org",18.0,"Link to website for Back to School information from the Superintendent
http://www.jctigers.org/Downloads/Back%20to%20School%20Letter_2_2020_21.pdf

JCTIGERS.ORG
www.jctigers.org",2020-07-16 13:00:45,,
66,1.0,,11.0,http://www.jctigers.org/protected/ArticleView.aspx?iid=5I2AY0&dasi=4GB3B,1586466784847123,Link to website for results,https://facebook.com/story.php?story_fbid=1586466784847123&id=135525609941255,"JCTIGERS.ORG
FCCLA National Results",0.0,"Link to website for results

JCTIGERS.ORG
FCCLA National Results",2020-07-09 13:51:56,,
67,1.0,,14.0,,1584690345024767,REMINDER - Back to School Community Meeting tonight at 7PM in the Athletic Complex.,https://facebook.com/story.php?story_fbid=1584690345024767&id=135525609941255,,0.0,REMINDER - Back to School Community Meeting tonight at 7PM in the Athletic Complex.,2020-07-07 15:01:57,,
68,0.0,,8.0,http://www.jctigers.org/Downloads/June%202020%20Newsletter.pdf,1573100626183739,June Newsletter now available at the following link: http://www.jctigers.org/Downloads/June%202020%20Newsletter.pdf,https://facebook.com/story.php?story_fbid=1573100626183739&id=135525609941255,"JCTIGERS.ORG
www.jctigers.org",0.0,"June Newsletter now available at the following link: http://www.jctigers.org/Downloads/June%202020%20Newsletter.pdf

JCTIGERS.ORG
www.jctigers.org",2020-06-24 06:16:18,,
69,0.0,,3.0,,1565195606974241,"Attention Community: ""Elite 8 Basketball Shirts"" have arrived. If you placed an order, please come by the school office Monday thru Thursday between the hours of 7am and 3pm to pick-up. Thank you for your continued support.",https://facebook.com/story.php?story_fbid=1565195606974241&id=135525609941255,,0.0,"Attention Community: ""Elite 8 Basketball Shirts"" have arrived. If you placed an order, please come by the school office Monday thru Thursday between the hours of 7am and 3pm to pick-up. Thank you for your continued support.",2020-06-15 10:52:16,,
70,1.0,,5.0,http://www.jctigers.org/Downloads/2020-2021%20sports%20participation-physical%20packet%20forms.pdf,1561831660643969,"Sports Physicals for 2020-2021 Follow link to print your packet or you may pick up at the school office Monday thru Thursday from 7am to 3pm
http://www.jctigers.org/Downloads/2020-2021%20sports%20participation-physical%20packet%20forms.pdf",https://facebook.com/story.php?story_fbid=1561831660643969&id=135525609941255,"JCTIGERS.ORG
www.jctigers.org",2.0,"Sports Physicals for 2020-2021 Follow link to print your packet or you may pick up at the school office Monday thru Thursday from 7am to 3pm
http://www.jctigers.org/Downloads/2020-2021%20sports%20participation-physical%20packet%20forms.pdf

JCTIGERS.ORG
www.jctigers.org",2020-06-11 10:27:54,,
71,0.0,,23.0,,1555639274596541,,https://facebook.com/story.php?story_fbid=1555639274596541&id=135525609941255,,0.0,,2020-06-04 07:03:16,,
72,1.0,,43.0,http://www.jctigers.org/Downloads/Covid%2019%20-%20back%20to%20school%20letter.pdf,1554172444743224,"Covid 19 - Back to School
Please follow the link http://www.jctigers.org/Downloads/Covid%2019%20-%20back%20to%20school%20letter.pdf",https://facebook.com/story.php?story_fbid=1554172444743224&id=135525609941255,"JCTIGERS.ORG
www.jctigers.org",15.0,"Covid 19 - Back to School
Please follow the link http://www.jctigers.org/Downloads/Covid%2019%20-%20back%20to%20school%20letter.pdf

JCTIGERS.ORG
www.jctigers.org",2020-06-02 13:50:03,,
73,0.0,,20.0,https://youtu.be/8Ur3FvXl7TI,1544454382381697,Senior's Future Plans link to YouTube https://youtu.be/8Ur3FvXl7TI,https://facebook.com/story.php?story_fbid=1544454382381697&id=135525609941255,"YOUTUBE.COM
Senior Future Plans",0.0,"Senior's Future Plans link to YouTube https://youtu.be/8Ur3FvXl7TI

YOUTUBE.COM
Senior Future Plans",2020-05-21 13:40:09,,
74,0.0,,6.0,http://www.jctigers.org/protected/ArticleView.aspx?iid=5IP22I&dasi=4GB3B,1544437909050011,Don't miss out order your 2020 Boy's Basketball shirts - just follow the link provided.,https://facebook.com/story.php?story_fbid=1544437909050011&id=135525609941255,"JCTIGERS.ORG
Boys Basketball 2020 Shirts - Order Now",2.0,"Don't miss out order your 2020 Boy's Basketball shirts - just follow the link provided.

JCTIGERS.ORG
Boys Basketball 2020 Shirts - Order Now",2020-05-21 13:11:32,,
75,0.0,,36.0,,1544259735734495,"Last official day of school, Thursday, May 21, 2020, message from our Superintendent",,,0.0,"Last official day of school, Thursday, May 21, 2020, message from our Superintendent",2020-05-21 09:13:00,https://video.fbna1-2.fna.fbcdn.net/v/t42.9040-2/99374309_2565008357102509_6247426065455644672_n.mp4?_nc_cat=103&_nc_sid=985c63&efg=eyJ2ZW5jb2RlX3RhZyI6ImxlZ2FjeV9zZCJ9&_nc_ohc=bGdsnTVk6_wAX8S9vor&_nc_ht=video.fbna1-2.fna&oh=c7c4bcb3695089b3cf3510638198f2d0&oe=5F5C4D0F,
76,3.0,,21.0,,1543509905809478,"Wednesday, May 20",,,0.0,"Wednesday, May 20",2020-05-20 10:01:44,https://video.fbna1-1.fna.fbcdn.net/v/t42.9040-2/99266583_702541127168773_7464764567604690944_n.mp4?_nc_cat=107&_nc_sid=985c63&efg=eyJ2ZW5jb2RlX3RhZyI6ImxlZ2FjeV9zZCJ9&_nc_ohc=X6DxEEVAjqgAX-fUKQ7&_nc_ht=video.fbna1-1.fna&oh=07180910d961f9a3eb27dcb6a0919197&oe=5F5C50E2,
77,3.0,,24.0,,1542671125893356,"Tuesday, May 19",,,0.0,"Tuesday, May 19",2020-05-19 09:08:05,https://video.fbna1-2.fna.fbcdn.net/v/t42.9040-2/100074733_579887642654646_5408297779187417088_n.mp4?_nc_cat=100&_nc_sid=985c63&efg=eyJ2ZW5jb2RlX3RhZyI6ImxlZ2FjeV9zZCJ9&_nc_ohc=kf4OZJzIIO4AX8smMrW&_nc_ht=video.fbna1-2.fna&oh=80851bc0ab4c1aa7b4acf6bad8b67c28&oe=5F5C46FC,
78,0.0,,1.0,http://www.jctigers.org/protected/ArticleView.aspx?iid=5IPP32&dasi=4GB3B,1541939099299892,Graduation Information,https://facebook.com/story.php?story_fbid=1541939099299892&id=135525609941255,"JCTIGERS.ORG
Jackson Center Graduation Info",17.0,"Graduation Information

JCTIGERS.ORG
Jackson Center Graduation Info",2020-05-18 10:44:25,,
79,0.0,,9.0,,1541891875971281,"Monday, May 18",,,0.0,"Monday, May 18",2020-05-18 09:31:41,https://video.fbna1-1.fna.fbcdn.net/v/t42.9040-2/98462515_585965942033706_221565805043646464_n.mp4?_nc_cat=104&_nc_sid=985c63&efg=eyJ2ZW5jb2RlX3RhZyI6ImxlZ2FjeV9zZCJ9&_nc_ohc=7J6sa8ohD14AX_Z2lcQ&_nc_ht=video.fbna1-1.fna&oh=fea72644f34f07c25d59bbcd9c9cf3ff&oe=5F5C4FF2,
80,5.0,https://scontent.fbna1-2.fna.fbcdn.net/v/t1.0-9/fr/cp0/e15/q65/98266124_1541877495972719_4760393029053841408_o.jpg?_nc_cat=106&_nc_sid=8024bb&_nc_ohc=zfdltV1Jx68AX_9cspR&_nc_ht=scontent.fbna1-2.fna&tp=14&oh=0d68b794afa4c25fddb1f01e5afe996d&oe=5F80FAC0,58.0,,1541877905972678,"On Sunday, May 24th immediately following the private graduation ceremony at 1pm, there will be a parade for the Jackson Center Class of 2020 Graduates. Parade route below",https://facebook.com/story.php?story_fbid=1541877905972678&id=135525609941255,,0.0,"On Sunday, May 24th immediately following the private graduation ceremony at 1pm, there will be a parade for the Jackson Center Class of 2020 Graduates. Parade route below",2020-05-18 09:09:47,,
81,1.0,,24.0,https://www.youtube.com/watch?v=PfO8epqjS6s&feature=share,1539265242900611,Presentation of Kindergarten thru 3rd Grade Awards,https://facebook.com/story.php?story_fbid=1539265242900611&id=135525609941255,"YOUTUBE.COM
Kindergarten thru 3rd Grade Awards for 2019-2020",6.0,"Presentation of Kindergarten thru 3rd Grade Awards

YOUTUBE.COM
Kindergarten thru 3rd Grade Awards for 2019-2020",2020-05-15 11:51:35,,
82,12.0,,39.0,https://www.sidneydailynews.com/news/177756/big-brothers-big-sisters-of-shelby-darke-county-awards-scholarships,1539257966234672,,https://facebook.com/story.php?story_fbid=1539257966234672&id=135525609941255,"SIDNEYDAILYNEWS.COM
Big Brothers Big Sisters of Shelby & Darke County awards scholarships - Sidney Daily News",2.0,"SIDNEYDAILYNEWS.COM
Big Brothers Big Sisters of Shelby & Darke County awards scholarships - Sidney Daily News",2020-05-15 11:41:36,,
83,5.0,,16.0,,1539127339581068,Friday May 15,,,0.0,Friday May 15,2020-05-15 08:41:41,https://video.fbna1-1.fna.fbcdn.net/v/t42.9040-2/97572105_556339685259267_3926616813202309120_n.mp4?_nc_cat=105&_nc_sid=985c63&efg=eyJ2ZW5jb2RlX3RhZyI6ImxlZ2FjeV9zZCJ9&_nc_ohc=N5MsJYGhKYMAX-vc8Vr&_nc_ht=video.fbna1-1.fna&oh=d5799da13c0742eb82dd35adfb9f60e0&oe=5F5C4C23,
84,0.0,,0.0,http://www.jctigers.org/Downloads/Agenda_BOE_Mtg_5_18_20.pdf,1539083572918778,"Link to school board meeting agenda on May 18, 2020
http://www.jctigers.org/Downloads/Agenda_BOE_Mtg_5_18_20.pdf",https://facebook.com/story.php?story_fbid=1539083572918778&id=135525609941255,"JCTIGERS.ORG
www.jctigers.org",0.0,"Link to school board meeting agenda on May 18, 2020
http://www.jctigers.org/Downloads/Agenda_BOE_Mtg_5_18_20.pdf

JCTIGERS.ORG
www.jctigers.org",2020-05-15 07:25:15,,
85,0.0,,16.0,,1538160633011072,"Thursday, May 14",,,0.0,"Thursday, May 14",2020-05-14 08:55:34,https://video.fbna1-1.fna.fbcdn.net/v/t42.9040-2/97571344_3025188860862117_8964368195892805632_n.mp4?_nc_cat=105&_nc_sid=985c63&efg=eyJ2ZW5jb2RlX3RhZyI6ImxlZ2FjeV9zZCJ9&_nc_ohc=1AX3090lBCAAX-9afbb&_nc_ht=video.fbna1-1.fna&oh=80c20be2da160cad4ead7fcd505e6212&oe=5F5C530D,
86,0.0,,21.0,,1537364656424003,"Wednesday, May 13",,,0.0,"Wednesday, May 13",2020-05-13 09:15:02,https://video.fbna1-2.fna.fbcdn.net/v/t42.9040-2/97963902_169193894487393_5990460869375426560_n.mp4?_nc_cat=109&_nc_sid=985c63&efg=eyJ2ZW5jb2RlX3RhZyI6ImxlZ2FjeV9zZCJ9&_nc_ohc=KHigk9Q3-cgAX9ezAmK&_nc_ht=video.fbna1-2.fna&oh=0a9ee032e9b85b85ce451f7f7f003505&oe=5F5C4881,
87,0.0,,13.0,,1535728609920941,"Monday, May 11 Announcements",,,0.0,"Monday, May 11 Announcements",2020-05-11 09:57:24,https://video.fbna1-1.fna.fbcdn.net/v/t42.9040-2/97303530_562531201329572_8033695447669276672_n.mp4?_nc_cat=105&_nc_sid=985c63&efg=eyJ2ZW5jb2RlX3RhZyI6ImxlZ2FjeV9zZCJ9&_nc_ohc=7lqDybdBjFUAX-r9i_L&_nc_ht=video.fbna1-1.fna&oh=b6cd759327d0e1f03e0ab74f333cb887&oe=5F5C525C,
88,0.0,,17.0,,1533156886844780,"Friday, May Announcements",,,0.0,"Friday, May Announcements",2020-05-08 10:05:37,https://video.fbna1-1.fna.fbcdn.net/v/t42.9040-2/96399228_1222969771368323_7589034107670102016_n.mp4?_nc_cat=107&_nc_sid=985c63&efg=eyJ2ZW5jb2RlX3RhZyI6ImxlZ2FjeV9zZCJ9&_nc_ohc=0vmTH-Qr7poAX9J0eHt&_nc_ht=video.fbna1-1.fna&oh=549bba560eec43bda0b4581ceb8f9b25&oe=5F5C4E46,
89,0.0,,20.0,,1531441123683023,"Wednesday, May 6",,,0.0,"Wednesday, May 6",2020-05-06 10:16:21,https://video.fbna1-2.fna.fbcdn.net/v/t42.9040-2/96372254_253740485820408_1003371593763651584_n.mp4?_nc_cat=102&_nc_sid=985c63&efg=eyJ2ZW5jb2RlX3RhZyI6ImxlZ2FjeV9zZCJ9&_nc_ohc=xHcwwmkGdoEAX-qn3qs&_nc_ht=video.fbna1-2.fna&oh=8e5b80b44e6dadcb39af8e8896b64bb7&oe=5F5C4B76,
90,0.0,,25.0,https://www.youtube.com/watch?v=HveehNndlFA&feature=share,1531389517021517,Check out Perfect Attendance for Grades K-5 on our YouTube Channel,https://facebook.com/story.php?story_fbid=1531389517021517&id=135525609941255,"YOUTUBE.COM
K 5 Perfect Attendance Year To Date",4.0,"Check out Perfect Attendance for Grades K-5 on our YouTube Channel

YOUTUBE.COM
K 5 Perfect Attendance Year To Date",2020-05-06 09:18:22,,
91,1.0,,22.0,,1530507967109672,"Tuesday, May 5, 2020",,,0.0,"Tuesday, May 5, 2020",2020-05-05 08:33:57,https://video.fbna1-2.fna.fbcdn.net/v/t42.9040-2/96127800_263684714787616_4150808556955762688_n.mp4?_nc_cat=109&_nc_sid=985c63&efg=eyJ2ZW5jb2RlX3RhZyI6ImxlZ2FjeV9zZCJ9&_nc_ohc=577P26aYov8AX8W6fZv&_nc_ht=video.fbna1-2.fna&oh=982a3798d693dd0815dce1ff8b1b5bd3&oe=5F5C4897,
92,0.0,,13.0,,1529582270535575,"Monday, May 4, 2020",,,0.0,"Monday, May 4, 2020",2020-05-04 06:39:29,https://video.fbna1-1.fna.fbcdn.net/v/t42.9040-2/96127157_2614264308891753_6351327058127224832_n.mp4?_nc_cat=110&_nc_sid=985c63&efg=eyJ2ZW5jb2RlX3RhZyI6ImxlZ2FjeV9zZCJ9&_nc_ohc=KO8dAyjOfooAX8q2Pcg&_nc_ht=video.fbna1-1.fna&oh=abbb148042ea7f2b7ae1036ad1755992&oe=5F5C50F8,
93,0.0,,21.0,http://www.jctigers.org/protected/ArticleView.aspx?iid=5IPG3B&dasi=4GB3B,1528498350643967,Link to website,https://facebook.com/story.php?story_fbid=1528498350643967&id=135525609941255,"JCTIGERS.ORG
2020 Prom",0.0,"Link to website

JCTIGERS.ORG
2020 Prom",2020-05-02 21:21:18,,
94,0.0,https://scontent.fbna1-1.fna.fbcdn.net/v/t1.0-9/fr/cp0/e15/q65/95521793_1527273864099749_2773824617175842816_o.jpg?_nc_cat=107&_nc_sid=8024bb&_nc_ohc=Mrl3treLarcAX9qQEcj&_nc_ht=scontent.fbna1-1.fna&tp=14&oh=64b23a4b30e202c40f5a2d87fdc094ec&oe=5F80E018,18.0,,1527274030766399,"We have created a You Tube Channel and we encourage our students, school, and community to subscribe to our channel. Our goal is to get 1000 subscribers so we may live stream events from our school. See picture below for details on how to subscribe.

Search on You Tube ""Jackson Center Local Schools"" with the icon of ""Tiger Paw"" that is pictured below.",https://facebook.com/story.php?story_fbid=1527274030766399&id=135525609941255,,0.0,"We have created a You Tube Channel and we encourage our students, school, and community to subscribe to our channel. Our goal is to get 1000 subscribers so we may live stream events from our school. See picture below for details on how to subscribe.

Search on You Tube ""Jackson Center Local Schools"" with the icon of ""Tiger Paw"" that is pictured below.",2020-05-01 10:34:51,,
95,0.0,,6.0,https://www.youtube.com/watch?v=VM2nTsmxui8&feature=share,1527267007433768,Testing our You Tube Channel,https://facebook.com/story.php?story_fbid=1527267007433768&id=135525609941255,"YOUTUBE.COM
Friday, May 1 Annoucements",0.0,"Testing our You Tube Channel

YOUTUBE.COM
Friday, May 1 Annoucements",2020-05-01 10:27:25,,
96,2.0,,1.0,https://docs.google.com/forms/d/e/1FAIpQLSeTUru5mV6rqCcMVFcVHEj10Gw1gl1RatZS1gx-piGs4-bg6A/viewform,1527198144107321,"2020 Jackson Center-UVCC FFA Spring Plant Sale Order Form
https://docs.google.com/forms/d/e/1FAIpQLSeTUru5mV6rqCcMVFcVHEj10Gw1gl1RatZS1gx-piGs4-bg6A/viewform",https://facebook.com/story.php?story_fbid=1527198144107321&id=135525609941255,"DOCS.GOOGLE.COM
2020 Jackson Center-UVCC FFA Spring Plant Sale Order Form",4.0,"2020 Jackson Center-UVCC FFA Spring Plant Sale Order Form
https://docs.google.com/forms/d/e/1FAIpQLSeTUru5mV6rqCcMVFcVHEj10Gw1gl1RatZS1gx-piGs4-bg6A/viewform

DOCS.GOOGLE.COM
2020 Jackson Center-UVCC FFA Spring Plant Sale Order Form",2020-05-01 08:44:09,,
97,2.0,,18.0,,1527187340775068,"Announcements May 1, 2020",,,0.0,"Announcements May 1, 2020",2020-05-01 08:23:46,https://video.fbna1-1.fna.fbcdn.net/v/t42.9040-2/95824728_228552115251221_8898294122658398208_n.mp4?_nc_cat=110&_nc_sid=985c63&efg=eyJ2ZW5jb2RlX3RhZyI6ImxlZ2FjeV9zZCJ9&_nc_ohc=Wd0Yb0fU8voAX8uLaO-&_nc_ht=video.fbna1-1.fna&oh=414645ad418120fb8330b963422920eb&oe=5F5C4F0C,
98,2.0,,18.0,,1526342827526186,Announcements April 30th,,,0.0,Announcements April 30th,2020-04-30 09:02:36,https://video.fbna1-1.fna.fbcdn.net/v/t42.9040-2/95406586_238821927180768_8159385032771764224_n.mp4?_nc_cat=105&_nc_sid=985c63&efg=eyJ2ZW5jb2RlX3RhZyI6ImxlZ2FjeV9zZCJ9&_nc_ohc=P-_ceYw0ax0AX-FauAH&_nc_ht=video.fbna1-1.fna&oh=192d4f3f57c8f701a5ecd859afa45fcb&oe=5F5C46D8,
99,1.0,,21.0,,1525478360945966,April 29 Announcements,,,0.0,April 29 Announcements,2020-04-29 09:09:27,https://video.fbna1-2.fna.fbcdn.net/v/t42.9040-2/95400921_260260235107814_5520098213148753920_n.mp4?_nc_cat=103&_nc_sid=985c63&efg=eyJ2ZW5jb2RlX3RhZyI6ImxlZ2FjeV9zZCJ9&_nc_ohc=Mg7mZiHnsnUAX8j7Lmd&_nc_ht=video.fbna1-2.fna&oh=86817069add7f50886b072bd797420a9&oe=5F5C4E44,
100,0.0,,20.0,,1524664794360656,Announcements Tuesday April 28,,,0.0,Announcements Tuesday April 28,2020-04-28 09:16:38,https://video.fbna1-1.fna.fbcdn.net/v/t42.9040-2/95194254_228951878171174_7630719617136066560_n.mp4?_nc_cat=107&_nc_sid=985c63&efg=eyJ2ZW5jb2RlX3RhZyI6ImxlZ2FjeV9zZCJ9&_nc_ohc=5xi2iXwX9wsAX_jRJif&_nc_ht=video.fbna1-1.fna&oh=a5061c23cbf92e2dcb8530411e10bd51&oe=5F5C4F55,
101,0.0,,23.0,,1523856587774810,"April 27, 2020 Announcements",,,0.0,"April 27, 2020 Announcements",2020-04-27 09:33:38,https://video.fbna1-2.fna.fbcdn.net/v/t42.9040-2/94921957_568939537088436_8981092867262906368_n.mp4?_nc_cat=111&_nc_sid=985c63&efg=eyJ2ZW5jb2RlX3RhZyI6ImxlZ2FjeV9zZCJ9&_nc_ohc=23lAFafI30IAX8fdXw-&_nc_ht=video.fbna1-2.fna&oh=d99056a1734b5eb17a8808413417a2af&oe=5F5C534C,
102,1.0,,23.0,,1521417378018731,"Friday, April 24, 2020 Announcements:",,,0.0,"Friday, April 24, 2020 Announcements:",2020-04-24 09:17:55,https://video.fbna1-2.fna.fbcdn.net/v/t42.9040-2/94827003_656237701615068_2826898064923426816_n.mp4?_nc_cat=106&_nc_sid=985c63&efg=eyJ2ZW5jb2RlX3RhZyI6ImxlZ2FjeV9zZCJ9&_nc_ohc=7b8Sas-sWN4AX9N5iBy&_nc_ht=video.fbna1-2.fna&oh=b87fad80856c6139d1e8a189ada87ddf&oe=5F5C47C7,
103,0.0,,0.0,http://www.jctigers.org/Downloads/bdm_Apr_20th_2020_Reg_Mtg.pdf,1521333178027151,"Link to website for Board Minutes
http://www.jctigers.org/Downloads/bdm_Apr_20th_2020_Reg_Mtg.pdf",https://facebook.com/story.php?story_fbid=1521333178027151&id=135525609941255,"JCTIGERS.ORG
www.jctigers.org",0.0,"Link to website for Board Minutes
http://www.jctigers.org/Downloads/bdm_Apr_20th_2020_Reg_Mtg.pdf

JCTIGERS.ORG
www.jctigers.org",2020-04-24 07:07:31,,
104,0.0,,24.0,,1520539838106485,"Thursday, April 23, 2020 Announcements",,,0.0,"Thursday, April 23, 2020 Announcements",2020-04-23 08:36:59,https://video.fbna1-1.fna.fbcdn.net/v/t42.9040-2/95036677_542414906419975_7678522375507279872_n.mp4?_nc_cat=104&_nc_sid=985c63&efg=eyJ2ZW5jb2RlX3RhZyI6ImxlZ2FjeV9zZCJ9&_nc_ohc=Aa0gCpEo_mkAX8PfHcd&_nc_ht=video.fbna1-1.fna&oh=90851b126b5644ab720da15cf98a92fa&oe=5F5C496E,
105,0.0,,29.0,,1519676851526117,"Wednesday April 22, 2020 Announcements presented by Coach Metz.",,,0.0,"Wednesday April 22, 2020 Announcements presented by Coach Metz.",2020-04-22 09:00:26,https://video.fbna1-2.fna.fbcdn.net/v/t42.9040-2/94223772_668146300398978_8715496809847324672_n.mp4?_nc_cat=106&_nc_sid=985c63&efg=eyJ2ZW5jb2RlX3RhZyI6ImxlZ2FjeV9zZCJ9&_nc_ohc=GAGm2wb1VKQAX8nuHIN&_nc_ht=video.fbna1-2.fna&oh=8a9c46a84410645e9c61fb8d18806fda&oe=5F5C5058,
106,0.0,https://scontent.fbna1-2.fna.fbcdn.net/v/t1.0-9/94252021_1519665224860613_972392522938580992_n.png?_nc_cat=101&_nc_sid=8024bb&_nc_ohc=NfgbdJquuN4AX_dcLPU&_nc_oc=AQmVuyTEb1pRdzm-aGH0hLyh1EXb7UwqOwYh93l6BTWcNp_wV5HgujVHxgezZnsEGJU&_nc_ht=scontent.fbna1-2.fna&oh=a2728150df78c45219f98dc6842a6b9e&oe=5F831585,1.0,,1519665858193883,Shelby Hills Online Registration,https://facebook.com/story.php?story_fbid=1519665858193883&id=135525609941255,,0.0,Shelby Hills Online Registration,2020-04-22 08:46:07,,
107,4.0,,38.0,,1518811658279303,Tuesday April 21 Announcements presented by Coach M,,,0.0,Tuesday April 21 Announcements presented by Coach M,2020-04-21 10:03:13,https://video.fbna1-2.fna.fbcdn.net/v/t42.9040-2/94561634_916777035438402_4610001570908602368_n.mp4?_nc_cat=103&_nc_sid=985c63&efg=eyJ2ZW5jb2RlX3RhZyI6ImxlZ2FjeV9zZCJ9&_nc_ohc=scYNZfbu68kAX-aaFlf&_nc_ht=video.fbna1-2.fna&oh=8786f6c776246c87dc1ff535b88fa0ae&oe=5F5C5467,
108,0.0,,21.0,,1517997355027400,"April 20, 2020 Annoucements created by Kim Metz",,,0.0,"April 20, 2020 Annoucements created by Kim Metz",2020-04-20 10:34:29,https://video.fbna1-2.fna.fbcdn.net/v/t42.9040-2/94333149_2953751138042566_1912670746476281856_n.mp4?_nc_cat=109&_nc_sid=985c63&efg=eyJ2ZW5jb2RlX3RhZyI6ImxlZ2FjeV9zZCJ9&_nc_ohc=WKmTS71cgokAX_2UgGg&_nc_ht=video.fbna1-2.fna&oh=5d092f1ff2740f65884f82367a06761a&oe=5F5C47B9,
109,2.0,,34.0,,1517995475027588,"April 19, 2020 Sunday Funday Family Pets",,,0.0,"April 19, 2020 Sunday Funday Family Pets",2020-04-20 10:32:32,https://video.fbna1-2.fna.fbcdn.net/v/t42.9040-2/94202684_571983776778287_5757742129480728576_n.mp4?_nc_cat=109&_nc_sid=985c63&efg=eyJ2ZW5jb2RlX3RhZyI6ImxlZ2FjeV9zZCJ9&_nc_ohc=wElcs7P7xWkAX_XJgAl&_nc_ht=video.fbna1-2.fna&oh=71de3a5d20d3877489ebf5ee316de043&oe=5F5C5023,
110,0.0,,24.0,,1515475978612871,"Friday, April 17 Announcements",,,0.0,"Friday, April 17 Announcements",2020-04-17 11:03:26,https://video.fbna1-2.fna.fbcdn.net/v/t42.9040-2/93705602_1624577287707891_1671995665565089792_n.mp4?_nc_cat=109&_nc_sid=985c63&efg=eyJ2ZW5jb2RlX3RhZyI6ImxlZ2FjeV9zZCJ9&_nc_ohc=_JUjpJsoXLsAX_Z_YdN&_nc_ht=video.fbna1-2.fna&oh=2ebcc09a21653cde6ac82bc94b25981a&oe=5F5C53A3,
111,1.0,,9.0,,1514492375377898,"Sunday Funday Challange for Sunday, April 19. Send Coach Metz a picture of you/or your family WITH your family pet. Even if it's a cow, chicken or pig.

Send pic to k_metz@jctigers.org Please ONLY send simple cell phone pictures...(DO NOT attach through GOOGLE)",https://facebook.com/story.php?story_fbid=1514492375377898&id=135525609941255,,0.0,"Sunday Funday Challange for Sunday, April 19. Send Coach Metz a picture of you/or your family WITH your family pet. Even if it's a cow, chicken or pig.

Send pic to k_metz@jctigers.org Please ONLY send simple cell phone pictures...(DO NOT attach through GOOGLE)",2020-04-16 09:02:11,,
112,0.0,,32.0,,1514489452044857,Daily Update from Coach Metz,,,0.0,Daily Update from Coach Metz,2020-04-16 08:58:08,https://video.fbna1-2.fna.fbcdn.net/v/t42.9040-2/94042239_653359838798889_2617061205679800320_n.mp4?_nc_cat=111&_nc_sid=985c63&efg=eyJ2ZW5jb2RlX3RhZyI6ImxlZ2FjeV9zZCJ9&_nc_ohc=pMRkIzFkbXAAX92oYUv&_nc_ht=video.fbna1-2.fna&oh=e85334dc6ee64811ae8fbe1e86d5272c&oe=5F5C476F,
113,0.0,,10.0,,1513554918804977,"Wednesday, April 15, 2020 Announcements",,,0.0,"Wednesday, April 15, 2020 Announcements",2020-04-15 08:35:58,https://video.fbna1-1.fna.fbcdn.net/v/t42.9040-2/93515106_216471033015743_2456862151059439616_n.mp4?_nc_cat=104&_nc_sid=985c63&efg=eyJ2ZW5jb2RlX3RhZyI6ImxlZ2FjeV9zZCJ9&_nc_ohc=BQr2vIXywAYAX_zWmPv&_nc_ht=video.fbna1-1.fna&oh=be2b316c63e9210b046d726c7cd7e005&oe=5F5C474F,
114,0.0,,5.0,http://www.jctigers.org/Downloads/April%202020%20Newsletter.pdf,1512662702227532,April 2020 Newsletter available on website at http://www.jctigers.org/Downloads/April%202020%20Newsletter.pdf,https://facebook.com/story.php?story_fbid=1512662702227532&id=135525609941255,"JCTIGERS.ORG
www.jctigers.org",0.0,"April 2020 Newsletter available on website at http://www.jctigers.org/Downloads/April%202020%20Newsletter.pdf

JCTIGERS.ORG
www.jctigers.org",2020-04-14 09:17:57,,
115,8.0,,34.0,,1512557268904742,"April 14, 2020 Announcements",,,0.0,"April 14, 2020 Announcements",2020-04-14 06:45:39,https://video.fbna1-2.fna.fbcdn.net/v/t42.9040-2/93491607_221306669122072_7618048561669734400_n.mp4?_nc_cat=106&_nc_sid=985c63&efg=eyJ2ZW5jb2RlX3RhZyI6ImxlZ2FjeV9zZCJ9&_nc_ohc=rmXNBKiAS9QAX9S9LQh&_nc_ht=video.fbna1-2.fna&oh=6442c94f18d8fbfcad41633a429069a0&oe=5F5C5413,
116,4.0,,20.0,,1511653842328418,"Monday, April 13 Announcements",,,0.0,"Monday, April 13 Announcements",2020-04-13 09:05:11,https://video.fbna1-2.fna.fbcdn.net/v/t42.9040-2/93426121_1095183670832005_3819582109312352256_n.mp4?_nc_cat=109&_nc_sid=985c63&efg=eyJ2ZW5jb2RlX3RhZyI6ImxlZ2FjeV9zZCJ9&_nc_ohc=EXn0sMSoTgkAX8_ZCNp&_nc_ht=video.fbna1-2.fna&oh=795120d21178b91e8a0ec6bc60d28471&oe=5F5C4735,
117,3.0,,29.0,,1511602205666915,"Easter Sunday Funday April 12, 2020",,,0.0,"Easter Sunday Funday April 12, 2020",2020-04-13 07:45:08,https://video.fbna1-1.fna.fbcdn.net/v/t42.9040-2/93886425_224458628790878_6297800998136053760_n.mp4?_nc_cat=105&_nc_sid=985c63&efg=eyJ2ZW5jb2RlX3RhZyI6ImxlZ2FjeV9zZCJ9&_nc_ohc=nktoTi6ftYsAX89JSyY&_nc_ht=video.fbna1-1.fna&oh=f407f46c938055c1117f59bd5fda5c62&oe=5F5C528C,
118,1.0,,22.0,,1509107465916389,Friday April 10 Announcements presented by our Freshmen,,,0.0,Friday April 10 Announcements presented by our Freshmen,2020-04-10 08:27:11,https://video.fbna1-2.fna.fbcdn.net/v/t42.9040-2/92964843_2966940850032855_4884144681962700800_n.mp4?_nc_cat=100&_nc_sid=985c63&efg=eyJ2ZW5jb2RlX3RhZyI6ImxlZ2FjeV9zZCJ9&_nc_ohc=5bEooYLHE84AX8Y_AoR&_nc_ht=video.fbna1-2.fna&oh=23f81ee7e70dace0155804b1f42de78a&oe=5F5C4C12,
119,1.0,,36.0,,1508322529328216,April 9th Announcements,,,0.0,April 9th Announcements,2020-04-09 08:54:06,https://video.fbna1-1.fna.fbcdn.net/v/t42.9040-2/92748419_2597491680536887_7789616261578620928_n.mp4?_nc_cat=108&_nc_sid=985c63&efg=eyJ2ZW5jb2RlX3RhZyI6ImxlZ2FjeV9zZCJ9&_nc_ohc=DVK52x-UQAgAX-Ea4V4&_nc_ht=video.fbna1-1.fna&oh=bb262d07358a8b872ef53cad6ce24386&oe=5F5C4728,
120,1.0,,24.0,,1507569766070159,"Wednesday, April 8th Announcements presented by our Sophomores",,,0.0,"Wednesday, April 8th Announcements presented by our Sophomores",2020-04-08 10:17:44,https://video.fbna1-1.fna.fbcdn.net/v/t42.9040-2/93032117_238283057547791_6005897205175549952_n.mp4?_nc_cat=105&_nc_sid=985c63&efg=eyJ2ZW5jb2RlX3RhZyI6ImxlZ2FjeV9zZCJ9&_nc_ohc=B6jl2f-NPOkAX84HweE&_nc_ht=video.fbna1-1.fna&oh=f1ffe5fe16a230ff3563dfe42ce72152&oe=5F5C503C,
121,3.0,,40.0,,1506669716160164,"Tuesday, April 7th",,,0.0,"Tuesday, April 7th",2020-04-07 08:14:09,https://video.fbna1-2.fna.fbcdn.net/v/t42.9040-2/92708817_319456939022098_5213274257852727296_n.mp4?_nc_cat=109&_nc_sid=985c63&efg=eyJ2ZW5jb2RlX3RhZyI6ImxlZ2FjeV9zZCJ9&_nc_ohc=FFxJpWb6Ss8AX_lvuTw&_nc_ht=video.fbna1-2.fna&oh=7a8303ce9fd87797bd655fa644eb0f20&oe=5F5C51E6,
122,2.0,,4.0,http://www.jctigers.org/protected/ArticleView.aspx?iid=5II3I2&dasi=4GB3B,1505994742894328,Link to website for details on next week's Sunday Funday,https://facebook.com/story.php?story_fbid=1505994742894328&id=135525609941255,"JCTIGERS.ORG
Sunday Funday - Easter Hunt",4.0,"Link to website for details on next week's Sunday Funday

JCTIGERS.ORG
Sunday Funday - Easter Hunt",2020-04-06 12:04:58,,
123,2.0,,16.0,,1505976742896128,Results of Sunday Funday Tiger Hunt Part Two,,,0.0,Results of Sunday Funday Tiger Hunt Part Two,2020-04-06 11:37:19,https://video.fbna1-2.fna.fbcdn.net/v/t42.9040-2/92404709_601861003747852_6001408105357770752_n.mp4?_nc_cat=103&_nc_sid=985c63&efg=eyJ2ZW5jb2RlX3RhZyI6ImxlZ2FjeV9zZCJ9&_nc_ohc=9L_kRKwvuIYAX-VU3WM&_nc_ht=video.fbna1-2.fna&oh=32d5dce17feb22ebe4fbae34d3ae9ec8&oe=5F5C50BE,
124,0.0,,24.0,,1505777456249390,"Monday, April 6 Announcements presented by the Junior Class",,,0.0,"Monday, April 6 Announcements presented by the Junior Class",2020-04-06 06:41:05,https://video.fbna1-2.fna.fbcdn.net/v/t42.9040-2/92431698_2984228425002774_5066096753799856128_n.mp4?_nc_cat=100&_nc_sid=985c63&efg=eyJ2ZW5jb2RlX3RhZyI6ImxlZ2FjeV9zZCJ9&_nc_ohc=5Z4ECw3_JsMAX-1jzyX&_nc_ht=video.fbna1-2.fna&oh=7d1d0e16d1287ca1ce49f98040913db1&oe=5F5C5116,
125,1.0,,33.0,,1505487596278376,Results of Sunday Funday Tiger Hunt Part One,,,0.0,Results of Sunday Funday Tiger Hunt Part One,2020-04-05 20:38:51,https://video.fbna1-2.fna.fbcdn.net/v/t42.9040-2/92376554_603122143879728_8755535311024422912_n.mp4?_nc_cat=103&_nc_sid=985c63&efg=eyJ2ZW5jb2RlX3RhZyI6ImxlZ2FjeV9zZCJ9&_nc_ohc=eXH9_Voj4BwAX9Nm4HV&_nc_ht=video.fbna1-2.fna&oh=133ce077d85dea0898574c4475f510f4&oe=5F5C4C97,
126,0.0,,3.0,,208120103952451,,,"MON, APR 6
Homework Exchange",0.0,"MON, APR 6
Homework Exchange",2020-04-03 18:00:55,,
127,13.0,,22.0,,1503775016449634,"Sunday, FunDay,April 5th will be a Tiger Hunt. Place a Tiger in your big picture window (or front window) at your house and the Hunters will try to snap a pic...Everyone join in...lets get those tigers in your windows.",https://facebook.com/story.php?story_fbid=1503775016449634&id=135525609941255,,0.0,"Sunday, FunDay,April 5th will be a Tiger Hunt. Place a Tiger in your big picture window (or front window) at your house and the Hunters will try to snap a pic...Everyone join in...lets get those tigers in your windows.",2020-04-03 17:52:50,,
128,0.0,,0.0,http://www.jctigers.org/protected/ArticleView.aspx?iid=5IIY0I&dasi=4GB3B,1503473239813145,Link to website for today's school news...,https://facebook.com/story.php?story_fbid=1503473239813145&id=135525609941255,"JCTIGERS.ORG
March PAWS Award Winners",0.0,"Link to website for today's school news...

JCTIGERS.ORG
March PAWS Award Winners",2020-04-03 09:52:34,,
129,13.0,,43.0,,1503424416484694,April 3rd Announcements presented by our seniors,,,0.0,April 3rd Announcements presented by our seniors,2020-04-03 08:41:00,https://video.fbna1-1.fna.fbcdn.net/v/t42.9040-2/92246299_1529153483926027_1093656122767704064_n.mp4?_nc_cat=108&_nc_sid=985c63&efg=eyJ2ZW5jb2RlX3RhZyI6ImxlZ2FjeV9zZCJ9&_nc_ohc=je8SVR0hcgUAX9odPdn&_nc_oc=AQn7ouY01ldfahVwvpWPxRba4J243g140wxDhdjmoXMkeGuij849A4DtwXkZLrZv974&_nc_ht=video.fbna1-1.fna&oh=4952ad09bb1ca6b67cfbe50be6533370&oe=5F5C4793,
130,0.0,,19.0,,1502658369894632,"April 2,2020 Video Announcement from Coach Metz",,,0.0,"April 2,2020 Video Announcement from Coach Metz",2020-04-02 10:11:54,https://video.fbna1-2.fna.fbcdn.net/v/t42.9040-2/92147001_2507597246149168_8727041407061065728_n.mp4?_nc_cat=106&_nc_sid=985c63&efg=eyJ2ZW5jb2RlX3RhZyI6ImxlZ2FjeV9zZCJ9&_nc_ohc=EFhpxHxEdQYAX8CuvuC&_nc_ht=video.fbna1-2.fna&oh=ea303f59ee5b2cdb180c0b5c90afb66b&oe=5F5C513B,
131,0.0,,1.0,http://www.jctigers.org/protected/ArticleView.aspx?iid=5IIY32&dasi=4GB3B,1502577366569399,Link to website for April 2nd news,https://facebook.com/story.php?story_fbid=1502577366569399&id=135525609941255,"JCTIGERS.ORG
Homework Drop-off/Pick-up",0.0,"Link to website for April 2nd news

JCTIGERS.ORG
Homework Drop-off/Pick-up",2020-04-02 08:21:39,,
132,0.0,https://scontent.fbna1-2.fna.fbcdn.net/v/t1.0-9/fr/cp0/e15/q65/91922307_1502532513240551_6405287193283133440_n.jpg?_nc_cat=109&_nc_sid=8024bb&_nc_ohc=rPOcKlW3ZyYAX9zBEva&_nc_ht=scontent.fbna1-2.fna&tp=14&oh=6f5397c2f110fdb5be56a28948869159&oe=5F7FC4B8,17.0,,1502532679907201,,https://facebook.com/story.php?story_fbid=1502532679907201&id=135525609941255,,0.0,,2020-04-02 07:07:18,,
133,2.0,,21.0,,1501778213315981,April 1 Announcements. Apologies for missing March 31 due to Grandma babysitting duty... Enjoy,,,0.0,April 1 Announcements. Apologies for missing March 31 due to Grandma babysitting duty... Enjoy,2020-04-01 09:16:33,https://video.fbna1-2.fna.fbcdn.net/v/t42.9040-2/92028085_891305234624393_5241442491625897984_n.mp4?_nc_cat=111&_nc_sid=985c63&efg=eyJ2ZW5jb2RlX3RhZyI6ImxlZ2FjeV9zZCJ9&_nc_ohc=msXWvdURQakAX8Glu3C&_nc_ht=video.fbna1-2.fna&oh=9b8a004f2896220818c774fc1d53f629&oe=5F5C46FC,
134,1.0,,6.0,http://www.jctigers.org/protected/ArticleView.aspx?iid=5IIYB0&dasi=4GB3B,1501767626650373,Link to website for today's news,https://facebook.com/story.php?story_fbid=1501767626650373&id=135525609941255,"JCTIGERS.ORG
Random Acts of Kindness",0.0,"Link to website for today's news

JCTIGERS.ORG
Random Acts of Kindness",2020-04-01 09:02:43,,
135,0.0,,9.0,http://www.jctigers.org/protected/ArticleView.aspx?iid=5IIGYI&dasi=4GB3B,1500153470145122,Link to website for today's video announcement from Coach Metz,https://facebook.com/story.php?story_fbid=1500153470145122&id=135525609941255,"JCTIGERS.ORG
March 30 Announcements",0.0,"Link to website for today's video announcement from Coach Metz

JCTIGERS.ORG
March 30 Announcements",2020-03-30 11:11:13,,
136,33.0,,106.0,,1500086760151793,And this just in from the Reichert family,,,0.0,And this just in from the Reichert family,2020-03-30 09:34:50,https://video.fbna1-1.fna.fbcdn.net/v/t42.9040-2/91567918_358442661710019_8679710618351042560_n.mp4?_nc_cat=104&_nc_sid=985c63&efg=eyJ2ZW5jb2RlX3RhZyI6ImxlZ2FjeV9zZCJ9&_nc_ohc=wUxglP039pQAX9iwpYO&_nc_ht=video.fbna1-1.fna&oh=65baf836dcfb5ddebd44aaa79fcc42dc&oe=5F5C4A8B,
137,0.0,,28.0,,1500080620152407,Sunday Funday,,,0.0,Sunday Funday,2020-03-30 09:26:21,https://video.fbna1-2.fna.fbcdn.net/v/t42.9040-2/91634684_588991145035794_219503744000196608_n.mp4?_nc_cat=106&_nc_sid=985c63&efg=eyJ2ZW5jb2RlX3RhZyI6ImxlZ2FjeV9zZCJ9&_nc_ohc=EsLNb9CP5MYAX_yfBKJ&_nc_ht=video.fbna1-2.fna&oh=9714ddf5ebf86ed6ed85db1b4c21df97&oe=5F5C49AD,
138,7.0,,27.0,https://youtu.be/khx1ufC_kwc,1497537060406763,"Link to announcements for Friday, March 27. https://youtu.be/khx1ufC_kwc",https://facebook.com/story.php?story_fbid=1497537060406763&id=135525609941255,"YOUTUBE.COM
Morning Announcements March 27, 2020",28.0,"Link to announcements for Friday, March 27. https://youtu.be/khx1ufC_kwc

YOUTUBE.COM
Morning Announcements March 27, 2020",2020-03-27 11:05:43,,
139,16.0,,40.0,,1496658007161335,Announcements - March 26. 2020. Sorry for the delay. Technical difficulties.,,,0.0,Announcements - March 26. 2020. Sorry for the delay. Technical difficulties.,2020-03-26 11:51:36,https://video.fbna1-2.fna.fbcdn.net/v/t42.9040-2/90930940_506312006919151_302305774254686208_n.mp4?_nc_cat=106&_nc_sid=985c63&efg=eyJ2ZW5jb2RlX3RhZyI6ImxlZ2FjeV9zZCJ9&_nc_ohc=JbJdMme6XJoAX9Y1Mwh&_nc_oc=AQnUdJku2FQY7jh93XeJtZWI1I4fAjuWrMPiCIkoZjvWOQYSOwwJKbVxPvn7tKwjFHQ&_nc_ht=video.fbna1-2.fna&oh=2f7034ea9680150f44ed2b369f538aae&oe=5F5C5199,
140,0.0,,1.0,http://www.jctigers.org/protected/EventView.aspx?id=8I0BYBGPB,1494630737364062,"Lunch available for students from 11am to Noon pickup at door #21, follow link to website for menu",https://facebook.com/story.php?story_fbid=1494630737364062&id=135525609941255,"JCTIGERS.ORG
Event Details",0.0,"Lunch available for students from 11am to Noon pickup at door #21, follow link to website for menu

JCTIGERS.ORG
Event Details",2020-03-24 07:35:14,,
141,0.0,,0.0,http://www.jctigers.org/protected/EventView.aspx?id=8IAUGY20I,1493723390788130,"Link to website for school lunch menu available for students to pick up Monday, March 23rd from 11am to Noon at door #21.",https://facebook.com/story.php?story_fbid=1493723390788130&id=135525609941255,"JCTIGERS.ORG
Event Details",0.0,"Link to website for school lunch menu available for students to pick up Monday, March 23rd from 11am to Noon at door #21.

JCTIGERS.ORG
Event Details",2020-03-23 07:12:37,,
142,0.0,,3.0,http://www.jctigers.org/protected/EventView.aspx?id=8IAPUBBYB,1490977141062755,"Link to website for Friday, March 20, school lunch available at door #21. Students from 11am to Noon and community members from Noon to 1pm.",https://facebook.com/story.php?story_fbid=1490977141062755&id=135525609941255,"JCTIGERS.ORG
Event Details",2.0,"Link to website for Friday, March 20, school lunch available at door #21. Students from 11am to Noon and community members from Noon to 1pm.

JCTIGERS.ORG
Event Details",2020-03-20 07:52:35,,
143,0.0,,1.0,http://www.jctigers.org/protected/EventView.aspx?id=8IAI0Y3UB,1490047634489039,"Link to website, lunch menu available for pick up at door #2, March 19th.
Students pick-up from 11am-Noon. Community pick-up from Noon to 1pm",https://facebook.com/story.php?story_fbid=1490047634489039&id=135525609941255,"JCTIGERS.ORG
Event Details",3.0,"Link to website, lunch menu available for pick up at door #2, March 19th.
Students pick-up from 11am-Noon. Community pick-up from Noon to 1pm

JCTIGERS.ORG
Event Details",2020-03-19 07:12:34,,
144,0.0,,0.0,,229611628228567,,,"MON, MAR 16
School Board Meeting",0.0,"MON, MAR 16
School Board Meeting",2020-03-16 15:51:55,,
145,0.0,,8.0,http://www.jctigers.org/protected/ArticleView.aspx?iid=5I3P0Y&dasi=4GB3B,1487857311374738,Link to website for Kindergarten through 3rd grade packet pick up information,https://facebook.com/story.php?story_fbid=1487857311374738&id=135525609941255,"JCTIGERS.ORG
www.jctigers.org",17.0,"Link to website for Kindergarten through 3rd grade packet pick up information

JCTIGERS.ORG
www.jctigers.org",2020-03-16 15:47:15,,
146,0.0,,1.0,,1487739794719823,,https://facebook.com/story.php?story_fbid=1487739794719823&id=135525609941255,,0.0,,2020-03-16 12:56:51,,
147,0.0,,8.0,http://www.jctigers.org/Downloads/COVID%20-19%20Letter2.pdf,1484305121729957,"Please follow this link for Coronavirus Notice from Jackson Center Schools
http://www.jctigers.org/Downloads/COVID%20-19%20Letter2.pdf",https://facebook.com/story.php?story_fbid=1484305121729957&id=135525609941255,"JCTIGERS.ORG
www.jctigers.org",15.0,"Please follow this link for Coronavirus Notice from Jackson Center Schools
http://www.jctigers.org/Downloads/COVID%20-19%20Letter2.pdf

JCTIGERS.ORG
www.jctigers.org",2020-03-12 10:21:47,,
148,0.0,,0.0,,882778175500331,,,"FRI, MAR 13
HS Boys Basketball Tournament",0.0,"FRI, MAR 13
HS Boys Basketball Tournament",2020-03-12 06:10:35,,
149,0.0,,4.0,,2568739093383874,,,"THU, MAR 12
Community Pep Rally",0.0,"THU, MAR 12
Community Pep Rally",2020-03-12 06:09:01,,
150,0.0,,1.0,http://www.jctigers.org/protected/ArticleView.aspx?iid=5I3YP2&dasi=4GB3B,1484146441745825,Link to website for today's school announcements,https://facebook.com/story.php?story_fbid=1484146441745825&id=135525609941255,"JCTIGERS.ORG
March 12 Announcements",0.0,"Link to website for today's school announcements

JCTIGERS.ORG
March 12 Announcements",2020-03-12 06:02:23,,
151,0.0,,0.0,http://www.jctigers.org/protected/EventView.aspx?id=8IPYBAGPI,1484145145079288,"Link to website for Thursday, March 12 lunch menu",https://facebook.com/story.php?story_fbid=1484145145079288&id=135525609941255,"JCTIGERS.ORG
Event Details",0.0,"Link to website for Thursday, March 12 lunch menu

JCTIGERS.ORG
Event Details",2020-03-12 05:59:42,,
152,0.0,,0.0,,643516669797297,,,"WED, MAR 11
HS Boys Basketball Tournament",0.0,"WED, MAR 11
HS Boys Basketball Tournament",2020-03-11 06:09:36,,
153,0.0,,0.0,http://www.jctigers.org/protected/ArticleView.aspx?iid=5I3GUI&dasi=4GB3B,1483323055161497,Link to website for today's school announcements,https://facebook.com/story.php?story_fbid=1483323055161497&id=135525609941255,"JCTIGERS.ORG
March 11 Announcements",0.0,"Link to website for today's school announcements

JCTIGERS.ORG
March 11 Announcements",2020-03-11 06:04:19,,
154,0.0,,0.0,http://www.jctigers.org/protected/EventView.aspx?id=8IPYBAGIB,1483321111828358,"Link to website for Wednesday, March 11 school lunch menu",https://facebook.com/story.php?story_fbid=1483321111828358&id=135525609941255,"JCTIGERS.ORG
Event Details",0.0,"Link to website for Wednesday, March 11 school lunch menu

JCTIGERS.ORG
Event Details",2020-03-11 06:00:27,,
155,0.0,,1.0,http://www.jctigers.org/protected/ArticleView.aspx?iid=5I3GYB&dasi=4GB3B,1482491268578009,Link to website for today's school announcements,https://facebook.com/story.php?story_fbid=1482491268578009&id=135525609941255,"JCTIGERS.ORG
March 10 Announcements",0.0,"Link to website for today's school announcements

JCTIGERS.ORG
March 10 Announcements",2020-03-10 06:04:44,,
156,0.0,,0.0,http://www.jctigers.org/protected/EventView.aspx?id=8IPYBAGPY,1482488575244945,"Link to website for Tuesday, March 10 school lunch menu",https://facebook.com/story.php?story_fbid=1482488575244945&id=135525609941255,"JCTIGERS.ORG
Event Details",0.0,"Link to website for Tuesday, March 10 school lunch menu

JCTIGERS.ORG
Event Details",2020-03-10 06:00:16,,
157,0.0,,0.0,,882876022132327,,,"TUE, MAR 10
HS Boys Basketball Tournament",0.0,"TUE, MAR 10
HS Boys Basketball Tournament",2020-03-09 06:08:32,,
158,0.0,,0.0,http://www.jctigers.org/protected/ArticleView.aspx?iid=5I3B2I&dasi=4GB3B,1481667881993681,Link to website for today's school announcements,https://facebook.com/story.php?story_fbid=1481667881993681&id=135525609941255,"JCTIGERS.ORG
March 9 Announcements",0.0,"Link to website for today's school announcements

JCTIGERS.ORG
March 9 Announcements",2020-03-09 06:04:45,,
159,0.0,,0.0,http://www.jctigers.org/protected/EventView.aspx?id=8IPYBAGPB,1481665255327277,"Link to website for Monday, March 9 school lunch",https://facebook.com/story.php?story_fbid=1481665255327277&id=135525609941255,"JCTIGERS.ORG
Event Details",0.0,"Link to website for Monday, March 9 school lunch

JCTIGERS.ORG
Event Details",2020-03-09 06:02:46,,
160,0.0,,14.0,,1480317242128745,"JC Boys continue in basketball tournament on Tuesday March 10 at 8pm vs Fairfield Cincinnati Christian at UD. Tickets will go on sale at 10am Monday, March 9 in the school office. Presale $7 and will be $8 at the door.",https://facebook.com/story.php?story_fbid=1480317242128745&id=135525609941255,,0.0,"JC Boys continue in basketball tournament on Tuesday March 10 at 8pm vs Fairfield Cincinnati Christian at UD. Tickets will go on sale at 10am Monday, March 9 in the school office. Presale $7 and will be $8 at the door.",2020-03-07 13:21:39,,
161,0.0,,0.0,http://www.jctigers.org/protected/ArticleView.aspx?iid=5I3BB0&dasi=4GB3B,1479178812242588,Link to website for today's school announcements,https://facebook.com/story.php?story_fbid=1479178812242588&id=135525609941255,"JCTIGERS.ORG
March 6 Announcements",0.0,"Link to website for today's school announcements

JCTIGERS.ORG
March 6 Announcements",2020-03-06 06:04:20,,
162,0.0,,0.0,http://www.jctigers.org/protected/EventView.aspx?id=8IPYBAGI0,1479178315575971,"Link to website for Friday, March 6 school lunch",https://facebook.com/story.php?story_fbid=1479178315575971&id=135525609941255,"JCTIGERS.ORG
Event Details",0.0,"Link to website for Friday, March 6 school lunch

JCTIGERS.ORG
Event Details",2020-03-06 06:03:20,,
163,0.0,,2.0,http://www.jctigers.org/protected/ArticleView.aspx?iid=5IYU3I&dasi=4GB3B,1478311922329277,Link to website for today's school announcements,https://facebook.com/story.php?story_fbid=1478311922329277&id=135525609941255,"JCTIGERS.ORG
March 5 Announcements",0.0,"Link to website for today's school announcements

JCTIGERS.ORG
March 5 Announcements",2020-03-05 06:10:21,,
164,0.0,,0.0,http://www.jctigers.org/protected/EventView.aspx?id=8IPYBAGI2,1478309038996232,"Link to website for Thursday, March 5 school lunch",https://facebook.com/story.php?story_fbid=1478309038996232&id=135525609941255,"JCTIGERS.ORG
Event Details",0.0,"Link to website for Thursday, March 5 school lunch

JCTIGERS.ORG
Event Details",2020-03-05 06:07:11,,
165,0.0,,2.0,,232363801136735,,,"MON, MAR 9
Class of 2024 Freshman Orientation",0.0,"MON, MAR 9
Class of 2024 Freshman Orientation",2020-03-04 06:11:33,,
166,0.0,,2.0,http://www.jctigers.org/protected/ArticleView.aspx?iid=5IY002&dasi=4GB3B,1477452385748564,Link to website for today's school announcements,https://facebook.com/story.php?story_fbid=1477452385748564&id=135525609941255,"JCTIGERS.ORG
March 4 Announcements",0.0,"Link to website for today's school announcements

JCTIGERS.ORG
March 4 Announcements",2020-03-04 06:05:25,,
167,0.0,,0.0,http://www.jctigers.org/protected/EventView.aspx?id=8IPYBAG30,1477446972415772,"Link to website for Wednesday, March 4th school lunch",https://facebook.com/story.php?story_fbid=1477446972415772&id=135525609941255,"JCTIGERS.ORG
Event Details",0.0,"Link to website for Wednesday, March 4th school lunch

JCTIGERS.ORG
Event Details",2020-03-04 05:58:09,,
168,0.0,,0.0,http://www.jctigers.org/protected/ArticleView.aspx?iid=5IY0I0&dasi=4GB3B,1476607465833056,Link to website for today's school announcements,https://facebook.com/story.php?story_fbid=1476607465833056&id=135525609941255,"JCTIGERS.ORG
March 3 Announcements",0.0,"Link to website for today's school announcements

JCTIGERS.ORG
March 3 Announcements",2020-03-03 06:05:58,,
169,0.0,,0.0,http://www.jctigers.org/protected/EventView.aspx?id=8IPYBAG32,1476605869166549,"Link to website for Tuesday, March 3 lunch menu",https://facebook.com/story.php?story_fbid=1476605869166549&id=135525609941255,"JCTIGERS.ORG
Event Details",0.0,"Link to website for Tuesday, March 3 lunch menu

JCTIGERS.ORG
Event Details",2020-03-03 06:04:03,,
170,0.0,,8.0,http://www.jackson-center.k12.oh.us/protected/ArticleView.aspx?iid=5IY0B2&dasi=4GB3B,1475935849233551,Link to website for detailed FCCLA results,https://facebook.com/story.php?story_fbid=1475935849233551&id=135525609941255,"JACKSON-CENTER.K12.OH.US
FCCLA Regional Results",2.0,"Link to website for detailed FCCLA results

JACKSON-CENTER.K12.OH.US
FCCLA Regional Results",2020-03-02 10:51:01,,
171,0.0,,2.0,,492711504751717,,,"FRI, MAR 6
HS Boy's Basketball Tournament",0.0,"FRI, MAR 6
HS Boy's Basketball Tournament",2020-03-02 06:25:47,,
172,0.0,,0.0,,750776165451116,,,"TUE, MAR 3
JCYSO Summer Sign-ups",0.0,"TUE, MAR 3
JCYSO Summer Sign-ups",2020-03-02 06:22:58,,
173,0.0,,2.0,,2836726866381383,,,"SUN, MAR 8
Musical ""Annie""",0.0,"SUN, MAR 8
Musical ""Annie""",2020-03-02 06:21:05,,
174,0.0,,1.0,,1475750069252129,"Monday, March 2nd Announcements
FCCLA Regional Competition results from Saturday:
 Receiving Gold: Avery Jackson, Kathryn Prenger, Zoe Razanno, Daniel Martin, Vanessa Fitzgerald, Maleah Kipker, Jadelyn Umbaugh, Morgan Kipker, Carleigh Ross, Kieran Yarkosky, Cortney Copeland, Allee Wentz, Xavier Esser, Cameron Ross, Ryan West, Sarah Clark, Delaney Mullen, and Reese Tooke.
 Receiving Silver: Christopher Klopfenstein, Hope Booser, Regan Davidson, Kennedy Jackson, Brianna Fitzgerald, Xander Gross, Sean Wren, and Tyler Yarkosky
 Receiving Bronze: Maddy Lundy, Haylee Shields and Sarah Swiger
State qualifiers will be announced on March 16.

Pre-sale tickets for $7 are now available in the office for the musical Annie performances next week on March 5th, 7th, and 8th. Tickets will be $9 at the door.

JC Varsity Boys continue in tournaments this Friday, March 6 vs. Cedarville, 7pm at Butler High School. Presale tickets are on sale in the school office from 8am to 3pm. Tickets are $6 each. We will receive 50% back from our ticket sales.",https://facebook.com/story.php?story_fbid=1475750069252129&id=135525609941255,,0.0,"Monday, March 2nd Announcements
FCCLA Regional Competition results from Saturday:
 Receiving Gold: Avery Jackson, Kathryn Prenger, Zoe Razanno, Daniel Martin, Vanessa Fitzgerald, Maleah Kipker, Jadelyn Umbaugh, Morgan Kipker, Carleigh Ross, Kieran Yarkosky, Cortney Copeland, Allee Wentz, Xavier Esser, Cameron Ross, Ryan West, Sarah Clark, Delaney Mullen, and Reese Tooke.
 Receiving Silver: Christopher Klopfenstein, Hope Booser, Regan Davidson, Kennedy Jackson, Brianna Fitzgerald, Xander Gross, Sean Wren, and Tyler Yarkosky
 Receiving Bronze: Maddy Lundy, Haylee Shields and Sarah Swiger
State qualifiers will be announced on March 16.

Pre-sale tickets for $7 are now available in the office for the musical Annie performances next week on March 5th, 7th, and 8th. Tickets will be $9 at the door.

JC Varsity Boys continue in tournaments this Friday, March 6 vs. Cedarville, 7pm at Butler High School. Presale tickets are on sale in the school office from 8am to 3pm. Tickets are $6 each. We will receive 50% back from our ticket sales.",2020-03-02 06:17:08,,
175,0.0,,0.0,http://www.jctigers.org/protected/EventView.aspx?id=8IPYBAG3I,1475748642585605,"Link to website for Monday, March 2nd lunch menu",https://facebook.com/story.php?story_fbid=1475748642585605&id=135525609941255,"JCTIGERS.ORG
Event Details",0.0,"Link to website for Monday, March 2nd lunch menu

JCTIGERS.ORG
Event Details",2020-03-02 06:15:50,,
176,0.0,,0.0,,2882198175151794,,,"SUN, MAR 1
JCYSO Summer Sign-ups",0.0,"SUN, MAR 1
JCYSO Summer Sign-ups",2020-02-28 06:09:58,,
177,0.0,,1.0,,852716391873357,,,"SAT, FEB 29
HS Boy's Basketball Tournament",0.0,"SAT, FEB 29
HS Boy's Basketball Tournament",2020-02-28 06:07:56,,
178,0.0,,0.0,http://www.jctigers.org/protected/ArticleView.aspx?iid=5IYAB2&dasi=4GB3B,1473076929519443,Link to website for today's school announcements,https://facebook.com/story.php?story_fbid=1473076929519443&id=135525609941255,"JCTIGERS.ORG
February 28 Announcements",0.0,"Link to website for today's school announcements

JCTIGERS.ORG
February 28 Announcements",2020-02-28 06:05:52,,
179,0.0,,0.0,http://www.jctigers.org/protected/EventView.aspx?id=8IYGA2PI0,1473063796187423,"Link to website for Friday, February 28 lunch menu",https://facebook.com/story.php?story_fbid=1473063796187423&id=135525609941255,"JCTIGERS.ORG
Event Details",0.0,"Link to website for Friday, February 28 lunch menu

JCTIGERS.ORG
Event Details",2020-02-28 05:46:04,,
180,0.0,,0.0,http://www.jctigers.org/protected/EventView.aspx?id=8IPYB203B,1472313692929100,Tickets for tonight's boys tournament game will be on sale at the school from 1pm to 4pm.,https://facebook.com/story.php?story_fbid=1472313692929100&id=135525609941255,"JCTIGERS.ORG
Event Details",4.0,"Tickets for tonight's boys tournament game will be on sale at the school from 1pm to 4pm.

JCTIGERS.ORG
Event Details",2020-02-27 08:41:03,,
181,0.0,,0.0,http://www.jctigers.org/protected/ArticleView.aspx?iid=5IY220&dasi=4GB3B,1472223286271474,Link to website for today's school announcements,https://facebook.com/story.php?story_fbid=1472223286271474&id=135525609941255,"JCTIGERS.ORG
February 27 Announcements",0.0,"Link to website for today's school announcements

JCTIGERS.ORG
February 27 Announcements",2020-02-27 06:21:40,,
182,0.0,,0.0,http://www.jctigers.org/protected/EventView.aspx?id=8IYGA2PI2,1472222406271562,"Link to website for Thursday, February 27th lunch menu",https://facebook.com/story.php?story_fbid=1472222406271562&id=135525609941255,"JCTIGERS.ORG
Event Details",0.0,"Link to website for Thursday, February 27th lunch menu

JCTIGERS.ORG
Event Details",2020-02-27 06:19:46,,
183,0.0,,3.0,http://www.jctigers.org/protected/ArticleView.aspx?iid=5IYPUI&dasi=4GB3B,1471396943020775,Link to today's school announcements,https://facebook.com/story.php?story_fbid=1471396943020775&id=135525609941255,"JCTIGERS.ORG
February 26 Announcements",0.0,"Link to today's school announcements

JCTIGERS.ORG
February 26 Announcements",2020-02-26 06:10:29,,
184,0.0,,0.0,http://www.jctigers.org/protected/EventView.aspx?id=8IYGA2PII,1471380639689072,"Link to website for Wednesday, February 26 lunch menu.",https://facebook.com/story.php?story_fbid=1471380639689072&id=135525609941255,"JCTIGERS.ORG
Event Details",0.0,"Link to website for Wednesday, February 26 lunch menu.

JCTIGERS.ORG
Event Details",2020-02-26 05:38:54,,
185,0.0,,0.0,,490242478326725,,,"SAT, FEB 29
FCCLA Regional Competition",0.0,"SAT, FEB 29
FCCLA Regional Competition",2020-02-25 06:18:56,,
186,0.0,,0.0,,184662539491522,,,"THU, FEB 27
HS Boys Basketball Tournament",0.0,"THU, FEB 27
HS Boys Basketball Tournament",2020-02-25 06:16:12,,
187,0.0,,1.0,,493819838227532,,,"THU, FEB 27
JCYSO Summer Sign-ups",0.0,"THU, FEB 27
JCYSO Summer Sign-ups",2020-02-25 06:14:16,,
188,0.0,,0.0,,229411974884607,,,"TUE, FEB 25
HS Girls Basketball Awards",0.0,"TUE, FEB 25
HS Girls Basketball Awards",2020-02-25 06:10:37,,
189,0.0,,0.0,http://www.jctigers.org/protected/ArticleView.aspx?iid=5IYPBB&dasi=4GB3B,1470570676436735,Link to website for today's school announcements,https://facebook.com/story.php?story_fbid=1470570676436735&id=135525609941255,"JCTIGERS.ORG
February 25 Announcements",0.0,"Link to website for today's school announcements

JCTIGERS.ORG
February 25 Announcements",2020-02-25 06:09:06,,
190,0.0,,0.0,http://www.jctigers.org/protected/EventView.aspx?id=8IYGA2PIY,1470567193103750,Link to website for February 25th lunch menu,https://facebook.com/story.php?story_fbid=1470567193103750&id=135525609941255,"JCTIGERS.ORG
Event Details",0.0,"Link to website for February 25th lunch menu

JCTIGERS.ORG
Event Details",2020-02-25 06:02:53,,
191,0.0,,0.0,http://www.jctigers.org/protected/ArticleView.aspx?iid=5IYIII&dasi=4GB3B,1469758069851329,Link to today's school announcements,https://facebook.com/story.php?story_fbid=1469758069851329&id=135525609941255,"JCTIGERS.ORG
February 24 announcements",0.0,"Link to today's school announcements

JCTIGERS.ORG
February 24 announcements",2020-02-24 06:07:27,,
192,0.0,,0.0,http://www.jctigers.org/protected/EventView.aspx?id=8IYGA2PIB,1469756913184778,"Link to website for Monday, February 24th lunch menu",https://facebook.com/story.php?story_fbid=1469756913184778&id=135525609941255,"JCTIGERS.ORG
Event Details",0.0,"Link to website for Monday, February 24th lunch menu

JCTIGERS.ORG
Event Details",2020-02-24 06:05:36,,
193,0.0,,0.0,http://www.jctigers.org/Downloads/February_2020_Newsletter.pdf,1467478373412632,Link to website for February 2020 Newsletter http://www.jctigers.org/Downloads/February_2020_Newsletter.pdf,https://facebook.com/story.php?story_fbid=1467478373412632&id=135525609941255,"JCTIGERS.ORG
www.jctigers.org",0.0,"Link to website for February 2020 Newsletter http://www.jctigers.org/Downloads/February_2020_Newsletter.pdf

JCTIGERS.ORG
www.jctigers.org",2020-02-21 12:05:26,,
194,0.0,,0.0,http://www.jctigers.org/protected/EventView.aspx?id=8IYGA2P30,1467222296771573,Link to website for February 21st lunch menu,https://facebook.com/story.php?story_fbid=1467222296771573&id=135525609941255,"JCTIGERS.ORG
Event Details",0.0,"Link to website for February 21st lunch menu

JCTIGERS.ORG
Event Details",2020-02-21 06:10:17,,
195,0.0,,1.0,http://www.jctigers.org/protected/ArticleView.aspx?iid=5IY3U2&dasi=4GB3B,1467221556771647,Link to website for today's school announcements,https://facebook.com/story.php?story_fbid=1467221556771647&id=135525609941255,"JCTIGERS.ORG
February 21 Announcements",0.0,"Link to website for today's school announcements

JCTIGERS.ORG
February 21 Announcements",2020-02-21 06:09:33,,
196,0.0,,0.0,http://www.jctigers.org/protected/ArticleView.aspx?iid=5IY3P2&dasi=4GB3B,1466337843526685,Link to website for today's school announcements,https://facebook.com/story.php?story_fbid=1466337843526685&id=135525609941255,"JCTIGERS.ORG
February 20 Announcements",0.0,"Link to website for today's school announcements

JCTIGERS.ORG
February 20 Announcements",2020-02-20 06:01:37,,
197,0.0,,0.0,http://www.jctigers.org/protected/EventView.aspx?id=8IYGA2P32,1466320870195049,Link to website for today's school lunch menu,https://facebook.com/story.php?story_fbid=1466320870195049&id=135525609941255,"JCTIGERS.ORG
Event Details",0.0,"Link to website for today's school lunch menu

JCTIGERS.ORG
Event Details",2020-02-20 05:33:19,,
