,comments,image,likes,link,post_id,post_text,post_url,shared_text,shares,text,time,video,video_thumbnail
0,0.0,,4.0,http://digital.olivesoftware.com/Olive/ODN/ElDorado/shared/ShowArticle.aspx?doc=ElDNTimes/2020/09/13&entity=Ar01508&sk=608CF86A,1771412106342295,,https://facebook.com/story.php?story_fbid=1771412106342295&id=144868215663367,"DIGITAL.OLIVESOFTWARE.COM
Dragons rally past Foreman - El Dorado , 9/13/2020",0.0,"DIGITAL.OLIVESOFTWARE.COM
Dragons rally past Foreman - El Dorado , 9/13/2020",2020-09-13 11:14:31,,
1,0.0,,10.0,,1770314813118691,,https://facebook.com/story.php?story_fbid=1770314813118691&id=144868215663367,"Leanna Hanry added 382 new photos to the album: 2020 JC vs Foreman September 11 Album 2.
September 11 at 10:36 PM ·",0.0,"Leanna Hanry added 382 new photos to the album: 2020 JC vs Foreman September 11 Album 2.
September 11 at 10:36 PM ·",2020-09-12 09:29:47,,
2,3.0,,28.0,,1770277266455779,,https://facebook.com/story.php?story_fbid=1770277266455779&id=144868215663367,"Leanna Hanry added 211 new photos to the album: 2020 JC vs Foreman September 11 Album 1.
September 11 at 10:26 PM ·",0.0,"Leanna Hanry added 211 new photos to the album: 2020 JC vs Foreman September 11 Album 1.
September 11 at 10:26 PM ·",2020-09-12 08:44:11,,
3,0.0,,17.0,,1769924559824383,,https://facebook.com/story.php?story_fbid=1769924559824383&id=144868215663367,"Leanna Hanry
September 11 at 10:01 PM ·

Junction City Dragons received the Griffin Game Ball Tonight. Congratulations Coaches and Dragons!!!",3.0,"Leanna Hanry
September 11 at 10:01 PM ·

Junction City Dragons received the Griffin Game Ball Tonight. Congratulations Coaches and Dragons!!!",2020-09-11 23:23:51,https://video-atl3-1.xx.fbcdn.net/v/t42.9040-2/119284876_313145276632799_7580209509659434411_n.mp4?_nc_cat=105&_nc_sid=985c63&efg=eyJ2ZW5jb2RlX3RhZyI6ImxlZ2FjeV9zZCJ9&_nc_ohc=2pNNGbVC3wwAX_ShNkV&_nc_ht=video-atl3-1.xx&oh=c221e598a2a657420b585f42c213e6bf&oe=5F5EC9E9,
4,1.0,,16.0,,1769672446516261,,https://facebook.com/story.php?story_fbid=1769672446516261&id=144868215663367,"Leanna Hanry added 47 new photos to the album: 2020 JC vs Foreman Pep Rally.
September 11 at 2:52 PM ·",0.0,"Leanna Hanry added 47 new photos to the album: 2020 JC vs Foreman Pep Rally.
September 11 at 2:52 PM ·",2020-09-11 15:56:00,,
5,3.0,https://scontent-atl3-1.xx.fbcdn.net/v/t1.0-9/fr/cp0/e15/q65/119136420_1769666059850233_2217157581549330560_o.jpg?_nc_cat=109&_nc_sid=8024bb&_nc_ohc=j-8kYgjvmtYAX9rM3o0&_nc_ht=scontent-atl3-1.xx&tp=14&oh=89e31ec978b046efeb7917ca2caa6339&oe=5F82A16C,19.0,https://bit.ly/3m7F9u1,1769667366516769,"Congratulations again to the Dragon Football Wall of Honor Class of 2020...the 1953 Dragon Team and the 1960 Dragon Team!
Due to Covid-19 restrictions, there will be no DFWOH reception or induction ceremony this year. Hopefully next year we will be able to hold a reception for these great teams along with next year's class!
However the DSN will virtually induct and honor these teams tonight on GAME NIGHT at 6pm if you would like to watch on the DSN YouTube Channel link at bit.ly/3m7F9u1",https://facebook.com/story.php?story_fbid=1769667366516769&id=144868215663367,,0.0,"Congratulations again to the Dragon Football Wall of Honor Class of 2020...the 1953 Dragon Team and the 1960 Dragon Team!
Due to Covid-19 restrictions, there will be no DFWOH reception or induction ceremony this year. Hopefully next year we will be able to hold a reception for these great teams along with next year's class!
However the DSN will virtually induct and honor these teams tonight on GAME NIGHT at 6pm if you would like to watch on the DSN YouTube Channel link at bit.ly/3m7F9u1",2020-09-11 15:47:21,,
6,0.0,,12.0,https://twitter.com/DragonSN_/status/1304483556023054341?s=20,1769644953185677,Yep...the DSN is excited! Join the DSN crew as they broadcast LIVE from the Bordertown! Go Dragons...Beat the Gators! #F7RE #Chasing8,https://facebook.com/story.php?story_fbid=1769644953185677&id=144868215663367,"TWITTER.COM
DragonSportsNetwork on Twitter",4.0,"Yep...the DSN is excited! Join the DSN crew as they broadcast LIVE from the Bordertown! Go Dragons...Beat the Gators! #F7RE #Chasing8

TWITTER.COM
DragonSportsNetwork on Twitter",2020-09-11 15:11:13,,
7,0.0,https://scontent-atl3-1.xx.fbcdn.net/v/t1.0-9/119236570_1769626913187481_3792238964579135125_o.png?_nc_cat=100&_nc_sid=2d5d41&_nc_ohc=VPSrqldZxH8AX9mfIxI&_nc_ht=scontent-atl3-1.xx&oh=a819b2d06ce9120bc1a855fc40ff925c&oe=5F82B0ED,7.0,,1769626906520815,"Northeast Claiborne Charter Students/Parents ONLY:
Louisiana is moving to phase 3 and the buses can transport up to 75% of the bus capacity. The mask mandate is still in effect.",,,0.0,"Northeast Claiborne Charter Students/Parents ONLY:
Louisiana is moving to phase 3 and the buses can transport up to 75% of the bus capacity. The mask mandate is still in effect.",2020-09-11 14:54:18,,
8,2.0,,7.0,https://www.youtube.com/channel/UC-yrP9lsdUN5u5dY3EBIZGw,1769616883188484,"The Dragon Sports Network will be bringing you LIVE action tonight from the Dragon/Gator game at 7:30pm. Join us prior to kickoff for DSN Game Night around 6:00pm featuring the Brad Smith Coaches Show, X-Wildcat's Pick 3, The 2A Report by Sohn Enis, 42 Sports The Vision, and a new special feature called The Playbook with Legendary Coach David Carpenter (X's and O's with someone who knows!!!)

Also special for tonight on the DSN is the induction of the Dragon Football Wall of Honor Class of 2020...The 1953 Dragon Team and the 1960 Dragon Team!

Kickoff is 7:30pm. Wayne Pumphrey and Jacob Pumphrey will have the call!

The DSN thanks our wonderful sponsors for helping us bring 2020 Dragon Football to the masses! #Chasing8",https://facebook.com/story.php?story_fbid=1769616883188484&id=144868215663367,"YOUTUBE.COM
DRAGON SPORTS NETWORK",0.0,"The Dragon Sports Network will be bringing you LIVE action tonight from the Dragon/Gator game at 7:30pm. Join us prior to kickoff for DSN Game Night around 6:00pm featuring the Brad Smith Coaches Show, X-Wildcat's Pick 3, The 2A Report by Sohn Enis, 42 Sports The Vision, and a new special feature called The Playbook with Legendary Coach David Carpenter (X's and O's with someone who knows!!!)

Also special for tonight on the DSN is the induction of the Dragon Football Wall of Honor Class of 2020...The 1953 Dragon Team and the 1960 Dragon Team!

Kickoff is 7:30pm. Wayne Pumphrey and Jacob Pumphrey will have the call!

The DSN thanks our wonderful sponsors for helping us bring 2020 Dragon Football to the masses! #Chasing8

YOUTUBE.COM
DRAGON SPORTS NETWORK",2020-09-11 14:42:30,,
9,0.0,,0.0,http://5il.co/4dw2,1769486139868225,"JCHS Announcements 9/11/2020
http://5il.co/4dw2",https://facebook.com/story.php?story_fbid=1769486139868225&id=144868215663367,,0.0,"JCHS Announcements 9/11/2020
http://5il.co/4dw2",2020-09-11 11:43:25,,
10,0.0,https://scontent-atl3-1.xx.fbcdn.net/v/t1.0-9/119205223_1769476786535827_7269317324672774327_n.png?_nc_cat=102&_nc_sid=2d5d41&_nc_ohc=CD1F2Wun9X0AX_bKjJ_&_nc_ht=scontent-atl3-1.xx&oh=52ff3d5f7250aad24dfb4e24033fe0d9&oe=5F8367C5,11.0,,1769476779869161,,,,0.0,,2020-09-11 11:33:42,,
11,0.0,,10.0,http://digital.olivesoftware.com/Olive/ODN/ElDorado/shared/ShowArticle.aspx?doc=ElDNTimes/2020/09/11&entity=Ar01306&sk=A71533DC,1769456366537869,"GO DRAGONS GO! Beat the Gators!
Admission: $5 Debit/Credit/Cash Accepted
Kickoff 7:30pm
•Covid Restrictions Apply to all Athletic Events.
•Mask up and Social Distance!",https://facebook.com/story.php?story_fbid=1769456366537869&id=144868215663367,"DIGITAL.OLIVESOFTWARE.COM
Junction City set to take on Foreman - El Dorado , 9/11/2020",6.0,"GO DRAGONS GO! Beat the Gators!
Admission: $5 Debit/Credit/Cash Accepted
Kickoff 7:30pm
•Covid Restrictions Apply to all Athletic Events.
•Mask up and Social Distance!

DIGITAL.OLIVESOFTWARE.COM
Junction City set to take on Foreman - El Dorado , 9/11/2020",2020-09-11 11:04:02,,
12,0.0,,3.0,,1769372133212959,Hey Dragon Fans! Stop by the Booster Club table tonight at the game and sign posters for our #1 Dragon Fan Caden! #FightLikeADragon #WeLoveYouCaden,https://facebook.com/story.php?story_fbid=1769372133212959&id=144868215663367,"Arlie Storm Richard is with Robby Lowe and 3 others.
September 10 at 8:47 PM ·

Hey Dragon Fans! Stop by the booster club table at the game tomorrow night on your way in and sign our posters for JC’s #1 Fan!! We love you and are continuously praying for you, Caden!! 💜💛🐉🏈",4.0,"Hey Dragon Fans! Stop by the Booster Club table tonight at the game and sign posters for our #1 Dragon Fan Caden! #FightLikeADragon #WeLoveYouCaden

Arlie Storm Richard is with Robby Lowe and 3 others.
September 10 at 8:47 PM ·

Hey Dragon Fans! Stop by the booster club table at the game tomorrow night on your way in and sign our posters for JC’s #1 Fan!! We love you and are continuously praying for you, Caden!! 💜💛🐉🏈",2020-09-11 09:15:09,,
13,1.0,https://scontent-atl3-1.xx.fbcdn.net/v/t1.0-9/fr/cp0/e15/q65/119097318_1769319036551602_6448895579394613999_o.jpg?_nc_cat=103&_nc_sid=2d5d41&_nc_ohc=k35IHE3BjY4AX8t6Tm1&_nc_ht=scontent-atl3-1.xx&tp=14&oh=70bffc1669045da1261db0ccc8f69a47&oe=5F8356BD,24.0,,1769319029884936,"We remember.

May God bless the families who lost loved ones on that fateful day and to our current first responders and true patriots, we thank you!
God Bless America!",,,0.0,"We remember.

May God bless the families who lost loved ones on that fateful day and to our current first responders and true patriots, we thank you!
God Bless America!",2020-09-11 08:00:13,,
14,0.0,https://scontent-atl3-1.xx.fbcdn.net/v/t1.0-9/119129078_1768741489942690_5031910468900176180_n.png?_nc_cat=109&_nc_sid=2d5d41&_nc_ohc=STb2lzJ_QFoAX-iAEvx&_nc_ht=scontent-atl3-1.xx&oh=959969bbd3a1174bacc4d2e55c9563dd&oe=5F84A57A,0.0,,1768741486609357,"JCSD-NECC Important Message from Ms. Hanry:
REMINDER: School pictures will be taken Tuesday, September 15.
Any virtual students wanting fall pictures made will need to check in with their respective office between 8:30-9:15am and they will be told where to go for pictures. After all virtual students pictures are made, we will then take pictures of the on-site students.
Masks and social distancing are required.",,,0.0,"JCSD-NECC Important Message from Ms. Hanry:
REMINDER: School pictures will be taken Tuesday, September 15.
Any virtual students wanting fall pictures made will need to check in with their respective office between 8:30-9:15am and they will be told where to go for pictures. After all virtual students pictures are made, we will then take pictures of the on-site students.
Masks and social distancing are required.",2020-09-10 15:59:44,,
15,0.0,https://scontent-atl3-1.xx.fbcdn.net/v/t1.0-9/119145417_1768706523279520_7881074533359073718_o.png?_nc_cat=103&_nc_sid=2d5d41&_nc_ohc=IhisNxXsE4sAX-3I-QS&_nc_ht=scontent-atl3-1.xx&oh=c82ee4c1391121f063bb25e6f0f9d62b&oe=5F853132,4.0,,1768706516612854,Tomorrow's spirit theme is DUO/SQUAD DAY! Pep Rally at 2:30pm between the buildings! Go Dragons...BEAT the Gators!,,,0.0,Tomorrow's spirit theme is DUO/SQUAD DAY! Pep Rally at 2:30pm between the buildings! Go Dragons...BEAT the Gators!,2020-09-10 15:00:09,,
16,0.0,https://scontent-atl3-1.xx.fbcdn.net/v/t1.0-9/fr/cp0/e15/q65/119131522_10158504326418397_5726400805947975140_o.jpg?_nc_cat=106&_nc_sid=2d5d41&_nc_ohc=6Gmpv-B9sf4AX8MpMYI&_nc_ht=scontent-atl3-1.xx&tp=14&oh=583f79a742db18fff17a1540e227168c&oe=5F82905C,0.0,http://myarkansaspbs.org/suicideprevention,1768700226613483,,https://facebook.com/story.php?story_fbid=1768700226613483&id=144868215663367,"Arkansas PBS
September 10 at 12:14 PM ·

#BeThe1 to help someone in need. Today is World Suicide Prevention Day, and we can all help. We’re proud to share essential, free “Suicide Prevention — Looking Deeper” resources where licensed professional counselor Shawna Burns discusses warning signs, risk factors and a plan for prevention at myarkansaspbs.org/suicideprevention.

Learn more about the full, 17-part series — originally created for educators by ArkansasIDEAS, a partnership between Arkansas Department of Education and Arkansas PBS — at http://bit.ly/SuicidePreventionMonth17PartSeries.

Are you in crisis now? Call the National Suicide Prevention Lifeline '1-800-273-TALK (8255)' now at 800-273-8255.",0.0,"Arkansas PBS
September 10 at 12:14 PM ·

#BeThe1 to help someone in need. Today is World Suicide Prevention Day, and we can all help. We’re proud to share essential, free “Suicide Prevention — Looking Deeper” resources where licensed professional counselor Shawna Burns discusses warning signs, risk factors and a plan for prevention at myarkansaspbs.org/suicideprevention.

Learn more about the full, 17-part series — originally created for educators by ArkansasIDEAS, a partnership between Arkansas Department of Education and Arkansas PBS — at http://bit.ly/SuicidePreventionMonth17PartSeries.

Are you in crisis now? Call the National Suicide Prevention Lifeline '1-800-273-TALK (8255)' now at 800-273-8255.",2020-09-10 14:49:06,,
17,1.0,https://scontent-atl3-1.xx.fbcdn.net/v/t1.0-9/fr/cp0/e15/q65/119145552_1768696079947231_4970596356700339492_o.jpg?_nc_cat=106&_nc_sid=2d5d41&_nc_ohc=aK45VrnFSMIAX_tm2BT&_nc_ht=scontent-atl3-1.xx&tp=14&oh=0bf6189e19cca20c7d80f081ad3e9058&oe=5F82B84B,40.0,,1768696076613898,"Principal Hill and the JCES students and staff want to shout ""A Big Thank You"" to Delek US for donating $500 for school supplies! #ThankYou",,,0.0,"Principal Hill and the JCES students and staff want to shout ""A Big Thank You"" to Delek US for donating $500 for school supplies! #ThankYou",2020-09-10 14:42:45,,
18,0.0,,0.0,http://5il.co/4dw2,1768635323286640,"JCHS Announcements 9/10/2020
http://5il.co/4dw2",https://facebook.com/story.php?story_fbid=1768635323286640&id=144868215663367,,0.0,"JCHS Announcements 9/10/2020
http://5il.co/4dw2",2020-09-10 13:04:52,,
19,1.0,,27.0,,1768619879954851,"Our Mighty Dragons host Foreman tomorrow at 7:30pm!
PEP RALLY TOMORROW AT 2:30PM BETWEEN THE BUILDINGS!
No Jr. game today.",https://facebook.com/story.php?story_fbid=1768619879954851&id=144868215663367,"FRI, SEP 11
Junction City vs. Foreman",0.0,"Our Mighty Dragons host Foreman tomorrow at 7:30pm!
PEP RALLY TOMORROW AT 2:30PM BETWEEN THE BUILDINGS!
No Jr. game today.

FRI, SEP 11
Junction City vs. Foreman",2020-09-10 12:42:12,,
20,0.0,,2.0,,1768571623293010,"JCSD-NECC Parents:
With spotty cell phone service right now, the following school landlines are working.
District Office 924-4575
Elementary Office 924-5463
High School Office 924-4519

Century Link service in town is down which has taken out the state internet and cell phone service. Our secondary internet is working so school email and school internet is working.",https://facebook.com/story.php?story_fbid=1768571623293010&id=144868215663367,,0.0,"JCSD-NECC Parents:
With spotty cell phone service right now, the following school landlines are working.
District Office 924-4575
Elementary Office 924-5463
High School Office 924-4519

Century Link service in town is down which has taken out the state internet and cell phone service. Our secondary internet is working so school email and school internet is working.",2020-09-10 11:29:34,,
21,0.0,,3.0,http://digital.olivesoftware.com/Olive/ODN/ElDorado/shared/ShowArticle.aspx?doc=ElDNTimes/2020/09/10&entity=Ar01307&sk=3450CB6F,1768550959961743,GO DRAGONS!🏈,https://facebook.com/story.php?story_fbid=1768550959961743&id=144868215663367,"DIGITAL.OLIVESOFTWARE.COM
Arkansas Prep Football Poll - El Dorado , 9/10/2020",0.0,"GO DRAGONS!🏈

DIGITAL.OLIVESOFTWARE.COM
Arkansas Prep Football Poll - El Dorado , 9/10/2020",2020-09-10 11:03:00,,
22,3.0,https://scontent-atl3-1.xx.fbcdn.net/v/t1.0-9/fr/cp0/e15/q65/119127185_1768510429965796_6022544062574483216_n.jpg?_nc_cat=109&_nc_sid=8024bb&_nc_ohc=vBtirMyXJs8AX_Sug0z&_nc_ht=scontent-atl3-1.xx&tp=14&oh=3b0ece6362ddb6e348fd25f831e6ace4&oe=5F8307AF,35.0,,1768515499965289,"We are so proud of JCHS Class of 1998 Alumnus, ZaKiya A. Wilson, for co-authoring the new children's book ""Just Like Me!"" You can order this book through Amazon and Barnes & Noble. We are DRAGON PROUD! #NextLevelDragons",https://facebook.com/story.php?story_fbid=1768515499965289&id=144868215663367,,0.0,"We are so proud of JCHS Class of 1998 Alumnus, ZaKiya A. Wilson, for co-authoring the new children's book ""Just Like Me!"" You can order this book through Amazon and Barnes & Noble. We are DRAGON PROUD! #NextLevelDragons",2020-09-10 10:19:53,,
23,0.0,https://scontent-atl3-1.xx.fbcdn.net/v/t1.0-9/119169036_1768505199966319_1932786922582034222_n.png?_nc_cat=106&_nc_sid=2d5d41&_nc_ohc=uIrt_OAISpoAX8QGRQy&_nc_ht=scontent-atl3-1.xx&oh=402f7c343148ed6aa392e170054cf7db&oe=5F85DD53,0.0,,1768505193299653,"JCSD-NECC Parents: The state internet and phone network is down. This outage is interrupting virtual education. Please use the following mobile phone numbers to reach us until our internet and phone system is restored.
•H.S. Office 870 315-2565
•H.S. Principal 870 315-2670
•Elem. Office 870 315-2631
•Elem. Principal 870 315-2637
•Super Office 870 315-2686",,,0.0,"JCSD-NECC Parents: The state internet and phone network is down. This outage is interrupting virtual education. Please use the following mobile phone numbers to reach us until our internet and phone system is restored.
•H.S. Office 870 315-2565
•H.S. Principal 870 315-2670
•Elem. Office 870 315-2631
•Elem. Principal 870 315-2637
•Super Office 870 315-2686",2020-09-10 10:06:44,,
24,0.0,https://scontent-atl3-1.xx.fbcdn.net/v/t1.0-9/fr/cp0/e15/q65/119071323_1768455866637919_1874203888007607969_o.jpg?_nc_cat=104&_nc_sid=8024bb&_nc_ohc=kX6i32RrLw0AX8ZXAfC&_nc_ht=scontent-atl3-1.xx&tp=14&oh=c528ec6590b1601a89757f8e1faf481e&oe=5F825835,9.0,,1768459359970903,"Congratulations to the Dragon Football Wall of Honor Class of 2020...The 1953 Dragon Team and the 1960 Dragon Team!

Due to Covid-19 restrictions, there will be no DFWOH reception or induction ceremony this year. Hopefully next year we will be able to hold a reception for these great teams along with next year's class! With this year's inductees being teams, there is bound to be a player you are kin to or know! Give a shout out and tag!",https://facebook.com/story.php?story_fbid=1768459359970903&id=144868215663367,,0.0,"Congratulations to the Dragon Football Wall of Honor Class of 2020...The 1953 Dragon Team and the 1960 Dragon Team!

Due to Covid-19 restrictions, there will be no DFWOH reception or induction ceremony this year. Hopefully next year we will be able to hold a reception for these great teams along with next year's class! With this year's inductees being teams, there is bound to be a player you are kin to or know! Give a shout out and tag!",2020-09-10 09:05:54,,
25,0.0,,2.0,https://youtu.be/vfvfh2qrwUk,1767981056685400,,https://facebook.com/story.php?story_fbid=1767981056685400&id=144868215663367,"YOUTUBE.COM
covid 19 overview",0.0,"YOUTUBE.COM
covid 19 overview",2020-09-09 19:25:44,,
26,0.0,,0.0,https://5il.co/kt4q,1767959800020859,"JCSD-NECC Important letter regarding COVID-19 guidance.
Please click link to read: https://5il.co/kt4q",https://facebook.com/story.php?story_fbid=1767959800020859&id=144868215663367,,0.0,"JCSD-NECC Important letter regarding COVID-19 guidance.
Please click link to read: https://5il.co/kt4q",2020-09-09 19:00:08,,
27,0.0,,17.0,,1767897383360434,2021 Senior Portraits!,https://facebook.com/story.php?story_fbid=1767897383360434&id=144868215663367,"Leanna Hanry added 187 new photos to the album: 2020-2021 JCHS Senior Portrait Day.
September 9 at 12:56 PM ·",0.0,"2021 Senior Portraits!

Leanna Hanry added 187 new photos to the album: 2020-2021 JCHS Senior Portrait Day.
September 9 at 12:56 PM ·",2020-09-09 17:13:42,,
28,0.0,https://scontent-atl3-1.xx.fbcdn.net/v/t1.0-9/fr/cp0/e15/q65/119102596_1767894836694022_4709069438034473527_n.jpg?_nc_cat=101&_nc_sid=2d5d41&_nc_ohc=qhQ6x4ZDFEUAX8ELQWD&_nc_oc=AQnmEy-GWsIldryDHfC3eZFk2keY-L6fYWeTpssGMEJZ31pcwkX0_wDMHha45skUXvs&_nc_ht=scontent-atl3-1.xx&tp=14&oh=efce464fe436905ad6718d543b4a1e2a&oe=5F8275AA,1.0,,1767894833360689,"REMINDER: Scheduled Substitute Training will be held tomorrow, Thursday September 10. You must already have a scheduled time to report to be able to attend.",,,0.0,"REMINDER: Scheduled Substitute Training will be held tomorrow, Thursday September 10. You must already have a scheduled time to report to be able to attend.",2020-09-09 17:08:54,,
29,0.0,,0.0,https://5il.co/ktg2,1767888540027985,Order your 2020-2021 Dragon Yearbook now for $40! The cost of the yearbook will increase to $45 after September 25! Click this link for order form!,https://facebook.com/story.php?story_fbid=1767888540027985&id=144868215663367,"CORE-DOCS.S3.AMAZONAWS.COM
core-docs.s3.amazonaws.com",0.0,"Order your 2020-2021 Dragon Yearbook now for $40! The cost of the yearbook will increase to $45 after September 25! Click this link for order form!

CORE-DOCS.S3.AMAZONAWS.COM
core-docs.s3.amazonaws.com",2020-09-09 16:55:34,,
30,0.0,https://scontent-atl3-1.xx.fbcdn.net/v/t1.0-9/119007469_1767877540029085_3985129876927238781_n.png?_nc_cat=104&_nc_sid=2d5d41&_nc_ohc=Fgu4NRJY5jUAX8fkRQH&_nc_ht=scontent-atl3-1.xx&oh=187408c022f4c6a8f9b5520d04db7855&oe=5F860B91,3.0,,1767877533362419,"JCSD-NECC Grades K-11 Fall School Pictures will be taken on Tuesday, September 15!",,,0.0,"JCSD-NECC Grades K-11 Fall School Pictures will be taken on Tuesday, September 15!",2020-09-09 16:34:46,,
31,0.0,https://scontent-atl3-1.xx.fbcdn.net/v/t1.0-9/119097986_1767841416699364_6633728092164067354_n.png?_nc_cat=103&_nc_sid=8024bb&_nc_ohc=b8aqaeSWNAcAX_Nbmb6&_nc_ht=scontent-atl3-1.xx&oh=430f6277a2dfef8ee7e2158655d14089&oe=5F845299,0.0,,1767841533366019,"JCSD-NECC Parents: The state network is not working properly and we realize we may have missed some calls. Please use the following mobile phone numbers to reach us until our district network landlines are restored.
•H.S. Office 870 315-2565
•H.S. Principal 870 315-2670
•Elem. Office 870 315-2631
•Elem. Principal 870 315-2637
•Super Office 870 315-2686",https://facebook.com/story.php?story_fbid=1767841533366019&id=144868215663367,,0.0,"JCSD-NECC Parents: The state network is not working properly and we realize we may have missed some calls. Please use the following mobile phone numbers to reach us until our district network landlines are restored.
•H.S. Office 870 315-2565
•H.S. Principal 870 315-2670
•Elem. Office 870 315-2631
•Elem. Principal 870 315-2637
•Super Office 870 315-2686",2020-09-09 15:25:46,,
32,0.0,,10.0,,1767723736711132,"GO DRAGONS! BEAT THE GATORS!
Friday, September 11, 2020 at 7:30!
•Admission is $5.00 - Debit/Credit/Cash Accepted.
•Covid Restrictions Apply to all Athletic Events.
•Mask up and Social Distance!

There will be no Jr. High game Thursday and no pep rally on Friday.

Junction City Dragons High School Football",https://facebook.com/story.php?story_fbid=1767723736711132&id=144868215663367,,0.0,"GO DRAGONS! BEAT THE GATORS!
Friday, September 11, 2020 at 7:30!
•Admission is $5.00 - Debit/Credit/Cash Accepted.
•Covid Restrictions Apply to all Athletic Events.
•Mask up and Social Distance!

There will be no Jr. High game Thursday and no pep rally on Friday.

Junction City Dragons High School Football",2020-09-09 12:20:25,,
33,0.0,,0.0,http://apasurvey.link/arkfeedback,1767681806715325,"Educators, families and community members are invited to participate in an online survey to gather feedback regarding education funding and other education issues in Arkansas.

Augenblick, Palaich and Associates (APA) is conducting a school finance study for the Arkansas House and Senate Education Committees. The Committees and APA believe that incorporating the perspective of educators and the community in Arkansas is essential to the study and will be gathering feedback on multiple study areas, including:
•What it means for students to be college and career ready when they graduate,
•Educational opportunities for students around the state,
•How well districts and charter systems in the state can attract and retain staff, and
•Education resources and funding in Arkansas, including the state education funding matrix and additional funding for specific student groups.

The survey is open to all educators and the general public until September 18th and can be found at the following link: apasurvey.link/arkfeedback",https://facebook.com/story.php?story_fbid=1767681806715325&id=144868215663367,"APACONSULTING.QUALTRICS.COM
Online Survey Software | Qualtrics Survey Solutions",0.0,"Educators, families and community members are invited to participate in an online survey to gather feedback regarding education funding and other education issues in Arkansas.

Augenblick, Palaich and Associates (APA) is conducting a school finance study for the Arkansas House and Senate Education Committees. The Committees and APA believe that incorporating the perspective of educators and the community in Arkansas is essential to the study and will be gathering feedback on multiple study areas, including:
•What it means for students to be college and career ready when they graduate,
•Educational opportunities for students around the state,
•How well districts and charter systems in the state can attract and retain staff, and
•Education resources and funding in Arkansas, including the state education funding matrix and additional funding for specific student groups.

The survey is open to all educators and the general public until September 18th and can be found at the following link: apasurvey.link/arkfeedback

APACONSULTING.QUALTRICS.COM
Online Survey Software | Qualtrics Survey Solutions",2020-09-09 11:24:15,,
34,0.0,,0.0,http://5il.co/4dw2,1767648673385305,"JCHS Announcements 9/9/2020
http://5il.co/4dw2",https://facebook.com/story.php?story_fbid=1767648673385305&id=144868215663367,,0.0,"JCHS Announcements 9/9/2020
http://5il.co/4dw2",2020-09-09 10:38:52,,
35,0.0,,3.0,https://youtu.be/Yh1lMtnUNuQ,1766992660117573,"Check out this important DEN video!

Robby Lowe Deneen Miller Donna McLelland",https://facebook.com/story.php?story_fbid=1766992660117573&id=144868215663367,"YOUTUBE.COM
About the P-EBT application for families",0.0,"Check out this important DEN video!

Robby Lowe Deneen Miller Donna McLelland

YOUTUBE.COM
About the P-EBT application for families",2020-09-08 20:06:13,,
36,0.0,,6.0,https://scorebooklive.com/arkansas/2020/09/08/vote-now-who-should-be-sblives-arkansas-high-school-athlete-of-the-week-2/,1766990690117770,"Please go vote for our Dragons.

👀 Dragon Nation.... We have two Mighty Dragons Nominated for SBLive’s Arkansas High School Athlete of the Week... AJ Ivory and Tate Barnett",https://facebook.com/story.php?story_fbid=1766990690117770&id=144868215663367,"SCOREBOOKLIVE.COM
Vote now: Who should be SBLive’s Arkansas high school athlete of the week? - Arkansas High School Sports News, Scores, Rankings - SBLive Arkansas",2.0,"Please go vote for our Dragons.

👀 Dragon Nation.... We have two Mighty Dragons Nominated for SBLive’s Arkansas High School Athlete of the Week... AJ Ivory and Tate Barnett

SCOREBOOKLIVE.COM
Vote now: Who should be SBLive’s Arkansas high school athlete of the week? - Arkansas High School Sports News, Scores, Rankings - SBLive Arkansas",2020-09-08 20:02:53,,
37,1.0,,1.0,,1766747543475418,Band Parents...your help is needed!!,https://facebook.com/story.php?story_fbid=1766747543475418&id=144868215663367,"Alana Girard‎Junction City Dragon Band
September 8 at 11:07 AM ·

Band parents: who is available to work concession stand Friday night?",0.0,"Band Parents...your help is needed!!

Alana Girard‎Junction City Dragon Band
September 8 at 11:07 AM ·

Band parents: who is available to work concession stand Friday night?",2020-09-08 13:00:19,,
38,0.0,,0.0,,,Band parents: who is available to work concession stand Friday night?,,,0.0,Band parents: who is available to work concession stand Friday night?,,,
39,0.0,https://scontent-atl3-1.xx.fbcdn.net/v/t1.0-9/fr/cp0/e15/q65/118975072_1766656090151230_7912734151896668805_n.jpg?_nc_cat=111&_nc_sid=110474&_nc_ohc=wXNbWuacN5gAX8g0CRM&_nc_ht=scontent-atl3-1.xx&tp=14&oh=6d78d93108fba2404e463073605ef6f8&oe=5F845CE1,1.0,,1766656426817863,"JCSD School Board Meeting tonight at 6:00pm in the Special Programs Building.
Until further notice all JCSD Board Meetings will be held at 6:00 instead of 6:30.",https://facebook.com/story.php?story_fbid=1766656426817863&id=144868215663367,,0.0,"JCSD School Board Meeting tonight at 6:00pm in the Special Programs Building.
Until further notice all JCSD Board Meetings will be held at 6:00 instead of 6:30.",2020-09-08 10:55:55,,
40,0.0,https://scontent-atl3-1.xx.fbcdn.net/v/t1.0-9/fr/cp0/e15/q65/119006209_1766649033485269_8503042720701726876_n.jpg?_nc_cat=105&_nc_sid=110474&_nc_ohc=qjDgALtUmRUAX9KnEJk&_nc_ht=scontent-atl3-1.xx&tp=14&oh=a08dbc4563561d9bfa41af9f50cfd4b2&oe=5F83E8EE,7.0,,1766649170151922,,https://facebook.com/story.php?story_fbid=1766649170151922&id=144868215663367,,0.0,,2020-09-08 10:47:10,,
41,0.0,,4.0,http://digital.olivesoftware.com/Olive/ODN/ElDorado/shared/ShowArticle.aspx?doc=ElDNTimes/2020/09/06&entity=Ar01802&sk=2B94BAFF,1766546276828878,Way to go Dragons!!🏈,https://facebook.com/story.php?story_fbid=1766546276828878&id=144868215663367,"DIGITAL.OLIVESOFTWARE.COM
Dragons upend Bucks - El Dorado , 9/6/2020",0.0,"Way to go Dragons!!🏈

DIGITAL.OLIVESOFTWARE.COM
Dragons upend Bucks - El Dorado , 9/6/2020",2020-09-08 08:30:12,,
42,0.0,,6.0,https://scorebooklive.com/arkansas/2020/09/06/top-stars-best-performances-in-week-2-of-arkansas-high-school-football/,1766196966863809,,https://facebook.com/story.php?story_fbid=1766196966863809&id=144868215663367,"ARKANSAS.SCOREBOOKLIVE.COM
Top stars, best performances in Week 2 of Arkansas high school football - Arkansas High School Sports News, Scores, Rankings - SBLive Arkansas",0.0,"ARKANSAS.SCOREBOOKLIVE.COM
Top stars, best performances in Week 2 of Arkansas high school football - Arkansas High School Sports News, Scores, Rankings - SBLive Arkansas",2020-09-07 23:20:49,,
43,0.0,,1.0,,1766088286874677,2021 JCHS SENIORS!!!,https://facebook.com/story.php?story_fbid=1766088286874677&id=144868215663367,"Leanna Hanry is with Melissa Hayes Pumphrey.
September 7 at 3:57 PM ·

Attention JCHS Seniors: Senior Portraits are this Wednesday, September 9, 2020 in the MPR. Scheduled times did not change. Please make every effort to be here unless you are sick￼",3.0,"2021 JCHS SENIORS!!!

Leanna Hanry is with Melissa Hayes Pumphrey.
September 7 at 3:57 PM ·

Attention JCHS Seniors: Senior Portraits are this Wednesday, September 9, 2020 in the MPR. Scheduled times did not change. Please make every effort to be here unless you are sick￼",2020-09-07 20:27:56,,
44,0.0,,0.0,,,"Attention JCHS Seniors: Senior Portraits are this Wednesday, September 9, 2020 in the MPR. Scheduled times did not change. Please make every effort to be here unless you are sick￼",https://facebook.com/story.php?story_fbid=10223762433310035&id=1269827084,,0.0,"Attention JCHS Seniors: Senior Portraits are this Wednesday, September 9, 2020 in the MPR. Scheduled times did not change. Please make every effort to be here unless you are sick￼",,,
45,0.0,,0.0,http://www.flashingredkidsahead.org/,1762750410541798,,https://facebook.com/story.php?story_fbid=1762750410541798&id=144868215663367,"Arkansas Department of Education
September 4 at 1:15 PM ·

Everyone has a responsibility to ensure students arrive to and from school safely. Remember, it is illegal to pass a stopped school bus whenever its red lights are flashing. www.flashingredkidsahead.org #FlashingRedKidsAhead",0.0,"Arkansas Department of Education
September 4 at 1:15 PM ·

Everyone has a responsibility to ensure students arrive to and from school safely. Remember, it is illegal to pass a stopped school bus whenever its red lights are flashing. www.flashingredkidsahead.org #FlashingRedKidsAhead",2020-09-04 17:07:22,https://video-atl3-1.xx.fbcdn.net/v/t42.9040-2/118710952_709017646360493_8821780100019511413_n.mp4?_nc_cat=110&_nc_sid=985c63&efg=eyJ2ZW5jb2RlX3RhZyI6ImxlZ2FjeV9zZCJ9&_nc_ohc=eV0T5IQLN4QAX8p3Jw7&_nc_ht=video-atl3-1.xx&oh=f4b8fb166b7a520b3c157c0e9ff2c95f&oe=5F5EC0E7,
46,0.0,https://scontent-atl3-1.xx.fbcdn.net/v/t1.0-9/fr/cp0/e15/q65/118829020_1762559240560915_8782222282414724468_n.jpg?_nc_cat=105&_nc_sid=8024bb&_nc_ohc=c5Qp_OqnJscAX_j0wbS&_nc_ht=scontent-atl3-1.xx&tp=14&oh=1d1e887e31cff56d860b5ce99edd9cda&oe=5F85BCAA,17.0,,1762559857227520,We wish everyone a safe and happy Labor Day Weekend! Enjoy!,https://facebook.com/story.php?story_fbid=1762559857227520&id=144868215663367,,0.0,We wish everyone a safe and happy Labor Day Weekend! Enjoy!,2020-09-04 12:20:54,,
47,0.0,,0.0,,1762548217228684,,https://facebook.com/story.php?story_fbid=1762548217228684&id=144868215663367,"Junction City Dragons High School Football
September 4 at 9:50 AM ·

Junction City Dragons @ Smackover Buckaroos tonight @ 7

You must have a voucher to purchase a ticket.",0.0,"Junction City Dragons High School Football
September 4 at 9:50 AM ·

Junction City Dragons @ Smackover Buckaroos tonight @ 7

You must have a voucher to purchase a ticket.",2020-09-04 12:07:27,,
48,0.0,,7.0,,1762544213895751,Please note: The Jr. High Football Game schedule for next week September 10 at Parkers Chapel has been rescheduled for September 17 at 7pm at Parkers Chapel. Please spread the word.,,,0.0,Please note: The Jr. High Football Game schedule for next week September 10 at Parkers Chapel has been rescheduled for September 17 at 7pm at Parkers Chapel. Please spread the word.,2020-09-04 12:02:35,,
49,0.0,,5.0,https://twitter.com/DragonSN_/status/1301905551517835266?s=20,1762531830563656,The DSN may be fired up for tonight!!! Check out their Twitter post!,https://facebook.com/story.php?story_fbid=1762531830563656&id=144868215663367,"TWITTER.COM
DragonSportsNetwork on Twitter",0.0,"The DSN may be fired up for tonight!!! Check out their Twitter post!

TWITTER.COM
DragonSportsNetwork on Twitter",2020-09-04 11:44:48,,
50,0.0,https://scontent-atl3-1.xx.fbcdn.net/v/t1.0-9/fr/cp0/e15/q65/118787526_1762530307230475_9122603822748152653_n.jpg?_nc_cat=103&_nc_sid=8024bb&_nc_ohc=D_o4PxyeA-wAX9Y9Tcc&_nc_ht=scontent-atl3-1.xx&tp=14&oh=35af9742accd23c53b5c0809f7caf1e8&oe=5F8348E6,0.0,https://5il.co/kmnj,1762531047230401,"JCHS 7-12 Students:
FALL FBLA CONFERENCE OCTOBER 9! - FORMS DUE SEPTEMBER 16!

Jr. High (7-8 grades) FORMS https://5il.co/kmnj
High School (9-12 grades) FORMS https://5il.co/kmni

We are so excited that even with COVID-19, FBLA will have a virtual Fall Leadership conference on campus in the MPR. On Friday, October 9th, High School will meet in the morning and then Junior High will meet after lunch. We will have lunch too! It won't be exactly like going to the conference, but will be the next best thing AND we don't have to get up early to do so. Please return the $25 dues (this is dues, fall conference registration, tshirt and lunch) and form to Mrs. Carelock by September 16.

Ways to sign up:
1 - You can fill out the form online and email Mrs. Carelock @ carelocke@jcdragons.k12.ar.us. Then send the money to school with the student's name on it.
2 - You can print form from internet and return with dues to school.
3 - You can pick up form from Mrs. Carelock and return by September 16 with dues.",https://facebook.com/story.php?story_fbid=1762531047230401&id=144868215663367,,0.0,"JCHS 7-12 Students:
FALL FBLA CONFERENCE OCTOBER 9! - FORMS DUE SEPTEMBER 16!

Jr. High (7-8 grades) FORMS https://5il.co/kmnj
High School (9-12 grades) FORMS https://5il.co/kmni

We are so excited that even with COVID-19, FBLA will have a virtual Fall Leadership conference on campus in the MPR. On Friday, October 9th, High School will meet in the morning and then Junior High will meet after lunch. We will have lunch too! It won't be exactly like going to the conference, but will be the next best thing AND we don't have to get up early to do so. Please return the $25 dues (this is dues, fall conference registration, tshirt and lunch) and form to Mrs. Carelock by September 16.

Ways to sign up:
1 - You can fill out the form online and email Mrs. Carelock @ carelocke@jcdragons.k12.ar.us. Then send the money to school with the student's name on it.
2 - You can print form from internet and return with dues to school.
3 - You can pick up form from Mrs. Carelock and return by September 16 with dues.",2020-09-04 11:43:43,,
51,0.0,,7.0,http://digital.olivesoftware.com/Olive/ODN/ElDorado/shared/ShowArticle.aspx?doc=ElDNTimes/2020/09/04&entity=Ar01501&sk=5184ABFC,1762518887231617,GO DRAGONS! #Chasing8,https://facebook.com/story.php?story_fbid=1762518887231617&id=144868215663367,"DIGITAL.OLIVESOFTWARE.COM
Impact players highlight Bucks, Dragons - El Dorado , 9/4/2020",2.0,"GO DRAGONS! #Chasing8

DIGITAL.OLIVESOFTWARE.COM
Impact players highlight Bucks, Dragons - El Dorado , 9/4/2020",2020-09-04 11:26:26,,
52,0.0,,11.0,http://digital.olivesoftware.com/Olive/ODN/ElDorado/shared/ShowArticle.aspx?doc=ElDNTimes/2020/09/04&entity=Ar01301&sk=9CAE760F,1762518293898343,Go Dragons! Beat the Bucks!,https://facebook.com/story.php?story_fbid=1762518293898343&id=144868215663367,"DIGITAL.OLIVESOFTWARE.COM
Junction City, Smackover ready to collide - El Dorado , 9/4/2020",0.0,"Go Dragons! Beat the Bucks!

DIGITAL.OLIVESOFTWARE.COM
Junction City, Smackover ready to collide - El Dorado , 9/4/2020",2020-09-04 11:25:38,,
53,0.0,,2.0,https://5il.co/kcyq,1762489723901200,"•No Pep Rally today.
•Early dismissal...Elem 2:20 and HS 2:30
•Let's ""cheer"" it for the boys!
Click for 2020 Dragon Football Roster! https://5il.co/kcyq",https://facebook.com/story.php?story_fbid=1762489723901200&id=144868215663367,"CORE-DOCS.S3.AMAZONAWS.COM
core-docs.s3.amazonaws.com",0.0,"•No Pep Rally today.
•Early dismissal...Elem 2:20 and HS 2:30
•Let's ""cheer"" it for the boys!
Click for 2020 Dragon Football Roster! https://5il.co/kcyq

CORE-DOCS.S3.AMAZONAWS.COM
core-docs.s3.amazonaws.com",2020-09-04 10:47:37,,
54,0.0,,2.0,http://5il.co/4dw2,1762485237234982,"JCHS Announcements 9/4/2020
http://5il.co/4dw2",https://facebook.com/story.php?story_fbid=1762485237234982&id=144868215663367,,0.0,"JCHS Announcements 9/4/2020
http://5il.co/4dw2",2020-09-04 10:42:57,,
55,5.0,,13.0,https://www.youtube.com/channel/UC-yrP9lsdUN5u5dY3EBIZGw,1762474437236062,"TONIGHT the DSN will bringing you LIVE action of the DRAGON/BUCKAROO game from Smackover beginning at 6:30 for DSN GAME NIGHT followed by kickoff at 7:00PM! A BIG THANK YOU to our DSN crew and sponsors for helping bring Dragon Football to the masses! #GoDragons #Chasing8

*Please note: Some fans have notified us that the radio didn't broadcast last week's game. Please call/notify the radio station directly because they feed off of our DSN streaming and the DSN has no control over the radio aspect of our broadcast. 101.5 The Hog",https://facebook.com/story.php?story_fbid=1762474437236062&id=144868215663367,"YOUTUBE.COM
DRAGON SPORTS NETWORK",3.0,"TONIGHT the DSN will bringing you LIVE action of the DRAGON/BUCKAROO game from Smackover beginning at 6:30 for DSN GAME NIGHT followed by kickoff at 7:00PM! A BIG THANK YOU to our DSN crew and sponsors for helping bring Dragon Football to the masses! #GoDragons #Chasing8

*Please note: Some fans have notified us that the radio didn't broadcast last week's game. Please call/notify the radio station directly because they feed off of our DSN streaming and the DSN has no control over the radio aspect of our broadcast. 101.5 The Hog

YOUTUBE.COM
DRAGON SPORTS NETWORK",2020-09-04 10:30:53,,
56,0.0,,0.0,http://dese.ade.arkansas.gov/public/userfiles/Communications/COVID-19%20Information/The_Kids_Guide_to_the_Coronavirus_Arkansas.pdf,1762422480574591,"Click link to read the ""Kids Guide to the Coronavirus!""",https://facebook.com/story.php?story_fbid=1762422480574591&id=144868215663367,"DESE.ADE.ARKANSAS.GOV
dese.ade.arkansas.gov",0.0,"Click link to read the ""Kids Guide to the Coronavirus!""

DESE.ADE.ARKANSAS.GOV
dese.ade.arkansas.gov",2020-09-04 09:25:02,,
57,0.0,,27.0,,1762356360581203,GAME TIME 7:00PM,https://facebook.com/story.php?story_fbid=1762356360581203&id=144868215663367,"FRI, SEP 4
Junction City @ Smackover",0.0,"GAME TIME 7:00PM

FRI, SEP 4
Junction City @ Smackover",2020-09-04 07:44:57,,
58,0.0,,7.0,,1761927417290764,JCSD-NECC will dismiss school early tomorrow Sept. 4 at 2:30pm. Elementary will dismiss at 2:20pm. Have a wonderful and safe Labor Day Weekend!,https://facebook.com/story.php?story_fbid=1761927417290764&id=144868215663367,,0.0,JCSD-NECC will dismiss school early tomorrow Sept. 4 at 2:30pm. Elementary will dismiss at 2:20pm. Have a wonderful and safe Labor Day Weekend!,2020-09-03 20:00:21,,
59,1.0,https://scontent-atl3-1.xx.fbcdn.net/v/t1.0-9/fr/cp0/e15/q65/118802303_1761837703966402_4437138543825715019_o.jpg?_nc_cat=109&_nc_sid=2d5d41&_nc_ohc=EN-dRSI8x-oAX_X9FHN&_nc_ht=scontent-atl3-1.xx&tp=14&oh=f14811ed18213eff2c10cccbd8530bae&oe=5F851774,8.0,,1761837693966403,"JCSD-NECC Important Message Regarding Free School Breakfast/Lunch Forms:

The United States Department of Agriculture (USDA) and the Arkansas Department of Education announced Wednesday, September 3 that all students will be provided free lunch and breakfast until December 31, 2020 as a response to COVID-19. The school needs all parents to complete and return the free lunch forms that were sent home with your students at the beginning of the year so that when USDA’s waiver on paid lunch ends, we can resume our free and reduced lunch program. Also, free and reduced lunch percentages are used to calculate supplemental Federal and State special funding that supports educational programs. We ask all parents to complete forms and return them as soon as possible. We do not know if the waiver will be extended to include the second semester.",,,0.0,"JCSD-NECC Important Message Regarding Free School Breakfast/Lunch Forms:

The United States Department of Agriculture (USDA) and the Arkansas Department of Education announced Wednesday, September 3 that all students will be provided free lunch and breakfast until December 31, 2020 as a response to COVID-19. The school needs all parents to complete and return the free lunch forms that were sent home with your students at the beginning of the year so that when USDA’s waiver on paid lunch ends, we can resume our free and reduced lunch program. Also, free and reduced lunch percentages are used to calculate supplemental Federal and State special funding that supports educational programs. We ask all parents to complete forms and return them as soon as possible. We do not know if the waiver will be extended to include the second semester.",2020-09-03 17:18:59,,
60,1.0,https://scontent-atl3-1.xx.fbcdn.net/v/t1.0-9/fr/cp0/e15/q65/118622644_2812800088947954_649190093858932039_n.jpg?_nc_cat=101&_nc_sid=110474&_nc_ohc=VvNuoFdZfMAAX8MoV9S&_nc_ht=scontent-atl3-1.xx&tp=14&oh=7dade8ec981daebb3d742096e7259b39&oe=5F827CB7,6.0,,1761646807318825,Mask Up Dragon Nation!!!,https://facebook.com/story.php?story_fbid=1761646807318825&id=144868215663367,"Junction City Elementary PTO
August 31 at 10:00 AM ·

Don’t forget to go see Mrs. Stacy Sweet in the elementary office to purchase a Dragon mask!

Adult and Youth sizes $12 each

💜🐉😷💛",0.0,"Mask Up Dragon Nation!!!

Junction City Elementary PTO
August 31 at 10:00 AM ·

Don’t forget to go see Mrs. Stacy Sweet in the elementary office to purchase a Dragon mask!

Adult and Youth sizes $12 each

💜🐉😷💛",2020-09-03 12:35:41,,
61,0.0,,1.0,https://5il.co/kl07,1761643790652460,"🏈We are cheering for our Jr. Dragons! Beat the Bucks!🏈
Click for roster!",https://facebook.com/story.php?story_fbid=1761643790652460&id=144868215663367,"CORE-DOCS.S3.AMAZONAWS.COM
core-docs.s3.amazonaws.com",2.0,"🏈We are cheering for our Jr. Dragons! Beat the Bucks!🏈
Click for roster!

CORE-DOCS.S3.AMAZONAWS.COM
core-docs.s3.amazonaws.com",2020-09-03 12:31:12,,
62,0.0,https://scontent-atl3-1.xx.fbcdn.net/v/t1.0-9/118762891_1761553293994843_8443409369154579325_n.png?_nc_cat=104&_nc_sid=8024bb&_nc_ohc=F0QZ6nX65WEAX-es3ee&_nc_ht=scontent-atl3-1.xx&oh=33b89dac957cdd5fd9feff85fb3c00dd&oe=5F8585A6,12.0,,1761553513994821,Jr. High Pep Rally at 1:50pm between the Jr. and Sr. High buildings! Go Jr. Dragons...Beat the Bucks!,https://facebook.com/story.php?story_fbid=1761553513994821&id=144868215663367,,0.0,Jr. High Pep Rally at 1:50pm between the Jr. and Sr. High buildings! Go Jr. Dragons...Beat the Bucks!,2020-09-03 10:29:24,,
63,0.0,,2.0,http://5il.co/4dw2,1761549757328530,JCHS Announcements 9/3/2020 http://5il.co/4dw2 We have many students who have not returned their school enrollment packets. Please do so ASAP. The packets are available in the office or to complete online at https://www.junctioncity.k12.ar.us/2020-21-student-enrollment-packet,https://facebook.com/story.php?story_fbid=1761549757328530&id=144868215663367,"CORE-DOCS.S3.AMAZONAWS.COM
core-docs.s3.amazonaws.com",0.0,"JCHS Announcements 9/3/2020 http://5il.co/4dw2 We have many students who have not returned their school enrollment packets. Please do so ASAP. The packets are available in the office or to complete online at https://www.junctioncity.k12.ar.us/2020-21-student-enrollment-packet

CORE-DOCS.S3.AMAZONAWS.COM
core-docs.s3.amazonaws.com",2020-09-03 10:25:56,,
64,0.0,https://scontent-atl3-1.xx.fbcdn.net/v/t1.0-9/fr/cp0/e15/q65/118769420_1761486387334867_4695695575012479814_n.jpg?_nc_cat=103&_nc_sid=2d5d41&_nc_ohc=3OPy9reqzroAX_OfVnh&_nc_ht=scontent-atl3-1.xx&tp=14&oh=0ac0387ef3097afa66d9c87563d39e36&oe=5F833901,18.0,,1761486377334868,Jr. Dragons Host the Smackover Jr. Bucks tonight at 7pm! Go Dragons!,,,0.0,Jr. Dragons Host the Smackover Jr. Bucks tonight at 7pm! Go Dragons!,2020-09-03 09:03:55,,
65,1.0,,59.0,,1760933460723493,A BIG thank you to the Harris Family! #FeedingOurDragons #Kindness,https://facebook.com/story.php?story_fbid=1760933460723493&id=144868215663367,"Teniah M Trosclair
September 2 at 5:35 PM ·

While in Mac’s buying items to feed our football boys this Friday, the nicest ladies came up and asked us what we were doing buying up all the taco stuff.... 🤣. We told them we were with the JC Booster Club, and that we were feeding our football players this Friday. They said they loved the JC Dragons and wanted to give us a donation!! There are still nice people in this world.... and Everybody loves the JC Dragons 🐲💜💛
They didn’t give us their names, they just said the Harris family... God bless them!! ❤️",3.0,"A BIG thank you to the Harris Family! #FeedingOurDragons #Kindness

Teniah M Trosclair
September 2 at 5:35 PM ·

While in Mac’s buying items to feed our football boys this Friday, the nicest ladies came up and asked us what we were doing buying up all the taco stuff.... 🤣. We told them we were with the JC Booster Club, and that we were feeding our football players this Friday. They said they loved the JC Dragons and wanted to give us a donation!! There are still nice people in this world.... and Everybody loves the JC Dragons 🐲💜💛
They didn’t give us their names, they just said the Harris family... God bless them!! ❤️",2020-09-02 18:42:10,,
66,0.0,,0.0,,,"While in Mac’s buying items to feed our football boys this Friday, the nicest ladies came up and asked us what we were doing buying up all the taco stuff.... 🤣. We told them we were with the JC Booster Club, and that we were feeding our football players this Friday. They said they loved the JC Dragons and wanted to give us a donation!! There are still nice people in this world.... and Everybody loves the JC Dragons 🐲💜💛
They didn’t give us their names, they just said the Harris family... God bless them!! ❤️",https://facebook.com/story.php?story_fbid=10223489307090805&id=1532474620,,0.0,"While in Mac’s buying items to feed our football boys this Friday, the nicest ladies came up and asked us what we were doing buying up all the taco stuff.... 🤣. We told them we were with the JC Booster Club, and that we were feeding our football players this Friday. They said they loved the JC Dragons and wanted to give us a donation!! There are still nice people in this world.... and Everybody loves the JC Dragons 🐲💜💛
They didn’t give us their names, they just said the Harris family... God bless them!! ❤️",,,
67,0.0,,2.0,https://youtu.be/ENFPB9pjH_E,1760916227391883,,https://facebook.com/story.php?story_fbid=1760916227391883&id=144868215663367,,0.0,,2020-09-02 18:11:54,,
68,0.0,,2.0,https://youtu.be/_x-qkQ3sxCA,1760899037393602,JCSD-NECC DEN! Dragon football and early dismissal!,https://facebook.com/story.php?story_fbid=1760899037393602&id=144868215663367,"YOUTUBE.COM
Smackover game",0.0,"JCSD-NECC DEN! Dragon football and early dismissal!

YOUTUBE.COM
Smackover game",2020-09-02 17:39:19,,
69,1.0,https://scontent-atl3-1.xx.fbcdn.net/v/t1.0-9/118627816_1760794587404047_8079078294267718371_n.png?_nc_cat=106&_nc_sid=8024bb&_nc_ohc=8IGefwGC4EQAX_Vvezz&_nc_ht=scontent-atl3-1.xx&oh=3a55b929e9307d019c7505d562672db2&oe=5F860C57,16.0,,1760795427403963,"🍎A sweet note to our school🍎
Jenny Crawford wrote: ""Cleaning out an old book bag of Makayla's today I found a treasure. A pack of smarties with a little note attached from Mrs. Hatley. Makayla had Mrs. Hatley in the third and then again in the fifth. JC has some of the best teachers, they not only teach our children, they love and encourage them everyday.""
#ThankYou #MrsHatleyRocks #JCHasTheBestTeachers

Christy Hatley Robby Lowe Vickie Charles-Hill Sharon Akin Harris",https://facebook.com/story.php?story_fbid=1760795427403963&id=144868215663367,,0.0,"🍎A sweet note to our school🍎
Jenny Crawford wrote: ""Cleaning out an old book bag of Makayla's today I found a treasure. A pack of smarties with a little note attached from Mrs. Hatley. Makayla had Mrs. Hatley in the third and then again in the fifth. JC has some of the best teachers, they not only teach our children, they love and encourage them everyday.""
#ThankYou #MrsHatleyRocks #JCHasTheBestTeachers

Christy Hatley Robby Lowe Vickie Charles-Hill Sharon Akin Harris",2020-09-02 14:57:17,,
70,0.0,https://scontent-atl3-1.xx.fbcdn.net/v/t1.0-9/118780809_1760758934074279_3578768643739467909_n.png?_nc_cat=109&_nc_sid=2d5d41&_nc_ohc=cXcrxJelCUoAX8hlT_v&_nc_ht=scontent-atl3-1.xx&oh=28ac08b66cc93ae848550c55c60cdd13&oe=5F837AA1,9.0,,1760758927407613,"Dragon Fans: If you are planning to attend the Friday night Smackover/JC football game, Smackover is requiring each attendee to present a voucher at the gate in order to buy a ticket. The vouchers are in the HS office. First come, first served!",,,0.0,"Dragon Fans: If you are planning to attend the Friday night Smackover/JC football game, Smackover is requiring each attendee to present a voucher at the gate in order to buy a ticket. The vouchers are in the HS office. First come, first served!",2020-09-02 14:00:45,,
71,1.0,,43.0,,1760687844081388,#1Dragon #WeLoveYouCaden,https://facebook.com/story.php?story_fbid=1760687844081388&id=144868215663367,"Leanna Hanry is with Sabrina McDonald and 4 others.
September 2 at 11:18 AM ·

Our JCHS warrior Caden Wilson made the front page of the Bernice Banner this week💜💛💜",2.0,"#1Dragon #WeLoveYouCaden

Leanna Hanry is with Sabrina McDonald and 4 others.
September 2 at 11:18 AM ·

Our JCHS warrior Caden Wilson made the front page of the Bernice Banner this week💜💛💜",2020-09-02 12:21:29,,
72,0.0,,25.0,,1760668567416649,Robby Lowe Janet C White Katie McGoogan Ryan Rae Vickie Charles-Hill,https://facebook.com/story.php?story_fbid=1760668567416649&id=144868215663367,"El Dorado-Union County Chamber of Commerce is with Michaela Singleton.
September 2 at 10:52 AM ·

🍎✏️ Because of the current guidelines in place by the CDC, we are having to be creative with how we can show appreciation to our new teachers in Union County this year! Instead of having our annual ""New Teachers Breakfast"" event, the El Dorado-Union County Chamber of Commerce is visiting local schools individually to show appreciation by providing breakfast and appreciation bags to the new teachers!

Our first ""New Teachers Breakfast"" event was yesterday in Junction City, where we welcomed their new teachers! Thank you Junction City School District teachers! We hope you have a fantastic year!!",2.0,"Robby Lowe Janet C White Katie McGoogan Ryan Rae Vickie Charles-Hill

El Dorado-Union County Chamber of Commerce is with Michaela Singleton.
September 2 at 10:52 AM ·

🍎✏️ Because of the current guidelines in place by the CDC, we are having to be creative with how we can show appreciation to our new teachers in Union County this year! Instead of having our annual ""New Teachers Breakfast"" event, the El Dorado-Union County Chamber of Commerce is visiting local schools individually to show appreciation by providing breakfast and appreciation bags to the new teachers!

Our first ""New Teachers Breakfast"" event was yesterday in Junction City, where we welcomed their new teachers! Thank you Junction City School District teachers! We hope you have a fantastic year!!",2020-09-02 11:54:10,,
73,0.0,,2.0,http://5il.co/4dw2,1760611484089024,"JCHS Announcements 9/2/2020
http://5il.co/4dw2",https://facebook.com/story.php?story_fbid=1760611484089024&id=144868215663367,,0.0,"JCHS Announcements 9/2/2020
http://5il.co/4dw2",2020-09-02 10:52:13,,
74,0.0,,0.0,https://5il.co/kck5,1760605960756243,REMINDER!!!,https://facebook.com/story.php?story_fbid=1760605960756243&id=144868215663367,"CORE-DOCS.S3.AMAZONAWS.COM
core-docs.s3.amazonaws.com

Teniah M Trosclair is with Michelle Smith and 4 others.
September 2 at 7:58 AM ·

REMINDER: Ad forms must be turned in to the office by this afternoon!!!
💜💛",0.0,"REMINDER!!!

CORE-DOCS.S3.AMAZONAWS.COM
core-docs.s3.amazonaws.com

Teniah M Trosclair is with Michelle Smith and 4 others.
September 2 at 7:58 AM ·

REMINDER: Ad forms must be turned in to the office by this afternoon!!!
💜💛",2020-09-02 10:47:31,,
75,0.0,,0.0,https://5il.co/kck5,,,https://facebook.com/story.php?story_fbid=10223486022088682&id=1532474620,"Teniah M Trosclair is with Michelle Smith and 4 others.
September 2 at 7:58 AM ·

REMINDER: Ad forms must be turned in to the office by this afternoon!!!
💜💛",0.0,"Teniah M Trosclair is with Michelle Smith and 4 others.
September 2 at 7:58 AM ·

REMINDER: Ad forms must be turned in to the office by this afternoon!!!
💜💛",,,
76,0.0,,3.0,,1760536450763194,,https://facebook.com/story.php?story_fbid=1760536450763194&id=144868215663367,"Leanna Hanry added 21 new photos to the album: 2020 9th and 10th Grade Orientation August 19.
September 2 at 8:14 AM ·",0.0,"Leanna Hanry added 21 new photos to the album: 2020 9th and 10th Grade Orientation August 19.
September 2 at 8:14 AM ·",2020-09-02 09:48:40,,
77,0.0,,0.0,,1760536124096560,,https://facebook.com/story.php?story_fbid=1760536124096560&id=144868215663367,"Leanna Hanry added 13 new photos to the album: 2020 11th and 12th Grade Orientation August 20.
September 2 at 8:15 AM ·",0.0,"Leanna Hanry added 13 new photos to the album: 2020 11th and 12th Grade Orientation August 20.
September 2 at 8:15 AM ·",2020-09-02 09:48:23,,
78,0.0,,6.0,,1760506360766203,,https://facebook.com/story.php?story_fbid=1760506360766203&id=144868215663367,"Leanna Hanry added 324 new photos to the album: 2020 JC vs Harmony Grove August 28.
September 1 at 8:16 AM ·",0.0,"Leanna Hanry added 324 new photos to the album: 2020 JC vs Harmony Grove August 28.
September 1 at 8:16 AM ·",2020-09-02 09:14:25,,
79,0.0,,1.0,,1760506170766222,,https://facebook.com/story.php?story_fbid=1760506170766222&id=144868215663367,"Leanna Hanry added 29 new photos to the album: 2020 7th and 8th Grade Orientation August 18.
September 2 at 8:12 AM ·",0.0,"Leanna Hanry added 29 new photos to the album: 2020 7th and 8th Grade Orientation August 18.
September 2 at 8:12 AM ·",2020-09-02 09:14:09,,
80,0.0,,5.0,,1759952664154906,"JCSD-NECC will dismiss early this Friday, Sept. 4 at 2:30pm. Elementary will dismiss at 2:20pm. Have a wonderful and safe Labor Day Weekend!",https://facebook.com/story.php?story_fbid=1759952664154906&id=144868215663367,,0.0,"JCSD-NECC will dismiss early this Friday, Sept. 4 at 2:30pm. Elementary will dismiss at 2:20pm. Have a wonderful and safe Labor Day Weekend!",2020-09-01 20:00:06,,
81,0.0,,1.0,https://youtu.be/FfAp59Qrono,1759938490822990,"Check out our latest DEN video about our 21stCCLC After School Program that will begin September 14th! We hope all K-6 parents will complete the interest survey!

7-12 Tutoring will be held every Tuesday from 5:30-6:30 in Mrs. Raines’s room beginning September 15.

Robby Lowe Deneen Miller Shelley Ray Vickie Charles-Hill",https://facebook.com/story.php?story_fbid=1759938490822990&id=144868215663367,"YOUTUBE.COM
Information on how to register your child for the 21 century after school program.",2.0,"Check out our latest DEN video about our 21stCCLC After School Program that will begin September 14th! We hope all K-6 parents will complete the interest survey!

7-12 Tutoring will be held every Tuesday from 5:30-6:30 in Mrs. Raines’s room beginning September 15.

Robby Lowe Deneen Miller Shelley Ray Vickie Charles-Hill

YOUTUBE.COM
Information on how to register your child for the 21 century after school program.",2020-09-01 19:34:17,,
82,0.0,https://scontent-atl3-1.xx.fbcdn.net/v/t1.0-9/118779813_10159395709347788_4795017053182857940_o.png?_nc_cat=105&_nc_sid=8024bb&_nc_ohc=lPsRI9Hv0wkAX97ShXo&_nc_ht=scontent-atl3-1.xx&oh=51aff7d82ef66079ed52468bd4e399ab&oe=5F84276D,0.0,http://www.smactalk.info/,1759843474165825,,https://facebook.com/story.php?story_fbid=1759843474165825&id=144868215663367,"Arkansas Department of Education
September 1 at 3:17 PM ·

DESE is launching a new campaign to help students learn how to use social media in safe and healthy ways. Parents and teachers can access resources to support their students at: www.smactalk.info. #ARStudentFocused #EngagementMattersAR",0.0,"Arkansas Department of Education
September 1 at 3:17 PM ·

DESE is launching a new campaign to help students learn how to use social media in safe and healthy ways. Parents and teachers can access resources to support their students at: www.smactalk.info. #ARStudentFocused #EngagementMattersAR",2020-09-01 16:47:57,,
83,0.0,,0.0,http://5il.co/4dw2,1759565004193672,"JCHS Announcements 9/1/2020
http://5il.co/4dw2",https://facebook.com/story.php?story_fbid=1759565004193672&id=144868215663367,,0.0,"JCHS Announcements 9/1/2020
http://5il.co/4dw2",2020-09-01 10:27:25,,
84,0.0,,1.0,https://5il.co/k34g,1759535860863253,"Senior Portraits have been rescheduled for Wednesday, September 9 in the MPR! Please click link for senior time schedule!",https://facebook.com/story.php?story_fbid=1759535860863253&id=144868215663367,"CORE-DOCS.S3.AMAZONAWS.COM
core-docs.s3.amazonaws.com",2.0,"Senior Portraits have been rescheduled for Wednesday, September 9 in the MPR! Please click link for senior time schedule!

CORE-DOCS.S3.AMAZONAWS.COM
core-docs.s3.amazonaws.com",2020-09-01 09:52:38,,
85,0.0,,1.0,https://5il.co/kgvp,1759511667532339,"Hey Dragon Fans! Check out this awesome football t-shirt! Order/Payment is due this Friday, Sept. 4! Support our Dragon Booster Club! Go Dragons!
Click this link for order form!",https://facebook.com/story.php?story_fbid=1759511667532339&id=144868215663367,"CORE-DOCS.S3.AMAZONAWS.COM
core-docs.s3.amazonaws.com",2.0,"Hey Dragon Fans! Check out this awesome football t-shirt! Order/Payment is due this Friday, Sept. 4! Support our Dragon Booster Club! Go Dragons!
Click this link for order form!

CORE-DOCS.S3.AMAZONAWS.COM
core-docs.s3.amazonaws.com",2020-09-01 09:25:23,,
86,0.0,,5.0,,1759018500914989,,https://facebook.com/story.php?story_fbid=1759018500914989&id=144868215663367,"Teniah M Trosclair is with Michelle Smith and 5 others.
August 31 at 4:13 PM ·

JCHS Football Shirts... Who wants one??!!
All Orders and Money due Sept. 4th!!
GO DRAGONS!! 💜💛🏈",3.0,"Teniah M Trosclair is with Michelle Smith and 5 others.
August 31 at 4:13 PM ·

JCHS Football Shirts... Who wants one??!!
All Orders and Money due Sept. 4th!!
GO DRAGONS!! 💜💛🏈",2020-08-31 19:55:51,,
87,1.0,https://scontent-atl3-1.xx.fbcdn.net/v/t1.0-9/118731458_1758760940940745_6075586609856485308_n.png?_nc_cat=103&_nc_sid=8024bb&_nc_ohc=vu1fdNoB2XIAX8KGopN&_nc_ht=scontent-atl3-1.xx&oh=a9d40bf35db5854fbf95b1d1597806f4&oe=5F83F3D5,15.0,,1758761620940677,"🏈Go Dragons!🏈 #Chasing8

PLEASE NOTE: GAME IS AT 7:00PM, not 7:30PM as previously scheduled.",https://facebook.com/story.php?story_fbid=1758761620940677&id=144868215663367,,0.0,"🏈Go Dragons!🏈 #Chasing8

PLEASE NOTE: GAME IS AT 7:00PM, not 7:30PM as previously scheduled.",2020-08-31 13:34:24,,
88,0.0,,0.0,http://5il.co/4dw2,1758654067618099,"JCHS Announcements 8/31/2020
http://5il.co/4dw2",https://facebook.com/story.php?story_fbid=1758654067618099&id=144868215663367,,0.0,"JCHS Announcements 8/31/2020
http://5il.co/4dw2",2020-08-31 11:27:58,,
89,1.0,https://scontent-atl3-1.xx.fbcdn.net/v/t1.0-9/fr/cp0/e15/q65/118765775_2813158348912128_3607220016136983227_n.jpg?_nc_cat=109&_nc_sid=110474&_nc_ohc=hNmtMVsKV9AAX8YSsfG&_nc_oc=AQmk-pjBRnP-ocRInK7ZmeMnAv5R6WzRYQRqOs20KeKea2gPsu3gubnyvWHqfH-eJ_s&_nc_ht=scontent-atl3-1.xx&tp=14&oh=ae2d00b0e6c4c7bc8f04d10e75e694e2&oe=5F85AB0D,6.0,,1758643710952468,"If you want one, make sure to order through the Junction City Elementary PTO! #MaskUpDragonNation",https://facebook.com/story.php?story_fbid=1758643710952468&id=144868215663367,"Junction City Elementary PTO
August 31 at 9:56 AM ·

Make sure we have you down! Only a limited amount ordered in each design. Adult and Youth sizes!
💜 🐉 😷 💛",5.0,"If you want one, make sure to order through the Junction City Elementary PTO! #MaskUpDragonNation

Junction City Elementary PTO
August 31 at 9:56 AM ·

Make sure we have you down! Only a limited amount ordered in each design. Adult and Youth sizes!
💜 🐉 😷 💛",2020-08-31 11:18:49,,
90,0.0,https://scontent-atl3-1.xx.fbcdn.net/v/t1.0-9/fr/cp0/e15/q65/118622644_2812800088947954_649190093858932039_n.jpg?_nc_cat=101&_nc_sid=110474&_nc_ohc=VvNuoFdZfMAAX8MoV9S&_nc_ht=scontent-atl3-1.xx&tp=14&oh=7dade8ec981daebb3d742096e7259b39&oe=5F827CB7,0.0,,1758641457619360,Support our Junction City Elementary PTO!! #MaskUpDragonNation,https://facebook.com/story.php?story_fbid=1758641457619360&id=144868215663367,"Junction City Elementary PTO
August 31 at 10:00 AM ·

Don’t forget to go see Mrs. Stacy Sweet in the elementary office to purchase a Dragon mask!

Adult and Youth sizes $12 each

💜🐉😷💛",0.0,"Support our Junction City Elementary PTO!! #MaskUpDragonNation

Junction City Elementary PTO
August 31 at 10:00 AM ·

Don’t forget to go see Mrs. Stacy Sweet in the elementary office to purchase a Dragon mask!

Adult and Youth sizes $12 each

💜🐉😷💛",2020-08-31 11:16:41,,
91,0.0,,3.0,http://digital.olivesoftware.com/Olive/ODN/ElDorado/shared/ShowArticle.aspx?doc=ElDNTimes/2020/08/30&entity=Ar01400&sk=79AD47E4,1757689751047864,,https://facebook.com/story.php?story_fbid=1757689751047864&id=144868215663367,"DIGITAL.OLIVESOFTWARE.COM
Harmony Grove tackles Junction City in season opener - El Dorado , 8/30/2020",0.0,"DIGITAL.OLIVESOFTWARE.COM
Harmony Grove tackles Junction City in season opener - El Dorado , 8/30/2020",2020-08-30 12:59:35,,
92,0.0,,8.0,http://digital.olivesoftware.com/Olive/ODN/ElDorado/shared/ShowArticle.aspx?doc=ElDNTimes/2020/08/29&entity=Ar03406&sk=3D79C032,1756840241132815,🟣⚾️🟡,https://facebook.com/story.php?story_fbid=1756840241132815&id=144868215663367,"DIGITAL.OLIVESOFTWARE.COM
Dealing - El Dorado , 8/29/2020",0.0,"🟣⚾️🟡

DIGITAL.OLIVESOFTWARE.COM
Dealing - El Dorado , 8/29/2020",2020-08-29 17:01:56,,
93,0.0,,9.0,http://digital.olivesoftware.com/Olive/ODN/ElDorado/shared/ShowArticle.aspx?doc=ElDNTimes/2020/08/29&entity=Ar02902&sk=50C4596B,1756838217799684,#DragonAthletesDominate,https://facebook.com/story.php?story_fbid=1756838217799684&id=144868215663367,"DIGITAL.OLIVESOFTWARE.COM
Union County's best athlete of past 20 years? - El Dorado , 8/29/2020",4.0,"#DragonAthletesDominate

DIGITAL.OLIVESOFTWARE.COM
Union County's best athlete of past 20 years? - El Dorado , 8/29/2020",2020-08-29 16:59:48,,
94,0.0,,6.0,http://digital.olivesoftware.com/Olive/ODN/ElDorado/shared/ShowArticle.aspx?doc=ElDNTimes/2020/08/29&entity=Ar02502&sk=064813CF,1756836971133142,🥎,https://facebook.com/story.php?story_fbid=1756836971133142&id=144868215663367,"DIGITAL.OLIVESOFTWARE.COM
Changing Speeds - El Dorado , 8/29/2020",0.0,"🥎

DIGITAL.OLIVESOFTWARE.COM
Changing Speeds - El Dorado , 8/29/2020",2020-08-29 16:57:40,,
95,0.0,,7.0,http://digital.olivesoftware.com/Olive/ODN/ElDorado/shared/ShowArticle.aspx?doc=ElDNTimes/2020/08/29&entity=Ar02000&sk=171528AE,1756835594466613,🟣🟡🟣🟡🟣🟡🟣🟡🟣🟡🟡🟣🟡🟣🟡🟣,https://facebook.com/story.php?story_fbid=1756835594466613&id=144868215663367,"DIGITAL.OLIVESOFTWARE.COM
Twenty years of sports success in Union County - El Dorado , 8/29/2020",0.0,"🟣🟡🟣🟡🟣🟡🟣🟡🟣🟡🟡🟣🟡🟣🟡🟣

DIGITAL.OLIVESOFTWARE.COM
Twenty years of sports success in Union County - El Dorado , 8/29/2020",2020-08-29 16:55:48,,
96,0.0,,6.0,http://digital.olivesoftware.com/Olive/ODN/ElDorado/shared/ShowArticle.aspx?doc=ElDNTimes/2020/08/29&entity=Ar02403&sk=02885B20,1756834457800060,"💜🏈⚾️🥎🏀🎽🎉💛
#DragonDynasty
💪🏽#DontForgetOurWeightliftingTitles🏋🏽

Robby Lowe David Carpenter",https://facebook.com/story.php?story_fbid=1756834457800060&id=144868215663367,"DIGITAL.OLIVESOFTWARE.COM
2000-2020 State Champions - El Dorado , 8/29/2020",2.0,"💜🏈⚾️🥎🏀🎽🎉💛
#DragonDynasty
💪🏽#DontForgetOurWeightliftingTitles🏋🏽

Robby Lowe David Carpenter

DIGITAL.OLIVESOFTWARE.COM
2000-2020 State Champions - El Dorado , 8/29/2020",2020-08-29 16:53:15,,
97,0.0,,2.0,http://digital.olivesoftware.com/Olive/ODN/ElDorado/shared/ShowArticle.aspx?doc=ElDNTimes/2020/08/29&entity=Ar03203&sk=4C366279,1756829427800563,⚾️,https://facebook.com/story.php?story_fbid=1756829427800563&id=144868215663367,"DIGITAL.OLIVESOFTWARE.COM
Dominance On The Diamond - El Dorado , 8/29/2020",0.0,"⚾️

DIGITAL.OLIVESOFTWARE.COM
Dominance On The Diamond - El Dorado , 8/29/2020",2020-08-29 16:44:32,,
98,3.0,,28.0,http://digital.olivesoftware.com/Olive/ODN/ElDorado/shared/ShowArticle.aspx?doc=ElDNTimes/2020/08/29&entity=Ar02701&sk=2E5D137A,1756828531133986,💜🥎💜,https://facebook.com/story.php?story_fbid=1756828531133986&id=144868215663367,"DIGITAL.OLIVESOFTWARE.COM
Memories still sharp for former 2A championship game MVP - El Dorado , 8/29/2020",2.0,"💜🥎💜

DIGITAL.OLIVESOFTWARE.COM
Memories still sharp for former 2A championship game MVP - El Dorado , 8/29/2020",2020-08-29 16:43:05,,
99,0.0,,2.0,http://digital.olivesoftware.com/Olive/ODN/ElDorado/shared/ShowArticle.aspx?doc=ElDNTimes/2020/08/29&entity=Ar02202&sk=59C2ABFC,1756827647800741,🏈,https://facebook.com/story.php?story_fbid=1756827647800741&id=144868215663367,"DIGITAL.OLIVESOFTWARE.COM
Junction City, also known as football country - El Dorado , 8/29/2020",3.0,"🏈

DIGITAL.OLIVESOFTWARE.COM
Junction City, also known as football country - El Dorado , 8/29/2020",2020-08-29 16:41:35,,
100,0.0,https://scontent-atl3-1.xx.fbcdn.net/v/t1.0-9/118649523_10159386630542788_8587433067848799560_n.png?_nc_cat=100&_nc_sid=da1649&_nc_ohc=GxU5jVgwH6sAX88UUTF&_nc_ht=scontent-atl3-1.xx&oh=eb872a0303a231b9bd846faffec97b29&oe=5F855072,2.0,http://ow.ly/DMsK50BbEgB,1756587211158118,,https://facebook.com/story.php?story_fbid=1756587211158118&id=144868215663367,"Arkansas Department of Education
August 29 at 10:01 AM ·

#SafetySaturday: Students, parents, bus drivers, and other motorists all play a key role in school bus safety. The National Highway Traffic Safety Administration has some great school bus safety information on their website. Check out their tips for staying safe at the bus stop at http://ow.ly/DMsK50BbEgB. #FlashingRedKidsAhead",0.0,"Arkansas Department of Education
August 29 at 10:01 AM ·

#SafetySaturday: Students, parents, bus drivers, and other motorists all play a key role in school bus safety. The National Highway Traffic Safety Administration has some great school bus safety information on their website. Check out their tips for staying safe at the bus stop at http://ow.ly/DMsK50BbEgB. #FlashingRedKidsAhead",2020-08-29 12:11:13,,
101,0.0,,2.0,https://youtu.be/IBT-aujsQys,1755938564556316,"Go Dragons...beat the Hornets!
The DSN is LIVE!

Please make sure to subscribe to the DSN channel on YouTube so you will be notified when the Dragon Sports Network goes LIVE!",https://facebook.com/story.php?story_fbid=1755938564556316&id=144868215663367,"YOUTUBE.COM
Dragon Sports Network",4.0,"Go Dragons...beat the Hornets!
The DSN is LIVE!

Please make sure to subscribe to the DSN channel on YouTube so you will be notified when the Dragon Sports Network goes LIVE!

YOUTUBE.COM
Dragon Sports Network",2020-08-28 20:31:35,,
102,0.0,,6.0,,1755823721234467,Come HUNGRY! Our AWESOME JCHS Band Boosters have got you covered with delicious game food! Support “The Sound Of The Bordertown!”,https://facebook.com/story.php?story_fbid=1755823721234467&id=144868215663367,"Alana Girard‎Junction City Dragon Band
August 28 at 3:46 PM ·

The concession stand menu for tonight's game is posted below. We will be open with only 2 one-way lines. Watch for the directional arrows.

We are set up to take debit/credit cards and cash.

Thank you for your patience and support!",5.0,"Come HUNGRY! Our AWESOME JCHS Band Boosters have got you covered with delicious game food! Support “The Sound Of The Bordertown!”

Alana Girard‎Junction City Dragon Band
August 28 at 3:46 PM ·

The concession stand menu for tonight's game is posted below. We will be open with only 2 one-way lines. Watch for the directional arrows.

We are set up to take debit/credit cards and cash.

Thank you for your patience and support!",2020-08-28 16:56:22,,
103,0.0,,4.0,https://www.youtube.com/channel/UC-yrP9lsdUN5u5dY3EBIZGw,1755667531250086,The DSN is READY!!! Game Night begins at 6:30pm on the DSN followed by the Kickoff at 7:30! GO DRAGONS! #BeatThoseHornets,https://facebook.com/story.php?story_fbid=1755667531250086&id=144868215663367,"YOUTUBE.COM
DRAGON SPORTS NETWORK

Chad Rhodes is with Jacob Pumphrey and 3 others at Paul H. Muse Field at David Carpenter Stadium.
August 28 at 11:31 AM · Junction City, AR ·

Nothing gets me more pumped than waiting on that Friday night kickoff! Don't let COVID keep you from enjoying some Dragon Football tonight! Just click this link https://www.youtube.com/channel/UC-yrP9lsdUN5u5dY3EBIZGw and it is just like you are there! Jacob and Wayne will be calling the action from the top of the press box!

Follow this link https://stats.digitalscout.com/football/boys/game/12571971
For live up to the minute stats with myself, Ricky and Tommy!

So, get ready to enjoy some Dragon football no matter where you are! You can have the whole seat, but you only need the EDGE!",3.0,"The DSN is READY!!! Game Night begins at 6:30pm on the DSN followed by the Kickoff at 7:30! GO DRAGONS! #BeatThoseHornets

YOUTUBE.COM
DRAGON SPORTS NETWORK

Chad Rhodes is with Jacob Pumphrey and 3 others at Paul H. Muse Field at David Carpenter Stadium.
August 28 at 11:31 AM · Junction City, AR ·

Nothing gets me more pumped than waiting on that Friday night kickoff! Don't let COVID keep you from enjoying some Dragon Football tonight! Just click this link https://www.youtube.com/channel/UC-yrP9lsdUN5u5dY3EBIZGw and it is just like you are there! Jacob and Wayne will be calling the action from the top of the press box!

Follow this link https://stats.digitalscout.com/football/boys/game/12571971
For live up to the minute stats with myself, Ricky and Tommy!

So, get ready to enjoy some Dragon football no matter where you are! You can have the whole seat, but you only need the EDGE!",2020-08-28 13:02:24,,
104,0.0,,0.0,https://www.youtube.com/channel/UC-yrP9lsdUN5u5dY3EBIZGw,,,https://facebook.com/story.php?story_fbid=10217516690245462&id=1122819436,"Chad Rhodes is with Jacob Pumphrey and 3 others at Paul H. Muse Field at David Carpenter Stadium.
August 28 at 11:31 AM · Junction City, AR ·

Nothing gets me more pumped than waiting on that Friday night kickoff! Don't let COVID keep you from enjoying some Dragon Football tonight! Just click this link https://www.youtube.com/channel/UC-yrP9lsdUN5u5dY3EBIZGw and it is just like you are there! Jacob and Wayne will be calling the action from the top of the press box!

Follow this link https://stats.digitalscout.com/football/boys/game/12571971
For live up to the minute stats with myself, Ricky and Tommy!

So, get ready to enjoy some Dragon football no matter where you are! You can have the whole seat, but you only need the EDGE!",0.0,"Chad Rhodes is with Jacob Pumphrey and 3 others at Paul H. Muse Field at David Carpenter Stadium.
August 28 at 11:31 AM · Junction City, AR ·

Nothing gets me more pumped than waiting on that Friday night kickoff! Don't let COVID keep you from enjoying some Dragon Football tonight! Just click this link https://www.youtube.com/channel/UC-yrP9lsdUN5u5dY3EBIZGw and it is just like you are there! Jacob and Wayne will be calling the action from the top of the press box!

Follow this link https://stats.digitalscout.com/football/boys/game/12571971
For live up to the minute stats with myself, Ricky and Tommy!

So, get ready to enjoy some Dragon football no matter where you are! You can have the whole seat, but you only need the EDGE!",,,
105,1.0,,17.0,,1755605081256331,"It's GAMEDAY!
•Pep Rally @ 2:30pm outside in between the Jr. & Sr. high buildings! Masks are required!
•Kickoff @ 7:30pm!",,,0.0,"It's GAMEDAY!
•Pep Rally @ 2:30pm outside in between the Jr. & Sr. high buildings! Masks are required!
•Kickoff @ 7:30pm!",2020-08-28 11:41:32,,
106,0.0,,0.0,http://5il.co/4dw2,1755600891256750,"JCHS Announcements 8-28-2020
http://5il.co/4dw2",https://facebook.com/story.php?story_fbid=1755600891256750&id=144868215663367,,0.0,"JCHS Announcements 8-28-2020
http://5il.co/4dw2",2020-08-28 11:35:04,,
107,0.0,,9.0,http://digital.olivesoftware.com/Olive/ODN/ElDorado/shared/ShowArticle.aspx?doc=ElDNTimes/2020/08/28&entity=Ar01302&sk=0AE88BBC,1755599601256879,G A M E D A Y! #GoDragons #GoinDownInTheBordertown,https://facebook.com/story.php?story_fbid=1755599601256879&id=144868215663367,"DIGITAL.OLIVESOFTWARE.COM
Junction City, Harmony Grove ready to collide - El Dorado , 8/28/2020",5.0,"G A M E D A Y! #GoDragons #GoinDownInTheBordertown

DIGITAL.OLIVESOFTWARE.COM
Junction City, Harmony Grove ready to collide - El Dorado , 8/28/2020",2020-08-28 11:32:59,,
108,0.0,https://scontent-atl3-1.xx.fbcdn.net/v/t1.0-9/fr/cp0/e15/q65/118617462_10159382892942788_9025471867844046091_o.jpg?_nc_cat=109&_nc_sid=8024bb&_nc_ohc=5Ce3_15P-kIAX9NQZV7&_nc_ht=scontent-atl3-1.xx&tp=14&oh=83eb980d9f0f60a30f8ec3e97d6ec1bd&oe=5F83401D,2.0,http://www.flashingredkidsahead.org/,1755566011260238,,https://facebook.com/story.php?story_fbid=1755566011260238&id=144868215663367,"Arkansas Department of Education
August 28 at 9:03 AM ·

Safety Tip: If you meet your child at the bus stop after school, wait on the side where your child will be dropped off, not across the street. Children can be so excited to see you after school that they dash across the street and forget safety rules. www.flashingredkidsahead.org #FlashingRedKidsAhead #ARStudentFocused #EngagementMattersAR",0.0,"Arkansas Department of Education
August 28 at 9:03 AM ·

Safety Tip: If you meet your child at the bus stop after school, wait on the side where your child will be dropped off, not across the street. Children can be so excited to see you after school that they dash across the street and forget safety rules. www.flashingredkidsahead.org #FlashingRedKidsAhead #ARStudentFocused #EngagementMattersAR",2020-08-28 10:47:20,,
109,0.0,,4.0,,1755481091268730,Hey Dragon Fans...check this out!!! Please support out JCHS Booster Club!,https://facebook.com/story.php?story_fbid=1755481091268730&id=144868215663367,"Teniah M Trosclair is with Brad Smith and 7 others.
August 27 at 9:25 PM ·

The JCHS Booster Club will be doing a raffle for a 4-Burner 36” Blackstone Griddle w/side shelves and a lid. It is a $300 value.
We are sending tickets home with each football player and cheerleader, and asking that they each sell 10. The tickets will be $5 a piece. We will draw for the Blackstone on Oct 23rd at the homecoming game.
We will also sell tickets at the home games and some junior high games. SO.... Find your favorite football player or cheerleader and get you a ticket, or come by and see us at the booster club table tomo night!!
We are so excited about seeing our boys and girls on that field tomo!!
Go Dragons 💜💛",0.0,"Hey Dragon Fans...check this out!!! Please support out JCHS Booster Club!

Teniah M Trosclair is with Brad Smith and 7 others.
August 27 at 9:25 PM ·

The JCHS Booster Club will be doing a raffle for a 4-Burner 36” Blackstone Griddle w/side shelves and a lid. It is a $300 value.
We are sending tickets home with each football player and cheerleader, and asking that they each sell 10. The tickets will be $5 a piece. We will draw for the Blackstone on Oct 23rd at the homecoming game.
We will also sell tickets at the home games and some junior high games. SO.... Find your favorite football player or cheerleader and get you a ticket, or come by and see us at the booster club table tomo night!!
We are so excited about seeing our boys and girls on that field tomo!!
Go Dragons 💜💛",2020-08-28 09:10:09,,
110,0.0,,1.0,https://5il.co/kck5,1755480034602169,"JCHS-NECC FOOTBALL PARENTS/FANS! If you would like to purchase an AD in the 2020 Dragon Football Program, please click the following link. The deadline to return form with payment is September 2. Please read form carefully concerning photos!",https://facebook.com/story.php?story_fbid=1755480034602169&id=144868215663367,"CORE-DOCS.S3.AMAZONAWS.COM
core-docs.s3.amazonaws.com",3.0,"JCHS-NECC FOOTBALL PARENTS/FANS! If you would like to purchase an AD in the 2020 Dragon Football Program, please click the following link. The deadline to return form with payment is September 2. Please read form carefully concerning photos!

CORE-DOCS.S3.AMAZONAWS.COM
core-docs.s3.amazonaws.com",2020-08-28 09:08:39,,
111,0.0,https://scontent-atl3-1.xx.fbcdn.net/v/t1.0-9/fr/cp0/e15/q65/118593304_1755012004648972_8897242991211304485_n.jpg?_nc_cat=111&_nc_sid=110474&_nc_ohc=ubRmltLU-LwAX8W23ea&_nc_ht=scontent-atl3-1.xx&tp=14&oh=6ab93d94fb328f29ee76f48bf50abac4&oe=5F8356D2,12.0,,1755012304648942,Tomorrow’s Theme Day! #DragonSpirit,https://facebook.com/story.php?story_fbid=1755012304648942&id=144868215663367,,0.0,Tomorrow’s Theme Day! #DragonSpirit,2020-08-27 21:17:57,,
112,1.0,https://scontent-atl3-1.xx.fbcdn.net/v/t1.0-9/fr/cp0/e15/q65/118602955_1754975034652669_2999523800962990203_n.jpg?_nc_cat=110&_nc_sid=2d5d41&_nc_ohc=RpS4IEAS5tcAX_h0MDU&_nc_ht=scontent-atl3-1.xx&tp=14&oh=d836ef1eb1d78e4532f41ec2833e89c8&oe=5F82D428,4.0,,1754975027986003,"PLEASE NOTE: At the JCHS football gate and concession stand there will be credit/debit card readers so we can minimize exchange of money. We will accept cash too. But for safety we prefer cards.

Robby Lowe Deneen Miller",,,0.0,"PLEASE NOTE: At the JCHS football gate and concession stand there will be credit/debit card readers so we can minimize exchange of money. We will accept cash too. But for safety we prefer cards.

Robby Lowe Deneen Miller",2020-08-27 20:29:01,,
113,0.0,,1.0,https://youtu.be/DN482VIn1Bw,1754935437989962,"The DEN has exciting information about tomorrow's Dragon/Hornet Game!!! GO DRAGONS!!

Please share!!!

Robby Lowe Deneen Miller Junction City Dragons High School Football David Carpenter",https://facebook.com/story.php?story_fbid=1754935437989962&id=144868215663367,"YOUTUBE.COM
Dragon/Hornet game Information! Also, we can now take credit card payments at the gate! GO DRAGONS!",0.0,"The DEN has exciting information about tomorrow's Dragon/Hornet Game!!! GO DRAGONS!!

Please share!!!

Robby Lowe Deneen Miller Junction City Dragons High School Football David Carpenter

YOUTUBE.COM
Dragon/Hornet game Information! Also, we can now take credit card payments at the gate! GO DRAGONS!",2020-08-27 19:28:03,,
114,5.0,https://scontent-atl3-1.xx.fbcdn.net/v/t1.0-9/fr/cp0/e15/q65/118454363_1754864514663721_7799104725508435022_o.jpg?_nc_cat=111&_nc_sid=2d5d41&_nc_ohc=Dixgo_YL-UsAX-cxwI-&_nc_ht=scontent-atl3-1.xx&tp=14&oh=95d03e9667b068a5efa4cf9f995c4ab4&oe=5F830C23,10.0,,1754864511330388,"JCSD-NECC MESSAGE:
The power to the school has been restored. JCSD will be open for onsite instruction Friday morning. Please realize buses may not be able to reach all students, but buses will run routes as normal as possible. The football game with Harmony Grove will be played as scheduled Friday night at 7:30.",,,0.0,"JCSD-NECC MESSAGE:
The power to the school has been restored. JCSD will be open for onsite instruction Friday morning. Please realize buses may not be able to reach all students, but buses will run routes as normal as possible. The football game with Harmony Grove will be played as scheduled Friday night at 7:30.",2020-08-27 17:20:04,,
115,0.0,https://scontent-atl3-1.xx.fbcdn.net/v/t1.0-9/fr/cp0/e15/q65/118653374_3566151930083871_6133433527718926521_n.jpg?_nc_cat=109&_nc_sid=8024bb&_nc_ohc=SFwS07-cuHMAX-j8Lh_&_nc_oc=AQkz5kUDeRDCTYjJMjvfObRXkIcbGc1XHLpsRog5geIdj5o_ZdqSj11ulFogDOwT1yk&_nc_ht=scontent-atl3-1.xx&tp=14&oh=adbb41ecc8e7502ec9e6e22e4a6be5d7&oe=5F82E5D3,2.0,,1754828631333976,,https://facebook.com/story.php?story_fbid=1754828631333976&id=144868215663367,"Read Aloud
August 27 at 10:14 AM ·",0.0,"Read Aloud
August 27 at 10:14 AM ·",2020-08-27 16:17:57,,
116,4.0,,2.0,https://us04web.zoom.us/j/78792538374?pwd=T1F0MDNmYXhudzdRUk5WemI0WVZ1dz09,1754467684703404,"JCES KINDERGARTEN PARENTS ONLY:

PLEASE JOIN OUR KINDERGARTEN TEACHERS FOR A ZOOM MEETING THIS MORNING AT 10:00 AM TO HELP YOU LEARN MORE ABOUT GOOGLE CLASSROOM!

Topic: Kindergarten Parent Training
Time: Aug 27, 2020 10:00 AM

Join Zoom Meeting
https://us04web.zoom.us/j/78792538374?pwd=T1F0MDNmYXhudzdRUk5WemI0WVZ1dz09

Meeting ID: 787 9253 8374
Passcode: S7PaKf",https://facebook.com/story.php?story_fbid=1754467684703404&id=144868215663367,,0.0,"JCES KINDERGARTEN PARENTS ONLY:

PLEASE JOIN OUR KINDERGARTEN TEACHERS FOR A ZOOM MEETING THIS MORNING AT 10:00 AM TO HELP YOU LEARN MORE ABOUT GOOGLE CLASSROOM!

Topic: Kindergarten Parent Training
Time: Aug 27, 2020 10:00 AM

Join Zoom Meeting
https://us04web.zoom.us/j/78792538374?pwd=T1F0MDNmYXhudzdRUk5WemI0WVZ1dz09

Meeting ID: 787 9253 8374
Passcode: S7PaKf",2020-08-27 08:00:06,,
117,0.0,https://scontent-atl3-1.xx.fbcdn.net/v/t1.0-9/117944919_779994952555518_7017101263848393282_o.png?_nc_cat=101&_nc_sid=8024bb&_nc_ohc=9wQVXGUAYVIAX9DhO7R&_nc_ht=scontent-atl3-1.xx&oh=df4e42fcef9e1da8ce6f59ecc3b2b131&oe=5F85C643,3.0,https://us02web.zoom.us/webinar/register/WN_aPe0IpJTQS6zMJ7M_wgnxw,1754053921411447,For All Virtual Learning DLC parents with students in Mrs. Venita Smith’s classes!,https://facebook.com/story.php?story_fbid=1754053921411447&id=144868215663367,"Virtual Arkansas
August 26 at 3:15 PM ·

Attention Virtual Arkansas Parents whose students are taking a Teacher-Led course.
We have something just for you! Pick a date that works best for you & register for a live webinar to learn more about Virtual Arkansas.

8.30.20 @ 4PM Register in advance for this webinar:
https://us02web.zoom.us/webinar/register/WN_aPe0IpJTQS6zMJ7M_wgnxw

8.31.20 @ 6PM Register in advance for this webinar:
https://us02web.zoom.us/webinar/register/WN_gjADFzdKTS65M6lifYpG9Q

9.3.20 @ 6PM Register in advance for this webinar:
https://us02web.zoom.us/webinar/register/WN_dDygfrYFRVmi59fk5p6PRg",0.0,"For All Virtual Learning DLC parents with students in Mrs. Venita Smith’s classes!

Virtual Arkansas
August 26 at 3:15 PM ·

Attention Virtual Arkansas Parents whose students are taking a Teacher-Led course.
We have something just for you! Pick a date that works best for you & register for a live webinar to learn more about Virtual Arkansas.

8.30.20 @ 4PM Register in advance for this webinar:
https://us02web.zoom.us/webinar/register/WN_aPe0IpJTQS6zMJ7M_wgnxw

8.31.20 @ 6PM Register in advance for this webinar:
https://us02web.zoom.us/webinar/register/WN_gjADFzdKTS65M6lifYpG9Q

9.3.20 @ 6PM Register in advance for this webinar:
https://us02web.zoom.us/webinar/register/WN_dDygfrYFRVmi59fk5p6PRg",2020-08-26 21:40:11,,
118,0.0,,2.0,,1754033024746870,"Attention JCHS seniors and parents:
Due to the uncertainty of the weather, JCHS senior pictures will be rescheduled for a later date but the scheduled times will be the same. Senior cheerleaders and football players, we will still do the head shots on Friday of this week.",https://facebook.com/story.php?story_fbid=1754033024746870&id=144868215663367,,0.0,"Attention JCHS seniors and parents:
Due to the uncertainty of the weather, JCHS senior pictures will be rescheduled for a later date but the scheduled times will be the same. Senior cheerleaders and football players, we will still do the head shots on Friday of this week.",2020-08-26 21:13:55,,
119,0.0,,0.0,,1754014068082099,"Important message for Seniors, football players and cheerleaders.",https://facebook.com/story.php?story_fbid=1754014068082099&id=144868215663367,"Leanna Hanry is with Cam Frazier and 19 others.
August 26 at 7:37 PM ·

Attention JCHS Seniors and parents:Due to the uncertainty of the weather, JCHS senior pictures will be rescheduled for a later date but the scheduled times will be the same. Senior cheerleaders and football players we will still do the head shots on Friday of this week.

Please tag others",2.0,"Important message for Seniors, football players and cheerleaders.

Leanna Hanry is with Cam Frazier and 19 others.
August 26 at 7:37 PM ·

Attention JCHS Seniors and parents:Due to the uncertainty of the weather, JCHS senior pictures will be rescheduled for a later date but the scheduled times will be the same. Senior cheerleaders and football players we will still do the head shots on Friday of this week.

Please tag others",2020-08-26 20:43:33,,
120,0.0,,0.0,,,"Attention JCHS Seniors and parents:Due to the uncertainty of the weather, JCHS senior pictures will be rescheduled for a later date but the scheduled times will be the same. Senior cheerleaders and football players we will still do the head shots on Friday of this week.

Please tag others",https://facebook.com/story.php?story_fbid=10223652518002221&id=1269827084,,0.0,"Attention JCHS Seniors and parents:Due to the uncertainty of the weather, JCHS senior pictures will be rescheduled for a later date but the scheduled times will be the same. Senior cheerleaders and football players we will still do the head shots on Friday of this week.

Please tag others",,,
121,5.0,https://scontent-atl3-1.xx.fbcdn.net/v/t1.0-9/fr/cp0/e15/q65/118517006_1754011804748992_8675976434231005794_n.jpg?_nc_cat=102&_nc_sid=2d5d41&_nc_ohc=_2KnMqNTZzIAX9-JTZV&_nc_oc=AQkS11qx3YqMFh2O3hmMCzzAn-gBVIIwAMffZcB2yJKvIab3f_aDHqS3cSkMiyyo2bw&_nc_ht=scontent-atl3-1.xx&tp=14&oh=a69badadc3d94d304b1dc7c8f7fd63fa&oe=5F84AF2E,13.0,,1754011798082326,"JCSD-NECC Inclement Weather Message:
With tropical storm winds predicted and the high likelihood of power outage or flooding, JCSD will be CLOSED to onsite instruction tomorrow Thursday, August 27. We plan to resume Friday. Students are to log into google classroom for assignments.",,,0.0,"JCSD-NECC Inclement Weather Message:
With tropical storm winds predicted and the high likelihood of power outage or flooding, JCSD will be CLOSED to onsite instruction tomorrow Thursday, August 27. We plan to resume Friday. Students are to log into google classroom for assignments.",2020-08-26 20:39:49,,
122,0.0,,1.0,https://forms.gle/dimBMdoDhCPq1has6,1753800394770133,"JCSD-NECC PARENTS OF VIRTUAL STUDENTS:
••Daily virtual meal pickup location has been changed! ••
Beginning tomorrow August 27, virtual meal pickup will be at 11:30 in the FRONT CAFETERIA PARKING LOT where the buses unload. Click link to order.

Robby Lowe Donna McLelland",https://facebook.com/story.php?story_fbid=1753800394770133&id=144868215663367,"DOCS.GOOGLE.COM
DRAGON VIRTUAL LUNCH (Pickup Only) One child per form. Daily Deadline: 9am",0.0,"JCSD-NECC PARENTS OF VIRTUAL STUDENTS:
••Daily virtual meal pickup location has been changed! ••
Beginning tomorrow August 27, virtual meal pickup will be at 11:30 in the FRONT CAFETERIA PARKING LOT where the buses unload. Click link to order.

Robby Lowe Donna McLelland

DOCS.GOOGLE.COM
DRAGON VIRTUAL LUNCH (Pickup Only) One child per form. Daily Deadline: 9am",2020-08-26 15:15:52,,
123,0.0,,1.0,https://5il.co/k34g,1753799511436888,REMINDER: 2021 Senior Portraits will be taken tomorrow (Thursday) in the MPR. Click link for schedule!,https://facebook.com/story.php?story_fbid=1753799511436888&id=144868215663367,"CORE-DOCS.S3.AMAZONAWS.COM
core-docs.s3.amazonaws.com",0.0,"REMINDER: 2021 Senior Portraits will be taken tomorrow (Thursday) in the MPR. Click link for schedule!

CORE-DOCS.S3.AMAZONAWS.COM
core-docs.s3.amazonaws.com",2020-08-26 15:14:34,,
124,0.0,,0.0,http://5il.co/4dw2,1753794371437402,"JCHS Announcements 8-26-2020
http://5il.co/4dw2",https://facebook.com/story.php?story_fbid=1753794371437402&id=144868215663367,,0.0,"JCHS Announcements 8-26-2020
http://5il.co/4dw2",2020-08-26 15:06:21,,
125,0.0,,1.0,,1753700444780128,GO DRAGONS!,https://facebook.com/story.php?story_fbid=1753700444780128&id=144868215663367,"Junction City Dragons High School Football
August 26 at 10:59 AM ·

The Dragons host Harmony Grove Friday night at 7:30. Tickets are $5 and may be purchased at the gate.",0.0,"GO DRAGONS!

Junction City Dragons High School Football
August 26 at 10:59 AM ·

The Dragons host Harmony Grove Friday night at 7:30. Tickets are $5 and may be purchased at the gate.",2020-08-26 12:51:25,,
126,0.0,,0.0,,,The Dragons host Harmony Grove Friday night at 7:30. Tickets are $5 and may be purchased at the gate.,https://facebook.com/story.php?story_fbid=707234736526895&id=127309331186108,,0.0,The Dragons host Harmony Grove Friday night at 7:30. Tickets are $5 and may be purchased at the gate.,,,
127,1.0,,12.0,https://www.youtube.com/channel/UC-yrP9lsdUN5u5dY3EBIZGw,1752837064866466,,https://facebook.com/story.php?story_fbid=1752837064866466&id=144868215663367,,17.0,,2020-08-25 15:18:13,,
128,0.0,,2.0,,1752691294881043,JCHS Band Request!,https://facebook.com/story.php?story_fbid=1752691294881043&id=144868215663367,"Alana Girard‎Junction City Dragon Band
August 25 at 10:50 AM ·

Band Parents: we need 3-4 people to work in the concession stand for the Harmony Grove game Friday night.

Who is available?",0.0,"JCHS Band Request!

Alana Girard‎Junction City Dragon Band
August 25 at 10:50 AM ·

Band Parents: we need 3-4 people to work in the concession stand for the Harmony Grove game Friday night.

Who is available?",2020-08-25 11:54:18,,
129,0.0,,0.0,,,"Band Parents: we need 3-4 people to work in the concession stand for the Harmony Grove game Friday night.

Who is available?",,,0.0,"Band Parents: we need 3-4 people to work in the concession stand for the Harmony Grove game Friday night.

Who is available?",,,
130,3.0,https://scontent-atl3-1.xx.fbcdn.net/v/t1.0-9/118472319_1752669374883235_4252727005904915002_n.png?_nc_cat=111&_nc_sid=8024bb&_nc_ohc=le-91Osj5_4AX-3JJWf&_nc_ht=scontent-atl3-1.xx&oh=acb6e113efcf721b01032c9cdaa03b0f&oe=5F85F050,18.0,,1752670051549834,Go Dragons!,https://facebook.com/story.php?story_fbid=1752670051549834&id=144868215663367,,0.0,Go Dragons!,2020-08-25 11:23:51,,
131,0.0,,0.0,http://5il.co/4dw2,1752668411549998,"JCHS Announcements 8/25/2020
http://5il.co/4dw2",https://facebook.com/story.php?story_fbid=1752668411549998&id=144868215663367,,0.0,"JCHS Announcements 8/25/2020
http://5il.co/4dw2",2020-08-25 11:21:48,,
132,1.0,,1.0,https://5il.co/k43u3u,1752646954885477,"SUBSTITUTE TRAINING will be held September 10, 2020. If you are interested in becoming a substitute or if you have been one in the past, due to COVID restrictions you MUST CALL by September 9th to schedule your training session. Please click this link for important information concerning substitute training! https://5il.co/k43u3u",https://facebook.com/story.php?story_fbid=1752646954885477&id=144868215663367,"CORE-DOCS.S3.AMAZONAWS.COM
core-docs.s3.amazonaws.com",4.0,"SUBSTITUTE TRAINING will be held September 10, 2020. If you are interested in becoming a substitute or if you have been one in the past, due to COVID restrictions you MUST CALL by September 9th to schedule your training session. Please click this link for important information concerning substitute training! https://5il.co/k43u3u

CORE-DOCS.S3.AMAZONAWS.COM
core-docs.s3.amazonaws.com",2020-08-25 10:51:24,,
133,0.0,https://scontent-atl3-1.xx.fbcdn.net/v/t1.0-9/118549442_1752620208221485_9028433377628343429_o.png?_nc_cat=105&_nc_sid=2d5d41&_nc_ohc=X1XddA-zAXgAX8rDPA-&_nc_ht=scontent-atl3-1.xx&oh=6efb749c203ec7061c49194700224064&oe=5F846D42,1.0,,1752620204888152,JCHS-NECC Parents of Grades 7-12 Virtual Students: Chromebooks may be checked out today in the MPR from 3:20 - 6:30pm!,,,0.0,JCHS-NECC Parents of Grades 7-12 Virtual Students: Chromebooks may be checked out today in the MPR from 3:20 - 6:30pm!,2020-08-25 10:18:14,,
134,1.0,,18.0,,1752539464896226,Teacher reflection on first day of school 2020!,https://facebook.com/story.php?story_fbid=1752539464896226&id=144868215663367,"Connie Hammett
August 24 at 11:44 PM ·

When I was a little girl, one of the most frighting things to me was going to school. Well today brought back some of that because everything was a little different. Non of us really knew what to expect of today. So we all got prepared, students and staff and guess what, we made it!! I am so proud of my school!!! We had it going on!!!!I am so proud of the students because they were ready for what they were facing. They wore their mask and cleaned their hands just like they were told. I am an adult and I can tell you, it was sooooo hard wearing those mask.
I just had to brag on our Junction City Elementary students for hanging in there today and doing a great job!!!! I’m proud to be a DRAGON!!!💜💛💜💛💜💛💜💛",0.0,"Teacher reflection on first day of school 2020!

Connie Hammett
August 24 at 11:44 PM ·

When I was a little girl, one of the most frighting things to me was going to school. Well today brought back some of that because everything was a little different. Non of us really knew what to expect of today. So we all got prepared, students and staff and guess what, we made it!! I am so proud of my school!!! We had it going on!!!!I am so proud of the students because they were ready for what they were facing. They wore their mask and cleaned their hands just like they were told. I am an adult and I can tell you, it was sooooo hard wearing those mask.
I just had to brag on our Junction City Elementary students for hanging in there today and doing a great job!!!! I’m proud to be a DRAGON!!!💜💛💜💛💜💛💜💛",2020-08-25 08:49:57,,
135,0.0,,0.0,,,"When I was a little girl, one of the most frighting things to me was going to school. Well today brought back some of that because everything was a little different. Non of us really knew what to expect of today. So we all got prepared, students and staff and guess what, we made it!! I am so proud of my school!!! We had it going on!!!!I am so proud of the students because they were ready for what they were facing. They wore their mask and cleaned their hands just like they were told. I am an adult and I can tell you, it was sooooo hard wearing those mask.
I just had to brag on our Junction City Elementary students for hanging in there today and doing a great job!!!! I’m proud to be a DRAGON!!!💜💛💜💛💜💛💜💛",https://facebook.com/story.php?story_fbid=10220896554674990&id=1573720357,,0.0,"When I was a little girl, one of the most frighting things to me was going to school. Well today brought back some of that because everything was a little different. Non of us really knew what to expect of today. So we all got prepared, students and staff and guess what, we made it!! I am so proud of my school!!! We had it going on!!!!I am so proud of the students because they were ready for what they were facing. They wore their mask and cleaned their hands just like they were told. I am an adult and I can tell you, it was sooooo hard wearing those mask.
I just had to brag on our Junction City Elementary students for hanging in there today and doing a great job!!!! I’m proud to be a DRAGON!!!💜💛💜💛💜💛💜💛",,,
136,0.0,,6.0,,1752055434944629,💛,https://facebook.com/story.php?story_fbid=1752055434944629&id=144868215663367,"Carrie Joyce Miller
August 24 at 5:11 PM ·

Magic Playdough was such a hit with these cuties! We had an excellent day!",0.0,"💛

Carrie Joyce Miller
August 24 at 5:11 PM ·

Magic Playdough was such a hit with these cuties! We had an excellent day!",2020-08-24 19:52:28,,
137,0.0,,16.0,,1752054524944720,💜,https://facebook.com/story.php?story_fbid=1752054524944720&id=144868215663367,"Dee-Shana Sullivan McKinnon is with Jana Frisby and 5 others.
August 24 at 5:50 PM ·

It was so fun to finally be back in the classroom with some real live children in the flesh! We had a good first day! ❤️ 😊
#ThirdGradeLife",0.0,"💜

Dee-Shana Sullivan McKinnon is with Jana Frisby and 5 others.
August 24 at 5:50 PM ·

It was so fun to finally be back in the classroom with some real live children in the flesh! We had a good first day! ❤️ 😊
#ThirdGradeLife",2020-08-24 19:50:28,,
138,0.0,https://scontent-atl3-1.xx.fbcdn.net/v/t1.0-9/fr/cp0/e15/q65/118439899_3557057824326615_3075943670957179902_n.jpg?_nc_cat=107&_nc_sid=8024bb&_nc_ohc=kgdM1ZQ1Y_wAX9BZxu-&_nc_ht=scontent-atl3-1.xx&tp=14&oh=545eee30dff08d4bc1a43e9a365077f9&oe=5F84F081,10.0,,1751915208291985,💜,https://facebook.com/story.php?story_fbid=1751915208291985&id=144868215663367,"Read Aloud
August 24 at 11:41 AM ·",3.0,"💜

Read Aloud
August 24 at 11:41 AM ·",2020-08-24 15:54:41,,
139,0.0,,36.0,,1751811998302306,Senior Breakfast was a HIT! We 💜 our 2021 Dragon Seniors! We pray you all have a GREAT YEAR!,https://facebook.com/story.php?story_fbid=1751811998302306&id=144868215663367,"Teniah M Trosclair
August 24 at 10:09 AM ·

Well it is officially Senior Year for my boy... I can not believe how fast the years have flown! I have enjoyed each and every minute! I pray the class of 2021 has a wonderful year, and all of their hopes and dreams come true!! GO DRAGONS!!
❤️🐲💜💛",0.0,"Senior Breakfast was a HIT! We 💜 our 2021 Dragon Seniors! We pray you all have a GREAT YEAR!

Teniah M Trosclair
August 24 at 10:09 AM ·

Well it is officially Senior Year for my boy... I can not believe how fast the years have flown! I have enjoyed each and every minute! I pray the class of 2021 has a wonderful year, and all of their hopes and dreams come true!! GO DRAGONS!!
❤️🐲💜💛",2020-08-24 13:14:51,,
140,0.0,,0.0,http://5il.co/4dw2,1751726531644186,"JCHS Announcements 8/24/2020
http://5il.co/4dw2",https://facebook.com/story.php?story_fbid=1751726531644186&id=144868215663367,,0.0,"JCHS Announcements 8/24/2020
http://5il.co/4dw2",2020-08-24 11:25:14,,
141,2.0,,45.0,,1751568524993320,THIS FRIDAY 7:30PM AT Paul H. Muse Field at David Carpenter Stadium! #GoDragons,https://facebook.com/story.php?story_fbid=1751568524993320&id=144868215663367,"FRI, AUG 28
Junction City vs. Harmony Grove",0.0,"THIS FRIDAY 7:30PM AT Paul H. Muse Field at David Carpenter Stadium! #GoDragons

FRI, AUG 28
Junction City vs. Harmony Grove",2020-08-24 09:00:42,,
