,comments,image,likes,link,post_id,post_text,post_url,shared_text,shares,text,time,video,video_thumbnail
0,0.0,https://scontent-atl3-1.xx.fbcdn.net/v/t1.0-9/fr/cp0/e15/q65/119136533_2705343513087637_778452775629262295_o.jpg?_nc_cat=102&_nc_sid=110474&_nc_ohc=F98WSHTG9XQAX_t2ntS&_nc_ht=scontent-atl3-1.xx&tp=14&oh=6b601b8f22accb779c4b76eaacbe65bf&oe=5F88372A,2.0,,2705343533087635,Homecoming dress up days,https://facebook.com/story.php?story_fbid=2705343533087635&id=1746624372292894,,0.0,Homecoming dress up days,2020-09-13 18:33:24,,
1,0.0,https://scontent-atl3-1.xx.fbcdn.net/v/t1.0-9/fr/cp0/e15/q65/119442550_2705003536454968_3407058562779782613_o.jpg?_nc_cat=108&_nc_sid=110474&_nc_ohc=D73r_gnQy1sAX89-N1Z&_nc_ht=scontent-atl3-1.xx&tp=14&oh=f282d96562ac2224cf9bd94e3d7c3f18&oe=5F88F420,9.0,,2705003566454965,2020-2021 school calendar,https://facebook.com/story.php?story_fbid=2705003566454965&id=1746624372292894,,0.0,2020-2021 school calendar,2020-09-13 09:36:13,,
2,0.0,,10.0,,2697544490534206,"Tonight's football game has been cancelled. We will have a home game Saturday September 5th, at 2 p.m.",https://facebook.com/story.php?story_fbid=2697544490534206&id=1746624372292894,,0.0,"Tonight's football game has been cancelled. We will have a home game Saturday September 5th, at 2 p.m.",2020-09-04 18:17:31,,
3,1.0,https://scontent-atl3-1.xx.fbcdn.net/v/t1.0-9/fr/cp0/e15/q65/118307098_2691242444497744_7345760942074728796_o.jpg?_nc_cat=111&_nc_sid=110474&_nc_ohc=adSs1rl-\-\fIAX8YErPB&_nc_ht=scontent-atl3-1.xx&tp=14&oh=a02e2ff8fcb240c463800ee203e485cd&oe=5F88A417,22.0,,2691242584497730,Middle School Tigers working together towards a common goal! わ,https://facebook.com/story.php?story_fbid=2691242584497730&id=1746624372292894,,0.0,Middle School Tigers working together towards a common goal! わ,2020-08-28 15:16:30,,
4,0.0,,16.0,,2689911897964132,,https://facebook.com/story.php?story_fbid=2689911897964132&id=1746624372292894,,0.0,,2020-08-27 05:21:47,,
5,3.0,,4.0,http://libertyps.org/,2689909894630999,Liberty Public School is currently operating at Orange Level 2. Our protocol for the color coded Covid system can be found at libertyps.org,https://facebook.com/story.php?story_fbid=2689909894630999&id=1746624372292894,,0.0,Liberty Public School is currently operating at Orange Level 2. Our protocol for the color coded Covid system can be found at libertyps.org,2020-08-27 05:18:01,,
6,0.0,,12.0,,2678606759094646,"The 2019-2020 YEARBOOKS have finally arrived! Distribution for those students and individuals that PRE-ORDERED is as follows:

If your last name begins with A - P, you can pick up from Mrs. Rodgers at the high school from
12:30 p.m. to 3:30 p.m. on TUESDAY, August 18th.

If your last name begins with Q - Z, you can pick up from Mrs. Rodgers at the high school from
12:30 p.m. to 3:30 p.m. on Wednesday, August, 19th.

Again, pick up will be for PRE-ORDERS only. Extra yearbooks will be for sale in the near future, stayed posted to the Liberty school facebook and website.

--
Linda J. Rodgers
Liberty High School
English Instructor",https://facebook.com/story.php?story_fbid=2678606759094646&id=1746624372292894,,0.0,"The 2019-2020 YEARBOOKS have finally arrived! Distribution for those students and individuals that PRE-ORDERED is as follows:

If your last name begins with A - P, you can pick up from Mrs. Rodgers at the high school from
12:30 p.m. to 3:30 p.m. on TUESDAY, August 18th.

If your last name begins with Q - Z, you can pick up from Mrs. Rodgers at the high school from
12:30 p.m. to 3:30 p.m. on Wednesday, August, 19th.

Again, pick up will be for PRE-ORDERS only. Extra yearbooks will be for sale in the near future, stayed posted to the Liberty school facebook and website.

--
Linda J. Rodgers
Liberty High School
English Instructor",2020-08-14 13:37:15,,
7,0.0,,1.0,,2677697352518920,Softball game for today has been rained out.,https://facebook.com/story.php?story_fbid=2677697352518920&id=1746624372292894,,0.0,Softball game for today has been rained out.,2020-08-13 12:01:39,,
8,0.0,,7.0,,2677162775905711,Please come out and support your Lady Tigers in their first home softball game. The game begins at 4:30 tomorrow. Please bring your own chair and sit six feet apart. If you can not sit six feet apart a mask is required.,https://facebook.com/story.php?story_fbid=2677162775905711&id=1746624372292894,,0.0,Please come out and support your Lady Tigers in their first home softball game. The game begins at 4:30 tomorrow. Please bring your own chair and sit six feet apart. If you can not sit six feet apart a mask is required.,2020-08-12 20:39:48,,
9,0.0,https://scontent-atl3-1.xx.fbcdn.net/v/t1.0-9/fr/cp0/e15/q65/117394461_2672626953025960_7169429766538777892_o.jpg?_nc_cat=106&_nc_sid=8024bb&_nc_ohc=GYE3J6yEaKgAX_9txH-&_nc_ht=scontent-atl3-1.xx&tp=14&oh=0ebd6208a447c616955676c91405e495&oe=5F864BC4,3.0,,2672627593025896,"Liberty High School and Junior High Cheer will be holding a Clinic at the school from 9-12 on Friday August 14th and Cheer Tryouts will be Monday August 17th High School at 9am and Junior High at 11am. Physicals and Drug tests are required to attend and tryout, athletic packets are in the high school office. Attending the clinic is mandatory to try out. Please contact Coach Britt at 918-510-700 or at Brittany.gillespie@libertyps.org for more information",https://facebook.com/story.php?story_fbid=2672627593025896&id=1746624372292894,,0.0,"Liberty High School and Junior High Cheer will be holding a Clinic at the school from 9-12 on Friday August 14th and Cheer Tryouts will be Monday August 17th High School at 9am and Junior High at 11am. Physicals and Drug tests are required to attend and tryout, athletic packets are in the high school office. Attending the clinic is mandatory to try out. Please contact Coach Britt at 918-510-700 or at Brittany.gillespie@libertyps.org for more information",2020-08-07 11:09:13,,
10,0.0,https://scontent-atl3-1.xx.fbcdn.net/v/t1.0-9/fr/cp0/e15/q65/109384861_3440183915993316_3862328906405471995_n.jpg?_nc_cat=108&_nc_sid=110474&_nc_ohc=QqHZsSJz5lMAX9uDd7W&_nc_ht=scontent-atl3-1.xx&tp=14&oh=18ea7ed17a04a7bbc10d8b01ecbf7458&oe=5F87E3B5,7.0,,2670069589948363,,https://facebook.com/story.php?story_fbid=2670069589948363&id=1746624372292894,"Nelson Car Country
July 31 at 11:20 AM 路

The Nelson Auto Group in partnership with the 180 Disaster Relief Ministry is giving away 500 boxes of fresh fruits and vegetables and dairy products. Each box weighs approximately 20 pounds.

We will also be giving away 500 backpacks filled with school supplies.

If you are in need, know someone in need, or would like some healthy options please come see us at Nelson Car Country Tuesday August 4th 1:00pm-4:00pm.

The Nelson Car Country Team will be there to help you load the box in your car. 1 box per car and 1 backpack per child please.

No strings attached, we just want to bless you!

Nelson Car Country
14780 S Memorial Dr
Bixby , ok 74008",3.0,"Nelson Car Country
July 31 at 11:20 AM 路

The Nelson Auto Group in partnership with the 180 Disaster Relief Ministry is giving away 500 boxes of fresh fruits and vegetables and dairy products. Each box weighs approximately 20 pounds.

We will also be giving away 500 backpacks filled with school supplies.

If you are in need, know someone in need, or would like some healthy options please come see us at Nelson Car Country Tuesday August 4th 1:00pm-4:00pm.

The Nelson Car Country Team will be there to help you load the box in your car. 1 box per car and 1 backpack per child please.

No strings attached, we just want to bless you!

Nelson Car Country
14780 S Memorial Dr
Bixby , ok 74008",2020-08-04 10:26:12,,
11,0.0,,9.0,,2670026823285973,"August 4th
The softball players, junior high and high school, are welcome to start practicing from 2:30 until 4:30. Extra time is available for any players who are willing to show up early or stay late. We may not cover everything in a practice, so if there is something you need or want to improve on, you will need to be prepared to give up some of your time. School guidelines for practicing safely during these times will be in place and will be expected to be followed. If you have questions you can email Jeremy.williams@libertyps.org.

Thank You,
Jeremy Williams",https://facebook.com/story.php?story_fbid=2670026823285973&id=1746624372292894,,0.0,"August 4th
The softball players, junior high and high school, are welcome to start practicing from 2:30 until 4:30. Extra time is available for any players who are willing to show up early or stay late. We may not cover everything in a practice, so if there is something you need or want to improve on, you will need to be prepared to give up some of your time. School guidelines for practicing safely during these times will be in place and will be expected to be followed. If you have questions you can email Jeremy.williams@libertyps.org.

Thank You,
Jeremy Williams",2020-08-04 09:20:10,,
12,8.0,,24.0,,2667221860233136,"Brief Update from Board Meeting:

Teachers official report date: Aug. 11
First day of school: Aug. 27

There will be options of distance learning or in person learning. Parents will have the choice to make this week. More information will follow.

Much more information will follow this week with additional details.",https://facebook.com/story.php?story_fbid=2667221860233136&id=1746624372292894,,0.0,"Brief Update from Board Meeting:

Teachers official report date: Aug. 11
First day of school: Aug. 27

There will be options of distance learning or in person learning. Parents will have the choice to make this week. More information will follow.

Much more information will follow this week with additional details.",2020-08-01 02:56:41,,
13,7.0,,2.0,,287913482434228,,,,2.0,,2020-07-28 21:29:49,https://video-atl3-1.xx.fbcdn.net/v/t42.26565-2/10000000_761572077937552_8044934111771101589_n.mp4?_nc_cat=101&_nc_sid=985c63&efg=eyJ2ZW5jb2RlX3RhZyI6Im9lcF9zZCJ9&_nc_ohc=C1mJuaDuhrAAX-RhOvC&_nc_ht=video-atl3-1.xx&oh=d991fef4473414cfa65ccbe351504383&oe=5F622BF5,
14,3.0,,0.0,,622991445008701,,,,0.0,,2020-07-28 20:52:49,https://video-atl3-1.xx.fbcdn.net/v/t42.26565-2/10000000_837027226829959_8990658110690226352_n.mp4?_nc_cat=102&_nc_sid=985c63&efg=eyJ2ZW5jb2RlX3RhZyI6Im9lcF9zZCJ9&_nc_ohc=la5zQ5rThGUAX89D9GR&_nc_ht=video-atl3-1.xx&oh=fb6eb8ccd477e86e7f29710b2da55c9d&oe=5F623336,
15,1.0,,0.0,,2664602310495091,We are to the public comment question session. Post here and we will address what we can.,https://facebook.com/story.php?story_fbid=2664602310495091&id=1746624372292894,,0.0,We are to the public comment question session. Post here and we will address what we can.,2020-07-28 20:52:01,,
16,0.0,,0.0,,286049219328163,,,,0.0,,2020-07-28 20:42:58,https://video-atl3-1.xx.fbcdn.net/v/t42.26565-2/115957033_301115187901567_2748318760864880355_n.mp4?_nc_cat=104&_nc_sid=985c63&efg=eyJ2ZW5jb2RlX3RhZyI6Im9lcF9zZCJ9&_nc_ohc=K-GHQLhK-38AX_OZDqj&_nc_ht=video-atl3-1.xx&oh=e4dbd8eb765599724ddb8c1851c05463&oe=5F623333,
17,9.0,,2.0,,286128369286154,,,,0.0,,2020-07-28 20:35:56,https://video-atl3-1.xx.fbcdn.net/v/t42.26565-2/10000000_310276673445475_4573024302095523133_n.mp4?_nc_cat=100&_nc_sid=985c63&efg=eyJ2ZW5jb2RlX3RhZyI6Im9lcF9zZCJ9&_nc_ohc=ApFHjc3BybAAX9puL2j&_nc_ht=video-atl3-1.xx&oh=78b84e7f31b5412577da71bf9cc5d548&oe=5F622A8E,
18,3.0,,1.0,,2664592407162748,"The Liberty Foundation page is live also. We are having major connectivity problems with all platforms. We are recording. Post your questions to this post, and we will try to address them.",https://facebook.com/story.php?story_fbid=2664592407162748&id=1746624372292894,,0.0,"The Liberty Foundation page is live also. We are having major connectivity problems with all platforms. We are recording. Post your questions to this post, and we will try to address them.",2020-07-28 20:33:07,,
19,6.0,,1.0,,2664581293830526,Try Trina Evans FB,https://facebook.com/story.php?story_fbid=2664581293830526&id=1746624372292894,,0.0,Try Trina Evans FB,2020-07-28 20:15:57,,
20,7.0,,1.0,,895600137598541,,,,0.0,,2020-07-28 20:04:27,https://video-atl3-1.xx.fbcdn.net/v/t42.26565-2/116029072_115313733412524_6505432287292796919_n.mp4?_nc_cat=106&_nc_sid=985c63&efg=eyJ2ZW5jb2RlX3RhZyI6Im9lcF9zZCJ9&_nc_ohc=Lj52CQzhJ_kAX98drGw&_nc_ht=video-atl3-1.xx&oh=23d298ae272d9396402be3e9020e7e5e&oe=5F622DCE,
21,31.0,,0.0,,603576047235162,,,,0.0,,2020-07-28 20:00:28,https://video-atl3-1.xx.fbcdn.net/v/t42.26565-2/110002091_966772230414514_4866760305540747547_n.mp4?_nc_cat=109&_nc_sid=985c63&efg=eyJ2ZW5jb2RlX3RhZyI6Im9lcF9zZCJ9&_nc_ohc=MQnPhKDYJ0gAX-6j5M6&_nc_ht=video-atl3-1.xx&oh=4dfbfe78132096f5c0af274e8ac9c0a2&oe=5F6228F9,
22,3.0,,2.0,,3386725738004175,,,,0.0,,2020-07-28 19:58:13,https://video-atl3-1.xx.fbcdn.net/v/t42.26565-2/115968632_349497433117922_2995422987658670856_n.mp4?_nc_cat=102&_nc_sid=985c63&efg=eyJ2ZW5jb2RlX3RhZyI6Im9lcF9zZCJ9&_nc_ohc=KWVsqzOA_DEAX_5Bl0-&_nc_ht=video-atl3-1.xx&oh=3481ee333978f73716cfd4ed914e0958&oe=5F6235A4,
23,0.0,,11.0,,2664568800498442,We will begin the live video when the meeting starts.,https://facebook.com/story.php?story_fbid=2664568800498442&id=1746624372292894,,0.0,We will begin the live video when the meeting starts.,2020-07-28 19:53:34,,
24,0.0,,14.0,,2663789350576387,,https://facebook.com/story.php?story_fbid=2663789350576387&id=1746624372292894,,0.0,,2020-07-27 20:56:42,,
25,0.0,https://scontent-atl3-1.xx.fbcdn.net/v/t1.0-9/111798314_2660815254207130_757623169667163678_o.png?_nc_cat=104&_nc_sid=8024bb&_nc_ohc=p_VL0ya-x64AX9NehDr&_nc_oc=AQl_Z-6OSN4aDj6r0bkDjehf-0mrqX7ao12yhVVxhToQn7RS9Xs5CyRlNXCjs0hUEvw&_nc_ht=scontent-atl3-1.xx&oh=d8bb37d7911f90b090c49fce3a929e51&oe=5F86FC67,1.0,https://www.ok.gov/health2/documents/IMM_Parents_School_Vaccines_Requirements_OK_English.pdf,2660814384207217,"Hello!

The state of Oklahoma requires that all incoming 7th graders receive their TDap immunization before the first day of school. We will need a copy of up-to-date shot records for your students. More information about immunization requirements is available from the Oklahoma State Department of Health.

https://www.ok.gov/health2/documents/IMM_Parents_School_Vaccines_Requirements_OK_English.pdf



Thank you!

Audra Broadhead",https://facebook.com/story.php?story_fbid=2660814384207217&id=1746624372292894,,0.0,"Hello!

The state of Oklahoma requires that all incoming 7th graders receive their TDap immunization before the first day of school. We will need a copy of up-to-date shot records for your students. More information about immunization requirements is available from the Oklahoma State Department of Health.

https://www.ok.gov/health2/documents/IMM_Parents_School_Vaccines_Requirements_OK_English.pdf



Thank you!

Audra Broadhead",2020-07-24 14:24:10,,
26,0.0,,14.0,,2660802330875089,,https://facebook.com/story.php?story_fbid=2660802330875089&id=1746624372292894,,0.0,,2020-07-24 14:03:03,,
27,1.0,,7.0,http://teacherease.com/,2660737360881586,"Greetings, Tiger Nation.

2020-2021 enrollment will begin on Tuesday, July 28th.

Returning Students: Log into teacherease.com.
Complete the online registration. Go to libertyps.org and complete the remaining forms. Email the forms to your building secretary. You may also drop off the paper forms to the correct building during office hours.

New Students: Pick up a packet from the correct building. Bring a copy of birth certificate, shot records, and evidence of proof of residency. The completed packet can be returned during office hours.

Students with No internet access: Pick up a paper packet from the correct building. Complete the packet and return it during office hours.

We are looking forward to a successful year.

Office hours 7/28-7/31
Tuesday, Wednesday, Friday 9-3
Thursday 12-7",https://facebook.com/story.php?story_fbid=2660737360881586&id=1746624372292894,,0.0,"Greetings, Tiger Nation.

2020-2021 enrollment will begin on Tuesday, July 28th.

Returning Students: Log into teacherease.com.
Complete the online registration. Go to libertyps.org and complete the remaining forms. Email the forms to your building secretary. You may also drop off the paper forms to the correct building during office hours.

New Students: Pick up a packet from the correct building. Bring a copy of birth certificate, shot records, and evidence of proof of residency. The completed packet can be returned during office hours.

Students with No internet access: Pick up a paper packet from the correct building. Complete the packet and return it during office hours.

We are looking forward to a successful year.

Office hours 7/28-7/31
Tuesday, Wednesday, Friday 9-3
Thursday 12-7",2020-07-24 12:23:18,,
28,0.0,,6.0,,2659708870984435,"Attention tonight is the night.

19-20 Liberty All Sports Banquet will be held at Faith Church July 23. The Booster Club will pay for each athlete grades 9-12. Guest must pay $10 each at the door. Doors will open at 6.",https://facebook.com/story.php?story_fbid=2659708870984435&id=1746624372292894,,0.0,"Attention tonight is the night.

19-20 Liberty All Sports Banquet will be held at Faith Church July 23. The Booster Club will pay for each athlete grades 9-12. Guest must pay $10 each at the door. Doors will open at 6.",2020-07-23 07:41:13,,
29,0.0,,1.0,,2657821134506542,"High School Softball Practice Schedule

Monday 9-11 am
Tuesday 10-12 am
Wednesday 9-11 am
Thursday 9-11 am
Friday 9-11 am",https://facebook.com/story.php?story_fbid=2657821134506542&id=1746624372292894,,0.0,"High School Softball Practice Schedule

Monday 9-11 am
Tuesday 10-12 am
Wednesday 9-11 am
Thursday 9-11 am
Friday 9-11 am",2020-07-21 00:47:53,,
30,1.0,https://scontent-atl3-1.xx.fbcdn.net/v/t1.0-9/fr/cp0/e15/q65/115825687_2655990014689654_6149791157278296474_n.jpg?_nc_cat=106&_nc_sid=110474&_nc_ohc=uD-l_OSkWhoAX_SL6XO&_nc_ht=scontent-atl3-1.xx&tp=14&oh=12029d76f012cf2cb67b2810d789f184&oe=5F8723AE,6.0,,2655990111356311,Elementary supply lists,https://facebook.com/story.php?story_fbid=2655990111356311&id=1746624372292894,,0.0,Elementary supply lists,2020-07-18 18:04:13,,
31,5.0,https://scontent-atl3-1.xx.fbcdn.net/v/t1.0-9/fr/cp0/e15/q65/115824862_2655926754695980_3991104343499798443_o.jpg?_nc_cat=110&_nc_sid=110474&_nc_ohc=XpOeLZ5R9A8AX_PxqT6&_nc_ht=scontent-atl3-1.xx&tp=14&oh=7052c47ac997025410671c6c4e1489ad&oe=5F88E5D9,11.0,,2655926828029306,4-6th Grade Supply Lists,https://facebook.com/story.php?story_fbid=2655926828029306&id=1746624372292894,,0.0,4-6th Grade Supply Lists,2020-07-18 15:58:37,,
32,0.0,https://scontent-atl3-1.xx.fbcdn.net/v/t1.0-9/fr/cp0/e15/q65/109526032_2655899721365350_1549533077201384011_n.jpg?_nc_cat=103&_nc_sid=110474&_nc_ohc=BII9J5by0zsAX8elCK_&_nc_ht=scontent-atl3-1.xx&tp=14&oh=9cc7ad7550c61fadac23b5be0fd0deff&oe=5F887A65,5.0,,2655899761365346,,https://facebook.com/story.php?story_fbid=2655899761365346&id=1746624372292894,,0.0,,2020-07-18 15:07:46,,
33,2.0,,9.0,,2655839524704703,19-20 Liberty All Sports Banquet will be held at Faith Church July 23. The Booster Club will pay for each athlete grades 9-12. Guest must pay $10 each at the door. Doors will open at 6.,https://facebook.com/story.php?story_fbid=2655839524704703&id=1746624372292894,"THU, JUL 23
Sports Banquet",0.0,"19-20 Liberty All Sports Banquet will be held at Faith Church July 23. The Booster Club will pay for each athlete grades 9-12. Guest must pay $10 each at the door. Doors will open at 6.

THU, JUL 23
Sports Banquet",2020-07-18 13:22:57,,
34,0.0,,5.0,https://www.libertyps.org/vnews/display.v/ART/5f10d3cc236a7?__FB_PRIVATE_TRACKING__=%7B%22loggedout_browser_id%22%3A%22b9b17b4da49d7baf934ee9b8c789c9aca452c162%22%7D#.XxDglvGpcL8.facebook,2654294404859215,,https://facebook.com/story.php?story_fbid=2654294404859215&id=1746624372292894,"LIBERTYPS.ORG
Liberty Public Schools - Liberty Schools Dealing with COVID-19",7.0,"LIBERTYPS.ORG
Liberty Public Schools - Liberty Schools Dealing with COVID-19",2020-07-16 19:20:27,,
35,5.0,,4.0,,2654156631539659,"Reminder

Physicals are tonight from 4:30 to 6:30 . Please be prepared to pay twenty dollars to Klugh Chiropractic and twenty dollars to Liberty Athletics. .",https://facebook.com/story.php?story_fbid=2654156631539659&id=1746624372292894,,0.0,"Reminder

Physicals are tonight from 4:30 to 6:30 . Please be prepared to pay twenty dollars to Klugh Chiropractic and twenty dollars to Liberty Athletics. .",2020-07-16 15:11:06,,
36,5.0,,18.0,,2653120601643262,,https://facebook.com/story.php?story_fbid=2653120601643262&id=1746624372292894,,0.0,,2020-07-15 10:53:58,,
37,1.0,,3.0,,2649954001959922,"Dear parents of 2020 graduates,

The senior class sponsors are asking that you meet on Monday at 7:00 p.m. at the football field. Please follow all cdc guidelines.

Anyone that reads this post, please share this information with the parents of 2020 graduates.

Thank You,
Jeremy Williams",https://facebook.com/story.php?story_fbid=2649954001959922&id=1746624372292894,,0.0,"Dear parents of 2020 graduates,

The senior class sponsors are asking that you meet on Monday at 7:00 p.m. at the football field. Please follow all cdc guidelines.

Anyone that reads this post, please share this information with the parents of 2020 graduates.

Thank You,
Jeremy Williams",2020-07-11 16:49:28,,
38,0.0,https://scontent-atl3-1.xx.fbcdn.net/v/t1.0-9/fr/cp0/e15/q65/107864093_2647453092210013_583817839134572056_n.jpg?_nc_cat=102&_nc_sid=110474&_nc_ohc=aLvRLHSWlWcAX8uyNfD&_nc_ht=scontent-atl3-1.xx&tp=14&oh=4f6583924856b82e909113a2406758ce&oe=5F866F25,6.0,,2647453122210010,,https://facebook.com/story.php?story_fbid=2647453122210010&id=1746624372292894,,0.0,,2020-07-08 14:24:11,,
39,3.0,https://scontent-atl3-1.xx.fbcdn.net/v/t1.0-9/fr/cp0/e15/q65/107661508_2647389222216400_4138354588673974911_n.jpg?_nc_cat=103&_nc_sid=110474&_nc_ohc=VBW4aBdvF8EAX-Meei5&_nc_ht=scontent-atl3-1.xx&tp=14&oh=94f27e950c6a291f1797bcdfef851dd8&oe=5F85BCFC,8.0,,2647389265549729,,https://facebook.com/story.php?story_fbid=2647389265549729&id=1746624372292894,,0.0,,2020-07-08 12:47:53,,
40,0.0,,5.0,,2640933219528667,Liberty Booster Club will host an all sports banquet on July 23rd at 6:00 p.m. at Faith Church.,https://facebook.com/story.php?story_fbid=2640933219528667&id=1746624372292894,,0.0,Liberty Booster Club will host an all sports banquet on July 23rd at 6:00 p.m. at Faith Church.,2020-06-30 14:38:47,,
41,6.0,,31.0,,2640203009601688,"Big shout out to Troy Applegarth for being chosen to represent Liberty High School July 4 in the Tulsa Drillers Senior Series!
For more info check out the Tulsa Drillers website.",https://facebook.com/story.php?story_fbid=2640203009601688&id=1746624372292894,,0.0,"Big shout out to Troy Applegarth for being chosen to represent Liberty High School July 4 in the Tulsa Drillers Senior Series!
For more info check out the Tulsa Drillers website.",2020-06-29 17:52:14,,
42,0.0,,5.0,,2635928020029187,"Good Afternoon Liberty Folks,

Tomorrow, Thursday June 25th, is our last food distribution of the summer. We will have our usual Child Nutrition feeding as well as the fresh produce distributed by our friends at Bixby Freewill Baptist. Our summer athletes will be joining in to help unload since we were overwhelmed with the amount of food coming straight from the farm. Everybody is invited to participate so please come out to say thanks to all of those who have made such great efforts to make sure Liberty got fed. The times are 9am to 10am but please note that due to construction you may need to enter and exit from the high school side.

==================================
Phillip Garland
Liberty Public Schools
Mounds, OK 74047
phone: 918-366-8496
email: phillip.garland@libertyps.org",https://facebook.com/story.php?story_fbid=2635928020029187&id=1746624372292894,,0.0,"Good Afternoon Liberty Folks,

Tomorrow, Thursday June 25th, is our last food distribution of the summer. We will have our usual Child Nutrition feeding as well as the fresh produce distributed by our friends at Bixby Freewill Baptist. Our summer athletes will be joining in to help unload since we were overwhelmed with the amount of food coming straight from the farm. Everybody is invited to participate so please come out to say thanks to all of those who have made such great efforts to make sure Liberty got fed. The times are 9am to 10am but please note that due to construction you may need to enter and exit from the high school side.

==================================
Phillip Garland
Liberty Public Schools
Mounds, OK 74047
phone: 918-366-8496
email: phillip.garland@libertyps.org",2020-06-24 12:40:50,,
43,0.0,,8.0,,2635774423377880,"Graduates,

Your diplomas and cumulative folders will be available for distribution starting June 26th. Please contact Jeremy Williams; jeremy.williams@libertyps.org or (918)366-8496 to make an appointment.

Congratulations,
Jeremy Williams",https://facebook.com/story.php?story_fbid=2635774423377880&id=1746624372292894,,0.0,"Graduates,

Your diplomas and cumulative folders will be available for distribution starting June 26th. Please contact Jeremy Williams; jeremy.williams@libertyps.org or (918)366-8496 to make an appointment.

Congratulations,
Jeremy Williams",2020-06-24 08:45:28,,
44,0.0,,6.0,,2632088787079777,Good Evening Liberty High School. We will be broadcasting live in Principal Williams Facebook page. We begin at 7 p.m. Here is the link https://www.facebook.com/profile.php?id=100004118170327,https://facebook.com/story.php?story_fbid=2632088787079777&id=1746624372292894,Jeremy Williams,0.0,"Good Evening Liberty High School. We will be broadcasting live in Principal Williams Facebook page. We begin at 7 p.m. Here is the link https://www.facebook.com/profile.php?id=100004118170327

Jeremy Williams",2020-06-19 19:23:25,,
45,0.0,,13.0,,2631165030505486,"Prom will go on as scheduled. Saturday, June 20th at 7:00 p.m.
Liberty Cafeteria.",https://facebook.com/story.php?story_fbid=2631165030505486&id=1746624372292894,,0.0,"Prom will go on as scheduled. Saturday, June 20th at 7:00 p.m.
Liberty Cafeteria.",2020-06-18 15:10:36,,
46,0.0,,4.0,,2630921783863144,The parking lots and roads on campus are closed at this time. Please park in the church lot until they are open again.,https://facebook.com/story.php?story_fbid=2630921783863144&id=1746624372292894,,0.0,The parking lots and roads on campus are closed at this time. Please park in the church lot until they are open again.,2020-06-18 08:54:50,,
47,1.0,,4.0,,2630131837275472,"Liberty Graduation Procedures

All graduates will arrive at New Beginnings at 6 p.m.

Students will be sitting in a social distance setting.

Families will be staggered alphabetically.

There will be a sign in sheet for all attendees.

Each student will be allowed ten entries.

We will ask families to enter as groups. We will sit families as follows:

A through I from 6 to 6:10
J through R from 6:10 -6:20
S through Z from 6:20-6:30

We encourage the use of masks and ask that social distancing be practiced.

The graduation ceremony will begin at 7.

A spot will be designated for families to photograph their senior as they cross the stage. Details will be given at the Graduation.

Questions you may have

No tickets

We will not provide a photographer and all photographs will be taken outside.

We will video and put the video on youtube.

Seats will be labeled and placed with the number of seats requested by the graduate.
Meaning your family will not be socially distanced.

We will try to space families to allow for social distancing.

Thank You,
Jeremy Williams",https://facebook.com/story.php?story_fbid=2630131837275472&id=1746624372292894,,0.0,"Liberty Graduation Procedures

All graduates will arrive at New Beginnings at 6 p.m.

Students will be sitting in a social distance setting.

Families will be staggered alphabetically.

There will be a sign in sheet for all attendees.

Each student will be allowed ten entries.

We will ask families to enter as groups. We will sit families as follows:

A through I from 6 to 6:10
J through R from 6:10 -6:20
S through Z from 6:20-6:30

We encourage the use of masks and ask that social distancing be practiced.

The graduation ceremony will begin at 7.

A spot will be designated for families to photograph their senior as they cross the stage. Details will be given at the Graduation.

Questions you may have

No tickets

We will not provide a photographer and all photographs will be taken outside.

We will video and put the video on youtube.

Seats will be labeled and placed with the number of seats requested by the graduate.
Meaning your family will not be socially distanced.

We will try to space families to allow for social distancing.

Thank You,
Jeremy Williams",2020-06-17 10:20:27,,
48,0.0,https://scontent-atl3-1.xx.fbcdn.net/v/t1.0-9/fr/cp0/e15/q65/104666844_2630040827284573_7947122883524545973_o.jpg?_nc_cat=102&_nc_sid=110474&_nc_ohc=4zTHv8zbCNcAX8HzAnS&_nc_ht=scontent-atl3-1.xx&tp=14&oh=9c90636691dac19139a0a85b06a59810&oe=5F86B17C,6.0,,2630040860617903,No food distribution this week.,https://facebook.com/story.php?story_fbid=2630040860617903&id=1746624372292894,,0.0,No food distribution this week.,2020-06-17 08:03:33,,
49,0.0,,4.0,,2625294131092576,Produce is available for any in the community today at the High School until the supply runs out.,https://facebook.com/story.php?story_fbid=2625294131092576&id=1746624372292894,,0.0,Produce is available for any in the community today at the High School until the supply runs out.,2020-06-11 11:31:07,,
50,5.0,,12.0,,2625289407759715,,https://facebook.com/story.php?story_fbid=2625289407759715&id=1746624372292894,,0.0,,2020-06-11 11:23:02,,
51,0.0,,8.0,,2624571674498155,"High School Prom at 7 P.M. 06/20/2020
Liberty Cafeteria
RSVP at jeremy.williams@libertyps.org.",https://facebook.com/story.php?story_fbid=2624571674498155&id=1746624372292894,,0.0,"High School Prom at 7 P.M. 06/20/2020
Liberty Cafeteria
RSVP at jeremy.williams@libertyps.org.",2020-06-10 13:48:05,,
52,0.0,https://scontent-atl3-1.xx.fbcdn.net/v/t1.0-9/fr/cp0/e15/q65/101962463_2620344944920828_9000568759770552285_n.jpg?_nc_cat=111&_nc_sid=110474&_nc_ohc=Z1XwspjxlLgAX8nMRUz&_nc_ht=scontent-atl3-1.xx&tp=14&oh=c90e52aa8b05fbf0e5004c1c18fe9dea&oe=5F86D427,8.0,,2620345241587465,Located at Bixby Freewill Baptist Church,https://facebook.com/story.php?story_fbid=2620345241587465&id=1746624372292894,,0.0,Located at Bixby Freewill Baptist Church,2020-06-05 15:49:40,,
53,0.0,,3.0,,2618598388428817,"PreK Enrollment
Elementary Building
Thursday, June 4th
Friday, June 5th
3 pm - 7 pm
*Must be 4 years old on or before September 1, 2020
*Birth certificate and current immunization record required

**Any families that did not pick up supplies at end of year may do so during these days/times.",https://facebook.com/story.php?story_fbid=2618598388428817&id=1746624372292894,,0.0,"PreK Enrollment
Elementary Building
Thursday, June 4th
Friday, June 5th
3 pm - 7 pm
*Must be 4 years old on or before September 1, 2020
*Birth certificate and current immunization record required

**Any families that did not pick up supplies at end of year may do so during these days/times.",2020-06-03 14:42:38,,
54,0.0,,11.0,,2614388852183104,,https://facebook.com/story.php?story_fbid=2614388852183104&id=1746624372292894,,0.0,,2020-05-29 13:39:41,,
55,0.0,https://scontent-atl3-1.xx.fbcdn.net/v/t1.0-9/fr/cp0/e15/q65/100487212_3069677039719354_8484241442619785216_o.jpg?_nc_cat=107&_nc_sid=110474&_nc_ohc=jcd_v2bogc8AX-pOjcE&_nc_ht=scontent-atl3-1.xx&tp=14&oh=2af5b34e9bdfb6e19a21c37c4fff0d0f&oe=5F86CDDC,4.0,,2612220989066557,This is an available resource for our families.,https://facebook.com/story.php?story_fbid=2612220989066557&id=1746624372292894,"Bixby Free Will Baptist Church
May 26 at 4:41 PM 路

Starting this Saturday we will be partnering with GoFresh and Food on the Move to help get dairy products and fresh food and veggies to families. We will have 500 units to give out.

Location: 15801 S Memorial Dr

Please share to get the word out.",0.0,"This is an available resource for our families.

Bixby Free Will Baptist Church
May 26 at 4:41 PM 路

Starting this Saturday we will be partnering with GoFresh and Food on the Move to help get dairy products and fresh food and veggies to families. We will have 500 units to give out.

Location: 15801 S Memorial Dr

Please share to get the word out.",2020-05-26 20:42:53,,
56,11.0,https://scontent-atl3-1.xx.fbcdn.net/v/t1.0-9/fr/cp0/e15/q65/100097971_2608235622798427_1006071139622977536_n.jpg?_nc_cat=106&_nc_sid=110474&_nc_ohc=LbilqIjV0H0AX9kddWX&_nc_ht=scontent-atl3-1.xx&tp=14&oh=827d278f39cf59e8dd5616e7eeb479b7&oe=5F87A2BE,40.0,,2608236309465025,Congratulations to Troy Applegarth for making the OBCA Class A East All-Star baseball team!,https://facebook.com/story.php?story_fbid=2608236309465025&id=1746624372292894,,0.0,Congratulations to Troy Applegarth for making the OBCA Class A East All-Star baseball team!,2020-05-21 21:14:02,,
57,0.0,,8.0,,2606540526301270,"Now taking applications for the following position:
Early Childhood Paraprofessional
Must have a high school diploma and 48 college hours OR be willing to take the paraprofessional exam. Please send resume with references to kim.stewart@libertyps.org.",https://facebook.com/story.php?story_fbid=2606540526301270&id=1746624372292894,,0.0,"Now taking applications for the following position:
Early Childhood Paraprofessional
Must have a high school diploma and 48 college hours OR be willing to take the paraprofessional exam. Please send resume with references to kim.stewart@libertyps.org.",2020-05-19 18:55:22,,
58,1.0,,1.0,,2606539922967997,"PreK Enrollment
Dates:
Thursday, June 4, 2020
Friday, June 5, 2020
Location:
Liberty Elementary School
Time:
3 pm - 7 pm
**Must be 4 years old on or before September 1, 2020
**Bring birth certificate and current immunization record",https://facebook.com/story.php?story_fbid=2606539922967997&id=1746624372292894,,0.0,"PreK Enrollment
Dates:
Thursday, June 4, 2020
Friday, June 5, 2020
Location:
Liberty Elementary School
Time:
3 pm - 7 pm
**Must be 4 years old on or before September 1, 2020
**Bring birth certificate and current immunization record",2020-05-19 18:54:05,,
59,3.0,,13.0,,2602304330058223,"Greetings all,

Unfortunately the group that had been working with the schools to provide weekly food security for families on Mondays has ended but our summer feeding program begins Thursday, May 14th.

We will be distributing a weeks worth of breakfasts and lunches for ALL children 0-18 every Thursday through June. This is not restricted to anyone including students from other districts. We will be able to continue this program as long as we can feed at least 50 children; if our demand falls below that we will have to discontinue the program.

We are extremely grateful to all the volunteers and workers who have gotten us this far. Please consider participating in our summer feeding program and have a good evening.

Sincerely,

Phillip Garland, EdD",https://facebook.com/story.php?story_fbid=2602304330058223&id=1746624372292894,,0.0,"Greetings all,

Unfortunately the group that had been working with the schools to provide weekly food security for families on Mondays has ended but our summer feeding program begins Thursday, May 14th.

We will be distributing a weeks worth of breakfasts and lunches for ALL children 0-18 every Thursday through June. This is not restricted to anyone including students from other districts. We will be able to continue this program as long as we can feed at least 50 children; if our demand falls below that we will have to discontinue the program.

We are extremely grateful to all the volunteers and workers who have gotten us this far. Please consider participating in our summer feeding program and have a good evening.

Sincerely,

Phillip Garland, EdD",2020-05-14 18:35:02,,
60,0.0,,13.0,,2601560050132651,"Good Afternoon Tigers,

I hope your day is ending on a good note. The Liberty Schools Fencing Advisory Committee met last night and had a productive first round of discussions. As a first step in getting our campus looking and working well we need to remove the old fence and I have a proposition to community members but please understand that further action may require Board approval. If anyone is interested or knows of an interested party who would want to remove our current fencing for repurposing or recycling, please email Phillip.garland@libertyps.org with your contact details. Plan B would be to find someone who is interested in repurposing or recycling the materials but cant uninstall the fence themselves please respond to this email.

Obviously if we find someone to remove the fence then we can put more effort and finances toward our total project of beautifying, securing, and enhancing our schools grounds and parking areas. Please ask around to see if this could be a win-win for the taker and the district. Thank you for your attention.

Regards,

Phillip Garland, EdD",https://facebook.com/story.php?story_fbid=2601560050132651&id=1746624372292894,,0.0,"Good Afternoon Tigers,

I hope your day is ending on a good note. The Liberty Schools Fencing Advisory Committee met last night and had a productive first round of discussions. As a first step in getting our campus looking and working well we need to remove the old fence and I have a proposition to community members but please understand that further action may require Board approval. If anyone is interested or knows of an interested party who would want to remove our current fencing for repurposing or recycling, please email Phillip.garland@libertyps.org with your contact details. Plan B would be to find someone who is interested in repurposing or recycling the materials but cant uninstall the fence themselves please respond to this email.

Obviously if we find someone to remove the fence then we can put more effort and finances toward our total project of beautifying, securing, and enhancing our schools grounds and parking areas. Please ask around to see if this could be a win-win for the taker and the district. Thank you for your attention.

Regards,

Phillip Garland, EdD",2020-05-13 19:54:47,,
61,8.0,,11.0,,2600071653614824,"IMPORTANT: YEARBOOK UPDATE
The Yearbook company has just notified that the yearbooks will not be delivered as scheduled. So yearbook distribution for this Tuesday, May 12th and Thursday, May 13th is CANCELLED.

As soon as the district has received the yearbooks, a new distribution date will be set and announced on the website.

Thank you for your patience.",https://facebook.com/story.php?story_fbid=2600071653614824&id=1746624372292894,,0.0,"IMPORTANT: YEARBOOK UPDATE
The Yearbook company has just notified that the yearbooks will not be delivered as scheduled. So yearbook distribution for this Tuesday, May 12th and Thursday, May 13th is CANCELLED.

As soon as the district has received the yearbooks, a new distribution date will be set and announced on the website.

Thank you for your patience.",2020-05-11 22:48:52,,
62,0.0,,1.0,,2599858583636131,"4-6th Grade Parents:
If you need to drop off materials such as library books, Mrs. Clay's Number the Stars book, Mr. McLain's math workbooks, band instruments that you do not wish to keep for the summer, or other materials from the packet that need to be returned, you may bring them to the Middle School Tuesday, May 12th, from 9 AM - 2 PM. There will be a box on the bench in front of the building. If it is raining, please call the Middle School number 918-366-1500 when you arrive, and someone will come out and pick up the items. The completed packets do not need to be turned in unless the teacher has requested this.
You may also pick up locker items if you have not already done so.
If you cannot make this drop off time, please call 918-366-1500 or 918-694-8710 to make alternative arrangements.",https://facebook.com/story.php?story_fbid=2599858583636131&id=1746624372292894,,0.0,"4-6th Grade Parents:
If you need to drop off materials such as library books, Mrs. Clay's Number the Stars book, Mr. McLain's math workbooks, band instruments that you do not wish to keep for the summer, or other materials from the packet that need to be returned, you may bring them to the Middle School Tuesday, May 12th, from 9 AM - 2 PM. There will be a box on the bench in front of the building. If it is raining, please call the Middle School number 918-366-1500 when you arrive, and someone will come out and pick up the items. The completed packets do not need to be turned in unless the teacher has requested this.
You may also pick up locker items if you have not already done so.
If you cannot make this drop off time, please call 918-366-1500 or 918-694-8710 to make alternative arrangements.",2020-05-11 15:39:54,,
63,7.0,https://scontent-atl3-1.xx.fbcdn.net/v/t1.0-9/fr/cp0/e15/q65/96288028_2596739807281342_1097201334802710528_n.jpg?_nc_cat=107&_nc_sid=8024bb&_nc_ohc=InjoMMEfAc0AX_Fe46Z&_nc_ht=scontent-atl3-1.xx&tp=14&oh=af6d33f5d562c1bf660aadb1b2dde28a&oe=5F894D21,31.0,,2596740037281319,Senior Shoutout 5/11/2020,https://facebook.com/story.php?story_fbid=2596740037281319&id=1746624372292894,,0.0,Senior Shoutout 5/11/2020,2020-05-11 08:00:27,,
64,15.0,https://scontent-atl3-1.xx.fbcdn.net/v/t1.0-9/fr/cp0/e15/q65/95244355_2590565044565485_7932758545072652288_n.jpg?_nc_cat=107&_nc_sid=8024bb&_nc_ohc=pizFTfbvTa8AX_S0h2r&_nc_ht=scontent-atl3-1.xx&tp=14&oh=c9770df5ac1899df59873284077126c7&oe=5F88E8B6,43.0,,2590565271232129,Senior Shoutout 05/11/2020,https://facebook.com/story.php?story_fbid=2590565271232129&id=1746624372292894,,0.0,Senior Shoutout 05/11/2020,2020-05-11 08:00:09,,
65,1.0,,11.0,,2599230837032239,"Although there is no breakfast/lunch from the cafeteria on Monday as weekly meals will start Thursday, there will be grocery items available from 8 AM - 2 PM at the cafeteria door tomorrow, Monday, May 11th for any who need it. This will be a drive through curbside pickup.",https://facebook.com/story.php?story_fbid=2599230837032239&id=1746624372292894,,0.0,"Although there is no breakfast/lunch from the cafeteria on Monday as weekly meals will start Thursday, there will be grocery items available from 8 AM - 2 PM at the cafeteria door tomorrow, Monday, May 11th for any who need it. This will be a drive through curbside pickup.",2020-05-10 20:35:13,,
66,13.0,https://scontent-atl3-1.xx.fbcdn.net/v/t1.0-9/fr/cp0/e15/q65/94900222_2590563704565619_8342889610732371968_n.jpg?_nc_cat=105&_nc_sid=8024bb&_nc_ohc=EYjjZpdcTO4AX_Rit-i&_nc_ht=scontent-atl3-1.xx&tp=14&oh=93443ad5199fe8c8f25dbf6c6947334a&oe=5F894423,33.0,,2590564091232247,Senior Shoutout 5/10/2020,https://facebook.com/story.php?story_fbid=2590564091232247&id=1746624372292894,,0.0,Senior Shoutout 5/10/2020,2020-05-10 08:00:48,,
67,15.0,https://scontent-atl3-1.xx.fbcdn.net/v/t1.0-9/fr/cp0/e15/q65/95262060_2590562997899023_3628744892601073664_n.jpg?_nc_cat=107&_nc_sid=8024bb&_nc_ohc=zLSNRseuBPIAX9gkJ7X&_nc_ht=scontent-atl3-1.xx&tp=14&oh=6138dd7ad2a35289e1d5fbaeecf2bc5e&oe=5F873C9B,43.0,,2590563314565658,Senior Shoutout 05/10/2020,https://facebook.com/story.php?story_fbid=2590563314565658&id=1746624372292894,,0.0,Senior Shoutout 05/10/2020,2020-05-10 08:00:04,,
68,12.0,https://scontent-atl3-1.xx.fbcdn.net/v/t1.0-9/fr/cp0/e15/q65/94787176_2590557827899540_1414488083834863616_n.jpg?_nc_cat=103&_nc_sid=8024bb&_nc_ohc=O2g_btZdT4gAX8Z4VkR&_nc_ht=scontent-atl3-1.xx&tp=14&oh=ef50cea642ba6be4603fc70c7881a86e&oe=5F87B6AA,42.0,,2590558107899512,Senior Shoutout 05/09/2020,https://facebook.com/story.php?story_fbid=2590558107899512&id=1746624372292894,,0.0,Senior Shoutout 05/09/2020,2020-05-09 08:00:33,,
69,11.0,https://scontent-atl3-1.xx.fbcdn.net/v/t1.0-9/fr/cp0/e15/q65/94888405_2590559951232661_833227568139206656_n.jpg?_nc_cat=108&_nc_sid=8024bb&_nc_ohc=pZ6aTFMoqlYAX-Nx2mN&_nc_ht=scontent-atl3-1.xx&tp=14&oh=b6178dd83cd4a7a2a0a4fa90b4ffc4aa&oe=5F86A367,37.0,,2590560447899278,Senior Shoutout 05/09/2020,https://facebook.com/story.php?story_fbid=2590560447899278&id=1746624372292894,,0.0,Senior Shoutout 05/09/2020,2020-05-09 08:00:07,,
70,21.0,https://scontent-atl3-1.xx.fbcdn.net/v/t1.0-9/fr/cp0/e15/q65/95189655_2590556414566348_9009670007692460032_n.jpg?_nc_cat=110&_nc_sid=8024bb&_nc_ohc=hw2EQY0rex4AX8_z3MD&_nc_ht=scontent-atl3-1.xx&tp=14&oh=c40fdb7b3073f4f4be20eb1bb69e41f3&oe=5F86D818,43.0,,2590556764566313,Senior Shoutout 05/08/2020,https://facebook.com/story.php?story_fbid=2590556764566313&id=1746624372292894,,0.0,Senior Shoutout 05/08/2020,2020-05-08 08:00:54,,
71,17.0,https://scontent-atl3-1.xx.fbcdn.net/v/t1.0-9/fr/cp0/e15/q65/95139751_2590555724566417_1776314189187383296_n.jpg?_nc_cat=102&_nc_sid=8024bb&_nc_ohc=5QKMzqEeULUAX-QHwEA&_nc_ht=scontent-atl3-1.xx&tp=14&oh=9ad6416045ebaf0a6db371a004d3215a&oe=5F86326D,40.0,,2590555984566391,Senior Shoutout 05/08/2020,https://facebook.com/story.php?story_fbid=2590555984566391&id=1746624372292894,,0.0,Senior Shoutout 05/08/2020,2020-05-08 08:00:07,,
72,6.0,,39.0,https://www.tulsaworld.com/sports/high-school/high-school-girls-basketball-the-super-12-teams-plus-the-top-100-players-in-the/collection_3c9d9027-09a7-584b-81a9-4ab2896f08ee.html,2596762190612437,Congratulations to Lady Tiger Jenikka Boone for being selected for Tulsa Worlds 2019-2020 Basketball All State Honorable Mention.,https://facebook.com/story.php?story_fbid=2596762190612437&id=1746624372292894,"TULSAWORLD.COM
High school girls basketball: The Super 12 teams, plus the top 100 players in the state",5.0,"Congratulations to Lady Tiger Jenikka Boone for being selected for Tulsa Worlds 2019-2020 Basketball All State Honorable Mention.

TULSAWORLD.COM
High school girls basketball: The Super 12 teams, plus the top 100 players in the state",2020-05-07 22:33:05,,
73,0.0,,0.0,,2596432383978751,,https://facebook.com/story.php?story_fbid=2596432383978751&id=1746624372292894,,0.0,,2020-05-07 14:30:47,,
74,1.0,https://scontent-atl3-1.xx.fbcdn.net/v/t1.0-9/96211740_2596258777329445_9158891405077118976_o.png?_nc_cat=107&_nc_sid=8024bb&_nc_ohc=7ivWimH1Dh4AX-CtYui&_nc_ht=scontent-atl3-1.xx&oh=2b093d37baf0c153904d7b8024e46ce4&oe=5F89792B,9.0,,2596258820662774,,https://facebook.com/story.php?story_fbid=2596258820662774&id=1746624372292894,,0.0,,2020-05-07 09:48:01,,
75,17.0,https://scontent-atl3-1.xx.fbcdn.net/v/t1.0-9/fr/cp0/e15/q65/94774554_2590553671233289_60655155946717184_n.jpg?_nc_cat=108&_nc_sid=8024bb&_nc_ohc=rcJNinm1F1gAX9APYZF&_nc_ht=scontent-atl3-1.xx&tp=14&oh=dae38a8c6e35c71a4d4160f8e5a2acd9&oe=5F883123,43.0,,2590553934566596,Senior Shoutout 05/07/2020,https://facebook.com/story.php?story_fbid=2590553934566596&id=1746624372292894,,0.0,Senior Shoutout 05/07/2020,2020-05-07 08:00:59,,
76,16.0,https://scontent-atl3-1.xx.fbcdn.net/v/t1.0-9/fr/cp0/e15/q65/95498381_2590554374566552_1426671158001926144_n.jpg?_nc_cat=103&_nc_sid=8024bb&_nc_ohc=JXesUsTTLz0AX_-2dBY&_nc_ht=scontent-atl3-1.xx&tp=14&oh=fc6209227d2092a924a67f17e2b9953f&oe=5F881A2E,37.0,,2590554634566526,Senior Shoutout 05/07/2020,https://facebook.com/story.php?story_fbid=2590554634566526&id=1746624372292894,,0.0,Senior Shoutout 05/07/2020,2020-05-07 08:00:49,,
77,0.0,https://scontent-atl3-1.xx.fbcdn.net/v/t1.0-9/fr/cp0/e15/q65/96082599_2595477547407568_7009371074995421184_n.jpg?_nc_cat=108&_nc_sid=8024bb&_nc_ohc=FaN7OMGNDiYAX_YaCaA&_nc_ht=scontent-atl3-1.xx&tp=14&oh=82351fce6c2ac0ce58fec558f7f2b812&oe=5F878779,5.0,,2595477597407563,,https://facebook.com/story.php?story_fbid=2595477597407563&id=1746624372292894,,0.0,,2020-05-06 10:41:08,,
78,14.0,https://scontent-atl3-1.xx.fbcdn.net/v/t1.0-9/fr/cp0/e15/q65/95128128_2590552437900079_3014104629815279616_n.jpg?_nc_cat=109&_nc_sid=8024bb&_nc_ohc=o9cvFN7KHeQAX-0myOg&_nc_ht=scontent-atl3-1.xx&tp=14&oh=b6ebe4c1fd41293e3ef7ec67ccfe0684&oe=5F874FEA,42.0,,2590552751233381,Senior Shoutout 05/06/2020,https://facebook.com/story.php?story_fbid=2590552751233381&id=1746624372292894,,0.0,Senior Shoutout 05/06/2020,2020-05-06 08:00:43,,
79,22.0,https://scontent-atl3-1.xx.fbcdn.net/v/t1.0-9/fr/cp0/e15/q65/95489435_2590551791233477_2146211143679475712_n.jpg?_nc_cat=106&_nc_sid=8024bb&_nc_ohc=Jk950QOioN8AX8FAOP-&_nc_ht=scontent-atl3-1.xx&tp=14&oh=3d0ba2ad273561620f3b8755f9ebe975&oe=5F86201C,50.0,,2590552071233449,Senior Shoutout 05/06/2020,https://facebook.com/story.php?story_fbid=2590552071233449&id=1746624372292894,,0.0,Senior Shoutout 05/06/2020,2020-05-06 08:00:08,,
80,0.0,,5.0,,2594951400793516,"2020 Liberty Yearbook Distribution - Pre-ordered and Pre-paid

Last Names beginning with A thru L will be available for pickup at the high school lobby on Tuesday, May 12th from 3:00 p.m. to 6:00 p.m.

Last names beginning with M thru Z will be available for pickup at the high school lobby on Thursday, May 14th from 3:00 p.m. to 6:00 p.m.

In keeping with social distancing, we ask that there be only one person coming into the lobby at a time to pick up their yearbook.

If you are unable to pick up your yearbook during the scheduled time, please contact Jeremy Williams at jeremy.williams@libertyps.org or Diane Mayberry at diane.mayberry@libertyps.org to arrange a time.",https://facebook.com/story.php?story_fbid=2594951400793516&id=1746624372292894,,0.0,"2020 Liberty Yearbook Distribution - Pre-ordered and Pre-paid

Last Names beginning with A thru L will be available for pickup at the high school lobby on Tuesday, May 12th from 3:00 p.m. to 6:00 p.m.

Last names beginning with M thru Z will be available for pickup at the high school lobby on Thursday, May 14th from 3:00 p.m. to 6:00 p.m.

In keeping with social distancing, we ask that there be only one person coming into the lobby at a time to pick up their yearbook.

If you are unable to pick up your yearbook during the scheduled time, please contact Jeremy Williams at jeremy.williams@libertyps.org or Diane Mayberry at diane.mayberry@libertyps.org to arrange a time.",2020-05-05 18:53:56,,
81,0.0,https://scontent-atl3-1.xx.fbcdn.net/v/t1.0-9/fr/cp0/e15/q65/95736232_2594702297485093_95708776346157056_n.jpg?_nc_cat=104&_nc_sid=8024bb&_nc_ohc=Rh7O-4kq-p4AX_1qOi2&_nc_ht=scontent-atl3-1.xx&tp=14&oh=dac4a0f7856ae6a79885608d483bd46b&oe=5F897837,21.0,,2594702344151755,,https://facebook.com/story.php?story_fbid=2594702344151755&id=1746624372292894,,0.0,,2020-05-05 12:15:12,,
82,19.0,https://scontent-atl3-1.xx.fbcdn.net/v/t1.0-9/fr/cp0/e15/q65/95753929_2590549817900341_7551774755276193792_n.jpg?_nc_cat=106&_nc_sid=8024bb&_nc_ohc=oGi4kfw7IOgAX8ERVwR&_nc_ht=scontent-atl3-1.xx&tp=14&oh=af5a84ab1b1d9baae596f10d73f61af0&oe=5F89907F,55.0,,2590550067900316,Senior Shoutout 05/05/2020,https://facebook.com/story.php?story_fbid=2590550067900316&id=1746624372292894,,0.0,Senior Shoutout 05/05/2020,2020-05-05 08:00:53,,
83,16.0,https://scontent-atl3-1.xx.fbcdn.net/v/t1.0-9/fr/cp0/e15/q65/95000801_2590550571233599_3915941968340844544_n.jpg?_nc_cat=108&_nc_sid=8024bb&_nc_ohc=X3OFZ8Tlp58AX8MwF77&_nc_ht=scontent-atl3-1.xx&tp=14&oh=f5cfa147dd29266ebee35529cb53783f&oe=5F875E2C,33.0,,2590550937900229,Senior Shoutout 05/05/2020,https://facebook.com/story.php?story_fbid=2590550937900229&id=1746624372292894,,0.0,Senior Shoutout 05/05/2020,2020-05-05 08:00:42,,
84,14.0,https://scontent-atl3-1.xx.fbcdn.net/v/t1.0-9/fr/cp0/e15/q65/95592922_2590548614567128_3141107396873551872_n.jpg?_nc_cat=108&_nc_sid=8024bb&_nc_ohc=29Jo96YIulUAX9m07Z-&_nc_ht=scontent-atl3-1.xx&tp=14&oh=86ab455ef8f28c5d5742832310bd1686&oe=5F87900C,49.0,,2590548807900442,Senior Shoutout 05/04/2020,https://facebook.com/story.php?story_fbid=2590548807900442&id=1746624372292894,,0.0,Senior Shoutout 05/04/2020,2020-05-04 08:00:29,,
85,15.0,https://scontent-atl3-1.xx.fbcdn.net/v/t1.0-9/fr/cp0/e15/q65/95121848_2590547821233874_5023210796679692288_n.jpg?_nc_cat=105&_nc_sid=8024bb&_nc_ohc=RchcmKP9GPkAX-JiMnw&_nc_ht=scontent-atl3-1.xx&tp=14&oh=c0b4e01d8bfd947cd18c1cb6576c40cd&oe=5F870A9F,37.0,,2590548167900506,Senior Shoutout 05/04/2020,https://facebook.com/story.php?story_fbid=2590548167900506&id=1746624372292894,,0.0,Senior Shoutout 05/04/2020,2020-05-04 08:00:17,,
86,15.0,https://scontent-atl3-1.xx.fbcdn.net/v/t1.0-9/fr/cp0/e15/q65/94750903_2590541024567887_9100278682173308928_n.jpg?_nc_cat=106&_nc_sid=8024bb&_nc_ohc=8XLwqavYng8AX8LS15Y&_nc_ht=scontent-atl3-1.xx&tp=14&oh=dc0d098eab8af898b62db65d4d614410&oe=5F8909BE,53.0,,2590541204567869,Senior Shoutout 05/03/2020,https://facebook.com/story.php?story_fbid=2590541204567869&id=1746624372292894,,0.0,Senior Shoutout 05/03/2020,2020-05-03 08:00:36,,
87,9.0,https://scontent-atl3-1.xx.fbcdn.net/v/t1.0-9/fr/cp0/e15/q65/95218681_2590541504567839_672565863936688128_n.jpg?_nc_cat=103&_nc_sid=8024bb&_nc_ohc=TZPnlUZQpNoAX-TiiJo&_nc_ht=scontent-atl3-1.xx&tp=14&oh=2d71ca90e8cf056c9f3877ddb1063e35&oe=5F8878DA,39.0,,2590541781234478,Senior Shoutout 05/03/2020,https://facebook.com/story.php?story_fbid=2590541781234478&id=1746624372292894,,0.0,Senior Shoutout 05/03/2020,2020-05-03 08:00:19,,
88,16.0,https://scontent-atl3-1.xx.fbcdn.net/v/t1.0-9/fr/cp0/e15/q65/95193726_2590539281234728_400553056661405696_n.jpg?_nc_cat=109&_nc_sid=8024bb&_nc_ohc=4DQlhcMjkD4AX8erQ5n&_nc_ht=scontent-atl3-1.xx&tp=14&oh=6893b2a520834161f11d5a9ac0de0902&oe=5F86938F,50.0,,2590539651234691,Senior Shoutout 05/02/2020,https://facebook.com/story.php?story_fbid=2590539651234691&id=1746624372292894,,0.0,Senior Shoutout 05/02/2020,2020-05-02 08:00:46,,
89,14.0,https://scontent-atl3-1.xx.fbcdn.net/v/t1.0-9/fr/cp0/e15/q65/95099782_2590538711234785_1151529415511900160_n.jpg?_nc_cat=109&_nc_sid=8024bb&_nc_ohc=i-x6qeGI7YYAX_mBbQ_&_nc_ht=scontent-atl3-1.xx&tp=14&oh=956375b81ec5b7e646ad3bf43af147e0&oe=5F863269,45.0,,2590538954568094,Senior Shoutout 05/02/2020,https://facebook.com/story.php?story_fbid=2590538954568094&id=1746624372292894,,0.0,Senior Shoutout 05/02/2020,2020-05-02 08:00:10,,
90,0.0,https://scontent-atl3-1.xx.fbcdn.net/v/t1.0-9/fr/cp0/e15/q65/95410384_2591432284478761_4093133910743973888_n.jpg?_nc_cat=106&_nc_sid=8024bb&_nc_ohc=VYCJ8mfKbLwAX-qgDrv&_nc_ht=scontent-atl3-1.xx&tp=14&oh=5e8e731c9d5e7b72be8a2a39c7c9b6e5&oe=5F86C948,2.0,,2591432344478755,,https://facebook.com/story.php?story_fbid=2591432344478755&id=1746624372292894,,0.0,,2020-05-01 09:41:16,,
91,16.0,https://scontent-atl3-1.xx.fbcdn.net/v/t1.0-9/fr/cp0/e15/q65/95329929_2590536137901709_2423712365108264960_n.jpg?_nc_cat=103&_nc_sid=8024bb&_nc_ohc=J9GaA-Z88-EAX-j_yJv&_nc_ht=scontent-atl3-1.xx&tp=14&oh=f662952337dc0e05fac47bc57a00b11d&oe=5F866B73,42.0,,2590536994568290,Senior Shoutout 05/01/2020,https://facebook.com/story.php?story_fbid=2590536994568290&id=1746624372292894,,0.0,Senior Shoutout 05/01/2020,2020-05-01 08:00:35,,
92,25.0,https://scontent-atl3-1.xx.fbcdn.net/v/t1.0-9/fr/cp0/e15/q65/95382884_2590537157901607_7362934758487097344_n.jpg?_nc_cat=101&_nc_sid=8024bb&_nc_ohc=6lXXi_gtliAAX_8ta9x&_nc_ht=scontent-atl3-1.xx&tp=14&oh=f43227afda36ea990167821243d263bf&oe=5F8942F8,61.0,,2590537911234865,Senior Shoutout 05/01/2020,https://facebook.com/story.php?story_fbid=2590537911234865&id=1746624372292894,,0.0,Senior Shoutout 05/01/2020,2020-05-01 08:00:24,,
93,22.0,https://scontent-atl3-1.xx.fbcdn.net/v/t1.0-9/fr/cp0/e15/q65/95198200_2589939474628042_8075255007219286016_n.jpg?_nc_cat=108&_nc_sid=8024bb&_nc_ohc=_Uq-M_UueJkAX_9SCGu&_nc_ht=scontent-atl3-1.xx&tp=14&oh=7fb90272f9837babf9fcc2c5b1095a38&oe=5F87DAC8,59.0,,2589939841294672,Senior Shoutout 04/30/2020,https://facebook.com/story.php?story_fbid=2589939841294672&id=1746624372292894,,0.0,Senior Shoutout 04/30/2020,2020-04-30 08:00:57,,
94,14.0,https://scontent-atl3-1.xx.fbcdn.net/v/t1.0-9/fr/cp0/e15/q65/95493460_2589940024627987_266309498728087552_n.jpg?_nc_cat=110&_nc_sid=8024bb&_nc_ohc=_VXz6t6Is1kAX87hiNE&_nc_ht=scontent-atl3-1.xx&tp=14&oh=450979d0ba6bbf6c53afffb56879480c&oe=5F87A8E6,47.0,,2589940337961289,Senior Shoutout 04/30/2020,https://facebook.com/story.php?story_fbid=2589940337961289&id=1746624372292894,,0.0,Senior Shoutout 04/30/2020,2020-04-30 08:00:55,,
95,3.0,https://scontent-atl3-1.xx.fbcdn.net/v/t1.0-9/fr/cp0/e15/q65/95327635_2589936297961693_8390531904830439424_n.jpg?_nc_cat=110&_nc_sid=8024bb&_nc_ohc=ExyqdpJxj20AX9s-Hoy&_nc_ht=scontent-atl3-1.xx&tp=14&oh=4dddfd5f4f5f72c08601c75db66cf20d&oe=5F881F0F,18.0,,2589936351295021,,https://facebook.com/story.php?story_fbid=2589936351295021&id=1746624372292894,,0.0,,2020-04-29 15:29:22,,
96,14.0,https://scontent-atl3-1.xx.fbcdn.net/v/t1.0-9/fr/cp0/e15/q65/95322946_2589896731298983_4934721679969484800_n.jpg?_nc_cat=106&_nc_sid=8024bb&_nc_ohc=nx2Pxy1yQ2UAX_1kKm9&_nc_ht=scontent-atl3-1.xx&tp=14&oh=6acbb0b1760c4d730563c0aeb8a0ce31&oe=5F88B2AE,42.0,,2589896821298974,Senior Shoutout 04/29/2020,https://facebook.com/story.php?story_fbid=2589896821298974&id=1746624372292894,,0.0,Senior Shoutout 04/29/2020,2020-04-29 14:24:26,,
97,16.0,https://scontent-atl3-1.xx.fbcdn.net/v/t1.0-9/fr/cp0/e15/q65/94746865_2589896414632348_3665345508680925184_n.jpg?_nc_cat=103&_nc_sid=8024bb&_nc_ohc=Wby3aQHM8y0AX9wlN1W&_nc_ht=scontent-atl3-1.xx&tp=14&oh=3eeae8a21bc188c5ebbf8784b1665e98&oe=5F8652C9,64.0,,2589896601298996,Senior Shoutout 04/29/2020,https://facebook.com/story.php?story_fbid=2589896601298996&id=1746624372292894,,0.0,Senior Shoutout 04/29/2020,2020-04-29 14:24:05,,
98,0.0,,5.0,,2589286781359978,"PreK Enrollment dates TBD
Dates will be posted on Liberty FB and website

Requirements for PreK:
Must be 4 on or before September 1, 2020
Copy of birth certificate
Copy of immunization record
Immunizations requirements must be met before school begins
* requirements can be found on the Oklahoma State Department of Health website",https://facebook.com/story.php?story_fbid=2589286781359978&id=1746624372292894,,0.0,"PreK Enrollment dates TBD
Dates will be posted on Liberty FB and website

Requirements for PreK:
Must be 4 on or before September 1, 2020
Copy of birth certificate
Copy of immunization record
Immunizations requirements must be met before school begins
* requirements can be found on the Oklahoma State Department of Health website",2020-04-28 19:47:34,,
99,0.0,https://scontent-atl3-1.xx.fbcdn.net/v/t1.0-9/fr/cp0/e15/q65/94622410_2589120891376567_4499155989781544960_n.jpg?_nc_cat=111&_nc_sid=8024bb&_nc_ohc=Z6fmvVSqu6kAX94B3zk&_nc_ht=scontent-atl3-1.xx&tp=14&oh=fb785dc98cf2e3655a0aaa3838a6b202&oe=5F868C51,15.0,,2589120958043227,,https://facebook.com/story.php?story_fbid=2589120958043227&id=1746624372292894,,0.0,,2020-04-28 14:27:58,,
100,0.0,https://scontent-atl3-1.xx.fbcdn.net/v/t1.0-9/fr/cp0/e15/q65/95024161_2589120754709914_7165753827834986496_n.jpg?_nc_cat=104&_nc_sid=8024bb&_nc_ohc=pjsPQDh1eHkAX_3kRe1&_nc_ht=scontent-atl3-1.xx&tp=14&oh=5236864b482f21cb59d042ebbea42782&oe=5F863D20,17.0,,2589120804709909,,https://facebook.com/story.php?story_fbid=2589120804709909&id=1746624372292894,,0.0,,2020-04-28 14:27:45,,
101,5.0,https://scontent-atl3-1.xx.fbcdn.net/v/t1.0-9/fr/cp0/e15/q65/95150526_2589120238043299_2234528929849278464_n.jpg?_nc_cat=106&_nc_sid=8024bb&_nc_ohc=u9u37E4xQ4kAX-95xbb&_nc_ht=scontent-atl3-1.xx&tp=14&oh=215f9447b41b184338f20578c5a32d58&oe=5F88B5AD,21.0,,2589120311376625,This is a tentative date for Prom as we monitor the situation for the safety of all involved.,https://facebook.com/story.php?story_fbid=2589120311376625&id=1746624372292894,,0.0,This is a tentative date for Prom as we monitor the situation for the safety of all involved.,2020-04-28 14:27:09,,
102,1.0,https://scontent-atl3-1.xx.fbcdn.net/v/t1.0-9/fr/cp0/e15/q65/94529038_2589119928043330_3792139969825341440_n.jpg?_nc_cat=104&_nc_sid=8024bb&_nc_ohc=M4007hBoMwAAX9SZQXw&_nc_ht=scontent-atl3-1.xx&tp=14&oh=f956a4e679a8c319703012c7c8c7db8b&oe=5F8849DF,27.0,,2589119998043323,These are tentative dates as we monitor the situation for the safety of all involved.,https://facebook.com/story.php?story_fbid=2589119998043323&id=1746624372292894,,0.0,These are tentative dates as we monitor the situation for the safety of all involved.,2020-04-28 14:26:44,,
103,0.0,https://scontent-atl3-1.xx.fbcdn.net/v/t1.0-9/fr/cp0/e15/q65/94689024_2586238234998166_6334459136712900608_n.jpg?_nc_cat=104&_nc_sid=8024bb&_nc_ohc=HG6bZgjLdzIAX9JKBxZ&_nc_oc=AQkW_nMzFd84ziVWdPDqRCY3vqfrhJF4bL8reO2R9pExYIjHI_Cv0CvzjZFydYdEU54&_nc_ht=scontent-atl3-1.xx&tp=14&oh=65f52450412ca61dc88a221b44ccccaa&oe=5F87E56B,1.0,,2586238438331479,4-6th Grades Personal Items Pick Up & Library Book Drop Off. Contact each building for pick up plans. CDC guidelines will always be in place to keep our Tigers safe.,https://facebook.com/story.php?story_fbid=2586238438331479&id=1746624372292894,,0.0,4-6th Grades Personal Items Pick Up & Library Book Drop Off. Contact each building for pick up plans. CDC guidelines will always be in place to keep our Tigers safe.,2020-04-24 21:31:40,,
104,0.0,,1.0,https://www.youtube.com/channel/UCEGSW42Dc-C9Qay_2yoXX1A,2586027168352606,"Foundations of Manufacturing Tech students! Tune in this evening! The Liberty Chapter will be recognized! Just follow the link!
Please share this information with your students so they can join in on the SkillsUSA Oklahoma Virtual Celebration and Awards Event tomorrow, Friday, April 24th at 7 p.m.!
Dozens of award winners will be recognized, district officers recognized and we will also be announcing who will be serving on the 2020-21 state officer team.
The state officer team will be leading this live event that will be broadcast on the Facebook
https://www.facebook.com/SkillsUSAOklahoma/live/
and the
SkillsUSA OK YouTube Channel https://www.youtube.com/channel/UCEGSW42Dc-C9Qay_2yoXX1A
THREE VERY SPECIAL GUEST SCHEDULED TO JOIN US LIVE!
Oklahoma Governor Kevin Stitt
SkillsUSA National Executive Director Chelle Travis
NTHS Executive Director Peyton Holland
Hope you join the State Officer Team and the Governor of the Great State of Oklahoma as we celebrate this record breaking year for SkillsUSA and most importantly celebrate our students.",https://facebook.com/story.php?story_fbid=2586027168352606&id=1746624372292894,SkillsUSA Oklahoma and SkillsUSA Oklahoma Alumni and Friends,0.0,"Foundations of Manufacturing Tech students! Tune in this evening! The Liberty Chapter will be recognized! Just follow the link!
Please share this information with your students so they can join in on the SkillsUSA Oklahoma Virtual Celebration and Awards Event tomorrow, Friday, April 24th at 7 p.m.!
Dozens of award winners will be recognized, district officers recognized and we will also be announcing who will be serving on the 2020-21 state officer team.
The state officer team will be leading this live event that will be broadcast on the Facebook
https://www.facebook.com/SkillsUSAOklahoma/live/
and the
SkillsUSA OK YouTube Channel https://www.youtube.com/channel/UCEGSW42Dc-C9Qay_2yoXX1A
THREE VERY SPECIAL GUEST SCHEDULED TO JOIN US LIVE!
Oklahoma Governor Kevin Stitt
SkillsUSA National Executive Director Chelle Travis
NTHS Executive Director Peyton Holland
Hope you join the State Officer Team and the Governor of the Great State of Oklahoma as we celebrate this record breaking year for SkillsUSA and most importantly celebrate our students.

SkillsUSA Oklahoma and SkillsUSA Oklahoma Alumni and Friends",2020-04-24 14:44:26,,
105,0.0,,0.0,,2585434901745166,"With the possibility of rain tomorrow, the volunteers who are acquiring food donations are in search of a box truck to pick up food donations tomorrow morning at 10 AM. If anyone has anything that might be borrowed, please contact Todd Henshaw at 918-521-5182 or Todd.henshaw@libertyps.org. Thanks in advance to any who might be able to help.",https://facebook.com/story.php?story_fbid=2585434901745166&id=1746624372292894,,0.0,"With the possibility of rain tomorrow, the volunteers who are acquiring food donations are in search of a box truck to pick up food donations tomorrow morning at 10 AM. If anyone has anything that might be borrowed, please contact Todd Henshaw at 918-521-5182 or Todd.henshaw@libertyps.org. Thanks in advance to any who might be able to help.",2020-04-23 21:51:30,,
106,0.0,,8.0,https://bixbyoutreach.org/,2585331551755501,Bixby Outreach Center is an available resource for our Liberty students and families.,https://facebook.com/story.php?story_fbid=2585331551755501&id=1746624372292894,"BIXBYOUTREACH.ORG
Bixby Outreach Center",3.0,"Bixby Outreach Center is an available resource for our Liberty students and families.

BIXBYOUTREACH.ORG
Bixby Outreach Center",2020-04-23 18:47:54,,
107,0.0,https://scontent-atl3-1.xx.fbcdn.net/v/t1.0-9/94033067_2585325615089428_9067784480030195712_o.png?_nc_cat=104&_nc_sid=8024bb&_nc_ohc=JKRzuppJzjYAX-a6Xi2&_nc_ht=scontent-atl3-1.xx&oh=34370c9171be8289fab236cfa275396e&oe=5F899802,4.0,https://www.ok.gov/health2/documents/IMM_Parents_School_Vaccines_Requirements_OK_English.pdf,2585326555089334,"Parents of current 6th grade students:

This is the address to the Oklahoma Vaccines Requirements.

https://www.ok.gov/health2/documents/IMM_Parents_School_Vaccines_Requirements_OK_English.pdf",https://facebook.com/story.php?story_fbid=2585326555089334&id=1746624372292894,,0.0,"Parents of current 6th grade students:

This is the address to the Oklahoma Vaccines Requirements.

https://www.ok.gov/health2/documents/IMM_Parents_School_Vaccines_Requirements_OK_English.pdf",2020-04-23 18:39:08,,
108,0.0,,10.0,,2585321275089862,"Food distribution
Friday, April 24
9-10 AM when picking up breakfast/lunch for any who need items.
CDC guidelines will be followed.

Thank you to all who have been volunteering, donating, working, and participating in the various food programs. You are making a huge difference.",https://facebook.com/story.php?story_fbid=2585321275089862&id=1746624372292894,,0.0,"Food distribution
Friday, April 24
9-10 AM when picking up breakfast/lunch for any who need items.
CDC guidelines will be followed.

Thank you to all who have been volunteering, donating, working, and participating in the various food programs. You are making a huge difference.",2020-04-23 18:28:16,,
109,5.0,,3.0,,2584627385159251,"7-12th grade students:
Mrs. Mayberry will be at the HS tomorrow, April 23, from 9-11 for materials pickup.",https://facebook.com/story.php?story_fbid=2584627385159251&id=1746624372292894,,0.0,"7-12th grade students:
Mrs. Mayberry will be at the HS tomorrow, April 23, from 9-11 for materials pickup.",2020-04-22 22:28:52,,
110,0.0,,10.0,,2579650168990306,,https://facebook.com/story.php?story_fbid=2579650168990306&id=1746624372292894,,0.0,,2020-04-16 21:35:19,,
111,0.0,,5.0,,2579502039005119,,https://facebook.com/story.php?story_fbid=2579502039005119&id=1746624372292894,,0.0,,2020-04-16 17:33:30,,
112,0.0,,2.0,,2577149775907012,,https://facebook.com/story.php?story_fbid=2577149775907012&id=1746624372292894,,0.0,,2020-04-13 21:58:09,,
113,8.0,,38.0,,2574529082835748,"We would like to thank the following for helping provide resources to our community:

Tulsa Dream Center, Victory Church, Terry Henshaw and the Disaster Relief 180, Bixby Outreach, our Faith Communities in Liberty, Bixby, and Leonard, and our cafeteria staff.",https://facebook.com/story.php?story_fbid=2574529082835748&id=1746624372292894,,0.0,"We would like to thank the following for helping provide resources to our community:

Tulsa Dream Center, Victory Church, Terry Henshaw and the Disaster Relief 180, Bixby Outreach, our Faith Communities in Liberty, Bixby, and Leonard, and our cafeteria staff.",2020-04-10 18:02:40,,
114,1.0,,17.0,,2573767799578543,,https://facebook.com/story.php?story_fbid=2573767799578543&id=1746624372292894,,0.0,,2020-04-09 18:56:15,,
115,0.0,,5.0,,2573533436268646,"7-12th grades:
If you do not have internet/device, there is a materials pickup Friday, April 10th from 9-10 AM at the high school. You can stop by while you are picking up your breakfast/lunch.",https://facebook.com/story.php?story_fbid=2573533436268646&id=1746624372292894,,0.0,"7-12th grades:
If you do not have internet/device, there is a materials pickup Friday, April 10th from 9-10 AM at the high school. You can stop by while you are picking up your breakfast/lunch.",2020-04-09 11:44:53,,
116,6.0,,13.0,,2572261933062463,"Good evening, Tiger Nation. The Staff and Administration are here to support you during this time of distance learning. This is a new experience for all of us, and as such, we want to focus on each other's well-being as a priority while we are learning. Please extend grace to all as we navigate these new experiences and learn together. Below you will find some information regarding contacting the school while the buildings are closed.

Main offices:

Elementary (PK-3rd grades) 918-366-8311
Middle School (4-6th grades) 918-366-1500
Jr High/High School (7-12th grades) 918-366-8784
Superintendent's office 918-366-8496

To reach Principals/Staff directly, dial 918-366-8496. When the recording begins, dial the correct extension:
Mr. Williams ext 133
Mrs. Stewart ext 112
Mrs. Evans ext 109
Mrs. Howard ext 160",https://facebook.com/story.php?story_fbid=2572261933062463&id=1746624372292894,,0.0,"Good evening, Tiger Nation. The Staff and Administration are here to support you during this time of distance learning. This is a new experience for all of us, and as such, we want to focus on each other's well-being as a priority while we are learning. Please extend grace to all as we navigate these new experiences and learn together. Below you will find some information regarding contacting the school while the buildings are closed.

Main offices:

Elementary (PK-3rd grades) 918-366-8311
Middle School (4-6th grades) 918-366-1500
Jr High/High School (7-12th grades) 918-366-8784
Superintendent's office 918-366-8496

To reach Principals/Staff directly, dial 918-366-8496. When the recording begins, dial the correct extension:
Mr. Williams ext 133
Mrs. Stewart ext 112
Mrs. Evans ext 109
Mrs. Howard ext 160",2020-04-07 20:36:46,,
117,0.0,,23.0,,2569003983388258,"New Guidelines for Breakfast/Lunch Pickup.

We have been approved to waive the need to have each child in the vehicle present when distributing meals. The cafeteria workers may need to see a form of ID for children who do not attend Liberty such as a government issued Social Security card or birth certificate. Please ask them if you're unsure and they can help you figure out what's needed.",https://facebook.com/story.php?story_fbid=2569003983388258&id=1746624372292894,,0.0,"New Guidelines for Breakfast/Lunch Pickup.

We have been approved to waive the need to have each child in the vehicle present when distributing meals. The cafeteria workers may need to see a form of ID for children who do not attend Liberty such as a government issued Social Security card or birth certificate. Please ask them if you're unsure and they can help you figure out what's needed.",2020-04-03 17:41:09,,
118,0.0,,11.0,http://www.prodigy.com/,2568996130055710,,https://facebook.com/story.php?story_fbid=2568996130055710&id=1746624372292894,,4.0,,2020-04-03 17:26:50,,
119,0.0,,21.0,,2568229540132369,,https://facebook.com/story.php?story_fbid=2568229540132369&id=1746624372292894,,0.0,,2020-04-02 19:05:53,,
120,1.0,,3.0,,2568186920136631,Like and follow Liberty Tigers PTA on FB for other important updates.,https://facebook.com/story.php?story_fbid=2568186920136631&id=1746624372292894,"Liberty Tigers Pta
March 25 at 6:39 PM 路

Fundraiser info: PTA Fundraiser items will be delivered in about 2 weeks. We will post here and reach out to those who participated on pickup/delivery options.
Thanks!",0.0,"Like and follow Liberty Tigers PTA on FB for other important updates.

Liberty Tigers Pta
March 25 at 6:39 PM 路

Fundraiser info: PTA Fundraiser items will be delivered in about 2 weeks. We will post here and reach out to those who participated on pickup/delivery options.
Thanks!",2020-04-02 18:02:41,,
121,0.0,,0.0,,,"Fundraiser info: PTA Fundraiser items will be delivered in about 2 weeks. We will post here and reach out to those who participated on pickup/delivery options.
Thanks!",https://facebook.com/story.php?story_fbid=1411474832393172&id=117792605094741,,0.0,"Fundraiser info: PTA Fundraiser items will be delivered in about 2 weeks. We will post here and reach out to those who participated on pickup/delivery options.
Thanks!",2020-09-16 09:00:45.744877,,
122,1.0,,9.0,,2567965360158787,"MS students who need the physical materials for distance learning - no internet/device:
Pickup Schedule
Monday 04/06
4th grade 6-6:45 PM
5th grade 6:45-7:30 PM
6th grade 7:30-8:15 PM
CDC guidelines will be in place. This is curbside pickup only in front of the MS.
Distance learning materials will be provided to all other MS students via digital communication.",https://facebook.com/story.php?story_fbid=2567965360158787&id=1746624372292894,,0.0,"MS students who need the physical materials for distance learning - no internet/device:
Pickup Schedule
Monday 04/06
4th grade 6-6:45 PM
5th grade 6:45-7:30 PM
6th grade 7:30-8:15 PM
CDC guidelines will be in place. This is curbside pickup only in front of the MS.
Distance learning materials will be provided to all other MS students via digital communication.",2020-04-02 12:16:05,,
123,3.0,https://scontent-atl3-1.xx.fbcdn.net/v/t1.0-9/fr/cp0/e15/q65/91879207_2566472066974783_7858752405976907776_n.jpg?_nc_cat=108&_nc_sid=110474&_nc_ohc=vZmnBrwuB0oAX9z9kwx&_nc_ht=scontent-atl3-1.xx&tp=14&oh=c255337c6963bcbdc9751e3855e9526f&oe=5F883C68,48.0,,2566472776974712,We わ & miss our Liberty Family!,https://facebook.com/story.php?story_fbid=2566472776974712&id=1746624372292894,,0.0,We わ & miss our Liberty Family!,2020-03-31 16:06:07,,
124,1.0,,14.0,,2562714604017196,,https://facebook.com/story.php?story_fbid=2562714604017196&id=1746624372292894,,0.0,,2020-03-27 08:51:07,,
125,0.0,,5.0,,2562353454053311,,https://facebook.com/story.php?story_fbid=2562353454053311&id=1746624372292894,,0.0,,2020-03-26 21:42:00,,
126,1.0,,6.0,,2561989874089669,"TCC concurrent students: please check your MyTCC account email. Your professors are going to be sending your plan of action to those. It is very important to keep on top of that because you can still fail. If you have any questions, let me know!
I am still waiting to hear back from OSUIT; however, I imagine it will be the same. Keep checking your Orange mail and look at your accounts to keep up!

Mrs. Broadhead",https://facebook.com/story.php?story_fbid=2561989874089669&id=1746624372292894,,0.0,"TCC concurrent students: please check your MyTCC account email. Your professors are going to be sending your plan of action to those. It is very important to keep on top of that because you can still fail. If you have any questions, let me know!
I am still waiting to hear back from OSUIT; however, I imagine it will be the same. Keep checking your Orange mail and look at your accounts to keep up!

Mrs. Broadhead",2020-03-26 12:38:03,,
127,0.0,,8.0,,2561988610756462,,https://facebook.com/story.php?story_fbid=2561988610756462&id=1746624372292894,,0.0,,2020-03-26 12:36:03,,
128,0.0,,3.0,https://youtu.be/59BWcQhZrBI,2561337410821582,"Glenpool and Liberty Foundations of Manufacturing students and parents (& former students if you just miss my voice-lol)- I have a YouTube channel, Mrs.Hahn, that I will be sharing info AND some lessons later!
If you are a Parent of a student, please share the following link and have the students share it out with other students from class. (I will try to send it out on student emails later)
Mrs. Hahn
https://youtu.be/59BWcQhZrBI",https://facebook.com/story.php?story_fbid=2561337410821582&id=1746624372292894,"YOUTUBE.COM
Miss you!",4.0,"Glenpool and Liberty Foundations of Manufacturing students and parents (& former students if you just miss my voice-lol)- I have a YouTube channel, Mrs.Hahn, that I will be sharing info AND some lessons later!
If you are a Parent of a student, please share the following link and have the students share it out with other students from class. (I will try to send it out on student emails later)
Mrs. Hahn
https://youtu.be/59BWcQhZrBI

YOUTUBE.COM
Miss you!",2020-03-25 18:17:31,,
129,0.0,https://scontent-atl3-1.xx.fbcdn.net/v/t1.0-9/fr/cp0/e15/q65/91319660_2559747830980540_4649724190125981696_n.jpg?_nc_cat=105&_nc_sid=110474&_nc_ohc=VzQzjQD-VsQAX8D27rR&_nc_ht=scontent-atl3-1.xx&tp=14&oh=d123897b3c0caf3a843b8335e17141ab&oe=5F882650,4.0,,2559748274313829,This is the guidance from the State Dept regarding 3rd and 8th grade reading tests for those who were concerned.,https://facebook.com/story.php?story_fbid=2559748274313829&id=1746624372292894,,0.0,This is the guidance from the State Dept regarding 3rd and 8th grade reading tests for those who were concerned.,2020-03-23 21:34:42,,
130,0.0,,35.0,,2559668990988424,,https://facebook.com/story.php?story_fbid=2559668990988424&id=1746624372292894,,0.0,,2020-03-23 18:56:14,,
131,5.0,,25.0,,2557780217843968,,https://facebook.com/story.php?story_fbid=2557780217843968&id=1746624372292894,,0.0,,2020-03-21 14:06:51,,
132,5.0,,8.0,,2553846914903965,,https://facebook.com/story.php?story_fbid=2553846914903965&id=1746624372292894,,0.0,,2020-03-16 18:16:16,,
133,0.0,,6.0,https://youtu.be/kejLpm7XnI4,2553085101646813,https://youtu.be/kejLpm7XnI4,https://facebook.com/story.php?story_fbid=2553085101646813&id=1746624372292894,"YOUTUBE.COM
FFA Labor Auction Final",0.0,"https://youtu.be/kejLpm7XnI4

YOUTUBE.COM
FFA Labor Auction Final",2020-03-15 18:56:24,,
134,0.0,,0.0,,2551512491804074,Tomorrows Varsity Baseball games have been canceled .,https://facebook.com/story.php?story_fbid=2551512491804074&id=1746624372292894,,0.0,Tomorrows Varsity Baseball games have been canceled .,2020-03-13 16:48:07,,
135,0.0,,14.0,,2551417918480198,,https://facebook.com/story.php?story_fbid=2551417918480198&id=1746624372292894,,0.0,,2020-03-13 13:55:06,,
136,0.0,,7.0,,2550936855194971,Weleetkas Administration has decided to postpone the remainder of the JH Baseball tournament. Hopefully we can make the game up later in the season.,https://facebook.com/story.php?story_fbid=2550936855194971&id=1746624372292894,,0.0,Weleetkas Administration has decided to postpone the remainder of the JH Baseball tournament. Hopefully we can make the game up later in the season.,2020-03-12 22:43:24,,
137,2.0,https://scontent-atl3-1.xx.fbcdn.net/v/t1.0-9/fr/cp0/e15/q65/89270255_2550772181878105_1233145046950215680_o.jpg?_nc_cat=102&_nc_sid=e007fa&_nc_ohc=lw2jNTfslK0AX9gUXBQ&_nc_ht=scontent-atl3-1.xx&tp=14&oh=74ffc63aa6ce28d111d2e8ecbf7dcb72&oe=5F884BBE,7.0,,,,,"Liberty Public Schools added 12 new photos.
March 12 at 4:13 PM 路",0.0,"Liberty Public Schools added 12 new photos.
March 12 at 4:13 PM 路",2020-03-12 17:13:27,,
138,0.0,,8.0,,2547593455529311,,https://facebook.com/story.php?story_fbid=2547593455529311&id=1746624372292894,,0.0,,2020-03-08 15:00:23,,
139,0.0,https://scontent-atl3-1.xx.fbcdn.net/v/t1.0-9/fr/cp0/e15/q65/88434829_2545989859023004_1262831293964484608_o.jpg?_nc_cat=111&_nc_sid=8024bb&_nc_ohc=tH2HwwSdRKYAX-ywjjv&_nc_ht=scontent-atl3-1.xx&tp=14&oh=4ffebcefa591ba7d23f75282d89d0a59&oe=5F885B4C,19.0,,2545989915689665,Our Elementary and Story time Tigers celebrated reading and Dr. Seuss.,https://facebook.com/story.php?story_fbid=2545989915689665&id=1746624372292894,,0.0,Our Elementary and Story time Tigers celebrated reading and Dr. Seuss.,2020-03-06 12:17:46,,
140,1.0,https://scontent-atl3-1.xx.fbcdn.net/v/t1.0-9/fr/cp0/e15/q65/88210803_2545989759023014_2894968176964009984_o.jpg?_nc_cat=103&_nc_sid=8024bb&_nc_ohc=DLcgPblVKMAAX_bcnDT&_nc_ht=scontent-atl3-1.xx&tp=14&oh=17082789e641442739bac160dff148c7&oe=5F863FF0,5.0,,2545989792356344,Our Elementary and Story time Tigers celebrated reading and Dr. Seuss.,https://facebook.com/story.php?story_fbid=2545989792356344&id=1746624372292894,,0.0,Our Elementary and Story time Tigers celebrated reading and Dr. Seuss.,2020-03-06 12:17:38,,
141,0.0,https://scontent-atl3-1.xx.fbcdn.net/v/t1.0-9/fr/cp0/e15/q65/88185965_2545989622356361_3259736953389580288_o.jpg?_nc_cat=100&_nc_sid=8024bb&_nc_ohc=Ahs38b7kK60AX84Id77&_nc_ht=scontent-atl3-1.xx&tp=14&oh=5b882a6b8b35c38c75ea841aec829d71&oe=5F85B44F,13.0,,2545989659023024,Our Elementary and Story time Tigers celebrated reading and Dr. Seuss.,https://facebook.com/story.php?story_fbid=2545989659023024&id=1746624372292894,,0.0,Our Elementary and Story time Tigers celebrated reading and Dr. Seuss.,2020-03-06 12:17:28,,
142,0.0,https://scontent-atl3-1.xx.fbcdn.net/v/t1.0-9/fr/cp0/e15/q65/89329124_2545989412356382_5703836866826993664_o.jpg?_nc_cat=109&_nc_sid=8024bb&_nc_ohc=Yh1vn01bZhsAX8co7GM&_nc_ht=scontent-atl3-1.xx&tp=14&oh=93cb9f89b576970eb81aebff15cd81e5&oe=5F868F48,10.0,,2545989479023042,Our Elementary and Story time Tigers celebrated reading and Dr. Seuss.,https://facebook.com/story.php?story_fbid=2545989479023042&id=1746624372292894,,0.0,Our Elementary and Story time Tigers celebrated reading and Dr. Seuss.,2020-03-06 12:17:12,,
143,0.0,https://scontent-atl3-1.xx.fbcdn.net/v/t1.0-9/fr/cp0/e15/q65/88180757_2545989145689742_4314486041164644352_o.jpg?_nc_cat=109&_nc_sid=8024bb&_nc_ohc=LLzKWhauh54AX8IkwQ1&_nc_ht=scontent-atl3-1.xx&tp=14&oh=de908b1db788a3a81d9e1752d9c62d88&oe=5F868FB1,8.0,,2545989202356403,Our Elementary and Story time Tigers celebrated reading and Dr. Seuss.,https://facebook.com/story.php?story_fbid=2545989202356403&id=1746624372292894,,0.0,Our Elementary and Story time Tigers celebrated reading and Dr. Seuss.,2020-03-06 12:16:45,,
144,1.0,https://scontent-atl3-1.xx.fbcdn.net/v/t1.0-9/fr/cp0/e15/q65/89307163_2545988959023094_8104599082779017216_o.jpg?_nc_cat=106&_nc_sid=8024bb&_nc_ohc=J4iHwJV5lkgAX_SjXIU&_nc_ht=scontent-atl3-1.xx&tp=14&oh=4180e58002b5442d4dc61062269a18e6&oe=5F88BA55,18.0,,2545989005689756,Our Elementary and Story time Tigers celebrated reading and Dr. Seuss.,https://facebook.com/story.php?story_fbid=2545989005689756&id=1746624372292894,,0.0,Our Elementary and Story time Tigers celebrated reading and Dr. Seuss.,2020-03-06 12:16:34,,
145,0.0,https://scontent-atl3-1.xx.fbcdn.net/v/t1.0-9/fr/cp0/e15/q65/88228584_2545177242437599_2854715129285574656_n.jpg?_nc_cat=104&_nc_sid=110474&_nc_ohc=EIi8I3C3aj8AX_fxXGv&_nc_ht=scontent-atl3-1.xx&tp=14&oh=749bab276cca7e0eabf1f7731aef74c5&oe=5F86B1D0,12.0,,2545177489104241,Art project on The Outsiders completed by our 6th grade Tigers.,https://facebook.com/story.php?story_fbid=2545177489104241&id=1746624372292894,,0.0,Art project on The Outsiders completed by our 6th grade Tigers.,2020-03-05 11:18:47,,
146,0.0,https://scontent-atl3-1.xx.fbcdn.net/v/t1.0-9/fr/cp0/e15/q65/88320301_2545176345771022_4677969033230811136_n.jpg?_nc_cat=100&_nc_sid=110474&_nc_ohc=9cllTQyKhqEAX85y277&_nc_ht=scontent-atl3-1.xx&tp=14&oh=57475cbbfd24f2cd01e57686cf199c58&oe=5F8655DF,19.0,,2545176615770995,The Tiger 6th grade Outsiders!,https://facebook.com/story.php?story_fbid=2545176615770995&id=1746624372292894,,0.0,The Tiger 6th grade Outsiders!,2020-03-05 11:17:11,,
147,2.0,,8.0,http://track.spe.schoolmessenger.com/f/a/uxYzfdzZaQIrm64WDscu2g~~/AAAAAQA~/RgRgQACIP0Q-aHR0cHM6Ly93d3cudHVsc2EtaGVhbHRoLm9yZy9jb3JvbmF2aXJ1cy1kaXNlYXNlLTIwMTktY292aWQtMTlXB3NjaG9vbG1CCgAACM1eXpYg1g5SF21hdHRoZXdyc3dlZXRAeWFob28uY29tWAQAAAAB,2544557139166276,,https://facebook.com/story.php?story_fbid=2544557139166276&id=1746624372292894,,4.0,,2020-03-04 15:27:28,,
148,0.0,,3.0,,2543670642588259,"Baseball parents of grades 9-12:
Baseball Parent meeting
March 3, 2020
5:30 PM
High School Library
At least 1 parent for any 9-12th grade player must attend",https://facebook.com/story.php?story_fbid=2543670642588259&id=1746624372292894,,0.0,"Baseball parents of grades 9-12:
Baseball Parent meeting
March 3, 2020
5:30 PM
High School Library
At least 1 parent for any 9-12th grade player must attend",2020-03-03 11:58:00,,
149,7.0,https://scontent-atl3-1.xx.fbcdn.net/v/t1.0-9/fr/cp0/e15/q65/88064421_2541528446135812_8770068105964552192_n.jpg?_nc_cat=105&_nc_sid=110474&_nc_ohc=iTuNHVkGfF8AX9ouYe8&_nc_ht=scontent-atl3-1.xx&tp=14&oh=9daedddf5acdfff9577f072ee97ea0c2&oe=5F88776A,68.0,,2541528736135783,Our Tigers advance to the Area Tournament!,https://facebook.com/story.php?story_fbid=2541528736135783&id=1746624372292894,,0.0,Our Tigers advance to the Area Tournament!,2020-02-29 17:44:33,,
150,0.0,,0.0,,2539057493049574,"Baseball parents of grades 9-12:
Baseball Parent meeting
March 3, 2020
5:30 PM
High School Library
At least 1 parent for any 9-12th grade player must attend",https://facebook.com/story.php?story_fbid=2539057493049574&id=1746624372292894,,0.0,"Baseball parents of grades 9-12:
Baseball Parent meeting
March 3, 2020
5:30 PM
High School Library
At least 1 parent for any 9-12th grade player must attend",2020-02-26 17:03:08,,
151,0.0,,6.0,,2538877436400913,"Boys Basketball Regionals:
Thursday 2/26 @Haskell @8:00",https://facebook.com/story.php?story_fbid=2538877436400913&id=1746624372292894,,0.0,"Boys Basketball Regionals:
Thursday 2/26 @Haskell @8:00",2020-02-26 11:31:09,,
152,0.0,,11.0,,2538876873067636,"Dr Seuss Family Night for Elementary Students (Grades 1-3)
Tuesday, March 3rd
6:30-8:00
Bring your kiddos and come join the fun! Hands on math, science, and art activities...
Snacks and Door Prizes",https://facebook.com/story.php?story_fbid=2538876873067636&id=1746624372292894,,0.0,"Dr Seuss Family Night for Elementary Students (Grades 1-3)
Tuesday, March 3rd
6:30-8:00
Bring your kiddos and come join the fun! Hands on math, science, and art activities...
Snacks and Door Prizes",2020-02-26 11:30:26,,
153,0.0,,0.0,https://youtu.be/6kf_7TkwnFU,2538307686457888,https://youtu.be/6kf_7TkwnFU,https://facebook.com/story.php?story_fbid=2538307686457888&id=1746624372292894,"YOUTUBE.COM
HC Camo",0.0,"https://youtu.be/6kf_7TkwnFU

YOUTUBE.COM
HC Camo",2020-02-25 16:54:26,,
154,0.0,https://scontent-atl3-1.xx.fbcdn.net/v/t1.0-9/fr/cp0/e15/q65/87365773_2538056699816320_671124322588295168_n.jpg?_nc_cat=102&_nc_sid=8024bb&_nc_ohc=KK0HyFSALp0AX8BV-uC&_nc_ht=scontent-atl3-1.xx&tp=14&oh=61f3c2e65afcc8d37f72904d0f6ae36a&oe=5F871CF0,29.0,,2538057356482921,Mr. Emersons sixth grade band class celebrated Fat Tuesday on the 25th with a parade and playing When the Saints Go Marching In. What a fun morning!,https://facebook.com/story.php?story_fbid=2538057356482921&id=1746624372292894,,0.0,Mr. Emersons sixth grade band class celebrated Fat Tuesday on the 25th with a parade and playing When the Saints Go Marching In. What a fun morning!,2020-02-25 10:04:31,,
155,0.0,,27.0,https://youtu.be/iD3XK4R5HFo,2538014179820572,https://youtu.be/iD3XK4R5HFo,https://facebook.com/story.php?story_fbid=2538014179820572&id=1746624372292894,"YOUTUBE.COM
2A District Champs 2 22 20",2.0,"https://youtu.be/iD3XK4R5HFo

YOUTUBE.COM
2A District Champs 2 22 20",2020-02-25 09:27:05,,
156,0.0,,5.0,,2534303146858342,"Baseball parents of grades 9-12:
Baseball Parent meeting
March 3, 2020
5:30 PM
High School Library
At least 1 parent for any 9-12th grade player must attend",https://facebook.com/story.php?story_fbid=2534303146858342&id=1746624372292894,,0.0,"Baseball parents of grades 9-12:
Baseball Parent meeting
March 3, 2020
5:30 PM
High School Library
At least 1 parent for any 9-12th grade player must attend",2020-02-20 14:48:59,,
157,0.0,,14.0,,2533348393620484,"Attention Tiger Parents & Guardians:

The snow makeup days will be Monday, February 24th and Monday, March 9th.",https://facebook.com/story.php?story_fbid=2533348393620484&id=1746624372292894,,0.0,"Attention Tiger Parents & Guardians:

The snow makeup days will be Monday, February 24th and Monday, March 9th.",2020-02-19 10:57:44,,
158,0.0,,7.0,https://youtu.be/cYDUNbTIRbs,2531244557164201,https://youtu.be/cYDUNbTIRbs,https://facebook.com/story.php?story_fbid=2531244557164201&id=1746624372292894,"YOUTUBE.COM
LTN JH BB Final Home 2020",3.0,"https://youtu.be/cYDUNbTIRbs

YOUTUBE.COM
LTN JH BB Final Home 2020",2020-02-16 18:26:07,,
159,0.0,,14.0,https://youtu.be/Ez6AIn2ja2A,2527654294189894,https://youtu.be/Ez6AIn2ja2A,https://facebook.com/story.php?story_fbid=2527654294189894&id=1746624372292894,"YOUTUBE.COM
FCCLA2020 9633",2.0,"https://youtu.be/Ez6AIn2ja2A

YOUTUBE.COM
FCCLA2020 9633",2020-02-12 08:41:46,,
160,0.0,,9.0,,2524013784553945,"SAVE THE DATE:
Dr Seuss Family Night for Elementary Students (Grades 1-3)
Tuesday, March 3rd
6:30-8:00
Bring your kiddos and come join the fun! Hands on math, science, and art activities...
Snacks and Door Prizes",https://facebook.com/story.php?story_fbid=2524013784553945&id=1746624372292894,,0.0,"SAVE THE DATE:
Dr Seuss Family Night for Elementary Students (Grades 1-3)
Tuesday, March 3rd
6:30-8:00
Bring your kiddos and come join the fun! Hands on math, science, and art activities...
Snacks and Door Prizes",2020-02-07 19:25:33,,
161,0.0,,4.0,,2522481921373798,,https://facebook.com/story.php?story_fbid=2522481921373798&id=1746624372292894,,0.0,,2020-02-05 22:10:34,,
162,1.0,,20.0,,2522479721374018,,https://facebook.com/story.php?story_fbid=2522479721374018&id=1746624372292894,,0.0,,2020-02-05 22:05:28,,
163,0.0,,7.0,https://youtu.be/_Ff43IDXJoY,2522239378064719,,https://facebook.com/story.php?story_fbid=2522239378064719&id=1746624372292894,"YOUTUBE.COM
LT BB Homecoming 2020",0.0,"YOUTUBE.COM
LT BB Homecoming 2020",2020-02-05 13:35:35,,
164,8.0,,26.0,,2521699288118728,,https://facebook.com/story.php?story_fbid=2521699288118728&id=1746624372292894,,0.0,,2020-02-04 20:57:16,,
165,0.0,,11.0,https://youtu.be/WmuwLFYrYQw,2521515514803772,,https://facebook.com/story.php?story_fbid=2521515514803772&id=1746624372292894,"YOUTUBE.COM
Liberty Elem Student of the Month Jan 2020",3.0,"YOUTUBE.COM
Liberty Elem Student of the Month Jan 2020",2020-02-04 14:40:38,,
166,2.0,https://scontent-atl3-1.xx.fbcdn.net/v/t1.0-9/fr/cp0/e15/q65/83784116_2517804638508193_9124739775054479360_o.jpg?_nc_cat=104&_nc_sid=8024bb&_nc_ohc=4irKxvuDqGQAX-_ZLlR&_nc_ht=scontent-atl3-1.xx&tp=14&oh=3f3befc31350d5e6d4f9e3ae95198f4c&oe=5F8844BE,17.0,,2517806335174690,"Ms. Howard's 4th grade homeroom visited Rose Hill in Perkins, OK. Mrs. Adam's 4th grade homeroom will visit in February.

Students reenact school during a normal school day in 1910, incorporating social studies, language arts, and math.",https://facebook.com/story.php?story_fbid=2517806335174690&id=1746624372292894,,0.0,"Ms. Howard's 4th grade homeroom visited Rose Hill in Perkins, OK. Mrs. Adam's 4th grade homeroom will visit in February.

Students reenact school during a normal school day in 1910, incorporating social studies, language arts, and math.",2020-01-30 16:04:40,,
167,0.0,https://scontent-atl3-1.xx.fbcdn.net/v/t1.0-9/fr/cp0/e15/q65/83502010_2517804098508247_4646695130080739328_o.jpg?_nc_cat=104&_nc_sid=8024bb&_nc_ohc=869GbMDckV4AX9BeEpt&_nc_ht=scontent-atl3-1.xx&tp=14&oh=3c560f9e0e773798f48af6136dd0f8e6&oe=5F87988C,27.0,,2517804288508228,Our Tigers celebrated Homecoming Week with a hat day!,https://facebook.com/story.php?story_fbid=2517804288508228&id=1746624372292894,,0.0,Our Tigers celebrated Homecoming Week with a hat day!,2020-01-30 16:00:53,,
168,0.0,,2.0,https://ybpay.lifetouch.com/Order,2516402721981718,"2020 LIBERTY YEARBOOKS are available until Feb. 3rd. If you would like to pay cash, they are $50 each. Please bring an envelope with you name or your child's name and grade, your phone number and the exact amount of money to the high school front office. You can also order online at https://ybpay.lifetouch.com/Order and use Yearbook ID: 13976620.
February 3rd is the last date to order your yearbook.",https://facebook.com/story.php?story_fbid=2516402721981718&id=1746624372292894,"YBPAY.LIFETOUCH.COM
Object moved",0.0,"2020 LIBERTY YEARBOOKS are available until Feb. 3rd. If you would like to pay cash, they are $50 each. Please bring an envelope with you name or your child's name and grade, your phone number and the exact amount of money to the high school front office. You can also order online at https://ybpay.lifetouch.com/Order and use Yearbook ID: 13976620.
February 3rd is the last date to order your yearbook.

YBPAY.LIFETOUCH.COM
Object moved",2020-01-28 20:29:07,,
169,0.0,,35.0,https://youtu.be/0oPdugOywrs,2516210252000965,https://youtu.be/0oPdugOywrs,https://facebook.com/story.php?story_fbid=2516210252000965&id=1746624372292894,"YOUTUBE.COM
LIBERTY FISHING TEAM SP 2020",7.0,"https://youtu.be/0oPdugOywrs

YOUTUBE.COM
LIBERTY FISHING TEAM SP 2020",2020-01-28 13:53:59,,
170,1.0,https://scontent-atl3-1.xx.fbcdn.net/v/t1.0-9/84119123_2516141562007834_1618659073761214464_o.png?_nc_cat=103&_nc_sid=8024bb&_nc_ohc=FfJ5FHWsj3MAX8uuoov&_nc_ht=scontent-atl3-1.xx&oh=28a7c8106ebb97b279bc645b7694ddf6&oe=5F87D2C2,6.0,,2516141622007828,,https://facebook.com/story.php?story_fbid=2516141622007828&id=1746624372292894,,0.0,,2020-01-28 11:56:40,,
171,0.0,https://scontent-atl3-1.xx.fbcdn.net/v/t1.0-9/83328712_2513020775653246_7575127858264145920_o.png?_nc_cat=104&_nc_sid=8024bb&_nc_ohc=9ezEbXvHCgEAX9u_4Gf&_nc_ht=scontent-atl3-1.xx&oh=1d05ab8713fa9b1192d0dcaf41918818&oe=5F866AF0,5.0,,2513020838986573,,https://facebook.com/story.php?story_fbid=2513020838986573&id=1746624372292894,,0.0,,2020-01-24 12:11:52,,
172,0.0,,1.0,https://ybpay.lifetouch.com/Order,2512999758988681,"IMPORTANT!
This next week will be your final opportunity to order the Liberty 20/20 Yearbook. All orders must be submitted by February 1, 2020, that date is coming up very quickly!

To order online go to https://ybpay.lifetouch.com/Order and use Yearbook ID: 13976620

If you have any questions, please email Mrs. Rodgers at linda.rodgers@libertyps.org",https://facebook.com/story.php?story_fbid=2512999758988681&id=1746624372292894,"YBPAY.LIFETOUCH.COM
Object moved",0.0,"IMPORTANT!
This next week will be your final opportunity to order the Liberty 20/20 Yearbook. All orders must be submitted by February 1, 2020, that date is coming up very quickly!

To order online go to https://ybpay.lifetouch.com/Order and use Yearbook ID: 13976620

If you have any questions, please email Mrs. Rodgers at linda.rodgers@libertyps.org

YBPAY.LIFETOUCH.COM
Object moved",2020-01-24 11:42:28,,
173,0.0,https://scontent-atl3-1.xx.fbcdn.net/v/t1.0-9/84062226_2512070539081603_3977848020627619840_o.png?_nc_cat=107&_nc_sid=8024bb&_nc_ohc=0Wimi_xYJ9kAX99kDK6&_nc_ht=scontent-atl3-1.xx&oh=f3a2f27b9d0f801d6a08c1ef0959e4d6&oe=5F86778C,5.0,,2512070679081589,,https://facebook.com/story.php?story_fbid=2512070679081589&id=1746624372292894,,0.0,,2020-01-23 09:56:01,,
174,1.0,,13.0,,2512038909084766,"Homecoming is 1/31 vs Depew
Ceremonies begin at 6 PM
For this game only, the boys will play at 6:30 and the girls will play at 8.
Go Tigers!",https://facebook.com/story.php?story_fbid=2512038909084766&id=1746624372292894,,0.0,"Homecoming is 1/31 vs Depew
Ceremonies begin at 6 PM
For this game only, the boys will play at 6:30 and the girls will play at 8.
Go Tigers!",2020-01-23 09:06:36,,
175,0.0,,3.0,https://ybpay.lifetouch.com/,2505538296401494,"Parents and guardians of 20/20 Seniors don't forget to submit 4 to 5 baby pictures for the 20/20 Liberty Yearbook, the DEADLINE for SENIOR BABY PICTURES is JANUARY 22. Also, the DEADLINE for SENIOR ADs is FEBRUARY 1. If you would like to purchase a SENIOR AD, they are $35 for a quarter page. You will want to submit 1 or 2 pictures of your seniors (preferably one being a senior picture) and your personal message. All payments for Senior ads are to be made to Mrs. Rodgers (linda.rodgers@libertyps.org) at the high school. You will also want to drop off your pictures and text copy to Mrs. Rodgers by email or in person.

Finally, if you have not ordered your 2020 Liberty Schools Yearbook, don't wait. Yearbooks will only be available online until February 1st, so order soon! You can order your yearbook at https://ybpay.lifetouch.com and the Yearbook ID: 13976620.

If you have questions, please contact Mrs. Rodgers by email at linda.rodgers@libertyps.org",https://facebook.com/story.php?story_fbid=2505538296401494&id=1746624372292894,"YBPAY.LIFETOUCH.COM
Object moved",0.0,"Parents and guardians of 20/20 Seniors don't forget to submit 4 to 5 baby pictures for the 20/20 Liberty Yearbook, the DEADLINE for SENIOR BABY PICTURES is JANUARY 22. Also, the DEADLINE for SENIOR ADs is FEBRUARY 1. If you would like to purchase a SENIOR AD, they are $35 for a quarter page. You will want to submit 1 or 2 pictures of your seniors (preferably one being a senior picture) and your personal message. All payments for Senior ads are to be made to Mrs. Rodgers (linda.rodgers@libertyps.org) at the high school. You will also want to drop off your pictures and text copy to Mrs. Rodgers by email or in person.

Finally, if you have not ordered your 2020 Liberty Schools Yearbook, don't wait. Yearbooks will only be available online until February 1st, so order soon! You can order your yearbook at https://ybpay.lifetouch.com and the Yearbook ID: 13976620.

If you have questions, please contact Mrs. Rodgers by email at linda.rodgers@libertyps.org

YBPAY.LIFETOUCH.COM
Object moved",2020-01-15 13:55:37,,
176,0.0,https://scontent-atl3-1.xx.fbcdn.net/v/t1.0-9/fr/cp0/e15/q65/82173418_2504459259842731_3943376411246460928_o.jpg?_nc_cat=100&_nc_sid=8024bb&_nc_ohc=8kkHYdMDiAkAX-8IENZ&_nc_ht=scontent-atl3-1.xx&tp=14&oh=1bda48083178b276b6ada438675bc3b8&oe=5F865123,16.0,http://Teacherease.com/,2504459346509389,"You are now able to add money to your students account through Teacherease.com or through the Teacherease APP. It is the same system to follow students grades. Click on the lunch tab, then fees, and follow the steps. If you have multiple students it will autofill the same amount, so do not rush through. There is a 3.5% fee for using the service which covers Liberty School Districts costs.",https://facebook.com/story.php?story_fbid=2504459346509389&id=1746624372292894,,0.0,"You are now able to add money to your students account through Teacherease.com or through the Teacherease APP. It is the same system to follow students grades. Click on the lunch tab, then fees, and follow the steps. If you have multiple students it will autofill the same amount, so do not rush through. There is a 3.5% fee for using the service which covers Liberty School Districts costs.",2020-01-14 13:19:19,,
177,0.0,,9.0,,2503753506579973,,https://facebook.com/story.php?story_fbid=2503753506579973&id=1746624372292894,,0.0,,2020-01-13 20:20:01,,
178,0.0,,7.0,,2500611436894180,"Senior Parents: There will be a Senior Parent Meeting Wednesday in the HS library at 6:30. It will be question and answer, as well as important dates for upcoming events. Thank you",https://facebook.com/story.php?story_fbid=2500611436894180&id=1746624372292894,,0.0,"Senior Parents: There will be a Senior Parent Meeting Wednesday in the HS library at 6:30. It will be question and answer, as well as important dates for upcoming events. Thank you",2020-01-10 21:55:19,,
179,0.0,https://scontent-atl3-1.xx.fbcdn.net/v/t1.0-9/fr/cp0/e15/q65/82640962_2500395776915746_1013409567989563392_n.jpg?_nc_cat=100&_nc_sid=110474&_nc_ohc=zt0MdOBA-lQAX8rDUhW&_nc_oc=AQmPhTy8Q0vJzQsr9BtqEQfKzUhJcum0JWYrgc0B0XlaEgfOnoUzSZj5VwY2c-_SeGo&_nc_ht=scontent-atl3-1.xx&tp=14&oh=69e631366a75870a21c33e3bf69aac82&oe=5F88A8F5,21.0,,2500396090249048,6th grade Tigers working on a STEM challenge today!,https://facebook.com/story.php?story_fbid=2500396090249048&id=1746624372292894,,0.0,6th grade Tigers working on a STEM challenge today!,2020-01-10 16:22:47,,
180,2.0,https://scontent-atl3-1.xx.fbcdn.net/v/t1.0-9/81576271_2497333290555328_6366495873299382272_o.png?_nc_cat=107&_nc_sid=8024bb&_nc_ohc=UdDor_sVfcwAX86DCwn&_nc_ht=scontent-atl3-1.xx&oh=e4d71d756242a522dd9b99c123049f65&oe=5F88F710,5.0,,2497333340555323,,https://facebook.com/story.php?story_fbid=2497333340555323&id=1746624372292894,,0.0,,2020-01-07 14:59:45,,
181,2.0,,9.0,,2497331127222211,"January 7, 2020

Important Notice to all Students Riding Bus #2 AM Route

