,comments,image,likes,link,post_id,post_text,post_url,shared_text,shares,text,time,video,video_thumbnail
0,0.0,,5.0,,1616149035215591,"**𝐀𝐓𝐓𝐄𝐍𝐓𝐈𝐎𝐍**

Per the Governor's Executive Order executed on July 22, 2020, the LeRoy-Ostrander Public School district will be mandating all k-12 students, staff, and visitors to wear masks as they enter and remain in the school building beginning 𝐉𝐮𝐥𝐲 𝟐𝟓, 𝟐𝟎𝟐𝟎. Students under the age of 5 do not have to wear masks.

Thank you for your understanding and compliance. Please call the school district administrative team if you have any questions.",https://facebook.com/story.php?story_fbid=1616149035215591&id=101089700054873,,0.0,"**𝐀𝐓𝐓𝐄𝐍𝐓𝐈𝐎𝐍**

Per the Governor's Executive Order executed on July 22, 2020, the LeRoy-Ostrander Public School district will be mandating all k-12 students, staff, and visitors to wear masks as they enter and remain in the school building beginning 𝐉𝐮𝐥𝐲 𝟐𝟓, 𝟐𝟎𝟐𝟎. Students under the age of 5 do not have to wear masks.

Thank you for your understanding and compliance. Please call the school district administrative team if you have any questions.",2020-07-22 16:00:22,,
1,0.0,,22.0,,1664997866997374,,https://facebook.com/story.php?story_fbid=1664997866997374&id=101089700054873,,0.0,,2020-09-11 16:31:22,,
2,0.0,,2.0,,1663733063790521,"The school board will hold a regular meeting on Tuesday, September 15th, 2020 at 6:30pm.

Due to the current federal and state emergency declarations, the Minnesota directive to residents to stay at home, and guidance about limiting person-to-person contact due to the COVID-19 (coronavirus) pandemic, this meeting of the Leroy-Ostrander District #499 School Board is being conducted in accordance with Minnesota Statutes 13D.021— Meetings by Telephone or Other Electronic Means.

Due to the health pandemic, the school board determined that it is not feasible for at least one board member, the superintendent, or the school district’s legal counsel to be physically present at the regular meeting location and that it is not feasible for the public to attend this meeting at the regular meeting location due to the health pandemic.

Persons may monitor this meeting from a remote location by live stream via the district’s Facebook page.",https://facebook.com/story.php?story_fbid=1663733063790521&id=101089700054873,,0.0,"The school board will hold a regular meeting on Tuesday, September 15th, 2020 at 6:30pm.

Due to the current federal and state emergency declarations, the Minnesota directive to residents to stay at home, and guidance about limiting person-to-person contact due to the COVID-19 (coronavirus) pandemic, this meeting of the Leroy-Ostrander District #499 School Board is being conducted in accordance with Minnesota Statutes 13D.021— Meetings by Telephone or Other Electronic Means.

Due to the health pandemic, the school board determined that it is not feasible for at least one board member, the superintendent, or the school district’s legal counsel to be physically present at the regular meeting location and that it is not feasible for the public to attend this meeting at the regular meeting location due to the health pandemic.

Persons may monitor this meeting from a remote location by live stream via the district’s Facebook page.",2020-09-11 13:00:04,,
3,0.0,https://scontent-atl3-1.xx.fbcdn.net/v/t1.0-9/fr/cp0/e15/q65/119148833_1664074033756424_2048097713680822038_o.jpg?_nc_cat=103&_nc_sid=8024bb&_nc_ohc=bwokk821mK4AX9JM4Ni&_nc_ht=scontent-atl3-1.xx&tp=14&oh=f16d23cd47ef864de58dccb367367d8d&oe=5F80E751,11.0,,1664075167089644,"What a week it has been at L-O School! It has been great to have students back in the building and the hustle and bustle of back to school! With that said, we would like to share a few reminders to our students and parents. Again, we would like to thank each and everyone of you for your continued support and patience as we travel through our 2020-2021 school year.",https://facebook.com/story.php?story_fbid=1664075167089644&id=101089700054873,,0.0,"What a week it has been at L-O School! It has been great to have students back in the building and the hustle and bustle of back to school! With that said, we would like to share a few reminders to our students and parents. Again, we would like to thank each and everyone of you for your continued support and patience as we travel through our 2020-2021 school year.",2020-09-10 18:02:52,,
4,0.0,https://scontent-atl3-1.xx.fbcdn.net/v/t1.0-9/fr/cp0/e15/q65/119125611_1662990043864823_208053689864519612_o.jpg?_nc_cat=103&_nc_sid=110474&_nc_ohc=0TVgCFlvKgAAX8Skz-7&_nc_ht=scontent-atl3-1.xx&tp=14&oh=e15cd24a8b3c5aa244afc299c6233437&oe=5F81BE3D,60.0,,1662990137198147,The support of our families and community members is outstanding! What a great way to begin our school year. THANK YOU from the staff at LeRoy-Ostrander!,https://facebook.com/story.php?story_fbid=1662990137198147&id=101089700054873,,0.0,The support of our families and community members is outstanding! What a great way to begin our school year. THANK YOU from the staff at LeRoy-Ostrander!,2020-09-09 13:56:15,,
5,11.0,https://scontent-atl3-1.xx.fbcdn.net/v/t1.0-9/fr/cp0/e15/q65/119102740_1662984510532043_8768378806832013061_n.jpg?_nc_cat=100&_nc_sid=8024bb&_nc_ohc=W4yXM51Zks0AX8bak8_&_nc_ht=scontent-atl3-1.xx&tp=14&oh=72383b75a38c71ecd8fced13e787c0dd&oe=5F829490,60.0,,1662985553865272,A VERY special thank you to the LeRoy & Ostrander Lions Clubs for the staff appreciation gift!,https://facebook.com/story.php?story_fbid=1662985553865272&id=101089700054873,,0.0,A VERY special thank you to the LeRoy & Ostrander Lions Clubs for the staff appreciation gift!,2020-09-09 13:48:41,,
6,0.0,,32.0,,1657255987771562,A Back to School message🍎📝📚 We are so excited for another school year!,,,0.0,A Back to School message🍎📝📚 We are so excited for another school year!,2020-09-03 16:34:08,https://video-atl3-1.xx.fbcdn.net/v/t42.9040-2/118642446_2735597543319049_6843180157135682574_n.mp4?_nc_cat=101&_nc_sid=985c63&efg=eyJ2ZW5jb2RlX3RhZyI6ImxlZ2FjeV9zZCJ9&_nc_ohc=-7WVQVvMBhgAX-cIf-0&_nc_ht=video-atl3-1.xx&oh=4fd7e821da049b5e81ff2a371548916d&oe=5F5D3517,
7,7.0,,52.0,https://bit.ly/2EAwMpN,1650869281743566,"The safety and protection of our students is one of our top priorities during the pandemic. That's why we understand you might be anxious about sending your kids to school this fall.

Join superintendent Jennifer Backer-Johnson and principal Aaron Hungerholt in this video, as they take you on a brief tour through the building to introduce some of the COVID-19 measures we are implementing to keep your kids safe.

ℹ️ Learn more on our COVID-19 information page:https://bit.ly/2EAwMpN",,,0.0,"The safety and protection of our students is one of our top priorities during the pandemic. That's why we understand you might be anxious about sending your kids to school this fall.

Join superintendent Jennifer Backer-Johnson and principal Aaron Hungerholt in this video, as they take you on a brief tour through the building to introduce some of the COVID-19 measures we are implementing to keep your kids safe.

ℹ️ Learn more on our COVID-19 information page:https://bit.ly/2EAwMpN",2020-08-28 16:03:36,https://video-atl3-1.xx.fbcdn.net/v/t42.9040-2/10000000_314314553332851_23884480994743485_n.mp4?_nc_cat=107&_nc_sid=985c63&efg=eyJ2ZW5jb2RlX3RhZyI6ImxlZ2FjeV9zZCJ9&_nc_ohc=fKqGfib2arcAX8uKNmW&_nc_ht=video-atl3-1.xx&oh=a1e4e40c6743f3b05e43d2a6e1b66be4&oe=5F5D2D72,
8,0.0,https://scontent-atl3-1.xx.fbcdn.net/v/t1.0-9/fr/cp0/e15/q65/118227544_1643003352530159_4904218468665678725_n.jpg?_nc_cat=103&_nc_sid=8024bb&_nc_ohc=cwxKtlYqZpoAX9WWsR_&_nc_ht=scontent-atl3-1.xx&tp=14&oh=50b919dbd17ed0dac34a3083e115ebed&oe=5F8356CC,128.0,,1643004169196744,"400 masks were donated today to the school district! The donation came form CUSB Wealth Management Solutions (Kevin Janssen)
THANK YOU for the generous donation!",https://facebook.com/story.php?story_fbid=1643004169196744&id=101089700054873,,0.0,"400 masks were donated today to the school district! The donation came form CUSB Wealth Management Solutions (Kevin Janssen)
THANK YOU for the generous donation!",2020-08-20 09:58:45,,
9,0.0,,8.0,,1642312785932549,"The LeRoy Ministerial Society is sponsoring a school supply giveaway. It will be Wednesday, August 26th from 6pm-7pm at the Community Center in LeRoy. It is open to any family in the district that is finding it hard to provide school supplies for their children.",https://facebook.com/story.php?story_fbid=1642312785932549&id=101089700054873,,0.0,"The LeRoy Ministerial Society is sponsoring a school supply giveaway. It will be Wednesday, August 26th from 6pm-7pm at the Community Center in LeRoy. It is open to any family in the district that is finding it hard to provide school supplies for their children.",2020-08-19 15:23:53,,
10,0.0,,14.0,,1642123469284814,,https://facebook.com/story.php?story_fbid=1642123469284814&id=101089700054873,,0.0,,2020-08-19 11:09:04,,
11,0.0,,9.0,,2270267546452282,"What: Regular School Board Meeting.

When: August 18th, 2020 At 6:30PM

Where: Online Livestreamed Zoom Meeting.",,,0.0,"What: Regular School Board Meeting.

When: August 18th, 2020 At 6:30PM

Where: Online Livestreamed Zoom Meeting.",2020-08-18 19:30:38,https://video-atl3-1.xx.fbcdn.net/v/t42.26565-2/10000000_183841306487655_2697531423337140841_n.mp4?_nc_cat=108&_nc_sid=985c63&efg=eyJ2ZW5jb2RlX3RhZyI6Im9lcF9zZCJ9&_nc_ohc=sBdjdSh5xOUAX-sf344&_nc_ht=video-atl3-1.xx&oh=6ce9e539b4fe51a6c54eb37924b67455&oe=5F5D305B,
12,0.0,,0.0,,1637352783095216,"The school board will hold a regular meeting on Tuesday, August 18th, 2020 at 6:30pm.

Due to the current federal and state emergency declarations, the Minnesota directive to residents to stay at home, and guidance about limiting person-to-person contact due to the COVID-19 (coronavirus) pandemic, this meeting of the Leroy-Ostrander District #499 School Board is being conducted in accordance with Minnesota Statutes 13D.021— Meetings by Telephone or Other Electronic Means.

Due to the health pandemic, the school board determined that it is not feasible for at least one board member, the superintendent, or the school district’s legal counsel to be physically present at the regular meeting location and that it is not feasible for the public to attend this meeting at the regular meeting location due to the health pandemic.

Persons may monitor this meeting from a remote location by live stream via the district’s Facebook page.",https://facebook.com/story.php?story_fbid=1637352783095216&id=101089700054873,,0.0,"The school board will hold a regular meeting on Tuesday, August 18th, 2020 at 6:30pm.

Due to the current federal and state emergency declarations, the Minnesota directive to residents to stay at home, and guidance about limiting person-to-person contact due to the COVID-19 (coronavirus) pandemic, this meeting of the Leroy-Ostrander District #499 School Board is being conducted in accordance with Minnesota Statutes 13D.021— Meetings by Telephone or Other Electronic Means.

Due to the health pandemic, the school board determined that it is not feasible for at least one board member, the superintendent, or the school district’s legal counsel to be physically present at the regular meeting location and that it is not feasible for the public to attend this meeting at the regular meeting location due to the health pandemic.

Persons may monitor this meeting from a remote location by live stream via the district’s Facebook page.",2020-08-14 12:34:08,,
13,0.0,,9.0,,1633663086797519,"The concussion testing scheduled for August 12th at 10:30 a.m. has been cancelled, due to the athletic seasons switching. We will communicate more information out to you as it becomes available with a reschedule date.",https://facebook.com/story.php?story_fbid=1633663086797519&id=101089700054873,,0.0,"The concussion testing scheduled for August 12th at 10:30 a.m. has been cancelled, due to the athletic seasons switching. We will communicate more information out to you as it becomes available with a reschedule date.",2020-08-10 13:33:17,,
14,0.0,,0.0,https://forms.gle/7xRYjP8v231NLs2TA,1633592493471245,"As a reminder, the Fall Back To School Parent Survey is due by noon today, Monday, August 10th. If you have not already done so, please take a few minutes to complete this survey regarding the 2020-2021 school year.
https://forms.gle/7xRYjP8v231NLs2TA",https://facebook.com/story.php?story_fbid=1633592493471245&id=101089700054873,"DOCS.GOOGLE.COM
Fall Planning Survey - Parents",0.0,"As a reminder, the Fall Back To School Parent Survey is due by noon today, Monday, August 10th. If you have not already done so, please take a few minutes to complete this survey regarding the 2020-2021 school year.
https://forms.gle/7xRYjP8v231NLs2TA

DOCS.GOOGLE.COM
Fall Planning Survey - Parents",2020-08-10 11:54:20,,
15,0.0,,1.0,,1629153073915187,"Our 2020-2021 Athletic Registration is now open. If your student athlete will be participating in a sporting event this school year, please begin registering them. Sports that are available for the fall sport season are Cross Country (7th - 12th grades) and Trap Team.

You may register for more than one sport at a time or you can register for each individual sport as the season approaches. There is also a ""Pay Later"" option at the end of the registration page. Any item marked with * is a required field you must complete.",https://facebook.com/story.php?story_fbid=1629153073915187&id=101089700054873,,0.0,"Our 2020-2021 Athletic Registration is now open. If your student athlete will be participating in a sporting event this school year, please begin registering them. Sports that are available for the fall sport season are Cross Country (7th - 12th grades) and Trap Team.

You may register for more than one sport at a time or you can register for each individual sport as the season approaches. There is also a ""Pay Later"" option at the end of the registration page. Any item marked with * is a required field you must complete.",2020-08-05 16:33:21,,
16,0.0,,2.0,https://forms.gle/7xRYjP8v231NLs2TA,1629151857248642,"Please take a few moments to complete our Fall Back To School Parent Survey. This was also emailed to parents through Infinite Campus. The link is also provided here!
https://forms.gle/7xRYjP8v231NLs2TA",https://facebook.com/story.php?story_fbid=1629151857248642&id=101089700054873,"DOCS.GOOGLE.COM
Fall Planning Survey - Parents",9.0,"Please take a few moments to complete our Fall Back To School Parent Survey. This was also emailed to parents through Infinite Campus. The link is also provided here!
https://forms.gle/7xRYjP8v231NLs2TA

DOCS.GOOGLE.COM
Fall Planning Survey - Parents",2020-08-05 16:31:01,,
17,0.0,,5.0,,1628901680606993,"If your student athlete is interested in participating in Cross Country for the 2020-2021 school year, please let Mr. Kennedy or Nikki Bergan know at skennedy@leroy.k12.mn.us or nbergan@leroy.k12.mn.us",https://facebook.com/story.php?story_fbid=1628901680606993&id=101089700054873,,0.0,"If your student athlete is interested in participating in Cross Country for the 2020-2021 school year, please let Mr. Kennedy or Nikki Bergan know at skennedy@leroy.k12.mn.us or nbergan@leroy.k12.mn.us",2020-08-05 10:29:29,,
18,0.0,https://scontent-atl3-1.xx.fbcdn.net/v/t1.0-9/fr/cp0/e15/q65/116583299_1622714501225711_6771540288844315797_o.jpg?_nc_cat=106&_nc_sid=8024bb&_nc_ohc=P7xTw4iJ4KAAX8DptEQ&_nc_ht=scontent-atl3-1.xx&tp=14&oh=2126ad17d9396349cecf5615ebb0b2d2&oe=5F8410D1,2.0,,1622714591225702,Immunization for Children - by appointment only. Please see the flyer for more details.,https://facebook.com/story.php?story_fbid=1622714591225702&id=101089700054873,,0.0,Immunization for Children - by appointment only. Please see the flyer for more details.,2020-07-29 14:32:52,,
19,0.0,https://scontent-atl3-1.xx.fbcdn.net/v/t1.0-9/fr/cp0/e15/q65/116794371_1622480687915759_4746529905221923659_o.jpg?_nc_cat=110&_nc_sid=8024bb&_nc_ohc=uPVyC3tuzH8AX8hU7H5&_nc_ht=scontent-atl3-1.xx&tp=14&oh=57dc518906e9aac816b894e68668fdbc&oe=5F8443B0,2.0,,1622482944582200,"Reminder: Volleyball & Football Stores are open until August 4th. Questions, please contact the email at the bottom of the flyer! Make sure to get your gear and show some Cardinal Spirit!",https://facebook.com/story.php?story_fbid=1622482944582200&id=101089700054873,,0.0,"Reminder: Volleyball & Football Stores are open until August 4th. Questions, please contact the email at the bottom of the flyer! Make sure to get your gear and show some Cardinal Spirit!",2020-07-29 09:14:15,,
20,0.0,,4.0,,1621770024653492,,https://facebook.com/story.php?story_fbid=1621770024653492&id=101089700054873,,0.0,,2020-07-28 14:09:44,,
21,0.0,,6.0,,2751549295079307,"Regular School Board Meeting 7-21-20

What: Regular School Board Meeting.
When: July 21st, 2020 At 6:30PM
Where: Online Livestreamed Zoom Meeting.",,,0.0,"Regular School Board Meeting 7-21-20

What: Regular School Board Meeting.
When: July 21st, 2020 At 6:30PM
Where: Online Livestreamed Zoom Meeting.",2020-07-21 19:31:37,https://video-atl3-1.xx.fbcdn.net/v/t42.26565-2/10000000_334215781073874_7089524231378943908_n.mp4?_nc_cat=104&_nc_sid=985c63&efg=eyJ2ZW5jb2RlX3RhZyI6Im9lcF9zZCJ9&_nc_ohc=NvC6zWwMWDcAX_Rx7if&_nc_ht=video-atl3-1.xx&oh=f5a13f321f9baf90e0a5c29d62a53cb2&oe=5F5D2B7B,
22,0.0,,3.0,,1613497975480697,"The school board will hold a regular meeting on Tuesday, July 21st, 2020 at 6:30pm.

Due to the current federal and state emergency declarations, the Minnesota directive to residents to stay at home, and guidance about limiting person-to-person contact due to the COVID-19 (coronavirus) pandemic, this meeting of the Leroy-Ostrander District #499 School Board is being conducted in accordance with Minnesota Statutes 13D.021— Meetings by Telephone or Other Electronic Means.

Due to the health pandemic, the school board determined that it is not feasible for at least one board member, the superintendent, or the school district’s legal counsel to be physically present at the regular meeting location and that it is not feasible for the public to attend this meeting at the regular meeting location due to the health pandemic.

Persons may monitor this meeting from a remote location by live stream via the district’s Facebook page.",https://facebook.com/story.php?story_fbid=1613496702147491&id=101089700054873,,0.0,"The school board will hold a regular meeting on Tuesday, July 21st, 2020 at 6:30pm.

Due to the current federal and state emergency declarations, the Minnesota directive to residents to stay at home, and guidance about limiting person-to-person contact due to the COVID-19 (coronavirus) pandemic, this meeting of the Leroy-Ostrander District #499 School Board is being conducted in accordance with Minnesota Statutes 13D.021— Meetings by Telephone or Other Electronic Means.

Due to the health pandemic, the school board determined that it is not feasible for at least one board member, the superintendent, or the school district’s legal counsel to be physically present at the regular meeting location and that it is not feasible for the public to attend this meeting at the regular meeting location due to the health pandemic.

Persons may monitor this meeting from a remote location by live stream via the district’s Facebook page.",2020-07-17 18:00:00,,
23,0.0,https://scontent-atl3-1.xx.fbcdn.net/v/t1.0-9/fr/cp0/e15/q65/109715291_1351612118365523_5278867678980694728_n.jpg?_nc_cat=101&_nc_sid=110474&_nc_ohc=_3pr_UpP4dYAX89VgPJ&_nc_ht=scontent-atl3-1.xx&tp=14&oh=9054cdca9d6c3480055ce0220681e98f&oe=5F82B380,6.0,,1611543439009484,GO BIG RED!,https://facebook.com/story.php?story_fbid=1611543439009484&id=101089700054873,"Cardinal Football
July 17 at 2:56 PM ·

LO Football fans- here you go! Our online store is up and running. Get the gear you need before the first game. Show your Cardinal pride and spirit as your Cardinals gear up to defend their sub-district title.

Very easy- follow the instructions on the photo. Go Cardinals !",0.0,"GO BIG RED!

Cardinal Football
July 17 at 2:56 PM ·

LO Football fans- here you go! Our online store is up and running. Get the gear you need before the first game. Show your Cardinal pride and spirit as your Cardinals gear up to defend their sub-district title.

Very easy- follow the instructions on the photo. Go Cardinals !",2020-07-17 12:06:19,,
24,0.0,,1.0,https://www.leroy.k12.mn.us/page/2628,1610622559101572,"Another reminder, Kindergarten registration forms need to be filled out and turned in before the coming school year. Here is a link for this as well. https://www.leroy.k12.mn.us/page/2628",https://facebook.com/story.php?story_fbid=1610622559101572&id=101089700054873,"LEROY.K12.MN.US
Documents - Leann Drees - Elementary Secretary - LeRoy-Ostrander Public School",0.0,"Another reminder, Kindergarten registration forms need to be filled out and turned in before the coming school year. Here is a link for this as well. https://www.leroy.k12.mn.us/page/2628

LEROY.K12.MN.US
Documents - Leann Drees - Elementary Secretary - LeRoy-Ostrander Public School",2020-07-16 11:31:19,,
25,0.0,,4.0,https://www.leroy.k12.mn.us/page/3051,1608779995952495,"Just as a reminder, Early Learners and Preschool registration forms need to be turned in for the coming school year. Here is a link to our website with the included forms! https://www.leroy.k12.mn.us/page/3051",https://facebook.com/story.php?story_fbid=1608779995952495&id=101089700054873,"LEROY.K12.MN.US
Registration Forms - Paige Ulwelling - Preschool - LeRoy-Ostrander Public School",0.0,"Just as a reminder, Early Learners and Preschool registration forms need to be turned in for the coming school year. Here is a link to our website with the included forms! https://www.leroy.k12.mn.us/page/3051

LEROY.K12.MN.US
Registration Forms - Paige Ulwelling - Preschool - LeRoy-Ostrander Public School",2020-07-14 11:53:58,,
26,0.0,https://scontent-atl3-1.xx.fbcdn.net/v/t1.0-9/fr/cp0/e15/q65/107630656_1343977659128969_7245127751924938134_n.jpg?_nc_cat=105&_nc_sid=110474&_nc_ohc=-6t1Pdt3qkQAX9FUsmZ&_nc_ht=scontent-atl3-1.xx&tp=14&oh=985c335d596ab8e68f0d4c179f82826c&oe=5F83A5CD,12.0,,1604377173059444,A great way to help support L-O Football & Volleyball programs! #CardinalPride,https://facebook.com/story.php?story_fbid=1604377173059444&id=101089700054873,"Cardinal Football
July 8 at 6:25 PM ·

The Cardinal Pride Stencil Fundraiser supporting the Volleyball and Football team is officially ready!

$40 to show off your Cardinal Pride on your driveway, sidewalk, or yard. 100% of the proceeds will go towards the volleyball and football programs.

To sign up, please contact
Coach Milks via email or text at 507-272-5655 or lmilks@leroy.k12.mn.us

Coach Carrier a via email or text at 507-259-1525 or
tcarrier@leroy. k12.mn.us

#CardinalPride",0.0,"A great way to help support L-O Football & Volleyball programs! #CardinalPride

Cardinal Football
July 8 at 6:25 PM ·

The Cardinal Pride Stencil Fundraiser supporting the Volleyball and Football team is officially ready!

$40 to show off your Cardinal Pride on your driveway, sidewalk, or yard. 100% of the proceeds will go towards the volleyball and football programs.

To sign up, please contact
Coach Milks via email or text at 507-272-5655 or lmilks@leroy.k12.mn.us

Coach Carrier a via email or text at 507-259-1525 or
tcarrier@leroy. k12.mn.us

#CardinalPride",2020-07-09 15:37:57,,
27,0.0,https://scontent-atl3-1.xx.fbcdn.net/v/t1.0-9/fr/cp0/e15/q65/107718546_1602591553238006_7297991179522802718_o.jpg?_nc_cat=109&_nc_sid=8024bb&_nc_ohc=SVSiZR36mk4AX_i28ZH&_nc_ht=scontent-atl3-1.xx&tp=14&oh=efecf83b38a9699342085acd1d1ba667&oe=5F84532B,6.0,,1602591759904652,"Reminder to student athletes and parents: This waiver MUST be initialed, signed & dated in order to participate in summer activities. Contact coaches or Mr. Kennedy with any questions!",https://facebook.com/story.php?story_fbid=1602591759904652&id=101089700054873,,0.0,"Reminder to student athletes and parents: This waiver MUST be initialed, signed & dated in order to participate in summer activities. Contact coaches or Mr. Kennedy with any questions!",2020-07-07 16:07:21,,
28,0.0,,2.0,,1598315896998905,,https://facebook.com/story.php?story_fbid=1598315896998905&id=101089700054873,,0.0,,2020-07-02 13:43:09,,
29,0.0,https://scontent-atl3-1.xx.fbcdn.net/v/t1.0-9/fr/cp0/e15/q65/105634838_1589395374557624_4927588242908671276_o.jpg?_nc_cat=105&_nc_sid=8024bb&_nc_ohc=KEETRpyvo10AX9ECYs6&_nc_ht=scontent-atl3-1.xx&tp=14&oh=8ed02606609219488782b1d5da70f078&oe=5F83D8CD,41.0,,1589398277890667,"Scoreboard is up. Thank you Dean & Sandy Runde for use of your tellehandler and to all who helped with this project, Tim Lewison & family, John & Becky Frazer, Brad Johnson, Steve Kasel, Nathan Frazer & family. Little projects like this add up to amazing changes!",https://facebook.com/story.php?story_fbid=1589398277890667&id=101089700054873,,0.0,"Scoreboard is up. Thank you Dean & Sandy Runde for use of your tellehandler and to all who helped with this project, Tim Lewison & family, John & Becky Frazer, Brad Johnson, Steve Kasel, Nathan Frazer & family. Little projects like this add up to amazing changes!",2020-06-22 14:35:48,,
30,0.0,,3.0,,1589210727909422,"ATTENTION L-O Students, Parents & Community Members
The grass will be sprayed tomorrow, Tuesday, June 23rd at 8:00 a.m. & will need to be kept off of until Wednesday. This includes the practice field/football field, bus garage, playground, etc.",https://facebook.com/story.php?story_fbid=1589210727909422&id=101089700054873,,0.0,"ATTENTION L-O Students, Parents & Community Members
The grass will be sprayed tomorrow, Tuesday, June 23rd at 8:00 a.m. & will need to be kept off of until Wednesday. This includes the practice field/football field, bus garage, playground, etc.",2020-06-22 10:19:26,,
31,0.0,https://scontent-atl3-1.xx.fbcdn.net/v/t1.0-9/fr/cp0/e15/q65/82948208_10158507604658953_5658091474525051734_o.jpg?_nc_cat=105&_nc_sid=8024bb&_nc_ohc=-VJmTs9rJmIAX_Kp3rQ&_nc_ht=scontent-atl3-1.xx&tp=14&oh=11a8ea02f83d9e1845f14f61b2e212ff&oe=5F81EFC0,0.0,http://sgiz.mobi/s3/2020-Parent-Distance-Learning-Feedback-Survey,1584795188350976,,https://facebook.com/story.php?story_fbid=1584795188350976&id=101089700054873,,2.0,,2020-06-17 11:40:06,,
32,0.0,https://scontent-atl3-1.xx.fbcdn.net/v/t1.0-9/fr/cp0/e15/q65/83493249_1584719021691926_8478806342924137803_o.jpg?_nc_cat=104&_nc_sid=2d5d41&_nc_ohc=eRNJGpZm49gAX-oFd0F&_nc_ht=scontent-atl3-1.xx&tp=14&oh=ca3e3d9030c5e4145c57356ea699ea27&oe=5F8330F0,5.0,,1584719018358593,,,,0.0,,2020-06-17 10:11:16,,
33,0.0,,11.0,,1188050708210128,"What: Regular School Board Meeting.

When: June 16th, 2020 At 6:30PM

Where: Online Livestreamed Zoom Meeting.",,,0.0,"What: Regular School Board Meeting.

When: June 16th, 2020 At 6:30PM

Where: Online Livestreamed Zoom Meeting.",2020-06-16 19:27:57,https://video-atl3-1.xx.fbcdn.net/v/t42.26565-2/10000000_745836609456938_466855364728533891_n.mp4?_nc_cat=110&_nc_sid=985c63&efg=eyJ2ZW5jb2RlX3RhZyI6Im9lcF9zZCJ9&_nc_ohc=_LdMLHmsC00AX8QJryJ&_nc_ht=video-atl3-1.xx&oh=46ccbcd467ca855cfe5f5e3ae7520791&oe=5F5D3142,
34,3.0,,31.0,,1583813158449179,LeRoy-Ostrander Class of 2020 Graduation🎓,,,0.0,LeRoy-Ostrander Class of 2020 Graduation🎓,2020-06-16 10:22:12,https://video-atl3-1.xx.fbcdn.net/v/t42.9040-2/10000000_573818269828465_964028949314688974_n.mp4?_nc_cat=101&_nc_sid=985c63&efg=eyJ2ZW5jb2RlX3RhZyI6ImxlZ2FjeV9zZCJ9&_nc_ohc=DnrbIJdlxZoAX9qbLcg&_nc_ht=video-atl3-1.xx&oh=b92648fe72d7c814eb26dff6ce4b0945&oe=5F5D368F,
35,4.0,,52.0,https://www.kimt.com/content/news/leroygraduation-571282961.html#.XujOlwkFHUs.facebook,1583793335117828,CONGRATULATIONS Class of 2020!,https://facebook.com/story.php?story_fbid=1583793335117828&id=101089700054873,"KIMT.COM
Celebrating graduation in a nontraditional way",13.0,"CONGRATULATIONS Class of 2020!

KIMT.COM
Celebrating graduation in a nontraditional way",2020-06-16 09:53:07,,
36,0.0,,23.0,,1582362555260906,"🎓ATTENTION: Class of 2020🎓
Students, please arrive at the practice football field by 4:30 p.m. tomorrow, Monday, June 15th as Commencement begins at 5:00 p.m.! Remember to wear your gown, hat and tassel. See you all tomorrow!!!",https://facebook.com/story.php?story_fbid=1582362555260906&id=101089700054873,,0.0,"🎓ATTENTION: Class of 2020🎓
Students, please arrive at the practice football field by 4:30 p.m. tomorrow, Monday, June 15th as Commencement begins at 5:00 p.m.! Remember to wear your gown, hat and tassel. See you all tomorrow!!!",2020-06-14 17:47:46,,
37,0.0,,5.0,,1580443115452850,"The school board will hold a regular meeting on Tuesday, June 16th, 2020 at 6:30pm.

Due to the current federal and state emergency declarations, the Minnesota directive to residents to stay at home, and guidance about limiting person-to-person contact due to the COVID-19 (coronavirus) pandemic, this meeting of the Leroy-Ostrander District #499 School Board is being conducted in accordance with Minnesota Statutes 13D.021— Meetings by Telephone or Other Electronic Means.

Due to the health pandemic, the school board determined that it is not feasible for at least one board member, the superintendent, or the school district’s legal counsel to be physically present at the regular meeting location and that it is not feasible for the public to attend this meeting at the regular meeting location due to the health pandemic.

Persons may monitor this meeting from a remote location by live stream via the district’s Facebook page.",https://facebook.com/story.php?story_fbid=1580443115452850&id=101089700054873,,0.0,"The school board will hold a regular meeting on Tuesday, June 16th, 2020 at 6:30pm.

Due to the current federal and state emergency declarations, the Minnesota directive to residents to stay at home, and guidance about limiting person-to-person contact due to the COVID-19 (coronavirus) pandemic, this meeting of the Leroy-Ostrander District #499 School Board is being conducted in accordance with Minnesota Statutes 13D.021— Meetings by Telephone or Other Electronic Means.

Due to the health pandemic, the school board determined that it is not feasible for at least one board member, the superintendent, or the school district’s legal counsel to be physically present at the regular meeting location and that it is not feasible for the public to attend this meeting at the regular meeting location due to the health pandemic.

Persons may monitor this meeting from a remote location by live stream via the district’s Facebook page.",2020-06-12 15:49:48,,
38,2.0,,22.0,,1578457652318063,"🎓Class of 2020 Graduation Commencement🎓
Commencement will be held on Monday, June 15th at 5:00 p.m. on the practice football field. Following commencement at 6:00 p.m. there will be a community parade to honor and celebrate the graduating class.

(There will be room for spectators in the bus garage parking lot as well as along the street, not already designated for the Senior class. Spectators MUST follow social distancing guidelines!)

Commencement will be recorded and posted to YouTube/FaceBook later in the evening!",https://facebook.com/story.php?story_fbid=1578457652318063&id=101089700054873,,0.0,"🎓Class of 2020 Graduation Commencement🎓
Commencement will be held on Monday, June 15th at 5:00 p.m. on the practice football field. Following commencement at 6:00 p.m. there will be a community parade to honor and celebrate the graduating class.

(There will be room for spectators in the bus garage parking lot as well as along the street, not already designated for the Senior class. Spectators MUST follow social distancing guidelines!)

Commencement will be recorded and posted to YouTube/FaceBook later in the evening!",2020-06-10 11:43:37,,
39,0.0,https://scontent-atl3-1.xx.fbcdn.net/v/t1.0-9/103137569_1577541539076341_7459443435993558561_o.png?_nc_cat=102&_nc_sid=8024bb&_nc_ohc=Szu4Vp-sOwYAX9B9bva&_nc_ht=scontent-atl3-1.xx&oh=fe6cf7c3fc89982cf4c9e92cdad1de1f&oe=5F823BC1,2.0,http://www.mn.p-ebt.org/,1577543525742809,Here is just another great resource for families during the pandemic! Stay Safe! www.mn.p-ebt.org,https://facebook.com/story.php?story_fbid=1577543525742809&id=101089700054873,,0.0,Here is just another great resource for families during the pandemic! Stay Safe! www.mn.p-ebt.org,2020-06-09 11:21:51,,
40,4.0,,20.0,https://www.instagram.com/p/CAwIoRRlWvM/?igshid=3tm4zf6lg639,1567831860047309,"Class of 2020 L-O graduate, Dylan Holmen
Congratulations Dylan!!!🎓❤",https://facebook.com/story.php?story_fbid=1567831860047309&id=101089700054873,,0.0,"Class of 2020 L-O graduate, Dylan Holmen
Congratulations Dylan!!!🎓❤",2020-05-29 16:48:51,,
41,2.0,,23.0,https://www.instagram.com/p/CAwIlydFI9z/?igshid=11r1623di2iti,1567831223380706,"Class of 2020 graduate Shanoah Sager!
Congratulations Shanoah👩‍🎓❤🎓",https://facebook.com/story.php?story_fbid=1567831223380706&id=101089700054873,,0.0,"Class of 2020 graduate Shanoah Sager!
Congratulations Shanoah👩‍🎓❤🎓",2020-05-29 16:47:39,,
42,3.0,,21.0,,1567825746714587,Daily Announcements for 5-29-2020 giving tips to stay safe and have fun this summer. Mr. Hungerholt was here to help me today!,,,0.0,Daily Announcements for 5-29-2020 giving tips to stay safe and have fun this summer. Mr. Hungerholt was here to help me today!,2020-05-29 16:39:16,https://video-atl3-1.xx.fbcdn.net/v/t42.9040-2/10000000_609394326333953_7097758882017050624_n.mp4?_nc_cat=111&_nc_sid=985c63&efg=eyJ2ZW5jb2RlX3RhZyI6ImxlZ2FjeV9zZCJ9&_nc_ohc=Iyl3n6-t_T8AX-C4up6&_nc_ht=video-atl3-1.xx&oh=58d4562cee75aeee77f3481d9f2d22e9&oe=5F5D2B4F,
43,0.0,,3.0,,1566654006831761,"SUMMER FOOD PROGRAM
Free Meals for any child age 18 and under
June 1 through June 30 (M-F)
8:00 am – 9:00 am (breakfast/lunch combo)
PICK UP ONLY – at Pool Doors
NO DELIVERIES (Last Day for Delivery is Friday, May 29)
July and August – (TBD) more information to come at a later date",https://facebook.com/story.php?story_fbid=1566654006831761&id=101089700054873,,0.0,"SUMMER FOOD PROGRAM
Free Meals for any child age 18 and under
June 1 through June 30 (M-F)
8:00 am – 9:00 am (breakfast/lunch combo)
PICK UP ONLY – at Pool Doors
NO DELIVERIES (Last Day for Delivery is Friday, May 29)
July and August – (TBD) more information to come at a later date",2020-05-28 09:39:09,,
44,0.0,,5.0,,1561627774001051,Congratulations to our Senior Track & Field athletes!,https://facebook.com/story.php?story_fbid=1561627774001051&id=101089700054873,"GMLOKS track & field
May 20 at 5:00 PM ·

Thank You Seniors!",0.0,"Congratulations to our Senior Track & Field athletes!

GMLOKS track & field
May 20 at 5:00 PM ·

Thank You Seniors!",2020-05-22 13:54:16,https://video-atl3-1.xx.fbcdn.net/v/t42.9040-2/100665559_568298417205262_6529571095719182336_n.mp4?_nc_cat=100&_nc_sid=985c63&efg=eyJ2ZW5jb2RlX3RhZyI6ImxlZ2FjeV9zZCJ9&_nc_ohc=tZbDJa0__t4AX8qhp1_&_nc_ht=video-atl3-1.xx&oh=05704fc294ba5024403103e4cd6f34cf&oe=5F5D29E8,
45,0.0,,1.0,https://www.signupgenius.com/go/30e0b4cabac2ba0f58-201920,1560863600744135,"Reminder if you have not signed your MS/HS student/students up to turn in/checkout for the 2019-2020 school year, please follow the link below to Sign-Up Genius and select a date and time.
https://www.signupgenius.com/go/30e0b4cabac2ba0f58-201920

Friday, May 22 9 a.m. -2 p.m.
Tuesday, May 26th 12 p.m. -7 p.m.
Wednesday, May 27th 9 a.m.- 3 p.m.
Thursday, May 28th 9 a.m. - 3 p.m.

(iPads/Laptops & chargers, text books, novels, calculators, library books, pay lunch account balances if needed. Returning anything that may be of school property.)",https://facebook.com/story.php?story_fbid=1560863600744135&id=101089700054873,"SIGNUPGENIUS.COM
2019-20 Student End of Year Checkout",0.0,"Reminder if you have not signed your MS/HS student/students up to turn in/checkout for the 2019-2020 school year, please follow the link below to Sign-Up Genius and select a date and time.
https://www.signupgenius.com/go/30e0b4cabac2ba0f58-201920

Friday, May 22 9 a.m. -2 p.m.
Tuesday, May 26th 12 p.m. -7 p.m.
Wednesday, May 27th 9 a.m.- 3 p.m.
Thursday, May 28th 9 a.m. - 3 p.m.

(iPads/Laptops & chargers, text books, novels, calculators, library books, pay lunch account balances if needed. Returning anything that may be of school property.)

SIGNUPGENIUS.COM
2019-20 Student End of Year Checkout",2020-05-21 15:52:27,,
46,1.0,,15.0,,1559859664177862,"Daily Announcements 5-20-20 LIVE from the Cardinal Courtyard with a special guest, Cardi the Bird",,,0.0,"Daily Announcements 5-20-20 LIVE from the Cardinal Courtyard with a special guest, Cardi the Bird",2020-05-20 12:32:51,https://video-atl3-1.xx.fbcdn.net/v/t42.9040-2/99375033_574057633314519_5590724290291957760_n.mp4?_nc_cat=109&_nc_sid=985c63&efg=eyJ2ZW5jb2RlX3RhZyI6ImxlZ2FjeV9zZCJ9&_nc_ohc=iAxH6htLtgIAX9YTsYj&_nc_oc=AQl_OUMhEHDvdKMLxKNxNSRHcVEUcCRzivBv0uXLaEUt3lrMXyn9xU1Y9iuuPLnRvf0&_nc_ht=video-atl3-1.xx&oh=928b2106bd2d2e8e113fee070512bcaa&oe=5F5D338D,
47,2.0,,3.0,,921194324992311,"What: Regular School Board Meeting.

When: May 19th, 2020 At 6:30PM

Where: Online Livestreamed Zoom Meeting.",,,0.0,"What: Regular School Board Meeting.

When: May 19th, 2020 At 6:30PM

Where: Online Livestreamed Zoom Meeting.",2020-05-19 19:27:56,https://scontent-atl3-1.xx.fbcdn.net/v/t66.36281-6/10000000_331516188219600_2306557999377690457_n.mp4?_nc_cat=106&_nc_sid=985c63&efg=eyJ2ZW5jb2RlX3RhZyI6Im9lcF9zZCJ9&_nc_ohc=Dg5-NPvN0lEAX8cgP8x&_nc_ht=scontent-atl3-1.xx&oh=1b5efe0980ab28f8b4380af053068847&oe=5F82576C,
48,0.0,,4.0,,1559004457596716,Daily Announcements 5-19-20,,,0.0,Daily Announcements 5-19-20,2020-05-19 14:02:39,https://video-atl3-1.xx.fbcdn.net/v/t42.9040-2/98327121_265981661191179_2835470613487812608_n.mp4?_nc_cat=109&_nc_sid=985c63&efg=eyJ2ZW5jb2RlX3RhZyI6ImxlZ2FjeV9zZCJ9&_nc_ohc=TImWv8Xm9v8AX-ON1rF&_nc_ht=video-atl3-1.xx&oh=4e7d44da376f865e5836047a2847e5c9&oe=5F5D2EEA,
49,0.0,,6.0,,1558237891006706,"Daily Announcements 5-18-2020...Every Monday Matters! Today, we choose Civility. Being civil requires us to be RESPECTFUL & KIND to one another, serve one another, help a neighbor, reach out to a friend, step into any situation to make it better. It matters NOW more than ever!",,,0.0,"Daily Announcements 5-18-2020...Every Monday Matters! Today, we choose Civility. Being civil requires us to be RESPECTFUL & KIND to one another, serve one another, help a neighbor, reach out to a friend, step into any situation to make it better. It matters NOW more than ever!",2020-05-18 17:11:22,https://video-atl3-1.xx.fbcdn.net/v/t42.9040-2/98170392_876477606204250_3932348331094704128_n.mp4?_nc_cat=104&_nc_sid=985c63&efg=eyJ2ZW5jb2RlX3RhZyI6ImxlZ2FjeV9zZCJ9&_nc_ohc=nAr2k7meDFAAX8xIm_C&_nc_ht=video-atl3-1.xx&oh=ca8ed41c21ee24a86770bc8157fdd6c5&oe=5F5D3612,
50,118.0,https://scontent-atl3-1.xx.fbcdn.net/v/t1.0-9/fr/cp0/e15/q65/98187002_1555740287923133_7751211810774056960_o.jpg?_nc_cat=103&_nc_sid=110474&_nc_ohc=XKAEccw870sAX-Xmp83&_nc_ht=scontent-atl3-1.xx&tp=14&oh=74f91276e31f521c2006f905d36e7109&oe=5F829A00,226.0,,1555740314589797,"It's this guys last day too! After 33 years, Mr. Rosedahl is retiring. Here's to living the dream for the rest of your life! We will miss you.",https://facebook.com/story.php?story_fbid=1555740314589797&id=101089700054873,,0.0,"It's this guys last day too! After 33 years, Mr. Rosedahl is retiring. Here's to living the dream for the rest of your life! We will miss you.",2020-05-15 22:07:27,,
51,1.0,,26.0,,1555479934615835,Daily Announcements 5-15-2020 SENIORS....You did it!!! Congratulations Class of 2020. We are so very proud of you!🎓❤,,,0.0,Daily Announcements 5-15-2020 SENIORS....You did it!!! Congratulations Class of 2020. We are so very proud of you!🎓❤,2020-05-15 14:51:12,https://video-atl3-1.xx.fbcdn.net/v/t42.9040-2/97354286_176539113664751_4948543601987551232_n.mp4?_nc_cat=110&_nc_sid=985c63&efg=eyJ2ZW5jb2RlX3RhZyI6ImxlZ2FjeV9zZCJ9&_nc_ohc=QkqrQ3DdX0QAX-Gs2-y&_nc_ht=video-atl3-1.xx&oh=a3adac7e2f28a0468305b578e11649dd&oe=5F5D2A35,
52,0.0,,2.0,,1555465484617280,"The school board will hold a regular meeting on Tuesday, May 19th, 2020 at 6:30pm.

Due to the current federal and state emergency declarations, the Minnesota directive to residents to stay at home, and guidance about limiting person-to-person contact due to the COVID-19 (coronavirus) pandemic, this meeting of the Leroy-Ostrander District #499 School Board is being conducted in accordance with Minnesota Statutes 13D.021— Meetings by Telephone or Other Electronic Means.

Due to the health pandemic, the school board determined that it is not feasible for at least one board member, the superintendent, or the school district’s legal counsel to be physically present at the regular meeting location and that it is not feasible for the public to attend this meeting at the regular meeting location due to the health pandemic.

Persons may monitor this meeting from a remote location by live stream via the district’s Facebook page.",https://facebook.com/story.php?story_fbid=1555465484617280&id=101089700054873,,0.0,"The school board will hold a regular meeting on Tuesday, May 19th, 2020 at 6:30pm.

Due to the current federal and state emergency declarations, the Minnesota directive to residents to stay at home, and guidance about limiting person-to-person contact due to the COVID-19 (coronavirus) pandemic, this meeting of the Leroy-Ostrander District #499 School Board is being conducted in accordance with Minnesota Statutes 13D.021— Meetings by Telephone or Other Electronic Means.

Due to the health pandemic, the school board determined that it is not feasible for at least one board member, the superintendent, or the school district’s legal counsel to be physically present at the regular meeting location and that it is not feasible for the public to attend this meeting at the regular meeting location due to the health pandemic.

Persons may monitor this meeting from a remote location by live stream via the district’s Facebook page.",2020-05-15 14:34:02,,
53,0.0,,9.0,,1554620404701788,"Daily Announcements 5-14-2020 ~ Seniors ""Your Future's So Bright, We Gotta Wear Shades""",,,0.0,"Daily Announcements 5-14-2020 ~ Seniors ""Your Future's So Bright, We Gotta Wear Shades""",2020-05-14 15:13:54,https://video-atl3-1.xx.fbcdn.net/v/t42.9040-2/97123709_1799757350165899_1500513645958791168_n.mp4?_nc_cat=109&_nc_sid=985c63&efg=eyJ2ZW5jb2RlX3RhZyI6ImxlZ2FjeV9zZCJ9&_nc_ohc=GAv6LhkTg50AX976f9e&_nc_ht=video-atl3-1.xx&oh=2503024a7beeeb1d02ab348165a64d11&oe=5F5D3468,
54,0.0,,24.0,https://www.instagram.com/p/CAJk2PrFpmG/?utm_source=ig_web_button_share_sheet,1553828468114315,"Class of 2020 Senior Spotlight Makayla Weiss🎓
Congratulations Makayla!",https://facebook.com/story.php?story_fbid=1553828468114315&id=101089700054873,,0.0,"Class of 2020 Senior Spotlight Makayla Weiss🎓
Congratulations Makayla!",2020-05-13 21:24:31,,
55,0.0,,8.0,,1553822368114925,Daily Announcements 5-13-20 AND Seniors...your countdown continues!,,,0.0,Daily Announcements 5-13-20 AND Seniors...your countdown continues!,2020-05-13 21:17:37,https://video-atl3-1.xx.fbcdn.net/v/t42.9040-2/97091346_556579588588681_154809970175508480_n.mp4?_nc_cat=103&_nc_sid=985c63&efg=eyJ2ZW5jb2RlX3RhZyI6ImxlZ2FjeV9zZCJ9&_nc_ohc=8hFfO_k_KR4AX-PwUEO&_nc_ht=video-atl3-1.xx&oh=0bbf73a79ff8508d60be0d866613d199&oe=5F5D28B8,
56,2.0,,19.0,,1553371921493303,,https://facebook.com/story.php?story_fbid=1553371921493303&id=101089700054873,,0.0,,2020-05-13 09:12:21,,
57,6.0,,65.0,https://www.instagram.com/p/CAGe-lCFI3l/?igshid=z5wit20e7cj7,1553031571527338,"Class of 2020 Senior Spotlight - Emily Hofner
Congratulations Emily!🎓❤",https://facebook.com/story.php?story_fbid=1553031571527338&id=101089700054873,,0.0,"Class of 2020 Senior Spotlight - Emily Hofner
Congratulations Emily!🎓❤",2020-05-12 22:20:23,,
58,0.0,,8.0,,1552734334890395,Daily Announcements 5-12-20...4 DAYS Seniors!!! You will ROCK in all that you do!,,,0.0,Daily Announcements 5-12-20...4 DAYS Seniors!!! You will ROCK in all that you do!,2020-05-12 13:30:37,https://video-atl3-1.xx.fbcdn.net/v/t42.9040-2/96567325_2846021795494977_800984948000423936_n.mp4?_nc_cat=103&_nc_sid=985c63&efg=eyJ2ZW5jb2RlX3RhZyI6ImxlZ2FjeV9zZCJ9&_nc_ohc=ji76l_4ThecAX8D6w6b&_nc_ht=video-atl3-1.xx&oh=f1ff8cd0aff5291c7351eee081ec6f34&oe=5F5D2E18,
59,5.0,,65.0,https://www.instagram.com/p/CADfVUolQwU/?utm_source=ig_web_button_share_sheet,1551881154975713,"Senior Spotlight, Class of 2020 - Carter Johnson
Congratulations Carter!🎓💙",https://facebook.com/story.php?story_fbid=1551881154975713&id=101089700054873,,0.0,"Senior Spotlight, Class of 2020 - Carter Johnson
Congratulations Carter!🎓💙",2020-05-11 12:56:46,,
60,1.0,,14.0,,1551877188309443,Daily Announcements 5-11-2020 SENIORS...it's your FINAL countdown! 5 days,,,0.0,Daily Announcements 5-11-2020 SENIORS...it's your FINAL countdown! 5 days,2020-05-11 12:50:08,https://video-atl3-1.xx.fbcdn.net/v/t42.9040-2/96521774_1916850568449948_4536758776350375936_n.mp4?_nc_cat=105&_nc_sid=985c63&efg=eyJ2ZW5jb2RlX3RhZyI6ImxlZ2FjeV9zZCJ9&_nc_ohc=QF_n9Agd5YAAX95oJ8S&_nc_ht=video-atl3-1.xx&oh=046aa1e68bbe93dc3ca4e8a05b6063a7&oe=5F5D2A98,
61,1.0,,27.0,https://www.instagram.com/p/B_75rW9FwB5/?utm_source=ig_web_button_share_sheet,1549246218572540,"L-O Senior Spotlight Kaelea Lewis
Congratulations Kaelea!",https://facebook.com/story.php?story_fbid=1549246218572540&id=101089700054873,,0.0,"L-O Senior Spotlight Kaelea Lewis
Congratulations Kaelea!",2020-05-08 15:16:48,,
62,1.0,,15.0,https://www.youtube.com/watch?v=LTVSJi2Mmts&feature=share,1549217821908713,A message to our L-O Graduating Senior Class of 2020. Cory Greenwood is a youth motivational speaker who has reached out to thousands of students and even made an appearance here at L-O this past winter.,https://facebook.com/story.php?story_fbid=1549217821908713&id=101089700054873,"YOUTUBE.COM
Leroy Ostrander Class of 2020",9.0,"A message to our L-O Graduating Senior Class of 2020. Cory Greenwood is a youth motivational speaker who has reached out to thousands of students and even made an appearance here at L-O this past winter.

YOUTUBE.COM
Leroy Ostrander Class of 2020",2020-05-08 14:34:09,,
63,1.0,,3.0,,2625544904324436,Special School Board Meeting 5-7-20 @ 5:30PM,,,0.0,Special School Board Meeting 5-7-20 @ 5:30PM,2020-05-07 18:30:41,https://video-atl3-1.xx.fbcdn.net/v/t42.26565-2/10000000_1161369274242682_187089203223961702_n.mp4?_nc_cat=101&_nc_sid=985c63&efg=eyJ2ZW5jb2RlX3RhZyI6Im9lcF9zZCJ9&_nc_ohc=alUQoN1rz6AAX-t6MoU&_nc_ht=video-atl3-1.xx&oh=1b3ccfd443e17fbbd62460201dd43a15&oe=5F5D324C,
64,0.0,,13.0,,1548369711993524,Daily Announcements 5-7-2020 & a word from Mr. Hungerholt!,,,0.0,Daily Announcements 5-7-2020 & a word from Mr. Hungerholt!,2020-05-07 16:51:54,https://video-atl3-1.xx.fbcdn.net/v/t42.9040-2/96522420_655381435307910_9153749998511325184_n.mp4?_nc_cat=100&_nc_sid=985c63&efg=eyJ2ZW5jb2RlX3RhZyI6ImxlZ2FjeV9zZCJ9&_nc_ohc=VPxXv6AxyMwAX_cpFtz&_nc_ht=video-atl3-1.xx&oh=ba688556d8d7d3ddbcef4c7d86ac8c38&oe=5F5D2EDC,
65,5.0,,24.0,,1547405025423326,Daily Announcements 5-6-2020 Happy Nurse Appreciation Day! Thank you to ALL nurses for everything you do and to school nurse Emily Brumm!,,,0.0,Daily Announcements 5-6-2020 Happy Nurse Appreciation Day! Thank you to ALL nurses for everything you do and to school nurse Emily Brumm!,2020-05-06 13:45:56,https://video-atl3-1.xx.fbcdn.net/v/t42.9040-2/96578090_582038789100386_5968547473784832000_n.mp4?_nc_cat=110&_nc_sid=985c63&efg=eyJ2ZW5jb2RlX3RhZyI6ImxlZ2FjeV9zZCJ9&_nc_ohc=0S-Ca968ydYAX9BF32B&_nc_ht=video-atl3-1.xx&oh=496f912dbd6f090bf405d5983771144f&oe=5F5D301D,
66,1.0,,49.0,https://www.instagram.com/p/B_0R9FgFVn1/?utm_source=ig_web_button_share_sheet,1546574008839761,"Today's Senior Spotlight Tanner Kasel
Congratulations Tanner on all your hard work!🎓❤️",https://facebook.com/story.php?story_fbid=1546574008839761&id=101089700054873,,0.0,"Today's Senior Spotlight Tanner Kasel
Congratulations Tanner on all your hard work!🎓❤️",2020-05-05 14:57:11,,
67,0.0,,8.0,,1546565672173928,Daily Announcements 5-5-2020 - included registration information & a shout-out to one of our favorite teachers here at L-O!,,,0.0,Daily Announcements 5-5-2020 - included registration information & a shout-out to one of our favorite teachers here at L-O!,2020-05-05 14:43:58,https://video-atl3-1.xx.fbcdn.net/v/t42.9040-2/96371038_3463796633637551_2114888187707916288_n.mp4?_nc_cat=104&_nc_sid=985c63&efg=eyJ2ZW5jb2RlX3RhZyI6ImxlZ2FjeV9zZCJ9&_nc_ohc=Va-_jCrR9qoAX9BiwIM&_nc_ht=video-atl3-1.xx&oh=2478b0d96632f41ed68107ae008c1032&oe=5F5D28D6,
68,0.0,,10.0,,1545780515585777,Daily Announcements 5-4-20 & this week is Teacher Appreciation Week. Thank you to ALL of our amazing staff at L-O for all you do!,,,0.0,Daily Announcements 5-4-20 & this week is Teacher Appreciation Week. Thank you to ALL of our amazing staff at L-O for all you do!,2020-05-04 16:06:55,https://video-atl3-1.xx.fbcdn.net/v/t42.9040-2/94698306_594792111134386_6025384128927498240_n.mp4?_nc_cat=108&_nc_sid=985c63&efg=eyJ2ZW5jb2RlX3RhZyI6ImxlZ2FjeV9zZCJ9&_nc_ohc=p1_MbrWpMAQAX80llap&_nc_ht=video-atl3-1.xx&oh=74c337929431316b51c790b96eb7aad5&oe=5F5D2D6B,
69,0.0,,6.0,,1545739768923185,"The school board will hold a special meeting on Thursday, May 7th, 2020 at 5:30pm.

Due to the current federal and state emergency declarations, the Minnesota directive to residents to stay at home, and guidance about limiting person-to-person contact due to the COVID-19 (coronavirus) pandemic, this meeting of the Leroy-Ostrander District #499 School Board is being conducted in accordance with Minnesota Statutes 13D.021— Meetings by Telephone or Other Electronic Means.

Due to the health pandemic, the school board determined that it is not feasible for at least one board member, the superintendent, or the school district’s legal counsel to be physically present at the regular meeting location and that it is not feasible for the public to attend this meeting at the regular meeting location due to the health pandemic.

Persons may monitor this meeting from a remote location by live stream via the district’s Facebook page.",https://facebook.com/story.php?story_fbid=1545739768923185&id=101089700054873,,0.0,"The school board will hold a special meeting on Thursday, May 7th, 2020 at 5:30pm.

Due to the current federal and state emergency declarations, the Minnesota directive to residents to stay at home, and guidance about limiting person-to-person contact due to the COVID-19 (coronavirus) pandemic, this meeting of the Leroy-Ostrander District #499 School Board is being conducted in accordance with Minnesota Statutes 13D.021— Meetings by Telephone or Other Electronic Means.

Due to the health pandemic, the school board determined that it is not feasible for at least one board member, the superintendent, or the school district’s legal counsel to be physically present at the regular meeting location and that it is not feasible for the public to attend this meeting at the regular meeting location due to the health pandemic.

Persons may monitor this meeting from a remote location by live stream via the district’s Facebook page.",2020-05-04 14:59:38,,
70,1.0,,21.0,,1545697545594074,"Light Up the Night for the Class of 2020!

Join L-O School in celebrating the graduating class! We invite you to help us ""Light Up the Night"" sky from your homes for 20 minutes, tonight, Monday, May 4th to celebrate our seniors as we light our football field and scoreboard to honor them.

When: Monday May 4th, 8:30 - 8:50 p.m.
Where: From the comfort of your homes
Please share your pictures and videos with us in the comments below. We look forward to seeing your pictures and videos as we honor this great group of kids!
#cardinalstrong #cardinalnation",https://facebook.com/story.php?story_fbid=1545697545594074&id=101089700054873,,0.0,"Light Up the Night for the Class of 2020!

Join L-O School in celebrating the graduating class! We invite you to help us ""Light Up the Night"" sky from your homes for 20 minutes, tonight, Monday, May 4th to celebrate our seniors as we light our football field and scoreboard to honor them.

When: Monday May 4th, 8:30 - 8:50 p.m.
Where: From the comfort of your homes
Please share your pictures and videos with us in the comments below. We look forward to seeing your pictures and videos as we honor this great group of kids!
#cardinalstrong #cardinalnation",2020-05-04 13:57:09,,
71,3.0,,28.0,,1543006569196505,"Here is a virtual tour of what the LO Ag Dept. has for sale for this year's
Spring Plant Sale! The sale is starting Monday, May 4th, at 9AM!",https://facebook.com/story.php?story_fbid=1543006569196505&id=101089700054873,"Tiffany Boettcher Timm
May 1 at 4:36 PM ·

Many people have been asking for a virtual tour of what we have available starting Monday in the LeRoy-Ostrander Ag Dept Greenhouse - well here it is I did the best I could hopefully it helps give you insight of what we’ve got.￼￼",2.0,"Here is a virtual tour of what the LO Ag Dept. has for sale for this year's
Spring Plant Sale! The sale is starting Monday, May 4th, at 9AM!

Tiffany Boettcher Timm
May 1 at 4:36 PM ·

Many people have been asking for a virtual tour of what we have available starting Monday in the LeRoy-Ostrander Ag Dept Greenhouse - well here it is I did the best I could hopefully it helps give you insight of what we’ve got.￼￼",2020-05-01 13:42:48,,
72,0.0,,12.0,,1542799999217162,"Daily Announcements 5-1-2020 Spotlight letter of the day ""K"" for kindness In a world where you can be anything, be kind.",,,0.0,"Daily Announcements 5-1-2020 Spotlight letter of the day ""K"" for kindness In a world where you can be anything, be kind.",2020-05-01 10:24:35,https://video-atl3-1.xx.fbcdn.net/v/t42.9040-2/95531042_1686757351463306_6140859796468793344_n.mp4?_nc_cat=104&_nc_sid=985c63&efg=eyJ2ZW5jb2RlX3RhZyI6ImxlZ2FjeV9zZCJ9&_nc_ohc=5GB9MncJB4QAX9jBO-E&_nc_ht=video-atl3-1.xx&oh=25ea2cca7eb05c8f54ec065bbc712b53&oe=5F5D3599,
73,0.0,,4.0,,605724433361471,"What: Special School Board Meeting.

When: April 30th, 2020 At 6:30PM

Where: Online Livestreamed Zoom Meeting.",,,0.0,"What: Special School Board Meeting.

When: April 30th, 2020 At 6:30PM

Where: Online Livestreamed Zoom Meeting.",2020-04-30 19:28:31,https://video-atl3-1.xx.fbcdn.net/v/t42.26565-2/10000000_2710066829228937_6322388879731874136_n.mp4?_nc_cat=110&_nc_sid=985c63&efg=eyJ2ZW5jb2RlX3RhZyI6Im9lcF9zZCJ9&_nc_ohc=SGgt3R8WsL8AX_DVOG5&_nc_ht=video-atl3-1.xx&oh=2e24ecfab2518e254fc58635c0caa31b&oe=5F5D2B75,
74,5.0,,21.0,,1541153509381811,"Announcements 4-29-2020 with Mr. Kennedy and spotlight letter ""J""",,,0.0,"Announcements 4-29-2020 with Mr. Kennedy and spotlight letter ""J""",2020-04-29 14:33:34,https://video-atl3-1.xx.fbcdn.net/v/t42.9040-2/95050112_237621484145220_8244842804514127872_n.mp4?_nc_cat=106&_nc_sid=985c63&efg=eyJ2ZW5jb2RlX3RhZyI6ImxlZ2FjeV9zZCJ9&_nc_ohc=gTrE8_t4MNQAX8TJf7s&_nc_ht=video-atl3-1.xx&oh=3123d82a76054803dec6b4d36581b6aa&oe=5F5D2AF5,
75,0.0,,5.0,,1540317639465398,"Daily Announcements 4-28-2020
National Superhero Day ~ Who's your superhero???",,,0.0,"Daily Announcements 4-28-2020
National Superhero Day ~ Who's your superhero???",2020-04-28 15:41:17,https://video-atl3-1.xx.fbcdn.net/v/t42.9040-2/95191348_433633087509281_9076077091216162816_n.mp4?_nc_cat=104&_nc_sid=985c63&efg=eyJ2ZW5jb2RlX3RhZyI6ImxlZ2FjeV9zZCJ9&_nc_ohc=0Zhu-7bHtOMAX8unC-3&_nc_ht=video-atl3-1.xx&oh=1bce0ad3c26effb401f4af1188c4350d&oe=5F5D298C,
76,0.0,,42.0,https://www.instagram.com/p/B_XkBvglivB/?igshid=lv08tngogxj0,1539745522855943,Senior Spotlight ~ Riley Olson L-O Class of 2020! Congratulations Riley🎓👨‍🎓,https://facebook.com/story.php?story_fbid=1539745522855943&id=101089700054873,,0.0,Senior Spotlight ~ Riley Olson L-O Class of 2020! Congratulations Riley🎓👨‍🎓,2020-04-27 22:46:12,,
77,0.0,,26.0,https://www.instagram.com/p/B_ghVm3lJvu/?igshid=1jrfuf6b1ewet,1539744439522718,Senior Spotlight ~ Tiana Plagman L-O Class of 2020! Congratulations Tiana🎓,https://facebook.com/story.php?story_fbid=1539744439522718&id=101089700054873,,0.0,Senior Spotlight ~ Tiana Plagman L-O Class of 2020! Congratulations Tiana🎓,2020-04-27 22:44:13,,
78,0.0,,20.0,https://www.instagram.com/p/B_BEHmWHAuH/?igshid=f6f5ujdklfo6,1539737772856718,"Today's Senior Spotlight, Tiana Plagman!
Congratulations Tiana👩‍🎓🎓",https://facebook.com/story.php?story_fbid=1539737772856718&id=101089700054873,,0.0,"Today's Senior Spotlight, Tiana Plagman!
Congratulations Tiana👩‍🎓🎓",2020-04-27 22:29:28,,
79,0.0,,1.0,https://forms.gle/RYfPmLBAGmHYUynE6,1539459329551229,"Parents: Please be watching your emails OR click the link below to follow to take a survey, with feedback on the Distance Learning process. Thank you for taking the time to complete this! Your feedback is important to us as we continue through the rest of the year with on-line learning.
https://forms.gle/RYfPmLBAGmHYUynE6",https://facebook.com/story.php?story_fbid=1539459329551229&id=101089700054873,"DOCS.GOOGLE.COM
Distance Learning Family Feedback",0.0,"Parents: Please be watching your emails OR click the link below to follow to take a survey, with feedback on the Distance Learning process. Thank you for taking the time to complete this! Your feedback is important to us as we continue through the rest of the year with on-line learning.
https://forms.gle/RYfPmLBAGmHYUynE6

DOCS.GOOGLE.COM
Distance Learning Family Feedback",2020-04-27 14:20:03,,
80,2.0,,7.0,,1539445582885937,"Daily Announcements 4-27-2020 with spotlight letter ""I""
See comments for the Homemade Ice Cream recipe!",,,0.0,"Daily Announcements 4-27-2020 with spotlight letter ""I""
See comments for the Homemade Ice Cream recipe!",2020-04-27 13:57:59,https://video-atl3-1.xx.fbcdn.net/v/t42.9040-2/95513937_249005372958761_5363117781250211840_n.mp4?_nc_cat=108&_nc_sid=985c63&efg=eyJ2ZW5jb2RlX3RhZyI6ImxlZ2FjeV9zZCJ9&_nc_ohc=DoNEcLgae2MAX_0ZMP6&_nc_ht=video-atl3-1.xx&oh=d63fd3815410d787ab61abe2c1f4db69&oe=5F5D2E75,
81,0.0,,14.0,,1536905413139954,4-24-2020 Update from Mr. Hungerholt,,,0.0,4-24-2020 Update from Mr. Hungerholt,2020-04-24 15:37:09,https://video-atl3-1.xx.fbcdn.net/v/t42.9040-2/95192631_898045817286159_2909315236043423744_n.mp4?_nc_cat=101&_nc_sid=985c63&efg=eyJ2ZW5jb2RlX3RhZyI6ImxlZ2FjeV9zZCJ9&_nc_ohc=k0mdCBQ3fRgAX-ocw19&_nc_ht=video-atl3-1.xx&oh=48c5ef2ddfd5731bf554236f356bbc69&oe=5F5D314E,
82,0.0,,5.0,,1536800063150489,"**𝐔𝐏𝐃𝐀𝐓𝐄 - 𝐓𝐡𝐞 𝐦𝐞𝐞𝐭𝐢𝐧𝐠 𝐝𝐚𝐭𝐞 𝐡𝐚𝐬 𝐜𝐡𝐚𝐧𝐠𝐞𝐝 𝐟𝐫𝐨𝐦 𝐌𝐨𝐧𝐝𝐚𝐲. 𝟒-𝟐𝟕-𝟐𝟎 𝐓𝐨 𝐓𝐡𝐮𝐫𝐬𝐝𝐚𝐲 𝟒-𝟑𝟎-𝟐𝟎**

The school board will hold a special meeting on Thursday, April 30th, 2020, at 6:30pm.

Due to the current federal and state emergency declarations, the Minnesota directive to residents to stay at home, and guidance about limiting person-to-person contact due to the COVID-19 (coronavirus) pandemic, this meeting of the Leroy-Ostrander District #499 School Board is being conducted in accordance with Minnesota Statutes 13D.021— Meetings by Telephone or Other Electronic Means.

Due to the health pandemic, the school board determined that it is not feasible for at least one board member, the superintendent, or the school district’s legal counsel to be physically present at the regular meeting location and that it is not feasible for the public to attend this meeting at the regular meeting location due to the health pandemic.

Persons may monitor this meeting from a remote location by live stream via the district’s Facebook page.",https://facebook.com/story.php?story_fbid=1536800063150489&id=101089700054873,,0.0,"**𝐔𝐏𝐃𝐀𝐓𝐄 - 𝐓𝐡𝐞 𝐦𝐞𝐞𝐭𝐢𝐧𝐠 𝐝𝐚𝐭𝐞 𝐡𝐚𝐬 𝐜𝐡𝐚𝐧𝐠𝐞𝐝 𝐟𝐫𝐨𝐦 𝐌𝐨𝐧𝐝𝐚𝐲. 𝟒-𝟐𝟕-𝟐𝟎 𝐓𝐨 𝐓𝐡𝐮𝐫𝐬𝐝𝐚𝐲 𝟒-𝟑𝟎-𝟐𝟎**

The school board will hold a special meeting on Thursday, April 30th, 2020, at 6:30pm.

Due to the current federal and state emergency declarations, the Minnesota directive to residents to stay at home, and guidance about limiting person-to-person contact due to the COVID-19 (coronavirus) pandemic, this meeting of the Leroy-Ostrander District #499 School Board is being conducted in accordance with Minnesota Statutes 13D.021— Meetings by Telephone or Other Electronic Means.

Due to the health pandemic, the school board determined that it is not feasible for at least one board member, the superintendent, or the school district’s legal counsel to be physically present at the regular meeting location and that it is not feasible for the public to attend this meeting at the regular meeting location due to the health pandemic.

Persons may monitor this meeting from a remote location by live stream via the district’s Facebook page.",2020-04-24 12:51:22,,
83,0.0,,0.0,,1535787253251770,"What: School Board Superintendent Search Interviews Round 2 - Interview 1/2: Jennifer Backer-Johnson

When: Wed. April, 22nd 2020 at 5PM

Where: Online Recorded Zoom Meeting",,,0.0,"What: School Board Superintendent Search Interviews Round 2 - Interview 1/2: Jennifer Backer-Johnson

When: Wed. April, 22nd 2020 at 5PM

Where: Online Recorded Zoom Meeting",2020-04-23 22:50:00,https://video-atl3-1.xx.fbcdn.net/v/t42.9040-2/10000000_677114103056240_3442897109332787200_n.mp4?_nc_cat=103&_nc_sid=985c63&efg=eyJ2ZW5jb2RlX3RhZyI6ImxlZ2FjeV9zZCJ9&_nc_ohc=Yoe74w3ZSxoAX_P9WZ5&_nc_ht=video-atl3-1.xx&oh=5a42e3fc41c2aba1dadf00140c0b4e13&oe=5F5D293A,
84,0.0,,5.0,,1535890963241399,Daily Announcements 4-23-20,,,0.0,Daily Announcements 4-23-20,2020-04-23 13:01:55,https://video-atl3-1.xx.fbcdn.net/v/t42.9040-2/94220979_2717972855148936_8950797142914498560_n.mp4?_nc_cat=109&_nc_sid=985c63&efg=eyJ2ZW5jb2RlX3RhZyI6ImxlZ2FjeV9zZCJ9&_nc_ohc=qqi3MbW0FQUAX-P6xxV&_nc_ht=video-atl3-1.xx&oh=76bac9981373545689abf799a294e6d4&oe=5F5D2F3D,
85,2.0,,4.0,,1535791386584690,"What: School Board Superintendent Search Interviews Round 2 - Deliberations

When: Wed. April, 22nd, 2020 at 7:40PM

Where: Online Recorded Zoom Meeting",,,0.0,"What: School Board Superintendent Search Interviews Round 2 - Deliberations

When: Wed. April, 22nd, 2020 at 7:40PM

Where: Online Recorded Zoom Meeting",2020-04-23 11:00:02,https://video-atl3-1.xx.fbcdn.net/v/t42.9040-2/10000000_283408035994316_8134523644643639296_n.mp4?_nc_cat=103&_nc_sid=985c63&efg=eyJ2ZW5jb2RlX3RhZyI6ImxlZ2FjeV9zZCJ9&_nc_ohc=a-WeLOGiLIIAX9tWNIE&_nc_ht=video-atl3-1.xx&oh=e2271347f37c109ffe4470eb9d1be45a&oe=5F5D3504,
86,0.0,,3.0,,1535789766584852,"What: School Board Superintendent Search Interviews Round 2 - Interview 2/2: Paula Foley

When: Wed. April, 22nd 2020 at 6:15 PM

Where: Online Recorded Zoom Meeting",,,0.0,"What: School Board Superintendent Search Interviews Round 2 - Interview 2/2: Paula Foley

When: Wed. April, 22nd 2020 at 6:15 PM

Where: Online Recorded Zoom Meeting",2020-04-23 10:55:00,https://video-atl3-1.xx.fbcdn.net/v/t42.9040-2/10000000_513869576166234_8234971363350151168_n.mp4?_nc_cat=104&_nc_sid=985c63&efg=eyJ2ZW5jb2RlX3RhZyI6ImxlZ2FjeV9zZCJ9&_nc_ohc=flShRwwipUcAX_COApr&_nc_ht=video-atl3-1.xx&oh=e255496ef4769834d5ae152e851aea4d&oe=5F5D28B7,
87,14.0,,6.0,,286335812736804,"What: Regular Monthly School Board Meeting
When: Tuesday, April 21st, 2020 At 6:30PM
Where: Online Livestream Zoom Meeting",,,0.0,"What: Regular Monthly School Board Meeting
When: Tuesday, April 21st, 2020 At 6:30PM
Where: Online Livestream Zoom Meeting",2020-04-21 19:27:56,https://video-atl3-1.xx.fbcdn.net/v/t42.26565-2/10000000_637686557132156_3534403365584986657_n.mp4?_nc_cat=105&_nc_sid=985c63&efg=eyJ2ZW5jb2RlX3RhZyI6Im9lcF9zZCJ9&_nc_ohc=WiNq0y2SoZEAX_W7jXD&_nc_ht=video-atl3-1.xx&oh=dcf8e88a21603dff4f9d342baf921cb0&oe=5F5D30E6,
88,0.0,,25.0,https://www.instagram.com/p/B_QcoHSlDxv/?igshid=sw6sskcnlvo2,1534370896726739,"L-O Class of 2020 Senior Spotlight Nicole Freerksen👩‍🎓
Congratulations Nicole!",https://facebook.com/story.php?story_fbid=1534370896726739&id=101089700054873,,0.0,"L-O Class of 2020 Senior Spotlight Nicole Freerksen👩‍🎓
Congratulations Nicole!",2020-04-21 18:27:04,,
89,0.0,,8.0,,1534182833412212,"Today's Daily Announcements brought to you by spotlight letter ""G"". Stay tuned tomorrow for the letter ""H"" and be prepared for a magical day!",,,0.0,"Today's Daily Announcements brought to you by spotlight letter ""G"". Stay tuned tomorrow for the letter ""H"" and be prepared for a magical day!",2020-04-21 13:14:41,https://video-atl3-1.xx.fbcdn.net/v/t42.9040-2/93135431_230661348281149_182083029684977664_n.mp4?_nc_cat=101&_nc_sid=985c63&efg=eyJ2ZW5jb2RlX3RhZyI6ImxlZ2FjeV9zZCJ9&_nc_ohc=eUIziGJr-vUAX_mCDFY&_nc_ht=video-atl3-1.xx&oh=60d8308d3f8326689a1f7a9e38ee9fbb&oe=5F5D368B,
90,0.0,,5.0,,1531535350343627,"The school board will hold a special meeting on Wednesday, April 22nd, 2020 at 4:55PM.

Due to the current federal and state emergency declarations, the Minnesota directive to residents to stay at home, and guidance about limiting person-to-person contact due to the COVID-19 (coronavirus) pandemic, this meeting of the Leroy-Ostrander District #499 School Board is being conducted in accordance with Minnesota Statutes 13D.021— Meetings by Telephone or Other Electronic Means.

Due to the health pandemic, the school board determined that it is not feasible for at least one board member, the superintendent, or the school district’s legal counsel to be physically present at the regular meeting location and that it is not feasible for the public to attend this meeting at the regular meeting location due to the health pandemic.

Due to the integrity of the interview candidates, this meeting will not be live streamed but will be recorded in segments. Access to the recordings will be made available on the school district’s website/social media as soon as is reasonably possible.",https://facebook.com/story.php?story_fbid=1531535350343627&id=101089700054873,,0.0,"The school board will hold a special meeting on Wednesday, April 22nd, 2020 at 4:55PM.

Due to the current federal and state emergency declarations, the Minnesota directive to residents to stay at home, and guidance about limiting person-to-person contact due to the COVID-19 (coronavirus) pandemic, this meeting of the Leroy-Ostrander District #499 School Board is being conducted in accordance with Minnesota Statutes 13D.021— Meetings by Telephone or Other Electronic Means.

Due to the health pandemic, the school board determined that it is not feasible for at least one board member, the superintendent, or the school district’s legal counsel to be physically present at the regular meeting location and that it is not feasible for the public to attend this meeting at the regular meeting location due to the health pandemic.

Due to the integrity of the interview candidates, this meeting will not be live streamed but will be recorded in segments. Access to the recordings will be made available on the school district’s website/social media as soon as is reasonably possible.",2020-04-19 15:30:52,,
91,11.0,https://scontent-atl3-1.xx.fbcdn.net/v/t1.0-9/fr/cp0/e15/q65/93792433_1531532963677199_3507049670033539072_n.jpg?_nc_cat=104&_nc_sid=8024bb&_nc_ohc=dDkoKO-DuXAAX_6eNg9&_nc_ht=scontent-atl3-1.xx&tp=14&oh=a5afd9bab503d03da1d965160cb2e491&oe=5F82352D,96.0,,1531533927010436,Just a quick Thank You to all the Business and Community Members that contributed and gave all of our seniors a T-Shirt and Yard sign! Picture Courtesy of Jamie Sager.,https://facebook.com/story.php?story_fbid=1531533927010436&id=101089700054873,,0.0,Just a quick Thank You to all the Business and Community Members that contributed and gave all of our seniors a T-Shirt and Yard sign! Picture Courtesy of Jamie Sager.,2020-04-18 14:13:18,,
92,0.0,,0.0,,1530645577099271,,https://facebook.com/story.php?story_fbid=1530645577099271&id=101089700054873,,0.0,,2020-04-17 14:21:42,,
93,1.0,,25.0,,1530561907107638,Good Morning everyone!!! Today's Daily Announcements for 4-17-2020 live from the L-O Ag Greenhouse🌼🌻🌹⚘,,,0.0,Good Morning everyone!!! Today's Daily Announcements for 4-17-2020 live from the L-O Ag Greenhouse🌼🌻🌹⚘,2020-04-17 12:20:44,https://video-atl3-1.xx.fbcdn.net/v/t42.9040-2/94058286_529287181286157_3340406536676573184_n.mp4?_nc_cat=111&_nc_sid=985c63&efg=eyJ2ZW5jb2RlX3RhZyI6ImxlZ2FjeV9zZCJ9&_nc_ohc=zMJrtQ8KlxkAX8Y3_wt&_nc_ht=video-atl3-1.xx&oh=d306df22aaed698af256175dbdbefef7&oe=5F5D2DE0,
94,0.0,,1.0,,1529482753882220,"School Board Superintendent Search Interviews - Round 1 - Interview 3/3

Interviewee: Becky Gerdes
Time: Wed 4/15/2020 6:25 PM - 7:40 PM
Place: Online Zoom Meeting",,,0.0,"School Board Superintendent Search Interviews - Round 1 - Interview 3/3

Interviewee: Becky Gerdes
Time: Wed 4/15/2020 6:25 PM - 7:40 PM
Place: Online Zoom Meeting",2020-04-16 11:30:02,https://video-atl3-1.xx.fbcdn.net/v/t42.9040-2/10000000_293518728297672_5456674899240157184_n.mp4?_nc_cat=107&_nc_sid=985c63&efg=eyJ2ZW5jb2RlX3RhZyI6ImxlZ2FjeV9zZCJ9&_nc_ohc=QdMzTncdUJAAX8zYzA5&_nc_ht=video-atl3-1.xx&oh=f21dc395a9309c0f20ab5d7425c2171f&oe=5F5D2CDB,
95,0.0,,1.0,,1529488073881688,"Deliberations on all first-round interviewees and deciding which interviewee will be in round 2 of the interviews on Wed. April 22nd

Time: 7:45 PM - 9:15 PM
Place: Online Zoom Meeting",,,0.0,"Deliberations on all first-round interviewees and deciding which interviewee will be in round 2 of the interviews on Wed. April 22nd

Time: 7:45 PM - 9:15 PM
Place: Online Zoom Meeting",2020-04-16 11:30:01,https://video-atl3-1.xx.fbcdn.net/v/t42.9040-2/10000000_890511614733270_6751636985279938560_n.mp4?_nc_cat=106&_nc_sid=985c63&efg=eyJ2ZW5jb2RlX3RhZyI6ImxlZ2FjeV9zZCJ9&_nc_ohc=VoHPDLSaxZEAX_b6teB&_nc_ht=video-atl3-1.xx&oh=354f2d5cf9343e27726502495aaa7b87&oe=5F5D310D,
96,0.0,,0.0,,1529481267215702,"School Board Superintendent Search Interviews - Round 1 - Interview 2/3

Interviewee: Jennifer Backer-Johnson
Time: Wed 4/15/2020 5:10 PM - 6:25 PM
Place: Online Zoom Meeting",,,0.0,"School Board Superintendent Search Interviews - Round 1 - Interview 2/3

Interviewee: Jennifer Backer-Johnson
Time: Wed 4/15/2020 5:10 PM - 6:25 PM
Place: Online Zoom Meeting",2020-04-16 11:30:01,https://video-atl3-1.xx.fbcdn.net/v/t42.9040-2/10000000_2963912723669457_4609958174559043584_n.mp4?_nc_cat=102&_nc_sid=985c63&efg=eyJ2ZW5jb2RlX3RhZyI6ImxlZ2FjeV9zZCJ9&_nc_ohc=GV1NGKV0oiEAX9YjkhX&_nc_ht=video-atl3-1.xx&oh=36e60bc80c6243dcd17b4400eaa90efd&oe=5F5D2B08,
97,0.0,,1.0,,1529478003882695,"School Board Superintendent Search Interviews Round 1 - Interview 1/3

Interviewee: Paula Foley
Time: 4/15/2020 3:55 PM - 5:10 PM
Place: Online Zoom Meeting",,,0.0,"School Board Superintendent Search Interviews Round 1 - Interview 1/3

Interviewee: Paula Foley
Time: 4/15/2020 3:55 PM - 5:10 PM
Place: Online Zoom Meeting",2020-04-16 11:30:00,https://video-atl3-1.xx.fbcdn.net/v/t42.9040-2/10000000_268639020814468_1925325210483949568_n.mp4?_nc_cat=106&_nc_sid=985c63&efg=eyJ2ZW5jb2RlX3RhZyI6ImxlZ2FjeV9zZCJ9&_nc_ohc=o9ePTrrOOUwAX8Gyqlc&_nc_ht=video-atl3-1.xx&oh=5a4e3e69430c8409220fab2d4b8b4f86&oe=5F5D2D9A,
98,0.0,,1.0,https://www.instagram.com/tv/B_C5cmvFQ31/?igshid=1qowr8ac2coqu,1529520287211800,"Daily Announcements 4-16-20 spotlight letter ""E""
https://www.instagram.com/tv/B_C5cmvFQ31/?igshid=1qowr8ac2coqu",https://facebook.com/story.php?story_fbid=1529520287211800&id=101089700054873,,0.0,"Daily Announcements 4-16-20 spotlight letter ""E""
https://www.instagram.com/tv/B_C5cmvFQ31/?igshid=1qowr8ac2coqu",2020-04-16 11:02:16,,
99,0.0,,23.0,https://instagram.com/lo_seniors2020?igshid=535orz7g3c7i,1528974333933062,"A look at our graduating Class of 2020! We would LOVE to see you all Seniors❤ #thisonesforyou
https://instagram.com/lo_seniors2020?igshid=535orz7g3c7i",https://facebook.com/story.php?story_fbid=1528974333933062&id=101089700054873,"INSTAGRAM.COM
@lo_seniors2020 • Instagram photos and videos",5.0,"A look at our graduating Class of 2020! We would LOVE to see you all Seniors❤ #thisonesforyou
https://instagram.com/lo_seniors2020?igshid=535orz7g3c7i

INSTAGRAM.COM
@lo_seniors2020 • Instagram photos and videos",2020-04-15 19:55:13,,
100,0.0,,14.0,,1528765513953944,4-15-2020 An update from Mr. Hungerholt,,,0.0,4-15-2020 An update from Mr. Hungerholt,2020-04-15 14:25:48,https://video-atl3-1.xx.fbcdn.net/v/t42.9040-2/93418668_692477324858456_5431743644879028224_n.mp4?_nc_cat=101&_nc_sid=985c63&efg=eyJ2ZW5jb2RlX3RhZyI6ImxlZ2FjeV9zZCJ9&_nc_ohc=aN1wer3j9jQAX8hDC4r&_nc_ht=video-atl3-1.xx&oh=35eed49d05529ae62242d8175fdbfc55&oe=5F5D2AC3,
101,0.0,,3.0,,1528581363972359,"Today's Daily Announcements 4-15-20 brought to you today by the letter ""D"" for dinosaur!",,,0.0,"Today's Daily Announcements 4-15-20 brought to you today by the letter ""D"" for dinosaur!",2020-04-15 10:43:34,https://video-atl3-1.xx.fbcdn.net/v/t42.9040-2/93497886_1230624280646358_7163105843058049024_n.mp4?_nc_cat=110&_nc_sid=985c63&efg=eyJ2ZW5jb2RlX3RhZyI6ImxlZ2FjeV9zZCJ9&_nc_ohc=UQCyeTz54D4AX8uiD5l&_nc_ht=video-atl3-1.xx&oh=be299aabb3cabb0e7a78e41636034b82&oe=5F5D28B6,
102,0.0,,11.0,,1527867727377056,Daily Announcements 4-14-20 a little late in the day. Stay tuned for tomorrow as we go on a dinosaur hunt!,,,0.0,Daily Announcements 4-14-20 a little late in the day. Stay tuned for tomorrow as we go on a dinosaur hunt!,2020-04-14 16:08:46,https://video-atl3-1.xx.fbcdn.net/v/t42.9040-2/92424308_2635370226568399_8527950105020465152_n.mp4?_nc_cat=110&_nc_sid=985c63&efg=eyJ2ZW5jb2RlX3RhZyI6ImxlZ2FjeV9zZCJ9&_nc_ohc=NBno6IaftLoAX8Jc4gY&_nc_ht=video-atl3-1.xx&oh=3c83d261533fdd90025283b4763f90cb&oe=5F5D2E82,
103,1.0,,5.0,https://www.leroy.k12.mn.us/page/2502,1527647100732452,"2020-2021 Early Learners and Preschool Registration:

The new parent meeting scheduled for May 6th at the school, has been canceled.

For children to be enrolled in Early Learners, they will need to be age 3 by September 1, 2020. For children to be enrolled in Preschool, they will need to be age 4 by September 1, 2020. Children also need to be potty trained.

There are a few options for you to turn in registration forms:
• Mail them directly to the school. The address is LeRoy-Ostrander Public School, Attn: Preschool, 406 W Main St., LeRoy, MN 55951.
• Drop them off during school office hours Monday-Thursday 8am-3pm. Address the forms Attn: Preschool.
• Scan and email the forms to Paige Ulwelling pulwelling@leroy.k12.mn.us. Registration forms can be downloaded from the school website at https://www.leroy.k12.mn.us/page/2502.

If there are any questions or concerns, you are able to reach the Preschool/Early Learners Teacher, Paige Ulwelling, by email at pulwelling@leroy.k12.mn.us.",https://facebook.com/story.php?story_fbid=1527647100732452&id=101089700054873,"LEROY.K12.MN.US
Paige Ulwelling - Preschool - LeRoy-Ostrander Public School",4.0,"2020-2021 Early Learners and Preschool Registration:

The new parent meeting scheduled for May 6th at the school, has been canceled.

For children to be enrolled in Early Learners, they will need to be age 3 by September 1, 2020. For children to be enrolled in Preschool, they will need to be age 4 by September 1, 2020. Children also need to be potty trained.

There are a few options for you to turn in registration forms:
• Mail them directly to the school. The address is LeRoy-Ostrander Public School, Attn: Preschool, 406 W Main St., LeRoy, MN 55951.
• Drop them off during school office hours Monday-Thursday 8am-3pm. Address the forms Attn: Preschool.
• Scan and email the forms to Paige Ulwelling pulwelling@leroy.k12.mn.us. Registration forms can be downloaded from the school website at https://www.leroy.k12.mn.us/page/2502.

If there are any questions or concerns, you are able to reach the Preschool/Early Learners Teacher, Paige Ulwelling, by email at pulwelling@leroy.k12.mn.us.

LEROY.K12.MN.US
Paige Ulwelling - Preschool - LeRoy-Ostrander Public School",2020-04-14 10:52:32,,
104,0.0,,13.0,https://www.instagram.com/p/B-xhX9IF5hf/?igshid=1483azytiz3kx,1523210184509477,"And your Daily Announcements 4-9-20 brought to you by the letter ""C"" 🐱",https://facebook.com/story.php?story_fbid=1523210184509477&id=101089700054873,,0.0,"And your Daily Announcements 4-9-20 brought to you by the letter ""C"" 🐱",2020-04-09 17:04:14,,
105,0.0,,10.0,https://suicidepreventionlifeline.org/,1523197294510766,,https://facebook.com/story.php?story_fbid=1523197294510766&id=101089700054873,,8.0,,2020-04-09 16:37:42,,
106,0.0,,10.0,,1522450841252078,Special School Board Meeting 4-8-20,https://facebook.com/story.php?story_fbid=1522450841252078&id=101089700054873,"Gary A Lee was live in Special School Board Meeting 4-8-20.
April 8 at 11:29 PM ·",0.0,"Special School Board Meeting 4-8-20

Gary A Lee was live in Special School Board Meeting 4-8-20.
April 8 at 11:29 PM ·",2020-04-08 19:29:55,https://video-atl3-1.xx.fbcdn.net/v/t42.26565-2/10000000_716902502487899_647382920596377308_n.mp4?_nc_cat=109&_nc_sid=985c63&efg=eyJ2ZW5jb2RlX3RhZyI6Im9lcF9zZCJ9&_nc_ohc=IM8fIt-hyCsAX8hioTb&_nc_ht=video-atl3-1.xx&oh=cb405b32fff6d77bb60e9203e5729ba8&oe=5F5D28D5,
107,1.0,,5.0,,1522246447939184,Daily Announcements 4-8-2020 brought to you somewhere on a beach!,,,0.0,Daily Announcements 4-8-2020 brought to you somewhere on a beach!,2020-04-08 13:36:55,https://video-atl3-1.xx.fbcdn.net/v/t42.9040-2/91856075_521659258737398_308220055890427904_n.mp4?_nc_cat=100&_nc_sid=985c63&efg=eyJ2ZW5jb2RlX3RhZyI6ImxlZ2FjeV9zZCJ9&_nc_ohc=2hsSqtwN7hEAX9QTbAo&_nc_oc=AQkGaCIOmvNVUvUn2G14vPMfrcrhTnn30ma0aBP-hubICQPLthmBVeG8PxdizunxR5w&_nc_ht=video-atl3-1.xx&oh=63f61625884027376b17c52606215cd6&oe=5F5D2D17,
108,2.0,,36.0,,1521405828023246,Today...we went on a safari adventure for our daily announcements 4-7-2020! Stay tuned for tomorrow's beach themed announcements!,,,0.0,Today...we went on a safari adventure for our daily announcements 4-7-2020! Stay tuned for tomorrow's beach themed announcements!,2020-04-07 13:46:02,https://video-atl3-1.xx.fbcdn.net/v/t42.9040-2/92483570_221188335798550_3425781900881428480_n.mp4?_nc_cat=101&_nc_sid=985c63&efg=eyJ2ZW5jb2RlX3RhZyI6ImxlZ2FjeV9zZCJ9&_nc_ohc=0h-3wblqiMQAX_CoR67&_nc_ht=video-atl3-1.xx&oh=4f8f0fe510e5e564bd310d0fd9f79fea&oe=5F5D2D3F,
109,1.0,,17.0,,1520822494748246,"Every Monday night, beginning at 8:30 until 8:50, the football field lights will shine bright, to show that happiness can be found, even in the darkest of times, if we only remember to turn on the light.
#bethelightmn",https://facebook.com/story.php?story_fbid=1520822494748246&id=101089700054873,"LeRoy-Ostrander Public School
April 3 at 5:07 PM ·

Once you choose hope, anything's possible
#bethelight #cardinalstrong
Photo courtesy of George Kroeker",3.0,"Every Monday night, beginning at 8:30 until 8:50, the football field lights will shine bright, to show that happiness can be found, even in the darkest of times, if we only remember to turn on the light.
#bethelightmn

LeRoy-Ostrander Public School
April 3 at 5:07 PM ·

Once you choose hope, anything's possible
#bethelight #cardinalstrong
Photo courtesy of George Kroeker",2020-04-06 21:36:05,,
110,3.0,https://scontent-atl3-1.xx.fbcdn.net/v/t1.0-9/fr/cp0/e15/q65/92021092_1520665954763900_4293769816168202240_n.jpg?_nc_cat=109&_nc_sid=2d5d41&_nc_ohc=qhtZpV1cK4MAX_2i-tU&_nc_ht=scontent-atl3-1.xx&tp=14&oh=2d735d4158282e43ea4d5b4697dc1f5a&oe=5F828DD7,29.0,,1520665951430567,"We are starting a community ""Food Shelf"" for anybody that is struggling during these tough times. We will place a cabinet by the pool with the words ""Cardinal Hope"" decorated on it. This cabinet can be filled with non perishable food items and home essentials (IE: Toilet paper, cleaning supplies, sanitizers, etc)

During these tough times, we are looking to bring ""hope"" to those that are struggling. With people losing their income, it's essential for this great community to band together and help one another.

If you have things that you would be willing to donate to this cause, please don't hesitate to bring them to the ""Cardinal Hope Cabinet."" It will be out tomorrow afternoon.

#staystrong #family #cardinalpride #cardinalhope",,,0.0,"We are starting a community ""Food Shelf"" for anybody that is struggling during these tough times. We will place a cabinet by the pool with the words ""Cardinal Hope"" decorated on it. This cabinet can be filled with non perishable food items and home essentials (IE: Toilet paper, cleaning supplies, sanitizers, etc)

During these tough times, we are looking to bring ""hope"" to those that are struggling. With people losing their income, it's essential for this great community to band together and help one another.

If you have things that you would be willing to donate to this cause, please don't hesitate to bring them to the ""Cardinal Hope Cabinet."" It will be out tomorrow afternoon.

#staystrong #family #cardinalpride #cardinalhope",2020-04-06 16:38:44,,
111,1.0,,22.0,,1520569264773569,Today is......April 6th - excuse me as I forgot what day it was 😁 & here are your daily announcements!,,,0.0,Today is......April 6th - excuse me as I forgot what day it was 😁 & here are your daily announcements!,2020-04-06 13:57:49,https://video-atl3-1.xx.fbcdn.net/v/t42.9040-2/92611131_312286129745689_8588699217671749632_n.mp4?_nc_cat=104&_nc_sid=985c63&efg=eyJ2ZW5jb2RlX3RhZyI6ImxlZ2FjeV9zZCJ9&_nc_ohc=SUZ2N9BVp_gAX8UvK5t&_nc_ht=video-atl3-1.xx&oh=1c179c8f45d631822cd640cda8091c08&oe=5F5D3607,
112,3.0,https://scontent-atl3-1.xx.fbcdn.net/v/t1.0-9/fr/cp0/e15/q65/91703931_1517986721698490_6866105903897116672_o.jpg?_nc_cat=109&_nc_sid=8024bb&_nc_ohc=CQh8g-aBr08AX-BnqQU&_nc_oc=AQlsYDFHofheCOR9r8_smJc76HYC9_1LQtuoDGEMyPxrGLk2TU1HZYcBCFAeUGAMKV0&_nc_ht=scontent-atl3-1.xx&tp=14&oh=de249c9ad6421c56d0d951cdbac06b3d&oe=5F849222,42.0,,1517987338365095,"Once you choose hope, anything's possible
#bethelight #cardinalstrong
Photo courtesy of George Kroeker",https://facebook.com/story.php?story_fbid=1517987338365095&id=101089700054873,,0.0,"Once you choose hope, anything's possible
#bethelight #cardinalstrong
Photo courtesy of George Kroeker",2020-04-03 13:07:00,,
113,0.0,,21.0,,1517943088369520,Daily announcements and update from Mr. Hungerholt.,,,0.0,Daily announcements and update from Mr. Hungerholt.,2020-04-03 11:59:46,https://video-atl3-1.xx.fbcdn.net/v/t42.9040-2/92154458_639527636624760_5413379094865772544_n.mp4?_nc_cat=110&_nc_sid=985c63&efg=eyJ2ZW5jb2RlX3RhZyI6ImxlZ2FjeV9zZCJ9&_nc_ohc=2LbShH_0TrAAX8s0eYQ&_nc_ht=video-atl3-1.xx&oh=b9b651ba333ad174192c551956476393&oe=5F5D3256,
114,0.0,,4.0,,1517154948448334,"*UPDATED*

There will be a special meeting of the Leroy-Ostrander School Board on Wednesday, April 8th, at 6:30PM remotely via Zoom.

Due to the current federal and state emergency declarations and guidance about limiting person-to-person contact due to the COVID-19 (coronavirus) pandemic, this meeting will be conducted in accordance with Minnesota Statutes 13D.021 Meetings by Telephone or Other Electronic Means. One or more board meetings may participate by telephone or other electronic means. In accordance with Minnesota Statutes 13D.021, members of the public are not permitted to attend this meeting due to the current health pandemic. The district will live stream the meeting via the district's social media.

The recorded version of this meeting will also be posted to the district's Facebook page for later viewing.",https://facebook.com/story.php?story_fbid=1517154948448334&id=101089700054873,,0.0,"*UPDATED*

There will be a special meeting of the Leroy-Ostrander School Board on Wednesday, April 8th, at 6:30PM remotely via Zoom.

Due to the current federal and state emergency declarations and guidance about limiting person-to-person contact due to the COVID-19 (coronavirus) pandemic, this meeting will be conducted in accordance with Minnesota Statutes 13D.021 Meetings by Telephone or Other Electronic Means. One or more board meetings may participate by telephone or other electronic means. In accordance with Minnesota Statutes 13D.021, members of the public are not permitted to attend this meeting due to the current health pandemic. The district will live stream the meeting via the district's social media.

The recorded version of this meeting will also be posted to the district's Facebook page for later viewing.",2020-04-02 15:03:02,,
115,0.0,,18.0,,1517063468457482,"4-2-2020 Some sweet, sweet music during announcements this morning!",,,0.0,"4-2-2020 Some sweet, sweet music during announcements this morning!",2020-04-02 12:55:55,https://video-atl3-1.xx.fbcdn.net/v/t42.9040-2/91703022_849894815477496_8655618312836743168_n.mp4?_nc_cat=104&_nc_sid=985c63&efg=eyJ2ZW5jb2RlX3RhZyI6ImxlZ2FjeV9zZCJ9&_nc_ohc=1rNXCyIJhVUAX9eCaCd&_nc_ht=video-atl3-1.xx&oh=14895326a90cfb17dab8df50efcc5ac0&oe=5F5D2961,
116,0.0,,12.0,,1516298208534008,April Fool's.... today's announcements are brought to you from Raphael and the rest of the gang!🐢🐢🐢🐢,,,0.0,April Fool's.... today's announcements are brought to you from Raphael and the rest of the gang!🐢🐢🐢🐢,2020-04-01 14:06:35,https://video-atl3-1.xx.fbcdn.net/v/t42.9040-2/91326331_662920437838809_6987228650273767424_n.mp4?_nc_cat=110&_nc_sid=985c63&efg=eyJ2ZW5jb2RlX3RhZyI6ImxlZ2FjeV9zZCJ9&_nc_ohc=SOW9oLHs6X8AX_Sg5aR&_nc_ht=video-atl3-1.xx&oh=61b471a7745bf413955254baee5de2d4&oe=5F5D3341,
117,0.0,,23.0,,1515282768635552,Happy 1st day of Distance Learning!!!,,,0.0,Happy 1st day of Distance Learning!!!,2020-03-31 11:19:34,https://video-atl3-1.xx.fbcdn.net/v/t42.9040-2/91167330_226635778392230_2697834748650192896_n.mp4?_nc_cat=104&_nc_sid=985c63&efg=eyJ2ZW5jb2RlX3RhZyI6ImxlZ2FjeV9zZCJ9&_nc_ohc=fSG4EsBzlZQAX-_WpNH&_nc_ht=video-atl3-1.xx&oh=3ae31de12f1ddb9763876566a9a2e0fc&oe=5F5D3302,
118,3.0,,27.0,,1511795262317636,Announcements with a Class of 2020 tribute❤,,,0.0,Announcements with a Class of 2020 tribute❤,2020-03-27 15:13:00,https://video-atl3-1.xx.fbcdn.net/v/t42.9040-2/91056555_2695442854010418_8077085685489598464_n.mp4?_nc_cat=107&_nc_sid=985c63&efg=eyJ2ZW5jb2RlX3RhZyI6ImxlZ2FjeV9zZCJ9&_nc_ohc=NZ-A73xJrxQAX--juKY&_nc_ht=video-atl3-1.xx&oh=b198cd9a0d2ea1edc636bb47b9a6a762&oe=5F5D34CE,
119,2.0,,36.0,,1511639315666564,An update from Mr. Hungerholt,,,0.0,An update from Mr. Hungerholt,2020-03-27 12:03:51,https://video-atl3-1.xx.fbcdn.net/v/t42.9040-2/91205000_518683932387020_4770386382864515072_n.mp4?_nc_cat=109&_nc_sid=985c63&efg=eyJ2ZW5jb2RlX3RhZyI6ImxlZ2FjeV9zZCJ9&_nc_ohc=KmnonxoBkYEAX94OBmx&_nc_oc=AQnJCv05cThiP0X7xUtPXrw4wgqdhm10bsrM4WQQCjJdP6-UjD4dLlle-kyV4ffvP3g&_nc_ht=video-atl3-1.xx&oh=335028e8e3821f97b00401fef45a862f&oe=5F5D29B9,
120,0.0,,19.0,,1510865389077290,Announcements live from Mrs. Olson's room,,,0.0,Announcements live from Mrs. Olson's room,2020-03-26 15:12:54,https://video-atl3-1.xx.fbcdn.net/v/t42.9040-2/90893721_216859106060996_8128781887549210624_n.mp4?_nc_cat=107&_nc_sid=985c63&efg=eyJ2ZW5jb2RlX3RhZyI6ImxlZ2FjeV9zZCJ9&_nc_ohc=QSfUpaxPZXYAX-QJrUj&_nc_oc=AQlf7hv1GjPXhtnWMvS1YQZtO49hbRphM2GT6QbjN5EKAEiUsShPlCrVXKPaJnYACl4&_nc_ht=video-atl3-1.xx&oh=74d4c7d0c5a1e7d15f3f27174cf9bc50&oe=5F5D2F04,
121,0.0,,21.0,,1509899609173868,Announcements live from Mr. Hungerholt's office,,,0.0,Announcements live from Mr. Hungerholt's office,2020-03-25 14:08:44,https://video-atl3-1.xx.fbcdn.net/v/t42.9040-2/90962703_249844639377721_9186329241006899200_n.mp4?_nc_cat=110&_nc_sid=985c63&efg=eyJ2ZW5jb2RlX3RhZyI6ImxlZ2FjeV9zZCJ9&_nc_ohc=HvoyF4ym1-oAX87HLdj&_nc_ht=video-atl3-1.xx&oh=c04ee5889351fe548e57da9dead4e5eb&oe=5F5D2C58,
122,17.0,,51.0,,1509892385841257,We miss our students here in the building. So we made a little video for everybody.,,,0.0,We miss our students here in the building. So we made a little video for everybody.,2020-03-25 13:58:38,https://video-atl3-1.xx.fbcdn.net/v/t42.9040-2/90840904_256611938702281_5049545955590799360_n.mp4?_nc_cat=107&_nc_sid=985c63&efg=eyJ2ZW5jb2RlX3RhZyI6ImxlZ2FjeV9zZCJ9&_nc_ohc=f12fYa8OLpgAX_5G-Qg&_nc_ht=video-atl3-1.xx&oh=85bf90de2b7fb4e247b8ae17ff49b2a4&oe=5F5D34CF,
123,5.0,,30.0,,1509012509262578,Live from nurse Emily's office today! Stay healthy and strong Cardinal Nation!!!,,,0.0,Live from nurse Emily's office today! Stay healthy and strong Cardinal Nation!!!,2020-03-24 14:30:41,https://video-atl3-1.xx.fbcdn.net/v/t42.9040-2/90799892_228103698342041_4319341634836758528_n.mp4?_nc_cat=109&_nc_sid=985c63&efg=eyJ2ZW5jb2RlX3RhZyI6ImxlZ2FjeV9zZCJ9&_nc_ohc=IDeBpkJxmboAX8VEGot&_nc_ht=video-atl3-1.xx&oh=b5255aa0bf0e1e4196e39c6e7a413c2f&oe=5F5D3057,
124,0.0,,0.0,https://www.surveymonkey.com/r/ZK88BTZ,1508251886005307,"Again, here is the link to take the technology/internet survey. We have extended the deadline to complete the survey through tonight in hopes of getting a few more results in. Thank you for your help with this!
https://www.surveymonkey.com/r/ZK88BTZ",https://facebook.com/story.php?story_fbid=1508251886005307&id=101089700054873,"SURVEYMONKEY.COM
Parent Feedback Survey",3.0,"Again, here is the link to take the technology/internet survey. We have extended the deadline to complete the survey through tonight in hopes of getting a few more results in. Thank you for your help with this!
https://www.surveymonkey.com/r/ZK88BTZ

SURVEYMONKEY.COM
Parent Feedback Survey",2020-03-23 18:03:21,,
125,15.0,,67.0,,1507976479366181,"Your daily announcements for Monday, March 23. Stay tuned throughout the week for more daily announcements including myself and staff members!",,,0.0,"Your daily announcements for Monday, March 23. Stay tuned throughout the week for more daily announcements including myself and staff members!",2020-03-23 11:27:33,https://video-atl3-1.xx.fbcdn.net/v/t42.9040-2/90863624_1078103122547327_650968998845874176_n.mp4?_nc_cat=105&_nc_sid=985c63&efg=eyJ2ZW5jb2RlX3RhZyI6ImxlZ2FjeV9zZCJ9&_nc_ohc=XXYzQkRUdWwAX8Q7bIX&_nc_ht=video-atl3-1.xx&oh=303c120880c993e044509d06e33906d3&oe=5F5D2A04,
126,3.0,https://scontent-atl3-1.xx.fbcdn.net/v/t1.0-9/fr/cp0/e15/q65/90149865_1504485629715266_4884725726613340160_o.jpg?_nc_cat=103&_nc_sid=8024bb&_nc_ohc=T3bbivvaezkAX_y6Yd6&_nc_ht=scontent-atl3-1.xx&tp=14&oh=0f47beea735c4b78e2f8d8aa00ac926b&oe=5F82D32D,7.0,,1504546886375807,❤️,https://facebook.com/story.php?story_fbid=1504546886375807&id=101089700054873,"LeRoy-Ostrander Public School
March 19 at 7:00 PM ·

It's been a busy week here at LO Schools as our staff works very hard to come up with plans and ideas for our students for distant learning in these unprecedented times.

As such, we would like to give a special thank you to Terry and Nicholette Free for their very kind and generous donations of snacks and beverages to all the staff members here!

As well as another special thank you to the Gumbel Family for their token of gratitude and support for all staff members during these long days!",0.0,"❤️

LeRoy-Ostrander Public School
March 19 at 7:00 PM ·

It's been a busy week here at LO Schools as our staff works very hard to come up with plans and ideas for our students for distant learning in these unprecedented times.

As such, we would like to give a special thank you to Terry and Nicholette Free for their very kind and generous donations of snacks and beverages to all the staff members here!

As well as another special thank you to the Gumbel Family for their token of gratitude and support for all staff members during these long days!",2020-03-19 15:19:08,,
127,9.0,https://scontent-atl3-1.xx.fbcdn.net/v/t1.0-9/fr/cp0/e15/q65/90149865_1504485629715266_4884725726613340160_o.jpg?_nc_cat=103&_nc_sid=8024bb&_nc_ohc=T3bbivvaezkAX_y6Yd6&_nc_ht=scontent-atl3-1.xx&tp=14&oh=0f47beea735c4b78e2f8d8aa00ac926b&oe=5F82D32D,63.0,,1504486176381878,"It's been a busy week here at LO Schools as our staff works very hard to come up with plans and ideas for our students for distant learning in these unprecedented times.

As such, we would like to give a special thank you to Terry and Nicholette Free for their very kind and generous donations of snacks and beverages to all the staff members here!

As well as another special thank you to the Gumbel Family for their token of gratitude and support for all staff members during these long days!",https://facebook.com/story.php?story_fbid=1504486176381878&id=101089700054873,,0.0,"It's been a busy week here at LO Schools as our staff works very hard to come up with plans and ideas for our students for distant learning in these unprecedented times.

As such, we would like to give a special thank you to Terry and Nicholette Free for their very kind and generous donations of snacks and beverages to all the staff members here!

As well as another special thank you to the Gumbel Family for their token of gratitude and support for all staff members during these long days!",2020-03-19 15:00:34,,
128,6.0,,4.0,,207067710361379,Regular School Board Meeting | March 2020,,,0.0,Regular School Board Meeting | March 2020,2020-03-17 19:19:22,https://video-atl3-1.xx.fbcdn.net/v/t42.1790-2/10000000_2500415913555364_3117922407291198261_n.mp4?_nc_cat=111&vs=16a5ce5acd19c5a6&_nc_vs=HBksFQAYJEdJQ1dtQUNrZFZGeUhlSUlBRFdiMHZQb0ZVVXJidjRHQUFBRhUAAsgBABUAGCRHSUNXbUFBWG81U21USHdDQUx2RjNiRVpHUVlaYnY0R0FBQUYVAgLIAQAoRC1pICclcycgLWZiX3VzZV90ZmR0X3N0YXJ0dGltZSAxIC1pICclcycgLWMgY29weSAtbW92ZmxhZ3MgZmFzdHN0YXJ0KwGIEnByb2dyZXNzaXZlX3JlY2lwZQExFQAlABwAABgBMBbI4svL9pReFQIoAkMzGANhdjEcF0Cus%2FGp%2B%2BdtGBlkYXNoX2xpdmVfbWRfZnJhZ18yX3ZpZGVvEgAYGHZpZGVvcy52dHMuY2FsbGJhY2sucHJvZBkcFQAV8rYEACgSVklERU9fVklFV19SRVFVRVNUGweIFW9lbV90YXJnZXRfZW5jb2RlX3RhZwZvZXBfc2QTb2VtX3JlcXVlc3RfdGltZV9tcw0xNTk5OTMzNTQ1MzIwDG9lbV9jZmdfcnVsZQp3YXNsaXZlX3NkE29lbV9yb2lfcmVhY2hfY291bnQFMSwwODYMb2VtX3ZpZGVvX2lkDzIwNzA2NzcxMDM2MTM3ORJvZW1fdmlkZW9fYXNzZXRfaWQPMjA3MDY3NzAzNjk0NzEzFW9lbV92aWRlb19yZXNvdXJjZV9pZA8yMDcwNjc3MDAzNjEzODAlBBwAAA%3D%3D&_nc_sid=a6057a&efg=eyJ2ZW5jb2RlX3RhZyI6Im9lcF9zZCJ9&_nc_ohc=qSotfa9v7WYAX-riEiM&_nc_ht=video-atl3-1.xx&oh=9d93d55385581490ef2464c2f580c02f&oe=5F5D2C48&_nc_rid=426a5a7224174da,
129,1.0,https://scontent-atl3-1.xx.fbcdn.net/v/t1.0-9/fr/cp0/e15/q65/90022567_1502523896578106_3109134569400434688_o.jpg?_nc_cat=108&_nc_sid=8024bb&_nc_ohc=ioIUjcd1uSwAX9bdDyN&_nc_oc=AQmZp1s2WmO3vF0DGyAjr1b5zI2_omUtlMGegEeUtYRFARdz2MAyFknOTk-MV0yq_Hs&_nc_ht=scontent-atl3-1.xx&tp=14&oh=0f62caeecaa0ae9f1b9b6c2dd4e4ea24&oe=5F831106,12.0,,1502525923244570,"Meals available beginning Wednesday, March 18th, 2020",https://facebook.com/story.php?story_fbid=1502525923244570&id=101089700054873,,0.0,"Meals available beginning Wednesday, March 18th, 2020",2020-03-17 10:36:26,,
130,0.0,https://scontent-atl3-1.xx.fbcdn.net/v/t1.0-9/fr/cp0/e15/q65/90308820_1501081690055660_3331773149900439552_o.jpg?_nc_cat=103&_nc_sid=2d5d41&_nc_ohc=J50skaeXmjMAX8Fwjf6&_nc_ht=scontent-atl3-1.xx&tp=14&oh=959d4fa45938a2a39977c6e13ddbd6b7&oe=5F842AEB,12.0,,1501081683388994,,,,0.0,,2020-03-15 17:59:38,,
131,0.0,,3.0,,1500833986747097,Open gym has been canceled until further notice.,https://facebook.com/story.php?story_fbid=1500833986747097&id=101089700054873,,0.0,Open gym has been canceled until further notice.,2020-03-15 11:18:01,,
132,1.0,https://scontent-atl3-1.xx.fbcdn.net/v/t1.0-9/fr/cp0/e15/q65/89073548_1496696227160873_489184538652573696_n.jpg?_nc_cat=101&_nc_sid=110474&_nc_ohc=lbsw-d70RNoAX-dZ_XM&_nc_ht=scontent-atl3-1.xx&tp=14&oh=9f0e72cbde4218e363c70b53575db987&oe=5F82FE53,60.0,,1496696343827528,Mrs. Barnes is out but the 2nd graders still wanted to get their story time in the library. So Brodi and Emily stepped up and took her place! This is Cardinal Pride! Kaleb came by later!,https://facebook.com/story.php?story_fbid=1496696343827528&id=101089700054873,,0.0,Mrs. Barnes is out but the 2nd graders still wanted to get their story time in the library. So Brodi and Emily stepped up and took her place! This is Cardinal Pride! Kaleb came by later!,2020-03-10 15:30:08,,
133,0.0,https://scontent-atl3-1.xx.fbcdn.net/v/t1.0-9/fr/cp0/e15/q65/88336055_1495837047246791_1494580019790348288_n.jpg?_nc_cat=100&_nc_sid=110474&_nc_ohc=e_jj1-gE_iQAX_YkR4p&_nc_ht=scontent-atl3-1.xx&tp=14&oh=314924131279ae341eb79a3d11cabbe6&oe=5F83BED4,1.0,,1495837063913456,In April we will once again be celebrating Autism Acceptance and Awareness month! If you would like to show your support along with us please stop in the office and fill out an order for for your awareness shirt! Orders are due March 20th so dont wait to join in on this great cause! #CardinalPride,https://facebook.com/story.php?story_fbid=1495837063913456&id=101089700054873,,0.0,In April we will once again be celebrating Autism Acceptance and Awareness month! If you would like to show your support along with us please stop in the office and fill out an order for for your awareness shirt! Orders are due March 20th so dont wait to join in on this great cause! #CardinalPride,2020-03-09 14:53:25,,
134,1.0,https://scontent-atl3-1.xx.fbcdn.net/v/t1.0-9/fr/cp0/e15/q65/88043666_1492379247592571_7362642176724959232_o.jpg?_nc_cat=102&_nc_sid=110474&_nc_ohc=zFz4g-b-z60AX87_0sZ&_nc_ht=scontent-atl3-1.xx&tp=14&oh=958de7c5f21dfd181f948a4df4b050e3&oe=5F836FB2,16.0,,1492379270925902,"Dont forget Cardinal Nation 5/6th grade ski trip will leave from the pool doors at 7am tomorrow. We will return to the pool doors at 4pm. Remember to send your skier with some lunch money as well, or pack a lunch. (P.S. dont forget sunscreen, snowburn happens quick)",https://facebook.com/story.php?story_fbid=1492379270925902&id=101089700054873,,0.0,"Dont forget Cardinal Nation 5/6th grade ski trip will leave from the pool doors at 7am tomorrow. We will return to the pool doors at 4pm. Remember to send your skier with some lunch money as well, or pack a lunch. (P.S. dont forget sunscreen, snowburn happens quick)",2020-03-05 14:45:40,,
135,0.0,https://scontent-atl3-1.xx.fbcdn.net/v/t1.0-9/fr/cp0/e15/q65/88040469_1490543004442862_4564162776527798272_n.jpg?_nc_cat=104&_nc_sid=110474&_nc_ohc=EOkse5AZHrIAX9TsWAq&_nc_ht=scontent-atl3-1.xx&tp=14&oh=2cf17f76ecf6a22249326b8330141309&oe=5F812EFD,40.0,,1490543147776181,Another interesting hands on opportunity for the kids at LO. Mrs. Nehl’s Sociology class has been talking about the various elements that make up culture and how people in society view other cultures. The kids took an attempt at making an “Americanized version” of some popular cultural foods from around the world that have made their way into American society. Although not all recipes turned out….it was a fun lab to complete! #CardinalPride,https://facebook.com/story.php?story_fbid=1490543147776181&id=101089700054873,,0.0,Another interesting hands on opportunity for the kids at LO. Mrs. Nehl’s Sociology class has been talking about the various elements that make up culture and how people in society view other cultures. The kids took an attempt at making an “Americanized version” of some popular cultural foods from around the world that have made their way into American society. Although not all recipes turned out….it was a fun lab to complete! #CardinalPride,2020-03-03 12:06:09,,
