,comments,image,likes,link,post_id,post_text,post_url,shared_text,shares,text,time,video,video_thumbnail
0,0.0,https://scontent-atl3-1.xx.fbcdn.net/v/t1.0-9/fr/cp0/e15/q65/119065534_3389306774459927_1339735143253636891_o.jpg?_nc_cat=107&_nc_sid=8024bb&_nc_ohc=M_6ccRHREWcAX_SnRe5&_nc_ht=scontent-atl3-1.xx&tp=14&oh=2ae66c042fec4392e9860d7df33d347d&oe=5F829EF9,5.0,,1664061653756720,,https://facebook.com/story.php?story_fbid=1664061653756720&id=415070505322514,"Madison County Schools
September 10 at 1:26 PM ·

Thanks to Madison County Judge Executive Reagan Taylor for keeping our community safe.
#MCShealthycommunity #MCSonfire",0.0,"Madison County Schools
September 10 at 1:26 PM ·

Thanks to Madison County Judge Executive Reagan Taylor for keeping our community safe.
#MCShealthycommunity #MCSonfire",2020-09-10 17:25:06,,
1,0.0,,2.0,,242249567069910,,,,4.0,,2020-09-08 09:05:49,https://scontent-atl3-1.xx.fbcdn.net/v/t66.36281-6/10000000_314364346505332_567669541179335891_n.mp4?_nc_cat=101&_nc_sid=985c63&efg=eyJ2ZW5jb2RlX3RhZyI6Im9lcF9zZCJ9&_nc_ohc=1CO7j22mDZkAX-UIjGo&_nc_ht=scontent-atl3-1.xx&oh=1b299a804dfe15473ad75681177005ab&oe=5F8492A9,
2,2.0,,0.0,,330321774755486,,,,3.0,,2020-09-04 15:40:32,https://scontent-atl3-1.xx.fbcdn.net/v/t66.36281-6/46007448_372941510367457_2712449716949990737_n.mp4?_nc_cat=108&_nc_sid=985c63&efg=eyJ2ZW5jb2RlX3RhZyI6Im9lcF9zZCJ9&_nc_ohc=-NoaNIr39SIAX_gPvJb&_nc_ht=scontent-atl3-1.xx&oh=e7c74a3655626ec85240a9c30db7fa0d&oe=5F83BC8D,
3,0.0,,1.0,,307314023696908,,,,0.0,,2020-09-02 15:50:32,https://scontent-atl3-1.xx.fbcdn.net/v/t66.36281-6/10000000_944509926061464_5683463620976812456_n.mp4?_nc_cat=106&_nc_sid=985c63&efg=eyJ2ZW5jb2RlX3RhZyI6Im9lcF9zZCJ9&_nc_ohc=wpR1scP9T14AX9dGUTg&_nc_ht=scontent-atl3-1.xx&oh=be1bbb2c9ebf50af3b850ca6e29e6bbd&oe=5F83EB42,
4,0.0,,0.0,,760068294792098,,,,3.0,,2020-09-01 17:03:33,https://scontent-atl3-1.xx.fbcdn.net/v/l/t66.36281-6/10000000_1153942414991456_318327785683389008_n.mp4?_nc_cat=106&_nc_sid=985c63&efg=eyJ2ZW5jb2RlX3RhZyI6Im9lcF9zZCJ9&_nc_ohc=79dPAGbX7n0AX_unp6I&_nc_ht=scontent-atl3-1.xx&oh=569dd2bc95e1fd674d0730d0c6636f15&oe=5F81836F,
5,12.0,,5.0,,317741879557809,,,,4.0,,2020-08-25 09:11:08,https://scontent-atl3-1.xx.fbcdn.net/v/t66.36281-6/10000000_126983975434427_4260862158780048816_n.mp4?_nc_cat=108&_nc_sid=985c63&efg=eyJ2ZW5jb2RlX3RhZyI6Im9lcF9zZCJ9&_nc_ohc=oNsrLYuqEQsAX-PV0de&_nc_ht=scontent-atl3-1.xx&oh=bf5b1ab708578ef42d9e6dbb10e6e1c6&oe=5F8146D0,
6,223.0,,12.0,,741610249969182,,,,8.0,,2020-08-20 14:35:52,https://scontent-atl3-1.xx.fbcdn.net/v/t66.36281-6/10000000_1551623468355633_7111966126606482813_n.mp4?_nc_cat=109&_nc_sid=985c63&efg=eyJ2ZW5jb2RlX3RhZyI6Im9lcF9zZCJ9&_nc_ohc=G6qqaIFBDGgAX_ihRPl&_nc_ht=scontent-atl3-1.xx&oh=31e362dc9729e4f350956732799a8328&oe=5F81A0DB,
7,0.0,,2.0,,3366771306718163,,,,2.0,,2020-08-18 17:08:49,https://scontent-atl3-1.xx.fbcdn.net/v/t66.36281-6/10000000_627165341566555_9080270067186046244_n.mp4?_nc_cat=106&_nc_sid=985c63&efg=eyJ2ZW5jb2RlX3RhZyI6Im9lcF9zZCJ9&_nc_ohc=XzXibRs8HqMAX8gt13X&_nc_ht=scontent-atl3-1.xx&oh=5aabad328a09d42855ae6c87a3f51652&oe=5F8290B4,
8,0.0,,7.0,,1247904108890781,Fiscal Court Meeting 08-11-2020,,,2.0,Fiscal Court Meeting 08-11-2020,2020-08-11 09:10:57,https://video-atl3-1.xx.fbcdn.net/v/t42.26565-2/10000000_4221046561270222_320727618201539387_n.mp4?_nc_cat=106&_nc_sid=985c63&efg=eyJ2ZW5jb2RlX3RhZyI6Im9lcF9zZCJ9&_nc_ohc=J-hCFipwT3gAX82HDew&_nc_ht=video-atl3-1.xx&oh=b0a9caca37bd477a437dda77ab393d70&oe=5F5D5CAF,
9,0.0,,5.0,,221037149207261,Road Department Bid Opening.,,,2.0,Road Department Bid Opening.,2020-08-07 14:59:00,https://video-atl3-1.xx.fbcdn.net/v/t42.26565-2/117293954_2422690191362281_4273156622267386556_n.mp4?_nc_cat=109&_nc_sid=985c63&efg=eyJ2ZW5jb2RlX3RhZyI6Im9lcF9zZCJ9&_nc_ohc=qLT-7DIVCqMAX9vqPWv&_nc_ht=video-atl3-1.xx&oh=3a46792cd77a14c26a2b9ec00a639bf1&oe=5F5D606D,
10,2.0,,1.0,,1428442437544259,,,,0.0,,2020-08-04 16:55:45,https://video-atl3-1.xx.fbcdn.net/v/t42.26565-2/10000000_351504529200800_2746316284578079366_n.mp4?_nc_cat=107&_nc_sid=985c63&efg=eyJ2ZW5jb2RlX3RhZyI6Im9lcF9zZCJ9&_nc_ohc=BbgP3hVupigAX_CxNtz&_nc_ht=video-atl3-1.xx&oh=c1476ff9c7287d687f6e7a3de03ff5dd&oe=5F5D64F1,
11,0.0,https://scontent-atl3-1.xx.fbcdn.net/v/t1.0-9/115806748_1627083747454511_5261760732727906250_n.png?_nc_cat=107&_nc_sid=8024bb&_nc_ohc=wMtQz5s5F1YAX_Trx5Z&_nc_ht=scontent-atl3-1.xx&oh=3157e0b135b86037de64e6027e249341&oe=5F8274A7,5.0,http://www.madisoncountyky.us/jobs,1627085834120969,"We are looking for some smart and hardworking students interested in earning experience/credit through our internship program. For more information, visit www.madisoncountyky.us/jobs.",https://facebook.com/story.php?story_fbid=1627085834120969&id=415070505322514,,0.0,"We are looking for some smart and hardworking students interested in earning experience/credit through our internship program. For more information, visit www.madisoncountyky.us/jobs.",2020-07-30 14:50:51,,
12,9.0,https://scontent-atl3-1.xx.fbcdn.net/v/t1.0-9/116044567_1626948220801397_5886960821995619924_n.png?_nc_cat=105&_nc_sid=8024bb&_nc_ohc=RQ3KaxeZ_JMAX8lZkIk&_nc_ht=scontent-atl3-1.xx&oh=d1d750854e80f87cc9f291c6281843af&oe=5F81E393,13.0,http://www.madisoncountyky.us/jobs,1626948344134718,We are open for business at Madison County Government. Looking for a job with full benefits and great working environment? Check us out at www.madisoncountyky.us/jobs.,https://facebook.com/story.php?story_fbid=1626948344134718&id=415070505322514,,0.0,We are open for business at Madison County Government. Looking for a job with full benefits and great working environment? Check us out at www.madisoncountyky.us/jobs.,2020-07-30 11:15:05,,
13,6.0,,3.0,,730067810892123,Fiscal Court 07-28-2020,,,4.0,Fiscal Court 07-28-2020,2020-07-28 09:19:19,https://video-atl3-1.xx.fbcdn.net/v/t42.26565-2/10000000_1415108852010745_1733733856629690393_n.mp4?_nc_cat=111&_nc_sid=985c63&efg=eyJ2ZW5jb2RlX3RhZyI6Im9lcF9zZCJ9&_nc_ohc=MCuk_0Oi_dcAX-FHI_E&_nc_ht=video-atl3-1.xx&oh=746dc2b97c0ded163b2946ac3bbacd6c&oe=5F5D59B4,
14,3.0,,1.0,,2630386230567921,,,,0.0,,2020-07-21 17:18:15,https://video-atl3-1.xx.fbcdn.net/v/t42.26565-2/10000000_2657502547913073_1119796118205281425_n.mp4?_nc_cat=105&_nc_sid=985c63&efg=eyJ2ZW5jb2RlX3RhZyI6Im9lcF9zZCJ9&_nc_ohc=nH_Xpgi0i2QAX_sV0ia&_nc_ht=video-atl3-1.xx&oh=72653d949949620cea38b1fa21350250&oe=5F5D5989,
15,3.0,,4.0,,2651852491748711,Fiscal Court Meeting 7-14-2020,,,3.0,Fiscal Court Meeting 7-14-2020,2020-07-14 09:11:09,https://video-atl3-1.xx.fbcdn.net/v/t42.26565-2/10000000_2432935300331157_445345012705350314_n.mp4?_nc_cat=100&_nc_sid=985c63&efg=eyJ2ZW5jb2RlX3RhZyI6Im9lcF9zZCJ9&_nc_ohc=q3VbDNx8FRwAX950UmF&_nc_ht=video-atl3-1.xx&oh=4b8d8b6bf6c2cd1339cbf5a5c3bb90ae&oe=5F5D6435,
16,0.0,,0.0,,1086854898376916,,,,0.0,,2020-07-07 17:13:08,https://video-atl3-1.xx.fbcdn.net/v/t42.26565-2/10000000_2695164130763742_6357813105105131789_n.mp4?_nc_cat=108&_nc_sid=985c63&efg=eyJ2ZW5jb2RlX3RhZyI6Im9lcF9zZCJ9&_nc_ohc=53db0cA5jWMAX99YvK7&_nc_ht=video-atl3-1.xx&oh=283afbefcc9b9ba7a9b101dae6fa508a&oe=5F5D5ED0,
17,5.0,https://scontent-atl3-1.xx.fbcdn.net/v/t1.0-9/107667457_2663549107079761_7402061014497553460_o.png?_nc_cat=107&_nc_sid=8024bb&_nc_ohc=lr__a2qD7FMAX9URUxT&_nc_ht=scontent-atl3-1.xx&oh=bfdc956812eb02cfab4e3b8783d301b5&oe=5F827705,12.0,http://drive.ky.gov/,1607319486097604,,https://facebook.com/story.php?story_fbid=1607319486097604&id=415070505322514,"Madison County Clerk's Office
July 6 at 9:14 AM ·

The Madison County Clerk's Office has been notified that the state of Kentucky has amended Order # 112155, relating to the 90-day extension for DMV services. The new extension date is October 6, 2020 at 11:59 p.m.
Though another extension was issued there are still opportunities to take care of the following services: vehicle registration certificates, vehicle license plates, vehicle tag certificates, and handicapped parking permits.
Constituents may take care of these services by mail (PO Box 1270, Richmond, KY 40476), by phone (859) 624-4703 option 1, or online (drive.ky.gov)
Title transfers are available by appointment only. Make an appointment on our website, www.madisoncountyclerk.us.",24.0,"Madison County Clerk's Office
July 6 at 9:14 AM ·

The Madison County Clerk's Office has been notified that the state of Kentucky has amended Order # 112155, relating to the 90-day extension for DMV services. The new extension date is October 6, 2020 at 11:59 p.m.
Though another extension was issued there are still opportunities to take care of the following services: vehicle registration certificates, vehicle license plates, vehicle tag certificates, and handicapped parking permits.
Constituents may take care of these services by mail (PO Box 1270, Richmond, KY 40476), by phone (859) 624-4703 option 1, or online (drive.ky.gov)
Title transfers are available by appointment only. Make an appointment on our website, www.madisoncountyclerk.us.",2020-07-06 10:19:27,,
18,0.0,https://scontent-atl3-1.xx.fbcdn.net/v/t1.0-9/105626173_2724763467767997_4465383527196356651_o.png?_nc_cat=105&_nc_sid=da1649&_nc_ohc=ePQajSHDFywAX-o90s8&_nc_ht=scontent-atl3-1.xx&oh=a7a9161ad4bbb3e7c94585c64d6ea50a&oe=5F842BB9,5.0,http://madisoncountyky.us/jobs,1603374266492126,,https://facebook.com/story.php?story_fbid=1603374266492126&id=415070505322514,"Madison County Emergency Management Agency
July 1 at 3:05 PM ·

Apply at:

madisoncountyky.us/jobs",9.0,"Madison County Emergency Management Agency
July 1 at 3:05 PM ·

Apply at:

madisoncountyky.us/jobs",2020-07-01 15:22:11,,
19,2.0,,4.0,,270440417346220,,,,5.0,,2020-06-23 09:10:40,https://video-atl3-1.xx.fbcdn.net/v/t42.26565-2/10000000_112330363694809_8373511788012841267_n.mp4?_nc_cat=105&_nc_sid=985c63&efg=eyJ2ZW5jb2RlX3RhZyI6Im9lcF9zZCJ9&_nc_ohc=N_w6MO4A_VgAX9oVuoV&_nc_ht=video-atl3-1.xx&oh=1c0efc82943e8f98e8132705192a3597&oe=5F5D5C40,
20,0.0,,2.0,,551979492146689,Board of Adjustments Meeting 06-18-2020,,,2.0,Board of Adjustments Meeting 06-18-2020,2020-06-18 14:42:45,https://video-atl3-1.xx.fbcdn.net/v/t42.26565-2/10000000_681108702453756_7661336736667173275_n.mp4?_nc_cat=106&_nc_sid=985c63&efg=eyJ2ZW5jb2RlX3RhZyI6Im9lcF9zZCJ9&_nc_ohc=v0eSFGVsWw8AX_m03ah&_nc_ht=video-atl3-1.xx&oh=9babd698e0a973582ea6403f3a2dd563&oe=5F5D5AD6,
21,0.0,,1.0,,1391696874351293,,,,2.0,,2020-06-16 17:23:56,https://video-atl3-1.xx.fbcdn.net/v/t42.26565-2/10000000_3245757905455056_2586204622965709193_n.mp4?_nc_cat=108&_nc_sid=985c63&efg=eyJ2ZW5jb2RlX3RhZyI6Im9lcF9zZCJ9&_nc_ohc=kyM7Vr-S8eIAX9u_ojC&_nc_ht=video-atl3-1.xx&oh=2f3e653a7c37b6cd2719739098095bad&oe=5F5D5F8E,
22,2.0,,10.0,,1175513019454761,,,,5.0,,2020-06-09 09:18:32,https://scontent-atl3-1.xx.fbcdn.net/v/t66.36281-6/10000000_184067243123055_6581820977313133435_n.mp4?_nc_cat=107&_nc_sid=985c63&efg=eyJ2ZW5jb2RlX3RhZyI6Im9lcF9zZCJ9&_nc_ohc=nXf4ytcXSbAAX9uR26R&_nc_ht=scontent-atl3-1.xx&oh=268c902dab2228f961ea4fbba003d1ab&oe=5F82B399,
23,1.0,,4.0,,880737845780602,,,,3.0,,2020-06-02 17:12:29,https://scontent-atl3-1.xx.fbcdn.net/v/t66.36281-6/10000000_109166584168048_1444912805391395938_n.mp4?_nc_cat=111&_nc_sid=985c63&efg=eyJ2ZW5jb2RlX3RhZyI6Im9lcF9zZCJ9&_nc_ohc=Cbl7YRJNORIAX-ZCPOu&_nc_ht=scontent-atl3-1.xx&oh=b022926693eca292fba52714e4be2048&oe=5F83D073,
24,2.0,,3.0,,585477119018423,,,,4.0,,2020-06-02 14:43:08,https://scontent-atl3-1.xx.fbcdn.net/v/t66.36281-6/10000000_978851299253503_3401877085155782680_n.mp4?_nc_cat=108&_nc_sid=985c63&efg=eyJ2ZW5jb2RlX3RhZyI6Im9lcF9zZCJ9&_nc_ohc=Ep__2Hyyl2EAX_1OjR8&_nc_ht=scontent-atl3-1.xx&oh=97e9e5e9260130370f065178f10f16c2&oe=5F83C16B,
25,9.0,,13.0,,245873126737012,Fiscal Court Meeting 5-26-2020,,,5.0,Fiscal Court Meeting 5-26-2020,2020-05-26 09:18:57,https://video-atl3-1.xx.fbcdn.net/v/t42.26565-2/10000000_618098475738166_8649420342098610651_n.mp4?_nc_cat=105&_nc_sid=985c63&efg=eyJ2ZW5jb2RlX3RhZyI6Im9lcF9zZCJ9&_nc_ohc=E-O8ud9EGE8AX8CFMYj&_nc_ht=video-atl3-1.xx&oh=34d2986580f440cadec9ebafe6f95766&oe=5F5D5DEE,
26,0.0,,2.0,,796430624215984,Fiscal Court use of LGEA & CRA Funds Public Comments,,,4.0,Fiscal Court use of LGEA & CRA Funds Public Comments,2020-05-26 08:48:16,https://scontent-atl3-1.xx.fbcdn.net/v/t66.36281-6/10000000_3753043974724414_7212230169320711959_n.mp4?_nc_cat=100&_nc_sid=985c63&efg=eyJ2ZW5jb2RlX3RhZyI6Im9lcF9zZCJ9&_nc_ohc=wUOoHY8C2PsAX_cXQ0F&_nc_oc=AQkwK99kVXqnrhhYvCqW9InWGwUh6eOw7ZSp3xR6DJP33BgpDlrxWOvfHkS1xbL166E&_nc_ht=scontent-atl3-1.xx&oh=2b3f5cf39f7f733260f160683b13f21e&oe=5F82E24C,
27,2.0,,2.0,,1088002448250552,Madison County Road Department Bid opening. 5-22-2020,,,3.0,Madison County Road Department Bid opening. 5-22-2020,2020-05-22 12:37:43,https://scontent-atl3-1.xx.fbcdn.net/v/t66.36281-6/10000000_315814886332947_5261805159973396551_n.mp4?_nc_cat=104&_nc_sid=985c63&efg=eyJ2ZW5jb2RlX3RhZyI6Im9lcF9zZCJ9&_nc_ohc=qp6kP0Ec6SQAX_U2eV3&_nc_ht=scontent-atl3-1.xx&oh=4a03b6b95b54bd84028510120b609715&oe=5F827D2D,
28,3.0,,2.0,,674221606763267,5-21-2020 Madison County Board of Adjustments Special Called Meeting.,,,3.0,5-21-2020 Madison County Board of Adjustments Special Called Meeting.,2020-05-21 14:12:07,https://scontent-atl3-1.xx.fbcdn.net/v/t66.36281-6/10000000_198465888300800_8431985347327413858_n.mp4?_nc_cat=107&_nc_sid=985c63&efg=eyJ2ZW5jb2RlX3RhZyI6Im9lcF9zZCJ9&_nc_ohc=YGbGwxmGlooAX917Fxu&_nc_ht=scontent-atl3-1.xx&oh=a1f3a89baa61e9f2271e3855c23f5f1d&oe=5F84C1B4,
29,0.0,https://scontent-atl3-1.xx.fbcdn.net/v/t1.0-9/88185969_2614741612103517_6207207927271391232_o.png?_nc_cat=108&_nc_sid=8024bb&_nc_ohc=yjH_iGcEn7YAX_WaSdy&_nc_ht=scontent-atl3-1.xx&oh=fbd0e9f2d09cccc0f85852aaa6cab92b&oe=5F825EC8,6.0,,1566937580135795,"The forecast shows rain, rain, and more rain. Please be careful as you travel! Be safe Madison County!",https://facebook.com/story.php?story_fbid=1566937580135795&id=415070505322514,"Madison County Emergency Management Agency
April 29 at 4:00 PM ·",3.0,"The forecast shows rain, rain, and more rain. Please be careful as you travel! Be safe Madison County!

Madison County Emergency Management Agency
April 29 at 4:00 PM ·",2020-05-19 12:35:24,,
30,0.0,https://scontent-atl3-1.xx.fbcdn.net/v/t1.0-9/99010925_2682165098694501_4122989942110420992_n.png?_nc_cat=104&_nc_sid=da1649&_nc_ohc=_zuaDPI0hK8AX8GTba1&_nc_ht=scontent-atl3-1.xx&oh=5cb1b965867c063786f931185be1b560&oe=5F847783,2.0,https://www.thelittleclinic.com/drivethru-testing,1565461980283355,,https://facebook.com/story.php?story_fbid=1565461980283355&id=415070505322514,"Madison County Emergency Management Agency
May 17 at 1:00 PM ·

Attention Madison County 📢

Free drive-thru testing site available by appointment only. Visit https://www.thelittleclinic.com/drivethru-testing to register.",2.0,"Madison County Emergency Management Agency
May 17 at 1:00 PM ·

Attention Madison County 📢

Free drive-thru testing site available by appointment only. Visit https://www.thelittleclinic.com/drivethru-testing to register.",2020-05-17 15:41:47,,
31,4.0,,1.0,,255041238884677,Fiscal Court 5-12-2020,,,5.0,Fiscal Court 5-12-2020,2020-05-12 09:08:42,https://video-atl3-1.xx.fbcdn.net/v/t42.26565-2/10000000_2760561144176423_3925878600290144417_n.mp4?_nc_cat=106&_nc_sid=985c63&efg=eyJ2ZW5jb2RlX3RhZyI6Im9lcF9zZCJ9&_nc_ohc=jAAPl9CcolgAX9T-pnK&_nc_ht=video-atl3-1.xx&oh=632c398df9948236bbc62afc08d30419&oe=5F5D5E88,
32,11.0,,7.0,,680124996081691,Fiscal Court Special Call Meeting 5-5-2020,,,5.0,Fiscal Court Special Call Meeting 5-5-2020,2020-05-05 09:10:59,https://video-atl3-1.xx.fbcdn.net/v/t42.26565-2/10000000_1162504614135051_742576685341987799_n.mp4?_nc_cat=104&_nc_sid=985c63&efg=eyJ2ZW5jb2RlX3RhZyI6Im9lcF9zZCJ9&_nc_ohc=vAvwyM7qcoAAX-jSBuI&_nc_ht=video-atl3-1.xx&oh=cfdca7f4edc338c90e287367c5614cf3&oe=5F5D59F6,
33,21.0,,9.0,,158930952214970,Madison County Fiscal Court 4-28-2020,,,7.0,Madison County Fiscal Court 4-28-2020,2020-04-28 09:00:20,https://video-atl3-1.xx.fbcdn.net/v/t42.26565-2/10000000_161527232121005_7036672631004588838_n.mp4?_nc_cat=100&_nc_sid=985c63&efg=eyJ2ZW5jb2RlX3RhZyI6Im9lcF9zZCJ9&_nc_ohc=9cZRjphw-d8AX-nIJEC&_nc_ht=video-atl3-1.xx&oh=2b2d0b6cbae7af424f3f503381468ad3&oe=5F5D5D21,
34,0.0,https://scontent-atl3-1.xx.fbcdn.net/v/t1.0-9/94394294_2657911577786520_8519889383413776384_o.png?_nc_cat=102&_nc_sid=da1649&_nc_ohc=5ySxSK9NXHkAX98fCuI&_nc_ht=scontent-atl3-1.xx&oh=6836debd30a7fefebfc8b7eb0eeb0996&oe=5F8297CB,3.0,,1544385235724363,,https://facebook.com/story.php?story_fbid=1544385235724363&id=415070505322514,"Madison County Emergency Management Agency
April 21 at 5:30 PM ·

Siren Testing - Don't forget📢",7.0,"Madison County Emergency Management Agency
April 21 at 5:30 PM ·

Siren Testing - Don't forget📢",2020-04-22 15:58:43,,
35,0.0,,11.0,http://www.madisoncountyky.us/adopt,1543480162481537,Great story about some of our recent adoptions from the Madison County Animal Shelter. Yes..we are still adopting despite COVID-19. We are taking appointments for serious adopters. Please check out our available dogs (no cats currently) at www.madisoncountyky.us/adopt.,https://facebook.com/story.php?story_fbid=1543480162481537&id=415070505322514,"RICHMONDREGISTER.COM
""TAKE HOME A FURRY FRIEND"" - More pets finding homes during COVID crisis

Richmond Register
April 21 at 11:59 AM ·

Since the outbreak of the COVID-19 virus, shelters have seen a huge increase in adoptions. ""We've had some incredible stories,"" said Katie Tibbs, animal care coordinator for the Madison County Animal Shelter. It's been a pleasant surprise in very uncertain times. With more people staying at home because of social distancing, travel restrictions and layoffs, the interest in shelter animals has been dramatic.

https://www.richmondregister.com/news/coronavirus/take-home-a-furry-friend---more-pets-finding-homes-during-covid-crisis/article_4ebd1d64-2592-56c9-a3ed-e350f866bc63.html",8.0,"Great story about some of our recent adoptions from the Madison County Animal Shelter. Yes..we are still adopting despite COVID-19. We are taking appointments for serious adopters. Please check out our available dogs (no cats currently) at www.madisoncountyky.us/adopt.

RICHMONDREGISTER.COM
""TAKE HOME A FURRY FRIEND"" - More pets finding homes during COVID crisis

Richmond Register
April 21 at 11:59 AM ·

Since the outbreak of the COVID-19 virus, shelters have seen a huge increase in adoptions. ""We've had some incredible stories,"" said Katie Tibbs, animal care coordinator for the Madison County Animal Shelter. It's been a pleasant surprise in very uncertain times. With more people staying at home because of social distancing, travel restrictions and layoffs, the interest in shelter animals has been dramatic.

https://www.richmondregister.com/news/coronavirus/take-home-a-furry-friend---more-pets-finding-homes-during-covid-crisis/article_4ebd1d64-2592-56c9-a3ed-e350f866bc63.html",2020-04-21 14:03:46,,
36,0.0,,0.0,https://www.richmondregister.com/news/coronavirus/take-home-a-furry-friend---more-pets-finding-homes-during-covid-crisis/article_4ebd1d64-2592-56c9-a3ed-e350f866bc63.html,,,https://facebook.com/story.php?story_fbid=4292352264111873&id=128843567129451,"Richmond Register
April 21 at 11:59 AM ·

Since the outbreak of the COVID-19 virus, shelters have seen a huge increase in adoptions. ""We've had some incredible stories,"" said Katie Tibbs, animal care coordinator for the Madison County Animal Shelter. It's been a pleasant surprise in very uncertain times. With more people staying at home because of social distancing, travel restrictions and layoffs, the interest in shelter animals has been dramatic.

https://www.richmondregister.com/news/coronavirus/take-home-a-furry-friend---more-pets-finding-homes-during-covid-crisis/article_4ebd1d64-2592-56c9-a3ed-e350f866bc63.html",0.0,"Richmond Register
April 21 at 11:59 AM ·

Since the outbreak of the COVID-19 virus, shelters have seen a huge increase in adoptions. ""We've had some incredible stories,"" said Katie Tibbs, animal care coordinator for the Madison County Animal Shelter. It's been a pleasant surprise in very uncertain times. With more people staying at home because of social distancing, travel restrictions and layoffs, the interest in shelter animals has been dramatic.

https://www.richmondregister.com/news/coronavirus/take-home-a-furry-friend---more-pets-finding-homes-during-covid-crisis/article_4ebd1d64-2592-56c9-a3ed-e350f866bc63.html",2020-09-12 17:22:42.866148,,
37,0.0,,11.0,https://my2020census.gov/,1539443219551898,Make sure you and your family are counted! Thank your Sheriff Mike Coyle #madisonmatters #2020census,https://facebook.com/story.php?story_fbid=1539443219551898&id=415070505322514,"Mike Coyle
April 16 at 3:49 PM ·

#MadisonMatters
#Census2020

https://my2020census.gov/",3.0,"Make sure you and your family are counted! Thank your Sheriff Mike Coyle #madisonmatters #2020census

Mike Coyle
April 16 at 3:49 PM ·

#MadisonMatters
#Census2020

https://my2020census.gov/",2020-04-16 17:31:39,https://video-atl3-1.xx.fbcdn.net/v/t42.9040-2/93932808_3362846220412148_7554964301069418496_n.mp4?_nc_cat=109&_nc_sid=985c63&efg=eyJ2ZW5jb2RlX3RhZyI6ImxlZ2FjeV9zZCJ9&_nc_ohc=wi-RNZkSbZ0AX_tWXra&_nc_ht=video-atl3-1.xx&oh=386080ff1f7982bd03e61b0d74a9e868&oe=5F5D595D,
38,19.0,,13.0,,1456339871204081,Madison County Fiscal Court 4-14-2020,,,7.0,Madison County Fiscal Court 4-14-2020,2020-04-14 09:02:55,https://video-atl3-1.xx.fbcdn.net/v/t42.26565-2/10000000_1207972456201867_5532316994846128660_n.mp4?_nc_cat=111&_nc_sid=985c63&efg=eyJ2ZW5jb2RlX3RhZyI6Im9lcF9zZCJ9&_nc_ohc=okc2kRVb8BgAX9THxY0&_nc_ht=video-atl3-1.xx&oh=5ec7fe1fd7eeae68636fb2f97fdc0501&oe=5F5D6513,
39,1.0,https://scontent-atl3-1.xx.fbcdn.net/v/t1.0-9/fr/cp0/e15/q65/91495764_2641507716093573_5983547569756700672_n.jpg?_nc_cat=108&_nc_sid=8024bb&_nc_ohc=-Z_HK_yQ0wMAX-pp5X6&_nc_ht=scontent-atl3-1.xx&tp=14&oh=a039a5c59a888efb3351041143ca8cf7&oe=5F8396C9,26.0,,1533860203443533,,https://facebook.com/story.php?story_fbid=1533860203443533&id=415070505322514,"Madison County Emergency Management Agency
April 9 at 2:00 PM ·

Our team is working closely with local preparedness partners on gaining resources, like personal protective equipment (PPE), needed for our health care facilities and first responders. We are working with Eastern Kentucky University Emergency Management to gain local resources.",0.0,"Madison County Emergency Management Agency
April 9 at 2:00 PM ·

Our team is working closely with local preparedness partners on gaining resources, like personal protective equipment (PPE), needed for our health care facilities and first responders. We are working with Eastern Kentucky University Emergency Management to gain local resources.",2020-04-10 07:49:06,,
40,1.0,https://scontent-atl3-1.xx.fbcdn.net/v/t1.0-9/fr/cp0/e15/q65/92331205_3677126228995571_8303931001772441600_o.jpg?_nc_cat=107&_nc_sid=8024bb&_nc_ohc=0VhDBoNKP7YAX_bqGt-&_nc_ht=scontent-atl3-1.xx&tp=14&oh=db1389dc63b0fa5ae5e1ccd86aa1e8b4&oe=5F83CFCC,16.0,,1531552763674277,Great advise for all of us. Thank you to all of our heath care workers and first responders working on the front lines to keep us safe! Stay healthy Madison County! #teamkentucky,https://facebook.com/story.php?story_fbid=1531552763674277&id=415070505322514,"Madison County Health Department
April 7 at 10:46 AM ·

National Public Health Week: Tips for Frontline Healthcare Workers. (Contact Christian Rose (christianrosemd@gmail.com) or Nadia Roumani (nadia@dschool.stanford.edu) for questions/feedback.)",10.0,"Great advise for all of us. Thank you to all of our heath care workers and first responders working on the front lines to keep us safe! Stay healthy Madison County! #teamkentucky

Madison County Health Department
April 7 at 10:46 AM ·

National Public Health Week: Tips for Frontline Healthcare Workers. (Contact Christian Rose (christianrosemd@gmail.com) or Nadia Roumani (nadia@dschool.stanford.edu) for questions/feedback.)",2020-04-07 11:40:13,,
41,0.0,https://scontent-atl3-1.xx.fbcdn.net/v/t1.0-9/fr/cp0/e15/q65/91942203_1529947247168162_5428785722377109504_n.jpg?_nc_cat=104&_nc_sid=110474&_nc_ohc=JP9xrWMEdF8AX8oFCxB&_nc_ht=scontent-atl3-1.xx&tp=14&oh=26a3be217287f7868f0085ef6e53e15b&oe=5F819BA2,14.0,,1529953807167506,"When Kentuckians think of dulcimers one can’t help but think about Mr. May of Berea...a longtime dulcimer craftsman!

Madison Countians...please remember to refrain from large gatherings and keep appropriate distance.

Madison County Sheriff Mike Coyle and his team are patrolling our public spaces to ensure compliance! #teamkentucky",https://facebook.com/story.php?story_fbid=1529953807167506&id=415070505322514,,0.0,"When Kentuckians think of dulcimers one can’t help but think about Mr. May of Berea...a longtime dulcimer craftsman!

Madison Countians...please remember to refrain from large gatherings and keep appropriate distance.

Madison County Sheriff Mike Coyle and his team are patrolling our public spaces to ensure compliance! #teamkentucky",2020-04-05 12:32:18,,
42,0.0,https://scontent-atl3-1.xx.fbcdn.net/v/t1.0-9/fr/cp0/e15/q65/92129579_1529250080571212_6651965732236034048_n.jpg?_nc_cat=111&_nc_sid=110474&_nc_ohc=3kManKfMp1gAX_qqtoo&_nc_ht=scontent-atl3-1.xx&tp=14&oh=06b49c56a7c22db9689ffab91210dbee&oe=5F83E4D0,6.0,,1529250303904523,,https://facebook.com/story.php?story_fbid=1529250303904523&id=415070505322514,,0.0,,2020-04-04 15:21:55,,
43,107.0,https://scontent-atl3-1.xx.fbcdn.net/v/t1.0-9/fr/cp0/e15/q65/92237021_1528654680630752_3275751168449445888_n.jpg?_nc_cat=110&_nc_sid=110474&_nc_ohc=cDs2tmtjOgIAX-TdU14&_nc_ht=scontent-atl3-1.xx&tp=14&oh=b808e1bbaa3dfcfc729da31c84c34ffe&oe=5F839B3B,255.0,,1528655700630650,Tonight the Madison County Courthouse is lit in green in honor of the Madison Countian who lost her life today to the COVID-19 virus. Our heartfelt condolences go out to her family. #teamkentucky,https://facebook.com/story.php?story_fbid=1528655700630650&id=415070505322514,,0.0,Tonight the Madison County Courthouse is lit in green in honor of the Madison Countian who lost her life today to the COVID-19 virus. Our heartfelt condolences go out to her family. #teamkentucky,2020-04-03 21:34:11,,
44,31.0,,16.0,https://madisoncountyhealthdept.org/Documents/COVIDRelease6.pdf?fbclid=IwAR1qhbPd89htYcoEhAQvwDpT7iPmKJ1cTc6GySKyvE2Ymk9PWULSjVtSYuM,1528496780646542,"Madison County Health Department Reports First Death Related to COVID-19 in Madison County

“On behalf of the Madison County Fiscal Court, I offer our deepest sympathies to the family for the loss of their loved one to this terrible virus,” said Judge Executive Reagan Taylor. “I want to stress the importance for Madison Countians to continue to comply with the guidance provided by the CDC and other health organizations. During this time of unpresented challenges, I hope we can continue to be patient and calm while keeping our fellow Madison Countians in our thoughts and prayers.”

Full press release: https://madisoncountyhealthdept.org/Documents/COVIDRelease6.pdf?fbclid=IwAR1qhbPd89htYcoEhAQvwDpT7iPmKJ1cTc6GySKyvE2Ymk9PWULSjVtSYuM",https://facebook.com/story.php?story_fbid=1528496780646542&id=415070505322514,"MADISONCOUNTYHEALTHDEPT.ORG
madisoncountyhealthdept.org",72.0,"Madison County Health Department Reports First Death Related to COVID-19 in Madison County

“On behalf of the Madison County Fiscal Court, I offer our deepest sympathies to the family for the loss of their loved one to this terrible virus,” said Judge Executive Reagan Taylor. “I want to stress the importance for Madison Countians to continue to comply with the guidance provided by the CDC and other health organizations. During this time of unpresented challenges, I hope we can continue to be patient and calm while keeping our fellow Madison Countians in our thoughts and prayers.”

Full press release: https://madisoncountyhealthdept.org/Documents/COVIDRelease6.pdf?fbclid=IwAR1qhbPd89htYcoEhAQvwDpT7iPmKJ1cTc6GySKyvE2Ymk9PWULSjVtSYuM

MADISONCOUNTYHEALTHDEPT.ORG
madisoncountyhealthdept.org",2020-04-03 16:05:32,,
45,0.0,https://scontent-atl3-1.xx.fbcdn.net/v/t1.0-9/fr/cp0/e15/q65/92159794_2641509242760087_1684445744964042752_o.jpg?_nc_cat=101&_nc_sid=8024bb&_nc_ohc=Fr5IcySqG4oAX_ERCYt&_nc_ht=scontent-atl3-1.xx&tp=14&oh=db0b29137adcadae4e8dc415c151c382&oe=5F80DC92,8.0,,1528488007314086,,https://facebook.com/story.php?story_fbid=1528488007314086&id=415070505322514,"Madison County Emergency Management Agency
April 3 at 3:32 PM ·

We have been working closely with Madison County Road Department and Madison County Fire Department to place barriers to secure the tents that were delivered to local health care facilities. We teamed up with Madison County Road Department and Madison County Fire Department to set up tents and fill the barriers for the Madison Family Clinic.",0.0,"Madison County Emergency Management Agency
April 3 at 3:32 PM ·

We have been working closely with Madison County Road Department and Madison County Fire Department to place barriers to secure the tents that were delivered to local health care facilities. We teamed up with Madison County Road Department and Madison County Fire Department to set up tents and fill the barriers for the Madison Family Clinic.",2020-04-03 15:48:36,,
46,10.0,,7.0,,883651642067879,Fiscal Court Meeting 03-31-2020 #teamkentucky,,,4.0,Fiscal Court Meeting 03-31-2020 #teamkentucky,2020-03-31 09:08:29,https://video-atl3-1.xx.fbcdn.net/v/t42.26565-2/10000000_759687514864338_7331282733454268854_n.mp4?_nc_cat=109&_nc_sid=985c63&efg=eyJ2ZW5jb2RlX3RhZyI6Im9lcF9zZCJ9&_nc_ohc=znrdfkhydk4AX87smqN&_nc_ht=video-atl3-1.xx&oh=a16c152548fea71c29e1e2a3667d3bf4&oe=5F5D654F,
47,0.0,,20.0,http://www.madisoncountyky.us/adopt,1524355537727333,Kudos to Madison County Animal Care Director Katie Tibbs who was highlighted on the front page of the Lexington Herald-Leader today discussing the ways that the Madison County Animal Shelter is working to adopt out animals during the COVID-19 pandemic. Looking to adopt? Visit www.madisoncountyky.us/adopt. For the full article visit https://www.google.com/amp/s/amp.kentucky.com/news/coronavirus/article241478496.html.,https://facebook.com/story.php?story_fbid=1524355537727333&id=415070505322514,"KENTUCKY.COM
Kentucky animal welfare groups: Now is not the time to surrender your loved ones",12.0,"Kudos to Madison County Animal Care Director Katie Tibbs who was highlighted on the front page of the Lexington Herald-Leader today discussing the ways that the Madison County Animal Shelter is working to adopt out animals during the COVID-19 pandemic. Looking to adopt? Visit www.madisoncountyky.us/adopt. For the full article visit https://www.google.com/amp/s/amp.kentucky.com/news/coronavirus/article241478496.html.

KENTUCKY.COM
Kentucky animal welfare groups: Now is not the time to surrender your loved ones",2020-03-29 17:00:36,,
48,3.0,https://scontent-atl3-1.xx.fbcdn.net/v/t1.0-9/90960215_1522488297914057_3233809447004405760_n.png?_nc_cat=106&_nc_sid=8024bb&_nc_ohc=yGKJI7PSm6MAX8wXhMf&_nc_ht=scontent-atl3-1.xx&oh=5267ebd1274d6f1b23f27325833ebacf&oe=5F83ED19,4.0,http://www.madisoncountyky.us/adopt,1522489864580567,"Are you telecommuting wishing you had the perfect pet to curl up with? Finding yourself with time to train a wonderful pet?

We can help! While we are not open to the public during the COVID-19 pandemic, we are scheduling appointments at the Madison County Animal Shelter for citizens interested in adopting our furry friends. Visit our website at www.madisoncountyky.us/adopt to find your perfect pet.

Email or Direct Message us to set up an appointment. Adoption fees are as follows:

Dogs and Puppies Adoptions
Fee: $37.10
Adoption includes:
-Partial Vaccination
-Madison County License
-$75 Spay/Neuter Voucher
-Microchip
-Free Vet Checkup

Cats and Kittens Adoptions
Fee: $21.20
Adoption includes:
-Partial Vaccination
-$40 Spay/Neuter Voucher
-Microchip
-Free Vet Checkup

Don't Forget!
1. Bring a way to transport your new friend home. Leashes, collars, and crates are always helpful!
2. Check with landlords and apartment complexes to ensure your landlord allows pets and what restrictions they may have on breeds.",https://facebook.com/story.php?story_fbid=1522489864580567&id=415070505322514,,0.0,"Are you telecommuting wishing you had the perfect pet to curl up with? Finding yourself with time to train a wonderful pet?

We can help! While we are not open to the public during the COVID-19 pandemic, we are scheduling appointments at the Madison County Animal Shelter for citizens interested in adopting our furry friends. Visit our website at www.madisoncountyky.us/adopt to find your perfect pet.

Email or Direct Message us to set up an appointment. Adoption fees are as follows:

Dogs and Puppies Adoptions
Fee: $37.10
Adoption includes:
-Partial Vaccination
-Madison County License
-$75 Spay/Neuter Voucher
-Microchip
-Free Vet Checkup

Cats and Kittens Adoptions
Fee: $21.20
Adoption includes:
-Partial Vaccination
-$40 Spay/Neuter Voucher
-Microchip
-Free Vet Checkup

Don't Forget!
1. Bring a way to transport your new friend home. Leashes, collars, and crates are always helpful!
2. Check with landlords and apartment complexes to ensure your landlord allows pets and what restrictions they may have on breeds.",2020-03-27 13:02:11,,
49,1.0,https://scontent-atl3-1.xx.fbcdn.net/v/t1.0-9/fr/cp0/e15/q65/91052722_1521603124669241_3495958127445016576_n.jpg?_nc_cat=102&_nc_sid=8024bb&_nc_ohc=arT7x7zM3_4AX9nENUy&_nc_ht=scontent-atl3-1.xx&tp=14&oh=8021b59676da0673a6bb699f7204a87f&oe=5F83CD29,2.0,http://www.madisoncountyky.us/,1521610511335169,"During this COVID-19 Pandemic, Madison County Government is still open for business. While our offices are closed to the public, the following services are still being provided (in appropriate compliance with the Governor's Executive orders). Need service...send us an online request at www.madisoncountyky.us:

Countywide Services:
Animal Shelter Adoptions (appointment only)
Golf Course (online appointments-carts are available for use)
Parks (no bathrooms open at this time)
Finance and Human Resources (appointment only)

Outside City Limits Services:
Large Item Pickup
Loan A Truck
Dead Cattle Removal
Building Inspections
Business Licensing (online and mail processing only)
Road Repair

As always, our teams in Emergency Management, Fire/Rescue, and 911 are serving Madison County 24/7.",https://facebook.com/story.php?story_fbid=1521610511335169&id=415070505322514,,0.0,"During this COVID-19 Pandemic, Madison County Government is still open for business. While our offices are closed to the public, the following services are still being provided (in appropriate compliance with the Governor's Executive orders). Need service...send us an online request at www.madisoncountyky.us:

Countywide Services:
Animal Shelter Adoptions (appointment only)
Golf Course (online appointments-carts are available for use)
Parks (no bathrooms open at this time)
Finance and Human Resources (appointment only)

Outside City Limits Services:
Large Item Pickup
Loan A Truck
Dead Cattle Removal
Building Inspections
Business Licensing (online and mail processing only)
Road Repair

As always, our teams in Emergency Management, Fire/Rescue, and 911 are serving Madison County 24/7.",2020-03-26 12:41:37,,
50,5.0,,8.0,https://youtu.be/l4FIPiM8Kws,1509129392583281,"Madison County Health Department Director Nancy Crewe addresses COVID19; Judge Executive Reagan Taylor, Mayor Bruce Fraley, and Mayor Robert Blythe affirm commitment to a coordinated effort between the County and cities to address COVID19 response",https://facebook.com/story.php?story_fbid=1509129392583281&id=415070505322514,"YOUTUBE.COM
Madison County, KY - COVID19",15.0,"Madison County Health Department Director Nancy Crewe addresses COVID19; Judge Executive Reagan Taylor, Mayor Bruce Fraley, and Mayor Robert Blythe affirm commitment to a coordinated effort between the County and cities to address COVID19 response

YOUTUBE.COM
Madison County, KY - COVID19",2020-03-11 20:35:54,,
51,7.0,https://scontent-atl3-1.xx.fbcdn.net/v/t1.0-9/fr/cp0/e15/q65/89530570_1507967032699517_3363021094268174336_o.jpg?_nc_cat=111&_nc_sid=8024bb&_nc_ohc=Q_e8-szPYvIAX8ju_Qo&_nc_ht=scontent-atl3-1.xx&tp=14&oh=ad02d636f97fe8787a7a056cb52d1894&oe=5F83743C,7.0,,1507968482699372,,https://facebook.com/story.php?story_fbid=1507968482699372&id=415070505322514,,0.0,,2020-03-10 11:22:53,,
52,4.0,,5.0,,2484194305162835,Fiscal Court 03-10-2020,,,5.0,Fiscal Court 03-10-2020,2020-03-10 09:26:40,https://scontent-atl3-1.xx.fbcdn.net/v/t66.36281-6/10000000_104431634698701_3008852206615116147_n.mp4?_nc_cat=100&_nc_sid=985c63&efg=eyJ2ZW5jb2RlX3RhZyI6Im9lcF9zZCJ9&_nc_ohc=WFPHthNCc_AAX9eiLlr&_nc_ht=scontent-atl3-1.xx&oh=f50bf0e80c1b59daaade5934613a681a&oe=5F81C67F,
53,8.0,,4.0,,194092041840072,Fiscal Court 02-25-2020,,,4.0,Fiscal Court 02-25-2020,2020-02-25 09:43:14,https://scontent-atl3-1.xx.fbcdn.net/v/t66.36281-6/10000000_173847527531054_7296270650778261998_n.mp4?_nc_cat=103&_nc_sid=985c63&efg=eyJ2ZW5jb2RlX3RhZyI6Im9lcF9zZCJ9&_nc_ohc=JNMRkheMYNQAX_bHrAk&_nc_ht=scontent-atl3-1.xx&oh=c7ce7dc81f9e8730ec44f627bf43cdd9&oe=5F83162C,
54,1.0,,0.0,https://www.youtube.com/watch?v=rREfxo0ckuE&list=PLdNdtyd3R96HeuDGIbI4mSh8eN1pibVUw&index=2&t=0s,1485366511626236,"Today's Fiscal Court Meeting has been posted to our YouTube Channel.

https://www.youtube.com/watch?v=rREfxo0ckuE&list=PLdNdtyd3R96HeuDGIbI4mSh8eN1pibVUw&index=2&t=0s",https://facebook.com/story.php?story_fbid=1485366511626236&id=415070505322514,"YOUTUBE.COM
Madison County Fiscal Court - 02-11-2019",0.0,"Today's Fiscal Court Meeting has been posted to our YouTube Channel.

https://www.youtube.com/watch?v=rREfxo0ckuE&list=PLdNdtyd3R96HeuDGIbI4mSh8eN1pibVUw&index=2&t=0s

YOUTUBE.COM
Madison County Fiscal Court - 02-11-2019",2020-02-11 16:23:02,,
55,0.0,https://scontent-atl3-1.xx.fbcdn.net/v/t1.0-9/fr/cp0/e15/q65/84761304_1485361918293362_417683486476861440_n.jpg?_nc_cat=106&_nc_sid=8024bb&_nc_ohc=CgzfdUIh2DAAX9vRIRc&_nc_ht=scontent-atl3-1.xx&tp=14&oh=86a2c5260b13bf1648c0de7517fe0656&oe=5F817A25,6.0,,1485363391626548,"With the predicted rain fall over the next two days we would like to remind you to stay weather aware and Turn Around, Don't Drown.",https://facebook.com/story.php?story_fbid=1485363391626548&id=415070505322514,,0.0,"With the predicted rain fall over the next two days we would like to remind you to stay weather aware and Turn Around, Don't Drown.",2020-02-11 16:16:15,,
56,0.0,https://scontent-atl3-1.xx.fbcdn.net/v/t1.0-9/84577374_915317465571958_8759992842832576512_n.png?_nc_cat=103&_nc_sid=8024bb&_nc_ohc=rS5B2dUEdpIAX90mEgs&_nc_ht=scontent-atl3-1.xx&oh=3a14218992c159fab80351b94d05278c&oe=5F81BE42,3.0,,1482769218552632,Special Saturday Hours Today! Come out and visit us today. We have many pups and cats needing homes!,https://facebook.com/story.php?story_fbid=1482769218552632&id=415070505322514,"Madison County Animal Shelter
February 8 at 9:58 AM ·

Stop by and meet our cats and dogs today! If you have any questions about any pet, please call us at 859-624-4744, we'd love to hear from you!",5.0,"Special Saturday Hours Today! Come out and visit us today. We have many pups and cats needing homes!

Madison County Animal Shelter
February 8 at 9:58 AM ·

Stop by and meet our cats and dogs today! If you have any questions about any pet, please call us at 859-624-4744, we'd love to hear from you!",2020-02-08 10:02:38,,
57,0.0,https://scontent-atl3-1.xx.fbcdn.net/v/t1.0-9/fr/cp0/e15/q65/83650193_908277509609287_73258101821669376_o.jpg?_nc_cat=101&_nc_sid=8024bb&_nc_ohc=qjbQWBzIr1QAX87ejOI&_nc_ht=scontent-atl3-1.xx&tp=14&oh=ecd8e3c0541bfd6edc506a61295a99af&oe=5F83DF8F,12.0,,1475604075935813,If you haven't had a chance to like our Madison County Animal Shelter Facebook page...we encourage you to do so! We have so many wonderful dogs and cats up for adoption who need wonderful homes.,https://facebook.com/story.php?story_fbid=1475604075935813&id=415070505322514,"Madison County Animal Shelter
January 30 at 12:23 PM ·

We are packed to the brim with awesome pups waiting for homes! All of these fantastic furry, friends are up for adoption at the Madison County Animal Shelter. Please feel free to share and let's help all these pups find their purrfect families! Come meet any of these pups any weekday between 11 am and 4:15 pm.
Please feel free to reach out to the shelter at (859) 624-4744 with further questions or inquiries.",13.0,"If you haven't had a chance to like our Madison County Animal Shelter Facebook page...we encourage you to do so! We have so many wonderful dogs and cats up for adoption who need wonderful homes.

Madison County Animal Shelter
January 30 at 12:23 PM ·

We are packed to the brim with awesome pups waiting for homes! All of these fantastic furry, friends are up for adoption at the Madison County Animal Shelter. Please feel free to share and let's help all these pups find their purrfect families! Come meet any of these pups any weekday between 11 am and 4:15 pm.
Please feel free to reach out to the shelter at (859) 624-4744 with further questions or inquiries.",2020-01-30 12:31:46,,
58,33.0,,25.0,,2447845051987871,,,,16.0,,2020-01-28 09:36:52,https://video-atl3-1.xx.fbcdn.net/v/t42.26565-2/10000000_285305162917996_8258253012520222110_n.mp4?_nc_cat=111&_nc_sid=985c63&efg=eyJ2ZW5jb2RlX3RhZyI6Im9lcF9zZCJ9&_nc_ohc=IbpFXVcc8ToAX_8BbSM&_nc_ht=video-atl3-1.xx&oh=00cf6f5e9dc6bad8f44fe36d7618e456&oe=5F5D59B5,
59,27.0,,9.0,,567828553770809,Fiscal Court 01.07.2020,,,16.0,Fiscal Court 01.07.2020,2020-01-07 09:30:58,https://video-atl3-1.xx.fbcdn.net/v/t42.26565-2/10000000_905651236577274_8524506323479622818_n.mp4?_nc_cat=104&_nc_sid=985c63&efg=eyJ2ZW5jb2RlX3RhZyI6Im9lcF9zZCJ9&_nc_ohc=m04cz2vxodsAX8bsxaw&_nc_ht=video-atl3-1.xx&oh=13cabee5e8dcfe0e28fd243abf63bc2f&oe=5F5D5F90,
60,66.0,,5.0,,2280826558876048,Fiscal Court 12-17-2019,,,35.0,Fiscal Court 12-17-2019,2019-12-17 09:30:35,https://scontent-atl3-1.xx.fbcdn.net/v/t66.36281-6/10000000_319657322622194_1531874827465210382_n.mp4?_nc_cat=111&_nc_sid=985c63&efg=eyJ2ZW5jb2RlX3RhZyI6Im9lcF9zZCJ9&_nc_ohc=1QzgKV0V2QQAX-RMvfV&_nc_ht=scontent-atl3-1.xx&oh=2b4541bca6897ee5b19ea117a76ab197&oe=5F810FA7,
61,57.0,,8.0,,567450174016278,Fiscal Court 11-26-2019,,,20.0,Fiscal Court 11-26-2019,2019-11-26 09:30:18,https://scontent-atl3-1.xx.fbcdn.net/v/t66.36281-6/10000000_1714111335410102_8339253311894943561_n.mp4?_nc_cat=110&_nc_sid=985c63&efg=eyJ2ZW5jb2RlX3RhZyI6Im9lcF9zZCJ9&_nc_ohc=pGxVxVcAotUAX9kjg-4&_nc_ht=scontent-atl3-1.xx&oh=f4a07e47beaccbe4f70867827d36f98d&oe=5F81211D,
62,4.0,https://scontent-atl3-1.xx.fbcdn.net/v/t1.0-9/fr/cp0/e15/q65/77037054_844660502637655_7794932258564997120_n.jpg?_nc_cat=103&_nc_sid=110474&_nc_ohc=xDiuB0o1YMcAX8qAqqb&_nc_ht=scontent-atl3-1.xx&tp=14&oh=63e9d40e1c84ac9ddeaa300e0ca4225d&oe=5F8384FB,69.0,,1406499732846248,"We are so proud of the work we do at our Animal Shelter. Such a wonderful story during this Thanksgiving season! If you want to see more stories like this, please like our Madison County Animal Shelter Facebook page.",https://facebook.com/story.php?story_fbid=1406499732846248&id=415070505322514,"Madison County Animal Shelter
November 20, 2019 at 5:21 PM ·

Heartwarming story this fine Wednesday! We had gotten a sweet pup in the shelter this week and upon intake we realized he had a chip registered to a family in Loveland Ohio. After some phone calls we were able to place Kristofferson back with his family whom he hadn't seen in years!
This sweet boy was excited to say the least after his family traveled all the way to Berea, KY to claim their handsome dog! We sure love happy endings and this serves as a perfect example of why microchipping is so important! Anyone may have their pet microchipped at the shelter for $26.50 as that's a service we are happy to provide.
We're so happy Kristofferson found his family!",4.0,"We are so proud of the work we do at our Animal Shelter. Such a wonderful story during this Thanksgiving season! If you want to see more stories like this, please like our Madison County Animal Shelter Facebook page.

Madison County Animal Shelter
November 20, 2019 at 5:21 PM ·

Heartwarming story this fine Wednesday! We had gotten a sweet pup in the shelter this week and upon intake we realized he had a chip registered to a family in Loveland Ohio. After some phone calls we were able to place Kristofferson back with his family whom he hadn't seen in years!
This sweet boy was excited to say the least after his family traveled all the way to Berea, KY to claim their handsome dog! We sure love happy endings and this serves as a perfect example of why microchipping is so important! Anyone may have their pet microchipped at the shelter for $26.50 as that's a service we are happy to provide.
We're so happy Kristofferson found his family!",2019-11-20 18:13:43,,
63,1.0,,18.0,,1401642579998630,The Madison County Fiscal Court sends its deepest sympathy to the family of former Madison County Sheriff Nelson O'Donnell. His service to the citizens of Madison County during his tenure as Sheriff is greatly appreciated.,https://facebook.com/story.php?story_fbid=1401642579998630&id=415070505322514,"Madison-County Sheriff KY
November 15, 2019 at 11:18 AM ·

The Madison County Sheriff’s Office is saddened to learn of the passing of Nelson O’Donnell. Nelson served 40 years in law enforcement, retiring from the Kentucky State Police before spending 16 years at the Madison County Sheriff’s Office. He proudly served as sheriff of Madison County from 2006 until 2010.

Please keep the O’Donnell family in your thoughts and prayers during this difficult time.",4.0,"The Madison County Fiscal Court sends its deepest sympathy to the family of former Madison County Sheriff Nelson O'Donnell. His service to the citizens of Madison County during his tenure as Sheriff is greatly appreciated.

Madison-County Sheriff KY
November 15, 2019 at 11:18 AM ·

The Madison County Sheriff’s Office is saddened to learn of the passing of Nelson O’Donnell. Nelson served 40 years in law enforcement, retiring from the Kentucky State Police before spending 16 years at the Madison County Sheriff’s Office. He proudly served as sheriff of Madison County from 2006 until 2010.

Please keep the O’Donnell family in your thoughts and prayers during this difficult time.",2019-11-15 16:16:44,,
64,19.0,,5.0,,2383308385220340,Fiscal Court 11-12-2019,,,10.0,Fiscal Court 11-12-2019,2019-11-12 09:38:54,https://video-atl3-1.xx.fbcdn.net/v/t42.26565-2/10000000_165552918402578_974416487639616383_n.mp4?_nc_cat=105&_nc_sid=985c63&efg=eyJ2ZW5jb2RlX3RhZyI6Im9lcF9zZCJ9&_nc_ohc=I_x9ZuFlh54AX9UUrSa&_nc_ht=video-atl3-1.xx&oh=985715279a77c293b3ebaa9054e8529d&oe=5F5D5BF3,
65,41.0,,78.0,,1385876871575201,,https://facebook.com/story.php?story_fbid=1385876871575201&id=415070505322514,,0.0,,2019-10-29 17:04:19,,
66,3.0,https://scontent-atl3-1.xx.fbcdn.net/v/t1.0-9/73195774_1379933282169560_8165135418455490560_n.png?_nc_cat=101&_nc_sid=8024bb&_nc_ohc=qeQQ-8donR0AX8FOfgM&_nc_ht=scontent-atl3-1.xx&oh=45030da755941bcb13bdc81887f868e0&oe=5F83054D,100.0,,1379937642169124,"We are so incredibly excited to launch our Madison County Animal Shelter Facebook Page. We currently have many wonderful dogs and cats available for adoption so we encourage you to ""like"" and ""share!""",https://facebook.com/story.php?story_fbid=1379937642169124&id=415070505322514,,0.0,"We are so incredibly excited to launch our Madison County Animal Shelter Facebook Page. We currently have many wonderful dogs and cats available for adoption so we encourage you to ""like"" and ""share!""",2019-10-23 10:02:06,,
67,11.0,,5.0,,676484439506713,Fiscal Court - 10-22-2019,,,14.0,Fiscal Court - 10-22-2019,2019-10-22 09:30:35,https://video-atl3-1.xx.fbcdn.net/v/t42.26565-2/10000000_2692388141001139_8286993331515031255_n.mp4?_nc_cat=102&_nc_sid=985c63&efg=eyJ2ZW5jb2RlX3RhZyI6Im9lcF9zZCJ9&_nc_ohc=aB1X_fFQfjwAX_nMs1k&_nc_ht=video-atl3-1.xx&oh=fa1e8137342f4624e50237d59f7e807f&oe=5F5D5DAA,
68,0.0,https://scontent-atl3-1.xx.fbcdn.net/v/t1.0-9/fr/cp0/e15/q65/72196999_2537509963143827_2073768694802022400_o.jpg?_nc_cat=110&_nc_sid=110474&_nc_ohc=aqgz1vUaKncAX8TJeVo&_nc_ht=scontent-atl3-1.xx&tp=14&oh=3fb662c05b3d42a23f0900e69b5b6121&oe=5F8489FB,6.0,,1371163079713247,,https://facebook.com/story.php?story_fbid=1371163079713247&id=415070505322514,"City of Berea, KY Government
October 14, 2019 at 10:39 AM ·

Madison County's three heads of government met in Berea this morning to address criminal justice in the county and how it is affected by the drug abuse crisis. From left, Madison County Judge Executive Reagan Taylor, Berea Mayor Bruce Fraley, and Richmond Mayor Robert Blythe, discussed the issue along with State Senator Jared Carpenter, Madison County Deputy Judge Executive Colleen Chaney, Jefferson County Circuit Court Clerk David Nicholson, Madison County Jailer Steve Tussey, and Berea City Administrator David Gregory. The meeting was just a first step, allowing public officials to discuss how the three governments can potentially work together for local criminal justice reform.",0.0,"City of Berea, KY Government
October 14, 2019 at 10:39 AM ·

Madison County's three heads of government met in Berea this morning to address criminal justice in the county and how it is affected by the drug abuse crisis. From left, Madison County Judge Executive Reagan Taylor, Berea Mayor Bruce Fraley, and Richmond Mayor Robert Blythe, discussed the issue along with State Senator Jared Carpenter, Madison County Deputy Judge Executive Colleen Chaney, Jefferson County Circuit Court Clerk David Nicholson, Madison County Jailer Steve Tussey, and Berea City Administrator David Gregory. The meeting was just a first step, allowing public officials to discuss how the three governments can potentially work together for local criminal justice reform.",2019-10-14 21:36:39,,
69,6.0,,3.0,,2453931058188230,Fiscal Court 10-08-2019,,,3.0,Fiscal Court 10-08-2019,2019-10-08 09:30:30,https://video-atl3-1.xx.fbcdn.net/v/t42.26565-2/10000000_576953612904388_3984461999382141052_n.mp4?_nc_cat=104&_nc_sid=985c63&efg=eyJ2ZW5jb2RlX3RhZyI6Im9lcF9zZCJ9&_nc_ohc=hP4M4QY8_V8AX9odoWk&_nc_ht=video-atl3-1.xx&oh=a2dc7e5af71f8074be4cead111568f13&oe=5F5D59A5,
70,10.0,https://scontent-atl3-1.xx.fbcdn.net/v/t1.0-9/72530791_1363577427138479_5563097995492196352_n.png?_nc_cat=106&_nc_sid=8024bb&_nc_ohc=AXz2S4yIic4AX-BQbcy&_nc_ht=scontent-atl3-1.xx&oh=db34ca3898b271d30a38939ad0d18168&oe=5F81792C,98.0,https://www.fs.usda.gov/detail/dbnf/alerts-notices/?cid=stelprdb5278374,1363577593805129,"Madison County Judge Executive Reagan Taylor, in consultation with Madison County Fire Chief Tim Gray, lifted the countywide burn ban put into effect by Executive Order on August 9, 2019.
Citizens are still required to adhere to the current Kentucky Forestry Burn Ban that is in effect annually in Kentucky from October 1 through December 15 and February 15 through April 30. This Forestry Ban states it is illegal to burn anything between the hours of 6 a.m. and 6 p.m. within 150 feet of any woodland or brushland. For more information visit https://www.fs.usda.gov/detail/dbnf/alerts-notices/?cid=stelprdb5278374
In addition, citizens residing within the city limits of Richmond and Berea are still required to acquire permits prior to any burning.",https://facebook.com/story.php?story_fbid=1363577593805129&id=415070505322514,,0.0,"Madison County Judge Executive Reagan Taylor, in consultation with Madison County Fire Chief Tim Gray, lifted the countywide burn ban put into effect by Executive Order on August 9, 2019.
Citizens are still required to adhere to the current Kentucky Forestry Burn Ban that is in effect annually in Kentucky from October 1 through December 15 and February 15 through April 30. This Forestry Ban states it is illegal to burn anything between the hours of 6 a.m. and 6 p.m. within 150 feet of any woodland or brushland. For more information visit https://www.fs.usda.gov/detail/dbnf/alerts-notices/?cid=stelprdb5278374
In addition, citizens residing within the city limits of Richmond and Berea are still required to acquire permits prior to any burning.",2019-10-07 11:01:38,,
71,2.0,https://scontent-atl3-1.xx.fbcdn.net/v/t1.0-9/fr/cp0/e15/q65/72280800_1361188377377384_1168927988725579776_n.jpg?_nc_cat=103&_nc_sid=110474&_nc_ohc=vXYEmkHlF9QAX8h6Ohx&_nc_ht=scontent-atl3-1.xx&tp=14&oh=fe619fe9694ccec575d0f0a8f3bda07d&oe=5F849DF8,5.0,,1361193367376885,"Cars are starting to arrive! Don’t forget to bring your old oil based paint, batteries, pesticides, electronics, and more to the Household Hazardous Waste event today from 9-3pm at Road Department South at 209 Clarksville Road.",https://facebook.com/story.php?story_fbid=1361193367376885&id=415070505322514,,0.0,"Cars are starting to arrive! Don’t forget to bring your old oil based paint, batteries, pesticides, electronics, and more to the Household Hazardous Waste event today from 9-3pm at Road Department South at 209 Clarksville Road.",2019-10-05 09:46:18,,
72,0.0,https://scontent-atl3-1.xx.fbcdn.net/v/t1.0-9/72749406_1360139467482275_3819850390149529600_o.png?_nc_cat=108&_nc_sid=8024bb&_nc_ohc=Zc-8VWfhsrYAX_HvGJU&_nc_ht=scontent-atl3-1.xx&oh=830e6713c0d31c31dd2b0bc8cd9b5c8d&oe=5F837CA9,15.0,,1360142860815269,"This Saturday, October 5th, from 9 am - 3 pm is the Household Hazardous Waste Event!! Please bring the accepted items to Road Department South.",https://facebook.com/story.php?story_fbid=1360142860815269&id=415070505322514,,0.0,"This Saturday, October 5th, from 9 am - 3 pm is the Household Hazardous Waste Event!! Please bring the accepted items to Road Department South.",2019-10-04 09:30:01,,
73,5.0,https://scontent-atl3-1.xx.fbcdn.net/v/t1.0-9/fr/cp0/e15/q65/72099294_1357534487742773_2445526087392821248_n.jpg?_nc_cat=103&_nc_sid=8024bb&_nc_ohc=I1EfG5FgaqsAX95i9Il&_nc_ht=scontent-atl3-1.xx&tp=14&oh=11cc78373e16b4067294669d486bd670&oe=5F820166,37.0,http://www.madisoncountyky.us/adopt,1357536501075905,"We are just a few of the amazing dogs in the shelter and each of us are looking for our fur-ever home. It costs $37.10 to adopt and this includes micro-chipping, $75 spay/neuter coupon, partial vaccination, dog license and free vet checkup!! Come see us today!!! Visit www.madisoncountyky.us/adopt to learn more.",https://facebook.com/story.php?story_fbid=1357536501075905&id=415070505322514,,0.0,"We are just a few of the amazing dogs in the shelter and each of us are looking for our fur-ever home. It costs $37.10 to adopt and this includes micro-chipping, $75 spay/neuter coupon, partial vaccination, dog license and free vet checkup!! Come see us today!!! Visit www.madisoncountyky.us/adopt to learn more.",2019-10-01 08:47:21,,
74,1.0,https://scontent-atl3-1.xx.fbcdn.net/v/t1.0-9/71697532_1352024768293745_5136856430195769344_o.png?_nc_cat=105&_nc_sid=8024bb&_nc_ohc=3PycIgD4xccAX9JTDz6&_nc_ht=scontent-atl3-1.xx&oh=76a1eb7bd67d59252da7ce438bfb239f&oe=5F82E25B,7.0,,1352024871627068,"The Madison County State Highway Crew with assistance from the Kentucky State Police will be doing Rolling Road Blocks starting at Midnight
On I-75 Southbound lanes and until 6:00 Am Wednesday morning. The work will be from the 80 Mile marker Southbound to the Madison – Rockcastle County Line ( 73 mm) .The Rolling Road Blocks will start at the 86 mm Southbound. The Southbound on ramps @ Exit 77 & 76 will be closed by KSP for short durations during this work. All workers and Equipment will be off the Interstate by 6:00 Am or before.",https://facebook.com/story.php?story_fbid=1352024871627068&id=415070505322514,,0.0,"The Madison County State Highway Crew with assistance from the Kentucky State Police will be doing Rolling Road Blocks starting at Midnight
On I-75 Southbound lanes and until 6:00 Am Wednesday morning. The work will be from the 80 Mile marker Southbound to the Madison – Rockcastle County Line ( 73 mm) .The Rolling Road Blocks will start at the 86 mm Southbound. The Southbound on ramps @ Exit 77 & 76 will be closed by KSP for short durations during this work. All workers and Equipment will be off the Interstate by 6:00 Am or before.",2019-09-24 15:34:41,,
75,110.0,,22.0,,2469245553171551,Fiscal Court Meeting 9-24-2019,,,33.0,Fiscal Court Meeting 9-24-2019,2019-09-24 09:32:33,https://video-atl3-1.xx.fbcdn.net/v/t42.26565-2/10000000_268651317797543_2127205746018188230_n.mp4?_nc_cat=100&_nc_sid=985c63&efg=eyJ2ZW5jb2RlX3RhZyI6Im9lcF9zZCJ9&_nc_ohc=6rMXM8hymCQAX_0B2GG&_nc_ht=video-atl3-1.xx&oh=a430c530ccd1246ffa428aaaa5c6f07d&oe=5F5D621D,
76,3.0,https://scontent-atl3-1.xx.fbcdn.net/v/t1.0-9/70714993_1348743305288558_8708887185891262464_n.png?_nc_cat=107&_nc_sid=8024bb&_nc_ohc=mcs-zCCPFyIAX8qiZSN&_nc_oc=AQle1c3GsxXM3DDwj43E4Eh0Pp-FRKqZXRmMM4697iPQim5Fpabq1tJOUSeAyKvmDXg&_nc_ht=scontent-atl3-1.xx&oh=a7059bb9569d41618872d83719ee7b39&oe=5F81956F,13.0,,1348743331955222,,https://facebook.com/story.php?story_fbid=1348743331955222&id=415070505322514,,0.0,,2019-09-20 11:10:57,,
77,25.0,https://scontent-atl3-1.xx.fbcdn.net/v/t1.0-9/fr/cp0/e15/q65/70047981_1343412699154952_602486317086932992_n.jpg?_nc_cat=106&_nc_sid=110474&_nc_ohc=Ibbk1t28wiAAX9WfqdB&_nc_ht=scontent-atl3-1.xx&tp=14&oh=20abc8cb0819c8c5445f50601d55755e&oe=5F81FCBB,74.0,,1343412715821617,"We had a great discussion today between leadership with the City of Richmond and Madison County about future uses of the Armory. We await a report from the Department of Corrections and architects within the week about possible uses. Thank you to Mayor Blythe, City Manager Minerich, Rep. Deanna Frazier, Jailer Tussey and the Department of Corrections staff for joining Judge Taylor on today’s tour.",https://facebook.com/story.php?story_fbid=1343412715821617&id=415070505322514,,0.0,"We had a great discussion today between leadership with the City of Richmond and Madison County about future uses of the Armory. We await a report from the Department of Corrections and architects within the week about possible uses. Thank you to Mayor Blythe, City Manager Minerich, Rep. Deanna Frazier, Jailer Tussey and the Department of Corrections staff for joining Judge Taylor on today’s tour.",2019-09-13 12:39:13,,
78,21.0,https://scontent-atl3-1.xx.fbcdn.net/v/t1.0-9/fr/cp0/e15/q65/70220245_1341066152722940_5754161776023306240_o.jpg?_nc_cat=111&_nc_sid=8024bb&_nc_ohc=GUlaK_fXVqEAX8LNi3R&_nc_ht=scontent-atl3-1.xx&tp=14&oh=2e7a81f391c71cce17910d001a5dfe30&oe=5F82C45E,11.0,http://www.madisoncountyky.us/publicsafety,1341066499389572,"Today, our community leaders are making serious decisions about our County's future. The following PowerPoint was presented at the Town Hall Meeting and we hope you will take a few minutes to review the facts prior to making your decision. Visit www.madisoncountyky.us/publicsafety for an overview.",https://facebook.com/story.php?story_fbid=1341066499389572&id=415070505322514,,0.0,"Today, our community leaders are making serious decisions about our County's future. The following PowerPoint was presented at the Town Hall Meeting and we hope you will take a few minutes to review the facts prior to making your decision. Visit www.madisoncountyky.us/publicsafety for an overview.",2019-09-10 14:20:00,,
79,380.0,,39.0,,2299653043628422,Public Hearing for Ord. 19-14 Ad Valorem Rate,,,83.0,Public Hearing for Ord. 19-14 Ad Valorem Rate,2019-09-10 13:59:25,https://scontent-atl3-1.xx.fbcdn.net/v/t66.36281-6/10000000_118802463092043_5312298739787199474_n.mp4?_nc_cat=101&_nc_sid=985c63&efg=eyJ2ZW5jb2RlX3RhZyI6Im9lcF9zZCJ9&_nc_ohc=yCO3Pr5Gkt8AX9KU8wb&_nc_oc=AQlPLyDQJk5wDQUpgEBnnjB_GNQbNhUtqmjFYE8rOQ50WoBFyCInuctCOLMAhHV_sLM&_nc_ht=scontent-atl3-1.xx&oh=b3d13da9c249e73e89790d4cd10b86b9&oe=5F83F89B,
80,15.0,,8.0,,768350653622384,fiscal court 09-10-19,,,18.0,fiscal court 09-10-19,2019-09-10 09:30:52,https://scontent-atl3-1.xx.fbcdn.net/v/t66.36281-6/10000000_198655018286961_7947803303464652207_n.mp4?_nc_cat=100&_nc_sid=985c63&efg=eyJ2ZW5jb2RlX3RhZyI6Im9lcF9zZCJ9&_nc_ohc=yA9bFJrwQ-QAX-Wvc6Q&_nc_ht=scontent-atl3-1.xx&oh=31effb9ce86ab0ff2675470190afaabb&oe=5F8307D3,
81,16.0,https://scontent-atl3-1.xx.fbcdn.net/v/t1.0-9/fr/cp0/e15/q65/69470193_1337217246441164_6282402883249897472_n.jpg?_nc_cat=111&_nc_sid=8024bb&_nc_ohc=oQ0LaBDpCLcAX96z48Z&_nc_ht=scontent-atl3-1.xx&tp=14&oh=46cff4562d16070c9cf0d46d404e76a3&oe=5F83D4B9,33.0,http://www.madisoncountyky.us/adopt,1337223063107249,"We currently have a full house at the Animal Shelter and these pups would love to come home with you!!! Viewing hours are from 11 a.m.- 4 p.m.. You can adopt one of these lovely dogs for $37.10 and this includes micro-chipping, $75 spay/neuter coupon, partial vaccination, dog license and free vet checkup!! Come see us today!!! Visit www.madisoncountyky.us/adopt to learn more.",https://facebook.com/story.php?story_fbid=1337223063107249&id=415070505322514,,0.0,"We currently have a full house at the Animal Shelter and these pups would love to come home with you!!! Viewing hours are from 11 a.m.- 4 p.m.. You can adopt one of these lovely dogs for $37.10 and this includes micro-chipping, $75 spay/neuter coupon, partial vaccination, dog license and free vet checkup!! Come see us today!!! Visit www.madisoncountyky.us/adopt to learn more.",2019-09-05 13:03:44,,
82,86.0,https://scontent-atl3-1.xx.fbcdn.net/v/t1.0-9/fr/cp0/e15/q65/69083522_1331386803690875_7918066823457669120_n.jpg?_nc_cat=102&_nc_sid=110474&_nc_ohc=Sb12NcLtjAUAX-zTFmp&_nc_oc=AQk-vNlQKbx2Ya0oaW0TQ9qHcDLI5XGXkS-M1_ZAXjMlTIJ2AD9cTzwKytw0F__2Bbc&_nc_ht=scontent-atl3-1.xx&tp=14&oh=68ef4d7a8e74e44dacc058c36098490f&oe=5F81B8DB,40.0,,1331388087024080,"In hopes to help people understand how to calculate their tax bill, here is a sample comparing last year and this year on a property assessed at $100,000.",https://facebook.com/story.php?story_fbid=1331388087024080&id=415070505322514,,0.0,"In hopes to help people understand how to calculate their tax bill, here is a sample comparing last year and this year on a property assessed at $100,000.",2019-08-28 16:42:59,,
83,65.0,,87.0,,1331282320367990,We understand an evening meeting is important to ensure public engagement on this issue. We look forward to a respectful and informative exchange of ideas that leads to a solution for our community.,https://facebook.com/story.php?story_fbid=1331282320367990&id=415070505322514,,0.0,We understand an evening meeting is important to ensure public engagement on this issue. We look forward to a respectful and informative exchange of ideas that leads to a solution for our community.,2019-08-28 13:09:47,,
84,68.0,https://scontent-atl3-1.xx.fbcdn.net/v/t1.0-9/fr/cp0/e15/q65/69645318_1330415327121356_3640144448769228800_o.jpg?_nc_cat=111&_nc_sid=8024bb&_nc_ohc=d2Efeh44M_UAX9gCbJv&_nc_ht=scontent-atl3-1.xx&tp=14&oh=b8ecd9b7bbbf330c3ce082f32e58af79&oe=5F82AACF,31.0,,1330416107121278,,https://facebook.com/story.php?story_fbid=1330416107121278&id=415070505322514,,0.0,,2019-08-27 10:30:00,,
85,66.0,,14.0,,2990550481170565,Fiscal Court Meeting 08-27-2019,,,37.0,Fiscal Court Meeting 08-27-2019,2019-08-27 09:30:14,https://scontent-atl3-1.xx.fbcdn.net/v/t66.36281-6/10000000_3468777716505723_8932891858375309507_n.mp4?_nc_cat=103&_nc_sid=985c63&efg=eyJ2ZW5jb2RlX3RhZyI6Im9lcF9zZCJ9&_nc_ohc=wSbDF4cjHxQAX-dFjiA&_nc_ht=scontent-atl3-1.xx&oh=1ecaa01c511f125ea649108bcd58688a&oe=5F840B72,
86,23.0,https://scontent-atl3-1.xx.fbcdn.net/v/t1.0-9/fr/cp0/e15/q65/68636738_1326993504130205_6628594903918051328_n.jpg?_nc_cat=105&_nc_sid=110474&_nc_ohc=cy2bCGvrNJgAX-IzafG&_nc_ht=scontent-atl3-1.xx&tp=14&oh=f05b961ad5df618ded2cd2308255cb73&oe=5F83BAD2,61.0,http://www.madisoncountyky.us/adopt,1326995234130032,"Correction: The puppies will be available tomorrow (Friday) for adoption.

Look who we have at the Madison County Animal Shelter! These 5 pups are 8 week old labs (3 boys and 2 girls) ready for a great home! Check out all of our furry friends at www.madisoncountyky.us/adopt. We open Monday for viewing/adoption at 11am.",https://facebook.com/story.php?story_fbid=1326995234130032&id=415070505322514,,0.0,"Correction: The puppies will be available tomorrow (Friday) for adoption.

Look who we have at the Madison County Animal Shelter! These 5 pups are 8 week old labs (3 boys and 2 girls) ready for a great home! Check out all of our furry friends at www.madisoncountyky.us/adopt. We open Monday for viewing/adoption at 11am.",2019-08-22 18:09:01,,
87,0.0,,6.0,,1326262350869987,"The Kentucky Department of Transportation with assistance from the Kentucky State Police will be conducting “Rolling Road Blocks” starting at midnight 8-22-2019 ending at 6:00 AM (Thursday 8-22-2019) morning.

The pothole repair work will be both North and Southbound sides of I-75 from the Rockcastle/ Madison County Line (MM73) to RIchmond Exit 87

The work will be postponed to a later date if it rains.",https://facebook.com/story.php?story_fbid=1326262350869987&id=415070505322514,,0.0,"The Kentucky Department of Transportation with assistance from the Kentucky State Police will be conducting “Rolling Road Blocks” starting at midnight 8-22-2019 ending at 6:00 AM (Thursday 8-22-2019) morning.

The pothole repair work will be both North and Southbound sides of I-75 from the Rockcastle/ Madison County Line (MM73) to RIchmond Exit 87

The work will be postponed to a later date if it rains.",2019-08-21 18:46:46,,
88,0.0,https://scontent-atl3-1.xx.fbcdn.net/v/t1.0-9/68589189_1321661384663417_2753859130987905024_n.png?_nc_cat=111&_nc_sid=8024bb&_nc_ohc=YIctUQbWz_IAX8zUEkp&_nc_ht=scontent-atl3-1.xx&oh=78cbf0e76ebbc56ec44a57ea33cfbb9e&oe=5F8303AD,14.0,http://www.madisoncountyky.us/jobs,1321662637996625,EMA/CSEPP is hiring. Positions starting at $16.41/hr. For more information and how to apply visit: www.madisoncountyky.us/jobs,https://facebook.com/story.php?story_fbid=1321662637996625&id=415070505322514,,0.0,EMA/CSEPP is hiring. Positions starting at $16.41/hr. For more information and how to apply visit: www.madisoncountyky.us/jobs,2019-08-15 08:23:03,,
89,0.0,https://scontent-atl3-1.xx.fbcdn.net/v/t1.0-9/68578236_1321164904713065_6934104934228951040_n.png?_nc_cat=108&_nc_sid=8024bb&_nc_ohc=OgYC-C3_mzQAX_9gjQl&_nc_oc=AQngQ2CrpugyZBOOP7zk3Jba_wsxhdSzjcGSQAaz0cOmhUcNJmvfOOhtZYz9IYRA6tc&_nc_ht=scontent-atl3-1.xx&oh=6489e8bd90636b9bfc4fdd721d35f6c6&oe=5F848003,7.0,http://www.madisoncountyky.us/jobs,1321165071379715,We're hiring!! Do you meet the qualifications below? Please visit: www.madisoncountyky.us/jobs to apply for the Applications Specialist position and find out more information.,https://facebook.com/story.php?story_fbid=1321165071379715&id=415070505322514,,0.0,We're hiring!! Do you meet the qualifications below? Please visit: www.madisoncountyky.us/jobs to apply for the Applications Specialist position and find out more information.,2019-08-14 16:11:08,,
90,1.0,https://scontent-atl3-1.xx.fbcdn.net/v/t1.0-9/fr/cp0/e15/q65/67884088_1320394524790103_9183037595251113984_n.jpg?_nc_cat=104&_nc_sid=8024bb&_nc_ohc=a3q1w5txfgkAX-p-Jvt&_nc_oc=AQlVWlfPnMkT8jXadw5mzai3NoBYhnUU3iRVoCAqc7f799Veh5TBgGUIwZf-Zj8Pg2I&_nc_ht=scontent-atl3-1.xx&tp=14&oh=12d1c78230fa56cb2f439e02d6b27209&oe=5F840300,11.0,http://www.nomorelitter.org/,1320394594790096,"Needing Volunteers!!!! 25th Annual Kentucky River Sweep this Saturday, August 17, 2019 from 9:00 a.m. to 1 p.m. Please visit www.nomorelitter.org for more information.",https://facebook.com/story.php?story_fbid=1320394594790096&id=415070505322514,,0.0,"Needing Volunteers!!!! 25th Annual Kentucky River Sweep this Saturday, August 17, 2019 from 9:00 a.m. to 1 p.m. Please visit www.nomorelitter.org for more information.",2019-08-13 15:20:13,,
91,7.0,,13.0,,402315183749400,Fiscal Court Meeting 8-12-2019,,,6.0,Fiscal Court Meeting 8-12-2019,2019-08-13 09:31:33,https://scontent-atl3-1.xx.fbcdn.net/v/t66.36281-6/10000000_660699091496442_659982544190442943_n.mp4?_nc_cat=102&_nc_sid=985c63&efg=eyJ2ZW5jb2RlX3RhZyI6Im9lcF9zZCJ9&_nc_ohc=8xRKq8xnt2IAX9OEGyI&_nc_oc=AQkNkvEHw241gTEwRWCpmf2k0_-A2sipeAR_Mr5B_2SWP57RXr3DhBL_E632RWkf0Go&_nc_ht=scontent-atl3-1.xx&oh=5434e882081682f27a2dfa0dc8132f78&oe=5F81CFE6,
92,2.0,https://scontent-atl3-1.xx.fbcdn.net/v/t1.0-9/67715971_1317508305078725_522300634880278528_n.png?_nc_cat=101&_nc_sid=8024bb&_nc_ohc=zyafDdflKCAAX-28KCN&_nc_ht=scontent-atl3-1.xx&oh=3ab360ac9accdce56bb2cf71f2b7d6a7&oe=5F81AF59,29.0,,1317508621745360,"Due to excessive dryness, Judge Executive Reagan Taylor has issued a burn ban notice for Madison County. This ban remains in effect until further notice. Madison County Fire Department",https://facebook.com/story.php?story_fbid=1317508621745360&id=415070505322514,,0.0,"Due to excessive dryness, Judge Executive Reagan Taylor has issued a burn ban notice for Madison County. This ban remains in effect until further notice. Madison County Fire Department",2019-08-09 13:40:54,,
93,0.0,https://scontent-atl3-1.xx.fbcdn.net/v/t1.0-9/fr/cp0/e15/q65/67970604_2422421871335493_5666304904268873728_n.jpg?_nc_cat=108&_nc_sid=8024bb&_nc_ohc=g6o2FzKt77cAX_zzKO5&_nc_ht=scontent-atl3-1.xx&tp=14&oh=7a52d948d99d4fbb3d0c0e4a387789f3&oe=5F834DD5,4.0,,1316624061833816,,https://facebook.com/story.php?story_fbid=1316624061833816&id=415070505322514,"Madison County Emergency Management Agency
August 8, 2019 at 9:01 AM ·

Per Richmond Utilities: West Kentucky Avenue at the corner of Westover Avenue will be closed for a few hours due to sewer work in that area.",2.0,"Madison County Emergency Management Agency
August 8, 2019 at 9:01 AM ·

Per Richmond Utilities: West Kentucky Avenue at the corner of Westover Avenue will be closed for a few hours due to sewer work in that area.",2019-08-08 09:24:23,,
94,0.0,https://scontent-atl3-1.xx.fbcdn.net/v/t1.0-9/67693079_1315400485289507_4905276990505877504_n.png?_nc_cat=106&_nc_sid=8024bb&_nc_ohc=gar6Ax_34V4AX-WuKH4&_nc_ht=scontent-atl3-1.xx&oh=f325b4f2e66931b633d810173fd2ea07&oe=5F81659E,14.0,http://www.madisoncountyky.us/jobs,1315400921956130,Madison County Solid Waste and Road Department is hiring!! Starting pay is $13/hr + benefits. For more information and to apply visit: www.madisoncountyky.us/jobs,https://facebook.com/story.php?story_fbid=1315400921956130&id=415070505322514,,0.0,Madison County Solid Waste and Road Department is hiring!! Starting pay is $13/hr + benefits. For more information and to apply visit: www.madisoncountyky.us/jobs,2019-08-06 15:20:36,,
95,22.0,https://scontent-atl3-1.xx.fbcdn.net/v/t1.0-9/67438302_1311016842394538_4934593247562432512_n.png?_nc_cat=107&_nc_sid=8024bb&_nc_ohc=3LiIyLuQxcQAX-Sz924&_nc_ht=scontent-atl3-1.xx&oh=854d560208da2eea3eb5085626c42e8d&oe=5F817F5E,24.0,http://www.madisoncountyky.us/jobs,1311016925727863,"Are you or someone you know looking for a job? We're hiring! Custodian starting pay is $10/hr plus benefits. Deadline to apply is Sunday, August 4, 2019, at 11:59 (ET). For more information and to apply visit: www.madisoncountyky.us/jobs",https://facebook.com/story.php?story_fbid=1311016925727863&id=415070505322514,,0.0,"Are you or someone you know looking for a job? We're hiring! Custodian starting pay is $10/hr plus benefits. Deadline to apply is Sunday, August 4, 2019, at 11:59 (ET). For more information and to apply visit: www.madisoncountyky.us/jobs",2019-07-31 12:38:30,,
96,1.0,https://scontent-atl3-1.xx.fbcdn.net/v/t1.0-9/67173914_1306036072892615_5780118879028117504_n.png?_nc_cat=108&_nc_sid=8024bb&_nc_ohc=ZUyGaXEEKWoAX-7gcHv&_nc_ht=scontent-atl3-1.xx&oh=4269108d0caf3cc51a8a111ec663ab04&oe=5F83D58C,24.0,http://www.madisoncountyky.us/adopt,1306036772892545,The Madison County Animal Shelter has some exciting announcements to make in the coming weeks..stay tuned! Until then...check out these furry friends. You can see all of our adoptable pets at www.madisoncountyky.us/adopt.,https://facebook.com/story.php?story_fbid=1306036772892545&id=415070505322514,,0.0,The Madison County Animal Shelter has some exciting announcements to make in the coming weeks..stay tuned! Until then...check out these furry friends. You can see all of our adoptable pets at www.madisoncountyky.us/adopt.,2019-07-24 16:12:10,,
97,0.0,https://scontent-atl3-1.xx.fbcdn.net/v/t1.0-9/67084680_1305961569566732_6951582251373035520_n.png?_nc_cat=109&_nc_sid=8024bb&_nc_ohc=9emUb3rrxQ4AX_1XJSS&_nc_ht=scontent-atl3-1.xx&oh=66bfc1467d0011b3620834119576071b&oe=5F81AB7A,6.0,http://www.madisoncountyky.us/jobs,1305960862900136,"We're hiring!! Do you meet the qualifications below? Starting salary is $30,000/yr. Please visit: www.madisoncountyky.us/jobs to apply and find out more information.",https://facebook.com/story.php?story_fbid=1305960862900136&id=415070505322514,,0.0,"We're hiring!! Do you meet the qualifications below? Starting salary is $30,000/yr. Please visit: www.madisoncountyky.us/jobs to apply and find out more information.",2019-07-24 13:30:43,,
98,7.0,,8.0,,398687447435790,,,,5.0,,2019-07-23 09:31:32,https://video-atl3-1.xx.fbcdn.net/v/t42.26565-2/10000000_330572344608729_7916678231896340509_n.mp4?_nc_cat=103&_nc_sid=985c63&efg=eyJ2ZW5jb2RlX3RhZyI6Im9lcF9zZCJ9&_nc_ohc=_vVdv3rURY0AX-FWn6J&_nc_ht=video-atl3-1.xx&oh=a96692df06177ab54c63bb2e5fe8eb8c&oe=5F5D5C6C,
99,0.0,,2.0,https://www.govdeals.com/index.cfm?fa=Main.AdvSearchResultsNew&searchPg=Location&inv_num&category=00&kWord&kWordSelect=2&sortBy=ad&agency=8234&state&country&locID=35592&timing=bySimple&locationType=state&timeType&timingWithin=1,1299421646887391,"Madison County Fiscal Court has items for auction on Gov Deals. Click the link below and place your bid. The items listed will run until Friday, July 26, 2019.
https://www.govdeals.com/index.cfm?fa=Main.AdvSearchResultsNew&searchPg=Location&inv_num=&category=00&kWord=&kWordSelect=2&sortBy=ad&agency=8234&state=&country=&locID=35592&timing=bySimple&locationType=state&timeType=&timingWithin=1",https://facebook.com/story.php?story_fbid=1299421646887391&id=415070505322514,"GOVDEALS.COM
Results for Madison County Fiscal Court, KY - govdeals.com",0.0,"Madison County Fiscal Court has items for auction on Gov Deals. Click the link below and place your bid. The items listed will run until Friday, July 26, 2019.
https://www.govdeals.com/index.cfm?fa=Main.AdvSearchResultsNew&searchPg=Location&inv_num=&category=00&kWord=&kWordSelect=2&sortBy=ad&agency=8234&state=&country=&locID=35592&timing=bySimple&locationType=state&timeType=&timingWithin=1

GOVDEALS.COM
Results for Madison County Fiscal Court, KY - govdeals.com",2019-07-15 08:37:02,,
100,1.0,,7.0,,371291993590236,Special call Fiscal Court Meeting 7-10-2109,,,2.0,Special call Fiscal Court Meeting 7-10-2109,2019-07-10 13:00:30,https://video-atl3-1.xx.fbcdn.net/v/t42.26565-2/10000000_751289095618157_8395784961883912213_n.mp4?_nc_cat=101&_nc_sid=985c63&efg=eyJ2ZW5jb2RlX3RhZyI6Im9lcF9zZCJ9&_nc_ohc=a4Olk6iwoLgAX-x-myE&_nc_ht=video-atl3-1.xx&oh=9b48c52d29004a9fac8b272c9f4d574d&oe=5F5D5F7B,
101,3.0,,6.0,,2391549367800521,,,,7.0,,2019-07-09 09:35:32,https://video-atl3-1.xx.fbcdn.net/v/t42.26565-2/10000000_289235059086739_190876905919086527_n.mp4?_nc_cat=100&_nc_sid=985c63&efg=eyJ2ZW5jb2RlX3RhZyI6Im9lcF9zZCJ9&_nc_ohc=K8qWMv40XT0AX9q4bSX&_nc_ht=video-atl3-1.xx&oh=cea9597bc60d7299bfcc0887e8306b98&oe=5F5D6017,
102,5.0,,5.0,,1171337236323714,Madison County Fiscal Court - 06-25-2019,,,3.0,Madison County Fiscal Court - 06-25-2019,2019-06-25 09:30:16,https://video-atl3-1.xx.fbcdn.net/v/t42.26565-2/10000000_155176119431659_726159297884627900_n.mp4?_nc_cat=105&_nc_sid=985c63&efg=eyJ2ZW5jb2RlX3RhZyI6Im9lcF9zZCJ9&_nc_ohc=W4fJ8i91t_wAX8cPioR&_nc_oc=AQma5XHF90o_nAZfGBL4_695ew75FuDuGViU1mY1BtRWOeXuRHLbQZvpzIFuIFz_wa0&_nc_ht=video-atl3-1.xx&oh=b2849924dddfafb97b30550828ff232d&oe=5F5D5931,
103,11.0,,28.0,,1276141915882031,"UPDATE: A super excited girl came in and adopted this cute little guy!!!
Our animal shelter has some super cute and fun loving pups. They are looking for a fur-ever home and would love to come home with you this weekend! We will adopt out today until 4:00 pm. Cost is $37.10 - this includes 1st round vaccines, wellness vet check, microchip, and a spay and neuter coupon.",,,0.0,"UPDATE: A super excited girl came in and adopted this cute little guy!!!
Our animal shelter has some super cute and fun loving pups. They are looking for a fur-ever home and would love to come home with you this weekend! We will adopt out today until 4:00 pm. Cost is $37.10 - this includes 1st round vaccines, wellness vet check, microchip, and a spay and neuter coupon.",2019-06-14 11:12:15,https://video-atl3-1.xx.fbcdn.net/v/t42.9040-2/64846976_796850580715153_5947700591588278272_n.mp4?_nc_cat=105&_nc_sid=985c63&efg=eyJ2ZW5jb2RlX3RhZyI6InN2ZV9zZCJ9&_nc_ohc=MXq7FXOwzJwAX8DCa8U&_nc_ht=video-atl3-1.xx&oh=d0a77b6a54fd6fa1f13c824c46d06318&oe=5F5D5A24,
104,1.0,https://scontent-atl3-1.xx.fbcdn.net/v/t1.0-9/62460544_1275455235950699_5380141433883721728_n.png?_nc_cat=106&_nc_sid=8024bb&_nc_ohc=bR_GwsSC1cMAX_vZOlW&_nc_ht=scontent-atl3-1.xx&oh=2e55aec2db346c4e21a52ea4e1252c9b&oe=5F82AB22,12.0,http://www.madisoncountyky.us/jobs,1275456192617270,"We are in need of a Code Enforcement Officer. This person would be responsible for the enforcement of codes, regulations, and ordinances adopted by Madison County Fiscal Court. These include zoning, business license administration, International Property Maintenance Code, and any violations thereof. For more details and to apply visit: www.madisoncountyky.us/jobs",https://facebook.com/story.php?story_fbid=1275456192617270&id=415070505322514,,0.0,"We are in need of a Code Enforcement Officer. This person would be responsible for the enforcement of codes, regulations, and ordinances adopted by Madison County Fiscal Court. These include zoning, business license administration, International Property Maintenance Code, and any violations thereof. For more details and to apply visit: www.madisoncountyky.us/jobs",2019-06-13 13:13:51,,
105,9.0,https://scontent-atl3-1.xx.fbcdn.net/v/t1.0-9/62500492_1275372672625622_5304270694865960960_n.png?_nc_cat=107&_nc_sid=8024bb&_nc_ohc=NG0x3wXAkOAAX_xYVRq&_nc_oc=AQme3Fi0T6FGIe4aAMYVcB1a6lmN7rpNB_XqnAOSY1F4G1SqfRXKelg7BeZJIGB6CJA&_nc_ht=scontent-atl3-1.xx&oh=69f82ab2549259df0288743f69622ce2&oe=5F82C6F5,25.0,http://www.madisoncountyky.us/jobs,1275373139292242,Do you fit the qualifications below? Starting salary is $12/hr. Apply at: www.madisoncountyky.us/jobs,https://facebook.com/story.php?story_fbid=1275373139292242&id=415070505322514,,0.0,Do you fit the qualifications below? Starting salary is $12/hr. Apply at: www.madisoncountyky.us/jobs,2019-06-13 11:05:18,,
106,2.0,,4.0,,319309358982581,Madison county Fiscal Court 6-11-2019,,,4.0,Madison county Fiscal Court 6-11-2019,2019-06-11 09:30:22,https://video-atl3-1.xx.fbcdn.net/v/t42.26565-2/10000000_1419872111535393_4723258356669751490_n.mp4?_nc_cat=105&_nc_sid=985c63&efg=eyJ2ZW5jb2RlX3RhZyI6Im9lcF9zZCJ9&_nc_ohc=kC6to3zNAXIAX8x68Wq&_nc_ht=video-atl3-1.xx&oh=a3dd6dfff35e72dd3bdf6f9a90d0db58&oe=5F5D6185,
107,0.0,https://scontent-atl3-1.xx.fbcdn.net/v/t1.0-9/fr/cp0/e15/q65/59691596_1247567758739447_4375252810426482688_n.jpg?_nc_cat=111&_nc_sid=8024bb&_nc_ohc=SQI8hqs-0BAAX-kSngO&_nc_ht=scontent-atl3-1.xx&tp=14&oh=3aad5f4113f82095b96d79dc0ad66aee&oe=5F80D6BC,2.0,https://www.census.gov/jobs,1247567995406090,The U.S. Census Bureau is recruiting thousands of workers for temporary jobs available nationwide in advance of the 2020 Census. Visit https://www.census.gov/jobs for more information,https://facebook.com/story.php?story_fbid=1247567995406090&id=415070505322514,,0.0,The U.S. Census Bureau is recruiting thousands of workers for temporary jobs available nationwide in advance of the 2020 Census. Visit https://www.census.gov/jobs for more information,2019-06-07 12:48:00,,
108,0.0,https://scontent-atl3-1.xx.fbcdn.net/v/t1.0-9/fr/cp0/e15/q65/61889467_1268511196645103_536580305922818048_o.jpg?_nc_cat=101&_nc_sid=8024bb&_nc_ohc=bhrgAPZ5qsQAX_T4G3l&_nc_ht=scontent-atl3-1.xx&tp=14&oh=ff5408ff10f5e710f56547a7ad531990&oe=5F848662,4.0,,1268511259978430,Heavy rain can bring dangerous flash floods. Be aware of weather conditions,https://facebook.com/story.php?story_fbid=1268511259978430&id=415070505322514,,0.0,Heavy rain can bring dangerous flash floods. Be aware of weather conditions,2019-06-04 16:24:42,,
109,0.0,,0.0,,1267610270068529,,https://facebook.com/story.php?story_fbid=1267610270068529&id=415070505322514,"Madison County Emergency Management Agency
June 3, 2019 at 10:04 AM ·

3 June 2019 10:00am

Linden Street between Fairview and Maple is closed. Time for shut down undetermined.",0.0,"Madison County Emergency Management Agency
June 3, 2019 at 10:04 AM ·

3 June 2019 10:00am

Linden Street between Fairview and Maple is closed. Time for shut down undetermined.",2019-06-03 11:06:13,,
110,0.0,,0.0,,,"3 June 2019 10:00am

Linden Street between Fairview and Maple is closed. Time for shut down undetermined.",https://facebook.com/story.php?story_fbid=2373592029551811&id=1399004800343877,,0.0,"3 June 2019 10:00am

Linden Street between Fairview and Maple is closed. Time for shut down undetermined.",2020-09-12 17:22:42.866275,,
111,0.0,https://scontent-atl3-1.xx.fbcdn.net/v/t1.0-9/fr/cp0/e15/q65/61621912_1267500213412868_6374889905843077120_n.jpg?_nc_cat=111&_nc_sid=8024bb&_nc_ohc=kyOs-G5-sCEAX8ogglc&_nc_ht=scontent-atl3-1.xx&tp=14&oh=19c912a2e0990148c3b1a649625fb5b8&oe=5F843B1D,11.0,,1267505213412368,Our Road Department is constantly looking for ways to do their job better. Last week they participated in a bucket truck training class. Take a look!,https://facebook.com/story.php?story_fbid=1267505213412368&id=415070505322514,,0.0,Our Road Department is constantly looking for ways to do their job better. Last week they participated in a bucket truck training class. Take a look!,2019-06-03 08:14:02,,
112,1.0,,4.0,,678549619272641,Madison County Fiscal Court - 05-28-2019,,,2.0,Madison County Fiscal Court - 05-28-2019,2019-05-28 09:30:26,https://video-atl3-1.xx.fbcdn.net/v/t42.26565-2/10000000_276452240255585_1673024463893698221_n.mp4?_nc_cat=100&_nc_sid=985c63&efg=eyJ2ZW5jb2RlX3RhZyI6Im9lcF9zZCJ9&_nc_ohc=lmWF7MOaGJYAX9o_SEJ&_nc_ht=video-atl3-1.xx&oh=cd81fb411e0269aeb35b4286eaf8e9a7&oe=5F5D586B,
113,1.0,,42.0,https://www.military.com/video/marine-corps-memorial-day-tribute,1260895637406659,"On behalf of all of our elected officials and staff, we proudly spend this Memorial Day remembering all of the military men and women who have lost their lives in the pursuit of freedom for each of us. We thank them and their families for their sacrifice for our nation.",https://facebook.com/story.php?story_fbid=1260895637406659&id=415070505322514,"MILITARY.COM
Marine Corps Memorial Day Tribute",9.0,"On behalf of all of our elected officials and staff, we proudly spend this Memorial Day remembering all of the military men and women who have lost their lives in the pursuit of freedom for each of us. We thank them and their families for their sacrifice for our nation.

MILITARY.COM
Marine Corps Memorial Day Tribute",2019-05-25 11:48:27,,
114,0.0,,4.0,https://www.census.gov/jobs,1247569028739320,The U.S. Census Bureau is recruiting thousands of workers for temporary jobs available nationwide in advance of the 2020 Census. Visit https://www.census.gov/jobs for more information,https://facebook.com/story.php?story_fbid=1247569028739320&id=415070505322514,"CENSUS.GOV
Employment Opportunities",7.0,"The U.S. Census Bureau is recruiting thousands of workers for temporary jobs available nationwide in advance of the 2020 Census. Visit https://www.census.gov/jobs for more information

CENSUS.GOV
Employment Opportunities",2019-05-22 12:50:00,,
115,1.0,,7.0,,460681454684998,budget Workshop 05-22-2019,,,3.0,budget Workshop 05-22-2019,2019-05-22 09:42:10,https://video-atl3-1.xx.fbcdn.net/v/t42.26565-2/10000000_324146025652735_7459235795266650148_n.mp4?_nc_cat=108&_nc_sid=985c63&efg=eyJ2ZW5jb2RlX3RhZyI6Im9lcF9zZCJ9&_nc_ohc=YQ7CA2mN0T0AX8wcHpp&_nc_ht=video-atl3-1.xx&oh=b7d24d127db8aa5f279432dc8f5bb069&oe=5F5D5A5F,
116,0.0,https://scontent-atl3-1.xx.fbcdn.net/v/t1.0-9/60791002_1257715911057965_5097023834045808640_n.png?_nc_cat=106&_nc_sid=8024bb&_nc_ohc=q8_OuU6k6_QAX81RuYz&_nc_ht=scontent-atl3-1.xx&oh=5989e936890c7d75b6022b850985af6d&oe=5F826685,3.0,http://madisoncountyky.us/vote,1257718004391089,Today is the day- Primary Election Day! Do you know where to vote? Check out madisoncountyky.us/vote to find where to go.,https://facebook.com/story.php?story_fbid=1257718004391089&id=415070505322514,,0.0,Today is the day- Primary Election Day! Do you know where to vote? Check out madisoncountyky.us/vote to find where to go.,2019-05-21 08:11:54,,
117,1.0,https://scontent-atl3-1.xx.fbcdn.net/v/t1.0-9/60814665_1257173344445555_4619632665702694912_n.png?_nc_cat=101&_nc_sid=8024bb&_nc_ohc=k8nkZeHs5Q8AX_CzVh_&_nc_ht=scontent-atl3-1.xx&oh=3a0845f0d9fd3e1a0e1fee5b11a99db3&oe=5F81F174,17.0,http://madisoncountyky.us/vote,1257174024445487,Do you know where to vote? Take a look at our map and find your precinct. madisoncountyky.us/vote,https://facebook.com/story.php?story_fbid=1257174024445487&id=415070505322514,,0.0,Do you know where to vote? Take a look at our map and find your precinct. madisoncountyky.us/vote,2019-05-20 13:46:33,,
118,0.0,,4.0,,1254996321329924,State of the County - Judge Reagan Taylor,,,0.0,State of the County - Judge Reagan Taylor,2019-05-17 16:23:03,https://video-atl3-1.xx.fbcdn.net/v/t42.9040-2/10000000_621593161642540_7193087171505422336_n.mp4?_nc_cat=104&_nc_sid=985c63&efg=eyJ2ZW5jb2RlX3RhZyI6InN2ZV9zZCJ9&_nc_ohc=pK8DDggIx8oAX9TG-Qn&_nc_ht=video-atl3-1.xx&oh=ba9a0bd929bc1a1b136ec499308f63f2&oe=5F5D5947,
119,1.0,,3.0,https://www.richmondregister.com/news/berea/japanese-visitors-welcomed-to-madison-county/article_39a51d06-e2b8-598b-ae38-fbbc708dc251.html,1254045768091646,,https://facebook.com/story.php?story_fbid=1254045768091646&id=415070505322514,"RICHMONDREGISTER.COM
Japanese visitors welcomed to Madison County",2.0,"RICHMONDREGISTER.COM
Japanese visitors welcomed to Madison County",2019-05-16 11:03:14,,
120,29.0,,8.0,,597826100737433,Fiscal Court 05/14/2019,,,6.0,Fiscal Court 05/14/2019,2019-05-14 09:37:31,https://video-atl3-1.xx.fbcdn.net/v/t42.26565-2/10000000_118942706274732_343284328265560501_n.mp4?_nc_cat=100&_nc_sid=985c63&efg=eyJ2ZW5jb2RlX3RhZyI6Im9lcF9zZCJ9&_nc_ohc=oMmbeD1c1mQAX-NV8Su&_nc_ht=video-atl3-1.xx&oh=8de38451b25f14fdc4ce7ad532dfa699&oe=5F5D5B9F,
121,0.0,,0.0,https://www.census.gov/jobs,1247569632072593,The U.S. Census Bureau is recruiting thousands of workers for temporary jobs available nationwide in advance of the 2020 Census. Visit https://www.census.gov/jobs for more information,https://facebook.com/story.php?story_fbid=1247569632072593&id=415070505322514,"CENSUS.GOV
Employment Opportunities",10.0,"The U.S. Census Bureau is recruiting thousands of workers for temporary jobs available nationwide in advance of the 2020 Census. Visit https://www.census.gov/jobs for more information

CENSUS.GOV
Employment Opportunities",2019-05-07 12:40:26,,
122,0.0,https://scontent-atl3-1.xx.fbcdn.net/v/t1.0-9/fr/cp0/e15/q65/59697291_1247564592073097_1414432219195244544_n.jpg?_nc_cat=108&_nc_sid=8024bb&_nc_ohc=W21pHS7zR_AAX8zqnW7&_nc_ht=scontent-atl3-1.xx&tp=14&oh=b0a019badf1812f0f1fc109efd4fc0a0&oe=5F843FD8,3.0,https://www.census.gov/jobs,1247567178739505,The U.S. Census Bureau is recruiting thousands of workers for temporary jobs available nationwide in advance of the 2020 Census. Visit https://www.census.gov/jobs for more information,https://facebook.com/story.php?story_fbid=1247567178739505&id=415070505322514,,0.0,The U.S. Census Bureau is recruiting thousands of workers for temporary jobs available nationwide in advance of the 2020 Census. Visit https://www.census.gov/jobs for more information,2019-05-07 12:36:15,,
123,1.0,https://scontent-atl3-1.xx.fbcdn.net/v/t1.0-9/fr/cp0/e15/q65/57936163_1238666042962952_3917719101253877760_n.jpg?_nc_cat=108&_nc_sid=8024bb&_nc_ohc=RW_Rd-pDnEIAX-b_qmC&_nc_ht=scontent-atl3-1.xx&tp=14&oh=bad07e394562d85588c05f733f3f28e1&oe=5F83E723,0.0,https://FloodSmart.gov/,1238666152962941,"Birds sing. Flowers bloom. Rivers flood. But with just a few simple steps, your home and belongings can be covered from unpredictable flooding this spring. Visit FloodSmart.gov today to learn more. #FloodSmart",https://facebook.com/story.php?story_fbid=1238666152962941&id=415070505322514,,0.0,"Birds sing. Flowers bloom. Rivers flood. But with just a few simple steps, your home and belongings can be covered from unpredictable flooding this spring. Visit FloodSmart.gov today to learn more. #FloodSmart",2019-04-24 12:33:26,,
124,3.0,,7.0,,1669414083161397,Fiscal Court 4-23-2019,,,2.0,Fiscal Court 4-23-2019,2019-04-23 09:30:15,https://video-atl3-1.xx.fbcdn.net/v/t42.26565-2/10000000_154474766171959_1352106975874343013_n.mp4?_nc_cat=104&_nc_sid=985c63&efg=eyJ2ZW5jb2RlX3RhZyI6Im9lcF9zZCJ9&_nc_ohc=DsxzooD48GYAX__QZ6J&_nc_ht=video-atl3-1.xx&oh=4e9a90cc43bf68028102f512444f548a&oe=5F5D6401,
125,0.0,,24.0,https://www.richmondregister.com/opinion/columns/tussey-correcting-corrections-new-jailer-experience-brings-great-change/article_08b02b23-e393-5e07-bb17-cb0a4d0f9583.html,1237736023055954,,https://facebook.com/story.php?story_fbid=1237736023055954&id=415070505322514,"RICHMONDREGISTER.COM
TUSSEY: Correcting corrections — New jailer experience brings great change

Richmond Register
April 22, 2019 at 6:08 PM ·

JAILER STEVE TUSSEY'S COLUMN: In recent months, our facility has garnered media attention for the removal of bad actors from the jail. I want to reiterate what I have said before about my commitment to having an efficient and well-run detention center. Our staff will abide by our legal obligations to report incidents occurring in our facility, we will follow national standards and procedures outlined by the Department of Corrections, and we pledge to be transparent with both law enforcement and the citizens of Madison County about the state of our facility. As Jailer, I am honored and humbled to serve the people of Madison County. I am proud to represent the dedicated staff at the Detention Center who as local sworn law enforcement agents, with the authority and the responsibility to enforce the laws of our great Commonwealth, serve as great community partners.

https://www.richmondregister.com/opinion/columns/tussey-correcting-corrections-new-jailer-experience-brings-great-change/article_08b02b23-e393-5e07-bb17-cb0a4d0f9583.html",4.0,"RICHMONDREGISTER.COM
TUSSEY: Correcting corrections — New jailer experience brings great change

Richmond Register
April 22, 2019 at 6:08 PM ·

JAILER STEVE TUSSEY'S COLUMN: In recent months, our facility has garnered media attention for the removal of bad actors from the jail. I want to reiterate what I have said before about my commitment to having an efficient and well-run detention center. Our staff will abide by our legal obligations to report incidents occurring in our facility, we will follow national standards and procedures outlined by the Department of Corrections, and we pledge to be transparent with both law enforcement and the citizens of Madison County about the state of our facility. As Jailer, I am honored and humbled to serve the people of Madison County. I am proud to represent the dedicated staff at the Detention Center who as local sworn law enforcement agents, with the authority and the responsibility to enforce the laws of our great Commonwealth, serve as great community partners.

https://www.richmondregister.com/opinion/columns/tussey-correcting-corrections-new-jailer-experience-brings-great-change/article_08b02b23-e393-5e07-bb17-cb0a4d0f9583.html",2019-04-23 06:16:47,,
126,0.0,,0.0,https://www.richmondregister.com/opinion/columns/tussey-correcting-corrections-new-jailer-experience-brings-great-change/article_08b02b23-e393-5e07-bb17-cb0a4d0f9583.html,,,https://facebook.com/story.php?story_fbid=3121412777872500&id=128843567129451,"Richmond Register
April 22, 2019 at 6:08 PM ·

JAILER STEVE TUSSEY'S COLUMN: In recent months, our facility has garnered media attention for the removal of bad actors from the jail. I want to reiterate what I have said before about my commitment to having an efficient and well-run detention center. Our staff will abide by our legal obligations to report incidents occurring in our facility, we will follow national standards and procedures outlined by the Department of Corrections, and we pledge to be transparent with both law enforcement and the citizens of Madison County about the state of our facility. As Jailer, I am honored and humbled to serve the people of Madison County. I am proud to represent the dedicated staff at the Detention Center who as local sworn law enforcement agents, with the authority and the responsibility to enforce the laws of our great Commonwealth, serve as great community partners.

https://www.richmondregister.com/opinion/columns/tussey-correcting-corrections-new-jailer-experience-brings-great-change/article_08b02b23-e393-5e07-bb17-cb0a4d0f9583.html",0.0,"Richmond Register
April 22, 2019 at 6:08 PM ·

JAILER STEVE TUSSEY'S COLUMN: In recent months, our facility has garnered media attention for the removal of bad actors from the jail. I want to reiterate what I have said before about my commitment to having an efficient and well-run detention center. Our staff will abide by our legal obligations to report incidents occurring in our facility, we will follow national standards and procedures outlined by the Department of Corrections, and we pledge to be transparent with both law enforcement and the citizens of Madison County about the state of our facility. As Jailer, I am honored and humbled to serve the people of Madison County. I am proud to represent the dedicated staff at the Detention Center who as local sworn law enforcement agents, with the authority and the responsibility to enforce the laws of our great Commonwealth, serve as great community partners.

https://www.richmondregister.com/opinion/columns/tussey-correcting-corrections-new-jailer-experience-brings-great-change/article_08b02b23-e393-5e07-bb17-cb0a4d0f9583.html",2020-09-12 17:22:42.866302,,
127,6.0,https://scontent-atl3-1.xx.fbcdn.net/v/t1.0-9/fr/cp0/e15/q65/56917836_1232522570243966_8758980295702609920_o.jpg?_nc_cat=109&_nc_sid=8024bb&_nc_ohc=ZQd-rkCJ9y0AX8IDEwo&_nc_ht=scontent-atl3-1.xx&tp=14&oh=f617703dc1ce82b30b2a9c4f4d3bc9f3&oe=5F80F1DD,64.0,,1232523510243872,Our Madison County Road Department has been really busy. Great job on all of the hard work on the Cardinal Drive Bridge!!!,https://facebook.com/story.php?story_fbid=1232523510243872&id=415070505322514,,0.0,Our Madison County Road Department has been really busy. Great job on all of the hard work on the Cardinal Drive Bridge!!!,2019-04-15 09:30:22,,
128,1.0,https://scontent-atl3-1.xx.fbcdn.net/v/t1.0-9/fr/cp0/e15/q65/56845666_1230030550493168_9191074136191926272_n.jpg?_nc_cat=111&_nc_sid=8024bb&_nc_ohc=8GXBEIIt940AX__Appy&_nc_ht=scontent-atl3-1.xx&tp=14&oh=48e5ea465d074d37defe273979f1b662&oe=5F8435A2,4.0,https://FloodSmart.gov/,1230030717159818,"April showers bring May flowers, but they can also bring floods! Visit FloodSmart.gov to learn how to purchase flood insurance before spring flooding takes you by surprise. #FloodSmart",https://facebook.com/story.php?story_fbid=1230030717159818&id=415070505322514,,0.0,"April showers bring May flowers, but they can also bring floods! Visit FloodSmart.gov to learn how to purchase flood insurance before spring flooding takes you by surprise. #FloodSmart",2019-04-11 12:44:25,,
129,0.0,,2.0,,330471117824173,Fiscal Court 04-09-2019,,,4.0,Fiscal Court 04-09-2019,2019-04-09 09:30:19,https://video-atl3-1.xx.fbcdn.net/v/t42.26565-2/10000000_313723336470833_2472760439860750308_n.mp4?_nc_cat=106&_nc_sid=985c63&efg=eyJ2ZW5jb2RlX3RhZyI6Im9lcF9zZCJ9&_nc_ohc=T7-FAYTs2dEAX_2A_qn&_nc_oc=AQkzvwmUCZ4Dh2lK5aBCQXBlcRV9nUkjWAAUIlYV5ASSvSri-5N2V29cwybrlEe7RBc&_nc_ht=video-atl3-1.xx&oh=14777b77404a8aabed164d4220d89d26&oe=5F5D5FD7,
130,0.0,https://scontent-atl3-1.xx.fbcdn.net/v/t1.0-9/56551714_1224481367714753_7724554911567839232_n.png?_nc_cat=105&_nc_sid=8024bb&_nc_ohc=TUwJZNq2e8EAX-vFHPz&_nc_ht=scontent-atl3-1.xx&oh=a52590dd2342b89e1cf0fb73d77ea56f&oe=5F8212DC,2.0,http://www.madisoncountyky.us/jobs,1224481801048043,"For full details and application, visit www.madisoncountyky.us/jobs
Animal Control Officer: position starts at $9.50/hr.
Deadline to Apply is: Sunday, April 21, 2019",https://facebook.com/story.php?story_fbid=1224481801048043&id=415070505322514,,0.0,"For full details and application, visit www.madisoncountyky.us/jobs
Animal Control Officer: position starts at $9.50/hr.
Deadline to Apply is: Sunday, April 21, 2019",2019-04-03 12:17:23,,
131,0.0,https://scontent-atl3-1.xx.fbcdn.net/v/t1.0-9/fr/cp0/e15/q65/55865075_1220386281457595_6357893221309218816_n.jpg?_nc_cat=109&_nc_sid=8024bb&_nc_ohc=JBRms8Zw-_IAX_jsZus&_nc_ht=scontent-atl3-1.xx&tp=14&oh=8e590dbda7a8ceef153ff871f13f0ba1&oe=5F81F1B7,7.0,https://FloodSmart.gov/,1220389161457307,"Spring showers can bring floods in hours, but flood policies can take up to 30 days to take effect. Now's the time to visit FloodSmart.gov and learn how to protect your home from flooding this spring. #FloodSmart",https://facebook.com/story.php?story_fbid=1220389161457307&id=415070505322514,,0.0,"Spring showers can bring floods in hours, but flood policies can take up to 30 days to take effect. Now's the time to visit FloodSmart.gov and learn how to protect your home from flooding this spring. #FloodSmart",2019-03-28 12:37:37,,
132,1.0,,16.0,https://www.richmondregister.com/news/berea/berea-county-working-for-industrial-park-road-projects/article_c88cc807-6781-50bb-94d8-c6c1b7da145b.html,1219107924918764,Working together we can achieve more! Madison County and City of Berea are working together to advocate for state road projects in the southern part of the County.,https://facebook.com/story.php?story_fbid=1219107924918764&id=415070505322514,"RICHMONDREGISTER.COM
Berea, county working for industrial park road projects",2.0,"Working together we can achieve more! Madison County and City of Berea are working together to advocate for state road projects in the southern part of the County.

RICHMONDREGISTER.COM
Berea, county working for industrial park road projects",2019-03-26 14:17:35,,
133,1.0,,4.0,,404716317024700,Fiscal Court 3/26/2019,,,2.0,Fiscal Court 3/26/2019,2019-03-26 09:31:30,https://video-atl3-1.xx.fbcdn.net/v/t42.26565-2/10000000_2667440736907389_7127990939662329882_n.mp4?_nc_cat=101&_nc_sid=985c63&efg=eyJ2ZW5jb2RlX3RhZyI6Im9lcF9zZCJ9&_nc_ohc=QFW27IgnCs4AX9m1dUV&_nc_ht=video-atl3-1.xx&oh=d656e64750c5efecb6b26b798afc5f8c&oe=5F5D62BB,
134,0.0,,24.0,https://www.richmondregister.com/opinion/columns/taylor-limitless-opportunities-for-county/article_1e2eda2a-50f1-5b68-9bb8-a94a2e640ef2.html,1213799092116314,,https://facebook.com/story.php?story_fbid=1213799092116314&id=415070505322514,"RICHMONDREGISTER.COM
TAYLOR: Limitless opportunities for county

Richmond Register
March 18, 2019 at 6:16 PM ·

JUDGE/EXEC REAGAN TAYLOR'S COLUMN: You can never have too many tools in the economic development tool box. When the Kentucky Economic Development Cabinet requested applications for counties interested in participating in the newly announced federal ""Opportunity Zone"" program, we jumped at the chance to submit a request for proposal. Six months later, we were thrilled to find out that our application was approved. Now, the real work of educating investors, businesses and entrepreneurs, accountants, bankers, land owners, and citizens on what an opportunity zone is and why it is such a potential advantage for our county has begun.

https://www.richmondregister.com/opinion/columns/taylor-limitless-opportunities-for-county/article_1e2eda2a-50f1-5b68-9bb8-a94a2e640ef2.html",10.0,"RICHMONDREGISTER.COM
TAYLOR: Limitless opportunities for county

Richmond Register
