,comments,image,likes,link,post_id,post_text,post_url,shared_text,shares,text,time,video,video_thumbnail
62,1.0,https://scontent-atl3-1.xx.fbcdn.net/v/t1.0-9/fr/cp0/e15/q65/88076599_4142833819075627_2548861153698643968_n.jpg?_nc_cat=108&_nc_sid=110474&_nc_ohc=SoqpPTgqYNQAX847Kl9&_nc_ht=scontent-atl3-1.xx&tp=14&oh=3a84fb6c63eadbc4cf255d918c9b2acb&oe=5F859525,32.0,,4142833859075623,And let’s not forget to congratulate the MDS Girls Basketball team on a fun and memorable season! #gomdsdragons 🐉 pc @alan.stanton,https://facebook.com/story.php?story_fbid=4142833859075623&id=116499965042386,,0.0,And let’s not forget to congratulate the MDS Girls Basketball team on a fun and memorable season! #gomdsdragons 🐉 pc @alan.stanton,2020-03-04 17:36:30,,
63,1.0,https://scontent-atl3-1.xx.fbcdn.net/v/t1.0-9/fr/cp0/e15/q65/88097789_4136319299727079_8415825461157822464_o.jpg?_nc_cat=111&_nc_sid=110474&_nc_ohc=-u1eDXxqDpcAX-kwTCj&_nc_ht=scontent-atl3-1.xx&tp=14&oh=9eccf1167473526e562f928ee144c071&oe=5F829731,29.0,,4136319393060403,A Monte tradition: the annual Burnt Spaghetti dinner gathers seniors and faculty together to nosh and talk. #mds2020 🐉,https://facebook.com/story.php?story_fbid=4136319393060403&id=116499965042386,,0.0,A Monte tradition: the annual Burnt Spaghetti dinner gathers seniors and faculty together to nosh and talk. #mds2020 🐉,2020-03-02 20:51:31,,
64,0.0,https://scontent-atl3-1.xx.fbcdn.net/v/t1.0-9/fr/cp0/e15/q65/87987719_4134435113248831_262230972014002176_n.jpg?_nc_cat=111&_nc_sid=110474&_nc_ohc=n7QC9EWPuTIAX81teyw&_nc_ht=scontent-atl3-1.xx&tp=14&oh=10c9361d723b6ea8514f7af5378cca32&oe=5F85CC3D,9.0,,4134435529915456,Good morning and happy Monday Dragons! Reminder: the 3rd quarter ends this Thursday! 🐉,https://facebook.com/story.php?story_fbid=4134435529915456&id=116499965042386,,0.0,Good morning and happy Monday Dragons! Reminder: the 3rd quarter ends this Thursday! 🐉,2020-03-02 08:38:34,,
65,0.0,https://scontent-atl3-1.xx.fbcdn.net/v/t1.0-9/fr/cp0/e15/q65/88154020_4121635581195451_8566574406610976768_n.jpg?_nc_cat=111&_nc_sid=110474&_nc_ohc=Qpzhb3xHscIAX8Na3pq&_nc_ht=scontent-atl3-1.xx&tp=14&oh=e7df241d24fdb01609831de8a6da9b0b&oe=5F85B651,16.0,,4121635831195426,MDS Model UN representing at UNM MUN meeting! #gomdsdragons 🐉,https://facebook.com/story.php?story_fbid=4121635831195426&id=116499965042386,,0.0,MDS Model UN representing at UNM MUN meeting! #gomdsdragons 🐉,2020-02-27 16:21:23,,
66,1.0,,15.0,,4119155894776753,MDS AP Lit students representing at Tyehimba Jess’ Lannan Foundation performance! #lannanfoundation #gomdsdragons,https://facebook.com/story.php?story_fbid=4119155894776753&id=116499965042386,,0.0,MDS AP Lit students representing at Tyehimba Jess’ Lannan Foundation performance! #lannanfoundation #gomdsdragons,2020-02-26 23:02:19,,
67,0.0,https://scontent-atl3-1.xx.fbcdn.net/v/t1.0-9/fr/cp0/e15/q65/87035804_4097028526989490_7964985819293286400_n.jpg?_nc_cat=106&_nc_sid=110474&_nc_ohc=fj_6SlCF4X4AX9YwW_i&_nc_ht=scontent-atl3-1.xx&tp=14&oh=065f8a77999f7c2ed11f302b86a455ad&oe=5F828A91,11.0,,4097029536989389,Happy Thursday Dragons! 🐉,https://facebook.com/story.php?story_fbid=4097029536989389&id=116499965042386,,0.0,Happy Thursday Dragons! 🐉,2020-02-20 09:49:26,,
68,2.0,https://scontent-atl3-1.xx.fbcdn.net/v/t1.0-9/fr/cp0/e15/q65/84601497_4069818873043789_6408506073702989824_n.jpg?_nc_cat=101&_nc_sid=110474&_nc_ohc=0CKxRabmBwMAX_KlLZb&_nc_ht=scontent-atl3-1.xx&tp=14&oh=c78c8d493c94442e778532a66eb01f14&oe=5F85B100,13.0,,4069819849710358,❤️❤️❤️❤️❤️❤️❤️,https://facebook.com/story.php?story_fbid=4069819849710358&id=116499965042386,,0.0,❤️❤️❤️❤️❤️❤️❤️,2020-02-12 13:02:44,,
69,0.0,https://scontent-atl3-1.xx.fbcdn.net/v/t1.0-9/fr/cp0/e15/q65/84126920_4065580653467611_6117042093983531008_n.jpg?_nc_cat=103&_nc_sid=110474&_nc_ohc=URUt_wt8YH8AX-R-LO-&_nc_ht=scontent-atl3-1.xx&tp=14&oh=71018d97507838a02f5bc37093d91079&oe=5F855E2C,28.0,,4065581166800893,"Enjoy your snow day Dragons! Sleep in, get outside and play, read a book, listen to some music - we’ll see you tomorrow! #gomdsdragons",https://facebook.com/story.php?story_fbid=4065581166800893&id=116499965042386,,0.0,"Enjoy your snow day Dragons! Sleep in, get outside and play, read a book, listen to some music - we’ll see you tomorrow! #gomdsdragons",2020-02-11 08:30:14,,
70,0.0,https://scontent-atl3-1.xx.fbcdn.net/v/t1.0-9/fr/cp0/e15/q65/84193103_4063992113626465_6854582944728612864_n.jpg?_nc_cat=106&_nc_sid=110474&_nc_ohc=RkPhRbRrlS4AX89t_Dy&_nc_oc=AQkaRIgUAmG_8m78B_wd0LBO4_AUZtx1mEcazNNU2ef1NB7vpLly_v0QuHSQsqlsdU8&_nc_ht=scontent-atl3-1.xx&tp=14&oh=891400b35068fc46e2cd04d6c073881b&oe=5F83F75C,24.0,,4063992476959762,"Another beautiful day on the slopes with seniors and the MDS Ski Program! A great opportunity to make memories and friends, and to enjoy our beautiful Sangre de Cristos. #gomdsdragons #skisantafe #skibueno",https://facebook.com/story.php?story_fbid=4063992476959762&id=116499965042386,,0.0,"Another beautiful day on the slopes with seniors and the MDS Ski Program! A great opportunity to make memories and friends, and to enjoy our beautiful Sangre de Cristos. #gomdsdragons #skisantafe #skibueno",2020-02-10 20:27:05,,
71,0.0,https://scontent-atl3-1.xx.fbcdn.net/v/t1.0-9/fr/cp0/e15/q65/84222558_4045968978762112_8591307907792896000_n.jpg?_nc_cat=111&_nc_sid=110474&_nc_ohc=Pj9TNHgxQSAAX8m0ydb&_nc_ht=scontent-atl3-1.xx&tp=14&oh=e4c7cf34cf4c6f8802b95d9e73121f6e&oe=5F84CE73,5.0,,4045970985428578,"Please sign up for our bi-annual Blood Drive sponsored by the MDS National Honor Society! Wednesday, February 19th from 9am to 1pm. See Amy for more details! 🩸 🐉",https://facebook.com/story.php?story_fbid=4045970985428578&id=116499965042386,,0.0,"Please sign up for our bi-annual Blood Drive sponsored by the MDS National Honor Society! Wednesday, February 19th from 9am to 1pm. See Amy for more details! 🩸 🐉",2020-02-05 17:58:05,,
72,0.0,https://scontent-atl3-1.xx.fbcdn.net/v/t1.0-9/fr/cp0/e15/q65/83993516_4041732985852378_1493878853494374400_n.jpg?_nc_cat=109&_nc_sid=110474&_nc_ohc=tA3eB6UkErsAX88vBUd&_nc_ht=scontent-atl3-1.xx&tp=14&oh=7c2fb15665ce0a072200e5346257f589&oe=5F83D5D4,19.0,,4041733265852350,Some snaps from last week’s Homecoming Game vs. Desert/Waldorf including our Homecoming Court! 🐉,https://facebook.com/story.php?story_fbid=4041733265852350&id=116499965042386,,0.0,Some snaps from last week’s Homecoming Game vs. Desert/Waldorf including our Homecoming Court! 🐉,2020-02-04 13:10:52,,
73,0.0,https://scontent-atl3-1.xx.fbcdn.net/v/t1.0-9/fr/cp0/e15/q65/83633698_4028104193881924_2397819330130608128_n.jpg?_nc_cat=101&_nc_sid=110474&_nc_ohc=g5_i40c1iysAX-KNhsA&_nc_ht=scontent-atl3-1.xx&tp=14&oh=02c3328b1784c35b58942c2cf5c7d0fa&oe=5F82D464,44.0,,4028104937215183,Meet the newest member of the Monte family: Elliott! #gomdsdragons 🐉,https://facebook.com/story.php?story_fbid=4028104937215183&id=116499965042386,,0.0,Meet the newest member of the Monte family: Elliott! #gomdsdragons 🐉,2020-01-31 10:31:19,,
74,0.0,https://scontent-atl3-1.xx.fbcdn.net/v/t1.0-9/fr/cp0/e15/q65/84455806_4023264921032518_5982173936136224768_n.jpg?_nc_cat=100&_nc_sid=110474&_nc_ohc=yV4gr2vZ7fkAX8hRdBy&_nc_ht=scontent-atl3-1.xx&tp=14&oh=1cae7031b4a11d83422e5960f00a180a&oe=5F83EEC1,41.0,,4023274334364910,Don’t worry!! 👽Aliens haven’t landed! It is the greenhouse lights growing our delicious vegetables🍴,https://facebook.com/story.php?story_fbid=4023274334364910&id=116499965042386,,0.0,Don’t worry!! 👽Aliens haven’t landed! It is the greenhouse lights growing our delicious vegetables🍴,2020-01-29 23:04:02,,
75,0.0,,38.0,,4020233044669039,"Monday was the first of four ski days. 🎿
🏔We are looking forward to more great adventures on the mountain, being physically active, making memories, sharing laughter and building community!! 🐉

⛷ MDS Ski and Outdoor Education Program (supported through Pete Lazar’s Outdoor Education Fund)⛷",https://facebook.com/story.php?story_fbid=4020233044669039&id=116499965042386,,0.0,"Monday was the first of four ski days. 🎿
🏔We are looking forward to more great adventures on the mountain, being physically active, making memories, sharing laughter and building community!! 🐉

⛷ MDS Ski and Outdoor Education Program (supported through Pete Lazar’s Outdoor Education Fund)⛷",2020-01-28 23:59:37,,
76,3.0,https://scontent-atl3-1.xx.fbcdn.net/v/t1.0-9/fr/cp0/e15/q65/83100418_4020149344677409_4452762513259364352_n.jpg?_nc_cat=106&_nc_sid=110474&_nc_ohc=TOxD29ujqXwAX8VMlk7&_nc_ht=scontent-atl3-1.xx&tp=14&oh=abcaf9c580d588d1a2c46ea5673a5683&oe=5F84B275,61.0,,4020160648009612,"Salad Bar! Now serving every Tuesday and Thursday.
Featuring some of our greenhouse vegetables! 🥬 🍅 🥒🥕",https://facebook.com/story.php?story_fbid=4020160648009612&id=116499965042386,,0.0,"Salad Bar! Now serving every Tuesday and Thursday.
Featuring some of our greenhouse vegetables! 🥬 🍅 🥒🥕",2020-01-28 23:21:52,,
77,0.0,https://scontent-atl3-1.xx.fbcdn.net/v/t1.0-9/fr/cp0/e15/q65/82428346_3993273417365002_5552254190912274432_n.jpg?_nc_cat=101&_nc_sid=110474&_nc_ohc=OzByw9LB7esAX9cYhNu&_nc_oc=AQnjKcUJMjyPpqxTAzLLVLmW4Kk_aSBvXqKFkPOb7lELA00HT7i27qqLvLYJYPkY9I4&_nc_ht=scontent-atl3-1.xx&tp=14&oh=0b164e2295069d22764bf585a772ca99&oe=5F8406FC,9.0,,3993274697364874,Some Monday inspo on this MLK Jr. Day.,https://facebook.com/story.php?story_fbid=3993274697364874&id=116499965042386,,0.0,Some Monday inspo on this MLK Jr. Day.,2020-01-20 13:10:40,,
78,0.0,https://scontent-atl3-1.xx.fbcdn.net/v/t1.0-9/fr/cp0/e15/q65/83132619_3981293291896348_8074753595557281792_n.jpg?_nc_cat=103&_nc_sid=110474&_nc_ohc=oPH2dFZGoIcAX_ov7vp&_nc_ht=scontent-atl3-1.xx&tp=14&oh=17a01ed29eadd03444787418039778ac&oe=5F838D66,18.0,,3981293618562982,"Enjoy your long holiday weekend Dragons: Friday is a snow day and Monday is Martin Luther King, Jr. Day! See you on Tuesday! #gomdsdragons",https://facebook.com/story.php?story_fbid=3981293618562982&id=116499965042386,,0.0,"Enjoy your long holiday weekend Dragons: Friday is a snow day and Monday is Martin Luther King, Jr. Day! See you on Tuesday! #gomdsdragons",2020-01-16 18:57:22,,
79,0.0,,22.0,,3954708421221502,Dragon hoops in action! #gomdsdragons,https://facebook.com/story.php?story_fbid=3954708421221502&id=116499965042386,,0.0,Dragon hoops in action! #gomdsdragons,2020-01-08 19:41:19,,
80,5.0,https://scontent-atl3-1.xx.fbcdn.net/v/t1.0-9/fr/cp0/e15/q65/81728561_3947994868559524_2763185729780580352_n.jpg?_nc_cat=110&_nc_sid=110474&_nc_ohc=w5ENA0fJFJ8AX8rB2rN&_nc_ht=scontent-atl3-1.xx&tp=14&oh=d27f419d322caad648125df8bb260283&oe=5F85606C,17.0,,3947999135225764,Hey Dragon alumni (especially class of ‘19 and ‘18) we’d love to have you stop by this Thursday the 9th at 10am for a visit with our current Dragon seniors! We’d love to see you! Drop us a line if you can make it!,https://facebook.com/story.php?story_fbid=3947999135225764&id=116499965042386,,0.0,Hey Dragon alumni (especially class of ‘19 and ‘18) we’d love to have you stop by this Thursday the 9th at 10am for a visit with our current Dragon seniors! We’d love to see you! Drop us a line if you can make it!,2020-01-06 19:08:21,,
81,1.0,https://scontent-atl3-1.xx.fbcdn.net/v/t1.0-9/fr/cp0/e15/q65/81893845_3934278833264461_1728831088052142080_n.jpg?_nc_cat=100&_nc_sid=110474&_nc_ohc=zlPsARxnnXIAX98mLXq&_nc_ht=scontent-atl3-1.xx&tp=14&oh=ab081cd8d0334dc81387adede64ef9bb&oe=5F828315,23.0,,3934279269931084,Happy New Year Dragons! We hope your 2020 is a bright and shiny one! We look forward to seeing all of you on Monday January 6th. #gomdsdragons,https://facebook.com/story.php?story_fbid=3934279269931084&id=116499965042386,,0.0,Happy New Year Dragons! We hope your 2020 is a bright and shiny one! We look forward to seeing all of you on Monday January 6th. #gomdsdragons,2020-01-02 16:24:16,,
82,1.0,https://scontent-atl3-1.xx.fbcdn.net/v/t1.0-9/fr/cp0/e15/q65/80489773_3913788085313536_6378147367954153472_n.jpg?_nc_cat=111&_nc_sid=110474&_nc_ohc=y94O4rkCsicAX_wx1ub&_nc_ht=scontent-atl3-1.xx&tp=14&oh=6c8f4ba64bd43a02eab65dd887cace9f&oe=5F83F454,32.0,,3913788418646836,"The varsity boys basketball team played in the Pojoaque Basketball tournament this past weekend. Despite missing several players, the boys stayed focused, worked hard and took 3rd place. Way to show your DRAGON PRIDE!",https://facebook.com/story.php?story_fbid=3913788418646836&id=116499965042386,,0.0,"The varsity boys basketball team played in the Pojoaque Basketball tournament this past weekend. Despite missing several players, the boys stayed focused, worked hard and took 3rd place. Way to show your DRAGON PRIDE!",2019-12-27 13:12:19,,
83,0.0,,11.0,http://gf.me/u/wfp4xt,3870484549643890,"Monte del Sol goes skiing!!!
Want to help make the dream a reality for MDS students interested in learning to ski or snowboard? Thanks to Ski Santa Fe's affordable school program deal, our students have the chance to take four lessons this season. Your support means a lot to them.

#gomdsdragons #letitsnow
gf.me/u/wfp4xt",https://facebook.com/story.php?story_fbid=3870484549643890&id=116499965042386,"GOFUNDME.COM
Click here to support Pete Lazar's Outdoor Education Fund organized by Zoe Nelsen",6.0,"Monte del Sol goes skiing!!!
Want to help make the dream a reality for MDS students interested in learning to ski or snowboard? Thanks to Ski Santa Fe's affordable school program deal, our students have the chance to take four lessons this season. Your support means a lot to them.

#gomdsdragons #letitsnow
gf.me/u/wfp4xt

GOFUNDME.COM
Click here to support Pete Lazar's Outdoor Education Fund organized by Zoe Nelsen",2019-12-14 09:25:52,,
84,0.0,https://scontent-atl3-1.xx.fbcdn.net/v/t1.0-9/fr/cp0/e15/q65/79536512_3868219799870365_1840130041631997952_n.jpg?_nc_cat=100&_nc_sid=110474&_nc_ohc=h0yUErFOXrcAX_wdKlb&_nc_ht=scontent-atl3-1.xx&tp=14&oh=0fd4241e93395fbc36e5d8d4b0eeb6a6&oe=5F82F60E,13.0,,3868220153203663,Happy holidays Dragons! See you in three weeks! #gomdsdragons,https://facebook.com/story.php?story_fbid=3868220153203663&id=116499965042386,,0.0,Happy holidays Dragons! See you in three weeks! #gomdsdragons,2019-12-13 16:08:53,,
85,11.0,https://scontent-atl3-1.xx.fbcdn.net/v/t1.0-9/fr/cp0/e15/q65/80084111_3864486430243702_4933209593783255040_n.jpg?_nc_cat=109&_nc_sid=110474&_nc_ohc=3HVnyOzICLMAX-QXTI9&_nc_ht=scontent-atl3-1.xx&tp=14&oh=8c2ad416a94744ae40cedc6bfe2217d5&oe=5F83FB3F,71.0,,3864488500243495,"Congratulations to Monte del Sol teacher, Rhonda Crespo, who recently earned her National Board Certification in Biology. She joins more than 125,000 teachers nationwide who have achieved this honor. In order to become a Board-certified teacher, teachers complete a performance-based, peer-reviewed process, demonstrating their proven impact on student learning and achievement. Great job, Rhonda; we are proud of you!",https://facebook.com/story.php?story_fbid=3864488500243495&id=116499965042386,,0.0,"Congratulations to Monte del Sol teacher, Rhonda Crespo, who recently earned her National Board Certification in Biology. She joins more than 125,000 teachers nationwide who have achieved this honor. In order to become a Board-certified teacher, teachers complete a performance-based, peer-reviewed process, demonstrating their proven impact on student learning and achievement. Great job, Rhonda; we are proud of you!",2019-12-12 14:11:50,,
86,11.0,https://scontent-atl3-1.xx.fbcdn.net/v/t1.0-9/fr/cp0/e15/q65/78657130_3845595498799462_7974432767364562944_n.jpg?_nc_cat=108&_nc_sid=110474&_nc_ohc=Ed7VPJJQ84sAX-qmxOp&_nc_ht=scontent-atl3-1.xx&tp=14&oh=470bddca04710d0a3cf617546b5e4caa&oe=5F83B8DD,54.0,,3845596365466042,"Yay Monte! Winner of the Governor’s STEM Challenge! This was a semester-long competition where student teams were tasked to “Keep our world safe with technology.” Each team designed and tested a prototype, and our group worked with agricultural technologies. They explored aquaponics, wicking beds, and vermiculture towers, but our main prototype was in hydroponics. Students won a showcase champion award from Descarte Labs! 🐉",https://facebook.com/story.php?story_fbid=3845596365466042&id=116499965042386,,0.0,"Yay Monte! Winner of the Governor’s STEM Challenge! This was a semester-long competition where student teams were tasked to “Keep our world safe with technology.” Each team designed and tested a prototype, and our group worked with agricultural technologies. They explored aquaponics, wicking beds, and vermiculture towers, but our main prototype was in hydroponics. Students won a showcase champion award from Descarte Labs! 🐉",2019-12-07 17:54:30,,
87,0.0,https://scontent-atl3-1.xx.fbcdn.net/v/t1.0-9/fr/cp0/e15/q65/77296833_3823492364343109_5277485526461448192_n.jpg?_nc_cat=106&_nc_sid=110474&_nc_ohc=4-jj3jmT1T4AX94UoCg&_nc_ht=scontent-atl3-1.xx&tp=14&oh=bdfeab587a073006258f716aa3bfda33&oe=5F8343CF,5.0,,3823492837676395,Join us for Monte’s Winter Dance! December 6th from 7-11PM. ❄️ 🥶,https://facebook.com/story.php?story_fbid=3823492837676395&id=116499965042386,,0.0,Join us for Monte’s Winter Dance! December 6th from 7-11PM. ❄️ 🥶,2019-12-01 13:59:53,,
88,0.0,https://scontent-atl3-1.xx.fbcdn.net/v/t1.0-9/fr/cp0/e15/q65/78432952_3808353662523646_6355186709012938752_n.jpg?_nc_cat=101&_nc_sid=110474&_nc_ohc=TgVw6iEC5qsAX9OTguP&_nc_ht=scontent-atl3-1.xx&tp=14&oh=3f7436d1dc0c846a638220224e240378&oe=5F82645C,14.0,,3808354362523576,"Happy Thanksgiving Dragons! Enjoy some well deserved time with families and friends! We’ll see you, refreshed and ready to finish the semester, on Monday!",https://facebook.com/story.php?story_fbid=3808354362523576&id=116499965042386,,0.0,"Happy Thanksgiving Dragons! Enjoy some well deserved time with families and friends! We’ll see you, refreshed and ready to finish the semester, on Monday!",2019-11-27 11:14:44,,
89,0.0,https://scontent-atl3-1.xx.fbcdn.net/v/t1.0-9/fr/cp0/e15/q65/75636027_3793814857310860_6855261674115432448_n.jpg?_nc_cat=104&_nc_sid=110474&_nc_ohc=QUwGQTR0ejkAX-627hZ&_nc_ht=scontent-atl3-1.xx&tp=14&oh=5cbec8367f2444860c0e68b524ff5a92&oe=5F8430FB,39.0,,3793818797310466,Our very own Alfredo Celedón Luján introducing author Tommy Orange at National Council of English Teacher’s annual conference!,https://facebook.com/story.php?story_fbid=3793818797310466&id=116499965042386,,0.0,Our very own Alfredo Celedón Luján introducing author Tommy Orange at National Council of English Teacher’s annual conference!,2019-11-23 11:11:18,,
90,0.0,https://scontent-atl3-1.xx.fbcdn.net/v/t1.0-9/fr/cp0/e15/q65/73409335_3787487061276973_8647566589186539520_n.jpg?_nc_cat=109&_nc_sid=110474&_nc_ohc=UhdJ6s1tdN8AX-sRFky&_nc_ht=scontent-atl3-1.xx&tp=14&oh=374e98d7bcc82d2e89e9d6f8ff0931d1&oe=5F859241,22.0,,3787489591276720,"“Crossing a bare common, in snow puddles, at twilight, under a clouded sky, without having in my thoughts any occurrence of special good fortune, I have enjoyed a perfect exhilaration. I am glad to the brink of fear.”

We are glad we just got a snow day Dragons! Enjoy your afternoon and hasta mañana! 🐉",https://facebook.com/story.php?story_fbid=3787489591276720&id=116499965042386,,0.0,"“Crossing a bare common, in snow puddles, at twilight, under a clouded sky, without having in my thoughts any occurrence of special good fortune, I have enjoyed a perfect exhilaration. I am glad to the brink of fear.”

We are glad we just got a snow day Dragons! Enjoy your afternoon and hasta mañana! 🐉",2019-11-21 16:39:21,,
91,15.0,,62.0,,3776758315683181,Please congratulate our full ride Davis Scholarship winners Victoria and Gabriel Alarcon MDS 2020! We are so proud of you both! #dragonsroar,https://facebook.com/story.php?story_fbid=3776758315683181&id=116499965042386,,0.0,Please congratulate our full ride Davis Scholarship winners Victoria and Gabriel Alarcon MDS 2020! We are so proud of you both! #dragonsroar,2019-11-18 14:39:05,,
92,0.0,https://scontent-atl3-1.xx.fbcdn.net/v/t1.0-9/fr/cp0/e15/q65/75614260_3773401556018857_6971855669536227328_n.jpg?_nc_cat=100&_nc_sid=110474&_nc_ohc=fOElVGsR_k8AX8guefr&_nc_ht=scontent-atl3-1.xx&tp=14&oh=3da4b8f50ab5ccc3a1de47444ff074f6&oe=5F85B003,51.0,,3773403476018665,Our new activity bus! Rolling in Dragon style! #gomdsdragons,https://facebook.com/story.php?story_fbid=3773403476018665&id=116499965042386,,0.0,Our new activity bus! Rolling in Dragon style! #gomdsdragons,2019-11-17 14:57:34,,
93,4.0,https://scontent-atl3-1.xx.fbcdn.net/v/t1.0-9/fr/cp0/e15/q65/74890925_3766820896676923_6430591877870780416_n.jpg?_nc_cat=106&_nc_sid=110474&_nc_ohc=2DECndQhQtwAX8VQw1Q&_nc_ht=scontent-atl3-1.xx&tp=14&oh=d37e2d871eb942ea79921cba447571c5&oe=5F83AA9A,45.0,,3766825910009755,Congratulations to our MDS Dragons volleyball team for their first and certainly not last trip to state championships. You make us all proud! #dragonsroar,https://facebook.com/story.php?story_fbid=3766825910009755&id=116499965042386,,0.0,Congratulations to our MDS Dragons volleyball team for their first and certainly not last trip to state championships. You make us all proud! #dragonsroar,2019-11-15 18:14:25,,
94,6.0,https://scontent-atl3-1.xx.fbcdn.net/v/t1.0-9/fr/cp0/e15/q65/75181377_3748698371822509_4863377565898768384_n.jpg?_nc_cat=105&_nc_sid=110474&_nc_ohc=Jzv7rPQB5AsAX-ZSAtz&_nc_ht=scontent-atl3-1.xx&tp=14&oh=3cd4e6fa476f01b4d991ef245acea7d1&oe=5F85D20A,38.0,,3748698431822503,"Yesterday the girls beat Desert Academy in a commanding 3-0 win to become the District Tournament Champions and earned their way to the State Tournament. In addition, 4 of our players were named to the All District Team. Go Dragons!",https://facebook.com/story.php?story_fbid=3748698431822503&id=116499965042386,,0.0,"Yesterday the girls beat Desert Academy in a commanding 3-0 win to become the District Tournament Champions and earned their way to the State Tournament. In addition, 4 of our players were named to the All District Team. Go Dragons!",2019-11-10 09:34:11,,
95,0.0,https://scontent-atl3-1.xx.fbcdn.net/v/t1.0-9/fr/cp0/e15/q65/75453492_3747308941961452_6184354410584342528_n.jpg?_nc_cat=110&_nc_sid=110474&_nc_ohc=ihd-jyPkYiYAX8dLqYi&_nc_ht=scontent-atl3-1.xx&tp=14&oh=7b0b29a341cad8e772b6664596f37e4a&oe=5F85682E,36.0,,3747312831961063,Congratulations to our Dragons volleyball team as they win districts and head to state! #heartofadragon,https://facebook.com/story.php?story_fbid=3747312831961063&id=116499965042386,,0.0,Congratulations to our Dragons volleyball team as they win districts and head to state! #heartofadragon,2019-11-09 23:47:04,,
96,0.0,https://scontent-atl3-1.xx.fbcdn.net/v/t1.0-9/fr/cp0/e15/q65/75159582_3745398502152496_421894779220000768_n.jpg?_nc_cat=104&_nc_sid=110474&_nc_ohc=Yy1mhqdHXaAAX-X4ZsX&_nc_ht=scontent-atl3-1.xx&tp=14&oh=3aa993414c19eb65d01b264a1ee39d52&oe=5F8575A2,17.0,,3745402842152062,"Come out and support your Dragons Volleyball today, 11/9 @1:30 at Ft. Marcy! #gomdsdragons",https://facebook.com/story.php?story_fbid=3745402842152062&id=116499965042386,,0.0,"Come out and support your Dragons Volleyball today, 11/9 @1:30 at Ft. Marcy! #gomdsdragons",2019-11-09 10:32:19,,
97,1.0,https://scontent-atl3-1.xx.fbcdn.net/v/t1.0-9/fr/cp0/e15/q65/75625235_3740261962666150_1453068984780849152_n.jpg?_nc_cat=110&_nc_sid=110474&_nc_ohc=kNYqdCdTUkIAX8oYy-g&_nc_ht=scontent-atl3-1.xx&tp=14&oh=4acb6dbcc099c1e3fa3a62aa34d49614&oe=5F8389E2,27.0,,3740264975999182,Dragons win! See them play their final district game Saturday at 1:30 at Ft. Marcy. #gomdsdragons,https://facebook.com/story.php?story_fbid=3740264975999182&id=116499965042386,,0.0,Dragons win! See them play their final district game Saturday at 1:30 at Ft. Marcy. #gomdsdragons,2019-11-07 21:45:03,,
98,10.0,https://scontent-atl3-1.xx.fbcdn.net/v/t1.0-9/fr/cp0/e15/q65/75464309_3739966759362337_2030300322936651776_n.jpg?_nc_cat=110&_nc_sid=110474&_nc_ohc=QskzOBE_cp0AX9xaUSw&_nc_oc=AQk67_96YFh54XSJEZZKv9onGJRohy0C1Ghufj-LqdPkQ-2NHKnXv_e-U5sL7jYGn_Y&_nc_ht=scontent-atl3-1.xx&tp=14&oh=2a1d6eee5170a222e1dfce091f82a4f5&oe=5F8404DE,53.0,,3739968566028823,Heroes with the hearts of dragons. #neverquit #gomdsdragons,https://facebook.com/story.php?story_fbid=3739968566028823&id=116499965042386,,0.0,Heroes with the hearts of dragons. #neverquit #gomdsdragons,2019-11-07 19:36:17,,
99,1.0,https://scontent-atl3-1.xx.fbcdn.net/v/t1.0-9/fr/cp0/e15/q65/72181184_3739105152781831_2206937218126184448_n.jpg?_nc_cat=105&_nc_sid=110474&_nc_ohc=F2VXdD_vulMAX_eR0sM&_nc_ht=scontent-atl3-1.xx&tp=14&oh=b4bcae8b884d7008d1fbf44818f99b10&oe=5F829E83,20.0,,3739107982781548,Please come out and support your Dragons Volleyball team tonight @ 6pm at the Chavez Center! #gomdsdragons,https://facebook.com/story.php?story_fbid=3739107982781548&id=116499965042386,,0.0,Please come out and support your Dragons Volleyball team tonight @ 6pm at the Chavez Center! #gomdsdragons,2019-11-07 13:01:56,,
