,comments,image,likes,link,post_id,post_text,post_url,shared_text,shares,text,time,video,video_thumbnail
34,8.0,https://scontent-atl3-1.xx.fbcdn.net/v/t1.0-9/fr/cp0/e15/q65/99156882_4473109496048056_1860225892962271232_n.jpg?_nc_cat=109&_nc_sid=110474&_nc_ohc=tRrGMHgWFnIAX8RzxqU&_nc_ht=scontent-atl3-1.xx&tp=14&oh=3a234b8d47cb22bec381981f012e5481&oe=5F857E9B,13.0,,4473109912714681,"Alright smarty pants - try to guess who this handsome fella is. To celebrate our graduating class of 2020, we’ll be counting down the days to graduation by sharing some (possibly embarrassing) memories of our faculty from their high school days! #graduationcountdown🎓 #gomdsdragons @mdsclassof2020",https://facebook.com/story.php?story_fbid=4473109912714681&id=116499965042386,,0.0,"Alright smarty pants - try to guess who this handsome fella is. To celebrate our graduating class of 2020, we’ll be counting down the days to graduation by sharing some (possibly embarrassing) memories of our faculty from their high school days! #graduationcountdown🎓 #gomdsdragons @mdsclassof2020",2020-05-25 14:23:00,,
35,10.0,https://scontent-atl3-1.xx.fbcdn.net/v/t1.0-9/fr/cp0/e15/q65/100634152_4472048559487483_4216750027369873408_n.jpg?_nc_cat=105&_nc_sid=110474&_nc_ohc=UDCiwfxD2ugAX9MhNPO&_nc_ht=scontent-atl3-1.xx&tp=14&oh=9cb51b160d0b21ed361bfa3b92ef990a&oe=5F85367D,19.0,,4472051022820570,"To celebrate our graduating class of 2020, we’ll be counting down the days to graduation by sharing some (possibly embarrassing) memories of our faculty from their high school days. Play along and see if you can name the teacher! As you can see, not much has changed with this faculty member! #graduationcountdown🎓 #gomdsdragons @mdsclassof2020",https://facebook.com/story.php?story_fbid=4472051022820570&id=116499965042386,,0.0,"To celebrate our graduating class of 2020, we’ll be counting down the days to graduation by sharing some (possibly embarrassing) memories of our faculty from their high school days. Play along and see if you can name the teacher! As you can see, not much has changed with this faculty member! #graduationcountdown🎓 #gomdsdragons @mdsclassof2020",2020-05-25 08:57:51,,
36,9.0,https://scontent-atl3-1.xx.fbcdn.net/v/t1.0-9/fr/cp0/e15/q65/99244042_4469364183089254_3728935840982761472_n.jpg?_nc_cat=103&_nc_sid=110474&_nc_ohc=-iEBkk3RtHAAX_VJbpJ&_nc_ht=scontent-atl3-1.xx&tp=14&oh=8a9863013080e9be1e9a3c9c8e11bf06&oe=5F83D32A,32.0,,4469364599755879,"Two for one Sunday! To celebrate our graduating class of 2020, we’ll be counting down the days to graduation by sharing some (possibly embarrassing) memories of our faculty from their high school days. Play along and see if you can name the teacher! Hmmm...who could this be? #graduationcountdown🎓 #gomdsdragons @mdsclassof2020",https://facebook.com/story.php?story_fbid=4469364599755879&id=116499965042386,,0.0,"Two for one Sunday! To celebrate our graduating class of 2020, we’ll be counting down the days to graduation by sharing some (possibly embarrassing) memories of our faculty from their high school days. Play along and see if you can name the teacher! Hmmm...who could this be? #graduationcountdown🎓 #gomdsdragons @mdsclassof2020",2020-05-24 14:56:06,,
37,3.0,,26.0,,4468282969864042,"To celebrate our graduating class of 2020, we’ll be counting down the days to graduation by sharing some (possibly embarrassing) memories of our faculty from their high school days. Play along and see if you can name the teacher! Today, things get more challenging!#graduationcountdown🎓 #gomdsdragons @mdsclassof2020",https://facebook.com/story.php?story_fbid=4468282969864042&id=116499965042386,,0.0,"To celebrate our graduating class of 2020, we’ll be counting down the days to graduation by sharing some (possibly embarrassing) memories of our faculty from their high school days. Play along and see if you can name the teacher! Today, things get more challenging!#graduationcountdown🎓 #gomdsdragons @mdsclassof2020",2020-05-24 09:25:04,,
38,7.0,https://scontent-atl3-1.xx.fbcdn.net/v/t1.0-9/fr/cp0/e15/q65/99287054_4465253760166963_9125982768654712832_n.jpg?_nc_cat=110&_nc_sid=110474&_nc_ohc=LaKRORdKTy4AX_hIibd&_nc_ht=scontent-atl3-1.xx&tp=14&oh=c75bd45357d3214612703f98007826b5&oe=5F85ED40,30.0,,4465254413500231,"To celebrate our graduating class of 2020, we’ll be counting down the days to graduation by sharing some (possibly embarrassing) memories of our faculty from their high school days. Play along and see if you can name the teacher! We’ll start with an easy one today! #graduationcountdown🎓 #gomdsdragons",https://facebook.com/story.php?story_fbid=4465254413500231&id=116499965042386,,0.0,"To celebrate our graduating class of 2020, we’ll be counting down the days to graduation by sharing some (possibly embarrassing) memories of our faculty from their high school days. Play along and see if you can name the teacher! We’ll start with an easy one today! #graduationcountdown🎓 #gomdsdragons",2020-05-23 14:41:34,,
39,0.0,,2.0,https://www.gofundme.com/f/emergency-pandemic-food-assistance?utm_source=customer&utm_medium=copy_link-tip&utm_campaign=p_cp+share-sheet,4448356995189973,"MDS Community! As we move through these uncertain times, please consider helping those who are struggling to put food on their table due to COVID-19. Anything helps! Please give and please share with your friends and family.",https://facebook.com/story.php?story_fbid=4448356995189973&id=116499965042386,"GOFUNDME.COM
Casa Program-Emergency Pandemic Food Assistance organized by Cate Moses",0.0,"MDS Community! As we move through these uncertain times, please consider helping those who are struggling to put food on their table due to COVID-19. Anything helps! Please give and please share with your friends and family.

GOFUNDME.COM
Casa Program-Emergency Pandemic Food Assistance organized by Cate Moses",2020-05-19 13:47:03,,
40,1.0,https://scontent-atl3-1.xx.fbcdn.net/v/t1.0-9/fr/cp0/e15/q65/97355011_4448126445213028_4463974151723417600_n.jpg?_nc_cat=109&_nc_sid=110474&_nc_ohc=ZC2vLB3i2SIAX-VIHep&_nc_ht=scontent-atl3-1.xx&tp=14&oh=84587e11323e4b38a8a1dc6029228748&oe=5F854864,13.0,,4448126798546326,"Congratulations to all our community for their awards, scholarships, and scholastic and sports achievements this year! #dragonpride🐉 #gomdsdragons",https://facebook.com/story.php?story_fbid=4448126798546326&id=116499965042386,,0.0,"Congratulations to all our community for their awards, scholarships, and scholastic and sports achievements this year! #dragonpride🐉 #gomdsdragons",2020-05-19 12:37:55,,
41,0.0,https://scontent-atl3-1.xx.fbcdn.net/v/t1.0-9/fr/cp0/e15/q65/98274400_4445105082181831_2485339433499361280_n.jpg?_nc_cat=100&_nc_sid=110474&_nc_ohc=dvO95e0RcSwAX_nLlLK&_nc_ht=scontent-atl3-1.xx&tp=14&oh=ed55aa70acc43f0bbb810feafa4e28ac&oe=5F853799,25.0,,4445110028848003,Beautiful flowers popping at Monte Del Sol.🌺🌼🌷🌾,https://facebook.com/story.php?story_fbid=4445110028848003&id=116499965042386,,0.0,Beautiful flowers popping at Monte Del Sol.🌺🌼🌷🌾,2020-05-18 18:29:15,,
42,0.0,,3.0,https://www.gofundme.com/f/emergency-pandemic-food-assistance,4444064265619246,"A great opportunity to help Monte families. Please share! Thank you.

https://www.gofundme.com/f/emergency-pandemic-food-assistance",https://facebook.com/story.php?story_fbid=4444064265619246&id=116499965042386,"GOFUNDME.COM
Casa Program-Emergency Pandemic Food Assistance organized by Cate Moses",2.0,"A great opportunity to help Monte families. Please share! Thank you.

https://www.gofundme.com/f/emergency-pandemic-food-assistance

GOFUNDME.COM
Casa Program-Emergency Pandemic Food Assistance organized by Cate Moses",2020-05-18 12:59:14,,
43,2.0,https://scontent-atl3-1.xx.fbcdn.net/v/t1.0-9/fr/cp0/e15/q65/97650505_4433729866652686_7566492521572859904_n.jpg?_nc_cat=103&_nc_sid=110474&_nc_ohc=3L3CnepnxPQAX_hSRQP&_nc_oc=AQlPNG8pnLkxDGZFtY7hxyiRGlHnEynauoIZ9n8K8Fle3ZR3raDuuZoJu9Jo_8mHbbU&_nc_ht=scontent-atl3-1.xx&tp=14&oh=4736379460d85bb72009cf72efef7512&oe=5F8231D1,4.0,https://www.graduatetogether2020.com/,4433731776652495,"In celebration of our MDS Class of 2020. While we will be having a virtual graduation ceremony for our seniors on the 29th, it’s not everyday that the whole country honors the hard work of the class of 2020. Streaming at https://www.graduatetogether2020.com",https://facebook.com/story.php?story_fbid=4433731776652495&id=116499965042386,,0.0,"In celebration of our MDS Class of 2020. While we will be having a virtual graduation ceremony for our seniors on the 29th, it’s not everyday that the whole country honors the hard work of the class of 2020. Streaming at https://www.graduatetogether2020.com",2020-05-16 15:52:29,,
44,0.0,https://scontent-atl3-1.xx.fbcdn.net/v/t1.0-9/fr/cp0/e15/q65/98199387_4432616123430727_3759822978032861184_n.jpg?_nc_cat=105&_nc_sid=110474&_nc_ohc=_6S3s3uTnOcAX-aFjGA&_nc_ht=scontent-atl3-1.xx&tp=14&oh=5474a2abed1bc0213311afe3ad9c49d3&oe=5F851099,13.0,,4432616823430657,"It’s May and it’s time to plant! Help support MDS scholarships and pick up some homegrown starts and seeds this Sunday from 9-2. Greens, tomatoes, peppers and more! 🐉 🌱 🍅",https://facebook.com/story.php?story_fbid=4432616823430657&id=116499965042386,,0.0,"It’s May and it’s time to plant! Help support MDS scholarships and pick up some homegrown starts and seeds this Sunday from 9-2. Greens, tomatoes, peppers and more! 🐉 🌱 🍅",2020-05-16 11:40:46,,
45,1.0,,15.0,https://www.du.edu/news/du-senior-juggles-school-work-and-motherhood-while-pursuing-law-school-dream?fbclid=IwAR0Jot2QeVAc3qe-36s3hXglTRlDRAr8eYF13AfUqh8ieu-zHjpKfQebbfg#.Xr7Bom6xM_A.facebook,4427523787273294,"MDS Alumnus! We are so proud of you Lucero!

https://www.du.edu/news/du-senior-juggles-school-work-and-motherhood-while-pursuing-law-school-dream?fbclid=IwAR0Jot2QeVAc3qe-36s3hXglTRlDRAr8eYF13AfUqh8ieu-zHjpKfQebbfg#.Xr7Bom6xM_A.facebook",https://facebook.com/story.php?story_fbid=4427523787273294&id=116499965042386,"DU.EDU
DU Senior Juggles School, Work and Motherhood While Pursuing Law School Dream | University of Denver",0.0,"MDS Alumnus! We are so proud of you Lucero!

https://www.du.edu/news/du-senior-juggles-school-work-and-motherhood-while-pursuing-law-school-dream?fbclid=IwAR0Jot2QeVAc3qe-36s3hXglTRlDRAr8eYF13AfUqh8ieu-zHjpKfQebbfg#.Xr7Bom6xM_A.facebook

DU.EDU
DU Senior Juggles School, Work and Motherhood While Pursuing Law School Dream | University of Denver",2020-05-15 13:47:27,,
46,6.0,,30.0,,4427146493977690,MDS science teacher Erick Druva with a message for his classes!,,,0.0,MDS science teacher Erick Druva with a message for his classes!,2020-05-15 12:14:01,https://video-atl3-1.xx.fbcdn.net/v/t42.9040-2/10000000_2680563268895052_5018984467256049664_n.mp4?_nc_cat=106&_nc_sid=985c63&efg=eyJ2ZW5jb2RlX3RhZyI6ImxlZ2FjeV9zZCJ9&_nc_ohc=b0qJMqlquuEAX-4BJjb&_nc_ht=video-atl3-1.xx&oh=07f7d03233b66b7873d739945ca880c4&oe=5F5E9946,
47,0.0,https://scontent-atl3-1.xx.fbcdn.net/v/t1.0-9/fr/cp0/e15/q65/95592222_4375457479146592_2226281016387960832_n.jpg?_nc_cat=104&_nc_sid=110474&_nc_ohc=MAbgYv4SU8IAX9eMutw&_nc_ht=scontent-atl3-1.xx&tp=14&oh=5b31ba97588eb9e56b7d498475ca5a04&oe=5F8563B4,18.0,,4375458055813201,“Education is the most powerful weapon which you can use to change the world.” Nelson Mandela —- Happy Teacher Appreciation Week to our amazing faculty! Let’s hear it for our teachers! You rock! #gomdsdragons,https://facebook.com/story.php?story_fbid=4375458055813201&id=116499965042386,,0.0,“Education is the most powerful weapon which you can use to change the world.” Nelson Mandela —- Happy Teacher Appreciation Week to our amazing faculty! Let’s hear it for our teachers! You rock! #gomdsdragons,2020-05-04 17:05:50,,
48,2.0,https://scontent-atl3-1.xx.fbcdn.net/v/t1.0-9/fr/cp0/e15/q65/95149158_4361844950507845_3469569259967873024_n.jpg?_nc_cat=100&_nc_sid=110474&_nc_ohc=yFmUw2tMOCQAX8EutqM&_nc_ht=scontent-atl3-1.xx&tp=14&oh=a61005dd0e1a6b64db4dbbc424630f04&oe=5F8348B5,33.0,,4361845683841105,"Over the past 3 day, we’ve celebrated the joys successes of 125 MDS student protege entirely online! Cheers to all who made our Annual Mentorship Festival a huge success! We hope to see you all in person very, very soon! #gomdsdragons",https://facebook.com/story.php?story_fbid=4361845683841105&id=116499965042386,,0.0,"Over the past 3 day, we’ve celebrated the joys successes of 125 MDS student protege entirely online! Cheers to all who made our Annual Mentorship Festival a huge success! We hope to see you all in person very, very soon! #gomdsdragons",2020-05-01 23:07:26,,
49,4.0,https://scontent-atl3-1.xx.fbcdn.net/v/t1.0-9/fr/cp0/e15/q65/95568952_4354015514624122_7957813172369358848_n.jpg?_nc_cat=100&_nc_sid=110474&_nc_ohc=lwVUI0OLt1QAX_P99ex&_nc_ht=scontent-atl3-1.xx&tp=14&oh=9dced65bb3b6b8d4110e1627458ff3c5&oe=5F8215B0,38.0,,4354016234624050,"Congratulations to Monte del Sol students Shayla Anthony, Nefi Guevara Perez, Max Montoya, and Hebert Soto, for their research, presentation, and computer model ""Examining the Effects on Wildfire Spread"" at the 30th annual New Mexico Supercomputing Challenge. The team won the Environmental Modeling Award from Los Alamos National Lab. Nefi and Max also received scholarships to New Mexico Tech. Congratulations team!",https://facebook.com/story.php?story_fbid=4354016234624050&id=116499965042386,,0.0,"Congratulations to Monte del Sol students Shayla Anthony, Nefi Guevara Perez, Max Montoya, and Hebert Soto, for their research, presentation, and computer model ""Examining the Effects on Wildfire Spread"" at the 30th annual New Mexico Supercomputing Challenge. The team won the Environmental Modeling Award from Los Alamos National Lab. Nefi and Max also received scholarships to New Mexico Tech. Congratulations team!",2020-04-30 09:43:36,,
50,10.0,,41.0,,4328798550479152,"Hey Dragons! Stay positive, stay active and keep that MDS Dragon spirit alive!",,,0.0,"Hey Dragons! Stay positive, stay active and keep that MDS Dragon spirit alive!",2020-04-24 12:15:44,https://video-atl3-1.xx.fbcdn.net/v/t42.9040-2/95105096_655411345300666_1596517928939814912_n.mp4?_nc_cat=103&_nc_sid=985c63&efg=eyJ2ZW5jb2RlX3RhZyI6ImxlZ2FjeV9zZCJ9&_nc_ohc=tL7oLI-U24kAX-SOjBK&_nc_ht=video-atl3-1.xx&oh=68ac59cbe571710eccc9078d41f45052&oe=5F5E986B,
51,0.0,https://scontent-atl3-1.xx.fbcdn.net/v/t1.0-9/fr/cp0/e15/q65/93691604_4289760124382995_6400121610346430464_n.jpg?_nc_cat=103&_nc_sid=110474&_nc_ohc=zhI9HFoGpD0AX-gpshW&_nc_ht=scontent-atl3-1.xx&tp=14&oh=865ce8fc509bdbcc54a76c32ab37272f&oe=5F858804,32.0,,4289762021049472,MDS Dragons: we love you and miss you. Stay safe and stay healthy.,https://facebook.com/story.php?story_fbid=4289762021049472&id=116499965042386,,0.0,MDS Dragons: we love you and miss you. Stay safe and stay healthy.,2020-04-14 12:09:22,,
52,1.0,,7.0,https://www.gofundme.com/f/emergency-pandemic-food-assistance?utm_source=facebook&utm_medium=social&utm_campaign=p_cf+share-flow-1,4235816356444039,Immediate help needed for Monte Families and Unaccompanied Homeless Youth. Thank you!,https://facebook.com/story.php?story_fbid=4235816356444039&id=116499965042386,"GOFUNDME.COM
Casa Program-Emergency Pandemic Food Assistance organized by Cate Moses",6.0,"Immediate help needed for Monte Families and Unaccompanied Homeless Youth. Thank you!

GOFUNDME.COM
Casa Program-Emergency Pandemic Food Assistance organized by Cate Moses",2020-03-30 19:01:51,,
53,0.0,,6.0,https://www.gofundme.com/f/stephen039s-3rd-battle-with-brain-surgery?utm_source=facebook&utm_medium=social&utm_campaign=m_pd+share-sheet,4226656174026724,"Yes - so many people in need these days. Here are two from our Monte del Sol School Community. They have been very generous to our school and have sent two beautiful children MdS. If you can donate, please help them. The restaurant they manage, El Farol, had to shut down due to COVID-19 ... Stephen and Monica are now in need due to medical bills. Please help if you can (""no donation too small or too big""), whether you are from Monte del Sol or not. Thank you.",https://facebook.com/story.php?story_fbid=4226656174026724&id=116499965042386,"GOFUNDME.COM
Saving Stephen organized by Monica Walsh",4.0,"Yes - so many people in need these days. Here are two from our Monte del Sol School Community. They have been very generous to our school and have sent two beautiful children MdS. If you can donate, please help them. The restaurant they manage, El Farol, had to shut down due to COVID-19 ... Stephen and Monica are now in need due to medical bills. Please help if you can (""no donation too small or too big""), whether you are from Monte del Sol or not. Thank you.

GOFUNDME.COM
Saving Stephen organized by Monica Walsh",2020-03-28 09:02:06,,
54,0.0,,3.0,https://www.needhelppayingbills.com/html/santa_fe_county_assistance_pro.html,4216061385086203,"Great news for New Mexico families. Please spread the word.

The City of Santa Fe has also said that no one's water will be turned off for nonpayment, your heat cannot be shut off, and this page has help resources for other paying other utility bills: https://www.needhelppayingbills.com/html/santa_fe_county_assistance_pro.html

https://nmpoliticalreport.com/2020/03/24/state-supreme-court-orders-eviction-moratorium-during-covid-19-emergency/?mc_cid=2c6874dd6f&mc_eid=89b96c5a98",https://facebook.com/story.php?story_fbid=4216061385086203&id=116499965042386,"State Supreme Court orders eviction moratorium during coronavirus emergency
The New Mexico Supreme Court ordered a temporary moratorium on evictions for those who are unable to pay rent during the public health emergency over the spread of COVID-19. A number of cities and …

State Supreme Court orders eviction moratorium during coronavirus emergency
The New Mexico Supreme Court ordered a temporary moratorium on evictions for those who are unable to pay rent during the public health emergency over the spread of COVID-19. A number of cities and …

See more at
nmpoliticalreport.com",0.0,"Great news for New Mexico families. Please spread the word.

The City of Santa Fe has also said that no one's water will be turned off for nonpayment, your heat cannot be shut off, and this page has help resources for other paying other utility bills: https://www.needhelppayingbills.com/html/santa_fe_county_assistance_pro.html

https://nmpoliticalreport.com/2020/03/24/state-supreme-court-orders-eviction-moratorium-during-covid-19-emergency/?mc_cid=2c6874dd6f&mc_eid=89b96c5a98

State Supreme Court orders eviction moratorium during coronavirus emergency
The New Mexico Supreme Court ordered a temporary moratorium on evictions for those who are unable to pay rent during the public health emergency over the spread of COVID-19. A number of cities and …

State Supreme Court orders eviction moratorium during coronavirus emergency
The New Mexico Supreme Court ordered a temporary moratorium on evictions for those who are unable to pay rent during the public health emergency over the spread of COVID-19. A number of cities and …

See more at
nmpoliticalreport.com",2020-03-25 12:32:34,,
55,0.0,https://scontent-atl3-1.xx.fbcdn.net/v/t1.0-9/fr/cp0/e15/q65/90018719_4208515195840822_6372073644247482368_n.jpg?_nc_cat=100&_nc_sid=110474&_nc_ohc=2csrTleRL1gAX9dFyte&_nc_ht=scontent-atl3-1.xx&tp=14&oh=6062914da88852dd419ef106f94345d7&oe=5F821A35,8.0,,4208516102507398,"Remember that there is always a blue sky behind those clouds.

MDS students: please check your emails and notifications today as we are rolling out virtual classes for tomorrow, the 24th, and Thursday, the 26th. Please also remember that Parent Teacher conferences are scheduled for this Friday - make sure you’ve communicated with and made arrangements with your advisor. #gomdsdragons 🐉",https://facebook.com/story.php?story_fbid=4208516102507398&id=116499965042386,,0.0,"Remember that there is always a blue sky behind those clouds.

MDS students: please check your emails and notifications today as we are rolling out virtual classes for tomorrow, the 24th, and Thursday, the 26th. Please also remember that Parent Teacher conferences are scheduled for this Friday - make sure you’ve communicated with and made arrangements with your advisor. #gomdsdragons 🐉",2020-03-23 13:46:46,,
56,0.0,,21.0,,4198507050174970,,https://facebook.com/story.php?story_fbid=4198507050174970&id=116499965042386,"Leslie Ann Chavez
March 20 at 7:26 PM ·

A couple of school lunches from this week.
🥗Students! Need lunch?!
Go to the Monte Del Sol website and fill out the form to order...that way we have a head count.
🍎Pick up M-F 11:45-12:30.",3.0,"Leslie Ann Chavez
March 20 at 7:26 PM ·

A couple of school lunches from this week.
🥗Students! Need lunch?!
Go to the Monte Del Sol website and fill out the form to order...that way we have a head count.
🍎Pick up M-F 11:45-12:30.",2020-03-20 20:20:32,,
57,0.0,,5.0,https://docs.google.com/document/d/1i4IJkDhBhhXIWYGBlIDEHBkrjt5nNIpHSF38A__f0do/edit?usp=sharing,4176216052404070,"Monte del Sol Community,
Please take the time to review the document in the link below and fill out any necessary information. We will do all we can to support our families during this time, which includes serving meals, providing ongoing social services, and helping to ensure students have access to internet at home. Please remain in communication with us and reach out to advisors, administration, counselors, etc., so we can assist in the ways we are able.

Thank you.

https://docs.google.com/document/d/1i4IJkDhBhhXIWYGBlIDEHBkrjt5nNIpHSF38A__f0do/edit?usp=sharing",https://facebook.com/story.php?story_fbid=4176216052404070&id=116499965042386,"DOCS.GOOGLE.COM
Details for Remote School Days",5.0,"Monte del Sol Community,
Please take the time to review the document in the link below and fill out any necessary information. We will do all we can to support our families during this time, which includes serving meals, providing ongoing social services, and helping to ensure students have access to internet at home. Please remain in communication with us and reach out to advisors, administration, counselors, etc., so we can assist in the ways we are able.

Thank you.

https://docs.google.com/document/d/1i4IJkDhBhhXIWYGBlIDEHBkrjt5nNIpHSF38A__f0do/edit?usp=sharing

DOCS.GOOGLE.COM
Details for Remote School Days",2020-03-14 13:40:21,,
58,0.0,,2.0,https://www.gofundme.com/f/family-of-guillermo-castrogarcia-fundraiser?pc=fb_co_campmgmtbnr_w&rcid=r01-158386024255-44ab4d3430ba444e&utm_source=facebook&utm_medium=social&utm_campaign=p_lico%2Bbanner&fbclid=IwAR0UW2bG3fNIlXlSqIUDRK8YQYwpa4Kpr8XXvw0oNVQu4iDPMJl6jJHrZYE,4163989233626752,"Please support this Monte del Sol Charter School Family if you can! Thanks, Dragons!

https://www.gofundme.com/f/family-of-guillermo-castrogarcia-fundraiser?pc=fb_co_campmgmtbnr_w&rcid=r01-158386024255-44ab4d3430ba444e&utm_source=facebook&utm_medium=social&utm_campaign=p_lico%2Bbanner&fbclid=IwAR0UW2bG3fNIlXlSqIUDRK8YQYwpa4Kpr8XXvw0oNVQu4iDPMJl6jJHrZYE",https://facebook.com/story.php?story_fbid=4163989233626752&id=116499965042386,"GOFUNDME.COM
Family of Guillermo Castro-Garcia Fundraiser organized by Cate Moses",7.0,"Please support this Monte del Sol Charter School Family if you can! Thanks, Dragons!

https://www.gofundme.com/f/family-of-guillermo-castrogarcia-fundraiser?pc=fb_co_campmgmtbnr_w&rcid=r01-158386024255-44ab4d3430ba444e&utm_source=facebook&utm_medium=social&utm_campaign=p_lico%2Bbanner&fbclid=IwAR0UW2bG3fNIlXlSqIUDRK8YQYwpa4Kpr8XXvw0oNVQu4iDPMJl6jJHrZYE

GOFUNDME.COM
Family of Guillermo Castro-Garcia Fundraiser organized by Cate Moses",2020-03-10 23:18:01,,
59,0.0,https://scontent-atl3-1.xx.fbcdn.net/v/t1.0-9/fr/cp0/e15/q65/89366378_4163188140373528_4948761756261416960_n.jpg?_nc_cat=101&_nc_sid=110474&_nc_ohc=bzFvJu7GDUkAX_kxCbI&_nc_oc=AQn-\-\KwokmPR3qqe6sivoNCAmcfRFhyagM32SzvK_BjVS1mC89KKNYt4z91RL6OYSUU&_nc_ht=scontent-atl3-1.xx&tp=14&oh=2ba06b2fc7e70bcb5a6d352ea430c1bb&oe=5F8400FB,12.0,,4163192557039753,Poets in the making: 11th grade American Lit blackout poetry. Just a sampling of some beautiful and inspiring work!,https://facebook.com/story.php?story_fbid=4163192557039753&id=116499965042386,,0.0,Poets in the making: 11th grade American Lit blackout poetry. Just a sampling of some beautiful and inspiring work!,2020-03-10 17:05:54,,
60,0.0,,0.0,https://www.gofundme.com/f/family-of-guillermo-castrogarcia-fundraiser,4162606687098340,"Please support this Monte del Sol Charter School family if you can! Thanks, Dragons!

https://www.gofundme.com/f/family-of-guillermo-castrogarcia-fundraiser",https://facebook.com/story.php?story_fbid=4162606687098340&id=116499965042386,"GOFUNDME.COM
Family of Guillermo Castro-Garcia Fundraiser organized by Cate Moses",2.0,"Please support this Monte del Sol Charter School family if you can! Thanks, Dragons!

https://www.gofundme.com/f/family-of-guillermo-castrogarcia-fundraiser

GOFUNDME.COM
Family of Guillermo Castro-Garcia Fundraiser organized by Cate Moses",2020-03-10 13:16:39,,
61,0.0,,1.0,https://www.gofundme.com/f/support-dayni?utm_source=facebook&utm_medium=social&utm_campaign=p_cp+share-sheet,4143232662369076,Please help us support our colleague in this difficult time.,https://facebook.com/story.php?story_fbid=4143232662369076&id=116499965042386,"GOFUNDME.COM
Help us support Dayni! organized by Amy Schroth",17.0,"Please help us support our colleague in this difficult time.

GOFUNDME.COM
Help us support Dayni! organized by Amy Schroth",2020-03-04 20:27:54,,
