,comments,image,likes,link,post_id,post_text,post_url,shared_text,shares,text,time,video,video_thumbnail
0,5.0,https://scontent.fbna1-1.fna.fbcdn.net/v/t1.0-9/fr/cp0/e15/q65/119148308_1445281369004886_1099261972953699111_n.jpg?_nc_cat=110&_nc_sid=8024bb&_nc_ohc=P54_7nxmcyUAX_fjuhW&_nc_ht=scontent.fbna1-1.fna&tp=14&oh=e972a6ec2b7db892dd163749ee84dd1d&oe=5F83B1F1,92.0,,1445283212338035,September 11 is a day to remember those individuals who lost their lives in 2001. It was a day where we put aside differences and joined together as Americans. Please feel free to share with us your memories from that day.,https://facebook.com/story.php?story_fbid=1445283212338035&id=229492840583751,,0.0,September 11 is a day to remember those individuals who lost their lives in 2001. It was a day where we put aside differences and joined together as Americans. Please feel free to share with us your memories from that day.,2020-09-11 09:31:09,,
1,0.0,https://scontent.fbna1-2.fna.fbcdn.net/v/t1.0-9/fr/cp0/e15/q65/119164974_1444515629081460_6359430178752516671_o.jpg?_nc_cat=106&_nc_sid=8024bb&_nc_ohc=SCYISWFyuZUAX82D0N-&_nc_ht=scontent.fbna1-2.fna&tp=14&oh=4b551f8098ba26495410ab1ecb75e565&oe=5F814966,19.0,,1444515895748100,Here is information from Perry High School regarding Friday night's football game. Note that this week's game is a free livestream.,https://facebook.com/story.php?story_fbid=1444515895748100&id=229492840583751,,0.0,Here is information from Perry High School regarding Friday night's football game. Note that this week's game is a free livestream.,2020-09-10 19:07:00,,
2,0.0,https://scontent.fbna1-2.fna.fbcdn.net/v/t1.0-9/fr/cp0/e15/q65/119211668_10157757520373635_6385988849063066375_o.jpg?_nc_cat=101&_nc_sid=8024bb&_nc_ohc=p3cOgjA7tEAAX_98mRW&_nc_ht=scontent.fbna1-2.fna&tp=14&oh=1d1b9ac851b976e7326c5733efdf2756&oe=5F804D4F,12.0,,1444505085749181,,https://facebook.com/story.php?story_fbid=1444505085749181&id=229492840583751,"Stark County Mental Health & Addiction Recovery
Yesterday at 10:44 AM ·

""Healing isn't 'getting rid' of the ways we cope ... Healing is finding and *adding* healthier ways to cope..."" What are some healthy ways to cope that you have discovered work for you? Be #inspired by all the work you have done towards your #recovery! #Believe in your recovery!

#beROSCy #thinkROSC #thinkROSCthursday #dontstopbelieving #recoveryoriented #recoveryorientedsystemofcare",3.0,"Stark County Mental Health & Addiction Recovery
Yesterday at 10:44 AM ·

""Healing isn't 'getting rid' of the ways we cope ... Healing is finding and *adding* healthier ways to cope..."" What are some healthy ways to cope that you have discovered work for you? Be #inspired by all the work you have done towards your #recovery! #Believe in your recovery!

#beROSCy #thinkROSC #thinkROSCthursday #dontstopbelieving #recoveryoriented #recoveryorientedsystemofcare",2020-09-10 13:27:17,,
3,0.0,https://scontent.fbna1-2.fna.fbcdn.net/v/t1.0-9/fr/cp0/e15/q65/119093603_3928185813864012_8168429077352238464_o.jpg?_nc_cat=100&_nc_sid=8024bb&_nc_ohc=G8CEkHN0Q5UAX89Ulnp&_nc_ht=scontent.fbna1-2.fna&tp=14&oh=51535734181b51e870c04595b4f3b92b&oe=5F837DB3,38.0,,1443893222477034,"We are fortunate to live in a community with outstanding businesses, organizations, and individuals,",https://facebook.com/story.php?story_fbid=1443893222477034&id=229492840583751,"North Canton Area Chamber of Commerce
September 9 at 11:39 AM ·

Last night the Chamber celebrated the accomplishments of several of our local businesses and individuals at our Annual Awards Dinner.

Congratulations to the winners:
Business of the Year: Shale Brewing Company
Community Investment Award: Akron Children's Hospital Pediatrics, North Canton
Fred Krum Visionary Award: The 720 Market
Chamber Appreciation Award: Site 14
Arts Impact Award: North Canton Playhouse
Community Service Award: North Canton Cares Pantry
Community Leader of the Year: Ryan Grosschmidt
Volunteer of the Year: T.J. Murphy

Photos 📷 : Julian Curet",0.0,"We are fortunate to live in a community with outstanding businesses, organizations, and individuals,

North Canton Area Chamber of Commerce
September 9 at 11:39 AM ·

Last night the Chamber celebrated the accomplishments of several of our local businesses and individuals at our Annual Awards Dinner.

Congratulations to the winners:
Business of the Year: Shale Brewing Company
Community Investment Award: Akron Children's Hospital Pediatrics, North Canton
Fred Krum Visionary Award: The 720 Market
Chamber Appreciation Award: Site 14
Arts Impact Award: North Canton Playhouse
Community Service Award: North Canton Cares Pantry
Community Leader of the Year: Ryan Grosschmidt
Volunteer of the Year: T.J. Murphy

Photos 📷 : Julian Curet",2020-09-09 20:37:21,,
4,12.0,https://scontent.fbna1-1.fna.fbcdn.net/v/t1.0-9/fr/cp0/e15/q65/118980301_1443736892492667_5529145172950064072_o.jpg?_nc_cat=105&_nc_sid=8024bb&_nc_ohc=gBANTGWLAH4AX9XJLvN&_nc_ht=scontent.fbna1-1.fna&tp=14&oh=3c6ebff0e27a3a40a1d498388c59666e&oe=5F82952B,164.0,,1443738249159198,Mrs. Lauren Maxwell's pre-engineering students competed in the cardboard boat challenge at Dogwood swimming pool Tuesday. Please note that the students in the boats did not wear a mask until they completed rowing across the pool. Student team members stood together for a brief time for the photos to be taken which are shown in this post.,https://facebook.com/story.php?story_fbid=1443738249159198&id=229492840583751,,0.0,Mrs. Lauren Maxwell's pre-engineering students competed in the cardboard boat challenge at Dogwood swimming pool Tuesday. Please note that the students in the boats did not wear a mask until they completed rowing across the pool. Student team members stood together for a brief time for the photos to be taken which are shown in this post.,2020-09-09 19:30:01,,
5,1.0,,11.0,https://www.northcantonschools.org/FoodService.aspx,1439981819534841,"In case you missed the NCCS emailed newsletter Friday, the United States Department of Agriculture (USDA) has extended its “Summer Serve” food program through December 31, 2020.

Because of this extension, breakfast and lunch meals will be available to ALL North Canton City School students each school day at no cost, beginning on Tuesday, September 8.

Per the USDA and federal Summer Food Service Program, this free service applies to complete meals only. Individual items will be charged accordingly. For example, if students choose to buy only milk (or an extra milk), they will be charged fifty cents. However, if students order a full meal that includes milk, the meal is provided at no cost to…",https://facebook.com/story.php?story_fbid=1439981819534841&id=229492840583751,"Food Service

Food Service

See more at
northcantonschools.org",0.0,"In case you missed the NCCS emailed newsletter Friday, the United States Department of Agriculture (USDA) has extended its “Summer Serve” food program through December 31, 2020.

Because of this extension, breakfast and lunch meals will be available to ALL North Canton City School students each school day at no cost, beginning on Tuesday, September 8.

Per the USDA and federal Summer Food Service Program, this free service applies to complete meals only. Individual items will be charged accordingly. For example, if students choose to buy only milk (or an extra milk), they will be charged fifty cents. However, if students order a full meal that includes milk, the meal is provided at no cost to…

Food Service

Food Service

See more at
northcantonschools.org",2020-09-05 14:18:29,,
6,1.0,https://scontent.fbna1-1.fna.fbcdn.net/v/t1.0-9/fr/cp0/e15/q65/118805112_1438977539635269_3217725742175569290_o.jpg?_nc_cat=110&_nc_sid=8024bb&_nc_ohc=wNCvFoWdJA0AX8dPOiV&_nc_ht=scontent.fbna1-1.fna&tp=14&oh=70ecc0ee4d4e3239906e0a1ba38c70a4&oe=5F83DA6F,1.0,,1438980332968323,"Here's an update on the 2019-2020 middle school and high school yearbooks. As we mentioned earlier, some Hoover High School yearbooks are still available for purchase, and orders must be placed by September 15.

Yearbooks will be distributed Tuesday, September 22, during third period. Freshmen will receive their middle school yearbooks, and upperclassmen will receive their high school yearbooks. Online students may pick up their yearbooks at Door 1 at Hoover H.S. September 22.",https://facebook.com/story.php?story_fbid=1438980332968323&id=229492840583751,,0.0,"Here's an update on the 2019-2020 middle school and high school yearbooks. As we mentioned earlier, some Hoover High School yearbooks are still available for purchase, and orders must be placed by September 15.

Yearbooks will be distributed Tuesday, September 22, during third period. Freshmen will receive their middle school yearbooks, and upperclassmen will receive their high school yearbooks. Online students may pick up their yearbooks at Door 1 at Hoover H.S. September 22.",2020-09-04 11:04:00,,
7,3.0,,11.0,https://northcantonschools.tedk12.com/hire/index.aspx,1438405169692506,"NCCS is looking for a technology sub from now through approximately Thanksgiving. If you know anyone with a love of computers and a knack for being able to help others with technology and/or hardware, please consider applying today.

We are willing to work around unique schedules, even if that is a college student taking classes at home this semester.

To apply for this or any non-teaching job in the district, click the link below.",https://facebook.com/story.php?story_fbid=1438405169692506&id=229492840583751,"NORTHCANTONSCHOOLS.TEDK12.COM
North Canton City School District - TalentEd Hire",32.0,"NCCS is looking for a technology sub from now through approximately Thanksgiving. If you know anyone with a love of computers and a knack for being able to help others with technology and/or hardware, please consider applying today.

We are willing to work around unique schedules, even if that is a college student taking classes at home this semester.

To apply for this or any non-teaching job in the district, click the link below.

NORTHCANTONSCHOOLS.TEDK12.COM
North Canton City School District - TalentEd Hire",2020-09-03 19:17:18,,
8,12.0,https://scontent.fbna1-2.fna.fbcdn.net/v/t1.0-9/fr/cp0/e15/q65/118804333_1438129016386788_2687254658707610172_o.jpg?_nc_cat=102&_nc_sid=8024bb&_nc_ohc=f6MYnz4XD_0AX_nIY4k&_nc_ht=scontent.fbna1-2.fna&tp=14&oh=b1b9fbcb6aade1bea84ee9a0a4a879cc&oe=5F82BF59,114.0,,1438131276386562,"When masks make it challenging to identify school personnel, you have to find a way to let people know who you are. Meet Dawn Thomas and Katie Wolff.",https://facebook.com/story.php?story_fbid=1438131276386562&id=229492840583751,,0.0,"When masks make it challenging to identify school personnel, you have to find a way to let people know who you are. Meet Dawn Thomas and Katie Wolff.",2020-09-03 19:03:56,,
9,3.0,,21.0,,1438393273027029,You have likely heard that Hoover’s Chris Triner is an excellent teacher. This video says a great deal about him as an educator. Enjoy!,https://facebook.com/story.php?story_fbid=1438393273027029&id=229492840583751,"Studio 525 at Hoover High School
September 3 at 2:59 PM ·

In this day and age, here's how we connect with our students no matter the learning format. ""Art 1 - Form, Value, & Observational Drawing""",2.0,"You have likely heard that Hoover’s Chris Triner is an excellent teacher. This video says a great deal about him as an educator. Enjoy!

Studio 525 at Hoover High School
September 3 at 2:59 PM ·

In this day and age, here's how we connect with our students no matter the learning format. ""Art 1 - Form, Value, & Observational Drawing""",2020-09-03 18:58:22,https://video.fbna1-2.fna.fbcdn.net/v/t42.9040-2/10000000_423475561961030_7698736519758264107_n.mp4?_nc_cat=103&_nc_sid=985c63&efg=eyJ2ZW5jb2RlX3RhZyI6ImxlZ2FjeV9zZCJ9&_nc_ohc=Da_9O1n6hY0AX-6mCzl&_nc_ht=video.fbna1-2.fna&oh=8103370832aac5c5540a3e484307246d&oe=5F5C7EE1,
10,0.0,https://scontent.fbna1-1.fna.fbcdn.net/v/t1.0-9/118786502_3334307793281881_8501142798531757084_n.png?_nc_cat=104&_nc_sid=da1649&_nc_ohc=oznjQ3Rk9b4AX8mgNLo&_nc_ht=scontent.fbna1-1.fna&oh=949d58751dd4ac4218da8438d6955d7f&oe=5F836D35,3.0,http://Tutor.com/,1438386166361073,,https://facebook.com/story.php?story_fbid=1438386166361073&id=229492840583751,"North Canton Public Library
September 3 at 11:26 AM ·

Check out today's blog for some info on how to use our great new service, Tutor.com!
http://ncantonlibrary.com/tutor-com-a-little-how-to-and-whats-there/",0.0,"North Canton Public Library
September 3 at 11:26 AM ·

Check out today's blog for some info on how to use our great new service, Tutor.com!
http://ncantonlibrary.com/tutor-com-a-little-how-to-and-whats-there/",2020-09-03 18:44:57,,
11,4.0,,9.0,https://www.nfhsnetwork.com/events/canton-mckinley-high-school-canton-oh/gam723716af35,1438239523042404,Streaming of Friday night's football game against Canton McKinley will be live streamed through the link below. Please note that McKinley is charging for this service.,https://facebook.com/story.php?story_fbid=1438239523042404&id=229492840583751,"NFHSNETWORK.COM
Canton McKinley vs Hoover - Coed Varsity Football 09/04/2020 | Live & On Demand",8.0,"Streaming of Friday night's football game against Canton McKinley will be live streamed through the link below. Please note that McKinley is charging for this service.

NFHSNETWORK.COM
Canton McKinley vs Hoover - Coed Varsity Football 09/04/2020 | Live & On Demand",2020-09-03 14:27:40,,
12,2.0,https://scontent.fbna1-1.fna.fbcdn.net/v/t1.0-9/fr/cp0/e15/q65/118597862_4289817201091706_3081659215836735413_o.jpg?_nc_cat=104&_nc_sid=8024bb&_nc_ohc=mWea7W3pmIQAX_mPEyU&_nc_ht=scontent.fbna1-1.fna&tp=14&oh=5f6a7cdfa861ec08cc0ecb96d01cdfe7&oe=5F824521,184.0,,1438128029720220,We appreciate our crossing guards who keep NCCS students safe!,https://facebook.com/story.php?story_fbid=1438128029720220&id=229492840583751,"North Canton Police Department
September 2 at 1:02 PM ·

A new school year is upon us, which means two things: One, its dangerously close to everything being pumpkin spice and two, our faithful crossing guards are back at their posts around the City! Although their primary role is helping children safely cross the street, crossing guards also act as role models, often helping children develop the skills necessary to cross streets safely at all times. They are also some of the friendliest folks you will ever want to meet, smiling (behind their masks) and waving to nearly every car that passes. Although they are pictured without their masks (so you can see more than just a pair of eyeballs), our 2020 guards are following mask mandates while crossing the children. So as you’re driving through town, give the guards a friendly wave and if you get the chance, thank them for their dedication to this community.",3.0,"We appreciate our crossing guards who keep NCCS students safe!

North Canton Police Department
September 2 at 1:02 PM ·

A new school year is upon us, which means two things: One, its dangerously close to everything being pumpkin spice and two, our faithful crossing guards are back at their posts around the City! Although their primary role is helping children safely cross the street, crossing guards also act as role models, often helping children develop the skills necessary to cross streets safely at all times. They are also some of the friendliest folks you will ever want to meet, smiling (behind their masks) and waving to nearly every car that passes. Although they are pictured without their masks (so you can see more than just a pair of eyeballs), our 2020 guards are following mask mandates while crossing the children. So as you’re driving through town, give the guards a friendly wave and if you get the chance, thank them for their dedication to this community.",2020-09-03 11:38:59,,
13,26.0,https://scontent.fbna1-1.fna.fbcdn.net/v/t1.0-9/fr/cp0/e15/q65/118762213_1436480776551612_2864104864791009011_o.jpg?_nc_cat=110&_nc_sid=8024bb&_nc_ohc=0jyJcfTrSyEAX_4ecSi&_nc_ht=scontent.fbna1-1.fna&tp=14&oh=7158546690aa650e356c8ae685b5ecaa&oe=5F81B627,288.0,,1436482136551476,"We wanted to take a moment to thank the administrative assistants in the North Canton City Schools District Office for their work in helping families deal with education during the pandemic. Donna Yackey, Julie Crawford, and Dena Campbell do a great job welcoming you into the office and answering your phone calls in the best of times, but their work has been extraordinary over the last few months. To them we say ""thank you.""",https://facebook.com/story.php?story_fbid=1436482136551476&id=229492840583751,,0.0,"We wanted to take a moment to thank the administrative assistants in the North Canton City Schools District Office for their work in helping families deal with education during the pandemic. Donna Yackey, Julie Crawford, and Dena Campbell do a great job welcoming you into the office and answering your phone calls in the best of times, but their work has been extraordinary over the last few months. To them we say ""thank you.""",2020-09-01 19:00:01,,
14,9.0,https://scontent.fbna1-1.fna.fbcdn.net/v/t1.0-9/fr/cp0/e15/q65/118727636_1436440819888941_5111439852009836709_o.jpg?_nc_cat=110&_nc_sid=8024bb&_nc_ohc=Z8Di4d98jW8AX-Wbyr1&_nc_ht=scontent.fbna1-1.fna&tp=14&oh=261c30d693ac34a6092548ea14b0a500&oe=5F80737D,6.0,https://docs.google.com/forms/d/e/1FAIpQLScIavIkadtCnP0yCU6HE6tgEH0MCnj9soyWZyxiSTmYniYimg/viewform,1436443526555337,"With the move to remote learning last spring, some Hoover students forgot to buy a 2019-2020 yearbook. If you wish to order a yearbook, please go to

https://docs.google.com/forms/d/e/1FAIpQLScIavIkadtCnP0yCU6HE6tgEH0MCnj9soyWZyxiSTmYniYimg/viewform.",https://facebook.com/story.php?story_fbid=1436443526555337&id=229492840583751,,0.0,"With the move to remote learning last spring, some Hoover students forgot to buy a 2019-2020 yearbook. If you wish to order a yearbook, please go to

https://docs.google.com/forms/d/e/1FAIpQLScIavIkadtCnP0yCU6HE6tgEH0MCnj9soyWZyxiSTmYniYimg/viewform.",2020-09-01 14:21:23,,
15,0.0,https://scontent.fbna1-2.fna.fbcdn.net/v/t1.0-9/fr/cp0/e15/q65/118615748_2166746680135999_6972943330496470081_o.jpg?_nc_cat=106&_nc_sid=110474&_nc_ohc=tkM2Pus2374AX99zqtv&_nc_ht=scontent.fbna1-2.fna&tp=14&oh=a27d6363658359c529b38050b23da83c&oe=5F80E96E,21.0,,1433858596813830,,https://facebook.com/story.php?story_fbid=1433858596813830&id=229492840583751,"ECC- Mary L. Evans Early Childhood Center
August 28 at 2:45 PM ·

The first week of school at the ECC was FANTASTIC! Thank you parents for all that you do! Enjoy some pictures from our Open House Drive Thru.",0.0,"ECC- Mary L. Evans Early Childhood Center
August 28 at 2:45 PM ·

The first week of school at the ECC was FANTASTIC! Thank you parents for all that you do! Enjoy some pictures from our Open House Drive Thru.",2020-08-29 14:03:17,,
16,0.0,,4.0,https://hoovervikings.com/archived-games,1433856900147333,Did you miss last night's football game? The Hoover High School Athletic Department has it archived here.,https://facebook.com/story.php?story_fbid=1433856900147333&id=229492840583751,"HOOVERVIKINGS.COM
Archived Games",4.0,"Did you miss last night's football game? The Hoover High School Athletic Department has it archived here.

HOOVERVIKINGS.COM
Archived Games",2020-08-29 14:00:48,,
17,13.0,https://scontent.fbna1-1.fna.fbcdn.net/v/t1.0-9/fr/cp0/e15/q65/118594386_1432868086912881_2846967538935392460_n.jpg?_nc_cat=107&_nc_sid=8024bb&_nc_ohc=9iVLGHeteHcAX8Aoy11&_nc_ht=scontent.fbna1-1.fna&tp=14&oh=6d1257c15d6b99c3b1c07432a116b766&oe=5F83D112,61.0,,1432871186912571,"The final Hall of Distinction inductee for 2020 is Daryl Revoldt.

After many years of service to the city of North Canton,
Daryl Revoldt has summarized his experience saying “I have
truly enjoyed municipal government and all of its facets. But I
also love this town.”

In the 1960s, North Canton doubled in size and was
considered the best place in the county to live. Murray and
Elaine Revoldt moved the family from Perry Township to
North Canton in 1964 as Daryl was entering the 8th grade.
He began his relationship with North Canton at the old
Middle School on Charlotte. He remembers many of his
teachers – Mr. Stoica, Mrs. Kidder, Mr. Martz, Mr. Viscounte,
and Mrs. Teeple. He describes the…",https://facebook.com/story.php?story_fbid=1432871186912571&id=229492840583751,,0.0,"The final Hall of Distinction inductee for 2020 is Daryl Revoldt.

After many years of service to the city of North Canton,
Daryl Revoldt has summarized his experience saying “I have
truly enjoyed municipal government and all of its facets. But I
also love this town.”

In the 1960s, North Canton doubled in size and was
considered the best place in the county to live. Murray and
Elaine Revoldt moved the family from Perry Township to
North Canton in 1964 as Daryl was entering the 8th grade.
He began his relationship with North Canton at the old
Middle School on Charlotte. He remembers many of his
teachers – Mr. Stoica, Mrs. Kidder, Mr. Martz, Mr. Viscounte,
and Mrs. Teeple. He describes the…",2020-08-28 19:00:18,,
18,3.0,,56.0,https://hoovervikings.com/,1433036893562667,"Many of you have expressed disappointment at being unable to attend the Hoover High School football game against GlenOak. Hoover's video productions class with Producer Tom Wilson and Director Tim McCarty, have partnered with Q-92 to broadcast tonight's game. The career tech students will provide the video portion of the programming with Q-92 supplying the play-by-play. Unfortunately, due to copyright restrictions, the performance of Hoover's Marching Band will be broadcast without the audio. Watch the livestream on the Hoover Vikings website at https://hoovervikings.com with the livestream available in the news briefs section of the page. The replay will be archived on the site Saturday. Kick-off is 7:00 p.m. Tune in before the game begins to hear Matt Kiraly introduce the game. Special thanks for the video productions/broadcast journalism team and Athletic Director Tim Walker for making this broadcast possible.",https://facebook.com/story.php?story_fbid=1433036893562667&id=229492840583751,"HOOVERVIKINGS.COM
Hoover High School",22.0,"Many of you have expressed disappointment at being unable to attend the Hoover High School football game against GlenOak. Hoover's video productions class with Producer Tom Wilson and Director Tim McCarty, have partnered with Q-92 to broadcast tonight's game. The career tech students will provide the video portion of the programming with Q-92 supplying the play-by-play. Unfortunately, due to copyright restrictions, the performance of Hoover's Marching Band will be broadcast without the audio. Watch the livestream on the Hoover Vikings website at https://hoovervikings.com with the livestream available in the news briefs section of the page. The replay will be archived on the site Saturday. Kick-off is 7:00 p.m. Tune in before the game begins to hear Matt Kiraly introduce the game. Special thanks for the video productions/broadcast journalism team and Athletic Director Tim Walker for making this broadcast possible.

HOOVERVIKINGS.COM
Hoover High School",2020-08-28 15:07:16,,
19,1.0,,4.0,,1432219066977783,,https://facebook.com/story.php?story_fbid=1432219066977783&id=229492840583751,"North Canton Public Library
August 27 at 2:39 PM ·

Check out this new lawn game! Spikeball or Roundnet is a team game that is a lot of fun! To get this from the library, place a hold on our catalog or give us a call!",0.0,"North Canton Public Library
August 27 at 2:39 PM ·

Check out this new lawn game! Spikeball or Roundnet is a team game that is a lot of fun! To get this from the library, place a hold on our catalog or give us a call!",2020-08-27 17:08:51,https://video.fbna1-1.fna.fbcdn.net/v/t42.9040-2/118533981_1608762042617534_8956715081831263477_n.mp4?_nc_cat=105&_nc_sid=985c63&efg=eyJ2ZW5jb2RlX3RhZyI6ImxlZ2FjeV9zZCJ9&_nc_ohc=94wONDsddT4AX94po8v&_nc_ht=video.fbna1-1.fna&oh=0562c7f0023a0ae55894231ae14f17c5&oe=5F5C7C5C,
20,16.0,https://scontent.fbna1-2.fna.fbcdn.net/v/t1.0-9/fr/cp0/e15/q65/118602354_1432218013644555_3460011459229192337_o.jpg?_nc_cat=101&_nc_sid=8024bb&_nc_ohc=vTJ-L8vlJF8AX_jVuvu&_nc_ht=scontent.fbna1-2.fna&tp=14&oh=fac52420ba91acd3687f6bf79ca7574f&oe=5F8220F2,98.0,,1432218096977880,"The third inductee to the 2020 Hall of Distinction is Rick Morrison.

According to one of his former swimmers, “Coach Rick
Morrison is one of the most dedicated individuals I know,
and his passion for swimming is second to none. He has
been a blessing to the North Canton City School District and
the hundreds of swimmers who have had the great
privilege to swim for him.”

Rick was born to parents Charles and Lucille Morrison
and raised in Canton, Ohio, with his brother Kim. He
attended Canton McKinley High School and swam for the
legendary Ted Branin in the 1960s. After graduating, he
attended the University of Cincinnati where he earned a
degree in Education. He later earned a Master’s degree…",https://facebook.com/story.php?story_fbid=1432218096977880&id=229492840583751,,0.0,"The third inductee to the 2020 Hall of Distinction is Rick Morrison.

According to one of his former swimmers, “Coach Rick
Morrison is one of the most dedicated individuals I know,
and his passion for swimming is second to none. He has
been a blessing to the North Canton City School District and
the hundreds of swimmers who have had the great
privilege to swim for him.”

Rick was born to parents Charles and Lucille Morrison
and raised in Canton, Ohio, with his brother Kim. He
attended Canton McKinley High School and swam for the
legendary Ted Branin in the 1960s. After graduating, he
attended the University of Cincinnati where he earned a
degree in Education. He later earned a Master’s degree…",2020-08-27 17:07:43,,
