,comments,image,likes,link,post_id,post_text,post_url,shared_text,shares,text,time,video,video_thumbnail
0,2.0,,5.0,https://youtu.be/gyi8DZRp-jg,3631819173528738,https://youtu.be/gyi8DZRp-jg,https://facebook.com/story.php?story_fbid=3631819173528738&id=147027375341286,"YOUTUBE.COM
Superintendent Laurrie's COVID-19 Update for 9-11-20",4.0,"https://youtu.be/gyi8DZRp-jg

YOUTUBE.COM
Superintendent Laurrie's COVID-19 Update for 9-11-20",2020-09-11 20:24:08,,
1,3.0,,25.0,https://www.wivb.com/news/school-back-in-session-for-students-in-niagara-falls/,3630617480315574,,https://facebook.com/story.php?story_fbid=3630617480315574&id=147027375341286,"WIVB.COM
School back in session for students in Niagara Falls",5.0,"WIVB.COM
School back in session for students in Niagara Falls",2020-09-11 11:10:26,,
2,1.0,,3.0,https://youtu.be/fjWSRElfcjA,3628203927223596,https://youtu.be/fjWSRElfcjA,https://facebook.com/story.php?story_fbid=3628203927223596&id=147027375341286,"YOUTUBE.COM
Superintendent Laurrie's COVID-19 Message for 9-10-20",4.0,"https://youtu.be/fjWSRElfcjA

YOUTUBE.COM
Superintendent Laurrie's COVID-19 Message for 9-10-20",2020-09-10 17:00:44,,
3,4.0,https://scontent-atl3-1.xx.fbcdn.net/v/t1.0-9/fr/cp0/e15/q65/119166618_3628048670572455_1079775816971726940_o.jpg?_nc_cat=104&_nc_sid=8024bb&_nc_ohc=WmSDd5a0uBQAX8dKB8T&_nc_ht=scontent-atl3-1.xx&tp=14&oh=43fae16634bb1bf7db8f82cdcd48d51f&oe=5F8466D3,92.0,,3628067090570613,"Welcome back, students! Today marked the first day our schools have been open in six months. The ""Blue Group"" attended today; the ""Gold Group"" will start tomorrow. Everything went very smoothly and we are so proud of Niagara Falls City School District!",https://facebook.com/story.php?story_fbid=3628067090570613&id=147027375341286,,0.0,"Welcome back, students! Today marked the first day our schools have been open in six months. The ""Blue Group"" attended today; the ""Gold Group"" will start tomorrow. Everything went very smoothly and we are so proud of Niagara Falls City School District!",2020-09-10 15:51:31,,
4,1.0,,6.0,https://youtu.be/M-qHkKWQJ4g,3625020724208583,https://youtu.be/M-qHkKWQJ4g,https://facebook.com/story.php?story_fbid=3625020724208583&id=147027375341286,"YOUTUBE.COM
Superintendent Laurrie's COVID-19 update for 9-9-20",4.0,"https://youtu.be/M-qHkKWQJ4g

YOUTUBE.COM
Superintendent Laurrie's COVID-19 update for 9-9-20",2020-09-09 15:50:51,,
5,0.0,,8.0,https://www.youtube.com/watch?v=aXYdOmyiw7M,3622023534508302,https://www.youtube.com/watch?v=aXYdOmyiw7M,https://facebook.com/story.php?story_fbid=3622023534508302&id=147027375341286,"YOUTUBE.COM
Superintendent Laurrie's COVID-19 Update for 9-8-20",4.0,"https://www.youtube.com/watch?v=aXYdOmyiw7M

YOUTUBE.COM
Superintendent Laurrie's COVID-19 Update for 9-8-20",2020-09-08 17:45:13,,
6,1.0,https://scontent-atl3-1.xx.fbcdn.net/v/t1.0-9/fr/cp0/e15/q65/119089993_3621095917934397_3040717297436966104_n.jpg?_nc_cat=108&_nc_sid=dd9801&_nc_ohc=8Y-4h77nWfYAX_cNiLW&_nc_ht=scontent-atl3-1.xx&tp=14&oh=5ee4d819803ca4276117f731d8879a18&oe=5F83F037,43.0,,3621106034600052,,,,0.0,,2020-09-08 11:09:55,,
7,0.0,,1.0,https://youtu.be/dfFk9HwMv6I,3609503765760279,https://youtu.be/dfFk9HwMv6I,https://facebook.com/story.php?story_fbid=3609503765760279&id=147027375341286,"YOUTUBE.COM
Superintendent Laurrie's COVID-19 Message for 9-4-20",0.0,"https://youtu.be/dfFk9HwMv6I

YOUTUBE.COM
Superintendent Laurrie's COVID-19 Message for 9-4-20",2020-09-04 16:34:45,,
8,11.0,https://scontent-atl3-1.xx.fbcdn.net/v/t1.0-9/fr/cp0/e15/q65/118825862_3608862632491059_6341763138814734034_o.jpg?_nc_cat=103&_nc_sid=8024bb&_nc_ohc=sMNa4Wjwr9sAX-Zq0EK&_nc_ht=scontent-atl3-1.xx&tp=14&oh=a0df20b35af5d12b3222571302a430ef&oe=5F8608A5,74.0,,3608862989157690,"Here's to the Class of 2020! The August graduates of Niagara Falls High School were recognized and honored by the Niagara Falls City School District Board of Education on August 27, 2020.
The District is very proud of the hard work and determination of these students who are now graduates of Niagara Falls High School! Congratulations!

Pictured left to right are: Tache Brown, William Preisch, Jawhan McCain, Dawson Coffta, Kristen Coyle",https://facebook.com/story.php?story_fbid=3608862989157690&id=147027375341286,,0.0,"Here's to the Class of 2020! The August graduates of Niagara Falls High School were recognized and honored by the Niagara Falls City School District Board of Education on August 27, 2020.
The District is very proud of the hard work and determination of these students who are now graduates of Niagara Falls High School! Congratulations!

Pictured left to right are: Tache Brown, William Preisch, Jawhan McCain, Dawson Coffta, Kristen Coyle",2020-09-04 12:02:15,,
9,5.0,,11.0,,3608600792517243,"Daily Home Screening for Students
Parents: Please complete this short check each morning we recommend that you keep your child home if they are not feeling well and report any yes answers to the below questions to your child's school nurse.

SECTION 1: Symptoms
Daily Home Screenings for Students:

If your child has any of the following symptoms, that indicates a possible illness that may decrease the student's ability to learn and also put them at risk for spreading illness to others. Please check your child for these symptoms:
Temperature 100.0 degrees Fahrenheit or higher
Sore throat
New uncontrolled cough that causes difficulty breathing (for students with chronic allergic/asthmatic cough, a change in their cough from baseline)
Diarrhea, vomiting, or abdominal pain
New onset of severe headache, especially with a fever
SECTION 2: Close Contact/Potential Exposure
Had close contact (within 6 feet of an infected person for at least 15 minutes) with a person with confirmed COVID-19
Traveled outside of Western New York in the past 14 days",https://facebook.com/story.php?story_fbid=3608600792517243&id=147027375341286,,0.0,"Daily Home Screening for Students
Parents: Please complete this short check each morning we recommend that you keep your child home if they are not feeling well and report any yes answers to the below questions to your child's school nurse.

SECTION 1: Symptoms
Daily Home Screenings for Students:

If your child has any of the following symptoms, that indicates a possible illness that may decrease the student's ability to learn and also put them at risk for spreading illness to others. Please check your child for these symptoms:
Temperature 100.0 degrees Fahrenheit or higher
Sore throat
New uncontrolled cough that causes difficulty breathing (for students with chronic allergic/asthmatic cough, a change in their cough from baseline)
Diarrhea, vomiting, or abdominal pain
New onset of severe headache, especially with a fever
SECTION 2: Close Contact/Potential Exposure
Had close contact (within 6 feet of an infected person for at least 15 minutes) with a person with confirmed COVID-19
Traveled outside of Western New York in the past 14 days",2020-09-04 10:15:38,,
10,1.0,,0.0,https://youtu.be/jBC88WKR8aA,3606278752749447,https://youtu.be/jBC88WKR8aA,https://facebook.com/story.php?story_fbid=3606278752749447&id=147027375341286,"YOUTUBE.COM
Superintendent Laurrie's COVID-19 Message for 9-3-20",0.0,"https://youtu.be/jBC88WKR8aA

YOUTUBE.COM
Superintendent Laurrie's COVID-19 Message for 9-3-20",2020-09-03 15:43:40,,
11,7.0,,52.0,,3603385153038807,"The New York State SEAL OF BILITERACY recognizes students who have studied and attained a high proficiency in two or more languages by high school graduation. One of the two languages must be English. On August 27, 2020, the Niagara Falls City School District Board of Education honored the five members of the Class of 2020 who earned this distinction:

Yu Li - English and Chinese
Hamza Ansari - English and Urdu
Laila Barnes - English and Spanish
Alexandra Bonnette - English and Spanish
Adrianna Parks - American Sign Language

Pictured here are: Alexandra Bonnette (left) and Laila Barnes (right)",https://facebook.com/story.php?story_fbid=3603385153038807&id=147027375341286,,0.0,"The New York State SEAL OF BILITERACY recognizes students who have studied and attained a high proficiency in two or more languages by high school graduation. One of the two languages must be English. On August 27, 2020, the Niagara Falls City School District Board of Education honored the five members of the Class of 2020 who earned this distinction:

Yu Li - English and Chinese
Hamza Ansari - English and Urdu
Laila Barnes - English and Spanish
Alexandra Bonnette - English and Spanish
Adrianna Parks - American Sign Language

Pictured here are: Alexandra Bonnette (left) and Laila Barnes (right)",2020-09-02 17:45:51,,
12,0.0,,0.0,https://youtu.be/EW3MuD4TxUs,3603230973054225,https://youtu.be/EW3MuD4TxUs,https://facebook.com/story.php?story_fbid=3603230973054225&id=147027375341286,"YOUTUBE.COM
Superintendent Laurrie's COVID-19 Message for 9-1-20",0.0,"https://youtu.be/EW3MuD4TxUs

YOUTUBE.COM
Superintendent Laurrie's COVID-19 Message for 9-1-20",2020-09-02 16:30:20,,
13,0.0,,3.0,https://youtu.be/EsBKL43YtMY,3603222389721750,https://youtu.be/EsBKL43YtMY,https://facebook.com/story.php?story_fbid=3603222389721750&id=147027375341286,"YOUTUBE.COM
Superintendent Laurrie's COVID-19 Update for 9-2-20",0.0,"https://youtu.be/EsBKL43YtMY

YOUTUBE.COM
Superintendent Laurrie's COVID-19 Update for 9-2-20",2020-09-02 16:26:02,,
14,0.0,https://scontent-atl3-1.xx.fbcdn.net/v/t1.0-9/fr/cp0/e15/q65/118602181_3312930692121191_8937219438850565305_o.jpg?_nc_cat=110&_nc_sid=8024bb&_nc_ohc=rKYYpCtQjI8AX-mm2nL&_nc_ht=scontent-atl3-1.xx&tp=14&oh=6852aaf1b8c205ca1c65e670dc36376a&oe=5F8442A2,11.0,,3603216706388985,,https://facebook.com/story.php?story_fbid=3603216706388985&id=147027375341286,"Niagara Falls Boys & Girls Club
August 28 at 9:00 AM ·

Shanya Davis, the NFBGC 2020 Youth of the Year, was presented with the First Annual Alterio Family Scholarship by the Alterio brothers, Tony and Philip Alterio (as pictured below) and Harry Alterio.
Shanya has been a long-term NFBGC member. She is attending UB to study Psychology with an ultimate goal of becoming a Lawyer, practicing family law.
Join us in congratulating Shanya!!!
#OhThePlacesYouWillGo
#WhateverItTakes",0.0,"Niagara Falls Boys & Girls Club
August 28 at 9:00 AM ·

Shanya Davis, the NFBGC 2020 Youth of the Year, was presented with the First Annual Alterio Family Scholarship by the Alterio brothers, Tony and Philip Alterio (as pictured below) and Harry Alterio.
Shanya has been a long-term NFBGC member. She is attending UB to study Psychology with an ultimate goal of becoming a Lawyer, practicing family law.
Join us in congratulating Shanya!!!
#OhThePlacesYouWillGo
#WhateverItTakes",2020-09-02 16:23:24,,
15,0.0,,3.0,https://youtu.be/O5RyFmzV-C8,3596949373682385,https://youtu.be/O5RyFmzV-C8,https://facebook.com/story.php?story_fbid=3596949373682385&id=147027375341286,"YOUTUBE.COM
Superintendent Laurrie's COVID-19 message for 8-31-20",0.0,"https://youtu.be/O5RyFmzV-C8

YOUTUBE.COM
Superintendent Laurrie's COVID-19 message for 8-31-20",2020-08-31 16:36:30,,
16,0.0,,3.0,https://youtu.be/0NVjfhzt3DY,3587586191285370,https://youtu.be/0NVjfhzt3DY,https://facebook.com/story.php?story_fbid=3587586191285370&id=147027375341286,"YOUTUBE.COM
Superintendent Laurrie's COVID-19 Message for 8-28-20",2.0,"https://youtu.be/0NVjfhzt3DY

YOUTUBE.COM
Superintendent Laurrie's COVID-19 Message for 8-28-20",2020-08-28 17:07:33,,
17,7.0,,53.0,https://www.wkbw.com/news/local-news/buffalo-strong/cafeteria-workers-in-niagara-falls-keep-the-meals-going,3587149877995668,,https://facebook.com/story.php?story_fbid=3587149877995668&id=147027375341286,"WKBW.COM
Cafeteria workers in Niagara Falls keep the meals going",5.0,"WKBW.COM
Cafeteria workers in Niagara Falls keep the meals going",2020-08-28 13:40:23,,
18,0.0,https://scontent-atl3-1.xx.fbcdn.net/v/t1.0-9/fr/cp0/e15/q65/118636862_3584409148269741_5446549096289541259_o.jpg?_nc_cat=110&_nc_sid=8024bb&_nc_ohc=-8rDZuoVpJUAX8Au1RJ&_nc_ht=scontent-atl3-1.xx&tp=14&oh=f6a51be2b071dd60457e3ec6d9fde8ec&oe=5F851032,54.0,,3584447828265873,"2020 - 2021 Open Houses continue through September 1st! Join your school and meet some of the teachers and other staff. A schedule for your school's open house dates and times was emailed or mailed to you. Call your child's school if you cannot find the information. Here are some pics of G.J. Mann, Niagara Falls High School and 79th Street School open houses.",https://facebook.com/story.php?story_fbid=3584447828265873&id=147027375341286,,0.0,"2020 - 2021 Open Houses continue through September 1st! Join your school and meet some of the teachers and other staff. A schedule for your school's open house dates and times was emailed or mailed to you. Call your child's school if you cannot find the information. Here are some pics of G.J. Mann, Niagara Falls High School and 79th Street School open houses.",2020-08-27 17:12:25,,
19,1.0,,5.0,https://www.youtube.com/watch?v=8GkAPBZGsmc,3584336331610356,https://www.youtube.com/watch?v=8GkAPBZGsmc,https://facebook.com/story.php?story_fbid=3584336331610356&id=147027375341286,"YOUTUBE.COM
Superintendent Laurrie's COVID-19 Update 8-27-20",3.0,"https://www.youtube.com/watch?v=8GkAPBZGsmc

YOUTUBE.COM
Superintendent Laurrie's COVID-19 Update 8-27-20",2020-08-27 16:15:50,,
20,0.0,,0.0,https://youtu.be/XcxLF6_vaOQ,3581177705259552,https://youtu.be/XcxLF6_vaOQ,https://facebook.com/story.php?story_fbid=3581177705259552&id=147027375341286,"YOUTUBE.COM
Superintendent Laurrie's COVID-19 Message for 8-26-20",3.0,"https://youtu.be/XcxLF6_vaOQ

YOUTUBE.COM
Superintendent Laurrie's COVID-19 Message for 8-26-20",2020-08-26 16:11:20,,
21,0.0,https://scontent-atl3-1.xx.fbcdn.net/v/t1.0-9/fr/cp0/e15/q65/118358979_3578120768898579_1539131948901182475_o.jpg?_nc_cat=103&_nc_sid=8024bb&_nc_ohc=tlK5RMpK9G4AX_r1qZJ&_nc_ht=scontent-atl3-1.xx&tp=14&oh=6f2e54cedc1647b5cc996df039b6a5a7&oe=5F82CF0A,9.0,,3578121218898534,The Veggie Van is back for September! Catch it at Abate and Hyde Park on Thursdays in September (excluding the 17th) - times are listed below. Let the farm come to you!,https://facebook.com/story.php?story_fbid=3578121218898534&id=147027375341286,,0.0,The Veggie Van is back for September! Catch it at Abate and Hyde Park on Thursdays in September (excluding the 17th) - times are listed below. Let the farm come to you!,2020-08-25 16:30:39,,
22,0.0,,0.0,https://youtu.be/jW4xfHB8f4A,3574779265899396,https://youtu.be/jW4xfHB8f4A,https://facebook.com/story.php?story_fbid=3574779265899396&id=147027375341286,"YOUTUBE.COM
Superintendent Laurrie's COVID-19 Update for 8-24-20",3.0,"https://youtu.be/jW4xfHB8f4A

YOUTUBE.COM
Superintendent Laurrie's COVID-19 Update for 8-24-20",2020-08-24 14:05:33,,
23,1.0,,5.0,https://youtu.be/q3Oe_Ktd0OQ,3565867230123933,https://youtu.be/q3Oe_Ktd0OQ,https://facebook.com/story.php?story_fbid=3565867230123933&id=147027375341286,"YOUTUBE.COM
Superintendent Laurrie's COVID-19 message for 8-21-20",4.0,"https://youtu.be/q3Oe_Ktd0OQ

YOUTUBE.COM
Superintendent Laurrie's COVID-19 message for 8-21-20",2020-08-21 14:49:03,,
24,0.0,,2.0,https://youtu.be/Z9Rp5zG3Q6o,3563199903723999,https://youtu.be/Z9Rp5zG3Q6o,https://facebook.com/story.php?story_fbid=3563199903723999&id=147027375341286,"YOUTUBE.COM
Superintendent Laurrie's COVID-19 message for 8-20-20",2.0,"https://youtu.be/Z9Rp5zG3Q6o

YOUTUBE.COM
Superintendent Laurrie's COVID-19 message for 8-20-20",2020-08-20 17:30:15,,
25,1.0,,13.0,https://www.nfbgc.org/back-to-school-2020-2021.html,3563033933740596,"The Niagara Falls Boys and Girls Club is providing before school, after school, and full day child care programs for the 2020 - 2021 school year. Please click on the link below for full information on the programs and how to sign up.

https://www.nfbgc.org/back-to-school-2020-2021.html",https://facebook.com/story.php?story_fbid=3563033933740596&id=147027375341286,"NFBGC.ORG
Back To School 2020-2021",39.0,"The Niagara Falls Boys and Girls Club is providing before school, after school, and full day child care programs for the 2020 - 2021 school year. Please click on the link below for full information on the programs and how to sign up.

https://www.nfbgc.org/back-to-school-2020-2021.html

NFBGC.ORG
Back To School 2020-2021",2020-08-20 16:05:28,,
26,0.0,https://scontent-atl3-1.xx.fbcdn.net/v/t1.0-9/118198199_3560276130683043_6403417460047381810_n.png?_nc_cat=111&_nc_sid=8024bb&_nc_ohc=FE8q3lrLYL0AX_RhyV7&_nc_ht=scontent-atl3-1.xx&oh=a147218d822235ab80553c55575a7bb8&oe=5F8464CF,1.0,,3560279307349392,"* Please note, this is an updated notice; testing at Abate is on August 24.

COVID-19 Testing at City Schools

Niagara Falls Memorial Medical Center will be conducting COVID-19 diagnostic testing at city schools as follows:
• Abate Elementary – Aug. 24 from 11 a.m. to 1 p.m.
• Niagara Street School – Aug. 25 from 9 a.m. to 12 noon
• Cataract Elementary – Aug. 28 from 11 a.m. to 1 p.m.
• Niagara Falls High School – Aug. 29 from 1 p.m. to 4 p.m.

To prevent delays at the test sites we highly recommend you register in advance. To register, please call 278-4496.

Testing will require collecting a saliva specimen

Test Instructions
For 30 minutes prior to collection DO NOT:
• Eat any food
• Drink any beverage
• Chew gum
• Brush Your teeth
• Smoke tobacco products or vape",https://facebook.com/story.php?story_fbid=3560279307349392&id=147027375341286,,0.0,"* Please note, this is an updated notice; testing at Abate is on August 24.

COVID-19 Testing at City Schools

Niagara Falls Memorial Medical Center will be conducting COVID-19 diagnostic testing at city schools as follows:
• Abate Elementary – Aug. 24 from 11 a.m. to 1 p.m.
• Niagara Street School – Aug. 25 from 9 a.m. to 12 noon
• Cataract Elementary – Aug. 28 from 11 a.m. to 1 p.m.
• Niagara Falls High School – Aug. 29 from 1 p.m. to 4 p.m.

To prevent delays at the test sites we highly recommend you register in advance. To register, please call 278-4496.

Testing will require collecting a saliva specimen

Test Instructions
For 30 minutes prior to collection DO NOT:
• Eat any food
• Drink any beverage
• Chew gum
• Brush Your teeth
• Smoke tobacco products or vape",2020-08-19 17:53:57,,
27,0.0,,0.0,https://youtu.be/W-AoJQ4ky6Y,3560182210692435,https://youtu.be/W-AoJQ4ky6Y,https://facebook.com/story.php?story_fbid=3560182210692435&id=147027375341286,"YOUTUBE.COM
Superintendent Laurrie's COVID-19 message for 8-19-20",0.0,"https://youtu.be/W-AoJQ4ky6Y

YOUTUBE.COM
Superintendent Laurrie's COVID-19 message for 8-19-20",2020-08-19 17:03:22,,
28,22.0,,21.0,,3559410887436234,"ATTENTION ALL STUDENTS AND PARENTS AT NIAGARA FALLS HIGH SCHOOL:

NFHS Hybrid Cohorts:

Last Name A - K = Blue Group attending in-person instruction on Mondays and Tuesdays

Last Name L - Z = Gold Group attending in-person instruction on Thursdays and Fridays

Please call 278-5800 with any questions.",https://facebook.com/story.php?story_fbid=3559410887436234&id=147027375341286,,0.0,"ATTENTION ALL STUDENTS AND PARENTS AT NIAGARA FALLS HIGH SCHOOL:

NFHS Hybrid Cohorts:

Last Name A - K = Blue Group attending in-person instruction on Mondays and Tuesdays

Last Name L - Z = Gold Group attending in-person instruction on Thursdays and Fridays

Please call 278-5800 with any questions.",2020-08-19 11:38:28,,
29,40.0,https://scontent-atl3-1.xx.fbcdn.net/v/t1.0-9/fr/cp0/e15/q65/118285536_3557178984326091_3702385856955633862_o.jpg?_nc_cat=110&_nc_sid=8024bb&_nc_ohc=0KE6Enj-jIEAX9heFv1&_nc_ht=scontent-atl3-1.xx&tp=14&oh=bfb054744198d702722c41a2cb829db5&oe=5F8404D8,126.0,,3557185117658811,"Congratulations to Niagara Falls High School Music Teacher Christina Custode for being named a Claes Nobel Educator of Distinction. Please see the news release below for details. Well done and well-deserved, Christina!",https://facebook.com/story.php?story_fbid=3557185117658811&id=147027375341286,,0.0,"Congratulations to Niagara Falls High School Music Teacher Christina Custode for being named a Claes Nobel Educator of Distinction. Please see the news release below for details. Well done and well-deserved, Christina!",2020-08-18 17:33:24,,
30,0.0,,6.0,https://youtu.be/NcPufmS9zSw,3557015427675780,https://youtu.be/NcPufmS9zSw,https://facebook.com/story.php?story_fbid=3557015427675780&id=147027375341286,"YOUTUBE.COM
Superintendent Laurrie's COVID-19 Update for 8-18-20",3.0,"https://youtu.be/NcPufmS9zSw

YOUTUBE.COM
Superintendent Laurrie's COVID-19 Update for 8-18-20",2020-08-18 16:07:45,,
31,0.0,https://scontent-atl3-1.xx.fbcdn.net/v/t1.0-9/fr/cp0/e15/q65/118251704_3556912927686030_2451970684541579832_o.jpg?_nc_cat=104&_nc_sid=8024bb&_nc_ohc=Kb7HntIbZeoAX9cDh3F&_nc_ht=scontent-atl3-1.xx&tp=14&oh=7ad321c57c8a9764ed26672a5cbcd326&oe=5F853E62,1.0,,3556913564352633,,https://facebook.com/story.php?story_fbid=3556913564352633&id=147027375341286,,0.0,,2020-08-18 15:20:00,,
32,8.0,,1.0,https://www.nfschools.net/domain/2747,3556730287704294,NFHS Parents - sign up for a Back to School Meeting on the NFHS website. Here is the link: https://www.nfschools.net/domain/2747,https://facebook.com/story.php?story_fbid=3556730287704294&id=147027375341286,"NFSCHOOLS.NET
Return to School / Welcome",8.0,"NFHS Parents - sign up for a Back to School Meeting on the NFHS website. Here is the link: https://www.nfschools.net/domain/2747

NFSCHOOLS.NET
Return to School / Welcome",2020-08-18 13:54:16,,
33,10.0,,9.0,https://youtu.be/iQsYtvIe7Tg,3554181367959186,https://youtu.be/iQsYtvIe7Tg,https://facebook.com/story.php?story_fbid=3554181367959186&id=147027375341286,"YOUTUBE.COM
Superintendent Laurrie's COVID-19 message for 8-17-20",5.0,"https://youtu.be/iQsYtvIe7Tg

YOUTUBE.COM
Superintendent Laurrie's COVID-19 message for 8-17-20",2020-08-17 16:30:12,,
34,0.0,https://scontent-atl3-1.xx.fbcdn.net/v/t1.0-9/117942793_3553501581360498_2895541734988813850_n.png?_nc_cat=101&_nc_sid=8024bb&_nc_ohc=bKHHptrxoycAX-fvb_8&_nc_ht=scontent-atl3-1.xx&oh=c088442a275d2a39dd34fd56d846aebe&oe=5F85D40D,3.0,,3553502254693764,"COVID-19 Testing at City Schools

Niagara Falls Memorial Medical Center will be conducting COVID-19 diagnostic testing at city schools as follows:
• Abate Elementary – Aug. 21 from 11 a.m. to 1 p.m.
• Niagara Street School – Aug. 25 from 9 a.m. to 12 noon
• Cataract Elementary – Aug. 28 from 11 a.m. to 1 p.m.
• Niagara Falls High School – Aug. 29 from 1 p.m. to 4 p.m.

To prevent delays at the test sites we highly recommend you register in advance. To register, please call 278-4496.

Testing will require collecting a saliva specimen

Test Instructions
For 30 minutes prior to collection DO NOT:
• Eat any food
• Drink any beverage
• Chew gum
• Brush Your teeth
• Smoke tobacco products or vape",https://facebook.com/story.php?story_fbid=3553502254693764&id=147027375341286,,0.0,"COVID-19 Testing at City Schools

Niagara Falls Memorial Medical Center will be conducting COVID-19 diagnostic testing at city schools as follows:
• Abate Elementary – Aug. 21 from 11 a.m. to 1 p.m.
• Niagara Street School – Aug. 25 from 9 a.m. to 12 noon
• Cataract Elementary – Aug. 28 from 11 a.m. to 1 p.m.
• Niagara Falls High School – Aug. 29 from 1 p.m. to 4 p.m.

To prevent delays at the test sites we highly recommend you register in advance. To register, please call 278-4496.

Testing will require collecting a saliva specimen

Test Instructions
For 30 minutes prior to collection DO NOT:
• Eat any food
• Drink any beverage
• Chew gum
• Brush Your teeth
• Smoke tobacco products or vape",2020-08-17 11:32:52,,
35,0.0,,2.0,https://www.youtube.com/watch?v=_p-qVRU79Kk,3553432518034071,Superintendent Laurrie's COVID-19 update for 8-13-20,https://facebook.com/story.php?story_fbid=3553432518034071&id=147027375341286,"YOUTUBE.COM
Superintendent Laurrie's COVID-19 message for 8-13-20",4.0,"Superintendent Laurrie's COVID-19 update for 8-13-20

YOUTUBE.COM
Superintendent Laurrie's COVID-19 message for 8-13-20",2020-08-17 11:01:52,,
36,0.0,,4.0,,3539344019442921,"The Cornell Cooperative Extension Veggie Van will be at Kalfas Elementary, 1800 Beech Avenue, on Thursday, August 13 between 11:30 a.m. and 1:00 p.m. Stop by and pick up some fresh veggies! The mobile market accepts cash, FMNP checks, Double Up Food Bucks and EBT.",https://facebook.com/story.php?story_fbid=3539344019442921&id=147027375341286,,0.0,"The Cornell Cooperative Extension Veggie Van will be at Kalfas Elementary, 1800 Beech Avenue, on Thursday, August 13 between 11:30 a.m. and 1:00 p.m. Stop by and pick up some fresh veggies! The mobile market accepts cash, FMNP checks, Double Up Food Bucks and EBT.",2020-08-12 16:16:11,,
37,2.0,,3.0,https://youtu.be/eYkf8XPfWIk,3539195856124404,https://youtu.be/eYkf8XPfWIk,https://facebook.com/story.php?story_fbid=3539195856124404&id=147027375341286,"YOUTUBE.COM
Superintendent Laurrie's COVID-19 message for 8-12-20",2.0,"https://youtu.be/eYkf8XPfWIk

YOUTUBE.COM
Superintendent Laurrie's COVID-19 message for 8-12-20",2020-08-12 15:04:23,,
38,10.0,,10.0,https://youtube.com/,3553505384693451,"ONE MORE LEFT! Please take the opportunity to participate in the last parent informational session regarding the reopening of District schools. The session will be live-streamed on YouTube on Tuesday, August 18, 2020, at 2:00 p.m.

To watch the live stream - go to youtube.com, search nfcsd for our channel and click on the live stream option. You will be able to text or call in questions at the following phone numbers: (716) 391-0736 OR (716) 246-1597.",https://facebook.com/story.php?story_fbid=3536185349758788&id=147027375341286,,0.0,"ONE MORE LEFT! Please take the opportunity to participate in the last parent informational session regarding the reopening of District schools. The session will be live-streamed on YouTube on Tuesday, August 18, 2020, at 2:00 p.m.

To watch the live stream - go to youtube.com, search nfcsd for our channel and click on the live stream option. You will be able to text or call in questions at the following phone numbers: (716) 391-0736 OR (716) 246-1597.",2020-08-11 14:53:00,,
39,0.0,,7.0,https://youtu.be/a01VrlimPWU,3536164939760829,https://youtu.be/a01VrlimPWU,https://facebook.com/story.php?story_fbid=3536164939760829&id=147027375341286,"YOUTUBE.COM
Superintendent Laurrie's COVID-19 update for 8-11-20",8.0,"https://youtu.be/a01VrlimPWU

YOUTUBE.COM
Superintendent Laurrie's COVID-19 update for 8-11-20",2020-08-11 14:43:25,,
40,3.0,,7.0,https://youtu.be/0MQP9l08pyA,3527077670669556,https://youtu.be/0MQP9l08pyA,https://facebook.com/story.php?story_fbid=3527077670669556&id=147027375341286,"YOUTUBE.COM
Superintendent Laurrie's COVID-19 message for Aug. 8 - 10, 2020",20.0,"https://youtu.be/0MQP9l08pyA

YOUTUBE.COM
Superintendent Laurrie's COVID-19 message for Aug. 8 - 10, 2020",2020-08-08 12:16:40,,
41,6.0,,6.0,https://youtu.be/_tgZ_2ftrUM,3524134577630532,https://youtu.be/_tgZ_2ftrUM,https://facebook.com/story.php?story_fbid=3524134577630532&id=147027375341286,"YOUTUBE.COM
Superintendent Laurrie's COVID-19 message for 8-7-20",4.0,"https://youtu.be/_tgZ_2ftrUM

YOUTUBE.COM
Superintendent Laurrie's COVID-19 message for 8-7-20",2020-08-07 12:34:47,,
42,0.0,https://scontent-atl3-1.xx.fbcdn.net/v/t1.0-9/fr/cp0/e15/q65/116212786_3324241970960976_776919638182031138_o.jpg?_nc_cat=106&_nc_sid=8024bb&_nc_ohc=eSbkWIq2R7IAX8BTjjM&_nc_ht=scontent-atl3-1.xx&tp=14&oh=cc4921c2909a39bb304fd002ebca3b18&oe=5F85EAF8,3.0,https://www.fideliscare.org/Blog/every-child-healthy,3523661507677839,,https://facebook.com/story.php?story_fbid=3523661507677839&id=147027375341286,"Fidelis Care
July 27 at 9:03 AM ·

Fidelis Care is proud to join with the New York State PTA on our new program, Every Child Healthy.

Look for our helpful health and wellness resources for kids and families at https://www.fideliscare.org/Blog/every-child-healthy",0.0,"Fidelis Care
July 27 at 9:03 AM ·

Fidelis Care is proud to join with the New York State PTA on our new program, Every Child Healthy.

Look for our helpful health and wellness resources for kids and families at https://www.fideliscare.org/Blog/every-child-healthy",2020-08-07 09:26:23,,
43,1.0,,5.0,,3518088451568478,The Community Child Care Clearing House Niagara helps individuals who are seeking child care. This is their brochure that includes the organization's phone number and website address.,https://facebook.com/story.php?story_fbid=3518088451568478&id=147027375341286,,0.0,The Community Child Care Clearing House Niagara helps individuals who are seeking child care. This is their brochure that includes the organization's phone number and website address.,2020-08-05 10:41:07,,
44,0.0,,2.0,https://www.youtube.com/watch?v=kmgyT_Yr5Lw,3516163311760992,https://www.youtube.com/watch?v=kmgyT_Yr5Lw,https://facebook.com/story.php?story_fbid=3516163311760992&id=147027375341286,"YOUTUBE.COM
Superintendent Laurrie's COVID-19 Message 8-4-20",0.0,"https://www.youtube.com/watch?v=kmgyT_Yr5Lw

YOUTUBE.COM
Superintendent Laurrie's COVID-19 Message 8-4-20",2020-08-04 18:00:17,,
45,0.0,,8.0,,3516157548428235,"Additional opportunities for COVID-19 testing. The dates, times and locations are:

Monday, August 24 @ Abate Elementary 11:00 a.m. - 1:00 p.m.
Tuesday, August 25 @ Niagara Street School 9:00 a.m. - noon
Friday, August 28 @ Cataract Elementary 11:00 a.m. - 1:00 p.m.
Saturday, August 29 @ Niagara Falls High School 1:00 p.m. - 4:00 p.m.",https://facebook.com/story.php?story_fbid=3516157548428235&id=147027375341286,,0.0,"Additional opportunities for COVID-19 testing. The dates, times and locations are:

Monday, August 24 @ Abate Elementary 11:00 a.m. - 1:00 p.m.
Tuesday, August 25 @ Niagara Street School 9:00 a.m. - noon
Friday, August 28 @ Cataract Elementary 11:00 a.m. - 1:00 p.m.
Saturday, August 29 @ Niagara Falls High School 1:00 p.m. - 4:00 p.m.",2020-08-04 17:57:54,,
46,0.0,https://scontent-atl3-1.xx.fbcdn.net/v/t1.0-9/fr/cp0/e15/q65/116287773_3504126749631315_9022398966174455865_n.jpg?_nc_cat=109&_nc_sid=8024bb&_nc_ohc=t6eMGKzvYxMAX906__2&_nc_ht=scontent-atl3-1.xx&tp=14&oh=b3a20a8aada4d77abec560d6dfc1c873&oe=5F840C6B,21.0,,3504126876297969,,https://facebook.com/story.php?story_fbid=3504126876297969&id=147027375341286,,0.0,,2020-07-31 17:41:12,,
47,0.0,https://scontent-atl3-1.xx.fbcdn.net/v/t1.0-9/fr/cp0/e15/q65/116897156_3504123689631621_4897824934903100372_n.jpg?_nc_cat=102&_nc_sid=8024bb&_nc_ohc=qbTZW7PYobsAX-MVQht&_nc_ht=scontent-atl3-1.xx&tp=14&oh=133519a045ad014e002fd45ce5369ab0&oe=5F8473A6,0.0,,3504123859631604,,https://facebook.com/story.php?story_fbid=3504123859631604&id=147027375341286,,0.0,,2020-07-31 17:39:35,,
48,0.0,https://scontent-atl3-1.xx.fbcdn.net/v/t1.0-9/fr/cp0/e15/q65/116872316_3504094149634575_4628733214853306775_n.jpg?_nc_cat=109&_nc_sid=8024bb&_nc_ohc=LEMCX-_r5lEAX9m6JsO&_nc_ht=scontent-atl3-1.xx&tp=14&oh=ec6dab6b7f0cb5317a39437fcfc2825c&oe=5F85B727,2.0,,3504094366301220,,https://facebook.com/story.php?story_fbid=3504094366301220&id=147027375341286,,0.0,,2020-07-31 17:24:40,,
49,1.0,,13.0,,3504031246307532,"Attention NFHS 2021 Seniors! Mark your calendars, senior pictures are due October 25, 2020. Buffalo Legacy Studios is our contracted photographer, but seniors may use another photography studio of their choice. Buffalo Legacy Studios will be practicing social distancing and all other CDC guidelines.",https://facebook.com/story.php?story_fbid=3504031246307532&id=147027375341286,,0.0,"Attention NFHS 2021 Seniors! Mark your calendars, senior pictures are due October 25, 2020. Buffalo Legacy Studios is our contracted photographer, but seniors may use another photography studio of their choice. Buffalo Legacy Studios will be practicing social distancing and all other CDC guidelines.",2020-07-31 16:51:00,,
50,0.0,,0.0,https://cornell.qualtrics.com/jfe/form/SV_b2sZCEsxFFPlHJH,3503999886310668,"Please participate in this 2-3 minute survey to help the SNAP- Ed Nutrition Education program through the Cornell Cooperative Extension. Niagara County’s program finds better ways to connect your family with tips and tricks to save time, save money and eat healthily.” Please click this link to be directly connected. https://cornell.qualtrics.com/jfe/form/SV_b2sZCEsxFFPlHJH",https://facebook.com/story.php?story_fbid=3503999886310668&id=147027375341286,"CORNELL.QUALTRICS.COM
SNAP-Ed Text2BHealthy",0.0,"Please participate in this 2-3 minute survey to help the SNAP- Ed Nutrition Education program through the Cornell Cooperative Extension. Niagara County’s program finds better ways to connect your family with tips and tricks to save time, save money and eat healthily.” Please click this link to be directly connected. https://cornell.qualtrics.com/jfe/form/SV_b2sZCEsxFFPlHJH

CORNELL.QUALTRICS.COM
SNAP-Ed Text2BHealthy",2020-07-31 16:33:57,,
51,3.0,,2.0,https://youtu.be/tt-vdlEM6d8,3503830522994271,https://youtu.be/tt-vdlEM6d8,https://facebook.com/story.php?story_fbid=3503830522994271&id=147027375341286,"YOUTUBE.COM
Superintendent Laurrie's COVID-19 message for 7-31-20",4.0,"https://youtu.be/tt-vdlEM6d8

YOUTUBE.COM
Superintendent Laurrie's COVID-19 message for 7-31-20",2020-07-31 15:14:45,,
52,0.0,,13.0,,3500921743285149,"The Community Health Center of Niagara (CHCN) Mobile Van is STILL offering FREE COVID-19 testing! No appointment nor referral needed. The testing dates and locations are below. All testing begins at 11:00 a.m. and ends at 1:00 p.m.

Dates and locations:

July 31st - Niagara Falls High School
August 7th - Kalfas
August 21st - Abate
August 28th - Hyde Park
September 4th - Niagara Street School",https://facebook.com/story.php?story_fbid=3500921743285149&id=147027375341286,,0.0,"The Community Health Center of Niagara (CHCN) Mobile Van is STILL offering FREE COVID-19 testing! No appointment nor referral needed. The testing dates and locations are below. All testing begins at 11:00 a.m. and ends at 1:00 p.m.

Dates and locations:

July 31st - Niagara Falls High School
August 7th - Kalfas
August 21st - Abate
August 28th - Hyde Park
September 4th - Niagara Street School",2020-07-30 16:16:51,,
53,2.0,,8.0,,3494531187257538,"Don't miss our Family Dinner sponsored by Fidelis Care!

Hyde Park Elementary School
Monday, August 10, 2020
Dinner 3:30 – 5:00 p.m.

What's Cookin':
BBQ Chicken
Pasta Salad
Corn on the Cob
Dinner Roll
Double Chocolate Chip Cookies",https://facebook.com/story.php?story_fbid=3494531187257538&id=147027375341286,,0.0,"Don't miss our Family Dinner sponsored by Fidelis Care!

Hyde Park Elementary School
Monday, August 10, 2020
Dinner 3:30 – 5:00 p.m.

What's Cookin':
BBQ Chicken
Pasta Salad
Corn on the Cob
Dinner Roll
Double Chocolate Chip Cookies",2020-07-28 13:34:47,,
54,0.0,,1.0,https://www.census.gov/content/dam/Census/programs-surveys/sis/resources/2020/prek_storybook_english_online.pdf,3494097040634286,"Census takers will be at Abate, Cataract, Hyde Park, Kalfas, and Niagara Street Schools from 11:00 a.m. - 1:00 p.m. today (7/29) and Friday (7/31) to assist with completing 2020 census forms. It is very important to the school district that you fill out your census form. Many government funding decisions are based on information from the U.S. Census. Thank you!

The Census representatives will be adhering to all federal, state, and local guidelines for the COVID-19 pandemic. We will have proper PPE and will follow social distancing.
https://www.census.gov/content/dam/Census/programs-surveys/sis/resources/2020/prek_storybook_english_online.pdf",https://facebook.com/story.php?story_fbid=3494097040634286&id=147027375341286,"CENSUS.GOV
www.census.gov",0.0,"Census takers will be at Abate, Cataract, Hyde Park, Kalfas, and Niagara Street Schools from 11:00 a.m. - 1:00 p.m. today (7/29) and Friday (7/31) to assist with completing 2020 census forms. It is very important to the school district that you fill out your census form. Many government funding decisions are based on information from the U.S. Census. Thank you!

The Census representatives will be adhering to all federal, state, and local guidelines for the COVID-19 pandemic. We will have proper PPE and will follow social distancing.
https://www.census.gov/content/dam/Census/programs-surveys/sis/resources/2020/prek_storybook_english_online.pdf

CENSUS.GOV
www.census.gov",2020-07-28 10:40:40,,
55,0.0,,8.0,https://youtu.be/bJ_zcux8LuU,3491972964180027,https://youtu.be/bJ_zcux8LuU,https://facebook.com/story.php?story_fbid=3491972964180027&id=147027375341286,"YOUTUBE.COM
Superintendent Laurrie's COVID-19 Message for 7-27-20",6.0,"https://youtu.be/bJ_zcux8LuU

YOUTUBE.COM
Superintendent Laurrie's COVID-19 Message for 7-27-20",2020-07-27 16:46:30,,
56,2.0,,2.0,https://youtu.be/AWExXZR5Nek,3479038398806817,https://youtu.be/AWExXZR5Nek,https://facebook.com/story.php?story_fbid=3479038398806817&id=147027375341286,"YOUTUBE.COM
Superintendent Laurrie's Covid Message for July 21, 2020",0.0,"https://youtu.be/AWExXZR5Nek

YOUTUBE.COM
Superintendent Laurrie's Covid Message for July 21, 2020",2020-07-23 10:47:20,,
57,0.0,,11.0,,3479021268808530,"The Community Mobile Health Van is offering COVID-19 testing from 11:00 a.m - 1:00 p.m. No appointment nor referral needed.

Dates and locations:
July 31st - NFHS
August 7th -Kalfas
August 21st - Abate
August 28th - Hyde Park
September 4th - NSS

11-1p.m.",https://facebook.com/story.php?story_fbid=3479021268808530&id=147027375341286,,0.0,"The Community Mobile Health Van is offering COVID-19 testing from 11:00 a.m - 1:00 p.m. No appointment nor referral needed.

Dates and locations:
July 31st - NFHS
August 7th -Kalfas
August 21st - Abate
August 28th - Hyde Park
September 4th - NSS

11-1p.m.",2020-07-23 10:40:11,,
58,0.0,https://scontent-atl3-1.xx.fbcdn.net/v/t1.0-9/fr/cp0/e15/q65/109953725_3473219479388709_2306639574080288859_o.jpg?_nc_cat=106&_nc_sid=8024bb&_nc_ohc=NYUc5HVobhcAX_wrclh&_nc_ht=scontent-atl3-1.xx&tp=14&oh=069168e15093b260b0e8b307aba1e720&oe=5F83854E,2.0,,3473219579388699,,https://facebook.com/story.php?story_fbid=3473219579388699&id=147027375341286,,0.0,,2020-07-21 11:55:21,,
59,0.0,,2.0,,3461516200559037,"Interscholastic High School sports have been postponed until September 21, 2020.

We will provide any and all updates as soon as they happen.",https://facebook.com/story.php?story_fbid=3461516200559037&id=147027375341286,,0.0,"Interscholastic High School sports have been postponed until September 21, 2020.

We will provide any and all updates as soon as they happen.",2020-07-17 12:15:14,,
60,0.0,,4.0,https://youtu.be/6VfJ0cWFTSY,3456232887754035,https://youtu.be/6VfJ0cWFTSY,https://facebook.com/story.php?story_fbid=3456232887754035&id=147027375341286,"YOUTUBE.COM
Superintendent Laurrie's COVID-19 message for 7-15-20",3.0,"https://youtu.be/6VfJ0cWFTSY

YOUTUBE.COM
Superintendent Laurrie's COVID-19 message for 7-15-20",2020-07-15 16:11:58,,
61,13.0,,7.0,https://otda.ny.gov/SNAP-COVID-19/Frequently-Asked-Questions-Pandemic-EBT.asp,3455880621122595,"https://otda.ny.gov/SNAP-COVID-19/Frequently-Asked-Questions-Pandemic-EBT.asp

This link has excellent information on SNAP benefits during COVID-19.",https://facebook.com/story.php?story_fbid=3455880621122595&id=147027375341286,"OTDA.NY.GOV
New York State Pandemic Electronic Benefit Transfer (P-EBT) Food Benefits Frequently Asked Questions | SNAP COVID-19 Information | SNAP",49.0,"https://otda.ny.gov/SNAP-COVID-19/Frequently-Asked-Questions-Pandemic-EBT.asp

This link has excellent information on SNAP benefits during COVID-19.

OTDA.NY.GOV
New York State Pandemic Electronic Benefit Transfer (P-EBT) Food Benefits Frequently Asked Questions | SNAP COVID-19 Information | SNAP",2020-07-15 13:45:15,,
62,0.0,,4.0,,3453186758058648,"Two important notes: The Veggie Van will not be at Kalfas School this Thursday, July 16, due to a scheduling conflict. The Veggie Van will return to Kalfas on Thursday, July 23 from 11:30 a.m. - 1:30 p.m.

Also, Niagara Falls Memorial Medical Center is helping to supply the South with much-needed COVID-19 testing supplies. Therefore, the hospital will not be conducting community testing on Friday (July 17) at Niagara Falls High School.",https://facebook.com/story.php?story_fbid=3453186758058648&id=147027375341286,,0.0,"Two important notes: The Veggie Van will not be at Kalfas School this Thursday, July 16, due to a scheduling conflict. The Veggie Van will return to Kalfas on Thursday, July 23 from 11:30 a.m. - 1:30 p.m.

Also, Niagara Falls Memorial Medical Center is helping to supply the South with much-needed COVID-19 testing supplies. Therefore, the hospital will not be conducting community testing on Friday (July 17) at Niagara Falls High School.",2020-07-14 16:25:48,,
63,0.0,,5.0,https://youtu.be/3pEsbPjBbMI,3449887941721863,https://youtu.be/3pEsbPjBbMI,https://facebook.com/story.php?story_fbid=3449887941721863&id=147027375341286,"YOUTUBE.COM
Superintendent Laurrie's COVID-19 message for 7-13-20",3.0,"https://youtu.be/3pEsbPjBbMI

YOUTUBE.COM
Superintendent Laurrie's COVID-19 message for 7-13-20",2020-07-13 13:43:21,,
64,0.0,https://scontent-atl3-1.xx.fbcdn.net/v/t1.0-9/fr/cp0/e15/q65/107461732_3438608336183157_293176292642923618_n.jpg?_nc_cat=100&_nc_sid=8024bb&_nc_ohc=hfJ6-BaTtdoAX-uu6Pw&_nc_ht=scontent-atl3-1.xx&tp=14&oh=5c333b18dc252fabe38738322140f118&oe=5F82FF6E,3.0,,3438608522849805,,https://facebook.com/story.php?story_fbid=3438608522849805&id=147027375341286,,0.0,,2020-07-09 15:41:44,,
65,0.0,,4.0,,3438600126183978,,https://facebook.com/story.php?story_fbid=3438600126183978&id=147027375341286,,0.0,,2020-07-09 15:36:32,,
66,1.0,https://scontent-atl3-1.xx.fbcdn.net/v/t1.0-9/fr/cp0/e15/q65/107964368_3438581536185837_1697367309507399502_o.jpg?_nc_cat=100&_nc_sid=8024bb&_nc_ohc=js5zKZ0Mil0AX_I0-u3&_nc_ht=scontent-atl3-1.xx&tp=14&oh=721eb0d2f3ed3a44342e7ada37aa60f6&oe=5F8648B7,0.0,,3438581689519155,,https://facebook.com/story.php?story_fbid=3438581689519155&id=147027375341286,,0.0,,2020-07-09 15:25:07,,
67,0.0,,7.0,,3437816649595659,"Veggie Van starts today (July 9, 2020)! The mobile farmer's market will be at Kalfas School,1800 Beech Avenue, between 11:00 a.m. and 1:00 p.m. Stop by and pick up some fresh veggies! The mobile market accepts cash, FMNP checks, Double Up Food Bucks and EBT.",https://facebook.com/story.php?story_fbid=3437816649595659&id=147027375341286,,0.0,"Veggie Van starts today (July 9, 2020)! The mobile farmer's market will be at Kalfas School,1800 Beech Avenue, between 11:00 a.m. and 1:00 p.m. Stop by and pick up some fresh veggies! The mobile market accepts cash, FMNP checks, Double Up Food Bucks and EBT.",2020-07-09 09:15:52,,
68,8.0,https://scontent-atl3-1.xx.fbcdn.net/v/t1.0-9/fr/cp0/e15/q65/107083545_3435805793130078_4095234571528975835_o.jpg?_nc_cat=100&_nc_sid=8024bb&_nc_ohc=tioyinXWzVQAX9Doah5&_nc_ht=scontent-atl3-1.xx&tp=14&oh=f1f9c93daaf4bca1ca5f480b0175c8e8&oe=5F8441CE,51.0,,3435831686460822,"At its reorganization meeting last night (Tuesday, July 7, 2020), the Niagara Falls City School District Board of Education held a swearing-in ceremony for (from left to right, first photo): re-elected member Russell Petrozzi, and new members Clara Dunn and Robert Bilson. The board also re-elected James Cancemi as board president and Dr. Ronald Barstys as board vice president (second photo, left to right: Cancemi, Petrozzi, Dunn, Barstys and Bilson).",https://facebook.com/story.php?story_fbid=3435831686460822&id=147027375341286,,0.0,"At its reorganization meeting last night (Tuesday, July 7, 2020), the Niagara Falls City School District Board of Education held a swearing-in ceremony for (from left to right, first photo): re-elected member Russell Petrozzi, and new members Clara Dunn and Robert Bilson. The board also re-elected James Cancemi as board president and Dr. Ronald Barstys as board vice president (second photo, left to right: Cancemi, Petrozzi, Dunn, Barstys and Bilson).",2020-07-08 16:13:39,,
69,0.0,,5.0,,3435794979797826,"FREE COVID-19 testing continues...Niagara Falls Memorial Medical Center will conduct testing from 11:00 a.m. - 1:00 p.m. on Friday, July 10 at Niagara Street School and from 11:00 a.m. - 1:00 p.m. on Friday, July 17 at Niagara Falls High School. No referrals needed.",https://facebook.com/story.php?story_fbid=3435794979797826&id=147027375341286,,0.0,"FREE COVID-19 testing continues...Niagara Falls Memorial Medical Center will conduct testing from 11:00 a.m. - 1:00 p.m. on Friday, July 10 at Niagara Street School and from 11:00 a.m. - 1:00 p.m. on Friday, July 17 at Niagara Falls High School. No referrals needed.",2020-07-08 15:57:28,,
70,0.0,,5.0,https://youtu.be/bWhLNjp9h1U,3432835516760439,https://youtu.be/bWhLNjp9h1U,https://facebook.com/story.php?story_fbid=3432835516760439&id=147027375341286,"YOUTUBE.COM
Superintendent Laurrie's COVID-19 message for 7-7-20",0.0,"https://youtu.be/bWhLNjp9h1U

YOUTUBE.COM
Superintendent Laurrie's COVID-19 message for 7-7-20",2020-07-07 16:05:45,,
71,7.0,https://scontent-atl3-1.xx.fbcdn.net/v/t1.0-9/fr/cp0/e15/q65/106982913_3432063616837629_151550770313941295_o.jpg?_nc_cat=108&_nc_sid=8024bb&_nc_ohc=im4tKOiwGooAX8DrM5l&_nc_ht=scontent-atl3-1.xx&tp=14&oh=ee1333b88f98e40589e6b896461ae52f&oe=5F84054D,40.0,,3432101686833822,"It's the return of the Veggie Van! The Veggie Van is a mobile farmers market bringing fresh Niagara County produce directly to the community, accepting cash, FMNP checks, Double Up Food Bucks and EBT. The Veggie Van will be parked at Kalfas School, 1800 Beech Avenue, from 11:30 a.m. - 1:30 p.m. July 9, 23, and 30. The van then travels on to Hyde Park Elementary, 1620 Hyde Park Blvd. for August and will be open 11:30 a.m. 1:30 p.m. every Thursday in August (August 7, 14, 21 and 28). Let the farm come to you! And check out the Veggie Van!",https://facebook.com/story.php?story_fbid=3432101686833822&id=147027375341286,,0.0,"It's the return of the Veggie Van! The Veggie Van is a mobile farmers market bringing fresh Niagara County produce directly to the community, accepting cash, FMNP checks, Double Up Food Bucks and EBT. The Veggie Van will be parked at Kalfas School, 1800 Beech Avenue, from 11:30 a.m. - 1:30 p.m. July 9, 23, and 30. The van then travels on to Hyde Park Elementary, 1620 Hyde Park Blvd. for August and will be open 11:30 a.m. 1:30 p.m. every Thursday in August (August 7, 14, 21 and 28). Let the farm come to you! And check out the Veggie Van!",2020-07-07 10:43:14,,
72,0.0,,5.0,https://www.niagara-gazette.com/news/local_news/call-for-racial-justice/article_e0537412-866c-5d40-bfe9-4b31331bbede.html,3431988090178515,,https://facebook.com/story.php?story_fbid=3431988090178515&id=147027375341286,"NIAGARA-GAZETTE.COM
Call for racial justice",0.0,"NIAGARA-GAZETTE.COM
Call for racial justice",2020-07-07 09:52:05,,
73,0.0,,4.0,https://youtu.be/tSMRJQj18fk,3418750664835591,https://youtu.be/tSMRJQj18fk,https://facebook.com/story.php?story_fbid=3418750664835591&id=147027375341286,"YOUTUBE.COM
Superintendent Laurrie's COVID-19 message for 7-2-20",0.0,"https://youtu.be/tSMRJQj18fk

YOUTUBE.COM
Superintendent Laurrie's COVID-19 message for 7-2-20",2020-07-02 17:02:54,,
74,0.0,,27.0,,3415602581817066,"The Niagara County Department of Emergency Services is giving away FREE adult and children's masks and small bottles of hand sanitizer tomorrow, Thursday, July 2, starting at 9:00 a.m. at the Niagara Falls City Market, 779 East Market Street. There will be both a drive-thru and walk-up tables. Bags will be distributed on a first-come, first-served basis. The event runs until 2 p.m. or until all bags have been handed out.",https://facebook.com/story.php?story_fbid=3415602581817066&id=147027375341286,,0.0,"The Niagara County Department of Emergency Services is giving away FREE adult and children's masks and small bottles of hand sanitizer tomorrow, Thursday, July 2, starting at 9:00 a.m. at the Niagara Falls City Market, 779 East Market Street. There will be both a drive-thru and walk-up tables. Bags will be distributed on a first-come, first-served basis. The event runs until 2 p.m. or until all bags have been handed out.",2020-07-01 14:59:14,,
75,0.0,https://scontent-atl3-1.xx.fbcdn.net/v/t1.0-9/fr/cp0/e15/q65/73322476_3412941038749887_5755980921949520009_n.jpg?_nc_cat=110&_nc_sid=8024bb&_nc_ohc=3vmykXg4hpcAX9VVGCf&_nc_ht=scontent-atl3-1.xx&tp=14&oh=43320ea03c8759d45dc0a8d6d7d1ce7a&oe=5F82C80C,0.0,,3412941115416546,,https://facebook.com/story.php?story_fbid=3412941115416546&id=147027375341286,,0.0,,2020-06-30 16:57:12,,
76,0.0,,0.0,https://youtu.be/x4k7I550_L8,3410049662372358,https://youtu.be/x4k7I550_L8,https://facebook.com/story.php?story_fbid=3410049662372358&id=147027375341286,"YOUTUBE.COM
Superintendent Laurrie's COVID-19 Message 6-29-20",0.0,"https://youtu.be/x4k7I550_L8

YOUTUBE.COM
Superintendent Laurrie's COVID-19 Message 6-29-20",2020-06-29 17:25:20,,
77,0.0,https://scontent-atl3-1.xx.fbcdn.net/v/t1.0-9/fr/cp0/e15/q65/106731590_3409331115777546_5441029417203732738_o.jpg?_nc_cat=102&_nc_sid=8024bb&_nc_ohc=Uv5NLQB6g5cAX_3Ed7U&_nc_ht=scontent-atl3-1.xx&tp=14&oh=83d2ac91a23de3b9f61e79a9e7d5dbf6&oe=5F862E78,22.0,,3409334199110571,More Class of 2020 Graduation!,https://facebook.com/story.php?story_fbid=3409334199110571&id=147027375341286,,0.0,More Class of 2020 Graduation!,2020-06-29 11:51:08,,
78,1.0,https://scontent-atl3-1.xx.fbcdn.net/v/t1.0-9/fr/cp0/e15/q65/106676186_3409272672450057_218327558745002706_o.jpg?_nc_cat=102&_nc_sid=8024bb&_nc_ohc=vygjnEsDxxsAX8aiFZx&_nc_ht=scontent-atl3-1.xx&tp=14&oh=9bc0683a6cc756d44428a1f9fe6e81c8&oe=5F83839F,60.0,,3409279079116083,"Class of 2020 Graduation Ceremony
Saturday, June 27, 2020",https://facebook.com/story.php?story_fbid=3409279079116083&id=147027375341286,,0.0,"Class of 2020 Graduation Ceremony
Saturday, June 27, 2020",2020-06-29 11:24:53,,
79,0.0,,9.0,https://www.wkbw.com/news/local-news/class-of-2020-niagara-falls-hs-seniors-graduate,3409135145797143,,https://facebook.com/story.php?story_fbid=3409135145797143&id=147027375341286,"WKBW.COM
Class of 2020: Niagara Falls HS seniors graduate",2.0,"WKBW.COM
Class of 2020: Niagara Falls HS seniors graduate",2020-06-29 10:20:07,,
80,1.0,,20.0,https://www.wivb.com/news/niagra-falls-holds-special-ceremony-for-graduates/,3409122872465037,,https://facebook.com/story.php?story_fbid=3409122872465037&id=147027375341286,"WIVB.COM
Niagara Falls holds special ceremony for graduates",0.0,"WIVB.COM
Niagara Falls holds special ceremony for graduates",2020-06-29 10:14:01,,
81,2.0,,57.0,https://spectrumlocalnews.com/nys/buffalo/human-interest/2020/06/28/niagara-falls-high-school-celebrates-seniors-with-drive-thru-ceremony-?cid=share_fb,3409102645800393,,https://facebook.com/story.php?story_fbid=3409102645800393&id=147027375341286,"SPECTRUMLOCALNEWS.COM
Niagara Falls High School Celebrates Seniors With Drive-Thru Ceremony",3.0,"SPECTRUMLOCALNEWS.COM
Niagara Falls High School Celebrates Seniors With Drive-Thru Ceremony",2020-06-29 10:03:54,,
82,2.0,,13.0,https://www.niagara-gazette.com/gallery/slideshow-graduation-festivities-in-niagara-falls/collection_956d6648-b8c2-11ea-baeb-0bba08dcffa9.html,3409077299136261,,https://facebook.com/story.php?story_fbid=3409077299136261&id=147027375341286,"NIAGARA-GAZETTE.COM
SLIDESHOW: Graduation festivities in Niagara Falls",4.0,"NIAGARA-GAZETTE.COM
SLIDESHOW: Graduation festivities in Niagara Falls",2020-06-29 09:52:06,,
83,0.0,,1.0,https://youtu.be/-4UQWA_sZ5k,3401087023268622,https://youtu.be/-4UQWA_sZ5k,https://facebook.com/story.php?story_fbid=3401087023268622&id=147027375341286,"YOUTUBE.COM
Superintendent Laurrie's message on graduation",0.0,"https://youtu.be/-4UQWA_sZ5k

YOUTUBE.COM
Superintendent Laurrie's message on graduation",2020-06-26 14:52:04,,
84,0.0,,2.0,https://www.niagara-gazette.com/news/local_news/cornell-co-op-giving-out-food-today/article_93f6771c-2e60-5482-8e57-87549b052140.html,3400474319996559,,https://facebook.com/story.php?story_fbid=3400474319996559&id=147027375341286,"NIAGARA-GAZETTE.COM
Cornell Co-op giving out food today",0.0,"NIAGARA-GAZETTE.COM
Cornell Co-op giving out food today",2020-06-26 10:13:35,,
85,0.0,,6.0,http://osc.viebit.com/,3400418403335484,Please note that there is an error in this story. The graduation speeches will be streamed live on Our Schools Channel at osc.viebit.com,https://facebook.com/story.php?story_fbid=3400418403335484&id=147027375341286,"WIVB.COM
Start time changed for Niagara Falls High School’s graduation vehicle procession on Saturday",9.0,"Please note that there is an error in this story. The graduation speeches will be streamed live on Our Schools Channel at osc.viebit.com

WIVB.COM
Start time changed for Niagara Falls High School’s graduation vehicle procession on Saturday",2020-06-26 09:48:50,,
86,0.0,,2.0,https://youtu.be/S8QRV9ChokM,3398506496860008,"NOTE: This video was filmed before a decision on graduation was made. The time for the Niagara Falls High School graduation on June 27, 2020, has been changed to 3:00 p.m. due to expected inclement weather.

https://youtu.be/S8QRV9ChokM",https://facebook.com/story.php?story_fbid=3398506496860008&id=147027375341286,"YOUTUBE.COM
Superintendent Laurrie's COVID-19 message for 6-25-20",3.0,"NOTE: This video was filmed before a decision on graduation was made. The time for the Niagara Falls High School graduation on June 27, 2020, has been changed to 3:00 p.m. due to expected inclement weather.

https://youtu.be/S8QRV9ChokM

YOUTUBE.COM
Superintendent Laurrie's COVID-19 message for 6-25-20",2020-06-25 16:47:04,,
87,0.0,,14.0,,3398282533549071,"Due to expected inclement weather, the Class of 2020 graduation ceremony time has been changed. The ceremony will now start at 3:00 p.m. on Saturday, June 27, 2020. Speeches will still be broadcast at 11:00 a.m. Principal Jones will be contacting seniors with more details.",https://facebook.com/story.php?story_fbid=3398282533549071&id=147027375341286,,0.0,"Due to expected inclement weather, the Class of 2020 graduation ceremony time has been changed. The ceremony will now start at 3:00 p.m. on Saturday, June 27, 2020. Speeches will still be broadcast at 11:00 a.m. Principal Jones will be contacting seniors with more details.",2020-06-25 14:56:52,,
88,0.0,,1.0,,3392386207472037,"A Falls resident is seeking a 1969 NFHS yearbook. If you are done with yours, please call 286-4204. Thank you.",https://facebook.com/story.php?story_fbid=3392386207472037&id=147027375341286,,0.0,"A Falls resident is seeking a 1969 NFHS yearbook. If you are done with yours, please call 286-4204. Thank you.",2020-06-23 14:38:28,,
89,0.0,https://scontent-atl3-1.xx.fbcdn.net/v/t1.0-9/fr/cp0/e15/q65/104292423_3381143195263005_8816895166530703388_o.jpg?_nc_cat=111&_nc_sid=8024bb&_nc_ohc=lyYhn7iTDRwAX_cLOlV&_nc_ht=scontent-atl3-1.xx&tp=14&oh=dbff03628b7c58310c25589d99b06598&oe=5F84A541,24.0,,3381144901929501,Niagara Falls Memorial Hospital performed free COVID-19 testing at Abate Elementary today. Over 50 individuals were tested for the virus.,https://facebook.com/story.php?story_fbid=3381144901929501&id=147027375341286,,0.0,Niagara Falls Memorial Hospital performed free COVID-19 testing at Abate Elementary today. Over 50 individuals were tested for the virus.,2020-06-19 14:41:24,,
90,0.0,,0.0,https://www.youtube.com/watch?v=WeKDxJL3Rbo,3378584372185554,https://www.youtube.com/watch?v=WeKDxJL3Rbo,https://facebook.com/story.php?story_fbid=3378584372185554&id=147027375341286,"YOUTUBE.COM
Superintendent Laurrie's Covid message 6-18-20",0.0,"https://www.youtube.com/watch?v=WeKDxJL3Rbo

YOUTUBE.COM
Superintendent Laurrie's Covid message 6-18-20",2020-06-18 16:56:33,,
91,9.0,https://scontent-atl3-1.xx.fbcdn.net/v/t1.0-9/fr/cp0/e15/q65/104775093_3377811092262882_800992813781669153_o.jpg?_nc_cat=106&_nc_sid=8024bb&_nc_ohc=wcbr0fXlTpoAX848Jfm&_nc_ht=scontent-atl3-1.xx&tp=14&oh=30a07b9fc681c6a5d1e716fed8f42bb8&oe=5F84FE51,102.0,,3377811408929517,,https://facebook.com/story.php?story_fbid=3377811408929517&id=147027375341286,,0.0,,2020-06-18 10:47:22,,
92,12.0,https://scontent-atl3-1.xx.fbcdn.net/v/t1.0-9/fr/cp0/e15/q65/104448813_3377804845596840_8414168442923953358_o.jpg?_nc_cat=100&_nc_sid=8024bb&_nc_ohc=KSHxBJzBKOkAX-FvnEF&_nc_ht=scontent-atl3-1.xx&tp=14&oh=667388069ec5f0b4b0102b63e9ac1ac2&oe=5F84509A,72.0,,3377805042263487,"The Niagara Falls City School District's newest Board of Education member Robert F. Bilson was sworn in last night by District Clerk Judie Glaser. He was elected for a one-year term, with a vote total of 2,862. Robert Bilson is the senior director of negotiation for production at Strategic Financial Solutions, NY. He is an accomplished television music composer for shows such as A&E’s The Wahlburgers. Bilson lives in LaSalle with his wife, Nicole, and their five children.",https://facebook.com/story.php?story_fbid=3377805042263487&id=147027375341286,,0.0,"The Niagara Falls City School District's newest Board of Education member Robert F. Bilson was sworn in last night by District Clerk Judie Glaser. He was elected for a one-year term, with a vote total of 2,862. Robert Bilson is the senior director of negotiation for production at Strategic Financial Solutions, NY. He is an accomplished television music composer for shows such as A&E’s The Wahlburgers. Bilson lives in LaSalle with his wife, Nicole, and their five children.",2020-06-18 10:44:41,,
93,0.0,,12.0,https://www.niagara-gazette.com/news/local_news/petrozzi-dunn-and-bilson-secure-school-board-seats/article_9f1ac616-ca05-520b-a90f-c05882fcafea.html,3377636172280374,,https://facebook.com/story.php?story_fbid=3377636172280374&id=147027375341286,"NIAGARA-GAZETTE.COM
Petrozzi, Dunn and Bilson secure school board seats",0.0,"NIAGARA-GAZETTE.COM
Petrozzi, Dunn and Bilson secure school board seats",2020-06-18 09:39:57,,
94,11.0,,54.0,,3376023499108308,"Niagara Falls residents passed the 2020 – 2021 Niagara Falls City School District (NFCSD) budget with a vote tally of 4,338 yes’s and 1,381 no’s.

Twenty-year board member Russell Petrozzi was re-elected for a five-year term on the NFCSD Board of Education, receiving 3,949 votes. Also elected for a five-year term on the board is incumbent board member Clara Dunn, receiving 3,717 votes and Robert F. Bilson was elected for a one-year term, with a vote total of 2,862.",https://facebook.com/story.php?story_fbid=3376023499108308&id=147027375341286,,0.0,"Niagara Falls residents passed the 2020 – 2021 Niagara Falls City School District (NFCSD) budget with a vote tally of 4,338 yes’s and 1,381 no’s.

Twenty-year board member Russell Petrozzi was re-elected for a five-year term on the NFCSD Board of Education, receiving 3,949 votes. Also elected for a five-year term on the board is incumbent board member Clara Dunn, receiving 3,717 votes and Robert F. Bilson was elected for a one-year term, with a vote total of 2,862.",2020-06-17 19:16:32,,
95,0.0,https://scontent-atl3-1.xx.fbcdn.net/v/t1.0-9/fr/cp0/e15/q65/104331342_3375525175824807_8012607500072288571_o.jpg?_nc_cat=102&_nc_sid=8024bb&_nc_ohc=o1d5v8DYuMMAX8SdUzK&_nc_ht=scontent-atl3-1.xx&tp=14&oh=69a59fe3835cc8e2634755ed36c28341&oe=5F844D1B,24.0,,3375529495824375,More fun Senior Class Day Parade pics!,https://facebook.com/story.php?story_fbid=3375529495824375&id=147027375341286,,0.0,More fun Senior Class Day Parade pics!,2020-06-17 15:08:24,,
96,2.0,https://scontent-atl3-1.xx.fbcdn.net/v/t1.0-9/fr/cp0/e15/q65/104757861_3375304575846867_2008814331776310507_o.jpg?_nc_cat=109&_nc_sid=8024bb&_nc_ohc=qMbe4quj7cQAX9qAN1b&_nc_ht=scontent-atl3-1.xx&tp=14&oh=7744ed84f2d99c1060acbda328144387&oe=5F84456D,59.0,,3375309472513044,"2020 Seniors on parade! Enjoy this album of pics from the Niagara Falls High School Senior Class Day Parade on Saturday, June 13! It was a fantastic event - good job, seniors!",https://facebook.com/story.php?story_fbid=3375309472513044&id=147027375341286,,0.0,"2020 Seniors on parade! Enjoy this album of pics from the Niagara Falls High School Senior Class Day Parade on Saturday, June 13! It was a fantastic event - good job, seniors!",2020-06-17 13:21:25,,
97,0.0,,5.0,https://youtu.be/g1wDH3cJ1Ac,3375158469194811,"This is the YouTube link to view the budget vote/election process and ballot counting taking place today (Wednesday, June 17, 2020):

https://youtu.be/g1wDH3cJ1Ac",https://facebook.com/story.php?story_fbid=3375158469194811&id=147027375341286,"YOUTUBE.COM
NFCSD BOE Election and Budget Vote Day 2",0.0,"This is the YouTube link to view the budget vote/election process and ballot counting taking place today (Wednesday, June 17, 2020):

https://youtu.be/g1wDH3cJ1Ac

YOUTUBE.COM
NFCSD BOE Election and Budget Vote Day 2",2020-06-17 12:07:24,,
98,1.0,,2.0,https://youtu.be/UVQ4HZp7QhY,3370081329702525,https://youtu.be/UVQ4HZp7QhY,https://facebook.com/story.php?story_fbid=3370081329702525&id=147027375341286,"YOUTUBE.COM
Superintendent Laurrie's COVID-19 message 6-15-20",0.0,"https://youtu.be/UVQ4HZp7QhY

YOUTUBE.COM
Superintendent Laurrie's COVID-19 message 6-15-20",2020-06-15 15:00:37,,
99,1.0,,49.0,http://www.wgrz.com/article/news/education/niagara-falls-high-school-senior-class-parade/71-aa0796e0-38ea-4815-bd74-302d135255f5,3369358159774842,,https://facebook.com/story.php?story_fbid=3369358159774842&id=147027375341286,"WGRZ.COM
Niagara Falls High School celebrates senior class",2.0,"WGRZ.COM
Niagara Falls High School celebrates senior class",2020-06-15 09:15:36,,
100,0.0,,0.0,https://youtu.be/1ZPkj9Q738w,3362089383835053,https://youtu.be/1ZPkj9Q738w,https://facebook.com/story.php?story_fbid=3362089383835053&id=147027375341286,"YOUTUBE.COM
Superintendent Laurrie's COVID-19 message for 6-12-20",0.0,"https://youtu.be/1ZPkj9Q738w

YOUTUBE.COM
Superintendent Laurrie's COVID-19 message for 6-12-20",2020-06-12 17:52:18,,
101,0.0,,15.0,https://www.niagara-gazette.com/news/local_news/parade-set-to-celebrate-nfhs-seniors/article_d6cdfe24-9e24-5f25-9025-3df7c6abb817.html,3360982107279114,,https://facebook.com/story.php?story_fbid=3360982107279114&id=147027375341286,"NIAGARA-GAZETTE.COM
Parade set to celebrate NFHS seniors",27.0,"NIAGARA-GAZETTE.COM
Parade set to celebrate NFHS seniors",2020-06-12 09:01:34,,
102,0.0,,8.0,https://www.wivb.com/news/local-news/niagara-county/niagara-falls/niagara-county-distributes-ppe-on-thursday/,3360939617283363,,https://facebook.com/story.php?story_fbid=3360939617283363&id=147027375341286,"WIVB.COM
Niagara County distributes PPE on Thursday",2.0,"WIVB.COM
Niagara County distributes PPE on Thursday",2020-06-12 08:43:32,,
103,0.0,,0.0,https://youtu.be/a90IHuGTnMQ,3359399274104064,https://youtu.be/a90IHuGTnMQ,https://facebook.com/story.php?story_fbid=3359399274104064&id=147027375341286,"YOUTUBE.COM
Superintendent Laurrie's COVID-19 message for 6-11-20",2.0,"https://youtu.be/a90IHuGTnMQ

YOUTUBE.COM
Superintendent Laurrie's COVID-19 message for 6-11-20",2020-06-11 18:30:36,,
104,46.0,,151.0,,3356531417724183,"Congratulations to Julia Pitarresi, Niagara Falls High School junior, for being awarded the New York State Theatre Award for Outstanding High School Theatre Student. She triumphed over every high school student in the state! Julia was also awarded the All Around Musicianship Award from the Niagara Falls High School Chorus. Way to go, Julia!",https://facebook.com/story.php?story_fbid=3356531417724183&id=147027375341286,,0.0,"Congratulations to Julia Pitarresi, Niagara Falls High School junior, for being awarded the New York State Theatre Award for Outstanding High School Theatre Student. She triumphed over every high school student in the state! Julia was also awarded the All Around Musicianship Award from the Niagara Falls High School Chorus. Way to go, Julia!",2020-06-10 17:44:24,,
105,0.0,,1.0,https://youtu.be/9pZpzvn9pqU,3356350477742277,https://youtu.be/9pZpzvn9pqU,https://facebook.com/story.php?story_fbid=3356350477742277&id=147027375341286,"YOUTUBE.COM
Superintendent Laurrie's COVID-19 message for 6-10-20",0.0,"https://youtu.be/9pZpzvn9pqU

YOUTUBE.COM
Superintendent Laurrie's COVID-19 message for 6-10-20",2020-06-10 16:11:17,,
106,1.0,https://scontent-atl3-1.xx.fbcdn.net/v/t1.0-9/fr/cp0/e15/q65/103390490_3355823871128271_654635646574049437_o.jpg?_nc_cat=109&_nc_sid=8024bb&_nc_ohc=kJZz1A99V0IAX9M7gwH&_nc_ht=scontent-atl3-1.xx&tp=14&oh=3c53f93901c36270c80627271979fa22&oe=5F842ABC,58.0,,3355845491126109,"Adopt a senior! Teachers and administrators from across the district were given the opportunity to ""adopt"" a Class of 2020 grad. On May 22, those with ""adopted"" seniors dropped off gifts and decorations at the seniors' homes. Pictured here is LaSalle Prep Principal James Spanbauer (retired) dropping off gifts to his adopted graduate, Okey.",https://facebook.com/story.php?story_fbid=3355845491126109&id=147027375341286,,0.0,"Adopt a senior! Teachers and administrators from across the district were given the opportunity to ""adopt"" a Class of 2020 grad. On May 22, those with ""adopted"" seniors dropped off gifts and decorations at the seniors' homes. Pictured here is LaSalle Prep Principal James Spanbauer (retired) dropping off gifts to his adopted graduate, Okey.",2020-06-10 11:55:02,,
107,0.0,https://scontent-atl3-1.xx.fbcdn.net/v/t1.0-9/fr/cp0/e15/q65/103959862_3355749164469075_8274071289665571003_o.jpg?_nc_cat=105&_nc_sid=8024bb&_nc_ohc=vQC7tO5O6BYAX8mf6MO&_nc_ht=scontent-atl3-1.xx&tp=14&oh=23b99c304891a6b109140cf862809e30&oe=5F849C04,92.0,,3355762297801095,2020 graduates picked up their caps and gowns from teachers and administrators on May 28. There was plenty of cheering and decorations from individuals who came to cheer the seniors on!,https://facebook.com/story.php?story_fbid=3355762297801095&id=147027375341286,,0.0,2020 graduates picked up their caps and gowns from teachers and administrators on May 28. There was plenty of cheering and decorations from individuals who came to cheer the seniors on!,2020-06-10 11:15:40,,
108,33.0,https://scontent-atl3-1.xx.fbcdn.net/v/t1.0-9/fr/cp0/e15/q65/103583973_3355679091142749_4675161737594408348_o.jpg?_nc_cat=100&_nc_sid=dd9801&_nc_ohc=dupm_ovJ8LIAX-t5sin&_nc_ht=scontent-atl3-1.xx&tp=14&oh=ae75f24cfd27e770d8d8120b1b9bf5ca&oe=5F850D9F,187.0,,3355680931142565,Niagara Falls High School Class of 2020,,,0.0,Niagara Falls High School Class of 2020,2020-06-10 10:42:48,,
109,0.0,,2.0,https://youtu.be/yoNe9Xqaf78,3353351458042179,https://youtu.be/yoNe9Xqaf78,https://facebook.com/story.php?story_fbid=3353351458042179&id=147027375341286,"YOUTUBE.COM
Superintendent Laurrie's COVID-19 message for 6-9-20",0.0,"https://youtu.be/yoNe9Xqaf78

YOUTUBE.COM
Superintendent Laurrie's COVID-19 message for 6-9-20",2020-06-09 14:45:48,,
110,1.0,,1.0,https://youtu.be/1N3Z9rm19tM,3350951748282150,https://youtu.be/1N3Z9rm19tM,https://facebook.com/story.php?story_fbid=3350951748282150&id=147027375341286,"YOUTUBE.COM
Superintendent Laurrie's COVID-19 message for 6-8-20",3.0,"https://youtu.be/1N3Z9rm19tM

YOUTUBE.COM
Superintendent Laurrie's COVID-19 message for 6-8-20",2020-06-08 18:16:01,,
111,0.0,,0.0,https://youtu.be/IiVjCpTd074,3349574601753198,https://youtu.be/IiVjCpTd074,https://facebook.com/story.php?story_fbid=3349574601753198&id=147027375341286,"YOUTUBE.COM
Superintendent Laurrie's Covid 19 Message for June 7, 2020",0.0,"https://youtu.be/IiVjCpTd074

YOUTUBE.COM
Superintendent Laurrie's Covid 19 Message for June 7, 2020",2020-06-08 07:30:29,,
112,0.0,,0.0,https://youtu.be/eaDvAob-jBc,3344572912253367,https://youtu.be/eaDvAob-jBc,https://facebook.com/story.php?story_fbid=3344572912253367&id=147027375341286,"YOUTUBE.COM
Superintendent Laurrie's COVID-19 Message for 6-6-20",4.0,"https://youtu.be/eaDvAob-jBc

YOUTUBE.COM
Superintendent Laurrie's COVID-19 Message for 6-6-20",2020-06-06 13:06:48,,
113,0.0,,1.0,https://youtu.be/TppgZVUSVpk,3342362245807767,https://youtu.be/TppgZVUSVpk,https://facebook.com/story.php?story_fbid=3342362245807767&id=147027375341286,"YOUTUBE.COM
Superintendent Laurrie's COVID-19 update 6-5-20",5.0,"https://youtu.be/TppgZVUSVpk

YOUTUBE.COM
Superintendent Laurrie's COVID-19 update 6-5-20",2020-06-05 17:52:19,,
114,0.0,,5.0,,3342123149165010,"IMPORTANT NEWS ABOUT THE BUDGET & BOARD VOTE: The District is aware that ballot delivery has not been timely in some areas of the city. In order to provide residents the opportunity to deliver their ballots in person, Central Office will be OPEN Saturday and Sunday 9 a.m. to 5 p.m. and Monday 9 a.m. to 9 p.m. for vote/election matters only.

Any resident who has not received his or her ballot after June 5 mail delivery can call 286-4204 or 425-2966 to be issued a replacement ballot specific to that individual. Your vote matters. Please be encouraged to deliver your ballot, which must be received by 5 p.m. June 9.

FAQ:
Can I bring my neighbors' ballots? YES. Be sure voters sign the back of the oath envelope.

I lost my ballot/the dog ate my ballot/ the kids ripped my ballot up: Call the numbers above to get a replacement ballot.

The humidity in my mailbox sealed my oath envelope before I put my ballot inside:Call the numbers above to get a replacement ballot.

I am angry that I got my ballot so late: Please accept our apologize and tell us how we can help.",https://facebook.com/story.php?story_fbid=3342123149165010&id=147027375341286,,0.0,"IMPORTANT NEWS ABOUT THE BUDGET & BOARD VOTE: The District is aware that ballot delivery has not been timely in some areas of the city. In order to provide residents the opportunity to deliver their ballots in person, Central Office will be OPEN Saturday and Sunday 9 a.m. to 5 p.m. and Monday 9 a.m. to 9 p.m. for vote/election matters only.

Any resident who has not received his or her ballot after June 5 mail delivery can call 286-4204 or 425-2966 to be issued a replacement ballot specific to that individual. Your vote matters. Please be encouraged to deliver your ballot, which must be received by 5 p.m. June 9.

FAQ:
Can I bring my neighbors' ballots? YES. Be sure voters sign the back of the oath envelope.

I lost my ballot/the dog ate my ballot/ the kids ripped my ballot up: Call the numbers above to get a replacement ballot.

The humidity in my mailbox sealed my oath envelope before I put my ballot inside:Call the numbers above to get a replacement ballot.

I am angry that I got my ballot so late: Please accept our apologize and tell us how we can help.",2020-06-05 15:50:05,,
115,14.0,https://scontent-atl3-1.xx.fbcdn.net/v/t1.0-9/fr/cp0/e15/q65/102728196_3342057842504874_356240959945572352_n.jpg?_nc_cat=102&_nc_sid=8024bb&_nc_ohc=Eku9KI06ALkAX_eLzwT&_nc_ht=scontent-atl3-1.xx&tp=14&oh=fbef4d67e4d0600d83d4ee00dedbdf06&oe=5F83237C,76.0,,3342068489170476,,https://facebook.com/story.php?story_fbid=3342068489170476&id=147027375341286,,0.0,,2020-06-05 15:22:37,,
116,0.0,,2.0,https://youtu.be/qiJ_SFCFyr0,3339365902774068,https://youtu.be/qiJ_SFCFyr0,https://facebook.com/story.php?story_fbid=3339365902774068&id=147027375341286,"YOUTUBE.COM
Superintendent Laurrie's COVID-19 Message 6-4-20",2.0,"https://youtu.be/qiJ_SFCFyr0

YOUTUBE.COM
Superintendent Laurrie's COVID-19 Message 6-4-20",2020-06-04 16:59:21,,
117,0.0,,1.0,https://youtu.be/HZZMa7Q_27M,3336448699732455,https://youtu.be/HZZMa7Q_27M,https://facebook.com/story.php?story_fbid=3336448699732455&id=147027375341286,"YOUTUBE.COM
Superintendent Laurrie's COVID-19 message for 6-3-20",3.0,"https://youtu.be/HZZMa7Q_27M

YOUTUBE.COM
Superintendent Laurrie's COVID-19 message for 6-3-20",2020-06-03 16:40:30,,
118,0.0,https://scontent-atl3-1.xx.fbcdn.net/v/t1.0-9/fr/cp0/e15/q65/102638582_3336263479750977_6066078428661022720_o.jpg?_nc_cat=105&_nc_sid=8024bb&_nc_ohc=UpfSJFiQtRMAX8p30pT&_nc_ht=scontent-atl3-1.xx&tp=14&oh=36973b6b18c80d9ff4f99f90b420e977&oe=5F831085,14.0,,3336263576417634,,https://facebook.com/story.php?story_fbid=3336263576417634&id=147027375341286,,0.0,,2020-06-03 15:04:58,,
119,1.0,,1.0,,3335710386472953,"We have made a change in the distribution of the remaining yearbooks!

They will not be distributed or sold from NFHS on June 10th and 11th.

The remaining yearbooks and yearbook accessories will be distributed and sold from the Field House on Thursday, June 11th and Friday, 12th from 11:00 a.m. to 1:00 p.m.

• Underclassmen who have paid for or have reserved for payment
• Seniors who did not pick up their paid or reserved yearbook on May 28
• Seniors who had damaged personalized books and will be receiving a free non-personalized book (4)
• Seniors who did not receive the extras they paid for because they were not delivered yet. (Clear Protective Cover (56), Autograph Sections (45), Multicolor Signing Markers (40))

Students can come to the Field House on either day using the Pine Avenue property entrance and they will remain in their vehicles.",https://facebook.com/story.php?story_fbid=3335710386472953&id=147027375341286,,0.0,"We have made a change in the distribution of the remaining yearbooks!

They will not be distributed or sold from NFHS on June 10th and 11th.

The remaining yearbooks and yearbook accessories will be distributed and sold from the Field House on Thursday, June 11th and Friday, 12th from 11:00 a.m. to 1:00 p.m.

• Underclassmen who have paid for or have reserved for payment
• Seniors who did not pick up their paid or reserved yearbook on May 28
• Seniors who had damaged personalized books and will be receiving a free non-personalized book (4)
• Seniors who did not receive the extras they paid for because they were not delivered yet. (Clear Protective Cover (56), Autograph Sections (45), Multicolor Signing Markers (40))

Students can come to the Field House on either day using the Pine Avenue property entrance and they will remain in their vehicles.",2020-06-03 10:55:07,,
120,6.0,,42.0,https://osc.viebit.com/player.php?hash=B2l2OkNZtpIz,3335481969829128,"Here it is...the one, the only, 2020 Senior Class Lip Dub!
Enjoy!

https://osc.viebit.com/player.php?hash=B2l2OkNZtpIz",https://facebook.com/story.php?story_fbid=3335481969829128&id=147027375341286,"OSC.VIEBIT.COM
NFHSLipDub2020.mp4",42.0,"Here it is...the one, the only, 2020 Senior Class Lip Dub!
Enjoy!

https://osc.viebit.com/player.php?hash=B2l2OkNZtpIz

OSC.VIEBIT.COM
NFHSLipDub2020.mp4",2020-06-03 09:06:28,,
121,0.0,,1.0,https://youtu.be/GJJWg3LE6uE,3333328756711116,https://youtu.be/GJJWg3LE6uE,https://facebook.com/story.php?story_fbid=3333328756711116&id=147027375341286,"YOUTUBE.COM
Superintendent Laurrie's COVID-19 message for 6-2-20",2.0,"https://youtu.be/GJJWg3LE6uE

YOUTUBE.COM
Superintendent Laurrie's COVID-19 message for 6-2-20",2020-06-02 16:01:07,,
122,15.0,,80.0,,3332820393428619,"We are pleased to announce that the Town of Niagara Business and Professional Association $500 scholarships have been awarded to these amazing students at Niagara Falls High School:

Lauren Granieri
Jenna Petri
Kayla Petri
Felicity Tiberi
Yazbeck Sarkees

Congratulations to these well-deserved seniors!!!!!",https://facebook.com/story.php?story_fbid=3332820393428619&id=147027375341286,,0.0,"We are pleased to announce that the Town of Niagara Business and Professional Association $500 scholarships have been awarded to these amazing students at Niagara Falls High School:

Lauren Granieri
Jenna Petri
Kayla Petri
Felicity Tiberi
Yazbeck Sarkees

Congratulations to these well-deserved seniors!!!!!",2020-06-02 11:53:53,,
123,0.0,,0.0,https://youtu.be/7sp8Gc2FTiE,3330758690301456,https://youtu.be/7sp8Gc2FTiE,https://facebook.com/story.php?story_fbid=3330758690301456&id=147027375341286,"YOUTUBE.COM
Superintendent Laurrie's COVID-19 update for 6-1-20",2.0,"https://youtu.be/7sp8Gc2FTiE

YOUTUBE.COM
Superintendent Laurrie's COVID-19 update for 6-1-20",2020-06-01 17:55:55,,
124,0.0,,2.0,https://youtu.be/c5zLmaD235E,3329707113739947,https://youtu.be/c5zLmaD235E,https://facebook.com/story.php?story_fbid=3329707113739947&id=147027375341286,"YOUTUBE.COM
Superintendent Laurrie's Covid 19 Message for Thursday, May 28, 2020",0.0,"https://youtu.be/c5zLmaD235E

YOUTUBE.COM
Superintendent Laurrie's Covid 19 Message for Thursday, May 28, 2020",2020-06-01 09:11:53,,
125,0.0,,0.0,https://youtu.be/GrLe-rl9-RQ,3329700213740637,https://youtu.be/GrLe-rl9-RQ,https://facebook.com/story.php?story_fbid=3329700213740637&id=147027375341286,"YOUTUBE.COM
Superintendent Laurrie's COVID-19 message for 5-29-20",0.0,"https://youtu.be/GrLe-rl9-RQ

YOUTUBE.COM
Superintendent Laurrie's COVID-19 message for 5-29-20",2020-06-01 09:08:33,,
126,0.0,,0.0,https://youtu.be/pLsyVfReBw8,3329692533741405,https://youtu.be/pLsyVfReBw8,https://facebook.com/story.php?story_fbid=3329692533741405&id=147027375341286,"YOUTUBE.COM
Superintendent Laurie's COVID-19 message for 5-30-20",0.0,"https://youtu.be/pLsyVfReBw8

YOUTUBE.COM
Superintendent Laurie's COVID-19 message for 5-30-20",2020-06-01 09:04:48,,
127,2.0,,28.0,https://youtu.be/7HcLKf163lc,3329678140409511,"https://youtu.be/7HcLKf163lc

This lip dub created by Kalfas staff is excellent - it's a must-see!",https://facebook.com/story.php?story_fbid=3329678140409511&id=147027375341286,"YOUTUBE.COM
Kalfas Elementary 2020 LipDub",4.0,"https://youtu.be/7HcLKf163lc

This lip dub created by Kalfas staff is excellent - it's a must-see!

YOUTUBE.COM
Kalfas Elementary 2020 LipDub",2020-06-01 08:57:28,,
128,0.0,,6.0,https://www.niagara-gazette.com/sports/hewitt-awards-to-be-presented-for-55th-time/article_b69f7424-3745-5cf3-81a8-c5e4fcd1737f.html,3324685550908770,,https://facebook.com/story.php?story_fbid=3324685550908770&id=147027375341286,"NIAGARA-GAZETTE.COM
Hewitt Awards to be presented for 55th time",0.0,"NIAGARA-GAZETTE.COM
Hewitt Awards to be presented for 55th time",2020-05-30 11:31:24,,
129,4.0,,44.0,,3324677567576235,,https://facebook.com/story.php?story_fbid=3324677567576235&id=147027375341286,,0.0,,2020-05-30 11:27:46,,
130,1.0,https://scontent-atl3-1.xx.fbcdn.net/v/t1.0-9/fr/cp0/e15/q65/101207716_3322725777771414_3524357035321720832_o.jpg?_nc_cat=104&_nc_sid=8024bb&_nc_ohc=Tar_HNJiHKMAX9gXjYJ&_nc_ht=scontent-atl3-1.xx&tp=14&oh=18cd807a04389e7f4d3aae860ab861d6&oe=5F847A9E,2.0,,3322725984438060,,https://facebook.com/story.php?story_fbid=3322725984438060&id=147027375341286,,0.0,,2020-05-29 17:28:02,,
131,0.0,,0.0,https://youtu.be/1xDFJbS6M1o,3314855295225129,https://youtu.be/1xDFJbS6M1o,https://facebook.com/story.php?story_fbid=3314855295225129&id=147027375341286,"YOUTUBE.COM
Superintendent Laurrie's COVID-19 Message for 5-26-20",4.0,"https://youtu.be/1xDFJbS6M1o

YOUTUBE.COM
Superintendent Laurrie's COVID-19 Message for 5-26-20",2020-05-26 17:53:23,,
132,0.0,,0.0,https://youtu.be/3xzhL7Ap01g,3306926946017964,https://youtu.be/3xzhL7Ap01g,https://facebook.com/story.php?story_fbid=3306926946017964&id=147027375341286,"YOUTUBE.COM
Superintendent Laurrie's COVID-19 message for 5-23-20",3.0,"https://youtu.be/3xzhL7Ap01g

YOUTUBE.COM
Superintendent Laurrie's COVID-19 message for 5-23-20",2020-05-23 15:51:57,,
133,0.0,,1.0,https://niagara-gazette.cnhi.newsmemory.com/?publink=2193999f9_134366f,3306811826029476,,https://facebook.com/story.php?story_fbid=3306811826029476&id=147027375341286,"NIAGARA-GAZETTE.CNHI.NEWSMEMORY.COM
niagara-gazette.cnhi.newsmemory.com",0.0,"NIAGARA-GAZETTE.CNHI.NEWSMEMORY.COM
niagara-gazette.cnhi.newsmemory.com",2020-05-23 14:52:36,,
134,0.0,,3.0,https://youtu.be/5geeCTBhzlg,3304510359592956,https://youtu.be/5geeCTBhzlg,https://facebook.com/story.php?story_fbid=3304510359592956&id=147027375341286,"YOUTUBE.COM
Superintendent Laurrie's COVID-19 message for 5-22-20",6.0,"https://youtu.be/5geeCTBhzlg

YOUTUBE.COM
Superintendent Laurrie's COVID-19 message for 5-22-20",2020-05-22 17:37:55,,
135,0.0,,2.0,https://youtu.be/gD8KHoIcXH8,3301795639864428,https://youtu.be/gD8KHoIcXH8,https://facebook.com/story.php?story_fbid=3301795639864428&id=147027375341286,"YOUTUBE.COM
Superintendent Laurrie's COVID-19 message for 5-21-20",3.0,"https://youtu.be/gD8KHoIcXH8

YOUTUBE.COM
Superintendent Laurrie's COVID-19 message for 5-21-20",2020-05-21 16:37:16,,
136,0.0,,35.0,https://www.niagara-gazette.com/opinion/guest-view-the-covid-19-consolation/article_334f4419-7d2f-5983-b32e-53175347a6a8.html,3301132053264120,"Congratulations to Sophia Duffie, a NFHS junior. Sophia wrote a first person perspective on her experience with what we've been going through. Her commentary is a must-read. The District is so proud of you, Sophia!",https://facebook.com/story.php?story_fbid=3301132053264120&id=147027375341286,"NIAGARA-GAZETTE.COM
GUEST VIEW: The COVID-19 consolation",18.0,"Congratulations to Sophia Duffie, a NFHS junior. Sophia wrote a first person perspective on her experience with what we've been going through. Her commentary is a must-read. The District is so proud of you, Sophia!

NIAGARA-GAZETTE.COM
GUEST VIEW: The COVID-19 consolation",2020-05-21 10:55:37,,
137,0.0,,3.0,https://youtu.be/61o8sCGSSTM,3299309090113083,https://youtu.be/61o8sCGSSTM,https://facebook.com/story.php?story_fbid=3299309090113083&id=147027375341286,"YOUTUBE.COM
Superintendent Laurrie's COVID-19 Message for 5-20-20",8.0,"https://youtu.be/61o8sCGSSTM

YOUTUBE.COM
Superintendent Laurrie's COVID-19 Message for 5-20-20",2020-05-20 17:50:59,,
138,0.0,,38.0,,3296437833733542,Thank you to the Niagara Falls City Council for proclaiming June 2020 as Graduates Month in the City of Niagara Falls. Seniors - you have made our district and our city proud!,https://facebook.com/story.php?story_fbid=3296437833733542&id=147027375341286,,0.0,Thank you to the Niagara Falls City Council for proclaiming June 2020 as Graduates Month in the City of Niagara Falls. Seniors - you have made our district and our city proud!,2020-05-19 15:36:07,,
139,2.0,,1.0,https://youtu.be/S2lD93Tb4dw,3296430330400959,https://youtu.be/S2lD93Tb4dw,https://facebook.com/story.php?story_fbid=3296430330400959&id=147027375341286,"YOUTUBE.COM
Superintendent Laurrie's COVID-19 message for 5-19-20",6.0,"https://youtu.be/S2lD93Tb4dw

YOUTUBE.COM
Superintendent Laurrie's COVID-19 message for 5-19-20",2020-05-19 15:32:51,,
140,0.0,,7.0,,3295948147115844,"The City of Niagara Falls Board of Education Regular Meeting of May 20, 2020 will be held at its usual location in the Board Room in the Administration Building, 630 66th Street, Niagara Falls. Due to social distancing guidelines, the meeting will be closed to the public. However, the meeting can be viewed and heard on YouTube and it will be recorded and later transcribed.",https://facebook.com/story.php?story_fbid=3295948147115844&id=147027375341286,,0.0,"The City of Niagara Falls Board of Education Regular Meeting of May 20, 2020 will be held at its usual location in the Board Room in the Administration Building, 630 66th Street, Niagara Falls. Due to social distancing guidelines, the meeting will be closed to the public. However, the meeting can be viewed and heard on YouTube and it will be recorded and later transcribed.",2020-05-19 11:35:43,,
141,0.0,,4.0,https://www.youtube.com/watch?v=2n6oryBknZw,3294111590632833,https://www.youtube.com/watch?v=2n6oryBknZw,https://facebook.com/story.php?story_fbid=3294111590632833&id=147027375341286,"YOUTUBE.COM
Superintendent Laurrie's COVID Message for 5-18-20",2.0,"https://www.youtube.com/watch?v=2n6oryBknZw

YOUTUBE.COM
Superintendent Laurrie's COVID Message for 5-18-20",2020-05-18 18:15:09,,
142,0.0,,13.0,https://www.niagara-gazette.com/opinion/laurrie-building-a-strong-foundation-for-the-children-of-niagara-county/article_49c61e03-daa7-5261-a5e9-2ab5328b574f.html,3293177097392949,,https://facebook.com/story.php?story_fbid=3293177097392949&id=147027375341286,"NIAGARA-GAZETTE.COM
LAURRIE: Building a strong foundation for the children of Niagara County",12.0,"NIAGARA-GAZETTE.COM
LAURRIE: Building a strong foundation for the children of Niagara County",2020-05-18 10:01:34,,
143,1.0,,15.0,https://www.youtube.com/embed/l_hQP7lukWM,3293073760736616,https://www.youtube.com/embed/l_hQP7lukWM,https://facebook.com/story.php?story_fbid=3293073760736616&id=147027375341286,"YOUTUBE.COM
Hold On Again - An Ode to Covid-19",12.0,"https://www.youtube.com/embed/l_hQP7lukWM

YOUTUBE.COM
Hold On Again - An Ode to Covid-19",2020-05-18 09:08:21,,
144,0.0,,4.0,https://youtu.be/V16YR1Pcfcg,3287159664661359,https://youtu.be/V16YR1Pcfcg,https://facebook.com/story.php?story_fbid=3287159664661359&id=147027375341286,"YOUTUBE.COM
Superintendent Laurrie's COVID-19 Message for 5-16-20",5.0,"https://youtu.be/V16YR1Pcfcg

YOUTUBE.COM
Superintendent Laurrie's COVID-19 Message for 5-16-20",2020-05-16 13:33:35,,
145,0.0,,0.0,https://youtu.be/eqsbt7F8Xtw,3284382131605779,https://youtu.be/eqsbt7F8Xtw,https://facebook.com/story.php?story_fbid=3284382131605779&id=147027375341286,"YOUTUBE.COM
Superintendent Laurrie's COVID-19 Message 5-15-20",3.0,"https://youtu.be/eqsbt7F8Xtw

YOUTUBE.COM
Superintendent Laurrie's COVID-19 Message 5-15-20",2020-05-15 17:26:41,,
146,0.0,,4.0,https://youtu.be/YNjAgVF5yjs,3281748428535816,https://youtu.be/YNjAgVF5yjs,https://facebook.com/story.php?story_fbid=3281748428535816&id=147027375341286,"YOUTUBE.COM
Superintendent Laurrie's COVID-19 message 5-14-20",0.0,"https://youtu.be/YNjAgVF5yjs

YOUTUBE.COM
Superintendent Laurrie's COVID-19 message 5-14-20",2020-05-14 17:43:28,,
147,0.0,,4.0,https://youtu.be/j4d4dNnKsAQ,3278764372167555,https://youtu.be/j4d4dNnKsAQ,https://facebook.com/story.php?story_fbid=3278764372167555&id=147027375341286,"YOUTUBE.COM
Superintendent Laurrie's COVID-19 message for 5-13-20",2.0,"https://youtu.be/j4d4dNnKsAQ

YOUTUBE.COM
Superintendent Laurrie's COVID-19 message for 5-13-20",2020-05-13 17:03:57,,
148,0.0,,20.0,https://www.graduatetogether2020.com/,3277957505581575,"https://www.graduatetogether2020.com/

Be sure to check out “Graduate Together: America Honors the High School Class of 2020,” a one-hour primetime show paying tribute to high school seniors. Tune in to see stories about NFHS Senior Mckenzie Gilmore and senior class advisors Amy Chiarella and Christine Barstys. The program will air on the national networks ABC, CBS, FOX, and NBC on Saturday, May 16, at 8 p.m.

Check out the website below for more information!",https://facebook.com/story.php?story_fbid=3277957505581575&id=147027375341286,"GRADUATETOGETHER2020.COM
Graduate Together 2020",20.0,"https://www.graduatetogether2020.com/

Be sure to check out “Graduate Together: America Honors the High School Class of 2020,” a one-hour primetime show paying tribute to high school seniors. Tune in to see stories about NFHS Senior Mckenzie Gilmore and senior class advisors Amy Chiarella and Christine Barstys. The program will air on the national networks ABC, CBS, FOX, and NBC on Saturday, May 16, at 8 p.m.

Check out the website below for more information!

GRADUATETOGETHER2020.COM
Graduate Together 2020",2020-05-13 11:10:35,,
149,0.0,,1.0,https://youtu.be/U7aq6Gp8PNo,3275961699114489,https://youtu.be/U7aq6Gp8PNo,https://facebook.com/story.php?story_fbid=3275961699114489&id=147027375341286,"YOUTUBE.COM
Superintendent Laurrie's COVID-19 message for 5--12-20",5.0,"https://youtu.be/U7aq6Gp8PNo

YOUTUBE.COM
Superintendent Laurrie's COVID-19 message for 5--12-20",2020-05-12 17:20:32,,
150,1.0,https://scontent-atl3-1.xx.fbcdn.net/v/t1.0-9/fr/cp0/e15/q65/97156011_3275328435844482_1199240252993044480_o.jpg?_nc_cat=103&_nc_sid=8024bb&_nc_ohc=t9b1OMU_4uwAX_qg678&_nc_ht=scontent-atl3-1.xx&tp=14&oh=9231f7d91af91290dc756d5eea97cd8b&oe=5F830957,2.0,,3275328639177795,,https://facebook.com/story.php?story_fbid=3275328639177795&id=147027375341286,,0.0,,2020-05-12 11:18:51,,
151,0.0,,0.0,,3275269462517046,,https://facebook.com/story.php?story_fbid=3275269462517046&id=147027375341286,,0.0,,2020-05-12 10:47:29,,
152,0.0,,2.0,https://youtu.be/3KyLjrsXWlw,3273559476021378,https://youtu.be/3KyLjrsXWlw,https://facebook.com/story.php?story_fbid=3273559476021378&id=147027375341286,"YOUTUBE.COM
Superintendent Laurrie's COVID-19 message for 5-9-10",2.0,"https://youtu.be/3KyLjrsXWlw

YOUTUBE.COM
Superintendent Laurrie's COVID-19 message for 5-9-10",2020-05-11 17:45:12,,
153,0.0,,1.0,https://youtu.be/ecdJ-liPEKE,3273552752688717,https://youtu.be/ecdJ-liPEKE,https://facebook.com/story.php?story_fbid=3273552752688717&id=147027375341286,"YOUTUBE.COM
Superintendent Laurrie COVID-19 Update 5-11-20",0.0,"https://youtu.be/ecdJ-liPEKE

YOUTUBE.COM
Superintendent Laurrie COVID-19 Update 5-11-20",2020-05-11 17:40:46,,
154,0.0,,0.0,https://youtu.be/4hPydco2QQE,3266115553432437,https://youtu.be/4hPydco2QQE,https://facebook.com/story.php?story_fbid=3266115553432437&id=147027375341286,"YOUTUBE.COM
Superintendent Laurrie's COVID-19 message for 5-8-20",5.0,"https://youtu.be/4hPydco2QQE

YOUTUBE.COM
Superintendent Laurrie's COVID-19 message for 5-8-20",2020-05-08 18:51:11,,
155,5.0,,34.0,https://www.wkbw.com/news/local-news/class-of-2020-celebrating-high-school-seniors,3265415903502402,"Lauren Granieri, well done!",https://facebook.com/story.php?story_fbid=3265415903502402&id=147027375341286,"WKBW.COM
Class of 2020: Celebrating high school seniors",7.0,"Lauren Granieri, well done!

WKBW.COM
Class of 2020: Celebrating high school seniors",2020-05-08 12:05:33,,
156,3.0,https://scontent-atl3-1.xx.fbcdn.net/v/t1.0-9/fr/cp0/e15/q65/96497962_3265374400173219_8155157238764273664_o.jpg?_nc_cat=101&_nc_sid=8024bb&_nc_ohc=ptqLQ6lZCl4AX-M__b_&_nc_ht=scontent-atl3-1.xx&tp=14&oh=9fb5558ff654bab2af4a69d6e8d0bfd9&oe=5F83FC31,57.0,,3265392353504757,"Niagara Falls High School seniors made a collage of photos for this year's Commitment Day picture. On Commitment Day, seniors wear gear pertaining to where they're going after graduation (college,military). Due to COVID-19 and social distancing, a photo shoot at the school did not take place so students got creative and put together this collage!",https://facebook.com/story.php?story_fbid=3265392353504757&id=147027375341286,,0.0,"Niagara Falls High School seniors made a collage of photos for this year's Commitment Day picture. On Commitment Day, seniors wear gear pertaining to where they're going after graduation (college,military). Due to COVID-19 and social distancing, a photo shoot at the school did not take place so students got creative and put together this collage!",2020-05-08 11:53:00,,
157,2.0,,0.0,https://youtu.be/SM17IVRDG6g,3265310033512989,"https://youtu.be/SM17IVRDG6g

The above is the link to the stream of the May 7, 2020 Board of Education meeting.",https://facebook.com/story.php?story_fbid=3265310033512989&id=147027375341286,"YOUTUBE.COM
NFCSD Board of Education Meeting for May 7, 2020",0.0,"https://youtu.be/SM17IVRDG6g

The above is the link to the stream of the May 7, 2020 Board of Education meeting.

YOUTUBE.COM
NFCSD Board of Education Meeting for May 7, 2020",2020-05-08 11:11:46,,
158,0.0,,0.0,https://youtu.be/_KhXeXA-QJM,3260765910634068,https://youtu.be/_KhXeXA-QJM,https://facebook.com/story.php?story_fbid=3260765910634068&id=147027375341286,"YOUTUBE.COM
IMG 0319",0.0,"https://youtu.be/_KhXeXA-QJM

YOUTUBE.COM
IMG 0319",2020-05-06 16:33:13,,
159,1.0,,2.0,,3260313814012611,"Please note: The Niagara Falls City School District Board of Education will meet at it's scheduled time on Thursday, May 7, 2020. Due to social distancing orders, the meeting will be closed to the public.The Board will convene at 7 p.m. for a special meeting to vote on one resolution to amend the previously passed procedures relative to the election in order to comply with the Governor's executive order. The meeting can be viewed and heard on YouTube and it will be recorded and later transcribed.",https://facebook.com/story.php?story_fbid=3260313814012611&id=147027375341286,,0.0,"Please note: The Niagara Falls City School District Board of Education will meet at it's scheduled time on Thursday, May 7, 2020. Due to social distancing orders, the meeting will be closed to the public.The Board will convene at 7 p.m. for a special meeting to vote on one resolution to amend the previously passed procedures relative to the election in order to comply with the Governor's executive order. The meeting can be viewed and heard on YouTube and it will be recorded and later transcribed.",2020-05-06 12:41:04,,
160,0.0,,1.0,https://youtu.be/waWWLC7cwk4,3258362907541035,https://youtu.be/waWWLC7cwk4,https://facebook.com/story.php?story_fbid=3258362907541035&id=147027375341286,"YOUTUBE.COM
Superintendent Laurrie's Covid-19 Message for May 5, 2020",5.0,"https://youtu.be/waWWLC7cwk4

YOUTUBE.COM
Superintendent Laurrie's Covid-19 Message for May 5, 2020",2020-05-05 17:39:31,,
161,0.0,,0.0,https://youtu.be/Kjm1audOS44,3255893287787997,https://youtu.be/Kjm1audOS44,https://facebook.com/story.php?story_fbid=3255893287787997&id=147027375341286,"YOUTUBE.COM
Superintendent Laurrie's COVID-19 Update 5-4-20",3.0,"https://youtu.be/Kjm1audOS44

YOUTUBE.COM
Superintendent Laurrie's COVID-19 Update 5-4-20",2020-05-04 18:21:39,,
162,0.0,,3.0,https://youtu.be/oLefBitp8eY,3253081604735832,https://youtu.be/oLefBitp8eY,https://facebook.com/story.php?story_fbid=3253081604735832&id=147027375341286,"YOUTUBE.COM
Superintendent Laurrie's COVID-19 Message for 5-3-20",5.0,"https://youtu.be/oLefBitp8eY

YOUTUBE.COM
Superintendent Laurrie's COVID-19 Message for 5-3-20",2020-05-03 14:15:24,,
163,0.0,,2.0,https://youtu.be/hC8I-b1PLrc,3250566001654059,https://youtu.be/hC8I-b1PLrc,https://facebook.com/story.php?story_fbid=3250566001654059&id=147027375341286,"YOUTUBE.COM
Superintendent Laurrie's COVID-19 Update 5-2-20",7.0,"https://youtu.be/hC8I-b1PLrc

YOUTUBE.COM
Superintendent Laurrie's COVID-19 Update 5-2-20",2020-05-02 15:05:31,,
164,0.0,,4.0,https://youtu.be/q7iPBqECkx8,3248440088533317,https://youtu.be/q7iPBqECkx8,https://facebook.com/story.php?story_fbid=3248440088533317&id=147027375341286,"YOUTUBE.COM
Superintendent Laurrie's 5-1-20 COVID-19 update",8.0,"https://youtu.be/q7iPBqECkx8

YOUTUBE.COM
Superintendent Laurrie's 5-1-20 COVID-19 update",2020-05-01 18:42:08,,
165,22.0,,40.0,,3247712768606049,"Governor Cuomo has ordered New York State school buildings closed for the remainder of the academic year. While students will not be returning to school buildings this school year, it is crucial that they continue to complete their online and packet assignments.",https://facebook.com/story.php?story_fbid=3247712768606049&id=147027375341286,,0.0,"Governor Cuomo has ordered New York State school buildings closed for the remainder of the academic year. While students will not be returning to school buildings this school year, it is crucial that they continue to complete their online and packet assignments.",2020-05-01 11:55:04,,
166,1.0,,0.0,https://youtu.be/YzC7tYxabYI,3247465968630729,"https://youtu.be/YzC7tYxabYI

This is Superintendent Laurrie's update for 4-30-20. Please ignore the typo indicating that this video is for 4-3-20. Thank you.",https://facebook.com/story.php?story_fbid=3247465968630729&id=147027375341286,"YOUTUBE.COM
Superintendent Laurrie's COVID-19 update for 4-3-20",0.0,"https://youtu.be/YzC7tYxabYI

This is Superintendent Laurrie's update for 4-30-20. Please ignore the typo indicating that this video is for 4-3-20. Thank you.

YOUTUBE.COM
Superintendent Laurrie's COVID-19 update for 4-3-20",2020-05-01 09:52:50,,
167,0.0,https://scontent-atl3-1.xx.fbcdn.net/v/t1.0-9/95263433_3244874592223200_3079659609007325184_n.png?_nc_cat=103&_nc_sid=8024bb&_nc_ohc=YhhiJ8p2h20AX9JG-F0&_nc_ht=scontent-atl3-1.xx&oh=a7b8a5c1f1a50fa4fc2e7fde4758b66c&oe=5F851D33,7.0,,3244874888889837,,https://facebook.com/story.php?story_fbid=3244874888889837&id=147027375341286,,0.0,,2020-04-30 09:06:24,,
168,0.0,,5.0,https://youtu.be/FdzdA4_TQ4o,3243364702374189,https://youtu.be/FdzdA4_TQ4o,https://facebook.com/story.php?story_fbid=3243364702374189&id=147027375341286,"YOUTUBE.COM
Superintendent Laurrie's COVID-19 Message 4-29-20",5.0,"https://youtu.be/FdzdA4_TQ4o

YOUTUBE.COM
Superintendent Laurrie's COVID-19 Message 4-29-20",2020-04-29 18:33:43,,
169,0.0,,2.0,https://youtu.be/SJyI65q_H9Q,3240846185959374,https://youtu.be/SJyI65q_H9Q,https://facebook.com/story.php?story_fbid=3240846185959374&id=147027375341286,"YOUTUBE.COM
Superintendent Laurrie's COVID-19 Message for 4-28-20",4.0,"https://youtu.be/SJyI65q_H9Q

YOUTUBE.COM
Superintendent Laurrie's COVID-19 Message for 4-28-20",2020-04-28 17:27:58,,
170,0.0,,5.0,https://youtu.be/3gv1nTBGcgQ,3238463982864261,https://youtu.be/3gv1nTBGcgQ,https://facebook.com/story.php?story_fbid=3238463982864261&id=147027375341286,"YOUTUBE.COM
Superintendent Laurrie's COVID-19 Message 4-27-20",7.0,"https://youtu.be/3gv1nTBGcgQ

YOUTUBE.COM
Superintendent Laurrie's COVID-19 Message 4-27-20",2020-04-27 18:29:05,,
171,0.0,,1.0,https://youtu.be/Fznq7UQ9CZI,3236016476442345,https://youtu.be/Fznq7UQ9CZI,https://facebook.com/story.php?story_fbid=3236016476442345&id=147027375341286,"YOUTUBE.COM
Superintendent Laurrie’s Covid-19 Message for April 26, 2020",5.0,"https://youtu.be/Fznq7UQ9CZI

YOUTUBE.COM
Superintendent Laurrie’s Covid-19 Message for April 26, 2020",2020-04-26 17:23:32,,
172,0.0,,1.0,https://youtu.be/BEQq0eUdNKk,3232983240079002,https://youtu.be/BEQq0eUdNKk,https://facebook.com/story.php?story_fbid=3232983240079002&id=147027375341286,"YOUTUBE.COM
Superintendent Laurrie's COVID-19 update for 4-25-20",5.0,"https://youtu.be/BEQq0eUdNKk

YOUTUBE.COM
Superintendent Laurrie's COVID-19 update for 4-25-20",2020-04-25 12:32:21,,
173,1.0,,9.0,https://youtu.be/kOusbGVZ-6c,3228302470547079,https://youtu.be/kOusbGVZ-6c,https://facebook.com/story.php?story_fbid=3228302470547079&id=147027375341286,"YOUTUBE.COM
Superintendent Laurrie's COVID-19 Message 4-23-20",5.0,"https://youtu.be/kOusbGVZ-6c

YOUTUBE.COM
Superintendent Laurrie's COVID-19 Message 4-23-20",2020-04-23 16:08:56,,
174,0.0,https://scontent-atl3-1.xx.fbcdn.net/v/t1.0-9/fr/cp0/e15/q65/94314253_3228199723890687_1359796537223282688_o.jpg?_nc_cat=102&_nc_sid=dd9801&_nc_ohc=ypeSUnuNXl0AX8vWOMN&_nc_oc=AQkJbhEQ_NG1yC5rV5YxSAHkiOC4xtHp_dnzdyfUyPuRE4HXNIZb2YT4pC4aoVbAbRA&_nc_ht=scontent-atl3-1.xx&tp=14&oh=d70113787545a82858ad7915e49a90cc&oe=5F837D5C,33.0,,3228199773890682,,,,0.0,,2020-04-23 15:11:48,,
175,0.0,,25.0,https://youtu.be/qLNk4i4vlV0,3225907907453202,https://youtu.be/qLNk4i4vlV0,https://facebook.com/story.php?story_fbid=3225907907453202&id=147027375341286,"YOUTUBE.COM
How to make a face covering with Dr. Jo Silvaroli",24.0,"https://youtu.be/qLNk4i4vlV0

YOUTUBE.COM
How to make a face covering with Dr. Jo Silvaroli",2020-04-22 18:15:48,,
176,0.0,,3.0,https://youtu.be/H9PbN3ONtQM,3225821234128536,https://youtu.be/H9PbN3ONtQM,https://facebook.com/story.php?story_fbid=3225821234128536&id=147027375341286,"YOUTUBE.COM
Superintendent Laurrie's COVID-19 message 4-22-20",5.0,"https://youtu.be/H9PbN3ONtQM

YOUTUBE.COM
Superintendent Laurrie's COVID-19 message 4-22-20",2020-04-22 17:20:34,,
177,0.0,,21.0,https://www.wivb.com/health/coronavirus/ralph-c-wilson-foundation-donates-sports-cards-to-niagara-falls-elementary-schools/,3225229830854343,,https://facebook.com/story.php?story_fbid=3225229830854343&id=147027375341286,"WIVB.COM
Ralph C. Wilson Foundation donates sports cards to Niagara Falls elementary schools",9.0,"WIVB.COM
Ralph C. Wilson Foundation donates sports cards to Niagara Falls elementary schools",2020-04-22 11:38:23,,
178,0.0,,2.0,https://youtu.be/M5p4pAj3l9Y,3223432521034074,https://youtu.be/M5p4pAj3l9Y,https://facebook.com/story.php?story_fbid=3223432521034074&id=147027375341286,"YOUTUBE.COM
Superintendent Laurrie's COVID-19 update for 4-21-20",4.0,"https://youtu.be/M5p4pAj3l9Y

YOUTUBE.COM
Superintendent Laurrie's COVID-19 update for 4-21-20",2020-04-21 17:31:04,,
179,0.0,,43.0,,3222582261119100,"Staff at LaSalle Prep School used photos to ""get together"" and formulate this word collage for LaSalle students...and everyone else! Enjoy!",https://facebook.com/story.php?story_fbid=3222582261119100&id=147027375341286,,0.0,"Staff at LaSalle Prep School used photos to ""get together"" and formulate this word collage for LaSalle students...and everyone else! Enjoy!",2020-04-21 09:59:07,,
180,0.0,,1.0,https://youtu.be/jRuCFcf66Yo,3221113927932600,https://youtu.be/jRuCFcf66Yo,https://facebook.com/story.php?story_fbid=3221113927932600&id=147027375341286,"YOUTUBE.COM
