,comments,image,likes,link,post_id,post_text,post_url,shared_text,shares,text,time,video,video_thumbnail
0,3.0,https://scontent-atl3-1.xx.fbcdn.net/v/t1.0-9/fr/cp0/e15/q65/119232197_3443862418967991_7925776431465521834_n.jpg?_nc_cat=102&_nc_sid=110474&_nc_ohc=a-Sh67bcvoQAX_ub4QW&_nc_ht=scontent-atl3-1.xx&tp=14&oh=dceadd7314577161d7989436bba325ed&oe=5F8253E0,72.0,,3443863052301261,Capping off a fantastic week with our dance! Just look at our fancy Pendragons! #itsagreatdaytobeapendragon,https://facebook.com/story.php?story_fbid=3443863052301261&id=242089932478605,,0.0,Capping off a fantastic week with our dance! Just look at our fancy Pendragons! #itsagreatdaytobeapendragon,2020-09-12 20:57:52,,
1,0.0,,2.0,,3442176532469913,"Due to poor field conditions from the rain, West Point has cancelled their softball tournament for today.",https://facebook.com/story.php?story_fbid=3442176532469913&id=242089932478605,,0.0,"Due to poor field conditions from the rain, West Point has cancelled their softball tournament for today.",2020-09-12 08:48:12,,
2,22.0,https://scontent-atl3-1.xx.fbcdn.net/v/t1.0-9/fr/cp0/e15/q65/119196049_3440965149257718_8129445637090560096_o.jpg?_nc_cat=105&_nc_sid=2d5d41&_nc_ohc=9vkVQioQzOgAX_ySmnV&_nc_ht=scontent-atl3-1.xx&tp=14&oh=e2ce602b85f24a47474daba8d131ef7c&oe=5F83B844,116.0,,3440965145924385,Congratulations to your 2020 Homecoming King Lucas Timm and Homecoming Queen Dawson Anderson!! #itsagreatdaytobeapendragon,,,0.0,Congratulations to your 2020 Homecoming King Lucas Timm and Homecoming Queen Dawson Anderson!! #itsagreatdaytobeapendragon,2020-09-11 22:52:46,,
3,0.0,,4.0,,3440461612641405,"Parents/guardians may come to the gym tomorrow night for some quick photos at the HC Dance. Masks will be required in the building. ""Picture time"" will run from 7:30-8:00 PM. We do ask that it is parents/guardians only to reduce the amount of people. Thank you!",https://facebook.com/story.php?story_fbid=3440461612641405&id=242089932478605,,0.0,"Parents/guardians may come to the gym tomorrow night for some quick photos at the HC Dance. Masks will be required in the building. ""Picture time"" will run from 7:30-8:00 PM. We do ask that it is parents/guardians only to reduce the amount of people. Thank you!",2020-09-11 18:58:06,,
4,2.0,https://scontent-atl3-1.xx.fbcdn.net/v/t1.0-9/fr/cp0/e15/q65/119042846_2579410565703315_2940132312874423917_n.jpg?_nc_cat=109&_nc_sid=110474&_nc_ohc=nDQTSrIhTiMAX89vsE8&_nc_ht=scontent-atl3-1.xx&tp=14&oh=57a8c925a39c68751e6dbf490d385fbf&oe=5F830FEC,39.0,,3440395412648025,,https://facebook.com/story.php?story_fbid=3440395412648025&id=242089932478605,"Pender PTO
September 11 at 5:16 PM ·

Today we finally were able to present new Pendragon t-shirts as a belated gift to our preschool graduates of 2020! You are rocking kindergarten! Congrats!",0.0,"Pender PTO
September 11 at 5:16 PM ·

Today we finally were able to present new Pendragon t-shirts as a belated gift to our preschool graduates of 2020! You are rocking kindergarten! Congrats!",2020-09-11 18:24:58,,
5,0.0,https://scontent-atl3-1.xx.fbcdn.net/v/t1.0-9/fr/cp0/e15/q65/119088808_3440131159341117_2508718162704867735_o.jpg?_nc_cat=109&_nc_sid=8024bb&_nc_ohc=qtsGXhhcJ3YAX-1b4VN&_nc_oc=AQmykJB8pAPcsnopQypRtQ5nccIf-17mw9bOCPQikhe_BNkP25YP9qPN_E33JB-lMFk&_nc_ht=scontent-atl3-1.xx&tp=14&oh=49e0274bfea66abe061a5752725af355&oe=5F822C9E,48.0,,3440134546007445,Here we go Dragons...here we GO! The 2nd graders wish everyone good luck tonight in our HoCo game vs. Winside!!,https://facebook.com/story.php?story_fbid=3440134546007445&id=242089932478605,,0.0,Here we go Dragons...here we GO! The 2nd graders wish everyone good luck tonight in our HoCo game vs. Winside!!,2020-09-11 16:14:36,,
6,0.0,,2.0,,3440114486009451,The West Point SB tournament on Saturday has been pushed back 2 hours. NEN now plays at 11:00 am instead of 9:00am.,https://facebook.com/story.php?story_fbid=3440114486009451&id=242089932478605,,0.0,The West Point SB tournament on Saturday has been pushed back 2 hours. NEN now plays at 11:00 am instead of 9:00am.,2020-09-11 16:05:30,,
7,0.0,https://scontent-atl3-1.xx.fbcdn.net/v/t1.0-9/fr/cp0/e15/q65/119061964_3440079676012932_46786902751561977_o.jpg?_nc_cat=102&_nc_sid=8024bb&_nc_ohc=0IUwFHCza6kAX8RwOIB&_nc_ht=scontent-atl3-1.xx&tp=14&oh=26a41a986a260d82c13f0d5a72ba97de&oe=5F82C586,39.0,,3440081956012704,Our 5th graders are ready for a Pendragon victory tonight!!,https://facebook.com/story.php?story_fbid=3440081956012704&id=242089932478605,,0.0,Our 5th graders are ready for a Pendragon victory tonight!!,2020-09-11 15:50:40,,
8,0.0,https://scontent-atl3-1.xx.fbcdn.net/v/t1.0-9/119204190_3440041126016787_6657427138852937740_o.png?_nc_cat=110&_nc_sid=2d5d41&_nc_ohc=SdBi35iMOY8AX-bSDna&_nc_ht=scontent-atl3-1.xx&oh=a4299f5f243d1f50b8cb310f3c13cd19&oe=5F82CF8E,1.0,https://5il.co/kxon,3440041122683454,The Elementary eNews for next week is available at the following link: https://5il.co/kxon. Have a wonderful weekend and GO BIG RED!,,,0.0,The Elementary eNews for next week is available at the following link: https://5il.co/kxon. Have a wonderful weekend and GO BIG RED!,2020-09-11 15:33:57,,
9,0.0,https://scontent-atl3-1.xx.fbcdn.net/v/t1.0-9/fr/cp0/e15/q65/119086467_3440018502685716_1676454199144379496_o.jpg?_nc_cat=104&_nc_sid=8024bb&_nc_ohc=dqxaXrCR5bQAX9H-xac&_nc_ht=scontent-atl3-1.xx&tp=14&oh=321d7b7fb38eccdf45b909f0f24a6454&oe=5F81E71D,31.0,,3440020099352223,Our 3rd Graders think it's a GREAT day to be a Pendragon!!,https://facebook.com/story.php?story_fbid=3440020099352223&id=242089932478605,,0.0,Our 3rd Graders think it's a GREAT day to be a Pendragon!!,2020-09-11 15:24:24,,
10,16.0,https://scontent-atl3-1.xx.fbcdn.net/v/t1.0-9/fr/cp0/e15/q65/119251299_3439948649359368_7920126859795472016_o.jpg?_nc_cat=108&_nc_sid=2d5d41&_nc_ohc=KCOKlBWMik4AX8WR6OS&_nc_ht=scontent-atl3-1.xx&tp=14&oh=b730e5af3e72b05ab230f985a8ba0b2d&oe=5F82AE1B,131.0,,3439948646026035,"Congratulations to our 200 Mile Club runners, Braden Prokop and Caleb Kelly for achieving 200+ miles over the course of the summer for Cross-Country!",,,0.0,"Congratulations to our 200 Mile Club runners, Braden Prokop and Caleb Kelly for achieving 200+ miles over the course of the summer for Cross-Country!",2020-09-11 14:53:00,,
11,0.0,https://scontent-atl3-1.xx.fbcdn.net/v/t1.0-9/fr/cp0/e15/q65/119447493_3439861332701433_6223730924881035896_o.jpg?_nc_cat=105&_nc_sid=8024bb&_nc_ohc=bQKCGuDJfYUAX9feDR0&_nc_ht=scontent-atl3-1.xx&tp=14&oh=70fc526fa2e53eb8e6942391e4364809&oe=5F843CC3,46.0,,3439881806032719,Our 1st graders wish our coaches and players good luck tonight against Winside! #gbr,https://facebook.com/story.php?story_fbid=3439881806032719&id=242089932478605,,0.0,Our 1st graders wish our coaches and players good luck tonight against Winside! #gbr,2020-09-11 14:23:20,,
12,0.0,https://scontent-atl3-1.xx.fbcdn.net/v/t1.0-9/fr/cp0/e15/q65/119194666_3439742296046670_201301891707746128_o.jpg?_nc_cat=101&_nc_sid=8024bb&_nc_ohc=cAeYzqvHxWAAX8800vj&_nc_ht=scontent-atl3-1.xx&tp=14&oh=1a04944c52d5f226f471987fe566f1a8&oe=5F823410,35.0,,3439743926046507,4th graders are ready for a PENDRAGON victory tonight! Let's Goooo!,https://facebook.com/story.php?story_fbid=3439743926046507&id=242089932478605,,0.0,4th graders are ready for a PENDRAGON victory tonight! Let's Goooo!,2020-09-11 13:27:42,,
13,3.0,https://scontent-atl3-1.xx.fbcdn.net/v/t1.0-9/fr/cp0/e15/q65/119228505_3439675822719984_641237572050962386_o.jpg?_nc_cat=105&_nc_sid=8024bb&_nc_ohc=oExPsVc9KSoAX-FLn-_&_nc_ht=scontent-atl3-1.xx&tp=14&oh=f9490627a198e7dca2971bddd36fccba&oe=5F83DBF9,63.0,,3439677309386502,Kindergarten says...GOOOOO BIIIIIGGG REDDDDDDD!!!,https://facebook.com/story.php?story_fbid=3439677309386502&id=242089932478605,,0.0,Kindergarten says...GOOOOO BIIIIIGGG REDDDDDDD!!!,2020-09-11 13:01:15,,
14,0.0,https://scontent-atl3-1.xx.fbcdn.net/v/t1.0-9/fr/cp0/e15/q65/119136301_3439527226068177_1620554497134325491_o.jpg?_nc_cat=109&_nc_sid=8024bb&_nc_ohc=WKYJcqhX9eQAX9MCcUK&_nc_oc=AQlu4OjS6J76-hKYrvM1M_onmXvu9tSLY4YjoOAGLzgo8Y_74mFsKm6wJ9gMrLfuh3E&_nc_ht=scontent-atl3-1.xx&tp=14&oh=f3fb1492cc0468959fe5ba01cca4ba14&oe=5F82E78E,59.0,,3439531492734417,Our 6th graders are enjoying this HoCo Friday! Let's go Pendragons!!,https://facebook.com/story.php?story_fbid=3439531492734417&id=242089932478605,,0.0,Our 6th graders are enjoying this HoCo Friday! Let's go Pendragons!!,2020-09-11 12:12:51,,
15,0.0,,9.0,,3439122946108605,"Reminder: Homecoming Dance, Saturday Sept. 12 Old Gym- Enter door 16; PENDER STUDENTS ONLY; Doors open at 7:15PM; Pictures from 7:30-8PM; Doors Lock at 8:10PM; Dance from 8PM-11PM; Students who leave early must check out with a sponsor and will NOT be allowed to reenter!",https://facebook.com/story.php?story_fbid=3439122946108605&id=242089932478605,,0.0,"Reminder: Homecoming Dance, Saturday Sept. 12 Old Gym- Enter door 16; PENDER STUDENTS ONLY; Doors open at 7:15PM; Pictures from 7:30-8PM; Doors Lock at 8:10PM; Dance from 8PM-11PM; Students who leave early must check out with a sponsor and will NOT be allowed to reenter!",2020-09-11 09:47:02,,
16,0.0,,0.0,,3439115176109382,"Reminder:
Homecoming Dance, Saturday Sept. 12
Old Gym- Enter door 16
PENDER STUDENTS ONLY!
Doors open at 7:15PM
Pictures from 7:30-8PM
Doors Lock at 8:10PM
Dance from 8PM-11PM
Students who leave early must check out with a sponsor and will NOT be allowed to reenter!",https://facebook.com/story.php?story_fbid=3439115176109382&id=242089932478605,,0.0,"Reminder:
Homecoming Dance, Saturday Sept. 12
Old Gym- Enter door 16
PENDER STUDENTS ONLY!
Doors open at 7:15PM
Pictures from 7:30-8PM
Doors Lock at 8:10PM
Dance from 8PM-11PM
Students who leave early must check out with a sponsor and will NOT be allowed to reenter!",2020-09-11 09:44:11,,
17,1.0,,7.0,,3438966612790905,Today's HC Pep Rally is for students only. We cannot allow extra guests into the school at this time. HC Coronation will take place after the game tonight! See you there!,https://facebook.com/story.php?story_fbid=3438966612790905&id=242089932478605,,0.0,Today's HC Pep Rally is for students only. We cannot allow extra guests into the school at this time. HC Coronation will take place after the game tonight! See you there!,2020-09-11 08:49:52,,
18,0.0,,4.0,,3437395852947981,Girls golf parents night will be this Friday night at halftime of the homecoming football game. Parents-please be down by the field around 7:20.,https://facebook.com/story.php?story_fbid=3437395852947981&id=242089932478605,,0.0,Girls golf parents night will be this Friday night at halftime of the homecoming football game. Parents-please be down by the field around 7:20.,2020-09-10 20:31:26,,
19,0.0,https://scontent-atl3-1.xx.fbcdn.net/v/t1.0-9/fr/cp0/e15/q65/119243200_3437225902964976_1331696283885412902_o.jpg?_nc_cat=106&_nc_sid=2d5d41&_nc_ohc=cp3H88li31YAX_jDac3&_nc_oc=AQl6ijQ47gn0SMydI_xYb1CI05-or9bkXX0Q2nwimObNpwRDtxxqli5PqMimIsRrGgI&_nc_ht=scontent-atl3-1.xx&tp=14&oh=25bb2f3a5f23d88ab4b3d71e58b400db&oe=5F81AE93,3.0,https://striv.tv/channel/pender/,3437225896298310,"If you’re watching VB vs Clarkson-Leigh, here is the Pender roster with updated numbers as well as the C-L roster.

https://striv.tv/channel/pender/",,,0.0,"If you’re watching VB vs Clarkson-Leigh, here is the Pender roster with updated numbers as well as the C-L roster.

https://striv.tv/channel/pender/",2020-09-10 19:04:00,,
20,13.0,,16.0,,3436935632994003,The elementary is so excited to be celebrating Homecoming 2020! The school school challenge videos will be posted in the comments...please give your favorite class a little love! 👍🏼 The class with the most likes will get a little extra recess time!! #GoBigRed #weknowthewords,https://facebook.com/story.php?story_fbid=3436935632994003&id=242089932478605,,0.0,The elementary is so excited to be celebrating Homecoming 2020! The school school challenge videos will be posted in the comments...please give your favorite class a little love! 👍🏼 The class with the most likes will get a little extra recess time!! #GoBigRed #weknowthewords,2020-09-10 16:37:34,,
21,1.0,,0.0,,3436932896327610,Change of Location: The One Act Parent/Guardian meeting will be held in the commons by the concession stand at 6PM.,https://facebook.com/story.php?story_fbid=3436932896327610&id=242089932478605,,0.0,Change of Location: The One Act Parent/Guardian meeting will be held in the commons by the concession stand at 6PM.,2020-09-10 16:36:08,,
22,0.0,,10.0,,3436932822994284,Reminder: Coronation for your 2020 Homecoming King and Queen will take place after tomorrow night's football game! #GoBigRed,https://facebook.com/story.php?story_fbid=3436932822994284&id=242089932478605,,0.0,Reminder: Coronation for your 2020 Homecoming King and Queen will take place after tomorrow night's football game! #GoBigRed,2020-09-10 16:36:06,,
23,0.0,https://scontent-atl3-1.xx.fbcdn.net/v/t1.0-9/119162126_3436932746327625_8929956114065907062_n.png?_nc_cat=105&_nc_sid=2d5d41&_nc_ohc=eeyghpgW1PAAX-NDwPa&_nc_ht=scontent-atl3-1.xx&oh=6d948c9f68906df1688c9b4f84dd7b30&oe=5F853CDC,3.0,,3436932739660959,Don't forget to get your Sparks & Flickers Dance Camp form and money turned into the office! Thanks!,,,0.0,Don't forget to get your Sparks & Flickers Dance Camp form and money turned into the office! Thanks!,2020-09-10 16:36:05,,
24,0.0,https://scontent-atl3-1.xx.fbcdn.net/v/t1.0-9/fr/cp0/e15/q65/119124433_3436655403022026_8968011582368384986_o.jpg?_nc_cat=105&_nc_sid=2d5d41&_nc_ohc=XTrvApRVG0sAX8fkgx1&_nc_ht=scontent-atl3-1.xx&tp=14&oh=eb7f40a20c1e207d99db465e598f8f6c&oe=5F8211A7,13.0,,3436655396355360,Advanced Bio is hunting for water bears today!,,,0.0,Advanced Bio is hunting for water bears today!,2020-09-10 14:29:59,,
25,4.0,,56.0,,3436465953040971,"Great news! From September 1 through December 31 (or until USDA funds are no longer available), PPS students will receive FREE breakfast and lunch! Main meals are free, but there will be charges for extras. Lunch accounts will be refunded for main meal costs back to September 1.",https://facebook.com/story.php?story_fbid=3436465953040971&id=242089932478605,,0.0,"Great news! From September 1 through December 31 (or until USDA funds are no longer available), PPS students will receive FREE breakfast and lunch! Main meals are free, but there will be charges for extras. Lunch accounts will be refunded for main meal costs back to September 1.",2020-09-10 13:11:16,,
26,0.0,,2.0,,3436379053049661,"The NEN softball game scheduled for today is Arlington has been postponed. We will now play Arlington on Tuesday, September 22nd at 5:00pm.",https://facebook.com/story.php?story_fbid=3436379053049661&id=242089932478605,,0.0,"The NEN softball game scheduled for today is Arlington has been postponed. We will now play Arlington on Tuesday, September 22nd at 5:00pm.",2020-09-10 12:37:41,,
27,1.0,,3.0,https://striv.tv/channel/pender/,3436129919741241,"The VB game tonight vs Clarkson-Leigh will be broadcast on 107.9 The Bull and streamed on Pender’s Striv channel.

https://striv.tv/channel/pender/",https://facebook.com/story.php?story_fbid=3436129919741241&id=242089932478605,,0.0,"The VB game tonight vs Clarkson-Leigh will be broadcast on 107.9 The Bull and streamed on Pender’s Striv channel.

https://striv.tv/channel/pender/",2020-09-10 10:56:40,,
28,0.0,,0.0,https://moveu.us/stores/pender,3433695226651377,FLAMES CLOTHING: Support your Flames dancers by purchasing some Flames gear! https://moveu.us/stores/pender,,,0.0,FLAMES CLOTHING: Support your Flames dancers by purchasing some Flames gear! https://moveu.us/stores/pender,2020-09-09 15:39:20,,
29,0.0,https://scontent-atl3-1.xx.fbcdn.net/v/t1.0-9/119006332_3433694989984734_258731239277443430_o.png?_nc_cat=108&_nc_sid=2d5d41&_nc_ohc=nalkDFeUBDsAX_DD_Lr&_nc_ht=scontent-atl3-1.xx&oh=f075e69b670c94e68cf888b884e95980&oe=5F83F0B0,0.0,https://moveu.us/stores/pender,3433694983318068,FLAMES CLOTHING: Support your Flames dancers by purchasing some Flames gear! https://moveu.us/stores/pender,,,0.0,FLAMES CLOTHING: Support your Flames dancers by purchasing some Flames gear! https://moveu.us/stores/pender,2020-09-09 15:39:14,,
30,0.0,https://scontent-atl3-1.xx.fbcdn.net/v/t1.0-9/fr/cp0/e15/q65/119150038_3433623019991931_263124039555004207_o.jpg?_nc_cat=100&_nc_sid=2d5d41&_nc_ohc=fatmsTsf_XUAX9V6_d8&_nc_ht=scontent-atl3-1.xx&tp=14&oh=f1a67c840b895c0793b98ff80dfc8d57&oe=5F845C69,1.0,,3433623016658598,"The NEN softball team plays in West Point on Saturday starting at 9:00 am. If you are traveling to the game, please read and follow their Covid restrictions.",,,0.0,"The NEN softball team plays in West Point on Saturday starting at 9:00 am. If you are traveling to the game, please read and follow their Covid restrictions.",2020-09-09 15:06:54,,
31,0.0,,3.0,,3431149520239281,For our fans at home watching on Striv: we are having major technical difficulties. We hope to be up soon.,https://facebook.com/story.php?story_fbid=3431149520239281&id=242089932478605,,0.0,For our fans at home watching on Striv: we are having major technical difficulties. We hope to be up soon.,2020-09-08 20:50:30,,
32,0.0,,5.0,http://twitch.tv/penderesports,3431094496911450,Pender Esports going live versus Amherst now! Check it out at twitch.tv/penderesports,,,0.0,Pender Esports going live versus Amherst now! Check it out at twitch.tv/penderesports,2020-09-08 20:28:01,,
33,0.0,,3.0,,3430890116931888,"Tomorrow, Wednesday, September 9th is our first 2:30 pm Wednesday dismissal of the year for K-12th grade.",https://facebook.com/story.php?story_fbid=3430890116931888&id=242089932478605,,0.0,"Tomorrow, Wednesday, September 9th is our first 2:30 pm Wednesday dismissal of the year for K-12th grade.",2020-09-08 19:00:13,,
34,0.0,https://scontent-atl3-1.xx.fbcdn.net/v/t1.0-9/fr/cp0/e15/q65/118968496_3430344470319786_5438623568766399720_o.jpg?_nc_cat=109&_nc_sid=2d5d41&_nc_ohc=AlIxqHuyaS0AX90pmfY&_nc_ht=scontent-atl3-1.xx&tp=14&oh=b6ad37b25867c43e6c846510261f18f6&oe=5F8416AD,7.0,,3430344460319787,"Picture Day is right around the corner. October 5th, Preschool - 6th grade will have their pictures taken and then on October 6th, preschool and 7th-12th grade will have theirs taken. Be prepared and get your haircuts now :)",,,0.0,"Picture Day is right around the corner. October 5th, Preschool - 6th grade will have their pictures taken and then on October 6th, preschool and 7th-12th grade will have theirs taken. Be prepared and get your haircuts now :)",2020-09-08 14:50:39,,
35,25.0,https://scontent-atl3-1.xx.fbcdn.net/v/t1.0-9/fr/cp0/e15/q65/119058930_3429837627037137_5790229102302887791_o.jpg?_nc_cat=111&_nc_sid=110474&_nc_ohc=GZoygfxPPSQAX_s8iVs&_nc_ht=scontent-atl3-1.xx&tp=14&oh=94e0e3f61e6b568e4438b3817bd3acde&oe=5F8545BD,130.0,,3429837697037130,"Congratulations to your Homecoming 2020 Candidates; you may not recognize them in their masks and tourist day gear but if you see the following, make sure to congratulate them!
Nathan Breitbarth, Dylan Vogt, Lucas Timm, Jaxon Maise, Marissa Kelly, Dawson Anderson, Zoey Lehmkuhl, and Ashley Ostrand!! #itsagreatdaytobeapendragon",https://facebook.com/story.php?story_fbid=3429837697037130&id=242089932478605,,0.0,"Congratulations to your Homecoming 2020 Candidates; you may not recognize them in their masks and tourist day gear but if you see the following, make sure to congratulate them!
Nathan Breitbarth, Dylan Vogt, Lucas Timm, Jaxon Maise, Marissa Kelly, Dawson Anderson, Zoey Lehmkuhl, and Ashley Ostrand!! #itsagreatdaytobeapendragon",2020-09-08 11:16:50,,
36,0.0,https://scontent-atl3-1.xx.fbcdn.net/v/t1.0-9/fr/cp0/e15/q65/119058941_3429827587038141_6981709437140937092_n.jpg?_nc_cat=103&_nc_sid=110474&_nc_ohc=yKuYfKQQ6lIAX_-n8gF&_nc_ht=scontent-atl3-1.xx&tp=14&oh=3801c7b789125166dfacea4d276793a7&oe=5F84C1F6,55.0,,3429829677037932,"Thank you to all who made our movie night a success! We continued our Homecoming celebration this morning with a 7-12 Pep Rally and Class Decorating contest! It may look a little different this year, but grateful our students have this week to celebrate! #GoBigRed #itsagreatdaytobeapendragon",https://facebook.com/story.php?story_fbid=3429829677037932&id=242089932478605,,0.0,"Thank you to all who made our movie night a success! We continued our Homecoming celebration this morning with a 7-12 Pep Rally and Class Decorating contest! It may look a little different this year, but grateful our students have this week to celebrate! #GoBigRed #itsagreatdaytobeapendragon",2020-09-08 11:13:35,,
37,0.0,,7.0,,3429605177060382,"There has been a schedule change for Cross Country. Thursday October 1st, the CC team will be headed to Stanton for a 4:00 pm start. The SSC Invite has been cancelled, so we picked up the Stanton Invite.",https://facebook.com/story.php?story_fbid=3429605177060382&id=242089932478605,,0.0,"There has been a schedule change for Cross Country. Thursday October 1st, the CC team will be headed to Stanton for a 4:00 pm start. The SSC Invite has been cancelled, so we picked up the Stanton Invite.",2020-09-08 09:47:11,,
38,0.0,,2.0,,3429522680401965,"Pender hosts Tri County Northeast and Howells-Dodge tonight in VB action. See schedule below.
5:30 Pender vs Howells Dodge
6:30 Tri County NE vs Howells Dodge
7:30 Pender vs Tri County NE",https://facebook.com/story.php?story_fbid=3429522680401965&id=242089932478605,,0.0,"Pender hosts Tri County Northeast and Howells-Dodge tonight in VB action. See schedule below.
5:30 Pender vs Howells Dodge
6:30 Tri County NE vs Howells Dodge
7:30 Pender vs Tri County NE",2020-09-08 09:14:26,,
39,0.0,,2.0,,3429492020405031,Allen has decided to postpone the JV football game scheduled for tonight. We will try and reschedule for a later date.,https://facebook.com/story.php?story_fbid=3429492020405031&id=242089932478605,,0.0,Allen has decided to postpone the JV football game scheduled for tonight. We will try and reschedule for a later date.,2020-09-08 09:02:23,,
40,1.0,https://scontent-atl3-1.xx.fbcdn.net/v/t1.0-9/fr/cp0/e15/q65/119003523_3427472507273649_1315730837765182056_n.jpg?_nc_cat=111&_nc_sid=110474&_nc_ohc=YPgU8f1y-rIAX8h8ge2&_nc_ht=scontent-atl3-1.xx&tp=14&oh=0147f4794e4e5c28007c958d696ae5a0&oe=5F820EF1,60.0,,3427472827273617,Homecoming 2020 is off to a festive start thanks to some of our Student Council members! #GoBigRed #ItsAGreatDayToBeAPendragon,https://facebook.com/story.php?story_fbid=3427472827273617&id=242089932478605,,0.0,Homecoming 2020 is off to a festive start thanks to some of our Student Council members! #GoBigRed #ItsAGreatDayToBeAPendragon,2020-09-07 16:39:13,,
41,0.0,,7.0,,3426902503997316,"The weight room will be open from 6:30-7:00am before school on Monday’s, Tuesday’s, and Thursday’s beginning Tuesday Sept 8th for all 7-12 grade students not in a weights class.",https://facebook.com/story.php?story_fbid=3426902503997316&id=242089932478605,,0.0,"The weight room will be open from 6:30-7:00am before school on Monday’s, Tuesday’s, and Thursday’s beginning Tuesday Sept 8th for all 7-12 grade students not in a weights class.",2020-09-07 13:03:12,,
42,0.0,,14.0,,3426855607335339,"Don't forget about our FREE Family Movie night tonight at the Community Center to kick off our Homecoming Week! Doors open at 6:40PM, movie starts at 7PM! Some concessions will be available but don't forget to wear you appropriate pajamas and mask and bring a blanket or a chair! See you all soon!",https://facebook.com/story.php?story_fbid=3426855607335339&id=242089932478605,,0.0,"Don't forget about our FREE Family Movie night tonight at the Community Center to kick off our Homecoming Week! Doors open at 6:40PM, movie starts at 7PM! Some concessions will be available but don't forget to wear you appropriate pajamas and mask and bring a blanket or a chair! See you all soon!",2020-09-07 12:46:18,,
43,0.0,,2.0,,3420232601330973,We are currently having technical difficulties with our Striv. We hope to be back streaming soon. Sorry!,https://facebook.com/story.php?story_fbid=3420232601330973&id=242089932478605,,0.0,We are currently having technical difficulties with our Striv. We hope to be back streaming soon. Sorry!,2020-09-05 10:49:32,,
44,0.0,,0.0,https://striv.tv/channel/pender/,3420011678019732,"Pender will stream BOTH gyms this morning. Check it out on our Striv Channel!

https://striv.tv/channel/pender/",https://facebook.com/story.php?story_fbid=3420011678019732&id=242089932478605,,0.0,"Pender will stream BOTH gyms this morning. Check it out on our Striv Channel!

https://striv.tv/channel/pender/",2020-09-05 09:25:06,,
45,0.0,https://scontent-atl3-1.xx.fbcdn.net/v/t1.0-9/fr/cp0/e15/q65/118859616_3419947914692775_6992788865520634846_o.jpg?_nc_cat=104&_nc_sid=2d5d41&_nc_ohc=5hsVmOsbJwUAX8XTMCw&_nc_ht=scontent-atl3-1.xx&tp=14&oh=793c95610bd36814fe78a4b49bc16bf8&oe=5F84E4BB,13.0,,3419947908026109,Attached you will find the Pender volleyball roster for online viewing!,,,0.0,Attached you will find the Pender volleyball roster for online viewing!,2020-09-05 09:00:14,,
46,0.0,,1.0,https://5il.co/ko4b,3418234594864107,The elementary eNews is available at the following link: https://5il.co/ko4b. Have a GREAT long weekend and gooooooo Pendragons!,,,0.0,The elementary eNews is available at the following link: https://5il.co/ko4b. Have a GREAT long weekend and gooooooo Pendragons!,2020-09-04 19:31:11,,
47,0.0,,1.0,,3417731168247783,"If you’re attending the football game tonight, please wear a mask if you cannot be socially distanced from others. Go Pendragons!",https://facebook.com/story.php?story_fbid=3417731168247783&id=242089932478605,,0.0,"If you’re attending the football game tonight, please wear a mask if you cannot be socially distanced from others. Go Pendragons!",2020-09-04 15:24:30,,
48,0.0,https://scontent-atl3-1.xx.fbcdn.net/v/t1.0-9/fr/cp0/e15/q65/118850538_3417670201587213_8746877692977725411_o.jpg?_nc_cat=104&_nc_sid=2d5d41&_nc_ohc=VuMDddqsErEAX_WPjHI&_nc_ht=scontent-atl3-1.xx&tp=14&oh=adbf4192caee5d1b0e8125d955e631f7&oe=5F84FFED,12.0,,3417670194920547,Here is a roster of Pender football players for tonight’s game if you’re watching from home!,,,0.0,Here is a roster of Pender football players for tonight’s game if you’re watching from home!,2020-09-04 14:55:47,,
49,3.0,https://scontent-atl3-1.xx.fbcdn.net/v/t1.0-9/fr/cp0/e15/q65/118794883_3417636264923940_973410701734375285_o.jpg?_nc_cat=103&_nc_sid=8024bb&_nc_ohc=dNfHAStmgwMAX90Vjah&_nc_ht=scontent-atl3-1.xx&tp=14&oh=c884758337ef6231e1573d0e7bd04d7f&oe=5F852854,47.0,,3417636471590586,Mrs. Kinning’s class using shaving cream to practice letters and sounds!,https://facebook.com/story.php?story_fbid=3417636471590586&id=242089932478605,,0.0,Mrs. Kinning’s class using shaving cream to practice letters and sounds!,2020-09-04 14:39:48,,
50,0.0,,3.0,,3417636401590593,Football Parent's: Reminder to please be at the football prior to 6:40 pm for Parent's Night Introductions. Thank You!,https://facebook.com/story.php?story_fbid=3417636401590593&id=242089932478605,,0.0,Football Parent's: Reminder to please be at the football prior to 6:40 pm for Parent's Night Introductions. Thank You!,2020-09-04 14:39:47,,
51,9.0,,23.0,https://striv.tv/channel/pender/,3417483981605835,"Tonight’s Football game vs Randolph will be streamed on Penders Striv channel. 2020 PHS alumni, Austin Roth, will be on the mic for the game. Kickoff is at 7:00 pm!

https://striv.tv/channel/pender/",https://facebook.com/story.php?story_fbid=3417483981605835&id=242089932478605,,0.0,"Tonight’s Football game vs Randolph will be streamed on Penders Striv channel. 2020 PHS alumni, Austin Roth, will be on the mic for the game. Kickoff is at 7:00 pm!

https://striv.tv/channel/pender/",2020-09-04 13:32:28,,
52,0.0,https://scontent-atl3-1.xx.fbcdn.net/v/t1.0-9/fr/cp0/e15/q65/118795557_3417252361628997_6344213057268294151_o.jpg?_nc_cat=104&_nc_sid=2d5d41&_nc_ohc=W64DnrNEh54AX_lPYB-&_nc_ht=scontent-atl3-1.xx&tp=14&oh=4163707e6a4854fd5f9076782204d4d0&oe=5F856784,4.0,https://striv.tv/channel/pender/,3417252358295664,"Here is the schedule for the Bronze division in Pender for Saturday. Masks are required while in the building for fans. Games will be on Pender’s Striv channel

https://striv.tv/channel/pender/",,,0.0,"Here is the schedule for the Bronze division in Pender for Saturday. Masks are required while in the building for fans. Games will be on Pender’s Striv channel

https://striv.tv/channel/pender/",2020-09-04 11:59:54,,
53,0.0,,2.0,,3416857808335119,"Anyone still need to buy a Husker Book? Find a Flames dancer at the game! They are $15, and since the Huskers aren’t playing 😭, we will draw a $25 winner for each game that should have happened! Thank your for supporting your Flames dancers 🥳",,,0.0,"Anyone still need to buy a Husker Book? Find a Flames dancer at the game! They are $15, and since the Huskers aren’t playing 😭, we will draw a $25 winner for each game that should have happened! Thank your for supporting your Flames dancers 🥳",2020-09-04 09:34:59,,
54,1.0,,4.0,https://striv.tv/channel/pender/,3414983095189257,"The VB games tonight in Pender can been streamed on Pender’s Striv channel.

https://striv.tv/channel/pender/",https://facebook.com/story.php?story_fbid=3414983095189257&id=242089932478605,,0.0,"The VB games tonight in Pender can been streamed on Pender’s Striv channel.

https://striv.tv/channel/pender/",2020-09-03 18:20:18,,
55,0.0,https://scontent-atl3-1.xx.fbcdn.net/v/t1.0-9/118784865_3414581058562794_5750480609689723197_o.png?_nc_cat=111&_nc_sid=2d5d41&_nc_ohc=qqgkCcxAX0cAX_APV53&_nc_ht=scontent-atl3-1.xx&oh=4c3a6a214304f231561f2fdfabfad7a9&oe=5F845E4B,1.0,https://moveu.us/stores/pender,3414581055229461,"FLAMES CLOTHING:
Support your Flames dancers by purchasing some Flames gear!
https://moveu.us/stores/pender",,,0.0,"FLAMES CLOTHING:
Support your Flames dancers by purchasing some Flames gear!
https://moveu.us/stores/pender",2020-09-03 14:58:07,,
56,0.0,,1.0,,3414580815229485,Don't forget to get your Husker Books from one of the Flames dancers! We will be randomly drawing a $25 winner each week! Only $15! Come watch the Flames dance at the first football game Friday! We can't wait to see you!,https://facebook.com/story.php?story_fbid=3414580815229485&id=242089932478605,,0.0,Don't forget to get your Husker Books from one of the Flames dancers! We will be randomly drawing a $25 winner each week! Only $15! Come watch the Flames dance at the first football game Friday! We can't wait to see you!,2020-09-03 14:58:00,,
57,0.0,,7.0,,3414580755229491,"The venue for the Family Movie Night on Monday is changed to the Community Center starting at 7PM. Some concessions will still be available but bring a blanket or chair so we can all comfortably, socially distance! See you there!",https://facebook.com/story.php?story_fbid=3414580755229491&id=242089932478605,,0.0,"The venue for the Family Movie Night on Monday is changed to the Community Center starting at 7PM. Some concessions will still be available but bring a blanket or chair so we can all comfortably, socially distance! See you there!",2020-09-03 14:57:58,,
58,2.0,https://scontent-atl3-1.xx.fbcdn.net/v/t1.0-9/fr/cp0/e15/q65/118825231_3413830305304536_313823641244997753_n.jpg?_nc_cat=102&_nc_sid=110474&_nc_ohc=Dqo45I7xjkMAX93YT3D&_nc_oc=AQl-13abNkmLnd73h1lGB_RGiuMA91oXHx2xoGelml-lA9x6plmEtLaL7vUhReeHVXc&_nc_ht=scontent-atl3-1.xx&tp=14&oh=2e137081fff3ac1f6646b7b5af10b5ba&oe=5F82775E,92.0,,3413830395304527,Do you have a bug under your rug? How about a bee in your tree? We are working on rhyming words in kindergarten. Such smart little dragons. 🎈,https://facebook.com/story.php?story_fbid=3413830395304527&id=242089932478605,,0.0,Do you have a bug under your rug? How about a bee in your tree? We are working on rhyming words in kindergarten. Such smart little dragons. 🎈,2020-09-03 09:53:14,,
59,2.0,https://scontent-atl3-1.xx.fbcdn.net/v/t1.0-9/fr/cp0/e15/q65/118771211_3413701818650718_5545571562070597215_o.jpg?_nc_cat=108&_nc_sid=2d5d41&_nc_ohc=KpEdqjfPEVIAX9AKxZ7&_nc_ht=scontent-atl3-1.xx&tp=14&oh=dbbde594b015fd898fea46d0d801f8e4&oe=5F84DA18,10.0,,3413701815317385,Pender hosts 3 softball games and 3 volleyball games today! See attached schedule!,,,0.0,Pender hosts 3 softball games and 3 volleyball games today! See attached schedule!,2020-09-03 09:00:06,,
60,0.0,https://scontent-atl3-1.xx.fbcdn.net/v/t1.0-9/fr/cp0/e15/q65/118779417_3411623422191891_501995905620241179_o.jpg?_nc_cat=106&_nc_sid=2d5d41&_nc_ohc=qBRC-a6gGjsAX_utU_7&_nc_ht=scontent-atl3-1.xx&tp=14&oh=513cf89d8d9725ea19e9d60909678b18&oe=5F852419,8.0,,3411623408858559,Happy Homecoming Week High Schoolers! #ItsAGreatDayToBeAPendragon,,,0.0,Happy Homecoming Week High Schoolers! #ItsAGreatDayToBeAPendragon,2020-09-02 16:51:54,,
61,0.0,https://scontent-atl3-1.xx.fbcdn.net/v/t1.0-9/118766396_3411500752204158_8363111791569196863_o.png?_nc_cat=108&_nc_sid=2d5d41&_nc_ohc=RAub3SmtIIUAX-B44BJ&_nc_ht=scontent-atl3-1.xx&oh=58c5a9d273e235dbc538fcc1f105cbdf&oe=5F84F36D,10.0,,3411500742204159,Elementary Homecoming 2020 Activities!! Let's Go Pendragons!!,,,0.0,Elementary Homecoming 2020 Activities!! Let's Go Pendragons!!,2020-09-02 15:53:53,,
62,0.0,,5.0,,3408765312477702,"Tomorrow, Wednesday, September 2nd is not a 2:30 dismissal. The first 2:30 dismissal will start on Wednesday, September 9th. As a reminder, there is also no school on Monday, September 7th.",https://facebook.com/story.php?story_fbid=3408765312477702&id=242089932478605,,0.0,"Tomorrow, Wednesday, September 2nd is not a 2:30 dismissal. The first 2:30 dismissal will start on Wednesday, September 9th. As a reminder, there is also no school on Monday, September 7th.",2020-09-01 20:00:06,,
63,0.0,,17.0,,3407209685966598,"Good Luck to our volleyball team as they travel to Logan View to kick off the season! Remember, you must have a ticket to attend the game.",https://facebook.com/story.php?story_fbid=3407209685966598&id=242089932478605,,0.0,"Good Luck to our volleyball team as they travel to Logan View to kick off the season! Remember, you must have a ticket to attend the game.",2020-09-01 09:05:27,,
64,0.0,,4.0,,3404646536222913,Parents of softball players: please be at the field in Wisner by 5:45 Tuesday night for parents night! Go Vipers!,https://facebook.com/story.php?story_fbid=3404646536222913&id=242089932478605,,0.0,Parents of softball players: please be at the field in Wisner by 5:45 Tuesday night for parents night! Go Vipers!,2020-08-31 12:57:18,,
65,0.0,https://scontent-atl3-1.xx.fbcdn.net/v/t1.0-9/fr/cp0/e15/q65/118630816_3404042626283304_1519212593511181894_o.jpg?_nc_cat=109&_nc_sid=2d5d41&_nc_ohc=XjfI50yUCRoAX9dViEI&_nc_ht=scontent-atl3-1.xx&tp=14&oh=6493270e584610124dc38102124ade54&oe=5F838B48,2.0,,3404042622949971,"If you plan on attending the volleyball game in Logan View on Tuesday, Sept 1st, please look at their current covid restrictions.",,,0.0,"If you plan on attending the volleyball game in Logan View on Tuesday, Sept 1st, please look at their current covid restrictions.",2020-08-31 09:03:43,,
66,18.0,https://scontent-atl3-1.xx.fbcdn.net/v/t1.0-9/fr/cp0/e15/q65/118252788_3399666356720931_2359653244829428224_o.jpg?_nc_cat=104&_nc_sid=2d5d41&_nc_ohc=EBhHaFio5mgAX9XQ_sr&_nc_ht=scontent-atl3-1.xx&tp=14&oh=67c9d83726af2e1177a68ce6d386c3d0&oe=5F848276,118.0,,3399666353387598,"Congrats to your NEN Vipers! Winning the NEN Invite today. 6-0 over Polk County, 12-3 over Boone Central & 16-4 over Blue River! Parents night is Tuesday @ Wisner!",,,0.0,"Congrats to your NEN Vipers! Winning the NEN Invite today. 6-0 over Polk County, 12-3 over Boone Central & 16-4 over Blue River! Parents night is Tuesday @ Wisner!",2020-08-29 23:49:16,,
67,0.0,https://scontent-atl3-1.xx.fbcdn.net/v/t1.0-9/fr/cp0/e15/q65/118603816_3397752666912300_2996982281832634750_o.jpg?_nc_cat=105&_nc_sid=2d5d41&_nc_ohc=Qk7lZn5dL6EAX-B2Obn&_nc_ht=scontent-atl3-1.xx&tp=14&oh=6f88790342e8435a2e12c0c97540c58a&oe=5F840164,5.0,,3397752663578967,Girls golf district has been announced. They travel to Battle Creek for the district tournament.,,,0.0,Girls golf district has been announced. They travel to Battle Creek for the district tournament.,2020-08-29 09:41:16,,
68,0.0,https://scontent-atl3-1.xx.fbcdn.net/v/t1.0-9/fr/cp0/e15/q65/118622492_3397750370245863_1355927709875139416_o.jpg?_nc_cat=107&_nc_sid=2d5d41&_nc_ohc=gMHwT38b0cQAX9pYOh9&_nc_ht=scontent-atl3-1.xx&tp=14&oh=24ea37502c608a6d69e9b4a75873024f&oe=5F830AC3,2.0,,3397750363579197,The volleyball districts were released by the NSAA yesterday.,,,0.0,The volleyball districts were released by the NSAA yesterday.,2020-08-29 09:40:14,,
69,0.0,https://scontent-atl3-1.xx.fbcdn.net/v/t1.0-9/fr/cp0/e15/q65/118651926_3397745630246337_4612400434290308048_o.jpg?_nc_cat=110&_nc_sid=2d5d41&_nc_ohc=iAoJhBkjh6wAX_y-RnV&_nc_ht=scontent-atl3-1.xx&tp=14&oh=ee7100325c0472df1a855e2422b31012&oe=5F83C878,3.0,,3397745626913004,The softball district assignments were released the the NSAA yesterday.,,,0.0,The softball district assignments were released the the NSAA yesterday.,2020-08-29 09:38:26,,
70,0.0,https://scontent-atl3-1.xx.fbcdn.net/v/t1.0-9/118610490_3395376803816553_1473714066653964614_o.png?_nc_cat=109&_nc_sid=2d5d41&_nc_ohc=GOAZnjSXxSwAX8XAegt&_nc_ht=scontent-atl3-1.xx&oh=38b88b5cd612c0e115f038531cb408e8&oe=5F84FC4F,5.0,https://5il.co/kdu9,3395376790483221,Our first Elementary eNews of the 20-21 school year is available at the following link: https://5il.co/kdu9. Enjoy our Meet the Teacher edition! Have a GREAT weekend and GOOOOOO Pendragons!!,,,0.0,Our first Elementary eNews of the 20-21 school year is available at the following link: https://5il.co/kdu9. Enjoy our Meet the Teacher edition! Have a GREAT weekend and GOOOOOO Pendragons!!,2020-08-28 16:01:45,,
71,0.0,https://scontent-atl3-1.xx.fbcdn.net/v/t1.0-9/fr/cp0/e15/q65/118655538_3395349103819323_779229849173135110_o.jpg?_nc_cat=107&_nc_sid=8024bb&_nc_ohc=vnzTJxdhw_kAX-RuQ_B&_nc_ht=scontent-atl3-1.xx&tp=14&oh=03dc48a72d1e29d2fbf06b8e8d72a858&oe=5F81C32E,38.0,,3395349243819309,The Flames Color Run was a Success! 🎉Thank you to all who came out to support our dancers! We hope to see you at our 2021 Color Run!,https://facebook.com/story.php?story_fbid=3395349243819309&id=242089932478605,,0.0,The Flames Color Run was a Success! 🎉Thank you to all who came out to support our dancers! We hope to see you at our 2021 Color Run!,2020-08-28 15:48:38,,
72,0.0,https://scontent-atl3-1.xx.fbcdn.net/v/t1.0-9/fr/cp0/e15/q65/118653972_3395348660486034_6653753280517549999_o.jpg?_nc_cat=101&_nc_sid=2d5d41&_nc_ohc=qL9kesjQVv4AX-TH0eo&_nc_ht=scontent-atl3-1.xx&tp=14&oh=db50ac3253ac62e6b51c0fb802963557&oe=5F847259,55.0,https://www.youtube.com/watch?v=4sqN2J9_axY,3395348657152701,"The kindergarteners celebrated “The Colors of Us” by making self portraits with our new multicultural crayons!

They also enjoyed this great short video: https://www.youtube.com/watch?v=4sqN2J9_axY",,,0.0,"The kindergarteners celebrated “The Colors of Us” by making self portraits with our new multicultural crayons!

They also enjoyed this great short video: https://www.youtube.com/watch?v=4sqN2J9_axY",2020-08-28 15:48:23,,
73,0.0,,0.0,http://www.creightonradio.com/,3395348320486068,"If you can't make it to Creighton tonight the game will be broadcast on Creighton Community Radio. 7 pm kick-off
http://www.creightonradio.com/",https://facebook.com/story.php?story_fbid=3395348320486068&id=242089932478605,,0.0,"If you can't make it to Creighton tonight the game will be broadcast on Creighton Community Radio. 7 pm kick-off
http://www.creightonradio.com/",2020-08-28 15:48:13,,
74,0.0,,5.0,https://educationquest-org.zoom.us/j/91612730142?pwd=L2dML3J1M0drK0RNSVlCaXh0V0xxdz09,3395179723836261,"Dear 12th grade Students and Parents,
You’re invited to EducationQuest Foundation’s Virtual Financial Aid Program. By attending, you’ll learn how to pay for college and will be eligible to register for a $500 scholarship!

Date and Time: 8/31 at 6:00 PM
Topic: EducationQuest’s Financial Aid Program
Time: Aug. 31, 2020 06:00 PM Central Time (US and Canada)
Join Zoom Meeting
https://educationquest-org.zoom.us/j/91612730142?pwd=L2dML3J1M0drK0RNSVlCaXh0V0xxdz09
Meeting ID: 916 1273 0142
Passcode: 779234

As you participate in the presentation, you may want to reference these resources:
Presentation Slides
Create a Federal Student Aid Account Handout
FAFSA Checklist
Scholarship Tip Sheet
Tuition Assistance Handout
Junior/Senior Timeline
If you need help with college planning or the FAFSA, call EducationQuest to set up a free virtual appointment.

Other Resources:
To stay on track to college, sign up for the Countdown2College email service and attend the EducationQuest Virtual College Fair September 27-30.

Contact Mr. Nixon if you have any questions!",https://facebook.com/story.php?story_fbid=3395179723836261&id=242089932478605,"EDUCATIONQUEST-ORG.ZOOM.US
Join our Cloud HD Video Meeting",2.0,"Dear 12th grade Students and Parents,
You’re invited to EducationQuest Foundation’s Virtual Financial Aid Program. By attending, you’ll learn how to pay for college and will be eligible to register for a $500 scholarship!

Date and Time: 8/31 at 6:00 PM
Topic: EducationQuest’s Financial Aid Program
Time: Aug. 31, 2020 06:00 PM Central Time (US and Canada)
Join Zoom Meeting
https://educationquest-org.zoom.us/j/91612730142?pwd=L2dML3J1M0drK0RNSVlCaXh0V0xxdz09
Meeting ID: 916 1273 0142
Passcode: 779234

As you participate in the presentation, you may want to reference these resources:
Presentation Slides
Create a Federal Student Aid Account Handout
FAFSA Checklist
Scholarship Tip Sheet
Tuition Assistance Handout
Junior/Senior Timeline
If you need help with college planning or the FAFSA, call EducationQuest to set up a free virtual appointment.

Other Resources:
To stay on track to college, sign up for the Countdown2College email service and attend the EducationQuest Virtual College Fair September 27-30.

Contact Mr. Nixon if you have any questions!

EDUCATIONQUEST-ORG.ZOOM.US
Join our Cloud HD Video Meeting",2020-08-28 14:33:17,,
75,0.0,,9.0,,3394923687195198,Creighton will live stream the football game tonight on their school Facebook page starting at 7:00 pm.,https://facebook.com/story.php?story_fbid=3394923687195198&id=242089932478605,,0.0,Creighton will live stream the football game tonight on their school Facebook page starting at 7:00 pm.,2020-08-28 12:38:43,,
76,0.0,,3.0,,3394439420576958,"If you’re traveling to Creighton tonight for the football game, please see the restrictions due to covid. See you there!",,,0.0,"If you’re traveling to Creighton tonight for the football game, please see the restrictions due to covid. See you there!",2020-08-28 09:10:44,,
77,0.0,https://scontent-atl3-1.xx.fbcdn.net/v/t1.0-9/fr/cp0/e15/q65/118581480_3393175290703371_4089247132274291492_o.jpg?_nc_cat=103&_nc_sid=2d5d41&_nc_ohc=i4DX7M1NjA8AX94mCeh&_nc_ht=scontent-atl3-1.xx&tp=14&oh=fc871dcddcd89945c43f95e92019b21b&oe=5F848784,2.0,,3393175287370038,The Football team travels to Creighton Friday night for their season opener. Attached you will find Creighton’s Covid-19 restrictions.,,,0.0,The Football team travels to Creighton Friday night for their season opener. Attached you will find Creighton’s Covid-19 restrictions.,2020-08-27 23:00:10,,
78,11.0,,64.0,,3392900544064179,Some great running took place in Hartington tonight. Alexis Bodlak medaled with a 9th place finish for varsity girls while Nathan Breitbarth medaled in his varsity boys race with 8th place. Congrats to Kairece Morris who won the Jr. High girls race! Go Pendragons!,https://facebook.com/story.php?story_fbid=3392900544064179&id=242089932478605,,0.0,Some great running took place in Hartington tonight. Alexis Bodlak medaled with a 9th place finish for varsity girls while Nathan Breitbarth medaled in his varsity boys race with 8th place. Congrats to Kairece Morris who won the Jr. High girls race! Go Pendragons!,2020-08-27 21:05:35,,
79,1.0,,7.0,https://striv.tv/channel/pender/,3392627927424774,"If you’re unable to come, click on the link to watch our Volleyball Scrimmage!

https://striv.tv/channel/pender/",https://facebook.com/story.php?story_fbid=3392627927424774&id=242089932478605,,0.0,"If you’re unable to come, click on the link to watch our Volleyball Scrimmage!

https://striv.tv/channel/pender/",2020-08-27 19:11:51,,
80,0.0,,14.0,,3391961460824754,"PRESCHOOL PARENTS: PPS preschool will be closed tomorrow Friday, August 28th through Wednesday, September 9th. We will reopen on Thursday, September 10th. The closure is due to a staff COVID exposure and the limited availability of substitutes. At this time, preschool students have not been exposed. We sincerely apologize for any inconvenience this may cause. Please contact the school if you have any questions.",https://facebook.com/story.php?story_fbid=3391961460824754&id=242089932478605,,0.0,"PRESCHOOL PARENTS: PPS preschool will be closed tomorrow Friday, August 28th through Wednesday, September 9th. We will reopen on Thursday, September 10th. The closure is due to a staff COVID exposure and the limited availability of substitutes. At this time, preschool students have not been exposed. We sincerely apologize for any inconvenience this may cause. Please contact the school if you have any questions.",2020-08-27 13:58:58,,
81,3.0,,35.0,,3391232127564354,Good Luck to our Cross Country teams today as they kickoff their season in Hartington!,https://facebook.com/story.php?story_fbid=3391232127564354&id=242089932478605,,0.0,Good Luck to our Cross Country teams today as they kickoff their season in Hartington!,2020-08-27 09:00:13,,
82,0.0,,4.0,,3389001817787385,Admittance to Thursday’s Volleyball Scrimmage will be a sports drink. Please wear a mask while inside the school. See you at 6:30 !,https://facebook.com/story.php?story_fbid=3389001817787385&id=242089932478605,,0.0,Admittance to Thursday’s Volleyball Scrimmage will be a sports drink. Please wear a mask while inside the school. See you at 6:30 !,2020-08-26 15:26:51,,
83,0.0,https://scontent-atl3-1.xx.fbcdn.net/v/t1.0-9/fr/cp0/e15/q65/118326281_3388652374488996_1959300398133458144_o.jpg?_nc_cat=101&_nc_sid=2d5d41&_nc_ohc=1wVk_fzd6DYAX_-1kyN&_nc_ht=scontent-atl3-1.xx&tp=14&oh=520320136999a6c8f7c71362382cbcc1&oe=5F8238EE,2.0,,3388652371155663,The bracket for the NEN softball tournament in Wisner is attached. Wisner asks that fans they wear a mask when social distancing isn’t possible. Concessions will be available.,,,0.0,The bracket for the NEN softball tournament in Wisner is attached. Wisner asks that fans they wear a mask when social distancing isn’t possible. Concessions will be available.,2020-08-26 12:57:04,,
84,0.0,https://scontent-atl3-1.xx.fbcdn.net/v/t1.0-9/fr/cp0/e15/q65/118603152_3388562577831309_661759041291575349_n.jpg?_nc_cat=109&_nc_sid=110474&_nc_ohc=hk8kxXmOrzEAX8x-ssV&_nc_ht=scontent-atl3-1.xx&tp=14&oh=cb24bce4e0d72230866271de904f3936&oe=5F828446,40.0,,3388570587830508,3rd grade PE is also a lesson in Canvas! The P in PRIDE is Preparation and our entire team is hard at work! #pendragonproud,https://facebook.com/story.php?story_fbid=3388570587830508&id=242089932478605,,0.0,3rd grade PE is also a lesson in Canvas! The P in PRIDE is Preparation and our entire team is hard at work! #pendragonproud,2020-08-26 12:23:57,,
85,0.0,,0.0,,3388372481183652,"If you would like a ticket to the volleyball game next Tuesday @ Logan View, talk to Mr. Ferg today.",https://facebook.com/story.php?story_fbid=3388372481183652&id=242089932478605,,0.0,"If you would like a ticket to the volleyball game next Tuesday @ Logan View, talk to Mr. Ferg today.",2020-08-26 11:03:05,,
86,0.0,,7.0,,3388065154547718,"Softball Parents night has moved to Tuesday, September 1st IN WISNER vs O’Neill.",https://facebook.com/story.php?story_fbid=3388065154547718&id=242089932478605,,0.0,"Softball Parents night has moved to Tuesday, September 1st IN WISNER vs O’Neill.",2020-08-26 09:02:20,,
87,0.0,https://scontent-atl3-1.xx.fbcdn.net/v/t1.0-9/fr/cp0/e15/q65/118159913_3385792298108337_4158604264580314931_o.jpg?_nc_cat=105&_nc_sid=8024bb&_nc_ohc=pvtVI955uSAAX8DlJLT&_nc_oc=AQmKycLIyvabG0mn6tuJc2-PSBCcM9lCC-GfIVoKh4f0U06NSDd1ZhwhPh-z78IgUEo&_nc_ht=scontent-atl3-1.xx&tp=14&oh=159c8ddafdbfa8a75687212f382d8975&oe=5F851717,86.0,,3385800988107468,2nd Grade*Daily 5*Listen to Reading*Mask Break*Beautiful day to be a Pendragon!,https://facebook.com/story.php?story_fbid=3385800988107468&id=242089932478605,,0.0,2nd Grade*Daily 5*Listen to Reading*Mask Break*Beautiful day to be a Pendragon!,2020-08-25 14:58:06,,
88,0.0,,8.0,,3384987494855484,"Logan View has announced that due to Covid-19, they are only allowing 140 visitor fans for next week’s volleyball game. If you’re interested in attending, please contact Coach Ostrand or the school office to reserve your seat. Tickets are $5 for adults, $4 children.",https://facebook.com/story.php?story_fbid=3384987494855484&id=242089932478605,,0.0,"Logan View has announced that due to Covid-19, they are only allowing 140 visitor fans for next week’s volleyball game. If you’re interested in attending, please contact Coach Ostrand or the school office to reserve your seat. Tickets are $5 for adults, $4 children.",2020-08-25 09:44:06,,
89,1.0,https://scontent-atl3-1.xx.fbcdn.net/v/t1.0-9/fr/cp0/e15/q65/118430331_3381947795159454_7834727743076729676_n.jpg?_nc_cat=110&_nc_sid=110474&_nc_ohc=ZjgB5R37YVcAX-7ubFL&_nc_ht=scontent-atl3-1.xx&tp=14&oh=bc67a0b54ec567404e6e6bf2b9ca56f5&oe=5F8562CA,100.0,,3381950818492485,Preschool is off to a fantastic start this morning! #littlependragons,https://facebook.com/story.php?story_fbid=3381950818492485&id=242089932478605,,0.0,Preschool is off to a fantastic start this morning! #littlependragons,2020-08-24 09:49:07,,
90,11.0,https://scontent-atl3-1.xx.fbcdn.net/v/t1.0-9/fr/cp0/e15/q65/118157646_3377020782318822_662676656762704395_o.jpg?_nc_cat=105&_nc_sid=2d5d41&_nc_ohc=yhkphKqh_s8AX8BjRn1&_nc_ht=scontent-atl3-1.xx&tp=14&oh=737779cea972db34a918c5e397cf4fe0&oe=5F858330,67.0,,3377020775652156,Your NEN Vipers take 3rd in Lincoln going 2-1. Five home runs today with two by Paige S. Let’s keep the season rolling!,,,0.0,Your NEN Vipers take 3rd in Lincoln going 2-1. Five home runs today with two by Paige S. Let’s keep the season rolling!,2020-08-22 18:40:39,,
91,0.0,,1.0,https://www.allsportcentral.com/eventInfo.cfm?eventID=74770,3373283052692595,"Don't forget the Flames Color Run is this Saturday the 22nd @8AM starting at the Pender Park. We hope to see you there!
You can register in person the day of the event as well!
https://www.allsportcentral.com/eventInfo.cfm?eventID=74770",https://facebook.com/story.php?story_fbid=3373283052692595&id=242089932478605,,0.0,"Don't forget the Flames Color Run is this Saturday the 22nd @8AM starting at the Pender Park. We hope to see you there!
You can register in person the day of the event as well!
https://www.allsportcentral.com/eventInfo.cfm?eventID=74770",2020-08-21 14:14:06,,
92,0.0,,24.0,,3372560056098228,Good Luck to the Girls Golf team as they kickoff their season today in Beemer for the West-Point Beemer invite!,https://facebook.com/story.php?story_fbid=3372560056098228&id=242089932478605,,0.0,Good Luck to the Girls Golf team as they kickoff their season today in Beemer for the West-Point Beemer invite!,2020-08-21 09:00:18,,
93,0.0,,7.0,,3372525016101732,The Football scrimmage will begin at 5:30 tonight followed by the Fall Sports Kickoff at 7:00pm. The Booster Club will have hotdogs and chips for free will donation. Please wear a mask if you cannot social distance. Hope to see you at Heyne!!!,https://facebook.com/story.php?story_fbid=3372525016101732&id=242089932478605,,0.0,The Football scrimmage will begin at 5:30 tonight followed by the Fall Sports Kickoff at 7:00pm. The Booster Club will have hotdogs and chips for free will donation. Please wear a mask if you cannot social distance. Hope to see you at Heyne!!!,2020-08-21 08:45:04,,
94,0.0,https://scontent-atl3-1.xx.fbcdn.net/v/t1.0-9/fr/cp0/e15/q65/118256156_3370910079596559_1628840798443418181_n.jpg?_nc_cat=103&_nc_sid=110474&_nc_ohc=r6Vv-\-\guXv4AX-pGXky&_nc_ht=scontent-atl3-1.xx&tp=14&oh=905a0cbb2a44941d40c299c35869c336&oe=5F83338F,100.0,,3370940792926821,"Day #1 of 180 was a pretty special day! We ❤️ our Pendragons! See you tomorrow for day #2! Moving forward with compassion, optimism, perseverance and energy! #20-21Vision😎",https://facebook.com/story.php?story_fbid=3370940792926821&id=242089932478605,,0.0,"Day #1 of 180 was a pretty special day! We ❤️ our Pendragons! See you tomorrow for day #2! Moving forward with compassion, optimism, perseverance and energy! #20-21Vision😎",2020-08-20 20:09:11,,
95,3.0,https://scontent-atl3-1.xx.fbcdn.net/v/t1.0-9/fr/cp0/e15/q65/118145173_3369523789735188_3779298379208080250_o.jpg?_nc_cat=107&_nc_sid=8024bb&_nc_ohc=ozoNBCc87I0AX_i8ZzB&_nc_ht=scontent-atl3-1.xx&tp=14&oh=d45a2efb6e799a774fb78bceb85e6590&oe=5F83CF6A,131.0,,3369523986401835,"WELCOME BACK PENDRAGONS!!!

It is SOOOOOOO good to see everyone! Today is the start of a great school year!",https://facebook.com/story.php?story_fbid=3369523986401835&id=242089932478605,,0.0,"WELCOME BACK PENDRAGONS!!!

It is SOOOOOOO good to see everyone! Today is the start of a great school year!",2020-08-20 09:27:39,,
96,1.0,,19.0,,3367709576583276,"Good evening,

Today is the last day of the summer break, which means the 2020-2021 school year starts TOMORROW!! Hopefully students are excited to come back, because PPS staff members are thrilled for them to be back! It has been WAY too long since school was last in session, and everyone at the school is very excited to get the school year started!

Here are a few reminders…

1. School will be dismissed tomorrow at 1:00 pm

2. Please do NOT arrive before 8:00 am.

3. Breakfast will be grab and go and will be eaten in the classrooms.

4. Facial coverings will be required. If you have one, please put it on before entering the building. If you do not have one, one will be available when you arrive!

Again, everyone at PPS looks forward to seeing you and can’t wait to get the school year started!

See you all tomorrow and have a great evening!

Its a Great Day to be a Pendragon!!",https://facebook.com/story.php?story_fbid=3367709576583276&id=242089932478605,,0.0,"Good evening,

Today is the last day of the summer break, which means the 2020-2021 school year starts TOMORROW!! Hopefully students are excited to come back, because PPS staff members are thrilled for them to be back! It has been WAY too long since school was last in session, and everyone at the school is very excited to get the school year started!

Here are a few reminders…

1. School will be dismissed tomorrow at 1:00 pm

2. Please do NOT arrive before 8:00 am.

3. Breakfast will be grab and go and will be eaten in the classrooms.

4. Facial coverings will be required. If you have one, please put it on before entering the building. If you do not have one, one will be available when you arrive!

Again, everyone at PPS looks forward to seeing you and can’t wait to get the school year started!

See you all tomorrow and have a great evening!

Its a Great Day to be a Pendragon!!",2020-08-19 18:29:23,,
97,1.0,,49.0,,3367208453300055,,https://facebook.com/story.php?story_fbid=3367208453300055&id=242089932478605,"Kayla Welch is with Lindi Troyer Hathaway and 6 others.
August 19 at 9:27 AM ·

We are so excited to see all of our kiddos tomorrow! I’m so lucky to get to work with these ladies every single day. #TogetherWeCan #PendragonAcademy",0.0,"Kayla Welch is with Lindi Troyer Hathaway and 6 others.
August 19 at 9:27 AM ·

We are so excited to see all of our kiddos tomorrow! I’m so lucky to get to work with these ladies every single day. #TogetherWeCan #PendragonAcademy",2020-08-19 14:23:56,,
98,0.0,,4.0,,3366444060043161,The Football Gatorade Scrimmage will begin at 5:30 on Friday night followed by the Fall Sports Kickoff at 7:00 @ Heyne Field. Please wear a mask when social distancing isn’t possible. Admittance is a sports drink! See you Friday night!,https://facebook.com/story.php?story_fbid=3366444060043161&id=242089932478605,,0.0,The Football Gatorade Scrimmage will begin at 5:30 on Friday night followed by the Fall Sports Kickoff at 7:00 @ Heyne Field. Please wear a mask when social distancing isn’t possible. Admittance is a sports drink! See you Friday night!,2020-08-19 09:00:04,,
99,0.0,https://scontent-atl3-1.xx.fbcdn.net/v/t1.0-9/fr/cp0/e15/q65/117855251_3364971056857128_7193018718469852019_n.jpg?_nc_cat=108&_nc_sid=2d5d41&_nc_ohc=PJAR8TiqxdIAX-4ZBXD&_nc_ht=scontent-atl3-1.xx&tp=14&oh=7d4ce6f2f447f018865b9b5c4b4fcb54&oe=5F846967,11.0,,3364971050190462,"Parents: Please be aware that due to social distancing efforts, students will be eating lunch in either the lunchroom, event center or multipurpose room. A microwave is not available in all locations. If you are packing your child's lunch, please consider options that do not need to be cooked/warmed. Thank you!",,,0.0,"Parents: Please be aware that due to social distancing efforts, students will be eating lunch in either the lunchroom, event center or multipurpose room. A microwave is not available in all locations. If you are packing your child's lunch, please consider options that do not need to be cooked/warmed. Thank you!",2020-08-18 20:35:52,,
100,0.0,,0.0,https://www.allsportcentral.com/eventInfo.cfm?eventID=74770,3363914126962821,"Don't forget to register for the Flames Color Run this Saturday!
https://www.allsportcentral.com/eventInfo.cfm?eventID=74770",https://facebook.com/story.php?story_fbid=3363914126962821&id=242089932478605,,0.0,"Don't forget to register for the Flames Color Run this Saturday!
https://www.allsportcentral.com/eventInfo.cfm?eventID=74770",2020-08-18 12:15:02,,
101,0.0,https://scontent-atl3-1.xx.fbcdn.net/v/t1.0-9/fr/cp0/e15/q65/117773852_3357610640926503_1418035150890539529_o.jpg?_nc_cat=101&_nc_sid=2d5d41&_nc_ohc=fFW8F9SnNUkAX_w9e-j&_nc_ht=scontent-atl3-1.xx&tp=14&oh=ddc4d0c7230c273d9d4c09e53b96ad5a&oe=5F84C9C9,2.0,https://bit.ly/FlamesColorRun5K,3357610634259837,"Last day to register for the Color Run and be guaranteed a T-shirt is today! Color Run will be next Saturday, August 22nd! Register and support the Flames!
bit.ly/FlamesColorRun5K",,,0.0,"Last day to register for the Color Run and be guaranteed a T-shirt is today! Color Run will be next Saturday, August 22nd! Register and support the Flames!
bit.ly/FlamesColorRun5K",2020-08-16 09:08:14,,
102,0.0,https://scontent-atl3-1.xx.fbcdn.net/v/t1.0-9/fr/cp0/e15/q65/117769368_3355766084444292_358330873815929170_o.jpg?_nc_cat=108&_nc_sid=2d5d41&_nc_ohc=Ku3QIq0h7bcAX_-qJod&_nc_ht=scontent-atl3-1.xx&tp=14&oh=5a76505c3674b96d68c9b07fbc624eb2&oe=5F830D8B,12.0,,3355766077777626,Remember to come to Lyons tonight at 6:30 for our NEN Viper softball scrimmage!,,,0.0,Remember to come to Lyons tonight at 6:30 for our NEN Viper softball scrimmage!,2020-08-15 17:12:16,,
103,0.0,,10.0,,3353025104718390,"The NEN Viper softball team will hold their Gatorade scrimmage Saturday, August 15th at 6:30 in Lyons. They kick off their season Monday, August 17th vs WP-B in Pender at 6:30 for the Jamboree Game. See you there!",https://facebook.com/story.php?story_fbid=3353025104718390&id=242089932478605,,0.0,"The NEN Viper softball team will hold their Gatorade scrimmage Saturday, August 15th at 6:30 in Lyons. They kick off their season Monday, August 17th vs WP-B in Pender at 6:30 for the Jamboree Game. See you there!",2020-08-14 19:00:09,,
104,0.0,,2.0,,3352544751433092,"Due to a possibility of rainy weather, the fall sports kick off scheduled for tonight will be moved to Friday, August 21 at 7:00 PM @Heyne Field.",https://facebook.com/story.php?story_fbid=3352544751433092&id=242089932478605,,0.0,"Due to a possibility of rainy weather, the fall sports kick off scheduled for tonight will be moved to Friday, August 21 at 7:00 PM @Heyne Field.",2020-08-14 15:01:06,,
105,0.0,,3.0,https://bit.ly/31QTWjt,3352116681475899,"The letter linked in this message addresses important information about the start of the school year.

https://bit.ly/31QTWjt

Also provided is the link to the updated Return to School Plan.

https://bit.ly/30VhAvE

It's a Great Day to be a Pendragon!!",https://facebook.com/story.php?story_fbid=3352116681475899&id=242089932478605,,0.0,"The letter linked in this message addresses important information about the start of the school year.

https://bit.ly/31QTWjt

Also provided is the link to the updated Return to School Plan.

https://bit.ly/30VhAvE

It's a Great Day to be a Pendragon!!",2020-08-14 11:50:45,,
106,0.0,,6.0,,3351994321488135,7th-12th grade students are encouraged to pick up their back to school packet anytime from 7:00 a.m.-3:00 p.m. at the front office at PPS. Having this completed and ready to turn in the first day of school ensures you are able to get your device the first day of school.,https://facebook.com/story.php?story_fbid=3351994321488135&id=242089932478605,,0.0,7th-12th grade students are encouraged to pick up their back to school packet anytime from 7:00 a.m.-3:00 p.m. at the front office at PPS. Having this completed and ready to turn in the first day of school ensures you are able to get your device the first day of school.,2020-08-14 10:58:57,,
107,0.0,,6.0,,3351651561522411,Reminder: Come support our coaches and athletes at the Fall Sports Kickoff at 7:00 pm tonight at the football field! Please wear a mask if you cannot social distance. Booster club will have free will donation hotdogs and chips. See you tonight!,https://facebook.com/story.php?story_fbid=3351651561522411&id=242089932478605,,0.0,Reminder: Come support our coaches and athletes at the Fall Sports Kickoff at 7:00 pm tonight at the football field! Please wear a mask if you cannot social distance. Booster club will have free will donation hotdogs and chips. See you tonight!,2020-08-14 08:41:39,,
108,0.0,,28.0,,3349070281780539,Looking forward to seeing you 1 week from today!!! Please remember students should arrive at 8:00AM and masks will be worn on school grounds. Stay Safe and see you on the 20th!,https://facebook.com/story.php?story_fbid=3349070281780539&id=242089932478605,,0.0,Looking forward to seeing you 1 week from today!!! Please remember students should arrive at 8:00AM and masks will be worn on school grounds. Stay Safe and see you on the 20th!,2020-08-13 12:31:30,,
109,0.0,https://scontent-atl3-1.xx.fbcdn.net/v/t1.0-9/117776599_3348967375124163_9055432304540113861_o.png?_nc_cat=105&_nc_sid=2d5d41&_nc_ohc=PdrDjHxN9u8AX-POQiM&_nc_ht=scontent-atl3-1.xx&oh=c548e6a8220bd16bafb35dbad12b205c&oe=5F821C8B,0.0,https://bit.ly/FlamesColorRun5K,3348967368457497,"Don't forget to sign up for the 5K (or 1 mile) Color Run on Saturday August 22nd! Please register by Aug 15th to be guaranteed a t-shirt! Info and register:
bit.ly/FlamesColorRun5K",,,0.0,"Don't forget to sign up for the 5K (or 1 mile) Color Run on Saturday August 22nd! Please register by Aug 15th to be guaranteed a t-shirt! Info and register:
bit.ly/FlamesColorRun5K",2020-08-13 11:46:31,,
110,0.0,https://scontent-atl3-1.xx.fbcdn.net/v/t1.0-9/117592977_3348967158457518_6191929528237564053_o.png?_nc_cat=108&_nc_sid=2d5d41&_nc_ohc=YbR5zonOU_sAX9IhJTf&_nc_ht=scontent-atl3-1.xx&oh=0f1a6d205e204cb86c54106e1fb73a19&oe=5F830583,0.0,https://bit.ly/FlamesColorRun5K,3348967151790852,"Don't forget to sign up for the 5K (or 1 mile) Color Run on Saturday August 22nd! Please register by Aug 15th to be guaranteed a t-shirt! Info and register:
bit.ly/FlamesColorRun5K",,,0.0,"Don't forget to sign up for the 5K (or 1 mile) Color Run on Saturday August 22nd! Please register by Aug 15th to be guaranteed a t-shirt! Info and register:
bit.ly/FlamesColorRun5K",2020-08-13 11:46:27,,
111,0.0,,6.0,,3348751308479103,The 2020 Booster Club Fall Sports Kickoff is Friday August 14th at 7:00 @ Heyne Field. Food will be free will donation. Coaches will introduce their teams. Please wear a mask if you cannot social distance. Come show your support for our athletes and coaches!,https://facebook.com/story.php?story_fbid=3348751308479103&id=242089932478605,,0.0,The 2020 Booster Club Fall Sports Kickoff is Friday August 14th at 7:00 @ Heyne Field. Food will be free will donation. Coaches will introduce their teams. Please wear a mask if you cannot social distance. Come show your support for our athletes and coaches!,2020-08-13 10:12:19,,
112,0.0,,18.0,,3348585471829020,"The 2020 Booster Club Fall Sports Kickoff will be Friday, August 14th at 7:00 @ Heyne field. Coaches will introduce their athletes and staff. Booster club will sell prepackaged hotdogs and chips. Please wear a mask if you cannot social distance. Come support our fall activities!",https://facebook.com/story.php?story_fbid=3348585471829020&id=242089932478605,,0.0,"The 2020 Booster Club Fall Sports Kickoff will be Friday, August 14th at 7:00 @ Heyne field. Coaches will introduce their athletes and staff. Booster club will sell prepackaged hotdogs and chips. Please wear a mask if you cannot social distance. Come support our fall activities!",2020-08-13 09:00:07,,
113,0.0,,9.0,https://www.youtube.com/watch?v=yyccC5DI_eg,3346943041993263,"PPS Mask/Facial Covering Protocol for Students and Staff:
* Put your mask/facial covering on as you exit your car (or when you arrive on school grounds if you are walking or riding a bike).
*If you don't have a mask/facial covering they will be available for you outside door 4 (main entrance).
*Masks/facial coverings will be worn while waiting outside to enter the building.
*Masks/facial coverings will be worn inside the building when appropriate social distancing is not possible.
Practice wearing those masks! Let's all work together to keep our kids in school! #8moredays",https://facebook.com/story.php?story_fbid=3346943041993263&id=242089932478605,"YOUTUBE.COM
Simple Steps to Protect You and Your Friends - English",6.0,"PPS Mask/Facial Covering Protocol for Students and Staff:
* Put your mask/facial covering on as you exit your car (or when you arrive on school grounds if you are walking or riding a bike).
*If you don't have a mask/facial covering they will be available for you outside door 4 (main entrance).
*Masks/facial coverings will be worn while waiting outside to enter the building.
*Masks/facial coverings will be worn inside the building when appropriate social distancing is not possible.
Practice wearing those masks! Let's all work together to keep our kids in school! #8moredays

YOUTUBE.COM
Simple Steps to Protect You and Your Friends - English",2020-08-12 18:52:08,,
114,0.0,https://scontent-atl3-1.xx.fbcdn.net/v/t1.0-9/fr/cp0/e15/q65/117714798_3346799572007610_7258720699625089056_n.jpg?_nc_cat=105&_nc_sid=8024bb&_nc_ohc=mB5ieiHKiZsAX9plZpp&_nc_ht=scontent-atl3-1.xx&tp=14&oh=e44b45eb074e0326070ac9255a7199c3&oe=5F8220EA,0.0,https://www.signupgenius.com/go/10C094DACAE28AAF58-open1,3346816088672625,"Additional slots (from 6:00-7:00 p.m.) have been added for all K-6 Open House meetings. If you needed a later slot please go and sign up! We hope this helps! Thank you!

K-1 Open House Sign Up: https://www.signupgenius.com/go/10C094DACAE28AAF58-open1

2nd-3rd Grade Open House Sign Up: https://www.signupgenius.com/go/10C094DACAE28AAF58-open2

4th-5th-6th Grade Open House Sign Up: https://www.signupgenius.com/go/10C094DACAE28AAF58-open3",https://facebook.com/story.php?story_fbid=3346816088672625&id=242089932478605,,0.0,"Additional slots (from 6:00-7:00 p.m.) have been added for all K-6 Open House meetings. If you needed a later slot please go and sign up! We hope this helps! Thank you!

K-1 Open House Sign Up: https://www.signupgenius.com/go/10C094DACAE28AAF58-open1

2nd-3rd Grade Open House Sign Up: https://www.signupgenius.com/go/10C094DACAE28AAF58-open2

4th-5th-6th Grade Open House Sign Up: https://www.signupgenius.com/go/10C094DACAE28AAF58-open3",2020-08-12 17:43:31,,
115,1.0,https://scontent-atl3-1.xx.fbcdn.net/v/t1.0-9/fr/cp0/e15/q65/117644017_3343486245672276_8870599091581368470_o.jpg?_nc_cat=106&_nc_sid=8024bb&_nc_ohc=Jn_7LA6fsCAAX-Gsogu&_nc_ht=scontent-atl3-1.xx&tp=14&oh=0d7488523e46503b9e9162eb727e272f&oe=5F845618,18.0,,3343515832335984,"PPS Mask/Facial Covering Protocol for Students and Staff:
* Put your mask/facial covering on as you exit your car (or when you arrive on school grounds if you are walking or riding a bike).
*If you don't have a mask/facial covering they will be available for you outside door 4 (main entrance).
*Masks/facial coverings will be worn while waiting outside to enter the building.
*Masks/facial coverings will be worn inside the building when appropriate social distancing is not possible.
Practice wearing those masks! Let's all work together to keep our kids in school! #9daysandcounting #everyonedoyourpart",https://facebook.com/story.php?story_fbid=3343515832335984&id=242089932478605,,0.0,"PPS Mask/Facial Covering Protocol for Students and Staff:
* Put your mask/facial covering on as you exit your car (or when you arrive on school grounds if you are walking or riding a bike).
*If you don't have a mask/facial covering they will be available for you outside door 4 (main entrance).
*Masks/facial coverings will be worn while waiting outside to enter the building.
*Masks/facial coverings will be worn inside the building when appropriate social distancing is not possible.
Practice wearing those masks! Let's all work together to keep our kids in school! #9daysandcounting #everyonedoyourpart",2020-08-11 15:12:53,,
116,2.0,https://scontent-atl3-1.xx.fbcdn.net/v/t1.0-9/fr/cp0/e15/q65/117678949_3342721499082084_8369168376254514948_o.jpg?_nc_cat=102&_nc_sid=2d5d41&_nc_ohc=bKCVA8TVxjQAX-Tpc_Q&_nc_ht=scontent-atl3-1.xx&tp=14&oh=92956e5ed68e66a51089edbde0247b94&oe=5F83ACA5,83.0,,3342721492415418,Here are just a few of the supplies that St. Mark's Lutheran Church donated to Pender Public Schools. This donation will ensure that each child will start the school year with the school supplies they need. Thank you so much. We appreciate you!,,,0.0,Here are just a few of the supplies that St. Mark's Lutheran Church donated to Pender Public Schools. This donation will ensure that each child will start the school year with the school supplies they need. Thank you so much. We appreciate you!,2020-08-11 09:19:05,,
117,0.0,https://scontent-atl3-1.xx.fbcdn.net/v/t1.0-9/117342713_3341531639201070_5354363823449676780_o.png?_nc_cat=102&_nc_sid=8024bb&_nc_ohc=yd4i0UQQTHsAX8rbVmY&_nc_ht=scontent-atl3-1.xx&oh=daa86ffef2884de921d431acf8b7509a&oe=5F837754,21.0,,3341541012533466,Tips and ideas for helping children become comfortable wearing facial coverings. #10daysandcounting 🤗,https://facebook.com/story.php?story_fbid=3341541012533466&id=242089932478605,,0.0,Tips and ideas for helping children become comfortable wearing facial coverings. #10daysandcounting 🤗,2020-08-10 23:00:49,,
118,2.0,,23.0,,3340844155936485,"Ten more days! We are so excited! :)

Hey incoming kindergartners! At the end of the school year, last year's kindergarteners made videos for the incoming kindergarteners. They know what it’s all about and wanted to let you know all about it. 🙂📚",,,0.0,"Ten more days! We are so excited! :)

Hey incoming kindergartners! At the end of the school year, last year's kindergarteners made videos for the incoming kindergarteners. They know what it’s all about and wanted to let you know all about it. 🙂📚",2020-08-10 16:50:02,https://video-atl3-1.xx.fbcdn.net/v/t42.9040-2/116095793_294345998491004_2709031048607640888_n.mp4?_nc_cat=106&_nc_sid=985c63&efg=eyJ2ZW5jb2RlX3RhZyI6ImxlZ2FjeV9zZCJ9&_nc_ohc=WjBsZNtsQvsAX-CSAdG&_nc_ht=video-atl3-1.xx&oh=e340c6322528734946dfb4733c12428b&oe=5F5E22C8,
119,26.0,,94.0,,3340446289309605,"WOW!! Since March 19, 2020, Pender Public Schools kitchen staff has cooked and served 18,707 breakfasts and 18,707 lunches. That is 37,414 total meals. Thank you for supporting our summer food program and if you see our wonderful kitchen staff, please thank them for a job well done. We can't wait to see you all next week.",https://facebook.com/story.php?story_fbid=3340446289309605&id=242089932478605,,0.0,"WOW!! Since March 19, 2020, Pender Public Schools kitchen staff has cooked and served 18,707 breakfasts and 18,707 lunches. That is 37,414 total meals. Thank you for supporting our summer food program and if you see our wonderful kitchen staff, please thank them for a job well done. We can't wait to see you all next week.",2020-08-10 13:41:09,,
120,0.0,,2.0,https://dakotasportsonline.chipply.com/pendercc,3334559313231636,"Last chance to get some Cross-Country gear, or if you just want a nice Pendragon polo to support all activities! Click on the link below to get started. Store closes August 10th!

https://dakotasportsonline.chipply.com/pendercc",https://facebook.com/story.php?story_fbid=3334559313231636&id=242089932478605,,0.0,"Last chance to get some Cross-Country gear, or if you just want a nice Pendragon polo to support all activities! Click on the link below to get started. Store closes August 10th!

https://dakotasportsonline.chipply.com/pendercc",2020-08-08 13:27:00,,
121,1.0,,0.0,,3330738313613736,"PPS Food Service (8.7.20) Dinner - Grilled cheese, vegetable/fruit, milk *Breakfast - Mini waffle, fruit, milk",https://facebook.com/story.php?story_fbid=3330738313613736&id=242089932478605,,0.0,"PPS Food Service (8.7.20) Dinner - Grilled cheese, vegetable/fruit, milk *Breakfast - Mini waffle, fruit, milk",2020-08-07 07:00:12,,
122,1.0,https://scontent-atl3-1.xx.fbcdn.net/v/t1.0-9/117242135_3328421213845446_1286498949058562660_o.png?_nc_cat=111&_nc_sid=8024bb&_nc_ohc=GxiJATyyJkoAX-OXSke&_nc_ht=scontent-atl3-1.xx&oh=a92fecc4a9f2ce200dff2bd9cfe6cb7d&oe=5F8214D3,5.0,,3328421803845387,,https://facebook.com/story.php?story_fbid=3328421803845387&id=242089932478605,,0.0,,2020-08-06 11:04:26,,
123,0.0,,0.0,,3327855313902036,"PPS Food Service (8.6.20) Dinner - Mini corn dogs, vegetable/fruit, milk *Breakfast - Yogurt, fruit, milk",https://facebook.com/story.php?story_fbid=3327855313902036&id=242089932478605,,0.0,"PPS Food Service (8.6.20) Dinner - Mini corn dogs, vegetable/fruit, milk *Breakfast - Yogurt, fruit, milk",2020-08-06 07:00:26,,
124,0.0,,2.0,https://www.walloffame247.com/pender-high-school,3325200317500869,"The 2020 Volleyball clothing store is now open!

https://www.walloffame247.com/pender-high-school",https://facebook.com/story.php?story_fbid=3325200317500869&id=242089932478605,,0.0,"The 2020 Volleyball clothing store is now open!

https://www.walloffame247.com/pender-high-school",2020-08-05 09:00:54,,
125,0.0,,1.0,,3324916404195927,"PPS Food Service (8.5.20) Dinner - Crispito, vegetable/fruit, milk *Breakfast - Cinni mini, fruit, milk",https://facebook.com/story.php?story_fbid=3324916404195927&id=242089932478605,,0.0,"PPS Food Service (8.5.20) Dinner - Crispito, vegetable/fruit, milk *Breakfast - Cinni mini, fruit, milk",2020-08-05 07:00:09,,
126,0.0,,0.0,,3322026091151625,"PPS Food Service (8.4.20) Dinner - Tavern, vegetable/fruit, milk *Breakfast - Cereal, fruit, milk",https://facebook.com/story.php?story_fbid=3322026091151625&id=242089932478605,,0.0,"PPS Food Service (8.4.20) Dinner - Tavern, vegetable/fruit, milk *Breakfast - Cereal, fruit, milk",2020-08-04 07:00:05,,
127,1.0,https://scontent-atl3-1.xx.fbcdn.net/v/t1.0-9/fr/cp0/e15/q65/117107419_3320718661282368_7611642824298923801_n.jpg?_nc_cat=110&_nc_sid=2d5d41&_nc_ohc=ZC7I67kj-7EAX9erovj&_nc_ht=scontent-atl3-1.xx&tp=14&oh=940f10efb0b8a9b793c6ddecea63b110&oe=5F81BE50,3.0,https://www.signupgenius.com/go/10C094DACAE28AAF58-open3,3320718654615702,4th-5th-6th Grade Open House Sign Up: https://www.signupgenius.com/go/10C094DACAE28AAF58-open3,,,0.0,4th-5th-6th Grade Open House Sign Up: https://www.signupgenius.com/go/10C094DACAE28AAF58-open3,2020-08-03 19:06:02,,
128,1.0,https://scontent-atl3-1.xx.fbcdn.net/v/t1.0-9/fr/cp0/e15/q65/117287030_3320713954616172_8955358192792352537_n.jpg?_nc_cat=105&_nc_sid=2d5d41&_nc_ohc=lRqVhp8utksAX96v2w3&_nc_ht=scontent-atl3-1.xx&tp=14&oh=336453fde93a8f87ea8a378ab6cf05c0&oe=5F832E47,2.0,https://www.signupgenius.com/go/10C094DACAE28AAF58-open2,3320713947949506,2nd-3rd Grade Open House Sign Up: https://www.signupgenius.com/go/10C094DACAE28AAF58-open2,,,0.0,2nd-3rd Grade Open House Sign Up: https://www.signupgenius.com/go/10C094DACAE28AAF58-open2,2020-08-03 19:04:24,,
129,1.0,https://scontent-atl3-1.xx.fbcdn.net/v/t1.0-9/fr/cp0/e15/q65/116721232_3320709534616614_1460884596598797954_n.jpg?_nc_cat=105&_nc_sid=2d5d41&_nc_ohc=Gdz_C3EPVE4AX8OUfRT&_nc_ht=scontent-atl3-1.xx&tp=14&oh=dcee95a49f32038bef9a8f46a717653a&oe=5F83F82C,1.0,https://www.signupgenius.com/go/10C094DACAE28AAF58-open1,3320709531283281,K-1 Open House Sign Up: https://www.signupgenius.com/go/10C094DACAE28AAF58-open1,,,0.0,K-1 Open House Sign Up: https://www.signupgenius.com/go/10C094DACAE28AAF58-open1,2020-08-03 19:02:35,,
130,0.0,https://scontent-atl3-1.xx.fbcdn.net/v/t1.0-9/fr/cp0/e15/q65/116904875_3320703707950530_2838327013378151587_n.jpg?_nc_cat=111&_nc_sid=2d5d41&_nc_ohc=OZuzkuz-CBwAX_an-PN&_nc_ht=scontent-atl3-1.xx&tp=14&oh=796d6a7a0d174dad8571ad54cc54dd0a&oe=5F81AF9C,0.0,https://www.signupgenius.com/go/10C094DACAE28AAF58-preschool,3320703701283864,Preschool Open House Sign Up: https://www.signupgenius.com/go/10C094DACAE28AAF58-preschool,,,0.0,Preschool Open House Sign Up: https://www.signupgenius.com/go/10C094DACAE28AAF58-preschool,2020-08-03 19:00:30,,
131,1.0,https://scontent-atl3-1.xx.fbcdn.net/v/t1.0-9/fr/cp0/e15/q65/117170188_3320646944622873_5259693513474772701_n.jpg?_nc_cat=108&_nc_sid=2d5d41&_nc_ohc=1QC5qGe1VGQAX_6PA_Y&_nc_ht=scontent-atl3-1.xx&tp=14&oh=98e4b68c2c56a312b581096de564909d&oe=5F858F16,9.0,,3320646937956207,"WE CAN’T WAIT TO SEE YOU...but...due to ongoing COVID-19 concerns, our 20-21 Open House will look a little different this year. The PK-6 Open House will be scheduled via Sign Up Genius. There will be no 7-12 Open House. The links for scheduling will be published shortly.",,,0.0,"WE CAN’T WAIT TO SEE YOU...but...due to ongoing COVID-19 concerns, our 20-21 Open House will look a little different this year. The PK-6 Open House will be scheduled via Sign Up Genius. There will be no 7-12 Open House. The links for scheduling will be published shortly.",2020-08-03 18:41:04,,
132,0.0,,2.0,,3319079944779573,"PPS Food Service (8.3.20) Dinner - Chicken strips, vegetable/fruit, milk *Breakfast - Mini french toast, fruit, milk",https://facebook.com/story.php?story_fbid=3319079944779573&id=242089932478605,,0.0,"PPS Food Service (8.3.20) Dinner - Chicken strips, vegetable/fruit, milk *Breakfast - Mini french toast, fruit, milk",2020-08-03 07:00:39,,
133,0.0,https://scontent-atl3-1.xx.fbcdn.net/v/t1.0-9/fr/cp0/e15/q65/116643601_3318032371550997_5874650727522410363_n.jpg?_nc_cat=111&_nc_sid=2d5d41&_nc_ohc=jNlUEMuLHp8AX-dDz-k&_nc_ht=scontent-atl3-1.xx&tp=14&oh=174d04da1aa710c16363d49f708219b5&oe=5F8520BE,12.0,https://bit.ly/FlamesColorRun5K,3318032368217664,"The Flames are excited to host a 5K Color Run on Saturday, August 22nd! Please visit the link for info and to register:
bit.ly/FlamesColorRun5K
Register by August 15th to be guaranteed a T-shirt.",,,0.0,"The Flames are excited to host a 5K Color Run on Saturday, August 22nd! Please visit the link for info and to register:
bit.ly/FlamesColorRun5K
Register by August 15th to be guaranteed a T-shirt.",2020-08-02 21:12:33,,
134,0.0,,1.0,,3310400042314230,"PPS Food Service (7.31.20) Dinner - Chicken fried steak, vegetable/fruit, milk *Breakfast - Apple frudel, fruit, milk",https://facebook.com/story.php?story_fbid=3310400042314230&id=242089932478605,,0.0,"PPS Food Service (7.31.20) Dinner - Chicken fried steak, vegetable/fruit, milk *Breakfast - Apple frudel, fruit, milk",2020-07-31 07:00:11,,
135,0.0,,0.0,,3307283862625848,"PPS Food Service (7.30.20) Dinner - Chicken and noodles, vegetable/fruit, milk *Breakfast - Breakfast stick, fruit, milk",https://facebook.com/story.php?story_fbid=3307283862625848&id=242089932478605,,0.0,"PPS Food Service (7.30.20) Dinner - Chicken and noodles, vegetable/fruit, milk *Breakfast - Breakfast stick, fruit, milk",2020-07-30 07:00:19,,
136,0.0,https://scontent-atl3-1.xx.fbcdn.net/v/t1.0-9/fr/cp0/e15/q65/116595649_3305914542762780_2126537137064277263_n.jpg?_nc_cat=107&_nc_sid=2d5d41&_nc_ohc=WBc3YaUjwkQAX-Xey_U&_nc_ht=scontent-atl3-1.xx&tp=14&oh=9689d2bb93b8e90256533b3e9b243cb8&oe=5F84097E,7.0,https://docs.google.com/document/d/1JElnmTGe3sYZu67ees3-Jm5_Sdk7QTbAoBqAhAsCRCo/edit?usp=sharing,3305914536096114,"2020-2021 PPS Preschool Guidance is available at the link below. If you have any additional questions please don't hesitate to contact the school! Thank you!
https://docs.google.com/document/d/1JElnmTGe3sYZu67ees3-Jm5_Sdk7QTbAoBqAhAsCRCo/edit?usp=sharing",,,0.0,"2020-2021 PPS Preschool Guidance is available at the link below. If you have any additional questions please don't hesitate to contact the school! Thank you!
https://docs.google.com/document/d/1JElnmTGe3sYZu67ees3-Jm5_Sdk7QTbAoBqAhAsCRCo/edit?usp=sharing",2020-07-29 19:15:22,,
137,0.0,,3.0,https://dakotasportsonline.chipply.com/nensoftball/store.aspx,3305048676182700,"Need some new Viper Softball gear for 2020? The NEN Viper softball clothing store is now open!

https://dakotasportsonline.chipply.com/nensoftball/store.aspx",https://facebook.com/story.php?story_fbid=3305048676182700&id=242089932478605,,0.0,"Need some new Viper Softball gear for 2020? The NEN Viper softball clothing store is now open!

https://dakotasportsonline.chipply.com/nensoftball/store.aspx",2020-07-29 12:49:15,,
138,0.0,,6.0,https://5il.co/irit,3304840102870224,"The first newsletter of the year is now available!
https://5il.co/irit",https://facebook.com/story.php?story_fbid=3304840102870224&id=242089932478605,,0.0,"The first newsletter of the year is now available!
https://5il.co/irit",2020-07-29 11:14:53,,
139,1.0,,0.0,,3304279046259663,"PPS Food Service (7.29.20) Dinner - BBQ rib, vegetable/fruit, milk *Breakfast - Mini donut, fruit, milk",https://facebook.com/story.php?story_fbid=3304279046259663&id=242089932478605,,0.0,"PPS Food Service (7.29.20) Dinner - BBQ rib, vegetable/fruit, milk *Breakfast - Mini donut, fruit, milk",2020-07-29 07:00:05,,
140,0.0,,0.0,,3301351979885703,"PPS Food Service (7.28.20) Dinner - Grilled cheese, vegetable/fruit, milk *Breakfast - Pancakes, fruit, milk",https://facebook.com/story.php?story_fbid=3301351979885703&id=242089932478605,,0.0,"PPS Food Service (7.28.20) Dinner - Grilled cheese, vegetable/fruit, milk *Breakfast - Pancakes, fruit, milk",2020-07-28 07:00:06,,
141,0.0,,0.0,,3298564050164496,"PPS Food Service (7.27.20) Dinner - Chicken alfredo, vegetable/fruit, milk *Breakfast - Biscuit/egg, fruit, milk",https://facebook.com/story.php?story_fbid=3298564050164496&id=242089932478605,,0.0,"PPS Food Service (7.27.20) Dinner - Chicken alfredo, vegetable/fruit, milk *Breakfast - Biscuit/egg, fruit, milk",2020-07-27 07:00:29,,
142,0.0,,2.0,,3289778274376407,"PPS Food Service (7.24.20) Dinner - Cheeseburger, vegetable/fruit, milk *Breakfast - Breakfast burrito, fruit, milk",https://facebook.com/story.php?story_fbid=3289778274376407&id=242089932478605,,0.0,"PPS Food Service (7.24.20) Dinner - Cheeseburger, vegetable/fruit, milk *Breakfast - Breakfast burrito, fruit, milk",2020-07-24 07:00:17,,
143,1.0,https://scontent-atl3-1.xx.fbcdn.net/v/t1.0-9/112872977_3288038421217059_7317490294113265189_n.png?_nc_cat=104&_nc_sid=2d5d41&_nc_ohc=eCDxcZ09r5kAX_MKUjj&_nc_ht=scontent-atl3-1.xx&oh=20855aaba8df673edc5b91f4a2f55bd5&oe=5F83100D,14.0,https://forms.gle/kT6m5zBkgzkZj9Hw7,3288038417883726,"Pender students, are you future business leaders? Would you like to see the Future Business Leaders of America organization come to PPS? Please fill out a short survey here: https://forms.gle/kT6m5zBkgzkZj9Hw7",,,0.0,"Pender students, are you future business leaders? Would you like to see the Future Business Leaders of America organization come to PPS? Please fill out a short survey here: https://forms.gle/kT6m5zBkgzkZj9Hw7",2020-07-23 15:32:16,,
144,0.0,,0.0,,3286885277999040,"PPS Food Service (7.23.20) Dinner - Saucy sub, vegetable/fruit, milk *Breakfast - Omelet, fruit, milk",https://facebook.com/story.php?story_fbid=3286885277999040&id=242089932478605,,0.0,"PPS Food Service (7.23.20) Dinner - Saucy sub, vegetable/fruit, milk *Breakfast - Omelet, fruit, milk",2020-07-23 07:00:23,,
145,0.0,,0.0,https://twitter.com/nsaahome/status/1286012039299837952?s=21,3285107674843467,"Fall sports classifications have been released by the NSAA. Follow the links below:

https://twitter.com/nsaahome/status/1286012039299837952?s=21",https://facebook.com/story.php?story_fbid=3285107674843467&id=242089932478605,,0.0,"Fall sports classifications have been released by the NSAA. Follow the links below:

https://twitter.com/nsaahome/status/1286012039299837952?s=21",2020-07-22 15:06:27,,
146,0.0,,0.0,,3283980664956168,"PPS Food Service (7.22.20) Dinner - Hot dog, vegetable/fruit, milk *Breakfast - Dutch waffle, fruit, milk",https://facebook.com/story.php?story_fbid=3283980664956168&id=242089932478605,,0.0,"PPS Food Service (7.22.20) Dinner - Hot dog, vegetable/fruit, milk *Breakfast - Dutch waffle, fruit, milk",2020-07-22 07:00:08,,
147,0.0,,0.0,,3281108611910040,"PPS Food Service (7.21.20) Dinner - Pizza, vegetable/fruit, milk *Breakfast - Poptart, fruit, milk",https://facebook.com/story.php?story_fbid=3281108611910040&id=242089932478605,,0.0,"PPS Food Service (7.21.20) Dinner - Pizza, vegetable/fruit, milk *Breakfast - Poptart, fruit, milk",2020-07-21 07:00:04,,
148,0.0,,1.0,https://forms.gle/PNdPYBw9K5spMzth8,3279554128732155,"Below is a link to a survey. If you have children that attend PPS, please complete it. Students, this is not a survey for you. Only adults with children that attend PPS should complete it. Thank you in advance for your prompt responses!

https://forms.gle/PNdPYBw9K5spMzth8",https://facebook.com/story.php?story_fbid=3279554128732155&id=242089932478605,,0.0,"Below is a link to a survey. If you have children that attend PPS, please complete it. Students, this is not a survey for you. Only adults with children that attend PPS should complete it. Thank you in advance for your prompt responses!

https://forms.gle/PNdPYBw9K5spMzth8",2020-07-20 16:28:24,,
149,0.0,,0.0,,3279389848748583,"Sports Physical reminder:
New students to the district as well as all incoming 7th and 9th graders need physicals before students can begin fall sports practice . Physical forms can be found in the school office.",https://facebook.com/story.php?story_fbid=3279389848748583&id=242089932478605,,0.0,"Sports Physical reminder:
New students to the district as well as all incoming 7th and 9th graders need physicals before students can begin fall sports practice . Physical forms can be found in the school office.",2020-07-20 15:04:26,,
150,0.0,,0.0,,3278298278857740,"PPS Food Service (7.20.20) Dinner - Mini corn dogs, vegetable/fruit, milk *Breakfast - Breakfast bites, fruit, milk",https://facebook.com/story.php?story_fbid=3278298278857740&id=242089932478605,,0.0,"PPS Food Service (7.20.20) Dinner - Mini corn dogs, vegetable/fruit, milk *Breakfast - Breakfast bites, fruit, milk",2020-07-20 07:00:08,,
151,0.0,https://scontent-atl3-1.xx.fbcdn.net/v/t1.0-9/fr/cp0/e15/q65/109819524_620792621884169_5487312552342598714_n.jpg?_nc_cat=108&_nc_sid=110474&_nc_ohc=1Gq4qC15HbkAX8o7Wuh&_nc_ht=scontent-atl3-1.xx&tp=14&oh=edfbeb3b9b76ff2d814c2b85924037fc&oe=5F828304,1.0,,3271631369524431,,https://facebook.com/story.php?story_fbid=3271631369524431&id=242089932478605,"Pender Pendragons Lady Basketball
July 17 at 9:45 PM ·

3 weeks from today we will have our golf tournament. Get your team and sign up!",0.0,"Pender Pendragons Lady Basketball
July 17 at 9:45 PM ·

3 weeks from today we will have our golf tournament. Get your team and sign up!",2020-07-17 22:47:29,,
152,0.0,,0.0,https://docs.google.com/spreadsheets/d/1vkJ6nptpzaOotCzrdO-xuyD1rqMwWTM3MV8u7nOe11Q/edit?usp=sharing,3270107553010146,JUNIOR HIGH Football players click this link to sign up for equipment checkout August 7: https://docs.google.com/spreadsheets/d/1vkJ6nptpzaOotCzrdO-xuyD1rqMwWTM3MV8u7nOe11Q/edit?usp=sharing,https://facebook.com/story.php?story_fbid=3270107553010146&id=242089932478605,,0.0,JUNIOR HIGH Football players click this link to sign up for equipment checkout August 7: https://docs.google.com/spreadsheets/d/1vkJ6nptpzaOotCzrdO-xuyD1rqMwWTM3MV8u7nOe11Q/edit?usp=sharing,2020-07-17 10:08:02,,
153,0.0,,1.0,,3269678289719739,"PPS Food Service (7.17.20) Dinner - Mac and cheese, vegetable/fruit, milk *Breakfast - Mini waffle, fruit, milk",https://facebook.com/story.php?story_fbid=3269678289719739&id=242089932478605,,0.0,"PPS Food Service (7.17.20) Dinner - Mac and cheese, vegetable/fruit, milk *Breakfast - Mini waffle, fruit, milk",2020-07-17 07:00:23,,
154,0.0,https://scontent-atl3-1.xx.fbcdn.net/v/t1.0-9/108950416_3268556633165238_520342052428316692_n.png?_nc_cat=111&_nc_sid=2d5d41&_nc_ohc=iCGwFKYLprsAX-EXtpS&_nc_ht=scontent-atl3-1.xx&oh=0f71b7fc8aee7b12449e88714c2129ce&oe=5F8228F4,1.0,https://docs.google.com/spreadsheets/d/1gTWtADly0xKFaUn1m5qfxcWvgrvxZk-_IgLxCbXL2X4/edit?usp=sharing,3268556629831905,Sandals Order Form Link https://docs.google.com/spreadsheets/d/1gTWtADly0xKFaUn1m5qfxcWvgrvxZk-_IgLxCbXL2X4/edit?usp=sharing,,,0.0,Sandals Order Form Link https://docs.google.com/spreadsheets/d/1gTWtADly0xKFaUn1m5qfxcWvgrvxZk-_IgLxCbXL2X4/edit?usp=sharing,2020-07-16 20:10:18,,
155,0.0,https://scontent-atl3-1.xx.fbcdn.net/v/t1.0-9/109237439_3268556339831934_3087254834518851172_n.png?_nc_cat=103&_nc_sid=2d5d41&_nc_ohc=rKlOfNmYZokAX_gpc1Y&_nc_ht=scontent-atl3-1.xx&oh=13b204aaff7446af560cc90523e4e4f1&oe=5F83DF32,1.0,https://docs.google.com/spreadsheets/d/1gTWtADly0xKFaUn1m5qfxcWvgrvxZk-_IgLxCbXL2X4/edit?usp=sharing,3268556333165268,https://docs.google.com/spreadsheets/d/1gTWtADly0xKFaUn1m5qfxcWvgrvxZk-_IgLxCbXL2X4/edit?usp=sharing,,,0.0,https://docs.google.com/spreadsheets/d/1gTWtADly0xKFaUn1m5qfxcWvgrvxZk-_IgLxCbXL2X4/edit?usp=sharing,2020-07-16 20:10:10,,
156,0.0,,0.0,https://www.cdc.gov/coronavirus/2019-ncov/prevent-getting-sick/diy-cloth-face-coverings.html,3268050206549214,"The link to the CDC website in the letter posted earlier today is not working. Sorry for the inconvenience. A functional link is below.

https://www.cdc.gov/coronavirus/2019-ncov/prevent-getting-sick/diy-cloth-face-coverings.html",https://facebook.com/story.php?story_fbid=3268050206549214&id=242089932478605,,0.0,"The link to the CDC website in the letter posted earlier today is not working. Sorry for the inconvenience. A functional link is below.

https://www.cdc.gov/coronavirus/2019-ncov/prevent-getting-sick/diy-cloth-face-coverings.html",2020-07-16 15:41:12,,
157,0.0,,5.0,https://drive.google.com/file/d/1YnNl52ZdybV09n7fQt0nkqSVUKWK52qo/view?usp=sharing,3267988709888697,"Below is a link to a letter written to students, parents, and family members. It contains information about PPS's Return to School plan. Please access and read it as soon as you can. Thanks!

https://drive.google.com/file/d/1YnNl52ZdybV09n7fQt0nkqSVUKWK52qo/view?usp=sharing",https://facebook.com/story.php?story_fbid=3267988709888697&id=242089932478605,,0.0,"Below is a link to a letter written to students, parents, and family members. It contains information about PPS's Return to School plan. Please access and read it as soon as you can. Thanks!

https://drive.google.com/file/d/1YnNl52ZdybV09n7fQt0nkqSVUKWK52qo/view?usp=sharing",2020-07-16 15:10:16,,
158,0.0,,1.0,,3266834880004080,"PPS Food Service (7.16.20) Dinner - Chicken patty, vegetable/fruit, milk *Breakfast - Yogurt, fruit, milk",https://facebook.com/story.php?story_fbid=3266834880004080&id=242089932478605,,0.0,"PPS Food Service (7.16.20) Dinner - Chicken patty, vegetable/fruit, milk *Breakfast - Yogurt, fruit, milk",2020-07-16 07:00:10,,
159,8.0,https://scontent-atl3-1.xx.fbcdn.net/v/t1.0-9/fr/cp0/e15/q65/109460033_3265752103445691_438055310405492594_o.jpg?_nc_cat=108&_nc_sid=8024bb&_nc_ohc=zImj1LhHEtYAX_awMZl&_nc_ht=scontent-atl3-1.xx&tp=14&oh=386d8665f74b44b13dac45ebcb2944a2&oe=5F8234CD,18.0,,3265752290112339,2020-2021 School Supply List,https://facebook.com/story.php?story_fbid=3265752290112339&id=242089932478605,,0.0,2020-2021 School Supply List,2020-07-15 21:09:48,,
160,0.0,,3.0,https://dakotasportsonline.chipply.com/pendercc,3265401923480709,"The Pendragon Cross-Country online store is now available! Click on the link to get started. Note: Some items are NOT sport specific so they can be worn to support any Pendragon activity! Store will close August 10th.

https://dakotasportsonline.chipply.com/pendercc",https://facebook.com/story.php?story_fbid=3265401923480709&id=242089932478605,,0.0,"The Pendragon Cross-Country online store is now available! Click on the link to get started. Note: Some items are NOT sport specific so they can be worn to support any Pendragon activity! Store will close August 10th.

https://dakotasportsonline.chipply.com/pendercc",2020-07-15 18:16:20,,
161,0.0,,0.0,,3263937276960507,"PPS Food Service (7.15.20) Dinner - Crispito, vegetable/fruit, milk *Breakfast - French toast, fruit, milk",https://facebook.com/story.php?story_fbid=3263937276960507&id=242089932478605,,0.0,"PPS Food Service (7.15.20) Dinner - Crispito, vegetable/fruit, milk *Breakfast - French toast, fruit, milk",2020-07-15 07:00:05,,
162,0.0,,9.0,https://docs.google.com/document/d/1DZK8bizZOEEFBFpSr7AikR9AWmVi2-k38BvvaUzWwJQ/edit?usp=sharing,3261857957168439,"Linked below is PPS's ""Return to School Plan"". It was made public on July 10 and approved by the School Board on July 13. It is being provided again to make sure families have access to it. Please note, the change from 48 to 72 hours for symptoms consistent with COVID-19.

https://docs.google.com/document/d/1DZK8bizZOEEFBFpSr7AikR9AWmVi2-k38BvvaUzWwJQ/edit?usp=sharing",https://facebook.com/story.php?story_fbid=3261857957168439&id=242089932478605,,0.0,"Linked below is PPS's ""Return to School Plan"". It was made public on July 10 and approved by the School Board on July 13. It is being provided again to make sure families have access to it. Please note, the change from 48 to 72 hours for symptoms consistent with COVID-19.

https://docs.google.com/document/d/1DZK8bizZOEEFBFpSr7AikR9AWmVi2-k38BvvaUzWwJQ/edit?usp=sharing",2020-07-14 13:36:25,,
163,0.0,,1.0,,3260981650589403,"PPS Food Service (7.14.20) Dinner - Tavern, vegetable/fruit, milk *Breakfast - Cinni mini, fruit, milk",https://facebook.com/story.php?story_fbid=3260981650589403&id=242089932478605,,0.0,"PPS Food Service (7.14.20) Dinner - Tavern, vegetable/fruit, milk *Breakfast - Cinni mini, fruit, milk",2020-07-14 07:00:01,,
164,0.0,,1.0,,3258119354208966,"PPS Food Service (7.13.20) Dinner - Spaghetti, vegetable/fruit, milk *Breakfast - Cereal, fruit, milk",https://facebook.com/story.php?story_fbid=3258119354208966&id=242089932478605,,0.0,"PPS Food Service (7.13.20) Dinner - Spaghetti, vegetable/fruit, milk *Breakfast - Cereal, fruit, milk",2020-07-13 07:00:13,,
165,5.0,https://scontent-atl3-1.xx.fbcdn.net/v/t1.0-9/fr/cp0/e15/q65/107606907_3250569551630613_4778580311651685530_n.jpg?_nc_cat=108&_nc_sid=110474&_nc_ohc=EduD6Xaf7M0AX_U5Vjd&_nc_ht=scontent-atl3-1.xx&tp=14&oh=a0148784925cfdb469d9315f72bc99eb&oe=5F85021D,32.0,https://bit.ly/PPSReturnToSchool,3250569798297255,"The PPS Return to School Plan is available at the following link: https://bit.ly/PPSReturnToSchool. Thank you to the students, staff and parents that have helped with the development of this plan. The plan is in draft form and will be presented to the Board of Education on Monday evening for approval. Please contact school administration if you have any questions or concerns. As always, our goal is to provide a safe learning/working environment for our students and staff. Thank you!",https://facebook.com/story.php?story_fbid=3250569798297255&id=242089932478605,,0.0,"The PPS Return to School Plan is available at the following link: https://bit.ly/PPSReturnToSchool. Thank you to the students, staff and parents that have helped with the development of this plan. The plan is in draft form and will be presented to the Board of Education on Monday evening for approval. Please contact school administration if you have any questions or concerns. As always, our goal is to provide a safe learning/working environment for our students and staff. Thank you!",2020-07-10 14:54:46,,
166,0.0,,0.0,,3249655681722000,"PPS Food Service (7.10.20) Dinner - Chicken strips, vegetable/fruit, milk *Breakfast - Donut, fruit, milk",https://facebook.com/story.php?story_fbid=3249655681722000&id=242089932478605,,0.0,"PPS Food Service (7.10.20) Dinner - Chicken strips, vegetable/fruit, milk *Breakfast - Donut, fruit, milk",2020-07-10 07:00:27,,
167,0.0,,1.0,,3247127105308191,"PPS Food Service (7.9.20) Dinner - Goulash, vegetable/fruit, milk *Breakfast - Breakfast pizza, fruit, milk",https://facebook.com/story.php?story_fbid=3247127105308191&id=242089932478605,,0.0,"PPS Food Service (7.9.20) Dinner - Goulash, vegetable/fruit, milk *Breakfast - Breakfast pizza, fruit, milk",2020-07-09 07:00:08,,
168,0.0,,1.0,,3244403685580533,"PPS Food Service (7.8.20) Dinner - Chicken fried steak, vegetable/fruit, milk *Breakfast - Mini french toast, fruit, milk",https://facebook.com/story.php?story_fbid=3244403685580533&id=242089932478605,,0.0,"PPS Food Service (7.8.20) Dinner - Chicken fried steak, vegetable/fruit, milk *Breakfast - Mini french toast, fruit, milk",2020-07-08 07:00:21,,
169,0.0,,2.0,,3241507639203471,"PPS Food Service (7.7.20) Dinner - Chicken and noodles, vegetable/fruit, milk *Breakfast - Apple frudel, fruit, milk",https://facebook.com/story.php?story_fbid=3241507639203471&id=242089932478605,,0.0,"PPS Food Service (7.7.20) Dinner - Chicken and noodles, vegetable/fruit, milk *Breakfast - Apple frudel, fruit, milk",2020-07-07 07:00:06,,
170,0.0,,0.0,,3238648072822761,"PPS Food Service (7.6.20) Dinner - BBQ rib, vegetable/fruit, milk *Breakfast - Breakfast stick, fruit, milk",https://facebook.com/story.php?story_fbid=3238648072822761&id=242089932478605,,0.0,"PPS Food Service (7.6.20) Dinner - BBQ rib, vegetable/fruit, milk *Breakfast - Breakfast stick, fruit, milk",2020-07-06 07:00:09,,
171,0.0,,1.0,,3230381206982781,No summer lunch program today. Happy 4th of July weekend!,https://facebook.com/story.php?story_fbid=3230381206982781&id=242089932478605,,0.0,No summer lunch program today. Happy 4th of July weekend!,2020-07-03 07:00:07,,
172,1.0,,3.0,https://penderhs-football2020.itemorder.com/sale,3228205230533712,"Independence Weekend Surprise!!! If you didn't get an order in for the football store, it has reopened until Sunday Night at midnight. One more chance.

https://penderhs-football2020.itemorder.com/sale",https://facebook.com/story.php?story_fbid=3228205230533712&id=242089932478605,,0.0,"Independence Weekend Surprise!!! If you didn't get an order in for the football store, it has reopened until Sunday Night at midnight. One more chance.

https://penderhs-football2020.itemorder.com/sale",2020-07-02 12:15:26,,
173,0.0,,1.0,,3227559710598264,"PPS Food Service (7.2.20) Dinner - Grilled cheese, vegetable/fruit, milk *Breakfast - Pancakes, fruit, milk",https://facebook.com/story.php?story_fbid=3227559710598264&id=242089932478605,,0.0,"PPS Food Service (7.2.20) Dinner - Grilled cheese, vegetable/fruit, milk *Breakfast - Pancakes, fruit, milk",2020-07-02 07:00:04,,
