,comments,image,likes,link,post_id,post_text,post_url,shared_text,shares,text,time,video,video_thumbnail
62,2.0,https://scontent-atl3-1.xx.fbcdn.net/v/t1.0-9/106134335_4908087679217055_6715222718472706536_n.png?_nc_cat=108&_nc_sid=8024bb&_nc_ohc=V_N318YotwkAX-tau0i&_nc_ht=scontent-atl3-1.xx&oh=9a7d25b674ae69029ccf17e919551c14&oe=5F82192D,6.0,https://us02web.zoom.us/j/81054098102,4908098452549311,Join us TONIGHT to learn more about Renwick Academy and the learning opportunities available in our new virtual program for ALL K-12 Kansas students. Click the following link attend our online parent meeting TONIGHT at 6:30 p.m. at https://us02web.zoom.us/j/81054098102,https://facebook.com/story.php?story_fbid=4908098452549311&id=278623088830227,,0.0,Join us TONIGHT to learn more about Renwick Academy and the learning opportunities available in our new virtual program for ALL K-12 Kansas students. Click the following link attend our online parent meeting TONIGHT at 6:30 p.m. at https://us02web.zoom.us/j/81054098102,2020-06-30 10:00:17,,
63,0.0,https://scontent-atl3-1.xx.fbcdn.net/v/t1.0-9/104495421_4907039872655169_8941977576688653855_n.png?_nc_cat=105&_nc_sid=8024bb&_nc_ohc=rTH9epjNeswAX8P4dLI&_nc_ht=scontent-atl3-1.xx&oh=59ba9992e773aeb633157771abb9fffa&oe=5F813C10,8.0,,4907041075988382,,https://facebook.com/story.php?story_fbid=4907041075988382&id=278623088830227,,0.0,,2020-06-29 09:00:20,,
64,0.0,https://scontent-atl3-1.xx.fbcdn.net/v/t1.0-9/104307338_4860508810641609_2589294083861905509_n.png?_nc_cat=107&_nc_sid=8024bb&_nc_ohc=FZeKutfEluEAX-qUFm2&_nc_ht=scontent-atl3-1.xx&oh=959f1460557b11bb10c5a51cc73dfa13&oe=5F830CC9,3.0,https://us02web.zoom.us/j/81054098102,4860509333974890,"Wanting an online learning opportunity for your student this school year? Look no further than Renwick Academy. Our virtual program offers online learning for K-12 students throughout the state, with the support of highly-certified Kansas educators. Find out more by attending our parent meeting at 6:30 p.m. on Tuesday, June 30 at https://us02web.zoom.us/j/81054098102",https://facebook.com/story.php?story_fbid=4860509333974890&id=278623088830227,,0.0,"Wanting an online learning opportunity for your student this school year? Look no further than Renwick Academy. Our virtual program offers online learning for K-12 students throughout the state, with the support of highly-certified Kansas educators. Find out more by attending our parent meeting at 6:30 p.m. on Tuesday, June 30 at https://us02web.zoom.us/j/81054098102",2020-06-25 10:00:13,,
65,1.0,https://scontent-atl3-1.xx.fbcdn.net/v/t1.0-9/103358438_4860504827308674_2894245474130584953_n.png?_nc_cat=106&_nc_sid=8024bb&_nc_ohc=pWv9P431sUMAX9pQ4Un&_nc_ht=scontent-atl3-1.xx&oh=9856c90cfe7dc6a6c23ac7affee05b4c&oe=5F8117B2,6.0,https://us02web.zoom.us/j/81054098102,4860505567308600,"Renwick Academy is a virtual program, open to all Kansas resident students, K-12th grade, throughout the state. We offer many benefits to students and families that choose us as their educational partner:
World-class curriculum provided for students
A tuition-free virtual program (with minimal student fees) that provides books, materials, manipulatives, science materials, and the loan of a computer for your family (some materials are online books and materials)
Self-paced, individualized instruction, including assistance for students who struggle, as well as opportunities for those who excel
Partnership with Kansas-certified teachers to support daily instruction, as well as accountability to the educational process
Smart use of technology
No time and distance barriers; school anytime, anywhere.

Want to learn more? Join us for our virtual parent meeting at 6:30 p.m. on Tuesday, June 30 at https://us02web.zoom.us/j/81054098102",https://facebook.com/story.php?story_fbid=4860505567308600&id=278623088830227,,0.0,"Renwick Academy is a virtual program, open to all Kansas resident students, K-12th grade, throughout the state. We offer many benefits to students and families that choose us as their educational partner:
World-class curriculum provided for students
A tuition-free virtual program (with minimal student fees) that provides books, materials, manipulatives, science materials, and the loan of a computer for your family (some materials are online books and materials)
Self-paced, individualized instruction, including assistance for students who struggle, as well as opportunities for those who excel
Partnership with Kansas-certified teachers to support daily instruction, as well as accountability to the educational process
Smart use of technology
No time and distance barriers; school anytime, anywhere.

Want to learn more? Join us for our virtual parent meeting at 6:30 p.m. on Tuesday, June 30 at https://us02web.zoom.us/j/81054098102",2020-06-23 12:00:09,,
66,0.0,https://scontent-atl3-1.xx.fbcdn.net/v/t1.0-9/101553873_4779541885404969_5869626143505645568_n.png?_nc_cat=102&_nc_sid=8024bb&_nc_ohc=wqi0T5qVUNIAX9G6W2G&_nc_oc=AQmtST03uIpxOf9jNXZnCvjhHDohAlTfOdXzhrPWF9OVCfO8Cii5fCI0cuLZIAMNPlI&_nc_ht=scontent-atl3-1.xx&oh=101d615817b529005a4e9550f18cd201&oe=5F827FC2,5.0,,4779542525404905,,https://facebook.com/story.php?story_fbid=4779542525404905&id=278623088830227,,0.0,,2020-06-22 09:00:16,,
67,0.0,https://scontent-atl3-1.xx.fbcdn.net/v/t1.0-9/103683237_4860437153982108_6161933270800715346_n.png?_nc_cat=105&_nc_sid=8024bb&_nc_ohc=9GWpJFyT6n0AX-zPxxe&_nc_ht=scontent-atl3-1.xx&oh=8a7dbaf6e8dd644e2f3cf236c5d852d0&oe=5F816E7E,7.0,https://us02web.zoom.us/j/81054098102,4860438680648622,"Flexible scheduling and the ability for K-12 students to learn in their own way with the support of highly qualified state-certified teachers. It's the virtual learning experience available through Renwick Academy, our new online program launching in the 2020-2021 school year. USD 267 students - as well as K-12 students throughout Kansas - are eligible to enroll. For more information, attend our online parent meeting at 6:30 p.m. on Tuesday, June 30 at https://us02web.zoom.us/j/81054098102 .",https://facebook.com/story.php?story_fbid=4860438680648622&id=278623088830227,,0.0,"Flexible scheduling and the ability for K-12 students to learn in their own way with the support of highly qualified state-certified teachers. It's the virtual learning experience available through Renwick Academy, our new online program launching in the 2020-2021 school year. USD 267 students - as well as K-12 students throughout Kansas - are eligible to enroll. For more information, attend our online parent meeting at 6:30 p.m. on Tuesday, June 30 at https://us02web.zoom.us/j/81054098102 .",2020-06-18 12:00:27,,
68,0.0,,16.0,https://us02web.zoom.us/j/81054098102,4860434160649074,"Our district is happy to announce the launch of our virtual learning program - Renwick Academy. This online curriculum will be available for K-12 students for a minimal enrollment fee beginning with the 2020-2021 school year and is open to USD 267 students, as well as any Kansas students. For more information, plan to join us for an online meeting at 6:30 p.m. on Tuesday, June 30 at the following link: https://us02web.zoom.us/j/81054098102 .",https://facebook.com/story.php?story_fbid=4860434160649074&id=278623088830227,,0.0,"Our district is happy to announce the launch of our virtual learning program - Renwick Academy. This online curriculum will be available for K-12 students for a minimal enrollment fee beginning with the 2020-2021 school year and is open to USD 267 students, as well as any Kansas students. For more information, plan to join us for an online meeting at 6:30 p.m. on Tuesday, June 30 at the following link: https://us02web.zoom.us/j/81054098102 .",2020-06-16 11:00:47,,
69,0.0,https://scontent-atl3-1.xx.fbcdn.net/v/t1.0-9/94518220_4646848955340930_9198222357636841472_n.png?_nc_cat=101&_nc_sid=8024bb&_nc_ohc=5ocbIdP3Q04AX_wQgdo&_nc_ht=scontent-atl3-1.xx&oh=8ffe66a2fcdc6c4c198e70891be4b5c8&oe=5F8343D1,3.0,,4646849768674182,,https://facebook.com/story.php?story_fbid=4646849768674182&id=278623088830227,,0.0,,2020-06-15 09:00:16,,
70,0.0,https://scontent-atl3-1.xx.fbcdn.net/v/t1.0-9/95142881_4646843705341455_7857607788602589184_n.png?_nc_cat=100&_nc_sid=8024bb&_nc_ohc=U6RuW9zxU_wAX-_Dh-d&_nc_ht=scontent-atl3-1.xx&oh=43e7c3e6b42a96d46b27106e8b6849b0&oe=5F82FC89,22.0,,4646844362008056,,https://facebook.com/story.php?story_fbid=4646844362008056&id=278623088830227,,0.0,,2020-06-08 09:00:21,,
71,0.0,https://scontent-atl3-1.xx.fbcdn.net/v/t1.0-9/101116586_4779529928739498_2083482300212838400_n.png?_nc_cat=107&_nc_sid=8024bb&_nc_ohc=22vpY5m238AAX8Ut6DL&_nc_ht=scontent-atl3-1.xx&oh=4c320a1c95e925daf2a373c764b22593&oe=5F82ADDC,29.0,,4779530538739437,,https://facebook.com/story.php?story_fbid=4779530538739437&id=278623088830227,,0.0,,2020-06-01 10:00:23,,
72,4.0,https://scontent-atl3-1.xx.fbcdn.net/v/t1.0-9/fr/cp0/e15/q65/82793934_1205817283107685_4692629139591528448_o.jpg?_nc_cat=104&_nc_sid=110474&_nc_ohc=SlHFihuw2_YAX_824IP&_nc_ht=scontent-atl3-1.xx&tp=14&oh=9eeca138fd04d4675122ac426bc3ade3&oe=5F81297F,43.0,https://m.youtube.com/watch?v=qWk8Ps7pTGA,4785860671439757,Congratulations Austin!,https://facebook.com/story.php?story_fbid=4785860671439757&id=278623088830227,"Renwick Agriculture and FFA Program
May 29 at 8:57 PM Â·

â­ï¸â­ï¸Tonight Austin Simon was named the Kansas FFA STAR in Agribusiness!â­ï¸â­ï¸ This is one of the *three* highest awards a Kansas FFA member can receive from the state level. To say we are proud is an understatement. During National FFA Convention last fall Austin was watching the National Star Awards presentation and turned to me and said, â€œHey, I can do that!â€ I said, â€œI know you can,â€ and- you guys- HE DID!

We are so proud of him, not just because of this award, but more importantly the person he is. Hard working, honest, dedicated and funny! Congratulations, Austin!

Fast forward to 1:32:00 in the video below to see Austinâ€™s interview about his project!

This award is in addition to and separate from the State Proficiency Award he received earlier this week!

https://m.youtube.com/watch?v=qWk8Ps7pTGA",0.0,"Congratulations Austin!

Renwick Agriculture and FFA Program
May 29 at 8:57 PM Â·

â­ï¸â­ï¸Tonight Austin Simon was named the Kansas FFA STAR in Agribusiness!â­ï¸â­ï¸ This is one of the *three* highest awards a Kansas FFA member can receive from the state level. To say we are proud is an understatement. During National FFA Convention last fall Austin was watching the National Star Awards presentation and turned to me and said, â€œHey, I can do that!â€ I said, â€œI know you can,â€ and- you guys- HE DID!

We are so proud of him, not just because of this award, but more importantly the person he is. Hard working, honest, dedicated and funny! Congratulations, Austin!

Fast forward to 1:32:00 in the video below to see Austinâ€™s interview about his project!

This award is in addition to and separate from the State Proficiency Award he received earlier this week!

https://m.youtube.com/watch?v=qWk8Ps7pTGA",2020-05-29 21:59:00,,
73,0.0,,28.0,https://www.kansas.com/sports/varsity-kansas/article242981611.html,4779326072093217,There's been a lot of talk about what might have been. But here's a great look at some extraordinary moments and accomplishments. Check out just a couple of the many instances where our Andale and Garden Plain athletes made us #RenwickProud in 2019-2020.,https://facebook.com/story.php?story_fbid=4779326072093217&id=278623088830227,"KANSAS.COM
Moments of the Year: Each of the 60 Wichita-area high schoolsâ€™ greatest achievements",2.0,"There's been a lot of talk about what might have been. But here's a great look at some extraordinary moments and accomplishments. Check out just a couple of the many instances where our Andale and Garden Plain athletes made us #RenwickProud in 2019-2020.

KANSAS.COM
Moments of the Year: Each of the 60 Wichita-area high schoolsâ€™ greatest achievements",2020-05-28 10:53:12,,
74,8.0,https://scontent-atl3-1.xx.fbcdn.net/v/t1.0-9/fr/cp0/e15/q65/101382893_1204160839939996_2070898630151110656_o.jpg?_nc_cat=103&_nc_sid=2d5d41&_nc_ohc=oCnBFXFfFWoAX_0Rho3&_nc_ht=scontent-atl3-1.xx&tp=14&oh=3cc2a868a9727e278b77a6d78d14bb86&oe=5F8315E6,63.0,,4777175462308278,"Way to represent our districtâ€™s outstanding FFA program with a state title, Austin! We are #RenwickProud of you!",https://facebook.com/story.php?story_fbid=4777175462308278&id=278623088830227,"Renwick Agriculture and FFA Program
May 27 at 9:07 PM Â·

Congratulations to Austin Simon! State Winner for his chicken coop business Asimeâ€™s Coops! Austin will take his application to the National FFA Convention in the fall. Austin has designed, built, and sold over 140 chicken coops throughout south central Kansas as well as surrounding states. To receive this award he had to keep records of all income and expenses with his business as well as make business goals and overcome business challenges. Hours of completing the application certainly paid off! Renwick FFA is proud to call you our own!",4.0,"Way to represent our districtâ€™s outstanding FFA program with a state title, Austin! We are #RenwickProud of you!

Renwick Agriculture and FFA Program
May 27 at 9:07 PM Â·

Congratulations to Austin Simon! State Winner for his chicken coop business Asimeâ€™s Coops! Austin will take his application to the National FFA Convention in the fall. Austin has designed, built, and sold over 140 chicken coops throughout south central Kansas as well as surrounding states. To receive this award he had to keep records of all income and expenses with his business as well as make business goals and overcome business challenges. Hours of completing the application certainly paid off! Renwick FFA is proud to call you our own!",2020-05-27 22:10:02,,
75,0.0,https://scontent-atl3-1.xx.fbcdn.net/v/t1.0-9/95703466_4646457552046737_5000557657396871168_n.png?_nc_cat=100&_nc_sid=8024bb&_nc_ohc=KmnCIwqu1IQAX9AVibC&_nc_ht=scontent-atl3-1.xx&oh=c7405e2314682b5860a1f1c33c91d763&oe=5F836544,30.0,,4646458408713318,,https://facebook.com/story.php?story_fbid=4646458408713318&id=278623088830227,,0.0,,2020-05-25 09:00:03,,
76,0.0,https://scontent-atl3-1.xx.fbcdn.net/v/t1.0-9/98313565_4738492479509910_9003224314048151552_n.png?_nc_cat=104&_nc_sid=8024bb&_nc_ohc=IWXZSiBH2moAX-gGndv&_nc_ht=scontent-atl3-1.xx&oh=de4d647710445a5419fdcedffc359c43&oe=5F828892,41.0,,4738492719509886,,https://facebook.com/story.php?story_fbid=4738492719509886&id=278623088830227,,0.0,,2020-05-22 10:00:36,,
77,1.0,https://scontent-atl3-1.xx.fbcdn.net/v/t1.0-9/98004553_4750194251673066_3353446040207360000_n.png?_nc_cat=105&_nc_sid=8024bb&_nc_ohc=QhYtbZucc6oAX_zBTFE&_nc_ht=scontent-atl3-1.xx&oh=f5096832280b38a9141d61a9dabbb179&oe=5F81CE8B,48.0,,4750038458355312,Our district offers its congratulations to fellow Kansas educator @TabathaRosproy on being named the 2020 National Teacher of the Year. The Winfield Early Learning Center teacher is the first preschool teacher to ever hold the National Teacher of the Year title. This prestigious honor also marks the first time in nearly 60 years a Kansas educator received the national title. @ksdehq @CCSSO #NTOY20,https://facebook.com/story.php?story_fbid=4750038458355312&id=278623088830227,,0.0,Our district offers its congratulations to fellow Kansas educator @TabathaRosproy on being named the 2020 National Teacher of the Year. The Winfield Early Learning Center teacher is the first preschool teacher to ever hold the National Teacher of the Year title. This prestigious honor also marks the first time in nearly 60 years a Kansas educator received the national title. @ksdehq @CCSSO #NTOY20,2020-05-21 10:18:02,,
78,5.0,,32.0,,4746130752079416,"A sweet send off to students from Renwick USD 267 Nutrition & Wellness is in the works on this final day of food service. A huge thanks goes out to all the families who participated, and to our nutrition and transportation staff who made the preparation & delivery of meals possible during the past two months! #RenwickProud",https://facebook.com/story.php?story_fbid=4746130752079416&id=278623088830227,"Renwick USD 267 Nutrition & Wellness was live.
May 20 at 10:17 AM Â·

Last day of meal service.",0.0,"A sweet send off to students from Renwick USD 267 Nutrition & Wellness is in the works on this final day of food service. A huge thanks goes out to all the families who participated, and to our nutrition and transportation staff who made the preparation & delivery of meals possible during the past two months! #RenwickProud

Renwick USD 267 Nutrition & Wellness was live.
May 20 at 10:17 AM Â·

Last day of meal service.",2020-05-20 11:37:00,https://video-atl3-1.xx.fbcdn.net/v/t42.26565-2/10000000_306584787250660_2299963867812324388_n.mp4?_nc_cat=108&_nc_sid=985c63&efg=eyJ2ZW5jb2RlX3RhZyI6Im9lcF9zZCJ9&_nc_ohc=8blCDU0YcwEAX9n5dnD&_nc_ht=video-atl3-1.xx&oh=4c6935a8ba95eedcc03087c93847a9d4&oe=5F5D3297,
79,5.0,https://scontent-atl3-1.xx.fbcdn.net/v/t1.0-9/fr/cp0/e15/q65/97660626_4742321432460348_8452865632780681216_n.jpg?_nc_cat=104&_nc_sid=8024bb&_nc_ohc=OmLHG68fPgYAX_eAM9j&_nc_ht=scontent-atl3-1.xx&tp=14&oh=fdcde06fc76b49bacd96e7330155948d&oe=5F80E6CB,36.0,,4742322302460261,"Renwick FFA members and chapter are receiving some great kudos to finish out the school year.

Austin Simon is this year's recipient of the South Central District's STAR in Ag Business award, and was also named the winner of the South Central District proficiency award area of Ag Mechanics Design and Fabrication. Congratulations, Austin!

Congratulations also go to Laura Doll for winning the South Central District proficiency award area of Ag Mechanics, Repair and Maintenance, as well as being named this year's South Central District's STAR in Ag Placement. Way to go, Laura!

To top it off, the Renwick Chapter was one of just 14 - out of the 42 chapters in the South Central District - recognized as a Superior Chapter on the district level. These chapters will move on to the state level competition. We are #RenwickProud of all Renwick FFA members and their sponsors - Cheyenne Holliday and Cody Holliday. Join us in offering them our congratulations!",https://facebook.com/story.php?story_fbid=4742322302460261&id=278623088830227,,0.0,"Renwick FFA members and chapter are receiving some great kudos to finish out the school year.

Austin Simon is this year's recipient of the South Central District's STAR in Ag Business award, and was also named the winner of the South Central District proficiency award area of Ag Mechanics Design and Fabrication. Congratulations, Austin!

Congratulations also go to Laura Doll for winning the South Central District proficiency award area of Ag Mechanics, Repair and Maintenance, as well as being named this year's South Central District's STAR in Ag Placement. Way to go, Laura!

To top it off, the Renwick Chapter was one of just 14 - out of the 42 chapters in the South Central District - recognized as a Superior Chapter on the district level. These chapters will move on to the state level competition. We are #RenwickProud of all Renwick FFA members and their sponsors - Cheyenne Holliday and Cody Holliday. Join us in offering them our congratulations!",2020-05-19 13:21:40,,
80,1.0,https://scontent-atl3-1.xx.fbcdn.net/v/t1.0-9/fr/cp0/e15/q65/99068480_4738996256126199_7100592568294965248_o.jpg?_nc_cat=106&_nc_sid=8024bb&_nc_ohc=gSFE_VOs4asAX9RbFhi&_nc_ht=scontent-atl3-1.xx&tp=14&oh=5930e0735f9c77334e3a764fdd43b839&oe=5F8358A0,6.0,,4741550255870799,"#KSClassof2020 ... join in on the celebration this Wednesday, May 20! Take pics, post, and share as KSDE commemorates the achievements of this year's graduating class. Remember to use #KSClassof2020 and tag your schools and @ksdehq so they can promote your posts! #RenwickProud",https://facebook.com/story.php?story_fbid=4741550255870799&id=278623088830227,,0.0,"#KSClassof2020 ... join in on the celebration this Wednesday, May 20! Take pics, post, and share as KSDE commemorates the achievements of this year's graduating class. Remember to use #KSClassof2020 and tag your schools and @ksdehq so they can promote your posts! #RenwickProud",2020-05-19 09:32:48,,
81,0.0,https://scontent-atl3-1.xx.fbcdn.net/v/t1.0-9/94487857_4646440125381813_3996689513874194432_n.png?_nc_cat=100&_nc_sid=8024bb&_nc_ohc=9FyNap5T29sAX932uHK&_nc_ht=scontent-atl3-1.xx&oh=380a57ba4abd32eb510286e0ef81736b&oe=5F810ACB,7.0,,4646440412048451,,https://facebook.com/story.php?story_fbid=4646440412048451&id=278623088830227,,0.0,,2020-05-18 09:00:25,,
82,5.0,,56.0,https://www.ksn.com/gooddaykansas/furry-friends-pupsicles-with-jaycee/,4717843128241512,"Check out Garden Plain High student Jaycee Brown sharing her culinary creativity on the local show, â€œGood Day Kansas.â€ Great job! #RenwickProud",https://facebook.com/story.php?story_fbid=4717843128241512&id=278623088830227,"KSN.COM
Furry Friends: Pupsicles With Jaycee",2.0,"Check out Garden Plain High student Jaycee Brown sharing her culinary creativity on the local show, â€œGood Day Kansas.â€ Great job! #RenwickProud

KSN.COM
Furry Friends: Pupsicles With Jaycee",2020-05-14 20:25:50,,
83,0.0,,0.0,,4717650894927402,,https://facebook.com/story.php?story_fbid=4717650894927402&id=278623088830227,"Garden Plain High School
May 14 at 6:00 PM Â·

Owl Nations... Be checking in tomorrow to see the 2020 Senior Spotlights. They will be posted on Friday from 8:00 am - 8:00 pm and then again starting Saturday at 8:00 am. Check in on the hour and half hour to see your favorite 2020 Seniors...",0.0,"Garden Plain High School
May 14 at 6:00 PM Â·

Owl Nations... Be checking in tomorrow to see the 2020 Senior Spotlights. They will be posted on Friday from 8:00 am - 8:00 pm and then again starting Saturday at 8:00 am. Check in on the hour and half hour to see your favorite 2020 Seniors...",2020-05-14 19:21:36,,
84,0.0,,0.0,,,Owl Nations... Be checking in tomorrow to see the 2020 Senior Spotlights. They will be posted on Friday from 8:00 am - 8:00 pm and then again starting Saturday at 8:00 am. Check in on the hour and half hour to see your favorite 2020 Seniors...,https://facebook.com/story.php?story_fbid=2679604319030313&id=1892579774399442,,0.0,Owl Nations... Be checking in tomorrow to see the 2020 Senior Spotlights. They will be posted on Friday from 8:00 am - 8:00 pm and then again starting Saturday at 8:00 am. Check in on the hour and half hour to see your favorite 2020 Seniors...,2020-09-12 14:13:40.257183,,
85,0.0,https://scontent-atl3-1.xx.fbcdn.net/v/t1.0-9/97284915_4710799598945865_4718790927852765184_n.png?_nc_cat=111&_nc_sid=2d5d41&_nc_ohc=ucFJGyQU-VkAX914nnk&_nc_ht=scontent-atl3-1.xx&oh=b5256309f4404bf74097ad6b9155c2c4&oe=5F83B207,0.0,https://bit.ly/RenwickSnapshotMayJune20,4710799592279199,"This May is much different than the traditional end of the school year. But the way in which our students, staff, and parents are responding to challenges reminds us why being #RenwickProud remains the same.
https://bit.ly/RenwickSnapshotMayJune20",,,0.0,"This May is much different than the traditional end of the school year. But the way in which our students, staff, and parents are responding to challenges reminds us why being #RenwickProud remains the same.
https://bit.ly/RenwickSnapshotMayJune20",2020-05-13 09:57:21,,
