,comments,image,likes,link,post_id,post_text,post_url,shared_text,shares,text,time,video,video_thumbnail
0,0.0,,18.0,,5147383028620851,"Superintendent Mindy Russell Bruce welcomed staff back this morning for professional development. As she outlined the challenges for 2020-2021, Superintendent Bruce reminded staff to draw on the strength, resilience, and ingenuity that's part of our district. ""Roots run deep in Renwick,"" she said.

The legacy and deep love our staff, students, and patrons have for Renwick is what makes it so special. It is our roots that make us strong and ready to do our best for this year - and all years - to come. #RenwickProud #RenwickStrong",,,0.0,"Superintendent Mindy Russell Bruce welcomed staff back this morning for professional development. As she outlined the challenges for 2020-2021, Superintendent Bruce reminded staff to draw on the strength, resilience, and ingenuity that's part of our district. ""Roots run deep in Renwick,"" she said.

The legacy and deep love our staff, students, and patrons have for Renwick is what makes it so special. It is our roots that make us strong and ready to do our best for this year - and all years - to come. #RenwickProud #RenwickStrong",2020-08-13 11:05:13,https://video-atl3-1.xx.fbcdn.net/v/t42.9040-2/109980120_1698634263644157_7017496246474843928_n.mp4?_nc_cat=104&_nc_sid=985c63&efg=eyJ2ZW5jb2RlX3RhZyI6ImxlZ2FjeV9zZCJ9&_nc_ohc=jT9pW4V5peMAX-CVAAO&_nc_ht=video-atl3-1.xx&oh=d95d5ec5457f1ba1a58c6143e96d50ff&oe=5F5D3502,
1,0.0,https://scontent-atl3-1.xx.fbcdn.net/v/t1.0-9/119194544_5295847040441115_6030800237790427595_n.png?_nc_cat=100&_nc_sid=8024bb&_nc_ohc=N6KdapHM5IIAX_8HOfQ&_nc_ht=scontent-atl3-1.xx&oh=bd0abae4207b98e3e02ee468d8fa76c2&oe=5F83B12A,29.0,,5295851630440656,"Renwick is fortunate to have loyal fans who support the extra curricular activities of our students. It has been exciting for our athletes, musicians, cheer and dance teams to have spectators cheer them on at events. Fans are reminded to follow the district's spectator guidelines at all Renwick activities. Unless spectators are socially distanced 6 feet, they must have a mask on. This includes all school age children. We are grateful to have students learning in our classrooms and participating in activities, and need the cooperation of everyone who attends school events to keep this possible. Please do your part and help us continue this for our schools. If protocols are not followed, spectators will be limited in the future.",https://facebook.com/story.php?story_fbid=5295851630440656&id=278623088830227,,0.0,"Renwick is fortunate to have loyal fans who support the extra curricular activities of our students. It has been exciting for our athletes, musicians, cheer and dance teams to have spectators cheer them on at events. Fans are reminded to follow the district's spectator guidelines at all Renwick activities. Unless spectators are socially distanced 6 feet, they must have a mask on. This includes all school age children. We are grateful to have students learning in our classrooms and participating in activities, and need the cooperation of everyone who attends school events to keep this possible. Please do your part and help us continue this for our schools. If protocols are not followed, spectators will be limited in the future.",2020-09-10 13:00:13,,
2,0.0,https://scontent-atl3-1.xx.fbcdn.net/v/t1.0-9/fr/cp0/e15/q65/119157439_2787481841575893_5903620703578059152_o.jpg?_nc_cat=109&_nc_sid=da1649&_nc_ohc=jvUtMWCWDgUAX9mwlk5&_nc_ht=scontent-atl3-1.xx&tp=14&oh=26b0df8b9f34c0e29794759089757ec6&oe=5F81E633,6.0,,5295502893808863,"Great option to keep up on the Friday night gridiron action for the Owls if you can't get to the game. Best of luck Friday night to Garden Plain as they travel to Sterling, and to Andale High, as they host Mulvane. #RenwickProud",https://facebook.com/story.php?story_fbid=5295502893808863&id=278623088830227,"Garden Plain High School
September 10 at 7:14 AM Â·",0.0,"Great option to keep up on the Friday night gridiron action for the Owls if you can't get to the game. Best of luck Friday night to Garden Plain as they travel to Sterling, and to Andale High, as they host Mulvane. #RenwickProud

Garden Plain High School
September 10 at 7:14 AM Â·",2020-09-10 10:03:36,,
3,0.0,https://scontent-atl3-1.xx.fbcdn.net/v/t1.0-9/119057288_5285341208158365_8249467031265887589_n.png?_nc_cat=103&_nc_sid=8024bb&_nc_ohc=gSgkACe-DBYAX-v9r2V&_nc_ht=scontent-atl3-1.xx&oh=032b89f4ef5d397fa0ff03b0c817f5fb&oe=5F8479EE,9.0,https://www.applitrack.com/usd267/onlineapp/,5285344754824677,Interested in work that allows you to have a school calendar schedule? We are currently looking for help in our Food Service Department. Check out the openings in our kitchen at Andale Elementary and all the other jobs listed at https://www.applitrack.com/usd267/onlineapp/,https://facebook.com/story.php?story_fbid=5285344754824677&id=278623088830227,,0.0,Interested in work that allows you to have a school calendar schedule? We are currently looking for help in our Food Service Department. Check out the openings in our kitchen at Andale Elementary and all the other jobs listed at https://www.applitrack.com/usd267/onlineapp/,2020-09-08 12:32:55,,
4,0.0,https://scontent-atl3-1.xx.fbcdn.net/v/t1.0-9/fr/cp0/e15/q65/118995215_5284579678234518_5934142212411176846_n.jpg?_nc_cat=104&_nc_sid=8024bb&_nc_ohc=wNC1ydAjAUcAX_XFFx_&_nc_ht=scontent-atl3-1.xx&tp=14&oh=37940909dcd22599b4ec2cff03a15c51&oe=5F8133BB,30.0,,5284621471563672,"We love this idea to encourage students to look beyond the basics and to discover new things in the familiar sights around them. The GPE 6-8 STEAM 8th graders recently participated in a ""photo scavenger hunt"" to capture images of items in their surroundings that represent letters. It's a great reminder of all that can be discovered with a fresh perspective. #RenwickProud",https://facebook.com/story.php?story_fbid=5284621471563672&id=278623088830227,,0.0,"We love this idea to encourage students to look beyond the basics and to discover new things in the familiar sights around them. The GPE 6-8 STEAM 8th graders recently participated in a ""photo scavenger hunt"" to capture images of items in their surroundings that represent letters. It's a great reminder of all that can be discovered with a fresh perspective. #RenwickProud",2020-09-08 09:46:28,,
5,0.0,https://scontent-atl3-1.xx.fbcdn.net/v/t1.0-9/118402752_5204381662920987_1867146636071157913_n.png?_nc_cat=111&_nc_sid=8024bb&_nc_ohc=sJQ-3uocHRcAX8W9qIm&_nc_ht=scontent-atl3-1.xx&oh=9a9d1450d3fbebd9632cd960515312e7&oe=5F82E9F9,13.0,,5204382619587558,,https://facebook.com/story.php?story_fbid=5204382619587558&id=278623088830227,,0.0,,2020-09-07 09:00:29,,
6,0.0,https://scontent-atl3-1.xx.fbcdn.net/v/t1.0-9/118405054_5242436209115532_8510988214785412250_n.png?_nc_cat=106&_nc_sid=8024bb&_nc_ohc=PN_FqLJgmtkAX_oZpYi&_nc_oc=AQkJFzeZFibNyt_Uv2L7mAGr75lGcZ5SLuV0V2C9Yj9qv5FzJiETdqe1KcbTshkRuJk&_nc_ht=scontent-atl3-1.xx&oh=20df2301bfa53097f7a724e21713ce58&oe=5F847087,13.0,,5242437362448750,"Don't forget ... no school on Monday, September 7 in observance of Labor Day. So relax. Enjoy. And we'll see you back here on Tuesday, September 8!",https://facebook.com/story.php?story_fbid=5242437362448750&id=278623088830227,,0.0,"Don't forget ... no school on Monday, September 7 in observance of Labor Day. So relax. Enjoy. And we'll see you back here on Tuesday, September 8!",2020-09-04 16:30:48,,
7,0.0,https://scontent-atl3-1.xx.fbcdn.net/v/t1.0-9/118604144_5252930661399420_414409142514162097_n.png?_nc_cat=105&_nc_sid=8024bb&_nc_ohc=HZrLz2tiH3UAX9sBZzp&_nc_ht=scontent-atl3-1.xx&oh=447ccdc44647cf3350f826f64e147b55&oe=5F82F2EE,75.0,,5252938421398644,"Game Day.

There's really not anything like it. Check out the spectator guidelines and support Renwick, either online or in person while adhering to spectator guidelines. Let's show these kids -- whether they are on the course, court, or field -- and no matter if they are dancing, running, cheering, or playing an instrument -- just how much it means to watch them do what they love. #RenwickProud",https://facebook.com/story.php?story_fbid=5252938421398644&id=278623088830227,,0.0,"Game Day.

There's really not anything like it. Check out the spectator guidelines and support Renwick, either online or in person while adhering to spectator guidelines. Let's show these kids -- whether they are on the course, court, or field -- and no matter if they are dancing, running, cheering, or playing an instrument -- just how much it means to watch them do what they love. #RenwickProud",2020-09-04 09:30:50,,
8,0.0,https://scontent-atl3-1.xx.fbcdn.net/v/t1.0-9/118787211_5252784331414053_8927851089891759968_n.png?_nc_cat=104&_nc_sid=8024bb&_nc_ohc=wd5KdSnWO7wAX_m3wo2&_nc_ht=scontent-atl3-1.xx&oh=03c9e06bc29fc868fa460e80d9decdbe&oe=5F829E9F,28.0,,5252784681414018,We're just a little over one week into the school year and are #RenwickProud of all our staff members and students. Here's a great conversation starter for parents in order to hear all about their child's day at school. We know one of the best parts of our day is seeing those students back here in our classrooms.,https://facebook.com/story.php?story_fbid=5252784681414018&id=278623088830227,,0.0,We're just a little over one week into the school year and are #RenwickProud of all our staff members and students. Here's a great conversation starter for parents in order to hear all about their child's day at school. We know one of the best parts of our day is seeing those students back here in our classrooms.,2020-09-02 12:06:23,,
9,0.0,https://scontent-atl3-1.xx.fbcdn.net/v/t1.0-9/fr/cp0/e15/q65/118719221_5242531845772635_673722363853220304_n.jpg?_nc_cat=108&_nc_sid=8024bb&_nc_ohc=jM5DzHhGfvUAX-qhnM5&_nc_ht=scontent-atl3-1.xx&tp=14&oh=a950e353924e8ef0d460dae766b65e19&oe=5F80F919,46.0,,5242945109064642,"Always #RenwickProud to see USD 267 students receiving a shoutout for excellence. We have a lot of great students who put in the work and achieve success in activities they love. None of this is possible without coaches and sponsors who put in countless hours supporting and leading these kids. If you haven't had a chance to do so, reach out and thank them for all they're doing to keep these opportunities going. #grateful",https://facebook.com/story.php?story_fbid=5242945109064642&id=278623088830227,,0.0,"Always #RenwickProud to see USD 267 students receiving a shoutout for excellence. We have a lot of great students who put in the work and achieve success in activities they love. None of this is possible without coaches and sponsors who put in countless hours supporting and leading these kids. If you haven't had a chance to do so, reach out and thank them for all they're doing to keep these opportunities going. #grateful",2020-09-01 10:30:39,,
10,0.0,https://scontent-atl3-1.xx.fbcdn.net/v/t1.0-9/117824613_5178923995466754_1479673953292410528_n.png?_nc_cat=107&_nc_sid=8024bb&_nc_ohc=FWXMKCOuCkEAX-Lzw1S&_nc_ht=scontent-atl3-1.xx&oh=bf59dff5c01286ab87c69b891fdfeabc&oe=5F80DCEB,15.0,,5178924828800004,,https://facebook.com/story.php?story_fbid=5178924828800004&id=278623088830227,,0.0,,2020-08-31 09:00:38,,
11,0.0,https://scontent-atl3-1.xx.fbcdn.net/v/t1.0-9/118349936_5221012354591251_43982600721748518_n.png?_nc_cat=103&_nc_sid=8024bb&_nc_ohc=2axUNSt6C7kAX8vsSxO&_nc_ht=scontent-atl3-1.xx&oh=9c5bf83bf825dcb88fb4b6da3e4e6a43&oe=5F83D021,75.0,,5221032284589258,,https://facebook.com/story.php?story_fbid=5221032284589258&id=278623088830227,,0.0,,2020-08-27 15:51:56,,
12,0.0,https://scontent-atl3-1.xx.fbcdn.net/v/t1.0-9/fr/cp0/e15/q65/118623321_5219601034732383_5151867560773123156_o.jpg?_nc_cat=106&_nc_sid=8024bb&_nc_ohc=x0K5beMDmcMAX-YAVBj&_nc_ht=scontent-atl3-1.xx&tp=14&oh=1a461412f7159b2a7feecae042403697&oe=5F837329,66.0,,5219602434732243,Our district offers many thanks to our friends at First National Bank for the items they so graciously donated from their annual school supply drive. Join us in saying thank you for their involvement in our education community. #RenwickProud,https://facebook.com/story.php?story_fbid=5219602434732243&id=278623088830227,,0.0,Our district offers many thanks to our friends at First National Bank for the items they so graciously donated from their annual school supply drive. Join us in saying thank you for their involvement in our education community. #RenwickProud,2020-08-27 10:02:00,,
13,0.0,,29.0,,5215887895103697,,https://facebook.com/story.php?story_fbid=5215887895103697&id=278623088830227,,2.0,,2020-08-26 17:37:32,,
14,0.0,,0.0,,,,https://facebook.com/story.php?story_fbid=2709198586001536&id=1478962669025140,,0.0,,2020-09-12 14:13:40.257066,,
15,2.0,https://scontent-atl3-1.xx.fbcdn.net/v/t1.0-9/117622613_5172823372743483_2853976283697258967_n.png?_nc_cat=103&_nc_sid=8024bb&_nc_ohc=ENxThbtbXfwAX8pJS47&_nc_ht=scontent-atl3-1.xx&oh=30e36c689c2392a40ff07003c84770bb&oe=5F80B7FD,16.0,,5172825999409887,"Steven Dockens joins Renwick as the Art Teacher at Garden Plain High School. We are excited to see this experienced educator help students create their artistic visions. #RenwickProud

How long have you been teaching ...

This will be my sixth year teaching. Previously I worked with USD 259.

I pursued a career in teaching because ...

I had an amazing art teacher in high school who showed me how rewarding teaching could be.

My hobbies include ...

Art, of course - it is what I teach. Other than that I am a bit of a gamer. Video games, board games, and yes dungeons and dragons.

The most important thing for students to know about me is ...

Art for me is very individualistic. My goal isn't to make everyone create the same thing, but to help you find your passions and assist on making your visions a reality.",https://facebook.com/story.php?story_fbid=5172825999409887&id=278623088830227,,0.0,"Steven Dockens joins Renwick as the Art Teacher at Garden Plain High School. We are excited to see this experienced educator help students create their artistic visions. #RenwickProud

How long have you been teaching ...

This will be my sixth year teaching. Previously I worked with USD 259.

I pursued a career in teaching because ...

I had an amazing art teacher in high school who showed me how rewarding teaching could be.

My hobbies include ...

Art, of course - it is what I teach. Other than that I am a bit of a gamer. Video games, board games, and yes dungeons and dragons.

The most important thing for students to know about me is ...

Art for me is very individualistic. My goal isn't to make everyone create the same thing, but to help you find your passions and assist on making your visions a reality.",2020-08-26 11:00:46,,
16,1.0,https://scontent-atl3-1.xx.fbcdn.net/v/t1.0-9/118254562_5172625559429931_5953508498737947552_n.png?_nc_cat=111&_nc_sid=8024bb&_nc_ohc=Htbuqao3p5sAX_yreaK&_nc_ht=scontent-atl3-1.xx&oh=245dd91f65d67efba74fc29ead1d1add&oe=5F8330EC,71.0,,5172629772762843,,https://facebook.com/story.php?story_fbid=5172629772762843&id=278623088830227,,0.0,,2020-08-25 11:30:41,,
17,7.0,https://scontent-atl3-1.xx.fbcdn.net/v/t1.0-9/fr/cp0/e15/q65/118359420_5208489159176904_2863749812263339514_n.jpg?_nc_cat=106&_nc_sid=110474&_nc_ohc=FkWJbiTeoLcAX94qwNz&_nc_ht=scontent-atl3-1.xx&tp=14&oh=bc6279858546b6af728bee536c147029&oe=5F82209C,204.0,,5208490332510120,"Late summer morning sun. Buses ready to unload students. Our hearts are full. Have a wonderful first day! Welcome back, Renwick nationðŸ–¤ðŸ’›",https://facebook.com/story.php?story_fbid=5208490332510120&id=278623088830227,,0.0,"Late summer morning sun. Buses ready to unload students. Our hearts are full. Have a wonderful first day! Welcome back, Renwick nationðŸ–¤ðŸ’›",2020-08-25 08:44:05,,
18,9.0,https://scontent-atl3-1.xx.fbcdn.net/v/t1.0-9/117665075_5167440219948465_3702182427219295803_n.png?_nc_cat=109&_nc_sid=8024bb&_nc_ohc=vxg3xo-waCAAX_UXlz4&_nc_ht=scontent-atl3-1.xx&oh=60928f403ce6fa00b1100431ec8727e2&oe=5F81BA9C,49.0,,5167441466615007,,https://facebook.com/story.php?story_fbid=5167441466615007&id=278623088830227,,0.0,,2020-08-24 11:01:14,,
19,0.0,https://scontent-atl3-1.xx.fbcdn.net/v/t1.0-9/117880882_5166970266662127_8257066217150467608_n.png?_nc_cat=106&_nc_sid=8024bb&_nc_ohc=TfjM323Mv1EAX9taa0n&_nc_ht=scontent-atl3-1.xx&oh=ea58de130b6152fcd570cf68b5148353&oe=5F81D9BD,13.0,,5166970926662061,,https://facebook.com/story.php?story_fbid=5166970926662061&id=278623088830227,,0.0,,2020-08-24 09:00:11,,
20,5.0,https://scontent-atl3-1.xx.fbcdn.net/v/t1.0-9/117545747_5167362173289603_8589893034044324714_n.png?_nc_cat=104&_nc_sid=8024bb&_nc_ohc=0zD7CUFBHvAAX_PlJe0&_nc_ht=scontent-atl3-1.xx&oh=653ceb5c4b5101fed5c9b195d41c866a&oe=5F80FEE1,55.0,,5167365806622573,,https://facebook.com/story.php?story_fbid=5167365806622573&id=278623088830227,,0.0,,2020-08-21 10:00:54,,
21,9.0,https://scontent-atl3-1.xx.fbcdn.net/v/t1.0-9/115721504_5033319750027180_6258022170470430481_n.png?_nc_cat=106&_nc_sid=8024bb&_nc_ohc=nf8JyuwA8D0AX8WFq5o&_nc_ht=scontent-atl3-1.xx&oh=0f94ddd1a6ae13e9c9db4d55a1580653&oe=5F8140E2,66.0,,5033320073360481,"The new staff member we are featuring today pursued a career in teaching because ""first and foremost - I love kids.""

But the joy found in being an educator doesn't end there for Christi Butterfield, who joins Renwick as a teacher at Colwich Elementary.

""I am honored to have the opportunity to be a part of their lives and watch them grow,"" she adds.

Her hobbies include spending time with her husband and three daughters. ""We love baseball and watching movies together.""

The most important thing for students to know about Mrs. Butterfield is ... ""that we will work hard, but have a lot of fun in class.""

Join us in welcoming Christi to USD 267! #RenwickProud",https://facebook.com/story.php?story_fbid=5033320073360481&id=278623088830227,,0.0,"The new staff member we are featuring today pursued a career in teaching because ""first and foremost - I love kids.""

But the joy found in being an educator doesn't end there for Christi Butterfield, who joins Renwick as a teacher at Colwich Elementary.

""I am honored to have the opportunity to be a part of their lives and watch them grow,"" she adds.

Her hobbies include spending time with her husband and three daughters. ""We love baseball and watching movies together.""

The most important thing for students to know about Mrs. Butterfield is ... ""that we will work hard, but have a lot of fun in class.""

Join us in welcoming Christi to USD 267! #RenwickProud",2020-08-20 10:55:32,,
22,6.0,https://scontent-atl3-1.xx.fbcdn.net/v/t1.0-9/118314536_5179924062033414_5434325254989716058_n.png?_nc_cat=102&_nc_sid=8024bb&_nc_ohc=m7c7ZIliypUAX_w4Qwr&_nc_ht=scontent-atl3-1.xx&oh=0238e4b1bc1ba0fa8a479f49ee75b77b&oe=5F813CC2,6.0,,5179924335366720,,https://facebook.com/story.php?story_fbid=5179924335366720&id=278623088830227,,0.0,,2020-08-19 20:47:51,,
23,0.0,https://scontent-atl3-1.xx.fbcdn.net/v/t1.0-9/106714512_4960894533936369_530449754901685657_n.png?_nc_cat=109&_nc_sid=8024bb&_nc_ohc=Ba0z3zXz1ewAX_uhz0g&_nc_ht=scontent-atl3-1.xx&oh=24a4331667f577f65ae66e39b84684cb&oe=5F84412A,41.0,,4960895290602960,,https://facebook.com/story.php?story_fbid=4960895290602960&id=278623088830227,,0.0,,2020-08-19 10:55:01,,
24,0.0,https://scontent-atl3-1.xx.fbcdn.net/v/t1.0-9/117173824_5098911173468037_5131327074166888000_n.png?_nc_cat=106&_nc_sid=8024bb&_nc_ohc=zv7qWrgG4kcAX8ZkGhE&_nc_ht=scontent-atl3-1.xx&oh=6b6f32ccbac5e91086f45274b229ad35&oe=5F80F3BF,59.0,,5098913326801155,"Welcome back to Alex Butterfield, who returns to the Renwick family this fall as an English teacher at Andale High School. #RenwickProud

How many years have you been teaching?
This will be my seventh year in the classroom. I'm very excited to be back in the Renwick district.

I pursued a career in teaching because ...
I had some amazing teachers that really had a tremendous impact on my life. I thought that was awesome and wanted to do the same for students.

My hobbies include ... Baseball, movies, and spending time with my wife and three daughters.

The most important thing for students to know about me is ...
I am passionate about education, but I am also a big goober that likes to joke around and have fun.",https://facebook.com/story.php?story_fbid=5098913326801155&id=278623088830227,,0.0,"Welcome back to Alex Butterfield, who returns to the Renwick family this fall as an English teacher at Andale High School. #RenwickProud

How many years have you been teaching?
This will be my seventh year in the classroom. I'm very excited to be back in the Renwick district.

I pursued a career in teaching because ...
I had some amazing teachers that really had a tremendous impact on my life. I thought that was awesome and wanted to do the same for students.

My hobbies include ... Baseball, movies, and spending time with my wife and three daughters.

The most important thing for students to know about me is ...
I am passionate about education, but I am also a big goober that likes to joke around and have fun.",2020-08-18 10:00:32,,
25,0.0,https://scontent-atl3-1.xx.fbcdn.net/v/t1.0-9/117606652_5168486066510547_8854551190417607478_n.png?_nc_cat=100&_nc_sid=8024bb&_nc_ohc=qNm3PEE3oasAX84cGtK&_nc_oc=AQmcb7-QiHsQLEmrLat3vYU4t4JWKEJOybr-xM0wgSQmQqXvPZ5mD-059bhEzLbNPE0&_nc_ht=scontent-atl3-1.xx&oh=742867a224286d9c34555b06f2c121da&oe=5F80D583,2.0,https://www.applitrack.com/usd267/onlineapp/default.aspx?Category=Maintenance%2FCustodial,5168486639843823,"Come work with a great team and make a difference everyday. We are hiring several custodial positions. Visit our website to find out more and apply today.

https://www.applitrack.com/usd267/onlineapp/default.aspx?Category=Maintenance%2fCustodial",https://facebook.com/story.php?story_fbid=5168486639843823&id=278623088830227,,0.0,"Come work with a great team and make a difference everyday. We are hiring several custodial positions. Visit our website to find out more and apply today.

https://www.applitrack.com/usd267/onlineapp/default.aspx?Category=Maintenance%2fCustodial",2020-08-17 14:40:53,,
26,0.0,https://scontent-atl3-1.xx.fbcdn.net/v/t1.0-9/118090005_5166946473331173_8316382846744988795_n.png?_nc_cat=105&_nc_sid=8024bb&_nc_ohc=woayeDlgrkQAX9_2OsJ&_nc_ht=scontent-atl3-1.xx&oh=8d32e0c7e9659d4dc422bc53e4142f3e&oe=5F810F2F,11.0,,5166947046664449,,https://facebook.com/story.php?story_fbid=5166947046664449&id=278623088830227,,0.0,,2020-08-17 09:00:57,,
27,15.0,https://scontent-atl3-1.xx.fbcdn.net/v/t1.0-9/106452566_4930912390267917_7849799201718491734_n.png?_nc_cat=100&_nc_sid=8024bb&_nc_ohc=c4opCZ7wUUUAX-fVC3H&_nc_ht=scontent-atl3-1.xx&oh=f8574761f3dfaeaa94bdc31fbd537a5b&oe=5F8158C3,82.0,,4930922306933592,,https://facebook.com/story.php?story_fbid=4930922306933592&id=278623088830227,,0.0,,2020-08-14 09:31:55,,
28,2.0,https://scontent-atl3-1.xx.fbcdn.net/v/t1.0-9/117358798_5143409365684884_5945692981621836011_n.png?_nc_cat=108&_nc_sid=8024bb&_nc_ohc=D6mnRkJQursAX9D-hXx&_nc_ht=scontent-atl3-1.xx&oh=3858e3843a17a286e7c3761e776dfd8d&oe=5F81DAF2,100.0,,5143410065684814,"Join us as we give a shout out to our teachers, paraprofessionals, bus drivers, food service, and support staff members who report in for their first official day of the 2020-2021 school year. Many thanks to all these dedicated professionals who are working hard to get things ready for students on their first day - August 25. Thanks for all you do! #RenwickProud",https://facebook.com/story.php?story_fbid=5143410065684814&id=278623088830227,,0.0,"Join us as we give a shout out to our teachers, paraprofessionals, bus drivers, food service, and support staff members who report in for their first official day of the 2020-2021 school year. Many thanks to all these dedicated professionals who are working hard to get things ready for students on their first day - August 25. Thanks for all you do! #RenwickProud",2020-08-13 08:45:32,,
29,0.0,https://scontent-atl3-1.xx.fbcdn.net/v/t1.0-9/fr/cp0/e15/q65/117594831_5141913239167830_2049028205208098485_o.jpg?_nc_cat=103&_nc_sid=8024bb&_nc_ohc=-YD1-K7e9AsAX-IoSea&_nc_ht=scontent-atl3-1.xx&tp=14&oh=e62750d7e1a5595ada0730f2ce591c79&oe=5F82B325,8.0,,5141913652501122,"The 2020 Census will direct $1.5 trillion every year to communities based on how many residents fill out the form. If you donâ€™t complete your census, your community will get less money. After COVID-19, we cannot be left with underfunded schools, hospitals and safety net programs. Completing the 2020 Census ensures our communities get our fair shareâ€”the resources we will need to truly recover. Complete your 2020 Census today.",https://facebook.com/story.php?story_fbid=5141913652501122&id=278623088830227,,0.0,"The 2020 Census will direct $1.5 trillion every year to communities based on how many residents fill out the form. If you donâ€™t complete your census, your community will get less money. After COVID-19, we cannot be left with underfunded schools, hospitals and safety net programs. Completing the 2020 Census ensures our communities get our fair shareâ€”the resources we will need to truly recover. Complete your 2020 Census today.",2020-08-12 09:55:07,,
30,15.0,https://scontent-atl3-1.xx.fbcdn.net/v/t1.0-9/107631566_4969265906432565_33902211899066820_n.png?_nc_cat=100&_nc_sid=8024bb&_nc_ohc=f_AtedtW628AX92RdnB&_nc_ht=scontent-atl3-1.xx&oh=f17bc39cc79b71646fd0322eae81d27a&oe=5F843151,83.0,,4969283116430844,,https://facebook.com/story.php?story_fbid=4969283116430844&id=278623088830227,,0.0,,2020-08-11 10:55:42,,
