,comments,image,likes,link,post_id,post_text,post_url,shared_text,shares,text,time,video,video_thumbnail
0,0.0,https://scontent-atl3-1.xx.fbcdn.net/v/t1.0-9/fr/cp0/e15/q65/119202227_1285282631856149_3996817082085968610_n.jpg?_nc_cat=103&_nc_sid=110474&_nc_ohc=X2HCmpr614EAX-tVQK_&_nc_ht=scontent-atl3-1.xx&tp=14&oh=978e8b0f8ae05bebed0f630e1e6babe6&oe=5F8BC8CB,5.0,,1285282735189472,,https://facebook.com/story.php?story_fbid=1285282735189472&id=601292616921824,,0.0,,2020-09-11 11:15:49,,
1,0.0,,4.0,,1278008765916869,Tomorrow we start face to face learning for those who parents filled out the return to school screener sent out via text. If you did not fill it out please contact your campus before taking your student to campus.,https://facebook.com/story.php?story_fbid=1278008765916869&id=601292616921824,,0.0,Tomorrow we start face to face learning for those who parents filled out the return to school screener sent out via text. If you did not fill it out please contact your campus before taking your student to campus.,2020-09-07 21:46:21,,
2,0.0,,11.0,,1250466858671060,1st week of school in the books. It was a challenge for the students and parents! But we are strong and caring. Success will happen for our students and we be with them all the way! Love and happiness to our Wolfpack family. ❤️❤️❤️🙏🏻🙏🏻🙏🏻😷😷😷,https://facebook.com/story.php?story_fbid=1250466858671060&id=601292616921824,,0.0,1st week of school in the books. It was a challenge for the students and parents! But we are strong and caring. Success will happen for our students and we be with them all the way! Love and happiness to our Wolfpack family. ❤️❤️❤️🙏🏻🙏🏻🙏🏻😷😷😷,2020-08-23 22:47:33,,
3,0.0,https://scontent-atl3-1.xx.fbcdn.net/v/t1.0-9/fr/cp0/e15/q65/107376759_1193183907732689_1137783893218043715_n.jpg?_nc_cat=103&_nc_sid=110474&_nc_ohc=59gWMZhV4zUAX-KV6Z9&_nc_ht=scontent-atl3-1.xx&tp=14&oh=7f1efca4a6924f76c40d0be2b7bcf60d&oe=5F8A3DEB,1.0,,1193184497732630,Parents students and staff join and get some exercise!!!!,https://facebook.com/story.php?story_fbid=1193184497732630&id=601292616921824,,0.0,Parents students and staff join and get some exercise!!!!,2020-07-09 15:08:46,,
4,0.0,https://scontent-atl3-1.xx.fbcdn.net/v/t1.0-9/fr/cp0/e15/q65/107427261_1189155431468870_3987794638903701231_n.jpg?_nc_cat=104&_nc_sid=110474&_nc_ohc=mrFo3SxuoTQAX_Kv2LF&_nc_ht=scontent-atl3-1.xx&tp=14&oh=cb8c284e0f113d12ba4aa8d91c9f6814&oe=5F8AD6F4,4.0,,1189155538135526,We wish our parents and students a safe and happy 4th of July!!!!,https://facebook.com/story.php?story_fbid=1189155538135526&id=601292616921824,,0.0,We wish our parents and students a safe and happy 4th of July!!!!,2020-07-04 12:37:44,,
5,0.0,,4.0,https://www.surveymonkey.com/r/V59XJKC,1185397565177990,"Please take the following survey SEE parents as this is important information for next school year and we need your feed back!!!!
https://www.surveymonkey.com/r/V59XJKC",https://facebook.com/story.php?story_fbid=1185397565177990&id=601292616921824,"SURVEYMONKEY.COM
Can you spare a few moments to take my survey?",0.0,"Please take the following survey SEE parents as this is important information for next school year and we need your feed back!!!!
https://www.surveymonkey.com/r/V59XJKC

SURVEYMONKEY.COM
Can you spare a few moments to take my survey?",2020-06-29 15:52:43,,
6,0.0,,2.0,,1183850658666014,District offices and all campuses will be close for the next two weeks as we give our staff some time to relax before the new school year begins. Food pickup will continue on both Monday’s!!!!!😷😴🍏🍎🥝🍞🥗🍴🥒🥕,https://facebook.com/story.php?story_fbid=1183850658666014&id=601292616921824,,0.0,District offices and all campuses will be close for the next two weeks as we give our staff some time to relax before the new school year begins. Food pickup will continue on both Monday’s!!!!!😷😴🍏🍎🥝🍞🥗🍴🥒🥕,2020-06-27 17:20:54,,
7,0.0,,10.0,,1179092232475190,We at the School of Excellence in Education are preparing for the fall! Our classrooms are COVID19 ready and we look forward to seeing our students back on campus. Registration is open and campuses are open each day Monday-Thursday from 8-4 to come by and take a tour are gather information. Soon we will be on Twitter and SnapChat---look for us and follow us.,https://facebook.com/story.php?story_fbid=1179092232475190&id=601292616921824,,0.0,We at the School of Excellence in Education are preparing for the fall! Our classrooms are COVID19 ready and we look forward to seeing our students back on campus. Registration is open and campuses are open each day Monday-Thursday from 8-4 to come by and take a tour are gather information. Soon we will be on Twitter and SnapChat---look for us and follow us.,2020-06-21 20:40:21,,
8,0.0,https://scontent-atl3-1.xx.fbcdn.net/v/t1.0-9/fr/cp0/e15/q65/104860074_1178103869240693_174347484165449388_o.jpg?_nc_cat=103&_nc_sid=85a577&_nc_ohc=gnfG0LmUpY0AX9eyg-q&_nc_ht=scontent-atl3-1.xx&tp=14&oh=cd03a68977ff2ddf680b94dadb6e476d&oe=5F889C5D,3.0,,1178101525907594,,,,0.0,,2020-06-20 14:32:30,,
9,0.0,https://scontent-atl3-1.xx.fbcdn.net/v/t1.0-9/fr/cp0/e15/q65/104315308_1178101489240931_7280119021892236211_o.jpg?_nc_cat=107&_nc_sid=7aed08&_nc_ohc=af81NCvVl7MAX_Z6ou5&_nc_ht=scontent-atl3-1.xx&tp=14&oh=89c396b7dc81fbac16b40f2954c7cf9c&oe=5F8BA8C2,0.0,,1178101525907594,,,,0.0,,2020-06-20 14:29:01,,
10,1.0,https://scontent-atl3-1.xx.fbcdn.net/v/t1.0-9/fr/cp0/e15/q65/101835796_1162020690849011_963371755882151936_n.jpg?_nc_cat=107&_nc_sid=110474&_nc_ohc=Z3-DJn0vL8IAX-VMwet&_nc_ht=scontent-atl3-1.xx&tp=14&oh=937699dcfa2214c9acb39daaaa9d3ee4&oe=5F8A652D,7.0,,1162020754182338,"Monday June 1st we would like all out parents to stop for a hamburger and chips. We love our parents and thank them for their support ❤️. Also please come in Lee:Saenz cafe, Kelley gym, and Walker entrance hallway to turn in Chromebooks and pick up
I for on P-EDT program the government is providing for summer nutrition!!!! We will continue our food program through
July!!",https://facebook.com/story.php?story_fbid=1162020754182338&id=601292616921824,,0.0,"Monday June 1st we would like all out parents to stop for a hamburger and chips. We love our parents and thank them for their support ❤️. Also please come in Lee:Saenz cafe, Kelley gym, and Walker entrance hallway to turn in Chromebooks and pick up
I for on P-EDT program the government is providing for summer nutrition!!!! We will continue our food program through
July!!",2020-05-31 09:20:10,,
11,5.0,https://scontent-atl3-1.xx.fbcdn.net/v/t1.0-9/fr/cp0/e15/q65/101689409_1161573727560374_6101480130389999616_n.jpg?_nc_cat=105&_nc_sid=110474&_nc_ohc=imGl2AVUNjMAX-HND1k&_nc_ht=scontent-atl3-1.xx&tp=14&oh=45e007a5acf76ec667a444da041233f8&oe=5F8BE953,13.0,,1161574604226953,Our seniors on their day. We love you and will miss you. Your future is in front of you and success is in your reach!!!!#Wolfpack.,https://facebook.com/story.php?story_fbid=1161574604226953&id=601292616921824,,0.0,Our seniors on their day. We love you and will miss you. Your future is in front of you and success is in your reach!!!!#Wolfpack.,2020-05-30 17:42:30,,
12,1.0,,8.0,,1161469164237497,Milton B Lee Academy senior parade at graduation today!!!,,,0.0,Milton B Lee Academy senior parade at graduation today!!!,2020-05-30 14:09:20,https://video-atl3-1.xx.fbcdn.net/v/t42.9040-2/10000000_207684340192741_8231640538902691840_n.mp4?_nc_cat=110&_nc_sid=985c63&efg=eyJ2ZW5jb2RlX3RhZyI6ImxlZ2FjeV9zZCJ9&_nc_ohc=RIFN5P23tcAAX8wmT1m&_nc_ht=video-atl3-1.xx&oh=c24ef026662f896b9abb9b6d8e6e9912&oe=5F6486B6,
13,0.0,https://scontent-atl3-1.xx.fbcdn.net/v/t1.0-9/fr/cp0/e15/q65/100781371_1160099474374466_8107810142063427584_n.jpg?_nc_cat=110&_nc_sid=110474&_nc_ohc=Xzp2CJ4jNzIAX9ra6G6&_nc_oc=AQlrePh6OiAxRyYtD7ziH78TOnf-Q8f-VUNCx5thv0JvAxJpFrwjxzbE2-twcrn0xFU&_nc_ht=scontent-atl3-1.xx&tp=14&oh=da200856fa22b0598bd3d1f91634c5fa&oe=5F8AA3E2,6.0,,1160099564374457,Lee Academy new logo!!!,https://facebook.com/story.php?story_fbid=1160099564374457&id=601292616921824,,0.0,Lee Academy new logo!!!,2020-05-28 18:38:42,,
14,0.0,https://scontent-atl3-1.xx.fbcdn.net/v/t1.0-9/fr/cp0/e15/q65/100530279_1157904501260630_8262043701858009088_n.jpg?_nc_cat=101&_nc_sid=110474&_nc_ohc=uAuRxIght1EAX9eZM_k&_nc_ht=scontent-atl3-1.xx&tp=14&oh=8c3cbfd0c65c12eb62a7822c20a5b85b&oe=5F8A18A1,3.0,,1157904934593920,Blessings today to all who have served and are serving our country ❤️,https://facebook.com/story.php?story_fbid=1157904934593920&id=601292616921824,,0.0,Blessings today to all who have served and are serving our country ❤️,2020-05-25 20:57:26,,
15,0.0,,2.0,,1156162988101448,"Have a wonderful day!!!! Parents please check out info on website about Family Food Benefits starting in June!!!!!

P-EBT program is on the website. Click COVID19 resources for information on Family Food Benefit",https://facebook.com/story.php?story_fbid=1156162988101448&id=601292616921824,,0.0,"Have a wonderful day!!!! Parents please check out info on website about Family Food Benefits starting in June!!!!!

P-EBT program is on the website. Click COVID19 resources for information on Family Food Benefit",2020-05-23 13:03:03,,
16,0.0,https://scontent-atl3-1.xx.fbcdn.net/v/t1.0-9/fr/cp0/e15/q65/96669113_1146275425756871_3726672848484302848_n.jpg?_nc_cat=107&_nc_sid=110474&_nc_ohc=1eF7n0x_BcwAX9GtwIO&_nc_ht=scontent-atl3-1.xx&tp=14&oh=03bf3d1b54547662564e5c6265de40de&oe=5F8BAB0E,2.0,,1146275889090158,Happy Mother’s Day!!! We love our mother’s and blessings to you always!❤️,https://facebook.com/story.php?story_fbid=1146275889090158&id=601292616921824,,0.0,Happy Mother’s Day!!! We love our mother’s and blessings to you always!❤️,2020-05-10 11:56:08,,
17,0.0,https://scontent-atl3-1.xx.fbcdn.net/v/t1.0-9/fr/cp0/e15/q65/95816487_1141178006266613_4628150230095757312_n.jpg?_nc_cat=106&_nc_sid=110474&_nc_ohc=9wt8_h5WnZwAX82QQP3&_nc_ht=scontent-atl3-1.xx&tp=14&oh=417e7a55ff7c4d09c842b08f3a978072&oe=5F8B39A6,6.0,,1141178869599860,Tomorrow starts Teacher Appreciation week. Thank you to all of the hard working teachers at SEE. You are truly appreciated.,https://facebook.com/story.php?story_fbid=1141178869599860&id=601292616921824,,0.0,Tomorrow starts Teacher Appreciation week. Thank you to all of the hard working teachers at SEE. You are truly appreciated.,2020-05-03 20:55:57,,
18,0.0,,5.0,,1141000222951058,"Tomorrow May 4th is the day to pickup work for the next 3 weeks!!!! Please stop by your students campus to drop off completed work to be evaluated and new work to be done. Pick up and drop off times remain the same as food pickup 11:30-1:30 at Kelley, Walker, Lee, Saenz, and Oak Manner. Our staff missed seeing our students!!!!!",https://facebook.com/story.php?story_fbid=1141000222951058&id=601292616921824,,0.0,"Tomorrow May 4th is the day to pickup work for the next 3 weeks!!!! Please stop by your students campus to drop off completed work to be evaluated and new work to be done. Pick up and drop off times remain the same as food pickup 11:30-1:30 at Kelley, Walker, Lee, Saenz, and Oak Manner. Our staff missed seeing our students!!!!!",2020-05-03 14:44:36,,
19,0.0,,5.0,,1138522503198830,We love our teachers and all of their hard work as they continue online learning!!!!,https://facebook.com/story.php?story_fbid=1138522503198830&id=601292616921824,,0.0,We love our teachers and all of their hard work as they continue online learning!!!!,2020-04-30 13:50:25,,
20,0.0,,1.0,,1130105407373873,Food pickup and packet drop off will be from 11:30-1:30 tomorrow on all campuses and at Oak Manner. Look forward to seeing you soon. Please remember to bring in any completed work to you campus.,https://facebook.com/story.php?story_fbid=1130105407373873&id=601292616921824,,0.0,Food pickup and packet drop off will be from 11:30-1:30 tomorrow on all campuses and at Oak Manner. Look forward to seeing you soon. Please remember to bring in any completed work to you campus.,2020-04-19 16:55:26,,
21,0.0,,7.0,,1129460314105049,Please parents ensure your students are doing their work and turning it in. This is a tough time for all of us but we must continue to help our children grown in their educational needs. We realize that you have now become teachers which tough. We love you and we are here to support you in your efforts.,https://facebook.com/story.php?story_fbid=1129460314105049&id=601292616921824,,0.0,Please parents ensure your students are doing their work and turning it in. This is a tough time for all of us but we must continue to help our children grown in their educational needs. We realize that you have now become teachers which tough. We love you and we are here to support you in your efforts.,2020-04-18 21:10:25,,
22,0.0,https://scontent-atl3-1.xx.fbcdn.net/v/t1.0-9/fr/cp0/e15/q65/93796014_1127846257599788_7796041180466118656_n.jpg?_nc_cat=100&_nc_sid=110474&_nc_ohc=R3K5ohIVyBgAX_FsbPq&_nc_ht=scontent-atl3-1.xx&tp=14&oh=0dcd917a32509aa15431b81bd41372d4&oe=5F89AF27,5.0,,1127846450933102,"Hope you are all doing well! We miss you each day!
Ok",https://facebook.com/story.php?story_fbid=1127846450933102&id=601292616921824,,0.0,"Hope you are all doing well! We miss you each day!
Ok",2020-04-16 21:43:01,,
23,0.0,https://scontent-atl3-1.xx.fbcdn.net/v/t1.0-9/fr/cp0/e15/q65/93031510_1124269857957428_946570668453920768_n.jpg?_nc_cat=101&_nc_sid=110474&_nc_ohc=EnAP5oBjSa4AX-zyE-w&_nc_ht=scontent-atl3-1.xx&tp=14&oh=467550330f786287e282fe1bc313be66&oe=5F8BC906,2.0,,1124270727957341,We wish all a Happy Easter. Please stay safe and take care of yourself. We miss seeing our students.,https://facebook.com/story.php?story_fbid=1124270727957341&id=601292616921824,,0.0,We wish all a Happy Easter. Please stay safe and take care of yourself. We miss seeing our students.,2020-04-12 11:57:45,,
24,0.0,,2.0,https://tea.texas.gov/texas-schools/health-safety-discipline/stay-well-texas,1118311541886593,"Parents and students please check out this link and stay home/stay safe
https://tea.texas.gov/texas-schools/health-safety-discipline/stay-well-texas",https://facebook.com/story.php?story_fbid=1118311541886593&id=601292616921824,"Stay Well, Texas | Texas Education Agency

Stay Well, Texas | Texas Education Agency

See more at
tea.texas.gov",0.0,"Parents and students please check out this link and stay home/stay safe
https://tea.texas.gov/texas-schools/health-safety-discipline/stay-well-texas

Stay Well, Texas | Texas Education Agency

Stay Well, Texas | Texas Education Agency

See more at
tea.texas.gov",2020-04-04 14:59:25,,
25,0.0,,0.0,,1113900525661028,Meal pick up tomorrow at all campuses and Oak Manner 11:30-1. Stay safe.,https://facebook.com/story.php?story_fbid=1113900525661028&id=601292616921824,,0.0,Meal pick up tomorrow at all campuses and Oak Manner 11:30-1. Stay safe.,2020-03-29 20:21:28,,
26,0.0,,2.0,,1110578805993200,Face to face instruction is suspend until April 24th. Packets will be picked for grading and new packets issued on Monday. Please stay safe!!!,https://facebook.com/story.php?story_fbid=1110578805993200&id=601292616921824,,0.0,Face to face instruction is suspend until April 24th. Packets will be picked for grading and new packets issued on Monday. Please stay safe!!!,2020-03-25 18:39:21,,
27,0.0,,1.0,http://www.excellence-sa.org/,1104843779900036,Face to face instruction is cancelled until April 3. Student work packets can be picked up at your students campus this Friday from 1-5. If your student rides the bus. Please check out website www.excellence-sa.org. “Transportation Packet Drop Location”,https://facebook.com/story.php?story_fbid=1104843779900036&id=601292616921824,"EXCELLENCE-SA.ORG
School of Excellence in Education, San Antonio",0.0,"Face to face instruction is cancelled until April 3. Student work packets can be picked up at your students campus this Friday from 1-5. If your student rides the bus. Please check out website www.excellence-sa.org. “Transportation Packet Drop Location”

EXCELLENCE-SA.ORG
School of Excellence in Education, San Antonio",2020-03-18 21:02:39,,
28,1.0,,3.0,,1101535720230842,Spring Break is extended one week. Classes resume March 23.,https://facebook.com/story.php?story_fbid=1101535720230842&id=601292616921824,,0.0,Spring Break is extended one week. Classes resume March 23.,2020-03-14 14:30:06,,
29,0.0,https://scontent-atl3-1.xx.fbcdn.net/v/t1.0-9/fr/cp0/e15/q65/87164981_1097003500684064_2887983181456211968_n.jpg?_nc_cat=109&_nc_sid=110474&_nc_ohc=NHHHIFGiD98AX_XXcX5&_nc_ht=scontent-atl3-1.xx&tp=14&oh=5bf23ea54062b1b4fbf46aa6130baadf&oe=5F89A10B,6.0,,1097003600684054,Enjoy Spring Break!!,https://facebook.com/story.php?story_fbid=1097003600684054&id=601292616921824,,0.0,Enjoy Spring Break!!,2020-03-08 16:55:01,,
30,0.0,https://scontent-atl3-1.xx.fbcdn.net/v/t1.0-9/fr/cp0/e15/q65/80713619_1041551029562645_5270347673067585536_n.jpg?_nc_cat=105&_nc_sid=110474&_nc_ohc=Btsj8TgSjJIAX8AQWNy&_nc_ht=scontent-atl3-1.xx&tp=14&oh=c2c3a35920c3d8769fb27008453db66f&oe=5F89E03E,3.0,,1041551742895907,"Go our parents,students,and hard working staff. Blessings for a new year!!!!",https://facebook.com/story.php?story_fbid=1041551742895907&id=601292616921824,,0.0,"Go our parents,students,and hard working staff. Blessings for a new year!!!!",2020-01-01 01:26:15,,
31,0.0,https://scontent-atl3-1.xx.fbcdn.net/v/t1.0-9/fr/cp0/e15/q65/80467016_1035033410214407_6948992330258972672_n.jpg?_nc_cat=103&_nc_sid=110474&_nc_ohc=w5HUMXV0-QIAX_0kMnG&_nc_ht=scontent-atl3-1.xx&tp=14&oh=22140ff323c9ebc6a41e3ad266cd354a&oe=5F899C42,4.0,,1035033966881018,"Merry Christmas to the students, parents, teachers, and supporters of the School of Excellence! Peace and joy to all.",https://facebook.com/story.php?story_fbid=1035033966881018&id=601292616921824,,0.0,"Merry Christmas to the students, parents, teachers, and supporters of the School of Excellence! Peace and joy to all.",2019-12-25 16:36:59,,
32,1.0,https://scontent-atl3-1.xx.fbcdn.net/v/t1.0-9/fr/cp0/e15/q65/79794709_1029112847473130_4309731611152220160_n.jpg?_nc_cat=103&_nc_sid=110474&_nc_ohc=O9vLZ06CIL4AX9Dl9z4&_nc_ht=scontent-atl3-1.xx&tp=14&oh=b6ab176f6bb30de9338eaf175e890287&oe=5F88A3C2,6.0,,1029113100806438,,https://facebook.com/story.php?story_fbid=1029113100806438&id=601292616921824,,0.0,,2019-12-19 14:38:13,,
33,0.0,https://scontent-atl3-1.xx.fbcdn.net/v/t1.0-9/fr/cp0/e15/q65/80359350_1029112550806493_5776681170024529920_n.jpg?_nc_cat=105&_nc_sid=110474&_nc_ohc=QiMiEDbWkBEAX-SaBqs&_nc_ht=scontent-atl3-1.xx&tp=14&oh=04175dced41df04b61b8276cf9a735b2&oe=5F8BF270,3.0,,1029112637473151,Wolfpack,https://facebook.com/story.php?story_fbid=1029112637473151&id=601292616921824,,0.0,Wolfpack,2019-12-19 14:37:33,,
34,0.0,,4.0,,1029109190806829,,,,0.0,,2019-12-19 14:31:47,https://video-atl3-1.xx.fbcdn.net/v/t42.9040-2/81301932_443110623288292_6231198497895350272_n.mp4?_nc_cat=107&_nc_sid=985c63&efg=eyJ2ZW5jb2RlX3RhZyI6InN2ZV9zZCJ9&_nc_ohc=ACeturK36TUAX8HSXnd&_nc_ht=video-atl3-1.xx&oh=a02f83ac0aaaf19232c65dd0c9ca9e0f&oe=5F6490EE,
35,0.0,,3.0,,1029061767478238,Wolfpack playing Sa inal at ATT Center,,,0.0,Wolfpack playing Sa inal at ATT Center,2019-12-19 13:15:01,https://video-atl3-1.xx.fbcdn.net/v/t42.9040-2/80926552_2811011365604396_7480693746607063040_n.mp4?_nc_cat=108&_nc_sid=985c63&efg=eyJ2ZW5jb2RlX3RhZyI6InN2ZV9zZCJ9&_nc_ohc=jlY-_OrxKgMAX9TFzv4&_nc_ht=video-atl3-1.xx&oh=cdb5c4b978ea4b53c0750b8e41ef1d65&oe=5F648D91,
36,0.0,,3.0,,1017444275306654,Junior High team in action!,,,0.0,Junior High team in action!,2019-12-07 17:08:10,https://video-atl3-1.xx.fbcdn.net/v/t42.9040-2/79917051_565891040866471_635552248096620544_n.mp4?_nc_cat=109&_nc_sid=985c63&efg=eyJ2ZW5jb2RlX3RhZyI6InN2ZV9zZCJ9&_nc_ohc=iqJLV0JoiQoAX-2GCTi&_nc_ht=video-atl3-1.xx&oh=d1499c31f657d2d7bdc4dda12ccc67bf&oe=5F6485FE,
37,1.0,https://scontent-atl3-1.xx.fbcdn.net/v/t1.0-9/fr/cp0/e15/q65/79438787_1017442628640152_5839996212102561792_n.jpg?_nc_cat=108&_nc_sid=110474&_nc_ohc=aOsG6vFjBEwAX-gjCw2&_nc_ht=scontent-atl3-1.xx&tp=14&oh=ee2bda6836ead9aced7dccd7333910ef&oe=5F8A3AE2,11.0,,1017442818640133,Dr Paul Saenz Junior High basketball team takes 3rd place in St George Tournament!!,https://facebook.com/story.php?story_fbid=1017442818640133&id=601292616921824,,0.0,Dr Paul Saenz Junior High basketball team takes 3rd place in St George Tournament!!,2019-12-07 17:05:27,,
38,0.0,https://scontent-atl3-1.xx.fbcdn.net/v/t1.0-9/fr/cp0/e15/q65/72224323_967201866997562_6076902330362494976_n.jpg?_nc_cat=109&_nc_sid=110474&_nc_ohc=6cT1Ur4n_1EAX9lP45I&_nc_ht=scontent-atl3-1.xx&tp=14&oh=f45a04c72846b2e898f1a11bae27fab8&oe=5F8A7F63,4.0,,967202000330882,"Come out and support the Wolfpack Athletes at our plate sale!!!! Let me know how many plates and which ones
so I can hold them for you. Next Saturday 11-3",https://facebook.com/story.php?story_fbid=967202000330882&id=601292616921824,,0.0,"Come out and support the Wolfpack Athletes at our plate sale!!!! Let me know how many plates and which ones
so I can hold them for you. Next Saturday 11-3",2019-10-13 11:30:35,,
39,0.0,https://scontent-atl3-1.xx.fbcdn.net/v/t1.0-9/fr/cp0/e15/q65/72131979_960667404317675_99995978341285888_n.jpg?_nc_cat=110&_nc_sid=110474&_nc_ohc=FVXIwFnmt7QAX_k0DSa&_nc_ht=scontent-atl3-1.xx&tp=14&oh=08d47c52bbca2d0c82ebb555d51272ba&oe=5F891A66,3.0,,960667620984320,"Walmart, Zapato’s, and Jesse Borrego in the house!!",https://facebook.com/story.php?story_fbid=960667620984320&id=601292616921824,,0.0,"Walmart, Zapato’s, and Jesse Borrego in the house!!",2019-10-05 15:50:12,,
40,1.0,https://scontent-atl3-1.xx.fbcdn.net/v/t1.0-9/fr/cp0/e15/q65/72528990_958969667820782_964052400824385536_n.jpg?_nc_cat=102&_nc_sid=110474&_nc_ohc=X0fzpJd1_zoAX922WqX&_nc_ht=scontent-atl3-1.xx&tp=14&oh=fe60d94274f33b6c13a5c958caa15726&oe=5F8A3F9D,5.0,,958969994487416,Come out and support our local Walmart!!!!,https://facebook.com/story.php?story_fbid=958969994487416&id=601292616921824,,0.0,Come out and support our local Walmart!!!!,2019-10-03 13:55:10,,
41,0.0,https://scontent-atl3-1.xx.fbcdn.net/v/t1.0-9/fr/cp0/e15/q65/67948672_919008858483530_8924565312326598656_n.jpg?_nc_cat=105&_nc_sid=110474&_nc_ohc=R7kiCSqET_kAX-q0Xhl&_nc_ht=scontent-atl3-1.xx&tp=14&oh=24339cc5a3b353482e86f0ae0687b655&oe=5F8B3AA7,3.0,,919010468483369,"Another successful Stuff the Bus! I appreciate all those who came out to support. Mr and Mrs Flores (parents of Mo,Desi,Mallory) for always being supportive!!!! Robert Romo with Walmart for helping out! And one of my favorite families- The Davila’s who come through every year!!! I am truly blessed. Many thanks!!!",https://facebook.com/story.php?story_fbid=919010468483369&id=601292616921824,,0.0,"Another successful Stuff the Bus! I appreciate all those who came out to support. Mr and Mrs Flores (parents of Mo,Desi,Mallory) for always being supportive!!!! Robert Romo with Walmart for helping out! And one of my favorite families- The Davila’s who come through every year!!! I am truly blessed. Many thanks!!!",2019-08-11 10:22:48,,
42,0.0,https://scontent-atl3-1.xx.fbcdn.net/v/t1.0-9/fr/cp0/e15/q65/67953901_913136149070801_7478430354676645888_n.jpg?_nc_cat=105&_nc_sid=110474&_nc_ohc=J97UJvW3G84AX9utU4v&_nc_ht=scontent-atl3-1.xx&tp=14&oh=51c6218c999d32bc89f08a66d4a4e3b0&oe=5F891A83,6.0,,913137032404046,Come out next Saturday tho help is Stuff the Bus for our students 3 locations 1. Vance Jackson. 2. Bandera at Woodlawn 3. Summit Parkway. 8am to 5pm.,https://facebook.com/story.php?story_fbid=913137032404046&id=601292616921824,,0.0,Come out next Saturday tho help is Stuff the Bus for our students 3 locations 1. Vance Jackson. 2. Bandera at Woodlawn 3. Summit Parkway. 8am to 5pm.,2019-08-03 20:26:30,,
43,0.0,,2.0,,389893851878979,,,"TUE, JUL 23, 2019
Family Fun Night",0.0,"TUE, JUL 23, 2019
Family Fun Night",2019-07-22 18:09:06,,
44,1.0,https://scontent-atl3-1.xx.fbcdn.net/v/t1.0-9/fr/cp0/e15/q65/67386936_902632100121206_2791274455119167488_n.jpg?_nc_cat=110&_nc_sid=110474&_nc_ohc=49pla8V571cAX98_2Q2&_nc_ht=scontent-atl3-1.xx&tp=14&oh=500b08e025d8c88b1ce22fbb184361ed&oe=5F8B8C53,6.0,,902632260121190,Summer League finished tonight. Good time had by all.,https://facebook.com/story.php?story_fbid=902632260121190&id=601292616921824,,0.0,Summer League finished tonight. Good time had by all.,2019-07-19 22:42:08,,
45,0.0,,2.0,https://images.app.goo.gl/8TNF2SGr5WCBKZ5F8,891539894563760,To all who served!!!!,https://facebook.com/story.php?story_fbid=891539894563760&id=601292616921824,"GOOGLE.COM
Image: Happy 4th of July Quotes, Pictures & Images | SayingImages.com",0.0,"To all who served!!!!

GOOGLE.COM
Image: Happy 4th of July Quotes, Pictures & Images | SayingImages.com",2019-07-04 12:34:23,,
46,0.0,,2.0,,345521973054552,,,"THU, JUN 20, 2019
Bright Ideas",0.0,"THU, JUN 20, 2019
Bright Ideas",2019-06-17 18:46:29,,
47,0.0,https://scontent-atl3-1.xx.fbcdn.net/v/t1.0-9/fr/cp0/e15/q65/64480264_878736479177435_3578962609572937728_n.jpg?_nc_cat=103&_nc_sid=110474&_nc_ohc=_Uv-F5sjyHwAX_t7vxj&_nc_ht=scontent-atl3-1.xx&tp=14&oh=aee11f54f90e782fa2bd931d6df36518&oe=5F8890AB,6.0,,878736682510748,Happy Fathers Day to all the Dad’s!!!,https://facebook.com/story.php?story_fbid=878736682510748&id=601292616921824,,0.0,Happy Fathers Day to all the Dad’s!!!,2019-06-16 20:36:58,,
