,comments,image,likes,link,post_id,post_text,post_url,shared_text,shares,text,time,video,video_thumbnail
48,0.0,https://scontent-atl3-1.xx.fbcdn.net/v/t1.0-9/fr/cp0/e15/q65/61986190_867708640280219_4855559557188943872_n.jpg?_nc_cat=103&_nc_sid=110474&_nc_ohc=o3LkUuQ5OJoAX9Lab5R&_nc_ht=scontent-atl3-1.xx&tp=14&oh=7725ad7be368005bc0ff21cbcddb5f99&oe=5F88605B,8.0,,867713580279725,SEE Lee Academy guest speaker Salutatorian from class of 2009 guest speaker addresses class of 2019. She is completing work on her PHD in Chemistry at Clark Atlanta,https://facebook.com/story.php?story_fbid=867713580279725&id=601292616921824,,0.0,SEE Lee Academy guest speaker Salutatorian from class of 2009 guest speaker addresses class of 2019. She is completing work on her PHD in Chemistry at Clark Atlanta,2019-06-01 12:00:03,,
49,2.0,,3.0,,867229593661457,100% Graduation rate. Lee Academy graduation will be held at 6500 IH 35 N tomorrow at 10am. Come join the celebration and wish our Senior well as they continue their journey,https://facebook.com/story.php?story_fbid=867229593661457&id=601292616921824,,0.0,100% Graduation rate. Lee Academy graduation will be held at 6500 IH 35 N tomorrow at 10am. Come join the celebration and wish our Senior well as they continue their journey,2019-05-31 19:00:43,,
50,0.0,,2.0,,863056810745402,"Our High School
Graduation will be held on June 1st at 10:00am at Alamo City Church. This is the 21st graduation for our school. 100% class graduation!!! So proud of our students!!!!",https://facebook.com/story.php?story_fbid=863056810745402&id=601292616921824,,0.0,"Our High School
Graduation will be held on June 1st at 10:00am at Alamo City Church. This is the 21st graduation for our school. 100% class graduation!!! So proud of our students!!!!",2019-05-25 14:45:54,,
51,1.0,,2.0,,862401834144233,New CNA Dual Credit program with St Phillips starting 2019-2020,https://facebook.com/story.php?story_fbid=862401834144233&id=601292616921824,,0.0,New CNA Dual Credit program with St Phillips starting 2019-2020,2019-05-24 16:03:50,,
52,0.0,https://scontent-atl3-1.xx.fbcdn.net/v/t1.0-9/fr/cp0/e15/q65/60353638_854286011622482_516299650739732480_n.jpg?_nc_cat=102&_nc_sid=110474&_nc_ohc=oX1ok-lN4HEAX8y5Z9r&_nc_ht=scontent-atl3-1.xx&tp=14&oh=3762e004bfe692c76f0eff7edefb0b87&oe=5F881FBF,51.0,,854286048289145,Happy Mother’s Day to all of the wonderful mothers from the School of Excellence in Education!!,https://facebook.com/story.php?story_fbid=854286048289145&id=601292616921824,,0.0,Happy Mother’s Day to all of the wonderful mothers from the School of Excellence in Education!!,2019-05-12 15:19:44,,
53,0.0,https://scontent-atl3-1.xx.fbcdn.net/v/t1.0-9/fr/cp0/e15/q65/60041808_851358128581937_8675285251552968704_n.jpg?_nc_cat=111&_nc_sid=110474&_nc_ohc=19tl-3anLsMAX8JxpGd&_nc_ht=scontent-atl3-1.xx&tp=14&oh=e8aea3e46fb750c432211d52eb59ffa3&oe=5F88E016,0.0,,852407975143619,,https://facebook.com/story.php?story_fbid=852407975143619&id=601292616921824,"School of Excellence in Education
May 7, 2019 at 8:01 PM ·

Time for golf! Join us at Ft Sam Golf Course May 18 to raise money for scholarships!!!",0.0,"School of Excellence in Education
May 7, 2019 at 8:01 PM ·

Time for golf! Join us at Ft Sam Golf Course May 18 to raise money for scholarships!!!",2019-05-09 15:46:11,,
54,0.0,https://scontent-atl3-1.xx.fbcdn.net/v/t1.0-9/fr/cp0/e15/q65/60041808_851358128581937_8675285251552968704_n.jpg?_nc_cat=111&_nc_sid=110474&_nc_ohc=19tl-3anLsMAX8JxpGd&_nc_ht=scontent-atl3-1.xx&tp=14&oh=e8aea3e46fb750c432211d52eb59ffa3&oe=5F88E016,0.0,,852407765143640,,https://facebook.com/story.php?story_fbid=852407765143640&id=601292616921824,"School of Excellence in Education
May 7, 2019 at 8:01 PM ·

Time for golf! Join us at Ft Sam Golf Course May 18 to raise money for scholarships!!!",0.0,"School of Excellence in Education
May 7, 2019 at 8:01 PM ·

Time for golf! Join us at Ft Sam Golf Course May 18 to raise money for scholarships!!!",2019-05-09 15:45:42,,
55,0.0,https://scontent-atl3-1.xx.fbcdn.net/v/t1.0-9/fr/cp0/e15/q65/60041808_851358128581937_8675285251552968704_n.jpg?_nc_cat=111&_nc_sid=110474&_nc_ohc=19tl-3anLsMAX8JxpGd&_nc_ht=scontent-atl3-1.xx&tp=14&oh=e8aea3e46fb750c432211d52eb59ffa3&oe=5F88E016,0.0,,851358371915246,Time for golf! Join us at Ft Sam Golf Course May 18 to raise money for scholarships!!!,https://facebook.com/story.php?story_fbid=851358371915246&id=601292616921824,,0.0,Time for golf! Join us at Ft Sam Golf Course May 18 to raise money for scholarships!!!,2019-05-07 21:01:23,,
56,0.0,https://scontent-atl3-1.xx.fbcdn.net/v/t1.0-9/fr/cp0/e15/q65/59476246_849285488789201_839318003563626496_n.jpg?_nc_cat=104&_nc_sid=110474&_nc_ohc=XRR3LjwQBKsAX8Ydh-r&_nc_ht=scontent-atl3-1.xx&tp=14&oh=bff87fe5bb978b93a6512e7f01fd3965&oe=5F88F758,1.0,,849285572122526,Cinco de Mayo in the house. All day today and most of day tomorrow!! Walmart and Romo also!!!!,https://facebook.com/story.php?story_fbid=849285572122526&id=601292616921824,,0.0,Cinco de Mayo in the house. All day today and most of day tomorrow!! Walmart and Romo also!!!!,2019-05-04 10:39:53,,
57,0.0,https://scontent-atl3-1.xx.fbcdn.net/v/t1.0-9/fr/cp0/e15/q65/57350444_836960173355066_8833760954840776704_n.jpg?_nc_cat=111&_nc_sid=110474&_nc_ohc=Zsn68V8IMjkAX_JXIjt&_nc_ht=scontent-atl3-1.xx&tp=14&oh=3646cb9323f723260465c57bf6981e79&oe=5F88BE39,3.0,,836960453355038,Great time had by all at the 1K 5K Wellness Event helps at Walker Elementary today!!!!,https://facebook.com/story.php?story_fbid=836960453355038&id=601292616921824,,0.0,Great time had by all at the 1K 5K Wellness Event helps at Walker Elementary today!!!!,2019-04-13 18:40:24,,
58,2.0,https://scontent-atl3-1.xx.fbcdn.net/v/t1.0-9/fr/cp0/e15/q65/56428443_832281057156311_9096804620566528000_n.jpg?_nc_cat=108&_nc_sid=110474&_nc_ohc=OTB2sx_eD-UAX_oKNAG&_nc_ht=scontent-atl3-1.xx&tp=14&oh=0ebe40c8c6ad9cd931a85522d1561d9b&oe=5F8BC857,6.0,,832281153822968,Wolfpack at District Track. Way to go team!!!,https://facebook.com/story.php?story_fbid=832281153822968&id=601292616921824,,0.0,Wolfpack at District Track. Way to go team!!!,2019-04-05 15:21:34,,
59,1.0,,3.0,,829503620767388,Health and Wellness Fair Saturday April13th. 1K and 5K games door prizes competitions lots of Fun. Come out and join us!!!,https://facebook.com/story.php?story_fbid=829503620767388&id=601292616921824,,0.0,Health and Wellness Fair Saturday April13th. 1K and 5K games door prizes competitions lots of Fun. Come out and join us!!!,2019-03-31 17:13:50,,
60,0.0,https://scontent-atl3-1.xx.fbcdn.net/v/t1.0-9/fr/cp0/e15/q65/52582569_807848619599555_1510391490919006208_n.jpg?_nc_cat=102&_nc_sid=110474&_nc_ohc=1PmbhXFHQhoAX_K8B4Z&_nc_ht=scontent-atl3-1.xx&tp=14&oh=1ad233d98f48a95d654af6e8f0d261df&oe=5F895488,0.0,,807848642932886,Need help with uniforms at Kelley. Let us know. See;,https://facebook.com/story.php?story_fbid=807848642932886&id=601292616921824,,0.0,Need help with uniforms at Kelley. Let us know. See;,2019-02-20 15:05:42,,
61,2.0,https://scontent-atl3-1.xx.fbcdn.net/v/t1.0-9/fr/cp0/e15/q65/52486481_807458239638593_3371738451949912064_n.jpg?_nc_cat=104&_nc_sid=110474&_nc_ohc=6uSAXP40GocAX9pzQRz&_nc_ht=scontent-atl3-1.xx&tp=14&oh=d375c3594289d3a73d4cf03118144563&oe=5F8B604B,8.0,,807459026305181,Wolfpack wins Bi-District game!!!! On to Area.,https://facebook.com/story.php?story_fbid=807459026305181&id=601292616921824,,0.0,Wolfpack wins Bi-District game!!!! On to Area.,2019-02-19 22:25:30,,
62,2.0,https://scontent-atl3-1.xx.fbcdn.net/v/t1.0-9/fr/cp0/e15/q65/51910921_803738936677190_2093149081890193408_n.jpg?_nc_cat=106&_nc_sid=110474&_nc_ohc=T3RmmX5CMLAAX-bIfK6&_nc_ht=scontent-atl3-1.xx&tp=14&oh=e680558a2fb8a6a1c0e0cd8b747d2d2b&oe=5F88D0AA,3.0,,803739170010500,Boys finished strong! Won District 29AA,https://facebook.com/story.php?story_fbid=803739170010500&id=601292616921824,,0.0,Boys finished strong! Won District 29AA,2019-02-13 10:44:46,,
63,0.0,https://scontent-atl3-1.xx.fbcdn.net/v/t1.0-9/fr/cp0/e15/q65/51311757_796898404027910_1255144801448230912_n.jpg?_nc_cat=103&_nc_sid=110474&_nc_ohc=NlTwden9OTUAX97Avpa&_nc_ht=scontent-atl3-1.xx&tp=14&oh=e8bd1b3f2409efd16edd1daf542ae1ff&oe=5F8BD9EA,7.0,,796898664027884,Lady Wolfpack takes the win!!!!,https://facebook.com/story.php?story_fbid=796898664027884&id=601292616921824,,0.0,Lady Wolfpack takes the win!!!!,2019-02-01 19:32:32,,
64,1.0,https://scontent-atl3-1.xx.fbcdn.net/v/t1.0-9/fr/cp0/e15/q65/51243240_796897944027956_201007686383304704_n.jpg?_nc_cat=110&_nc_sid=110474&_nc_ohc=gx3tzN39pUMAX_ABKes&_nc_oc=AQnIXx_uFShnoGbaf-TNm_2EkVAb-QRXTMXbsmeG_oJGpiKSiXxQr8RKNvYXwg4AdQk&_nc_ht=scontent-atl3-1.xx&tp=14&oh=8574c053bba8747c864590ab4023136c&oe=5F8AAFA3,8.0,,796898097361274,Congratulations to the Lady Wolfpack!!!,https://facebook.com/story.php?story_fbid=796898097361274&id=601292616921824,,0.0,Congratulations to the Lady Wolfpack!!!,2019-02-01 19:31:12,,
65,0.0,https://scontent-atl3-1.xx.fbcdn.net/v/t1.0-9/fr/cp0/e15/q65/44862259_741083902942694_7841098273619181568_n.jpg?_nc_cat=103&_nc_sid=110474&_nc_ohc=nYkQg8F-IHEAX-sTN8z&_nc_ht=scontent-atl3-1.xx&tp=14&oh=1b85690742d88d61305bc579127612f2&oe=5F88F017,4.0,,741084172942667,Casino Night was a success and great fun for all that attended,https://facebook.com/story.php?story_fbid=741084172942667&id=601292616921824,,0.0,Casino Night was a success and great fun for all that attended,2018-10-28 00:52:17,,
66,1.0,https://scontent-atl3-1.xx.fbcdn.net/v/t1.0-9/fr/cp0/e15/q65/43734638_740792432971841_342728550450724864_n.jpg?_nc_cat=101&_nc_sid=110474&_nc_ohc=OW1W9yNmj6kAX_27iZM&_nc_ht=scontent-atl3-1.xx&tp=14&oh=2238316e6af63ec486ff79493314a055&oe=5F8A444D,9.0,,740792712971813,Saenz Jr Hi opens season with a win!!!,https://facebook.com/story.php?story_fbid=740792712971813&id=601292616921824,,0.0,Saenz Jr Hi opens season with a win!!!,2018-10-27 10:57:23,,
67,0.0,https://scontent-atl3-1.xx.fbcdn.net/v/t1.0-9/fr/cp0/e15/q65/44678944_738902753160809_4585359389321330688_n.jpg?_nc_cat=101&_nc_sid=110474&_nc_ohc=F1W46tCFJrMAX_SdOfr&_nc_ht=scontent-atl3-1.xx&tp=14&oh=115f198b1cf9bc26c3e088c219ad9b08&oe=5F8B5CDC,14.0,,738903109827440,Senior and parent night!! Love these kids.,https://facebook.com/story.php?story_fbid=738903109827440&id=601292616921824,,0.0,Senior and parent night!! Love these kids.,2018-10-23 22:03:06,,
68,1.0,https://scontent-atl3-1.xx.fbcdn.net/v/t1.0-9/fr/cp0/e15/q65/44088655_734154536968964_1904771910776913920_n.jpg?_nc_cat=100&_nc_sid=110474&_nc_ohc=O5CS8YCZEZQAX8dWw5Z&_nc_ht=scontent-atl3-1.xx&tp=14&oh=d9ffc6e614b153461426ee295acab29d&oe=5F8AB094,8.0,,734154616968956,Great time had by all at the Walmart sponsored all star tournament yesterday!! Celebrities in the house!,https://facebook.com/story.php?story_fbid=734154616968956&id=601292616921824,,0.0,Great time had by all at the Walmart sponsored all star tournament yesterday!! Celebrities in the house!,2018-10-14 16:04:20,,
69,1.0,,2.0,,728659750816209,,,"SAT, OCT 27, 2018
Casino Night",0.0,"SAT, OCT 27, 2018
Casino Night",2018-10-02 11:51:01,,
70,0.0,https://scontent-atl3-1.xx.fbcdn.net/v/t1.0-9/fr/cp0/e15/q65/40833751_715003132217438_4606401095529398272_n.jpg?_nc_cat=105&_nc_sid=110474&_nc_ohc=5mUdpHRF8GEAX86XXEK&_nc_ht=scontent-atl3-1.xx&tp=14&oh=c5782c2f97220f5230db72614ed10d36&oe=5F896763,8.0,,715003182217433,Lady Wolfpack does it again!! They defeated Gervin in 3 tonight!!! Good job ladies!!,https://facebook.com/story.php?story_fbid=715003182217433&id=601292616921824,,0.0,Lady Wolfpack does it again!! They defeated Gervin in 3 tonight!!! Good job ladies!!,2018-09-04 21:17:50,,
71,0.0,https://scontent-atl3-1.xx.fbcdn.net/v/t1.0-9/fr/cp0/e15/q65/40520700_712312759153142_8098636684624658432_n.jpg?_nc_cat=102&_nc_sid=110474&_nc_ohc=S6lZFSMkMIUAX8T922L&_nc_ht=scontent-atl3-1.xx&tp=14&oh=d4f704546872f9637e28d254942334da&oe=5F8B2647,6.0,,712312905819794,Lady Wolfpack defeats Athlos!! Way to go ladies and coaches.,https://facebook.com/story.php?story_fbid=712312905819794&id=601292616921824,,0.0,Lady Wolfpack defeats Athlos!! Way to go ladies and coaches.,2018-08-31 20:39:03,,
72,0.0,https://scontent-atl3-1.xx.fbcdn.net/v/t1.0-9/fr/cp0/e15/q65/39864426_705224126528672_7315905235963084800_n.jpg?_nc_cat=105&_nc_sid=110474&_nc_ohc=cOfP740wXZEAX96SonU&_nc_ht=scontent-atl3-1.xx&tp=14&oh=47a7242339d1d9d5462d1d042de980cd&oe=5F8A7872,2.0,,705224449861973,Lady Wolfpack played hard tonight. They continue to grow work as a team!! So proud,https://facebook.com/story.php?story_fbid=705224449861973&id=601292616921824,,0.0,Lady Wolfpack played hard tonight. They continue to grow work as a team!! So proud,2018-08-21 21:47:15,,
73,2.0,,4.0,,702544990129919,Tomorrow starts the 21st year for the School of Excellence in Education. Students who are returning and those who are new welcome. Let’s have a productive school year filled with successes!!!!,https://facebook.com/story.php?story_fbid=702544990129919&id=601292616921824,,0.0,Tomorrow starts the 21st year for the School of Excellence in Education. Students who are returning and those who are new welcome. Let’s have a productive school year filled with successes!!!!,2018-08-19 12:10:05,,
74,0.0,,1.0,,691775237873561,Good morning world!!! One last stuff the bus activity for me with the School of Excellence in Education!!! Come out and help with a donation. Even a small donation will Help a child!!!!! There will be a bus at Walmart on Vance Jackson at IH10 (Robert Romo’s store)!!! I will be there from 10-12 and 4-6!!! Would love to see you!!!!!!,https://facebook.com/story.php?story_fbid=691775237873561&id=601292616921824,,0.0,Good morning world!!! One last stuff the bus activity for me with the School of Excellence in Education!!! Come out and help with a donation. Even a small donation will Help a child!!!!! There will be a bus at Walmart on Vance Jackson at IH10 (Robert Romo’s store)!!! I will be there from 10-12 and 4-6!!! Would love to see you!!!!!!,2018-08-09 09:58:55,,
75,1.0,,1.0,,2046064652091029,,,"TUE, AUG 14, 2018
SEE 20th Year Anniversary Alumni Mixer and Recruitment",0.0,"TUE, AUG 14, 2018
SEE 20th Year Anniversary Alumni Mixer and Recruitment",2018-08-08 15:06:17,,
76,0.0,,0.0,,681841515533600,Lady Wolfpack Volleyball practice begins 8/1/18 from 8-11 and 1-4! Let's go Wolfpack!!!!,https://facebook.com/story.php?story_fbid=681841515533600&id=601292616921824,,0.0,Lady Wolfpack Volleyball practice begins 8/1/18 from 8-11 and 1-4! Let's go Wolfpack!!!!,2018-07-30 17:15:17,,
77,2.0,https://scontent-atl3-1.xx.fbcdn.net/v/t1.0-9/fr/cp0/e15/q65/37913176_679649382419480_7104202346573332480_n.jpg?_nc_cat=110&_nc_sid=110474&_nc_ohc=Wi4qKdjG6uYAX9QRH2v&_nc_ht=scontent-atl3-1.xx&tp=14&oh=49426e63291886c764089de215faec87&oe=5F8A3E0F,6.0,,679649399086145,Little Wolfpack brings it home!!!❤️❤️🎉🎉,https://facebook.com/story.php?story_fbid=679649399086145&id=601292616921824,,0.0,Little Wolfpack brings it home!!!❤️❤️🎉🎉,2018-07-28 14:01:55,,
78,0.0,,0.0,,648761672174918,Hello Lee Academy students--we are hosting a tournament this weekend and I am looking for help with concessions and the book. Please let me know if you can help. Time is 7;30-6:30!!!,https://facebook.com/story.php?story_fbid=648761672174918&id=601292616921824,,0.0,Hello Lee Academy students--we are hosting a tournament this weekend and I am looking for help with concessions and the book. Please let me know if you can help. Time is 7;30-6:30!!!,2018-06-26 12:36:49,,
79,0.0,,0.0,,644914815892937,,https://facebook.com/story.php?story_fbid=644914815892937&id=601292616921824,School of Excellence in Education updated their phone number.,0.0,School of Excellence in Education updated their phone number.,2018-06-22 11:31:56,,
80,0.0,,0.0,http://www.excellence-sa.org/,644914812559604,,https://facebook.com/story.php?story_fbid=644914812559604&id=601292616921824,School of Excellence in Education updated their website address.,0.0,School of Excellence in Education updated their website address.,2018-06-22 11:31:56,,
81,0.0,,0.0,http://share.here.com/r/mylocation/e-eyJuYW1lIjoiU2Nob29sIG9mIEV4Y2VsbGVuY2UgaW4gRWR1Y2F0aW9uIiwiYWRkcmVzcyI6IjE4MjYgQmFzc2UgUmQsIFNhbiBBbnRvbmlvLCBUWCA3ODIxMyIsImxhdGl0dWRlIjoyOS40ODc1MSwibG9uZ2l0dWRlIjotOTguNTE0NiwicHJvdmlkZXJOYW1lIjoiZmFjZWJvb2siLCJwcm92aWRlcklkIjo2MDEyOTI2MTY5MjE4MjR9?link=addresses&fb_locale=en_US&ref=fb_mobile,644914809226271,,https://facebook.com/story.php?story_fbid=644914809226271&id=601292616921824,School of Excellence in Education updated their address.,0.0,School of Excellence in Education updated their address.,2018-06-22 11:31:56,,
82,0.0,,2.0,,637918303259255,Looking for students and ex-students volunteers to help with neighborhood walk this Saturday at Lee Academy Start time is 8am! Come out and help with recruiting efforts!!! Mrs Berrios and others will be there!!!!!,https://facebook.com/story.php?story_fbid=637918303259255&id=601292616921824,"SAT, JUN 16, 2018
School of Excellence in Education",0.0,"Looking for students and ex-students volunteers to help with neighborhood walk this Saturday at Lee Academy Start time is 8am! Come out and help with recruiting efforts!!! Mrs Berrios and others will be there!!!!!

SAT, JUN 16, 2018
School of Excellence in Education",2018-06-14 08:21:49,,
83,0.0,https://scontent-atl3-1.xx.fbcdn.net/v/t1.0-9/fr/cp0/e15/q65/35151414_636921193358966_8845107077320802304_n.jpg?_nc_cat=104&_nc_sid=110474&_nc_ohc=AydGXPR4bXgAX_yOVEu&_nc_ht=scontent-atl3-1.xx&tp=14&oh=498f2be9f102eb6693dd43f7bb83553a&oe=5F890392,3.0,,636921363358949,Iman Matan signs with Houston Tillotson!!! So proud of this young man!!!,https://facebook.com/story.php?story_fbid=636921363358949&id=601292616921824,,0.0,Iman Matan signs with Houston Tillotson!!! So proud of this young man!!!,2018-06-12 21:25:27,,
84,0.0,https://scontent-atl3-1.xx.fbcdn.net/v/t1.0-9/fr/cp0/e15/q65/34274761_631613290556423_3920231794560991232_n.jpg?_nc_cat=101&_nc_sid=110474&_nc_ohc=WhUNxrvxIp0AX_huihJ&_nc_ht=scontent-atl3-1.xx&tp=14&oh=043a0144a45c58decebf289e7e0a8150&oe=5F8B1F0D,3.0,,631613443889741,"From Mrs Berrios!!!! Better known as Dona!!! Yesterday, was the last day of school. I took a group picture with the juniors, the class of 2019. 💗
Today, I took group pictures with the Senior class of 2018.
Good job graduates!!!
This class received over $800,000 in scholarships and awards
Remember, life is a journey. Choose wisely! 💗",https://facebook.com/story.php?story_fbid=631613443889741&id=601292616921824,,0.0,"From Mrs Berrios!!!! Better known as Dona!!! Yesterday, was the last day of school. I took a group picture with the juniors, the class of 2019. 💗
Today, I took group pictures with the Senior class of 2018.
Good job graduates!!!
This class received over $800,000 in scholarships and awards
Remember, life is a journey. Choose wisely! 💗",2018-06-02 15:00:13,,
85,0.0,https://scontent-atl3-1.xx.fbcdn.net/v/t1.0-9/fr/cp0/e15/q65/34136638_631610387223380_5663986863174582272_n.jpg?_nc_cat=101&_nc_sid=110474&_nc_ohc=qEw3PJJyh90AX-muWtW&_nc_ht=scontent-atl3-1.xx&tp=14&oh=6bf0d7f9d5f94d80c89bb8327b3d5143&oe=5F88CF4C,3.0,,631611440556608,Graduation Day Class of 2018,https://facebook.com/story.php?story_fbid=631611440556608&id=601292616921824,,0.0,Graduation Day Class of 2018,2018-06-02 14:55:43,,
86,0.0,,1.0,,631175577266861,"So it was the last day for school for the 2017-18 school year and it was another great year. Lots of hugging and the usual tears. The School of Excellence wants to wish our students, staff, and parents a safe and happy summer!!! See you in the fall. Oh not the seniors-they move on to the next chapter in their lives--God Speed.",https://facebook.com/story.php?story_fbid=631175577266861&id=601292616921824,,0.0,"So it was the last day for school for the 2017-18 school year and it was another great year. Lots of hugging and the usual tears. The School of Excellence wants to wish our students, staff, and parents a safe and happy summer!!! See you in the fall. Oh not the seniors-they move on to the next chapter in their lives--God Speed.",2018-06-01 17:55:05,,
87,0.0,,1.0,,429509450855841,,,"SAT, MAY 19, 2018
SEE Foundation Golf Tournament",0.0,"SAT, MAY 19, 2018
SEE Foundation Golf Tournament",2018-05-17 16:32:19,,
88,0.0,,0.0,,624699157914503,"Gallien Electric and Construction (GEC) presented 4 students golf clubs, golf balls, and a glove so they may play in the Foundation Golf Tournament at Ft. Sam this Saturday. Shotgun start at noon!!!!!!!",https://facebook.com/story.php?story_fbid=624699157914503&id=601292616921824,,0.0,"Gallien Electric and Construction (GEC) presented 4 students golf clubs, golf balls, and a glove so they may play in the Foundation Golf Tournament at Ft. Sam this Saturday. Shotgun start at noon!!!!!!!",2018-05-17 16:27:07,,
89,0.0,,0.0,,623797328004686,Calling all golfers!!! Foundation tournament this Saturday at Ft San Houston shotgun start at 12. Only $75 includes cart round of golf dinner and goody bags!!!! Let me know ASAP!!!,https://facebook.com/story.php?story_fbid=623797328004686&id=601292616921824,,0.0,Calling all golfers!!! Foundation tournament this Saturday at Ft San Houston shotgun start at 12. Only $75 includes cart round of golf dinner and goody bags!!!! Let me know ASAP!!!,2018-05-15 13:31:06,,
90,0.0,,1.0,,620981698286249,To all the Teachers at SEE Thanks for all you do!!! Teaching is a calling not a job.,https://facebook.com/story.php?story_fbid=620981698286249&id=601292616921824,,0.0,To all the Teachers at SEE Thanks for all you do!!! Teaching is a calling not a job.,2018-05-08 18:26:10,,
91,0.0,https://scontent-atl3-1.xx.fbcdn.net/v/t1.0-9/fr/cp0/e15/q65/31512809_616469665404119_6323178113052180480_n.jpg?_nc_cat=109&_nc_sid=8024bb&_nc_ohc=9nyTgSktk2AAX_7hQV3&_nc_ht=scontent-atl3-1.xx&tp=14&oh=049603bf1b1cf406e2b5ff6773697be1&oe=5F8A2611,3.0,,616469772070775,Iman Matan wins 2nd in Regional and heads to State for the 4th year in a row!!! Way to Wolfpack!!!!,https://facebook.com/story.php?story_fbid=616469772070775&id=601292616921824,,0.0,Iman Matan wins 2nd in Regional and heads to State for the 4th year in a row!!! Way to Wolfpack!!!!,2018-04-28 16:24:45,,
92,1.0,https://scontent-atl3-1.xx.fbcdn.net/v/t1.0-9/fr/cp0/e15/q65/31206422_614353135615772_2955265575019872256_n.jpg?_nc_cat=103&_nc_sid=110474&_nc_ohc=kpafVKM_kfUAX9yPm9k&_nc_ht=scontent-atl3-1.xx&tp=14&oh=ad3d4a4f10b91dd44e7d556cc081b66d&oe=5F886512,5.0,,614353188949100,Lady Wolfpack continue to dive for volleyball on Sunday’s. So proud of these young ladies!!!,https://facebook.com/story.php?story_fbid=614353188949100&id=601292616921824,,0.0,Lady Wolfpack continue to dive for volleyball on Sunday’s. So proud of these young ladies!!!,2018-04-23 20:07:35,,
93,0.0,https://scontent-atl3-1.xx.fbcdn.net/v/t1.0-9/fr/cp0/e15/q65/31189704_613914802326272_1583377115720450048_n.jpg?_nc_cat=105&_nc_sid=110474&_nc_ohc=dRHRI2rpS5AAX-eju4W&_nc_ht=scontent-atl3-1.xx&tp=14&oh=add3b5a8a00134dede28d1944417a832&oe=5F88931A,1.0,,613914825659603,Proud of All Area players good job!!!!!!!,https://facebook.com/story.php?story_fbid=613914825659603&id=601292616921824,,0.0,Proud of All Area players good job!!!!!!!,2018-04-22 20:59:56,,
94,0.0,https://scontent-atl3-1.xx.fbcdn.net/v/t1.0-9/fr/cp0/e15/q65/31143845_613856432332109_8790963972263116800_n.jpg?_nc_cat=106&_nc_sid=110474&_nc_ohc=SLKfMjN3-J0AX9AgoBk&_nc_ht=scontent-atl3-1.xx&tp=14&oh=b697676b324260f3db6c169a0e62f0a7&oe=5F8874D7,3.0,,613856445665441,Three of Milton B Lee basketball seniors ready to play in All Area games at IWU Gym. So proud of these young men.,https://facebook.com/story.php?story_fbid=613856445665441&id=601292616921824,,0.0,Three of Milton B Lee basketball seniors ready to play in All Area games at IWU Gym. So proud of these young men.,2018-04-22 16:42:25,,
95,0.0,,0.0,,613317275719358,,https://facebook.com/story.php?story_fbid=613317275719358&id=601292616921824,"Walker Elementary- School Of Excellence In Education
April 21, 2018 at 8:50 AM · San Antonio, TX ·

Walker Wolfpack Warming Up!",0.0,"Walker Elementary- School Of Excellence In Education
April 21, 2018 at 8:50 AM · San Antonio, TX ·

Walker Wolfpack Warming Up!",2018-04-21 14:15:03,https://video-atl3-1.xx.fbcdn.net/v/t42.9040-2/31030873_1034705270001553_2563209170555764736_n.mp4?_nc_cat=103&_nc_sid=985c63&efg=eyJ2ZW5jb2RlX3RhZyI6InN2ZV9zZCJ9&_nc_ohc=qYsVXqe0RnIAX8bd5Bc&_nc_ht=video-atl3-1.xx&oh=a6e9f89fdc679ec258f4d37b05cb48e6&oe=5F6484D6,
96,0.0,https://scontent-atl3-1.xx.fbcdn.net/v/t1.0-9/fr/cp0/e15/q65/30705982_610857689298650_2798655068654534656_n.jpg?_nc_cat=101&_nc_sid=8024bb&_nc_ohc=eHHBBZtriq8AX8SfsNG&_nc_ht=scontent-atl3-1.xx&tp=14&oh=b0396535cb55e72b37419c63e7cd5c78&oe=5F8851A1,0.0,,610857835965302,1k/5K was a success,https://facebook.com/story.php?story_fbid=610857835965302&id=601292616921824,,0.0,1k/5K was a success,2018-04-16 15:55:06,,
97,0.0,https://scontent-atl3-1.xx.fbcdn.net/v/t1.0-9/fr/cp0/e15/q65/30706293_610062706044815_6023462088112865280_n.jpg?_nc_cat=108&_nc_sid=110474&_nc_ohc=3iPxidCNrmMAX_1uKfJ&_nc_ht=scontent-atl3-1.xx&tp=14&oh=f2f88e0dc642da6694193e57b5742d77&oe=5F886606,2.0,,610062852711467,1k/5K Wellness event was a great success!!! Some pics and others will follow,https://facebook.com/story.php?story_fbid=610062852711467&id=601292616921824,,0.0,1k/5K Wellness event was a great success!!! Some pics and others will follow,2018-04-14 20:06:20,,
98,0.0,,1.0,,607972922920460,,https://facebook.com/story.php?story_fbid=607972922920460&id=601292616921824,"ELEMENTARY SCHOOL
School of Excellence in Education - Events",0.0,"ELEMENTARY SCHOOL
School of Excellence in Education - Events",2018-04-09 18:47:31,,
