,comments,image,likes,link,post_id,post_text,post_url,shared_text,shares,text,time,video,video_thumbnail
0,0.0,,2.0,https://tinyurl.com/spsmeals,703333463586026,"Seekonk Families:
Did you know free meals are available to all in school and virtual students? Meals can be picked up each day between 10:00 and 10:30am at Seekonk High School. For more information see: https://tinyurl.com/spsmeals",https://facebook.com/story.php?story_fbid=703333463586026&id=258767564709287,"DOCS.GOOGLE.COM
Free Meals Back To School Flyer",2.0,"Seekonk Families:
Did you know free meals are available to all in school and virtual students? Meals can be picked up each day between 10:00 and 10:30am at Seekonk High School. For more information see: https://tinyurl.com/spsmeals

DOCS.GOOGLE.COM
Free Meals Back To School Flyer",2020-09-11 16:32:16,,
1,0.0,,0.0,https://drive.google.com/file/d/1_9pVLyRYcNodFGXMdvkEwhw7Xk5o8ohA/view?usp=sharing,702971870288852,"Seekonk Families,Please be aware due to construction at Aitken Elementary, in person learning will begin 9/29. All schools will begin instruction as planned on 9/15 for hybrid model; Aitken will also begin instruction on 9/15 but will begin remote instruction until 9/29. For further details see https://drive.google.com/file/d/1_9pVLyRYcNodFGXMdvkEwhw7Xk5o8ohA/view?usp=sharing",https://facebook.com/story.php?story_fbid=702971870288852&id=258767564709287,"DRIVE.GOOGLE.COM
Seekonk Public Schools Announces Two-Week In-Person Learning Delay at Aitken Elementary School.pdf",0.0,"Seekonk Families,Please be aware due to construction at Aitken Elementary, in person learning will begin 9/29. All schools will begin instruction as planned on 9/15 for hybrid model; Aitken will also begin instruction on 9/15 but will begin remote instruction until 9/29. For further details see https://drive.google.com/file/d/1_9pVLyRYcNodFGXMdvkEwhw7Xk5o8ohA/view?usp=sharing

DRIVE.GOOGLE.COM
Seekonk Public Schools Announces Two-Week In-Person Learning Delay at Aitken Elementary School.pdf",2020-09-11 05:05:39,,
2,0.0,,6.0,,695446097708096,"Please be advised, tonight's School Committee will not be able to be live streamed due to an issue with the Network Server. The meeting will be recorded and available on our website and social media as soon as possible. We apologize for the inconvenience this has caused.",https://facebook.com/story.php?story_fbid=695446097708096&id=258767564709287,,0.0,"Please be advised, tonight's School Committee will not be able to be live streamed due to an issue with the Network Server. The meeting will be recorded and available on our website and social media as soon as possible. We apologize for the inconvenience this has caused.",2020-08-31 19:21:50,,
3,0.0,https://scontent-atl3-1.xx.fbcdn.net/v/t1.0-9/fr/cp0/e15/q65/118580953_692687067983999_7027027286606405844_o.jpg?_nc_cat=103&_nc_sid=8024bb&_nc_ohc=O6oadOHKKaEAX__QdaH&_nc_ht=scontent-atl3-1.xx&tp=14&oh=f49d7ea204bfa7568c9103c61ecce164&oe=5F8507D7,1.0,http://seekonk.sharpschool.com/district/transportation,692687111317328,,https://facebook.com/story.php?story_fbid=692687111317328&id=258767564709287,,0.0,,2020-08-27 19:19:59,,
4,63.0,,26.0,,647354432552118,Seekonk School Committee 8-24-2020,,,10.0,Seekonk School Committee 8-24-2020,2020-08-24 18:44:38,https://scontent-atl3-1.xx.fbcdn.net/v/t66.36281-6/10000000_1952765074860079_2642135841019715587_n.mp4?_nc_cat=109&_nc_sid=985c63&efg=eyJ2ZW5jb2RlX3RhZyI6Im9lcF9zZCJ9&_nc_ohc=aUDg1CKEfK8AX9giFXF&_nc_ht=scontent-atl3-1.xx&oh=830a7c3b092e41251bc3f3b3b38f9d74&oe=5F84EFDA,
5,165.0,,36.0,,1020866698365409,Seekonk School Committee 8-10-20,,,19.0,Seekonk School Committee 8-10-20,2020-08-10 18:47:41,https://scontent-atl3-1.xx.fbcdn.net/v/t66.36281-6/10000000_2989295334510395_4189977021915742511_n.mp4?_nc_cat=109&_nc_sid=985c63&efg=eyJ2ZW5jb2RlX3RhZyI6Im9lcF9zZCJ9&_nc_ohc=183pWi7_xhIAX-ukF8z&_nc_ht=scontent-atl3-1.xx&oh=821fc4f58fb06361472f9c2b3458a9f0&oe=5F84DAD3,
6,0.0,,6.0,https://vimeo.com/442751255,672600023326037,Parent and Community Return to School Video from Superintendent Dr. Rich Drolet https://vimeo.com/442751255,https://facebook.com/story.php?story_fbid=672600023326037&id=258767564709287,"VIMEO.COM
Parent Community Screencastify Presentation 7-29-20",2.0,"Parent and Community Return to School Video from Superintendent Dr. Rich Drolet https://vimeo.com/442751255

VIMEO.COM
Parent Community Screencastify Presentation 7-29-20",2020-07-29 12:18:50,,
7,7.0,https://scontent-atl3-1.xx.fbcdn.net/v/t1.0-9/fr/cp0/e15/q65/115805469_670176743568365_1442679124780615297_o.jpg?_nc_cat=106&_nc_sid=8024bb&_nc_ohc=Oot8JPb3HCoAX-lHo5q&_nc_ht=scontent-atl3-1.xx&tp=14&oh=af21a42b7ef7f5ce4484f3a786820f1f&oe=5F85504E,43.0,,670177570234949,We are so proud of all of our #2020 Graduates!! Congratulations!,https://facebook.com/story.php?story_fbid=670177570234949&id=258767564709287,,0.0,We are so proud of all of our #2020 Graduates!! Congratulations!,2020-07-25 12:26:21,,
8,95.0,,40.0,,573845113283086,Seekonk High School Graduation 2020,,,19.0,Seekonk High School Graduation 2020,2020-07-24 17:53:57,https://video-atl3-1.xx.fbcdn.net/v/t42.26565-2/10000000_682843452300222_4265972117748474881_n.mp4?_nc_cat=110&_nc_sid=985c63&efg=eyJ2ZW5jb2RlX3RhZyI6Im9lcF9zZCJ9&_nc_ohc=iDpUoyZuvqIAX9-4D4e&_nc_ht=video-atl3-1.xx&oh=7b658a01668e359c7ae8f14f622b8eaa&oe=5F5DEADF,
9,4.0,,2.0,,3478916458786581,Seekonk School Committee 7-20-2020,,,3.0,Seekonk School Committee 7-20-2020,2020-07-20 18:53:15,https://video-atl3-1.xx.fbcdn.net/v/t42.26565-2/10000000_2660578630866738_7161823017713210265_n.mp4?_nc_cat=104&_nc_sid=985c63&efg=eyJ2ZW5jb2RlX3RhZyI6Im9lcF9zZCJ9&_nc_ohc=Doq8frtHY1IAX-eObep&_nc_ht=video-atl3-1.xx&oh=8158c836eb4176ddc935413bfab4aadd&oe=5F5DE598,
10,0.0,,0.0,,597130114543425,Seekonk School Committee 7-20-20,,,0.0,Seekonk School Committee 7-20-20,2020-07-20 18:48:45,https://video-atl3-1.xx.fbcdn.net/v/t42.26565-2/115926479_981451142370012_5086003075007812619_n.mp4?_nc_cat=107&_nc_sid=985c63&efg=eyJ2ZW5jb2RlX3RhZyI6Im9lcF9zZCJ9&_nc_ohc=Em8ybbNKfjoAX834Ndr&_nc_ht=video-atl3-1.xx&oh=072b6dbf6ec9ce2e2b695729ff45a2b9&oe=5F5DE843,
11,0.0,,2.0,https://forms.gle/Bo5r3CgybiiNsyMd7,655444318374941,"Hello Seekonk Public Schools Families,
Bus registration for Seekonk Public Schools is set to close on July 31st. Due to the uncertainties presented in this school year's startup there will be no extensions on that deadline, with any registrations received after that point placed on a waitlist. Our goal is to provide transportation services to every family that needs it. To do this all families in need of transportation will need to have their bus registration submitted by July 31st. If you have already submitted a registration, we thank you and no further action is needed at this time. A bus registration is attached to this email and a link to register online is included here: https://forms.gle/Bo5r3CgybiiNsyMd7. Either method is acceptable and bus fees have been waived for this school year.
Thank you and stay safe.",https://facebook.com/story.php?story_fbid=655444318374941&id=258767564709287,"DOCS.GOOGLE.COM
Seekonk Public Schools Transportation Registration",2.0,"Hello Seekonk Public Schools Families,
Bus registration for Seekonk Public Schools is set to close on July 31st. Due to the uncertainties presented in this school year's startup there will be no extensions on that deadline, with any registrations received after that point placed on a waitlist. Our goal is to provide transportation services to every family that needs it. To do this all families in need of transportation will need to have their bus registration submitted by July 31st. If you have already submitted a registration, we thank you and no further action is needed at this time. A bus registration is attached to this email and a link to register online is included here: https://forms.gle/Bo5r3CgybiiNsyMd7. Either method is acceptable and bus fees have been waived for this school year.
Thank you and stay safe.

DOCS.GOOGLE.COM
Seekonk Public Schools Transportation Registration",2020-07-01 21:03:50,,
12,8.0,https://scontent-atl3-1.xx.fbcdn.net/v/t1.0-9/103570097_646159099303463_8752463356637589276_n.png?_nc_cat=110&_nc_sid=8024bb&_nc_ohc=ATwSlcoURlcAX9LsG3c&_nc_ht=scontent-atl3-1.xx&oh=7b5f00bee06cfb28acc9d5ddb97f4a90&oe=5F844DD2,28.0,,646159305970109,,https://facebook.com/story.php?story_fbid=646159305970109&id=258767564709287,,0.0,,2020-06-16 16:38:02,,
13,7.0,,0.0,,2622129244718436,Seekonk School Committee 6-20-2020,,,4.0,Seekonk School Committee 6-20-2020,2020-06-15 18:58:30,https://scontent-atl3-1.xx.fbcdn.net/v/t66.36281-6/10000000_208222270951838_3031089489095707384_n.mp4?_nc_cat=108&_nc_sid=985c63&efg=eyJ2ZW5jb2RlX3RhZyI6Im9lcF9zZCJ9&_nc_ohc=qUubdVjkUekAX9fUoqA&_nc_ht=scontent-atl3-1.xx&oh=369744736f449a8276c06dcdc2f63357&oe=5F81DB7A,
14,0.0,,0.0,,1155626611502713,Seekonk School Committee 6-15-2020,,,0.0,Seekonk School Committee 6-15-2020,2020-06-15 17:59:20,https://scontent-atl3-1.xx.fbcdn.net/v/t66.36281-6/119431805_323912865700281_2691252732737029976_n.mp4?_nc_cat=100&_nc_sid=985c63&efg=eyJ2ZW5jb2RlX3RhZyI6Im9lcF9zZCJ9&_nc_ohc=PVXrTLkc5C4AX9SD-42&_nc_ht=scontent-atl3-1.xx&oh=b8f2d94828d477d05d427103d269adf0&oe=5F83C7A8,
15,2.0,https://scontent-atl3-1.xx.fbcdn.net/v/t1.0-9/101838396_641121596473880_2525319798680734935_o.png?_nc_cat=104&_nc_sid=8024bb&_nc_ohc=2951fGCqvTsAX9u6OIw&_nc_ht=scontent-atl3-1.xx&oh=9877767a7a5a81aa7e30e087d2f8fb22&oe=5F849CB8,13.0,,641121646473875,#SeekonkPS is proud to announce that Mr. Matthew Bosh has been selected as the new Assistant Principal for Seekonk High School. He will be a wonderful addition to our Seekonk team!,https://facebook.com/story.php?story_fbid=641121646473875&id=258767564709287,,0.0,#SeekonkPS is proud to announce that Mr. Matthew Bosh has been selected as the new Assistant Principal for Seekonk High School. He will be a wonderful addition to our Seekonk team!,2020-06-08 15:24:46,,
16,0.0,,1.0,,252509416171942,Seekonk School Committee 6-1-2020,,,2.0,Seekonk School Committee 6-1-2020,2020-06-01 18:56:15,https://scontent-atl3-1.xx.fbcdn.net/v/t66.36281-6/10000000_313188719764441_6463101174133630668_n.mp4?_nc_cat=105&_nc_sid=985c63&efg=eyJ2ZW5jb2RlX3RhZyI6Im9lcF9zZCJ9&_nc_ohc=rkFowEf0dbcAX_fnXI1&_nc_ht=scontent-atl3-1.xx&oh=0a3e826f6a26cf18d7b1fdb8f3b378f4&oe=5F843CFD,
17,0.0,https://scontent-atl3-1.xx.fbcdn.net/v/t1.0-9/100896365_633613347224705_4386216667932262400_n.png?_nc_cat=105&_nc_sid=8024bb&_nc_ohc=1U67q8-G_uUAX83oo_I&_nc_ht=scontent-atl3-1.xx&oh=c8749dcec8fd80772a7c3a972b310131&oe=5F837972,13.0,,633613387224701,#SeekonkPS is proud to announce that Ms. Erica Thomas has been selected as the new Associate Principal for Seekonk High School. She will be a wonderful addition to our Seekonk team!,https://facebook.com/story.php?story_fbid=633613387224701&id=258767564709287,,0.0,#SeekonkPS is proud to announce that Ms. Erica Thomas has been selected as the new Associate Principal for Seekonk High School. She will be a wonderful addition to our Seekonk team!,2020-05-27 13:55:44,,
18,0.0,,1.0,,3572426722796211,Seekonk School Committee 5-11-20,,,0.0,Seekonk School Committee 5-11-20,2020-05-11 19:16:42,https://video-atl3-1.xx.fbcdn.net/v/t42.26565-2/10000000_2804593049828990_5227034259457540392_n.mp4?_nc_cat=110&_nc_sid=985c63&efg=eyJ2ZW5jb2RlX3RhZyI6Im9lcF9zZCJ9&_nc_ohc=zaPLqoVY12oAX8zkQPj&_nc_ht=video-atl3-1.xx&oh=5d85e01cab6fccd4978c6d93abd41ef8&oe=5F5DE42B,
19,0.0,,2.0,,1120191328343105,"Seekonk School Committee April 27th, 2020",,,0.0,"Seekonk School Committee April 27th, 2020",2020-04-27 18:50:29,https://video-atl3-1.xx.fbcdn.net/v/t42.26565-2/10000000_1769480596549844_1466988889955915941_n.mp4?_nc_cat=102&_nc_sid=985c63&efg=eyJ2ZW5jb2RlX3RhZyI6Im9lcF9zZCJ9&_nc_ohc=PqVCJadjyksAX8AamH8&_nc_ht=video-atl3-1.xx&oh=aca6f150f2eacef9506b84c7560d3b6f&oe=5F5DE26B,
20,1.0,,12.0,https://vimeo.com/411609278?ref=tw-share%E2%80%AC,614052035847503,‪So proud of our #SeekonkPS Seniors! We miss you!Watch “Honoring the SHS Class of 2020” on #Vimeo https://vimeo.com/411609278?ref=tw-share‬,https://facebook.com/story.php?story_fbid=614052035847503&id=258767564709287,"VIMEO.COM
Honoring the SHS Class of 2020",7.0,"‪So proud of our #SeekonkPS Seniors! We miss you!Watch “Honoring the SHS Class of 2020” on #Vimeo https://vimeo.com/411609278?ref=tw-share‬

VIMEO.COM
Honoring the SHS Class of 2020",2020-04-24 22:27:17,,
21,0.0,,0.0,,607316439854396,"The School Committee held a regular meeting on Monday, April 13, 2020. This was the second virtual meeting. The meeting was scheduled to begin at 7:00 P.M. Per Governor Baker's Order suspending certain provisions of the Open Meeting Law, G.L. c. 30A, sec. 20 the public was not permitted to physically access this School Committee meeting and therefore, the meeting was held VIRTUALLY.",,,0.0,"The School Committee held a regular meeting on Monday, April 13, 2020. This was the second virtual meeting. The meeting was scheduled to begin at 7:00 P.M. Per Governor Baker's Order suspending certain provisions of the Open Meeting Law, G.L. c. 30A, sec. 20 the public was not permitted to physically access this School Committee meeting and therefore, the meeting was held VIRTUALLY.",2020-04-14 07:07:15,https://video-atl3-1.xx.fbcdn.net/v/t42.9040-2/10000000_592341274963137_2940766160565567488_n.mp4?_nc_cat=100&_nc_sid=985c63&efg=eyJ2ZW5jb2RlX3RhZyI6ImxlZ2FjeV9zZCJ9&_nc_ohc=mW3rZme3F5MAX-w6W4H&_nc_ht=video-atl3-1.xx&oh=9c6ba969d0865df5a84f18abcbb327e5&oe=5F5DE50F,
22,0.0,https://scontent-atl3-1.xx.fbcdn.net/v/t1.0-9/92575638_603870393532334_2426688206213742592_o.png?_nc_cat=107&_nc_sid=8024bb&_nc_ohc=a-snJsZifBoAX8kjZBQ&_nc_ht=scontent-atl3-1.xx&oh=97401de9b230613305d97eef775769d6&oe=5F82A203,8.0,,603870586865648,"Families, please know we are providing meals every day for you if you need them. Pick up is available Monday through Friday at Seekonk High School starting at 11:30. #SeekonkPS",https://facebook.com/story.php?story_fbid=603870586865648&id=258767564709287,,0.0,"Families, please know we are providing meals every day for you if you need them. Pick up is available Monday through Friday at Seekonk High School starting at 11:30. #SeekonkPS",2020-04-08 16:36:37,,
23,0.0,https://scontent-atl3-1.xx.fbcdn.net/v/t1.0-9/92098455_601580673761306_959109473287274496_o.png?_nc_cat=104&_nc_sid=8024bb&_nc_ohc=Tb-cSA9yvV4AX9NN7ao&_nc_ht=scontent-atl3-1.xx&oh=5f2d46986b88ad851a6b76a0514282c4&oe=5F8260B1,6.0,,601581623761211,"Families we are here for you! Starting Monday, April 6th we will be offering a Virtual Parent Tech Night at 7:00pm to answer your technology questions to help support your child during distance learning! We hope you will join Colleen Terrill, Director of Technology and Digital Learning, Suzanne Larson, SHS Library Media Specialist, Jenn St. Michel, HMS Library Media Specialist, Mindy Andrews, Martin Elementary Library Media Specialist, Audrey Lamar, Aitken Elementary Library Media Specialist and Beth Haselton Elementary Technology teacher. Each evening, April 6th to the 9th will focus on a different school! Please see your email for further details or email terrillc@seekonkschools.org.",https://facebook.com/story.php?story_fbid=601581623761211&id=258767564709287,,0.0,"Families we are here for you! Starting Monday, April 6th we will be offering a Virtual Parent Tech Night at 7:00pm to answer your technology questions to help support your child during distance learning! We hope you will join Colleen Terrill, Director of Technology and Digital Learning, Suzanne Larson, SHS Library Media Specialist, Jenn St. Michel, HMS Library Media Specialist, Mindy Andrews, Martin Elementary Library Media Specialist, Audrey Lamar, Aitken Elementary Library Media Specialist and Beth Haselton Elementary Technology teacher. Each evening, April 6th to the 9th will focus on a different school! Please see your email for further details or email terrillc@seekonkschools.org.",2020-04-04 18:43:06,,
24,3.0,,9.0,https://vimeo.com/402396211?ref=fb-share,598760697376637,"To our amazing #SeekonkPS students, all of the faculty and staff want you to know we miss you so much! We hope you are doing well and are thinking of you! ❤️💕",https://facebook.com/story.php?story_fbid=598760697376637&id=258767564709287,"VIMEO.COM
We miss our Seekonk students!",37.0,"To our amazing #SeekonkPS students, all of the faculty and staff want you to know we miss you so much! We hope you are doing well and are thinking of you! ❤️💕

VIMEO.COM
We miss our Seekonk students!",2020-03-30 22:09:57,,
25,0.0,,15.0,https://youtu.be/gj-FC5pWZRo,592410518011655,"A message to Seekonk Public Schools and Families!
https://youtu.be/gj-FC5pWZRo",https://facebook.com/story.php?story_fbid=592410518011655&id=258767564709287,"YOUTUBE.COM
A message to Seekonk Public Schools from Superintendent Dr. Rich Drolet.",4.0,"A message to Seekonk Public Schools and Families!
https://youtu.be/gj-FC5pWZRo

YOUTUBE.COM
A message to Seekonk Public Schools from Superintendent Dr. Rich Drolet.",2020-03-20 15:36:50,,
26,0.0,,5.0,https://sites.google.com/seekonkschools.org/enrichment-activities/home,590032858249421,"Families,

Please check out the Enrichment Activities website https://sites.google.com/seekonkschools.org/enrichment-activities/home we developed to support your student while we are at home for the next few weeks. We will continue to update it with additional resources.",https://facebook.com/story.php?story_fbid=590032858249421&id=258767564709287,"SITES.GOOGLE.COM
Enrichment Activities",3.0,"Families,

Please check out the Enrichment Activities website https://sites.google.com/seekonkschools.org/enrichment-activities/home we developed to support your student while we are at home for the next few weeks. We will continue to update it with additional resources.

SITES.GOOGLE.COM
Enrichment Activities",2020-03-16 21:10:42,,
27,0.0,https://scontent-atl3-1.xx.fbcdn.net/v/t1.0-9/89549551_589433271642713_8367401435767242752_o.png?_nc_cat=102&_nc_sid=8024bb&_nc_ohc=nJ2fmojfnE8AX-MhiFG&_nc_ht=scontent-atl3-1.xx&oh=b907550deae7ed208d709eb3b4917816&oe=5F8335A6,3.0,,589433298309377,"Please be advised, in light of the Governor's announcement that ALL schools in the Commonwealth of Massachusetts must close, our Seekonk Public Schools (including the South Coast Collaborative) will be closed through Monday, April 6, 2020. #SeekonkPS",https://facebook.com/story.php?story_fbid=589433298309377&id=258767564709287,,0.0,"Please be advised, in light of the Governor's announcement that ALL schools in the Commonwealth of Massachusetts must close, our Seekonk Public Schools (including the South Coast Collaborative) will be closed through Monday, April 6, 2020. #SeekonkPS",2020-03-15 20:16:21,,
28,1.0,https://scontent-atl3-1.xx.fbcdn.net/v/t1.0-9/89905870_588109491775091_6616211791649177600_o.png?_nc_cat=109&_nc_sid=8024bb&_nc_ohc=x1faqtYzIl0AX8EBxMe&_nc_ht=scontent-atl3-1.xx&oh=d2476fe1494ca94165bbfebc87af65d5&oe=5F819B42,9.0,,588109558441751,"Please be advised, Seekonk Public Schools will be closed next week. Please see attached letter for further information. #SeekonkPS",https://facebook.com/story.php?story_fbid=588109558441751&id=258767564709287,,0.0,"Please be advised, Seekonk Public Schools will be closed next week. Please see attached letter for further information. #SeekonkPS",2020-03-13 17:32:46,,
29,0.0,,4.0,http://bit.do/cvupdate,587478715171502,"With the exception of school led afterschool clubs and sports, all extra curricular Seekonk field trips and school nighttime events are cancelled through April 27th http://bit.do/cvupdate See our website for further information https://sites.google.com/seekonkschools.org/coronavirus-resources/home…",https://facebook.com/story.php?story_fbid=587478715171502&id=258767564709287,"DRIVE.GOOGLE.COM
Coronavirus update_3.pdf",0.0,"With the exception of school led afterschool clubs and sports, all extra curricular Seekonk field trips and school nighttime events are cancelled through April 27th http://bit.do/cvupdate See our website for further information https://sites.google.com/seekonkschools.org/coronavirus-resources/home…

DRIVE.GOOGLE.COM
Coronavirus update_3.pdf",2020-03-12 15:46:55,,
30,0.0,,1.0,,1570332079757079,Seekonk School Committee 3-9-2020,,,0.0,Seekonk School Committee 3-9-2020,2020-03-09 18:19:45,https://scontent-atl3-1.xx.fbcdn.net/v/t66.36281-6/10000000_174120177513423_1943660093315274940_n.mp4?_nc_cat=102&_nc_sid=985c63&efg=eyJ2ZW5jb2RlX3RhZyI6Im9lcF9zZCJ9&_nc_ohc=LKPrwf9iUaEAX-zgCdj&_nc_ht=scontent-atl3-1.xx&oh=fc91044acd0ca5c5c074686b58f323ff&oe=5F839DC2,
31,0.0,,1.0,,812060419205304,Seekonk School Committee 3-9-2020,,,0.0,Seekonk School Committee 3-9-2020,2020-03-09 18:16:21,https://scontent-atl3-1.xx.fbcdn.net/v/t66.36281-6/46334565_757837851679269_8445735813596886457_n.mp4?_nc_cat=103&_nc_sid=985c63&efg=eyJ2ZW5jb2RlX3RhZyI6Im9lcF9zZCJ9&_nc_ohc=vEhEIBt8To8AX-PNxxz&_nc_ht=scontent-atl3-1.xx&oh=2ce9891f26ea3d3b6ce1fefe72b055ea&oe=5F837EA9,
32,0.0,,2.0,,634434074066267,Seekonk School Committee 2-24-2020,,,0.0,Seekonk School Committee 2-24-2020,2020-02-24 18:52:27,https://scontent-atl3-1.xx.fbcdn.net/v/t66.36281-6/10000000_971622269951690_5557279139675663299_n.mp4?_nc_cat=108&_nc_sid=985c63&efg=eyJ2ZW5jb2RlX3RhZyI6Im9lcF9zZCJ9&_nc_ohc=ZPyFmFuFCSAAX8z624t&_nc_ht=scontent-atl3-1.xx&oh=8abef741534c7e60cc6c8990ed20873c&oe=5F831A2B,
33,1.0,,0.0,,1641380022669539,Seekonk School Committee 2-03-2020,,,0.0,Seekonk School Committee 2-03-2020,2020-02-03 18:51:44,https://video-atl3-1.xx.fbcdn.net/v/t42.26565-2/10000000_588976888453282_3828747325737027497_n.mp4?_nc_cat=104&_nc_sid=985c63&efg=eyJ2ZW5jb2RlX3RhZyI6Im9lcF9zZCJ9&_nc_ohc=grjDbcOyZ6UAX_IYZTO&_nc_ht=video-atl3-1.xx&oh=d0e691fd9cbfe8d5f11844634914d165&oe=5F5DEA0E,
34,0.0,,0.0,,531552324375583,Seekonk School Committee 1-22-20,,,0.0,Seekonk School Committee 1-22-20,2020-01-22 18:45:42,https://video-atl3-1.xx.fbcdn.net/v/t42.26565-2/10000000_165876638312606_4544360193135646487_n.mp4?_nc_cat=102&_nc_sid=985c63&efg=eyJ2ZW5jb2RlX3RhZyI6Im9lcF9zZCJ9&_nc_ohc=nNTxIs9_osQAX8d6pkJ&_nc_ht=video-atl3-1.xx&oh=02bf3179849d2b7c4d5e6962888c51c6&oe=5F5DE157,
35,2.0,https://scontent-atl3-1.xx.fbcdn.net/v/t1.0-9/fr/cp0/e15/q65/80368935_531801960739178_4714917623266017280_n.jpg?_nc_cat=109&_nc_sid=110474&_nc_ohc=yxmm6Sxck2sAX9BzoZV&_nc_ht=scontent-atl3-1.xx&tp=14&oh=5dd08d68f95c4043f006ab0736d00b04&oe=5F83CD92,12.0,,531801997405841,Who’s that Elf on the Shelf at Martin Elementary School this morning?,https://facebook.com/story.php?story_fbid=531801997405841&id=258767564709287,,0.0,Who’s that Elf on the Shelf at Martin Elementary School this morning?,2019-12-19 11:10:05,,
36,0.0,,1.0,,580349709430086,Seekonk School Committee 12-16-19,,,0.0,Seekonk School Committee 12-16-19,2019-12-16 18:53:19,https://scontent-atl3-1.xx.fbcdn.net/v/t66.36281-6/10000000_1699488193548027_4551140700495219244_n.mp4?_nc_cat=107&_nc_sid=985c63&efg=eyJ2ZW5jb2RlX3RhZyI6Im9lcF9zZCJ9&_nc_ohc=Vf9GbsX8J8AAX9yASaE&_nc_ht=scontent-atl3-1.xx&oh=a149be47f6724be7fd5cd5692cde7b07&oe=5F85197E,
37,0.0,,9.0,,475011162998322,Seekonk High School Unified Champions Banner Unveiling,,,11.0,Seekonk High School Unified Champions Banner Unveiling,2019-12-12 12:49:25,https://scontent-atl3-1.xx.fbcdn.net/v/t66.36281-6/10000000_363293474828320_6048137732660783699_n.mp4?_nc_cat=103&_nc_sid=985c63&efg=eyJ2ZW5jb2RlX3RhZyI6Im9lcF9zZCJ9&_nc_ohc=mYtO-rz59cQAX-G83jZ&_nc_ht=scontent-atl3-1.xx&oh=35d16c9fadb950468b083e2839eacae5&oe=5F831057,
38,0.0,,7.0,,455536115104699,SHS Band Holiday Concert,,,0.0,SHS Band Holiday Concert,2019-12-11 19:59:50,https://scontent-atl3-1.xx.fbcdn.net/v/t66.36281-6/10000000_614225645937162_3732052304700902527_n.mp4?_nc_cat=104&_nc_sid=985c63&efg=eyJ2ZW5jb2RlX3RhZyI6Im9lcF9zZCJ9&_nc_ohc=NhQjQP2P5MAAX_hTZK5&_nc_ht=scontent-atl3-1.xx&oh=939fbed9f3408945a6dca1678720b988&oe=5F834591,
39,0.0,,33.0,https://drive.google.com/file/d/0B7PGndDwHUNxQkZqWjM1bDRoekg2bU54Z1laemt2bExJMGkw/view?usp=sharing,524573478128693,"We are pleased to announce Seekonk High School will receive national banner recognition on 12/12 for providing inclusive sports & activities for students with & without disabilities. Hasbro is sponsoring Seekonk High School's National Banner Unveiling Assembly on Thursday. Hasbro has picked Seekonk High School staff, led by Social Studies teacher and Unified Coordinator, Kristin Nelson, and our Seekonk High School students, for their commitment and dedication to inclusion. We are so proud of their efforts and success. dehttps://drive.google.com/file/d/0B7PGndDwHUNxQkZqWjM1bDRoekg2bU54Z1laemt2bExJMGkw/view?usp=sharing",https://facebook.com/story.php?story_fbid=524573478128693&id=258767564709287,"SHS Unified Banner Unveiling Press Release.pdf



See more at
drive.google.com",0.0,"We are pleased to announce Seekonk High School will receive national banner recognition on 12/12 for providing inclusive sports & activities for students with & without disabilities. Hasbro is sponsoring Seekonk High School's National Banner Unveiling Assembly on Thursday. Hasbro has picked Seekonk High School staff, led by Social Studies teacher and Unified Coordinator, Kristin Nelson, and our Seekonk High School students, for their commitment and dedication to inclusion. We are so proud of their efforts and success. dehttps://drive.google.com/file/d/0B7PGndDwHUNxQkZqWjM1bDRoekg2bU54Z1laemt2bExJMGkw/view?usp=sharing

SHS Unified Banner Unveiling Press Release.pdf



See more at
drive.google.com",2019-12-09 19:58:28,,
40,2.0,,15.0,https://www.youtube.com/watch?v=j_6o8dBZMG4&feature=share,519537901965584,"There is no school in Seekonk Public Schools today, Tuesday, December 3rd. Best Snow Day Ever!",https://facebook.com/story.php?story_fbid=519537901965584&id=258767564709287,"YOUTUBE.COM
Seekonk High School Best Snow Day Ever 2019-20",104.0,"There is no school in Seekonk Public Schools today, Tuesday, December 3rd. Best Snow Day Ever!

YOUTUBE.COM
Seekonk High School Best Snow Day Ever 2019-20",2019-12-03 05:57:48,,
41,0.0,,1.0,,430418014543526,Seekonk High School Spirit Week Hypnotist,,,0.0,Seekonk High School Spirit Week Hypnotist,2019-11-25 19:24:59,https://scontent-atl3-1.xx.fbcdn.net/v/t66.36281-6/46356244_670116730282481_3104657372621610482_n.mp4?_nc_cat=111&_nc_sid=985c63&efg=eyJ2ZW5jb2RlX3RhZyI6Im9lcF9zZCJ9&_nc_ohc=cEJIDFsudVQAX_KLxEI&_nc_ht=scontent-atl3-1.xx&oh=b9987c782800ff706e8d37a19ca8822f&oe=5F837383,
42,0.0,,0.0,,2783125441740244,Test 2,,,0.0,Test 2,2019-11-22 16:31:21,https://scontent-atl3-1.xx.fbcdn.net/v/t66.36281-6/10000000_1474164909441119_6047607875202707462_n.mp4?_nc_cat=103&_nc_sid=985c63&efg=eyJ2ZW5jb2RlX3RhZyI6Im9lcF9zZCJ9&_nc_ohc=WqddOUkfA6oAX-sROdR&_nc_ht=scontent-atl3-1.xx&oh=e681b5233e7c2a90d4835526aeaea996&oe=5F81CF23,
43,0.0,,1.0,,674464549744462,Seekonk SC Meeting 11-4-19,,,0.0,Seekonk SC Meeting 11-4-19,2019-11-04 19:00:36,https://video-atl3-1.xx.fbcdn.net/v/t42.26565-2/10000000_2053820211416770_1231109618020405870_n.mp4?_nc_cat=109&_nc_sid=985c63&efg=eyJ2ZW5jb2RlX3RhZyI6Im9lcF9zZCJ9&_nc_ohc=ETmS--V9vWwAX8bBgxd&_nc_ht=video-atl3-1.xx&oh=ee69d4d9eb051eefd71b4e4c77bd8c01&oe=5F5DE881,
44,0.0,,0.0,,2430397417246202,Seekonk Quad Board Meeting 10-23-19,,,0.0,Seekonk Quad Board Meeting 10-23-19,2019-10-23 18:54:37,https://video-atl3-1.xx.fbcdn.net/v/t42.26565-2/10000000_167928658290396_2298440037030252812_n.mp4?_nc_cat=104&_nc_sid=985c63&efg=eyJ2ZW5jb2RlX3RhZyI6Im9lcF9zZCJ9&_nc_ohc=UoCK7jKzQ18AX-9vHjz&_nc_ht=video-atl3-1.xx&oh=dc13e1af7950047fdba7edd4650bcc52&oe=5F5DE710,
45,0.0,,0.0,,470765253528257,Seekonk Quad Board Meeting 10-23-19,,,0.0,Seekonk Quad Board Meeting 10-23-19,2019-10-23 18:21:08,https://video-atl3-1.xx.fbcdn.net/v/t42.26565-2/10000000_110575890626038_4524868166269133380_n.mp4?_nc_cat=100&_nc_sid=985c63&efg=eyJ2ZW5jb2RlX3RhZyI6Im9lcF9zZCJ9&_nc_ohc=PtxwKvmvo_oAX992Asm&_nc_ht=video-atl3-1.xx&oh=6c657ae4d20f6f4c235752617e04568e&oe=5F5DED98,
46,0.0,,1.0,,451277322188748,Audio test 2,,,0.0,Audio test 2,2019-10-22 20:14:23,https://video-atl3-1.xx.fbcdn.net/v/t42.26565-2/10000000_300326414648800_1168929778224661411_n.mp4?_nc_cat=109&_nc_sid=985c63&efg=eyJ2ZW5jb2RlX3RhZyI6Im9lcF9zZCJ9&_nc_ohc=1qVFn7MCbtUAX9lRplk&_nc_ht=video-atl3-1.xx&oh=70bb2e2ef05eccf552813e5a84f56c22&oe=5F5DE2AA,
47,0.0,,0.0,,509261306290900,Audio Test,,,0.0,Audio Test,2019-10-22 16:01:45,https://video-atl3-1.xx.fbcdn.net/v/t42.26565-2/109981035_170336431198647_6504314695839064352_n.mp4?_nc_cat=101&_nc_sid=985c63&efg=eyJ2ZW5jb2RlX3RhZyI6Im9lcF9zZCJ9&_nc_ohc=WcZ4vJe703wAX_M_U5i&_nc_ht=video-atl3-1.xx&oh=a59ba31aadaa4776e35aefa12dbba7db&oe=5F5DE846,
48,0.0,,3.0,,488731185046256,"We are so grateful for our assistant principals in #SeekonkPS and want to honor the work they do every day! We appreciate you during #NationalPrincipalsMonth and always Mr. George Kelleher, Mr. David Graf, Mrs. Kerry Hutchins and Mr. Kevin Aguiar",,,0.0,"We are so grateful for our assistant principals in #SeekonkPS and want to honor the work they do every day! We appreciate you during #NationalPrincipalsMonth and always Mr. George Kelleher, Mr. David Graf, Mrs. Kerry Hutchins and Mr. Kevin Aguiar",2019-10-22 05:05:25,https://video-atl3-1.xx.fbcdn.net/v/t42.9040-2/75344563_1646956365439903_3820933804239880192_n.mp4?_nc_cat=101&_nc_sid=985c63&efg=eyJ2ZW5jb2RlX3RhZyI6InN2ZV9zZCJ9&_nc_ohc=_VDSzBjFpqAAX8jSm9s&_nc_ht=video-atl3-1.xx&oh=71bdba5047dbd3d59854a7eede1ebd22&oe=5F5DED6F,
49,4.0,,0.0,,514592122669281,Seekonk School Committee 10-21-19,,,0.0,Seekonk School Committee 10-21-19,2019-10-21 19:00:38,https://video-atl3-1.xx.fbcdn.net/v/t42.26565-2/10000000_1397826673752780_1631315574447109922_n.mp4?_nc_cat=108&_nc_sid=985c63&efg=eyJ2ZW5jb2RlX3RhZyI6Im9lcF9zZCJ9&_nc_ohc=9M-GSS6NnjAAX_CvPef&_nc_ht=video-atl3-1.xx&oh=1dd171e5a35091d030f9da3bff0ca3d0&oe=5F5DE055,
50,0.0,,0.0,,524704311695682,Seekonk School Committee 10/21,,,0.0,Seekonk School Committee 10/21,2019-10-21 16:16:20,https://video-atl3-1.xx.fbcdn.net/v/t42.26565-2/10000000_286754735980858_8506504712339012585_n.mp4?_nc_cat=102&_nc_sid=985c63&efg=eyJ2ZW5jb2RlX3RhZyI6Im9lcF9zZCJ9&_nc_ohc=JL2vhIfEPc0AX8UeoAW&_nc_ht=video-atl3-1.xx&oh=5b9499a7b2a05c3c6b90c199f489042a&oe=5F5DE33C,
51,0.0,https://scontent-atl3-1.xx.fbcdn.net/v/t1.0-9/fr/cp0/e15/q65/70882542_461750281077680_7777490606829338624_n.jpg?_nc_cat=105&_nc_sid=110474&_nc_ohc=tZ9E6hvBuSYAX-WPkgv&_nc_ht=scontent-atl3-1.xx&tp=14&oh=db857e5c13d08e8ed43f0f1652f8e59e&oe=5F81696E,9.0,,461750431077665,Awesome ceremony tonight! Thanks to Seekonk Police Department and Seekonk Fire Dept and Seekonk Dispatch and all our public safety workers. #wewillneverforget,https://facebook.com/story.php?story_fbid=461750431077665&id=258767564709287,,0.0,Awesome ceremony tonight! Thanks to Seekonk Police Department and Seekonk Fire Dept and Seekonk Dispatch and all our public safety workers. #wewillneverforget,2019-09-11 21:22:00,,
52,0.0,https://scontent-atl3-1.xx.fbcdn.net/v/t1.0-9/68886325_452457478673627_5034576302347124736_n.png?_nc_cat=111&_nc_sid=8024bb&_nc_ohc=IMJz0CyF0vMAX8gQdwF&_nc_ht=scontent-atl3-1.xx&oh=37846c2649cd2840d851dab205b10162&oe=5F81FC41,10.0,,452457645340277,,https://facebook.com/story.php?story_fbid=452457645340277&id=258767564709287,,0.0,,2019-08-26 09:20:53,,
53,0.0,https://scontent-atl3-1.xx.fbcdn.net/v/t1.0-9/fr/cp0/e15/q65/69909924_452451728674202_8353333064230764544_o.jpg?_nc_cat=109&_nc_sid=8024bb&_nc_ohc=CxVjAeK0B7AAX8vDoz_&_nc_ht=scontent-atl3-1.xx&tp=14&oh=a57aaffc7deb8dc15d1d8595b3fe2670&oe=5F84D28B,18.0,,452451778674197,Welcome back faculty and staff! We can't wait to welcome our students tomorrow!,https://facebook.com/story.php?story_fbid=452451778674197&id=258767564709287,,0.0,Welcome back faculty and staff! We can't wait to welcome our students tomorrow!,2019-08-26 09:07:07,,
54,0.0,https://scontent-atl3-1.xx.fbcdn.net/v/t1.0-9/fr/cp0/e15/q65/61697798_407294419856600_3663632718672953344_n.jpg?_nc_cat=109&_nc_sid=110474&_nc_ohc=790tpjnsmj4AX_Qga3N&_nc_ht=scontent-atl3-1.xx&tp=14&oh=80874d60e033ccac618f40b6fd973cc6&oe=5F819825,41.0,,407294636523245,Congratulations to the SHS class of 2019!,https://facebook.com/story.php?story_fbid=407294636523245&id=258767564709287,,0.0,Congratulations to the SHS class of 2019!,2019-06-01 00:45:08,,
55,0.0,https://scontent-atl3-1.xx.fbcdn.net/v/t1.0-9/60485297_402003077052401_7973336025990692864_n.png?_nc_cat=100&_nc_sid=8024bb&_nc_ohc=FVz82lj2e_QAX9h9fuw&_nc_ht=scontent-atl3-1.xx&oh=90d2719ed3a7c6c69a4e688866031937&oe=5F825ACD,24.0,,402003673719008,"At last night's school committee meeting, we honored our 21 faculty and staff members retiring this year. Thank you for your many years of service to Seekonk Public Schools.",https://facebook.com/story.php?story_fbid=402003673719008&id=258767564709287,,0.0,"At last night's school committee meeting, we honored our 21 faculty and staff members retiring this year. Thank you for your many years of service to Seekonk Public Schools.",2019-05-21 09:25:10,,
56,2.0,https://scontent-atl3-1.xx.fbcdn.net/v/t1.0-9/59620397_395462697706439_2175417685796454400_n.png?_nc_cat=103&_nc_sid=8024bb&_nc_ohc=yOJdH-pgKUIAX_X9NAP&_nc_ht=scontent-atl3-1.xx&oh=5d54ed945d7b77a657c21ac1cf744d61&oe=5F820393,15.0,,395462754373100,Martin Elementary School was one of 60 MA schools selected to join ST Math Massachusetts Program to help improve elementary math proficiency.,https://facebook.com/story.php?story_fbid=395462754373100&id=258767564709287,,0.0,Martin Elementary School was one of 60 MA schools selected to join ST Math Massachusetts Program to help improve elementary math proficiency.,2019-05-08 10:21:43,,
57,0.0,https://scontent-atl3-1.xx.fbcdn.net/v/t1.0-9/59799460_395456627707046_1866819591179599872_n.png?_nc_cat=104&_nc_sid=8024bb&_nc_ohc=04OOdl3JkrIAX-XKiKp&_nc_ht=scontent-atl3-1.xx&oh=f3d2f866b457c21b93949db88ed0d376&oe=5F82147A,6.0,,395456644373711,Superintendent Drolet is pleased to announce Mr. George Kelleher-Bianchi as new Assistant Principal at Hurley Middle School.,https://facebook.com/story.php?story_fbid=395456644373711&id=258767564709287,,0.0,Superintendent Drolet is pleased to announce Mr. George Kelleher-Bianchi as new Assistant Principal at Hurley Middle School.,2019-05-08 10:05:47,,
58,0.0,https://scontent-atl3-1.xx.fbcdn.net/v/t1.0-9/fr/cp0/e15/q65/59795312_395117211074321_2761569649551212544_o.jpg?_nc_cat=102&_nc_sid=8024bb&_nc_ohc=Gw56fDWfheIAX9ub7LQ&_nc_ht=scontent-atl3-1.xx&tp=14&oh=76c107bc2392dafe97b16c3b6340615c&oe=5F8359A2,23.0,,395117321074310,Congratulations to our 12 seniors who have committed to majoring in education when they attend college this fall. #futureMAteachers,https://facebook.com/story.php?story_fbid=395117321074310&id=258767564709287,,0.0,Congratulations to our 12 seniors who have committed to majoring in education when they attend college this fall. #futureMAteachers,2019-05-07 14:23:52,,
59,0.0,,20.0,,392699791316063,Congratulation to SHS teacher Kristin Nelson on being named the 2019 MIAA Unified Basketball Coach of the Year!,https://facebook.com/story.php?story_fbid=392699791316063&id=258767564709287,,0.0,Congratulation to SHS teacher Kristin Nelson on being named the 2019 MIAA Unified Basketball Coach of the Year!,2019-05-02 09:37:46,,
60,0.0,https://scontent-atl3-1.xx.fbcdn.net/v/t1.0-9/fr/cp0/e15/q65/57328185_383098045609571_6136376194209153024_n.jpg?_nc_cat=101&_nc_sid=110474&_nc_ohc=KqSqi77Tx2sAX_tOOfw&_nc_ht=scontent-atl3-1.xx&tp=14&oh=26ef5167d8caace48a4b0114c228160e&oe=5F829C07,25.0,,383098695609506,"Congratulations 🎉 to all our new Seekonk High School National, Hispanica, & Portuguesa Honor Society Inductees! And thanks to Ms. Almeida and Ms. Marinucci for advising!",https://facebook.com/story.php?story_fbid=383098695609506&id=258767564709287,,0.0,"Congratulations 🎉 to all our new Seekonk High School National, Hispanica, & Portuguesa Honor Society Inductees! And thanks to Ms. Almeida and Ms. Marinucci for advising!",2019-04-10 19:30:10,,
61,0.0,https://scontent-atl3-1.xx.fbcdn.net/v/t1.0-9/56595459_382541162331926_2210241035819286528_n.png?_nc_cat=104&_nc_sid=8024bb&_nc_ohc=iQxZx5nPmOcAX-H2KCH&_nc_ht=scontent-atl3-1.xx&oh=be03f56edb21076c6213ef6c726f014d&oe=5F849CC8,8.0,,382541245665251,Seekonk Public Schools is excited to announce Mrs. Colleen Terrill the next Director of Technology and Digital Learning.,https://facebook.com/story.php?story_fbid=382541245665251&id=258767564709287,,0.0,Seekonk Public Schools is excited to announce Mrs. Colleen Terrill the next Director of Technology and Digital Learning.,2019-04-09 13:17:43,,
62,0.0,,13.0,https://www.youtube.com/watch?v=MjgoK8amdU4,368589467060429,"https://www.youtube.com/watch?v=MjgoK8amdU4
@ChooseToInclude, #WeAreSeekonk, #InclusionRevolution",https://facebook.com/story.php?story_fbid=368589467060429&id=258767564709287,"YOUTUBE.COM
Take the Pledge to Spread Inclusion",0.0,"https://www.youtube.com/watch?v=MjgoK8amdU4
@ChooseToInclude, #WeAreSeekonk, #InclusionRevolution

YOUTUBE.COM
Take the Pledge to Spread Inclusion",2019-03-06 13:45:31,,
63,3.0,,18.0,https://www.youtube.com/watch?v=0gcJozi6fCE&feature=share,367589623827080,,https://facebook.com/story.php?story_fbid=367589623827080&id=258767564709287,"YOUTUBE.COM
Seekonk Public Schools Snow Day Rap Video",21.0,"YOUTUBE.COM
Seekonk Public Schools Snow Day Rap Video",2019-03-03 23:26:18,,
64,5.0,https://scontent-atl3-1.xx.fbcdn.net/v/t1.0-9/52842328_365341587385217_8703924557339164672_n.png?_nc_cat=104&_nc_sid=8024bb&_nc_ohc=GluXBWTIyTEAX-QWvXB&_nc_ht=scontent-atl3-1.xx&oh=888efb023529cbb523630a7dfbc93705&oe=5F81C548,35.0,,365341650718544,"At last night's school committee meeting, we were proud to announce that Hurley Middle School has received a Project Lead the Way grant to support innovative course offerings for middle school students. #PLTW #STEM #innovation",https://facebook.com/story.php?story_fbid=365341650718544&id=258767564709287,,0.0,"At last night's school committee meeting, we were proud to announce that Hurley Middle School has received a Project Lead the Way grant to support innovative course offerings for middle school students. #PLTW #STEM #innovation",2019-02-26 11:14:44,,
65,0.0,https://scontent-atl3-1.xx.fbcdn.net/v/t1.0-9/fr/cp0/e15/q65/52153210_359884457930930_4593234400837107712_n.jpg?_nc_cat=111&_nc_sid=110474&_nc_ohc=mMtIcScd9sgAX9Sy7jH&_nc_ht=scontent-atl3-1.xx&tp=14&oh=c934b88cdc3627fb45778b6a9f18dc9e&oe=5F8196D6,6.0,,359884641264245,Senior Night!,https://facebook.com/story.php?story_fbid=359884641264245&id=258767564709287,,0.0,Senior Night!,2019-02-13 19:00:45,,
66,1.0,https://scontent-atl3-1.xx.fbcdn.net/v/t1.0-9/fr/cp0/e15/q65/51387357_353664358552940_7948007873701740544_n.jpg?_nc_cat=108&_nc_sid=110474&_nc_ohc=1FOM3X9QlbQAX8_R_02&_nc_ht=scontent-atl3-1.xx&tp=14&oh=85dcb157e522d1d1852a64c684e4d7f4&oe=5F83EF54,22.0,,353664721886237,Mrs. Hutchins reviewing bathroom expectations #pbis,https://facebook.com/story.php?story_fbid=353664721886237&id=258767564709287,,0.0,Mrs. Hutchins reviewing bathroom expectations #pbis,2019-01-30 17:37:47,,
67,0.0,https://scontent-atl3-1.xx.fbcdn.net/v/t1.0-9/fr/cp0/e15/q65/50862028_353664018552974_2673259744646397952_n.jpg?_nc_cat=111&_nc_sid=110474&_nc_ohc=D7dMjKlnU4QAX9xPdbV&_nc_ht=scontent-atl3-1.xx&tp=14&oh=9a83703ffb0e28bd60af984196a282a2&oe=5F82D73C,3.0,,353664138552962,Nice save!,https://facebook.com/story.php?story_fbid=353664138552962&id=258767564709287,,0.0,Nice save!,2019-01-30 17:35:54,,
68,0.0,,2.0,https://rsvp.eftours.com/t4s4zcu,353070258612350,"Attention Seekonk High Fresh. and Soph.: Are you interested in visiting London and Paris in the Summer of 2020? There will be a Family Info. Meeting this Wed., Jan. 30 at 7PM in the SHS Library. For more info. and to RSVP for the meeting visit:
https://rsvp.eftours.com/t4s4zcu",https://facebook.com/story.php?story_fbid=353070258612350&id=258767564709287,"RSVP.EFTOURS.COM
Pack your bags for London Summer 2020!",0.0,"Attention Seekonk High Fresh. and Soph.: Are you interested in visiting London and Paris in the Summer of 2020? There will be a Family Info. Meeting this Wed., Jan. 30 at 7PM in the SHS Library. For more info. and to RSVP for the meeting visit:
https://rsvp.eftours.com/t4s4zcu

RSVP.EFTOURS.COM
Pack your bags for London Summer 2020!",2019-01-29 09:30:59,,
69,0.0,https://scontent-atl3-1.xx.fbcdn.net/v/t1.0-9/fr/cp0/e15/q65/50883685_352874291965280_3603305264435953664_n.jpg?_nc_cat=108&_nc_sid=110474&_nc_ohc=Lng1l9VptvkAX-3Ytoo&_nc_ht=scontent-atl3-1.xx&tp=14&oh=227e56969444414d4a2052f7a0152291&oe=5F81E4A4,15.0,,352874521965257,Principals getting feedback from students about how to improve our schools,https://facebook.com/story.php?story_fbid=352874521965257&id=258767564709287,,0.0,Principals getting feedback from students about how to improve our schools,2019-01-28 21:24:05,,
70,1.0,https://scontent-atl3-1.xx.fbcdn.net/v/t1.0-9/fr/cp0/e15/q65/50309764_349156212337088_8586837027226386432_n.jpg?_nc_cat=111&_nc_sid=110474&_nc_ohc=ld8DLbkm7qQAX_WJRIQ&_nc_ht=scontent-atl3-1.xx&tp=14&oh=b98cc422f891ed0fa0d98eb70512ac84&oe=5F83F566,29.0,,349156399003736,Our Warriors are getting ready to compete on High School Quiz Show!,https://facebook.com/story.php?story_fbid=349156399003736&id=258767564709287,,0.0,Our Warriors are getting ready to compete on High School Quiz Show!,2019-01-19 17:40:54,,
71,0.0,https://scontent-atl3-1.xx.fbcdn.net/v/t1.0-9/fr/cp0/e15/q65/50046973_348673459052030_6888304979237404672_o.jpg?_nc_cat=107&_nc_sid=8024bb&_nc_ohc=9RRElw88K2IAX-ksGMS&_nc_ht=scontent-atl3-1.xx&tp=14&oh=eb528ce48cfbe76121c13ab0d0cc39af&oe=5F822932,19.0,,348673612385348,Mrs. Braganca and her second grade students at Martin Elementary School were honored today by Command Sergeant Major Moises A. Moniz from the R.I. National Guard. The students made holiday cards for deployed troops earlier this year.,https://facebook.com/story.php?story_fbid=348673612385348&id=258767564709287,,0.0,Mrs. Braganca and her second grade students at Martin Elementary School were honored today by Command Sergeant Major Moises A. Moniz from the R.I. National Guard. The students made holiday cards for deployed troops earlier this year.,2019-01-18 13:11:28,,
72,0.0,https://scontent-atl3-1.xx.fbcdn.net/v/t1.0-9/fr/cp0/e15/q65/49801147_346045282648181_9168103598825930752_n.jpg?_nc_cat=106&_nc_sid=110474&_nc_ohc=C9R7Td3_b30AX_LiLvE&_nc_ht=scontent-atl3-1.xx&tp=14&oh=7d5e7fa9fc192822bb219552ed23e438&oe=5F81BE68,5.0,,346045649314811,Seekonk HS Model UN Crisis Team members throwing some wrenches in the mix!,https://facebook.com/story.php?story_fbid=346045649314811&id=258767564709287,,0.0,Seekonk HS Model UN Crisis Team members throwing some wrenches in the mix!,2019-01-12 10:25:20,,
73,0.0,https://scontent-atl3-1.xx.fbcdn.net/v/t1.0-9/fr/cp0/e15/q65/49243607_346028899316486_5776528840419442688_n.jpg?_nc_cat=110&_nc_sid=110474&_nc_ohc=c4KcOhEJgfsAX-BQ_M-&_nc_ht=scontent-atl3-1.xx&tp=14&oh=51a2db4db8a417ac21a7e8fde7574adf&oe=5F81755C,9.0,,346029332649776,Phenomenal discussions and professional debating happening Seekonk High School #SeekonkModelUN,https://facebook.com/story.php?story_fbid=346029332649776&id=258767564709287,,0.0,Phenomenal discussions and professional debating happening Seekonk High School #SeekonkModelUN,2019-01-12 09:46:50,,
74,0.0,,2.0,,341996733053036,Go JV! Seekonk High School 2 for 2!,,,0.0,Go JV! Seekonk High School 2 for 2!,2019-01-02 17:26:14,https://video-atl3-1.xx.fbcdn.net/v/t42.9040-2/50017950_272135873453464_7529592473258033152_n.mp4?_nc_cat=106&_nc_sid=985c63&efg=eyJ2ZW5jb2RlX3RhZyI6InN2ZV9zZCJ9&_nc_ohc=0EHu6p75nUMAX93cZUY&_nc_ht=video-atl3-1.xx&oh=32d809f841f892307b53ee878464a6f4&oe=5F5DE088,
75,2.0,,10.0,,336703586915684,Very cool tradition for seniors led by Mr. H,,,0.0,Very cool tradition for seniors led by Mr. H,2018-12-21 14:41:41,https://video-atl3-1.xx.fbcdn.net/v/t42.9040-2/49124076_950591478461593_3522884875151474688_n.mp4?_nc_cat=109&_nc_sid=985c63&efg=eyJ2ZW5jb2RlX3RhZyI6InN2ZV9zZCJ9&_nc_ohc=Ms-dTGG6YWMAX_Tpz-D&_nc_ht=video-atl3-1.xx&oh=0533094b5cc36708afae71d52e128db9&oe=5F5DE597,
76,0.0,,8.0,,336701276915915,Is that “The Boss?” No it’s a very talented Mr. H!,,,0.0,Is that “The Boss?” No it’s a very talented Mr. H!,2018-12-21 14:33:27,https://video-atl3-1.xx.fbcdn.net/v/t42.9040-2/49025113_344530959462521_8409134898543067136_n.mp4?_nc_cat=104&_nc_sid=985c63&efg=eyJ2ZW5jb2RlX3RhZyI6InN2ZV9zZCJ9&_nc_ohc=5RY1KMFsQPUAX9D0tVD&_nc_ht=video-atl3-1.xx&oh=919055502f5d2479325c665695da7166&oe=5F5DE347,
77,0.0,https://scontent-atl3-1.xx.fbcdn.net/v/t1.0-9/fr/cp0/e15/q65/48386877_336697383582971_8050801606624542720_n.jpg?_nc_cat=110&_nc_sid=110474&_nc_ohc=i_f6ems_2IQAX8U74Bl&_nc_ht=scontent-atl3-1.xx&tp=14&oh=cd7448e377529da008948606b156640a&oe=5F83E665,23.0,,336697423582967,The Polar Express visited Martin ES today! Thanks to our reader (Mrs. Hutchins) and conductor (Mr. Lush)!,https://facebook.com/story.php?story_fbid=336697423582967&id=258767564709287,,0.0,The Polar Express visited Martin ES today! Thanks to our reader (Mrs. Hutchins) and conductor (Mr. Lush)!,2018-12-21 14:19:34,,
78,1.0,https://scontent-atl3-1.xx.fbcdn.net/v/t1.0-9/fr/cp0/e15/q65/48374397_335791157006927_387201622540812288_n.jpg?_nc_cat=102&_nc_sid=110474&_nc_ohc=yVO9KxhJzogAX9Awe7U&_nc_ht=scontent-atl3-1.xx&tp=14&oh=f8b5339fd8f13a8cafd4835287fe5d58&oe=5F852AD2,20.0,,335791177006925,Getting into the holiday spirit with the HMS band at their Winter Concert.,https://facebook.com/story.php?story_fbid=335791177006925&id=258767564709287,,0.0,Getting into the holiday spirit with the HMS band at their Winter Concert.,2018-12-19 18:30:16,,
79,4.0,https://scontent-atl3-1.xx.fbcdn.net/v/t1.0-9/fr/cp0/e15/q65/48373223_334778500441526_8577393416344698880_o.jpg?_nc_cat=110&_nc_sid=8024bb&_nc_ohc=vj8P1EQuNOkAX-vBIis&_nc_ht=scontent-atl3-1.xx&tp=14&oh=523436e25e91e96db1ed6a5862cc85b8&oe=5F835385,57.0,,334778847108158,"Today, the Seekonk High School Athletic Department was proud to recognize five student athletes as they commit to continue their athletic careers at several colleges and universities. Congratulations Cameron, Trinity, Logan, Adam, and Hannah!",https://facebook.com/story.php?story_fbid=334778847108158&id=258767564709287,,0.0,"Today, the Seekonk High School Athletic Department was proud to recognize five student athletes as they commit to continue their athletic careers at several colleges and universities. Congratulations Cameron, Trinity, Logan, Adam, and Hannah!",2018-12-17 10:36:49,,
80,0.0,https://scontent-atl3-1.xx.fbcdn.net/v/t1.0-9/fr/cp0/e15/q65/48362956_333219007264142_7598249604248764416_n.jpg?_nc_cat=100&_nc_sid=110474&_nc_ohc=AP89jaAYtw8AX9oRLKx&_nc_ht=scontent-atl3-1.xx&tp=14&oh=5c4a13440d10bb50e22f34080f9a124d&oe=5F82A4E1,14.0,,333219027264140,"Congrats to SHS senior Thomas Ciolfi for earning a $1,000 superintendent’s scholarship sponsored by the SCEC for demonstrating leadership and academic excellence!",https://facebook.com/story.php?story_fbid=333219027264140&id=258767564709287,,0.0,"Congrats to SHS senior Thomas Ciolfi for earning a $1,000 superintendent’s scholarship sponsored by the SCEC for demonstrating leadership and academic excellence!",2018-12-13 16:09:02,,
81,0.0,https://scontent-atl3-1.xx.fbcdn.net/v/t1.0-9/fr/cp0/e15/q65/48361532_332850337301009_4158602548208467968_n.jpg?_nc_cat=110&_nc_sid=110474&_nc_ohc=OEYWZrBWWxcAX9nP_Sj&_nc_ht=scontent-atl3-1.xx&tp=14&oh=fdb11aea83fd4819ebef0492dbcefec2&oe=5F81A70A,14.0,,332850510634325,Let the SHS Winter Concert begin! Seekonk High School,https://facebook.com/story.php?story_fbid=332850510634325&id=258767564709287,,0.0,Let the SHS Winter Concert begin! Seekonk High School,2018-12-12 19:04:10,,
82,0.0,https://scontent-atl3-1.xx.fbcdn.net/v/t1.0-9/fr/cp0/e15/q65/48234025_332806020638774_6041150867971768320_n.jpg?_nc_cat=111&_nc_sid=110474&_nc_ohc=e8qKnLDzz8cAX9z1k6u&_nc_ht=scontent-atl3-1.xx&tp=14&oh=446149477c144f55f754ad4cc319d6b2&oe=5F81E2D1,8.0,,332806047305438,Hurley doing well against Berkley! Dr. Kevin M. Hurley Middle School,https://facebook.com/story.php?story_fbid=332806047305438&id=258767564709287,,0.0,Hurley doing well against Berkley! Dr. Kevin M. Hurley Middle School,2018-12-12 16:19:17,,
83,0.0,,7.0,,332352310684145,For 3! Swish! Seekonk High School,,,0.0,For 3! Swish! Seekonk High School,2018-12-11 18:45:41,https://video-atl3-1.xx.fbcdn.net/v/t42.9040-2/48462373_341130590016608_2747966002066096128_n.mp4?_nc_cat=111&_nc_sid=985c63&efg=eyJ2ZW5jb2RlX3RhZyI6InN2ZV9zZCJ9&_nc_ohc=SJlgQpiQtwEAX9MV6Zs&_nc_ht=video-atl3-1.xx&oh=b251a39b9e519b1c2c518d090bb5eaac&oe=5F5DE4F5,
84,0.0,https://scontent-atl3-1.xx.fbcdn.net/v/t1.0-9/fr/cp0/e15/q65/47365336_328409181078458_3252481847388536832_n.jpg?_nc_cat=105&_nc_sid=110474&_nc_ohc=KDWxS7AhdRoAX_pDGdE&_nc_ht=scontent-atl3-1.xx&tp=14&oh=c6b5e2e6cfa39efa95706f0967955fbb&oe=5F830686,6.0,,328409231078453,Thank you to all who were able to come to tonight’s Superintendent Coffee Hour prior to School Commitee to meet the new administrative team.,https://facebook.com/story.php?story_fbid=328409231078453&id=258767564709287,,0.0,Thank you to all who were able to come to tonight’s Superintendent Coffee Hour prior to School Commitee to meet the new administrative team.,2018-12-03 20:54:51,,
85,0.0,https://scontent-atl3-1.xx.fbcdn.net/v/t1.0-9/fr/cp0/e15/q65/47025201_326735067912536_7622242189212385280_n.jpg?_nc_cat=104&_nc_sid=110474&_nc_ohc=Y8HOYRpeJPAAX-I3eEb&_nc_ht=scontent-atl3-1.xx&tp=14&oh=3746437e971cd658316eeecd2443f594&oe=5F82C325,4.0,,326735077912535,Phenomenal SHS students “SPEAK”ing to HMS 8th graders about some of the many positive aspects associated with attending Seekonk High School!,https://facebook.com/story.php?story_fbid=326735077912535&id=258767564709287,,0.0,Phenomenal SHS students “SPEAK”ing to HMS 8th graders about some of the many positive aspects associated with attending Seekonk High School!,2018-11-29 23:32:47,,
86,0.0,https://scontent-atl3-1.xx.fbcdn.net/v/t1.0-9/46464902_322467831672593_7966047264625917952_n.png?_nc_cat=102&_nc_sid=8024bb&_nc_ohc=19UBInojOKQAX9FUIgS&_nc_ht=scontent-atl3-1.xx&oh=dfbab3fe63009e7fc419bef7af480983&oe=5F81F1D1,9.0,,322467865005923,Wow! Seekonk High will compete on the 10th Season of WGBH's High School Quiz Show! They qualified by placing in the top 16 of the 79 HSs participating in the preliminary round. We are very proud! Way to go! #SeekonkPS #WGBH,https://facebook.com/story.php?story_fbid=322467865005923&id=258767564709287,,0.0,Wow! Seekonk High will compete on the 10th Season of WGBH's High School Quiz Show! They qualified by placing in the top 16 of the 79 HSs participating in the preliminary round. We are very proud! Way to go! #SeekonkPS #WGBH,2018-11-19 17:20:47,,
87,1.0,https://scontent-atl3-1.xx.fbcdn.net/v/t1.0-9/fr/cp0/e15/q65/46446987_320677391851637_8627617767471710208_n.jpg?_nc_cat=111&_nc_sid=110474&_nc_ohc=Am_qkAvKF2gAX8KkKvW&_nc_ht=scontent-atl3-1.xx&tp=14&oh=decfbb6328ba98761cf0c7a85665f81d&oe=5F835C51,12.0,,320677611851615,At SHS Learning about force and friction (and also maybe preparing for Spirit Week)!,https://facebook.com/story.php?story_fbid=320677611851615&id=258767564709287,,0.0,At SHS Learning about force and friction (and also maybe preparing for Spirit Week)!,2018-11-15 12:00:10,,
88,0.0,https://scontent-atl3-1.xx.fbcdn.net/v/t1.0-9/46148751_320258295226880_5378819945461186560_n.png?_nc_cat=100&_nc_sid=8024bb&_nc_ohc=FabbQ60Eo8MAX-Q4b5d&_nc_ht=scontent-atl3-1.xx&oh=d641b7e84f225f5b34415d15efe57fc9&oe=5F82FE1C,1.0,,320258358560207,Join us for the next Superintendent's Coffee Hour.,https://facebook.com/story.php?story_fbid=320258358560207&id=258767564709287,,0.0,Join us for the next Superintendent's Coffee Hour.,2018-11-14 10:57:31,,
89,0.0,https://scontent-atl3-1.xx.fbcdn.net/v/t1.0-9/fr/cp0/e15/q65/44126876_310305782888798_5529802116228448256_n.jpg?_nc_cat=100&_nc_sid=110474&_nc_ohc=ts7ko3_C5-AAX8FGSDB&_nc_ht=scontent-atl3-1.xx&tp=14&oh=ed9337474c0e70ab11ff3e03acd10e79&oe=5F82B748,2.0,,310305799555463,7th grade band and some volleyball action at Hurley Middle School!,https://facebook.com/story.php?story_fbid=310305799555463&id=258767564709287,,0.0,7th grade band and some volleyball action at Hurley Middle School!,2018-10-18 12:16:43,,
90,0.0,,0.0,http://www.seekonkschools.org/common/pages/DisplayFile.aspx?itemId=49643197,308323213087055,The latest Superintendent's Update is posted on the district's website and can be found by clicking here: http://www.seekonkschools.org/common/pages/DisplayFile.aspx?itemId=49643197,https://facebook.com/story.php?story_fbid=308323213087055&id=258767564709287,"SEEKONK.K12.MA.US
www.seekonk.k12.ma.us",0.0,"The latest Superintendent's Update is posted on the district's website and can be found by clicking here: http://www.seekonkschools.org/common/pages/DisplayFile.aspx?itemId=49643197

SEEKONK.K12.MA.US
www.seekonk.k12.ma.us",2018-10-12 15:16:09,,
91,1.0,https://scontent-atl3-1.xx.fbcdn.net/v/t1.0-9/fr/cp0/e15/q65/43650816_308015956451114_1455128301340196864_n.jpg?_nc_cat=107&_nc_sid=110474&_nc_ohc=uxh976Tm0OYAX9CHi8H&_nc_ht=scontent-atl3-1.xx&tp=14&oh=e9b937cf3bab43b6a29d880fe985477a&oe=5F846E65,20.0,,308016563117720,Great first unified game of the season! Seekonk High School,https://facebook.com/story.php?story_fbid=308016563117720&id=258767564709287,,0.0,Great first unified game of the season! Seekonk High School,2018-10-11 16:34:04,,
92,0.0,https://scontent-atl3-1.xx.fbcdn.net/v/t1.0-9/fr/cp0/e15/q65/43698403_307955213123855_6504512036016226304_o.jpg?_nc_cat=106&_nc_sid=8024bb&_nc_ohc=rX1iimWOhDoAX8oSh9e&_nc_ht=scontent-atl3-1.xx&tp=14&oh=2b7c485a726cad0e89b49b3a41eff33d&oe=5F8196DA,5.0,,307955306457179,The first meeting of the Social Emotional Learning Taskforce was a hit with representatives from each school! #SEL,https://facebook.com/story.php?story_fbid=307955306457179&id=258767564709287,,0.0,The first meeting of the Social Emotional Learning Taskforce was a hit with representatives from each school! #SEL,2018-10-11 12:24:39,,
93,0.0,https://scontent-atl3-1.xx.fbcdn.net/v/t1.0-9/fr/cp0/e15/q65/43198544_306072729978770_3295629522635849728_o.jpg?_nc_cat=109&_nc_sid=110474&_nc_ohc=1S_cbtbuFn8AX-GVgSy&_nc_ht=scontent-atl3-1.xx&tp=14&oh=41c9545e165bfeee51b1280ef619e65b&oe=5F82513A,4.0,,306072746645435,What a great line leader!,https://facebook.com/story.php?story_fbid=306072746645435&id=258767564709287,,0.0,What a great line leader!,2018-10-05 17:17:57,,
94,0.0,https://scontent-atl3-1.xx.fbcdn.net/v/t1.0-9/fr/cp0/e15/q65/43165803_306030919982951_5022741537142865920_n.jpg?_nc_cat=109&_nc_sid=110474&_nc_ohc=jiWasEsl1YsAX9uTW6n&_nc_ht=scontent-atl3-1.xx&tp=14&oh=923fbc23cd57b8befa29e7e4e91d4657&oe=5F82F22B,24.0,,306030933316283,What a great group of 2nd graders! Thanks to Keri Pinho Steitz for inviting the superintendent to read to her class this morning.,https://facebook.com/story.php?story_fbid=306030933316283&id=258767564709287,,0.0,What a great group of 2nd graders! Thanks to Keri Pinho Steitz for inviting the superintendent to read to her class this morning.,2018-10-05 14:17:53,,
95,0.0,,5.0,https://drive.google.com/file/d/1abhOt8dxD3zqlzGLA1jwOb58hdV-TORs/view,305672123352164,"As we prepare for Town Meeting on November 19, the school committee and school department are pleased to share information about the proposed Aitken School addition. https://drive.google.com/file/d/1abhOt8dxD3zqlzGLA1jwOb58hdV-TORs/view",https://facebook.com/story.php?story_fbid=305672123352164&id=258767564709287,"DRIVE.GOOGLE.COM
Aitken Addition - FAQs.pdf",2.0,"As we prepare for Town Meeting on November 19, the school committee and school department are pleased to share information about the proposed Aitken School addition. https://drive.google.com/file/d/1abhOt8dxD3zqlzGLA1jwOb58hdV-TORs/view

DRIVE.GOOGLE.COM
Aitken Addition - FAQs.pdf",2018-10-04 13:39:04,,
96,1.0,https://scontent-atl3-1.xx.fbcdn.net/v/t1.0-9/fr/cp0/e15/q65/42999649_304708990115144_2613040832822902784_n.jpg?_nc_cat=104&_nc_sid=110474&_nc_ohc=hJfQPyexQD8AX-9F9sz&_nc_ht=scontent-atl3-1.xx&tp=14&oh=82c82824b89a07096800363f390bf951&oe=5F81E170,16.0,,304709006781809,Had fun administering a class meeting in Mrs. Sceeles’ 4th grade class this afternoon!,https://facebook.com/story.php?story_fbid=304709006781809&id=258767564709287,,0.0,Had fun administering a class meeting in Mrs. Sceeles’ 4th grade class this afternoon!,2018-10-01 18:43:39,,
97,0.0,,2.0,,536899690097964,Nice kick!,,,0.0,Nice kick!,2018-09-28 19:55:04,https://video-atl3-1.xx.fbcdn.net/v/t42.9040-2/42803810_327057558029076_7918752570821050368_n.mp4?_nc_cat=108&_nc_sid=985c63&efg=eyJ2ZW5jb2RlX3RhZyI6InN2ZV9zZCJ9&_nc_ohc=CHUQ5S3ixWoAX_Bp_Hz&_nc_ht=video-atl3-1.xx&oh=b431e9e55038845775eba6112f561fa0&oe=5F5DE662,
98,0.0,,2.0,,309200803196644,Friday night lights!,,,0.0,Friday night lights!,2018-09-28 19:32:58,https://video-atl3-1.xx.fbcdn.net/v/t42.9040-2/42606534_671245526578907_6717132364780142592_n.mp4?_nc_cat=109&_nc_sid=985c63&efg=eyJ2ZW5jb2RlX3RhZyI6InN2ZV9zZCJ9&_nc_ohc=vME4pkbrHTQAX8C9Vgh&_nc_ht=video-atl3-1.xx&oh=6a03390620c30bd1db61611e780d492e&oe=5F5DE39E,
99,0.0,,4.0,http://www.seekonk.k12.ma.us/common/pages/DisplayFile.aspx?itemId=48940259,303084476944262,"Want to know what has been happening in Seekonk Schools? Check out the latest Superintendent’s Update.
http://www.seekonk.k12.ma.us/common/pages/DisplayFile.aspx?itemId=48940259",https://facebook.com/story.php?story_fbid=303084476944262&id=258767564709287,"SEEKONK.K12.MA.US
www.seekonk.k12.ma.us",0.0,"Want to know what has been happening in Seekonk Schools? Check out the latest Superintendent’s Update.
http://www.seekonk.k12.ma.us/common/pages/DisplayFile.aspx?itemId=48940259

SEEKONK.K12.MA.US
www.seekonk.k12.ma.us",2018-09-26 12:26:24,,
100,0.0,https://scontent-atl3-1.xx.fbcdn.net/v/t1.0-9/42555338_303084140277629_2659860657863655424_o.png?_nc_cat=103&_nc_sid=8024bb&_nc_ohc=8zySkuF5ryQAX-rklfZ&_nc_ht=scontent-atl3-1.xx&oh=dc078a8dd8335c86eb0d71b0d6a3f175&oe=5F83CACC,3.0,,303084190277624,Come and join us!,https://facebook.com/story.php?story_fbid=303084190277624&id=258767564709287,,0.0,Come and join us!,2018-09-26 12:25:05,,
101,0.0,https://scontent-atl3-1.xx.fbcdn.net/v/t1.0-9/fr/cp0/e15/q65/41990836_300451560540887_2846346471408664576_o.jpg?_nc_cat=101&_nc_sid=110474&_nc_ohc=DkMIe-l5sVgAX-OG5xo&_nc_ht=scontent-atl3-1.xx&tp=14&oh=663a51777c030045bea7caa0476e499e&oe=5F84368F,2.0,,300451577207552,Thanks Mr. Rubin for inviting the superintendent to speak to your SHS students about personal growth and development!,https://facebook.com/story.php?story_fbid=300451577207552&id=258767564709287,,0.0,Thanks Mr. Rubin for inviting the superintendent to speak to your SHS students about personal growth and development!,2018-09-18 15:08:06,,
102,0.0,https://scontent-atl3-1.xx.fbcdn.net/v/t1.0-9/fr/cp0/e15/q65/42058783_300450850540958_1370676995054108672_n.jpg?_nc_cat=105&_nc_sid=110474&_nc_ohc=s-1kbaqDkBcAX8wDRly&_nc_ht=scontent-atl3-1.xx&tp=14&oh=fcc783620e756349f649d9dc4852db39&oe=5F816138,0.0,,300450887207621,Thanks Mr. Perry for sharing how you use the “CER” Claim/Evidence/Reasoning process to help SHS students write about scientific thinking!,https://facebook.com/story.php?story_fbid=300450887207621&id=258767564709287,,0.0,Thanks Mr. Perry for sharing how you use the “CER” Claim/Evidence/Reasoning process to help SHS students write about scientific thinking!,2018-09-18 15:06:35,,
103,0.0,,4.0,,300436263875750,"Due to current weather conditions, expect buses to be running about 10-15 minutes late this afternoon.",https://facebook.com/story.php?story_fbid=300436263875750&id=258767564709287,,0.0,"Due to current weather conditions, expect buses to be running about 10-15 minutes late this afternoon.",2018-09-18 14:03:53,,
104,0.0,,2.0,,551282115311367,1-0 Seekonk! Post-goal celebration,,,0.0,1-0 Seekonk! Post-goal celebration,2018-09-14 16:55:19,https://video-atl3-1.xx.fbcdn.net/v/t42.9040-2/41622273_266780280832423_4058009157096177664_n.mp4?_nc_cat=100&_nc_sid=985c63&efg=eyJ2ZW5jb2RlX3RhZyI6InN2ZV9zZCJ9&_nc_ohc=s_4YgWgiKMIAX8GDmuM&_nc_ht=video-atl3-1.xx&oh=ec891af21bb0fc6b264ca75fb6d45bb4&oe=5F5DE764,
105,0.0,https://scontent-atl3-1.xx.fbcdn.net/v/t1.0-9/fr/cp0/e15/q65/41741951_299133087339401_6588293967354265600_o.jpg?_nc_cat=108&_nc_sid=8024bb&_nc_ohc=p49-EioMuLwAX8V52xl&_nc_oc=AQlinw3G3_ku4IlNTVR8LXOYAUfX77DvcWgLvARjNE5SOtgF_IP2IUdspG06sp46UD8&_nc_ht=scontent-atl3-1.xx&tp=14&oh=08c851dfe9967b3bd6ca95f76aba9ced&oe=5F81893B,7.0,,299133150672728,Thank you Chief Mace for your service to our community!,https://facebook.com/story.php?story_fbid=299133150672728&id=258767564709287,,0.0,Thank you Chief Mace for your service to our community!,2018-09-14 14:33:33,,
106,0.0,https://scontent-atl3-1.xx.fbcdn.net/v/t1.0-9/41842825_299131504006226_5063557702278447104_n.png?_nc_cat=109&_nc_sid=8024bb&_nc_ohc=4ZyrsuC0jHMAX-z1WKt&_nc_ht=scontent-atl3-1.xx&oh=7f20f068546794e506064a9c3118afbc&oe=5F84C6C3,9.0,,299131994006177,Seekonk High School was pleased to welcome author Karen M. McManus to speak with our students today. McManus is the author of this year's all school read One of Us Is Lying.,https://facebook.com/story.php?story_fbid=299131994006177&id=258767564709287,,0.0,Seekonk High School was pleased to welcome author Karen M. McManus to speak with our students today. McManus is the author of this year's all school read One of Us Is Lying.,2018-09-14 14:28:07,,
107,1.0,https://scontent-atl3-1.xx.fbcdn.net/v/t1.0-9/fr/cp0/e15/q65/41622763_298264040759639_1212354098112757760_n.jpg?_nc_cat=104&_nc_sid=110474&_nc_ohc=4S35cgFh64MAX_n2a6c&_nc_ht=scontent-atl3-1.xx&tp=14&oh=192abb362894092bbcd2daa8366afff9&oe=5F8471D2,20.0,,298264070759636,Wonderful 9/11 Ceremony this evening led by the town. Thanks to Zachary Waddicor and Mr. Lush and Mr. Haidemenos and Mr. Smialek and the many other Seekonk educators and students who participated and attended!,https://facebook.com/story.php?story_fbid=298264070759636&id=258767564709287,,0.0,Wonderful 9/11 Ceremony this evening led by the town. Thanks to Zachary Waddicor and Mr. Lush and Mr. Haidemenos and Mr. Smialek and the many other Seekonk educators and students who participated and attended!,2018-09-11 22:13:16,,
108,2.0,https://scontent-atl3-1.xx.fbcdn.net/v/t1.0-9/fr/cp0/e15/q65/41120194_296447060941337_1083934477178109952_n.jpg?_nc_cat=101&_nc_sid=110474&_nc_ohc=mtcPFoODzDsAX8r32te&_nc_ht=scontent-atl3-1.xx&tp=14&oh=1251f08026294edaa16c2faaea0964f1&oe=5F82AC1B,16.0,,296447154274661,Had fun visiting Mrs. Owens Grade 1 and Mrs. Germain’s Grade 4 classes! Great kids and great teachers!,https://facebook.com/story.php?story_fbid=296447154274661&id=258767564709287,,0.0,Had fun visiting Mrs. Owens Grade 1 and Mrs. Germain’s Grade 4 classes! Great kids and great teachers!,2018-09-06 13:35:56,,
109,0.0,https://scontent-atl3-1.xx.fbcdn.net/v/t1.0-9/fr/cp0/e15/q65/40810538_295708594348517_744235188636090368_n.jpg?_nc_cat=104&_nc_sid=110474&_nc_ohc=Ew0z2TxeVPgAX_8gbTc&_nc_ht=scontent-atl3-1.xx&tp=14&oh=b5c4a9353a2a871de0ef03986f041fc9&oe=5F83E61F,5.0,,295708621015181,Bus safety tips from “Buster” for our AES kindergartens,https://facebook.com/story.php?story_fbid=295708621015181&id=258767564709287,,0.0,Bus safety tips from “Buster” for our AES kindergartens,2018-09-04 09:58:21,,
110,0.0,https://scontent-atl3-1.xx.fbcdn.net/v/t1.0-9/40363697_294046274514749_5616724291430121472_n.png?_nc_cat=108&_nc_sid=8024bb&_nc_ohc=AmAkwO6Sx_gAX_jgzVq&_nc_oc=AQmNxlHjUQo8FZgZ6aWGhbTlHbKIApWZrnqnN5aKPML4cef49idqxJ2xDMOx1P4WwFg&_nc_ht=scontent-atl3-1.xx&oh=a9853a848d16a19a03196ae7e96879a4&oe=5F84EF51,5.0,,294046331181410,Parents and Guardians: Open House is a great opportunity to learn more about the upcoming school year. We hope you can make it!,https://facebook.com/story.php?story_fbid=294046331181410&id=258767564709287,,0.0,Parents and Guardians: Open House is a great opportunity to learn more about the upcoming school year. We hope you can make it!,2018-08-30 11:30:17,,
111,0.0,https://scontent-atl3-1.xx.fbcdn.net/v/t1.0-9/fr/cp0/e15/q65/40310795_293821377870572_555833321460858880_n.jpg?_nc_cat=106&_nc_sid=110474&_nc_ohc=qYUcHdkPX7IAX932Q9f&_nc_ht=scontent-atl3-1.xx&tp=14&oh=10f702fcd472fc79355fb394d8a7ed7e&oe=5F83328E,15.0,,293821394537237,"Look out, Seekonk. The class of 2031 has arrived! So happy to welcome our Kindergarteners to Aitken and Martin today!",https://facebook.com/story.php?story_fbid=293821394537237&id=258767564709287,,0.0,"Look out, Seekonk. The class of 2031 has arrived! So happy to welcome our Kindergarteners to Aitken and Martin today!",2018-08-29 19:55:41,,
112,0.0,https://scontent-atl3-1.xx.fbcdn.net/v/t1.0-9/fr/cp0/e15/q65/40325493_293119824607394_6447477941226962944_n.jpg?_nc_cat=101&_nc_sid=110474&_nc_ohc=zBBqqQL-WZoAX_QIR1I&_nc_ht=scontent-atl3-1.xx&tp=14&oh=88a85ef8dd93c5f7fd9a6cad24c9825b&oe=5F84E833,7.0,,293119881274055,Martin School staff are ready for a new year. Are you???,https://facebook.com/story.php?story_fbid=293119881274055&id=258767564709287,,0.0,Martin School staff are ready for a new year. Are you???,2018-08-27 19:15:19,,
113,0.0,https://scontent-atl3-1.xx.fbcdn.net/v/t1.0-9/40374089_292956874623689_6010459817653567488_n.png?_nc_cat=108&_nc_sid=8024bb&_nc_ohc=8ilyfOMaOLYAX-USUzY&_nc_ht=scontent-atl3-1.xx&oh=288c43d81717a0bf3f672cf8b982d7f0&oe=5F81894A,6.0,,292957024623674,So many smiling faces at today’s Welcome Back Orientation! Excited and eager to welcome our students tomorrow.,https://facebook.com/story.php?story_fbid=292957024623674&id=258767564709287,,0.0,So many smiling faces at today’s Welcome Back Orientation! Excited and eager to welcome our students tomorrow.,2018-08-27 09:05:41,,
114,0.0,https://scontent-atl3-1.xx.fbcdn.net/v/t1.0-9/fr/cp0/e15/q65/39913974_289960998256610_858640971234017280_o.jpg?_nc_cat=103&_nc_sid=8024bb&_nc_ohc=Gn6Zi9NlnF4AX99Qs8x&_nc_ht=scontent-atl3-1.xx&tp=14&oh=b034475741d1bf7276eec7d19c6a2d22&oe=5F825C6E,3.0,,289961108256599,Day 1 of the District Leadership Team retreat focused on building trust and qualities of successful leaders.,https://facebook.com/story.php?story_fbid=289961108256599&id=258767564709287,,0.0,Day 1 of the District Leadership Team retreat focused on building trust and qualities of successful leaders.,2018-08-22 17:36:51,,
115,0.0,https://scontent-atl3-1.xx.fbcdn.net/v/t1.0-9/39861814_288911825028194_7079292721667506176_n.png?_nc_cat=106&_nc_sid=8024bb&_nc_ohc=tt_zi3kh-mMAX-VIcmm&_nc_ht=scontent-atl3-1.xx&oh=ccccbed9dfd32b45a7d652c3095b6550&oe=5F82A199,3.0,http://seekonk.sharpschool.com/cms/One.aspx?pageId=271690&portalId=232971&objectId.822314=36185628&contextId.822314=16015232&parentId.822314=16015233,288912345028142,Our school buses are ready to roll! Check up updated 2018-2019 bus routes. http://seekonk.sharpschool.com//cms/One.aspx?pageId=271690&portalId=232971&objectId.822314=36185628&contextId.822314=16015232&parentId.822314=16015233,https://facebook.com/story.php?story_fbid=288912345028142&id=258767564709287,,0.0,Our school buses are ready to roll! Check up updated 2018-2019 bus routes. http://seekonk.sharpschool.com//cms/One.aspx?pageId=271690&portalId=232971&objectId.822314=36185628&contextId.822314=16015232&parentId.822314=16015233,2018-08-21 15:17:41,,
116,0.0,https://scontent-atl3-1.xx.fbcdn.net/v/t1.0-9/fr/cp0/e15/q65/39811083_288811151704928_8147831991652319232_o.jpg?_nc_cat=100&_nc_sid=8024bb&_nc_ohc=sKvBkurDbAkAX9qN7z5&_nc_ht=scontent-atl3-1.xx&tp=14&oh=b6bec166ed55097774687a3a96fdf07e&oe=5F82D9CC,2.0,,288812258371484,Seekonk new teacher orientation! So exciting to welcome these great educators!,https://facebook.com/story.php?story_fbid=288812258371484&id=258767564709287,,0.0,Seekonk new teacher orientation! So exciting to welcome these great educators!,2018-08-21 12:54:04,,
117,0.0,,4.0,http://www.thesunchronicle.com/news/local_news/seekonk-has-a-new-school-superintendent/article_2e3b03a1-ef2c-575d-b2a3-1610603b4ac9.html,281841295735247,SPS is so excited to have Dr. Drolet join the team! http://www.thesunchronicle.com/news/local_news/seekonk-has-a-new-school-superintendent/article_2e3b03a1-ef2c-575d-b2a3-1610603b4ac9.html,https://facebook.com/story.php?story_fbid=281841295735247&id=258767564709287,"THESUNCHRONICLE.COM
Seekonk has a new school superintendent",0.0,"SPS is so excited to have Dr. Drolet join the team! http://www.thesunchronicle.com/news/local_news/seekonk-has-a-new-school-superintendent/article_2e3b03a1-ef2c-575d-b2a3-1610603b4ac9.html

THESUNCHRONICLE.COM
Seekonk has a new school superintendent",2018-08-13 20:40:26,,
118,0.0,https://scontent-atl3-1.xx.fbcdn.net/v/t1.0-9/37694830_263141600938550_5985438124166086656_o.png?_nc_cat=103&_nc_sid=8024bb&_nc_ohc=0Lpp1mjYbDgAX8otoCJ&_nc_ht=scontent-atl3-1.xx&oh=f34ce3330041e4d6f7da5508f7e5ce3d&oe=5F839797,3.0,,263142034271840,It's almost that time! Save the date for the opening of school! We'll see you soon!,https://facebook.com/story.php?story_fbid=263142034271840&id=258767564709287,,0.0,It's almost that time! Save the date for the opening of school! We'll see you soon!,2018-07-23 16:24:52,,
