,comments,image,likes,link,post_id,post_text,post_url,shared_text,shares,text,time,video,video_thumbnail
145,1.0,https://scontent-atl3-1.xx.fbcdn.net/v/t1.0-9/fr/cp0/e15/q65/79747732_2601714556740109_7647751958488416256_n.jpg?_nc_cat=100&_nc_sid=8024bb&_nc_ohc=-aFzPfvuF8wAX9Wu6nu&_nc_ht=scontent-atl3-1.xx&tp=14&oh=c2f883a18b716f8c8def8e38c6c3b809&oe=5F86F0CC,32.0,,2601717030073195,"All West School students attending a concert at Sutherlin High School this morning.
#engagedstudentsstaffandcommunity",https://facebook.com/story.php?story_fbid=2601717030073195&id=2067286396849597,,0.0,"All West School students attending a concert at Sutherlin High School this morning.
#engagedstudentsstaffandcommunity",2019-12-13 15:20:57,,
146,0.0,https://scontent-atl3-1.xx.fbcdn.net/v/t1.0-9/fr/cp0/e15/q65/78954359_2597407267170838_1047733739733385216_n.jpg?_nc_cat=105&_nc_sid=8024bb&_nc_ohc=XrfiLn4PxMsAX9atNrI&_nc_ht=scontent-atl3-1.xx&tp=14&oh=0b2594a1c8a57f8fe1164d510d786ee7&oe=5F89937D,36.0,,2597413300503568,"Thank you to the SHS Choir for performing
at the tree lighting last night. The Chamber of Commerce
really appreciates your support. Also, just a couple of pictures
from the ""Who Hair"" contest.
#engagedstudentsstaffandcommunity",https://facebook.com/story.php?story_fbid=2597413300503568&id=2067286396849597,,0.0,"Thank you to the SHS Choir for performing
at the tree lighting last night. The Chamber of Commerce
really appreciates your support. Also, just a couple of pictures
from the ""Who Hair"" contest.
#engagedstudentsstaffandcommunity",2019-12-09 12:53:53,,
147,0.0,https://scontent-atl3-1.xx.fbcdn.net/v/t1.0-9/fr/cp0/e15/q65/78992470_2597404890504409_29353202365235200_n.jpg?_nc_cat=107&_nc_sid=8024bb&_nc_ohc=0z01MGURC6YAX9nl7_l&_nc_ht=scontent-atl3-1.xx&tp=14&oh=ceb8965a279676aeec690d08e8232e0d&oe=5F878158,42.0,,2597406257170939,"Great night at the Sutherlin Tree Lighting Ceremony.
We live in a wonderful community!",https://facebook.com/story.php?story_fbid=2597406257170939&id=2067286396849597,,0.0,"Great night at the Sutherlin Tree Lighting Ceremony.
We live in a wonderful community!",2019-12-09 12:44:58,,
148,3.0,https://scontent-atl3-1.xx.fbcdn.net/v/t1.0-9/fr/cp0/e15/q65/78337855_2591573007754264_4829900065352974336_n.jpg?_nc_cat=109&_nc_sid=8024bb&_nc_ohc=t6Qw0K79B8wAX-\-\D8ra&_nc_ht=scontent-atl3-1.xx&tp=14&oh=5d06efc30c8479ef819cee00460186bb&oe=5F8809A9,59.0,,2591574671087431,"Great things happening at East Primary everyday!
#engagedstudentsstaffandcommunity",https://facebook.com/story.php?story_fbid=2591574671087431&id=2067286396849597,,0.0,"Great things happening at East Primary everyday!
#engagedstudentsstaffandcommunity",2019-12-03 15:35:26,,
149,0.0,,26.0,,2590669874511244,"KEZI News will be featuring Sutherlin High School in the weekly ""Skilled to Work"" segment tonight. Check it out!",https://facebook.com/story.php?story_fbid=2590669874511244&id=2067286396849597,,0.0,"KEZI News will be featuring Sutherlin High School in the weekly ""Skilled to Work"" segment tonight. Check it out!",2019-12-02 16:56:40,,
150,2.0,https://scontent-atl3-1.xx.fbcdn.net/v/t1.0-9/fr/cp0/e15/q65/75586176_2585731895005042_123665671958560768_o.jpg?_nc_cat=107&_nc_sid=8024bb&_nc_ohc=0VGami0OuVsAX_s2LU-&_nc_ht=scontent-atl3-1.xx&tp=14&oh=bf6757bd38a848f79ebd148b0b4fed2f&oe=5F86FD91,39.0,,2585734695004762,PTO cookie dough fundraiser winners Sophie Bartley and Braylee Hopkins.,https://facebook.com/story.php?story_fbid=2585734695004762&id=2067286396849597,,0.0,PTO cookie dough fundraiser winners Sophie Bartley and Braylee Hopkins.,2019-11-27 15:59:36,,
151,4.0,https://scontent-atl3-1.xx.fbcdn.net/v/t1.0-9/fr/cp0/e15/q65/78310545_2585586758352889_8748287197230137344_n.jpg?_nc_cat=105&_nc_sid=8024bb&_nc_ohc=vlnybo-bzrQAX9DwUAM&_nc_ht=scontent-atl3-1.xx&tp=14&oh=b184ccfe819119f1e974704f8179007b&oe=5F87D7F1,49.0,,2585590588352506,"Sutherlin Valley Online Academy, Sutherlin High School and Sutherlin Middle School provided a combined 35 Thanksgiving baskets this year. Great job helping out our community! Thank you to all businesses and individuals who contributed.
#engagedstudentsstaffandcommunity
#wearesutherlin",https://facebook.com/story.php?story_fbid=2585590588352506&id=2067286396849597,,0.0,"Sutherlin Valley Online Academy, Sutherlin High School and Sutherlin Middle School provided a combined 35 Thanksgiving baskets this year. Great job helping out our community! Thank you to all businesses and individuals who contributed.
#engagedstudentsstaffandcommunity
#wearesutherlin",2019-11-27 12:48:40,,
152,0.0,https://scontent-atl3-1.xx.fbcdn.net/v/t1.0-9/fr/cp0/e15/q65/78051601_2579625782282320_4952321730099019776_n.jpg?_nc_cat=102&_nc_sid=8024bb&_nc_ohc=gzSRo5Qreh4AX9h6RAF&_nc_ht=scontent-atl3-1.xx&tp=14&oh=55ce21676664db0ad3973a36b8930383&oe=5F86E315,13.0,,2579626598948905,Reading makes a difference.,https://facebook.com/story.php?story_fbid=2579626598948905&id=2067286396849597,,0.0,Reading makes a difference.,2019-11-21 14:17:57,,
153,0.0,https://scontent-atl3-1.xx.fbcdn.net/v/t1.0-9/fr/cp0/e15/q65/74790197_2572809906297241_7545468094018224128_o.jpg?_nc_cat=105&_nc_sid=8024bb&_nc_ohc=eUwtEB4XLFkAX8FIrjv&_nc_ht=scontent-atl3-1.xx&tp=14&oh=f403113d2feff3f698016fb85bf47c11&oe=5F88F465,25.0,,2572811462963752,"Students who are engaged in multiple activities at school have better attendance on a daily basis.
Engaged students, staff and community.",https://facebook.com/story.php?story_fbid=2572811462963752&id=2067286396849597,,0.0,"Students who are engaged in multiple activities at school have better attendance on a daily basis.
Engaged students, staff and community.",2019-11-14 18:47:54,,
154,0.0,https://scontent-atl3-1.xx.fbcdn.net/v/t1.0-9/fr/cp0/e15/q65/76991428_2572801466298085_1480988359558955008_n.jpg?_nc_cat=111&_nc_sid=8024bb&_nc_ohc=Zugw9A_Qy14AX95QdS0&_nc_ht=scontent-atl3-1.xx&tp=14&oh=64c22ca82b0f7f6d3b3a06775d291c18&oe=5F8945DE,25.0,,2572802602964638,"FFA leaders presenting to Rotary this morning. Thank you Sutherlin Rotary for all your support.
#engagedstudentsstaffandcommunity",https://facebook.com/story.php?story_fbid=2572802602964638&id=2067286396849597,,0.0,"FFA leaders presenting to Rotary this morning. Thank you Sutherlin Rotary for all your support.
#engagedstudentsstaffandcommunity",2019-11-14 18:32:23,,
155,0.0,,0.0,https://website6730.wixsite.com/suthvalleyonlineacad,2570665506511681,"Are you ready to “Step through the door to your future success?""

Check out Sutherlin Valley Online Academy, where scheduling and academic pacing options allow us to accommodate a wide variety of learning needs.

#WeAreSutherlin",https://facebook.com/story.php?story_fbid=2570665506511681&id=2067286396849597,"WEBSITE6730.WIXSITE.COM
HOME | suthvalleyonlineacad",0.0,"Are you ready to “Step through the door to your future success?""

Check out Sutherlin Valley Online Academy, where scheduling and academic pacing options allow us to accommodate a wide variety of learning needs.

#WeAreSutherlin

WEBSITE6730.WIXSITE.COM
HOME | suthvalleyonlineacad",2019-11-12 12:18:38,,
156,1.0,,18.0,,2565220580389507,Good luck Sutherlin Boys Soccer vs St. Mary's. Go Bulldogs!!!!!!,https://facebook.com/story.php?story_fbid=2565220580389507&id=2067286396849597,,0.0,Good luck Sutherlin Boys Soccer vs St. Mary's. Go Bulldogs!!!!!!,2019-11-06 18:52:18,,
157,0.0,,46.0,,2565152033729695,"Sutherlin School District is aware of a disruption that occurred today in the Therapeutic Learning Class located on the West Intermediate campus. The TLC is a transitional program serving students in kindergarten through sixth grade from around the county and is administered through the Douglas Education Service District and Compass Behavioral Health. The disruption was brought under control without incident. Police were called to the class, but no action was taken. The safety of all students on our campuses is our top priority. There is word of the incident circulating on social media and we appreciate the community’s concern. We would like to reassure parents and families that our students are safe and that this is being handled by Douglas ESD and Compass Behavioral Health.",https://facebook.com/story.php?story_fbid=2565152033729695&id=2067286396849597,,0.0,"Sutherlin School District is aware of a disruption that occurred today in the Therapeutic Learning Class located on the West Intermediate campus. The TLC is a transitional program serving students in kindergarten through sixth grade from around the county and is administered through the Douglas Education Service District and Compass Behavioral Health. The disruption was brought under control without incident. Police were called to the class, but no action was taken. The safety of all students on our campuses is our top priority. There is word of the incident circulating on social media and we appreciate the community’s concern. We would like to reassure parents and families that our students are safe and that this is being handled by Douglas ESD and Compass Behavioral Health.",2019-11-06 16:48:34,,
158,0.0,https://scontent-atl3-1.xx.fbcdn.net/v/t1.0-9/fr/cp0/e15/q65/73395474_2560525580859007_1203549711508701184_n.jpg?_nc_cat=102&_nc_sid=8024bb&_nc_ohc=W4GIK2U9mh4AX-Z2hub&_nc_ht=scontent-atl3-1.xx&tp=14&oh=3db269ff789274777baa79afc15a1091&oe=5F8994ED,26.0,,2560526174192281,"Sorry last picture got cutoff. Thank you Theresa, Samantha, Brenda and Amy.",https://facebook.com/story.php?story_fbid=2560526174192281&id=2067286396849597,,0.0,"Sorry last picture got cutoff. Thank you Theresa, Samantha, Brenda and Amy.",2019-11-01 19:49:03,,
159,0.0,https://scontent-atl3-1.xx.fbcdn.net/v/t1.0-9/fr/cp0/e15/q65/73263679_2560521690859396_8569234455951048704_n.jpg?_nc_cat=102&_nc_sid=8024bb&_nc_ohc=0Te4HPEC13AAX97d98y&_nc_ht=scontent-atl3-1.xx&tp=14&oh=11a3bd40681176ee395f0c3172b18154&oe=5F888ADC,27.0,,2560524924192406,"Chomper was downtown giving Umpqua Bank the thumbs up for supporting Sutherlin Schools. Thank you Theresa, Samantha, Brenda and Amy, your Bulldog shirts look great.
#Engagedstudentstaffandcommunity",https://facebook.com/story.php?story_fbid=2560524924192406&id=2067286396849597,,0.0,"Chomper was downtown giving Umpqua Bank the thumbs up for supporting Sutherlin Schools. Thank you Theresa, Samantha, Brenda and Amy, your Bulldog shirts look great.
#Engagedstudentstaffandcommunity",2019-11-01 19:46:30,,
160,0.0,,2.0,https://douglasesd.co1.qualtrics.com/jfe/form/SV_bvbLoWijZL6Konj,2559529330958632,"Join In!
Sutherlin School District Community Survey
The Student Success Act marks a turning point for education in Oregon. Our district has an important role to play. We need your input to help develop a plan to best meet the needs of our students and our community.
Your voice matters. Please use the survey to share feedback.

Sutherlin Community Needs Assessment Survey
https://douglasesd.co1.qualtrics.com/jfe/form/SV_bvbLoWijZL6Konj",https://facebook.com/story.php?story_fbid=2559529330958632&id=2067286396849597,"DOUGLASESD.CO1.QUALTRICS.COM
Online Survey | Built with Qualtrics Experience Management™",4.0,"Join In!
Sutherlin School District Community Survey
The Student Success Act marks a turning point for education in Oregon. Our district has an important role to play. We need your input to help develop a plan to best meet the needs of our students and our community.
Your voice matters. Please use the survey to share feedback.

Sutherlin Community Needs Assessment Survey
https://douglasesd.co1.qualtrics.com/jfe/form/SV_bvbLoWijZL6Konj

DOUGLASESD.CO1.QUALTRICS.COM
Online Survey | Built with Qualtrics Experience Management™",2019-10-31 17:30:43,,
161,0.0,https://scontent-atl3-1.xx.fbcdn.net/v/t1.0-9/fr/cp0/e15/q65/74617626_2554738154771083_2095311889981505536_n.jpg?_nc_cat=104&_nc_sid=8024bb&_nc_ohc=JquFOHg9YxUAX9iZUTU&_nc_ht=scontent-atl3-1.xx&tp=14&oh=2e8a7dab543702122f63b72736f411f4&oe=5F880553,28.0,,2554740694770829,Where is Chomper today? Having a relaxing morning bird watching at Fords Pond. Thank you Friends of Fords Pond for this great community resource.,https://facebook.com/story.php?story_fbid=2554740694770829&id=2067286396849597,,0.0,Where is Chomper today? Having a relaxing morning bird watching at Fords Pond. Thank you Friends of Fords Pond for this great community resource.,2019-10-26 13:38:53,,
162,0.0,,9.0,,2554103611501204,Volleyball league playoff game 7:00 Saturday the 26th at home. Come support our Lady Bulldogs!,https://facebook.com/story.php?story_fbid=2554103611501204&id=2067286396849597,,0.0,Volleyball league playoff game 7:00 Saturday the 26th at home. Come support our Lady Bulldogs!,2019-10-25 20:53:16,,
163,5.0,https://scontent-atl3-1.xx.fbcdn.net/v/t1.0-9/fr/cp0/e15/q65/73259875_2554092508168981_750288416758824960_n.jpg?_nc_cat=110&_nc_sid=8024bb&_nc_ohc=Oc-V1bP-nAwAX_B9Q8o&_nc_ht=scontent-atl3-1.xx&tp=14&oh=b8fdbc7de66e072d2de09e2541af71c0&oe=5F89E605,45.0,,2554095481502017,A Lightening Arrester failed on a power pole behind the High School causing a power outage and grass fire. Thanks to Sutherlin Fire and Pacific Power we are back in business. Power has been restored and we are ready for tomorrows volleyball games. Go Bulldogs!,https://facebook.com/story.php?story_fbid=2554095481502017&id=2067286396849597,,0.0,A Lightening Arrester failed on a power pole behind the High School causing a power outage and grass fire. Thanks to Sutherlin Fire and Pacific Power we are back in business. Power has been restored and we are ready for tomorrows volleyball games. Go Bulldogs!,2019-10-25 20:40:07,,
164,0.0,https://scontent-atl3-1.xx.fbcdn.net/v/t1.0-9/fr/cp0/e15/q65/74471409_2550887121822853_5223072413989732352_n.jpg?_nc_cat=100&_nc_sid=8024bb&_nc_ohc=tHwgyVUkal8AX_PmKCG&_nc_ht=scontent-atl3-1.xx&tp=14&oh=1d52a63cb3cf93ca10b613158eb293e5&oe=5F87037B,4.0,,2550894145155484,Wednesday October 23rd at 5:00 p.m. we will be hosting another community input session for the Student Success Act. The meeting will take place at East Primary in the library. Hope to see you there.,https://facebook.com/story.php?story_fbid=2550894145155484&id=2067286396849597,,0.0,Wednesday October 23rd at 5:00 p.m. we will be hosting another community input session for the Student Success Act. The meeting will take place at East Primary in the library. Hope to see you there.,2019-10-22 13:33:16,,
165,2.0,https://scontent-atl3-1.xx.fbcdn.net/v/t1.0-9/fr/cp0/e15/q65/72691102_2549959758582256_1650626528230244352_n.jpg?_nc_cat=101&_nc_sid=8024bb&_nc_ohc=WQub3hq0KTcAX9EdbPF&_nc_oc=AQlmm6z-J4gJnTAS671VM-p3c4bbAiNyt75K7akhZ_gqE3FRxBk6H3hVsNqcI7fPLUY&_nc_ht=scontent-atl3-1.xx&tp=14&oh=6fa79c588bade9e3ff7f09e99eaf6ace&oe=5F871200,12.0,,2549962268582005,Chomper wants to remind everyone that we are hosting another Student Success Act input session. This time we will be meeting at East Primary in the Library at 5:00. Hope to see you there.,https://facebook.com/story.php?story_fbid=2549962268582005&id=2067286396849597,,0.0,Chomper wants to remind everyone that we are hosting another Student Success Act input session. This time we will be meeting at East Primary in the Library at 5:00. Hope to see you there.,2019-10-21 14:57:27,,
166,0.0,https://scontent-atl3-1.xx.fbcdn.net/v/t1.0-9/fr/cp0/e15/q65/72684281_2546744135570485_2966039315798294528_n.jpg?_nc_cat=100&_nc_sid=8024bb&_nc_ohc=ypFka9eONq8AX8msjWP&_nc_ht=scontent-atl3-1.xx&tp=14&oh=8a333357d54b0b10874878c5f21066c1&oe=5F88589B,50.0,,2546745468903685,"Pink Out Day at the District Office!
#Wearesutherlin",https://facebook.com/story.php?story_fbid=2546745468903685&id=2067286396849597,,0.0,"Pink Out Day at the District Office!
#Wearesutherlin",2019-10-18 12:54:10,,
167,0.0,,21.0,,2545971952314370,"Our main focus is to engage and connect with students, faculty, staff and the community. Not only we want our students to attend school to receive the best education possible, but we want to prepare them for future success and help mold them into great citizens in our community.
#WeAreSutherlin",,,0.0,"Our main focus is to engage and connect with students, faculty, staff and the community. Not only we want our students to attend school to receive the best education possible, but we want to prepare them for future success and help mold them into great citizens in our community.
#WeAreSutherlin",2019-10-17 17:59:46,https://video-atl3-1.xx.fbcdn.net/v/t42.9040-2/74600904_2392864054360961_1039274831708684288_n.mp4?_nc_cat=104&_nc_sid=985c63&efg=eyJ2ZW5jb2RlX3RhZyI6InN2ZV9zZCJ9&_nc_ohc=oKqtijsF-RIAX_7Aaod&_nc_ht=video-atl3-1.xx&oh=8d49fc097516c2b4291f123860203daf&oe=5F629B3A,
168,0.0,,11.0,https://www.youtube.com/watch?v=ow2EM7LNiNo,2545970778981154,,https://facebook.com/story.php?story_fbid=2545970778981154&id=2067286396849597,"YOUTUBE.COM
We Are Sutherlin. We Are Here.",2.0,"YOUTUBE.COM
We Are Sutherlin. We Are Here.",2019-10-17 17:57:38,,
169,0.0,https://scontent-atl3-1.xx.fbcdn.net/v/t1.0-9/fr/cp0/e15/q65/72397119_2544863535758545_2084098868537982976_n.jpg?_nc_cat=103&_nc_sid=8024bb&_nc_ohc=3YkVLGllD3wAX9YOngg&_nc_ht=scontent-atl3-1.xx&tp=14&oh=f22779b55d8c0b8ed1e6d11de5ec752d&oe=5F88CAED,22.0,,2544866935758205,"Great day to be a Bulldog!
Don't forget about our Student Success Act community engagement meeting tonight at 7:00 in the Middle School Activity Center.",https://facebook.com/story.php?story_fbid=2544866935758205&id=2067286396849597,,0.0,"Great day to be a Bulldog!
Don't forget about our Student Success Act community engagement meeting tonight at 7:00 in the Middle School Activity Center.",2019-10-16 13:17:37,,
170,2.0,https://scontent-atl3-1.xx.fbcdn.net/v/t1.0-9/fr/cp0/e15/q65/71932772_2544081672503398_8041304424615772160_n.jpg?_nc_cat=107&_nc_sid=8024bb&_nc_ohc=S0OtoE6KfioAX-ELF4A&_nc_ht=scontent-atl3-1.xx&tp=14&oh=457a802a9bee8a6dfe3ee66cba6bcfd1&oe=5F89ABD6,40.0,,2544082189170013,Chomper is out and about again today enjoying the playground at East!,https://facebook.com/story.php?story_fbid=2544082189170013&id=2067286396849597,,0.0,Chomper is out and about again today enjoying the playground at East!,2019-10-15 16:10:57,,
171,0.0,https://scontent-atl3-1.xx.fbcdn.net/v/t1.0-9/fr/cp0/e15/q65/73004001_2544078132503752_9025597387103535104_n.jpg?_nc_cat=111&_nc_sid=8024bb&_nc_ohc=hb-FWf5jtngAX9_YXSn&_nc_ht=scontent-atl3-1.xx&tp=14&oh=79936e8dc95cb1ede22d356f83d091b3&oe=5F89EA26,2.0,,2544080385836860,Quick change for our meeting on the 16th. The meeting will now be held in the Middle School Activity Center at 7:00 and not the High School.,https://facebook.com/story.php?story_fbid=2544080385836860&id=2067286396849597,,0.0,Quick change for our meeting on the 16th. The meeting will now be held in the Middle School Activity Center at 7:00 and not the High School.,2019-10-15 16:07:50,,
172,0.0,,2.0,,530569431102435,,,"WED, OCT 23, 2019
Student Success Act",0.0,"WED, OCT 23, 2019
Student Success Act",2019-10-15 12:08:26,,
173,0.0,,3.0,,435714737295957,,,"WED, OCT 16, 2019
Student Success Act",0.0,"WED, OCT 16, 2019
Student Success Act",2019-10-15 12:06:14,,
174,1.0,https://scontent-atl3-1.xx.fbcdn.net/v/t1.0-9/fr/cp0/e15/q65/74216718_2543894465855452_3311579467805097984_o.jpg?_nc_cat=108&_nc_sid=8024bb&_nc_ohc=bpNDmpTfsZAAX-3pfnQ&_nc_oc=AQmrh4pLaMBlCjKZ3UDdtskEqxUFJ7DGwvey4_jMuUfC8mhdwCyTE4rUm4dKhmloWKI&_nc_ht=scontent-atl3-1.xx&tp=14&oh=d5f354f0d11aecc7e3f5a6537611c7a4&oe=5F86C874,3.0,,2543894625855436,Student Success Act!,https://facebook.com/story.php?story_fbid=2543894625855436&id=2067286396849597,,0.0,Student Success Act!,2019-10-15 11:18:54,,
175,2.0,https://scontent-atl3-1.xx.fbcdn.net/v/t1.0-9/fr/cp0/e15/q65/72297191_2543153465929552_3179822305094139904_n.jpg?_nc_cat=103&_nc_sid=8024bb&_nc_ohc=bvs-UaHCkXoAX87mdjg&_nc_ht=scontent-atl3-1.xx&tp=14&oh=7b9998235f1f8d5561d1b5c96f3fd67a&oe=5F86EF6E,54.0,,2543157832595782,"No we are not letting Chomper drive Bus! He just wanted to thank all of our drivers for the hard work they put in everyday. Thank you to all our dedicated drivers!

Engaged students, staff and community.",https://facebook.com/story.php?story_fbid=2543157832595782&id=2067286396849597,,0.0,"No we are not letting Chomper drive Bus! He just wanted to thank all of our drivers for the hard work they put in everyday. Thank you to all our dedicated drivers!

Engaged students, staff and community.",2019-10-14 15:04:48,,
176,0.0,https://scontent-atl3-1.xx.fbcdn.net/v/t1.0-9/fr/cp0/e15/q65/71843496_1015362502128338_94839165727801344_n.jpg?_nc_cat=101&_nc_sid=110474&_nc_ohc=cdrLccYuYDIAX9OWIoC&_nc_ht=scontent-atl3-1.xx&tp=14&oh=e09f374f7504a90c67ddb9c6ad78ca1a&oe=5F894EF0,5.0,http://www.fosteringresilience.com/index_parents.php,2540638776181021,,https://facebook.com/story.php?story_fbid=2540638776181021&id=2067286396849597,"Sutherlin Middle School
October 11, 2019 at 9:52 AM ·

Students don’t have school today because the teachers in the district have the opportunity to learn from Dr. Ginsburg! Do you want to learn more about him? Here is a link so you can learn with us!
http://www.fosteringresilience.com/index_parents.php",0.0,"Sutherlin Middle School
October 11, 2019 at 9:52 AM ·

Students don’t have school today because the teachers in the district have the opportunity to learn from Dr. Ginsburg! Do you want to learn more about him? Here is a link so you can learn with us!
http://www.fosteringresilience.com/index_parents.php",2019-10-11 20:28:01,,
177,1.0,https://scontent-atl3-1.xx.fbcdn.net/v/t1.0-9/fr/cp0/e15/q65/72195455_2523416444383439_3849328309775106048_o.jpg?_nc_cat=107&_nc_sid=110474&_nc_ohc=GYePRB7I1oAAX_Zeba4&_nc_ht=scontent-atl3-1.xx&tp=14&oh=9efded6497b34213caf3995fba3c3ac6&oe=5F86CAA9,10.0,,2540638619514370,,https://facebook.com/story.php?story_fbid=2540638619514370&id=2067286396849597,"Sutherlin Area Chamber of Commerce & Visitors Center
October 11, 2019 at 10:09 AM ·

Congratulations and welcome to Reflexology with Tami Marie on her Chamber Ribbon Cutting this morning at 10am. She is a Certified Reflexologist and Licensed Nail Technician. The event was well attended by several along with Mayor, Todd McKnight, Chamber President, Tami Trowbridge, and Executive Director, Tracy Martz. Thank you all for coming out and showing your support. Tami Marie welcomes you to stop by today anytime until 4pm, say hello and have some refreshments! 115 NE First Avenue. Her phone number is 503-580-9597",0.0,"Sutherlin Area Chamber of Commerce & Visitors Center
October 11, 2019 at 10:09 AM ·

Congratulations and welcome to Reflexology with Tami Marie on her Chamber Ribbon Cutting this morning at 10am. She is a Certified Reflexologist and Licensed Nail Technician. The event was well attended by several along with Mayor, Todd McKnight, Chamber President, Tami Trowbridge, and Executive Director, Tracy Martz. Thank you all for coming out and showing your support. Tami Marie welcomes you to stop by today anytime until 4pm, say hello and have some refreshments! 115 NE First Avenue. Her phone number is 503-580-9597",2019-10-11 20:27:41,,
178,0.0,,8.0,http://www.nrtoday.com/sports/preps/prep_boys_soccer/sutherlin-whips-south-umpqua/article_f97d0de2-d7b1-5b6e-81d5-9c8972aeca00.html#utm_campaign=blox&utm_source=facebook&utm_medium=social,2540637906181108,,https://facebook.com/story.php?story_fbid=2540637906181108&id=2067286396849597,"NRTODAY.COM
Sutherlin whips South Umpqua, 8-0",0.0,"NRTODAY.COM
Sutherlin whips South Umpqua, 8-0",2019-10-11 20:26:17,,
179,0.0,,5.0,http://www.nrtoday.com/sports/preps/prep_football/sutherlin-rolls-past-harrisburg/article_73dad21a-98bb-528e-a507-cc05710dc812.html#utm_campaign=blox&utm_source=facebook&utm_medium=social,2540637289514503,,https://facebook.com/story.php?story_fbid=2540637289514503&id=2067286396849597,"NRTODAY.COM
Sutherlin rolls past Harrisburg, 45-7

Sutherlin Area Chamber of Commerce & Visitors Center
October 11, 2019 at 1:42 PM ·

Congrats Sutherlin Bulldogs!",3.0,"NRTODAY.COM
Sutherlin rolls past Harrisburg, 45-7

Sutherlin Area Chamber of Commerce & Visitors Center
October 11, 2019 at 1:42 PM ·

Congrats Sutherlin Bulldogs!",2019-10-11 20:25:05,,
180,0.0,,0.0,http://www.nrtoday.com/sports/preps/prep_football/sutherlin-rolls-past-harrisburg/article_73dad21a-98bb-528e-a507-cc05710dc812.html#utm_campaign=blox&utm_source=facebook&utm_medium=social,,,https://facebook.com/story.php?story_fbid=2523710714354012&id=215996391792134,"Sutherlin Area Chamber of Commerce & Visitors Center
October 11, 2019 at 1:42 PM ·

Congrats Sutherlin Bulldogs!",0.0,"Sutherlin Area Chamber of Commerce & Visitors Center
October 11, 2019 at 1:42 PM ·

Congrats Sutherlin Bulldogs!",2020-09-16 16:17:04.396169,,
181,0.0,https://scontent-atl3-1.xx.fbcdn.net/v/t1.0-9/fr/cp0/e15/q65/72109955_2540580949520137_1491764939310759936_n.jpg?_nc_cat=110&_nc_sid=8024bb&_nc_ohc=rmFOmcrYIR4AX86Brei&_nc_ht=scontent-atl3-1.xx&tp=14&oh=e90bac5013491ec1e79ef5f00949bac7&oe=5F872B94,28.0,,2540584859519746,"When Chomper isn't busy being the high school mascot he loves visiting the Sutherlin C Giles Hunt Memorial Library.
#sutherlinsuccess",https://facebook.com/story.php?story_fbid=2540584859519746&id=2067286396849597,,0.0,"When Chomper isn't busy being the high school mascot he loves visiting the Sutherlin C Giles Hunt Memorial Library.
#sutherlinsuccess",2019-10-11 18:42:37,,
182,0.0,https://scontent-atl3-1.xx.fbcdn.net/v/t1.0-9/fr/cp0/e15/q65/72830157_2540262836218615_6670817700907843584_n.jpg?_nc_cat=105&_nc_sid=8024bb&_nc_ohc=lPDLSsEJ5QwAX_6KvwG&_nc_ht=scontent-atl3-1.xx&tp=14&oh=ffdb89985cc6d036c8bbdf24aa2215dd&oe=5F8801EE,41.0,,2540263626218536,Another great day to be a Bulldog!,https://facebook.com/story.php?story_fbid=2540263626218536&id=2067286396849597,,0.0,Another great day to be a Bulldog!,2019-10-11 10:14:42,,
