,comments,image,likes,link,post_id,post_text,post_url,shared_text,shares,text,time,video,video_thumbnail
184,24.0,https://scontent-atl3-1.xx.fbcdn.net/v/t1.0-9/fr/cp0/e15/q65/100786008_1541785559328362_8331623005276864512_o.jpg?_nc_cat=109&_nc_sid=8024bb&_nc_ohc=PT-Mwbouj34AX_o2LjY&_nc_ht=scontent-atl3-1.xx&tp=14&oh=c991d46809a3717f36b24d961165421c&oe=5F853FF1,93.0,,1541786719328246,"Senior Theatre Tribute: Kiser Shelton is well known at UA and in the state for his theatrical performances. As a UA ""lifer"" he has also contributed to UA in his best leading role as Student Body President. Congratulations, Kiser! And thank you for all you have done for UA.",https://facebook.com/story.php?story_fbid=1541786719328246&id=476331569207105,,0.0,"Senior Theatre Tribute: Kiser Shelton is well known at UA and in the state for his theatrical performances. As a UA ""lifer"" he has also contributed to UA in his best leading role as Student Body President. Congratulations, Kiser! And thank you for all you have done for UA.",2020-05-25 20:45:51,,
185,2.0,https://scontent-atl3-1.xx.fbcdn.net/v/t1.0-9/fr/cp0/e15/q65/100063781_1540858672754384_5883108178991775744_n.jpg?_nc_cat=111&_nc_sid=110474&_nc_ohc=z3QdW6wNjLgAX_mKU0V&_nc_ht=scontent-atl3-1.xx&tp=14&oh=d1a0121865144c2a328bc6c0a7b50c8f&oe=5F8370FF,7.0,http://www.jostens.com/,1540861339420784,"There are a few remaining yearbooks, but sales close at MIDNIGHT TONIGHT!!! This is absolutely your last chance to get the 2020 edition. Books will be available for pickup this week.

www.jostens.com",https://facebook.com/story.php?story_fbid=1540861339420784&id=476331569207105,,0.0,"There are a few remaining yearbooks, but sales close at MIDNIGHT TONIGHT!!! This is absolutely your last chance to get the 2020 edition. Books will be available for pickup this week.

www.jostens.com",2020-05-24 19:08:38,,
186,2.0,https://scontent-atl3-1.xx.fbcdn.net/v/t1.0-9/fr/cp0/e15/q65/99425368_1539869772853274_4229361258236739584_n.jpg?_nc_cat=106&_nc_sid=110474&_nc_ohc=9023bvRTimEAX_BzP0y&_nc_ht=scontent-atl3-1.xx&tp=14&oh=70a14d747dedb7581c71cb5853dfbd2f&oe=5F838777,13.0,,1539871969519721,It’s time for summer camp! We’ve missed your kids! Get signed up ASAP through MyPaymentsPlus. Non-UA students are welcome. Create a guest account to register. See you soon!,https://facebook.com/story.php?story_fbid=1539871969519721&id=476331569207105,,0.0,It’s time for summer camp! We’ve missed your kids! Get signed up ASAP through MyPaymentsPlus. Non-UA students are welcome. Create a guest account to register. See you soon!,2020-05-23 15:46:10,,
187,1.0,,31.0,https://vimeo.com/421741853,1539216402918611,"The 2020 High School Academic Awards were videoed this year due to COVID-19 restrictions. However, this does not mean there weren't silent cheers and big smiles along with happy and sad tears as the awards were presented by a handful of UA staff and community representatives all seated 6 feet a part in South Gym. Class of 2020, you deserve the fanfare, high fives, and congratulations in person, and we're sorry we couldn't give it to you. But we are VERY PROUD OF YOU!
https://vimeo.com/421741853",https://facebook.com/story.php?story_fbid=1539216402918611&id=476331569207105,"VIMEO.COM
HS Academic Awards 2020",7.0,"The 2020 High School Academic Awards were videoed this year due to COVID-19 restrictions. However, this does not mean there weren't silent cheers and big smiles along with happy and sad tears as the awards were presented by a handful of UA staff and community representatives all seated 6 feet a part in South Gym. Class of 2020, you deserve the fanfare, high fives, and congratulations in person, and we're sorry we couldn't give it to you. But we are VERY PROUD OF YOU!
https://vimeo.com/421741853

VIMEO.COM
HS Academic Awards 2020",2020-05-22 18:47:40,,
188,5.0,https://scontent-atl3-1.xx.fbcdn.net/v/t1.0-9/fr/cp0/e15/q65/99157933_1539200136253571_1064250032175185920_n.jpg?_nc_cat=102&_nc_sid=8024bb&_nc_ohc=VXAHR1afYRsAX-Rro38&_nc_ht=scontent-atl3-1.xx&tp=14&oh=a18a2a7818ba656212286881051b6a95&oe=5F85497D,23.0,http://www.jostens.com/,1539200202920231,"BIG NEWS...if you didn't order a yearbook, you have one last chance this weekend. This is the 20th edition and there are lots of extras in the book! Orders end Sunday at midnight and can be picked up next week! This is your lucky day! LIMITED SUPPLY!!!

www.jostens.com",https://facebook.com/story.php?story_fbid=1539200202920231&id=476331569207105,,0.0,"BIG NEWS...if you didn't order a yearbook, you have one last chance this weekend. This is the 20th edition and there are lots of extras in the book! Orders end Sunday at midnight and can be picked up next week! This is your lucky day! LIMITED SUPPLY!!!

www.jostens.com",2020-05-22 18:12:58,,
189,17.0,,140.0,,1537506036422981,"Our new headmaster, Mr. John Marshall, is ready to begin his role in July. Please welcome Mr. Marshall to UA!",,,0.0,"Our new headmaster, Mr. John Marshall, is ready to begin his role in July. Please welcome Mr. Marshall to UA!",2020-05-20 20:15:27,https://video-atl3-1.xx.fbcdn.net/v/t42.9040-2/98318260_284979655869758_5980123119317155840_n.mp4?_nc_cat=101&_nc_sid=985c63&efg=eyJ2ZW5jb2RlX3RhZyI6ImxlZ2FjeV9zZCJ9&_nc_ohc=I8P40Ndoa-gAX-i4zyf&_nc_ht=video-atl3-1.xx&oh=4fd9d2fa6cfd0826be9c943be2a995d9&oe=5F5EEA40,
190,4.0,,39.0,https://www.unionacademy.org/apps/pages/lsacademics,1537424203097831,"K-4 Creative Core Week is May 26-29!!! Families should plan to pick up their Field Day Fun Pack the morning of Tuesday, May 26. Check out the K-4 Academic page on the website for exact times and locations. #creativecore #fieldday

https://www.unionacademy.org/apps/pages/lsacademics",,,0.0,"K-4 Creative Core Week is May 26-29!!! Families should plan to pick up their Field Day Fun Pack the morning of Tuesday, May 26. Check out the K-4 Academic page on the website for exact times and locations. #creativecore #fieldday

https://www.unionacademy.org/apps/pages/lsacademics",2020-05-20 18:01:56,https://video-atl3-1.xx.fbcdn.net/v/t42.9040-2/98160613_267928737593057_7721216639647088640_n.mp4?_nc_cat=111&_nc_sid=985c63&efg=eyJ2ZW5jb2RlX3RhZyI6ImxlZ2FjeV9zZCJ9&_nc_ohc=tzQFNGWqi6QAX_hG_Qw&_nc_ht=video-atl3-1.xx&oh=feddc842f518506729813a95546ba067&oe=5F5EE818,
191,0.0,https://scontent-atl3-1.xx.fbcdn.net/v/t1.0-9/fr/cp0/e15/q65/98432533_1537333306440254_486483021403258880_o.jpg?_nc_cat=110&_nc_sid=8024bb&_nc_ohc=Zx_OCW5EgaUAX8JtSiH&_nc_ht=scontent-atl3-1.xx&tp=14&oh=57e4294e8668b70eb4f2aaf1b9083bc5&oe=5F8336D7,24.0,,1537334993106752,"UPDATE: Senior Pick-up/Drop-off and the Parade of Champions have been rescheduled to Tuesday, May 26 due to the prediction of rain the remainder of the week. Additionally, the parade will now line up in South Carpool (not Apprentice Academy). An email with the specific updates will be emailed to all families tonight. #adaptability #UASeniorStrong",https://facebook.com/story.php?story_fbid=1537334993106752&id=476331569207105,,0.0,"UPDATE: Senior Pick-up/Drop-off and the Parade of Champions have been rescheduled to Tuesday, May 26 due to the prediction of rain the remainder of the week. Additionally, the parade will now line up in South Carpool (not Apprentice Academy). An email with the specific updates will be emailed to all families tonight. #adaptability #UASeniorStrong",2020-05-20 15:25:17,,
192,0.0,https://scontent-atl3-1.xx.fbcdn.net/v/t1.0-9/fr/cp0/e15/q65/97464039_1537109899795928_5203953547460214784_o.jpg?_nc_cat=111&_nc_sid=9e2e56&_nc_ohc=XGw7GzBm0XMAX9z_mz8&_nc_ht=scontent-atl3-1.xx&tp=14&oh=fd344ee48fedd1a83f31a002cffe49c5&oe=5F83AA15,35.0,,1537109989795919,This week’s Taco Tuesday at the Community Shelter of UC was sponsored by our fabulous 5th graders! #UAServesFromHome @ Community Shelter of Union County,https://facebook.com/story.php?story_fbid=1537109989795919&id=476331569207105,,0.0,This week’s Taco Tuesday at the Community Shelter of UC was sponsored by our fabulous 5th graders! #UAServesFromHome @ Community Shelter of Union County,2020-05-20 09:42:04,,
193,2.0,,55.0,,1536680059838912,"The Varsity Cheer Squad volunteered as a team throughout the year at The Closet, The Community Shelter of Union County, and InReach. In this short video they share why they serve and why it’s important to represent UA in the community. #UACheerHasHeart",,UA Varsity Cheer Community Service,0.0,"The Varsity Cheer Squad volunteered as a team throughout the year at The Closet, The Community Shelter of Union County, and InReach. In this short video they share why they serve and why it’s important to represent UA in the community. #UACheerHasHeart

UA Varsity Cheer Community Service",2020-05-19 21:01:23,https://scontent-atl3-1.xx.fbcdn.net/v/t42.9040-4/98159888_1661795397316952_6557264340469153792_n.mp4?_nc_cat=109&_nc_sid=985c63&efg=eyJ2ZW5jb2RlX3RhZyI6ImxlZ2FjeV9zZCJ9&_nc_ohc=SQ_Kr5OEozwAX98_bEw&_nc_ht=scontent-atl3-1.xx&oh=e97f58fba15120aba752f86e7f16c4a1&oe=5F5EE5E6,
194,2.0,https://scontent-atl3-1.xx.fbcdn.net/v/t1.0-9/fr/cp0/e15/q65/98338113_1535656309941287_1388674196514537472_o.jpg?_nc_cat=111&_nc_sid=8024bb&_nc_ohc=MOZ5_BTEhqIAX_QUXR5&_nc_ht=scontent-atl3-1.xx&tp=14&oh=817390e76c632af25b9b69e96d33f056&oe=5F84EDCB,29.0,,1535656839941234,Senior Athlete Tribute: Ashleigh McCoy will be attending prep school in preparation for the US Air Force Academy. Congratulations!,https://facebook.com/story.php?story_fbid=1535656839941234&id=476331569207105,,0.0,Senior Athlete Tribute: Ashleigh McCoy will be attending prep school in preparation for the US Air Force Academy. Congratulations!,2020-05-18 19:15:00,,
195,1.0,https://scontent-atl3-1.xx.fbcdn.net/v/t1.0-9/fr/cp0/e15/q65/98207297_1535643043275947_5609723022291238912_o.jpg?_nc_cat=108&_nc_sid=8024bb&_nc_ohc=sAdHeMaVd0oAX9gTCPH&_nc_ht=scontent-atl3-1.xx&tp=14&oh=6551df2e7308fbe943896a5459c280fd&oe=5F861B41,25.0,,1535643876609197,Senior Athlete Tribute: Nayheli Muniz has enjoyed running track. She plans to attend WSSU to study journalism and mass communication. Thank you for representing UA!,https://facebook.com/story.php?story_fbid=1535643876609197&id=476331569207105,,0.0,Senior Athlete Tribute: Nayheli Muniz has enjoyed running track. She plans to attend WSSU to study journalism and mass communication. Thank you for representing UA!,2020-05-18 19:08:00,,
196,2.0,https://scontent-atl3-1.xx.fbcdn.net/v/t1.0-9/fr/cp0/e15/q65/98239469_1535636226609962_5809978054310625280_o.jpg?_nc_cat=110&_nc_sid=8024bb&_nc_ohc=Upuxjq7WDDkAX-hJapx&_nc_ht=scontent-atl3-1.xx&tp=14&oh=0a8597f6a8da6cefe97e5f2f5390838c&oe=5F840F2B,38.0,,1535637159943202,Senior Athlete Tribute: Jessica Trush has qualified for regionals and been part of an all-conference relay team. She plans to attend UNC to study nursing. Congratulations!,https://facebook.com/story.php?story_fbid=1535637159943202&id=476331569207105,,0.0,Senior Athlete Tribute: Jessica Trush has qualified for regionals and been part of an all-conference relay team. She plans to attend UNC to study nursing. Congratulations!,2020-05-18 18:58:00,,
197,1.0,https://scontent-atl3-1.xx.fbcdn.net/v/t1.0-9/fr/cp0/e15/q65/98453758_1535634929943425_6692328469084241920_o.jpg?_nc_cat=110&_nc_sid=8024bb&_nc_ohc=IJkHQoJ6ElAAX9LzvES&_nc_ht=scontent-atl3-1.xx&tp=14&oh=d68f13cbe33ec373f0081a7ad7126b8e&oe=5F84A253,41.0,,1535635893276662,Senior Athlete Tribute: Felicity Booth is a runner and thrower on the track team and will be attending ECU to study nursing. Thank you for representing UA!,https://facebook.com/story.php?story_fbid=1535635893276662&id=476331569207105,,0.0,Senior Athlete Tribute: Felicity Booth is a runner and thrower on the track team and will be attending ECU to study nursing. Thank you for representing UA!,2020-05-18 18:53:00,,
198,0.0,https://scontent-atl3-1.xx.fbcdn.net/v/t1.0-9/fr/cp0/e15/q65/98274397_1535615323278719_7428203679972327424_o.jpg?_nc_cat=100&_nc_sid=8024bb&_nc_ohc=O6WcW0cvgFUAX8Nf1ET&_nc_ht=scontent-atl3-1.xx&tp=14&oh=523a6c08475ca0f8c947d30b5814fb59&oe=5F841A56,5.0,https://www.unionacademy.org/apps/pages/onlinepayments,1535616296611955,"Summer Sports Camp registration is OPEN on MyPaymentsPlus (baseball, cheer, basketball, softball). Non-UA students are welcome (create a guest account). Don't miss the deadline for a t-shirt!

https://www.unionacademy.org/apps/pages/onlinepayments",https://facebook.com/story.php?story_fbid=1535616296611955&id=476331569207105,,0.0,"Summer Sports Camp registration is OPEN on MyPaymentsPlus (baseball, cheer, basketball, softball). Non-UA students are welcome (create a guest account). Don't miss the deadline for a t-shirt!

https://www.unionacademy.org/apps/pages/onlinepayments",2020-05-18 15:10:02,,
199,0.0,,18.0,,1534868553353396,We ❤️ our Seniors (Part 2),,,0.0,We ❤️ our Seniors (Part 2),2020-05-17 20:28:29,https://video-atl3-1.xx.fbcdn.net/v/t42.9040-2/98323191_249946059582183_5159997202885509120_n.mp4?_nc_cat=103&_nc_sid=985c63&efg=eyJ2ZW5jb2RlX3RhZyI6ImxlZ2FjeV9zZCJ9&_nc_ohc=G-Qkgq0COygAX9biNXT&_nc_ht=video-atl3-1.xx&oh=e64a44a80e1c0b72a9a990b7b0c2be43&oe=5F5EEB30,
200,0.0,,13.0,https://www.krispykreme.com/promos/2020seniorweek,1533775543462697,"SENIORS, go get those FREE doughnuts on Tuesday! You deserve them!
https://www.krispykreme.com/promos/2020seniorweek",https://facebook.com/story.php?story_fbid=1533775543462697&id=476331569207105,"KRISPYKREME.COM
Krispy Kreme - Promotions",0.0,"SENIORS, go get those FREE doughnuts on Tuesday! You deserve them!
https://www.krispykreme.com/promos/2020seniorweek

KRISPYKREME.COM
Krispy Kreme - Promotions",2020-05-16 18:06:50,,
201,0.0,,24.0,,1533563300150588,Savanna Brooks shares a quick drill you can do to keep your fielding skills sharp. #uasoftball,,,0.0,Savanna Brooks shares a quick drill you can do to keep your fielding skills sharp. #uasoftball,2020-05-16 12:45:59,https://video-atl3-1.xx.fbcdn.net/v/t42.9040-2/97538789_950868405348552_5922909104052895744_n.mp4?_nc_cat=111&_nc_sid=985c63&efg=eyJ2ZW5jb2RlX3RhZyI6ImxlZ2FjeV9zZCJ9&_nc_ohc=XnbPGCFtW6cAX9LqinA&_nc_ht=video-atl3-1.xx&oh=9047f0480be01ce46506a0d2a5318317&oe=5F5EE13F,
202,2.0,https://scontent-atl3-1.xx.fbcdn.net/v/t1.0-9/fr/cp0/e15/q65/97717867_1531959160311002_1075792249977044992_n.jpg?_nc_cat=101&_nc_sid=e007fa&_nc_ohc=7ZQOzXiIcPwAX9tfZg_&_nc_ht=scontent-atl3-1.xx&tp=14&oh=9a1402323022e2d3ee64d211de61ece3&oe=5F863EB0,44.0,,,,,"Union Academy Charter School added 69 new photos.
May 14 at 7:13 PM ·

Our #tbt tribute to the Class of 2020 continues. We appreciate all the time you have committed to Union Academy over the years.",0.0,"Union Academy Charter School added 69 new photos.
May 14 at 7:13 PM ·

Our #tbt tribute to the Class of 2020 continues. We appreciate all the time you have committed to Union Academy over the years.",2020-05-14 19:13:59,,
203,0.0,https://scontent-atl3-1.xx.fbcdn.net/v/t1.0-9/fr/cp0/e15/q65/97269731_1531182517055333_4193466322463490048_o.jpg?_nc_cat=111&_nc_sid=8024bb&_nc_ohc=EuJSOqc1a1IAX_C22SG&_nc_ht=scontent-atl3-1.xx&tp=14&oh=1628b4c8b09a960f8626866d91bfb31a&oe=5F84F594,19.0,,1531182540388664,"Senior Athlete Tribute: TJ Walker competed in the 400 and 200 Meter during his time on the track team. Congratulations, TJ!",https://facebook.com/story.php?story_fbid=1531182540388664&id=476331569207105,,0.0,"Senior Athlete Tribute: TJ Walker competed in the 400 and 200 Meter during his time on the track team. Congratulations, TJ!",2020-05-13 20:13:23,,
204,0.0,https://scontent-atl3-1.xx.fbcdn.net/v/t1.0-9/fr/cp0/e15/q65/97186451_1531180147055570_8328548208124887040_o.jpg?_nc_cat=110&_nc_sid=8024bb&_nc_ohc=hXRN-uSBNHMAX9e5G86&_nc_ht=scontent-atl3-1.xx&tp=14&oh=f9a04a3ab41f097dbd9f20f85dc07b21&oe=5F8308CA,33.0,,1531180173722234,"Senior Athlete Tribute: Sean Alexander enjoyed his season on the track team. He plans to study sports management. Thank you, Sean!",https://facebook.com/story.php?story_fbid=1531180173722234&id=476331569207105,,0.0,"Senior Athlete Tribute: Sean Alexander enjoyed his season on the track team. He plans to study sports management. Thank you, Sean!",2020-05-13 20:09:28,,
205,1.0,https://scontent-atl3-1.xx.fbcdn.net/v/t1.0-9/fr/cp0/e15/q65/97220624_1531177513722500_6830764353185120256_o.jpg?_nc_cat=110&_nc_sid=8024bb&_nc_ohc=37BAubVf_FcAX-KrsOu&_nc_ht=scontent-atl3-1.xx&tp=14&oh=a76de3dca4a6354f4f6112f59cd1bb63&oe=5F85C8D6,37.0,,1531178083722443,"Senior Athlete Tribute: Jalen Anderson has placed at States several times and signed to continue his track and field career as well as his academic career at UNC-Asheville. Congratulations, Jalen.",https://facebook.com/story.php?story_fbid=1531178083722443&id=476331569207105,,0.0,"Senior Athlete Tribute: Jalen Anderson has placed at States several times and signed to continue his track and field career as well as his academic career at UNC-Asheville. Congratulations, Jalen.",2020-05-13 20:06:23,,
206,0.0,,24.0,,1531137303726521,"As a K-12 school there are many staff members involved in the education of our students, and they all want to share how much the seniors mean to them. #2020 #quarantined2020",,,0.0,"As a K-12 school there are many staff members involved in the education of our students, and they all want to share how much the seniors mean to them. #2020 #quarantined2020",2020-05-13 19:04:32,https://video-atl3-1.xx.fbcdn.net/v/t42.9040-2/10000000_281305839697434_5976358266949599232_n.mp4?_nc_cat=102&_nc_sid=985c63&efg=eyJ2ZW5jb2RlX3RhZyI6ImxlZ2FjeV9zZCJ9&_nc_ohc=nZ11MXoYi_EAX90shOL&_nc_ht=video-atl3-1.xx&oh=39425d3fa977986aec7604f5899c6b96&oe=5F5EEBDE,
207,0.0,https://scontent-atl3-1.xx.fbcdn.net/v/t1.0-9/fr/cp0/e15/q65/97075849_1531094783730773_536043198787616768_o.jpg?_nc_cat=104&_nc_sid=8024bb&_nc_ohc=1cTzbkeQddcAX8TWY0l&_nc_ht=scontent-atl3-1.xx&tp=14&oh=c60a1db47215da502795b5daa76b7792&oe=5F844C79,4.0,https://docs.google.com/forms/d/e/1FAIpQLScWAFZf6_Wy0gUAquaKv_3f3F6ridtvtAgGHe6Ax_12HTgwKQ/viewform?usp=sf_link,1531097260397192,"If you are interested in trying out for high school cheer, please complete the form in the link below or on the UA Varsity Cheer Instagram page by May 22. Contact Coach Jennifer Smith if you have questions (jsmith@unionacademy.org).

https://docs.google.com/forms/d/e/1FAIpQLScWAFZf6_Wy0gUAquaKv_3f3F6ridtvtAgGHe6Ax_12HTgwKQ/viewform?usp=sf_link

Cheer camp registration for rising K-8th graders is open on MyPaymentsPlus. Non-UA students are welcome. A back-up date has been posted in July and a fall camp can be held if needed. If camp has to be canceled, refunds will be issued.",https://facebook.com/story.php?story_fbid=1531097260397192&id=476331569207105,,0.0,"If you are interested in trying out for high school cheer, please complete the form in the link below or on the UA Varsity Cheer Instagram page by May 22. Contact Coach Jennifer Smith if you have questions (jsmith@unionacademy.org).

https://docs.google.com/forms/d/e/1FAIpQLScWAFZf6_Wy0gUAquaKv_3f3F6ridtvtAgGHe6Ax_12HTgwKQ/viewform?usp=sf_link

Cheer camp registration for rising K-8th graders is open on MyPaymentsPlus. Non-UA students are welcome. A back-up date has been posted in July and a fall camp can be held if needed. If camp has to be canceled, refunds will be issued.",2020-05-13 17:44:06,,
208,0.0,,17.0,https://www.nchsaa.org/news/2020-5-6/nchsaa-recognizes-top-teams-%E2%80%9Cclick-it-or-ticket%E2%80%9D-scholar-athlete-team-competition-0,1530719493768302,"Congratulations to our women's cross country team and men's swim team for having the 3rd highest GPA in the NCHSAA ""Click it or Ticket"" Scholar Athlete Team Competition.

https://www.nchsaa.org/news/2020-5-6/nchsaa-recognizes-top-teams-%E2%80%9Cclick-it-or-ticket%E2%80%9D-scholar-athlete-team-competition-0",https://facebook.com/story.php?story_fbid=1530719493768302&id=476331569207105,"NCHSAA recognizes top teams in “Click It or Ticket” Scholar Athlete Team Competition | North Carolina High School Athletic Association
CHAPEL HILL —The NCHSAA Scholar Athlete Program is sponsored by the Governor’s Highway Safety Program’s “Click It or Ticket” initiative and provides certificates of recognition to individual students as well as teams that meet the qualification standards.

NCHSAA recognizes top teams in “Click It or Ticket” Scholar Athlete Team Competition | North Carolina High School Athletic Association
CHAPEL HILL —The NCHSAA Scholar Athlete Program is sponsored by the Governor’s Highway Safety Program’s “Click It or Ticket” initiative and provides certificates of recognition to individual students as well as teams that meet the qualification standards.

NCHSAA recognizes top teams in “Click It or Ticket” Scholar Athlete Team Competition | North Carolina High School Athletic Association
CHAPEL HILL —The NCHSAA Scholar Athlete Program is sponsored by the Governor’s Highway Safety Program’s “Click It or Ticket” initiative and provides certificates of recognition to individual students as well as teams that meet the qualification standards.

NCHSAA recognizes top teams in “Click It or Ticket” Scholar Athlete Team Competition | North Carolina High School Athletic Association
CHAPEL HILL —The NCHSAA Scholar Athlete Program is sponsored by the Governor’s Highway Safety Program’s “Click It or Ticket” initiative and provides certificates of recognition to individual students as well as teams that meet the qualification standards.

NCHSAA recognizes top teams in “Click It or Ticket” Scholar Athlete Team Competition | North Carolina High School Athletic Association
CHAPEL HILL —The NCHSAA Scholar Athlete Program is sponsored by the Governor’s Highway Safety Program’s “Click It or Ticket” initiative and provides certificates of recognition to individual students as well as teams that meet the qualification standards.

See more at
nchsaa.org",0.0,"Congratulations to our women's cross country team and men's swim team for having the 3rd highest GPA in the NCHSAA ""Click it or Ticket"" Scholar Athlete Team Competition.

https://www.nchsaa.org/news/2020-5-6/nchsaa-recognizes-top-teams-%E2%80%9Cclick-it-or-ticket%E2%80%9D-scholar-athlete-team-competition-0

NCHSAA recognizes top teams in “Click It or Ticket” Scholar Athlete Team Competition | North Carolina High School Athletic Association
CHAPEL HILL —The NCHSAA Scholar Athlete Program is sponsored by the Governor’s Highway Safety Program’s “Click It or Ticket” initiative and provides certificates of recognition to individual students as well as teams that meet the qualification standards.

NCHSAA recognizes top teams in “Click It or Ticket” Scholar Athlete Team Competition | North Carolina High School Athletic Association
CHAPEL HILL —The NCHSAA Scholar Athlete Program is sponsored by the Governor’s Highway Safety Program’s “Click It or Ticket” initiative and provides certificates of recognition to individual students as well as teams that meet the qualification standards.

NCHSAA recognizes top teams in “Click It or Ticket” Scholar Athlete Team Competition | North Carolina High School Athletic Association
CHAPEL HILL —The NCHSAA Scholar Athlete Program is sponsored by the Governor’s Highway Safety Program’s “Click It or Ticket” initiative and provides certificates of recognition to individual students as well as teams that meet the qualification standards.

NCHSAA recognizes top teams in “Click It or Ticket” Scholar Athlete Team Competition | North Carolina High School Athletic Association
CHAPEL HILL —The NCHSAA Scholar Athlete Program is sponsored by the Governor’s Highway Safety Program’s “Click It or Ticket” initiative and provides certificates of recognition to individual students as well as teams that meet the qualification standards.

NCHSAA recognizes top teams in “Click It or Ticket” Scholar Athlete Team Competition | North Carolina High School Athletic Association
CHAPEL HILL —The NCHSAA Scholar Athlete Program is sponsored by the Governor’s Highway Safety Program’s “Click It or Ticket” initiative and provides certificates of recognition to individual students as well as teams that meet the qualification standards.

See more at
nchsaa.org",2020-05-13 09:51:17,,
209,0.0,https://scontent-atl3-1.xx.fbcdn.net/v/t1.0-9/fr/cp0/e15/q65/97011468_1530689760437942_5616368045367754752_o.jpg?_nc_cat=100&_nc_sid=110474&_nc_ohc=kxjPNkBHv3cAX9GexaS&_nc_ht=scontent-atl3-1.xx&tp=14&oh=2719ee465041baf44390f43425ff1b0a&oe=5F84441F,8.0,,1530692297104355,"Tomorrow, May 14 from 1-3pm: uniform drop-off. Please drive through South Carpool to return your uniform to your coach. Make sure all your items are turned in, so coaches can inventory and store uniforms for next season. See you tomorrow!",https://facebook.com/story.php?story_fbid=1530692297104355&id=476331569207105,,0.0,"Tomorrow, May 14 from 1-3pm: uniform drop-off. Please drive through South Carpool to return your uniform to your coach. Make sure all your items are turned in, so coaches can inventory and store uniforms for next season. See you tomorrow!",2020-05-13 09:21:47,,
210,1.0,https://scontent-atl3-1.xx.fbcdn.net/v/t1.0-9/fr/cp0/e15/q65/96840581_1529902217183363_4986828626931482624_o.jpg?_nc_cat=108&_nc_sid=2d5d41&_nc_ohc=6idyS1PWE-sAX_T5BsD&_nc_ht=scontent-atl3-1.xx&tp=14&oh=611e0b0d55f02c31f67f8b509bb1672d&oe=5F85C6F0,45.0,,1529902210516697,This week the Finance Dept. sponsored Taco Tuesday at the Community Shelter. Lynn Kroeger and Robert Rushing represented UA. #ourncschoolheroes,,,0.0,This week the Finance Dept. sponsored Taco Tuesday at the Community Shelter. Lynn Kroeger and Robert Rushing represented UA. #ourncschoolheroes,2020-05-12 12:02:16,,
