,comments,image,likes,link,post_id,post_text,post_url,shared_text,shares,text,time,video,video_thumbnail
297,1.0,https://scontent-atl3-1.xx.fbcdn.net/v/t1.0-9/fr/cp0/e15/q65/92596847_1499829903523928_4030119151304441856_o.jpg?_nc_cat=100&_nc_sid=8024bb&_nc_ohc=UnuXnn7bj7AAX_2_NG7&_nc_ht=scontent-atl3-1.xx&tp=14&oh=2adb52704f9f37ed4087c8a890c6bddd&oe=5F861755,41.0,,1499832080190377,Spring Break begins tomorrow; classes resume April 20. We hope you have a wonderful time with your family relaxing and taking a break from remote learning.,https://facebook.com/story.php?story_fbid=1499832080190377&id=476331569207105,,0.0,Spring Break begins tomorrow; classes resume April 20. We hope you have a wonderful time with your family relaxing and taking a break from remote learning.,2020-04-09 10:40:15,,
298,10.0,,60.0,,1499296766910575,Join the UA coaches in a Pushup Challenge to help us all stay fit! Video your pushups and tag us on social media.,,,0.0,Join the UA coaches in a Pushup Challenge to help us all stay fit! Video your pushups and tag us on social media.,2020-04-08 21:56:21,https://video-atl3-1.xx.fbcdn.net/v/t42.9040-2/92172955_507951199874244_7516746432234127360_n.mp4?_nc_cat=111&_nc_sid=985c63&efg=eyJ2ZW5jb2RlX3RhZyI6ImxlZ2FjeV9zZCJ9&_nc_ohc=3-j2aGqb9FMAX-kFt3L&_nc_ht=video-atl3-1.xx&oh=8eafdb776c3d3009a4cdb93d1417d6b3&oe=5F5EE22A,
299,0.0,https://scontent-atl3-1.xx.fbcdn.net/v/t1.0-9/fr/cp0/e15/q65/92411965_1530859157072817_5511888748234670080_o.jpg?_nc_cat=103&_nc_sid=8024bb&_nc_ohc=3inkWShuPlkAX8uWVDJ&_nc_ht=scontent-atl3-1.xx&tp=14&oh=d60f1648b26d80e8ce83192d36e42097&oe=5F83C3A9,2.0,,1499002090273376,Please see the link below for additional resources from the state for food and childcare needs.,https://facebook.com/story.php?story_fbid=1499002090273376&id=476331569207105,"NC Public Schools
April 8 at 2:45 PM ·

Dial 2-1-1 or text COVIDNC to 898211 for free, confidential information 24/7 to help you connect with people and groups who can assist in locating resources within your community for food, shelter, child care and more.",3.0,"Please see the link below for additional resources from the state for food and childcare needs.

NC Public Schools
April 8 at 2:45 PM ·

Dial 2-1-1 or text COVIDNC to 898211 for free, confidential information 24/7 to help you connect with people and groups who can assist in locating resources within your community for food, shelter, child care and more.",2020-04-08 14:51:35,,
300,6.0,https://scontent-atl3-1.xx.fbcdn.net/v/t1.0-9/fr/cp0/e15/q65/92558063_1498890596951192_3417330599243808768_o.jpg?_nc_cat=106&_nc_sid=9e2e56&_nc_ohc=B7M6iZ9H2GsAX_W_rej&_nc_ht=scontent-atl3-1.xx&tp=14&oh=199c795aa3a1e2b8acc46410a685300f&oe=5F831774,66.0,,1498890693617849,"Yesterday’s Taco Tuesday at Community Shelter of Union County was sponsored by our 5th Grade Junior Beta Club! Thanks for making this happen, Mrs. Rushing. If your team or club is interested in sponsoring a meal, let us know! #ncschoolheroes #uaservesathome",https://facebook.com/story.php?story_fbid=1498890693617849&id=476331569207105,,0.0,"Yesterday’s Taco Tuesday at Community Shelter of Union County was sponsored by our 5th Grade Junior Beta Club! Thanks for making this happen, Mrs. Rushing. If your team or club is interested in sponsoring a meal, let us know! #ncschoolheroes #uaservesathome",2020-04-08 12:02:02,,
301,7.0,,27.0,,1498762350297350,These messages from the 2nd grade team will brighten your Wednesday. Happy Hump Day! #wemissyoubig #2ndgraderocks,,,0.0,These messages from the 2nd grade team will brighten your Wednesday. Happy Hump Day! #wemissyoubig #2ndgraderocks,2020-04-08 09:04:26,https://video-atl3-1.xx.fbcdn.net/v/t42.9040-2/10000000_3051810841547925_8434386304061407232_n.mp4?_nc_cat=108&_nc_sid=985c63&efg=eyJ2ZW5jb2RlX3RhZyI6ImxlZ2FjeV9zZCJ9&_nc_ohc=l3UjAc_8dlUAX_kPTQK&_nc_ht=video-atl3-1.xx&oh=792f3d2b2a2129b99cd3492bee85a1a9&oe=5F5EE709,
302,2.0,,53.0,,1498203883686530,"The 8th grade team, Mrs. Yermack, and Mrs. McGinnis knew several weeks ago we would all need a reminder to stay focused and do our best! #eyeofthetiger",,,0.0,"The 8th grade team, Mrs. Yermack, and Mrs. McGinnis knew several weeks ago we would all need a reminder to stay focused and do our best! #eyeofthetiger",2020-04-07 18:25:24,https://video-atl3-1.xx.fbcdn.net/v/t42.9040-2/92596170_149067829854228_4921025810946588672_n.mp4?_nc_cat=107&_nc_sid=985c63&efg=eyJ2ZW5jb2RlX3RhZyI6ImxlZ2FjeV9zZCJ9&_nc_ohc=CQjgAPLywBEAX-MIgFh&_nc_ht=video-atl3-1.xx&oh=f8a7255f9cae138e97ba5890cb801639&oe=5F5EDFA3,
303,4.0,https://scontent-atl3-1.xx.fbcdn.net/v/t1.0-9/fr/cp0/e15/q65/92230061_1497962687043983_3651134119028457472_o.jpg?_nc_cat=102&_nc_sid=9e2e56&_nc_ohc=1ryWpe2ImFUAX-OO1e1&_nc_ht=scontent-atl3-1.xx&tp=14&oh=c3452ff3cde6a7fa19be4f38acd19c92&oe=5F83BF4B,47.0,,1497963073710611,"High school students Kara Mann and Ryan House are getting in their volunteer hours! Ryan helped build a raised garden, and Kara wrote positive letters for her neighbors. Jennie and Hailey Stewart wrote positive messages to the residents and healthcare providers at the Jesse Helms Center. 4th grade student Gabe made playdough and spent time playing with his little sister. How are you giving back to the community? #uaservesathome",https://facebook.com/story.php?story_fbid=1497963073710611&id=476331569207105,,0.0,"High school students Kara Mann and Ryan House are getting in their volunteer hours! Ryan helped build a raised garden, and Kara wrote positive letters for her neighbors. Jennie and Hailey Stewart wrote positive messages to the residents and healthcare providers at the Jesse Helms Center. 4th grade student Gabe made playdough and spent time playing with his little sister. How are you giving back to the community? #uaservesathome",2020-04-07 11:36:26,,
304,8.0,https://scontent-atl3-1.xx.fbcdn.net/v/t1.0-9/fr/cp0/e15/q65/92299769_1497378520435733_1323335967142051840_o.jpg?_nc_cat=104&_nc_sid=8024bb&_nc_ohc=3_xd1Bd_qgAAX-9og4S&_nc_ht=scontent-atl3-1.xx&tp=14&oh=58b7dd1ddc899525cc4cd0da82cb7f49&oe=5F842265,92.0,,1497382250435360,"Senior Athlete Tribute: Nick Smith is the only senior on this year's golf team. He brought home UA's first ever state championship and has been recognized as the UC Player of the Year, All-Region, Conference Player of the Year and All-Conference. Thank you, Nick!",https://facebook.com/story.php?story_fbid=1497382250435360&id=476331569207105,,0.0,"Senior Athlete Tribute: Nick Smith is the only senior on this year's golf team. He brought home UA's first ever state championship and has been recognized as the UC Player of the Year, All-Region, Conference Player of the Year and All-Conference. Thank you, Nick!",2020-04-06 19:45:11,,
305,2.0,https://scontent-atl3-1.xx.fbcdn.net/v/t1.0-9/fr/cp0/e15/q65/92675920_1497014957138756_712804093977952256_o.jpg?_nc_cat=108&_nc_sid=9e2e56&_nc_ohc=4esJDlbazMoAX-XSLrn&_nc_ht=scontent-atl3-1.xx&tp=14&oh=67c129b36e3d52719426961e428624dc&oe=5F848612,61.0,,1497015020472083,Congratulations to #3 Sarah Brown for earning a spot on the NC East-West All-Star team! Well deserved!,https://facebook.com/story.php?story_fbid=1497015020472083&id=476331569207105,,0.0,Congratulations to #3 Sarah Brown for earning a spot on the NC East-West All-Star team! Well deserved!,2020-04-06 10:46:33,,
306,9.0,,45.0,,1496901883816730,Here’s another group of wonderful teachers who took a few minutes out of their last day on campus to send their 1st grade students a message. They feel LUCKY to have you as their students. #missingyou #lucky1s,,,0.0,Here’s another group of wonderful teachers who took a few minutes out of their last day on campus to send their 1st grade students a message. They feel LUCKY to have you as their students. #missingyou #lucky1s,2020-04-06 08:02:47,https://video-atl3-1.xx.fbcdn.net/v/t42.9040-2/91354607_221966505546773_2170828955622309888_n.mp4?_nc_cat=108&_nc_sid=985c63&efg=eyJ2ZW5jb2RlX3RhZyI6ImxlZ2FjeV9zZCJ9&_nc_ohc=04kewGfE29cAX_tEuwU&_nc_ht=video-atl3-1.xx&oh=84a49632d8420f40b0d85fe2dfc0b73f&oe=5F5EE96A,
307,7.0,https://scontent-atl3-1.xx.fbcdn.net/v/t1.0-9/fr/cp0/e15/q65/92701084_1496485390525046_182388324550311936_o.jpg?_nc_cat=104&_nc_sid=9e2e56&_nc_ohc=zj3KuBR9cgQAX_adoSz&_nc_ht=scontent-atl3-1.xx&tp=14&oh=0c36c5d98f6ce19ad78d16869b94b09a&oe=5F852A18,60.0,,1496485640525021,"Cooper Wilson (Class of 2013) graduated from SPCC in 2016 with an Associate of Science Degree and then from Eastern Kentucky University in 2018 with a Bachelor of Science degree in Fire Protection Administration and a minor in Fire and Safety Engineering Technology. Cooper was recently accepted to UNCC where he will get his masters in Fire Protection and Administration. Cooper has worked with many fire departments including Bakers Volunteer Fire Department since 2014 and Wesley Chapel Fire Department since 2019 as a part-time firefighter, and he began his firefighting career in November of 2019 at Monroe Fire Department. Cooper and his fiance Sara Rucker have a 1 year old lab/great pyrenees mix named Murphy. Cooper and Sara plan to get married May 23, 2020.",https://facebook.com/story.php?story_fbid=1496485640525021&id=476331569207105,,0.0,"Cooper Wilson (Class of 2013) graduated from SPCC in 2016 with an Associate of Science Degree and then from Eastern Kentucky University in 2018 with a Bachelor of Science degree in Fire Protection Administration and a minor in Fire and Safety Engineering Technology. Cooper was recently accepted to UNCC where he will get his masters in Fire Protection and Administration. Cooper has worked with many fire departments including Bakers Volunteer Fire Department since 2014 and Wesley Chapel Fire Department since 2019 as a part-time firefighter, and he began his firefighting career in November of 2019 at Monroe Fire Department. Cooper and his fiance Sara Rucker have a 1 year old lab/great pyrenees mix named Murphy. Cooper and Sara plan to get married May 23, 2020.",2020-04-05 19:56:37,,
308,15.0,https://scontent-atl3-1.xx.fbcdn.net/v/t1.0-9/fr/cp0/e15/q65/91427259_1496328210540764_3192449972800847872_o.jpg?_nc_cat=105&_nc_sid=9e2e56&_nc_ohc=mpdvY-Q-_foAX9ktihu&_nc_ht=scontent-atl3-1.xx&tp=14&oh=2209b8bab87fae47eb2a6a71e6062b46&oe=5F82C06C,130.0,,1496328353874083,Sophomore Michael Shores created a chalk mural to encourage his neighbors. Thanks for serving your community and lifting spirits! #UAServesatHome,https://facebook.com/story.php?story_fbid=1496328353874083&id=476331569207105,,0.0,Sophomore Michael Shores created a chalk mural to encourage his neighbors. Thanks for serving your community and lifting spirits! #UAServesatHome,2020-04-05 15:14:47,,
309,8.0,,60.0,https://youtu.be/a_66E4njqmA,1496086287231623,UA’s Wind Ensemble put together a virtual concert for you to enjoy! Social distancing can’t stop these musicians from creating beautiful music! #getcreative #weareua,https://facebook.com/story.php?story_fbid=1496086287231623&id=476331569207105,"YOUTUBE.COM
Union Academy Wind Ensemble - Aberystwyth Variants - Virtual Concert",17.0,"UA’s Wind Ensemble put together a virtual concert for you to enjoy! Social distancing can’t stop these musicians from creating beautiful music! #getcreative #weareua

YOUTUBE.COM
Union Academy Wind Ensemble - Aberystwyth Variants - Virtual Concert",2020-04-05 09:41:25,,
310,3.0,https://scontent-atl3-1.xx.fbcdn.net/v/t1.0-9/fr/cp0/e15/q65/92225470_1496053363901582_7996971561733062656_o.jpg?_nc_cat=109&_nc_sid=2d5d41&_nc_ohc=AoIFEJ6pBjoAX-1WDoA&_nc_ht=scontent-atl3-1.xx&tp=14&oh=eec2e27b7941d4b9c1abae5220552878&oe=5F83961C,75.0,,1496053357234916,The 2nd grade team is missing you! #socialdistancing #weareua,,,0.0,The 2nd grade team is missing you! #socialdistancing #weareua,2020-04-05 08:44:08,,
311,3.0,,38.0,,1495486687291583,Senior Drew Noblet shares ways to work on skills and speed and agility while at home. Drew will be playing baseball at the University of the South Sewanee next year.,,,0.0,Senior Drew Noblet shares ways to work on skills and speed and agility while at home. Drew will be playing baseball at the University of the South Sewanee next year.,2020-04-04 16:23:22,https://video-atl3-1.xx.fbcdn.net/v/t42.9040-2/92504223_623888668167527_6999463603350798336_n.mp4?_nc_cat=104&_nc_sid=985c63&efg=eyJ2ZW5jb2RlX3RhZyI6ImxlZ2FjeV9zZCJ9&_nc_ohc=Gyv-MjzpxiEAX8JFtJ9&_nc_ht=video-atl3-1.xx&oh=b5658dd017148df9e4ebf75c785bdef9&oe=5F5EE74A,
312,1.0,https://scontent-atl3-1.xx.fbcdn.net/v/t1.0-9/fr/cp0/e15/q65/91974611_1494762840697301_4310533447186644992_n.jpg?_nc_cat=108&_nc_sid=8024bb&_nc_ohc=mL4gckG1Yq4AX-8Y1tL&_nc_ht=scontent-atl3-1.xx&tp=14&oh=96577c6c0053f5e77bc11e92770a43d1&oe=5F847BC5,18.0,https://www.unionacademy.org/apps/pages/showallnews,1494763314030587,"The Friday Update has been emailed to families and posted on the UA webpage. Have a wonderful weekend. We are UA!

https://www.unionacademy.org/apps/pages/showallnews",https://facebook.com/story.php?story_fbid=1494763314030587&id=476331569207105,,0.0,"The Friday Update has been emailed to families and posted on the UA webpage. Have a wonderful weekend. We are UA!

https://www.unionacademy.org/apps/pages/showallnews",2020-04-03 20:33:53,,
313,26.0,,105.0,,1494701787370073,Mrs. McGinnis takes us into her house to show that we are all working to figure out our new normal. Happy Friday!,,,0.0,Mrs. McGinnis takes us into her house to show that we are all working to figure out our new normal. Happy Friday!,2020-04-03 18:34:14,https://video-atl3-1.xx.fbcdn.net/v/t42.9040-2/90934823_211452050081965_530314013062463488_n.mp4?_nc_cat=105&_nc_sid=985c63&efg=eyJ2ZW5jb2RlX3RhZyI6ImxlZ2FjeV9zZCJ9&_nc_ohc=OG9dvbDcbasAX_zLr3I&_nc_ht=video-atl3-1.xx&oh=f0f034f3b712626e911a4fbc11f400f4&oe=5F5EE254,
314,0.0,https://scontent-atl3-1.xx.fbcdn.net/v/t1.0-9/fr/cp0/e15/q65/91879609_1493764574130461_8002138385915314176_o.jpg?_nc_cat=110&_nc_sid=9e2e56&_nc_ohc=AfBfiDI41QYAX-ole9x&_nc_ht=scontent-atl3-1.xx&tp=14&oh=32fd441f0b4c1f29ebc643608ebeb4bb&oe=5F83971D,49.0,,1493764767463775,Today’s assignment: Read outside! We hope you are having a wonderful time soaking in some sun while you work. #readoutside #beautifulday #getoutside,https://facebook.com/story.php?story_fbid=1493764767463775&id=476331569207105,,0.0,Today’s assignment: Read outside! We hope you are having a wonderful time soaking in some sun while you work. #readoutside #beautifulday #getoutside,2020-04-02 16:38:45,,
315,0.0,,10.0,https://www.surveymonkey.com/r/UAParent2020,1492980964208822,"An email was sent to parents with the link to the annual UA Board Survey. Please complete the survey by April 30, so we can know what we are doing right and what we can focus on for next year. The link to the survey is also below in case you did not receive the email. We appreciate your participation.
https://www.surveymonkey.com/r/UAParent2020",https://facebook.com/story.php?story_fbid=1492980964208822&id=476331569207105,,0.0,"An email was sent to parents with the link to the annual UA Board Survey. Please complete the survey by April 30, so we can know what we are doing right and what we can focus on for next year. The link to the survey is also below in case you did not receive the email. We appreciate your participation.
https://www.surveymonkey.com/r/UAParent2020",2020-04-01 18:38:14,,
316,0.0,,19.0,https://www.unionacademy.org/apps/pages/index.jsp?uREC_ID=734573&type=d&pREC_ID=1150035,1492149104292008,"The UA Board of Directors will meet virtually on Thursday, April 2 at 6:30 p.m. Information on how to sign up for public comments and to join the meeting can be found on the UA website. https://www.unionacademy.org/apps/pages/index.jsp?uREC_ID=734573&type=d&pREC_ID=1150035",https://facebook.com/story.php?story_fbid=1492149104292008&id=476331569207105,,0.0,"The UA Board of Directors will meet virtually on Thursday, April 2 at 6:30 p.m. Information on how to sign up for public comments and to join the meeting can be found on the UA website. https://www.unionacademy.org/apps/pages/index.jsp?uREC_ID=734573&type=d&pREC_ID=1150035",2020-03-31 19:20:46,,
317,12.0,https://scontent-atl3-1.xx.fbcdn.net/v/t1.0-9/fr/cp0/e15/q65/90705597_1491911854315733_3378682877196632064_o.jpg?_nc_cat=109&_nc_sid=9e2e56&_nc_ohc=JTp6YJ4cG6wAX9wFKWd&_nc_ht=scontent-atl3-1.xx&tp=14&oh=342bfe214a0548083d9c0792f802c8e2&oe=5F844C20,121.0,,1491912080982377,Thanks to Beth Rushing UA is continuing its Taco Tuesday tradition at the Community Shelter of Union County. Today’s meal was provided by Junior Civitan. #UAServesfromHome #weareua #NCSchoolHeroes,https://facebook.com/story.php?story_fbid=1491912080982377&id=476331569207105,,0.0,Thanks to Beth Rushing UA is continuing its Taco Tuesday tradition at the Community Shelter of Union County. Today’s meal was provided by Junior Civitan. #UAServesfromHome #weareua #NCSchoolHeroes,2020-03-31 13:18:01,,
318,12.0,https://scontent-atl3-1.xx.fbcdn.net/v/t1.0-9/fr/cp0/e15/q65/91577390_1491255444381374_558286516586020864_o.jpg?_nc_cat=111&_nc_sid=8024bb&_nc_ohc=bemXsnfkMnEAX931Fk1&_nc_ht=scontent-atl3-1.xx&tp=14&oh=82cef25b7dbc0c87d41bb69b6511e74d&oe=5F832861,73.0,,1491260257714226,"Tonight we begin our tribute to our SENIOR ATHLETES for spring sports. We are still hoping they might get a few more games in when we return to school. Please let them know how much you appreciate the dedication and effort they have put into representing UA over the years. Each Monday, we will feature another team, so congratulate them and celebrate all their accomplishments!

Caroline Stafford is the lone senior on the softball team. This year she plays 3B/OF and plans to attend Gardner Webb University in the fall. Thank you, Caroline!",https://facebook.com/story.php?story_fbid=1491260257714226&id=476331569207105,,0.0,"Tonight we begin our tribute to our SENIOR ATHLETES for spring sports. We are still hoping they might get a few more games in when we return to school. Please let them know how much you appreciate the dedication and effort they have put into representing UA over the years. Each Monday, we will feature another team, so congratulate them and celebrate all their accomplishments!

Caroline Stafford is the lone senior on the softball team. This year she plays 3B/OF and plans to attend Gardner Webb University in the fall. Thank you, Caroline!",2020-03-30 19:38:47,,
319,1.0,,44.0,http://www.unionacademy.org/,1491104014396517,UA’s high school student council has some inspiring words and good vibes to help you Stay at Home! Thanks for continuing to lift our spirits!,,"WWW.UNIONACADEMY.ORG
From Our Home To Yours: UA StuCo",0.0,"UA’s high school student council has some inspiring words and good vibes to help you Stay at Home! Thanks for continuing to lift our spirits!

WWW.UNIONACADEMY.ORG
From Our Home To Yours: UA StuCo",2020-03-30 15:08:33,https://scontent-atl3-1.xx.fbcdn.net/v/t42.9040-4/91120919_1266863150371187_4823523112660238336_n.mp4?_nc_cat=102&_nc_sid=985c63&efg=eyJ2ZW5jb2RlX3RhZyI6ImxlZ2FjeV9zZCJ9&_nc_ohc=ErLABDyP8eoAX91_lH-&_nc_ht=scontent-atl3-1.xx&oh=63464a0ac162c96e25798924a2f8da42&oe=5F5EDEC6,
320,13.0,,49.0,,1490963461077239,Hakuna Matata from your 5th grade team. No worries just do your best! #wemissyoubig #goawaycovid19 (Thanks for the awesome music Disney!),,,0.0,Hakuna Matata from your 5th grade team. No worries just do your best! #wemissyoubig #goawaycovid19 (Thanks for the awesome music Disney!),2020-03-30 12:04:47,https://video-atl3-1.xx.fbcdn.net/v/t42.9040-2/91466675_510068189903369_2831019738878967808_n.mp4?_nc_cat=101&_nc_sid=985c63&efg=eyJ2ZW5jb2RlX3RhZyI6ImxlZ2FjeV9zZCJ9&_nc_ohc=geQvy6srbMsAX_QJVu-&_nc_ht=video-atl3-1.xx&oh=768b20bbdbb65824d4fe89954d154f06&oe=5F5EE844,
321,7.0,https://scontent-atl3-1.xx.fbcdn.net/v/t1.0-9/fr/cp0/e15/q65/91257489_1490343627805889_6321246644784332800_o.jpg?_nc_cat=108&_nc_sid=9e2e56&_nc_ohc=4_DlWLpSPIwAX_4xYhc&_nc_ht=scontent-atl3-1.xx&tp=14&oh=32d0beb5462a58d82477ad7313374eab&oe=5F84E349,47.0,,1490344101139175,"Lauren Smith (2015) graduated from UNCC's architecture program in December of 2018. She had the opportunity to travel with the program to a new city every year to study different architects and the buildings they designed: Savannah, GA; Chicago, IL; and Seattle, WA. Lauren currently works with two designers taking existing houses and turning them into the client’s dream house just like they do on HGTV. Lauren explained, “It's the best job ever and what I've wanted to do after taking art with Mrs. Faulkner, where she had us design a house.”",https://facebook.com/story.php?story_fbid=1490344101139175&id=476331569207105,,0.0,"Lauren Smith (2015) graduated from UNCC's architecture program in December of 2018. She had the opportunity to travel with the program to a new city every year to study different architects and the buildings they designed: Savannah, GA; Chicago, IL; and Seattle, WA. Lauren currently works with two designers taking existing houses and turning them into the client’s dream house just like they do on HGTV. Lauren explained, “It's the best job ever and what I've wanted to do after taking art with Mrs. Faulkner, where she had us design a house.”",2020-03-29 18:59:43,,
322,0.0,https://scontent-atl3-1.xx.fbcdn.net/v/t1.0-9/90451979_3047657221932565_1558841977603096576_o.png?_nc_cat=106&_nc_sid=8024bb&_nc_ohc=pmnA6Ym-1RAAX-9brLx&_nc_ht=scontent-atl3-1.xx&oh=382d801a1f5fe28355fa43d710284ebd&oe=5F84B11D,7.0,http://NoKidHungryNC.org/covid19,1490260447814207,No Kid Hungry North Carolina is a resource to find meals for kids who need them! #MealsForKids,https://facebook.com/story.php?story_fbid=1490260447814207&id=476331569207105,"No Kid Hungry North Carolina
March 21 at 10:38 AM ·

NEW: You can now text FOODNC to 877-877 to find meals for kids near you in North Carolina!

Please help us spread the word!

For more #MealsForKids options during #COVID19 school closures - including bus deliveries - check out the updates at NoKidHungryNC.org/covid19",3.0,"No Kid Hungry North Carolina is a resource to find meals for kids who need them! #MealsForKids

No Kid Hungry North Carolina
March 21 at 10:38 AM ·

NEW: You can now text FOODNC to 877-877 to find meals for kids near you in North Carolina!

Please help us spread the word!

For more #MealsForKids options during #COVID19 school closures - including bus deliveries - check out the updates at NoKidHungryNC.org/covid19",2020-03-29 16:40:14,,
323,1.0,,32.0,,1489365944570324,"So many students are missing sports this spring, but no one misses them more than our seniors. But there are lots of drills and conditioning activities that can be done at home to stay ready when the season starts back. Look for videos from our varsity athletes with examples to share with your athlete. Up first is varsity baseball player Jaden Sylvestre.",,,0.0,"So many students are missing sports this spring, but no one misses them more than our seniors. But there are lots of drills and conditioning activities that can be done at home to stay ready when the season starts back. Look for videos from our varsity athletes with examples to share with your athlete. Up first is varsity baseball player Jaden Sylvestre.",2020-03-28 16:57:02,https://video-atl3-1.xx.fbcdn.net/v/t42.9040-2/91088126_651785185661203_416699230296473600_n.mp4?_nc_cat=103&_nc_sid=985c63&efg=eyJ2ZW5jb2RlX3RhZyI6ImxlZ2FjeV9zZCJ9&_nc_ohc=jCJGzKwgvo0AX8_P-MS&_nc_ht=video-atl3-1.xx&oh=88dd4ed0378d31869b1cd211f2b39d4c&oe=5F5EE8DC,
324,14.0,,51.0,,1488500441323541,"Because remote learning is a new concept for many of us, Mr. Zorn and his family graciously allowed us to take a sneak peek into a typical day for them. They appear to be doing great! We hope you enjoy their video and get a good laugh to end the week 😂😂!",,,0.0,"Because remote learning is a new concept for many of us, Mr. Zorn and his family graciously allowed us to take a sneak peek into a typical day for them. They appear to be doing great! We hope you enjoy their video and get a good laugh to end the week 😂😂!",2020-03-27 19:58:08,https://video-atl3-1.xx.fbcdn.net/v/t42.9040-2/91361063_216532359455426_7271484279006167040_n.mp4?_nc_cat=110&_nc_sid=985c63&efg=eyJ2ZW5jb2RlX3RhZyI6ImxlZ2FjeV9zZCJ9&_nc_ohc=xDncTrJUeNAAX9yh_Ti&_nc_ht=video-atl3-1.xx&oh=46346caab4c7eb4ad718eb6cb9359b6b&oe=5F5EE82C,
325,0.0,https://scontent-atl3-1.xx.fbcdn.net/v/t1.0-9/fr/cp0/e15/q65/91239574_1488478177992434_3539942221803421696_n.jpg?_nc_cat=103&_nc_sid=110474&_nc_ohc=BtoX8DRyeA8AX-w40Tj&_nc_ht=scontent-atl3-1.xx&tp=14&oh=11776955667f8f18424b52289532012f&oe=5F8459B3,16.0,https://www.unionacademy.org/apps/pages/showallnews,1488478444659074,"Coronavirus Update: Today, March 27, Gov. Roy Cooper issued a Stay at Home order which goes into effect at 5 p.m. Monday, March 30.

Each Friday we will email an update to keep our lines of communication open with our UA Community. All updates are also posted on the UA website under “All School News” should you need to reference them. Below is the link to today’s update.

https://www.unionacademy.org/apps/pages/showallnews",https://facebook.com/story.php?story_fbid=1488478444659074&id=476331569207105,,0.0,"Coronavirus Update: Today, March 27, Gov. Roy Cooper issued a Stay at Home order which goes into effect at 5 p.m. Monday, March 30.

Each Friday we will email an update to keep our lines of communication open with our UA Community. All updates are also posted on the UA website under “All School News” should you need to reference them. Below is the link to today’s update.

https://www.unionacademy.org/apps/pages/showallnews",2020-03-27 19:22:27,,
