,comments,image,likes,link,post_id,post_text,post_url,shared_text,shares,text,time,video,video_thumbnail
0,0.0,,41.0,,1642632325910351,"Today on Patriot Day, we remember and honor the dedicated men and women in uniform who gave their lives rescuing others in the September 11, 2001 attacks.",,,0.0,"Today on Patriot Day, we remember and honor the dedicated men and women in uniform who gave their lives rescuing others in the September 11, 2001 attacks.",2020-09-11 08:00:26,https://video-atl3-1.xx.fbcdn.net/v/t42.9040-2/119135824_715235389030814_4531238561325440988_n.mp4?_nc_cat=106&_nc_sid=985c63&efg=eyJ2ZW5jb2RlX3RhZyI6ImxlZ2FjeV9zZCJ9&_nc_ohc=wyraaSH-7rUAX_ITQpZ&_nc_ht=video-atl3-1.xx&oh=b9894eeade2bfb45141591c9528bade2&oe=5F5EDE5A,
1,2.0,,38.0,,1641499102690340,Sea turtles never give up! The next time you feel as if things are tough just remember to be as resilient and determined as a baby sea turtle headed out to sea.,,,0.0,Sea turtles never give up! The next time you feel as if things are tough just remember to be as resilient and determined as a baby sea turtle headed out to sea.,2020-09-10 08:00:44,https://video-atl3-1.xx.fbcdn.net/v/t42.9040-2/119107103_324030455374681_4892126109358307080_n.mp4?_nc_cat=111&_nc_sid=985c63&efg=eyJ2ZW5jb2RlX3RhZyI6ImxlZ2FjeV9zZCJ9&_nc_ohc=eEOMAsiGHA0AX9cuzFQ&_nc_ht=video-atl3-1.xx&oh=bb0ddc17f594b52801c9f6b7974a1d8e&oe=5F5EDFB3,
2,0.0,https://scontent-atl3-1.xx.fbcdn.net/v/t1.0-9/fr/cp0/e15/q65/119118626_1641579152682335_6106225224691151772_o.jpg?_nc_cat=107&_nc_sid=8024bb&_nc_ohc=C9b4tPmFCCoAX-916Hz&_nc_ht=scontent-atl3-1.xx&tp=14&oh=d3616f094d0f90725299a3c21e916164&oe=5F849E27,2.0,,1641581782682072,"Order your 2020-21 yearbook now before the price goes UP! Early bird special of $45 ends September 18. Contact zzander@unionacademy.org with any questions.

Senior ads are now on sale. Senior parents received an email with detailed info.",https://facebook.com/story.php?story_fbid=1641581782682072&id=476331569207105,,0.0,"Order your 2020-21 yearbook now before the price goes UP! Early bird special of $45 ends September 18. Contact zzander@unionacademy.org with any questions.

Senior ads are now on sale. Senior parents received an email with detailed info.",2020-09-09 19:37:01,,
3,9.0,,48.0,,1641805312659719,"Character can be taught even during remote learning. Kindergarten student, Harper, gives an example of compassion and reminds us all of the UA motto: “We do the right thing even when no one is looking....(and help others).” Great job! #schoolofcharacter #itstartsathome #kindergartenersrock",,,0.0,"Character can be taught even during remote learning. Kindergarten student, Harper, gives an example of compassion and reminds us all of the UA motto: “We do the right thing even when no one is looking....(and help others).” Great job! #schoolofcharacter #itstartsathome #kindergartenersrock",2020-09-09 19:28:57,https://video-atl3-1.xx.fbcdn.net/v/t42.9040-2/119133821_862958327571377_3757728049012298619_n.mp4?_nc_cat=108&_nc_sid=985c63&efg=eyJ2ZW5jb2RlX3RhZyI6ImxlZ2FjeV9zZCJ9&_nc_ohc=uUSg7fUFYdoAX_nIMR1&_nc_ht=video-atl3-1.xx&oh=bece74c11956735bfc4b983c45b49d04&oe=5F5EE140,
4,5.0,,36.0,,1640714822768768,"“Learn from yesterday, live for today, hope for tomorrow.” -Albert Einstein",,,0.0,"“Learn from yesterday, live for today, hope for tomorrow.” -Albert Einstein",2020-09-09 08:00:45,https://video-atl3-1.xx.fbcdn.net/v/t42.9040-2/119036363_233275268120381_3638414453299858104_n.mp4?_nc_cat=109&_nc_sid=985c63&efg=eyJ2ZW5jb2RlX3RhZyI6ImxlZ2FjeV9zZCJ9&_nc_ohc=08sWEBMPSHYAX_Dboef&_nc_ht=video-atl3-1.xx&oh=05188fd59ab6f2a50d3c8f8d8e52cd67&oe=5F5EE1BA,
5,2.0,,27.0,,1640664489440468,"Carpool Change: Tomorrow (9-9-20) 3rd and 4th grade students will move to North Carpool for pick-up. Any students with K-2 siblings should continue to use South Carpool.

Thank you for a great first day back. Please continue to complete the Daily Screening Form BEFORE you arrive on campus. Older students with a phone can bookmark the form to their home screen. The form is also located on the student homepage of all UA issued chromebooks.",https://facebook.com/story.php?story_fbid=1640664489440468&id=476331569207105,,0.0,"Carpool Change: Tomorrow (9-9-20) 3rd and 4th grade students will move to North Carpool for pick-up. Any students with K-2 siblings should continue to use South Carpool.

Thank you for a great first day back. Please continue to complete the Daily Screening Form BEFORE you arrive on campus. Older students with a phone can bookmark the form to their home screen. The form is also located on the student homepage of all UA issued chromebooks.",2020-09-08 13:50:51,,
6,8.0,https://scontent-atl3-1.xx.fbcdn.net/v/t1.0-9/fr/cp0/e15/q65/119068748_1640615386112045_8010343605044207195_o.jpg?_nc_cat=104&_nc_sid=0be424&_nc_ohc=usGaQyx3uH0AX-br-Gx&_nc_ht=scontent-atl3-1.xx&tp=14&oh=190bf0e715e0ebebd20a0433284b9b49&oe=5F82A4D1,104.0,,1640617732778477,,https://facebook.com/story.php?story_fbid=1640617732778477&id=476331569207105,"Union Academy Charter School added 29 new photos.
September 8 at 12:33 PM ·

Welcome Back! We missed you. Thanks for doing your part to make sure we had a great first day back. #UAbacktoschool",0.0,"Union Academy Charter School added 29 new photos.
September 8 at 12:33 PM ·

Welcome Back! We missed you. Thanks for doing your part to make sure we had a great first day back. #UAbacktoschool",2020-09-08 12:33:27,,
7,2.0,,78.0,,1640468249460092,"Welcome Back, Cardinals! We are so happy to have students back on campus. Everyone did a great job this morning wearing a mask, staying 6 feet apart, and filling out the daily screening form. Let’s have a GREAT DAY AT UA! #UAbacktoschool #finally #weareUA #goCardinals",,,0.0,"Welcome Back, Cardinals! We are so happy to have students back on campus. Everyone did a great job this morning wearing a mask, staying 6 feet apart, and filling out the daily screening form. Let’s have a GREAT DAY AT UA! #UAbacktoschool #finally #weareUA #goCardinals",2020-09-08 08:59:51,https://video-atl3-1.xx.fbcdn.net/v/t42.9040-2/118940020_626855194925257_456227858075672565_n.mp4?_nc_cat=104&_nc_sid=985c63&efg=eyJ2ZW5jb2RlX3RhZyI6ImxlZ2FjeV9zZCJ9&_nc_ohc=OCG2x81JlHAAX-mdYEx&_nc_ht=video-atl3-1.xx&oh=cf582a307a52834962ebee223cb50ca0&oe=5F5EE5A0,
8,0.0,,39.0,,1637844119722505,"Today is a VERY special day! Students are returning to campus for in-person instruction for the first time since March. Whether you are on campus this week, will return next week, or will continue to learn from home, you are an important part of the UA community. #UAbacktoschool #finally #weareUA",,,0.0,"Today is a VERY special day! Students are returning to campus for in-person instruction for the first time since March. Whether you are on campus this week, will return next week, or will continue to learn from home, you are an important part of the UA community. #UAbacktoschool #finally #weareUA",2020-09-08 08:00:04,https://video-atl3-1.xx.fbcdn.net/v/t42.9040-2/118706097_322684338943801_4442098066744993662_n.mp4?_nc_cat=105&_nc_sid=985c63&efg=eyJ2ZW5jb2RlX3RhZyI6ImxlZ2FjeV9zZCJ9&_nc_ohc=mG3pGY3W3WIAX8tJyNk&_nc_ht=video-atl3-1.xx&oh=d795f5c11d18c2812d347c6c46995948&oe=5F5EE66B,
9,0.0,,17.0,,1637832583056992,We can’t wait to see some of our Cardinals tomorrow! Please review the guidelines with your students before coming to campus. And don’t forget to complete the Daily Screening Form PRIOR to your arrival on campus.,,,0.0,We can’t wait to see some of our Cardinals tomorrow! Please review the guidelines with your students before coming to campus. And don’t forget to complete the Daily Screening Form PRIOR to your arrival on campus.,2020-09-07 18:00:26,https://video-atl3-1.xx.fbcdn.net/v/t42.9040-2/118937189_249572102880099_1880298225527097259_n.mp4?_nc_cat=103&_nc_sid=985c63&efg=eyJ2ZW5jb2RlX3RhZyI6ImxlZ2FjeV9zZCJ9&_nc_ohc=h3-hQPKhTewAX9_jyR0&_nc_ht=video-atl3-1.xx&oh=b3f6d771acb3a349272b449c419e4582&oe=5F5EE529,
10,0.0,https://scontent-atl3-1.xx.fbcdn.net/v/t1.0-9/fr/cp0/e15/q65/118822994_1637828969724020_2343290041145324195_n.jpg?_nc_cat=101&_nc_sid=8024bb&_nc_ohc=4J0m6ddjPJcAX-6u60D&_nc_ht=scontent-atl3-1.xx&tp=14&oh=8c121093f2bfdccf96c532007fd20138&oe=5F85DA48,18.0,https://www.unionacademy.org/apps/news/article/696054,1637829016390682,"The latest edition of News from the Nest is available on the UA webpage. Please also check your email for important reminders regarding our return to campus on Tuesday.

News from the Nest
https://www.unionacademy.org/apps/news/article/696054

Return to Campus Info
https://www.unionacademy.org/apps/pages/showallnews",https://facebook.com/story.php?story_fbid=1637829016390682&id=476331569207105,,0.0,"The latest edition of News from the Nest is available on the UA webpage. Please also check your email for important reminders regarding our return to campus on Tuesday.

News from the Nest
https://www.unionacademy.org/apps/news/article/696054

Return to Campus Info
https://www.unionacademy.org/apps/pages/showallnews",2020-09-05 14:14:59,,
11,1.0,,34.0,,1635639903276260,Welcome to the weekend! We can’t wait to see some of our Cardinals on campus Tuesday. #UAbacktoschool #letsdothis,,,0.0,Welcome to the weekend! We can’t wait to see some of our Cardinals on campus Tuesday. #UAbacktoschool #letsdothis,2020-09-04 08:00:45,https://video-atl3-1.xx.fbcdn.net/v/t42.9040-2/118829481_348663649873502_1446745604636869791_n.mp4?_nc_cat=103&_nc_sid=985c63&efg=eyJ2ZW5jb2RlX3RhZyI6ImxlZ2FjeV9zZCJ9&_nc_ohc=ZNLdlBkD3nYAX-Bf0He&_nc_ht=video-atl3-1.xx&oh=15730a0312273f3ab6e6f6136552378a&oe=5F5EE4D6,
12,1.0,https://scontent-atl3-1.xx.fbcdn.net/v/t1.0-9/fr/cp0/e15/q65/118563049_1636015776572006_5882674466708944834_o.jpg?_nc_cat=107&_nc_sid=9e2e56&_nc_ohc=E5yGPHW9HrQAX9yz075&_nc_ht=scontent-atl3-1.xx&tp=14&oh=556d80e53549d5a67d74d5c8e55df011&oe=5F857EE8,55.0,,1636015963238654,Thank you SO much to all the families who came out to spread mulch around the school this week on a hot humid night. Your willingness to beautify our campus is greatly appreciated. We love seeing our students take ownership in their school. #UAcommunity #UAbacktoschool #serveothers,https://facebook.com/story.php?story_fbid=1636015963238654&id=476331569207105,,0.0,Thank you SO much to all the families who came out to spread mulch around the school this week on a hot humid night. Your willingness to beautify our campus is greatly appreciated. We love seeing our students take ownership in their school. #UAcommunity #UAbacktoschool #serveothers,2020-09-03 17:08:23,,
13,7.0,https://scontent-atl3-1.xx.fbcdn.net/v/t1.0-9/fr/cp0/e15/q65/118590176_1635883999918517_9013057377230163935_o.jpg?_nc_cat=104&_nc_sid=9e2e56&_nc_ohc=zwpfzrdbWBQAX9G_5Q0&_nc_oc=AQkGUChDiHe-J097eL7dzYpA3aO22ULdl2k_2dw5TpL5exnjPmkUNNoLMbBrogyO9m4&_nc_ht=scontent-atl3-1.xx&tp=14&oh=e22447443ffddf48d199dc8f0ab262a0&oe=5F849D7F,72.0,,1635884049918512,"The Hospitality Team recruited parents and students to create posters, cards, and special treats for teachers and staff to kick off our return to campus next week. We appreciate our UA families! #UAcommunity #weareUA #UAbacktoschool",https://facebook.com/story.php?story_fbid=1635884049918512&id=476331569207105,,0.0,"The Hospitality Team recruited parents and students to create posters, cards, and special treats for teachers and staff to kick off our return to campus next week. We appreciate our UA families! #UAcommunity #weareUA #UAbacktoschool",2020-09-03 13:45:10,,
14,32.0,,206.0,https://www.unionacademy.org/apps/news/article/1288884,1635800053260245,"Families and visitors to Union Academy now enter between two beautiful new planters on either side of the main entrance courtesy of senior, Walker Hudson. The project is one of the last requirements Walker is completing to officially become an Eagle Scout.

https://www.unionacademy.org/apps/news/article/1288884",https://facebook.com/story.php?story_fbid=1635800053260245&id=476331569207105,,0.0,"Families and visitors to Union Academy now enter between two beautiful new planters on either side of the main entrance courtesy of senior, Walker Hudson. The project is one of the last requirements Walker is completing to officially become an Eagle Scout.

https://www.unionacademy.org/apps/news/article/1288884",2020-09-03 12:13:08,,
15,1.0,,23.0,,1635078569999060,"Happy Thursday, Cardinals. The long weekend is almost here! #weareua",,,0.0,"Happy Thursday, Cardinals. The long weekend is almost here! #weareua",2020-09-03 08:00:10,https://video-atl3-1.xx.fbcdn.net/v/t42.9040-2/118500166_664865680809448_111654957767309127_n.mp4?_nc_cat=106&_nc_sid=985c63&efg=eyJ2ZW5jb2RlX3RhZyI6ImxlZ2FjeV9zZCJ9&_nc_ohc=reYddu7eU94AX8ghGdd&_nc_ht=video-atl3-1.xx&oh=caf49a033b2b58ab4f17c8a51d7b5cc9&oe=5F5EDE3C,
16,0.0,,15.0,https://www.unionacademy.org/apps/pages/msacademics,1634949753345275,"Middle School Parents (5-8): A VERY important message has been added to the Grades 5-8 Academics page. It is at the top of the page titled ""Important MS Parent Information Letter 9.2.20.""
https://www.unionacademy.org/apps/pages/msacademics

Our blackboard system is currently down so you will not receive an email. Please share this with other MS families.",https://facebook.com/story.php?story_fbid=1634949753345275&id=476331569207105,"UNIONACADEMY.ORG
Grades 5 - 8 - Academics - Union Academy Charter School",10.0,"Middle School Parents (5-8): A VERY important message has been added to the Grades 5-8 Academics page. It is at the top of the page titled ""Important MS Parent Information Letter 9.2.20.""
https://www.unionacademy.org/apps/pages/msacademics

Our blackboard system is currently down so you will not receive an email. Please share this with other MS families.

UNIONACADEMY.ORG
Grades 5 - 8 - Academics - Union Academy Charter School",2020-09-02 15:46:02,,
17,0.0,,6.0,https://www.unionacademy.org/apps/news/article/696054,1634873396686244,"We are still accepting Pledge of Allegiance videos from our Cardinals and Shout Outs to our fantastic staff. Both links are available in News from the Nest. Send yours in today!
https://www.unionacademy.org/apps/news/article/696054",https://facebook.com/story.php?story_fbid=1634873396686244&id=476331569207105,,0.0,"We are still accepting Pledge of Allegiance videos from our Cardinals and Shout Outs to our fantastic staff. Both links are available in News from the Nest. Send yours in today!
https://www.unionacademy.org/apps/news/article/696054",2020-09-02 13:50:45,,
18,0.0,https://scontent-atl3-1.xx.fbcdn.net/v/t1.0-9/fr/cp0/e15/q65/118702657_1634822036691380_8562674702363296494_o.jpg?_nc_cat=108&_nc_sid=9e2e56&_nc_ohc=dHmNy6EugegAX9YU9jT&_nc_ht=scontent-atl3-1.xx&tp=14&oh=7d040a8d61a7d195e4ea7375b310cc57&oe=5F845D59,48.0,,1634822073358043,It was a beautiful morning for our first Coffee with the Head of School. #meetmrmarshall,https://facebook.com/story.php?story_fbid=1634822073358043&id=476331569207105,,0.0,It was a beautiful morning for our first Coffee with the Head of School. #meetmrmarshall,2020-09-02 12:33:41,,
19,2.0,,36.0,,1634000533440197,"“Anybody can be great because anybody can serve.” This quote by Dr. Martin Luther King, Jr. is one Mrs. Rushing makes sure her students understand. Go be great, Cardinals!",,,0.0,"“Anybody can be great because anybody can serve.” This quote by Dr. Martin Luther King, Jr. is one Mrs. Rushing makes sure her students understand. Go be great, Cardinals!",2020-09-02 08:00:46,https://video-atl3-1.xx.fbcdn.net/v/t42.9040-2/118382974_3280349332011683_7228688350127062391_n.mp4?_nc_cat=100&_nc_sid=985c63&efg=eyJ2ZW5jb2RlX3RhZyI6ImxlZ2FjeV9zZCJ9&_nc_ohc=gfnDSorSSb0AX82qPSr&_nc_ht=video-atl3-1.xx&oh=c9122cde51cbbdc874c53dd7d9836256&oe=5F5EDF56,
20,0.0,https://scontent-atl3-1.xx.fbcdn.net/v/t1.0-9/fr/cp0/e15/q65/118725448_1634007780106139_4228739601464744680_o.jpg?_nc_cat=101&_nc_sid=8024bb&_nc_ohc=0jjw0YLdJPEAX_A7xbR&_nc_ht=scontent-atl3-1.xx&tp=14&oh=9daba189ab2bea41679974361edea69a&oe=5F860CC7,5.0,,1634009876772596,Yearbooks are on sale NOW! Order by September 18 and save $10. Contact zzander@unionacademy.org if you have any questions.,https://facebook.com/story.php?story_fbid=1634009876772596&id=476331569207105,,0.0,Yearbooks are on sale NOW! Order by September 18 and save $10. Contact zzander@unionacademy.org if you have any questions.,2020-09-01 20:00:02,,
21,0.0,https://scontent-atl3-1.xx.fbcdn.net/v/t1.0-9/fr/cp0/e15/q65/118593987_1634004976773086_3379426132821998198_o.jpg?_nc_cat=107&_nc_sid=8024bb&_nc_ohc=mmonydZpTzUAX93mAX3&_nc_ht=scontent-atl3-1.xx&tp=14&oh=d5aa6e063e020fd4cfa80eab84535ced&oe=5F83F5F9,22.0,https://www.unionacademy.org/apps/pages/media,1634007273439523,"Don't forget to request your library books by Thursday morning at 9 a.m. You could be our next UA Prize Pack WINNER!

Students will request books on the Media Services page link. There is a video to watch that explains the process of requesting a book as well. During this time, students can drop off a book that was checked out previously.

K-4: Please make sure that you have filled out the Media Center User Agreement (found on the Media Services webpage).
5-12: Please fill out the Media Center User Agreement and bring with you for your first pick up or drop off of a book.
All of this information is located on the Media Services page- https://www.unionacademy.org/apps/pages/media

*Remember if you have a book out from last year, you can turn it in, replace it, or pay for it through My Payments Plus. These books will need to be turned in or paid for before you are able to check another one out.

We look forward to seeing you and helping you find the right book for you!",https://facebook.com/story.php?story_fbid=1634007273439523&id=476331569207105,,0.0,"Don't forget to request your library books by Thursday morning at 9 a.m. You could be our next UA Prize Pack WINNER!

Students will request books on the Media Services page link. There is a video to watch that explains the process of requesting a book as well. During this time, students can drop off a book that was checked out previously.

K-4: Please make sure that you have filled out the Media Center User Agreement (found on the Media Services webpage).
5-12: Please fill out the Media Center User Agreement and bring with you for your first pick up or drop off of a book.
All of this information is located on the Media Services page- https://www.unionacademy.org/apps/pages/media

*Remember if you have a book out from last year, you can turn it in, replace it, or pay for it through My Payments Plus. These books will need to be turned in or paid for before you are able to check another one out.

We look forward to seeing you and helping you find the right book for you!",2020-09-01 18:15:59,,
22,2.0,,28.0,https://www.unionacademy.org/apps/pages/showallnews,1633956696777914,"UA begins Plan B (Hybrid/Remote) on Tuesday, September 1. An email was sent today with several links explaining the procedures everyone will follow to keep us all as safe as possible. Please take time to watch the video from Mr. Marshall and review the guidelines with your students BEFORE they come to campus. The information is posted on our website for future reference. We can’t wait to see our Cardinals back at school!
https://www.unionacademy.org/apps/pages/showallnews",,,0.0,"UA begins Plan B (Hybrid/Remote) on Tuesday, September 1. An email was sent today with several links explaining the procedures everyone will follow to keep us all as safe as possible. Please take time to watch the video from Mr. Marshall and review the guidelines with your students BEFORE they come to campus. The information is posted on our website for future reference. We can’t wait to see our Cardinals back at school!
https://www.unionacademy.org/apps/pages/showallnews",2020-09-01 16:51:51,https://video-atl3-1.xx.fbcdn.net/v/t42.9040-2/118393995_633906040890151_1978395364038815716_n.mp4?_nc_cat=107&_nc_sid=985c63&efg=eyJ2ZW5jb2RlX3RhZyI6ImxlZ2FjeV9zZCJ9&_nc_ohc=Fl2DHGcMof8AX8scqdl&_nc_ht=video-atl3-1.xx&oh=c43b80a85d8fd400d35cd04b37946fca&oe=5F5EE4A5,
23,0.0,,43.0,,1633088290198088,Today’s featured speaker is Coach Frashier who reminds us to “Do the right thing even when no one is looking.”,,,0.0,Today’s featured speaker is Coach Frashier who reminds us to “Do the right thing even when no one is looking.”,2020-09-01 08:00:25,https://video-atl3-1.xx.fbcdn.net/v/t42.9040-2/118696727_340540937082380_7172014682836097988_n.mp4?_nc_cat=110&_nc_sid=985c63&efg=eyJ2ZW5jb2RlX3RhZyI6ImxlZ2FjeV9zZCJ9&_nc_ohc=Jx8joaWOv0sAX9qyotU&_nc_ht=video-atl3-1.xx&oh=e3c32e6d180d3964d254f2729042034a&oe=5F5EEA56,
24,4.0,,35.0,,1633102033530047,"K-4 Creative Core students got the chance to unplug and get outdoors! Using their ""nature eyes"" future Botanists, Zoologists and Environmental Engineers were asked to submit examples of what they discovered or created while exploring the outdoors. Join STEM student Zachary as he hosts a scientific journey through his garden. Great job, Zachary! #futurebotanist #getunplugged",,,0.0,"K-4 Creative Core students got the chance to unplug and get outdoors! Using their ""nature eyes"" future Botanists, Zoologists and Environmental Engineers were asked to submit examples of what they discovered or created while exploring the outdoors. Join STEM student Zachary as he hosts a scientific journey through his garden. Great job, Zachary! #futurebotanist #getunplugged",2020-08-31 20:08:25,https://video-atl3-1.xx.fbcdn.net/v/t42.9040-2/117736299_629205021114392_8718283739256217261_n.mp4?_nc_cat=107&_nc_sid=985c63&efg=eyJ2ZW5jb2RlX3RhZyI6ImxlZ2FjeV9zZCJ9&_nc_ohc=GQunIJlo38gAX-c_adt&_nc_ht=video-atl3-1.xx&oh=7173f3222b3da40295f864817b03a94a&oe=5F5EE7AB,
25,2.0,,15.0,https://www.mypaymentsplus.com/welcome,1632639320242985,"NEW FAMILIES!!! If you have not ordered your car tag, please do so by Wednesday, September 2. Tags will be available for pick-up Thursday, September 3 from 11am-1pm in the North Lot. You MUST have a tag to pick-up in afternoon carpool. Contact cnash@unionacademy.org if you have any questions.
https://www.mypaymentsplus.com/welcome",https://facebook.com/story.php?story_fbid=1632639320242985&id=476331569207105,,0.0,"NEW FAMILIES!!! If you have not ordered your car tag, please do so by Wednesday, September 2. Tags will be available for pick-up Thursday, September 3 from 11am-1pm in the North Lot. You MUST have a tag to pick-up in afternoon carpool. Contact cnash@unionacademy.org if you have any questions.
https://www.mypaymentsplus.com/welcome",2020-08-31 08:45:15,,
26,0.0,,34.0,,1632627470244170,Happy Monday! High school students start their new zoom class schedule this morning. Wake up kids! #weareua,,,0.0,Happy Monday! High school students start their new zoom class schedule this morning. Wake up kids! #weareua,2020-08-31 08:27:05,https://video-atl3-1.xx.fbcdn.net/v/t42.9040-2/118265479_638508586637431_3239535432135795886_n.mp4?_nc_cat=108&_nc_sid=985c63&efg=eyJ2ZW5jb2RlX3RhZyI6ImxlZ2FjeV9zZCJ9&_nc_ohc=ptgz8EI9mK0AX-8fmXd&_nc_ht=video-atl3-1.xx&oh=f2d1907d2e43b98203f6baf71c8a6aef&oe=5F5EE6C1,
27,11.0,https://scontent-atl3-1.xx.fbcdn.net/v/t1.0-9/fr/cp0/e15/q65/118650622_1631961016977482_9154034799335259116_o.jpg?_nc_cat=104&_nc_sid=8024bb&_nc_ohc=s7QIOVEAPKMAX8PEKlA&_nc_ht=scontent-atl3-1.xx&tp=14&oh=fb815a7bc17fb30686e9a4fcde00d8a4&oe=5F8509B9,68.0,,1631948660312051,,https://facebook.com/story.php?story_fbid=1631948660312051&id=476331569207105,,0.0,,2020-08-30 20:00:32,,
28,57.0,https://scontent-atl3-1.xx.fbcdn.net/v/t1.0-9/fr/cp0/e15/q65/118402316_1630116617161922_5784680400988218327_n.jpg?_nc_cat=110&_nc_sid=9e2e56&_nc_ohc=GHXQCj615Q0AX_AUBHp&_nc_ht=scontent-atl3-1.xx&tp=14&oh=bef62ea324d3bfd03fa9923f1e1fb00c&oe=5F85649C,180.0,,1630116710495246,"6th grade teacher, Ms. Hoiten, is in the Army National Guard and just completed two weeks of annual training for the year. She was recognized by a two star general for accomplishing her military mission while maintaining her teaching position at UA. “They said I worked above and beyond to fulfill my mission, doing whatever was asked while both in our JTF setup and on the ranges at Camp Butner this week. I have been working early mornings and many late nights keeping up with my school work,” said Ms. Hoiten. Thank you for serving our country AND being a fantastic teacher and role model. #armystrong #UAteacher #dedication #armynationalguard",https://facebook.com/story.php?story_fbid=1630116710495246&id=476331569207105,,0.0,"6th grade teacher, Ms. Hoiten, is in the Army National Guard and just completed two weeks of annual training for the year. She was recognized by a two star general for accomplishing her military mission while maintaining her teaching position at UA. “They said I worked above and beyond to fulfill my mission, doing whatever was asked while both in our JTF setup and on the ranges at Camp Butner this week. I have been working early mornings and many late nights keeping up with my school work,” said Ms. Hoiten. Thank you for serving our country AND being a fantastic teacher and role model. #armystrong #UAteacher #dedication #armynationalguard",2020-08-28 21:53:16,,
29,0.0,,14.0,https://youtu.be/RKJPUpGuSwA,1629995347174049,"Are you interested in joining the band? It’s a fun way to learn to play an instrument and make new friends. Contact sstevens@unionacademy.org for more info.

https://youtu.be/RKJPUpGuSwA",https://facebook.com/story.php?story_fbid=1629995347174049&id=476331569207105,"YOUTUBE.COM
UA Band Promo 2020",4.0,"Are you interested in joining the band? It’s a fun way to learn to play an instrument and make new friends. Contact sstevens@unionacademy.org for more info.

https://youtu.be/RKJPUpGuSwA

YOUTUBE.COM
UA Band Promo 2020",2020-08-28 18:43:08,,
