,comments,image,likes,link,post_id,post_text,post_url,shared_text,shares,text,time,video,video_thumbnail
96,23.0,https://scontent-atl3-1.xx.fbcdn.net/v/t1.0-9/fr/cp0/e15/q65/111160951_1594218964085021_8090807384534872472_o.jpg?_nc_cat=107&_nc_sid=8024bb&_nc_ohc=tVODeisdTdYAX9F6HSx&_nc_oc=AQmjAV4byGPJCYJKdEI5TZaK8Fx8QDxktnMPBMtw__1dD0GAT7-ILRQg3Mvu-5gjBY8&_nc_ht=scontent-atl3-1.xx&tp=14&oh=077588cb84094ab3b30fa960dd3e1338&oe=5F82A6A8,35.0,https://docs.google.com/document/d/1RJc7t02lgh9UfRScOcgA1d48SrgkyW3SsXZSMJC2ALY/edit?usp=sharing,1594220064084911,"All families have been emailed a letter from Mr. Marshall outlining in detail UA's Plan B for Hybrid/Remote learning which begins August 24. Once you have carefully read the plan and decided what works best for your family, please complete the Plan B Survey located in the letter for EACH of your UA students. We ask that the survey be completed for every student by July 31, so we can plan accordingly. The link to the letter is also located below.
https://docs.google.com/document/d/1RJc7t02lgh9UfRScOcgA1d48SrgkyW3SsXZSMJC2ALY/edit?usp=sharing",https://facebook.com/story.php?story_fbid=1594220064084911&id=476331569207105,,0.0,"All families have been emailed a letter from Mr. Marshall outlining in detail UA's Plan B for Hybrid/Remote learning which begins August 24. Once you have carefully read the plan and decided what works best for your family, please complete the Plan B Survey located in the letter for EACH of your UA students. We ask that the survey be completed for every student by July 31, so we can plan accordingly. The link to the letter is also located below.
https://docs.google.com/document/d/1RJc7t02lgh9UfRScOcgA1d48SrgkyW3SsXZSMJC2ALY/edit?usp=sharing",2020-07-21 18:44:03,,
97,0.0,,15.0,https://www.unionacademy.org/apps/news/article/1258764,1594173354089582,"The inaugural issue of Cardinal Courier has been mailed to all UA families. It should arrive in your mailbox this week. You can also view it on the UA webpage. https://www.unionacademy.org/apps/news/article/1258764

UA's biweekly News from the Nest will resume online very soon to keep you posted on UA events.",https://facebook.com/story.php?story_fbid=1594173354089582&id=476331569207105,"UNIONACADEMY.ORG
Cardinal Courier (Mailer)",0.0,"The inaugural issue of Cardinal Courier has been mailed to all UA families. It should arrive in your mailbox this week. You can also view it on the UA webpage. https://www.unionacademy.org/apps/news/article/1258764

UA's biweekly News from the Nest will resume online very soon to keep you posted on UA events.

UNIONACADEMY.ORG
Cardinal Courier (Mailer)",2020-07-21 15:27:35,,
98,13.0,,64.0,https://www.unionacademy.org/apps/news/article/1258323,1593400837500167,"Community service is an important part of Union Academy's mission, but Beth Rushing takes volunteering to another level. Many of you know Mrs. Rushing and love that she gives students the opportunity to serve at the Community Shelter of Union County and Brookdale Union. She never asks for recognition and finding pictures of her volunteering was close to impossible because she is too busy serving or teaching a life skill to her students. Take a few minutes to read the article on our webpage to learn more about Mrs. Rushing's amazing heart for her community and her students. Thank you for all you do, Beth Rushing!
https://www.unionacademy.org/apps/news/article/1258323",https://facebook.com/story.php?story_fbid=1593400837500167&id=476331569207105,"UNIONACADEMY.ORG
Beth Rushing Teaches Students Through Service to Others",14.0,"Community service is an important part of Union Academy's mission, but Beth Rushing takes volunteering to another level. Many of you know Mrs. Rushing and love that she gives students the opportunity to serve at the Community Shelter of Union County and Brookdale Union. She never asks for recognition and finding pictures of her volunteering was close to impossible because she is too busy serving or teaching a life skill to her students. Take a few minutes to read the article on our webpage to learn more about Mrs. Rushing's amazing heart for her community and her students. Thank you for all you do, Beth Rushing!
https://www.unionacademy.org/apps/news/article/1258323

UNIONACADEMY.ORG
Beth Rushing Teaches Students Through Service to Others",2020-07-20 19:14:01,,
99,2.0,https://scontent-atl3-1.xx.fbcdn.net/v/t1.0-9/fr/cp0/e15/q65/108236534_1590736661099918_6901734551737803044_o.jpg?_nc_cat=102&_nc_sid=9e2e56&_nc_ohc=pVShzUg_gokAX8eiL00&_nc_ht=scontent-atl3-1.xx&tp=14&oh=bec27078d961a4fa3435307e7a7b779b&oe=5F852EE1,51.0,,1590736841099900,"10th grader, Ava Myers, collected donations for the Union County Animal Shelter and delivered them today! Ava’s service not only allowed her to help one of her favorite causes, she also gave others the opportunity to get involved as well. Great job! How are YOU serving? Share your pictures and community service with us. #CardinalsCare",https://facebook.com/story.php?story_fbid=1590736841099900&id=476331569207105,,0.0,"10th grader, Ava Myers, collected donations for the Union County Animal Shelter and delivered them today! Ava’s service not only allowed her to help one of her favorite causes, she also gave others the opportunity to get involved as well. Great job! How are YOU serving? Share your pictures and community service with us. #CardinalsCare",2020-07-17 18:26:30,,
100,0.0,https://scontent-atl3-1.xx.fbcdn.net/v/t1.0-9/fr/cp0/e15/q65/110159172_1590669561106628_5891197227082960849_n.jpg?_nc_cat=104&_nc_sid=8024bb&_nc_ohc=I1K-a4lxqlUAX-RkmF7&_nc_ht=scontent-atl3-1.xx&tp=14&oh=90a1b546bea6de36c1eff2c54ee61bf0&oe=5F848473,29.0,https://www.unionacademy.org/,1590669847773266,"An email from Mr. Marshall was sent to all UA Families. It can also be found on the UA webpage.

https://www.unionacademy.org/

The Friday Update link was included in the email from Mr. Marshall and has been posted on the UA webpage.

https://www.unionacademy.org/apps/pages/showallnews",https://facebook.com/story.php?story_fbid=1590669847773266&id=476331569207105,,0.0,"An email from Mr. Marshall was sent to all UA Families. It can also be found on the UA webpage.

https://www.unionacademy.org/

The Friday Update link was included in the email from Mr. Marshall and has been posted on the UA webpage.

https://www.unionacademy.org/apps/pages/showallnews",2020-07-17 16:30:12,,
101,20.0,https://scontent-atl3-1.xx.fbcdn.net/v/t1.0-9/fr/cp0/e15/q65/108182574_1589900784516839_5831814425133899526_o.jpg?_nc_cat=100&_nc_sid=9e2e56&_nc_ohc=y5bujsJKDvoAX_0e7EQ&_nc_ht=scontent-atl3-1.xx&tp=14&oh=c460b4223a6f5e6245833df6f57d65b1&oe=5F843286,177.0,,1589901014516816,Our new Cardinals are ready to tackle kindergarten! Welcome to UA! #classof2033,https://facebook.com/story.php?story_fbid=1589901014516816&id=476331569207105,,0.0,Our new Cardinals are ready to tackle kindergarten! Welcome to UA! #classof2033,2020-07-16 21:48:23,,
102,8.0,https://scontent-atl3-1.xx.fbcdn.net/v/t1.0-9/fr/cp0/e15/q65/109152398_1589661531207431_7955491607743403592_o.jpg?_nc_cat=108&_nc_sid=8024bb&_nc_ohc=1VYrHZvj9h0AX887Jfx&_nc_ht=scontent-atl3-1.xx&tp=14&oh=1f003763cc434054aa5c10efdd522523&oe=5F82F2C2,124.0,https://www.unionacademy.org/apps/news/article/1257120,1589664427873808,"The Charlotte Business Journal ranked Union Academy the #1 Healthiest Employer of Greater Charlotte in the 100-499 employees category. The Healthiest Employers of Greater Charlotte Awards highlights local companies that are making strides in terms of wellness programs for their workers. Congratulations specifically to CFO Lynn Kroeger, Human Resources Associate Peggy Covington, School Nurse Paige Harriott, and Adminstrative Assistant Cheyanne Nash for their hard work building the program and submitting the documentation for the award.

https://www.unionacademy.org/apps/news/article/1257120",https://facebook.com/story.php?story_fbid=1589664427873808&id=476331569207105,,0.0,"The Charlotte Business Journal ranked Union Academy the #1 Healthiest Employer of Greater Charlotte in the 100-499 employees category. The Healthiest Employers of Greater Charlotte Awards highlights local companies that are making strides in terms of wellness programs for their workers. Congratulations specifically to CFO Lynn Kroeger, Human Resources Associate Peggy Covington, School Nurse Paige Harriott, and Adminstrative Assistant Cheyanne Nash for their hard work building the program and submitting the documentation for the award.

https://www.unionacademy.org/apps/news/article/1257120",2020-07-16 16:06:51,,
103,27.0,,63.0,,1588659401307644,"Yesterday, Governor Cooper announced NC schools would move to Plan B to reopen schools in August. Mr. Marshall has prepared a video message and statement regarding UA's preliminary plan to have UA students return to campus. More information and a survey to get parent input will be forthcoming.",,,0.0,"Yesterday, Governor Cooper announced NC schools would move to Plan B to reopen schools in August. Mr. Marshall has prepared a video message and statement regarding UA's preliminary plan to have UA students return to campus. More information and a survey to get parent input will be forthcoming.",2020-07-15 13:43:09,https://video-atl3-1.xx.fbcdn.net/v/t42.9040-2/108184273_2368076496820104_8199121947779617492_n.mp4?_nc_cat=111&_nc_sid=985c63&efg=eyJ2ZW5jb2RlX3RhZyI6ImxlZ2FjeV9zZCJ9&_nc_ohc=ziQdu0agKXAAX-G9Gml&_nc_ht=video-atl3-1.xx&oh=95cbf85ce603d12fe3f808df4213ccad&oe=5F5EE491,
104,19.0,https://scontent-atl3-1.xx.fbcdn.net/v/t1.0-9/fr/cp0/e15/q65/109535229_1588493381324246_5308763200746700867_o.jpg?_nc_cat=100&_nc_sid=8024bb&_nc_ohc=zwh3TQcmjjAAX-4PuMc&_nc_ht=scontent-atl3-1.xx&tp=14&oh=b0a7a5a2e40d16c1aa251cec18cf6de6&oe=5F8295CB,130.0,https://www.unionacademy.org/apps/news/article/1256335,1588494811324103,"Congratulations to UA's FFA Meats Evaluation Team for placing FIRST at the state competition. Isaac Williams (1st) was the high scoring individual overall, followed by Gracie Williams (2nd overall), Cade Stegall (4th overall), and Kaleb Pope (6th overall). Even though the competition looked a little different this summer, the team continued to work hard to maintain their winning streak!
https://www.unionacademy.org/apps/news/article/1256335",https://facebook.com/story.php?story_fbid=1588494811324103&id=476331569207105,,0.0,"Congratulations to UA's FFA Meats Evaluation Team for placing FIRST at the state competition. Isaac Williams (1st) was the high scoring individual overall, followed by Gracie Williams (2nd overall), Cade Stegall (4th overall), and Kaleb Pope (6th overall). Even though the competition looked a little different this summer, the team continued to work hard to maintain their winning streak!
https://www.unionacademy.org/apps/news/article/1256335",2020-07-15 09:40:46,,
105,7.0,https://scontent-atl3-1.xx.fbcdn.net/v/t1.0-9/fr/cp0/e15/q65/109877449_1587870114719906_4539355544439247536_o.jpg?_nc_cat=109&_nc_sid=2d5d41&_nc_ohc=JaTBBRMNmIEAX9NudHy&_nc_ht=scontent-atl3-1.xx&tp=14&oh=a32a52c854087d32e96e1bad558faf4b&oe=5F83BD16,68.0,,1587870111386573,"Several UA students and an alumnus helped distribute groceries at the Community Shelter’s mobile pantry in partnership with Common Heart and Second Harvest. Thank you Aidon Love, RJ Baker, LeKayla Love, Laniyah Love, Savannah Helms, Lauren Munday, and Brooklyn Calkins. What are YOU doing to serve your community? #CardinalsCare Community Shelter of Union County",,,0.0,"Several UA students and an alumnus helped distribute groceries at the Community Shelter’s mobile pantry in partnership with Common Heart and Second Harvest. Thank you Aidon Love, RJ Baker, LeKayla Love, Laniyah Love, Savannah Helms, Lauren Munday, and Brooklyn Calkins. What are YOU doing to serve your community? #CardinalsCare Community Shelter of Union County",2020-07-14 18:09:57,,
106,1.0,https://scontent-atl3-1.xx.fbcdn.net/v/t1.0-9/fr/cp0/e15/q65/109120856_1587835711390013_6650552807368816482_n.jpg?_nc_cat=106&_nc_sid=8024bb&_nc_ohc=UUNQab0mJVAAX85WfEb&_nc_ht=scontent-atl3-1.xx&tp=14&oh=ff5f7c68212c778663e45ffefd4760d2&oe=5F848FE3,111.0,https://www.dpi.nc.gov/news/covid-19-response-resources/lighting-our-way-forward,1587844924722425,"The administrative team gathered this afternoon to discuss the governor's announcement that schools with a start date in August will reopen using Plan B from NC DPI: Lighting Our Way Forward. We are preparing an update from Mr. Marshall that will be shared with the UA community tomorrow.

For more information about the various plans, please click on the link https://www.dpi.nc.gov/news/covid-19-response-resources/lighting-our-way-forward.",https://facebook.com/story.php?story_fbid=1587844924722425&id=476331569207105,,0.0,"The administrative team gathered this afternoon to discuss the governor's announcement that schools with a start date in August will reopen using Plan B from NC DPI: Lighting Our Way Forward. We are preparing an update from Mr. Marshall that will be shared with the UA community tomorrow.

For more information about the various plans, please click on the link https://www.dpi.nc.gov/news/covid-19-response-resources/lighting-our-way-forward.",2020-07-14 17:29:25,,
107,0.0,https://scontent-atl3-1.xx.fbcdn.net/v/t1.0-9/fr/cp0/e15/q65/108178357_1583930728447178_7191847609437773430_o.jpg?_nc_cat=108&_nc_sid=8024bb&_nc_ohc=Op6SKTTvZQEAX-JeFB9&_nc_ht=scontent-atl3-1.xx&tp=14&oh=1ba6cfcd6e718ec0ae8c80b23314ec36&oe=5F82B6C5,24.0,https://docs.google.com/forms/d/e/1FAIpQLSetRHRLNsBm5Zrycmp5fpBw4Uq8koaF9cAzb1KimBE0JHl-tw/viewform,1583934501780134,"The 2020-21 Volunteer Magnet Contest is OPEN! Your magnet design could be the winner and be used as advertisement (and the Flip Game) on hundreds of cars. Since we're a little unsure about the upcoming school year, the requirements are different than in years past, so be sure to read the guidelines completely. Good luck and be CREATIVE!
https://docs.google.com/forms/d/e/1FAIpQLSetRHRLNsBm5Zrycmp5fpBw4Uq8koaF9cAzb1KimBE0JHl-tw/viewform",https://facebook.com/story.php?story_fbid=1583934501780134&id=476331569207105,,0.0,"The 2020-21 Volunteer Magnet Contest is OPEN! Your magnet design could be the winner and be used as advertisement (and the Flip Game) on hundreds of cars. Since we're a little unsure about the upcoming school year, the requirements are different than in years past, so be sure to read the guidelines completely. Good luck and be CREATIVE!
https://docs.google.com/forms/d/e/1FAIpQLSetRHRLNsBm5Zrycmp5fpBw4Uq8koaF9cAzb1KimBE0JHl-tw/viewform",2020-07-10 19:26:01,,
108,1.0,https://scontent-atl3-1.xx.fbcdn.net/v/t1.0-9/fr/cp0/e15/q65/107814394_1583991728441078_6805877591805906433_o.jpg?_nc_cat=110&_nc_sid=8024bb&_nc_ohc=rLP-7gt2yNAAX9TgV1o&_nc_ht=scontent-atl3-1.xx&tp=14&oh=8270ccd6438a713e0c6c7cb52a66e03c&oe=5F859039,8.0,https://www.mypaymentsplus.com/welcome,1583993568440894,"We still have two camps with open slots!!! Baseball and softball camps will be held the week of July 13 at Parks Williams. Non UA students are WELCOME to attend. Find a friend and register on MyPaymentsPlus (non UA students register as a guest). https://www.mypaymentsplus.com/welcome

Please bring your own glove, bat, and helmet (and mask for softball). Hand sanitizer will be provided. Email the coaches for each camp if you have additional questions.",https://facebook.com/story.php?story_fbid=1583993568440894&id=476331569207105,,0.0,"We still have two camps with open slots!!! Baseball and softball camps will be held the week of July 13 at Parks Williams. Non UA students are WELCOME to attend. Find a friend and register on MyPaymentsPlus (non UA students register as a guest). https://www.mypaymentsplus.com/welcome

Please bring your own glove, bat, and helmet (and mask for softball). Hand sanitizer will be provided. Email the coaches for each camp if you have additional questions.",2020-07-10 16:51:00,,
109,0.0,,21.0,https://www.unionacademy.org/apps/pages/showallnews,1583990885107829,"The Friday Reopening Update has been emailed to families and posted on the UA webpage. Have a great weekend!
https://www.unionacademy.org/apps/pages/showallnews",https://facebook.com/story.php?story_fbid=1583990885107829&id=476331569207105,"UNIONACADEMY.ORG
Show All News - Union Academy Charter School",2.0,"The Friday Reopening Update has been emailed to families and posted on the UA webpage. Have a great weekend!
https://www.unionacademy.org/apps/pages/showallnews

UNIONACADEMY.ORG
Show All News - Union Academy Charter School",2020-07-10 14:37:58,,
110,54.0,,117.0,https://www.unionacademy.org/apps/news/article/1254851,1583893495117568,"Congratulations to Katie Stewart, Director of Technology, who successfully graduated from the 2019-2020 Certified Government Chief Information Officers Program™ at the University of North Carolina at Chapel Hill’s School of Government.
https://www.unionacademy.org/apps/news/article/1254851",https://facebook.com/story.php?story_fbid=1583893495117568&id=476331569207105,"UNIONACADEMY.ORG
Stewart Graduates from UNC-CH School of Government",0.0,"Congratulations to Katie Stewart, Director of Technology, who successfully graduated from the 2019-2020 Certified Government Chief Information Officers Program™ at the University of North Carolina at Chapel Hill’s School of Government.
https://www.unionacademy.org/apps/news/article/1254851

UNIONACADEMY.ORG
Stewart Graduates from UNC-CH School of Government",2020-07-10 12:16:16,,
111,1.0,,23.0,http://www.unionacademy.org/,1583314368508814,"Union Academy Private PreKindergarten is OPENING August 3. There are a few slots still available. Enroll now at www.unionacademy.org.
For more information contact Janet Turner at jturner@unionacademy.org.",https://facebook.com/story.php?story_fbid=1583314368508814&id=476331569207105,"UNIONACADEMY.ORG
Union Academy Charter School",5.0,"Union Academy Private PreKindergarten is OPENING August 3. There are a few slots still available. Enroll now at www.unionacademy.org.
For more information contact Janet Turner at jturner@unionacademy.org.

UNIONACADEMY.ORG
Union Academy Charter School",2020-07-09 21:21:24,,
112,1.0,https://scontent-atl3-1.xx.fbcdn.net/v/t1.0-9/fr/cp0/e15/q65/106505687_10158193441983673_7718830818183153473_o.jpg?_nc_cat=108&_nc_sid=8024bb&_nc_ohc=bWma6EJRitQAX99Cv9G&_nc_ht=scontent-atl3-1.xx&tp=14&oh=5f39caa5b5a671585289fdd0ce75a47d&oe=5F837B82,6.0,,1583312458509005,This is a great opportunity to serve!,https://facebook.com/story.php?story_fbid=1583312458509005&id=476331569207105,"Community Shelter of Union County
July 7 at 3:40 PM ·

We’ve got lots of opportunities to provide meals in our dining hall.",4.0,"This is a great opportunity to serve!

Community Shelter of Union County
July 7 at 3:40 PM ·

We’ve got lots of opportunities to provide meals in our dining hall.",2020-07-09 21:18:38,,
113,8.0,https://scontent-atl3-1.xx.fbcdn.net/v/t1.0-9/fr/cp0/e15/q65/107719087_1582186535288264_7524146251098884633_o.jpg?_nc_cat=106&_nc_sid=9e2e56&_nc_ohc=Af9zSWdyHJgAX-ujlRD&_nc_ht=scontent-atl3-1.xx&tp=14&oh=21a878e3d4a1ba8c31322d4f6c68c573&oe=5F8371B7,102.0,,1582186991954885,The UA Athletics Department has been busy getting things ready for YOU! Check out the updates to The Nest! We can’t wait to have you back on campus. #wearyourmask #staysafe,https://facebook.com/story.php?story_fbid=1582186991954885&id=476331569207105,,0.0,The UA Athletics Department has been busy getting things ready for YOU! Check out the updates to The Nest! We can’t wait to have you back on campus. #wearyourmask #staysafe,2020-07-08 15:53:46,,
114,5.0,https://scontent-atl3-1.xx.fbcdn.net/v/t1.0-9/fr/cp0/e15/q65/107560602_1582167618623489_4202989352561573333_o.jpg?_nc_cat=107&_nc_sid=8024bb&_nc_ohc=AQtoe32NYvcAX_pHGwJ&_nc_ht=scontent-atl3-1.xx&tp=14&oh=bacd578c1093e96274489e5b2e279b75&oe=5F8455FB,10.0,,1582167911956793,Band camp scheduled for July 13-24 has been canceled. Please contact Mr. Hinson if you have any questions (shinson@unionacademy.org).,https://facebook.com/story.php?story_fbid=1582167911956793&id=476331569207105,,0.0,Band camp scheduled for July 13-24 has been canceled. Please contact Mr. Hinson if you have any questions (shinson@unionacademy.org).,2020-07-08 15:20:31,,
115,0.0,https://scontent-atl3-1.xx.fbcdn.net/v/t1.0-9/fr/cp0/e15/q65/107489890_1580310948809156_7525345566495944868_o.jpg?_nc_cat=100&_nc_sid=9e2e56&_nc_ohc=uAAkNUHQcjkAX_K3fjO&_nc_ht=scontent-atl3-1.xx&tp=14&oh=1cb93c22bfe410065d2f04a474a8e134&oe=5F83A9FF,35.0,,1580311048809146,Our high school students are finding ways to get back into the community and serve! Need some ideas? Contact Mrs. Watkins (awatkins@unionacademy.org). #CardinalsCare,https://facebook.com/story.php?story_fbid=1580311048809146&id=476331569207105,,0.0,Our high school students are finding ways to get back into the community and serve! Need some ideas? Contact Mrs. Watkins (awatkins@unionacademy.org). #CardinalsCare,2020-07-06 16:18:43,,
116,0.0,https://scontent-atl3-1.xx.fbcdn.net/v/t1.0-9/fr/cp0/e15/q65/107376576_1580119235494994_3523284294180123955_o.jpg?_nc_cat=102&_nc_sid=8024bb&_nc_ohc=Mp2n-xR4UO4AX_E8tmf&_nc_ht=scontent-atl3-1.xx&tp=14&oh=5af140a576822ddbc0ab197deb2a308e&oe=5F83ABA0,17.0,https://www.unionacademy.org/apps/pages/index.jsp?uREC_ID=734715&type=d&pREC_ID=1152860,1580120488828202,"The UA Athletic Clearinghouse paperwork for 2020-21 is on the UA Athletic website. The forms are all online and required for any student 6-12 who plans on participating in athletics. Please complete the forms following the directions that are also included on the website (links are midway down the page in the link below).

The athletic clearinghouse is for UA sponsored MS and HS sports NOT the UAA recreational league.

Even though we are unsure of what the fall will bring, completing the paperwork will make sure we are ready if we are able to move forward. (Let's think positively.)

https://www.unionacademy.org/apps/pages/index.jsp?uREC_ID=734715&type=d&pREC_ID=1152860",https://facebook.com/story.php?story_fbid=1580120488828202&id=476331569207105,,0.0,"The UA Athletic Clearinghouse paperwork for 2020-21 is on the UA Athletic website. The forms are all online and required for any student 6-12 who plans on participating in athletics. Please complete the forms following the directions that are also included on the website (links are midway down the page in the link below).

The athletic clearinghouse is for UA sponsored MS and HS sports NOT the UAA recreational league.

Even though we are unsure of what the fall will bring, completing the paperwork will make sure we are ready if we are able to move forward. (Let's think positively.)

https://www.unionacademy.org/apps/pages/index.jsp?uREC_ID=734715&type=d&pREC_ID=1152860",2020-07-06 11:33:35,,
117,19.0,https://scontent-atl3-1.xx.fbcdn.net/v/t1.0-9/fr/cp0/e15/q65/107012544_1579552438885007_8513302396552256756_o.jpg?_nc_cat=100&_nc_sid=9e2e56&_nc_ohc=-73Q9nbmtpwAX_Z3gK8&_nc_ht=scontent-atl3-1.xx&tp=14&oh=7fb981aeb477e2d36d4b3aee8f9d49fe&oe=5F8434A5,88.0,,1579552818884969,"Zaria Moser-Robinson (2015) graduated from North Carolina A&T State University in May 2020 with a degree in political science. Zaria was a member of the Political Science Society and served as secretary, and she also earned recognition on the Dean’s and Chancellor’s list several times. While attending NC A&T in Greensboro, Zaria volunteered at the Elimu Learning Center where she tutored high school students who are refugees, African American, or from other ethnic groups in the TRIAD region. She is working as an after school/summer camp teacher at the Dickerson Community Center in Monroe and plans to take the LSAT in February and apply to law school for the fall of 2021.",https://facebook.com/story.php?story_fbid=1579552818884969&id=476331569207105,,0.0,"Zaria Moser-Robinson (2015) graduated from North Carolina A&T State University in May 2020 with a degree in political science. Zaria was a member of the Political Science Society and served as secretary, and she also earned recognition on the Dean’s and Chancellor’s list several times. While attending NC A&T in Greensboro, Zaria volunteered at the Elimu Learning Center where she tutored high school students who are refugees, African American, or from other ethnic groups in the TRIAD region. She is working as an after school/summer camp teacher at the Dickerson Community Center in Monroe and plans to take the LSAT in February and apply to law school for the fall of 2021.",2020-07-05 18:34:12,,
118,5.0,,37.0,https://www.unionacademy.org/apps/news/article/1252833,1577164402457144,"An email was sent to all UA families regarding the School's reopening plan. You may also access it on our webpage. More information will be shared next week. Please complete the survey at the end of the letter, so we can began preparing to assist families with any technology requests.

Families new to UA will receive an email, also.

https://www.unionacademy.org/apps/news/article/1252833",https://facebook.com/story.php?story_fbid=1577164402457144&id=476331569207105,,0.0,"An email was sent to all UA families regarding the School's reopening plan. You may also access it on our webpage. More information will be shared next week. Please complete the survey at the end of the letter, so we can began preparing to assist families with any technology requests.

Families new to UA will receive an email, also.

https://www.unionacademy.org/apps/news/article/1252833",2020-07-03 09:15:44,,
