,comments,image,likes,link,post_id,post_text,post_url,shared_text,shares,text,time,video,video_thumbnail
0,2.0,,15.0,https://docs.google.com/document/d/15hMZjHR72pSVJIiDefnys8074GdQYr9wFEbMW-ForIM/edit?usp=sharing,1731660203649557,,https://facebook.com/story.php?story_fbid=1731660203649557&id=479010665581190,,180.0,,2020-07-03 16:00:59,,
1,0.0,,2.0,https://www.youtube.com/watch?v=Q90LVUYVWwo,1798781780270732,,https://facebook.com/story.php?story_fbid=1798781780270732&id=479010665581190,"YOUTUBE.COM
Lucky Bulldogs 9-11-2020",0.0,"YOUTUBE.COM
Lucky Bulldogs 9-11-2020",2020-09-11 15:51:37,,
2,0.0,,6.0,https://www.youtube.com/watch?v=UEU-Yr0HlvE,1798781470270763,,https://facebook.com/story.php?story_fbid=1798781470270763&id=479010665581190,"YOUTUBE.COM
VCSC Teacher Spotlight - Mrs. Vieck (CMS)",0.0,"YOUTUBE.COM
VCSC Teacher Spotlight - Mrs. Vieck (CMS)",2020-09-11 15:51:11,,
3,0.0,https://scontent-atl3-1.xx.fbcdn.net/v/t1.0-9/fr/cp0/e15/q65/119060223_1798733150275595_4292305033127736582_n.jpg?_nc_cat=102&_nc_sid=8024bb&_nc_ohc=4QLMxrnoilgAX8ExRWr&_nc_ht=scontent-atl3-1.xx&tp=14&oh=f0bd63f90b5f06ff253e697c67e9b1a9&oe=5F844A3E,83.0,,1798733510275559,We have no new cases and no active cases! Both of our active cases were released to resume school activities. Have a great weekend!,https://facebook.com/story.php?story_fbid=1798733510275559&id=479010665581190,,0.0,We have no new cases and no active cases! Both of our active cases were released to resume school activities. Have a great weekend!,2020-09-11 15:01:38,,
4,5.0,,7.0,https://www.youtube.com/watch?v=UEU-Yr0HlvE,1798731563609087,"VCSC Teacher Spotlight - Mrs. Vieck

VCSC Teacher Spotlight visits a different VCSC school each week to showcase the wonderful things that are happening in our classrooms. This week, we went to Clark Middle School and visited with Mrs. Vieck and her students.

https://www.youtube.com/watch?v=UEU-Yr0HlvE",https://facebook.com/story.php?story_fbid=1798731563609087&id=479010665581190,"YOUTUBE.COM
VCSC Teacher Spotlight - Mrs. Vieck (CMS)",5.0,"VCSC Teacher Spotlight - Mrs. Vieck

VCSC Teacher Spotlight visits a different VCSC school each week to showcase the wonderful things that are happening in our classrooms. This week, we went to Clark Middle School and visited with Mrs. Vieck and her students.

https://www.youtube.com/watch?v=UEU-Yr0HlvE

YOUTUBE.COM
VCSC Teacher Spotlight - Mrs. Vieck (CMS)",2020-09-11 14:45:08,,
5,0.0,,1.0,https://www.youtube.com/watch?v=0hKmOEenUEw,1797744143707829,,https://facebook.com/story.php?story_fbid=1797744143707829&id=479010665581190,"YOUTUBE.COM
CMS Students of the Week 9-10-2020",0.0,"YOUTUBE.COM
CMS Students of the Week 9-10-2020",2020-09-10 15:27:14,,
6,1.0,,1.0,https://www.youtube.com/watch?v=ki6TXTYmHOc,1797743673707876,,https://facebook.com/story.php?story_fbid=1797743673707876&id=479010665581190,"YOUTUBE.COM
Soaring Eagles 9-10-2020",0.0,"YOUTUBE.COM
Soaring Eagles 9-10-2020",2020-09-10 15:26:29,,
7,0.0,https://scontent-atl3-1.xx.fbcdn.net/v/t1.0-9/fr/cp0/e15/q65/118943578_1797681467047430_4277734852393252997_n.jpg?_nc_cat=107&_nc_sid=8024bb&_nc_ohc=239MbZAwLJ0AX9kD99m&_nc_ht=scontent-atl3-1.xx&tp=14&oh=f62a5a51de3afd544a24597683d485c0&oe=5F84B708,59.0,,1797681613714082,No new cases today!,https://facebook.com/story.php?story_fbid=1797681613714082&id=479010665581190,,0.0,No new cases today!,2020-09-10 15:01:41,,
8,0.0,,4.0,https://www.youtube.com/watch?v=S3TEyIF_Fhg,1796843393797904,,https://facebook.com/story.php?story_fbid=1796843393797904&id=479010665581190,"YOUTUBE.COM
Best Bens 9-9-2020",0.0,"YOUTUBE.COM
Best Bens 9-9-2020",2020-09-09 17:10:14,,
9,0.0,,1.0,https://www.youtube.com/watch?v=wzC_mIqgpyI,1796842840464626,,https://facebook.com/story.php?story_fbid=1796842840464626&id=479010665581190,"YOUTUBE.COM
What We Learned! 9-9-2020",0.0,"YOUTUBE.COM
What We Learned! 9-9-2020",2020-09-09 17:09:10,,
10,1.0,,6.0,https://www.youtube.com/watch?v=Zg5kRAzJk6I,1796842257131351,,https://facebook.com/story.php?story_fbid=1796842257131351&id=479010665581190,"YOUTUBE.COM
Alices of the Week 9-8-2020",0.0,"YOUTUBE.COM
Alices of the Week 9-8-2020",2020-09-09 17:08:09,,
11,0.0,https://scontent-atl3-1.xx.fbcdn.net/v/t1.0-9/fr/cp0/e15/q65/118842380_1796765670472343_6573612489826941944_n.jpg?_nc_cat=104&_nc_sid=110474&_nc_ohc=DPLTVbLAtNYAX87Kq8f&_nc_ht=scontent-atl3-1.xx&tp=14&oh=45dba5fa26cbe16e5524f3263879b4d4&oe=5F82A8C6,51.0,,1796765727139004,Now new cases today!,https://facebook.com/story.php?story_fbid=1796765727139004&id=479010665581190,,0.0,Now new cases today!,2020-09-09 14:56:34,,
12,0.0,,54.0,,1795801920568718,No new cases today.,https://facebook.com/story.php?story_fbid=1795801920568718&id=479010665581190,,0.0,No new cases today.,2020-09-08 14:58:50,,
13,1.0,,4.0,https://www.youtube.com/watch?v=l45c7fosgqI,1791953297620247,,https://facebook.com/story.php?story_fbid=1791953297620247&id=479010665581190,"YOUTUBE.COM
CMS Students of the Week 9-4-2020",0.0,"YOUTUBE.COM
CMS Students of the Week 9-4-2020",2020-09-04 16:10:45,,
14,1.0,,14.0,https://www.youtube.com/watch?v=zYcCyA2gpVU,1791920247623552,"VCSC Teacher Spotlight - Mrs. Kirchoff

VCSC Teacher Spotlight visits a different VCSC school each week to showcase the wonderful things that are happening in our classrooms. This week, we went to Franklin Elementary School and visited with Mrs. Kirchoff and her students.

https://www.youtube.com/watch?v=zYcCyA2gpVU",https://facebook.com/story.php?story_fbid=1791920247623552&id=479010665581190,"YOUTUBE.COM
VCSC Teacher Spotlight - Mrs. Kirchoff (Franklin)",9.0,"VCSC Teacher Spotlight - Mrs. Kirchoff

VCSC Teacher Spotlight visits a different VCSC school each week to showcase the wonderful things that are happening in our classrooms. This week, we went to Franklin Elementary School and visited with Mrs. Kirchoff and her students.

https://www.youtube.com/watch?v=zYcCyA2gpVU

YOUTUBE.COM
VCSC Teacher Spotlight - Mrs. Kirchoff (Franklin)",2020-09-04 15:12:34,,
15,0.0,https://scontent-atl3-1.xx.fbcdn.net/v/t1.0-9/fr/cp0/e15/q65/118616634_1791911050957805_7330574400924449258_n.jpg?_nc_cat=100&_nc_sid=110474&_nc_ohc=E3W-1UCIc-EAX_fU_V8&_nc_ht=scontent-atl3-1.xx&tp=14&oh=4e2df163a95b4fd250bf80a526601762&oe=5F84F7BB,33.0,,1791911304291113,No new cases today! Have a great weekend.,https://facebook.com/story.php?story_fbid=1791911304291113&id=479010665581190,,0.0,No new cases today! Have a great weekend.,2020-09-04 14:57:49,,
16,0.0,,1.0,https://www.youtube.com/watch?v=bgyynIzoOYM,1791851840963726,,https://facebook.com/story.php?story_fbid=1791851840963726&id=479010665581190,"YOUTUBE.COM
Lucky Bulldogs 9-4-2020",0.0,"YOUTUBE.COM
Lucky Bulldogs 9-4-2020",2020-09-04 13:33:54,,
17,0.0,,1.0,https://www.youtube.com/watch?v=xxgyqewkClE,1791851150963795,,https://facebook.com/story.php?story_fbid=1791851150963795&id=479010665581190,"YOUTUBE.COM
Soaring Eagles 9-3-2020",0.0,"YOUTUBE.COM
Soaring Eagles 9-3-2020",2020-09-04 13:32:56,,
18,0.0,https://scontent-atl3-1.xx.fbcdn.net/v/t1.0-9/118700605_635510987101705_449576728175555617_n.png?_nc_cat=102&_nc_sid=8024bb&_nc_ohc=PQ7FjnOj000AX95OGmz&_nc_ht=scontent-atl3-1.xx&oh=80576132c83cf46580c69911fefff77d&oe=5F84F79D,15.0,,1791237397691837,,https://facebook.com/story.php?story_fbid=1791237397691837&id=479010665581190,,0.0,,2020-09-03 22:03:17,,
19,2.0,https://scontent-atl3-1.xx.fbcdn.net/v/t1.0-9/fr/cp0/e15/q65/118516939_1790966264385617_3318906797767486300_o.jpg?_nc_cat=100&_nc_sid=110474&_nc_ohc=105naMPJi1QAX8VSWn5&_nc_ht=scontent-atl3-1.xx&tp=14&oh=8e4d1b875b3b224a6434b8d77c6e9778&oe=5F83CD8B,12.0,,1790966397718937,The VCSC has one new case to report today.,https://facebook.com/story.php?story_fbid=1790966397718937&id=479010665581190,,0.0,The VCSC has one new case to report today.,2020-09-03 14:59:24,,
20,0.0,,10.0,https://www.youtube.com/watch?v=eE8SKcuzY_A,1790051601143750,,https://facebook.com/story.php?story_fbid=1790051601143750&id=479010665581190,"YOUTUBE.COM
WLA Virtual Updates",0.0,"YOUTUBE.COM
WLA Virtual Updates",2020-09-02 15:33:14,,
21,0.0,,0.0,https://www.youtube.com/watch?v=l-cgjQk_8jk,1790048734477370,,https://facebook.com/story.php?story_fbid=1790048734477370&id=479010665581190,"YOUTUBE.COM
What We Learned! 9-2-2020",0.0,"YOUTUBE.COM
What We Learned! 9-2-2020",2020-09-02 15:28:36,,
22,1.0,,7.0,https://www.youtube.com/watch?v=ipTjZsfT4m8,1790047767810800,,https://facebook.com/story.php?story_fbid=1790047767810800&id=479010665581190,"YOUTUBE.COM
Best Bens 9-2-2020",0.0,"YOUTUBE.COM
Best Bens 9-2-2020",2020-09-02 15:27:07,,
23,3.0,https://scontent-atl3-1.xx.fbcdn.net/v/t1.0-9/fr/cp0/e15/q65/118579384_1789999731148937_782616955345463616_n.jpg?_nc_cat=110&_nc_sid=8024bb&_nc_ohc=lk_hJOQsnqwAX-KTi2D&_nc_ht=scontent-atl3-1.xx&tp=14&oh=04133b7863dbb42471cf3cb7c656465f&oe=5F82610B,59.0,,1789999934482250,No new cases today!,https://facebook.com/story.php?story_fbid=1789999934482250&id=479010665581190,,0.0,No new cases today!,2020-09-02 15:01:28,,
24,0.0,,2.0,https://www.instagram.com/vcscpics/,1789024757913101,"The VCSC has updated its Instagram page! We will be sharing all the things that are going on in the VCSC, through pictures. We cant wait to share it all with you!

https://www.instagram.com/vcscpics/",https://facebook.com/story.php?story_fbid=1789024757913101&id=479010665581190,"INSTAGRAM.COM
www.instagram.com",0.0,"The VCSC has updated its Instagram page! We will be sharing all the things that are going on in the VCSC, through pictures. We cant wait to share it all with you!

https://www.instagram.com/vcscpics/

INSTAGRAM.COM
www.instagram.com",2020-09-01 15:48:14,,
25,0.0,,2.0,https://www.youtube.com/watch?v=HPeFt3IGHKc,1789021817913395,"VCSC Update with Mr. Parsley

https://www.youtube.com/watch?v=HPeFt3IGHKc",https://facebook.com/story.php?story_fbid=1789021817913395&id=479010665581190,"YOUTUBE.COM
Mr. Parsley VCSC Update",5.0,"VCSC Update with Mr. Parsley

https://www.youtube.com/watch?v=HPeFt3IGHKc

YOUTUBE.COM
Mr. Parsley VCSC Update",2020-09-01 15:43:04,,
26,1.0,https://scontent-atl3-1.xx.fbcdn.net/v/t1.0-9/fr/cp0/e15/q65/118572829_1788983171250593_9106270282182891402_n.jpg?_nc_cat=110&_nc_sid=110474&_nc_ohc=IoWr-Y8pp0cAX_VXfux&_nc_ht=scontent-atl3-1.xx&tp=14&oh=8232b4a63878f4cbcab917325af7188b&oe=5F85316A,46.0,,1788983444583899,No new cases today.,https://facebook.com/story.php?story_fbid=1788983444583899&id=479010665581190,,0.0,No new cases today.,2020-09-01 14:47:20,,
27,2.0,https://scontent-atl3-1.xx.fbcdn.net/v/t1.0-9/fr/cp0/e15/q65/118649213_1787810184701225_3962816782227168208_n.jpg?_nc_cat=108&_nc_sid=110474&_nc_ohc=8POmfRHX-34AX-teLkW&_nc_ht=scontent-atl3-1.xx&tp=14&oh=a5a6d8637ab7efdaa56c92f25b8fd3e7&oe=5F859EE1,0.0,,1788053898010187,TOMORROW,https://facebook.com/story.php?story_fbid=1788053898010187&id=479010665581190,"VCSC News
August 31 at 3:47 PM 路

REMINDER

VCSC Early Release is tomorrow (9/1). This means that HS/MS students will be released at 1pm and elementary students will be released at 1:30pm. For your planning, the first Tuesday of each month is an early release day. We will make sure to remind you of each early release day as well on our social media sites and our website. Thank you for your time.

Also, with Homecoming being moved, we will not be having an early release on Friday, September 25th.",7.0,"TOMORROW

VCSC News
August 31 at 3:47 PM 路

REMINDER

VCSC Early Release is tomorrow (9/1). This means that HS/MS students will be released at 1pm and elementary students will be released at 1:30pm. For your planning, the first Tuesday of each month is an early release day. We will make sure to remind you of each early release day as well on our social media sites and our website. Thank you for your time.

Also, with Homecoming being moved, we will not be having an early release on Friday, September 25th.",2020-08-31 17:54:34,,
28,7.0,https://scontent-atl3-1.xx.fbcdn.net/v/t1.0-9/fr/cp0/e15/q65/118537369_1787944511354459_3443527097841566713_o.jpg?_nc_cat=105&_nc_sid=110474&_nc_ohc=Koo0UwUZZ3EAX9THzJv&_nc_oc=AQm195MkySY56Pv50TJZbbEsg4NJ4yut0lqT7M_yjSLoigRcH0YCEN-hE9LTVy71dso&_nc_ht=scontent-atl3-1.xx&tp=14&oh=523139d37454a9a794c6fd280b21e55c&oe=5F852D7E,28.0,,1787944621354448,VCSC Update 8-31-2020,https://facebook.com/story.php?story_fbid=1787944621354448&id=479010665581190,,0.0,VCSC Update 8-31-2020,2020-08-31 15:00:57,,
29,0.0,,1.0,https://www.youtube.com/watch?v=3F4s8SI9RoI,1787919904690253,,https://facebook.com/story.php?story_fbid=1787919904690253&id=479010665581190,"YOUTUBE.COM
WOW Students of the Week 8-31-2020",0.0,"YOUTUBE.COM
WOW Students of the Week 8-31-2020",2020-08-31 14:24:55,,
30,3.0,https://scontent-atl3-1.xx.fbcdn.net/v/t1.0-9/fr/cp0/e15/q65/118649213_1787810184701225_3962816782227168208_n.jpg?_nc_cat=108&_nc_sid=110474&_nc_ohc=8POmfRHX-34AX-teLkW&_nc_ht=scontent-atl3-1.xx&tp=14&oh=a5a6d8637ab7efdaa56c92f25b8fd3e7&oe=5F859EE1,24.0,,1787811908034386,"REMINDER

VCSC Early Release is tomorrow (9/1). This means that HS/MS students will be released at 1pm and elementary students will be released at 1:30pm. For your planning, the first Tuesday of each month is an early release day. We will make sure to remind you of each early release day as well on our social media sites and our website. Thank you for your time.

Also, with Homecoming being moved, we will not be having an early release on Friday, September 25th.",https://facebook.com/story.php?story_fbid=1787811908034386&id=479010665581190,,0.0,"REMINDER

VCSC Early Release is tomorrow (9/1). This means that HS/MS students will be released at 1pm and elementary students will be released at 1:30pm. For your planning, the first Tuesday of each month is an early release day. We will make sure to remind you of each early release day as well on our social media sites and our website. Thank you for your time.

Also, with Homecoming being moved, we will not be having an early release on Friday, September 25th.",2020-08-31 11:47:21,,
31,0.0,https://scontent-atl3-1.xx.fbcdn.net/v/t1.0-9/fr/cp0/e15/q65/118626970_1784997368315840_2910961609081816041_o.jpg?_nc_cat=101&_nc_sid=8024bb&_nc_ohc=cbqquRhkzVsAX8sLNRf&_nc_ht=scontent-atl3-1.xx&tp=14&oh=deb0f3d27123f2012d241e311a62c3c7&oe=5F82D9E3,63.0,,1784997611649149,No new cases and no active cases! Have a great weekend!,https://facebook.com/story.php?story_fbid=1784997611649149&id=479010665581190,,0.0,No new cases and no active cases! Have a great weekend!,2020-08-28 15:30:47,,
32,0.0,,0.0,https://www.youtube.com/watch?v=eNJT9mGHB0U,1784996584982585,"VCSC Teacher Spotlight - Ms. Bridgewater

VCSC Teacher Spotlight visits a different VCSC school each week to showcase the wonderful things that are happening in our classrooms. This week, we went to Tecumseh Harrison and visited with Ms. Bridgewater and her students.

https://www.youtube.com/watch?v=eNJT9mGHB0U",https://facebook.com/story.php?story_fbid=1784996584982585&id=479010665581190,"YOUTUBE.COM
Teacher Spotlight - Ms. Bridgewater (THE)",6.0,"VCSC Teacher Spotlight - Ms. Bridgewater

VCSC Teacher Spotlight visits a different VCSC school each week to showcase the wonderful things that are happening in our classrooms. This week, we went to Tecumseh Harrison and visited with Ms. Bridgewater and her students.

https://www.youtube.com/watch?v=eNJT9mGHB0U

YOUTUBE.COM
Teacher Spotlight - Ms. Bridgewater (THE)",2020-08-28 14:55:16,,
33,0.0,,5.0,https://www.youtube.com/watch?v=GfNPyzMsaL0,1784995934982650,,https://facebook.com/story.php?story_fbid=1784995934982650&id=479010665581190,"YOUTUBE.COM
CMS Students of the Week 8-28-2020",2.0,"YOUTUBE.COM
CMS Students of the Week 8-28-2020",2020-08-28 14:54:26,,
34,0.0,,2.0,https://www.youtube.com/watch?v=Dql_0CPyoFU,1784995688316008,,https://facebook.com/story.php?story_fbid=1784995688316008&id=479010665581190,"YOUTUBE.COM
Lucky Bulldogs 8-2-8-2020",0.0,"YOUTUBE.COM
Lucky Bulldogs 8-2-8-2020",2020-08-28 14:54:12,,
35,0.0,,0.0,https://www.youtube.com/watch?v=qgCieQS3nWI,1784210545061189,,https://facebook.com/story.php?story_fbid=1784210545061189&id=479010665581190,"YOUTUBE.COM
Soaring Eagles 8-27-2020",0.0,"YOUTUBE.COM
Soaring Eagles 8-27-2020",2020-08-27 19:48:44,,
36,3.0,https://scontent-atl3-1.xx.fbcdn.net/v/t1.0-9/fr/cp0/e15/q65/118189653_1784041108411466_5048421125449755403_o.jpg?_nc_cat=108&_nc_sid=110474&_nc_ohc=auv2Gy4p3XcAX8KsnT2&_nc_ht=scontent-atl3-1.xx&tp=14&oh=7d36838f5789662c35f2ca6eed6d974f&oe=5F831D1F,86.0,,1784041178411459,Another great day! No new cases and no active cases!,https://facebook.com/story.php?story_fbid=1784041178411459&id=479010665581190,,0.0,Another great day! No new cases and no active cases!,2020-08-27 15:13:40,,
37,8.0,https://scontent-atl3-1.xx.fbcdn.net/v/t1.0-9/fr/cp0/e15/q65/118458772_2388947181410594_4684474533844162785_n.jpg?_nc_cat=109&_nc_sid=110474&_nc_ohc=10be6B4CbGkAX9d1s0R&_nc_ht=scontent-atl3-1.xx&tp=14&oh=891f333a9366a38e055c6fba734e38ab&oe=5F83D209,67.0,,1783595208456056,,https://facebook.com/story.php?story_fbid=1783595208456056&id=479010665581190,"Vincennes Lincoln Tennis
August 27 at 4:03 AM 路

I write this post at midnight in part thanks to the young man pictured here. With the match split at 2 points apiece, Calvin endured a 3-hour marathon and came away with the win for the team. Im so proud of the way he fought, and stayed in it mentally and physically to the end.",0.0,"Vincennes Lincoln Tennis
August 27 at 4:03 AM 路

I write this post at midnight in part thanks to the young man pictured here. With the match split at 2 points apiece, Calvin endured a 3-hour marathon and came away with the win for the team. Im so proud of the way he fought, and stayed in it mentally and physically to the end.",2020-08-27 06:13:01,,
38,0.0,,9.0,https://www.youtube.com/watch?v=gYBnPYnqiwE,1783062778509299,,https://facebook.com/story.php?story_fbid=1783062778509299&id=479010665581190,"YOUTUBE.COM
Best Bens 8-26-2020",0.0,"YOUTUBE.COM
Best Bens 8-26-2020",2020-08-26 17:11:34,,
39,0.0,,2.0,https://www.youtube.com/watch?v=rLYo577jjWI,1783062591842651,,https://facebook.com/story.php?story_fbid=1783062591842651&id=479010665581190,"YOUTUBE.COM
What We Learned 8-26-2020",0.0,"YOUTUBE.COM
What We Learned 8-26-2020",2020-08-26 17:11:16,,
40,1.0,https://scontent-atl3-1.xx.fbcdn.net/v/t1.0-9/fr/cp0/e15/q65/118626006_1782998208515756_2284517143522275687_o.jpg?_nc_cat=109&_nc_sid=8024bb&_nc_ohc=PBvN9d5CqGgAX9d6obM&_nc_ht=scontent-atl3-1.xx&tp=14&oh=18fcc0b9fee9ac7a0bec60ba93bb5e97&oe=5F839F9A,77.0,,1782998251849085,No new cases and no active cases in the VCSC.,https://facebook.com/story.php?story_fbid=1782998251849085&id=479010665581190,,0.0,No new cases and no active cases in the VCSC.,2020-08-26 15:27:26,,
41,2.0,https://scontent-atl3-1.xx.fbcdn.net/v/t1.0-9/fr/cp0/e15/q65/118072665_1782924461856464_6345441356038611072_o.jpg?_nc_cat=100&_nc_sid=110474&_nc_ohc=sYpBfkKOxKkAX8I-WpA&_nc_ht=scontent-atl3-1.xx&tp=14&oh=864f338541319a1d08a7fc5b779c6db9&oe=5F85E2D6,28.0,,1782924548523122,"Another Successful Telehealth Ribbon Cutting! Telehealth has expanded in the VCSC and will now be available at CMS. We are so thankful for this partnership with GSH to help better serve the needs of our students and their families. If you have questions about Telehealth, please contact Nurse Sara at schutzs@vcsc.k12.in.us",https://facebook.com/story.php?story_fbid=1782924548523122&id=479010665581190,,0.0,"Another Successful Telehealth Ribbon Cutting! Telehealth has expanded in the VCSC and will now be available at CMS. We are so thankful for this partnership with GSH to help better serve the needs of our students and their families. If you have questions about Telehealth, please contact Nurse Sara at schutzs@vcsc.k12.in.us",2020-08-26 14:00:37,,
42,0.0,,5.0,https://www.youtube.com/watch?v=9NQUOOIbfoA,1782092245273019,,https://facebook.com/story.php?story_fbid=1782092245273019&id=479010665581190,"YOUTUBE.COM
WOW Students of the Week 8-24-2020",0.0,"YOUTUBE.COM
WOW Students of the Week 8-24-2020",2020-08-25 19:55:58,,
43,0.0,,12.0,https://www.youtube.com/watch?v=7jNCXxJL2_E,1782091418606435,,https://facebook.com/story.php?story_fbid=1782091418606435&id=479010665581190,"YOUTUBE.COM
Alices of the Week 8-25-2020",0.0,"YOUTUBE.COM
Alices of the Week 8-25-2020",2020-08-25 19:54:58,,
44,6.0,https://scontent-atl3-1.xx.fbcdn.net/v/t1.0-9/fr/cp0/e15/q65/118087702_1781896761959234_9001047875315064418_o.jpg?_nc_cat=103&_nc_sid=110474&_nc_ohc=qf50yldFtpMAX8k5JGV&_nc_ht=scontent-atl3-1.xx&tp=14&oh=a5bf7ec482c00dbe13768a7dee6d5da6&oe=5F82784F,108.0,,1781896951959215,The VCSC has no new cases to report today. We can also report that the remaining students in quarantine have been released and can resume regular school activities. This leaves the VCSC with no active cases!,https://facebook.com/story.php?story_fbid=1781896951959215&id=479010665581190,,0.0,The VCSC has no new cases to report today. We can also report that the remaining students in quarantine have been released and can resume regular school activities. This leaves the VCSC with no active cases!,2020-08-25 14:55:57,,
45,0.0,,5.0,https://www.youtube.com/watch?v=3-wnc77zBU8,1781875798627997,,https://facebook.com/story.php?story_fbid=1781875798627997&id=479010665581190,,15.0,,2020-08-25 14:30:47,,
46,0.0,,17.0,https://drive.google.com/file/d/1mKq-ei6iETnLgcIn_YnGztqHYPUZyKnh/view?usp=sharing,1780875245394719,"Below are our updated nursing protocols.

https://drive.google.com/file/d/1mKq-ei6iETnLgcIn_YnGztqHYPUZyKnh/view?usp=sharing",https://facebook.com/story.php?story_fbid=1780875245394719&id=479010665581190,"DRIVE.GOOGLE.COM
Updated Nursing Protocols.pdf",25.0,"Below are our updated nursing protocols.

https://drive.google.com/file/d/1mKq-ei6iETnLgcIn_YnGztqHYPUZyKnh/view?usp=sharing

DRIVE.GOOGLE.COM
Updated Nursing Protocols.pdf",2020-08-24 16:39:18,,
47,9.0,https://scontent-atl3-1.xx.fbcdn.net/v/t1.0-9/fr/cp0/e15/q65/117863243_1780784065403837_3780551923208166872_o.jpg?_nc_cat=107&_nc_sid=110474&_nc_ohc=yZUO336ZNW8AX_B2bW3&_nc_ht=scontent-atl3-1.xx&tp=14&oh=380264cbfb651ad53d2905bbe5dce6dc&oe=5F8514BD,92.0,,1780784088737168,The VCSC has no new cases to report today. We can also report that three students have been released from quarantine and can resume regular school activities. This leaves the VCSC with two active cases and these students will return to classes later this week.,https://facebook.com/story.php?story_fbid=1780784088737168&id=479010665581190,,0.0,The VCSC has no new cases to report today. We can also report that three students have been released from quarantine and can resume regular school activities. This leaves the VCSC with two active cases and these students will return to classes later this week.,2020-08-24 15:09:09,,
48,0.0,,6.0,,1779606688854908,,https://facebook.com/story.php?story_fbid=1779606688854908&id=479010665581190,"Vincennes Lincoln Volleyball
August 22 at 6:12 PM 路

The Vincennes Lincoln volleyball teams traveled to Southridge today. 

The Varsity team won in straight sets. 25-14, 25-14, 25-19. The Alices are 3-0 on the season and will play Castle at home on Tuesday.

Leaders
Kills
Maycee Lange 12
Livie Koenig 9

Assists
Callie Foster 33

Digs
Kali Haynes 5
Mackenzie Newland 4

Aces
Maycee Lange 4

The JV won in 2 sets. 25-9, 25-19
They are 3-0 on the season.

Leaders
Kills
Zoey Weiss 9

Assists
Jaclyn Sutton 9
Gracie Kramer 7

Digs
Olivia Hamilton 12
Cameron Cary 9

Aces
Cameron Cary 4

The freshman team opened their season today. They played well and fought hard but came up short in 3 sets. 20-25, 25-20, 7-15.

Leaders
Kills
Mattye Meadows 8
Xzandra Cox 7

Assists
McKenna Henderson 14

Digs
Courtney Deffendoll 8

Aces
Mattye Meadows 3

All three teams will play Castle at home on Tuesday.

#bumpkill #coachpoint #jumpball #showemwhoisboss #teamfirst #effort #werisetogether #maskup",0.0,"Vincennes Lincoln Volleyball
August 22 at 6:12 PM 路

The Vincennes Lincoln volleyball teams traveled to Southridge today. 

The Varsity team won in straight sets. 25-14, 25-14, 25-19. The Alices are 3-0 on the season and will play Castle at home on Tuesday.

Leaders
Kills
Maycee Lange 12
Livie Koenig 9

Assists
Callie Foster 33

Digs
Kali Haynes 5
Mackenzie Newland 4

Aces
Maycee Lange 4

The JV won in 2 sets. 25-9, 25-19
They are 3-0 on the season.

Leaders
Kills
Zoey Weiss 9

Assists
Jaclyn Sutton 9
Gracie Kramer 7

Digs
Olivia Hamilton 12
Cameron Cary 9

Aces
Cameron Cary 4

The freshman team opened their season today. They played well and fought hard but came up short in 3 sets. 20-25, 25-20, 7-15.

Leaders
Kills
Mattye Meadows 8
Xzandra Cox 7

Assists
McKenna Henderson 14

Digs
Courtney Deffendoll 8

Aces
Mattye Meadows 3

All three teams will play Castle at home on Tuesday.

#bumpkill #coachpoint #jumpball #showemwhoisboss #teamfirst #effort #werisetogether #maskup",2020-08-23 10:18:24,,
49,0.0,,0.0,,,"The Vincennes Lincoln volleyball teams traveled to Southridge today. 

The Varsity team won in straight sets. 25-14, 25-14, 25-19. The Alices are 3-0 on the season and will play Castle at home on Tuesday.

Leaders
Kills
Maycee Lange 12
Livie Koenig 9

Assists
Callie Foster 33

Digs
Kali Haynes 5
Mackenzie Newland 4

Aces
Maycee Lange 4

The JV won in 2 sets. 25-9, 25-19
They are 3-0 on the season.

Leaders
Kills
Zoey Weiss 9

Assists
Jaclyn Sutton 9
Gracie Kramer 7

Digs
Olivia Hamilton 12
Cameron Cary 9

Aces
Cameron Cary 4

The freshman team opened their season today. They played well and fought hard but came up short in 3 sets. 20-25, 25-20, 7-15.

Leaders
Kills
Mattye Meadows 8
Xzandra Cox 7

Assists
McKenna Henderson 14

Digs
Courtney Deffendoll 8

Aces
Mattye Meadows 3

All three teams will play Castle at home on Tuesday.

#bumpkill #coachpoint #jumpball #showemwhoisboss #teamfirst #effort #werisetogether #maskup",https://facebook.com/story.php?story_fbid=626911947961609&id=169079990411476,,0.0,"The Vincennes Lincoln volleyball teams traveled to Southridge today. 

The Varsity team won in straight sets. 25-14, 25-14, 25-19. The Alices are 3-0 on the season and will play Castle at home on Tuesday.

Leaders
Kills
Maycee Lange 12
Livie Koenig 9

Assists
Callie Foster 33

Digs
Kali Haynes 5
Mackenzie Newland 4

Aces
Maycee Lange 4

The JV won in 2 sets. 25-9, 25-19
They are 3-0 on the season.

Leaders
Kills
Zoey Weiss 9

Assists
Jaclyn Sutton 9
Gracie Kramer 7

Digs
Olivia Hamilton 12
Cameron Cary 9

Aces
Cameron Cary 4

The freshman team opened their season today. They played well and fought hard but came up short in 3 sets. 20-25, 25-20, 7-15.

Leaders
Kills
Mattye Meadows 8
Xzandra Cox 7

Assists
McKenna Henderson 14

Digs
Courtney Deffendoll 8

Aces
Mattye Meadows 3

All three teams will play Castle at home on Tuesday.

#bumpkill #coachpoint #jumpball #showemwhoisboss #teamfirst #effort #werisetogether #maskup",,,
50,5.0,https://scontent-atl3-1.xx.fbcdn.net/v/t1.0-9/fr/cp0/e15/q65/117768732_1778605018955075_2270991390654074968_o.jpg?_nc_cat=101&_nc_sid=8024bb&_nc_ohc=DSx22Sd2JPgAX-KmJb4&_nc_ht=scontent-atl3-1.xx&tp=14&oh=f68c2474c3a91db25fb8bedd61e9a9c6&oe=5F83E8E7,8.0,,1778605322288378,TIcket and Attendance Information for Home Football Games,https://facebook.com/story.php?story_fbid=1778605322288378&id=479010665581190,,0.0,TIcket and Attendance Information for Home Football Games,2020-08-22 09:37:02,,
51,13.0,https://scontent-atl3-1.xx.fbcdn.net/v/t1.0-9/fr/cp0/e15/q65/118044196_1777924445689799_6329382129303403736_o.jpg?_nc_cat=111&_nc_sid=110474&_nc_ohc=g2-1M3YOMFgAX8fahVd&_nc_ht=scontent-atl3-1.xx&tp=14&oh=9ad991cedeceb70911158b36f0e3af38&oe=5F821173,21.0,,1777925482356362,VCSC joint statement with the Homecoming Coordination Committee and the City of Vincennes concerning Homecoming 2020.,https://facebook.com/story.php?story_fbid=1777925482356362&id=479010665581190,,0.0,VCSC joint statement with the Homecoming Coordination Committee and the City of Vincennes concerning Homecoming 2020.,2020-08-21 15:59:47,,
52,4.0,,76.0,,1777887772360133,"The VCSC has no new cases to report today. We can also report that throughout next week, all of our students currently with active cases will be released and be able to resume regular school activities. Have a great weekend!",https://facebook.com/story.php?story_fbid=1777887772360133&id=479010665581190,,0.0,"The VCSC has no new cases to report today. We can also report that throughout next week, all of our students currently with active cases will be released and be able to resume regular school activities. Have a great weekend!",2020-08-21 14:55:49,,
53,0.0,,2.0,https://www.youtube.com/watch?v=A2lMH95VARA,1777817462367164,,https://facebook.com/story.php?story_fbid=1777817462367164&id=479010665581190,"YOUTUBE.COM
Lucky Bulldog 8-21-2020",2.0,"YOUTUBE.COM
Lucky Bulldog 8-21-2020",2020-08-21 13:22:04,,
54,2.0,,15.0,https://www.youtube.com/watch?v=Q6yQRKhhZkY,1777022799113297,,https://facebook.com/story.php?story_fbid=1777022799113297&id=479010665581190,"YOUTUBE.COM
CMS Students of the Week 8-20-2020",0.0,"YOUTUBE.COM
CMS Students of the Week 8-20-2020",2020-08-20 17:05:17,,
55,1.0,,3.0,https://www.youtube.com/watch?v=JooPSXoihr0,1777022572446653,,https://facebook.com/story.php?story_fbid=1777022572446653&id=479010665581190,"YOUTUBE.COM
Soaring Eagle 8-20-2020",2.0,"YOUTUBE.COM
Soaring Eagle 8-20-2020",2020-08-20 17:05:01,,
56,10.0,https://scontent-atl3-1.xx.fbcdn.net/v/t1.0-9/fr/cp0/e15/q65/117967825_1776956109119966_8204877854273589110_o.jpg?_nc_cat=108&_nc_sid=8024bb&_nc_ohc=wAcAuB-fCc8AX_dI_Cc&_nc_ht=scontent-atl3-1.xx&tp=14&oh=cc8c724a6ed3eb52f4bf0dbf818f3619&oe=5F8463BD,64.0,,1776956189119958,No new cases today.,https://facebook.com/story.php?story_fbid=1776956189119958&id=479010665581190,,0.0,No new cases today.,2020-08-20 15:16:43,,
57,0.0,,6.0,https://www.youtube.com/watch?v=pyvPsHHwjFA,1776145375867706,,https://facebook.com/story.php?story_fbid=1776145375867706&id=479010665581190,"YOUTUBE.COM
What We Learned 8-19-2020",0.0,"YOUTUBE.COM
What We Learned 8-19-2020",2020-08-19 19:03:51,,
58,0.0,,7.0,https://www.youtube.com/watch?v=47NthV-FT38,1776145209201056,,https://facebook.com/story.php?story_fbid=1776145209201056&id=479010665581190,"YOUTUBE.COM
Best Bens 8-19-2020",0.0,"YOUTUBE.COM
Best Bens 8-19-2020",2020-08-19 19:03:36,,
59,0.0,https://scontent-atl3-1.xx.fbcdn.net/v/t1.0-9/fr/cp0/e15/q65/117735580_1776076092541301_2381255685876642896_o.jpg?_nc_cat=109&_nc_sid=110474&_nc_ohc=0N_7e_0ONE4AX_hCqB_&_nc_ht=scontent-atl3-1.xx&tp=14&oh=55f5b25aaa64fcb68613c266b9b2a9da&oe=5F85B22F,9.0,,1776076135874630,Ticket and Attendance Information for Fridays Alice Football game against Evansville Bosse.,https://facebook.com/story.php?story_fbid=1776076135874630&id=479010665581190,,0.0,Ticket and Attendance Information for Fridays Alice Football game against Evansville Bosse.,2020-08-19 17:01:29,,
60,0.0,https://scontent-atl3-1.xx.fbcdn.net/v/t1.0-9/fr/cp0/e15/q65/117998862_1776012809214296_7219684165245973355_o.jpg?_nc_cat=108&_nc_sid=110474&_nc_ohc=VdNxBnSSyVYAX-_i1D8&_nc_ht=scontent-atl3-1.xx&tp=14&oh=b39477593847d6ba6dcc0433fd993b0e&oe=5F85E6EF,68.0,,1776012839214293,No new cases today 8-19-2020.,https://facebook.com/story.php?story_fbid=1776012839214293&id=479010665581190,,0.0,No new cases today 8-19-2020.,2020-08-19 15:19:23,,
61,0.0,,29.0,,1775292592619651,,https://facebook.com/story.php?story_fbid=1775292592619651&id=479010665581190,"Vincennes Lincoln Tennis
August 18 at 11:47 PM 路

LHS Tennis Parents and fans,

I would like to thank those of you who wore masks and socially distanced while attending our match on Monday. Please know that even though we play outside face coverings and social distancing are still requirements per IHSAA and VCSC policy. Our team wears them anytime were not on the court, and we should have the same expectations for those attending our events. The more we adhere to this policy, the greater our chances of your child having a full tennis season. Thank you for your continued support of LHS tennis!

- Coach Crane",2.0,"Vincennes Lincoln Tennis
August 18 at 11:47 PM 路

LHS Tennis Parents and fans,

I would like to thank those of you who wore masks and socially distanced while attending our match on Monday. Please know that even though we play outside face coverings and social distancing are still requirements per IHSAA and VCSC policy. Our team wears them anytime were not on the court, and we should have the same expectations for those attending our events. The more we adhere to this policy, the greater our chances of your child having a full tennis season. Thank you for your continued support of LHS tennis!

- Coach Crane",2020-08-18 20:46:38,,
62,0.0,,0.0,,,"LHS Tennis Parents and fans,

I would like to thank those of you who wore masks and socially distanced while attending our match on Monday. Please know that even though we play outside face coverings and social distancing are still requirements per IHSAA and VCSC policy. Our team wears them anytime were not on the court, and we should have the same expectations for those attending our events. The more we adhere to this policy, the greater our chances of your child having a full tennis season. Thank you for your continued support of LHS tennis!

- Coach Crane",https://facebook.com/story.php?story_fbid=2382374345401211&id=2049462325359083,,0.0,"LHS Tennis Parents and fans,

I would like to thank those of you who wore masks and socially distanced while attending our match on Monday. Please know that even though we play outside face coverings and social distancing are still requirements per IHSAA and VCSC policy. Our team wears them anytime were not on the court, and we should have the same expectations for those attending our events. The more we adhere to this policy, the greater our chances of your child having a full tennis season. Thank you for your continued support of LHS tennis!

- Coach Crane",,,
63,8.0,https://scontent-atl3-1.xx.fbcdn.net/v/t1.0-9/fr/cp0/e15/q65/118105634_1775072762641634_1995036608418232477_o.jpg?_nc_cat=100&_nc_sid=110474&_nc_ohc=_fTvN1P43ngAX8Ek2c9&_nc_ht=scontent-atl3-1.xx&tp=14&oh=8e4e7b3e78d0967290abf62277ce5404&oe=5F82EBC8,88.0,,1775073089308268,"No new positve cases today.

Our plan is to keep our students, staff and their families as informed as possible. We will continue to update all parties about positive or active cases within the VCSC at the end of each school day. We thank you for your understanding, patience, and most importantly, your support.",https://facebook.com/story.php?story_fbid=1775073089308268&id=479010665581190,,0.0,"No new positve cases today.

Our plan is to keep our students, staff and their families as informed as possible. We will continue to update all parties about positive or active cases within the VCSC at the end of each school day. We thank you for your understanding, patience, and most importantly, your support.",2020-08-18 15:08:12,,
64,0.0,https://scontent-atl3-1.xx.fbcdn.net/v/t1.0-9/fr/cp0/e15/q65/117868158_1775053325976911_4518386626833613478_n.jpg?_nc_cat=110&_nc_sid=85a577&_nc_ohc=ziGzRtok4-kAX8goBR8&_nc_ht=scontent-atl3-1.xx&tp=14&oh=b7c099edc9918d61fe040cd82308d67a&oe=5F8330DD,19.0,,1775053362643574,,,,0.0,,2020-08-18 14:35:33,,
65,1.0,,10.0,https://www.youtube.com/watch?v=0ImBwJsHY5w,1774924385989805,,https://facebook.com/story.php?story_fbid=1774924385989805&id=479010665581190,"YOUTUBE.COM
Alices of the Week 8-18-2020",3.0,"YOUTUBE.COM
Alices of the Week 8-18-2020",2020-08-18 11:42:45,,
66,0.0,,7.0,https://youtu.be/Kj2Ayr0AT6k,1774315552717355,,https://facebook.com/story.php?story_fbid=1774315552717355&id=479010665581190,"YOUTUBE.COM
WOW Students of the Week 8-17-2020",2.0,"YOUTUBE.COM
WOW Students of the Week 8-17-2020",2020-08-17 20:27:13,,
67,2.0,,20.0,https://www.youtube.com/watch?v=Hqk82c7EbZA,1774194142729496,"Mr. Combs discusses VCSC Covid Protocols.

Remember, the building front office staff of each VCSC building will be making calls and SchoolMessenger contacts if their building is affected.

https://www.youtube.com/watch?v=Hqk82c7EbZA",https://facebook.com/story.php?story_fbid=1774194142729496&id=479010665581190,"YOUTUBE.COM
Mr. Combs Reviews VCSC Covid Protocols",7.0,"Mr. Combs discusses VCSC Covid Protocols.

Remember, the building front office staff of each VCSC building will be making calls and SchoolMessenger contacts if their building is affected.

https://www.youtube.com/watch?v=Hqk82c7EbZA

YOUTUBE.COM
Mr. Combs Reviews VCSC Covid Protocols",2020-08-17 16:53:22,,
68,0.0,https://scontent-atl3-1.xx.fbcdn.net/v/t1.0-9/fr/cp0/e15/q65/117604813_1774094926072751_2914989188139132816_o.jpg?_nc_cat=109&_nc_sid=8024bb&_nc_ohc=ARzoIqk5z6MAX_iYUuB&_nc_ht=scontent-atl3-1.xx&tp=14&oh=d137739960848586f5f5a0dc095cb1c4&oe=5F83D893,12.0,,1774095136072730,VCSC Statement 8-17-2020 Update,https://facebook.com/story.php?story_fbid=1774095136072730&id=479010665581190,,0.0,VCSC Statement 8-17-2020 Update,2020-08-17 16:00:48,,
69,0.0,https://scontent-atl3-1.xx.fbcdn.net/v/t1.0-9/fr/cp0/e15/q65/118003417_1774337746048469_8529686991041806344_o.jpg?_nc_cat=108&_nc_sid=8024bb&_nc_ohc=FfRLvKzVj3gAX-zssV0&_nc_oc=AQlxNlQV7OiFzVxCo_pq9gKS-YowBN4OUZToFoGSu6VniYOM7YoJckCu0kxCC0TUWWg&_nc_ht=scontent-atl3-1.xx&tp=14&oh=286e405cad625068dc8f6be40e3360f7&oe=5F84CC06,24.0,,1774046666077577,Ticket and Fan Information for VCSC Athletic Events,https://facebook.com/story.php?story_fbid=1774046666077577&id=479010665581190,,0.0,Ticket and Fan Information for VCSC Athletic Events,2020-08-17 13:52:35,,
70,0.0,https://scontent-atl3-1.xx.fbcdn.net/v/t1.0-9/fr/cp0/e15/q65/117414248_1773847749430802_4496558417510384759_o.jpg?_nc_cat=100&_nc_sid=8024bb&_nc_ohc=ktV1btzRsskAX8rf4p0&_nc_ht=scontent-atl3-1.xx&tp=14&oh=1cd78708b01d210c24abc4fc3cf1c15a&oe=5F847B7B,16.0,,1773847909430786,VCSC Statement for 8-17-2020,https://facebook.com/story.php?story_fbid=1773847909430786&id=479010665581190,,0.0,VCSC Statement for 8-17-2020,2020-08-17 09:35:00,,
71,5.0,https://scontent-atl3-1.xx.fbcdn.net/v/t1.0-9/fr/cp0/e15/q65/117988694_1772017856280458_844801424001793722_o.jpg?_nc_cat=109&_nc_sid=8024bb&_nc_ohc=sy4kUAiSHHIAX-UCy_R&_nc_oc=AQmdWbIS51SVlEuDUX5GNK8EDx0ZZwMR3peIK7IlbGDsI7E3HCIzq5lvV_gdyNIzsJk&_nc_ht=scontent-atl3-1.xx&tp=14&oh=98a5831efd38afa8e4cb0324ee973c6a&oe=5F8476AD,24.0,,1772008306281413,VCSC Statement on Football Scrimmage Cancellation,https://facebook.com/story.php?story_fbid=1772008306281413&id=479010665581190,,0.0,VCSC Statement on Football Scrimmage Cancellation,2020-08-15 11:08:07,,
72,1.0,,11.0,https://www.youtube.com/watch?v=uZo5vIlDkNI,1771151249700452,,https://facebook.com/story.php?story_fbid=1771151249700452&id=479010665581190,"YOUTUBE.COM
Lucky Bulldogs 8-14-2020",2.0,"YOUTUBE.COM
Lucky Bulldogs 8-14-2020",2020-08-14 14:17:59,,
73,11.0,https://scontent-atl3-1.xx.fbcdn.net/v/t1.0-9/fr/cp0/e15/q65/117597579_1770928019722775_1478812601254505335_o.jpg?_nc_cat=108&_nc_sid=8024bb&_nc_ohc=HtE68yjQBLQAX9vQB1S&_nc_ht=scontent-atl3-1.xx&tp=14&oh=c987103ded2276319106f1bf432cb17e&oe=5F83C4D8,35.0,,1770928239722753,VCSC Special Announcement 8-14-2020,https://facebook.com/story.php?story_fbid=1770928239722753&id=479010665581190,,0.0,VCSC Special Announcement 8-14-2020,2020-08-14 09:29:32,,
74,1.0,,10.0,https://drive.google.com/file/d/1zlwJ4ByRlNr9W12EgIDyWdKK4x7H7rhb/view?usp=sharing,1769077519907825,"Attention VCSC Families

In partnership with GSH, we have attached our Return to School Procedures for students that have been kept home or have been sent home for Covid related symptoms. You will find our current procedures, information on who to contact, and places your student can be seen. We thank you for your patience and understanding as we all work together to keep our students, our staff and our community safe.

https://drive.google.com/file/d/1zlwJ4ByRlNr9W12EgIDyWdKK4x7H7rhb/view?usp=sharing",https://facebook.com/story.php?story_fbid=1769077519907825&id=479010665581190,"DRIVE.GOOGLE.COM
COVID 19 Student Return to School Info.pdf",37.0,"Attention VCSC Families

In partnership with GSH, we have attached our Return to School Procedures for students that have been kept home or have been sent home for Covid related symptoms. You will find our current procedures, information on who to contact, and places your student can be seen. We thank you for your patience and understanding as we all work together to keep our students, our staff and our community safe.

https://drive.google.com/file/d/1zlwJ4ByRlNr9W12EgIDyWdKK4x7H7rhb/view?usp=sharing

DRIVE.GOOGLE.COM
COVID 19 Student Return to School Info.pdf",2020-08-13 17:00:20,,
75,1.0,,6.0,https://youtu.be/tgf1rBJn8DM,1770165559799021,,https://facebook.com/story.php?story_fbid=1770165559799021&id=479010665581190,"YOUTUBE.COM
Soaring Eagles 8-13-2020",3.0,"YOUTUBE.COM
Soaring Eagles 8-13-2020",2020-08-13 14:43:30,,
76,0.0,,6.0,https://www.youtube.com/watch?v=2s7Ve122pwc,1769210436561200,,https://facebook.com/story.php?story_fbid=1769210436561200&id=479010665581190,"YOUTUBE.COM
What We Learned! 8-12-2020",2.0,"YOUTUBE.COM
What We Learned! 8-12-2020",2020-08-12 17:00:51,,
77,5.0,https://scontent-atl3-1.xx.fbcdn.net/v/t1.0-9/fr/cp0/e15/q65/117684124_1768981116584132_4486671890212543355_o.jpg?_nc_cat=106&_nc_sid=8024bb&_nc_ohc=zD3A8_Ncq4IAX9ri0Aq&_nc_ht=scontent-atl3-1.xx&tp=14&oh=62f5644008d0258b6e73932be9cf54ad&oe=5F8504F4,37.0,,1768981343250776,VCSC Special Announcement,https://facebook.com/story.php?story_fbid=1768981343250776&id=479010665581190,,0.0,VCSC Special Announcement,2020-08-12 11:53:16,,
78,5.0,https://scontent-atl3-1.xx.fbcdn.net/v/t1.0-9/fr/cp0/e15/q65/117340666_3148593641873371_1464265227675879500_o.jpg?_nc_cat=100&_nc_sid=8024bb&_nc_ohc=z8cnSWDgw8sAX8mofXc&_nc_ht=scontent-atl3-1.xx&tp=14&oh=f646fe637f6a70ddeea6dc1883b9d61c&oe=5F826F8F,30.0,,1767781056704138,"Through Sodexo, you can order birthday treats for your childs class and have them delivered. The email address is below.",https://facebook.com/story.php?story_fbid=1767781056704138&id=479010665581190,"Sodexo Nutrition Vincennes Community Schools
August 10 at 8:06 PM 路

We had two birthday Packages delivered today! Happy Birthday Luke and Bria! If you would like to order a birthday package for your students class just email lipst@vcsc.k12.in.us or call 812-882-2039.",12.0,"Through Sodexo, you can order birthday treats for your childs class and have them delivered. The email address is below.

Sodexo Nutrition Vincennes Community Schools
August 10 at 8:06 PM 路

We had two birthday Packages delivered today! Happy Birthday Luke and Bria! If you would like to order a birthday package for your students class just email lipst@vcsc.k12.in.us or call 812-882-2039.",2020-08-11 08:01:58,,
79,0.0,,6.0,https://www.youtube.com/watch?v=3h1pJDerazA,1767082690107308,,https://facebook.com/story.php?story_fbid=1767082690107308&id=479010665581190,"YOUTUBE.COM
WOW Students of the Week 8-10-2020",0.0,"YOUTUBE.COM
WOW Students of the Week 8-10-2020",2020-08-10 14:49:44,,
80,1.0,,7.0,,1763581530457424,,https://facebook.com/story.php?story_fbid=1763581530457424&id=479010665581190,"VCSC News
August 6 at 4:59 PM 路

Thank you for doing such a great job of wearing your masks on our buses. As a reminder, we ask that ALL bus riders wear a mask to make our bus riding experience as safe and healthy as possible. We thank you for your patience and understanding.",0.0,"VCSC News
August 6 at 4:59 PM 路

Thank you for doing such a great job of wearing your masks on our buses. As a reminder, we ask that ALL bus riders wear a mask to make our bus riding experience as safe and healthy as possible. We thank you for your patience and understanding.",2020-08-06 21:50:29,,
81,1.0,https://scontent-atl3-1.xx.fbcdn.net/v/t1.0-9/fr/cp0/e15/q65/116705863_3663507320343783_8824968278583108358_o.jpg?_nc_cat=101&_nc_sid=110474&_nc_ohc=jTyI5iXFxqkAX8i_Sq0&_nc_ht=scontent-atl3-1.xx&tp=14&oh=2ef5569c991ca0d921a81346a4759bc3&oe=5F82367C,47.0,,1763386130476964,,https://facebook.com/story.php?story_fbid=1763386130476964&id=479010665581190,"Riley Elementary School
August 6 at 8:32 PM 路

We had a GREAT first day!! Our students did such an awesome job! Thank you parents for helping prepare them for our new normal.

FYI: they are all smiling even if you cant see them! Ready for day 2.",0.0,"Riley Elementary School
August 6 at 8:32 PM 路

We had a GREAT first day!! Our students did such an awesome job! Thank you parents for helping prepare them for our new normal.

FYI: they are all smiling even if you cant see them! Ready for day 2.",2020-08-06 16:49:15,,
82,0.0,https://scontent-atl3-1.xx.fbcdn.net/v/t1.0-9/fr/cp0/e15/q65/116839258_10158796047119674_7734866386872617792_o.jpg?_nc_cat=106&_nc_sid=110474&_nc_ohc=BFBm1j77DQQAX9dUkCM&_nc_ht=scontent-atl3-1.xx&tp=14&oh=392224afc64c050287b5eb350e08e631&oe=5F84184B,66.0,,1763346950480882,,https://facebook.com/story.php?story_fbid=1763346950480882&id=479010665581190,"Tecumseh Harrison Elementary - Vincennes, IN
August 6 at 7:32 PM 路

A huge thank you to THE PTO for the awesome yard card sign! We had a great first day at THE.",3.0,"Tecumseh Harrison Elementary - Vincennes, IN
August 6 at 7:32 PM 路

A huge thank you to THE PTO for the awesome yard card sign! We had a great first day at THE.",2020-08-06 15:46:56,,
83,0.0,,25.0,https://youtu.be/MkSSxj1CGDY,1763346337147610,,https://facebook.com/story.php?story_fbid=1763346337147610&id=479010665581190,"YOUTUBE.COM
FIRST DAY AT THE NEW FRANKLIN!",3.0,"YOUTUBE.COM
FIRST DAY AT THE NEW FRANKLIN!",2020-08-06 15:46:02,,
84,0.0,https://scontent-atl3-1.xx.fbcdn.net/v/t1.0-9/fr/cp0/e15/q65/117173528_1763238813825029_6315752681756924438_n.jpg?_nc_cat=106&_nc_sid=110474&_nc_ohc=pBX-VwYTR3AAX_4C4bL&_nc_ht=scontent-atl3-1.xx&tp=14&oh=bb451f547e463aba31299b48df06812c&oe=5F823FB9,43.0,,1763241500491427,"Thank you for doing such a great job of wearing your masks on our buses. As a reminder, we ask that ALL bus riders wear a mask to make our bus riding experience as safe and healthy as possible. We thank you for your patience and understanding.",https://facebook.com/story.php?story_fbid=1763241500491427&id=479010665581190,,0.0,"Thank you for doing such a great job of wearing your masks on our buses. As a reminder, we ask that ALL bus riders wear a mask to make our bus riding experience as safe and healthy as possible. We thank you for your patience and understanding.",2020-08-06 12:59:37,,
85,1.0,https://scontent-atl3-1.xx.fbcdn.net/v/t1.0-9/fr/cp0/e15/q65/116703704_1762068160608761_6903472453147019862_n.jpg?_nc_cat=110&_nc_sid=110474&_nc_ohc=58I-nw7NcqcAX-IYdwI&_nc_oc=AQn89EUfT0DnC3x0FpmLEL-RC4f8QZhdFOcBb3NWCG89bLVP6T47eUP9OZoFo2JHqJI&_nc_ht=scontent-atl3-1.xx&tp=14&oh=d4dc1570e25c721c244f4bc799757c0e&oe=5F82CA82,31.0,,1762068527275391,VCSC DAILY SCHEDULE,https://facebook.com/story.php?story_fbid=1762068527275391&id=479010665581190,,0.0,VCSC DAILY SCHEDULE,2020-08-05 09:24:08,,
86,1.0,,6.0,https://drive.google.com/file/d/11O0YgU131HHUZEZjofXmqhBWKgMTjDZz/view?usp=sharing,1761294564019454,"VCSC Bus Stops and Times 2020-21

https://drive.google.com/file/d/11O0YgU131HHUZEZjofXmqhBWKgMTjDZz/view?usp=sharing

Updated Routes (Franklin 18, Elementary 12, and LHS Bus 5) - https://drive.google.com/drive/folders/1Jd_poyuQaWqTqGpFQFDgBxiIy6I6wT1h?usp=sharing",https://facebook.com/story.php?story_fbid=1761294564019454&id=479010665581190,"DRIVE.GOOGLE.COM
VCSC Bus Stops and Times for 2020-21.pdf",39.0,"VCSC Bus Stops and Times 2020-21

https://drive.google.com/file/d/11O0YgU131HHUZEZjofXmqhBWKgMTjDZz/view?usp=sharing

Updated Routes (Franklin 18, Elementary 12, and LHS Bus 5) - https://drive.google.com/drive/folders/1Jd_poyuQaWqTqGpFQFDgBxiIy6I6wT1h?usp=sharing

DRIVE.GOOGLE.COM
VCSC Bus Stops and Times for 2020-21.pdf",2020-08-04 14:03:03,,
87,3.0,,8.0,https://drive.google.com/file/d/1i4hgU2A82GO_B59_LAP5SSAXCCT0_Pry/view?usp=sharing,1757661584382752,"Please read this special message from our VCSC Head Nurse.

https://drive.google.com/file/d/1i4hgU2A82GO_B59_LAP5SSAXCCT0_Pry/view?usp=sharing",https://facebook.com/story.php?story_fbid=1757661584382752&id=479010665581190,"DRIVE.GOOGLE.COM
VCSC Commonly Asked Health Questions.pdf",32.0,"Please read this special message from our VCSC Head Nurse.

https://drive.google.com/file/d/1i4hgU2A82GO_B59_LAP5SSAXCCT0_Pry/view?usp=sharing

DRIVE.GOOGLE.COM
VCSC Commonly Asked Health Questions.pdf",2020-08-03 09:00:34,,
88,0.0,https://scontent-atl3-1.xx.fbcdn.net/v/t1.0-9/fr/cp0/e15/q65/116066741_1758606040954973_8473619522378957745_o.jpg?_nc_cat=109&_nc_sid=110474&_nc_ohc=k-IGxcKAl10AX8i6PYw&_nc_ht=scontent-atl3-1.xx&tp=14&oh=03fe82412d4c09234c3c3883d211e56c&oe=5F82C2E9,83.0,,1758607007621543,"Little A has some exciting news! The VCSC will be partnering with Tunnel Car Wash. We will explain the details in the future but to put it simply, you get a car wash and part of your car wash can be donated to the VCSC. Isnt that awesome! So stay tuned for more news on this great partnership and go like the Tunnel Car Wash Facebook page!

Tunnel Car Wash - https://www.facebook.com/Tunnel-Car-Wash-105681267619110/",https://facebook.com/story.php?story_fbid=1758607007621543&id=479010665581190,,0.0,"Little A has some exciting news! The VCSC will be partnering with Tunnel Car Wash. We will explain the details in the future but to put it simply, you get a car wash and part of your car wash can be donated to the VCSC. Isnt that awesome! So stay tuned for more news on this great partnership and go like the Tunnel Car Wash Facebook page!

Tunnel Car Wash - https://www.facebook.com/Tunnel-Car-Wash-105681267619110/",2020-08-01 18:06:03,,
89,0.0,,0.0,,1757610361054541,FYI,https://facebook.com/story.php?story_fbid=1757610361054541&id=479010665581190,"Franklin Elementary
July 31 at 8:42 PM 路

Due to inclement weather, Franklin registration is now closed down for the day. For those who didn't register, stop by Monday between 8 and 3 to pick up paperwork. If that doesn't work for your schedule, we can send the papers home with your child on the first day of school. If you use this option, please have your child return the paperwork (in the red folder) on the next school day. Email Mrs. Pancake with any questions. pancakem@vcsc.k12.in.us",2.0,"FYI

Franklin Elementary
July 31 at 8:42 PM 路

Due to inclement weather, Franklin registration is now closed down for the day. For those who didn't register, stop by Monday between 8 and 3 to pick up paperwork. If that doesn't work for your schedule, we can send the papers home with your child on the first day of school. If you use this option, please have your child return the paperwork (in the red folder) on the next school day. Email Mrs. Pancake with any questions. pancakem@vcsc.k12.in.us",2020-07-31 16:55:27,,
90,0.0,,0.0,,,"Due to inclement weather, Franklin registration is now closed down for the day. For those who didn't register, stop by Monday between 8 and 3 to pick up paperwork. If that doesn't work for your schedule, we can send the papers home with your child on the first day of school. If you use this option, please have your child return the paperwork (in the red folder) on the next school day. Email Mrs. Pancake with any questions. pancakem@vcsc.k12.in.us",https://facebook.com/story.php?story_fbid=3036597519710441&id=424140317622854,,0.0,"Due to inclement weather, Franklin registration is now closed down for the day. For those who didn't register, stop by Monday between 8 and 3 to pick up paperwork. If that doesn't work for your schedule, we can send the papers home with your child on the first day of school. If you use this option, please have your child return the paperwork (in the red folder) on the next school day. Email Mrs. Pancake with any questions. pancakem@vcsc.k12.in.us",,,
91,0.0,https://scontent-atl3-1.xx.fbcdn.net/v/t1.0-9/fr/cp0/e15/q65/116158068_4085163378223274_8968607872650039273_o.jpg?_nc_cat=107&_nc_sid=110474&_nc_ohc=pyjz7fUfFioAX_69EQu&_nc_oc=AQlwto0QpQ7CscadkEf8PrJfuLgO5rjCMnmbxl2OyIqA176CiFqzspIqjCTYNvoe244&_nc_ht=scontent-atl3-1.xx&tp=14&oh=9055b18faa31d74ffe41e3f70957c1aa&oe=5F8235E9,2.0,,1757592514389659,,https://facebook.com/story.php?story_fbid=1757592514389659&id=479010665581190,"Lincoln High School
July 31 at 8:19 PM 路

LHS Back to School Day Info",11.0,"Lincoln High School
July 31 at 8:19 PM 路

LHS Back to School Day Info",2020-07-31 16:20:13,,
92,1.0,,4.0,https://drive.google.com/file/d/1Yd94lKjvbbzOpN1gDR9pf5AqreO7hVtd/view?usp=sharing,1757587444390166,,https://facebook.com/story.php?story_fbid=1757587444390166&id=479010665581190,"DRIVE.GOOGLE.COM
WLA Virtual Information and Consent Form.pdf",11.0,"DRIVE.GOOGLE.COM
WLA Virtual Information and Consent Form.pdf",2020-07-31 16:11:23,,
93,0.0,https://scontent-atl3-1.xx.fbcdn.net/v/t1.0-9/fr/cp0/e15/q65/116704229_4078678748871737_5618911841321551305_o.jpg?_nc_cat=100&_nc_sid=110474&_nc_ohc=jEHdYI9P-LQAX_zwrF4&_nc_ht=scontent-atl3-1.xx&tp=14&oh=74c038c53e3216c5a78ee33e54f198de&oe=5F8314B8,7.0,,1756459167836327,,https://facebook.com/story.php?story_fbid=1756459167836327&id=479010665581190,"Lincoln High School
July 30 at 2:40 PM 路

FRESHMAN ORIENTATION INFO",20.0,"Lincoln High School
July 30 at 2:40 PM 路

FRESHMAN ORIENTATION INFO",2020-07-30 10:41:09,,
94,0.0,,10.0,,1755798704569040,,https://facebook.com/story.php?story_fbid=1755798704569040&id=479010665581190,"Washington Learning Academy - WLA
July 29 at 8:46 PM 路

Mr. Blue (WLA Principal) has new information for our virtual school families.",11.0,"Washington Learning Academy - WLA
July 29 at 8:46 PM 路

Mr. Blue (WLA Principal) has new information for our virtual school families.",2020-07-29 16:46:48,https://video-atl3-1.xx.fbcdn.net/v/t42.9040-2/116400836_330069648160326_2165743700518450951_n.mp4?_nc_cat=106&_nc_sid=985c63&efg=eyJ2ZW5jb2RlX3RhZyI6ImxlZ2FjeV9zZCJ9&_nc_ohc=idkSi7LxoO0AX9s89d3&_nc_ht=video-atl3-1.xx&oh=cfcf758646b6c35e785bc574210eee81&oe=5F5E90F4,
95,1.0,,7.0,https://www.youtube.com/watch?v=7MPtd0HXkjo,1753874091428168,"Mr. Parsleys video update for 7-27-2020.

https://www.youtube.com/watch?v=7MPtd0HXkjo",https://facebook.com/story.php?story_fbid=1753874091428168&id=479010665581190,"YOUTUBE.COM
Mr. Parsley VCSC Update 7-27-2020",34.0,"Mr. Parsleys video update for 7-27-2020.

https://www.youtube.com/watch?v=7MPtd0HXkjo

YOUTUBE.COM
Mr. Parsley VCSC Update 7-27-2020",2020-07-27 14:16:16,,
96,13.0,,8.0,https://www.in.gov/gov/files/Executive%20Order%2020-37%20Face%20Covering%20Requirement.pdf,1753814714767439,"The VCSC Re-Entry Plan has been updated to accommodate the Governor's new Executive Order mandating face masks/coverings. Face masks/coverings will be needed for students grade 3 and up and all staff. Exemptions laid out in the Governor's Executive Order can be found here (https://www.in.gov/gov/files/Executive%20Order%2020-37%20Face%20Covering%20Requirement.pdf). Additional questions can be sent to our helpline (vcschelp@vcsc.k12.in.us). Thank you for your understanding and patience as we all work through these changes together.

https://docs.google.com/document/d/15hMZjHR72pSVJIiDefnys8074GdQYr9wFEbMW-ForIM/edit",https://facebook.com/story.php?story_fbid=1753814714767439&id=479010665581190,"DOCS.GOOGLE.COM
VCSC's Path to Re-Entry",30.0,"The VCSC Re-Entry Plan has been updated to accommodate the Governor's new Executive Order mandating face masks/coverings. Face masks/coverings will be needed for students grade 3 and up and all staff. Exemptions laid out in the Governor's Executive Order can be found here (https://www.in.gov/gov/files/Executive%20Order%2020-37%20Face%20Covering%20Requirement.pdf). Additional questions can be sent to our helpline (vcschelp@vcsc.k12.in.us). Thank you for your understanding and patience as we all work through these changes together.

https://docs.google.com/document/d/15hMZjHR72pSVJIiDefnys8074GdQYr9wFEbMW-ForIM/edit

DOCS.GOOGLE.COM
VCSC's Path to Re-Entry",2020-07-27 12:39:43,,
97,1.0,https://scontent-atl3-1.xx.fbcdn.net/v/t1.0-9/fr/cp0/e15/q65/116323322_3098907600175309_4022664695287594242_n.jpg?_nc_cat=103&_nc_sid=8024bb&_nc_ohc=yk5R-Hb0j90AX8dbDFb&_nc_oc=AQkSDjyZXGpFga4HqW6ukzxidDMCpe1w_UiJH8n5F7Vsh2eFIQXmhelUJBd5-_LSeMY&_nc_ht=scontent-atl3-1.xx&tp=14&oh=65e336a52d91f9d2058be26f6a7a67a3&oe=5F82A726,23.0,,1750932691722308,,https://facebook.com/story.php?story_fbid=1750932691722308&id=479010665581190,"Sodexo Nutrition Vincennes Community Schools
July 24 at 1:45 PM 路

We have something extra juicy for you for Monday's July 27th food distribution. WATERMELON!! Thank you to the Illiana Watermelon Association members, Mouzin Brothers Farm, Freyco Inc and JMR farms Inc for providing us with melons FREE to you. Drive through any of our four elementary schools as normal on Monday between 9am-11am for your FREE meals for the week and a watermelon!

BONUS: This years Watermelon Queen will be visiting during distribution at Franklin and Vigo!!

This will be our last day of food distribution for the summer. We hope you all have enjoyed this program that we were able to provide to your families during these unpredictable times. Thank you for participating.
Mouzin Brothers Farms
Freyco Produce
Jmr Farm",9.0,"Sodexo Nutrition Vincennes Community Schools
July 24 at 1:45 PM 路

We have something extra juicy for you for Monday's July 27th food distribution. WATERMELON!! Thank you to the Illiana Watermelon Association members, Mouzin Brothers Farm, Freyco Inc and JMR farms Inc for providing us with melons FREE to you. Drive through any of our four elementary schools as normal on Monday between 9am-11am for your FREE meals for the week and a watermelon!

BONUS: This years Watermelon Queen will be visiting during distribution at Franklin and Vigo!!

This will be our last day of food distribution for the summer. We hope you all have enjoyed this program that we were able to provide to your families during these unpredictable times. Thank you for participating.
Mouzin Brothers Farms
Freyco Produce
Jmr Farm",2020-07-24 10:17:05,,
98,2.0,,22.0,,1749928248489419,We were so happy to share the new Franklin with our community this week at our Ribbon Cutting. We know our students and teachers are going to love it!,,,0.0,We were so happy to share the new Franklin with our community this week at our Ribbon Cutting. We know our students and teachers are going to love it!,2020-07-23 08:16:08,https://video-atl3-1.xx.fbcdn.net/v/t42.9040-2/110223081_324534545256060_4519868203630904502_n.mp4?_nc_cat=103&_nc_sid=985c63&efg=eyJ2ZW5jb2RlX3RhZyI6ImxlZ2FjeV9zZCJ9&_nc_ohc=rJiPqVC6ZnEAX9MSYDG&_nc_ht=video-atl3-1.xx&oh=d5c4ab840d18bbaf0cdf554f1893ebfd&oe=5F5E864A,
99,33.0,https://scontent-atl3-1.xx.fbcdn.net/v/t1.0-9/fr/cp0/e15/q65/109226124_1749332655215645_6365600330450847781_n.jpg?_nc_cat=101&_nc_sid=110474&_nc_ohc=_AS24kbr1WsAX9tDfJZ&_nc_ht=scontent-atl3-1.xx&tp=14&oh=3834b6d85eb68aea471465c39f3eb6c5&oe=5F83E85C,70.0,,1749332838548960,"ATTENTION VCSC FAMILIES

With the Governor's announcement of a mask mandate starting 7-27-2020, the VCSC will be updating it's Re-Entry Plan to accommodate this change. With the flexibility we have already placed in our plan, this will be an easy adjustment for us. We will release the updated plan and a video from Mr. Parsley on Monday discussing these changes. Thank you for your understanding and patience, as we all work through this together.",https://facebook.com/story.php?story_fbid=1749332838548960&id=479010665581190,,0.0,"ATTENTION VCSC FAMILIES

With the Governor's announcement of a mask mandate starting 7-27-2020, the VCSC will be updating it's Re-Entry Plan to accommodate this change. With the flexibility we have already placed in our plan, this will be an easy adjustment for us. We will release the updated plan and a video from Mr. Parsley on Monday discussing these changes. Thank you for your understanding and patience, as we all work through this together.",2020-07-22 15:50:37,,
100,0.0,,0.0,https://docs.google.com/forms/d/e/1FAIpQLSf3ZlyZk8orixQVPP5KOZ2m1wzaFZ6_YE8_BSEMJ6_457zdTw/viewform,1747997702015807,,https://facebook.com/story.php?story_fbid=1747997702015807&id=479010665581190,"DOCS.GOOGLE.COM
Vincennes Community School Corporation Parent/Guardian Request for Virtual At-Home Learning for 2020-21",3.0,"DOCS.GOOGLE.COM
Vincennes Community School Corporation Parent/Guardian Request for Virtual At-Home Learning for 2020-21",2020-07-21 06:07:20,,
101,15.0,,8.0,https://drive.google.com/file/d/1NK_lUhGXPoT0Vh7HERq2tc4kvRG2XTnz/view?usp=sharing,1747572458724998,"Attention VCSC Families,

Below are the links from the two texts we sent you this morning concerning the beginning of school. Please read. Thank you.

Attached is a letter explaining the beginning of the VCSC school year, with your educational options. Please read.
https://drive.google.com/file/d/1NK_lUhGXPoT0Vh7HERq2tc4kvRG2XTnz/view?usp=sharing

If you are interested in the VCSCs At-Home/Online Learning, please fill out the form and we will contact you. https://docs.google.com/forms/d/e/1FAIpQLSf3ZlyZk8orixQVPP5KOZ2m1wzaFZ6_YE8_BSEMJ6_457zdTw/viewform",https://facebook.com/story.php?story_fbid=1747572458724998&id=479010665581190,"DOCS.GOOGLE.COM
Vincennes Community School Corporation Parent/Guardian Request for Virtual At-Home Learning for 2020-21",93.0,"Attention VCSC Families,

Below are the links from the two texts we sent you this morning concerning the beginning of school. Please read. Thank you.

Attached is a letter explaining the beginning of the VCSC school year, with your educational options. Please read.
https://drive.google.com/file/d/1NK_lUhGXPoT0Vh7HERq2tc4kvRG2XTnz/view?usp=sharing

If you are interested in the VCSCs At-Home/Online Learning, please fill out the form and we will contact you. https://docs.google.com/forms/d/e/1FAIpQLSf3ZlyZk8orixQVPP5KOZ2m1wzaFZ6_YE8_BSEMJ6_457zdTw/viewform

DOCS.GOOGLE.COM
Vincennes Community School Corporation Parent/Guardian Request for Virtual At-Home Learning for 2020-21",2020-07-20 17:28:26,,
102,97.0,,72.0,,748705692548742,"LHS Class of 2020 Graduation Ceremony

Feed will start at 6:55pm

Ceremony will start at 7:00pm

Our video is placed in an area to maximize student and parent viewing, while we social distance inside.

Thank you for watching.",,,69.0,"LHS Class of 2020 Graduation Ceremony

Feed will start at 6:55pm

Ceremony will start at 7:00pm

Our video is placed in an area to maximize student and parent viewing, while we social distance inside.

Thank you for watching.",2020-07-17 18:53:20,https://video-atl3-1.xx.fbcdn.net/v/t42.26565-2/10000000_293979971962015_7876011614665167007_n.mp4?_nc_cat=103&_nc_sid=985c63&efg=eyJ2ZW5jb2RlX3RhZyI6Im9lcF9zZCJ9&_nc_ohc=__DNfYNV-FAAX8v-HHU&_nc_ht=video-atl3-1.xx&oh=736df05cda516c287f8d910e92d594d7&oe=5F5E8763,
103,1.0,,20.0,https://www.youtube.com/watch?v=wiWc0Clw68U,1744833452332232,"VCSC Update for 7-17-2020

There is a lot of good news as we move closer to the beginning of school. Our community is in a very good position for reentry on August 6th. As you know, all plans are subject to change but we have a strong foundation with our VCSC Reentry Plan that will allow us to overcome anything and everything. Next week, we will be sending out a survey of interest in virtual at-home learning. This is different than our eLearning and will be a program, self paced that will be done at home by the student. While we believe in person learning is best for our students and community, our goal is to provide platforms for our students if in person instruction isnt an option. We thank you for all your patience and understanding as we go through this together. Have a great weekend.

https://www.youtube.com/watch?v=wiWc0Clw68U",https://facebook.com/story.php?story_fbid=1744833452332232&id=479010665581190,"YOUTUBE.COM
Mr. Parsley's VCSC Update 7-17-2020 (UPDATED)",56.0,"VCSC Update for 7-17-2020

There is a lot of good news as we move closer to the beginning of school. Our community is in a very good position for reentry on August 6th. As you know, all plans are subject to change but we have a strong foundation with our VCSC Reentry Plan that will allow us to overcome anything and everything. Next week, we will be sending out a survey of interest in virtual at-home learning. This is different than our eLearning and will be a program, self paced that will be done at home by the student. While we believe in person learning is best for our students and community, our goal is to provide platforms for our students if in person instruction isnt an option. We thank you for all your patience and understanding as we go through this together. Have a great weekend.

https://www.youtube.com/watch?v=wiWc0Clw68U

YOUTUBE.COM
Mr. Parsley's VCSC Update 7-17-2020 (UPDATED)",2020-07-17 16:00:42,,
104,3.0,,28.0,,1744631625685748,,https://facebook.com/story.php?story_fbid=1744631625685748&id=479010665581190,"Amanda Hendrickson-LinnVCSC News
July 17 at 2:19 PM 路

Fords the Art of Photography will be at LHS Graduation
photographing each senior as they are handed their diploma cases.
All individual images will be available for FREE high-resolution downloads as a give to the Seniors.
There will be options to order prints if desired at special pricing.
Before Sunday evening, I will have the link to the gallery from the evening.
Congratulation to ALL Graduating Seniors

PLEASE SHARE",11.0,"Amanda Hendrickson-LinnVCSC News
July 17 at 2:19 PM 路

Fords the Art of Photography will be at LHS Graduation
photographing each senior as they are handed their diploma cases.
All individual images will be available for FREE high-resolution downloads as a give to the Seniors.
There will be options to order prints if desired at special pricing.
Before Sunday evening, I will have the link to the gallery from the evening.
Congratulation to ALL Graduating Seniors

PLEASE SHARE",2020-07-17 10:22:32,,
105,8.0,https://scontent-atl3-1.xx.fbcdn.net/v/t1.0-9/fr/cp0/e15/q65/108154854_1744000105748900_5992446279501849799_o.jpg?_nc_cat=110&_nc_sid=110474&_nc_ohc=68csvuT5O2sAX91fPLC&_nc_ht=scontent-atl3-1.xx&tp=14&oh=2e0a5719ca9e104486fa3b786e69a73d&oe=5F856A56,64.0,,1744000269082217,"2020 Graduation TOMORROW

Graduation Practice 9:00 AM. Enter through external doors at Ader.

Graduation 7:00. Doors open at 6:15.

Recommended face coverings.

Recommended 4 guests per graduate.

Sections of bleachers will be marked off to help with social distancing.

Live feed will be on this page and then shared out on our other pages.",https://facebook.com/story.php?story_fbid=1744000269082217&id=479010665581190,,0.0,"2020 Graduation TOMORROW

Graduation Practice 9:00 AM. Enter through external doors at Ader.

Graduation 7:00. Doors open at 6:15.

Recommended face coverings.

Recommended 4 guests per graduate.

Sections of bleachers will be marked off to help with social distancing.

Live feed will be on this page and then shared out on our other pages.",2020-07-16 17:40:53,,
106,1.0,,4.0,https://www.youtube.com/watch?v=CA2d6_45cUM,1741994152616162,,https://facebook.com/story.php?story_fbid=1741994152616162&id=479010665581190,"YOUTUBE.COM
2020 Graduation is Almost HERE!",0.0,"YOUTUBE.COM
2020 Graduation is Almost HERE!",2020-07-14 13:09:16,,
107,0.0,https://scontent-atl3-1.xx.fbcdn.net/v/t1.0-9/fr/cp0/e15/q65/108814510_1739204802895097_6857437808855260279_o.jpg?_nc_cat=102&_nc_sid=110474&_nc_ohc=zzZeXp2VYT0AX-S8bcd&_nc_ht=scontent-atl3-1.xx&tp=14&oh=4a9567bc9cc58557f3a5d195f9ccf9c1&oe=5F8371BF,16.0,,1739211236227787,"Our Franklin Open House is almost here!

Event Info - https://www.facebook.com/events/s/franklin-ribbon-cutting-and-op/199821057770388/?ti=ia",https://facebook.com/story.php?story_fbid=1739211236227787&id=479010665581190,,0.0,"Our Franklin Open House is almost here!

Event Info - https://www.facebook.com/events/s/franklin-ribbon-cutting-and-op/199821057770388/?ti=ia",2020-07-11 12:50:58,,
108,1.0,,6.0,https://www.youtube.com/watch?v=CA2d6_45cUM,1738927699589474,,https://facebook.com/story.php?story_fbid=1738927699589474&id=479010665581190,"YOUTUBE.COM
2020 Graduation is Almost HERE!",8.0,"YOUTUBE.COM
2020 Graduation is Almost HERE!",2020-07-11 06:43:19,,
109,0.0,,9.0,https://www.youtube.com/watch?v=CA2d6_45cUM,1738643096284601,https://www.youtube.com/watch?v=CA2d6_45cUM,https://facebook.com/story.php?story_fbid=1738643096284601&id=479010665581190,"YOUTUBE.COM
2020 Graduation is Almost HERE!",33.0,"https://www.youtube.com/watch?v=CA2d6_45cUM

YOUTUBE.COM
2020 Graduation is Almost HERE!",2020-07-10 23:33:54,,
110,22.0,https://scontent-atl3-1.xx.fbcdn.net/v/t1.0-9/fr/cp0/e15/q65/107537097_1736559223159655_2143737083665260381_n.jpg?_nc_cat=107&_nc_sid=8024bb&_nc_ohc=4wTKvL2bW9cAX8Pc-r7&_nc_ht=scontent-atl3-1.xx&tp=14&oh=e9047cb63f86300f3e1319fd4c5e31e1&oe=5F85A262,33.0,,1736560586492852,,https://facebook.com/story.php?story_fbid=1736560586492852&id=479010665581190,,0.0,,2020-07-09 16:00:39,,
111,0.0,,4.0,,1734396070042637,,https://facebook.com/story.php?story_fbid=1734396070042637&id=479010665581190,"Sodexo Nutrition Vincennes Community Schools
July 6 at 1:42 PM 路",4.0,"Sodexo Nutrition Vincennes Community Schools
July 6 at 1:42 PM 路",2020-07-06 09:48:31,,
112,0.0,,0.0,,,,https://facebook.com/story.php?story_fbid=3050177068381696&id=1096512137081542,,0.0,,,,
113,0.0,,7.0,,1728008300681414,,https://facebook.com/story.php?story_fbid=1728008300681414&id=479010665581190,"Lincoln High School
June 29 at 4:24 PM 路

Class of 2020 Graduates,
Recently, an RSVP card for attendance to the graduation ceremony was mailed to your home address. Please disregard the deadline, complete and return ASAP.
Thank you!",7.0,"Lincoln High School
June 29 at 4:24 PM 路

Class of 2020 Graduates,
Recently, an RSVP card for attendance to the graduation ceremony was mailed to your home address. Please disregard the deadline, complete and return ASAP.
Thank you!",2020-06-29 12:52:20,,
114,0.0,,0.0,,,"Class of 2020 Graduates,
Recently, an RSVP card for attendance to the graduation ceremony was mailed to your home address. Please disregard the deadline, complete and return ASAP.
Thank you!",https://facebook.com/story.php?story_fbid=3936164783123135&id=123468411059477,,0.0,"Class of 2020 Graduates,
Recently, an RSVP card for attendance to the graduation ceremony was mailed to your home address. Please disregard the deadline, complete and return ASAP.
Thank you!",,,
115,0.0,https://scontent-atl3-1.xx.fbcdn.net/v/t1.0-9/fr/cp0/e15/q65/104883164_3031587616907308_5501290461264068825_n.jpg?_nc_cat=109&_nc_sid=110474&_nc_ohc=awH6ZhHixRwAX_PoenJ&_nc_ht=scontent-atl3-1.xx&tp=14&oh=d36a8bd34c7a387d9e6514946c7fa1f8&oe=5F82E618,2.0,,1727830517365859,Theres still time!,https://facebook.com/story.php?story_fbid=1727830517365859&id=479010665581190,"Sodexo Nutrition Vincennes Community Schools
June 29 at 12:12 PM 路

Its distribution day!!! Come get your free meals for the week. All kids ages 18 and under. Drive thru style at all 4 elementary schools. 9am-11am.",0.0,"Theres still time!

Sodexo Nutrition Vincennes Community Schools
June 29 at 12:12 PM 路

Its distribution day!!! Come get your free meals for the week. All kids ages 18 and under. Drive thru style at all 4 elementary schools. 9am-11am.",2020-06-29 09:28:41,,
116,1.0,,6.0,https://youtu.be/D1ObD2fiiBQ,1724985974316980,VCSC Updates,https://facebook.com/story.php?story_fbid=1724985974316980&id=479010665581190,"YOUTUBE.COM
VCSC UPDATE 6-25-2020",8.0,"VCSC Updates

YOUTUBE.COM
VCSC UPDATE 6-25-2020",2020-06-26 11:48:51,,
117,1.0,https://scontent-atl3-1.xx.fbcdn.net/v/t1.0-9/fr/cp0/e15/q65/104747697_1718683858280525_2665540159300340973_o.jpg?_nc_cat=101&_nc_sid=110474&_nc_ohc=7Cs1JKdm_DMAX-S-Hfx&_nc_ht=scontent-atl3-1.xx&tp=14&oh=a6bedd47e0dda74e132300ca0537eec2&oe=5F847DA6,48.0,,1718684358280475,,https://facebook.com/story.php?story_fbid=1718684358280475&id=479010665581190,,0.0,,2020-06-19 16:18:40,,
118,12.0,,34.0,,1716737675141810,Congratulations Mrs. Niehaus!,https://facebook.com/story.php?story_fbid=1716737675141810&id=479010665581190,"Knox County Chamber Of Commerce
June 17 at 4:30 PM 路

The Knox County Chamber of Commerce is proud to announce the 2020 Educator of the Year is Tina Niehaus. She has been a teacher for 32 years, having spent 29 of those years teaching first grade at Tecumseh-Harrison Elementary School in Vincennes.

The Educator of the Year is for a teacher or administrator working in a Knox County K-12 public or private school system. The recipient was selected based on years of service, accomplishments in the profession and endearment from students and other educators.

Tina shows her dedication to her education profession through being a leader in innovation within her classroom. Co-workers have said they admire Tina because of her open mindset and her end visions is always on the kids they serve.

Tina will be recognized on Friday, June 19, 2020 at noon through a virtual Facebook event on the Knox County Chamber of Commerce's Facebook page.",0.0,"Congratulations Mrs. Niehaus!

Knox County Chamber Of Commerce
June 17 at 4:30 PM 路

The Knox County Chamber of Commerce is proud to announce the 2020 Educator of the Year is Tina Niehaus. She has been a teacher for 32 years, having spent 29 of those years teaching first grade at Tecumseh-Harrison Elementary School in Vincennes.

The Educator of the Year is for a teacher or administrator working in a Knox County K-12 public or private school system. The recipient was selected based on years of service, accomplishments in the profession and endearment from students and other educators.

Tina shows her dedication to her education profession through being a leader in innovation within her classroom. Co-workers have said they admire Tina because of her open mindset and her end visions is always on the kids they serve.

Tina will be recognized on Friday, June 19, 2020 at noon through a virtual Facebook event on the Knox County Chamber of Commerce's Facebook page.",2020-06-17 13:13:43,,
119,0.0,https://scontent-atl3-1.xx.fbcdn.net/v/t1.0-9/fr/cp0/e15/q65/103092371_883653898807094_81340104331025102_o.jpg?_nc_cat=104&_nc_sid=8024bb&_nc_ohc=aIO7ofy6QB8AX8tSHZM&_nc_oc=AQkqrvrrUW7gWAHqH6WnuDwUrxHpo8Yn76IkZmQWC8-dOCk7wCNUrhxL3uWiaIIuO3U&_nc_ht=scontent-atl3-1.xx&tp=14&oh=f245ee44ac8c24d4dc8c656e334f7080&oe=5F8537FA,0.0,,1713926222089622,,https://facebook.com/story.php?story_fbid=1713926222089622&id=479010665581190,"The Online Alice
June 9 at 7:48 PM 路

Class of 2024 -

LHS summer school has been canceled due to the COVID-19 pandemic. If your student plans to take PE their Freshman year at LHS, during the regular school year, there is nothing you need to do.

If your student wants to earn one or both of their PE credits using Summer PE or a PE waiver, Ive attached the policy for the class of 2024, only. This will need to be returned to Mrs. Tolliver by July 27, 2020. Please read carefully, and give me a call at 812-882-6168 if you have questions.

I hope all of you are well and we look forward to seeing you at Lincoln in August.

Mr. Combs",0.0,"The Online Alice
June 9 at 7:48 PM 路

Class of 2024 -

LHS summer school has been canceled due to the COVID-19 pandemic. If your student plans to take PE their Freshman year at LHS, during the regular school year, there is nothing you need to do.

If your student wants to earn one or both of their PE credits using Summer PE or a PE waiver, Ive attached the policy for the class of 2024, only. This will need to be returned to Mrs. Tolliver by July 27, 2020. Please read carefully, and give me a call at 812-882-6168 if you have questions.

I hope all of you are well and we look forward to seeing you at Lincoln in August.

Mr. Combs",2020-06-14 11:13:51,,
120,1.0,https://scontent-atl3-1.xx.fbcdn.net/v/t1.0-9/fr/cp0/e15/q65/103303192_1710530415762536_531976521094731626_o.jpg?_nc_cat=106&_nc_sid=110474&_nc_ohc=tCTBf_t58sAAX-DqZX1&_nc_ht=scontent-atl3-1.xx&tp=14&oh=de9ebbc9c810ba654513834a097cf64c&oe=5F834474,70.0,,1710530462429198,"Class of 2020 Graduation Ceremony
Friday, July 17th
7:00pm
Alice Arena

We look forward to celebrating the Class of 2020 with their families and our community. We welcome all and will have a live feed available for those more comfortable with watching. Graduation guidelines will be released later but they will be minimal and easy to follow. Congratulations Class of 2020!",https://facebook.com/story.php?story_fbid=1710530462429198&id=479010665581190,,0.0,"Class of 2020 Graduation Ceremony
Friday, July 17th
7:00pm
Alice Arena

We look forward to celebrating the Class of 2020 with their families and our community. We welcome all and will have a live feed available for those more comfortable with watching. Graduation guidelines will be released later but they will be minimal and easy to follow. Congratulations Class of 2020!",2020-06-10 17:39:49,,
121,0.0,https://scontent-atl3-1.xx.fbcdn.net/v/t1.0-9/fr/cp0/e15/q65/103092371_883653898807094_81340104331025102_o.jpg?_nc_cat=104&_nc_sid=8024bb&_nc_ohc=aIO7ofy6QB8AX8tSHZM&_nc_oc=AQkqrvrrUW7gWAHqH6WnuDwUrxHpo8Yn76IkZmQWC8-dOCk7wCNUrhxL3uWiaIIuO3U&_nc_ht=scontent-atl3-1.xx&tp=14&oh=f245ee44ac8c24d4dc8c656e334f7080&oe=5F8537FA,5.0,,1709595865855991,,https://facebook.com/story.php?story_fbid=1709595865855991&id=479010665581190,"The Online Alice
June 9 at 7:48 PM 路

Class of 2024 -

LHS summer school has been canceled due to the COVID-19 pandemic. If your student plans to take PE their Freshman year at LHS, during the regular school year, there is nothing you need to do.

If your student wants to earn one or both of their PE credits using Summer PE or a PE waiver, Ive attached the policy for the class of 2024, only. This will need to be returned to Mrs. Tolliver by July 27, 2020. Please read carefully, and give me a call at 812-882-6168 if you have questions.

I hope all of you are well and we look forward to seeing you at Lincoln in August.

Mr. Combs",3.0,"The Online Alice
June 9 at 7:48 PM 路

Class of 2024 -

LHS summer school has been canceled due to the COVID-19 pandemic. If your student plans to take PE their Freshman year at LHS, during the regular school year, there is nothing you need to do.

If your student wants to earn one or both of their PE credits using Summer PE or a PE waiver, Ive attached the policy for the class of 2024, only. This will need to be returned to Mrs. Tolliver by July 27, 2020. Please read carefully, and give me a call at 812-882-6168 if you have questions.

I hope all of you are well and we look forward to seeing you at Lincoln in August.

Mr. Combs",2020-06-09 15:56:28,,
122,0.0,,14.0,https://docs.google.com/forms/d/e/1FAIpQLSd1xZlQrRDudySa1MUJqlqJ_u1nt_RtDzg09g60_tIVAduNLQ/viewform,1708788602603384,"The Back to School Survey can be found here! We have also fixed the Extracurricular question. If you need to add more to that, send us a private message and we will get it added. Thank you.

https://docs.google.com/forms/d/e/1FAIpQLSd1xZlQrRDudySa1MUJqlqJ_u1nt_RtDzg09g60_tIVAduNLQ/viewform",https://facebook.com/story.php?story_fbid=1708788602603384&id=479010665581190,"DOCS.GOOGLE.COM
2020 VCSC Back to School Survey",107.0,"The Back to School Survey can be found here! We have also fixed the Extracurricular question. If you need to add more to that, send us a private message and we will get it added. Thank you.

https://docs.google.com/forms/d/e/1FAIpQLSd1xZlQrRDudySa1MUJqlqJ_u1nt_RtDzg09g60_tIVAduNLQ/viewform

DOCS.GOOGLE.COM
2020 VCSC Back to School Survey",2020-06-08 18:19:32,,
123,0.0,,3.0,https://youtu.be/9Tf2m7iPL14,1708643085951269,Summer Updates 6-8-2020,https://facebook.com/story.php?story_fbid=1708643085951269&id=479010665581190,"YOUTUBE.COM
Mr. Parsley Summer Updates 6-8-2020",11.0,"Summer Updates 6-8-2020

YOUTUBE.COM
Mr. Parsley Summer Updates 6-8-2020",2020-06-08 14:17:54,,
124,0.0,https://scontent-atl3-1.xx.fbcdn.net/v/t1.0-9/fr/cp0/e15/q65/101533714_1706949462787298_418634834851715158_o.jpg?_nc_cat=105&_nc_sid=110474&_nc_ohc=Ncoh2vUzzaIAX-EPdHu&_nc_ht=scontent-atl3-1.xx&tp=14&oh=4cba16f773e4d262c933b671ae3b0900&oe=5F849137,34.0,,1706949492787295,,https://facebook.com/story.php?story_fbid=1706949492787295&id=479010665581190,,0.0,,2020-06-06 17:54:13,,
125,2.0,,4.0,,1701843729964538,,https://facebook.com/story.php?story_fbid=1701843729964538&id=479010665581190,"Sodexo Nutrition Vincennes Community Schools
June 1 at 12:55 PM 路

Food distribution is TODAY!! 9-11am at Tecumseh, Riley, Vigo and Washington.
Tecumseh - Back of school
Riley - Alley
Vigo - Loop
Washington - Student drop off door",2.0,"Sodexo Nutrition Vincennes Community Schools
June 1 at 12:55 PM 路

Food distribution is TODAY!! 9-11am at Tecumseh, Riley, Vigo and Washington.
Tecumseh - Back of school
Riley - Alley
Vigo - Loop
Washington - Student drop off door",2020-06-01 09:06:01,,
126,0.0,,0.0,,,"Food distribution is TODAY!! 9-11am at Tecumseh, Riley, Vigo and Washington.
Tecumseh - Back of school
Riley - Alley
Vigo - Loop
Washington - Student drop off door",https://facebook.com/story.php?story_fbid=2956787447720659&id=1096512137081542,,0.0,"Food distribution is TODAY!! 9-11am at Tecumseh, Riley, Vigo and Washington.
Tecumseh - Back of school
Riley - Alley
Vigo - Loop
Washington - Student drop off door",,,
127,0.0,,7.0,,1698764060272505,TODAY!,https://facebook.com/story.php?story_fbid=1698764060272505&id=479010665581190,"The Online Alice
May 14 at 10:28 PM 路

Celebrate our Seniors with us! Come help us decorate!",2.0,"TODAY!

The Online Alice
May 14 at 10:28 PM 路

Celebrate our Seniors with us! Come help us decorate!",2020-05-29 07:33:16,https://video-atl3-1.xx.fbcdn.net/v/t42.9040-2/96429573_2565915700327358_8488637921467826176_n.mp4?_nc_cat=107&_nc_sid=985c63&efg=eyJ2ZW5jb2RlX3RhZyI6ImxlZ2FjeV9zZCJ9&_nc_ohc=6ac3F7lpjYkAX8TL6Y-&_nc_ht=video-atl3-1.xx&oh=466224cf54d51fcfa15fa83dc24fe569&oe=5F5E8655,
128,0.0,,9.0,,1697271337088444,,https://facebook.com/story.php?story_fbid=1697271337088444&id=479010665581190,"Lincoln High School
May 27 at 4:53 PM 路

CLASS OF 2020 GRADUATES
DIPLOMA DRIVE-THRU EVENT
DATE: FRIDAY, MAY 29TH
TIME: 6:00-8:00 PM
LOCATION: LINCOLN HIGH SCHOOL-HART STREET SIDE

This is for ALL 2020 graduates, even if you plan to participate in a graduation ceremony in July. Graduates may also return their devices during this event.

For the safety of all involved and to keep this event as efficient as possible, please....
1. Enter the first parking lot entrance from Hart Street
2. Pull up by the side of the building/sidewalk
3. Stay in your vehicle
4. Provide your name/students name to receive your graduate packet
5. If necessary, turn in your device with charger",8.0,"Lincoln High School
May 27 at 4:53 PM 路

CLASS OF 2020 GRADUATES
DIPLOMA DRIVE-THRU EVENT
DATE: FRIDAY, MAY 29TH
TIME: 6:00-8:00 PM
LOCATION: LINCOLN HIGH SCHOOL-HART STREET SIDE

This is for ALL 2020 graduates, even if you plan to participate in a graduation ceremony in July. Graduates may also return their devices during this event.

For the safety of all involved and to keep this event as efficient as possible, please....
1. Enter the first parking lot entrance from Hart Street
2. Pull up by the side of the building/sidewalk
3. Stay in your vehicle
4. Provide your name/students name to receive your graduate packet
5. If necessary, turn in your device with charger",2020-05-27 14:46:46,,
129,0.0,,0.0,,,"CLASS OF 2020 GRADUATES
DIPLOMA DRIVE-THRU EVENT
DATE: FRIDAY, MAY 29TH
TIME: 6:00-8:00 PM
LOCATION: LINCOLN HIGH SCHOOL-HART STREET SIDE

This is for ALL 2020 graduates, even if you plan to participate in a graduation ceremony in July. Graduates may also return their devices during this event.

For the safety of all involved and to keep this event as efficient as possible, please....
1. Enter the first parking lot entrance from Hart Street
2. Pull up by the side of the building/sidewalk
3. Stay in your vehicle
4. Provide your name/students name to receive your graduate packet
5. If necessary, turn in your device with charger",https://facebook.com/story.php?story_fbid=3799018143504467&id=123468411059477,,0.0,"CLASS OF 2020 GRADUATES
DIPLOMA DRIVE-THRU EVENT
DATE: FRIDAY, MAY 29TH
TIME: 6:00-8:00 PM
LOCATION: LINCOLN HIGH SCHOOL-HART STREET SIDE

This is for ALL 2020 graduates, even if you plan to participate in a graduation ceremony in July. Graduates may also return their devices during this event.

For the safety of all involved and to keep this event as efficient as possible, please....
1. Enter the first parking lot entrance from Hart Street
2. Pull up by the side of the building/sidewalk
3. Stay in your vehicle
4. Provide your name/students name to receive your graduate packet
5. If necessary, turn in your device with charger",,,
130,0.0,https://scontent-atl3-1.xx.fbcdn.net/v/t1.0-9/fr/cp0/e15/q65/100892776_1695176623964582_6546715393984036864_o.jpg?_nc_cat=104&_nc_sid=8024bb&_nc_ohc=cluq0_DpLEMAX_q49Vh&_nc_ht=scontent-atl3-1.xx&tp=14&oh=eb27f475d98c2c74e552b81be55da70c&oe=5F83F3D5,11.0,,1695179793964265,"REMINDER: Food Distribution is on TUESDAY (May, 26th) this week. Time (9 am-11 am) and places (all VCSC elementary schools) of distribution will be the same.

Food Distribution will continue on Monday, and the following Mondays of the summer, starting on June 1st. There will be no deliveries during the summer. Anyone (family, friend, neighbor, etc.) can pick up food for a student, as long as we have a name.

Thank you for your time, understanding, and patience.",https://facebook.com/story.php?story_fbid=1695179793964265&id=479010665581190,,0.0,"REMINDER: Food Distribution is on TUESDAY (May, 26th) this week. Time (9 am-11 am) and places (all VCSC elementary schools) of distribution will be the same.

Food Distribution will continue on Monday, and the following Mondays of the summer, starting on June 1st. There will be no deliveries during the summer. Anyone (family, friend, neighbor, etc.) can pick up food for a student, as long as we have a name.

Thank you for your time, understanding, and patience.",2020-05-25 05:12:31,,
131,3.0,,17.0,,1693003747515203,,https://facebook.com/story.php?story_fbid=1693003747515203&id=479010665581190,"Vigo Elementary School was live.
May 22 at 9:12 PM 路

Vigo Parade!",0.0,"Vigo Elementary School was live.
May 22 at 9:12 PM 路

Vigo Parade!",2020-05-22 17:13:20,https://scontent-atl3-1.xx.fbcdn.net/v/t66.36281-6/48578276_703152933600333_4808816390597737112_n.mp4?_nc_cat=111&_nc_sid=985c63&efg=eyJ2ZW5jb2RlX3RhZyI6Im9lcF9zZCJ9&_nc_ohc=iUSpEms_RfYAX-hDZU2&_nc_ht=scontent-atl3-1.xx&oh=44de5ad1ee6ab68ea62ce0ef1b35d867&oe=5F82341D,
132,0.0,,0.0,http://Jostens.com/,1692879320860979,,https://facebook.com/story.php?story_fbid=1692879320860979&id=479010665581190,"Lincoln High School
May 22 at 5:39 PM 路

May 31 is the last day for Lincoln students to order the 2020 Lincoln Log yearbook! Go to Jostens.com to order. This is the only way you will guarantee owning the yearbook that captures this historic year.",0.0,"Lincoln High School
May 22 at 5:39 PM 路

May 31 is the last day for Lincoln students to order the 2020 Lincoln Log yearbook! Go to Jostens.com to order. This is the only way you will guarantee owning the yearbook that captures this historic year.",2020-05-22 13:40:12,https://video-atl3-1.xx.fbcdn.net/v/t42.9040-2/99255806_710358483114834_79253987836035072_n.mp4?_nc_cat=109&_nc_sid=985c63&efg=eyJ2ZW5jb2RlX3RhZyI6ImxlZ2FjeV9zZCJ9&_nc_ohc=e9FXOEFK5zcAX8O0mzI&_nc_ht=video-atl3-1.xx&oh=4391827b5fc91ab5d7efdb36821a1629&oe=5F5E8EC0,
133,0.0,,4.0,https://www.youtube.com/watch?v=Rb4_lwgzzrI&t=2s,1689631824519062,"Mr. Parsley's Weekly Update:

https://www.youtube.com/watch?v=Rb4_lwgzzrI&t=2s",https://facebook.com/story.php?story_fbid=1689631824519062&id=479010665581190,"YOUTUBE.COM
Mr. Parsley's Weekly Update 5-18-2020",3.0,"Mr. Parsley's Weekly Update:

https://www.youtube.com/watch?v=Rb4_lwgzzrI&t=2s

YOUTUBE.COM
Mr. Parsley's Weekly Update 5-18-2020",2020-05-18 20:33:49,,
134,0.0,,14.0,https://www.youtube.com/watch?v=d5MtKdEoXik,1689366464545598,"Congratulations Class of 2020! We are so proud of you!

https://www.youtube.com/watch?v=d5MtKdEoXik",https://facebook.com/story.php?story_fbid=1689366464545598&id=479010665581190,"YOUTUBE.COM
Congratulations Lincoln High School Class of 2020!",20.0,"Congratulations Class of 2020! We are so proud of you!

https://www.youtube.com/watch?v=d5MtKdEoXik

YOUTUBE.COM
Congratulations Lincoln High School Class of 2020!",2020-05-18 13:41:15,,
135,0.0,,3.0,,1689107077904870,,https://facebook.com/story.php?story_fbid=1689107077904870&id=479010665581190,"Sodexo Nutrition Vincennes Community Schools
May 18 at 12:04 PM 路

It is food distribution day. Pick up locations are Tecumseh, Riley, Vigo and Washington. 9-11am. There is lots of food available. Take advantage of this opportunity.",5.0,"Sodexo Nutrition Vincennes Community Schools
May 18 at 12:04 PM 路

It is food distribution day. Pick up locations are Tecumseh, Riley, Vigo and Washington. 9-11am. There is lots of food available. Take advantage of this opportunity.",2020-05-18 08:16:23,,
136,0.0,,0.0,,,"It is food distribution day. Pick up locations are Tecumseh, Riley, Vigo and Washington. 9-11am. There is lots of food available. Take advantage of this opportunity.",https://facebook.com/story.php?story_fbid=2923111451088259&id=1096512137081542,,0.0,"It is food distribution day. Pick up locations are Tecumseh, Riley, Vigo and Washington. 9-11am. There is lots of food available. Take advantage of this opportunity.",,,
137,0.0,,10.0,,1685797388235839,,https://facebook.com/story.php?story_fbid=1685797388235839&id=479010665581190,"The Online Alice
May 14 at 10:28 PM 路

Celebrate our Seniors with us! Come help us decorate!",3.0,"The Online Alice
May 14 at 10:28 PM 路

Celebrate our Seniors with us! Come help us decorate!",2020-05-14 18:28:34,https://video-atl3-1.xx.fbcdn.net/v/t42.9040-2/96429573_2565915700327358_8488637921467826176_n.mp4?_nc_cat=107&_nc_sid=985c63&efg=eyJ2ZW5jb2RlX3RhZyI6ImxlZ2FjeV9zZCJ9&_nc_ohc=6ac3F7lpjYkAX8TL6Y-&_nc_ht=video-atl3-1.xx&oh=466224cf54d51fcfa15fa83dc24fe569&oe=5F5E8655,
138,3.0,,27.0,,1685790538236524,,https://facebook.com/story.php?story_fbid=1685790538236524&id=479010665581190,,5.0,,2020-05-14 18:14:39,,
139,0.0,,0.0,,,,https://facebook.com/story.php?story_fbid=1610326009131906&id=598841323613718,,0.0,,,,
140,1.0,,11.0,https://www.youtube.com/watch?v=qFB3JbvWiwY,1684757925006452,,https://facebook.com/story.php?story_fbid=1684757925006452&id=479010665581190,"YOUTUBE.COM
Final Franklin Remodel Walkthrough",2.0,"YOUTUBE.COM
Final Franklin Remodel Walkthrough",2020-05-13 15:15:34,,
141,0.0,,4.0,https://www.youtube.com/watch?v=axBa7vWBZW8,1682958741853037,"Mr. Parsley's Weekly Update 5-11-2020

https://www.youtube.com/watch?v=axBa7vWBZW8",https://facebook.com/story.php?story_fbid=1682958741853037&id=479010665581190,"YOUTUBE.COM
Mr. Parsley Weekly Update 5-11-2020",5.0,"Mr. Parsley's Weekly Update 5-11-2020

https://www.youtube.com/watch?v=axBa7vWBZW8

YOUTUBE.COM
Mr. Parsley Weekly Update 5-11-2020",2020-05-11 14:35:16,,
142,0.0,,2.0,https://youtu.be/jN8GO7DkxXE,1680432872105624,,https://facebook.com/story.php?story_fbid=1680432872105624&id=479010665581190,"YOUTUBE.COM
Mr. Combs Weekly Update 5-8-2020",0.0,"YOUTUBE.COM
Mr. Combs Weekly Update 5-8-2020",2020-05-08 23:12:06,,
143,1.0,https://scontent-atl3-1.xx.fbcdn.net/v/t1.0-9/fr/cp0/e15/q65/96250264_1680327788782799_6539554510975533056_o.jpg?_nc_cat=109&_nc_sid=110474&_nc_ohc=2pjbxTz2Bw0AX_ebKDy&_nc_ht=scontent-atl3-1.xx&tp=14&oh=3a45f43195224e5de61d968af63980dd&oe=5F83E854,13.0,,1680327818782796,,https://facebook.com/story.php?story_fbid=1680327818782796&id=479010665581190,,0.0,,2020-05-08 20:21:26,,
144,0.0,,2.0,https://docs.google.com/forms/d/e/1FAIpQLSeP29E3FaanQDWtCF_h4gwl8x5ZKqbPvanaONe8Ullrwb13Og/viewform?usp=sf_link,1680062755475969,LHS/CMS Dance Tryout Sheet,https://facebook.com/story.php?story_fbid=1680062755475969&id=479010665581190,"DOCS.GOOGLE.COM
LHS/ CMS Dance Try Out Sheet",4.0,"LHS/CMS Dance Tryout Sheet

DOCS.GOOGLE.COM
LHS/ CMS Dance Try Out Sheet",2020-05-08 13:37:17,,
145,0.0,,3.0,https://docs.google.com/forms/d/e/1FAIpQLSft7n84iXh45ty-pga_at8GDVICwmD9ILzB1ae-x3qNRSjA4Q/viewform?usp=sf_link,1678367818978796,,https://facebook.com/story.php?story_fbid=1678367818978796&id=479010665581190,"Vincennes Lincoln Cheerleading
May 6 at 4:30 PM 路

Do you want to be part of the 2020-2021 LHS Cheer Team? If you answered yes, then please complete the link below. Tryouts this year will be virtual with instructions sent out in the coming weeks to those who fill out the form below. Please fill out the form and submit on or before 3:00pm on FRIDAY MAY 15th.
https://docs.google.com/forms/d/e/1FAIpQLSft7n84iXh45ty-pga_at8GDVICwmD9ILzB1ae-x3qNRSjA4Q/viewform?usp=sf_link",0.0,"Vincennes Lincoln Cheerleading
May 6 at 4:30 PM 路

Do you want to be part of the 2020-2021 LHS Cheer Team? If you answered yes, then please complete the link below. Tryouts this year will be virtual with instructions sent out in the coming weeks to those who fill out the form below. Please fill out the form and submit on or before 3:00pm on FRIDAY MAY 15th.
https://docs.google.com/forms/d/e/1FAIpQLSft7n84iXh45ty-pga_at8GDVICwmD9ILzB1ae-x3qNRSjA4Q/viewform?usp=sf_link",2020-05-06 17:56:47,,
146,0.0,,0.0,https://docs.google.com/forms/d/e/1FAIpQLSft7n84iXh45ty-pga_at8GDVICwmD9ILzB1ae-x3qNRSjA4Q/viewform?usp=sf_link,,"Do you want to be part of the 2020-2021 LHS Cheer Team? If you answered yes, then please complete the link below. Tryouts this year will be virtual with instructions sent out in the coming weeks to those who fill out the form below. Please fill out the form and submit on or before 3:00pm on FRIDAY MAY 15th.
https://docs.google.com/forms/d/e/1FAIpQLSft7n84iXh45ty-pga_at8GDVICwmD9ILzB1ae-x3qNRSjA4Q/viewform?usp=sf_link",https://facebook.com/story.php?story_fbid=2576494309117558&id=343015349132143,,0.0,"Do you want to be part of the 2020-2021 LHS Cheer Team? If you answered yes, then please complete the link below. Tryouts this year will be virtual with instructions sent out in the coming weeks to those who fill out the form below. Please fill out the form and submit on or before 3:00pm on FRIDAY MAY 15th.
https://docs.google.com/forms/d/e/1FAIpQLSft7n84iXh45ty-pga_at8GDVICwmD9ILzB1ae-x3qNRSjA4Q/viewform?usp=sf_link",,,
147,0.0,https://scontent-atl3-1.xx.fbcdn.net/v/t1.0-9/95933693_560338961285575_7860107558353108992_n.png?_nc_cat=111&_nc_sid=8024bb&_nc_ohc=iFaIY_2JRy8AX-v-0tg&_nc_ht=scontent-atl3-1.xx&oh=c1f038ef5bc5c7763dc8c3a82c9e1cff&oe=5F837B5C,2.0,https://vincenneslincolnvb.wixsite.com/website,1677091339106444,,https://facebook.com/story.php?story_fbid=1677091339106444&id=479010665581190,"Vincennes Lincoln Volleyball
May 5 at 12:00 PM 路

硷 VINCENNES VIRTUAL VOLLEYBALL CAMP 硷

Yes, you read that right! Vincennes Lincoln Volleyball will be hosting a virtual volleyball camp on June 1 - 4.

Coaches and players will lead you through a series of volleyball skills and drills for you to do from your home. The camp is free with the option to order a t-shirt.

Registration is easy! Click on the link below to get started.

We can't wait to virtually work on our volleyball skills so our team is better when we play together again!


https://vincenneslincolnvb.wixsite.com/website",0.0,"Vincennes Lincoln Volleyball
May 5 at 12:00 PM 路

硷 VINCENNES VIRTUAL VOLLEYBALL CAMP 硷

Yes, you read that right! Vincennes Lincoln Volleyball will be hosting a virtual volleyball camp on June 1 - 4.

Coaches and players will lead you through a series of volleyball skills and drills for you to do from your home. The camp is free with the option to order a t-shirt.

Registration is easy! Click on the link below to get started.

We can't wait to virtually work on our volleyball skills so our team is better when we play together again!


https://vincenneslincolnvb.wixsite.com/website",2020-05-05 10:20:08,,
148,0.0,,8.0,https://www.youtube.com/watch?v=419iZ61nHkI,1676443619171216,"Mr. Parsley's Weekly Update 5-4-2020

https://www.youtube.com/watch?v=419iZ61nHkI",https://facebook.com/story.php?story_fbid=1676443619171216&id=479010665581190,"YOUTUBE.COM
Mr. Parsley's Weekly Update 5-4-2020",5.0,"Mr. Parsley's Weekly Update 5-4-2020

https://www.youtube.com/watch?v=419iZ61nHkI

YOUTUBE.COM
Mr. Parsley's Weekly Update 5-4-2020",2020-05-04 16:05:25,,
149,1.0,,76.0,,1676304522518459,Big A had a blast at food distribution and packet pickup today!,https://facebook.com/story.php?story_fbid=1676304522518459&id=479010665581190,,0.0,Big A had a blast at food distribution and packet pickup today!,2020-05-04 12:34:02,,
150,0.0,https://scontent-atl3-1.xx.fbcdn.net/v/t1.0-9/95260266_1673417319473846_7626960442715275264_n.png?_nc_cat=104&_nc_sid=8024bb&_nc_ohc=LDgbaCiPcTUAX-5JMqb&_nc_ht=scontent-atl3-1.xx&oh=f805f39bf5ef8a2b3b7b588fd8bdc4dd&oe=5F841D2A,2.0,https://scoutingevent.com/156-CabinFeverCamporee,1673420329473545,"Calling Everyone Stuck at Home!

Please join us for the First Virtual Camporee from the Buffalo Trace Council. Scouts of all ages are invited to attend. Not a Scout but wanting to learn more? You are invited to attend as well! We will have some online activities as well as activities you can do with your families; all in the comfort of your home.

Location: Your home and online
Date: May 9, 2020
Time: 8:00 am  9:00 pm CT

An exciting day has been planned for you and your family. It is designed to be fun and interactive. We want to provide all of you with an opportunity to interact with other scouts. All Scouts (Cub Scouts, Scouts BSA, and Venturers) are encouraged to attend, we have activities for all ages.

This event will be free for all to attend, but you must register. Event patches will be optionally available after the event for $5 and will be mailed directly to you.

See link below to register and please check your email in the following days for more information as well.

https://scoutingevent.com/156-CabinFeverCamporee",https://facebook.com/story.php?story_fbid=1673420329473545&id=479010665581190,,0.0,"Calling Everyone Stuck at Home!

Please join us for the First Virtual Camporee from the Buffalo Trace Council. Scouts of all ages are invited to attend. Not a Scout but wanting to learn more? You are invited to attend as well! We will have some online activities as well as activities you can do with your families; all in the comfort of your home.

Location: Your home and online
Date: May 9, 2020
Time: 8:00 am  9:00 pm CT

An exciting day has been planned for you and your family. It is designed to be fun and interactive. We want to provide all of you with an opportunity to interact with other scouts. All Scouts (Cub Scouts, Scouts BSA, and Venturers) are encouraged to attend, we have activities for all ages.

This event will be free for all to attend, but you must register. Event patches will be optionally available after the event for $5 and will be mailed directly to you.

See link below to register and please check your email in the following days for more information as well.

https://scoutingevent.com/156-CabinFeverCamporee",2020-05-01 11:06:01,,
151,3.0,https://scontent-atl3-1.xx.fbcdn.net/v/t1.0-9/fr/cp0/e15/q65/94878465_1672823329533245_5622376524226232320_o.jpg?_nc_cat=108&_nc_sid=110474&_nc_ohc=jGtofxFZfYkAX-E74cJ&_nc_ht=scontent-atl3-1.xx&tp=14&oh=343f9cd343ee4a47515d065469a13e73&oe=5F845183,30.0,,1672823349533243,,https://facebook.com/story.php?story_fbid=1672823349533243&id=479010665581190,,0.0,,2020-04-30 19:26:44,,
152,0.0,,1.0,https://youtu.be/oxw1BpsUbXg,1671312929684285,"Mr. Parsleys Weekly Update from Monday 4-27-2020

https://youtu.be/oxw1BpsUbXg",https://facebook.com/story.php?story_fbid=1671312929684285&id=479010665581190,"YOUTUBE.COM
Mr. Parsley's Weekly Update 4-27-2020",6.0,"Mr. Parsleys Weekly Update from Monday 4-27-2020

https://youtu.be/oxw1BpsUbXg

YOUTUBE.COM
Mr. Parsley's Weekly Update 4-27-2020",2020-04-29 06:27:53,,
