,comments,image,likes,link,post_id,post_text,post_url,shared_text,shares,text,time,video,video_thumbnail
0,0.0,,16.0,https://youtu.be/1zPoMhsv71o,3571097626235125,An update from Mr. Kern as we get ready for the first day of school tomorrow! We hope you are enjoying your last day of summer vacation and are EXCITED for the year to start!  https://youtu.be/1zPoMhsv71o,https://facebook.com/story.php?story_fbid=3571097626235125&id=478339048844347,"YOUTUBE.COM
The Night Before School...",6.0,"An update from Mr. Kern as we get ready for the first day of school tomorrow! We hope you are enjoying your last day of summer vacation and are EXCITED for the year to start!  https://youtu.be/1zPoMhsv71o

YOUTUBE.COM
The Night Before School...",2020-08-30 19:02:03,,
1,0.0,,6.0,https://youtu.be/e5Wq8lbVokQ,3539563069388581,An Elementary Covid-19 Procedures update from Mr. Kern! This can also be found on the website's Covid-19 Page! https://youtu.be/e5Wq8lbVokQ,https://facebook.com/story.php?story_fbid=3539563069388581&id=478339048844347,"YOUTUBE.COM
Elementary Covid-19 Procedures",7.0,"An Elementary Covid-19 Procedures update from Mr. Kern! This can also be found on the website's Covid-19 Page! https://youtu.be/e5Wq8lbVokQ

YOUTUBE.COM
Elementary Covid-19 Procedures",2020-08-20 16:55:50,,
2,0.0,https://scontent-atl3-1.xx.fbcdn.net/v/t1.0-9/118190727_3537117282966493_6463383224122608357_n.png?_nc_cat=108&_nc_sid=8024bb&_nc_ohc=qhXvcu_b-dwAX_Nqcjw&_nc_ht=scontent-atl3-1.xx&oh=067b2a7e41290e31b39f616ed211490a&oe=5F84C4D6,7.0,,3537118842966337,"An important letter from Mr. Dalchow. Wyndmere School has changed their start date to Monday, August 31, 2020.",https://facebook.com/story.php?story_fbid=3537118842966337&id=478339048844347,,0.0,"An important letter from Mr. Dalchow. Wyndmere School has changed their start date to Monday, August 31, 2020.",2020-08-19 21:00:47,,
3,0.0,https://scontent-atl3-1.xx.fbcdn.net/v/t1.0-9/fr/cp0/e15/q65/116788334_3500624956615726_4538100982851950107_o.jpg?_nc_cat=101&_nc_sid=8024bb&_nc_ohc=PT61Qb7b0W8AX90j2py&_nc_oc=AQnQIhVLEujurVw_fhRh4238zm2gRIZkyNIdJ6CGobMwJUrjemFU6LfgFSzMy_UkbdE&_nc_ht=scontent-atl3-1.xx&tp=14&oh=a67ede4ec46ba084668e16ad632a81d9&oe=5F83F7EF,4.0,,3500626006615621,Mr. Dalchow's letter regarding the start of the 2020-2021 school year.,https://facebook.com/story.php?story_fbid=3500626006615621&id=478339048844347,,0.0,Mr. Dalchow's letter regarding the start of the 2020-2021 school year.,2020-08-07 16:40:24,,
4,0.0,,6.0,http://www.wyndmere.k12.nd.us/,3492526924092196,The final draft of the 2020-2021 Wyndmere School Restart Plan has been finalized for review by the School Board. You can see this draft on the school website: http://www.wyndmere.k12.nd.us,https://facebook.com/story.php?story_fbid=3492526924092196&id=478339048844347,"WYNDMERE.K12.ND.US
Wyndmere Public School",6.0,"The final draft of the 2020-2021 Wyndmere School Restart Plan has been finalized for review by the School Board. You can see this draft on the school website: http://www.wyndmere.k12.nd.us

WYNDMERE.K12.ND.US
Wyndmere Public School",2020-08-04 22:23:37,,
5,2.0,https://scontent-atl3-1.xx.fbcdn.net/v/t1.0-9/fr/cp0/e15/q65/115929807_3458402747504614_4697698859395802116_o.jpg?_nc_cat=110&_nc_sid=8024bb&_nc_ohc=o_lKfSssTbIAX8PVc9l&_nc_ht=scontent-atl3-1.xx&tp=14&oh=67b5bfd032043d978889c0ef16ca4eae&oe=5F85B676,1.0,,3458403717504517,"If you are a Wyndmere Public School parent and didn't receive this letter via email this morning, please email shari.hetland@k12.nd.us to let us know. We want to make sure our email list is up-to-date to keep you informed!",https://facebook.com/story.php?story_fbid=3458403717504517&id=478339048844347,,0.0,"If you are a Wyndmere Public School parent and didn't receive this letter via email this morning, please email shari.hetland@k12.nd.us to let us know. We want to make sure our email list is up-to-date to keep you informed!",2020-07-24 12:54:46,,
6,6.0,https://scontent-atl3-1.xx.fbcdn.net/v/t1.0-9/fr/cp0/e15/q65/101832038_3158666764190818_1952678959544008704_o.jpg?_nc_cat=102&_nc_sid=110474&_nc_ohc=vsR0vU8PvUwAX8xTxUa&_nc_ht=scontent-atl3-1.xx&tp=14&oh=c486dee8dce2882ae75088215f6eea20&oe=5F84AE1A,25.0,,3316309155047308,Way to go!!,https://facebook.com/story.php?story_fbid=3316309155047308&id=478339048844347,"Wyndmere FFA Chapter
June 3 at 4:06 PM 路

Congrats to Sierra Strenge for being named the STATE WINNER in the proficiency area of Veterinary Science. Anyone who who knows her, knows that her passion lies in vet science and we are excited to see her well deserved recognition in it. Good luck at nationals judging!",0.0,"Way to go!!

Wyndmere FFA Chapter
June 3 at 4:06 PM 路

Congrats to Sierra Strenge for being named the STATE WINNER in the proficiency area of Veterinary Science. Anyone who who knows her, knows that her passion lies in vet science and we are excited to see her well deserved recognition in it. Good luck at nationals judging!",2020-06-03 18:49:39,,
7,2.0,,6.0,,3316061031738787,"Time is running out to make your vote count in this years school board election! If youve received a ballot, follow the instructions that came with the ballot and drop it off at the Lincoln State Bank Night Depository or get it postmarked by June 8, 2020. If you havent applied for a ballot yet, call the school at 439-2287 between 8AM and 4 PM to get an application and get it turned in.",https://facebook.com/story.php?story_fbid=3316061031738787&id=478339048844347,,0.0,"Time is running out to make your vote count in this years school board election! If youve received a ballot, follow the instructions that came with the ballot and drop it off at the Lincoln State Bank Night Depository or get it postmarked by June 8, 2020. If you havent applied for a ballot yet, call the school at 439-2287 between 8AM and 4 PM to get an application and get it turned in.",2020-06-03 16:40:28,,
8,0.0,,3.0,,3297231566955067,"If you haven't filled out an Absentee/Mail Ballot Application for the School Board Election yet, time is running short! There are applications available in the north foyer of the High School by the pop machine. You can pick one up and fill it out. There are 4 options to return it to the school: 1) call the school between 8-4 to drop it off, 2) put it in an envelope labeled ""School Election"" and drop it off in the Wyndmere Lincoln State Bank Night Depository box, 3) email it to shari.hetland@k12.nd.us, OR 4) fax it to 701-439-2804. Once we receive the application back, we will mail a ballot out to you (ballot should also include instructions and TWO envelopes). Please make sure you read and follow the instructions! The ballot must be postmarked by June 8, 2020 or dropped off before 5 PM on June 8, 2020. If you have questions, please call the school at 439-2287.",https://facebook.com/story.php?story_fbid=3297231566955067&id=478339048844347,,0.0,"If you haven't filled out an Absentee/Mail Ballot Application for the School Board Election yet, time is running short! There are applications available in the north foyer of the High School by the pop machine. You can pick one up and fill it out. There are 4 options to return it to the school: 1) call the school between 8-4 to drop it off, 2) put it in an envelope labeled ""School Election"" and drop it off in the Wyndmere Lincoln State Bank Night Depository box, 3) email it to shari.hetland@k12.nd.us, OR 4) fax it to 701-439-2804. Once we receive the application back, we will mail a ballot out to you (ballot should also include instructions and TWO envelopes). Please make sure you read and follow the instructions! The ballot must be postmarked by June 8, 2020 or dropped off before 5 PM on June 8, 2020. If you have questions, please call the school at 439-2287.",2020-05-27 15:16:42,,
9,0.0,,7.0,https://wyndmereonline.weebly.com/,3285379214806969,"Graduation is Sunday, May 24 at 2PM. More information (including the commencement program and parade route) can be found here: https://wyndmereonline.weebly.com
CONGRATULATIONS to the Class os 2020!",https://facebook.com/story.php?story_fbid=3285379214806969&id=478339048844347,"WYNDMEREONLINE.WEEBLY.COM
Wyndmere School Online Portal",4.0,"Graduation is Sunday, May 24 at 2PM. More information (including the commencement program and parade route) can be found here: https://wyndmereonline.weebly.com
CONGRATULATIONS to the Class os 2020!

WYNDMEREONLINE.WEEBLY.COM
Wyndmere School Online Portal",2020-05-22 21:13:48,,
10,0.0,,43.0,,3280251218653102,"Thats a rap Warbird Nation! We made it to the end of the 2019-2020 school year! Thank you to all of the students, parents, and staff for making the best of a strange situation and continuing to make our school great. Enjoy your summer and we will SEE YOU NEXT YEAR!  #WeAreWarbirds",https://facebook.com/story.php?story_fbid=3280251218653102&id=478339048844347,,0.0,"Thats a rap Warbird Nation! We made it to the end of the 2019-2020 school year! Thank you to all of the students, parents, and staff for making the best of a strange situation and continuing to make our school great. Enjoy your summer and we will SEE YOU NEXT YEAR!  #WeAreWarbirds",2020-05-20 20:30:56,,
11,1.0,,2.0,,245537690219191,Daily Announcements 5-20-2020,,,0.0,Daily Announcements 5-20-2020,2020-05-20 09:36:32,https://scontent-atl3-1.xx.fbcdn.net/v/t66.36281-6/10000000_751605265667826_3991615893873483946_n.mp4?_nc_cat=110&_nc_sid=985c63&efg=eyJ2ZW5jb2RlX3RhZyI6Im9lcF9zZCJ9&_nc_ohc=pdPDLZc72nYAX8TE7Dq&_nc_ht=scontent-atl3-1.xx&oh=4d0dfe9c3e57e672ad5eef884b2b4d69&oe=5F85366A,
12,1.0,,3.0,,1365081383880318,Daily Announcements 5-19-2020,,,0.0,Daily Announcements 5-19-2020,2020-05-19 09:31:21,https://scontent-atl3-1.xx.fbcdn.net/v/t66.36281-6/10000000_232640727946995_5963146004667149595_n.mp4?_nc_cat=108&_nc_sid=985c63&efg=eyJ2ZW5jb2RlX3RhZyI6Im9lcF9zZCJ9&_nc_ohc=fcOqx9kXyjEAX8p6RDR&_nc_ht=scontent-atl3-1.xx&oh=5dc7af1327bf98bfbc6c40ad7f839a9e&oe=5F833539,
13,1.0,,3.0,,594468628113157,Daily Announcements 5-18-2020,,,0.0,Daily Announcements 5-18-2020,2020-05-18 09:32:04,https://scontent-atl3-1.xx.fbcdn.net/v/t66.36281-6/10000000_120514869574948_6362377507062332381_n.mp4?_nc_cat=109&_nc_sid=985c63&efg=eyJ2ZW5jb2RlX3RhZyI6Im9lcF9zZCJ9&_nc_ohc=dkvC6y4pLfsAX9TnA4B&_nc_ht=scontent-atl3-1.xx&oh=66fcdc3a273583d2769ed80f7fe3cc5e&oe=5F84850E,
14,0.0,https://scontent-atl3-1.xx.fbcdn.net/v/t1.0-9/fr/cp0/e15/q65/98807617_3273919542619603_6453399618796388352_n.jpg?_nc_cat=110&_nc_sid=110474&_nc_ohc=86HJnZzzAc8AX8siTU-&_nc_ht=scontent-atl3-1.xx&tp=14&oh=94620062e534bc1cfa5cbe3b0692e0f8&oe=5F828A6B,18.0,,3273927142618843,We are happy to report...WyLi is back in the nest where he belongs! Thanks to all who helped get him back! Hes exhausted from all of his travels but happy to be back! Prize winners...you can claim your prize (WPS POPCORN!!) after 9AM at the school today! Just call when you arrive and well run it out to you!,https://facebook.com/story.php?story_fbid=3273927142618843&id=478339048844347,,0.0,We are happy to report...WyLi is back in the nest where he belongs! Thanks to all who helped get him back! Hes exhausted from all of his travels but happy to be back! Prize winners...you can claim your prize (WPS POPCORN!!) after 9AM at the school today! Just call when you arrive and well run it out to you!,2020-05-18 08:50:45,,
15,0.0,,2.0,,349735252661879,Daily Announcements 5-15-2020,,,0.0,Daily Announcements 5-15-2020,2020-05-15 09:31:54,https://scontent-atl3-1.xx.fbcdn.net/v/t66.36281-6/10000000_3506233566064005_1837465354099137350_n.mp4?_nc_cat=101&_nc_sid=985c63&efg=eyJ2ZW5jb2RlX3RhZyI6Im9lcF9zZCJ9&_nc_ohc=Cuwlw7_p1BYAX9lCxHd&_nc_ht=scontent-atl3-1.xx&oh=23d68d3ee5efc85da2b26cd2304bd8a1&oe=5F86173A,
16,0.0,https://scontent-atl3-1.xx.fbcdn.net/v/t1.0-9/fr/cp0/e15/q65/97116269_3261540167190874_3730940237795295232_n.jpg?_nc_cat=110&_nc_sid=8024bb&_nc_ohc=XlcPTAjBva0AX8iXTWU&_nc_ht=scontent-atl3-1.xx&tp=14&oh=e48cd4bbd01e2cd9472adaf8c8b6668a&oe=5F855FDA,6.0,,3261540943857463,"Awards Day 2020 Program - May 14, 2020 - 10:00AM",https://facebook.com/story.php?story_fbid=3261540943857463&id=478339048844347,,0.0,"Awards Day 2020 Program - May 14, 2020 - 10:00AM",2020-05-14 09:44:38,,
17,0.0,,3.0,,2885171568202864,Daily Announcements 5-14-2020,,,0.0,Daily Announcements 5-14-2020,2020-05-14 09:33:37,https://video-atl3-1.xx.fbcdn.net/v/t42.26565-2/10000000_609931403043733_481472720941818682_n.mp4?_nc_cat=105&_nc_sid=985c63&efg=eyJ2ZW5jb2RlX3RhZyI6Im9lcF9zZCJ9&_nc_ohc=paYypHAIx9QAX_UPhJo&_nc_ht=video-atl3-1.xx&oh=1cd458e6a1b3e380374133cf7b7d392c&oe=5F5F11C7,
18,5.0,https://scontent-atl3-1.xx.fbcdn.net/v/t1.0-9/fr/cp0/e15/q65/96680551_3258630560815168_176015890163171328_n.jpg?_nc_cat=105&_nc_sid=110474&_nc_ohc=_Q0c5A7wR_AAX_BneTQ&_nc_ht=scontent-atl3-1.xx&tp=14&oh=63673b0fd11ceb0cda25e36794b96b36&oe=5F833379,2.0,,3258633607481530,"Where in the World is WyLi??? Its day 16 and WyLi is looking tired from all his adventures. Please help get him back to our nest! If you know this spot, comment below!",https://facebook.com/story.php?story_fbid=3258633607481530&id=478339048844347,,0.0,"Where in the World is WyLi??? Its day 16 and WyLi is looking tired from all his adventures. Please help get him back to our nest! If you know this spot, comment below!",2020-05-13 09:47:45,,
19,0.0,,2.0,,2280047268971746,Daily Announcements 5-13-2020,,,0.0,Daily Announcements 5-13-2020,2020-05-13 09:31:46,https://scontent-atl3-1.xx.fbcdn.net/v/t66.36281-6/10000000_776274963172882_1691525688734968858_n.mp4?_nc_cat=104&_nc_sid=985c63&efg=eyJ2ZW5jb2RlX3RhZyI6Im9lcF9zZCJ9&_nc_ohc=xYd7ibqLJW8AX9QLS3k&_nc_ht=scontent-atl3-1.xx&oh=daabd8dc84651844a4c626a7e478fad2&oe=5F837780,
20,5.0,https://scontent-atl3-1.xx.fbcdn.net/v/t1.0-9/fr/cp0/e15/q65/96528281_3255997081078516_2918952528475324416_n.jpg?_nc_cat=102&_nc_sid=110474&_nc_ohc=X_xmgNxmeGMAX8REPgh&_nc_ht=scontent-atl3-1.xx&tp=14&oh=3d38a43d9ad5ede620f3355ef5850ddc&oe=5F867080,3.0,,3256001817744709,Where in the World is WyLi??? Day 15 and WyLi is getting closer to the nest!!! Do you know where he is???,https://facebook.com/story.php?story_fbid=3256001817744709&id=478339048844347,,0.0,Where in the World is WyLi??? Day 15 and WyLi is getting closer to the nest!!! Do you know where he is???,2020-05-12 09:45:28,,
21,0.0,,4.0,,260081442042832,Daily Announcements 5-12-2020,,,0.0,Daily Announcements 5-12-2020,2020-05-12 09:31:41,https://scontent-atl3-1.xx.fbcdn.net/v/t66.36281-6/10000000_346213453194683_5759468255582693899_n.mp4?_nc_cat=109&_nc_sid=985c63&efg=eyJ2ZW5jb2RlX3RhZyI6Im9lcF9zZCJ9&_nc_ohc=L6735PEeOBMAX-JE_0u&_nc_ht=scontent-atl3-1.xx&oh=107c3f18b37e367c06db0b84f1217c50&oe=5F84D010,
22,0.0,,2.0,,244198213352382,,,"THU, MAY 14
WPS Awards Day 2020",0.0,"THU, MAY 14
WPS Awards Day 2020",2020-05-11 16:17:19,,
23,3.0,https://scontent-atl3-1.xx.fbcdn.net/v/t1.0-9/fr/cp0/e15/q65/96583956_3253403718004519_549409532149760000_n.jpg?_nc_cat=108&_nc_sid=110474&_nc_ohc=cMRiFau2hRQAX9KZiAD&_nc_ht=scontent-atl3-1.xx&tp=14&oh=f25ae9f50bc05d1f8a3f99a0970b716a&oe=5F84FDB8,4.0,,3253406464670911,Where in the World is WyLi??? Day 14 and were still missing WyLi? Can you identify his last known location???,https://facebook.com/story.php?story_fbid=3253406464670911&id=478339048844347,,0.0,Where in the World is WyLi??? Day 14 and were still missing WyLi? Can you identify his last known location???,2020-05-11 09:42:44,,
24,0.0,,1.0,,172232304111160,Daily Announcements 5-11-2020,,,0.0,Daily Announcements 5-11-2020,2020-05-11 09:33:43,https://video-atl3-1.xx.fbcdn.net/v/t42.26565-2/10000000_661772644694259_6545962135078232818_n.mp4?_nc_cat=109&_nc_sid=985c63&efg=eyJ2ZW5jb2RlX3RhZyI6Im9lcF9zZCJ9&_nc_ohc=XkIhri7wUoIAX91U2Ww&_nc_ht=video-atl3-1.xx&oh=0d6129a501523cb456c87670ebe6f596&oe=5F5F0FA7,
25,3.0,https://scontent-atl3-1.xx.fbcdn.net/v/t1.0-9/fr/cp0/e15/q65/96735675_3244069738937917_5990085682507284480_n.jpg?_nc_cat=108&_nc_sid=110474&_nc_ohc=CMzaGwIIqskAX8C-rHT&_nc_ht=scontent-atl3-1.xx&tp=14&oh=69343debc8f9ee62e64d4142eb75638e&oe=5F834177,7.0,,3244076832270541,Where in the World is WyLi! Its day 13 and WyLi is still flying solo! Please help locate him and get him back to the nest!,https://facebook.com/story.php?story_fbid=3244076832270541&id=478339048844347,,0.0,Where in the World is WyLi! Its day 13 and WyLi is still flying solo! Please help locate him and get him back to the nest!,2020-05-08 09:53:03,,
26,0.0,,2.0,,1112061922484193,Daily Announcements 5-8-2020,,,0.0,Daily Announcements 5-8-2020,2020-05-08 09:31:35,https://video-atl3-1.xx.fbcdn.net/v/t42.26565-2/10000000_375015280145597_3613999061688586005_n.mp4?_nc_cat=100&_nc_sid=985c63&efg=eyJ2ZW5jb2RlX3RhZyI6Im9lcF9zZCJ9&_nc_ohc=FlEbZxS-ahAAX9hQ1-X&_nc_ht=video-atl3-1.xx&oh=f5223b4a44774ff733d286eb77f28da2&oe=5F5F0FD4,
27,5.0,https://scontent-atl3-1.xx.fbcdn.net/v/t1.0-9/fr/cp0/e15/q65/96357945_3241744015837156_8397231023020048384_n.jpg?_nc_cat=100&_nc_sid=110474&_nc_ohc=-DJgaEd_S3EAX_Ca1BR&_nc_ht=scontent-atl3-1.xx&tp=14&oh=197c3ea0ccd95b001d47bdab5c4beafb&oe=5F855B19,5.0,,3241752379169653,Where in the World is WyLi-Day 12. Please help get him back to the nest!,https://facebook.com/story.php?story_fbid=3241752379169653&id=478339048844347,,0.0,Where in the World is WyLi-Day 12. Please help get him back to the nest!,2020-05-07 10:37:32,,
28,0.0,,3.0,,550564332558002,Daily Announcements 5-7-2020,,,0.0,Daily Announcements 5-7-2020,2020-05-07 09:32:43,https://video-atl3-1.xx.fbcdn.net/v/t42.26565-2/10000000_588866798446405_4450784191680482172_n.mp4?_nc_cat=100&_nc_sid=985c63&efg=eyJ2ZW5jb2RlX3RhZyI6Im9lcF9zZCJ9&_nc_ohc=u2dIOjZ5vxsAX9vQBKp&_nc_ht=video-atl3-1.xx&oh=422f597b56142bfbf22cc00f19c5f5e7&oe=5F5F0686,
29,0.0,https://scontent-atl3-1.xx.fbcdn.net/v/t1.0-9/fr/cp0/e15/q65/95454335_3239216732756551_3199721326663172096_o.jpg?_nc_cat=104&_nc_sid=8024bb&_nc_ohc=rZRJ9eQsmggAX9MS7Yg&_nc_ht=scontent-atl3-1.xx&tp=14&oh=d396331ad21f81015da252fbcac37b23&oe=5F829133,29.0,,3239220416089516,"Hope you can join us! Remember to email shari.hetland@k12.nd.us your ""take-out"" order by noon on Tuesday, May 12th!",https://facebook.com/story.php?story_fbid=3239220416089516&id=478339048844347,,0.0,"Hope you can join us! Remember to email shari.hetland@k12.nd.us your ""take-out"" order by noon on Tuesday, May 12th!",2020-05-06 10:20:22,,
30,1.0,,4.0,,260432681676710,,,"TUE, MAY 26
2020 School Board Election",0.0,"TUE, MAY 26
2020 School Board Election",2020-05-06 10:10:47,,
31,5.0,https://scontent-atl3-1.xx.fbcdn.net/v/t1.0-9/fr/cp0/e15/q65/96360359_3239175269427364_5000433691755806720_n.jpg?_nc_cat=107&_nc_sid=110474&_nc_ohc=HOlFiV00vEQAX8Dchsz&_nc_ht=scontent-atl3-1.xx&tp=14&oh=f3aa35ae9b83825d5ef9250cbf76e469&oe=5F84D38F,4.0,,3239178436093714,Where in the World is WyLi? Day 11 and still missing our bird here at the nest! Please help WyLi find his way home!,https://facebook.com/story.php?story_fbid=3239178436093714&id=478339048844347,,0.0,Where in the World is WyLi? Day 11 and still missing our bird here at the nest! Please help WyLi find his way home!,2020-05-06 09:56:16,,
32,0.0,,3.0,,1114160005586316,Daily Announcements 5-6-2020,,,0.0,Daily Announcements 5-6-2020,2020-05-06 09:32:19,https://video-atl3-1.xx.fbcdn.net/v/t42.26565-2/10000000_156790936020231_2971014684468662696_n.mp4?_nc_cat=110&_nc_sid=985c63&efg=eyJ2ZW5jb2RlX3RhZyI6Im9lcF9zZCJ9&_nc_ohc=MKRqlSdtOWoAX8ts8Pa&_nc_ht=video-atl3-1.xx&oh=433766bcc548313fb1d96685f061e57d&oe=5F5F121A,
33,6.0,https://scontent-atl3-1.xx.fbcdn.net/v/t1.0-9/fr/cp0/e15/q65/96662605_3236599333018291_6499706379928862720_n.jpg?_nc_cat=101&_nc_sid=110474&_nc_ohc=Xh-bjgf3TJ4AX-cpkoh&_nc_ht=scontent-atl3-1.xx&tp=14&oh=68a351f240e2a3f12e4d47a557a367c9&oe=5F8426FB,2.0,,3236601559684735,Where in the World is WyLi??? Day 10 and were still on the lookout for that busy bird! Comment below if you know where he is!!,https://facebook.com/story.php?story_fbid=3236601559684735&id=478339048844347,,0.0,Where in the World is WyLi??? Day 10 and were still on the lookout for that busy bird! Comment below if you know where he is!!,2020-05-05 09:48:24,,
34,6.0,https://scontent-atl3-1.xx.fbcdn.net/v/t1.0-9/fr/cp0/e15/q65/96081812_3236597729685118_5468153641720348672_n.jpg?_nc_cat=101&_nc_sid=110474&_nc_ohc=aI-RiOL6RhwAX_Yq3Pl&_nc_ht=scontent-atl3-1.xx&tp=14&oh=aeed7c7e9dd94d0d471faee8b131c054&oe=5F831BBB,4.0,,3236599046351653,Where in the World is WyLi-day 9??? Help WyLi find his way back to the nest!!,https://facebook.com/story.php?story_fbid=3236599046351653&id=478339048844347,,0.0,Where in the World is WyLi-day 9??? Help WyLi find his way back to the nest!!,2020-05-05 09:46:59,,
35,0.0,,2.0,,702482880561542,Daily Announcements 5-5-2020,,,0.0,Daily Announcements 5-5-2020,2020-05-05 09:30:30,https://video-atl3-1.xx.fbcdn.net/v/t42.26565-2/10000000_123581299120614_8784956728302004853_n.mp4?_nc_cat=105&_nc_sid=985c63&efg=eyJ2ZW5jb2RlX3RhZyI6Im9lcF9zZCJ9&_nc_ohc=tFLiCGEufAMAX8KuMqD&_nc_ht=video-atl3-1.xx&oh=b2f012143ddcd1c3f7214d6cf3f34757&oe=5F5F0742,
36,2.0,,5.0,,715627649209115,Teacher Appreciation 2020,,,2.0,Teacher Appreciation 2020,2020-05-04 09:47:59,https://video-atl3-1.xx.fbcdn.net/v/t42.26565-2/10000000_176227207214791_5834396003248368403_n.mp4?_nc_cat=109&_nc_sid=985c63&efg=eyJ2ZW5jb2RlX3RhZyI6Im9lcF9zZCJ9&_nc_ohc=2_ACj-nluigAX_XH82M&_nc_ht=video-atl3-1.xx&oh=145746fd8bbb2aeefe0db8eaf2a78084&oe=5F5F0523,
37,0.0,,3.0,,661599677736448,Daily Announcements 5-4-2020,,,0.0,Daily Announcements 5-4-2020,2020-05-04 09:32:21,https://video-atl3-1.xx.fbcdn.net/v/t42.26565-2/10000000_708901959956623_6590662483570161102_n.mp4?_nc_cat=108&_nc_sid=985c63&efg=eyJ2ZW5jb2RlX3RhZyI6Im9lcF9zZCJ9&_nc_ohc=fto_7_SPGUUAX9S-Jwy&_nc_ht=video-atl3-1.xx&oh=e914f73a514b931802340552bfcff7b7&oe=5F5F0CC0,
38,8.0,https://scontent-atl3-1.xx.fbcdn.net/v/t1.0-9/fr/cp0/e15/q65/95615983_3226276940717197_8942010589014654976_n.jpg?_nc_cat=100&_nc_sid=110474&_nc_ohc=6YirNYBBIikAX_ubsPd&_nc_ht=scontent-atl3-1.xx&tp=14&oh=cc14e6f4f08c55c191ac08b33c2aed1a&oe=5F84842A,4.0,,3226281624050062,Where in the Workd is WyLi Day 8 and another spotting! Please help get him back to the Nest! Be the first to comment for a prize!,https://facebook.com/story.php?story_fbid=3226281624050062&id=478339048844347,,0.0,Where in the Workd is WyLi Day 8 and another spotting! Please help get him back to the Nest! Be the first to comment for a prize!,2020-05-01 10:17:47,,
39,0.0,,5.0,,169838437636660,Daily Announcements 5-1-2020,,,0.0,Daily Announcements 5-1-2020,2020-05-01 09:31:51,https://video-atl3-1.xx.fbcdn.net/v/t42.26565-2/10000000_3477293168971759_3780846110196738308_n.mp4?_nc_cat=102&_nc_sid=985c63&efg=eyJ2ZW5jb2RlX3RhZyI6Im9lcF9zZCJ9&_nc_ohc=GGIQAGV_RIwAX-dqUEp&_nc_ht=video-atl3-1.xx&oh=a6c15b6bb7f0160ac565217bdd0f130e&oe=5F5F0C2C,
40,1.0,https://scontent-atl3-1.xx.fbcdn.net/v/t1.0-9/fr/cp0/e15/q65/95506168_3223708534307371_1653634899418021888_n.jpg?_nc_cat=101&_nc_sid=110474&_nc_ohc=dvfrGzZvGY8AX8CqGfq&_nc_ht=scontent-atl3-1.xx&tp=14&oh=523737fa7ab21dbed2d52b4740de0e03&oe=5F83CBF5,4.0,,3223711614307063,"Where in the World is WyLi??? Day 7 and hes still on the loose! Please help get WyLi back to the Warbird Nest! If you recognize his last known location, please comment below",https://facebook.com/story.php?story_fbid=3223711614307063&id=478339048844347,,0.0,"Where in the World is WyLi??? Day 7 and hes still on the loose! Please help get WyLi back to the Warbird Nest! If you recognize his last known location, please comment below",2020-04-30 09:35:41,,
41,0.0,,4.0,,275561180135029,Daily Announcements 4-30-2020,,,0.0,Daily Announcements 4-30-2020,2020-04-30 09:27:49,https://video-atl3-1.xx.fbcdn.net/v/t42.26565-2/10000000_349852526203194_3057722840761894789_n.mp4?_nc_cat=111&_nc_sid=985c63&efg=eyJ2ZW5jb2RlX3RhZyI6Im9lcF9zZCJ9&_nc_ohc=SG9LdZG4rBkAX9JOiES&_nc_ht=video-atl3-1.xx&oh=cbfe87eeca3d0e8e2f795b3f0b0e2f50&oe=5F5F05B7,
42,0.0,,1.0,,3221633751181516,Ok Warbird Nation....time to get on and vote!! Today is the ONLY day to do it! Go to the Midco Sports page and click on their logo! #WeAreWarbirds,https://facebook.com/story.php?story_fbid=3221633751181516&id=478339048844347,"Todd HosfordLidgerwood-Wyndmere Warbirds Boys' Basketball
April 29 at 1:10 PM 路

Its time to vote. We are way behind so rally the troops. Go to the stories part up top. Find Midco, click on that, SD teams will pop up first, then we will show up, click on the finger pointing to us. Share with the rest of Warbird Nation and your job here is complete!!",0.0,"Ok Warbird Nation....time to get on and vote!! Today is the ONLY day to do it! Go to the Midco Sports page and click on their logo! #WeAreWarbirds

Todd HosfordLidgerwood-Wyndmere Warbirds Boys' Basketball
April 29 at 1:10 PM 路

Its time to vote. We are way behind so rally the troops. Go to the stories part up top. Find Midco, click on that, SD teams will pop up first, then we will show up, click on the finger pointing to us. Share with the rest of Warbird Nation and your job here is complete!!",2020-04-29 14:29:27,,
43,6.0,https://scontent-atl3-1.xx.fbcdn.net/v/t1.0-9/fr/cp0/e15/q65/95184094_3221121927899365_8299908953878298624_n.jpg?_nc_cat=111&_nc_sid=110474&_nc_ohc=dGR6X5zQxMwAX8DZ83f&_nc_ht=scontent-atl3-1.xx&tp=14&oh=4264ca37cf57ba97bb7321495ce70664&oe=5F855FBE,10.0,,3221125454565679,Where in the World is WyLi??! Day 6 and WyLi has yet to return to the Warbird Nest! Please help us find him!,https://facebook.com/story.php?story_fbid=3221125454565679&id=478339048844347,,0.0,Where in the World is WyLi??! Day 6 and WyLi has yet to return to the Warbird Nest! Please help us find him!,2020-04-29 09:57:44,,
44,0.0,,3.0,,944359816021173,Daily Announcements 4-29-2020,,,0.0,Daily Announcements 4-29-2020,2020-04-29 09:30:19,https://video-atl3-1.xx.fbcdn.net/v/t42.26565-2/10000000_214968326489921_8139476386915846912_n.mp4?_nc_cat=106&_nc_sid=985c63&efg=eyJ2ZW5jb2RlX3RhZyI6Im9lcF9zZCJ9&_nc_ohc=-YoBkigZ__oAX-MI1to&_nc_ht=video-atl3-1.xx&oh=f6d39b0bc99d93e97b88bc7afcee607d&oe=5F5F0546,
45,8.0,,12.0,,3218792994798925,Where in the World is WyLi...day 5!,https://facebook.com/story.php?story_fbid=3218792994798925&id=478339048844347,,0.0,Where in the World is WyLi...day 5!,2020-04-28 10:27:44,,
46,0.0,,7.0,,811429172684252,Daily Announcements 4-28-20201,,,0.0,Daily Announcements 4-28-20201,2020-04-28 09:31:53,https://video-atl3-1.xx.fbcdn.net/v/t42.26565-2/10000000_163480048570963_6337481757106046758_n.mp4?_nc_cat=105&_nc_sid=985c63&efg=eyJ2ZW5jb2RlX3RhZyI6Im9lcF9zZCJ9&_nc_ohc=oCtdf9ud1hUAX8jc7MO&_nc_ht=video-atl3-1.xx&oh=e55c62b5966eb72c9a35dd370927bb1a&oe=5F5F0B64,
47,8.0,https://scontent-atl3-1.xx.fbcdn.net/v/t1.0-9/fr/cp0/e15/q65/94899609_3216109235067301_3721374293360115712_n.jpg?_nc_cat=105&_nc_sid=110474&_nc_ohc=R-7G5FlBz1gAX-ARIcE&_nc_ht=scontent-atl3-1.xx&tp=14&oh=7783f2c2426717eb41e358a6452c9794&oe=5F83771C,4.0,,3216112351733656,Where in the World is WyLi??? Day 4 and still no WyLi? Can you identify his last known location???,https://facebook.com/story.php?story_fbid=3216112351733656&id=478339048844347,,0.0,Where in the World is WyLi??? Day 4 and still no WyLi? Can you identify his last known location???,2020-04-27 09:40:01,,
48,0.0,,4.0,,522205325118264,Daily Announcements 4-27-2020,,,0.0,Daily Announcements 4-27-2020,2020-04-27 09:30:29,https://video-atl3-1.xx.fbcdn.net/v/t42.26565-2/10000000_754394441991742_5607237775604573006_n.mp4?_nc_cat=102&_nc_sid=985c63&efg=eyJ2ZW5jb2RlX3RhZyI6Im9lcF9zZCJ9&_nc_ohc=LuN4ej7xMgsAX-3Mw-I&_nc_ht=video-atl3-1.xx&oh=293c022f2467c1fafb8be3a1e09cae21&oe=5F5F0E20,
49,11.0,https://scontent-atl3-1.xx.fbcdn.net/v/t1.0-9/fr/cp0/e15/q65/94575301_3208483662496525_4138055214211006464_n.jpg?_nc_cat=102&_nc_sid=110474&_nc_ohc=kBXUKrU3dm0AX9cyTXN&_nc_ht=scontent-atl3-1.xx&tp=14&oh=1258e6542767662f905183e7de909857&oe=5F848291,7.0,,3208488989162659,Where in the World is WyLi??? Day 3 and WyLi is still on the loose! Be the first person to correctly identify his last location and you will win a prize! One family winner and one staff winner per day. A family can only win once. The daily winner will be announced at 3 pm.,https://facebook.com/story.php?story_fbid=3208488989162659&id=478339048844347,,0.0,Where in the World is WyLi??? Day 3 and WyLi is still on the loose! Be the first person to correctly identify his last location and you will win a prize! One family winner and one staff winner per day. A family can only win once. The daily winner will be announced at 3 pm.,2020-04-24 09:41:11,,
50,1.0,,3.0,,622514608336030,Daily Announcements 4-24-2020,,,0.0,Daily Announcements 4-24-2020,2020-04-24 09:31:35,https://video-atl3-1.xx.fbcdn.net/v/t42.26565-2/10000000_732414354216456_8722819571610530887_n.mp4?_nc_cat=101&_nc_sid=985c63&efg=eyJ2ZW5jb2RlX3RhZyI6Im9lcF9zZCJ9&_nc_ohc=SmRWAQOZYjwAX9pvQ8k&_nc_ht=video-atl3-1.xx&oh=6829b044a6ce4fce08841dd995f53e39&oe=5F5F0667,
51,6.0,,53.0,,3206179052726986,A shout out to Shari Hetland for Administrative Professionals Day (yesterday)! She is often the first voice you hear when calling the school and what a POSITIVE and JOYFUL voice it is! Thank you for all that you do!! #WeAreWarbirds,https://facebook.com/story.php?story_fbid=3206179052726986&id=478339048844347,,0.0,A shout out to Shari Hetland for Administrative Professionals Day (yesterday)! She is often the first voice you hear when calling the school and what a POSITIVE and JOYFUL voice it is! Thank you for all that you do!! #WeAreWarbirds,2020-04-23 11:52:33,,
52,2.0,https://scontent-atl3-1.xx.fbcdn.net/v/t1.0-9/fr/cp0/e15/q65/94368645_3205892822755609_7407808031334858752_n.jpg?_nc_cat=104&_nc_sid=110474&_nc_ohc=gLBh_HsVzpsAX-YoQaM&_nc_ht=scontent-atl3-1.xx&tp=14&oh=a7ff5454c6b267043605ce9cc49de2ec&oe=5F860E01,3.0,,3205908379420720,Where in the World is WyLi??? Be the first to comment with the correct location and you will win a prize! REMINDER! A household can only win once.,https://facebook.com/story.php?story_fbid=3205908379420720&id=478339048844347,,0.0,Where in the World is WyLi??? Be the first to comment with the correct location and you will win a prize! REMINDER! A household can only win once.,2020-04-23 09:46:23,,
53,0.0,,2.0,,536350277078815,Daily Announcements 4-23-2020,,,0.0,Daily Announcements 4-23-2020,2020-04-23 09:32:11,https://video-atl3-1.xx.fbcdn.net/v/t42.26565-2/10000000_990759898020016_3213343225687777073_n.mp4?_nc_cat=102&_nc_sid=985c63&efg=eyJ2ZW5jb2RlX3RhZyI6Im9lcF9zZCJ9&_nc_ohc=mSm8djEqdkwAX-MkaVn&_nc_ht=video-atl3-1.xx&oh=eb387865841ab6115a95ad6cbc21a65c&oe=5F5F1132,
54,2.0,https://scontent-atl3-1.xx.fbcdn.net/v/t1.0-9/fr/cp0/e15/q65/94143985_3053647638026065_3564052287007490048_n.jpg?_nc_cat=104&_nc_sid=110474&_nc_ohc=cyRsabq8b7IAX8BKSh2&_nc_ht=scontent-atl3-1.xx&tp=14&oh=a8cd743a4aded31e1cbf56666886ccb4&oe=5F83CB99,16.0,,3204010609610497,Congratulations!!,https://facebook.com/story.php?story_fbid=3204010609610497&id=478339048844347,"Wyndmere FFA Chapter
April 22 at 12:14 PM 路

Congrats to our newly elected officers! Excited to work with this team next year!",0.0,"Congratulations!!

Wyndmere FFA Chapter
April 22 at 12:14 PM 路

Congrats to our newly elected officers! Excited to work with this team next year!",2020-04-22 16:06:19,,
55,4.0,https://scontent-atl3-1.xx.fbcdn.net/v/t1.0-9/fr/cp0/e15/q65/94186753_3203282493016642_3265119595383488512_n.jpg?_nc_cat=108&_nc_sid=110474&_nc_ohc=ZJty8-vxFl0AX9WcA5n&_nc_ht=scontent-atl3-1.xx&tp=14&oh=3cc829ebbde6d31e993b43434fb6feec&oe=5F83184A,16.0,,3203288323016059,Where in the World is WyLi??? Our beloved WyLi has gone missing! Please help locate his most recent whereabouts so we can further investigate and hopefully get him back where he belongs. The first correct answer will win a prize!,https://facebook.com/story.php?story_fbid=3203288323016059&id=478339048844347,,0.0,Where in the World is WyLi??? Our beloved WyLi has gone missing! Please help locate his most recent whereabouts so we can further investigate and hopefully get him back where he belongs. The first correct answer will win a prize!,2020-04-22 09:43:26,,
56,0.0,,7.0,,3035946596462412,Daily Announcements 4-22-2020,,,0.0,Daily Announcements 4-22-2020,2020-04-22 09:32:34,https://video-atl3-1.xx.fbcdn.net/v/t42.26565-2/10000000_1016026345521396_142244497964267308_n.mp4?_nc_cat=104&_nc_sid=985c63&efg=eyJ2ZW5jb2RlX3RhZyI6Im9lcF9zZCJ9&_nc_ohc=wgk20o6VKZ0AX8bFKLc&_nc_ht=video-atl3-1.xx&oh=c61bcbf54888ea43dd5e45ec4aa1970f&oe=5F5F0BD7,
57,0.0,,10.0,,2270874429875787,Daily Announcements 4-21-2020,,,0.0,Daily Announcements 4-21-2020,2020-04-21 09:29:40,https://video-atl3-1.xx.fbcdn.net/v/t42.26565-2/10000000_676764989546053_6450486746908836419_n.mp4?_nc_cat=106&_nc_sid=985c63&efg=eyJ2ZW5jb2RlX3RhZyI6Im9lcF9zZCJ9&_nc_ohc=h0UufbolCvYAX8xZh-G&_nc_ht=video-atl3-1.xx&oh=9af66a412d96298336b4c45a01d848d5&oe=5F5F0B23,
58,0.0,,1.0,,164232188204205,Daily Announcements 4-20-2020,,,0.0,Daily Announcements 4-20-2020,2020-04-20 09:30:22,https://video-atl3-1.xx.fbcdn.net/v/t42.26565-2/106713893_3215452135200593_1697464273670968291_n.mp4?_nc_cat=110&_nc_sid=985c63&efg=eyJ2ZW5jb2RlX3RhZyI6Im9lcF9zZCJ9&_nc_ohc=49sggU--xBcAX_Pg9Rq&_nc_ht=video-atl3-1.xx&oh=c9a599a2482f9f251ad884f1bf95d3cf&oe=5F5F0D46,
59,0.0,,0.0,,629257297923234,Daily Announcements 4-17-2020,,,0.0,Daily Announcements 4-17-2020,2020-04-17 09:29:42,https://video-atl3-1.xx.fbcdn.net/v/t42.26565-2/108148531_211450500117203_2914075353934790007_n.mp4?_nc_cat=109&_nc_sid=985c63&efg=eyJ2ZW5jb2RlX3RhZyI6Im9lcF9zZCJ9&_nc_ohc=pS5-KPxSB00AX8Gv2hA&_nc_ht=video-atl3-1.xx&oh=b0c1c51168ca01f13740a19d10ba26a0&oe=5F5F08CA,
60,5.0,,34.0,,3190863317591893,The Haugen/Kuchera/Heitkamp clan sent this to me to share with the staff. Thank you for sending this! It's great to see your smiling faces!,,,0.0,The Haugen/Kuchera/Heitkamp clan sent this to me to share with the staff. Thank you for sending this! It's great to see your smiling faces!,2020-04-17 09:28:45,https://video-atl3-1.xx.fbcdn.net/v/t42.9040-2/94176055_535318763853779_1201883526190858240_n.mp4?_nc_cat=109&_nc_sid=985c63&efg=eyJ2ZW5jb2RlX3RhZyI6ImxlZ2FjeV9zZCJ9&_nc_ohc=YDGt47gj0r0AX-NC2Q9&_nc_ht=video-atl3-1.xx&oh=013205527590d2da1cbf18310c6ba33e&oe=5F5F0EAA,
61,0.0,,6.0,,239699387082686,Daily Announcements 4-16-2020,,,0.0,Daily Announcements 4-16-2020,2020-04-16 09:30:14,https://video-atl3-1.xx.fbcdn.net/v/t42.26565-2/10000000_1502491033287893_2197576141000684673_n.mp4?_nc_cat=101&_nc_sid=985c63&efg=eyJ2ZW5jb2RlX3RhZyI6Im9lcF9zZCJ9&_nc_ohc=IhjC5buqGaQAX-VINfi&_nc_ht=video-atl3-1.xx&oh=26be0d61639d2407767606aed1c47252&oe=5F5F085F,
62,1.0,,8.0,,691643158273265,Daily Announcements 4-14-2020,,,0.0,Daily Announcements 4-14-2020,2020-04-14 09:32:20,https://video-atl3-1.xx.fbcdn.net/v/t42.26565-2/10000000_2872840392943549_3850097320360319327_n.mp4?_nc_cat=108&_nc_sid=985c63&efg=eyJ2ZW5jb2RlX3RhZyI6Im9lcF9zZCJ9&_nc_ohc=Vw4yraanJTcAX-AfYPB&_nc_ht=video-atl3-1.xx&oh=072f8fe55501bae4f5fbb30330bac7a2&oe=5F5F047A,
63,0.0,https://scontent-atl3-1.xx.fbcdn.net/v/t1.0-9/fr/cp0/e15/q65/92811571_3172836222727936_2288172611814817792_o.jpg?_nc_cat=101&_nc_sid=e007fa&_nc_ohc=Dv7YI8nqhTsAX-s9XsT&_nc_ht=scontent-atl3-1.xx&tp=14&oh=3027016118e3768d0899bff459acb717&oe=5F8532AB,23.0,,,,,"Wyndmere School added 5 new photos.
April 9 at 3:29 PM 路",0.0,"Wyndmere School added 5 new photos.
April 9 at 3:29 PM 路",2020-04-09 16:29:24,,
64,0.0,,15.0,https://www.youtube.com/watch?v=ikhk9AFMxMM&feature=youtu.be,3172794566065435,"Dear Students....

https://www.youtube.com/watch?v=ikhk9AFMxMM&feature=youtu.be",https://facebook.com/story.php?story_fbid=3172794566065435&id=478339048844347,"YOUTUBE.COM
Wyndmere Staff- Dear Students",21.0,"Dear Students....

https://www.youtube.com/watch?v=ikhk9AFMxMM&feature=youtu.be

YOUTUBE.COM
Wyndmere Staff- Dear Students",2020-04-09 16:02:20,,
65,0.0,,3.0,,3172114392800119,Daiky Announcements 4/9/2020,,,0.0,Daiky Announcements 4/9/2020,2020-04-09 09:42:28,https://video-atl3-1.xx.fbcdn.net/v/t42.9040-2/92984716_1058407774516273_6747669221477449728_n.mp4?_nc_cat=100&_nc_sid=985c63&efg=eyJ2ZW5jb2RlX3RhZyI6ImxlZ2FjeV9zZCJ9&_nc_ohc=kG_8r18aHrYAX9Cg7ta&_nc_ht=video-atl3-1.xx&oh=7f26db3736dc2243568a14c48f1fa7c4&oe=5F5F0679,
66,0.0,,1.0,https://wyndmereonline.weebly.com/,3170539812957577,"A reminder that WPS has a webpage where you can find occasional updates, technology help, and contact information during this period of distance education. The link can be found in the center section of our website as well as here. Link: https://wyndmereonline.weebly.com",https://facebook.com/story.php?story_fbid=3170539812957577&id=478339048844347,"WYNDMEREONLINE.WEEBLY.COM
Wyndmere School Online Portal",0.0,"A reminder that WPS has a webpage where you can find occasional updates, technology help, and contact information during this period of distance education. The link can be found in the center section of our website as well as here. Link: https://wyndmereonline.weebly.com

WYNDMEREONLINE.WEEBLY.COM
Wyndmere School Online Portal",2020-04-08 16:03:16,,
67,0.0,https://scontent-atl3-1.xx.fbcdn.net/v/t1.0-9/fr/cp0/e15/q65/92462939_3169827713028787_6825432237186482176_n.jpg?_nc_cat=106&_nc_sid=110474&_nc_ohc=EozEHN0gabAAX-VCzUW&_nc_ht=scontent-atl3-1.xx&tp=14&oh=84427549cbe938f7ae1dcb5f09f2d785&oe=5F84DC72,37.0,,3169829763028582,WPS is not the same without each one of you!,https://facebook.com/story.php?story_fbid=3169829763028582&id=478339048844347,,0.0,WPS is not the same without each one of you!,2020-04-08 09:41:00,,
68,0.0,,8.0,,1081753838884546,Daily Announcements 4-8-2020,,,0.0,Daily Announcements 4-8-2020,2020-04-08 09:30:21,https://video-atl3-1.xx.fbcdn.net/v/t42.26565-2/10000000_305892330790299_4091995114904470636_n.mp4?_nc_cat=108&_nc_sid=985c63&efg=eyJ2ZW5jb2RlX3RhZyI6Im9lcF9zZCJ9&_nc_ohc=JoyRoFRQ85YAX8Rg3fC&_nc_ht=video-atl3-1.xx&oh=cc19ed989f0227f8e0d03a741a323ea0&oe=5F5F0E54,
69,0.0,,9.0,,1448163675356377,Daily Announcements 4-7-2020,,,0.0,Daily Announcements 4-7-2020,2020-04-07 09:32:24,https://video-atl3-1.xx.fbcdn.net/v/t42.26565-2/10000000_342645180058689_6017011131680689578_n.mp4?_nc_cat=103&_nc_sid=985c63&efg=eyJ2ZW5jb2RlX3RhZyI6Im9lcF9zZCJ9&_nc_ohc=JnbgN_OS2ScAX-NM_xK&_nc_ht=video-atl3-1.xx&oh=b4b28cd140c5ae24b3d3dc61d2909e94&oe=5F5F0D9E,
70,0.0,,10.0,,513279422888254,Daily Announcements 4-6-2020,,,0.0,Daily Announcements 4-6-2020,2020-04-06 10:12:24,https://video-atl3-1.xx.fbcdn.net/v/t42.26565-2/106687443_695253054371658_2721722340310152382_n.mp4?_nc_cat=100&_nc_sid=985c63&efg=eyJ2ZW5jb2RlX3RhZyI6Im9lcF9zZCJ9&_nc_ohc=Dz_JsIP02k0AX8i8fl8&_nc_ht=video-atl3-1.xx&oh=181bca0617f2cce517a16abbecea160a&oe=5F5F06BB,
71,0.0,,6.0,https://www.youtube.com/channel/UCg26PwgQtn9LYdFPRMTLYkg,3159087554102803,Check out Mr. Gerhardt's YouTube channel for Music lessons for grades K-6! https://www.youtube.com/channel/UCg26PwgQtn9LYdFPRMTLYkg,https://facebook.com/story.php?story_fbid=3159087554102803&id=478339048844347,"YOUTUBE.COM
Mr Gerhardt Music",0.0,"Check out Mr. Gerhardt's YouTube channel for Music lessons for grades K-6! https://www.youtube.com/channel/UCg26PwgQtn9LYdFPRMTLYkg

YOUTUBE.COM
Mr Gerhardt Music",2020-04-03 14:14:17,,
72,3.0,https://scontent-atl3-1.xx.fbcdn.net/v/t1.0-9/fr/cp0/e15/q65/91779972_3159063580771867_9123838699505713152_n.jpg?_nc_cat=100&_nc_sid=8024bb&_nc_ohc=hmqkof_gRrQAX-FpjF1&_nc_ht=scontent-atl3-1.xx&tp=14&oh=7ebc5d9eb531e3a8c656ae0f6d28767b&oe=5F84F8FB,51.0,,3159066034104955,"Yesterday was World Autism Awareness Day...our staff showed off their ""Choose Kind"" t-shirts in support of this day!",https://facebook.com/story.php?story_fbid=3159066034104955&id=478339048844347,,0.0,"Yesterday was World Autism Awareness Day...our staff showed off their ""Choose Kind"" t-shirts in support of this day!",2020-04-03 14:02:15,,
73,4.0,,19.0,,3158546230823602,Daily Announcements 4-3-2020,,,0.0,Daily Announcements 4-3-2020,2020-04-03 09:36:43,https://video-atl3-1.xx.fbcdn.net/v/t42.9040-2/91939504_505360223489544_1316586705209262080_n.mp4?_nc_cat=101&_nc_sid=985c63&efg=eyJ2ZW5jb2RlX3RhZyI6ImxlZ2FjeV9zZCJ9&_nc_ohc=1p58eS8Odl0AX8x5H8f&_nc_ht=video-atl3-1.xx&oh=8be1d36e06c078e24e8457ff1b4e595f&oe=5F5F0C49,
74,0.0,,6.0,,214381199879972,,,,0.0,,2020-04-03 09:26:54,https://video-atl3-1.xx.fbcdn.net/v/t42.26565-2/10000000_176293197197575_139083212773402934_n.mp4?_nc_cat=100&_nc_sid=985c63&efg=eyJ2ZW5jb2RlX3RhZyI6Im9lcF9zZCJ9&_nc_ohc=kHbcIremHSwAX-H7aMM&_nc_ht=video-atl3-1.xx&oh=80832de44b3a4a26839e975776f14d66&oe=5F5F1258,
75,0.0,,4.0,,3156789317665960,,https://facebook.com/story.php?story_fbid=3156789317665960&id=478339048844347,,0.0,,2020-04-02 13:52:20,,
76,10.0,,37.0,,154179312552414,Daily Announcements 4-2-2020,,,3.0,Daily Announcements 4-2-2020,2020-04-02 09:25:37,https://video-atl3-1.xx.fbcdn.net/v/t42.26565-2/10000000_257197418918406_4082438355218312670_n.mp4?_nc_cat=109&_nc_sid=985c63&efg=eyJ2ZW5jb2RlX3RhZyI6Im9lcF9zZCJ9&_nc_ohc=CZeMYzSz3uUAX9qWHgo&_nc_ht=video-atl3-1.xx&oh=7cd00c6c838be53b2aac28e2f37a2d17&oe=5F5F089C,
77,0.0,,5.0,https://www.valleynewslive.com/content/news/Public-health-officials-urge-families-to-stay-off-public-playground-equipment-569277141.html,3154109517933940,https://www.valleynewslive.com/content/news/Public-health-officials-urge-families-to-stay-off-public-playground-equipment-569277141.html,https://facebook.com/story.php?story_fbid=3154109517933940&id=478339048844347,"VALLEYNEWSLIVE.COM
Public health officials urge families to stay off public playground equipment",15.0,"https://www.valleynewslive.com/content/news/Public-health-officials-urge-families-to-stay-off-public-playground-equipment-569277141.html

VALLEYNEWSLIVE.COM
Public health officials urge families to stay off public playground equipment",2020-04-01 10:04:40,,
78,0.0,,7.0,,3149875041690721,FYI for elementary parents: SeeSaw is currently down. They are working on the problem and hope to have it fixed soon! We are aware and making adjustments as needed. #distancelearning,https://facebook.com/story.php?story_fbid=3149875041690721&id=478339048844347,,0.0,FYI for elementary parents: SeeSaw is currently down. They are working on the problem and hope to have it fixed soon! We are aware and making adjustments as needed. #distancelearning,2020-03-30 11:54:26,,
79,3.0,,38.0,,3143079045703654,"We have made it through the first week of distance learning! Thank you to the parents, students, and staff for all of their patience, enthusiasm, and efforts. #WeAreWarbirds",https://facebook.com/story.php?story_fbid=3143079045703654&id=478339048844347,,0.0,"We have made it through the first week of distance learning! Thank you to the parents, students, and staff for all of their patience, enthusiasm, and efforts. #WeAreWarbirds",2020-03-27 14:01:53,,
80,0.0,,7.0,,3131969753481250,From Mrs. Manstrom - I will post my library readings this week on the Wyndmere Little Free Library FB page- so parents can follow that platform if the children want to listen in. Tomorrow will be the 4th graders. Ill combine their class so we arent in two places. ,https://facebook.com/story.php?story_fbid=3131969753481250&id=478339048844347,,0.0,From Mrs. Manstrom - I will post my library readings this week on the Wyndmere Little Free Library FB page- so parents can follow that platform if the children want to listen in. Tomorrow will be the 4th graders. Ill combine their class so we arent in two places. ,2020-03-22 20:55:11,,
81,44.0,,36.0,,906715456436452,,,,8.0,,2020-03-22 20:31:49,https://video-atl3-1.xx.fbcdn.net/v/t42.26565-2/10000000_712346606272583_2159738555322724263_n.mp4?_nc_cat=106&_nc_sid=985c63&efg=eyJ2ZW5jb2RlX3RhZyI6Im9lcF9zZCJ9&_nc_ohc=DilxQiK84kkAX9lbpse&_nc_ht=video-atl3-1.xx&oh=7796131ffc45bac31ec92de807384be7&oe=5F5F0D95,
82,1.0,,9.0,,3131774240167468,"We are going to try a quick Facebook live tonight at 7:30 to give a few updates. Mr. Kern has never tried this, so we will see what happens!! #WeAreWarbirds",https://facebook.com/story.php?story_fbid=3131774240167468&id=478339048844347,,0.0,"We are going to try a quick Facebook live tonight at 7:30 to give a few updates. Mr. Kern has never tried this, so we will see what happens!! #WeAreWarbirds",2020-03-22 18:45:15,,
83,2.0,,13.0,https://forms.gle/mjueCX6iGtPKHERb7,3119243638087195,"We are currently in the process of planning for distance learning in the event of a longer school closure. An email was sent out to each family with a survey to address technology. This survey can be accessed here:

https://forms.gle/mjueCX6iGtPKHERb7

Please fill out if you have not yet done so.",https://facebook.com/story.php?story_fbid=3119243638087195&id=478339048844347,"DOCS.GOOGLE.COM
Wyndmere Distance/Online Learning Questionnaire",5.0,"We are currently in the process of planning for distance learning in the event of a longer school closure. An email was sent out to each family with a survey to address technology. This survey can be accessed here:

https://forms.gle/mjueCX6iGtPKHERb7

Please fill out if you have not yet done so.

DOCS.GOOGLE.COM
Wyndmere Distance/Online Learning Questionnaire",2020-03-17 11:26:06,,
84,0.0,,0.0,,3117609374917288,The Wyndmere Gearing up for Kindergarten program has been postponed until further notice.,https://facebook.com/story.php?story_fbid=3117609374917288&id=478339048844347,,0.0,The Wyndmere Gearing up for Kindergarten program has been postponed until further notice.,2020-03-16 17:56:39,,
85,2.0,,21.0,,3115651455113080,,https://facebook.com/story.php?story_fbid=3115651455113080&id=478339048844347,,0.0,,2020-03-15 21:23:34,,
86,0.0,,3.0,,3110791372265755,"Due to the NDHSAA suspending of all extra-curricular activities indefinitely, all WPS extra and co-curricular events are cancelled until further notice.",https://facebook.com/story.php?story_fbid=3110791372265755&id=478339048844347,,0.0,"Due to the NDHSAA suspending of all extra-curricular activities indefinitely, all WPS extra and co-curricular events are cancelled until further notice.",2020-03-13 16:22:52,,
87,14.0,https://scontent-atl3-1.xx.fbcdn.net/v/t1.0-9/fr/cp0/e15/q65/89008170_3104564506221775_723052178003984384_n.jpg?_nc_cat=109&_nc_sid=110474&_nc_ohc=RvaQO2Y2Cx0AX8GAgRW&_nc_ht=scontent-atl3-1.xx&tp=14&oh=b601a6763a1040fcbd0dc52daf63b38f&oe=5F85D963,127.0,,3104565272888365,"Take a look at these! Wyndmere School has added stop arm extenders to our buses in an effort to curb failures to stop, especially on highways. Another step in keeping our students and drivers safe! #WeAreWarbirds #BusSafety",https://facebook.com/story.php?story_fbid=3104565272888365&id=478339048844347,,0.0,"Take a look at these! Wyndmere School has added stop arm extenders to our buses in an effort to curb failures to stop, especially on highways. Another step in keeping our students and drivers safe! #WeAreWarbirds #BusSafety",2020-03-10 20:33:12,,
88,1.0,,23.0,,3104439736234252,"2 great wins by the elementary boys basketball team tonight against Richland-44! 2-0 to start the year!!
#WeAreWarbirds",https://facebook.com/story.php?story_fbid=3104439736234252&id=478339048844347,,0.0,"2 great wins by the elementary boys basketball team tonight against Richland-44! 2-0 to start the year!!
#WeAreWarbirds",2020-03-10 18:58:56,,
89,0.0,https://scontent-atl3-1.xx.fbcdn.net/v/t1.0-9/fr/cp0/e15/q65/88959137_2951192628271567_8159571082165092352_n.jpg?_nc_cat=103&_nc_sid=110474&_nc_ohc=uMmnUNjcZCgAX-tP7Wr&_nc_ht=scontent-atl3-1.xx&tp=14&oh=2ba8c3f1f72b01b60b3a175f53a30ea0&oe=5F82D846,8.0,,3102319599779599,,https://facebook.com/story.php?story_fbid=3102319599779599&id=478339048844347,"Wyndmere FFA Chapter
March 9 at 6:27 PM 路

THANK YOU to TSgts Shelly and Matt from the ND Air Guard for coming into our sophomore and freshman classes today. They helped our sophomores practice some interviewing skills and talked about the Food Science behind MREs with the freshman. Awesome morning!",0.0,"Wyndmere FFA Chapter
March 9 at 6:27 PM 路

THANK YOU to TSgts Shelly and Matt from the ND Air Guard for coming into our sophomore and freshman classes today. They helped our sophomores practice some interviewing skills and talked about the Food Science behind MREs with the freshman. Awesome morning!",2020-03-09 19:31:42,,
90,12.0,https://scontent-atl3-1.xx.fbcdn.net/v/t1.0-9/fr/cp0/e15/q65/88177458_3095035683841324_7879462106918027264_n.jpg?_nc_cat=107&_nc_sid=110474&_nc_ohc=BE5_x1C4HQAAX-V_2fK&_nc_ht=scontent-atl3-1.xx&tp=14&oh=4fc9252e22759c47816ea67025d50a12&oe=5F84209A,66.0,,3095036680507891,"We are saddened by the passing of longtime Wyndmere School employee Karolyn Nelson. She served our students and staff with compassion, a positive demeanor, and was loved by all. She will be greatly missed.",https://facebook.com/story.php?story_fbid=3095036680507891&id=478339048844347,,0.0,"We are saddened by the passing of longtime Wyndmere School employee Karolyn Nelson. She served our students and staff with compassion, a positive demeanor, and was loved by all. She will be greatly missed.",2020-03-06 10:35:28,,
91,0.0,,1.0,,3084576841553875,,https://facebook.com/story.php?story_fbid=3084576841553875&id=478339048844347,"Darcy BlazekWyndmere High School Alumni
March 1 at 11:40 AM 路",0.0,"Darcy BlazekWyndmere High School Alumni
March 1 at 11:40 AM 路",2020-03-01 14:39:39,,
92,0.0,,0.0,,,,,,0.0,,2020-09-13 23:49:27.821224,,
93,0.0,,1.0,,3069687986376094,,https://facebook.com/story.php?story_fbid=3069687986376094&id=478339048844347,,0.0,,2020-02-23 18:46:52,,
94,1.0,,24.0,,3067772693234290,,https://facebook.com/story.php?story_fbid=3067772693234290&id=478339048844347,,0.0,,2020-02-22 21:59:12,,
95,0.0,,3.0,,3066673440010882,"There is Elementary Basketball this Saturday for grades 2-6th grade. Please come to the gym quietly because there is a Speech Meet going on in the classrooms. Due to conflicts, the Elementary basketball program will not be playing at halftimes for the varsity boys basketball games. We will plan to do it next year.
9-9:50=2nd-3rd grade
10-11:15=4th-6th grade",https://facebook.com/story.php?story_fbid=3066673440010882&id=478339048844347,,0.0,"There is Elementary Basketball this Saturday for grades 2-6th grade. Please come to the gym quietly because there is a Speech Meet going on in the classrooms. Due to conflicts, the Elementary basketball program will not be playing at halftimes for the varsity boys basketball games. We will plan to do it next year.
9-9:50=2nd-3rd grade
10-11:15=4th-6th grade",2020-02-22 09:53:03,,
96,0.0,https://scontent-atl3-1.xx.fbcdn.net/v/t1.0-9/fr/cp0/e15/q65/86999418_3063186280359598_5642736756563378176_n.jpg?_nc_cat=111&_nc_sid=110474&_nc_ohc=UvJbgSzGeBIAX_G7Ge5&_nc_ht=scontent-atl3-1.xx&tp=14&oh=a8ea7065da659d569e7503c096cefc5c&oe=5F84C89A,21.0,,3063186733692886,"Congratulations to the newest members of the ND Assoc. of Honor Society, Nick Puetz, Alexandra Puetz, and Thomas Lothspeich! They were honored during a ceremony this morning!!",https://facebook.com/story.php?story_fbid=3063186733692886&id=478339048844347,,0.0,"Congratulations to the newest members of the ND Assoc. of Honor Society, Nick Puetz, Alexandra Puetz, and Thomas Lothspeich! They were honored during a ceremony this morning!!",2020-02-20 19:47:17,,
97,0.0,,5.0,,3063126600365566,,https://facebook.com/story.php?story_fbid=3063126600365566&id=478339048844347,,0.0,,2020-02-20 19:06:06,,
98,1.0,,35.0,,3059072857437607,,https://facebook.com/story.php?story_fbid=3059072857437607&id=478339048844347,,0.0,,2020-02-18 22:56:54,,
99,0.0,,9.0,,3056908144320745,,https://facebook.com/story.php?story_fbid=3056908144320745&id=478339048844347,,0.0,,2020-02-17 23:06:16,,
100,2.0,https://scontent-atl3-1.xx.fbcdn.net/v/t1.0-9/fr/cp0/e15/q65/86615277_3051694511508775_1538031611218493440_n.jpg?_nc_cat=101&_nc_sid=110474&_nc_ohc=VHMF7GNs2ksAX9iB0v7&_nc_oc=AQmmF1JXP7E-kQMqwnz3FUTQ6aBxkQs3gZ6CpEQkYvKOCe-i68zBO8p79J8UM_HUiCs&_nc_ht=scontent-atl3-1.xx&tp=14&oh=b67ee03442903c499128bb9e4207f09a&oe=5F85BBB8,34.0,,3051697271508499,"Garrett, Justin, Maria, and Ethan competed at the Richland Co. Spelling Bee on Thursday! Garrett took 1st in the 6th grade division and Justin took 1st in the 5th grade division! #WeAreWarbirds",https://facebook.com/story.php?story_fbid=3051697271508499&id=478339048844347,,0.0,"Garrett, Justin, Maria, and Ethan competed at the Richland Co. Spelling Bee on Thursday! Garrett took 1st in the 6th grade division and Justin took 1st in the 5th grade division! #WeAreWarbirds",2020-02-15 14:46:24,,
101,0.0,,14.0,,3050099851668241,,https://facebook.com/story.php?story_fbid=3050099851668241&id=478339048844347,,0.0,,2020-02-14 21:52:52,,
102,0.0,https://scontent-atl3-1.xx.fbcdn.net/v/t1.0-9/fr/cp0/e15/q65/86173918_2897493356974828_7316261769788260352_n.jpg?_nc_cat=107&_nc_sid=110474&_nc_ohc=zJtmTU4LtFMAX_E_5NK&_nc_ht=scontent-atl3-1.xx&tp=14&oh=0c878137dd85e27e989ab1f6ee81e68f&oe=5F82CB13,8.0,http://judgingcard.com/,3049690365042523,Awesome job Wyndmere FFA!!,https://facebook.com/story.php?story_fbid=3049690365042523&id=478339048844347,"Wyndmere FFA Chapter
February 14 at 4:22 PM 路

We competed at NDSU today. Congrats to Sierra Strenge for placing first in Small Animal Care! Ms. Leier and I are proud of all our members! Way to go every- full results can be found on judgingcard.com",0.0,"Awesome job Wyndmere FFA!!

Wyndmere FFA Chapter
February 14 at 4:22 PM 路

We competed at NDSU today. Congrats to Sierra Strenge for placing first in Small Animal Care! Ms. Leier and I are proud of all our members! Way to go every- full results can be found on judgingcard.com",2020-02-14 17:17:28,,
103,0.0,,4.0,,3043140232364203,,https://facebook.com/story.php?story_fbid=3043140232364203&id=478339048844347,,0.0,,2020-02-11 20:32:19,,
104,0.0,https://scontent-atl3-1.xx.fbcdn.net/v/t1.0-9/fr/cp0/e15/q65/84306255_3029960030348890_607961275107901440_n.jpg?_nc_cat=106&_nc_sid=110474&_nc_ohc=VsSEfEU-7NAAX9VY1LF&_nc_ht=scontent-atl3-1.xx&tp=14&oh=d9f5711dc92eb1cffe1dc6694eefd0d7&oe=5F8533F4,0.0,,3029960130348880,,https://facebook.com/story.php?story_fbid=3029960130348880&id=478339048844347,,0.0,,2020-02-05 21:24:57,,
105,0.0,,2.0,https://bookfairs.scholastic.com/bookfairs/articles/ewallet.html?psch=CORP%2Fps%2F2017%2FGoogle%2Ftxtl%2FeWallet%7CPHM%2FSBF%7CBrand%7CCore%7CPHM%2Fscholastic+ewallet%2F78120723056%2Fp%2FMultiBUHeadline%2FScholastic+Enterprise+659-765-1234%2F&k_clickid=aa2f0813-59fb-4084-b934-5297ddcdc747&gclid=CjwKCAiAsIDxBRAsEiwAV76N87AzuzgRRIDzzWcJhBAeFQgB8CyMQ_fqNSgo9GMopztiVE9rf7rJYRoCVdMQAvD_BwE,3029162830428610,The Book Fair e-Wallet is way for your child to shop the fair without having to send money with them! Check it out!,https://facebook.com/story.php?story_fbid=3029162830428610&id=478339048844347,"BOOKFAIRS.SCHOLASTIC.COM
Try the Book Fair eWallet",0.0,"The Book Fair e-Wallet is way for your child to shop the fair without having to send money with them! Check it out!

BOOKFAIRS.SCHOLASTIC.COM
Try the Book Fair eWallet",2020-02-05 13:15:05,,
106,0.0,https://scontent-atl3-1.xx.fbcdn.net/v/t1.0-9/fr/cp0/e15/q65/83227542_3029151163763110_2094584021873852416_n.jpg?_nc_cat=105&_nc_sid=110474&_nc_ohc=0uLKLnkLdSAAX-BzJhX&_nc_ht=scontent-atl3-1.xx&tp=14&oh=414526371ae2793502329d1140957916&oe=5F83BDCD,0.0,https://volunteer.scholastic.com/#/signup/C7rIHD711,3029157227095837,Wyndmeres Spring Book Fair is fast approaching. Click the link to volunteer and help out! https://volunteer.scholastic.com/#/signup/C7rIHD711,https://facebook.com/story.php?story_fbid=3029157227095837&id=478339048844347,,0.0,Wyndmeres Spring Book Fair is fast approaching. Click the link to volunteer and help out! https://volunteer.scholastic.com/#/signup/C7rIHD711,2020-02-05 13:12:40,,
107,0.0,,0.0,https://www.nfhsnetwork.com/,3012276615450565,We just got word that tonights Boys basketball game against Oakes can be viewed online at the following address: https://www.nfhsnetwork.com Just make sure to search Oakes!,https://facebook.com/story.php?story_fbid=3012276615450565&id=478339048844347,"NFHSNETWORK.COM
High School Sports Online - Stream Live & On Demand",0.0,"We just got word that tonights Boys basketball game against Oakes can be viewed online at the following address: https://www.nfhsnetwork.com Just make sure to search Oakes!

NFHSNETWORK.COM
High School Sports Online - Stream Live & On Demand",2020-01-28 19:08:36,,
108,0.0,https://scontent-atl3-1.xx.fbcdn.net/v/t1.0-9/fr/cp0/e15/q65/83184008_602453743658663_7260103813967642624_o.jpg?_nc_cat=107&_nc_sid=9e2e56&_nc_ohc=edr8SPw7hRoAX9nFxbr&_nc_ht=scontent-atl3-1.xx&tp=14&oh=0c1e51ce735a8a1dd142db3c0f768c17&oe=5F84D43B,7.0,,3008479689163591,     ,https://facebook.com/story.php?story_fbid=3008479689163591&id=478339048844347,"Wyndmere Music Department
January 26 at 7:02 PM 路

We had a great weekend at UND Honor Band and Choir! Congratulations to Alexandra P (women's choir) and Ethan W & Alexis B (band) for their fantastic music making! They concluded the concert with the band, orchestra, women's choir, and mixed choir performing a powerful ""Battle Hymn of the Republic"". Great job, everyone!",0.0,"     

Wyndmere Music Department
January 26 at 7:02 PM 路

We had a great weekend at UND Honor Band and Choir! Congratulations to Alexandra P (women's choir) and Ethan W & Alexis B (band) for their fantastic music making! They concluded the concert with the band, orchestra, women's choir, and mixed choir performing a powerful ""Battle Hymn of the Republic"". Great job, everyone!",2020-01-26 22:38:30,,
109,2.0,https://scontent-atl3-1.xx.fbcdn.net/v/t1.0-9/fr/cp0/e15/q65/83278213_3006128712732022_7363761312058310656_n.jpg?_nc_cat=111&_nc_sid=110474&_nc_ohc=RhfHdAWdR5AAX8CEp4Z&_nc_ht=scontent-atl3-1.xx&tp=14&oh=243cf1382160b72f099625be3e647762&oe=5F851911,33.0,,3006128959398664,"Our LEGO League team competed in their first competition in Fargo today! Congrats to coach Rae Hosford and the team on a great experience! Also, thank you to our coaches from Bobcat for helping this season!",https://facebook.com/story.php?story_fbid=3006128959398664&id=478339048844347,,0.0,"Our LEGO League team competed in their first competition in Fargo today! Congrats to coach Rae Hosford and the team on a great experience! Also, thank you to our coaches from Bobcat for helping this season!",2020-01-25 21:19:29,,
110,0.0,,0.0,,2988522044492689,FFA Update,https://facebook.com/story.php?story_fbid=2988522044492689&id=478339048844347,"Wyndmere FFA Chapter
January 17 at 9:17 AM 路",0.0,"FFA Update

Wyndmere FFA Chapter
January 17 at 9:17 AM 路",2020-01-17 11:21:33,,
111,0.0,,0.0,,,,https://facebook.com/story.php?story_fbid=2838561252868039&id=769411503116368,,0.0,,2020-09-13 23:49:27.821257,,
112,0.0,,8.0,,2988007297877497,,https://facebook.com/story.php?story_fbid=2988007297877497&id=478339048844347,,0.0,,2020-01-17 06:51:28,,
113,0.0,,1.0,,2984748371536723,,https://facebook.com/story.php?story_fbid=2984748371536723&id=478339048844347,,0.0,,2020-01-15 19:34:39,,
114,2.0,,28.0,,2973457215999172,And we are going to overtime!,https://facebook.com/story.php?story_fbid=2973457215999172&id=478339048844347,,0.0,And we are going to overtime!,2020-01-10 21:57:14,,
115,1.0,https://scontent-atl3-1.xx.fbcdn.net/v/t1.0-9/fr/cp0/e15/q65/82075105_2967903009887926_3280381366532833280_n.jpg?_nc_cat=102&_nc_sid=110474&_nc_ohc=zuB7z4MfFbIAX9fQiqJ&_nc_ht=scontent-atl3-1.xx&tp=14&oh=6ce2c8afe72ccac925aa565500086a5e&oe=5F847F9B,3.0,,2967903046554589,,https://facebook.com/story.php?story_fbid=2967903046554589&id=478339048844347,,0.0,,2020-01-08 12:11:33,,
116,4.0,,33.0,,2924114504266777,Congrats!!,https://facebook.com/story.php?story_fbid=2924114504266777&id=478339048844347,"Tonya Dee AbelWyndmere PTO
December 20, 2019 at 12:23 PM 路

Congrats to all the Wyndmere teachers graduating today with their masters degree! Mrs. Strenge, Mrs. Hosford, Miss Stein, Mrs. Hoffert, Ms. Zaun, Mrs. Fyre, Ms. Braun, Mrs. Illies",0.0,"Congrats!!

Tonya Dee AbelWyndmere PTO
December 20, 2019 at 12:23 PM 路

Congrats to all the Wyndmere teachers graduating today with their masters degree! Mrs. Strenge, Mrs. Hosford, Miss Stein, Mrs. Hoffert, Ms. Zaun, Mrs. Fyre, Ms. Braun, Mrs. Illies",2019-12-20 13:13:07,,
117,0.0,,26.0,,2906868799324681,,https://facebook.com/story.php?story_fbid=2906868799324681&id=478339048844347,,0.0,,2019-12-12 21:17:06,,
118,0.0,,3.0,,2899429403401954,Come get into the Christmas spirit tonight at the Wyndmere gym!,https://facebook.com/story.php?story_fbid=2899429403401954&id=478339048844347,"MON, DEC 9, 2019
Christmas Concert",0.0,"Come get into the Christmas spirit tonight at the Wyndmere gym!

MON, DEC 9, 2019
Christmas Concert",2019-12-09 17:35:57,,
119,0.0,,11.0,,2872174699460758,,https://facebook.com/story.php?story_fbid=2872174699460758&id=478339048844347,,0.0,,2019-11-28 10:13:27,,
120,1.0,,3.0,,2833778536633708,,https://facebook.com/story.php?story_fbid=2833778536633708&id=478339048844347,,0.0,,2019-11-11 19:27:53,,
121,0.0,,6.0,,2829494040395491,"The Wyndmere Drama Department will be performing a dessert performance of the high school 1-act play After Hours this Sunday evening @ 6:30! Tickets are $5 for adults, $3 for students with a $1 Off any food pantry donation that you bring to the performance.",https://facebook.com/story.php?story_fbid=2829494040395491&id=478339048844347,,0.0,"The Wyndmere Drama Department will be performing a dessert performance of the high school 1-act play After Hours this Sunday evening @ 6:30! Tickets are $5 for adults, $3 for students with a $1 Off any food pantry donation that you bring to the performance.",2019-11-09 22:45:19,,
122,0.0,,0.0,,2829321770412718,,https://facebook.com/story.php?story_fbid=2829321770412718&id=478339048844347,,0.0,,2019-11-09 20:50:11,,
123,0.0,,45.0,,2827304527281109,,https://facebook.com/story.php?story_fbid=2827304527281109&id=478339048844347,,0.0,,2019-11-08 23:15:43,,
124,1.0,,13.0,,2826759457335616,,https://facebook.com/story.php?story_fbid=2826759457335616&id=478339048844347,,0.0,,2019-11-08 17:06:14,,
125,1.0,https://scontent-atl3-1.xx.fbcdn.net/v/t1.0-9/fr/cp0/e15/q65/75380329_2823802484297980_903134715001700352_n.jpg?_nc_cat=101&_nc_sid=110474&_nc_ohc=-v3CV-lNFRoAX_GdxjQ&_nc_ht=scontent-atl3-1.xx&tp=14&oh=cfb6a9ea5f0af55a33a2a266b65efbd4&oe=5F85178B,21.0,,2823803450964550,Wonderful job by the junior class on their Native American projects! #WeAreWarbirds,https://facebook.com/story.php?story_fbid=2823803450964550&id=478339048844347,,0.0,Wonderful job by the junior class on their Native American projects! #WeAreWarbirds,2019-11-07 09:56:07,,
126,0.0,,13.0,,2809184579093104,,https://facebook.com/story.php?story_fbid=2809184579093104&id=478339048844347,,0.0,,2019-10-31 18:05:35,,
127,0.0,,2.0,https://bookfairs.scholastic.com/bookfairs/cptoolkit/homepage.do?method=homepage&url=wyndmereschool1,2806417139369848,Volunteers needed!,https://facebook.com/story.php?story_fbid=2806417139369848&id=478339048844347,"Tonya Dee AbelWyndmere PTO
October 30, 2019 at 8:23 AM 路

The book fair is quickly approaching and we have several spots open to volunteer. We love hosting the book fair and encouraging reading but if we cant get volunteers to help run it the PTO wont be able to continue with this event in the future. Use the link below to give an hour or two of your time so we can continue to encourage a love of books in our kids!

https://bookfairs.scholastic.com/bookfairs/cptoolkit/homepage.do?method=homepage&url=wyndmereschool1",0.0,"Volunteers needed!

Tonya Dee AbelWyndmere PTO
October 30, 2019 at 8:23 AM 路

The book fair is quickly approaching and we have several spots open to volunteer. We love hosting the book fair and encouraging reading but if we cant get volunteers to help run it the PTO wont be able to continue with this event in the future. Use the link below to give an hour or two of your time so we can continue to encourage a love of books in our kids!

https://bookfairs.scholastic.com/bookfairs/cptoolkit/homepage.do?method=homepage&url=wyndmereschool1",2019-10-30 12:16:43,,
128,0.0,,2.0,,2806313439380218,,https://facebook.com/story.php?story_fbid=2806313439380218&id=478339048844347,,0.0,,2019-10-30 11:06:58,,
129,1.0,https://scontent-atl3-1.xx.fbcdn.net/v/t1.0-9/fr/cp0/e15/q65/75462486_2796320283712867_4932566431020613632_n.jpg?_nc_cat=106&_nc_sid=110474&_nc_ohc=4E1uBznjT2QAX8SG13l&_nc_ht=scontent-atl3-1.xx&tp=14&oh=d016fc0efb92344c0af05546c938c0b8&oe=5F832E73,31.0,,2796320527046176,The elementary students joined in as well by cleaning around the school and decorating the outside!,https://facebook.com/story.php?story_fbid=2796320527046176&id=478339048844347,,0.0,The elementary students joined in as well by cleaning around the school and decorating the outside!,2019-10-25 18:44:11,,
130,1.0,,40.0,,2796182093726686,Another successful #DayOfCaring in the books! Our awesome students were out making a difference with a smile on their faces! #WeAreWarbirds,https://facebook.com/story.php?story_fbid=2796182093726686&id=478339048844347,,0.0,Another successful #DayOfCaring in the books! Our awesome students were out making a difference with a smile on their faces! #WeAreWarbirds,2019-10-25 16:59:20,,
131,0.0,,3.0,,2789554617722767,,https://facebook.com/story.php?story_fbid=2789554617722767&id=478339048844347,,0.0,,2019-10-22 15:19:43,,
132,2.0,,22.0,,2787180737960155,Thank you bus drivers and subs for getting our students to their destinations safe and sound each day! We appreciate it!! #BusDriversRock,https://facebook.com/story.php?story_fbid=2787180737960155&id=478339048844347,"Tonya Dee AbelWyndmere PTO
October 21, 2019 at 7:32 AM 路",0.0,"Thank you bus drivers and subs for getting our students to their destinations safe and sound each day! We appreciate it!! #BusDriversRock

Tonya Dee AbelWyndmere PTO
October 21, 2019 at 7:32 AM 路",2019-10-21 14:28:34,,
133,0.0,https://scontent-atl3-1.xx.fbcdn.net/v/t1.0-9/fr/cp0/e15/q65/72920864_2766553310022898_7879218234379993088_n.jpg?_nc_cat=100&_nc_sid=110474&_nc_ohc=_2mUA-IZOcYAX-cr2_9&_nc_ht=scontent-atl3-1.xx&tp=14&oh=e9cf7dbde8646f9bf5caa627bb84f35a&oe=5F8457FF,36.0,,2766553496689546,Alyson Jezusko was the guest conductor for the NDSU Gold Star Marching Band today!! #WarbirdNation,https://facebook.com/story.php?story_fbid=2766553496689546&id=478339048844347,,0.0,Alyson Jezusko was the guest conductor for the NDSU Gold Star Marching Band today!! #WarbirdNation,2019-10-12 15:47:27,,
134,0.0,,0.0,,2764874410190788,FFA announcement!,https://facebook.com/story.php?story_fbid=2764874410190788&id=478339048844347,"Wyndmere FFA Chapter
October 11, 2019 at 11:52 AM 路",0.0,"FFA announcement!

Wyndmere FFA Chapter
October 11, 2019 at 11:52 AM 路",2019-10-11 20:58:57,,
135,0.0,,0.0,,,,https://facebook.com/story.php?story_fbid=2622782264445940&id=769411503116368,,0.0,,2020-09-13 23:49:27.821295,,
136,0.0,,2.0,,2764614433550119,,https://facebook.com/story.php?story_fbid=2764614433550119&id=478339048844347,,0.0,,2019-10-11 17:28:56,,
137,0.0,,11.0,,2764153273596235,,https://facebook.com/story.php?story_fbid=2764153273596235&id=478339048844347,,0.0,,2019-10-11 12:26:05,,
138,1.0,https://scontent-atl3-1.xx.fbcdn.net/v/t1.0-9/fr/cp0/e15/q65/71767143_2763981793613383_4447273643839324160_n.jpg?_nc_cat=110&_nc_sid=110474&_nc_ohc=VJwBzHG5GZIAX9aXlnc&_nc_ht=scontent-atl3-1.xx&tp=14&oh=f3f3b8454e83585e4b55a2fdca7c1795&oe=5F829374,55.0,,2763983260279903,Thank you to the Wyndmere Fire & Rescue for coming in and talking with the students about fire safety today!!,https://facebook.com/story.php?story_fbid=2763983260279903&id=478339048844347,,0.0,Thank you to the Wyndmere Fire & Rescue for coming in and talking with the students about fire safety today!!,2019-10-11 10:48:59,,
139,0.0,,13.0,,2745766382101591,"Our school does, indeed, have the best!!",https://facebook.com/story.php?story_fbid=2745766382101591&id=478339048844347,"Tonya Dee AbelWyndmere PTO
October 2, 2019 at 7:33 AM 路

Happy Custodian Appreciation Day to all those that keep our hallways clean, jerseys washed and sidewalks snow free! Be sure to say thanks if you see them today!",0.0,"Our school does, indeed, have the best!!

Tonya Dee AbelWyndmere PTO
October 2, 2019 at 7:33 AM 路

Happy Custodian Appreciation Day to all those that keep our hallways clean, jerseys washed and sidewalks snow free! Be sure to say thanks if you see them today!",2019-10-02 12:10:35,,
140,0.0,,14.0,,2733289676682595,,https://facebook.com/story.php?story_fbid=2733289676682595&id=478339048844347,,0.0,,2019-09-26 11:45:58,,
141,1.0,,5.0,,2730857160259180,,https://facebook.com/story.php?story_fbid=2730857160259180&id=478339048844347,,0.0,,2019-09-25 10:32:59,,
142,1.0,,17.0,https://www.wahpetondailynews.com/news_monitor/wyndmere-school-once-again-leading-the-way/article_8ccc7f0e-d3e6-11e9-bde7-8727170454e4.html#utm_campaign=blox&utm_source=facebook&utm_medium=social,2707756135902616,#WeAreWarbirds,https://facebook.com/story.php?story_fbid=2707756135902616&id=478339048844347,"WAHPETONDAILYNEWS.COM
Wyndmere School once again leading the way

News Monitor
September 13, 2019 at 12:00 PM 路

Wyndmere teacher Stacey Strenge set a goal to earn her masters degree ever since she graduated from South Dakota State University in 1995. It has been about 24 years and Strenge is earning her master's degree with the Teacher Leadership Academy.",13.0,"#WeAreWarbirds

WAHPETONDAILYNEWS.COM
Wyndmere School once again leading the way

News Monitor
September 13, 2019 at 12:00 PM 路

Wyndmere teacher Stacey Strenge set a goal to earn her masters degree ever since she graduated from South Dakota State University in 1995. It has been about 24 years and Strenge is earning her master's degree with the Teacher Leadership Academy.",2019-09-14 09:10:21,,
143,0.0,,0.0,https://www.wahpetondailynews.com/news_monitor/wyndmere-school-once-again-leading-the-way/article_8ccc7f0e-d3e6-11e9-bde7-8727170454e4.html#utm_campaign=blox&utm_source=facebook&utm_medium=social,,,https://facebook.com/story.php?story_fbid=2444172449035200&id=517374781714986,"News Monitor
September 13, 2019 at 12:00 PM 路

Wyndmere teacher Stacey Strenge set a goal to earn her masters degree ever since she graduated from South Dakota State University in 1995. It has been about 24 years and Strenge is earning her master's degree with the Teacher Leadership Academy.",0.0,"News Monitor
September 13, 2019 at 12:00 PM 路

Wyndmere teacher Stacey Strenge set a goal to earn her masters degree ever since she graduated from South Dakota State University in 1995. It has been about 24 years and Strenge is earning her master's degree with the Teacher Leadership Academy.",2020-09-13 23:49:27.821308,,
144,0.0,https://scontent-atl3-1.xx.fbcdn.net/v/t1.0-9/fr/cp0/e15/q65/71057586_2706187176059512_569785393872896000_n.jpg?_nc_cat=103&_nc_sid=110474&_nc_ohc=YRp36UimjjcAX8Gp2yd&_nc_ht=scontent-atl3-1.xx&tp=14&oh=a1a42ffe90a58920d8325e96678f27a3&oe=5F8610FA,24.0,,2706190529392510,The First Graders read Dont Let the Pigeon Drive the Bus! and put their artistic spin on it today! #WeAreWarbirds,https://facebook.com/story.php?story_fbid=2706190529392510&id=478339048844347,,0.0,The First Graders read Dont Let the Pigeon Drive the Bus! and put their artistic spin on it today! #WeAreWarbirds,2019-09-13 13:40:58,,
145,1.0,https://scontent-atl3-1.xx.fbcdn.net/v/t1.0-9/fr/cp0/e15/q65/69613851_2687480624596834_8919873936729047040_n.jpg?_nc_cat=100&_nc_sid=110474&_nc_ohc=yeb4rmKo2pMAX-beiyu&_nc_ht=scontent-atl3-1.xx&tp=14&oh=f484e1b6af2db8244ae894b07cfe3785&oe=5F85B289,24.0,,2687480747930155,Some Order of Operations in Algebra 1 last week! #WeAreWarbirds,https://facebook.com/story.php?story_fbid=2687480747930155&id=478339048844347,,0.0,Some Order of Operations in Algebra 1 last week! #WeAreWarbirds,2019-09-04 19:43:54,,
146,0.0,,3.0,,2667583409919889,,https://facebook.com/story.php?story_fbid=2667583409919889&id=478339048844347,,0.0,,2019-08-26 20:57:13,,
147,3.0,https://scontent-atl3-1.xx.fbcdn.net/v/t1.0-9/fr/cp0/e15/q65/69158757_2653884271289803_1350633280331841536_n.jpg?_nc_cat=109&_nc_sid=110474&_nc_ohc=BUP4m1QEbAkAX-yJQSl&_nc_ht=scontent-atl3-1.xx&tp=14&oh=de667d2c7ba0536fb55c88743af554cb&oe=5F847D01,68.0,,2653884497956447,We are ready! Get a good night of sleep everyone! Tomorrow brings a new school year and new adventures. Make it AWESOME Warbirds!! #WeAreWarbirds ,https://facebook.com/story.php?story_fbid=2653884497956447&id=478339048844347,,0.0,We are ready! Get a good night of sleep everyone! Tomorrow brings a new school year and new adventures. Make it AWESOME Warbirds!! #WeAreWarbirds ,2019-08-19 21:48:47,,
148,0.0,https://scontent-atl3-1.xx.fbcdn.net/v/t1.0-9/fr/cp0/e15/q65/68245762_2646278908717006_1194213075377455104_n.jpg?_nc_cat=101&_nc_sid=110474&_nc_ohc=3zU3fAcB_9AAX-U-Fn6&_nc_ht=scontent-atl3-1.xx&tp=14&oh=19d14461b58bf8d4bd4a1ea0d6ebcaf9&oe=5F8497B1,48.0,,2646279135383650,"If this school year has the same energy as Back To School night did... it is going to be one AWESOME year!! Thanks to everyone who came out!
#WeAreWarbirds",https://facebook.com/story.php?story_fbid=2646279135383650&id=478339048844347,,0.0,"If this school year has the same energy as Back To School night did... it is going to be one AWESOME year!! Thanks to everyone who came out!
#WeAreWarbirds",2019-08-15 21:16:11,,
149,3.0,https://scontent-atl3-1.xx.fbcdn.net/v/t1.0-9/fr/cp0/e15/q65/68323968_2642352252443005_4811612399549284352_n.jpg?_nc_cat=111&_nc_sid=110474&_nc_ohc=vwcosCiGZW0AX_iDqGF&_nc_ht=scontent-atl3-1.xx&tp=14&oh=d0c5f57ed2c1d16dde5c07da9c4c1a14&oe=5F8314A5,36.0,,2642352409109656,The teachers and paras are back for a week of professional growth! The energy in the building is GREAT and the excitement for the first day is growing by the minute!! #OneWeekToGo,https://facebook.com/story.php?story_fbid=2642352409109656&id=478339048844347,,0.0,The teachers and paras are back for a week of professional growth! The energy in the building is GREAT and the excitement for the first day is growing by the minute!! #OneWeekToGo,2019-08-13 20:46:10,,
150,0.0,https://scontent-atl3-1.xx.fbcdn.net/v/t1.0-9/fr/cp0/e15/q65/61105293_2498246100186955_6476693958041796608_n.jpg?_nc_cat=100&_nc_sid=110474&_nc_ohc=LmIeUACU5OsAX8-rjTx&_nc_ht=scontent-atl3-1.xx&tp=14&oh=7103e61671cb6a3e72cc74f9ce78bbc1&oe=5F82B583,62.0,,2498246176853614,Congratulations class of 2019! #WarbirdAlumni,https://facebook.com/story.php?story_fbid=2498246176853614&id=478339048844347,,0.0,Congratulations class of 2019! #WarbirdAlumni,2019-05-26 18:03:36,,
151,0.0,https://scontent-atl3-1.xx.fbcdn.net/v/t1.0-9/fr/cp0/e15/q65/60541482_2488250891186476_4209955981813088256_n.jpg?_nc_cat=108&_nc_sid=110474&_nc_ohc=brzz6vBWahcAX9PaHqk&_nc_ht=scontent-atl3-1.xx&tp=14&oh=53c20f0dafea291d090897226abbbb1f&oe=5F8414BF,46.0,,2488250944519804,A successful track-and-field day in the books for Wyndmere Elementary! Thank you to Mrs. Hosford for organizing the event!!,https://facebook.com/story.php?story_fbid=2488250944519804&id=478339048844347,,0.0,A successful track-and-field day in the books for Wyndmere Elementary! Thank you to Mrs. Hosford for organizing the event!!,2019-05-20 22:02:34,,
152,0.0,https://scontent-atl3-1.xx.fbcdn.net/v/t1.0-9/fr/cp0/e15/q65/60481898_2487392631272302_4586384683914231808_n.jpg?_nc_cat=104&_nc_sid=110474&_nc_ohc=ld76Sueov6gAX8h2CJh&_nc_ht=scontent-atl3-1.xx&tp=14&oh=302b15a5d7bd826dfab2673400d2144b&oe=5F8519EE,12.0,,2487392661272299,"Just another reason our school is AWESOME: the absolutely delicious meals served every day. Seriously, how lucky are we?! Happy Finals week everyone! #TheFinalCountdown #WarbirdMagic",https://facebook.com/story.php?story_fbid=2487392661272299&id=478339048844347,,0.0,"Just another reason our school is AWESOME: the absolutely delicious meals served every day. Seriously, how lucky are we?! Happy Finals week everyone! #TheFinalCountdown #WarbirdMagic",2019-05-20 10:07:58,,
153,0.0,https://scontent-atl3-1.xx.fbcdn.net/v/t1.0-9/fr/cp0/e15/q65/60801361_2486554624689436_3064367661417758720_n.jpg?_nc_cat=111&_nc_sid=110474&_nc_ohc=dijh0tdPpd0AX8LwjA8&_nc_ht=scontent-atl3-1.xx&tp=14&oh=cb10d5f35131654b83cb8e8a71cc3b54&oe=5F828BA8,36.0,,2486554788022753,Last week some future Kindergarteners learned about bus safety with Mr. Kern and Mr. Luebke!,https://facebook.com/story.php?story_fbid=2486554788022753&id=478339048844347,,0.0,Last week some future Kindergarteners learned about bus safety with Mr. Kern and Mr. Luebke!,2019-05-19 21:15:13,,
154,1.0,https://scontent-atl3-1.xx.fbcdn.net/v/t1.0-9/fr/cp0/e15/q65/60343002_2478041788874053_6124341755975303168_n.jpg?_nc_cat=105&_nc_sid=110474&_nc_ohc=3MX9HGU9Lt0AX-XooH0&_nc_ht=scontent-atl3-1.xx&tp=14&oh=84ec2cffc026e3225df9524a40561b0d&oe=5F858A59,29.0,,2478042028874029,The Warbird singers and musicians put on quite a show tonight! Great job to all the students and Mrs. Jezusko on an entertaining evening! #WarbirdMusic,https://facebook.com/story.php?story_fbid=2478042028874029&id=478339048844347,,0.0,The Warbird singers and musicians put on quite a show tonight! Great job to all the students and Mrs. Jezusko on an entertaining evening! #WarbirdMusic,2019-05-14 22:34:01,,
155,0.0,https://scontent-atl3-1.xx.fbcdn.net/v/t1.0-9/fr/cp0/e15/q65/60041450_2471999179478314_4363446026934157312_n.jpg?_nc_cat=104&_nc_sid=110474&_nc_ohc=hTqsjVKL3gQAX9TqBZS&_nc_ht=scontent-atl3-1.xx&tp=14&oh=55b09f97cfff5a23326d851b47070a45&oe=5F85FC24,31.0,,2471999239478308,Mrs. Illies and Mrs. Hoffert (as well as some wonderful chaperones) took the 4th and 5th Graders to the Capitol and Heritage Museum in Bismarck! The kids had a great time and represented Wyndmere well!,https://facebook.com/story.php?story_fbid=2471999239478308&id=478339048844347,,0.0,Mrs. Illies and Mrs. Hoffert (as well as some wonderful chaperones) took the 4th and 5th Graders to the Capitol and Heritage Museum in Bismarck! The kids had a great time and represented Wyndmere well!,2019-05-11 10:53:19,,
156,0.0,,13.0,,2469324846412414,Another AWESOME awards day at WPS today. It is always great to be reminded how amazing our students are! #WarbirdPride,https://facebook.com/story.php?story_fbid=2469324846412414&id=478339048844347,,0.0,Another AWESOME awards day at WPS today. It is always great to be reminded how amazing our students are! #WarbirdPride,2019-05-09 19:31:11,,
157,1.0,https://scontent-atl3-1.xx.fbcdn.net/v/t1.0-9/fr/cp0/e15/q65/59730156_2467783639899868_9089726299714355200_n.jpg?_nc_cat=105&_nc_sid=110474&_nc_ohc=CQ8tDn_UqPIAX8q42wf&_nc_ht=scontent-atl3-1.xx&tp=14&oh=4a73489c421c1b97c87ea849d070069a&oe=5F82C287,25.0,,2467783756566523,"Despite the unexpected events of the morning, the 8th Graders traveled to Fargo for their incentive trip (they help with lunch each day)! West Acres and SkyZone made for a busy day!",https://facebook.com/story.php?story_fbid=2467783756566523&id=478339048844347,,0.0,"Despite the unexpected events of the morning, the 8th Graders traveled to Fargo for their incentive trip (they help with lunch each day)! West Acres and SkyZone made for a busy day!",2019-05-08 20:48:19,,
158,2.0,,60.0,,2467569226587976,"A big THANK YOU to the workers at Otter Tail Power Company, Randy, Vance, Dan, Bob, and all the other people who worked to get power restored, freezers online, technology running, and everything in between!! (and in the rain)",https://facebook.com/story.php?story_fbid=2467569226587976&id=478339048844347,,0.0,"A big THANK YOU to the workers at Otter Tail Power Company, Randy, Vance, Dan, Bob, and all the other people who worked to get power restored, freezers online, technology running, and everything in between!! (and in the rain)",2019-05-08 17:33:42,,
159,2.0,,3.0,,2466885039989728,,https://facebook.com/story.php?story_fbid=2466885039989728&id=478339048844347,,0.0,,2019-05-08 08:28:01,,
160,0.0,https://scontent-atl3-1.xx.fbcdn.net/v/t1.0-9/fr/cp0/e15/q65/59747882_2466146480063584_6704415902919557120_n.jpg?_nc_cat=109&_nc_sid=110474&_nc_ohc=kmlyXOh9gawAX-l2-\-\k&_nc_ht=scontent-atl3-1.xx&tp=14&oh=8a2c2dbbd79dec7ec185e7aef5ecb505&oe=5F85E830,20.0,,2466146796730219,,https://facebook.com/story.php?story_fbid=2466146796730219&id=478339048844347,,0.0,,2019-05-07 19:51:16,,
161,3.0,https://scontent-atl3-1.xx.fbcdn.net/v/t1.0-9/fr/cp0/e15/q65/59229804_2459494184062147_5745814451248955392_n.jpg?_nc_cat=107&_nc_sid=110474&_nc_ohc=-49fPYHdlDgAX9ID8T7&_nc_ht=scontent-atl3-1.xx&tp=14&oh=d83168a25d724079b88cc82177653540&oe=5F857358,40.0,,2459494334062132,The Wyndmere Elementary Math Olympics team is getting ready for competition! #MathRocks #WarbirdPride,https://facebook.com/story.php?story_fbid=2459494334062132&id=478339048844347,,0.0,The Wyndmere Elementary Math Olympics team is getting ready for competition! #MathRocks #WarbirdPride,2019-05-03 17:46:26,,
162,0.0,https://scontent-atl3-1.xx.fbcdn.net/v/t1.0-9/fr/cp0/e15/q65/58384128_2448959595115606_3648664787711164416_n.jpg?_nc_cat=106&_nc_sid=110474&_nc_ohc=UCKxR8zS5CIAX_W3oWb&_nc_ht=scontent-atl3-1.xx&tp=14&oh=8d22d789fe72dcdf90fe31b260c799ca&oe=5F82EFA0,39.0,,2448959945115571,The first graders had a special guest come read to them yesterday! WHS graduate Jordyn Hetland read them a book she wrote and illustrated!!,https://facebook.com/story.php?story_fbid=2448959945115571&id=478339048844347,,0.0,The first graders had a special guest come read to them yesterday! WHS graduate Jordyn Hetland read them a book she wrote and illustrated!!,2019-04-27 11:26:07,,
163,0.0,https://scontent-atl3-1.xx.fbcdn.net/v/t1.0-9/fr/cp0/e15/q65/58372582_2444774418867457_2331156464124559360_n.jpg?_nc_cat=107&_nc_sid=110474&_nc_ohc=N2JLYMNEt5wAX_ERiJd&_nc_ht=scontent-atl3-1.xx&tp=14&oh=ace334ad0e10906b796ec0440bbaf06b&oe=5F8638B4,8.0,,2444774605534105,Pronoun Mindmaps created by the 10th Graders! They look awesome! #WarbirdMagic,https://facebook.com/story.php?story_fbid=2444774605534105&id=478339048844347,,0.0,Pronoun Mindmaps created by the 10th Graders! They look awesome! #WarbirdMagic,2019-04-24 19:04:58,,
164,0.0,https://scontent-atl3-1.xx.fbcdn.net/v/t1.0-9/fr/cp0/e15/q65/57775038_2319778524746317_1845057786459717632_n.jpg?_nc_cat=102&_nc_sid=110474&_nc_ohc=alJND0YetcUAX-H7m-M&_nc_ht=scontent-atl3-1.xx&tp=14&oh=fefe98a1481b6cf9fd2a8357ad21e7b7&oe=5F84B1E1,17.0,,2441780209166878,Congratulations!,https://facebook.com/story.php?story_fbid=2441780209166878&id=478339048844347,"Wyndmere FFA Chapter
April 22, 2019 at 6:20 PM 路

Congratulations to our newly elected 2019-2020 officer team!
President: Jessica Kuchera
Vice President: Sierra Strenge
Secretary: Laiken David
Treasurer: Nick Puetz
Reporter: Julia Quam
Sentinel: Parker Strege
Parliamentarian: Ashlie Mauch
Historian: Nate Adams
Chaplain: Jack Manstrom (not pictured)
I look forward to seeing what your year of service has in store!",0.0,"Congratulations!

Wyndmere FFA Chapter
April 22, 2019 at 6:20 PM 路

Congratulations to our newly elected 2019-2020 officer team!
President: Jessica Kuchera
Vice President: Sierra Strenge
Secretary: Laiken David
Treasurer: Nick Puetz
Reporter: Julia Quam
Sentinel: Parker Strege
Parliamentarian: Ashlie Mauch
Historian: Nate Adams
Chaplain: Jack Manstrom (not pictured)
I look forward to seeing what your year of service has in store!",2019-04-22 20:00:46,,
165,0.0,,3.0,,2425632550781644,Good luck to all of our musicians tomorrow!! #MusicalWarbirds,https://facebook.com/story.php?story_fbid=2425632550781644&id=478339048844347,"Wyndmere Music Department
April 12, 2019 at 6:54 PM 路

Just a reminder that the first bus for region music will leave for Hankinson at 6:45am and the second at 9am! Parents can pick students up, but must either have a note or sign them out. The groups perform one hour earlier than originally scheduled!
Good luck tomorrow, Warbirds! 娥",0.0,"Good luck to all of our musicians tomorrow!! #MusicalWarbirds

Wyndmere Music Department
April 12, 2019 at 6:54 PM 路

Just a reminder that the first bus for region music will leave for Hankinson at 6:45am and the second at 9am! Parents can pick students up, but must either have a note or sign them out. The groups perform one hour earlier than originally scheduled!
Good luck tomorrow, Warbirds! 娥",2019-04-12 20:19:07,,
166,0.0,,0.0,,,"Just a reminder that the first bus for region music will leave for Hankinson at 6:45am and the second at 9am! Parents can pick students up, but must either have a note or sign them out. The groups perform one hour earlier than originally scheduled!
Good luck tomorrow, Warbirds! 娥",https://facebook.com/story.php?story_fbid=422352211668818&id=177527736151268,,0.0,"Just a reminder that the first bus for region music will leave for Hankinson at 6:45am and the second at 9am! Parents can pick students up, but must either have a note or sign them out. The groups perform one hour earlier than originally scheduled!
Good luck tomorrow, Warbirds! 娥",2020-09-13 23:49:27.821456,,
167,0.0,,3.0,,2424133147598251,,https://facebook.com/story.php?story_fbid=2424133147598251&id=478339048844347,,0.0,,2019-04-11 20:57:16,,
168,0.0,,1.0,,2423230587688507,,https://facebook.com/story.php?story_fbid=2423230587688507&id=478339048844347,,0.0,,2019-04-11 07:23:04,,
169,0.0,https://scontent-atl3-1.xx.fbcdn.net/v/t1.0-9/fr/cp0/e15/q65/56558618_2419071108104455_6359968742780174336_o.jpg?_nc_cat=105&_nc_sid=110474&_nc_ohc=wDkn7WDpWMYAX_3Wo_J&_nc_ht=scontent-atl3-1.xx&tp=14&oh=f54cdbbea512f756d00ae8f824e60f25&oe=5F8515B9,18.0,,2419074254770807,Lifelong Fitness class taking advantage of a nice day with a competitive game of croquet. #WarbirdFitness #Spring,https://facebook.com/story.php?story_fbid=2419074254770807&id=478339048844347,,0.0,Lifelong Fitness class taking advantage of a nice day with a competitive game of croquet. #WarbirdFitness #Spring,2019-04-08 11:34:47,,
170,0.0,https://scontent-atl3-1.xx.fbcdn.net/v/t1.0-9/fr/cp0/e15/q65/56328648_2413495588662007_8593900444542042112_n.jpg?_nc_cat=108&_nc_sid=110474&_nc_ohc=27f5EQz36voAX_izWP5&_nc_ht=scontent-atl3-1.xx&tp=14&oh=12340751f7bc6674e02ef49f4b7ba7fa&oe=5F84C7CF,9.0,,2413495968661969,Some intense PhyEd action today!!,https://facebook.com/story.php?story_fbid=2413495968661969&id=478339048844347,,0.0,Some intense PhyEd action today!!,2019-04-04 21:00:21,,
171,2.0,https://scontent-atl3-1.xx.fbcdn.net/v/t1.0-9/fr/cp0/e15/q65/56173190_2405947262750173_5243832739710369792_n.jpg?_nc_cat=100&_nc_sid=110474&_nc_ohc=uaeiDbnw4n4AX8-NXRT&_nc_ht=scontent-atl3-1.xx&tp=14&oh=ec393062802d87859ea87fd619dde595&oe=5F85DC7F,42.0,,2405947332750166,The elementary boys basketball team took 1st in the 6th grade division of the Lidgerwood Jamboree!,https://facebook.com/story.php?story_fbid=2405947332750166&id=478339048844347,,0.0,The elementary boys basketball team took 1st in the 6th grade division of the Lidgerwood Jamboree!,2019-03-30 22:13:49,,
172,0.0,https://scontent-atl3-1.xx.fbcdn.net/v/t1.0-9/fr/cp0/e15/q65/55540664_2393481033996796_364459354096664576_n.jpg?_nc_cat=107&_nc_sid=110474&_nc_ohc=vXHNpIdz94EAX_Vo16i&_nc_ht=scontent-atl3-1.xx&tp=14&oh=de527d02d26e249f582e990831bc5850&oe=5F85362C,19.0,,2393481637330069,"On Thursday, the elementary students saw presentations by Tom Gibson with the Richland County Soil Conservation District and today was Health Day in the high school! #busyWarbirds #HealthAndWellness #Conservation",https://facebook.com/story.php?story_fbid=2393481637330069&id=478339048844347,,0.0,"On Thursday, the elementary students saw presentations by Tom Gibson with the Richland County Soil Conservation District and today was Health Day in the high school! #busyWarbirds #HealthAndWellness #Conservation",2019-03-22 18:56:18,,
173,1.0,,4.0,,2381720568506176,,https://facebook.com/story.php?story_fbid=2381720568506176&id=478339048844347,,0.0,,2019-03-15 09:38:33,,
174,0.0,,6.0,,2380968448581388,,https://facebook.com/story.php?story_fbid=2380968448581388&id=478339048844347,,0.0,,2019-03-14 20:49:37,,
175,0.0,https://scontent-atl3-1.xx.fbcdn.net/v/t1.0-9/fr/cp0/e15/q65/53909742_2380306231980943_9049183315973636096_n.jpg?_nc_cat=108&_nc_sid=110474&_nc_ohc=7O9qdBmdIB0AX-rONKt&_nc_ht=scontent-atl3-1.xx&tp=14&oh=c4aeed93a99ee10a62818ceecd95e85f&oe=5F850F3A,24.0,,2380306688647564,Thank you to Ronda Luebke for coming to the school and teaching CPR to our juniors! Such a great skill to know!!,https://facebook.com/story.php?story_fbid=2380306688647564&id=478339048844347,,0.0,Thank you to Ronda Luebke for coming to the school and teaching CPR to our juniors! Such a great skill to know!!,2019-03-14 12:43:18,,
176,0.0,,14.0,,2379410782070488,,https://facebook.com/story.php?story_fbid=2379410782070488&id=478339048844347,,0.0,,2019-03-13 19:46:15,,
177,0.0,,29.0,,2366951966649703,,https://facebook.com/story.php?story_fbid=2366951966649703&id=478339048844347,,0.0,,2019-03-04 18:58:03,,
178,0.0,,3.0,,2366793219998911,,https://facebook.com/story.php?story_fbid=2366793219998911&id=478339048844347,,0.0,,2019-03-04 16:15:07,,
179,6.0,https://scontent-atl3-1.xx.fbcdn.net/v/t1.0-9/fr/cp0/e15/q65/53207622_2366665986678301_6949955936236601344_n.jpg?_nc_cat=109&_nc_sid=110474&_nc_ohc=BVKeOZ-cQPcAX_lhCA_&_nc_ht=scontent-atl3-1.xx&tp=14&oh=f210a0698c710cdfab8a304a3efba7e2&oe=5F84AB5B,57.0,,2366666186678281,"Engineers from NASA have been working with Mrs. Fyres Physics students and are visiting North Dakota this week (from Alabama). They launched a weather balloon today, which they hope will reach the Atlantic Ocean. They did mention that they have not launched in these conditions before ザ .",https://facebook.com/story.php?story_fbid=2366666186678281&id=478339048844347,,0.0,"Engineers from NASA have been working with Mrs. Fyres Physics students and are visiting North Dakota this week (from Alabama). They launched a weather balloon today, which they hope will reach the Atlantic Ocean. They did mention that they have not launched in these conditions before ザ .",2019-03-04 14:11:32,,
180,2.0,https://scontent-atl3-1.xx.fbcdn.net/v/t1.0-9/fr/cp0/e15/q65/53043173_2361796023831964_5741328937728868352_o.jpg?_nc_cat=106&_nc_sid=110474&_nc_ohc=Aiz4KqGyyfwAX8kXskm&_nc_ht=scontent-atl3-1.xx&tp=14&oh=bdfbc63c58322c012e7159bcb340d07d&oe=5F862373,23.0,,2361796527165247,#ThisIsMarch,https://facebook.com/story.php?story_fbid=2361796527165247&id=478339048844347,,0.0,#ThisIsMarch,2019-03-01 09:08:11,,
181,0.0,,0.0,,2355331854478381,Music Festival Update!,https://facebook.com/story.php?story_fbid=2355331854478381&id=478339048844347,"Wyndmere Music Department
February 24, 2019 at 8:19 PM 路",0.0,"Music Festival Update!

Wyndmere Music Department
February 24, 2019 at 8:19 PM 路",2019-02-24 20:28:33,,
182,0.0,,0.0,,,,https://facebook.com/story.php?story_fbid=402113540359352&id=177527736151268,,0.0,,2020-09-13 23:49:27.821482,,
183,0.0,,9.0,,2355278224483744,Wyndmere School will start 2 hours late tomorrow (2/25). Buses will run where possible. Contact your driver if you have concerns.,https://facebook.com/story.php?story_fbid=2355278224483744&id=478339048844347,,0.0,Wyndmere School will start 2 hours late tomorrow (2/25). Buses will run where possible. Contact your driver if you have concerns.,2019-02-24 19:36:02,,
184,1.0,,0.0,,2352095948135305,FFA Update!,https://facebook.com/story.php?story_fbid=2352095948135305&id=478339048844347,"Wyndmere FFA Chapter
February 22, 2019 at 7:50 PM 路",0.0,"FFA Update!

Wyndmere FFA Chapter
February 22, 2019 at 7:50 PM 路",2019-02-22 20:49:47,,
185,0.0,,0.0,,,,https://facebook.com/story.php?story_fbid=2235529189837918&id=769411503116368,,0.0,,2020-09-13 23:49:27.821487,,
186,1.0,https://scontent-atl3-1.xx.fbcdn.net/v/t1.0-9/fr/cp0/e15/q65/52591460_2351758238169076_7339464810913857536_o.jpg?_nc_cat=100&_nc_sid=110474&_nc_ohc=-faDRE79G4QAX95_cEW&_nc_ht=scontent-atl3-1.xx&tp=14&oh=592a87e26449414623c194c6aee3235c&oe=5F83256A,40.0,,2351758344835732,Just another beautiful winter recess in North Dakota!,https://facebook.com/story.php?story_fbid=2351758344835732&id=478339048844347,,0.0,Just another beautiful winter recess in North Dakota!,2019-02-22 15:23:24,,
187,0.0,,3.0,,2340689865942580,,https://facebook.com/story.php?story_fbid=2340689865942580&id=478339048844347,,0.0,,2019-02-15 18:39:05,,
188,0.0,,14.0,,2338835809461319,,https://facebook.com/story.php?story_fbid=2338835809461319&id=478339048844347,,0.0,,2019-02-14 17:50:19,,
189,0.0,https://scontent-atl3-1.xx.fbcdn.net/v/t1.0-9/fr/cp0/e15/q65/51807958_2332345483443685_5795928726659137536_n.jpg?_nc_cat=111&_nc_sid=110474&_nc_ohc=X3wsylByQXEAX-P05AV&_nc_ht=scontent-atl3-1.xx&tp=14&oh=eca5e044597dbb9d916620d166bcbcef&oe=5F8398A5,11.0,,2332345933443640,It feels like Mrs. Illies class was on to something when they made these snow globes a few weeks ago! #Warbirds #Snowbirds,https://facebook.com/story.php?story_fbid=2332345933443640&id=478339048844347,,0.0,It feels like Mrs. Illies class was on to something when they made these snow globes a few weeks ago! #Warbirds #Snowbirds,2019-02-10 20:36:31,,
190,2.0,https://scontent-atl3-1.xx.fbcdn.net/v/t1.0-9/fr/cp0/e15/q65/51502997_2330557356955831_1167898523719434240_n.jpg?_nc_cat=105&_nc_sid=110474&_nc_ohc=N3Vd00X4pU4AX_go0mr&_nc_ht=scontent-atl3-1.xx&tp=14&oh=56e1345abbdb5c9e0de393d83d9af87f&oe=5F835591,30.0,,2330557383622495,Warbirds with a BIG Region 1 win!! #WarbirdPride,https://facebook.com/story.php?story_fbid=2330557383622495&id=478339048844347,,0.0,Warbirds with a BIG Region 1 win!! #WarbirdPride,2019-02-09 16:43:56,,
191,0.0,https://scontent-atl3-1.xx.fbcdn.net/v/t1.0-9/fr/cp0/e15/q65/51844152_2330547390290161_3010513564709421056_o.jpg?_nc_cat=109&_nc_sid=110474&_nc_ohc=3ykECL6llIQAX_OLjsM&_nc_ht=scontent-atl3-1.xx&tp=14&oh=9c4b553a7bbe1b49846531230a8e5bc6&oe=5F82D6A7,10.0,,2330547413623492,A little extra basketball on this cold Saturday! Warbird GBB and Oak Grove headed to OT!,https://facebook.com/story.php?story_fbid=2330547413623492&id=478339048844347,,0.0,A little extra basketball on this cold Saturday! Warbird GBB and Oak Grove headed to OT!,2019-02-09 16:32:25,,
192,0.0,,0.0,,2327933437218223,Update from FFA:,https://facebook.com/story.php?story_fbid=2327933437218223&id=478339048844347,"Wyndmere FFA Chapter
February 7, 2019 at 8:36 PM 路",0.0,"Update from FFA:

Wyndmere FFA Chapter
February 7, 2019 at 8:36 PM 路",2019-02-07 22:46:14,,
193,0.0,,0.0,,,,https://facebook.com/story.php?story_fbid=2212347172156120&id=769411503116368,,0.0,,2020-09-13 23:49:27.821499,,
194,0.0,,4.0,,2327932033885030,,https://facebook.com/story.php?story_fbid=2327932033885030&id=478339048844347,,0.0,,2019-02-07 22:44:38,,
195,0.0,,0.0,,2327563493921884,Announcement:,https://facebook.com/story.php?story_fbid=2327563493921884&id=478339048844347,"Wyndmere FFA Chapter
February 7, 2019 at 10:30 AM 路",0.0,"Announcement:

Wyndmere FFA Chapter
February 7, 2019 at 10:30 AM 路",2019-02-07 16:02:27,,
196,0.0,,0.0,,,,https://facebook.com/story.php?story_fbid=2211744578883046&id=769411503116368,,0.0,,2020-09-13 23:49:27.821504,,
197,0.0,,13.0,,2326493710695529,,https://facebook.com/story.php?story_fbid=2326493710695529&id=478339048844347,,0.0,,2019-02-06 23:13:53,,
198,2.0,https://scontent-atl3-1.xx.fbcdn.net/v/t1.0-9/fr/cp0/e15/q65/51726509_2326361754042058_4354543904054312960_n.jpg?_nc_cat=101&_nc_sid=110474&_nc_ohc=ioXvv11sVPUAX-eYz4r&_nc_ht=scontent-atl3-1.xx&tp=14&oh=cb258a15712053fc2b387eb76b6a5330&oe=5F85C617,76.0,,2326361787375388,Congratulations to Lane Grasto and Casey Buskohl on signing with NDSCS! #WarbirdPride #WarbirdNation,https://facebook.com/story.php?story_fbid=2326361787375388&id=478339048844347,,0.0,Congratulations to Lane Grasto and Casey Buskohl on signing with NDSCS! #WarbirdPride #WarbirdNation,2019-02-06 20:49:27,,
199,0.0,,1.0,,2325876590757241,,https://facebook.com/story.php?story_fbid=2325876590757241&id=478339048844347,,0.0,,2019-02-06 12:39:38,,
200,0.0,,8.0,,2322716491073251,,https://facebook.com/story.php?story_fbid=2322716491073251&id=478339048844347,,0.0,,2019-02-04 09:53:29,,
201,0.0,,6.0,,2322496347761932,,https://facebook.com/story.php?story_fbid=2322496347761932&id=478339048844347,,0.0,,2019-02-04 06:51:41,,
202,1.0,,17.0,,2320587947952772,"After a BBB win over the Raiders earlier this week, the Warbird GBB team wins over Maple Valley 65-38 at the NDSCS Bonanza tonight! #WarbirdNation",https://facebook.com/story.php?story_fbid=2320587947952772&id=478339048844347,,0.0,"After a BBB win over the Raiders earlier this week, the Warbird GBB team wins over Maple Valley 65-38 at the NDSCS Bonanza tonight! #WarbirdNation",2019-02-02 22:25:28,,
203,0.0,,9.0,,2320187887992778,#dedication,https://facebook.com/story.php?story_fbid=2320187887992778&id=478339048844347,"Todd HosfordLidgerwood-Wyndmere Warbirds Boys' Basketball
February 2, 2019 at 1:32 PM 路

Hard working crew of 3rd and 4th graders this morning. (No pics of the older group but they worked hard too!)",0.0,"#dedication

Todd HosfordLidgerwood-Wyndmere Warbirds Boys' Basketball
February 2, 2019 at 1:32 PM 路

Hard working crew of 3rd and 4th graders this morning. (No pics of the older group but they worked hard too!)",2019-02-02 15:26:50,,
204,2.0,https://scontent-atl3-1.xx.fbcdn.net/v/t1.0-9/fr/cp0/e15/q65/51097707_2319939468017620_2773115573909848064_n.jpg?_nc_cat=107&_nc_sid=110474&_nc_ohc=e9Mrw6molYwAX8d82t3&_nc_ht=scontent-atl3-1.xx&tp=14&oh=55967f40917d4d7f903861a229242c84&oe=5F830D40,21.0,,2319939924684241,Warbird youth basketball getting better each week! #WarbirdPride #practice  ,https://facebook.com/story.php?story_fbid=2319939924684241&id=478339048844347,,0.0,Warbird youth basketball getting better each week! #WarbirdPride #practice  ,2019-02-02 11:31:35,,
205,1.0,https://scontent-atl3-1.xx.fbcdn.net/v/t1.0-9/fr/cp0/e15/q65/50949501_2315629361781964_1928596708548149248_n.jpg?_nc_cat=107&_nc_sid=110474&_nc_ohc=1qGEsmjqQVMAX_-IVc8&_nc_ht=scontent-atl3-1.xx&tp=14&oh=b90d7d143ce78760ec86b837a06d5717&oe=5F8336AD,5.0,,2315629381781962,Kindergarten Screening announcement:,https://facebook.com/story.php?story_fbid=2315629381781962&id=478339048844347,,0.0,Kindergarten Screening announcement:,2019-01-30 11:57:13,,
206,1.0,,15.0,,2313358455342388,,https://facebook.com/story.php?story_fbid=2313358455342388&id=478339048844347,,0.0,,2019-01-28 21:48:53,,
